{"Id":2220288,"Number":192,"KnessetNum":25,"Name":"ישיבת מליאה בתאריך 15/07/2024 בשעה 16:00","StartDate":"2024-07-15T16:00:00+03:00","FinishDate":"2024-07-15T23:30:00+03:00","IsSpecialMeeting":false,"LastUpdatedDate":"2024-07-17T12:34:02.677+03:00"}
{"Id":2220289,"Number":193,"KnessetNum":25,"Name":"ישיבת מליאה בתאריך 16/07/2024 בשעה 16:00","StartDate":"2024-07-16T16:00:00+03:00","FinishDate":"2024-07-16T20:40:00+03:00","IsSpecialMeeting":false,"LastUpdatedDate":"2024-07-17T10:39:44.277+03:00"}
{"Id":2220290,"Number":194,"KnessetNum":25,"Name":"ישיבת מליאה בתאריך 17/07/2024 בשעה 11:00","StartDate":"2024-07-17T11:00:00+03:00","FinishDate":"2024-07-18T04:50:00+03:00","IsSpecialMeeting":false,"LastUpdatedDate":"2024-09-16T18:25:30.74+03:00"}
{"Id":2220706,"Number":195,"KnessetNum":25,"Name":"ישיבת מליאה בתאריך 22/07/2024 בשעה 10:00","StartDate":"2024-07-22T10:00:00+03:00","FinishDate":"2024-07-22T22:10:00+03:00","IsSpecialMeeting":false,"LastUpdatedDate":"2024-07-23T14:01:04.617+03:00"}
{"Id":2220707,"Number":196,"KnessetNum":25,"Name":"ישיבת מליאה בתאריך 23/07/2024 בשעה 10:00","StartDate":"2024-07-23T10:00:00+03:00","FinishDate":"2024-07-23T15:30:00+03:00","IsSpecialMeeting":false,"LastUpdatedDate":"2024-07-24T15:54:33.187+03:00"}
{"Id":2220708,"Number":197,"KnessetNum":25,"Name":"ישיבת מליאה בתאריך 24/07/2024 בשעה 09:00","StartDate":"2024-07-24T09:00:00+03:00","FinishDate":"2024-07-25T04:40:00+03:00","IsSpecialMeeting":false,"LastUpdatedDate":"2024-07-25T04:32:26.63+03:00"}
{"Id":2221214,"Number":198,"KnessetNum":25,"Name":"ישיבת מליאה בתאריך 28/07/2024 בשעה 11:00","StartDate":"2024-07-28T11:00:00+03:00","FinishDate":"2024-07-28T13:00:00+03:00","IsSpecialMeeting":false,"LastUpdatedDate":"2024-07-28T12:55:42.687+03:00"}
{"Id":2221412,"Number":209,"KnessetNum":25,"Name":"ישיבת מליאה בתאריך 28/10/2024 בשעה 16:00","StartDate":"2024-10-28T16:00:00+02:00","FinishDate":"2024-10-28T23:40:00+02:00","IsSpecialMeeting":false,"LastUpdatedDate":"2024-11-04T12:33:54.607+02:00"}
{"Id":2221413,"Number":210,"KnessetNum":25,"Name":"ישיבת מליאה בתאריך 29/10/2024 בשעה 16:00","StartDate":"2024-10-29T16:00:00+02:00","FinishDate":"2024-10-29T18:50:00+02:00","IsSpecialMeeting":false,"LastUpdatedDate":"2024-11-03T14:14:21.127+02:00"}
{"Id":2221414,"Number":211,"KnessetNum":25,"Name":"ישיבת מליאה בתאריך 30/10/2024 בשעה 11:00","StartDate":"2024-10-30T11:00:00+02:00","FinishDate":"2024-10-30T18:10:00+02:00","IsSpecialMeeting":false,"LastUpdatedDate":"2024-10-31T14:38:28.99+02:00"}
{"Id":2221583,"Number":199,"KnessetNum":25,"Name":"ישיבת מליאה בתאריך 05/08/2024 בשעה 10:00","StartDate":"2024-08-05T10:00:00+03:00","FinishDate":"2024-08-05T20:20:00+03:00","IsSpecialMeeting":false,"LastUpdatedDate":"2024-08-06T13:41:14.297+03:00"}
{"Id":2221584,"Number":200,"KnessetNum":25,"Name":"ישיבת מליאה בתאריך 06/08/2024 בשעה 09:00","StartDate":"2024-08-06T09:00:00+03:00","FinishDate":"2024-08-06T14:00:00+03:00","IsSpecialMeeting":false,"LastUpdatedDate":"2024-08-06T13:59:10.727+03:00"}
{"Id":2221765,"Number":201,"KnessetNum":25,"Name":"ישיבת מליאה בתאריך 14/08/2024 בשעה 09:30","StartDate":"2024-08-14T09:30:00+03:00","FinishDate":"2024-08-14T13:40:00+03:00","IsSpecialMeeting":false,"LastUpdatedDate":"2024-08-14T14:36:59.867+03:00"}
{"Id":2221928,"Number":202,"KnessetNum":25,"Name":"ישיבת מליאה בתאריך 05/09/2024 בשעה 10:00","StartDate":"2024-09-05T10:00:00+03:00","FinishDate":"2024-09-05T10:20:00+03:00","IsSpecialMeeting":false,"LastUpdatedDate":"2024-09-05T08:04:13.163+03:00"}
{"Id":2221929,"Number":203,"KnessetNum":25,"Name":"ישיבת מליאה בתאריך 09/09/2024 בשעה 12:00","StartDate":"2024-09-09T12:00:00+03:00","FinishDate":"2024-09-09T20:40:00+03:00","IsSpecialMeeting":false,"LastUpdatedDate":"2024-09-11T15:13:16.323+03:00"}
{"Id":2222003,"Number":204,"KnessetNum":25,"Name":"ישיבת מליאה בתאריך 12/09/2024 בשעה 11:30","StartDate":"2024-09-12T11:30:00+03:00","FinishDate":"2024-09-12T15:50:00+03:00","IsSpecialMeeting":false,"LastUpdatedDate":"2024-09-12T15:45:09.527+03:00"}
{"Id":2222329,"Number":205,"KnessetNum":25,"Name":"ישיבת מליאה בתאריך 26/09/2024 בשעה 16:00","StartDate":"2024-09-26T16:00:00+03:00","FinishDate":"2024-09-29T08:26:32+03:00","IsSpecialMeeting":false,"LastUpdatedDate":"2024-09-29T08:40:56.5+03:00"}
{"Id":2222331,"Number":206,"KnessetNum":25,"Name":"ישיבת מליאה בתאריך 29/09/2024 בשעה 09:00","StartDate":"2024-09-29T09:00:00+03:00","FinishDate":"2024-09-29T23:40:00+03:00","IsSpecialMeeting":false,"LastUpdatedDate":"2024-09-30T08:09:03.76+03:00"}
{"Id":2222453,"Number":207,"KnessetNum":25,"Name":"ישיבת מליאה בתאריך 30/09/2024 בשעה 12:00","StartDate":"2024-09-30T12:00:00+03:00","FinishDate":"2024-09-30T14:40:00+03:00","IsSpecialMeeting":false,"LastUpdatedDate":"2024-09-30T14:33:57.123+03:00"}
{"Id":2222605,"Number":208,"KnessetNum":25,"Name":"ישיבת מליאה בתאריך 15/10/2024 בשעה 10:00","StartDate":"2024-10-15T10:00:00+03:00","FinishDate":"2024-10-15T10:20:00+03:00","IsSpecialMeeting":false,"LastUpdatedDate":"2024-10-15T10:02:04.47+03:00"}
{"Id":2222815,"Number":212,"KnessetNum":25,"Name":"ישיבת מליאה בתאריך 04/11/2024 בשעה 16:00","StartDate":"2024-11-04T16:00:00+02:00","FinishDate":"2024-11-05T05:50:00+02:00","IsSpecialMeeting":false,"LastUpdatedDate":"2024-11-05T05:43:37.81+02:00"}
{"Id":2222817,"Number":213,"KnessetNum":25,"Name":"ישיבת מליאה בתאריך 05/11/2024 בשעה 16:00","StartDate":"2024-11-05T16:00:00+02:00","FinishDate":"2024-11-05T18:23:59+02:00","IsSpecialMeeting":false,"LastUpdatedDate":"2024-11-12T15:58:38.983+02:00"}
{"Id":2222818,"Number":214,"KnessetNum":25,"Name":"ישיבת מליאה בתאריך 06/11/2024 בשעה 11:00","StartDate":"2024-11-06T11:00:00+02:00","FinishDate":"2024-11-07T03:40:00+02:00","IsSpecialMeeting":false,"LastUpdatedDate":"2024-11-12T15:41:18.207+02:00"}
{"Id":2223108,"Number":216,"KnessetNum":25,"Name":"ישיבת מליאה בתאריך 11/11/2024 בשעה 16:00","StartDate":"2024-11-11T16:00:00+02:00","FinishDate":"2024-11-12T03:30:00+02:00","IsSpecialMeeting":false,"LastUpdatedDate":"2024-11-13T15:40:30.197+02:00"}
{"Id":2223109,"Number":217,"KnessetNum":25,"Name":"ישיבת מליאה בתאריך 12/11/2024 בשעה 16:00","StartDate":"2024-11-12T16:00:00+02:00","FinishDate":"2024-11-12T19:20:00+02:00","IsSpecialMeeting":false,"LastUpdatedDate":"2024-11-13T14:25:23.387+02:00"}
{"Id":2223110,"Number":218,"KnessetNum":25,"Name":"ישיבת מליאה בתאריך 13/11/2024 בשעה 11:00","StartDate":"2024-11-13T11:00:00+02:00","FinishDate":"2024-11-13T20:45:38+02:00","IsSpecialMeeting":false,"LastUpdatedDate":"2024-11-26T12:38:19.133+02:00"}
{"Id":2223456,"Number":219,"KnessetNum":25,"Name":"ישיבת מליאה בתאריך 18/11/2024 בשעה 16:00","StartDate":"2024-11-18T16:00:00+02:00","FinishDate":"2024-11-19T01:20:00+02:00","IsSpecialMeeting":false,"LastUpdatedDate":"2024-11-19T07:31:40.323+02:00"}
{"Id":2223457,"Number":220,"KnessetNum":25,"Name":"ישיבת מליאה בתאריך 19/11/2024 בשעה 16:00","StartDate":"2024-11-19T16:00:00+02:00","FinishDate":"2024-11-19T23:50:00+02:00","IsSpecialMeeting":false,"LastUpdatedDate":"2024-11-20T08:18:00.63+02:00"}
{"Id":2223458,"Number":221,"KnessetNum":25,"Name":"ישיבת מליאה בתאריך 20/11/2024 בשעה 11:00","StartDate":"2024-11-20T11:00:00+02:00","FinishDate":"2024-11-20T19:16:07+02:00","IsSpecialMeeting":false,"LastUpdatedDate":"2024-11-21T14:59:42.54+02:00"}
{"Id":2223462,"Number":215,"KnessetNum":25,"Name":"ישיבת מליאה בתאריך 07/11/2024 בשעה 20:00","StartDate":"2024-11-07T20:00:00+02:00","FinishDate":"2024-11-08T00:50:00+02:00","IsSpecialMeeting":false,"LastUpdatedDate":"2024-11-08T00:42:07.897+02:00"}
{"Id":2223649,"Number":222,"KnessetNum":25,"Name":"ישיבת מליאה בתאריך 25/11/2024 בשעה 16:00","StartDate":"2024-11-25T16:00:00+02:00","FinishDate":"2024-11-26T01:30:00+02:00","IsSpecialMeeting":false,"LastUpdatedDate":"2024-11-26T01:30:06.29+02:00"}
{"Id":2223650,"Number":223,"KnessetNum":25,"Name":"ישיבת מליאה בתאריך 26/11/2024 בשעה 16:00","StartDate":"2024-11-26T16:00:00+02:00","FinishDate":"2024-11-26T19:20:00+02:00","IsSpecialMeeting":false,"LastUpdatedDate":"2024-11-26T19:20:12.537+02:00"}
{"Id":2223651,"Number":224,"KnessetNum":25,"Name":"ישיבת מליאה בתאריך 27/11/2024 בשעה 11:00","StartDate":"2024-11-27T11:00:00+02:00","FinishDate":"2024-11-27T21:30:00+02:00","IsSpecialMeeting":false,"LastUpdatedDate":"2024-11-27T21:20:11.233+02:00"}
{"Id":2224065,"Number":225,"KnessetNum":25,"Name":"ישיבת מליאה בתאריך 02/12/2024 בשעה 16:00","StartDate":"2024-12-02T16:00:00+02:00","FinishDate":"2024-12-03T01:03:18+02:00","IsSpecialMeeting":false,"LastUpdatedDate":"2024-12-03T10:14:37.11+02:00"}
{"Id":2224066,"Number":226,"KnessetNum":25,"Name":"ישיבת מליאה בתאריך 03/12/2024 בשעה 16:00","StartDate":"2024-12-03T16:00:00+02:00","FinishDate":"2024-12-03T16:50:00+02:00","IsSpecialMeeting":false,"LastUpdatedDate":"2024-12-03T16:51:12.593+02:00"}
{"Id":2224067,"Number":227,"KnessetNum":25,"Name":"ישיבת מליאה בתאריך 04/12/2024 בשעה 11:00","StartDate":"2024-12-04T11:00:00+02:00","FinishDate":"2024-12-04T23:10:00+02:00","IsSpecialMeeting":false,"LastUpdatedDate":"2024-12-10T15:34:24.493+02:00"}
{"Id":2224435,"Number":228,"KnessetNum":25,"Name":"ישיבת מליאה בתאריך 09/12/2024 בשעה 16:00","StartDate":"2024-12-09T16:00:00+02:00","FinishDate":"2024-12-10T00:30:00+02:00","IsSpecialMeeting":false,"LastUpdatedDate":"2024-12-10T14:54:27.937+02:00"}
{"Id":2224436,"Number":229,"KnessetNum":25,"Name":"ישיבת מליאה בתאריך 10/12/2024 בשעה 16:00","StartDate":"2024-12-10T16:00:00+02:00","FinishDate":"2024-12-10T18:40:00+02:00","IsSpecialMeeting":false,"LastUpdatedDate":"2024-12-11T09:44:33.237+02:00"}
{"Id":2224437,"Number":230,"KnessetNum":25,"Name":"ישיבת מליאה בתאריך 11/12/2024 בשעה 11:00","StartDate":"2024-12-11T11:00:00+02:00","FinishDate":"2024-12-11T23:20:00+02:00","IsSpecialMeeting":false,"LastUpdatedDate":"2024-12-17T11:03:21.057+02:00"}
{"Id":2225127,"Number":234,"KnessetNum":25,"Name":"ישיבת מליאה בתאריך 23/12/2024 בשעה 16:00","StartDate":"2024-12-23T16:00:00+02:00","FinishDate":"2024-12-24T04:00:00+02:00","IsSpecialMeeting":false,"LastUpdatedDate":"2024-12-24T04:02:08.357+02:00"}
{"Id":2225128,"Number":235,"KnessetNum":25,"Name":"ישיבת מליאה בתאריך 24/12/2024 בשעה 16:00","StartDate":"2024-12-24T16:00:00+02:00","FinishDate":"2024-12-25T00:10:00+02:00","IsSpecialMeeting":false,"LastUpdatedDate":"2024-12-25T07:28:17.44+02:00"}
{"Id":2225129,"Number":236,"KnessetNum":25,"Name":"ישיבת מליאה בתאריך 25/12/2024 בשעה 13:00","StartDate":"2024-12-25T13:00:00+02:00","FinishDate":"2024-12-25T16:10:00+02:00","IsSpecialMeeting":false,"LastUpdatedDate":"2024-12-25T16:01:50.117+02:00"}
{"Id":2225157,"Number":231,"KnessetNum":25,"Name":"ישיבת מליאה בתאריך 16/12/2024 בשעה 16:00","StartDate":"2024-12-16T16:00:00+02:00","FinishDate":"2024-12-17T01:40:00+02:00","IsSpecialMeeting":false,"LastUpdatedDate":"2024-12-17T01:37:05.343+02:00"}
{"Id":2225158,"Number":232,"KnessetNum":25,"Name":"ישיבת מליאה בתאריך 17/12/2024 בשעה 16:00","StartDate":"2024-12-17T16:00:00+02:00","FinishDate":"2024-12-17T17:50:00+02:00","IsSpecialMeeting":false,"LastUpdatedDate":"2024-12-17T17:54:22.43+02:00"}
{"Id":2225159,"Number":233,"KnessetNum":25,"Name":"ישיבת מליאה בתאריך 18/12/2024 בשעה 11:00","StartDate":"2024-12-18T11:00:00+02:00","FinishDate":"2024-12-19T04:40:00+02:00","IsSpecialMeeting":false,"LastUpdatedDate":"2024-12-19T08:10:14.057+02:00"}
{"Id":2225671,"Number":237,"KnessetNum":25,"Name":"ישיבת מליאה בתאריך 30/12/2024 בשעה 09:00","StartDate":"2024-12-30T09:00:00+02:00","FinishDate":"2024-12-30T15:10:00+02:00","IsSpecialMeeting":false,"LastUpdatedDate":"2024-12-30T15:03:10.683+02:00"}
{"Id":2225672,"Number":238,"KnessetNum":25,"Name":"ישיבת מליאה בתאריך 31/12/2024 בשעה 10:00","StartDate":"2024-12-31T10:00:00+02:00","FinishDate":"2024-12-31T17:40:00+02:00","IsSpecialMeeting":false,"LastUpdatedDate":"2024-12-31T17:47:27.147+02:00"}
{"Id":2225673,"Number":239,"KnessetNum":25,"Name":"ישיבת מליאה בתאריך 01/01/2025 בשעה 11:00","StartDate":"2025-01-01T11:00:00+02:00","FinishDate":"2025-01-01T14:20:00+02:00","IsSpecialMeeting":false,"LastUpdatedDate":"2025-01-01T14:17:11.85+02:00"}
{"Id":2226072,"Number":240,"KnessetNum":25,"Name":"ישיבת מליאה בתאריך 06/01/2025 בשעה 16:00","StartDate":"2025-01-06T16:00:00+02:00","FinishDate":"2025-01-06T23:10:00+02:00","IsSpecialMeeting":false,"LastUpdatedDate":"2025-01-06T23:33:14.893+02:00"}
{"Id":2226073,"Number":241,"KnessetNum":25,"Name":"ישיבת מליאה בתאריך 07/01/2025 בשעה 16:00","StartDate":"2025-01-07T16:00:00+02:00","FinishDate":"2025-01-07T21:12:49+02:00","IsSpecialMeeting":false,"LastUpdatedDate":"2025-01-09T10:36:00.307+02:00"}
{"Id":2226074,"Number":242,"KnessetNum":25,"Name":"ישיבת מליאה בתאריך 08/01/2025 בשעה 11:00","StartDate":"2025-01-08T11:00:00+02:00","FinishDate":"2025-01-08T21:22:25+02:00","IsSpecialMeeting":false,"LastUpdatedDate":"2025-01-08T23:23:31.5+02:00"}
{"Id":2226303,"Number":243,"KnessetNum":25,"Name":"ישיבת מליאה בתאריך 13/01/2025 בשעה 16:00","StartDate":"2025-01-13T16:00:00+02:00","FinishDate":"2025-01-13T23:50:00+02:00","IsSpecialMeeting":false,"LastUpdatedDate":"2025-01-13T23:43:14.853+02:00"}
{"Id":2226304,"Number":244,"KnessetNum":25,"Name":"ישיבת מליאה בתאריך 14/01/2025 בשעה 16:00","StartDate":"2025-01-14T16:00:00+02:00","FinishDate":"2025-01-14T18:10:00+02:00","IsSpecialMeeting":false,"LastUpdatedDate":"2025-01-14T18:39:44.44+02:00"}
{"Id":2226305,"Number":245,"KnessetNum":25,"Name":"ישיבת מליאה בתאריך 15/01/2025 בשעה 11:00","StartDate":"2025-01-15T11:00:00+02:00","FinishDate":"2025-01-15T21:10:00+02:00","IsSpecialMeeting":false,"LastUpdatedDate":"2025-01-15T21:03:40.577+02:00"}
{"Id":2226758,"Number":246,"KnessetNum":25,"Name":"ישיבת מליאה בתאריך 20/01/2025 בשעה 16:00","StartDate":"2025-01-20T16:00:00+02:00","FinishDate":"2025-01-20T22:08:18+02:00","IsSpecialMeeting":false,"LastUpdatedDate":"2025-01-22T10:59:56.437+02:00"}
{"Id":2226759,"Number":247,"KnessetNum":25,"Name":"ישיבת מליאה בתאריך 21/01/2025 בשעה 16:00","StartDate":"2025-01-21T16:00:00+02:00","FinishDate":"2025-01-21T17:30:00+02:00","IsSpecialMeeting":false,"LastUpdatedDate":"2025-01-21T17:24:10.357+02:00"}
{"Id":2226760,"Number":248,"KnessetNum":25,"Name":"ישיבת מליאה בתאריך 22/01/2025 בשעה 11:00","StartDate":"2025-01-22T11:00:00+02:00","FinishDate":"2025-01-22T23:50:00+02:00","IsSpecialMeeting":false,"LastUpdatedDate":"2025-01-23T06:58:33.06+02:00"}
{"Id":2227125,"Number":249,"KnessetNum":25,"Name":"ישיבת מליאה בתאריך 27/01/2025 בשעה 16:00","StartDate":"2025-01-27T16:00:00+02:00","FinishDate":"2025-01-27T21:40:00+02:00","IsSpecialMeeting":false,"LastUpdatedDate":"2025-02-09T12:04:34.537+02:00"}
{"Id":2227126,"Number":250,"KnessetNum":25,"Name":"ישיבת מליאה בתאריך 28/01/2025 בשעה 16:00","StartDate":"2025-01-28T16:00:00+02:00","FinishDate":"2025-01-28T18:38:02+02:00","IsSpecialMeeting":false,"LastUpdatedDate":"2025-01-29T10:55:21.277+02:00"}
{"Id":2227127,"Number":251,"KnessetNum":25,"Name":"ישיבת מליאה בתאריך 29/01/2025 בשעה 11:00","StartDate":"2025-01-29T11:00:00+02:00","FinishDate":"2025-01-29T20:40:00+02:00","IsSpecialMeeting":false,"LastUpdatedDate":"2025-02-09T10:54:24.74+02:00"}
{"Id":2227440,"Number":252,"KnessetNum":25,"Name":"ישיבת מליאה בתאריך 03/02/2025 בשעה 16:00","StartDate":"2025-02-03T16:00:00+02:00","FinishDate":"2025-02-03T21:20:00+02:00","IsSpecialMeeting":false,"LastUpdatedDate":"2025-02-03T21:16:54.767+02:00"}
{"Id":2227441,"Number":253,"KnessetNum":25,"Name":"ישיבת מליאה בתאריך 04/02/2025 בשעה 16:00","StartDate":"2025-02-04T16:00:00+02:00","FinishDate":"2025-02-04T17:50:00+02:00","IsSpecialMeeting":false,"LastUpdatedDate":"2025-02-04T17:44:14.94+02:00"}
{"Id":2227442,"Number":254,"KnessetNum":25,"Name":"ישיבת מליאה בתאריך 05/02/2025 בשעה 11:00","StartDate":"2025-02-05T11:00:00+02:00","FinishDate":"2025-02-05T16:30:00+02:00","IsSpecialMeeting":false,"LastUpdatedDate":"2025-02-05T16:26:49.88+02:00"}
{"Id":2227768,"Number":255,"KnessetNum":25,"Name":"ישיבת מליאה בתאריך 10/02/2025 בשעה 16:00","StartDate":"2025-02-10T16:00:00+02:00","FinishDate":"2025-02-10T21:10:00+02:00","IsSpecialMeeting":false,"LastUpdatedDate":"2025-02-10T21:01:30.04+02:00"}
{"Id":2227769,"Number":256,"KnessetNum":25,"Name":"ישיבת מליאה בתאריך 11/02/2025 בשעה 16:00","StartDate":"2025-02-11T16:00:00+02:00","FinishDate":"2025-02-11T17:31:23+02:00","IsSpecialMeeting":false,"LastUpdatedDate":"2025-02-12T11:44:42.247+02:00"}
{"Id":2227770,"Number":257,"KnessetNum":25,"Name":"ישיבת מליאה בתאריך 12/02/2025 בשעה 11:00","StartDate":"2025-02-12T11:00:00+02:00","FinishDate":"2025-02-12T16:00:00+02:00","IsSpecialMeeting":false,"LastUpdatedDate":"2025-02-16T14:57:01.197+02:00"}
{"Id":2227965,"Number":258,"KnessetNum":25,"Name":"ישיבת מליאה בתאריך 17/02/2025 בשעה 16:00","StartDate":"2025-02-17T16:00:00+02:00","FinishDate":"2025-02-17T21:50:00+02:00","IsSpecialMeeting":false,"LastUpdatedDate":"2025-02-18T15:40:42.38+02:00"}
{"Id":2227966,"Number":259,"KnessetNum":25,"Name":"ישיבת מליאה בתאריך 18/02/2025 בשעה 16:00","StartDate":"2025-02-18T16:00:00+02:00","FinishDate":"2025-02-18T18:40:00+02:00","IsSpecialMeeting":false,"LastUpdatedDate":"2025-02-18T18:33:00.007+02:00"}
{"Id":2227967,"Number":260,"KnessetNum":25,"Name":"ישיבת מליאה בתאריך 19/02/2025 בשעה 11:00","StartDate":"2025-02-19T11:00:00+02:00","FinishDate":"2025-02-19T17:50:00+02:00","IsSpecialMeeting":false,"LastUpdatedDate":"2025-02-20T14:56:26.567+02:00"}
{"Id":2228250,"Number":261,"KnessetNum":25,"Name":"ישיבת מליאה בתאריך 24/02/2025 בשעה 16:00","StartDate":"2025-02-24T16:00:00+02:00","FinishDate":"2025-02-24T21:50:00+02:00","IsSpecialMeeting":false,"LastUpdatedDate":"2025-02-24T21:47:42.797+02:00"}
{"Id":2228251,"Number":262,"KnessetNum":25,"Name":"ישיבת מליאה בתאריך 25/02/2025 בשעה 16:00","StartDate":"2025-02-25T16:00:00+02:00","FinishDate":"2025-02-25T17:00:00+02:00","IsSpecialMeeting":false,"LastUpdatedDate":"2025-03-02T10:57:16.68+02:00"}
{"Id":2228252,"Number":263,"KnessetNum":25,"Name":"ישיבת מליאה בתאריך 26/02/2025 בשעה 11:00","StartDate":"2025-02-26T11:00:00+02:00","FinishDate":"2025-02-26T14:10:00+02:00","IsSpecialMeeting":false,"LastUpdatedDate":"2025-03-02T14:58:26.497+02:00"}
{"Id":2228804,"Number":264,"KnessetNum":25,"Name":"ישיבת מליאה בתאריך 03/03/2025 בשעה 16:00","StartDate":"2025-03-03T16:00:00+02:00","FinishDate":"2025-03-04T05:40:00+02:00","IsSpecialMeeting":false,"LastUpdatedDate":"2025-03-11T10:04:27.657+02:00"}
{"Id":2228805,"Number":265,"KnessetNum":25,"Name":"ישיבת מליאה בתאריך 04/03/2025 בשעה 16:00","StartDate":"2025-03-04T16:00:00+02:00","FinishDate":"2025-03-04T18:00:00+02:00","IsSpecialMeeting":false,"LastUpdatedDate":"2025-03-04T17:58:59.907+02:00"}
{"Id":2228806,"Number":266,"KnessetNum":25,"Name":"ישיבת מליאה בתאריך 05/03/2025 בשעה 11:00","StartDate":"2025-03-05T11:00:00+02:00","FinishDate":"2025-03-05T18:35:00+02:00","IsSpecialMeeting":false,"LastUpdatedDate":"2025-03-11T11:12:26.763+02:00"}
{"Id":2229213,"Number":267,"KnessetNum":25,"Name":"ישיבת מליאה בתאריך 10/03/2025 בשעה 16:00","StartDate":"2025-03-10T16:00:00+02:00","FinishDate":"2025-03-10T23:20:00+02:00","IsSpecialMeeting":false,"LastUpdatedDate":"2025-03-11T11:48:47.397+02:00"}
{"Id":2229214,"Number":268,"KnessetNum":25,"Name":"ישיבת מליאה בתאריך 11/03/2025 בשעה 16:00","StartDate":"2025-03-11T16:00:00+02:00","FinishDate":"2025-03-11T19:30:00+02:00","IsSpecialMeeting":false,"LastUpdatedDate":"2025-03-11T19:29:58.93+02:00"}
{"Id":2229215,"Number":269,"KnessetNum":25,"Name":"ישיבת מליאה בתאריך 12/03/2025 בשעה 11:00","StartDate":"2025-03-12T11:00:00+02:00","FinishDate":"2025-03-12T20:40:00+02:00","IsSpecialMeeting":false,"LastUpdatedDate":"2025-03-12T20:35:05.01+02:00"}
{"Id":2229520,"Number":270,"KnessetNum":25,"Name":"ישיבת מליאה בתאריך 17/03/2025 בשעה 16:00","StartDate":"2025-03-17T16:00:00+02:00","FinishDate":"2025-03-17T23:51:22+02:00","IsSpecialMeeting":false,"LastUpdatedDate":"2025-03-18T07:23:39.343+02:00"}
{"Id":2229521,"Number":271,"KnessetNum":25,"Name":"ישיבת מליאה בתאריך 18/03/2025 בשעה 16:00","StartDate":"2025-03-18T16:00:00+02:00","FinishDate":"2025-03-18T16:20:00+02:00","IsSpecialMeeting":false,"LastUpdatedDate":"2025-03-18T16:16:01.647+02:00"}
{"Id":2229522,"Number":272,"KnessetNum":25,"Name":"ישיבת מליאה בתאריך 19/03/2025 בשעה 11:00","StartDate":"2025-03-19T11:00:00+02:00","FinishDate":"2025-03-20T06:00:00+02:00","IsSpecialMeeting":false,"LastUpdatedDate":"2025-03-20T10:11:02.653+02:00"}