{"Id":180387,"Number":61,"KnessetNum":17,"Name":"ישיבת מליאה בתאריך 20/11/2006 בשעה 16:00","StartDate":"2006-11-20T16:00:00+02:00","FinishDate":"2006-11-20T21:30:00+02:00","IsSpecialMeeting":false,"LastUpdatedDate":"2021-01-05T12:01:39.107+02:00"}
{"Id":180388,"Number":62,"KnessetNum":17,"Name":"ישיבת מליאה בתאריך 21/11/2006 בשעה: 16:00","StartDate":"2006-11-21T16:00:00+02:00","FinishDate":"2006-11-21T20:20:00+02:00","IsSpecialMeeting":false,"LastUpdatedDate":"2013-10-03T16:21:47+03:00"}
{"Id":180389,"Number":63,"KnessetNum":17,"Name":"ישיבת מליאה בתאריך 22/11/2006 בשעה: 11:00","StartDate":"2006-11-22T11:00:00+02:00","FinishDate":"2006-11-22T19:30:00+02:00","IsSpecialMeeting":false,"LastUpdatedDate":"2013-10-03T16:21:47+03:00"}
{"Id":181192,"Number":64,"KnessetNum":17,"Name":"ישיבת מליאה בתאריך 27/11/2006 בשעה 16:00","StartDate":"2006-11-27T16:00:00+02:00","FinishDate":"2006-11-27T20:00:00+02:00","IsSpecialMeeting":false,"LastUpdatedDate":"2021-01-05T11:47:53.863+02:00"}
{"Id":181193,"Number":65,"KnessetNum":17,"Name":"ישיבת מליאה בתאריך 28/11/2006 בשעה: 16:00","StartDate":"2006-11-28T16:00:00+02:00","FinishDate":"2006-11-28T19:30:00+02:00","IsSpecialMeeting":false,"LastUpdatedDate":"2013-10-03T16:21:47+03:00"}
{"Id":181194,"Number":66,"KnessetNum":17,"Name":"ישיבת מליאה בתאריך 29/11/2006 בשעה: 11:00","StartDate":"2006-11-29T11:00:00+02:00","FinishDate":"2006-11-29T19:10:00+02:00","IsSpecialMeeting":false,"LastUpdatedDate":"2013-10-03T16:21:47+03:00"}
{"Id":182025,"Number":67,"KnessetNum":17,"Name":"ישיבת מליאה בתאריך 04/12/2006 בשעה: 16:00","StartDate":"2006-12-04T16:00:00+02:00","FinishDate":"2006-12-04T21:30:00+02:00","IsSpecialMeeting":false,"LastUpdatedDate":"2013-10-03T16:21:47+03:00"}
{"Id":182028,"Number":68,"KnessetNum":17,"Name":"ישיבת מליאה בתאריך 05/12/2006 בשעה: 16:00","StartDate":"2006-12-05T16:00:00+02:00","FinishDate":"2006-12-05T19:30:00+02:00","IsSpecialMeeting":false,"LastUpdatedDate":"2013-10-03T16:21:47+03:00"}
{"Id":182029,"Number":69,"KnessetNum":17,"Name":"ישיבת מליאה בתאריך 06/12/2006 בשעה: 11:00","StartDate":"2006-12-06T11:00:00+02:00","FinishDate":"2006-12-06T23:40:00+02:00","IsSpecialMeeting":false,"LastUpdatedDate":"2013-10-03T16:21:47+03:00"}
{"Id":182496,"Number":70,"KnessetNum":17,"Name":"ישיבת מליאה בתאריך 11/12/2006 בשעה: 16:00","StartDate":"2006-12-11T16:00:00+02:00","FinishDate":"2006-12-11T19:20:00+02:00","IsSpecialMeeting":false,"LastUpdatedDate":"2013-10-03T16:21:47+03:00"}
{"Id":182497,"Number":71,"KnessetNum":17,"Name":"ישיבת מליאה בתאריך 12/12/2006 בשעה: 16:00","StartDate":"2006-12-12T16:00:00+02:00","FinishDate":"2006-12-12T19:50:00+02:00","IsSpecialMeeting":false,"LastUpdatedDate":"2013-10-03T16:21:47+03:00"}
{"Id":182498,"Number":72,"KnessetNum":17,"Name":"ישיבת מליאה בתאריך 13/12/2006 בשעה: 11:00","StartDate":"2006-12-13T11:00:00+02:00","FinishDate":"2006-12-13T19:40:00+02:00","IsSpecialMeeting":false,"LastUpdatedDate":"2013-10-03T16:21:47+03:00"}
{"Id":183693,"Number":73,"KnessetNum":17,"Name":"ישיבת מליאה בתאריך 18/12/2006 בשעה: 12:00","StartDate":"2006-12-18T12:00:00+02:00","FinishDate":"2006-12-18T15:00:00+02:00","IsSpecialMeeting":false,"LastUpdatedDate":"2013-10-03T16:21:47+03:00"}
{"Id":183694,"Number":74,"KnessetNum":17,"Name":"ישיבת מליאה בתאריך 19/12/2006 בשעה: 12:00","StartDate":"2006-12-19T12:00:00+02:00","FinishDate":"2006-12-19T15:30:00+02:00","IsSpecialMeeting":false,"LastUpdatedDate":"2013-10-03T16:21:47+03:00"}
{"Id":184215,"Number":75,"KnessetNum":17,"Name":"ישיבת מליאה בתאריך 25/12/2006 בשעה: 16:00","StartDate":"2006-12-25T16:00:00+02:00","FinishDate":"2006-12-25T20:20:00+02:00","IsSpecialMeeting":false,"LastUpdatedDate":"2013-10-03T16:21:47+03:00"}
{"Id":184216,"Number":76,"KnessetNum":17,"Name":"ישיבת מליאה בתאריך 26/12/2006 בשעה: 16:00","StartDate":"2006-12-26T16:00:00+02:00","FinishDate":"2006-12-26T19:42:00+02:00","IsSpecialMeeting":false,"LastUpdatedDate":"2013-10-03T16:21:47+03:00"}
{"Id":184217,"Number":77,"KnessetNum":17,"Name":"ישיבת מליאה בתאריך 27/12/2006 בשעה: 11:00","StartDate":"2006-12-27T11:00:00+02:00","FinishDate":"2006-12-27T19:40:00+02:00","IsSpecialMeeting":false,"LastUpdatedDate":"2013-10-03T16:21:47+03:00"}
{"Id":184920,"Number":78,"KnessetNum":17,"Name":"ישיבת מליאה בתאריך 01/01/2007 בשעה 16:00","StartDate":"2007-01-01T16:00:00+02:00","FinishDate":"2007-01-01T20:30:00+02:00","IsSpecialMeeting":false,"LastUpdatedDate":"2020-02-09T11:06:33.747+02:00"}
{"Id":184925,"Number":79,"KnessetNum":17,"Name":"ישיבת מליאה בתאריך 02/01/2007 בשעה: 11:00","StartDate":"2007-01-02T11:00:00+02:00","FinishDate":"2007-01-02T20:00:00+02:00","IsSpecialMeeting":false,"LastUpdatedDate":"2013-10-03T16:21:47+03:00"}
{"Id":184927,"Number":80,"KnessetNum":17,"Name":"ישיבת מליאה בתאריך 03/01/2007 בשעה: 09:00","StartDate":"2007-01-03T09:00:00+02:00","FinishDate":"2007-01-03T12:40:00+02:00","IsSpecialMeeting":false,"LastUpdatedDate":"2013-10-03T16:21:47+03:00"}
{"Id":185523,"Number":81,"KnessetNum":17,"Name":"ישיבת מליאה בתאריך 08/01/2007 בשעה 16:00","StartDate":"2007-01-08T16:00:00+02:00","FinishDate":"2007-01-08T19:40:00+02:00","IsSpecialMeeting":false,"LastUpdatedDate":"2020-09-13T11:44:29.813+03:00"}
{"Id":185524,"Number":82,"KnessetNum":17,"Name":"ישיבת מליאה בתאריך 09/01/2007 בשעה: 16:00","StartDate":"2007-01-09T16:00:00+02:00","FinishDate":"2007-01-09T20:10:00+02:00","IsSpecialMeeting":false,"LastUpdatedDate":"2013-10-03T16:21:47+03:00"}
{"Id":185525,"Number":83,"KnessetNum":17,"Name":"ישיבת מליאה בתאריך 10/01/2007 בשעה: 11:00","StartDate":"2007-01-10T11:00:00+02:00","FinishDate":"2007-01-10T18:30:00+02:00","IsSpecialMeeting":false,"LastUpdatedDate":"2013-10-03T16:21:47+03:00"}
{"Id":186251,"Number":84,"KnessetNum":17,"Name":"ישיבת מליאה בתאריך 15/01/2007 בשעה 16:00","StartDate":"2007-01-15T16:00:00+02:00","FinishDate":"2007-01-15T21:40:00+02:00","IsSpecialMeeting":false,"LastUpdatedDate":"2021-01-05T12:35:00.63+02:00"}
{"Id":186265,"Number":85,"KnessetNum":17,"Name":"ישיבת מליאה בתאריך 16/01/2007 בשעה 16:00","StartDate":"2007-01-16T16:00:00+02:00","FinishDate":"2007-01-16T21:00:00+02:00","IsSpecialMeeting":false,"LastUpdatedDate":"2020-09-10T10:57:43.517+03:00"}
{"Id":186267,"Number":86,"KnessetNum":17,"Name":"ישיבת מליאה בתאריך 17/01/2007 בשעה: 11:00","StartDate":"2007-01-17T11:00:00+02:00","FinishDate":"2007-01-17T19:20:00+02:00","IsSpecialMeeting":false,"LastUpdatedDate":"2013-10-03T16:21:47+03:00"}
{"Id":187052,"Number":87,"KnessetNum":17,"Name":"ישיבת מליאה בתאריך 22/01/2007 בשעה 16:00","StartDate":"2007-01-22T16:00:00+02:00","FinishDate":"2007-01-22T19:40:00+02:00","IsSpecialMeeting":false,"LastUpdatedDate":"2021-01-05T11:31:14.037+02:00"}
{"Id":187058,"Number":88,"KnessetNum":17,"Name":"ישיבת מליאה בתאריך 23/01/2007 בשעה: 16:00","StartDate":"2007-01-23T16:00:00+02:00","FinishDate":"2007-01-23T18:50:00+02:00","IsSpecialMeeting":false,"LastUpdatedDate":"2013-10-03T16:21:47+03:00"}
{"Id":187060,"Number":89,"KnessetNum":17,"Name":"ישיבת מליאה בתאריך 24/01/2007 בשעה: 11:00","StartDate":"2007-01-24T11:00:00+02:00","FinishDate":"2007-01-24T18:10:00+02:00","IsSpecialMeeting":false,"LastUpdatedDate":"2013-10-03T16:21:47+03:00"}
{"Id":187574,"Number":90,"KnessetNum":17,"Name":"ישיבת מליאה בתאריך 29/01/2007 בשעה: 16:00","StartDate":"2007-01-29T16:00:00+02:00","FinishDate":"2007-01-29T20:20:00+02:00","IsSpecialMeeting":false,"LastUpdatedDate":"2013-10-03T16:21:47+03:00"}
{"Id":187576,"Number":91,"KnessetNum":17,"Name":"ישיבת מליאה בתאריך 30/01/2007 בשעה: 16:00","StartDate":"2007-01-30T16:00:00+02:00","FinishDate":"2007-01-30T20:00:00+02:00","IsSpecialMeeting":false,"LastUpdatedDate":"2013-10-03T16:21:47+03:00"}
{"Id":187577,"Number":92,"KnessetNum":17,"Name":"ישיבת מליאה בתאריך 31/01/2007 בשעה: 11:00","StartDate":"2007-01-31T11:00:00+02:00","FinishDate":"2007-01-31T17:40:00+02:00","IsSpecialMeeting":false,"LastUpdatedDate":"2013-10-03T16:21:47+03:00"}
{"Id":188346,"Number":93,"KnessetNum":17,"Name":"ישיבת מליאה בתאריך 05/02/2007 בשעה: 16:00","StartDate":"2007-02-05T16:00:00+02:00","FinishDate":"2007-02-05T19:40:00+02:00","IsSpecialMeeting":false,"LastUpdatedDate":"2013-10-03T16:21:47+03:00"}
{"Id":188350,"Number":94,"KnessetNum":17,"Name":"ישיבת מליאה בתאריך 06/02/2007 בשעה: 16:00","StartDate":"2007-02-06T16:00:00+02:00","FinishDate":"2007-02-06T20:40:00+02:00","IsSpecialMeeting":false,"LastUpdatedDate":"2013-10-03T16:21:47+03:00"}
{"Id":188463,"Number":95,"KnessetNum":17,"Name":"ישיבת מליאה בתאריך 07/02/2007 בשעה: 11:00","StartDate":"2007-02-07T11:00:00+02:00","FinishDate":"2007-02-07T20:40:00+02:00","IsSpecialMeeting":false,"LastUpdatedDate":"2013-10-03T16:21:47+03:00"}
{"Id":189263,"Number":96,"KnessetNum":17,"Name":"ישיבת מליאה בתאריך 12/02/2007 בשעה: 16:00","StartDate":"2007-02-12T16:00:00+02:00","FinishDate":"2007-02-12T21:00:00+02:00","IsSpecialMeeting":false,"LastUpdatedDate":"2013-10-03T16:21:47+03:00"}
{"Id":189443,"Number":97,"KnessetNum":17,"Name":"ישיבת מליאה בתאריך 13/02/2007 בשעה: 16:00","StartDate":"2007-02-13T16:00:00+02:00","FinishDate":"2007-02-13T18:50:00+02:00","IsSpecialMeeting":false,"LastUpdatedDate":"2013-10-03T16:21:47+03:00"}
{"Id":189451,"Number":98,"KnessetNum":17,"Name":"ישיבת מליאה בתאריך 14/02/2007 בשעה 11:00","StartDate":"2007-02-14T11:00:00+02:00","FinishDate":"2007-02-14T20:30:00+02:00","IsSpecialMeeting":false,"LastUpdatedDate":"2020-09-10T10:45:19.373+03:00"}
{"Id":189941,"Number":99,"KnessetNum":17,"Name":"ישיבת מליאה בתאריך 19/02/2007 בשעה: 16:00","StartDate":"2007-02-19T16:00:00+02:00","FinishDate":"2007-02-19T19:30:00+02:00","IsSpecialMeeting":false,"LastUpdatedDate":"2013-10-03T16:21:47+03:00"}
{"Id":189942,"Number":100,"KnessetNum":17,"Name":"ישיבת מליאה בתאריך 20/02/2007 בשעה: 16:00","StartDate":"2007-02-20T16:00:00+02:00","FinishDate":"2007-02-20T20:30:00+02:00","IsSpecialMeeting":false,"LastUpdatedDate":"2013-10-03T16:21:47+03:00"}
{"Id":189943,"Number":101,"KnessetNum":17,"Name":"ישיבת מליאה בתאריך 21/02/2007 בשעה 11:00","StartDate":"2007-02-21T11:00:00+02:00","FinishDate":"2007-02-21T18:20:00+02:00","IsSpecialMeeting":false,"LastUpdatedDate":"2021-01-05T11:33:16.16+02:00"}