{"Id":410715,"Number":235,"KnessetNum":18,"Name":"ישיבת מליאה בתאריך 27/04/2011 בשעה: 11:00","StartDate":"2011-04-27T11:00:00+03:00","FinishDate":"2011-04-27T15:40:00+03:00","IsSpecialMeeting":false,"LastUpdatedDate":"2013-10-03T16:21:47+03:00"}
{"Id":411213,"Number":236,"KnessetNum":18,"Name":"ישיבת מליאה בתאריך 11/05/2011 בשעה: 12:00","StartDate":"2011-05-11T12:00:00+03:00","FinishDate":"2011-05-11T16:00:00+03:00","IsSpecialMeeting":false,"LastUpdatedDate":"2013-10-03T16:21:47+03:00"}
{"Id":411413,"Number":237,"KnessetNum":18,"Name":"ישיבת מליאה בתאריך 16/05/2011 בשעה: 16:00","StartDate":"2011-05-16T16:00:00+03:00","FinishDate":"2011-05-16T21:10:00+03:00","IsSpecialMeeting":false,"LastUpdatedDate":"2013-10-03T16:21:47+03:00"}
{"Id":411414,"Number":238,"KnessetNum":18,"Name":"ישיבת מליאה בתאריך 17/05/2011 בשעה: 16:00","StartDate":"2011-05-17T16:00:00+03:00","FinishDate":"2011-05-17T19:10:00+03:00","IsSpecialMeeting":false,"LastUpdatedDate":"2013-10-03T16:21:47+03:00"}
{"Id":411415,"Number":239,"KnessetNum":18,"Name":"ישיבת מליאה בתאריך 18/05/2011 בשעה: 11:00","StartDate":"2011-05-18T11:00:00+03:00","FinishDate":"2011-05-18T18:30:00+03:00","IsSpecialMeeting":false,"LastUpdatedDate":"2013-10-03T16:21:47+03:00"}
{"Id":411986,"Number":240,"KnessetNum":18,"Name":"ישיבת מליאה בתאריך 23/05/2011 בשעה: 16:00","StartDate":"2011-05-23T16:00:00+03:00","FinishDate":"2011-05-23T19:10:00+03:00","IsSpecialMeeting":false,"LastUpdatedDate":"2013-10-03T16:21:47+03:00"}
{"Id":411987,"Number":241,"KnessetNum":18,"Name":"ישיבת מליאה בתאריך 24/05/2011 בשעה: 16:00","StartDate":"2011-05-24T16:00:00+03:00","FinishDate":"2011-05-24T18:50:00+03:00","IsSpecialMeeting":false,"LastUpdatedDate":"2013-10-03T16:21:47+03:00"}
{"Id":411988,"Number":242,"KnessetNum":18,"Name":"ישיבת מליאה בתאריך 25/05/2011 בשעה: 11:00","StartDate":"2011-05-25T11:00:00+03:00","FinishDate":"2011-05-25T19:40:00+03:00","IsSpecialMeeting":false,"LastUpdatedDate":"2013-10-03T16:21:47+03:00"}
{"Id":412554,"Number":243,"KnessetNum":18,"Name":"ישיבת מליאה בתאריך 30/05/2011 בשעה: 16:00","StartDate":"2011-05-30T16:00:00+03:00","FinishDate":"2011-05-30T21:00:00+03:00","IsSpecialMeeting":false,"LastUpdatedDate":"2013-10-03T16:21:47+03:00"}
{"Id":412571,"Number":244,"KnessetNum":18,"Name":"ישיבת מליאה בתאריך 31/05/2011 בשעה: 16:00","StartDate":"2011-05-31T16:00:00+03:00","FinishDate":"2011-05-31T18:30:00+03:00","IsSpecialMeeting":false,"LastUpdatedDate":"2013-10-03T16:21:47+03:00"}
{"Id":412575,"Number":245,"KnessetNum":18,"Name":"ישיבת מליאה בתאריך 01/06/2011 בשעה: 11:00","StartDate":"2011-06-01T11:00:00+03:00","FinishDate":"2011-06-01T16:50:00+03:00","IsSpecialMeeting":false,"LastUpdatedDate":"2013-10-03T16:21:47+03:00"}
{"Id":412897,"Number":246,"KnessetNum":18,"Name":"ישיבת מליאה בתאריך 06/06/2011 בשעה: 16:00","StartDate":"2011-06-06T16:00:00+03:00","FinishDate":"2011-06-06T21:10:00+03:00","IsSpecialMeeting":false,"LastUpdatedDate":"2013-10-03T16:21:47+03:00"}
{"Id":413237,"Number":247,"KnessetNum":18,"Name":"ישיבת מליאה בתאריך 13/06/2011 בשעה: 16:00","StartDate":"2011-06-13T16:00:00+03:00","FinishDate":"2011-06-13T19:00:00+03:00","IsSpecialMeeting":false,"LastUpdatedDate":"2013-10-03T16:21:47+03:00"}
{"Id":413238,"Number":248,"KnessetNum":18,"Name":"ישיבת מליאה בתאריך 14/06/2011 בשעה: 16:00","StartDate":"2011-06-14T16:00:00+03:00","FinishDate":"2011-06-14T18:00:00+03:00","IsSpecialMeeting":false,"LastUpdatedDate":"2013-10-03T16:21:47+03:00"}
{"Id":413239,"Number":249,"KnessetNum":18,"Name":"ישיבת מליאה בתאריך 15/06/2011 בשעה: 11:00","StartDate":"2011-06-15T11:00:00+03:00","FinishDate":"2011-06-15T20:30:00+03:00","IsSpecialMeeting":false,"LastUpdatedDate":"2013-10-03T16:21:47+03:00"}
{"Id":413705,"Number":250,"KnessetNum":18,"Name":"ישיבת מליאה בתאריך 20/06/2011 בשעה: 16:00","StartDate":"2011-06-20T16:00:00+03:00","FinishDate":"2011-06-20T19:40:00+03:00","IsSpecialMeeting":false,"LastUpdatedDate":"2013-10-03T16:21:47+03:00"}
{"Id":413715,"Number":251,"KnessetNum":18,"Name":"ישיבת מליאה בתאריך 21/06/2011 בשעה: 16:00","StartDate":"2011-06-21T16:00:00+03:00","FinishDate":"2011-06-21T20:10:00+03:00","IsSpecialMeeting":false,"LastUpdatedDate":"2013-10-03T16:21:47+03:00"}
{"Id":413720,"Number":252,"KnessetNum":18,"Name":"ישיבת מליאה בתאריך 22/06/2011 בשעה: 11:00","StartDate":"2011-06-22T11:00:00+03:00","FinishDate":"2011-06-22T18:20:00+03:00","IsSpecialMeeting":false,"LastUpdatedDate":"2013-10-03T16:21:47+03:00"}
{"Id":414057,"Number":253,"KnessetNum":18,"Name":"ישיבת מליאה בתאריך 27/06/2011 בשעה: 16:00","StartDate":"2011-06-27T16:00:00+03:00","FinishDate":"2011-06-27T20:10:00+03:00","IsSpecialMeeting":false,"LastUpdatedDate":"2013-10-03T16:21:47+03:00"}
{"Id":414058,"Number":254,"KnessetNum":18,"Name":"ישיבת מליאה בתאריך 28/06/2011 בשעה: 16:00","StartDate":"2011-06-28T16:00:00+03:00","FinishDate":"2011-06-28T21:10:00+03:00","IsSpecialMeeting":false,"LastUpdatedDate":"2013-10-03T16:21:47+03:00"}
{"Id":414060,"Number":255,"KnessetNum":18,"Name":"ישיבת מליאה בתאריך 29/06/2011 בשעה: 11:00","StartDate":"2011-06-29T11:00:00+03:00","FinishDate":"2011-06-29T18:30:00+03:00","IsSpecialMeeting":false,"LastUpdatedDate":"2013-10-03T16:21:47+03:00"}
{"Id":414574,"Number":256,"KnessetNum":18,"Name":"ישיבת מליאה בתאריך 04/07/2011 בשעה: 16:00","StartDate":"2011-07-04T16:00:00+03:00","FinishDate":"2011-07-04T21:50:00+03:00","IsSpecialMeeting":false,"LastUpdatedDate":"2013-10-03T16:21:47+03:00"}
{"Id":414575,"Number":257,"KnessetNum":18,"Name":"ישיבת מליאה בתאריך 05/07/2011 בשעה: 16:00","StartDate":"2011-07-05T16:00:00+03:00","FinishDate":"2011-07-05T19:40:00+03:00","IsSpecialMeeting":false,"LastUpdatedDate":"2013-10-03T16:21:47+03:00"}
{"Id":414576,"Number":258,"KnessetNum":18,"Name":"ישיבת מליאה בתאריך 06/07/2011 בשעה: 11:00","StartDate":"2011-07-06T11:00:00+03:00","FinishDate":"2011-07-06T16:30:00+03:00","IsSpecialMeeting":false,"LastUpdatedDate":"2013-10-03T16:21:47+03:00"}
{"Id":415198,"Number":259,"KnessetNum":18,"Name":"ישיבת מליאה בתאריך 11/07/2011 בשעה: 16:00","StartDate":"2011-07-11T16:00:00+03:00","FinishDate":"2011-07-11T23:30:00+03:00","IsSpecialMeeting":false,"LastUpdatedDate":"2013-10-03T16:21:47+03:00"}
{"Id":415200,"Number":260,"KnessetNum":18,"Name":"ישיבת מליאה בתאריך 12/07/2011 בשעה: 16:00","StartDate":"2011-07-12T16:00:00+03:00","FinishDate":"2011-07-12T18:20:00+03:00","IsSpecialMeeting":false,"LastUpdatedDate":"2013-10-03T16:21:47+03:00"}
{"Id":415205,"Number":261,"KnessetNum":18,"Name":"ישיבת מליאה בתאריך 13/07/2011 בשעה: 11:00","StartDate":"2011-07-13T11:00:00+03:00","FinishDate":"2011-07-13T18:50:00+03:00","IsSpecialMeeting":false,"LastUpdatedDate":"2013-10-03T16:21:47+03:00"}
{"Id":415692,"Number":262,"KnessetNum":18,"Name":"ישיבת מליאה בתאריך 18/07/2011 בשעה: 16:00","StartDate":"2011-07-18T16:00:00+03:00","FinishDate":"2011-07-18T22:30:00+03:00","IsSpecialMeeting":false,"LastUpdatedDate":"2013-10-03T16:21:47+03:00"}
{"Id":415693,"Number":263,"KnessetNum":18,"Name":"ישיבת מליאה בתאריך 19/07/2011 בשעה: 16:00","StartDate":"2011-07-19T16:00:00+03:00","FinishDate":"2011-07-19T17:40:00+03:00","IsSpecialMeeting":false,"LastUpdatedDate":"2013-10-03T16:21:47+03:00"}
{"Id":415694,"Number":264,"KnessetNum":18,"Name":"ישיבת מליאה בתאריך 20/07/2011 בשעה: 11:00","StartDate":"2011-07-20T11:00:00+03:00","FinishDate":"2011-07-21T00:30:00+03:00","IsSpecialMeeting":false,"LastUpdatedDate":"2013-10-03T16:21:47+03:00"}
{"Id":418491,"Number":291,"KnessetNum":7,"Name":"ישיבת מליאה בתאריך 24/04/1972 בשעה 16:00","StartDate":"1972-04-24T16:00:00+03:00","FinishDate":"1972-04-24T20:42:00+03:00","IsSpecialMeeting":null,"LastUpdatedDate":"2021-02-01T10:32:58.58+02:00"}
{"Id":418497,"Number":400,"KnessetNum":7,"Name":"ישיבת מליאה בתאריך 05/03/1973 בשעה 16:01","StartDate":"1973-03-05T16:01:00+02:00","FinishDate":"1973-03-05T21:10:00+02:00","IsSpecialMeeting":null,"LastUpdatedDate":"2021-03-15T11:25:31.773+02:00"}
{"Id":418505,"Number":10,"KnessetNum":8,"Name":"ישיבת מליאה בתאריך 12/02/1974 בשעה 15:00","StartDate":"1974-02-12T15:00:00+02:00","FinishDate":"1974-02-12T20:45:00+02:00","IsSpecialMeeting":null,"LastUpdatedDate":"2020-08-18T14:34:34.203+03:00"}
{"Id":418506,"Number":55,"KnessetNum":8,"Name":"ישיבת מליאה בתאריך 05/06/1974 בשעה 11:01","StartDate":"1974-06-05T11:01:00+03:00","FinishDate":"1974-06-05T13:58:00+03:00","IsSpecialMeeting":null,"LastUpdatedDate":"2021-06-24T11:20:48.293+03:00"}
{"Id":418507,"Number":62,"KnessetNum":8,"Name":"ישיבת מליאה בתאריך 24/06/1974 בשעה 16:02","StartDate":"1974-06-24T16:02:00+03:00","FinishDate":"1974-06-24T20:00:00+03:00","IsSpecialMeeting":null,"LastUpdatedDate":"2021-07-04T00:49:02.557+03:00"}
{"Id":418508,"Number":76,"KnessetNum":8,"Name":"ישיבת מליאה בתאריך 23/07/1974 בשעה 16:04","StartDate":"1974-07-23T16:04:00+03:00","FinishDate":"1974-07-23T19:30:00+03:00","IsSpecialMeeting":null,"LastUpdatedDate":"2021-07-31T13:09:02.563+03:00"}
{"Id":418509,"Number":79,"KnessetNum":8,"Name":"ישיבת מליאה בתאריך 29/07/1974 בשעה 16:04","StartDate":"1974-07-29T16:04:00+03:00","FinishDate":"1974-07-29T18:47:00+03:00","IsSpecialMeeting":null,"LastUpdatedDate":"2021-07-31T14:07:51.643+03:00"}
{"Id":418510,"Number":82,"KnessetNum":8,"Name":"ישיבת מליאה בתאריך 05/08/1974 בשעה 16:02","StartDate":"1974-08-05T16:02:00+03:00","FinishDate":"1974-08-05T20:46:00+03:00","IsSpecialMeeting":null,"LastUpdatedDate":"2021-07-31T15:34:17.26+03:00"}
{"Id":418512,"Number":129,"KnessetNum":8,"Name":"ישיבת מליאה בתאריך 06/01/1975 בשעה 16:01","StartDate":"1975-01-06T16:01:00+02:00","FinishDate":"1975-01-06T19:58:00+02:00","IsSpecialMeeting":null,"LastUpdatedDate":"2021-11-20T00:52:01.517+02:00"}
{"Id":418514,"Number":143,"KnessetNum":8,"Name":"ישיבת מליאה בתאריך 05/02/1975 בשעה 11:01","StartDate":"1975-02-05T11:01:00+02:00","FinishDate":"1975-02-05T13:38:00+02:00","IsSpecialMeeting":null,"LastUpdatedDate":"2021-12-15T00:41:23.443+02:00"}
{"Id":418517,"Number":165,"KnessetNum":8,"Name":"ישיבת מליאה בתאריך 28/04/1975 בשעה 16:03","StartDate":"1975-04-28T16:03:00+03:00","FinishDate":"1975-04-28T19:31:00+03:00","IsSpecialMeeting":null,"LastUpdatedDate":"2021-12-24T02:13:22.867+02:00"}
{"Id":418519,"Number":180,"KnessetNum":8,"Name":"ישיבת מליאה בתאריך 02/06/1975 בשעה 16:02","StartDate":"1975-06-02T16:02:00+03:00","FinishDate":"1975-06-02T21:05:00+03:00","IsSpecialMeeting":null,"LastUpdatedDate":"2022-01-12T00:36:36.2+02:00"}
{"Id":418526,"Number":214,"KnessetNum":8,"Name":"ישיבת מליאה בתאריך 20/10/1975 בשעה 16:05","StartDate":"1975-10-20T16:05:00+02:00","FinishDate":"1975-10-20T18:50:00+02:00","IsSpecialMeeting":null,"LastUpdatedDate":"2022-01-17T00:41:52.81+02:00"}
{"Id":418528,"Number":233,"KnessetNum":8,"Name":"ישיבת מליאה בתאריך 02/12/1975 בשעה 16:23","StartDate":"1975-12-02T16:23:00+02:00","FinishDate":"1975-12-02T22:17:00+02:00","IsSpecialMeeting":null,"LastUpdatedDate":"2022-03-13T08:57:29.267+02:00"}
{"Id":418531,"Number":250,"KnessetNum":8,"Name":"ישיבת מליאה בתאריך 12/01/1976 בשעה 16:04","StartDate":"1976-01-12T16:04:00+02:00","FinishDate":"1976-01-12T20:20:00+02:00","IsSpecialMeeting":null,"LastUpdatedDate":"2022-03-20T18:32:03.357+02:00"}
{"Id":418532,"Number":262,"KnessetNum":8,"Name":"ישיבת מליאה בתאריך 09/02/1976 בשעה 16:02","StartDate":"1976-02-09T16:02:00+02:00","FinishDate":"1976-02-09T19:10:00+02:00","IsSpecialMeeting":null,"LastUpdatedDate":"2022-04-03T02:43:52.77+03:00"}
{"Id":418533,"Number":279,"KnessetNum":8,"Name":"ישיבת מליאה בתאריך 22/03/1976 בשעה 16:04","StartDate":"1976-03-22T16:04:00+02:00","FinishDate":"1976-03-22T20:08:00+02:00","IsSpecialMeeting":null,"LastUpdatedDate":"2022-04-10T02:38:32.3+03:00"}
{"Id":418534,"Number":282,"KnessetNum":8,"Name":"ישיבת מליאה בתאריך 29/03/1976 בשעה 16:03","StartDate":"1976-03-29T16:03:00+02:00","FinishDate":"1976-03-29T20:25:00+02:00","IsSpecialMeeting":null,"LastUpdatedDate":"2022-05-02T09:58:26.367+03:00"}
{"Id":418536,"Number":301,"KnessetNum":8,"Name":"ישיבת מליאה בתאריך 07/06/1976 בשעה 16:00","StartDate":"1976-06-07T16:00:00+03:00","FinishDate":"1976-06-07T20:04:00+03:00","IsSpecialMeeting":null,"LastUpdatedDate":"2022-05-23T08:53:15.057+03:00"}
{"Id":418540,"Number":335,"KnessetNum":8,"Name":"ישיבת מליאה בתאריך 25/10/1976 בשעה 16:04","StartDate":"1976-10-25T16:04:00+02:00","FinishDate":"1976-10-25T18:55:00+02:00","IsSpecialMeeting":null,"LastUpdatedDate":"2022-06-16T14:13:34.993+03:00"}
{"Id":418546,"Number":371,"KnessetNum":8,"Name":"ישיבת מליאה בתאריך 17/01/1977 בשעה 16:04","StartDate":"1977-01-17T16:04:00+02:00","FinishDate":"1977-01-17T18:54:00+02:00","IsSpecialMeeting":null,"LastUpdatedDate":"2022-11-17T15:38:32.397+02:00"}
{"Id":418550,"Number":383,"KnessetNum":8,"Name":"ישיבת מליאה בתאריך 14/02/1977 בשעה 16:04","StartDate":"1977-02-14T16:04:00+02:00","FinishDate":"1977-02-14T20:41:00+02:00","IsSpecialMeeting":null,"LastUpdatedDate":"2022-12-10T04:12:30.36+02:00"}
{"Id":418558,"Number":4,"KnessetNum":9,"Name":"ישיבת מליאה בתאריך 27/06/1977 בשעה 16:03","StartDate":"1977-06-27T16:03:00+03:00","FinishDate":"1977-06-27T18:06:00+03:00","IsSpecialMeeting":null,"LastUpdatedDate":"2020-08-19T13:41:47.263+03:00"}
{"Id":418559,"Number":5,"KnessetNum":9,"Name":"ישיבת מליאה בתאריך 28/06/1977 בשעה 16:03","StartDate":"1977-06-28T16:03:00+03:00","FinishDate":"1977-06-28T20:21:00+03:00","IsSpecialMeeting":null,"LastUpdatedDate":"2020-08-19T14:18:33.877+03:00"}
{"Id":418560,"Number":10,"KnessetNum":9,"Name":"ישיבת מליאה בתאריך 11/07/1977 בשעה 16:02","StartDate":"1977-07-11T16:02:00+03:00","FinishDate":"1977-07-11T20:48:00+03:00","IsSpecialMeeting":null,"LastUpdatedDate":"2020-08-22T02:27:37.943+03:00"}
{"Id":418561,"Number":34,"KnessetNum":9,"Name":"ישיבת מליאה בתאריך 31/10/1977 בשעה 16:03","StartDate":"1977-10-31T16:03:00+02:00","FinishDate":"1977-10-31T22:58:00+02:00","IsSpecialMeeting":null,"LastUpdatedDate":"2020-09-28T02:00:18.437+03:00"}
{"Id":418562,"Number":56,"KnessetNum":9,"Name":"ישיבת מליאה בתאריך 19/12/1977 בשעה 16:02","StartDate":"1977-12-19T16:02:00+02:00","FinishDate":"1977-12-19T20:16:00+02:00","IsSpecialMeeting":null,"LastUpdatedDate":"2020-10-14T23:15:12.537+03:00"}
{"Id":418563,"Number":62,"KnessetNum":9,"Name":"ישיבת מליאה בתאריך 02/01/1978 בשעה 16:02","StartDate":"1978-01-02T16:02:00+02:00","FinishDate":"1978-01-02T18:45:00+02:00","IsSpecialMeeting":null,"LastUpdatedDate":"2020-10-16T20:30:26.5+03:00"}
{"Id":418564,"Number":68,"KnessetNum":9,"Name":"ישיבת מליאה בתאריך 16/01/1978 בשעה 16:03","StartDate":"1978-01-16T16:03:00+02:00","FinishDate":"1978-01-16T19:05:00+02:00","IsSpecialMeeting":null,"LastUpdatedDate":"2020-10-17T00:45:49.997+03:00"}
{"Id":418565,"Number":79,"KnessetNum":9,"Name":"ישיבת מליאה בתאריך 08/02/1978 בשעה 11:02","StartDate":"1978-02-08T11:02:00+02:00","FinishDate":"1978-02-08T16:24:00+02:00","IsSpecialMeeting":null,"LastUpdatedDate":"2020-10-19T01:08:19.647+03:00"}
{"Id":418566,"Number":80,"KnessetNum":9,"Name":"ישיבת מליאה בתאריך 13/02/1978 בשעה 16:05","StartDate":"1978-02-13T16:05:00+02:00","FinishDate":"1978-02-13T18:55:00+02:00","IsSpecialMeeting":null,"LastUpdatedDate":"2020-10-20T20:50:55.953+03:00"}
{"Id":418567,"Number":102,"KnessetNum":9,"Name":"ישיבת מליאה בתאריך 03/04/1978 בשעה 16:03","StartDate":"1978-04-03T16:03:00+02:00","FinishDate":"1978-04-03T20:40:00+02:00","IsSpecialMeeting":null,"LastUpdatedDate":"2020-10-26T22:02:48.81+02:00"}
{"Id":418569,"Number":116,"KnessetNum":9,"Name":"ישיבת מליאה בתאריך 05/06/1978 בשעה 16:03","StartDate":"1978-06-05T16:03:00+03:00","FinishDate":"1978-06-05T19:42:00+03:00","IsSpecialMeeting":null,"LastUpdatedDate":"2020-11-01T01:36:40.577+02:00"}
{"Id":418570,"Number":122,"KnessetNum":9,"Name":"ישיבת מליאה בתאריך 19/06/1978 בשעה 16:01","StartDate":"1978-06-19T16:01:00+03:00","FinishDate":"1978-06-19T21:52:00+03:00","IsSpecialMeeting":null,"LastUpdatedDate":"2020-11-06T03:20:57.56+02:00"}
{"Id":418571,"Number":136,"KnessetNum":9,"Name":"ישיבת מליאה בתאריך 19/07/1978 בשעה 11:00","StartDate":"1978-07-19T11:00:00+03:00","FinishDate":"1978-07-20T00:23:00+03:00","IsSpecialMeeting":null,"LastUpdatedDate":"2020-11-08T03:21:19.79+02:00"}
{"Id":418572,"Number":153,"KnessetNum":9,"Name":"ישיבת מליאה בתאריך 13/11/1978 בשעה 16:02","StartDate":"1978-11-13T16:02:00+02:00","FinishDate":"1978-11-13T19:20:00+02:00","IsSpecialMeeting":null,"LastUpdatedDate":"2020-11-18T00:51:17.737+02:00"}
{"Id":418574,"Number":161,"KnessetNum":9,"Name":"ישיבת מליאה בתאריך 29/11/1978 בשעה 11:03","StartDate":"1978-11-29T11:03:00+02:00","FinishDate":"1978-11-29T15:27:00+02:00","IsSpecialMeeting":null,"LastUpdatedDate":"2020-11-19T08:46:26.193+02:00"}
{"Id":418575,"Number":167,"KnessetNum":9,"Name":"ישיבת מליאה בתאריך 18/12/1978 בשעה 16:03","StartDate":"1978-12-18T16:03:00+02:00","FinishDate":"1978-12-18T18:31:00+02:00","IsSpecialMeeting":null,"LastUpdatedDate":"2025-01-27T13:16:29.83+02:00"}
{"Id":418576,"Number":172,"KnessetNum":9,"Name":"ישיבת מליאה בתאריך 27/12/1978 בשעה 11:02","StartDate":"1978-12-27T11:02:00+02:00","FinishDate":"1978-12-27T15:58:00+02:00","IsSpecialMeeting":null,"LastUpdatedDate":"2020-11-23T22:22:48.78+02:00"}
{"Id":418577,"Number":177,"KnessetNum":9,"Name":"ישיבת מליאה בתאריך 09/01/1979 בשעה 16:03","StartDate":"1979-01-09T16:03:00+02:00","FinishDate":"1979-01-09T20:04:00+02:00","IsSpecialMeeting":null,"LastUpdatedDate":"2020-11-28T03:03:30.397+02:00"}
{"Id":418578,"Number":179,"KnessetNum":9,"Name":"ישיבת מליאה בתאריך 15/01/1979 בשעה 16:01","StartDate":"1979-01-15T16:01:00+02:00","FinishDate":"1979-01-15T19:36:00+02:00","IsSpecialMeeting":null,"LastUpdatedDate":"2020-11-28T03:17:03.53+02:00"}
{"Id":418579,"Number":186,"KnessetNum":9,"Name":"ישיבת מליאה בתאריך 30/01/1979 בשעה 16:03","StartDate":"1979-01-30T16:03:00+02:00","FinishDate":"1979-01-30T20:20:00+02:00","IsSpecialMeeting":null,"LastUpdatedDate":"2020-11-30T10:46:12.723+02:00"}
{"Id":418580,"Number":188,"KnessetNum":9,"Name":"ישיבת מליאה בתאריך 05/02/1979 בשעה 16:02","StartDate":"1979-02-05T16:02:00+02:00","FinishDate":"1979-02-05T18:51:00+02:00","IsSpecialMeeting":null,"LastUpdatedDate":"2020-12-01T00:15:26.883+02:00"}
{"Id":418581,"Number":203,"KnessetNum":9,"Name":"ישיבת מליאה בתאריך 12/03/1979 בשעה 12:11","StartDate":"1979-03-12T12:11:00+02:00","FinishDate":"1979-03-12T13:48:00+02:00","IsSpecialMeeting":null,"LastUpdatedDate":"2020-12-03T23:42:06.48+02:00"}
{"Id":418582,"Number":226,"KnessetNum":9,"Name":"ישיבת מליאה בתאריך 28/05/1979 בשעה 16:02","StartDate":"1979-05-28T16:02:00+03:00","FinishDate":"1979-05-28T20:22:00+03:00","IsSpecialMeeting":null,"LastUpdatedDate":"2021-04-19T15:15:28.83+03:00"}
{"Id":418583,"Number":229,"KnessetNum":9,"Name":"ישיבת מליאה בתאריך 04/06/1979 בשעה 16:02","StartDate":"1979-06-04T16:02:00+03:00","FinishDate":"1979-06-04T19:10:00+03:00","IsSpecialMeeting":null,"LastUpdatedDate":"2020-12-11T03:10:29.15+02:00"}
{"Id":418586,"Number":307,"KnessetNum":9,"Name":"ישיבת מליאה בתאריך 11/02/1980 בשעה 16:00","StartDate":"1980-02-11T16:00:00+02:00","FinishDate":"1980-02-11T20:29:00+02:00","IsSpecialMeeting":null,"LastUpdatedDate":"2021-02-17T03:36:53.967+02:00"}
{"Id":418588,"Number":316,"KnessetNum":9,"Name":"ישיבת מליאה בתאריך 04/03/1980 בשעה 16:02","StartDate":"1980-03-04T16:02:00+02:00","FinishDate":"1980-03-04T20:33:00+02:00","IsSpecialMeeting":null,"LastUpdatedDate":"2021-02-21T14:51:29.003+02:00"}
{"Id":418589,"Number":319,"KnessetNum":9,"Name":"ישיבת מליאה בתאריך 10/03/1980 בשעה 16:00","StartDate":"1980-03-10T16:00:00+02:00","FinishDate":"1980-03-10T21:32:00+02:00","IsSpecialMeeting":null,"LastUpdatedDate":"2021-02-18T02:20:45.483+02:00"}
{"Id":418593,"Number":341,"KnessetNum":9,"Name":"ישיבת מליאה בתאריך 09/06/1980 בשעה 16:04","StartDate":"1980-06-09T16:04:00+03:00","FinishDate":"1980-06-09T21:45:00+03:00","IsSpecialMeeting":null,"LastUpdatedDate":"2021-04-11T01:39:20.803+03:00"}
{"Id":418594,"Number":356,"KnessetNum":9,"Name":"ישיבת מליאה בתאריך 14/07/1980 בשעה 16:00","StartDate":"1980-07-14T16:00:00+03:00","FinishDate":"1980-07-14T19:47:00+03:00","IsSpecialMeeting":null,"LastUpdatedDate":"2020-10-21T13:14:10.06+03:00"}
{"Id":418603,"Number":433,"KnessetNum":9,"Name":"ישיבת מליאה בתאריך 16/03/1981 בשעה 16:04","StartDate":"1981-03-16T16:04:00+02:00","FinishDate":"1981-03-16T20:10:00+02:00","IsSpecialMeeting":null,"LastUpdatedDate":"2020-06-17T15:25:41.427+03:00"}
{"Id":418606,"Number":442,"KnessetNum":9,"Name":"ישיבת מליאה בתאריך 11/05/1981 בשעה 16:04","StartDate":"1981-05-11T16:04:00+03:00","FinishDate":"1981-05-11T19:28:00+03:00","IsSpecialMeeting":null,"LastUpdatedDate":"2020-06-11T11:35:20.113+03:00"}
{"Id":418615,"Number":48,"KnessetNum":10,"Name":"ישיבת מליאה בתאריך 20/01/1982 בשעה 11:04","StartDate":"1982-01-20T11:04:00+02:00","FinishDate":"1982-01-20T12:29:00+02:00","IsSpecialMeeting":null,"LastUpdatedDate":"2023-03-29T11:19:36.507+03:00"}
{"Id":418616,"Number":69,"KnessetNum":10,"Name":"ישיבת מליאה בתאריך 11/03/1982 בשעה 11:04","StartDate":"1982-03-11T11:04:00+02:00","FinishDate":"1982-03-11T12:56:00+02:00","IsSpecialMeeting":null,"LastUpdatedDate":"2023-04-24T11:47:42.753+03:00"}
{"Id":418618,"Number":102,"KnessetNum":10,"Name":"ישיבת מליאה בתאריך 28/06/1982 בשעה 16:04","StartDate":"1982-06-28T16:04:00+03:00","FinishDate":"1982-06-28T19:19:00+03:00","IsSpecialMeeting":null,"LastUpdatedDate":"2023-05-09T13:14:32.54+03:00"}
{"Id":418619,"Number":108,"KnessetNum":10,"Name":"ישיבת מליאה בתאריך 12/07/1982 בשעה 16:04","StartDate":"1982-07-12T16:04:00+03:00","FinishDate":"1982-07-12T19:29:00+03:00","IsSpecialMeeting":null,"LastUpdatedDate":"2023-05-10T13:53:46.707+03:00"}
{"Id":418620,"Number":123,"KnessetNum":10,"Name":"ישיבת מליאה בתאריך 18/10/1982 בשעה 16:04","StartDate":"1982-10-18T16:04:00+02:00","FinishDate":"1982-10-18T20:42:00+02:00","IsSpecialMeeting":null,"LastUpdatedDate":"2023-05-18T11:17:03.55+03:00"}
{"Id":418621,"Number":140,"KnessetNum":10,"Name":"ישיבת מליאה בתאריך 24/11/1982 בשעה 11:04","StartDate":"1982-11-24T11:04:00+02:00","FinishDate":"1982-11-24T16:10:00+02:00","IsSpecialMeeting":null,"LastUpdatedDate":"2023-05-23T12:32:56.077+03:00"}
{"Id":418624,"Number":176,"KnessetNum":10,"Name":"ישיבת מליאה בתאריך 16/02/1983 בשעה 11:04","StartDate":"1983-02-16T11:04:00+02:00","FinishDate":"1983-02-16T18:09:00+02:00","IsSpecialMeeting":null,"LastUpdatedDate":"2023-06-14T10:41:57.917+03:00"}
{"Id":418649,"Number":5,"KnessetNum":11,"Name":"ישיבת מליאה בתאריך 12/09/1984 בשעה 11:08","StartDate":"1984-09-12T11:08:00+03:00","FinishDate":"1984-09-12T11:35:00+03:00","IsSpecialMeeting":null,"LastUpdatedDate":"2023-09-04T13:28:31.07+03:00"}
{"Id":418653,"Number":16,"KnessetNum":11,"Name":"ישיבת מליאה בתאריך 07/11/1984 בשעה 11:00","StartDate":"1984-11-07T11:00:00+02:00","FinishDate":"1984-11-07T14:28:00+02:00","IsSpecialMeeting":null,"LastUpdatedDate":"2023-09-07T12:44:48.08+03:00"}
{"Id":418654,"Number":26,"KnessetNum":11,"Name":"ישיבת מליאה בתאריך 03/12/1984 בשעה 16:01","StartDate":"1984-12-03T16:01:00+02:00","FinishDate":"1984-12-03T18:44:00+02:00","IsSpecialMeeting":null,"LastUpdatedDate":"2023-09-12T10:04:22.133+03:00"}
{"Id":418655,"Number":33,"KnessetNum":11,"Name":"ישיבת מליאה בתאריך 18/12/1984 בשעה 16:03","StartDate":"1984-12-18T16:03:00+02:00","FinishDate":"1984-12-18T17:33:00+02:00","IsSpecialMeeting":null,"LastUpdatedDate":"2023-09-13T11:51:51.95+03:00"}
{"Id":418656,"Number":49,"KnessetNum":11,"Name":"ישיבת מליאה בתאריך 23/01/1985 בשעה 11:00","StartDate":"1985-01-23T11:00:00+02:00","FinishDate":"1985-01-23T15:47:00+02:00","IsSpecialMeeting":null,"LastUpdatedDate":"2025-02-02T10:02:31.26+02:00"}
{"Id":418661,"Number":126,"KnessetNum":11,"Name":"ישיבת מליאה בתאריך 21/10/1985 בשעה 16:01","StartDate":"1985-10-21T16:01:00+02:00","FinishDate":"1985-10-21T21:32:00+02:00","IsSpecialMeeting":null,"LastUpdatedDate":"2024-11-24T13:18:13.337+02:00"}
{"Id":418662,"Number":140,"KnessetNum":11,"Name":"ישיבת מליאה בתאריך 20/11/1985 בשעה 11:03","StartDate":"1985-11-20T11:03:00+02:00","FinishDate":"1985-11-20T15:57:00+02:00","IsSpecialMeeting":null,"LastUpdatedDate":"2024-12-01T10:19:35.777+02:00"}
{"Id":418663,"Number":155,"KnessetNum":11,"Name":"ישיבת מליאה בתאריך 25/12/1985 בשעה 11:00","StartDate":"1985-12-25T11:00:00+02:00","FinishDate":"1985-12-25T15:09:00+02:00","IsSpecialMeeting":null,"LastUpdatedDate":"2024-12-15T11:34:44.73+02:00"}
{"Id":418664,"Number":161,"KnessetNum":11,"Name":"ישיבת מליאה בתאריך 08/01/1986 בשעה 11:01","StartDate":"1986-01-08T11:01:00+02:00","FinishDate":"1986-01-08T16:16:00+02:00","IsSpecialMeeting":null,"LastUpdatedDate":"2024-12-16T10:22:54.17+02:00"}
{"Id":418666,"Number":189,"KnessetNum":11,"Name":"ישיבת מליאה בתאריך 17/03/1986 בשעה 16:02","StartDate":"1986-03-17T16:02:00+02:00","FinishDate":"1986-03-17T20:24:00+02:00","IsSpecialMeeting":null,"LastUpdatedDate":"2025-01-08T13:32:47.063+02:00"}
{"Id":418668,"Number":202,"KnessetNum":11,"Name":"ישיבת מליאה בתאריך 20/05/1986 בשעה 16:00","StartDate":"1986-05-20T16:00:00+03:00","FinishDate":null,"IsSpecialMeeting":null,"LastUpdatedDate":"2025-01-15T12:02:31.32+02:00"}
{"Id":418669,"Number":214,"KnessetNum":11,"Name":"ישיבת מליאה בתאריך 17/06/1986 בשעה 16:04","StartDate":"1986-06-17T16:04:00+03:00","FinishDate":"1986-06-17T19:40:00+03:00","IsSpecialMeeting":null,"LastUpdatedDate":"2025-01-20T12:07:58.117+02:00"}
{"Id":418675,"Number":256,"KnessetNum":11,"Name":"ישיבת מליאה בתאריך 18/11/1986 בשעה 16:01","StartDate":"1986-11-18T16:01:00+02:00","FinishDate":"1986-11-18T20:03:00+02:00","IsSpecialMeeting":null,"LastUpdatedDate":"2025-02-26T10:58:06.147+02:00"}
{"Id":418676,"Number":281,"KnessetNum":11,"Name":"ישיבת מליאה בתאריך 14/01/1987 בשעה 11:02","StartDate":"1987-01-14T11:02:00+02:00","FinishDate":"1987-01-14T15:28:00+02:00","IsSpecialMeeting":null,"LastUpdatedDate":"2025-03-10T10:23:25.72+02:00"}
{"Id":418677,"Number":284,"KnessetNum":11,"Name":"ישיבת מליאה בתאריך 21/01/1987 בשעה 11:02","StartDate":"1987-01-21T11:02:00+02:00","FinishDate":"1987-01-21T17:08:00+02:00","IsSpecialMeeting":null,"LastUpdatedDate":"2025-03-10T11:08:16.07+02:00"}
{"Id":418678,"Number":286,"KnessetNum":11,"Name":"ישיבת מליאה בתאריך 27/01/1987 בשעה 16:02","StartDate":"1987-01-27T16:02:00+02:00","FinishDate":"1987-01-27T19:39:00+02:00","IsSpecialMeeting":null,"LastUpdatedDate":"2025-03-10T11:09:13.883+02:00"}
{"Id":418680,"Number":290,"KnessetNum":11,"Name":"ישיבת מליאה בתאריך 03/02/1987 בשעה 16:00","StartDate":"1987-02-03T16:00:00+02:00","FinishDate":"1987-02-03T19:51:00+02:00","IsSpecialMeeting":null,"LastUpdatedDate":"2025-03-10T11:11:02.643+02:00"}
{"Id":418688,"Number":321,"KnessetNum":11,"Name":"ישיבת מליאה בתאריך 20/05/1987 בשעה 11:00","StartDate":"1987-05-20T11:00:00+03:00","FinishDate":"1987-05-20T12:30:00+03:00","IsSpecialMeeting":null,"LastUpdatedDate":"2025-03-10T12:43:06.253+02:00"}
{"Id":418690,"Number":325,"KnessetNum":11,"Name":"ישיבת מליאה בתאריך 01/06/1987 בשעה 11:04","StartDate":"1987-06-01T11:04:00+03:00","FinishDate":"1987-06-01T14:52:00+03:00","IsSpecialMeeting":null,"LastUpdatedDate":"2025-03-10T12:50:26.12+02:00"}
{"Id":418707,"Number":385,"KnessetNum":11,"Name":"ישיבת מליאה בתאריך 30/12/1987 בשעה 11:04","StartDate":"1987-12-30T11:04:00+02:00","FinishDate":"1987-12-30T16:58:00+02:00","IsSpecialMeeting":null,"LastUpdatedDate":"2025-03-11T10:06:00.717+02:00"}
{"Id":418711,"Number":399,"KnessetNum":11,"Name":"ישיבת מליאה בתאריך 02/02/1988 בשעה 16:03","StartDate":"1988-02-02T16:03:00+02:00","FinishDate":"1988-02-02T17:41:00+02:00","IsSpecialMeeting":null,"LastUpdatedDate":"2019-12-23T16:30:42.477+02:00"}
{"Id":418736,"Number":2,"KnessetNum":12,"Name":"ישיבת מליאה בתאריך 28/11/1988 בשעה 16:03","StartDate":"1988-11-28T16:03:00+02:00","FinishDate":"1988-11-28T19:43:00+02:00","IsSpecialMeeting":null,"LastUpdatedDate":"2024-02-18T13:08:20.683+02:00"}
{"Id":418744,"Number":73,"KnessetNum":12,"Name":"ישיבת מליאה בתאריך 13/06/1989 בשעה 16:00","StartDate":"1989-06-13T16:00:00+03:00","FinishDate":"1989-06-13T22:13:00+03:00","IsSpecialMeeting":null,"LastUpdatedDate":"2025-03-03T15:47:53.937+02:00"}
{"Id":418767,"Number":261,"KnessetNum":12,"Name":"ישיבת מליאה בתאריך 30/01/1991 בשעה 11:03","StartDate":"1991-01-30T11:03:00+02:00","FinishDate":"1991-01-30T16:09:00+02:00","IsSpecialMeeting":null,"LastUpdatedDate":"2019-12-16T11:29:45.493+02:00"}
{"Id":418794,"Number":389,"KnessetNum":12,"Name":"ישיבת מליאה בתאריך 25/02/1992 בשעה 16:07","StartDate":"1992-02-25T16:07:00+02:00","FinishDate":"1992-02-25T21:45:00+02:00","IsSpecialMeeting":null,"LastUpdatedDate":"2025-03-10T09:15:38.207+02:00"}
{"Id":418818,"Number":214,"KnessetNum":13,"Name":"ישיבת מליאה בתאריך 11/05/1994 בשעה 12:00","StartDate":"1994-05-11T12:00:00+03:00","FinishDate":"1994-05-11T20:26:00+03:00","IsSpecialMeeting":null,"LastUpdatedDate":"2025-02-16T08:32:08.207+02:00"}
{"Id":418886,"Number":434,"KnessetNum":13,"Name":"ישיבת מליאה בתאריך 22/04/1996 בשעה 10:13","StartDate":"1996-04-22T10:13:00+03:00","FinishDate":"1996-04-22T12:40:00+03:00","IsSpecialMeeting":null,"LastUpdatedDate":"2023-07-06T12:21:32.72+03:00"}
{"Id":418917,"Number":160,"KnessetNum":14,"Name":"ישיבת מליאה בתאריך 23/12/1997 בשעה 16:02","StartDate":"1997-12-23T16:02:00+02:00","FinishDate":"1997-12-24T00:51:00+02:00","IsSpecialMeeting":null,"LastUpdatedDate":"2025-02-24T11:41:13.737+02:00"}
{"Id":418970,"Number":282,"KnessetNum":14,"Name":"ישיבת מליאה בתאריך 27/01/1999 בשעה 10:07","StartDate":"1999-01-27T10:07:00+02:00","FinishDate":"1999-01-27T14:33:00+02:00","IsSpecialMeeting":null,"LastUpdatedDate":"2020-06-11T10:10:09.013+03:00"}
{"Id":419302,"Number":265,"KnessetNum":18,"Name":"ישיבת מליאה בתאריך 25/07/2011 בשעה: 16:00","StartDate":"2011-07-25T16:00:00+03:00","FinishDate":"2011-07-25T22:20:00+03:00","IsSpecialMeeting":false,"LastUpdatedDate":"2013-10-03T16:21:47+03:00"}
{"Id":419485,"Number":266,"KnessetNum":18,"Name":"ישיבת מליאה בתאריך 26/07/2011 בשעה: 16:00","StartDate":"2011-07-26T16:00:00+03:00","FinishDate":"2011-07-26T20:30:00+03:00","IsSpecialMeeting":false,"LastUpdatedDate":"2013-10-03T16:21:47+03:00"}
{"Id":419495,"Number":267,"KnessetNum":18,"Name":"ישיבת מליאה בתאריך 27/07/2011 בשעה: 11:00","StartDate":"2011-07-27T11:00:00+03:00","FinishDate":"2011-07-27T19:30:00+03:00","IsSpecialMeeting":false,"LastUpdatedDate":"2013-10-03T16:21:47+03:00"}
{"Id":419936,"Number":268,"KnessetNum":18,"Name":"ישיבת מליאה בתאריך 01/08/2011 בשעה: 16:00","StartDate":"2011-08-01T16:00:00+03:00","FinishDate":"2011-08-02T00:10:00+03:00","IsSpecialMeeting":false,"LastUpdatedDate":"2013-10-03T16:21:47+03:00"}
{"Id":419967,"Number":269,"KnessetNum":18,"Name":"ישיבת מליאה בתאריך 02/08/2011 בשעה: 16:00","StartDate":"2011-08-02T16:00:00+03:00","FinishDate":"2011-08-02T23:30:00+03:00","IsSpecialMeeting":false,"LastUpdatedDate":"2013-10-03T16:21:47+03:00"}
{"Id":419972,"Number":270,"KnessetNum":18,"Name":"ישיבת מליאה בתאריך 03/08/2011 בשעה: 11:00","StartDate":"2011-08-03T11:00:00+03:00","FinishDate":"2011-08-04T03:30:00+03:00","IsSpecialMeeting":false,"LastUpdatedDate":"2013-10-03T16:21:47+03:00"}