{"Id":480003,"Number":17,"KnessetNum":19,"Name":"ישיבת מליאה בתאריך 19/03/2013 בשעה 12:00","StartDate":"2013-03-19T12:00:00+02:00","FinishDate":"2013-03-19T19:10:00+02:00","IsSpecialMeeting":false,"LastUpdatedDate":"2020-11-23T20:19:28.71+02:00"}
{"Id":480282,"Number":18,"KnessetNum":19,"Name":"ישיבת מליאה בתאריך 09/04/2013 בשעה: 11:00","StartDate":"2013-04-09T11:00:00+03:00","FinishDate":"2013-04-09T14:10:00+03:00","IsSpecialMeeting":false,"LastUpdatedDate":"2015-03-17T20:10:41+02:00"}
{"Id":480345,"Number":19,"KnessetNum":19,"Name":"ישיבת מליאה בתאריך 22/04/2013 בשעה 16:00","StartDate":"2013-04-22T16:00:00+03:00","FinishDate":"2013-04-22T23:43:00+03:00","IsSpecialMeeting":false,"LastUpdatedDate":"2024-02-22T14:24:24.037+02:00"}
{"Id":480903,"Number":20,"KnessetNum":19,"Name":"ישיבת מליאה בתאריך 23/04/2013 בשעה: 16:00","StartDate":"2013-04-23T16:00:00+03:00","FinishDate":"2013-04-23T19:10:00+03:00","IsSpecialMeeting":false,"LastUpdatedDate":"2015-03-17T20:23:40+02:00"}
{"Id":480907,"Number":21,"KnessetNum":19,"Name":"ישיבת מליאה בתאריך 24/04/2013 בשעה: 11:00","StartDate":"2013-04-24T11:00:00+03:00","FinishDate":"2013-04-24T16:20:00+03:00","IsSpecialMeeting":false,"LastUpdatedDate":"2015-03-17T20:24:53+02:00"}
{"Id":481053,"Number":22,"KnessetNum":19,"Name":"ישיבת מליאה בתאריך 29/04/2013 בשעה 16:00","StartDate":"2013-04-29T16:00:00+03:00","FinishDate":"2013-04-29T22:10:00+03:00","IsSpecialMeeting":false,"LastUpdatedDate":"2020-11-23T20:23:24.48+02:00"}
{"Id":481396,"Number":23,"KnessetNum":19,"Name":"ישיבת מליאה בתאריך 30/04/2013 בשעה 16:00","StartDate":"2013-04-30T16:00:00+03:00","FinishDate":"2013-04-30T17:50:00+03:00","IsSpecialMeeting":false,"LastUpdatedDate":"2020-11-23T20:24:31.717+02:00"}
{"Id":481397,"Number":24,"KnessetNum":19,"Name":"ישיבת מליאה בתאריך 01/05/2013 בשעה: 11:00","StartDate":"2013-05-01T11:00:00+03:00","FinishDate":"2013-05-01T16:30:00+03:00","IsSpecialMeeting":false,"LastUpdatedDate":"2015-03-17T20:04:45+02:00"}
{"Id":481637,"Number":25,"KnessetNum":19,"Name":"ישיבת מליאה בתאריך 06/05/2013 בשעה 16:00","StartDate":"2013-05-06T16:00:00+03:00","FinishDate":"2013-05-06T19:20:00+03:00","IsSpecialMeeting":false,"LastUpdatedDate":"2020-11-23T20:26:57.11+02:00"}
{"Id":482036,"Number":27,"KnessetNum":19,"Name":"ישיבת מליאה בתאריך 08/05/2013 בשעה 11:00","StartDate":"2013-05-08T11:00:00+03:00","FinishDate":"2013-05-08T19:10:00+03:00","IsSpecialMeeting":false,"LastUpdatedDate":"2020-11-23T20:32:00.063+02:00"}
{"Id":482043,"Number":26,"KnessetNum":19,"Name":"ישיבת מליאה בתאריך 07/05/2013 בשעה: 16:00","StartDate":"2013-05-07T16:00:00+03:00","FinishDate":"2013-05-07T17:40:00+03:00","IsSpecialMeeting":false,"LastUpdatedDate":"2015-03-17T19:57:26+02:00"}
{"Id":482216,"Number":28,"KnessetNum":19,"Name":"ישיבת מליאה בתאריך 13/05/2013 בשעה 16:00","StartDate":"2013-05-13T16:00:00+03:00","FinishDate":"2013-05-13T20:50:00+03:00","IsSpecialMeeting":false,"LastUpdatedDate":"2020-11-23T20:24:12.28+02:00"}
{"Id":482542,"Number":29,"KnessetNum":19,"Name":"ישיבת מליאה בתאריך 20/05/2013 בשעה 16:00","StartDate":"2013-05-20T16:00:00+03:00","FinishDate":"2013-05-20T22:50:00+03:00","IsSpecialMeeting":false,"LastUpdatedDate":"2020-11-23T20:21:37.48+02:00"}
{"Id":482596,"Number":188,"KnessetNum":11,"Name":"ישיבת מליאה בתאריך 12/03/1986 בשעה 11:02","StartDate":"1986-03-12T11:02:00+02:00","FinishDate":"1986-03-12T13:03:00+02:00","IsSpecialMeeting":null,"LastUpdatedDate":"2025-01-08T12:05:37.983+02:00"}
{"Id":482630,"Number":124,"KnessetNum":10,"Name":"ישיבת מליאה בתאריך 19/10/1982 בשעה 17:03","StartDate":"1982-10-19T17:03:00+02:00","FinishDate":"1982-10-19T20:18:00+02:00","IsSpecialMeeting":null,"LastUpdatedDate":"2023-05-18T12:06:34.277+03:00"}
{"Id":482631,"Number":194,"KnessetNum":10,"Name":"ישיבת מליאה בתאריך 25/04/1983 בשעה 11:04","StartDate":"1983-04-25T11:04:00+03:00","FinishDate":"1983-04-25T13:10:00+03:00","IsSpecialMeeting":null,"LastUpdatedDate":"2023-06-25T12:05:09.85+03:00"}
{"Id":482632,"Number":215,"KnessetNum":10,"Name":"ישיבת מליאה בתאריך 20/06/1983 בשעה 16:02","StartDate":"1983-06-20T16:02:00+03:00","FinishDate":"1983-06-20T19:33:00+03:00","IsSpecialMeeting":null,"LastUpdatedDate":"2023-07-02T12:32:01.533+03:00"}
{"Id":482633,"Number":274,"KnessetNum":10,"Name":"ישיבת מליאה בתאריך 18/01/1984 בשעה 11:02","StartDate":"1984-01-18T11:02:00+02:00","FinishDate":"1984-01-18T17:09:00+02:00","IsSpecialMeeting":null,"LastUpdatedDate":"2023-07-26T10:17:28.127+03:00"}
{"Id":482634,"Number":160,"KnessetNum":10,"Name":"ישיבת מליאה בתאריך 11/01/1983 בשעה 16:00","StartDate":"1983-01-11T16:00:00+02:00","FinishDate":"1983-01-11T19:28:00+02:00","IsSpecialMeeting":null,"LastUpdatedDate":"2023-06-05T14:05:57.623+03:00"}
{"Id":482635,"Number":101,"KnessetNum":10,"Name":"ישיבת מליאה בתאריך 23/06/1982 בשעה 11:12","StartDate":"1982-06-23T11:12:00+03:00","FinishDate":"1982-06-23T13:57:00+03:00","IsSpecialMeeting":null,"LastUpdatedDate":"2023-05-09T11:58:50.69+03:00"}
{"Id":482636,"Number":201,"KnessetNum":10,"Name":"ישיבת מליאה בתאריך 11/05/1983 בשעה 11:04","StartDate":"1983-05-11T11:04:00+03:00","FinishDate":"1983-05-11T13:06:00+03:00","IsSpecialMeeting":null,"LastUpdatedDate":"2023-06-26T10:19:56.687+03:00"}
{"Id":482637,"Number":270,"KnessetNum":10,"Name":"ישיבת מליאה בתאריך 10/01/1984 בשעה 16:00","StartDate":"1984-01-10T16:00:00+02:00","FinishDate":"1984-01-10T18:58:00+02:00","IsSpecialMeeting":null,"LastUpdatedDate":"2023-07-25T14:18:41.64+03:00"}
{"Id":482638,"Number":204,"KnessetNum":10,"Name":"ישיבת מליאה בתאריך 24/05/1983 בשעה 14:03","StartDate":"1983-05-24T14:03:00+03:00","FinishDate":"1983-05-24T18:38:00+03:00","IsSpecialMeeting":null,"LastUpdatedDate":"2023-06-26T11:48:09.753+03:00"}
{"Id":482639,"Number":12,"KnessetNum":10,"Name":"ישיבת מליאה בתאריך 18/08/1981 בשעה 18:20","StartDate":"1981-08-18T18:20:00+03:00","FinishDate":"1981-08-18T18:33:00+03:00","IsSpecialMeeting":null,"LastUpdatedDate":"2023-03-01T08:15:44.597+02:00"}
{"Id":482640,"Number":54,"KnessetNum":10,"Name":"ישיבת מליאה בתאריך 03/02/1982 בשעה 11:02","StartDate":"1982-02-03T11:02:00+02:00","FinishDate":"1982-02-03T14:44:00+02:00","IsSpecialMeeting":null,"LastUpdatedDate":"2023-04-02T12:45:31.363+03:00"}
{"Id":482641,"Number":135,"KnessetNum":10,"Name":"ישיבת מליאה בתאריך 15/11/1982 בשעה 16:03","StartDate":"1982-11-15T16:03:00+02:00","FinishDate":"1982-11-15T16:32:00+02:00","IsSpecialMeeting":null,"LastUpdatedDate":"2023-05-22T10:48:14.323+03:00"}
{"Id":482642,"Number":235,"KnessetNum":10,"Name":"ישיבת מליאה בתאריך 18/10/1983 בשעה 16:04","StartDate":"1983-10-18T16:04:00+02:00","FinishDate":"1983-10-18T18:52:00+02:00","IsSpecialMeeting":null,"LastUpdatedDate":"2023-07-10T10:19:31.023+03:00"}
{"Id":482643,"Number":217,"KnessetNum":10,"Name":"ישיבת מליאה בתאריך 22/06/1983 בשעה 11:03","StartDate":"1983-06-22T11:03:00+03:00","FinishDate":"1983-06-22T16:02:00+03:00","IsSpecialMeeting":null,"LastUpdatedDate":"2023-07-02T13:25:10.453+03:00"}
{"Id":482644,"Number":7,"KnessetNum":10,"Name":"ישיבת מליאה בתאריך 05/08/1981 בשעה 10:04","StartDate":"1981-08-05T10:04:00+03:00","FinishDate":"1981-08-05T23:54:00+03:00","IsSpecialMeeting":null,"LastUpdatedDate":"2023-02-23T10:59:24.78+02:00"}
{"Id":482645,"Number":207,"KnessetNum":10,"Name":"ישיבת מליאה בתאריך 31/05/1983 בשעה 16:01","StartDate":"1983-05-31T16:01:00+03:00","FinishDate":"1983-05-31T19:45:00+03:00","IsSpecialMeeting":null,"LastUpdatedDate":"2023-06-27T10:02:30.767+03:00"}
{"Id":482646,"Number":157,"KnessetNum":10,"Name":"ישיבת מליאה בתאריך 04/01/1983 בשעה 16:01","StartDate":"1983-01-04T16:01:00+02:00","FinishDate":"1983-01-04T19:17:00+02:00","IsSpecialMeeting":null,"LastUpdatedDate":"2023-06-05T09:28:05.8+03:00"}
{"Id":482647,"Number":80,"KnessetNum":10,"Name":"ישיבת מליאה בתאריך 04/05/1982 בשעה 16:02","StartDate":"1982-05-04T16:02:00+03:00","FinishDate":"1982-05-04T21:36:00+03:00","IsSpecialMeeting":null,"LastUpdatedDate":"2023-05-02T14:36:48.457+03:00"}
{"Id":482648,"Number":198,"KnessetNum":10,"Name":"ישיבת מליאה בתאריך 05/05/1983 בשעה 18:12","StartDate":"1983-05-05T18:12:00+03:00","FinishDate":"1983-05-05T19:00:00+03:00","IsSpecialMeeting":null,"LastUpdatedDate":"2023-06-26T08:57:56.767+03:00"}
{"Id":482649,"Number":214,"KnessetNum":10,"Name":"ישיבת מליאה בתאריך 15/06/1983 בשעה 11:04","StartDate":"1983-06-15T11:04:00+03:00","FinishDate":"1983-06-15T12:55:00+03:00","IsSpecialMeeting":null,"LastUpdatedDate":"2023-07-02T12:19:00.863+03:00"}
{"Id":482650,"Number":4,"KnessetNum":10,"Name":"ישיבת מליאה בתאריך 28/07/1981 בשעה 16:03","StartDate":"1981-07-28T16:03:00+03:00","FinishDate":"1981-07-28T18:59:00+03:00","IsSpecialMeeting":null,"LastUpdatedDate":"2023-02-23T09:37:15.86+02:00"}
{"Id":482651,"Number":121,"KnessetNum":10,"Name":"ישיבת מליאה בתאריך 08/09/1982 בשעה 09:09","StartDate":"1982-09-08T09:09:00+03:00","FinishDate":"1982-09-08T18:45:00+03:00","IsSpecialMeeting":null,"LastUpdatedDate":"2023-05-18T09:31:30.113+03:00"}
{"Id":482652,"Number":139,"KnessetNum":10,"Name":"ישיבת מליאה בתאריך 23/11/1982 בשעה 11:03","StartDate":"1982-11-23T11:03:00+02:00","FinishDate":"1982-11-23T17:48:00+02:00","IsSpecialMeeting":null,"LastUpdatedDate":"2023-05-23T11:12:05.753+03:00"}
{"Id":482653,"Number":3,"KnessetNum":10,"Name":"ישיבת מליאה בתאריך 27/07/1981 בשעה 16:05","StartDate":"1981-07-27T16:05:00+03:00","FinishDate":"1981-07-27T17:50:00+03:00","IsSpecialMeeting":null,"LastUpdatedDate":"2023-02-23T09:04:40.283+02:00"}
{"Id":482654,"Number":84,"KnessetNum":10,"Name":"ישיבת מליאה בתאריך 12/05/1982 בשעה 11:02","StartDate":"1982-05-12T11:02:00+03:00","FinishDate":"1982-05-12T15:13:00+03:00","IsSpecialMeeting":null,"LastUpdatedDate":"2023-05-03T09:44:50.373+03:00"}
{"Id":482655,"Number":22,"KnessetNum":10,"Name":"ישיבת מליאה בתאריך 18/11/1981 בשעה 11:02","StartDate":"1981-11-18T11:02:00+02:00","FinishDate":"1981-11-18T13:17:00+02:00","IsSpecialMeeting":null,"LastUpdatedDate":"2023-03-13T08:31:40.053+02:00"}
{"Id":482656,"Number":122,"KnessetNum":10,"Name":"ישיבת מליאה בתאריך 22/09/1982 בשעה 16:05","StartDate":"1982-09-22T16:05:00+02:00","FinishDate":"1982-09-22T16:44:00+02:00","IsSpecialMeeting":null,"LastUpdatedDate":"2023-05-18T10:08:34.207+03:00"}
{"Id":482657,"Number":175,"KnessetNum":10,"Name":"ישיבת מליאה בתאריך 15/02/1983 בשעה 16:02","StartDate":"1983-02-15T16:02:00+02:00","FinishDate":"1983-02-15T20:40:00+02:00","IsSpecialMeeting":null,"LastUpdatedDate":"2024-02-04T09:40:27.11+02:00"}
{"Id":482658,"Number":196,"KnessetNum":10,"Name":"ישיבת מליאה בתאריך 03/05/1983 בשעה 16:02","StartDate":"1983-05-03T16:02:00+03:00","FinishDate":"1983-05-03T19:31:00+03:00","IsSpecialMeeting":null,"LastUpdatedDate":"2023-06-25T12:18:29.817+03:00"}
{"Id":482659,"Number":2,"KnessetNum":10,"Name":"ישיבת מליאה בתאריך 21/07/1981 בשעה 16:05","StartDate":"1981-07-21T16:05:00+03:00","FinishDate":"1981-07-21T16:52:00+03:00","IsSpecialMeeting":null,"LastUpdatedDate":"2023-02-23T07:53:44.443+02:00"}
{"Id":482661,"Number":186,"KnessetNum":11,"Name":"ישיבת מליאה בתאריך 10/03/1986 בשעה 16:02","StartDate":"1986-03-10T16:02:00+02:00","FinishDate":"1986-03-10T20:35:00+02:00","IsSpecialMeeting":null,"LastUpdatedDate":"2025-01-08T11:02:59.137+02:00"}
{"Id":482662,"Number":84,"KnessetNum":11,"Name":"ישיבת מליאה בתאריך 14/05/1985 בשעה 16:03","StartDate":"1985-05-14T16:03:00+03:00","FinishDate":"1985-05-14T20:00:00+03:00","IsSpecialMeeting":null,"LastUpdatedDate":"2024-11-03T12:04:34.643+02:00"}
{"Id":482663,"Number":268,"KnessetNum":11,"Name":"ישיבת מליאה בתאריך 16/12/1986 בשעה 16:00","StartDate":"1986-12-16T16:00:00+02:00","FinishDate":"1986-12-16T19:51:00+02:00","IsSpecialMeeting":null,"LastUpdatedDate":"2025-03-05T10:23:18.33+02:00"}
{"Id":482664,"Number":12,"KnessetNum":11,"Name":"ישיבת מליאה בתאריך 30/10/1984 בשעה 16:04","StartDate":"1984-10-30T16:04:00+02:00","FinishDate":"1984-10-30T20:22:00+02:00","IsSpecialMeeting":null,"LastUpdatedDate":"2023-09-07T09:06:24.067+03:00"}
{"Id":482665,"Number":24,"KnessetNum":11,"Name":"ישיבת מליאה בתאריך 27/11/1984 בשעה 16:00","StartDate":"1984-11-27T16:00:00+02:00","FinishDate":"1984-11-27T19:03:00+02:00","IsSpecialMeeting":null,"LastUpdatedDate":"2023-09-11T10:21:30.633+03:00"}
{"Id":482666,"Number":63,"KnessetNum":11,"Name":"ישיבת מליאה בתאריך 26/02/1985 בשעה 16:01","StartDate":"1985-02-26T16:01:00+02:00","FinishDate":"1985-02-26T19:34:00+02:00","IsSpecialMeeting":null,"LastUpdatedDate":"2023-10-09T08:19:14.23+03:00"}
{"Id":482667,"Number":394,"KnessetNum":11,"Name":"ישיבת מליאה בתאריך 20/01/1988 בשעה 11:03","StartDate":"1988-01-20T11:03:00+02:00","FinishDate":"1988-01-20T15:18:00+02:00","IsSpecialMeeting":null,"LastUpdatedDate":"2025-03-11T11:20:11.207+02:00"}
{"Id":482668,"Number":67,"KnessetNum":11,"Name":"ישיבת מליאה בתאריך 06/03/1985 בשעה 11:00","StartDate":"1985-03-06T11:00:00+02:00","FinishDate":"1985-03-06T15:29:00+02:00","IsSpecialMeeting":null,"LastUpdatedDate":"2023-10-10T12:48:56+03:00"}
{"Id":482669,"Number":303,"KnessetNum":11,"Name":"ישיבת מליאה בתאריך 04/03/1987 בשעה 11:00","StartDate":"1987-03-04T11:00:00+02:00","FinishDate":"1987-03-04T15:44:00+02:00","IsSpecialMeeting":null,"LastUpdatedDate":"2025-03-10T11:38:09.773+02:00"}
{"Id":482670,"Number":85,"KnessetNum":11,"Name":"ישיבת מליאה בתאריך 15/05/1985 בשעה 11:02","StartDate":"1985-05-15T11:02:00+03:00","FinishDate":"1985-05-15T14:52:00+03:00","IsSpecialMeeting":null,"LastUpdatedDate":"2023-10-23T16:14:53.193+03:00"}
{"Id":482671,"Number":393,"KnessetNum":11,"Name":"ישיבת מליאה בתאריך 19/01/1988 בשעה 16:01","StartDate":"1988-01-19T16:01:00+02:00","FinishDate":"1988-01-19T19:29:00+02:00","IsSpecialMeeting":null,"LastUpdatedDate":"2025-03-11T11:18:59.76+02:00"}
{"Id":482672,"Number":58,"KnessetNum":11,"Name":"ישיבת מליאה בתאריך 13/02/1985 בשעה 11:01","StartDate":"1985-02-13T11:01:00+02:00","FinishDate":"1985-02-13T17:10:00+02:00","IsSpecialMeeting":null,"LastUpdatedDate":"2023-09-26T12:35:22.59+03:00"}
{"Id":482673,"Number":288,"KnessetNum":11,"Name":"ישיבת מליאה בתאריך 29/01/1987 בשעה 10:03","StartDate":"1987-01-29T10:03:00+02:00","FinishDate":"1987-01-29T12:21:00+02:00","IsSpecialMeeting":null,"LastUpdatedDate":"2025-03-10T11:10:11.76+02:00"}
{"Id":482674,"Number":143,"KnessetNum":11,"Name":"ישיבת מליאה בתאריך 27/11/1985 בשעה 11:01","StartDate":"1985-11-27T11:01:00+02:00","FinishDate":"1985-11-27T17:17:00+02:00","IsSpecialMeeting":null,"LastUpdatedDate":"2024-12-02T08:29:07.707+02:00"}
{"Id":482675,"Number":388,"KnessetNum":11,"Name":"ישיבת מליאה בתאריך 06/01/1988 בשעה 11:00","StartDate":"1988-01-06T11:00:00+02:00","FinishDate":"1988-01-06T16:03:00+02:00","IsSpecialMeeting":null,"LastUpdatedDate":"2025-03-11T11:16:46.13+02:00"}
{"Id":482676,"Number":22,"KnessetNum":11,"Name":"ישיבת מליאה בתאריך 21/11/1984 בשעה 11:00","StartDate":"1984-11-21T11:00:00+02:00","FinishDate":"1984-11-21T13:10:00+02:00","IsSpecialMeeting":null,"LastUpdatedDate":"2023-09-11T08:05:07.097+03:00"}
{"Id":482677,"Number":4,"KnessetNum":11,"Name":"ישיבת מליאה בתאריך 05/09/1984 בשעה 11:04","StartDate":"1984-09-05T11:04:00+03:00","FinishDate":"1984-09-05T13:00:00+03:00","IsSpecialMeeting":null,"LastUpdatedDate":"2023-09-04T13:12:33.087+03:00"}
{"Id":482678,"Number":25,"KnessetNum":11,"Name":"ישיבת מליאה בתאריך 28/11/1984 בשעה 11:00","StartDate":"1984-11-28T11:00:00+02:00","FinishDate":"1984-11-28T13:28:00+02:00","IsSpecialMeeting":null,"LastUpdatedDate":"2023-09-12T09:19:45.36+03:00"}
{"Id":482679,"Number":146,"KnessetNum":11,"Name":"ישיבת מליאה בתאריך 04/12/1985 בשעה 11:01","StartDate":"1985-12-04T11:01:00+02:00","FinishDate":"1985-12-04T13:28:00+02:00","IsSpecialMeeting":null,"LastUpdatedDate":"2024-12-02T12:53:33.433+02:00"}
{"Id":482680,"Number":259,"KnessetNum":11,"Name":"ישיבת מליאה בתאריך 25/11/1986 בשעה 16:00","StartDate":"1986-11-25T16:00:00+02:00","FinishDate":"1986-11-25T20:20:00+02:00","IsSpecialMeeting":null,"LastUpdatedDate":"2025-03-02T09:30:36.88+02:00"}
{"Id":482681,"Number":82,"KnessetNum":11,"Name":"ישיבת מליאה בתאריך 08/05/1985 בשעה 11:01","StartDate":"1985-05-08T11:01:00+03:00","FinishDate":"1985-05-08T13:59:00+03:00","IsSpecialMeeting":null,"LastUpdatedDate":"2024-02-22T15:07:22.41+02:00"}
{"Id":482682,"Number":333,"KnessetNum":11,"Name":"ישיבת מליאה בתאריך 23/06/1987 בשעה 16:04","StartDate":"1987-06-23T16:04:00+03:00","FinishDate":"1987-06-23T19:15:00+03:00","IsSpecialMeeting":null,"LastUpdatedDate":"2025-03-10T15:11:39.277+02:00"}
{"Id":482683,"Number":291,"KnessetNum":11,"Name":"ישיבת מליאה בתאריך 04/02/1987 בשעה 11:01","StartDate":"1987-02-04T11:01:00+02:00","FinishDate":"1987-02-04T12:45:00+02:00","IsSpecialMeeting":null,"LastUpdatedDate":"2025-03-10T11:11:31.487+02:00"}
{"Id":482684,"Number":425,"KnessetNum":11,"Name":"ישיבת מליאה בתאריך 18/04/1988 בשעה 10:01","StartDate":"1988-04-18T10:01:00+03:00","FinishDate":"1988-04-18T11:27:00+03:00","IsSpecialMeeting":null,"LastUpdatedDate":"2025-03-11T13:50:42.377+02:00"}
{"Id":482685,"Number":254,"KnessetNum":11,"Name":"ישיבת מליאה בתאריך 12/11/1986 בשעה 11:00","StartDate":"1986-11-12T11:00:00+02:00","FinishDate":"1986-11-12T13:57:00+02:00","IsSpecialMeeting":null,"LastUpdatedDate":"2025-02-26T10:03:40.46+02:00"}
{"Id":482686,"Number":13,"KnessetNum":11,"Name":"ישיבת מליאה בתאריך 31/10/1984 בשעה 11:03","StartDate":"1984-10-31T11:03:00+02:00","FinishDate":"1984-10-31T13:51:00+02:00","IsSpecialMeeting":null,"LastUpdatedDate":"2023-09-07T09:40:43.27+03:00"}
{"Id":482687,"Number":363,"KnessetNum":11,"Name":"ישיבת מליאה בתאריך 10/11/1987 בשעה 16:01","StartDate":"1987-11-10T16:01:00+02:00","FinishDate":"1987-11-10T20:58:00+02:00","IsSpecialMeeting":null,"LastUpdatedDate":"2025-03-10T17:03:36.647+02:00"}
{"Id":482688,"Number":21,"KnessetNum":11,"Name":"ישיבת מליאה בתאריך 20/11/1984 בשעה 16:01","StartDate":"1984-11-20T16:01:00+02:00","FinishDate":"1984-11-20T19:00:00+02:00","IsSpecialMeeting":null,"LastUpdatedDate":"2023-09-11T07:19:00.727+03:00"}
{"Id":482689,"Number":27,"KnessetNum":11,"Name":"ישיבת מליאה בתאריך 04/12/1984 בשעה 16:01","StartDate":"1984-12-04T16:01:00+02:00","FinishDate":"1984-12-04T18:38:00+02:00","IsSpecialMeeting":null,"LastUpdatedDate":"2023-09-12T10:22:03.657+03:00"}
{"Id":482690,"Number":70,"KnessetNum":11,"Name":"ישיבת מליאה בתאריך 13/03/1985 בשעה 11:03","StartDate":"1985-03-13T11:03:00+02:00","FinishDate":"1985-03-13T13:25:00+02:00","IsSpecialMeeting":null,"LastUpdatedDate":"2023-10-17T08:41:50.333+03:00"}
{"Id":482691,"Number":57,"KnessetNum":11,"Name":"ישיבת מליאה בתאריך 12/02/1985 בשעה 16:02","StartDate":"1985-02-12T16:02:00+02:00","FinishDate":"1985-02-12T21:07:00+02:00","IsSpecialMeeting":null,"LastUpdatedDate":"2023-09-26T12:49:15.41+03:00"}
{"Id":482692,"Number":466,"KnessetNum":11,"Name":"ישיבת מליאה בתאריך 10/08/1988 בשעה 11:05","StartDate":"1988-08-10T11:05:00+03:00","FinishDate":"1988-08-10T12:30:00+03:00","IsSpecialMeeting":null,"LastUpdatedDate":"2025-03-11T15:11:27.76+02:00"}
{"Id":482693,"Number":66,"KnessetNum":11,"Name":"ישיבת מליאה בתאריך 05/03/1985 בשעה 16:03","StartDate":"1985-03-05T16:03:00+02:00","FinishDate":"1985-03-05T20:21:00+02:00","IsSpecialMeeting":null,"LastUpdatedDate":"2023-10-10T11:48:30.14+03:00"}
{"Id":482694,"Number":296,"KnessetNum":11,"Name":"ישיבת מליאה בתאריך 17/02/1987 בשעה 16:02","StartDate":"1987-02-17T16:02:00+02:00","FinishDate":"1987-02-17T17:42:00+02:00","IsSpecialMeeting":null,"LastUpdatedDate":"2025-03-10T11:14:02.183+02:00"}
{"Id":482695,"Number":400,"KnessetNum":11,"Name":"ישיבת מליאה בתאריך 03/02/1988 בשעה 11:02","StartDate":"1988-02-03T11:02:00+02:00","FinishDate":"1988-02-03T15:10:00+02:00","IsSpecialMeeting":null,"LastUpdatedDate":"2025-03-11T11:29:41.817+02:00"}
{"Id":482696,"Number":139,"KnessetNum":11,"Name":"ישיבת מליאה בתאריך 19/11/1985 בשעה 16:00","StartDate":"1985-11-19T16:00:00+02:00","FinishDate":"1985-11-19T21:53:00+02:00","IsSpecialMeeting":null,"LastUpdatedDate":"2024-12-01T09:21:30.473+02:00"}
{"Id":482697,"Number":184,"KnessetNum":11,"Name":"ישיבת מליאה בתאריך 04/03/1986 בשעה 16:00","StartDate":"1986-03-04T16:00:00+02:00","FinishDate":"1986-03-04T21:06:00+02:00","IsSpecialMeeting":null,"LastUpdatedDate":"2025-01-06T09:12:08.907+02:00"}
{"Id":482698,"Number":19,"KnessetNum":11,"Name":"ישיבת מליאה בתאריך 14/11/1984 בשעה 11:01","StartDate":"1984-11-14T11:01:00+02:00","FinishDate":"1984-11-14T16:45:00+02:00","IsSpecialMeeting":null,"LastUpdatedDate":"2023-09-10T10:35:06.927+03:00"}
{"Id":482699,"Number":1,"KnessetNum":11,"Name":"ישיבת מליאה בתאריך 13/08/1984 בשעה 16:00","StartDate":"1984-08-13T16:00:00+03:00","FinishDate":"1984-08-13T16:57:00+03:00","IsSpecialMeeting":null,"LastUpdatedDate":"2023-09-04T11:27:30.797+03:00"}
{"Id":482700,"Number":287,"KnessetNum":11,"Name":"ישיבת מליאה בתאריך 28/01/1987 בשעה 11:04","StartDate":"1987-01-28T11:04:00+02:00","FinishDate":"1987-01-28T22:13:00+02:00","IsSpecialMeeting":null,"LastUpdatedDate":"2025-03-10T11:09:41.87+02:00"}
{"Id":482701,"Number":330,"KnessetNum":11,"Name":"ישיבת מליאה בתאריך 16/06/1987 בשעה 16:04","StartDate":"1987-06-16T16:04:00+03:00","FinishDate":"1987-06-16T21:10:00+03:00","IsSpecialMeeting":null,"LastUpdatedDate":"2025-03-10T15:04:56.86+02:00"}
{"Id":482702,"Number":136,"KnessetNum":11,"Name":"ישיבת מליאה בתאריך 12/11/1985 בשעה 16:00","StartDate":"1985-11-12T16:00:00+02:00","FinishDate":"1985-11-12T20:46:00+02:00","IsSpecialMeeting":null,"LastUpdatedDate":"2024-11-27T12:09:19.933+02:00"}
{"Id":482703,"Number":357,"KnessetNum":11,"Name":"ישיבת מליאה בתאריך 27/10/1987 בשעה 16:00","StartDate":"1987-10-27T16:00:00+02:00","FinishDate":"1987-10-27T20:00:00+02:00","IsSpecialMeeting":null,"LastUpdatedDate":"2025-03-10T16:18:43.08+02:00"}
{"Id":482704,"Number":99,"KnessetNum":11,"Name":"ישיבת מליאה בתאריך 18/06/1985 בשעה 16:00","StartDate":"1985-06-18T16:00:00+03:00","FinishDate":"1985-06-18T21:25:00+03:00","IsSpecialMeeting":null,"LastUpdatedDate":"2024-02-22T14:48:38.107+02:00"}
{"Id":482705,"Number":42,"KnessetNum":11,"Name":"ישיבת מליאה בתאריך 08/01/1985 בשעה 16:01","StartDate":"1985-01-08T16:01:00+02:00","FinishDate":"1985-01-08T19:44:00+02:00","IsSpecialMeeting":null,"LastUpdatedDate":"2023-09-19T11:02:27.54+03:00"}
{"Id":482706,"Number":423,"KnessetNum":11,"Name":"ישיבת מליאה בתאריך 28/03/1988 בשעה 10:03","StartDate":"1988-03-28T10:03:00+02:00","FinishDate":"1988-03-28T15:14:00+02:00","IsSpecialMeeting":true,"LastUpdatedDate":"2025-03-11T13:49:37.837+02:00"}
{"Id":482707,"Number":31,"KnessetNum":11,"Name":"ישיבת מליאה בתאריך 12/12/1984 בשעה 11:02","StartDate":"1984-12-12T11:02:00+02:00","FinishDate":"1984-12-12T16:08:00+02:00","IsSpecialMeeting":null,"LastUpdatedDate":"2023-09-13T10:06:02.163+03:00"}
{"Id":482708,"Number":37,"KnessetNum":11,"Name":"ישיבת מליאה בתאריך 26/12/1984 בשעה 11:00","StartDate":"1984-12-26T11:00:00+02:00","FinishDate":"1984-12-26T15:22:00+02:00","IsSpecialMeeting":null,"LastUpdatedDate":"2023-09-18T08:30:56.847+03:00"}
{"Id":482709,"Number":190,"KnessetNum":11,"Name":"ישיבת מליאה בתאריך 18/03/1986 בשעה 16:00","StartDate":"1986-03-18T16:00:00+02:00","FinishDate":"1986-03-18T20:00:00+02:00","IsSpecialMeeting":null,"LastUpdatedDate":"2025-01-12T07:50:03.703+02:00"}
{"Id":482710,"Number":372,"KnessetNum":11,"Name":"ישיבת מליאה בתאריך 01/12/1987 בשעה 16:01","StartDate":"1987-12-01T16:01:00+02:00","FinishDate":"1987-12-01T21:22:00+02:00","IsSpecialMeeting":null,"LastUpdatedDate":"2025-03-10T17:17:33.99+02:00"}
{"Id":482711,"Number":158,"KnessetNum":11,"Name":"ישיבת מליאה בתאריך 01/01/1986 בשעה 11:01","StartDate":"1986-01-01T11:01:00+02:00","FinishDate":"1986-01-01T14:48:00+02:00","IsSpecialMeeting":null,"LastUpdatedDate":"2024-12-15T13:14:22.59+02:00"}
{"Id":482712,"Number":247,"KnessetNum":11,"Name":"ישיבת מליאה בתאריך 28/10/1986 בשעה 16:01","StartDate":"1986-10-28T16:01:00+02:00","FinishDate":"1986-10-28T19:15:00+02:00","IsSpecialMeeting":null,"LastUpdatedDate":"2025-02-23T09:38:33.967+02:00"}
{"Id":482713,"Number":245,"KnessetNum":11,"Name":"ישיבת מליאה בתאריך 20/10/1986 בשעה 10:03","StartDate":"1986-10-20T10:03:00+02:00","FinishDate":"1986-10-20T16:00:00+02:00","IsSpecialMeeting":null,"LastUpdatedDate":"2025-02-23T08:57:28.01+02:00"}
{"Id":482714,"Number":7,"KnessetNum":11,"Name":"ישיבת מליאה בתאריך 24/09/1984 בשעה 11:06","StartDate":"1984-09-24T11:06:00+03:00","FinishDate":"1984-09-24T19:25:00+03:00","IsSpecialMeeting":null,"LastUpdatedDate":"2023-09-05T07:45:52.5+03:00"}
{"Id":482715,"Number":176,"KnessetNum":11,"Name":"ישיבת מליאה בתאריך 12/02/1986 בשעה 11:00","StartDate":"1986-02-12T11:00:00+02:00","FinishDate":"1986-02-12T14:25:00+02:00","IsSpecialMeeting":null,"LastUpdatedDate":"2024-12-25T11:34:02.703+02:00"}
{"Id":482716,"Number":181,"KnessetNum":11,"Name":"ישיבת מליאה בתאריך 25/02/1986 בשעה 16:00","StartDate":"1986-02-25T16:00:00+02:00","FinishDate":"1986-02-25T20:06:00+02:00","IsSpecialMeeting":null,"LastUpdatedDate":"2024-12-30T09:51:07.697+02:00"}
{"Id":482717,"Number":2,"KnessetNum":11,"Name":"ישיבת מליאה בתאריך 03/09/1984 בשעה 16:04","StartDate":"1984-09-03T16:04:00+03:00","FinishDate":"1984-09-03T17:45:00+03:00","IsSpecialMeeting":null,"LastUpdatedDate":"2023-09-04T12:05:43.737+03:00"}
{"Id":482718,"Number":285,"KnessetNum":11,"Name":"ישיבת מליאה בתאריך 26/01/1987 בשעה 16:00","StartDate":"1987-01-26T16:00:00+02:00","FinishDate":"1987-01-26T18:46:00+02:00","IsSpecialMeeting":null,"LastUpdatedDate":"2025-03-10T11:08:48.697+02:00"}
{"Id":482719,"Number":97,"KnessetNum":11,"Name":"ישיבת מליאה בתאריך 12/06/1985 בשעה 11:05","StartDate":"1985-06-12T11:05:00+03:00","FinishDate":"1985-06-12T14:34:00+03:00","IsSpecialMeeting":null,"LastUpdatedDate":"2023-10-25T08:47:57.463+03:00"}
{"Id":482720,"Number":424,"KnessetNum":11,"Name":"ישיבת מליאה בתאריך 28/03/1988 בשעה 15:15","StartDate":"1988-03-28T15:15:00+02:00","FinishDate":"1988-03-28T16:24:00+02:00","IsSpecialMeeting":null,"LastUpdatedDate":"2025-03-11T13:50:12.047+02:00"}
{"Id":482721,"Number":224,"KnessetNum":11,"Name":"ישיבת מליאה בתאריך 09/07/1986 בשעה 11:03","StartDate":"1986-07-09T11:03:00+03:00","FinishDate":"1986-07-09T17:12:00+03:00","IsSpecialMeeting":null,"LastUpdatedDate":"2025-02-05T12:52:07.33+02:00"}
{"Id":482722,"Number":28,"KnessetNum":11,"Name":"ישיבת מליאה בתאריך 05/12/1984 בשעה 11:00","StartDate":"1984-12-05T11:00:00+02:00","FinishDate":"1984-12-05T15:20:00+02:00","IsSpecialMeeting":null,"LastUpdatedDate":"2023-09-11T11:18:30.91+03:00"}
{"Id":482723,"Number":429,"KnessetNum":11,"Name":"ישיבת מליאה בתאריך 09/05/1988 בשעה 19:20","StartDate":"1988-05-09T19:20:00+03:00","FinishDate":"1988-05-09T19:58:00+03:00","IsSpecialMeeting":null,"LastUpdatedDate":"2025-03-11T13:53:38.673+02:00"}
{"Id":482724,"Number":450,"KnessetNum":11,"Name":"ישיבת מליאה בתאריך 22/06/1988 בשעה 11:03","StartDate":"1988-06-22T11:03:00+03:00","FinishDate":"1988-06-22T18:19:00+03:00","IsSpecialMeeting":null,"LastUpdatedDate":"2025-03-11T14:55:25.3+02:00"}
{"Id":482725,"Number":262,"KnessetNum":11,"Name":"ישיבת מליאה בתאריך 02/12/1986 בשעה 16:00","StartDate":"1986-12-02T16:00:00+02:00","FinishDate":"1986-12-02T19:57:00+02:00","IsSpecialMeeting":null,"LastUpdatedDate":"2025-03-02T12:05:43.103+02:00"}
{"Id":482726,"Number":318,"KnessetNum":11,"Name":"ישיבת מליאה בתאריך 13/05/1987 בשעה 11:01","StartDate":"1987-05-13T11:01:00+03:00","FinishDate":"1987-05-13T13:52:00+03:00","IsSpecialMeeting":null,"LastUpdatedDate":"2025-03-10T12:38:28.4+02:00"}
{"Id":482727,"Number":124,"KnessetNum":11,"Name":"ישיבת מליאה בתאריך 15/10/1985 בשעה 16:01","StartDate":"1985-10-15T16:01:00+02:00","FinishDate":"1985-10-15T20:49:00+02:00","IsSpecialMeeting":null,"LastUpdatedDate":"2024-11-24T12:30:42.47+02:00"}
{"Id":482728,"Number":199,"KnessetNum":11,"Name":"ישיבת מליאה בתאריך 09/04/1986 בשעה 11:03","StartDate":"1986-04-09T11:03:00+03:00","FinishDate":"1986-04-09T12:07:00+03:00","IsSpecialMeeting":null,"LastUpdatedDate":"2025-01-15T10:58:20.123+02:00"}
{"Id":482729,"Number":88,"KnessetNum":11,"Name":"ישיבת מליאה בתאריך 22/05/1985 בשעה 11:00","StartDate":"1985-05-22T11:00:00+03:00","FinishDate":"1985-05-22T11:48:00+03:00","IsSpecialMeeting":null,"LastUpdatedDate":"2023-10-23T17:21:07.817+03:00"}
{"Id":482730,"Number":211,"KnessetNum":11,"Name":"ישיבת מליאה בתאריך 10/06/1986 בשעה 16:00","StartDate":"1986-06-10T16:00:00+03:00","FinishDate":"1986-06-10T19:19:00+03:00","IsSpecialMeeting":null,"LastUpdatedDate":"2025-01-20T09:34:29.833+02:00"}
{"Id":482731,"Number":375,"KnessetNum":11,"Name":"ישיבת מליאה בתאריך 08/12/1987 בשעה 16:00","StartDate":"1987-12-08T16:00:00+02:00","FinishDate":"1987-12-08T21:18:00+02:00","IsSpecialMeeting":null,"LastUpdatedDate":"2025-03-10T17:23:16.163+02:00"}
{"Id":482732,"Number":172,"KnessetNum":11,"Name":"ישיבת מליאה בתאריך 04/02/1986 בשעה 16:00","StartDate":"1986-02-04T16:00:00+02:00","FinishDate":"1986-02-04T19:27:00+02:00","IsSpecialMeeting":null,"LastUpdatedDate":"2024-12-23T11:44:53.017+02:00"}
{"Id":482733,"Number":379,"KnessetNum":11,"Name":"ישיבת מליאה בתאריך 16/12/1987 בשעה 11:00","StartDate":"1987-12-16T11:00:00+02:00","FinishDate":"1987-12-16T17:21:00+02:00","IsSpecialMeeting":null,"LastUpdatedDate":"2025-03-11T09:09:27.283+02:00"}
{"Id":482734,"Number":433,"KnessetNum":11,"Name":"ישיבת מליאה בתאריך 17/05/1988 בשעה 16:02","StartDate":"1988-05-17T16:02:00+03:00","FinishDate":"1988-05-17T19:10:00+03:00","IsSpecialMeeting":null,"LastUpdatedDate":"2025-03-11T14:02:31.98+02:00"}
{"Id":482735,"Number":250,"KnessetNum":11,"Name":"ישיבת מליאה בתאריך 04/11/1986 בשעה 16:00","StartDate":"1986-11-04T16:00:00+02:00","FinishDate":"1986-11-04T19:10:00+02:00","IsSpecialMeeting":null,"LastUpdatedDate":"2025-02-23T11:20:41.923+02:00"}
{"Id":482736,"Number":61,"KnessetNum":11,"Name":"ישיבת מליאה בתאריך 20/02/1985 בשעה 11:02","StartDate":"1985-02-20T11:02:00+02:00","FinishDate":"1985-02-20T19:29:00+02:00","IsSpecialMeeting":null,"LastUpdatedDate":"2023-09-28T09:01:08.957+03:00"}
{"Id":482737,"Number":169,"KnessetNum":11,"Name":"ישיבת מליאה בתאריך 28/01/1986 בשעה 16:01","StartDate":"1986-01-28T16:01:00+02:00","FinishDate":"1986-01-28T18:54:00+02:00","IsSpecialMeeting":null,"LastUpdatedDate":"2024-12-23T09:57:15.18+02:00"}
{"Id":482738,"Number":442,"KnessetNum":11,"Name":"ישיבת מליאה בתאריך 07/06/1988 בשעה 16:02","StartDate":"1988-06-07T16:02:00+03:00","FinishDate":"1988-06-07T21:42:00+03:00","IsSpecialMeeting":null,"LastUpdatedDate":"2025-03-11T14:12:04.17+02:00"}
{"Id":482765,"Number":161,"KnessetNum":10,"Name":"ישיבת מליאה בתאריך 12/01/1983 בשעה 11:01","StartDate":"1983-01-12T11:01:00+02:00","FinishDate":"1983-01-12T14:34:00+02:00","IsSpecialMeeting":null,"LastUpdatedDate":"2023-06-06T09:21:54.94+03:00"}
{"Id":482766,"Number":283,"KnessetNum":10,"Name":"ישיבת מליאה בתאריך 08/02/1984 בשעה 11:04","StartDate":"1984-02-08T11:04:00+02:00","FinishDate":"1984-02-08T14:49:00+02:00","IsSpecialMeeting":null,"LastUpdatedDate":"2023-07-30T11:37:21.817+03:00"}
{"Id":482767,"Number":169,"KnessetNum":10,"Name":"ישיבת מליאה בתאריך 01/02/1983 בשעה 16:04","StartDate":"1983-02-01T16:04:00+02:00","FinishDate":"1983-02-01T17:48:00+02:00","IsSpecialMeeting":null,"LastUpdatedDate":"2023-06-08T12:14:33.4+03:00"}
{"Id":482768,"Number":81,"KnessetNum":10,"Name":"ישיבת מליאה בתאריך 05/05/1982 בשעה 11:06","StartDate":"1982-05-05T11:06:00+03:00","FinishDate":"1982-05-05T17:27:00+03:00","IsSpecialMeeting":null,"LastUpdatedDate":"2023-05-02T15:03:45.523+03:00"}
{"Id":482769,"Number":184,"KnessetNum":10,"Name":"ישיבת מליאה בתאריך 08/03/1983 בשעה 11:02","StartDate":"1983-03-08T11:02:00+02:00","FinishDate":"1983-03-08T13:07:00+02:00","IsSpecialMeeting":null,"LastUpdatedDate":"2023-06-20T10:47:52.493+03:00"}
{"Id":482770,"Number":86,"KnessetNum":10,"Name":"ישיבת מליאה בתאריך 18/05/1982 בשעה 16:07","StartDate":"1982-05-18T16:07:00+03:00","FinishDate":"1982-05-18T19:18:00+03:00","IsSpecialMeeting":null,"LastUpdatedDate":"2023-05-03T09:54:03.717+03:00"}
{"Id":482771,"Number":228,"KnessetNum":10,"Name":"ישיבת מליאה בתאריך 21/07/1983 בשעה 11:01","StartDate":"1983-07-21T11:01:00+03:00","FinishDate":"1983-07-21T17:41:00+03:00","IsSpecialMeeting":null,"LastUpdatedDate":"2023-07-09T07:50:17.157+03:00"}
{"Id":482772,"Number":210,"KnessetNum":10,"Name":"ישיבת מליאה בתאריך 07/06/1983 בשעה 16:01","StartDate":"1983-06-07T16:01:00+03:00","FinishDate":"1983-06-07T19:29:00+03:00","IsSpecialMeeting":null,"LastUpdatedDate":"2023-06-27T15:04:28.127+03:00"}
{"Id":482773,"Number":67,"KnessetNum":10,"Name":"ישיבת מליאה בתאריך 04/03/1982 בשעה 11:24","StartDate":"1982-03-04T11:24:00+02:00","FinishDate":"1982-03-04T13:01:00+02:00","IsSpecialMeeting":null,"LastUpdatedDate":"2023-04-24T09:58:37.467+03:00"}
{"Id":482774,"Number":94,"KnessetNum":10,"Name":"ישיבת מליאה בתאריך 07/06/1982 בשעה 16:02","StartDate":"1982-06-07T16:02:00+03:00","FinishDate":"1982-06-07T18:30:00+03:00","IsSpecialMeeting":null,"LastUpdatedDate":"2023-05-07T11:40:34.193+03:00"}
{"Id":482775,"Number":29,"KnessetNum":10,"Name":"ישיבת מליאה בתאריך 07/12/1981 בשעה 16:08","StartDate":"1981-12-07T16:08:00+02:00","FinishDate":"1981-12-07T20:39:00+02:00","IsSpecialMeeting":null,"LastUpdatedDate":"2023-03-16T10:51:53.63+02:00"}
{"Id":482776,"Number":95,"KnessetNum":10,"Name":"ישיבת מליאה בתאריך 08/06/1982 בשעה 16:03","StartDate":"1982-06-08T16:03:00+03:00","FinishDate":"1982-06-08T18:22:00+03:00","IsSpecialMeeting":null,"LastUpdatedDate":"2024-01-29T12:57:18.233+02:00"}
{"Id":482777,"Number":97,"KnessetNum":10,"Name":"ישיבת מליאה בתאריך 15/06/1982 בשעה 16:03","StartDate":"1982-06-15T16:03:00+03:00","FinishDate":"1982-06-15T19:33:00+03:00","IsSpecialMeeting":null,"LastUpdatedDate":"2023-05-08T09:26:34.07+03:00"}
{"Id":482778,"Number":179,"KnessetNum":10,"Name":"ישיבת מליאה בתאריך 23/02/1983 בשעה 11:04","StartDate":"1983-02-23T11:04:00+02:00","FinishDate":"1983-02-23T15:24:00+02:00","IsSpecialMeeting":null,"LastUpdatedDate":"2023-06-15T11:08:32.927+03:00"}
{"Id":482779,"Number":15,"KnessetNum":10,"Name":"ישיבת מליאה בתאריך 03/11/1981 בשעה 16:04","StartDate":"1981-11-03T16:04:00+02:00","FinishDate":"1981-11-03T20:36:00+02:00","IsSpecialMeeting":null,"LastUpdatedDate":"2023-03-01T10:36:01.723+02:00"}
{"Id":482780,"Number":289,"KnessetNum":10,"Name":"ישיבת מליאה בתאריך 22/02/1984 בשעה 11:03","StartDate":"1984-02-22T11:03:00+02:00","FinishDate":"1984-02-22T12:53:00+02:00","IsSpecialMeeting":null,"LastUpdatedDate":"2024-02-05T11:07:20.203+02:00"}
{"Id":482781,"Number":233,"KnessetNum":10,"Name":"ישיבת מליאה בתאריך 10/10/1983 בשעה 10:05","StartDate":"1983-10-10T10:05:00+02:00","FinishDate":"1983-10-10T19:11:00+02:00","IsSpecialMeeting":null,"LastUpdatedDate":"2023-07-10T08:54:33.147+03:00"}
{"Id":482782,"Number":103,"KnessetNum":10,"Name":"ישיבת מליאה בתאריך 29/06/1982 בשעה 16:07","StartDate":"1982-06-29T16:07:00+03:00","FinishDate":"1982-06-29T23:34:00+03:00","IsSpecialMeeting":null,"LastUpdatedDate":"2023-05-09T14:33:24.45+03:00"}
{"Id":482783,"Number":268,"KnessetNum":10,"Name":"ישיבת מליאה בתאריך 04/01/1984 בשעה 11:02","StartDate":"1984-01-04T11:02:00+02:00","FinishDate":"1984-01-04T16:49:00+02:00","IsSpecialMeeting":null,"LastUpdatedDate":"2023-07-25T11:53:14.063+03:00"}
{"Id":482784,"Number":91,"KnessetNum":10,"Name":"ישיבת מליאה בתאריך 31/05/1982 בשעה 11:05","StartDate":"1982-05-31T11:05:00+03:00","FinishDate":"1982-05-31T20:49:00+03:00","IsSpecialMeeting":null,"LastUpdatedDate":"2023-05-04T10:05:27.233+03:00"}
{"Id":482785,"Number":89,"KnessetNum":10,"Name":"ישיבת מליאה בתאריך 25/05/1982 בשעה 16:04","StartDate":"1982-05-25T16:04:00+03:00","FinishDate":"1982-05-25T20:40:00+03:00","IsSpecialMeeting":null,"LastUpdatedDate":"2023-05-03T11:20:52.367+03:00"}
{"Id":482786,"Number":19,"KnessetNum":10,"Name":"ישיבת מליאה בתאריך 11/11/1981 בשעה 11:04","StartDate":"1981-11-11T11:04:00+02:00","FinishDate":"1981-11-11T14:29:00+02:00","IsSpecialMeeting":null,"LastUpdatedDate":"2023-03-02T08:45:58.853+02:00"}
{"Id":482787,"Number":222,"KnessetNum":10,"Name":"ישיבת מליאה בתאריך 05/07/1983 בשעה 16:00","StartDate":"1983-07-05T16:00:00+03:00","FinishDate":"1983-07-05T19:07:00+03:00","IsSpecialMeeting":null,"LastUpdatedDate":"2023-07-03T17:07:35.117+03:00"}
{"Id":482788,"Number":277,"KnessetNum":10,"Name":"ישיבת מליאה בתאריך 25/01/1984 בשעה 11:08","StartDate":"1984-01-25T11:08:00+02:00","FinishDate":"1984-01-25T19:01:00+02:00","IsSpecialMeeting":null,"LastUpdatedDate":"2023-07-26T13:41:54.33+03:00"}
{"Id":482789,"Number":155,"KnessetNum":10,"Name":"ישיבת מליאה בתאריך 29/12/1982 בשעה 11:05","StartDate":"1982-12-29T11:05:00+02:00","FinishDate":"1982-12-29T14:25:00+02:00","IsSpecialMeeting":null,"LastUpdatedDate":"2023-06-04T12:04:41.987+03:00"}
{"Id":482790,"Number":79,"KnessetNum":10,"Name":"ישיבת מליאה בתאריך 03/05/1982 בשעה 16:04","StartDate":"1982-05-03T16:04:00+03:00","FinishDate":"1982-05-03T21:01:00+03:00","IsSpecialMeeting":null,"LastUpdatedDate":"2023-05-02T13:42:01.747+03:00"}
{"Id":482791,"Number":241,"KnessetNum":10,"Name":"ישיבת מליאה בתאריך 02/11/1983 בשעה 11:04","StartDate":"1983-11-02T11:04:00+02:00","FinishDate":"1983-11-02T12:43:00+02:00","IsSpecialMeeting":null,"LastUpdatedDate":"2023-07-10T15:55:05.477+03:00"}
{"Id":482792,"Number":170,"KnessetNum":10,"Name":"ישיבת מליאה בתאריך 02/02/1983 בשעה 11:01","StartDate":"1983-02-02T11:01:00+02:00","FinishDate":"1983-02-02T14:10:00+02:00","IsSpecialMeeting":null,"LastUpdatedDate":"2023-06-08T13:01:58.547+03:00"}
{"Id":482793,"Number":28,"KnessetNum":10,"Name":"ישיבת מליאה בתאריך 02/12/1981 בשעה 17:03","StartDate":"1981-12-02T17:03:00+02:00","FinishDate":"1981-12-02T23:10:00+02:00","IsSpecialMeeting":null,"LastUpdatedDate":"2023-03-16T10:17:15.38+02:00"}
{"Id":482794,"Number":243,"KnessetNum":10,"Name":"ישיבת מליאה בתאריך 08/11/1983 בשעה 16:02","StartDate":"1983-11-08T16:02:00+02:00","FinishDate":"1983-11-08T17:07:00+02:00","IsSpecialMeeting":null,"LastUpdatedDate":"2023-07-10T16:48:40.08+03:00"}
{"Id":482795,"Number":74,"KnessetNum":10,"Name":"ישיבת מליאה בתאריך 23/03/1982 בשעה 16:06","StartDate":"1982-03-23T16:06:00+02:00","FinishDate":"1982-03-23T21:20:00+02:00","IsSpecialMeeting":null,"LastUpdatedDate":"2023-04-30T12:31:47.88+03:00"}
{"Id":482796,"Number":185,"KnessetNum":10,"Name":"ישיבת מליאה בתאריך 08/03/1983 בשעה 16:04","StartDate":"1983-03-08T16:04:00+02:00","FinishDate":"1983-03-08T19:21:00+02:00","IsSpecialMeeting":null,"LastUpdatedDate":"2023-06-20T10:59:19.517+03:00"}
{"Id":482797,"Number":130,"KnessetNum":10,"Name":"ישיבת מליאה בתאריך 02/11/1982 בשעה 16:10","StartDate":"1982-11-02T16:10:00+02:00","FinishDate":"1982-11-02T20:07:00+02:00","IsSpecialMeeting":null,"LastUpdatedDate":"2023-05-22T08:07:35.617+03:00"}
{"Id":482897,"Number":191,"KnessetNum":10,"Name":"ישיבת מליאה בתאריך 22/03/1983 בשעה 11:01","StartDate":"1983-03-22T11:01:00+02:00","FinishDate":"1983-03-22T12:04:00+02:00","IsSpecialMeeting":null,"LastUpdatedDate":"2023-06-20T15:46:16.53+03:00"}
{"Id":482898,"Number":243,"KnessetNum":11,"Name":"ישיבת מליאה בתאריך 11/09/1986 בשעה 13:24","StartDate":"1986-09-11T13:24:00+03:00","FinishDate":"1986-09-11T13:42:00+03:00","IsSpecialMeeting":null,"LastUpdatedDate":"2025-02-19T13:06:40.61+02:00"}
{"Id":482899,"Number":408,"KnessetNum":11,"Name":"ישיבת מליאה בתאריך 23/02/1988 בשעה 16:01","StartDate":"1988-02-23T16:01:00+02:00","FinishDate":"1988-02-23T16:50:00+02:00","IsSpecialMeeting":null,"LastUpdatedDate":"2025-03-11T11:48:31.327+02:00"}
{"Id":482900,"Number":445,"KnessetNum":11,"Name":"ישיבת מליאה בתאריך 14/06/1988 בשעה 15:00","StartDate":"1988-06-14T15:00:00+03:00","FinishDate":"1988-06-14T15:47:00+03:00","IsSpecialMeeting":null,"LastUpdatedDate":"2025-03-11T14:39:43.343+02:00"}
{"Id":482901,"Number":143,"KnessetNum":14,"Name":"ישיבת מליאה בתאריך 12/11/1997 בשעה 17:03","StartDate":"1997-11-12T17:03:00+02:00","FinishDate":"1997-11-12T17:54:00+02:00","IsSpecialMeeting":null,"LastUpdatedDate":"2020-06-11T13:57:53.933+03:00"}
{"Id":482902,"Number":138,"KnessetNum":15,"Name":"ישיבת מליאה בתאריך 31/07/2000 בשעה 11:04","StartDate":"2000-07-31T11:04:00+03:00","FinishDate":"2000-07-31T13:42:00+03:00","IsSpecialMeeting":null,"LastUpdatedDate":"2025-02-27T08:58:04.1+02:00"}
{"Id":482903,"Number":212,"KnessetNum":12,"Name":"ישיבת מליאה בתאריך 26/09/1990 בשעה 12:18","StartDate":"1990-09-26T12:18:00+02:00","FinishDate":"1990-09-26T14:10:00+02:00","IsSpecialMeeting":null,"LastUpdatedDate":"2025-03-06T08:44:06.447+02:00"}
{"Id":482904,"Number":213,"KnessetNum":12,"Name":"ישיבת מליאה בתאריך 26/09/1990 בשעה 14:10","StartDate":"1990-09-26T14:10:00+02:00","FinishDate":"1990-09-26T15:25:00+02:00","IsSpecialMeeting":null,"LastUpdatedDate":"2025-10-29T11:49:56.697+02:00"}
{"Id":482905,"Number":101,"KnessetNum":12,"Name":"ישיבת מליאה בתאריך 11/10/1989 בשעה 13:46","StartDate":"1989-10-11T13:46:00+02:00","FinishDate":"1989-10-11T14:49:00+02:00","IsSpecialMeeting":null,"LastUpdatedDate":"2025-03-03T18:02:12.96+02:00"}
{"Id":482906,"Number":264,"KnessetNum":13,"Name":"ישיבת מליאה בתאריך 27/10/1994 בשעה 20:40","StartDate":"1994-10-27T20:40:00+02:00","FinishDate":"1994-10-27T21:40:00+02:00","IsSpecialMeeting":true,"LastUpdatedDate":"2025-02-16T10:12:45.573+02:00"}
{"Id":482907,"Number":210,"KnessetNum":12,"Name":"ישיבת מליאה בתאריך 12/09/1990 בשעה 14:42","StartDate":"1990-09-12T14:42:00+03:00","FinishDate":"1990-09-12T15:39:00+03:00","IsSpecialMeeting":null,"LastUpdatedDate":"2025-03-06T08:23:13.94+02:00"}
{"Id":482908,"Number":97,"KnessetNum":12,"Name":"ישיבת מליאה בתאריך 04/09/1989 בשעה 15:13","StartDate":"1989-09-04T15:13:00+03:00","FinishDate":"1989-09-04T18:48:00+03:00","IsSpecialMeeting":null,"LastUpdatedDate":"2025-03-03T17:58:23.173+02:00"}
{"Id":482909,"Number":118,"KnessetNum":10,"Name":"ישיבת מליאה בתאריך 12/08/1982 בשעה 15:04","StartDate":"1982-08-12T15:04:00+03:00","FinishDate":"1982-08-12T18:17:00+03:00","IsSpecialMeeting":null,"LastUpdatedDate":"2022-03-01T17:47:44.24+02:00"}
{"Id":482911,"Number":238,"KnessetNum":11,"Name":"ישיבת מליאה בתאריך 03/09/1986 בשעה 13:03","StartDate":"1986-09-03T13:03:00+03:00","FinishDate":"1986-09-03T13:55:00+03:00","IsSpecialMeeting":null,"LastUpdatedDate":"2025-02-19T11:11:54.703+02:00"}
{"Id":482912,"Number":239,"KnessetNum":11,"Name":"ישיבת מליאה בתאריך 03/09/1986 בשעה 14:01","StartDate":"1986-09-03T14:01:00+03:00","FinishDate":"1986-09-03T15:55:00+03:00","IsSpecialMeeting":null,"LastUpdatedDate":"2025-02-19T11:29:46.357+02:00"}
{"Id":483018,"Number":240,"KnessetNum":11,"Name":"ישיבת מליאה בתאריך 03/09/1986 בשעה 16:02","StartDate":"1986-09-03T16:02:00+03:00","FinishDate":"1986-09-03T16:02:00+03:00","IsSpecialMeeting":null,"LastUpdatedDate":"2025-02-19T12:10:36.877+02:00"}
{"Id":483224,"Number":30,"KnessetNum":19,"Name":"ישיבת מליאה בתאריך 21/05/2013 בשעה: 16:00","StartDate":"2013-05-21T16:00:00+03:00","FinishDate":"2013-05-21T18:40:00+03:00","IsSpecialMeeting":false,"LastUpdatedDate":"2015-03-17T19:57:35+02:00"}
{"Id":483225,"Number":31,"KnessetNum":19,"Name":"ישיבת מליאה בתאריך 22/05/2013 בשעה 11:00","StartDate":"2013-05-22T11:00:00+03:00","FinishDate":"2013-05-22T19:40:00+03:00","IsSpecialMeeting":false,"LastUpdatedDate":"2023-12-31T11:01:08.513+02:00"}
{"Id":483437,"Number":32,"KnessetNum":19,"Name":"ישיבת מליאה בתאריך 27/05/2013 בשעה: 16:00","StartDate":"2013-05-27T16:00:00+03:00","FinishDate":"2013-05-27T18:20:00+03:00","IsSpecialMeeting":false,"LastUpdatedDate":"2015-03-17T20:10:50+02:00"}
{"Id":483724,"Number":33,"KnessetNum":19,"Name":"ישיבת מליאה בתאריך 28/05/2013 בשעה 16:00","StartDate":"2013-05-28T16:00:00+03:00","FinishDate":"2013-05-28T17:30:00+03:00","IsSpecialMeeting":false,"LastUpdatedDate":"2020-11-23T20:20:22.117+02:00"}
{"Id":483746,"Number":34,"KnessetNum":19,"Name":"ישיבת מליאה בתאריך 29/05/2013 בשעה: 11:00","StartDate":"2013-05-29T11:00:00+03:00","FinishDate":"2013-05-29T20:20:00+03:00","IsSpecialMeeting":false,"LastUpdatedDate":"2015-03-17T20:07:44+02:00"}
{"Id":483959,"Number":35,"KnessetNum":19,"Name":"ישיבת מליאה בתאריך 03/06/2013 בשעה: 16:00","StartDate":"2013-06-03T16:00:00+03:00","FinishDate":"2013-06-04T02:00:00+03:00","IsSpecialMeeting":false,"LastUpdatedDate":"2015-03-17T20:14:06+02:00"}
{"Id":484240,"Number":36,"KnessetNum":19,"Name":"ישיבת מליאה בתאריך 04/06/2013 בשעה: 16:00","StartDate":"2013-06-04T16:00:00+03:00","FinishDate":"2013-06-04T18:10:00+03:00","IsSpecialMeeting":false,"LastUpdatedDate":"2015-03-17T19:55:53+02:00"}
{"Id":484241,"Number":37,"KnessetNum":19,"Name":"ישיבת מליאה בתאריך 05/06/2013 בשעה 11:00","StartDate":"2013-06-05T11:00:00+03:00","FinishDate":"2013-06-05T19:10:00+03:00","IsSpecialMeeting":false,"LastUpdatedDate":"2020-11-23T20:31:10.14+02:00"}
{"Id":484419,"Number":38,"KnessetNum":19,"Name":"ישיבת מליאה בתאריך 10/06/2013 בשעה 16:00","StartDate":"2013-06-10T16:00:00+03:00","FinishDate":"2013-06-11T04:30:00+03:00","IsSpecialMeeting":true,"LastUpdatedDate":"2020-11-19T13:02:54.483+02:00"}
{"Id":484723,"Number":39,"KnessetNum":19,"Name":"ישיבת מליאה בתאריך 11/06/2013 בשעה: 16:00","StartDate":"2013-06-11T16:00:00+03:00","FinishDate":"2013-06-11T17:50:00+03:00","IsSpecialMeeting":false,"LastUpdatedDate":"2015-03-17T20:07:16+02:00"}
{"Id":484735,"Number":40,"KnessetNum":19,"Name":"ישיבת מליאה בתאריך 12/06/2013 בשעה: 11:00","StartDate":"2013-06-12T11:00:00+03:00","FinishDate":"2013-06-12T16:30:00+03:00","IsSpecialMeeting":false,"LastUpdatedDate":"2015-03-17T20:13:01+02:00"}
{"Id":484920,"Number":41,"KnessetNum":19,"Name":"ישיבת מליאה בתאריך 17/06/2013 בשעה: 16:00","StartDate":"2013-06-17T16:00:00+03:00","FinishDate":"2013-06-18T01:20:00+03:00","IsSpecialMeeting":false,"LastUpdatedDate":"2015-03-17T20:09:54+02:00"}
{"Id":484986,"Number":42,"KnessetNum":19,"Name":"ישיבת מליאה בתאריך 18/06/2013 בשעה: 16:00","StartDate":"2013-06-18T16:00:00+03:00","FinishDate":"2013-06-18T18:20:00+03:00","IsSpecialMeeting":false,"LastUpdatedDate":"2015-03-17T20:08:39+02:00"}
{"Id":484990,"Number":43,"KnessetNum":19,"Name":"ישיבת מליאה בתאריך 19/06/2013 בשעה: 11:00","StartDate":"2013-06-19T11:00:00+03:00","FinishDate":"2013-06-19T18:50:00+03:00","IsSpecialMeeting":false,"LastUpdatedDate":"2015-03-17T20:14:15+02:00"}
{"Id":485419,"Number":44,"KnessetNum":19,"Name":"ישיבת מליאה בתאריך 24/06/2013 בשעה: 16:00","StartDate":"2013-06-24T16:00:00+03:00","FinishDate":"2013-06-24T22:40:00+03:00","IsSpecialMeeting":false,"LastUpdatedDate":"2015-03-17T19:57:44+02:00"}
{"Id":485713,"Number":45,"KnessetNum":19,"Name":"ישיבת מליאה בתאריך 25/06/2013 בשעה 16:00","StartDate":"2013-06-25T16:00:00+03:00","FinishDate":"2013-06-25T18:20:00+03:00","IsSpecialMeeting":false,"LastUpdatedDate":"2020-11-23T20:18:55.517+02:00"}
{"Id":485727,"Number":46,"KnessetNum":19,"Name":"ישיבת מליאה בתאריך 26/06/2013 בשעה: 11:00","StartDate":"2013-06-26T11:00:00+03:00","FinishDate":"2013-06-26T17:10:00+03:00","IsSpecialMeeting":false,"LastUpdatedDate":"2015-03-17T20:24:16+02:00"}
{"Id":485904,"Number":47,"KnessetNum":19,"Name":"ישיבת מליאה בתאריך 01/07/2013 בשעה 16:00","StartDate":"2013-07-01T16:00:00+03:00","FinishDate":"2013-07-01T23:00:00+03:00","IsSpecialMeeting":false,"LastUpdatedDate":"2020-11-23T20:29:20.007+02:00"}
{"Id":486269,"Number":48,"KnessetNum":19,"Name":"ישיבת מליאה בתאריך 02/07/2013 בשעה 16:00","StartDate":"2013-07-02T16:00:00+03:00","FinishDate":"2013-07-02T19:20:00+03:00","IsSpecialMeeting":false,"LastUpdatedDate":"2020-11-23T20:36:25.957+02:00"}
{"Id":486270,"Number":49,"KnessetNum":19,"Name":"ישיבת מליאה בתאריך 03/07/2013 בשעה 11:00","StartDate":"2013-07-03T11:00:00+03:00","FinishDate":"2013-07-03T18:40:00+03:00","IsSpecialMeeting":false,"LastUpdatedDate":"2020-11-23T20:40:46.45+02:00"}
{"Id":486483,"Number":50,"KnessetNum":19,"Name":"ישיבת מליאה בתאריך 08/07/2013 בשעה 16:00","StartDate":"2013-07-08T16:00:00+03:00","FinishDate":"2013-07-08T23:00:00+03:00","IsSpecialMeeting":false,"LastUpdatedDate":"2020-11-23T20:14:37.487+02:00"}
{"Id":486484,"Number":51,"KnessetNum":19,"Name":"ישיבת מליאה בתאריך 09/07/2013 בשעה 16:00","StartDate":"2013-07-09T16:00:00+03:00","FinishDate":"2013-07-09T19:40:00+03:00","IsSpecialMeeting":false,"LastUpdatedDate":"2020-11-23T20:43:39.74+02:00"}
{"Id":486485,"Number":52,"KnessetNum":19,"Name":"ישיבת מליאה בתאריך 10/07/2013 בשעה: 11:00","StartDate":"2013-07-10T11:00:00+03:00","FinishDate":"2013-07-10T17:50:00+03:00","IsSpecialMeeting":false,"LastUpdatedDate":"2015-03-17T20:11:37+02:00"}
{"Id":487231,"Number":53,"KnessetNum":19,"Name":"ישיבת מליאה בתאריך 15/07/2013 בשעה: 11:00","StartDate":"2013-07-15T11:00:00+03:00","FinishDate":"2013-07-15T12:40:00+03:00","IsSpecialMeeting":false,"LastUpdatedDate":"2015-03-17T20:07:53+02:00"}
{"Id":487239,"Number":54,"KnessetNum":19,"Name":"ישיבת מליאה בתאריך 17/07/2013 בשעה 11:00","StartDate":"2013-07-17T11:00:00+03:00","FinishDate":"2013-07-17T19:30:00+03:00","IsSpecialMeeting":false,"LastUpdatedDate":"2020-11-23T20:20:01.107+02:00"}
{"Id":487763,"Number":55,"KnessetNum":19,"Name":"ישיבת מליאה בתאריך 22/07/2013 בשעה 16:00","StartDate":"2013-07-22T16:00:00+03:00","FinishDate":"2013-07-23T05:30:00+03:00","IsSpecialMeeting":false,"LastUpdatedDate":"2020-11-19T13:40:44.433+02:00"}
{"Id":488095,"Number":56,"KnessetNum":19,"Name":"ישיבת מליאה בתאריך 23/07/2013 בשעה 13:00","StartDate":"2013-07-23T13:00:00+03:00","FinishDate":"2013-07-23T21:40:00+03:00","IsSpecialMeeting":false,"LastUpdatedDate":"2020-11-23T20:35:32.02+02:00"}
{"Id":488163,"Number":57,"KnessetNum":19,"Name":"ישיבת מליאה בתאריך 24/07/2013 בשעה 10:00","StartDate":"2013-07-24T10:00:00+03:00","FinishDate":"2013-07-24T20:20:00+03:00","IsSpecialMeeting":false,"LastUpdatedDate":"2020-11-23T20:29:47.49+02:00"}
{"Id":488244,"Number":58,"KnessetNum":19,"Name":"ישיבת מליאה בתאריך 29/07/2013 בשעה 09:00","StartDate":"2013-07-29T09:00:00+03:00","FinishDate":"2013-07-30T03:30:00+03:00","IsSpecialMeeting":false,"LastUpdatedDate":"2020-11-23T20:35:55.677+02:00"}
{"Id":488245,"Number":59,"KnessetNum":19,"Name":"ישיבת מליאה בתאריך 30/07/2013 בשעה 16:00","StartDate":"2013-07-30T16:00:00+03:00","FinishDate":"2013-07-30T18:40:00+03:00","IsSpecialMeeting":false,"LastUpdatedDate":"2020-11-23T20:39:51.287+02:00"}
{"Id":488246,"Number":60,"KnessetNum":19,"Name":"ישיבת מליאה בתאריך 31/07/2013 בשעה 11:00","StartDate":"2013-07-31T11:00:00+03:00","FinishDate":"2013-08-01T03:40:00+03:00","IsSpecialMeeting":false,"LastUpdatedDate":"2020-11-23T20:42:50.463+02:00"}
{"Id":488683,"Number":17,"KnessetNum":1,"Name":"ישיבת מליאה בתאריך 28/03/1949 בשעה 16:10","StartDate":"1949-03-28T16:10:00+02:00","FinishDate":"1949-03-28T23:00:00+02:00","IsSpecialMeeting":null,"LastUpdatedDate":"2020-10-18T07:59:09.983+03:00"}
{"Id":488684,"Number":367,"KnessetNum":3,"Name":"ישיבת מליאה בתאריך 02/12/1957 בשעה 16:13","StartDate":"1957-12-02T16:13:00+02:00","FinishDate":"1957-12-02T19:04:00+02:00","IsSpecialMeeting":null,"LastUpdatedDate":"2022-03-03T11:30:30.773+02:00"}
{"Id":488685,"Number":368,"KnessetNum":6,"Name":"ישיבת מליאה בתאריך 28/01/1969 בשעה 16:03","StartDate":"1969-01-28T16:03:00+02:00","FinishDate":"1969-01-28T20:26:00+02:00","IsSpecialMeeting":null,"LastUpdatedDate":"2022-11-17T11:39:19.213+02:00"}
{"Id":488686,"Number":10,"KnessetNum":7,"Name":"ישיבת מליאה בתאריך 08/12/1969 בשעה 16:02","StartDate":"1969-12-08T16:02:00+02:00","FinishDate":"1969-12-08T18:41:00+02:00","IsSpecialMeeting":null,"LastUpdatedDate":"2020-11-24T10:26:51.49+02:00"}
{"Id":488687,"Number":139,"KnessetNum":7,"Name":"ישיבת מליאה בתאריך 11/01/1971 בשעה 16:01","StartDate":"1971-01-11T16:01:00+02:00","FinishDate":null,"IsSpecialMeeting":null,"LastUpdatedDate":"2020-12-28T08:35:16.58+02:00"}
{"Id":488688,"Number":257,"KnessetNum":9,"Name":"ישיבת מליאה בתאריך 02/10/1979 בשעה 15:04","StartDate":"1979-10-02T15:04:00+02:00","FinishDate":"1979-10-02T16:26:00+02:00","IsSpecialMeeting":null,"LastUpdatedDate":"2020-12-17T13:26:03.587+02:00"}
{"Id":488689,"Number":328,"KnessetNum":9,"Name":"ישיבת מליאה בתאריך 05/05/1980 בשעה 16:02","StartDate":"1980-05-05T16:02:00+03:00","FinishDate":"1980-05-05T18:46:00+03:00","IsSpecialMeeting":null,"LastUpdatedDate":"2021-02-24T01:29:02.187+02:00"}
{"Id":488690,"Number":4,"KnessetNum":1,"Name":"ישיבת מליאה בתאריך 16/02/1949 בשעה 16:38","StartDate":"1949-02-16T16:38:00+02:00","FinishDate":"1949-02-16T21:13:00+02:00","IsSpecialMeeting":null,"LastUpdatedDate":"2020-10-18T08:30:09.66+03:00"}
{"Id":488691,"Number":131,"KnessetNum":2,"Name":"ישיבת מליאה בתאריך 03/11/1952 בשעה 19:30","StartDate":"1952-11-03T19:30:00+02:00","FinishDate":"1952-11-03T21:40:00+02:00","IsSpecialMeeting":null,"LastUpdatedDate":"2020-10-25T09:32:45.973+02:00"}
{"Id":488692,"Number":137,"KnessetNum":2,"Name":"ישיבת מליאה בתאריך 17/11/1952 בשעה 20:00","StartDate":"1952-11-17T20:00:00+02:00","FinishDate":"1952-11-17T22:00:00+02:00","IsSpecialMeeting":null,"LastUpdatedDate":"2020-10-25T09:10:51.457+02:00"}
{"Id":488693,"Number":149,"KnessetNum":2,"Name":"ישיבת מליאה בתאריך 02/12/1952 בשעה 20:07","StartDate":"1952-12-02T20:07:00+02:00","FinishDate":"1952-12-02T22:02:00+02:00","IsSpecialMeeting":null,"LastUpdatedDate":"2022-01-06T08:18:41.98+02:00"}
{"Id":488694,"Number":152,"KnessetNum":2,"Name":"ישיבת מליאה בתאריך 09/12/1952 בשעה 16:05","StartDate":"1952-12-09T16:05:00+02:00","FinishDate":"1952-12-09T18:30:00+02:00","IsSpecialMeeting":null,"LastUpdatedDate":"2021-11-21T11:34:02.97+02:00"}
{"Id":488695,"Number":153,"KnessetNum":2,"Name":"ישיבת מליאה בתאריך 09/12/1952 בשעה 20:37","StartDate":"1952-12-09T20:37:00+02:00","FinishDate":"1952-12-09T20:50:00+02:00","IsSpecialMeeting":null,"LastUpdatedDate":"2020-10-25T08:22:18.087+02:00"}
{"Id":488697,"Number":161,"KnessetNum":2,"Name":"ישיבת מליאה בתאריך 29/12/1952 בשעה 20:15","StartDate":"1952-12-29T20:15:00+02:00","FinishDate":"1952-12-29T21:45:00+02:00","IsSpecialMeeting":null,"LastUpdatedDate":"2020-10-21T16:41:52.047+03:00"}
{"Id":488698,"Number":162,"KnessetNum":2,"Name":"ישיבת מליאה בתאריך 30/12/1952 בשעה 16:07","StartDate":"1952-12-30T16:07:00+02:00","FinishDate":"1952-12-30T19:05:00+02:00","IsSpecialMeeting":null,"LastUpdatedDate":"2021-12-27T21:22:05.267+02:00"}
{"Id":488699,"Number":163,"KnessetNum":2,"Name":"ישיבת מליאה בתאריך 30/12/1952 בשעה 20:20","StartDate":"1952-12-30T20:20:00+02:00","FinishDate":"1952-12-30T22:35:00+02:00","IsSpecialMeeting":null,"LastUpdatedDate":"2021-11-21T13:11:32.873+02:00"}
{"Id":488700,"Number":167,"KnessetNum":2,"Name":"ישיבת מליאה בתאריך 06/01/1953 בשעה 16:10","StartDate":"1953-01-06T16:10:00+02:00","FinishDate":"1953-01-06T19:05:00+02:00","IsSpecialMeeting":null,"LastUpdatedDate":"2021-11-21T13:15:48.84+02:00"}
{"Id":488701,"Number":168,"KnessetNum":2,"Name":"ישיבת מליאה בתאריך 06/01/1953 בשעה 20:10","StartDate":"1953-01-06T20:10:00+02:00","FinishDate":"1953-01-06T20:40:00+02:00","IsSpecialMeeting":null,"LastUpdatedDate":"2020-10-21T16:27:24.33+03:00"}
{"Id":488702,"Number":171,"KnessetNum":2,"Name":"ישיבת מליאה בתאריך 20/01/1953 בשעה 16:05","StartDate":"1953-01-20T16:05:00+02:00","FinishDate":"1953-01-20T18:50:00+02:00","IsSpecialMeeting":null,"LastUpdatedDate":"2020-10-21T16:17:38.45+03:00"}
{"Id":488703,"Number":172,"KnessetNum":2,"Name":"ישיבת מליאה בתאריך 20/01/1953 בשעה 20:30","StartDate":"1953-01-20T20:30:00+02:00","FinishDate":"1953-01-20T22:10:00+02:00","IsSpecialMeeting":null,"LastUpdatedDate":"2020-10-21T16:19:28.213+03:00"}
{"Id":488704,"Number":176,"KnessetNum":2,"Name":"ישיבת מליאה בתאריך 27/01/1953 בשעה 16:10","StartDate":"1953-01-27T16:10:00+02:00","FinishDate":"1953-01-27T18:25:00+02:00","IsSpecialMeeting":null,"LastUpdatedDate":"2020-10-21T16:03:09.757+03:00"}
{"Id":488705,"Number":180,"KnessetNum":2,"Name":"ישיבת מליאה בתאריך 02/02/1953 בשעה 20:15","StartDate":"1953-02-02T20:15:00+02:00","FinishDate":"1953-02-02T21:10:00+02:00","IsSpecialMeeting":null,"LastUpdatedDate":"2020-10-21T15:56:35.033+03:00"}
{"Id":488706,"Number":181,"KnessetNum":2,"Name":"ישיבת מליאה בתאריך 03/02/1953 בשעה 16:10","StartDate":"1953-02-03T16:10:00+02:00","FinishDate":"1953-02-03T18:50:00+02:00","IsSpecialMeeting":null,"LastUpdatedDate":"2020-10-21T15:47:57.237+03:00"}
{"Id":488707,"Number":182,"KnessetNum":2,"Name":"ישיבת מליאה בתאריך 03/02/1953 בשעה 20:09","StartDate":"1953-02-03T20:09:00+02:00","FinishDate":"1953-02-03T22:10:00+02:00","IsSpecialMeeting":null,"LastUpdatedDate":"2022-01-04T10:18:02.51+02:00"}
{"Id":488709,"Number":186,"KnessetNum":2,"Name":"ישיבת מליאה בתאריך 10/02/1953 בשעה 16:10","StartDate":"1953-02-10T16:10:00+02:00","FinishDate":"1953-02-10T19:15:00+02:00","IsSpecialMeeting":null,"LastUpdatedDate":"2020-10-21T15:27:52.553+03:00"}
{"Id":488710,"Number":187,"KnessetNum":2,"Name":"ישיבת מליאה בתאריך 10/02/1953 בשעה 20:40","StartDate":"1953-02-10T20:40:00+02:00","FinishDate":"1953-02-10T21:50:00+02:00","IsSpecialMeeting":null,"LastUpdatedDate":"2020-10-21T15:29:36.5+03:00"}
{"Id":488711,"Number":200,"KnessetNum":2,"Name":"ישיבת מליאה בתאריך 04/03/1953 בשעה 10:35","StartDate":"1953-03-04T10:35:00+02:00","FinishDate":"1953-03-04T12:48:00+02:00","IsSpecialMeeting":null,"LastUpdatedDate":"2020-10-21T14:49:30.593+03:00"}
{"Id":488712,"Number":201,"KnessetNum":2,"Name":"ישיבת מליאה בתאריך 04/03/1953 בשעה 14:33","StartDate":"1953-03-04T14:33:00+02:00","FinishDate":"1953-03-04T17:20:00+02:00","IsSpecialMeeting":null,"LastUpdatedDate":"2020-10-21T14:52:27.92+03:00"}
{"Id":488713,"Number":202,"KnessetNum":2,"Name":"ישיבת מליאה בתאריך 09/03/1953 בשעה 16:05","StartDate":"1953-03-09T16:05:00+02:00","FinishDate":"1953-03-09T18:52:00+02:00","IsSpecialMeeting":null,"LastUpdatedDate":"2020-10-21T14:43:57.64+03:00"}
{"Id":488714,"Number":203,"KnessetNum":2,"Name":"ישיבת מליאה בתאריך 09/03/1953 בשעה 20:05","StartDate":"1953-03-09T20:05:00+02:00","FinishDate":"1953-03-09T22:20:00+02:00","IsSpecialMeeting":null,"LastUpdatedDate":"2020-10-21T14:46:05.687+03:00"}
{"Id":488715,"Number":204,"KnessetNum":2,"Name":"ישיבת מליאה בתאריך 10/03/1953 בשעה 16:02","StartDate":"1953-03-10T16:02:00+02:00","FinishDate":"1953-03-10T18:02:00+02:00","IsSpecialMeeting":null,"LastUpdatedDate":"2022-01-04T12:10:27.963+02:00"}
{"Id":488716,"Number":205,"KnessetNum":2,"Name":"ישיבת מליאה בתאריך 10/03/1953 בשעה 20:10","StartDate":"1953-03-10T20:10:00+02:00","FinishDate":"1953-03-10T22:00:00+02:00","IsSpecialMeeting":null,"LastUpdatedDate":"2020-10-21T14:41:43.39+03:00"}
{"Id":488717,"Number":214,"KnessetNum":2,"Name":"ישיבת מליאה בתאריך 24/03/1953 בשעה 16:00","StartDate":"1953-03-24T16:00:00+02:00","FinishDate":"1953-03-24T19:00:00+02:00","IsSpecialMeeting":null,"LastUpdatedDate":"2021-09-30T10:04:12.603+03:00"}
{"Id":488718,"Number":215,"KnessetNum":2,"Name":"ישיבת מליאה בתאריך 24/03/1953 בשעה 20:10","StartDate":"1953-03-24T20:10:00+02:00","FinishDate":"1953-03-24T23:12:00+02:00","IsSpecialMeeting":null,"LastUpdatedDate":"2021-09-30T10:09:54.687+03:00"}
{"Id":488719,"Number":218,"KnessetNum":2,"Name":"ישיבת מליאה בתאריך 26/03/1953 בשעה 19:30","StartDate":"1953-03-26T19:30:00+02:00","FinishDate":"1953-03-26T22:45:00+02:00","IsSpecialMeeting":null,"LastUpdatedDate":"2020-10-21T13:37:05.117+03:00"}
{"Id":488720,"Number":227,"KnessetNum":2,"Name":"ישיבת מליאה בתאריך 12/05/1953 בשעה 20:37","StartDate":"1953-05-12T20:37:00+03:00","FinishDate":"1953-05-12T21:25:00+03:00","IsSpecialMeeting":null,"LastUpdatedDate":"2020-10-21T12:54:42.29+03:00"}
{"Id":488721,"Number":231,"KnessetNum":2,"Name":"ישיבת מליאה בתאריך 18/05/1953 בשעה 18:35","StartDate":"1953-05-18T18:35:00+03:00","FinishDate":"1953-05-18T19:50:00+03:00","IsSpecialMeeting":null,"LastUpdatedDate":"2021-10-04T07:53:31.737+03:00"}
{"Id":488722,"Number":234,"KnessetNum":2,"Name":"ישיבת מליאה בתאריך 26/05/1953 בשעה 16:06","StartDate":"1953-05-26T16:06:00+03:00","FinishDate":"1953-05-26T18:50:00+03:00","IsSpecialMeeting":null,"LastUpdatedDate":"2022-01-10T12:05:55.983+02:00"}
{"Id":488723,"Number":235,"KnessetNum":2,"Name":"ישיבת מליאה בתאריך 26/05/1953 בשעה 20:07","StartDate":"1953-05-26T20:07:00+03:00","FinishDate":"1953-05-26T21:10:00+03:00","IsSpecialMeeting":null,"LastUpdatedDate":"2020-10-21T12:19:25.05+03:00"}
{"Id":488724,"Number":243,"KnessetNum":2,"Name":"ישיבת מליאה בתאריך 08/06/1953 בשעה 20:03","StartDate":"1953-06-08T20:03:00+03:00","FinishDate":"1953-06-08T21:55:00+03:00","IsSpecialMeeting":null,"LastUpdatedDate":"2022-01-12T09:09:13.453+02:00"}
{"Id":488725,"Number":244,"KnessetNum":2,"Name":"ישיבת מליאה בתאריך 09/06/1953 בשעה 16:05","StartDate":"1953-06-09T16:05:00+03:00","FinishDate":"1953-06-09T19:02:00+03:00","IsSpecialMeeting":null,"LastUpdatedDate":"2022-01-12T09:15:58.203+02:00"}
{"Id":488726,"Number":245,"KnessetNum":2,"Name":"ישיבת מליאה בתאריך 09/06/1953 בשעה 20:06","StartDate":"1953-06-09T20:06:00+03:00","FinishDate":"1953-06-09T21:55:00+03:00","IsSpecialMeeting":null,"LastUpdatedDate":"2020-10-21T11:11:53.907+03:00"}
{"Id":488727,"Number":255,"KnessetNum":2,"Name":"ישיבת מליאה בתאריך 23/06/1953 בשעה 20:06","StartDate":"1953-06-23T20:06:00+03:00","FinishDate":"1953-06-23T22:36:00+03:00","IsSpecialMeeting":null,"LastUpdatedDate":"2022-01-12T10:56:18.86+02:00"}
{"Id":488728,"Number":258,"KnessetNum":2,"Name":"ישיבת מליאה בתאריך 29/06/1953 בשעה 20:18","StartDate":"1953-06-29T20:18:00+03:00","FinishDate":"1953-06-29T22:00:00+03:00","IsSpecialMeeting":null,"LastUpdatedDate":"2022-01-12T11:30:25.44+02:00"}
{"Id":488730,"Number":265,"KnessetNum":2,"Name":"ישיבת מליאה בתאריך 07/07/1953 בשעה 20:17","StartDate":"1953-07-07T20:17:00+03:00","FinishDate":"1953-07-07T22:55:00+03:00","IsSpecialMeeting":null,"LastUpdatedDate":"2021-10-21T08:13:26.68+03:00"}
{"Id":488731,"Number":267,"KnessetNum":2,"Name":"ישיבת מליאה בתאריך 13/07/1953 בשעה 16:10","StartDate":"1953-07-13T16:10:00+03:00","FinishDate":"1953-07-13T19:10:00+03:00","IsSpecialMeeting":null,"LastUpdatedDate":"2020-10-21T09:54:40.747+03:00"}
{"Id":488732,"Number":268,"KnessetNum":2,"Name":"ישיבת מליאה בתאריך 13/07/1953 בשעה 20:18","StartDate":"1953-07-13T20:18:00+03:00","FinishDate":"1953-07-13T21:56:00+03:00","IsSpecialMeeting":null,"LastUpdatedDate":"2020-10-21T09:56:22.86+03:00"}
{"Id":488733,"Number":270,"KnessetNum":2,"Name":"ישיבת מליאה בתאריך 14/07/1953 בשעה 20:20","StartDate":"1953-07-14T20:20:00+03:00","FinishDate":"1953-07-14T21:53:00+03:00","IsSpecialMeeting":null,"LastUpdatedDate":"2021-10-25T08:08:48.527+03:00"}
{"Id":488734,"Number":275,"KnessetNum":2,"Name":"ישיבת מליאה בתאריך 27/07/1953 בשעה 16:10","StartDate":"1953-07-27T16:10:00+03:00","FinishDate":"1953-07-27T19:20:00+03:00","IsSpecialMeeting":null,"LastUpdatedDate":"2020-10-21T09:25:11.507+03:00"}
{"Id":488735,"Number":276,"KnessetNum":2,"Name":"ישיבת מליאה בתאריך 27/07/1953 בשעה 20:35","StartDate":"1953-07-27T20:35:00+03:00","FinishDate":"1953-07-27T21:48:00+03:00","IsSpecialMeeting":null,"LastUpdatedDate":"2020-10-21T09:27:22.517+03:00"}
{"Id":488736,"Number":277,"KnessetNum":2,"Name":"ישיבת מליאה בתאריך 28/07/1953 בשעה 16:10","StartDate":"1953-07-28T16:10:00+03:00","FinishDate":"1953-07-28T19:28:00+03:00","IsSpecialMeeting":null,"LastUpdatedDate":"2020-10-21T09:21:17.56+03:00"}
{"Id":488737,"Number":278,"KnessetNum":2,"Name":"ישיבת מליאה בתאריך 28/07/1953 בשעה 20:33","StartDate":"1953-07-28T20:33:00+03:00","FinishDate":"1953-07-28T22:08:00+03:00","IsSpecialMeeting":null,"LastUpdatedDate":"2020-10-21T09:22:49.413+03:00"}
{"Id":488738,"Number":286,"KnessetNum":2,"Name":"ישיבת מליאה בתאריך 10/08/1953 בשעה 20:05","StartDate":"1953-08-10T20:05:00+03:00","FinishDate":"1953-08-10T21:45:00+03:00","IsSpecialMeeting":null,"LastUpdatedDate":"2021-10-25T16:51:26.777+03:00"}
{"Id":488740,"Number":289,"KnessetNum":2,"Name":"ישיבת מליאה בתאריך 12/08/1953 בשעה 16:05","StartDate":"1953-08-12T16:05:00+03:00","FinishDate":"1953-08-12T19:25:00+03:00","IsSpecialMeeting":null,"LastUpdatedDate":"2021-10-25T17:16:59.63+03:00"}
{"Id":488741,"Number":290,"KnessetNum":2,"Name":"ישיבת מליאה בתאריך 12/08/1953 בשעה 20:30","StartDate":"1953-08-12T20:30:00+03:00","FinishDate":"1953-08-12T23:15:00+03:00","IsSpecialMeeting":null,"LastUpdatedDate":"2020-10-20T17:04:54.1+03:00"}
{"Id":488742,"Number":295,"KnessetNum":2,"Name":"ישיבת מליאה בתאריך 18/08/1953 בשעה 20:06","StartDate":"1953-08-18T20:06:00+03:00","FinishDate":"1953-08-18T23:13:00+03:00","IsSpecialMeeting":null,"LastUpdatedDate":"2022-01-13T07:45:22.2+02:00"}
{"Id":488743,"Number":296,"KnessetNum":2,"Name":"ישיבת מליאה בתאריך 19/08/1953 בשעה 16:12","StartDate":"1953-08-19T16:12:00+03:00","FinishDate":"1953-08-19T19:25:00+03:00","IsSpecialMeeting":null,"LastUpdatedDate":"2020-10-20T16:42:21.127+03:00"}
{"Id":488744,"Number":297,"KnessetNum":2,"Name":"ישיבת מליאה בתאריך 19/08/1953 בשעה 22:33","StartDate":"1953-08-19T22:33:00+03:00","FinishDate":"1953-08-19T23:07:00+03:00","IsSpecialMeeting":null,"LastUpdatedDate":"2020-10-20T16:44:05.923+03:00"}
{"Id":488745,"Number":301,"KnessetNum":2,"Name":"ישיבת מליאה בתאריך 25/08/1953 בשעה 16:07","StartDate":"1953-08-25T16:07:00+03:00","FinishDate":"1953-08-25T18:55:00+03:00","IsSpecialMeeting":null,"LastUpdatedDate":"2021-10-28T09:42:39.52+03:00"}
{"Id":488746,"Number":302,"KnessetNum":2,"Name":"ישיבת מליאה בתאריך 25/08/1953 בשעה 20:12","StartDate":"1953-08-25T20:12:00+03:00","FinishDate":"1953-08-25T21:40:00+03:00","IsSpecialMeeting":null,"LastUpdatedDate":"2020-10-20T16:31:45.693+03:00"}
{"Id":488747,"Number":303,"KnessetNum":2,"Name":"ישיבת מליאה בתאריך 26/08/1953 בשעה 16:03","StartDate":"1953-08-26T16:03:00+03:00","FinishDate":"1953-08-26T18:45:00+03:00","IsSpecialMeeting":null,"LastUpdatedDate":"2020-10-20T15:47:56.923+03:00"}
{"Id":488748,"Number":304,"KnessetNum":2,"Name":"ישיבת מליאה בתאריך 26/08/1953 בשעה 20:40","StartDate":"1953-08-26T20:40:00+03:00","FinishDate":null,"IsSpecialMeeting":null,"LastUpdatedDate":"2020-10-20T15:49:51.893+03:00"}
{"Id":488749,"Number":310,"KnessetNum":2,"Name":"ישיבת מליאה בתאריך 03/11/1953 בשעה 20:07","StartDate":"1953-11-03T20:07:00+02:00","FinishDate":"1953-11-03T21:25:00+02:00","IsSpecialMeeting":null,"LastUpdatedDate":"2020-10-20T15:29:07.65+03:00"}
{"Id":488750,"Number":314,"KnessetNum":2,"Name":"ישיבת מליאה בתאריך 10/11/1953 בשעה 16:05","StartDate":"1953-11-10T16:05:00+02:00","FinishDate":"1953-11-10T18:40:00+02:00","IsSpecialMeeting":null,"LastUpdatedDate":"2020-10-20T15:06:10.993+03:00"}
{"Id":488751,"Number":315,"KnessetNum":2,"Name":"ישיבת מליאה בתאריך 10/11/1953 בשעה 20:20","StartDate":"1953-11-10T20:20:00+02:00","FinishDate":"1953-11-10T21:55:00+02:00","IsSpecialMeeting":null,"LastUpdatedDate":"2020-10-20T15:09:11.61+03:00"}
{"Id":488753,"Number":323,"KnessetNum":2,"Name":"ישיבת מליאה בתאריך 23/11/1953 בשעה 20:04","StartDate":"1953-11-23T20:04:00+02:00","FinishDate":"1953-11-23T21:56:00+02:00","IsSpecialMeeting":null,"LastUpdatedDate":"2021-11-01T10:37:20.577+02:00"}
{"Id":488754,"Number":335,"KnessetNum":2,"Name":"ישיבת מליאה בתאריך 14/12/1953 בשעה 20:07","StartDate":"1953-12-14T20:07:00+02:00","FinishDate":"1953-12-14T22:00:00+02:00","IsSpecialMeeting":null,"LastUpdatedDate":"2020-10-20T14:03:32.523+03:00"}
{"Id":488755,"Number":338,"KnessetNum":2,"Name":"ישיבת מליאה בתאריך 21/12/1953 בשעה 20:02","StartDate":"1953-12-21T20:02:00+02:00","FinishDate":"1953-12-21T21:55:00+02:00","IsSpecialMeeting":null,"LastUpdatedDate":"2020-10-20T13:00:22.08+03:00"}
{"Id":488756,"Number":339,"KnessetNum":2,"Name":"ישיבת מליאה בתאריך 22/12/1953 בשעה 16:08","StartDate":"1953-12-22T16:08:00+02:00","FinishDate":"1953-12-22T18:56:00+02:00","IsSpecialMeeting":null,"LastUpdatedDate":"2021-12-30T08:10:55.577+02:00"}
{"Id":488757,"Number":340,"KnessetNum":2,"Name":"ישיבת מליאה בתאריך 22/12/1953 בשעה 20:03","StartDate":"1953-12-22T20:03:00+02:00","FinishDate":"1953-12-22T22:00:00+02:00","IsSpecialMeeting":null,"LastUpdatedDate":"2020-10-20T12:58:35.293+03:00"}
{"Id":488759,"Number":365,"KnessetNum":2,"Name":"ישיבת מליאה בתאריך 01/02/1954 בשעה 20:07","StartDate":"1954-02-01T20:07:00+02:00","FinishDate":"1954-02-01T21:05:00+02:00","IsSpecialMeeting":null,"LastUpdatedDate":"2021-12-30T08:41:46+02:00"}
{"Id":488761,"Number":369,"KnessetNum":2,"Name":"ישיבת מליאה בתאריך 08/02/1954 בשעה 16:07","StartDate":"1954-02-08T16:07:00+02:00","FinishDate":"1954-02-08T18:46:00+02:00","IsSpecialMeeting":null,"LastUpdatedDate":"2020-10-20T10:10:26.19+03:00"}
{"Id":488762,"Number":370,"KnessetNum":2,"Name":"ישיבת מליאה בתאריך 08/02/1954 בשעה 20:00","StartDate":"1954-02-08T20:00:00+02:00","FinishDate":"1954-02-08T21:16:00+02:00","IsSpecialMeeting":null,"LastUpdatedDate":"2020-10-20T10:12:07.833+03:00"}
{"Id":488763,"Number":371,"KnessetNum":2,"Name":"ישיבת מליאה בתאריך 09/02/1954 בשעה 16:12","StartDate":"1954-02-09T16:12:00+02:00","FinishDate":"1954-02-09T18:17:00+02:00","IsSpecialMeeting":null,"LastUpdatedDate":"2024-02-22T17:00:15.99+02:00"}
{"Id":488764,"Number":372,"KnessetNum":2,"Name":"ישיבת מליאה בתאריך 09/02/1954 בשעה 20:11","StartDate":"1954-02-09T20:11:00+02:00","FinishDate":"1954-02-09T21:30:00+02:00","IsSpecialMeeting":null,"LastUpdatedDate":"2020-10-20T10:07:22.55+03:00"}
{"Id":488765,"Number":377,"KnessetNum":2,"Name":"ישיבת מליאה בתאריך 22/02/1954 בשעה 16:15","StartDate":"1954-02-22T16:15:00+02:00","FinishDate":"1954-02-22T18:40:00+02:00","IsSpecialMeeting":null,"LastUpdatedDate":"2021-12-28T15:48:57.417+02:00"}
{"Id":488766,"Number":378,"KnessetNum":2,"Name":"ישיבת מליאה בתאריך 22/02/1954 בשעה 20:12","StartDate":"1954-02-22T20:12:00+02:00","FinishDate":"1954-02-22T21:12:00+02:00","IsSpecialMeeting":null,"LastUpdatedDate":"2021-12-30T09:34:57.753+02:00"}
{"Id":488767,"Number":398,"KnessetNum":2,"Name":"ישיבת מליאה בתאריך 22/03/1954 בשעה 20:02","StartDate":"1954-03-22T20:02:00+02:00","FinishDate":"1954-03-22T23:15:00+02:00","IsSpecialMeeting":null,"LastUpdatedDate":"2021-12-28T17:52:10.253+02:00"}
{"Id":488768,"Number":402,"KnessetNum":2,"Name":"ישיבת מליאה בתאריך 29/03/1954 בשעה 16:07","StartDate":"1954-03-29T16:07:00+02:00","FinishDate":"1954-03-29T18:50:00+02:00","IsSpecialMeeting":null,"LastUpdatedDate":"2020-10-19T18:37:50.197+03:00"}
{"Id":488769,"Number":407,"KnessetNum":2,"Name":"ישיבת מליאה בתאריך 31/03/1954 בשעה 20:03","StartDate":"1954-03-31T20:03:00+02:00","FinishDate":"1954-04-01T01:02:00+02:00","IsSpecialMeeting":null,"LastUpdatedDate":"2020-10-19T18:26:53.543+03:00"}
{"Id":488771,"Number":410,"KnessetNum":2,"Name":"ישיבת מליאה בתאריך 05/04/1954 בשעה 20:05","StartDate":"1954-04-05T20:05:00+02:00","FinishDate":"1954-04-05T22:01:00+02:00","IsSpecialMeeting":null,"LastUpdatedDate":"2021-11-16T12:36:12.903+02:00"}
{"Id":488772,"Number":413,"KnessetNum":2,"Name":"ישיבת מליאה בתאריך 07/04/1954 בשעה 14:33","StartDate":"1954-04-07T14:33:00+03:00","FinishDate":"1954-04-07T20:35:00+03:00","IsSpecialMeeting":null,"LastUpdatedDate":"2020-10-19T18:06:07.443+03:00"}
{"Id":488774,"Number":422,"KnessetNum":2,"Name":"ישיבת מליאה בתאריך 18/05/1954 בשעה 20:15","StartDate":"1954-05-18T20:15:00+03:00","FinishDate":"1954-05-18T21:55:00+03:00","IsSpecialMeeting":null,"LastUpdatedDate":"2020-10-19T17:41:26.47+03:00"}
{"Id":488776,"Number":426,"KnessetNum":2,"Name":"ישיבת מליאה בתאריך 25/05/1954 בשעה 16:10","StartDate":"1954-05-25T16:10:00+03:00","FinishDate":"1954-05-25T18:54:00+03:00","IsSpecialMeeting":null,"LastUpdatedDate":"2021-11-18T09:45:06.653+02:00"}
{"Id":488777,"Number":427,"KnessetNum":2,"Name":"ישיבת מליאה בתאריך 25/05/1954 בשעה 20:07","StartDate":"1954-05-25T20:07:00+03:00","FinishDate":"1954-05-25T22:40:00+03:00","IsSpecialMeeting":null,"LastUpdatedDate":"2020-10-19T17:10:46.1+03:00"}
{"Id":488778,"Number":430,"KnessetNum":2,"Name":"ישיבת מליאה בתאריך 31/05/1954 בשעה 20:07","StartDate":"1954-05-31T20:07:00+03:00","FinishDate":"1954-05-31T21:25:00+03:00","IsSpecialMeeting":null,"LastUpdatedDate":"2020-08-24T12:07:07.587+03:00"}
{"Id":488780,"Number":447,"KnessetNum":2,"Name":"ישיבת מליאה בתאריך 28/06/1954 בשעה 16:09","StartDate":"1954-06-28T16:09:00+03:00","FinishDate":"1954-06-28T19:13:00+03:00","IsSpecialMeeting":null,"LastUpdatedDate":"2020-10-19T15:58:12.96+03:00"}
{"Id":488781,"Number":448,"KnessetNum":2,"Name":"ישיבת מליאה בתאריך 28/06/1954 בשעה 20:15","StartDate":"1954-06-28T20:15:00+03:00","FinishDate":"1954-06-28T21:50:00+03:00","IsSpecialMeeting":null,"LastUpdatedDate":"2020-10-19T16:00:17.1+03:00"}
{"Id":488783,"Number":463,"KnessetNum":2,"Name":"ישיבת מליאה בתאריך 02/08/1954 בשעה 20:02","StartDate":"1954-08-02T20:02:00+03:00","FinishDate":"1954-08-02T21:33:00+03:00","IsSpecialMeeting":null,"LastUpdatedDate":"2021-11-22T16:19:23.72+02:00"}
{"Id":488784,"Number":465,"KnessetNum":2,"Name":"ישיבת מליאה בתאריך 03/08/1954 בשעה 20:16","StartDate":"1954-08-03T20:16:00+03:00","FinishDate":"1954-08-03T21:57:00+03:00","IsSpecialMeeting":null,"LastUpdatedDate":"2021-11-25T12:34:21.02+02:00"}
{"Id":488785,"Number":468,"KnessetNum":2,"Name":"ישיבת מליאה בתאריך 09/08/1954 בשעה 20:15","StartDate":"1954-08-09T20:15:00+03:00","FinishDate":"1954-08-09T22:30:00+03:00","IsSpecialMeeting":null,"LastUpdatedDate":"2020-10-19T14:27:03.653+03:00"}
{"Id":488786,"Number":470,"KnessetNum":2,"Name":"ישיבת מליאה בתאריך 10/08/1954 בשעה 20:15","StartDate":"1954-08-10T20:15:00+03:00","FinishDate":"1954-08-10T22:31:00+03:00","IsSpecialMeeting":null,"LastUpdatedDate":"2020-10-19T14:22:19.297+03:00"}
{"Id":488788,"Number":478,"KnessetNum":2,"Name":"ישיבת מליאה בתאריך 24/08/1954 בשעה 16:07","StartDate":"1954-08-24T16:07:00+03:00","FinishDate":"1954-08-24T19:05:00+03:00","IsSpecialMeeting":null,"LastUpdatedDate":"2020-10-19T13:49:58.13+03:00"}
{"Id":488789,"Number":479,"KnessetNum":2,"Name":"ישיבת מליאה בתאריך 24/08/1954 בשעה 20:18","StartDate":"1954-08-24T20:18:00+03:00","FinishDate":"1954-08-24T23:13:00+03:00","IsSpecialMeeting":null,"LastUpdatedDate":"2020-10-19T14:01:41.87+03:00"}
{"Id":488790,"Number":483,"KnessetNum":2,"Name":"ישיבת מליאה בתאריך 31/08/1954 בשעה 16:05","StartDate":"1954-08-31T16:05:00+03:00","FinishDate":"1954-08-31T19:00:00+03:00","IsSpecialMeeting":null,"LastUpdatedDate":"2020-10-19T13:13:02.413+03:00"}
{"Id":488791,"Number":484,"KnessetNum":2,"Name":"ישיבת מליאה בתאריך 31/08/1954 בשעה 20:06","StartDate":"1954-08-31T20:06:00+03:00","FinishDate":"1954-08-31T22:00:00+03:00","IsSpecialMeeting":null,"LastUpdatedDate":"2020-10-19T13:14:50.88+03:00"}
{"Id":488792,"Number":489,"KnessetNum":2,"Name":"ישיבת מליאה בתאריך 07/09/1954 בשעה 20:10","StartDate":"1954-09-07T20:10:00+03:00","FinishDate":"1954-09-07T21:55:00+03:00","IsSpecialMeeting":null,"LastUpdatedDate":"2020-10-19T12:59:35.963+03:00"}
{"Id":488793,"Number":494,"KnessetNum":2,"Name":"ישיבת מליאה בתאריך 09/11/1954 בשעה 20:08","StartDate":"1954-11-09T20:08:00+02:00","FinishDate":"1954-11-09T21:55:00+02:00","IsSpecialMeeting":null,"LastUpdatedDate":"2020-10-19T12:32:25.947+03:00"}
{"Id":488794,"Number":501,"KnessetNum":2,"Name":"ישיבת מליאה בתאריך 22/11/1954 בשעה 16:08","StartDate":"1954-11-22T16:08:00+02:00","FinishDate":"1954-11-22T18:44:00+02:00","IsSpecialMeeting":null,"LastUpdatedDate":"2020-10-19T12:06:01.01+03:00"}
{"Id":488795,"Number":502,"KnessetNum":2,"Name":"ישיבת מליאה בתאריך 22/11/1954 בשעה 20:02","StartDate":"1954-11-22T20:02:00+02:00","FinishDate":"1954-11-22T21:47:00+02:00","IsSpecialMeeting":null,"LastUpdatedDate":"2021-12-02T07:28:09.153+02:00"}
{"Id":488796,"Number":505,"KnessetNum":2,"Name":"ישיבת מליאה בתאריך 29/11/1954 בשעה 16:05","StartDate":"1954-11-29T16:05:00+02:00","FinishDate":"1954-11-29T18:49:00+02:00","IsSpecialMeeting":null,"LastUpdatedDate":"2021-04-20T13:22:56.593+03:00"}
{"Id":488797,"Number":510,"KnessetNum":2,"Name":"ישיבת מליאה בתאריך 06/12/1954 בשעה 20:04","StartDate":"1954-12-06T20:04:00+02:00","FinishDate":"1954-12-06T22:04:00+02:00","IsSpecialMeeting":null,"LastUpdatedDate":"2021-12-02T10:55:06.54+02:00"}
{"Id":488798,"Number":513,"KnessetNum":2,"Name":"ישיבת מליאה בתאריך 13/12/1954 בשעה 16:17","StartDate":"1954-12-13T16:17:00+02:00","FinishDate":"1954-12-13T19:03:00+02:00","IsSpecialMeeting":null,"LastUpdatedDate":"2020-10-19T11:14:07.823+03:00"}
{"Id":488799,"Number":514,"KnessetNum":2,"Name":"ישיבת מליאה בתאריך 13/12/1954 בשעה 20:15","StartDate":"1954-12-13T20:15:00+02:00","FinishDate":"1954-12-13T21:56:00+02:00","IsSpecialMeeting":null,"LastUpdatedDate":"2020-10-19T11:15:52.753+03:00"}
{"Id":488800,"Number":522,"KnessetNum":2,"Name":"ישיבת מליאה בתאריך 27/12/1954 בשעה 20:05","StartDate":"1954-12-27T20:05:00+02:00","FinishDate":"1954-12-27T21:50:00+02:00","IsSpecialMeeting":null,"LastUpdatedDate":"2020-10-19T10:41:37.497+03:00"}
{"Id":488801,"Number":525,"KnessetNum":2,"Name":"ישיבת מליאה בתאריך 03/01/1955 בשעה 16:05","StartDate":"1955-01-03T16:05:00+02:00","FinishDate":"1955-01-03T18:59:00+02:00","IsSpecialMeeting":null,"LastUpdatedDate":"2020-10-19T10:29:56.893+03:00"}
{"Id":488802,"Number":526,"KnessetNum":2,"Name":"ישיבת מליאה בתאריך 03/01/1955 בשעה 20:10","StartDate":"1955-01-03T20:10:00+02:00","FinishDate":"1955-01-03T22:25:00+02:00","IsSpecialMeeting":null,"LastUpdatedDate":"2020-10-19T10:31:40.637+03:00"}
{"Id":488803,"Number":530,"KnessetNum":2,"Name":"ישיבת מליאה בתאריך 10/01/1955 בשעה 20:22","StartDate":"1955-01-10T20:22:00+02:00","FinishDate":"1955-01-10T21:15:00+02:00","IsSpecialMeeting":null,"LastUpdatedDate":"2020-10-19T09:51:38.083+03:00"}
{"Id":488804,"Number":533,"KnessetNum":2,"Name":"ישיבת מליאה בתאריך 17/01/1955 בשעה 16:11","StartDate":"1955-01-17T16:11:00+02:00","FinishDate":"1955-01-17T19:02:00+02:00","IsSpecialMeeting":null,"LastUpdatedDate":"2020-10-19T09:33:58.027+03:00"}
{"Id":488805,"Number":542,"KnessetNum":2,"Name":"ישיבת מליאה בתאריך 31/01/1955 בשעה 20:31","StartDate":"1955-01-31T20:31:00+02:00","FinishDate":"1955-01-31T21:47:00+02:00","IsSpecialMeeting":null,"LastUpdatedDate":"2020-10-19T08:58:37.653+03:00"}
{"Id":488806,"Number":556,"KnessetNum":2,"Name":"ישיבת מליאה בתאריך 22/02/1955 בשעה 16:08","StartDate":"1955-02-22T16:08:00+02:00","FinishDate":"1955-02-22T19:30:00+02:00","IsSpecialMeeting":null,"LastUpdatedDate":"2021-12-13T09:10:33.23+02:00"}
{"Id":488807,"Number":557,"KnessetNum":2,"Name":"ישיבת מליאה בתאריך 22/02/1955 בשעה 20:36","StartDate":"1955-02-22T20:36:00+02:00","FinishDate":"1955-02-22T21:55:00+02:00","IsSpecialMeeting":null,"LastUpdatedDate":"2021-12-13T09:21:58.297+02:00"}
{"Id":488808,"Number":578,"KnessetNum":2,"Name":"ישיבת מליאה בתאריך 23/03/1955 בשעה 20:06","StartDate":"1955-03-23T20:06:00+02:00","FinishDate":"1955-03-23T22:47:00+02:00","IsSpecialMeeting":null,"LastUpdatedDate":"2020-10-18T12:23:52.87+03:00"}
{"Id":488809,"Number":584,"KnessetNum":2,"Name":"ישיבת מליאה בתאריך 30/03/1955 בשעה 15:05","StartDate":"1955-03-30T15:05:00+02:00","FinishDate":"1955-03-30T19:00:00+02:00","IsSpecialMeeting":null,"LastUpdatedDate":"2020-10-18T11:52:36.667+03:00"}
{"Id":488810,"Number":588,"KnessetNum":2,"Name":"ישיבת מליאה בתאריך 09/05/1955 בשעה 16:07","StartDate":"1955-05-09T16:07:00+03:00","FinishDate":"1955-05-09T18:34:00+03:00","IsSpecialMeeting":null,"LastUpdatedDate":"2021-12-26T12:44:50.163+02:00"}
{"Id":488811,"Number":589,"KnessetNum":2,"Name":"ישיבת מליאה בתאריך 09/05/1955 בשעה 20:07","StartDate":"1955-05-09T20:07:00+03:00","FinishDate":"1955-05-09T21:29:00+03:00","IsSpecialMeeting":null,"LastUpdatedDate":"2020-10-18T11:38:10.52+03:00"}
{"Id":488812,"Number":590,"KnessetNum":2,"Name":"ישיבת מליאה בתאריך 10/05/1955 בשעה 16:06","StartDate":"1955-05-10T16:06:00+03:00","FinishDate":"1955-05-10T19:00:00+03:00","IsSpecialMeeting":null,"LastUpdatedDate":"2020-10-18T11:32:49.25+03:00"}
{"Id":488813,"Number":594,"KnessetNum":2,"Name":"ישיבת מליאה בתאריך 16/05/1955 בשעה 20:10","StartDate":"1955-05-16T20:10:00+03:00","FinishDate":"1955-05-16T22:19:00+03:00","IsSpecialMeeting":null,"LastUpdatedDate":"2021-12-05T11:20:21.7+02:00"}
{"Id":488814,"Number":597,"KnessetNum":2,"Name":"ישיבת מליאה בתאריך 23/05/1955 בשעה 16:11","StartDate":"1955-05-23T16:11:00+03:00","FinishDate":"1955-05-23T18:28:00+03:00","IsSpecialMeeting":null,"LastUpdatedDate":"2020-10-18T10:53:28.703+03:00"}
{"Id":488815,"Number":598,"KnessetNum":2,"Name":"ישיבת מליאה בתאריך 23/05/1955 בשעה 20:03","StartDate":"1955-05-23T20:03:00+03:00","FinishDate":"1955-05-23T21:32:00+03:00","IsSpecialMeeting":null,"LastUpdatedDate":"2020-10-18T10:55:32.34+03:00"}
{"Id":488816,"Number":601,"KnessetNum":2,"Name":"ישיבת מליאה בתאריך 30/05/1955 בשעה 16:14","StartDate":"1955-05-30T16:14:00+03:00","FinishDate":"1955-05-30T18:45:00+03:00","IsSpecialMeeting":null,"LastUpdatedDate":"2020-10-18T10:32:32.73+03:00"}
{"Id":488817,"Number":605,"KnessetNum":2,"Name":"ישיבת מליאה בתאריך 06/06/1955 בשעה 16:05","StartDate":"1955-06-06T16:05:00+03:00","FinishDate":"1955-06-06T18:55:00+03:00","IsSpecialMeeting":null,"LastUpdatedDate":"2020-10-18T10:00:22.663+03:00"}
{"Id":488818,"Number":606,"KnessetNum":2,"Name":"ישיבת מליאה בתאריך 06/06/1955 בשעה 20:00","StartDate":"1955-06-06T20:00:00+03:00","FinishDate":"1955-06-06T21:50:00+03:00","IsSpecialMeeting":null,"LastUpdatedDate":"2024-02-05T18:02:22.313+02:00"}
{"Id":488819,"Number":609,"KnessetNum":2,"Name":"ישיבת מליאה בתאריך 13/06/1955 בשעה 16:06","StartDate":"1955-06-13T16:06:00+03:00","FinishDate":"1955-06-13T18:55:00+03:00","IsSpecialMeeting":null,"LastUpdatedDate":"2020-10-18T09:27:13.847+03:00"}
{"Id":488820,"Number":610,"KnessetNum":2,"Name":"ישיבת מליאה בתאריך 13/06/1955 בשעה 20:03","StartDate":"1955-06-13T20:03:00+03:00","FinishDate":"1955-06-13T22:25:00+03:00","IsSpecialMeeting":null,"LastUpdatedDate":"2020-10-18T09:38:24.537+03:00"}
{"Id":488821,"Number":613,"KnessetNum":2,"Name":"ישיבת מליאה בתאריך 20/06/1955 בשעה 16:17","StartDate":"1955-06-20T16:17:00+03:00","FinishDate":"1955-06-20T20:15:00+03:00","IsSpecialMeeting":null,"LastUpdatedDate":"2020-10-18T09:10:57.813+03:00"}
{"Id":488822,"Number":614,"KnessetNum":2,"Name":"ישיבת מליאה בתאריך 20/06/1955 בשעה 20:18","StartDate":"1955-06-20T20:18:00+03:00","FinishDate":"1955-06-20T22:10:00+03:00","IsSpecialMeeting":null,"LastUpdatedDate":"2023-10-25T09:29:02.32+03:00"}
{"Id":488823,"Number":616,"KnessetNum":2,"Name":"ישיבת מליאה בתאריך 21/06/1955 בשעה 20:03","StartDate":"1955-06-21T20:03:00+03:00","FinishDate":"1955-06-21T23:45:00+03:00","IsSpecialMeeting":null,"LastUpdatedDate":"2021-12-14T11:32:30.303+02:00"}
{"Id":488824,"Number":618,"KnessetNum":2,"Name":"ישיבת מליאה בתאריך 27/06/1955 בשעה 16:10","StartDate":"1955-06-27T16:10:00+03:00","FinishDate":"1955-06-27T19:53:00+03:00","IsSpecialMeeting":null,"LastUpdatedDate":"2020-10-18T08:56:22.303+03:00"}
{"Id":488825,"Number":619,"KnessetNum":2,"Name":"ישיבת מליאה בתאריך 27/06/1955 בשעה 20:03","StartDate":"1955-06-27T20:03:00+03:00","FinishDate":"1955-06-27T21:10:00+03:00","IsSpecialMeeting":null,"LastUpdatedDate":"2020-10-18T09:02:34.567+03:00"}
{"Id":488826,"Number":621,"KnessetNum":2,"Name":"ישיבת מליאה בתאריך 28/06/1955 בשעה 20:32","StartDate":"1955-06-28T20:32:00+03:00","FinishDate":"1955-06-28T21:45:00+03:00","IsSpecialMeeting":null,"LastUpdatedDate":"2020-10-18T08:50:49.173+03:00"}
{"Id":488827,"Number":622,"KnessetNum":2,"Name":"ישיבת מליאה בתאריך 29/06/1955 בשעה 16:05","StartDate":"1955-06-29T16:05:00+03:00","FinishDate":"1955-06-29T18:55:00+03:00","IsSpecialMeeting":null,"LastUpdatedDate":"2020-10-18T08:43:42.183+03:00"}
{"Id":488828,"Number":623,"KnessetNum":2,"Name":"ישיבת מליאה בתאריך 29/06/1955 בשעה 20:07","StartDate":"1955-06-29T20:07:00+03:00","FinishDate":"1955-06-30T00:57:00+03:00","IsSpecialMeeting":null,"LastUpdatedDate":"2020-10-18T08:46:35.377+03:00"}
{"Id":488829,"Number":11,"KnessetNum":3,"Name":"ישיבת מליאה בתאריך 24/10/1955 בשעה 16:09","StartDate":"1955-10-24T16:09:00+02:00","FinishDate":"1955-10-24T18:07:00+02:00","IsSpecialMeeting":null,"LastUpdatedDate":"2021-11-02T14:05:07.183+02:00"}
{"Id":488830,"Number":13,"KnessetNum":3,"Name":"ישיבת מליאה בתאריך 25/10/1955 בשעה 16:00","StartDate":"1955-10-25T16:00:00+02:00","FinishDate":"1955-10-25T19:00:00+02:00","IsSpecialMeeting":null,"LastUpdatedDate":"2021-12-26T12:33:14.14+02:00"}
{"Id":488831,"Number":16,"KnessetNum":3,"Name":"ישיבת מליאה בתאריך 31/10/1955 בשעה 16:08","StartDate":"1955-10-31T16:08:00+02:00","FinishDate":"1955-10-31T18:55:00+02:00","IsSpecialMeeting":null,"LastUpdatedDate":"2021-11-03T13:23:25.74+02:00"}
{"Id":488832,"Number":22,"KnessetNum":3,"Name":"ישיבת מליאה בתאריך 14/11/1955 בשעה 16:12","StartDate":"1955-11-14T16:12:00+02:00","FinishDate":"1955-11-14T19:07:00+02:00","IsSpecialMeeting":null,"LastUpdatedDate":"2021-11-03T19:34:35.377+02:00"}
{"Id":488833,"Number":23,"KnessetNum":3,"Name":"ישיבת מליאה בתאריך 14/11/1955 בשעה 20:15","StartDate":"1955-11-14T20:15:00+02:00","FinishDate":"1955-11-14T22:04:00+02:00","IsSpecialMeeting":null,"LastUpdatedDate":"2021-11-03T18:38:18.243+02:00"}
{"Id":488834,"Number":24,"KnessetNum":3,"Name":"ישיבת מליאה בתאריך 15/11/1955 בשעה 16:10","StartDate":"1955-11-15T16:10:00+02:00","FinishDate":"1955-11-15T18:42:00+02:00","IsSpecialMeeting":null,"LastUpdatedDate":"2021-11-03T19:42:12.703+02:00"}
{"Id":488835,"Number":27,"KnessetNum":3,"Name":"ישיבת מליאה בתאריך 22/11/1955 בשעה 16:11","StartDate":"1955-11-22T16:11:00+02:00","FinishDate":"1955-11-22T18:30:00+02:00","IsSpecialMeeting":null,"LastUpdatedDate":"2023-12-31T13:34:49.73+02:00"}
{"Id":488836,"Number":28,"KnessetNum":3,"Name":"ישיבת מליאה בתאריך 22/11/1955 בשעה 20:02","StartDate":"1955-11-22T20:02:00+02:00","FinishDate":"1955-11-22T21:55:00+02:00","IsSpecialMeeting":null,"LastUpdatedDate":"2021-11-07T13:19:00.883+02:00"}
{"Id":488837,"Number":30,"KnessetNum":3,"Name":"ישיבת מליאה בתאריך 28/11/1955 בשעה 16:12","StartDate":"1955-11-28T16:12:00+02:00","FinishDate":"1955-11-28T18:55:00+02:00","IsSpecialMeeting":null,"LastUpdatedDate":"2022-01-26T13:29:39.273+02:00"}
{"Id":488838,"Number":31,"KnessetNum":3,"Name":"ישיבת מליאה בתאריך 28/11/1955 בשעה 20:01","StartDate":"1955-11-28T20:01:00+02:00","FinishDate":"1955-11-28T22:10:00+02:00","IsSpecialMeeting":null,"LastUpdatedDate":"2021-11-08T09:52:05.433+02:00"}
{"Id":488839,"Number":38,"KnessetNum":3,"Name":"ישיבת מליאה בתאריך 12/12/1955 בשעה 20:15","StartDate":"1955-12-12T20:15:00+02:00","FinishDate":"1955-12-12T22:00:00+02:00","IsSpecialMeeting":null,"LastUpdatedDate":"2021-11-14T10:26:10.717+02:00"}
{"Id":488840,"Number":39,"KnessetNum":3,"Name":"ישיבת מליאה בתאריך 13/12/1955 בשעה 16:02","StartDate":"1955-12-13T16:02:00+02:00","FinishDate":"1955-12-13T18:50:00+02:00","IsSpecialMeeting":null,"LastUpdatedDate":"2021-12-05T18:06:10.093+02:00"}
{"Id":488841,"Number":40,"KnessetNum":3,"Name":"ישיבת מליאה בתאריך 13/12/1955 בשעה 20:06","StartDate":"1955-12-13T20:06:00+02:00","FinishDate":"1955-12-13T21:37:00+02:00","IsSpecialMeeting":null,"LastUpdatedDate":"2021-11-14T11:37:30.973+02:00"}
{"Id":488842,"Number":42,"KnessetNum":3,"Name":"ישיבת מליאה בתאריך 19/12/1955 בשעה 16:10","StartDate":"1955-12-19T16:10:00+02:00","FinishDate":"1955-12-19T19:06:00+02:00","IsSpecialMeeting":null,"LastUpdatedDate":"2021-11-14T11:44:30.84+02:00"}
{"Id":488843,"Number":43,"KnessetNum":3,"Name":"ישיבת מליאה בתאריך 19/12/1955 בשעה 20:18","StartDate":"1955-12-19T20:18:00+02:00","FinishDate":"1955-12-19T21:48:00+02:00","IsSpecialMeeting":null,"LastUpdatedDate":"2021-11-15T08:23:48.693+02:00"}
{"Id":488844,"Number":44,"KnessetNum":3,"Name":"ישיבת מליאה בתאריך 20/12/1955 בשעה 16:03","StartDate":"1955-12-20T16:03:00+02:00","FinishDate":"1955-12-20T19:03:00+02:00","IsSpecialMeeting":null,"LastUpdatedDate":"2021-11-15T08:28:20.643+02:00"}
{"Id":488845,"Number":47,"KnessetNum":3,"Name":"ישיבת מליאה בתאריך 26/12/1955 בשעה 16:15","StartDate":"1955-12-26T16:15:00+02:00","FinishDate":"1955-12-26T19:16:00+02:00","IsSpecialMeeting":null,"LastUpdatedDate":"2021-11-21T12:10:23.233+02:00"}
{"Id":488846,"Number":56,"KnessetNum":3,"Name":"ישיבת מליאה בתאריך 10/01/1956 בשעה 16:07","StartDate":"1956-01-10T16:07:00+02:00","FinishDate":"1956-01-10T18:40:00+02:00","IsSpecialMeeting":null,"LastUpdatedDate":"2021-11-25T17:05:56.777+02:00"}
{"Id":488847,"Number":60,"KnessetNum":3,"Name":"ישיבת מליאה בתאריך 16/01/1956 בשעה 20:03","StartDate":"1956-01-16T20:03:00+02:00","FinishDate":"1956-01-16T21:31:00+02:00","IsSpecialMeeting":null,"LastUpdatedDate":"2023-12-27T12:08:44.07+02:00"}
{"Id":488848,"Number":64,"KnessetNum":3,"Name":"ישיבת מליאה בתאריך 24/01/1956 בשעה 16:05","StartDate":"1956-01-24T16:05:00+02:00","FinishDate":"1956-01-24T19:30:00+02:00","IsSpecialMeeting":null,"LastUpdatedDate":"2021-11-25T19:52:36.077+02:00"}
{"Id":488849,"Number":65,"KnessetNum":3,"Name":"ישיבת מליאה בתאריך 24/01/1956 בשעה 20:37","StartDate":"1956-01-24T20:37:00+02:00","FinishDate":"1956-01-24T21:14:00+02:00","IsSpecialMeeting":null,"LastUpdatedDate":"2021-11-28T13:39:46.147+02:00"}
{"Id":488850,"Number":68,"KnessetNum":3,"Name":"ישיבת מליאה בתאריך 31/01/1956 בשעה 16:16","StartDate":"1956-01-31T16:16:00+02:00","FinishDate":"1956-01-31T19:10:00+02:00","IsSpecialMeeting":null,"LastUpdatedDate":"2021-11-28T14:16:26.003+02:00"}
{"Id":488851,"Number":69,"KnessetNum":3,"Name":"ישיבת מליאה בתאריך 31/01/1956 בשעה 20:20","StartDate":"1956-01-31T20:20:00+02:00","FinishDate":"1956-01-31T21:50:00+02:00","IsSpecialMeeting":null,"LastUpdatedDate":"2021-11-28T14:48:40.733+02:00"}
{"Id":488852,"Number":76,"KnessetNum":3,"Name":"ישיבת מליאה בתאריך 13/02/1956 בשעה 20:18","StartDate":"1956-02-13T20:18:00+02:00","FinishDate":"1956-02-13T22:08:00+02:00","IsSpecialMeeting":null,"LastUpdatedDate":"2021-11-28T17:37:04.38+02:00"}
{"Id":488853,"Number":77,"KnessetNum":3,"Name":"ישיבת מליאה בתאריך 14/02/1956 בשעה 16:05","StartDate":"1956-02-14T16:05:00+02:00","FinishDate":"1956-02-14T18:42:00+02:00","IsSpecialMeeting":null,"LastUpdatedDate":"2021-11-28T17:54:20.61+02:00"}
{"Id":488854,"Number":78,"KnessetNum":3,"Name":"ישיבת מליאה בתאריך 14/02/1956 בשעה 20:04","StartDate":"1956-02-14T20:04:00+02:00","FinishDate":"1956-02-14T21:15:00+02:00","IsSpecialMeeting":null,"LastUpdatedDate":"2021-11-28T18:13:01.217+02:00"}
{"Id":488855,"Number":86,"KnessetNum":3,"Name":"ישיבת מליאה בתאריך 28/02/1956 בשעה 20:22","StartDate":"1956-02-28T20:22:00+02:00","FinishDate":"1956-02-28T22:35:00+02:00","IsSpecialMeeting":null,"LastUpdatedDate":"2021-12-01T09:31:16.397+02:00"}
{"Id":488856,"Number":98,"KnessetNum":3,"Name":"ישיבת מליאה בתאריך 12/03/1956 בשעה 20:32","StartDate":"1956-03-12T20:32:00+02:00","FinishDate":"1956-03-12T22:03:00+02:00","IsSpecialMeeting":null,"LastUpdatedDate":"2021-12-01T14:20:54.01+02:00"}
{"Id":488857,"Number":100,"KnessetNum":3,"Name":"ישיבת מליאה בתאריך 13/03/1956 בשעה 20:58","StartDate":"1956-03-13T20:58:00+02:00","FinishDate":"1956-03-13T23:10:00+02:00","IsSpecialMeeting":null,"LastUpdatedDate":"2021-12-02T10:28:51.717+02:00"}
{"Id":488858,"Number":107,"KnessetNum":3,"Name":"ישיבת מליאה בתאריך 21/03/1956 בשעה 16:00","StartDate":"1956-03-21T16:00:00+02:00","FinishDate":"1956-03-21T19:10:00+02:00","IsSpecialMeeting":null,"LastUpdatedDate":"2021-12-02T12:40:52.21+02:00"}
{"Id":488859,"Number":108,"KnessetNum":3,"Name":"ישיבת מליאה בתאריך 21/03/1956 בשעה 20:33","StartDate":"1956-03-21T20:33:00+02:00","FinishDate":"1956-03-21T23:14:00+02:00","IsSpecialMeeting":null,"LastUpdatedDate":"2021-12-02T12:50:35.587+02:00"}
{"Id":488860,"Number":109,"KnessetNum":3,"Name":"ישיבת מליאה בתאריך 22/03/1956 בשעה 09:10","StartDate":"1956-03-22T09:10:00+02:00","FinishDate":"1956-03-22T13:58:00+02:00","IsSpecialMeeting":null,"LastUpdatedDate":"2021-12-02T13:00:16.707+02:00"}
{"Id":488861,"Number":110,"KnessetNum":3,"Name":"ישיבת מליאה בתאריך 22/03/1956 בשעה 16:06","StartDate":"1956-03-22T16:06:00+02:00","FinishDate":"1956-03-22T18:57:00+02:00","IsSpecialMeeting":null,"LastUpdatedDate":"2021-12-02T15:25:13.48+02:00"}
{"Id":488862,"Number":111,"KnessetNum":3,"Name":"ישיבת מליאה בתאריך 22/03/1956 בשעה 20:28","StartDate":"1956-03-22T20:28:00+02:00","FinishDate":"1956-03-22T22:25:00+02:00","IsSpecialMeeting":null,"LastUpdatedDate":"2021-12-02T15:33:27.883+02:00"}
{"Id":488863,"Number":116,"KnessetNum":3,"Name":"ישיבת מליאה בתאריך 08/05/1956 בשעה 20:11","StartDate":"1956-05-08T20:11:00+03:00","FinishDate":"1956-05-08T22:22:00+03:00","IsSpecialMeeting":null,"LastUpdatedDate":"2021-12-05T09:32:09.497+02:00"}
{"Id":488864,"Number":118,"KnessetNum":3,"Name":"ישיבת מליאה בתאריך 21/05/1956 בשעה 16:11","StartDate":"1956-05-21T16:11:00+03:00","FinishDate":"1956-05-21T18:49:00+03:00","IsSpecialMeeting":null,"LastUpdatedDate":"2022-01-27T14:23:12.35+02:00"}
{"Id":488865,"Number":119,"KnessetNum":3,"Name":"ישיבת מליאה בתאריך 21/05/1956 בשעה 20:05","StartDate":"1956-05-21T20:05:00+03:00","FinishDate":"1956-05-21T22:07:00+03:00","IsSpecialMeeting":null,"LastUpdatedDate":"2021-12-05T10:49:49.773+02:00"}
{"Id":488866,"Number":121,"KnessetNum":3,"Name":"ישיבת מליאה בתאריך 22/05/1956 בשעה 19:55","StartDate":"1956-05-22T19:55:00+03:00","FinishDate":"1956-05-22T22:59:00+03:00","IsSpecialMeeting":null,"LastUpdatedDate":"2021-12-05T11:00:09.447+02:00"}
{"Id":488867,"Number":123,"KnessetNum":3,"Name":"ישיבת מליאה בתאריך 28/05/1956 בשעה 16:13","StartDate":"1956-05-28T16:13:00+03:00","FinishDate":"1956-05-28T18:44:00+03:00","IsSpecialMeeting":null,"LastUpdatedDate":"2021-12-07T11:05:40.277+02:00"}
{"Id":488868,"Number":125,"KnessetNum":3,"Name":"ישיבת מליאה בתאריך 29/05/1956 בשעה 16:04","StartDate":"1956-05-29T16:04:00+03:00","FinishDate":"1956-05-29T18:59:00+03:00","IsSpecialMeeting":null,"LastUpdatedDate":"2021-12-07T13:09:56.23+02:00"}
{"Id":488869,"Number":126,"KnessetNum":3,"Name":"ישיבת מליאה בתאריך 29/05/1956 בשעה 20:00","StartDate":"1956-05-29T20:00:00+03:00","FinishDate":"1956-05-29T21:25:00+03:00","IsSpecialMeeting":null,"LastUpdatedDate":"2021-12-07T13:24:44.87+02:00"}
{"Id":488870,"Number":128,"KnessetNum":3,"Name":"ישיבת מליאה בתאריך 04/06/1956 בשעה 16:10","StartDate":"1956-06-04T16:10:00+03:00","FinishDate":"1956-06-04T19:00:00+03:00","IsSpecialMeeting":null,"LastUpdatedDate":"2021-12-07T13:57:40.683+02:00"}
{"Id":488871,"Number":129,"KnessetNum":3,"Name":"ישיבת מליאה בתאריך 04/06/1956 בשעה 20:00","StartDate":"1956-06-04T20:00:00+03:00","FinishDate":"1956-06-04T21:45:00+03:00","IsSpecialMeeting":null,"LastUpdatedDate":"2021-12-07T14:36:05.757+02:00"}
{"Id":488872,"Number":132,"KnessetNum":3,"Name":"ישיבת מליאה בתאריך 11/06/1956 בשעה 16:11","StartDate":"1956-06-11T16:11:00+03:00","FinishDate":"1956-06-11T19:00:00+03:00","IsSpecialMeeting":null,"LastUpdatedDate":"2021-12-07T15:58:37.947+02:00"}
{"Id":488873,"Number":133,"KnessetNum":3,"Name":"ישיבת מליאה בתאריך 11/06/1956 בשעה 20:00","StartDate":"1956-06-11T20:00:00+03:00","FinishDate":"1956-06-11T21:45:00+03:00","IsSpecialMeeting":null,"LastUpdatedDate":"2021-12-26T12:46:02+02:00"}
{"Id":488874,"Number":134,"KnessetNum":3,"Name":"ישיבת מליאה בתאריך 12/06/1956 בשעה 16:05","StartDate":"1956-06-12T16:05:00+03:00","FinishDate":"1956-06-12T19:00:00+03:00","IsSpecialMeeting":null,"LastUpdatedDate":"2021-12-08T10:37:09.133+02:00"}
{"Id":488875,"Number":137,"KnessetNum":3,"Name":"ישיבת מליאה בתאריך 18/06/1956 בשעה 16:13","StartDate":"1956-06-18T16:13:00+03:00","FinishDate":"1956-06-18T19:00:00+03:00","IsSpecialMeeting":null,"LastUpdatedDate":"2022-01-30T14:29:15.08+02:00"}
{"Id":488876,"Number":142,"KnessetNum":3,"Name":"ישיבת מליאה בתאריך 25/06/1956 בשעה 16:10","StartDate":"1956-06-25T16:10:00+03:00","FinishDate":"1956-06-25T19:00:00+03:00","IsSpecialMeeting":null,"LastUpdatedDate":"2021-12-08T13:01:37.99+02:00"}
{"Id":488877,"Number":143,"KnessetNum":3,"Name":"ישיבת מליאה בתאריך 25/06/1956 בשעה 20:10","StartDate":"1956-06-25T20:10:00+03:00","FinishDate":"1956-06-25T21:25:00+03:00","IsSpecialMeeting":null,"LastUpdatedDate":"2021-12-08T13:17:29.83+02:00"}
{"Id":488878,"Number":149,"KnessetNum":3,"Name":"ישיבת מליאה בתאריך 03/07/1956 בשעה 20:19","StartDate":"1956-07-03T20:19:00+03:00","FinishDate":"1956-07-03T21:30:00+03:00","IsSpecialMeeting":null,"LastUpdatedDate":"2021-12-08T15:46:21.927+02:00"}
{"Id":488879,"Number":151,"KnessetNum":3,"Name":"ישיבת מליאה בתאריך 09/07/1956 בשעה 16:07","StartDate":"1956-07-09T16:07:00+03:00","FinishDate":"1956-07-09T19:05:00+03:00","IsSpecialMeeting":null,"LastUpdatedDate":"2020-05-18T16:59:27.753+03:00"}
{"Id":488880,"Number":152,"KnessetNum":3,"Name":"ישיבת מליאה בתאריך 09/07/1956 בשעה 20:10","StartDate":"1956-07-09T20:10:00+03:00","FinishDate":"1956-07-09T22:13:00+03:00","IsSpecialMeeting":null,"LastUpdatedDate":"2021-12-08T16:03:31.477+02:00"}
{"Id":488881,"Number":155,"KnessetNum":3,"Name":"ישיבת מליאה בתאריך 18/07/1956 בשעה 16:10","StartDate":"1956-07-18T16:10:00+03:00","FinishDate":"1956-07-18T19:10:00+03:00","IsSpecialMeeting":null,"LastUpdatedDate":"2021-12-09T13:43:39.737+02:00"}
{"Id":488882,"Number":157,"KnessetNum":3,"Name":"ישיבת מליאה בתאריך 19/07/1956 בשעה 11:00","StartDate":"1956-07-19T11:00:00+03:00","FinishDate":"1956-07-19T13:30:00+03:00","IsSpecialMeeting":null,"LastUpdatedDate":"2021-12-09T14:03:23.91+02:00"}
{"Id":488883,"Number":158,"KnessetNum":3,"Name":"ישיבת מליאה בתאריך 19/07/1956 בשעה 15:03","StartDate":"1956-07-19T15:03:00+03:00","FinishDate":"1956-07-19T18:12:00+03:00","IsSpecialMeeting":null,"LastUpdatedDate":"2021-12-09T15:01:29.593+02:00"}
{"Id":488884,"Number":162,"KnessetNum":3,"Name":"ישיבת מליאה בתאריך 24/07/1956 בשעה 20:00","StartDate":"1956-07-24T20:00:00+03:00","FinishDate":"1956-07-24T22:25:00+03:00","IsSpecialMeeting":null,"LastUpdatedDate":"2021-12-12T13:56:49.277+02:00"}
{"Id":488885,"Number":166,"KnessetNum":3,"Name":"ישיבת מליאה בתאריך 09/10/1956 בשעה 16:00","StartDate":"1956-10-09T16:00:00+02:00","FinishDate":"1956-10-09T19:01:00+02:00","IsSpecialMeeting":null,"LastUpdatedDate":"2021-12-12T14:44:32.367+02:00"}
{"Id":488886,"Number":167,"KnessetNum":3,"Name":"ישיבת מליאה בתאריך 09/10/1956 בשעה 20:00","StartDate":"1956-10-09T20:00:00+02:00","FinishDate":"1956-10-09T20:55:00+02:00","IsSpecialMeeting":null,"LastUpdatedDate":"2021-12-12T14:55:04.09+02:00"}
{"Id":488887,"Number":174,"KnessetNum":3,"Name":"ישיבת מליאה בתאריך 22/10/1956 בשעה 16:25","StartDate":"1956-10-22T16:25:00+02:00","FinishDate":"1956-10-22T19:08:00+02:00","IsSpecialMeeting":null,"LastUpdatedDate":"2021-12-12T17:36:59.38+02:00"}
{"Id":488888,"Number":180,"KnessetNum":3,"Name":"ישיבת מליאה בתאריך 30/10/1956 בשעה 16:30","StartDate":"1956-10-30T16:30:00+02:00","FinishDate":"1956-10-30T18:10:00+02:00","IsSpecialMeeting":null,"LastUpdatedDate":"2021-12-14T08:04:00.05+02:00"}
{"Id":488889,"Number":192,"KnessetNum":3,"Name":"ישיבת מליאה בתאריך 26/11/1956 בשעה 16:10","StartDate":"1956-11-26T16:10:00+02:00","FinishDate":"1956-11-26T18:45:00+02:00","IsSpecialMeeting":null,"LastUpdatedDate":"2021-12-15T14:37:10.04+02:00"}
{"Id":488890,"Number":193,"KnessetNum":3,"Name":"ישיבת מליאה בתאריך 26/11/1956 בשעה 19:53","StartDate":"1956-11-26T19:53:00+02:00","FinishDate":"1956-11-26T21:40:00+02:00","IsSpecialMeeting":null,"LastUpdatedDate":"2021-12-15T14:42:56.323+02:00"}
{"Id":488891,"Number":195,"KnessetNum":3,"Name":"ישיבת מליאה בתאריך 27/11/1956 בשעה 20:02","StartDate":"1956-11-27T20:02:00+02:00","FinishDate":"1956-11-27T21:17:00+02:00","IsSpecialMeeting":null,"LastUpdatedDate":"2021-12-15T15:18:07.133+02:00"}
{"Id":488892,"Number":204,"KnessetNum":3,"Name":"ישיבת מליאה בתאריך 17/12/1956 בשעה 16:00","StartDate":"1956-12-17T16:00:00+02:00","FinishDate":"1956-12-17T19:00:00+02:00","IsSpecialMeeting":null,"LastUpdatedDate":"2021-12-15T19:07:07.25+02:00"}
{"Id":488893,"Number":208,"KnessetNum":3,"Name":"ישיבת מליאה בתאריך 24/12/1956 בשעה 16:10","StartDate":"1956-12-24T16:10:00+02:00","FinishDate":"1956-12-24T18:50:00+02:00","IsSpecialMeeting":null,"LastUpdatedDate":"2021-12-16T11:07:39.41+02:00"}
{"Id":488894,"Number":209,"KnessetNum":3,"Name":"ישיבת מליאה בתאריך 24/12/1956 בשעה 20:01","StartDate":"1956-12-24T20:01:00+02:00","FinishDate":"1956-12-24T22:14:00+02:00","IsSpecialMeeting":null,"LastUpdatedDate":"2021-12-16T11:31:48.13+02:00"}
{"Id":488895,"Number":210,"KnessetNum":3,"Name":"ישיבת מליאה בתאריך 25/12/1956 בשעה 16:00","StartDate":"1956-12-25T16:00:00+02:00","FinishDate":"1956-12-25T19:06:00+02:00","IsSpecialMeeting":null,"LastUpdatedDate":"2021-12-16T11:41:19.267+02:00"}
{"Id":488896,"Number":211,"KnessetNum":3,"Name":"ישיבת מליאה בתאריך 25/12/1956 בשעה 20:16","StartDate":"1956-12-25T20:16:00+02:00","FinishDate":"1956-12-25T21:50:00+02:00","IsSpecialMeeting":null,"LastUpdatedDate":"2021-12-16T11:49:04.223+02:00"}
{"Id":488897,"Number":213,"KnessetNum":3,"Name":"ישיבת מליאה בתאריך 31/12/1956 בשעה 16:06","StartDate":"1956-12-31T16:06:00+02:00","FinishDate":"1956-12-31T19:06:00+02:00","IsSpecialMeeting":null,"LastUpdatedDate":"2021-12-16T13:25:12.41+02:00"}
{"Id":488898,"Number":214,"KnessetNum":3,"Name":"ישיבת מליאה בתאריך 31/12/1956 בשעה 20:22","StartDate":"1956-12-31T20:22:00+02:00","FinishDate":"1956-12-31T21:50:00+02:00","IsSpecialMeeting":null,"LastUpdatedDate":"2021-12-16T13:56:58.447+02:00"}
{"Id":488899,"Number":217,"KnessetNum":3,"Name":"ישיבת מליאה בתאריך 07/01/1957 בשעה 16:10","StartDate":"1957-01-07T16:10:00+02:00","FinishDate":"1957-01-07T19:01:00+02:00","IsSpecialMeeting":null,"LastUpdatedDate":"2022-01-02T12:04:56.22+02:00"}
{"Id":488900,"Number":219,"KnessetNum":3,"Name":"ישיבת מליאה בתאריך 08/01/1957 בשעה 16:02","StartDate":"1957-01-08T16:02:00+02:00","FinishDate":"1957-01-08T18:42:00+02:00","IsSpecialMeeting":null,"LastUpdatedDate":"2022-01-02T12:43:25.797+02:00"}
{"Id":488901,"Number":220,"KnessetNum":3,"Name":"ישיבת מליאה בתאריך 08/01/1957 בשעה 20:05","StartDate":"1957-01-08T20:05:00+02:00","FinishDate":"1957-01-08T22:16:00+02:00","IsSpecialMeeting":null,"LastUpdatedDate":"2022-01-02T13:07:44.403+02:00"}
{"Id":488902,"Number":240,"KnessetNum":3,"Name":"ישיבת מליאה בתאריך 11/02/1957 בשעה 20:14","StartDate":"1957-02-11T20:14:00+02:00","FinishDate":"1957-02-11T22:06:00+02:00","IsSpecialMeeting":null,"LastUpdatedDate":"2022-01-18T08:20:28.927+02:00"}
{"Id":488903,"Number":244,"KnessetNum":3,"Name":"ישיבת מליאה בתאריך 18/02/1957 בשעה 16:15","StartDate":"1957-02-18T16:15:00+02:00","FinishDate":"1957-02-18T18:55:00+02:00","IsSpecialMeeting":null,"LastUpdatedDate":"2022-01-25T08:33:14.287+02:00"}
{"Id":488904,"Number":245,"KnessetNum":3,"Name":"ישיבת מליאה בתאריך 18/02/1957 בשעה 20:03","StartDate":"1957-02-18T20:03:00+02:00","FinishDate":"1957-02-18T21:25:00+02:00","IsSpecialMeeting":null,"LastUpdatedDate":"2022-01-26T08:22:18.553+02:00"}
{"Id":488905,"Number":251,"KnessetNum":3,"Name":"ישיבת מליאה בתאריך 25/02/1957 בשעה 16:08","StartDate":"1957-02-25T16:08:00+02:00","FinishDate":"1957-02-25T19:25:00+02:00","IsSpecialMeeting":null,"LastUpdatedDate":"2022-02-06T10:06:22.81+02:00"}
{"Id":488906,"Number":266,"KnessetNum":3,"Name":"ישיבת מליאה בתאריך 20/03/1957 בשעה 16:10","StartDate":"1957-03-20T16:10:00+02:00","FinishDate":"1957-03-20T18:45:00+02:00","IsSpecialMeeting":null,"LastUpdatedDate":"2022-02-09T15:16:10.427+02:00"}
{"Id":488907,"Number":268,"KnessetNum":3,"Name":"ישיבת מליאה בתאריך 21/03/1957 בשעה 11:05","StartDate":"1957-03-21T11:05:00+02:00","FinishDate":"1957-03-21T12:42:00+02:00","IsSpecialMeeting":null,"LastUpdatedDate":"2022-02-14T07:34:41.253+02:00"}
{"Id":488908,"Number":269,"KnessetNum":3,"Name":"ישיבת מליאה בתאריך 21/03/1957 בשעה 14:10","StartDate":"1957-03-21T14:10:00+02:00","FinishDate":"1957-03-21T16:59:00+02:00","IsSpecialMeeting":null,"LastUpdatedDate":"2022-02-14T07:45:08.927+02:00"}
{"Id":488909,"Number":271,"KnessetNum":3,"Name":"ישיבת מליאה בתאריך 25/03/1957 בשעה 20:15","StartDate":"1957-03-25T20:15:00+02:00","FinishDate":"1957-03-25T23:50:00+02:00","IsSpecialMeeting":null,"LastUpdatedDate":"2022-02-14T17:14:02.437+02:00"}
{"Id":488910,"Number":273,"KnessetNum":3,"Name":"ישיבת מליאה בתאריך 26/03/1957 בשעה 20:08","StartDate":"1957-03-26T20:08:00+02:00","FinishDate":"1957-03-26T23:50:00+02:00","IsSpecialMeeting":null,"LastUpdatedDate":"2022-02-15T07:18:44.707+02:00"}
{"Id":488911,"Number":274,"KnessetNum":3,"Name":"ישיבת מליאה בתאריך 27/03/1957 בשעה 16:02","StartDate":"1957-03-27T16:02:00+02:00","FinishDate":"1957-03-27T18:02:00+02:00","IsSpecialMeeting":null,"LastUpdatedDate":"2022-02-15T07:36:58.923+02:00"}
{"Id":488912,"Number":275,"KnessetNum":3,"Name":"ישיבת מליאה בתאריך 27/03/1957 בשעה 20:12","StartDate":"1957-03-27T20:12:00+02:00","FinishDate":"1957-03-28T05:01:00+02:00","IsSpecialMeeting":null,"LastUpdatedDate":"2022-02-16T08:04:17.13+02:00"}
{"Id":488913,"Number":279,"KnessetNum":3,"Name":"ישיבת מליאה בתאריך 02/04/1957 בשעה 16:08","StartDate":"1957-04-02T16:08:00+02:00","FinishDate":"1957-04-02T19:10:00+02:00","IsSpecialMeeting":null,"LastUpdatedDate":"2022-02-17T08:26:46.253+02:00"}
{"Id":488914,"Number":283,"KnessetNum":3,"Name":"ישיבת מליאה בתאריך 08/04/1957 בשעה 16:05","StartDate":"1957-04-08T16:05:00+03:00","FinishDate":"1957-04-08T19:02:00+03:00","IsSpecialMeeting":null,"LastUpdatedDate":"2022-02-17T10:00:24.55+02:00"}
{"Id":488915,"Number":284,"KnessetNum":3,"Name":"ישיבת מליאה בתאריך 09/04/1957 בשעה 16:05","StartDate":"1957-04-09T16:05:00+03:00","FinishDate":"1957-04-09T18:59:00+03:00","IsSpecialMeeting":null,"LastUpdatedDate":"2022-02-17T10:26:59.7+02:00"}
{"Id":488916,"Number":285,"KnessetNum":3,"Name":"ישיבת מליאה בתאריך 09/04/1957 בשעה 20:17","StartDate":"1957-04-09T20:17:00+03:00","FinishDate":"1957-04-09T22:35:00+03:00","IsSpecialMeeting":null,"LastUpdatedDate":"2022-02-17T10:51:23.827+02:00"}
{"Id":488917,"Number":286,"KnessetNum":3,"Name":"ישיבת מליאה בתאריך 10/04/1957 בשעה 10:49","StartDate":"1957-04-10T10:49:00+03:00","FinishDate":"1957-04-10T14:00:00+03:00","IsSpecialMeeting":null,"LastUpdatedDate":"2022-02-17T11:35:13.02+02:00"}
{"Id":488918,"Number":289,"KnessetNum":3,"Name":"ישיבת מליאה בתאריך 11/04/1957 בשעה 09:03","StartDate":"1957-04-11T09:03:00+03:00","FinishDate":"1957-04-11T13:03:00+03:00","IsSpecialMeeting":null,"LastUpdatedDate":"2022-02-22T07:12:41.487+02:00"}
{"Id":488919,"Number":290,"KnessetNum":3,"Name":"ישיבת מליאה בתאריך 11/04/1957 בשעה 14:02","StartDate":"1957-04-11T14:02:00+03:00","FinishDate":"1957-04-11T19:30:00+03:00","IsSpecialMeeting":null,"LastUpdatedDate":"2022-02-22T07:34:43.563+02:00"}
{"Id":488920,"Number":291,"KnessetNum":3,"Name":"ישיבת מליאה בתאריך 20/05/1957 בשעה 16:11","StartDate":"1957-05-20T16:11:00+03:00","FinishDate":"1957-05-20T18:58:00+03:00","IsSpecialMeeting":null,"LastUpdatedDate":"2022-02-22T15:10:21.037+02:00"}
{"Id":488921,"Number":292,"KnessetNum":3,"Name":"ישיבת מליאה בתאריך 20/05/1957 בשעה 20:01","StartDate":"1957-05-20T20:01:00+03:00","FinishDate":"1957-05-20T21:45:00+03:00","IsSpecialMeeting":null,"LastUpdatedDate":"2022-02-22T15:16:25.32+02:00"}
{"Id":488922,"Number":294,"KnessetNum":3,"Name":"ישיבת מליאה בתאריך 21/05/1957 בשעה 20:02","StartDate":"1957-05-21T20:02:00+03:00","FinishDate":"1957-05-21T22:12:00+03:00","IsSpecialMeeting":null,"LastUpdatedDate":"2022-02-22T15:51:43.963+02:00"}
{"Id":488923,"Number":298,"KnessetNum":3,"Name":"ישיבת מליאה בתאריך 28/05/1957 בשעה 20:06","StartDate":"1957-05-28T20:06:00+03:00","FinishDate":"1957-05-28T21:58:00+03:00","IsSpecialMeeting":null,"LastUpdatedDate":"2022-02-22T16:54:43.643+02:00"}
{"Id":488924,"Number":302,"KnessetNum":3,"Name":"ישיבת מליאה בתאריך 10/06/1957 בשעה 16:07","StartDate":"1957-06-10T16:07:00+03:00","FinishDate":"1957-06-10T19:14:00+03:00","IsSpecialMeeting":null,"LastUpdatedDate":"2022-02-23T11:17:20.207+02:00"}
{"Id":488925,"Number":303,"KnessetNum":3,"Name":"ישיבת מליאה בתאריך 10/06/1957 בשעה 20:30","StartDate":"1957-06-10T20:30:00+03:00","FinishDate":"1957-06-10T21:52:00+03:00","IsSpecialMeeting":null,"LastUpdatedDate":"2022-02-23T12:25:06.757+02:00"}
{"Id":488926,"Number":304,"KnessetNum":3,"Name":"ישיבת מליאה בתאריך 11/06/1957 בשעה 16:07","StartDate":"1957-06-11T16:07:00+03:00","FinishDate":"1957-06-11T18:52:00+03:00","IsSpecialMeeting":null,"LastUpdatedDate":"2022-02-23T12:29:46.86+02:00"}
{"Id":488927,"Number":305,"KnessetNum":3,"Name":"ישיבת מליאה בתאריך 11/06/1957 בשעה 20:02","StartDate":"1957-06-11T20:02:00+03:00","FinishDate":"1957-06-11T21:25:00+03:00","IsSpecialMeeting":null,"LastUpdatedDate":"2022-02-23T12:37:27.093+02:00"}
{"Id":488928,"Number":313,"KnessetNum":3,"Name":"ישיבת מליאה בתאריך 25/06/1957 בשעה 16:12","StartDate":"1957-06-25T16:12:00+03:00","FinishDate":"1957-06-25T18:30:00+03:00","IsSpecialMeeting":null,"LastUpdatedDate":"2022-02-23T14:23:11.51+02:00"}
{"Id":488929,"Number":314,"KnessetNum":3,"Name":"ישיבת מליאה בתאריך 25/06/1957 בשעה 20:02","StartDate":"1957-06-25T20:02:00+03:00","FinishDate":"1957-06-25T21:11:00+03:00","IsSpecialMeeting":null,"LastUpdatedDate":"2022-02-23T14:28:59.273+02:00"}
{"Id":488930,"Number":316,"KnessetNum":3,"Name":"ישיבת מליאה בתאריך 01/07/1957 בשעה 16:10","StartDate":"1957-07-01T16:10:00+03:00","FinishDate":"1957-07-01T19:20:00+03:00","IsSpecialMeeting":null,"LastUpdatedDate":"2022-02-23T14:41:00.2+02:00"}
{"Id":488931,"Number":317,"KnessetNum":3,"Name":"ישיבת מליאה בתאריך 01/07/1957 בשעה 20:34","StartDate":"1957-07-01T20:34:00+03:00","FinishDate":"1957-07-01T21:42:00+03:00","IsSpecialMeeting":null,"LastUpdatedDate":"2022-02-23T14:49:20.707+02:00"}
{"Id":488932,"Number":320,"KnessetNum":3,"Name":"ישיבת מליאה בתאריך 08/07/1957 בשעה 16:10","StartDate":"1957-07-08T16:10:00+03:00","FinishDate":"1957-07-08T18:55:00+03:00","IsSpecialMeeting":null,"LastUpdatedDate":"2022-02-23T16:08:15.08+02:00"}
{"Id":488933,"Number":321,"KnessetNum":3,"Name":"ישיבת מליאה בתאריך 08/07/1957 בשעה 20:00","StartDate":"1957-07-08T20:00:00+03:00","FinishDate":"1957-07-08T21:22:00+03:00","IsSpecialMeeting":null,"LastUpdatedDate":"2022-02-23T16:19:48.633+02:00"}
{"Id":488934,"Number":323,"KnessetNum":3,"Name":"ישיבת מליאה בתאריך 09/07/1957 בשעה 20:04","StartDate":"1957-07-09T20:04:00+03:00","FinishDate":"1957-07-09T21:06:00+03:00","IsSpecialMeeting":null,"LastUpdatedDate":"2022-02-24T11:57:48.483+02:00"}
{"Id":488935,"Number":328,"KnessetNum":3,"Name":"ישיבת מליאה בתאריך 16/07/1957 בשעה 20:33","StartDate":"1957-07-16T20:33:00+03:00","FinishDate":"1957-07-16T21:25:00+03:00","IsSpecialMeeting":null,"LastUpdatedDate":"2022-02-24T14:04:36.033+02:00"}
{"Id":488936,"Number":331,"KnessetNum":3,"Name":"ישיבת מליאה בתאריך 22/07/1957 בשעה 20:13","StartDate":"1957-07-22T20:13:00+03:00","FinishDate":"1957-07-22T21:24:00+03:00","IsSpecialMeeting":null,"LastUpdatedDate":"2022-02-24T14:29:23.623+02:00"}
{"Id":488937,"Number":332,"KnessetNum":3,"Name":"ישיבת מליאה בתאריך 23/07/1957 בשעה 16:04","StartDate":"1957-07-23T16:04:00+03:00","FinishDate":"1957-07-23T19:06:00+03:00","IsSpecialMeeting":null,"LastUpdatedDate":"2022-02-24T14:34:58.207+02:00"}
{"Id":488938,"Number":335,"KnessetNum":3,"Name":"ישיבת מליאה בתאריך 29/07/1957 בשעה 16:15","StartDate":"1957-07-29T16:15:00+03:00","FinishDate":"1957-07-29T18:45:00+03:00","IsSpecialMeeting":null,"LastUpdatedDate":"2022-02-24T15:40:31.23+02:00"}
{"Id":488939,"Number":336,"KnessetNum":3,"Name":"ישיבת מליאה בתאריך 29/07/1957 בשעה 20:10","StartDate":"1957-07-29T20:10:00+03:00","FinishDate":"1957-07-29T22:21:00+03:00","IsSpecialMeeting":null,"LastUpdatedDate":"2022-02-24T15:50:17.267+02:00"}
{"Id":488940,"Number":337,"KnessetNum":3,"Name":"ישיבת מליאה בתאריך 30/07/1957 בשעה 16:07","StartDate":"1957-07-30T16:07:00+03:00","FinishDate":"1957-07-30T19:00:00+03:00","IsSpecialMeeting":null,"LastUpdatedDate":"2022-02-24T16:51:04.957+02:00"}
{"Id":488941,"Number":339,"KnessetNum":3,"Name":"ישיבת מליאה בתאריך 31/07/1957 בשעה 10:32","StartDate":"1957-07-31T10:32:00+03:00","FinishDate":"1957-07-31T13:28:00+03:00","IsSpecialMeeting":null,"LastUpdatedDate":"2022-02-24T17:06:02.043+02:00"}
{"Id":488942,"Number":340,"KnessetNum":3,"Name":"ישיבת מליאה בתאריך 31/07/1957 בשעה 14:40","StartDate":"1957-07-31T14:40:00+03:00","FinishDate":"1957-07-31T19:30:00+03:00","IsSpecialMeeting":null,"LastUpdatedDate":"2022-02-24T17:21:40.517+02:00"}
{"Id":488943,"Number":342,"KnessetNum":3,"Name":"ישיבת מליאה בתאריך 21/10/1957 בשעה 20:27","StartDate":"1957-10-21T20:27:00+02:00","FinishDate":"1957-10-21T21:23:00+02:00","IsSpecialMeeting":null,"LastUpdatedDate":"2022-03-01T06:51:48.377+02:00"}
{"Id":488944,"Number":355,"KnessetNum":3,"Name":"ישיבת מליאה בתאריך 11/11/1957 בשעה 20:18","StartDate":"1957-11-11T20:18:00+02:00","FinishDate":"1957-11-11T21:56:00+02:00","IsSpecialMeeting":null,"LastUpdatedDate":"2022-03-02T16:38:44.297+02:00"}
{"Id":488945,"Number":360,"KnessetNum":3,"Name":"ישיבת מליאה בתאריך 19/11/1957 בשעה 16:03","StartDate":"1957-11-19T16:03:00+02:00","FinishDate":"1957-11-19T19:03:00+02:00","IsSpecialMeeting":null,"LastUpdatedDate":"2022-03-02T17:46:12.823+02:00"}
{"Id":488946,"Number":364,"KnessetNum":3,"Name":"ישיבת מליאה בתאריך 25/11/1957 בשעה 20:08","StartDate":"1957-11-25T20:08:00+02:00","FinishDate":"1957-11-25T21:00:00+02:00","IsSpecialMeeting":null,"LastUpdatedDate":"2022-03-02T19:48:18.187+02:00"}
{"Id":488947,"Number":370,"KnessetNum":3,"Name":"ישיבת מליאה בתאריך 09/12/1957 בשעה 16:13","StartDate":"1957-12-09T16:13:00+02:00","FinishDate":"1957-12-09T18:52:00+02:00","IsSpecialMeeting":null,"LastUpdatedDate":"2022-03-03T11:56:04.58+02:00"}
{"Id":488948,"Number":373,"KnessetNum":3,"Name":"ישיבת מליאה בתאריך 10/12/1957 בשעה 20:30","StartDate":"1957-12-10T20:30:00+02:00","FinishDate":"1957-12-10T22:15:00+02:00","IsSpecialMeeting":null,"LastUpdatedDate":"2022-03-03T13:54:21.74+02:00"}
{"Id":488949,"Number":375,"KnessetNum":3,"Name":"ישיבת מליאה בתאריך 16/12/1957 בשעה 16:07","StartDate":"1957-12-16T16:07:00+02:00","FinishDate":"1957-12-16T18:50:00+02:00","IsSpecialMeeting":null,"LastUpdatedDate":"2022-03-03T14:29:41.173+02:00"}
{"Id":488950,"Number":382,"KnessetNum":3,"Name":"ישיבת מליאה בתאריך 31/12/1957 בשעה 16:05","StartDate":"1957-12-31T16:05:00+02:00","FinishDate":"1957-12-31T18:57:00+02:00","IsSpecialMeeting":null,"LastUpdatedDate":"2022-03-06T09:36:24.373+02:00"}
{"Id":488951,"Number":383,"KnessetNum":3,"Name":"ישיבת מליאה בתאריך 31/12/1957 בשעה 20:05","StartDate":"1957-12-31T20:05:00+02:00","FinishDate":"1957-12-31T21:45:00+02:00","IsSpecialMeeting":null,"LastUpdatedDate":"2022-03-06T09:45:28.027+02:00"}
{"Id":488952,"Number":389,"KnessetNum":3,"Name":"ישיבת מליאה בתאריך 13/01/1958 בשעה 16:13","StartDate":"1958-01-13T16:13:00+02:00","FinishDate":"1958-01-13T18:40:00+02:00","IsSpecialMeeting":null,"LastUpdatedDate":"2022-03-07T15:32:58.997+02:00"}
{"Id":488953,"Number":391,"KnessetNum":3,"Name":"ישיבת מליאה בתאריך 14/01/1958 בשעה 16:02","StartDate":"1958-01-14T16:02:00+02:00","FinishDate":"1958-01-14T18:50:00+02:00","IsSpecialMeeting":null,"LastUpdatedDate":"2022-03-07T15:59:24.88+02:00"}
{"Id":488954,"Number":392,"KnessetNum":3,"Name":"ישיבת מליאה בתאריך 14/01/1958 בשעה 20:03","StartDate":"1958-01-14T20:03:00+02:00","FinishDate":"1958-01-14T21:49:00+02:00","IsSpecialMeeting":null,"LastUpdatedDate":"2022-03-07T16:06:53.967+02:00"}
{"Id":488955,"Number":394,"KnessetNum":3,"Name":"ישיבת מליאה בתאריך 20/01/1958 בשעה 16:15","StartDate":"1958-01-20T16:15:00+02:00","FinishDate":"1958-01-20T18:25:00+02:00","IsSpecialMeeting":null,"LastUpdatedDate":"2022-03-07T16:30:49.707+02:00"}
{"Id":488956,"Number":399,"KnessetNum":3,"Name":"ישיבת מליאה בתאריך 27/01/1958 בשעה 16:10","StartDate":"1958-01-27T16:10:00+02:00","FinishDate":"1958-01-27T17:16:00+02:00","IsSpecialMeeting":null,"LastUpdatedDate":"2023-11-19T12:44:25.643+02:00"}
{"Id":488957,"Number":400,"KnessetNum":3,"Name":"ישיבת מליאה בתאריך 27/01/1958 בשעה 20:00","StartDate":"1958-01-27T20:00:00+02:00","FinishDate":"1958-01-27T21:51:00+02:00","IsSpecialMeeting":null,"LastUpdatedDate":"2022-03-08T16:59:48.177+02:00"}
{"Id":488958,"Number":403,"KnessetNum":3,"Name":"ישיבת מליאה בתאריך 03/02/1958 בשעה 16:12","StartDate":"1958-02-03T16:12:00+02:00","FinishDate":"1958-02-03T19:08:00+02:00","IsSpecialMeeting":null,"LastUpdatedDate":"2022-03-08T17:12:54.5+02:00"}
{"Id":488959,"Number":404,"KnessetNum":3,"Name":"ישיבת מליאה בתאריך 03/02/1958 בשעה 20:18","StartDate":"1958-02-03T20:18:00+02:00","FinishDate":"1958-02-03T21:27:00+02:00","IsSpecialMeeting":null,"LastUpdatedDate":"2022-03-08T17:25:47.8+02:00"}
{"Id":488960,"Number":407,"KnessetNum":3,"Name":"ישיבת מליאה בתאריך 10/02/1958 בשעה 16:10","StartDate":"1958-02-10T16:10:00+02:00","FinishDate":"1958-02-10T19:00:00+02:00","IsSpecialMeeting":null,"LastUpdatedDate":"2022-03-08T17:48:08.227+02:00"}
{"Id":488961,"Number":416,"KnessetNum":3,"Name":"ישיבת מליאה בתאריך 18/02/1958 בשעה 20:20","StartDate":"1958-02-18T20:20:00+02:00","FinishDate":"1958-02-18T22:40:00+02:00","IsSpecialMeeting":null,"LastUpdatedDate":"2022-03-08T19:30:36.223+02:00"}
{"Id":488962,"Number":419,"KnessetNum":3,"Name":"ישיבת מליאה בתאריך 24/02/1958 בשעה 20:06","StartDate":"1958-02-24T20:06:00+02:00","FinishDate":"1958-02-24T22:55:00+02:00","IsSpecialMeeting":null,"LastUpdatedDate":"2023-11-19T09:27:43.457+02:00"}
{"Id":488963,"Number":420,"KnessetNum":3,"Name":"ישיבת מליאה בתאריך 25/02/1958 בשעה 16:13","StartDate":"1958-02-25T16:13:00+02:00","FinishDate":"1958-02-25T19:09:00+02:00","IsSpecialMeeting":null,"LastUpdatedDate":"2022-03-09T07:03:46.663+02:00"}
{"Id":488964,"Number":421,"KnessetNum":3,"Name":"ישיבת מליאה בתאריך 25/02/1958 בשעה 20:30","StartDate":"1958-02-25T20:30:00+02:00","FinishDate":"1958-02-25T22:43:00+02:00","IsSpecialMeeting":null,"LastUpdatedDate":"2023-11-19T09:08:34.127+02:00"}
{"Id":488965,"Number":424,"KnessetNum":3,"Name":"ישיבת מליאה בתאריך 03/03/1958 בשעה 20:03","StartDate":"1958-03-03T20:03:00+02:00","FinishDate":"1958-03-03T22:34:00+02:00","IsSpecialMeeting":null,"LastUpdatedDate":"2022-03-09T13:32:01.28+02:00"}
{"Id":488966,"Number":426,"KnessetNum":3,"Name":"ישיבת מליאה בתאריך 04/03/1958 בשעה 20:15","StartDate":"1958-03-04T20:15:00+02:00","FinishDate":"1958-03-04T22:45:00+02:00","IsSpecialMeeting":null,"LastUpdatedDate":"2022-03-09T13:57:04.56+02:00"}
{"Id":488967,"Number":430,"KnessetNum":3,"Name":"ישיבת מליאה בתאריך 11/03/1958 בשעה 16:00","StartDate":"1958-03-11T16:00:00+02:00","FinishDate":"1958-03-11T19:02:00+02:00","IsSpecialMeeting":null,"LastUpdatedDate":"2022-03-09T16:35:41.79+02:00"}
{"Id":488968,"Number":435,"KnessetNum":3,"Name":"ישיבת מליאה בתאריך 17/03/1958 בשעה 16:06","StartDate":"1958-03-17T16:06:00+02:00","FinishDate":"1958-03-17T18:54:00+02:00","IsSpecialMeeting":null,"LastUpdatedDate":"2022-03-10T09:39:48.03+02:00"}
{"Id":488969,"Number":436,"KnessetNum":3,"Name":"ישיבת מליאה בתאריך 17/03/1958 בשעה 20:00","StartDate":"1958-03-17T20:00:00+02:00","FinishDate":"1958-03-18T00:00:00+02:00","IsSpecialMeeting":null,"LastUpdatedDate":"2022-03-10T10:01:46.19+02:00"}
{"Id":488970,"Number":438,"KnessetNum":3,"Name":"ישיבת מליאה בתאריך 19/03/1958 בשעה 15:10","StartDate":"1958-03-19T15:10:00+02:00","FinishDate":"1958-03-19T18:56:00+02:00","IsSpecialMeeting":null,"LastUpdatedDate":"2022-03-10T10:21:14.9+02:00"}
{"Id":488971,"Number":439,"KnessetNum":3,"Name":"ישיבת מליאה בתאריך 19/03/1958 בשעה 20:02","StartDate":"1958-03-19T20:02:00+02:00","FinishDate":"1958-03-19T23:26:00+02:00","IsSpecialMeeting":null,"LastUpdatedDate":"2022-03-10T10:30:25.16+02:00"}
{"Id":488972,"Number":440,"KnessetNum":3,"Name":"ישיבת מליאה בתאריך 20/03/1958 בשעה 11:05","StartDate":"1958-03-20T11:05:00+02:00","FinishDate":"1958-03-20T12:32:00+02:00","IsSpecialMeeting":null,"LastUpdatedDate":"2022-03-10T10:48:29.003+02:00"}
{"Id":488973,"Number":441,"KnessetNum":3,"Name":"ישיבת מליאה בתאריך 20/03/1958 בשעה 13:04","StartDate":"1958-03-20T13:04:00+02:00","FinishDate":"1958-03-20T18:41:00+02:00","IsSpecialMeeting":null,"LastUpdatedDate":"2022-03-10T10:52:09.917+02:00"}
{"Id":488974,"Number":442,"KnessetNum":3,"Name":"ישיבת מליאה בתאריך 24/03/1958 בשעה 15:10","StartDate":"1958-03-24T15:10:00+02:00","FinishDate":"1958-03-24T19:09:00+02:00","IsSpecialMeeting":null,"LastUpdatedDate":"2022-03-10T11:07:14.037+02:00"}
{"Id":488975,"Number":445,"KnessetNum":3,"Name":"ישיבת מליאה בתאריך 25/03/1958 בשעה 15:35","StartDate":"1958-03-25T15:35:00+02:00","FinishDate":"1958-03-25T19:00:00+02:00","IsSpecialMeeting":null,"LastUpdatedDate":"2022-03-10T13:31:17.227+02:00"}
{"Id":488976,"Number":447,"KnessetNum":3,"Name":"ישיבת מליאה בתאריך 26/03/1958 בשעה 10:07","StartDate":"1958-03-26T10:07:00+02:00","FinishDate":"1958-03-26T14:00:00+02:00","IsSpecialMeeting":null,"LastUpdatedDate":"2022-03-10T13:51:35.883+02:00"}
{"Id":488977,"Number":450,"KnessetNum":3,"Name":"ישיבת מליאה בתאריך 27/03/1958 בשעה 10:04","StartDate":"1958-03-27T10:04:00+02:00","FinishDate":"1958-03-27T13:53:00+02:00","IsSpecialMeeting":null,"LastUpdatedDate":"2022-03-10T14:45:48.303+02:00"}
{"Id":488978,"Number":451,"KnessetNum":3,"Name":"ישיבת מליאה בתאריך 27/03/1958 בשעה 15:02","StartDate":"1958-03-27T15:02:00+02:00","FinishDate":"1958-03-27T18:03:00+02:00","IsSpecialMeeting":null,"LastUpdatedDate":"2022-03-10T15:10:37.143+02:00"}
{"Id":488979,"Number":459,"KnessetNum":3,"Name":"ישיבת מליאה בתאריך 26/05/1958 בשעה 16:10","StartDate":"1958-05-26T16:10:00+03:00","FinishDate":"1958-05-26T18:55:00+03:00","IsSpecialMeeting":null,"LastUpdatedDate":"2022-03-10T16:45:37.41+02:00"}
{"Id":488980,"Number":461,"KnessetNum":3,"Name":"ישיבת מליאה בתאריך 27/05/1958 בשעה 16:05","StartDate":"1958-05-27T16:05:00+03:00","FinishDate":"1958-05-27T18:53:00+03:00","IsSpecialMeeting":null,"LastUpdatedDate":"2022-03-16T07:21:38.907+02:00"}
{"Id":488981,"Number":462,"KnessetNum":3,"Name":"ישיבת מליאה בתאריך 27/05/1958 בשעה 20:03","StartDate":"1958-05-27T20:03:00+03:00","FinishDate":"1958-05-27T21:10:00+03:00","IsSpecialMeeting":null,"LastUpdatedDate":"2022-03-16T06:59:35.823+02:00"}
{"Id":488982,"Number":469,"KnessetNum":3,"Name":"ישיבת מליאה בתאריך 09/06/1958 בשעה 16:08","StartDate":"1958-06-09T16:08:00+03:00","FinishDate":"1958-06-09T18:08:00+03:00","IsSpecialMeeting":null,"LastUpdatedDate":"2022-03-16T08:52:36.96+02:00"}
{"Id":488983,"Number":470,"KnessetNum":3,"Name":"ישיבת מליאה בתאריך 09/06/1958 בשעה 20:08","StartDate":"1958-06-09T20:08:00+03:00","FinishDate":"1958-06-09T21:56:00+03:00","IsSpecialMeeting":null,"LastUpdatedDate":"2022-03-16T09:09:04.277+02:00"}
{"Id":488984,"Number":471,"KnessetNum":3,"Name":"ישיבת מליאה בתאריך 10/06/1958 בשעה 16:11","StartDate":"1958-06-10T16:11:00+03:00","FinishDate":"1958-06-10T18:50:00+03:00","IsSpecialMeeting":null,"LastUpdatedDate":"2022-03-16T09:29:10.743+02:00"}
{"Id":488985,"Number":472,"KnessetNum":3,"Name":"ישיבת מליאה בתאריך 10/06/1958 בשעה 20:29","StartDate":"1958-06-10T20:29:00+03:00","FinishDate":"1958-06-11T02:15:00+03:00","IsSpecialMeeting":null,"LastUpdatedDate":"2022-03-16T09:43:36.393+02:00"}
{"Id":488986,"Number":475,"KnessetNum":3,"Name":"ישיבת מליאה בתאריך 16/06/1958 בשעה 20:17","StartDate":"1958-06-16T20:17:00+03:00","FinishDate":"1958-06-16T21:04:00+03:00","IsSpecialMeeting":null,"LastUpdatedDate":"2022-03-16T11:38:26.8+02:00"}
{"Id":488987,"Number":479,"KnessetNum":3,"Name":"ישיבת מליאה בתאריך 24/06/1958 בשעה 16:13","StartDate":"1958-06-24T16:13:00+03:00","FinishDate":"1958-06-24T19:16:00+03:00","IsSpecialMeeting":null,"LastUpdatedDate":"2022-03-16T16:01:04.24+02:00"}
{"Id":488988,"Number":482,"KnessetNum":3,"Name":"ישיבת מליאה בתאריך 30/06/1958 בשעה 16:08","StartDate":"1958-06-30T16:08:00+03:00","FinishDate":"1958-06-30T19:00:00+03:00","IsSpecialMeeting":null,"LastUpdatedDate":"2022-03-16T16:16:50.44+02:00"}
{"Id":488989,"Number":486,"KnessetNum":3,"Name":"ישיבת מליאה בתאריך 07/07/1958 בשעה 16:15","StartDate":"1958-07-07T16:15:00+03:00","FinishDate":"1958-07-07T17:45:00+03:00","IsSpecialMeeting":null,"LastUpdatedDate":"2022-03-21T07:22:52.833+02:00"}
{"Id":488990,"Number":493,"KnessetNum":3,"Name":"ישיבת מליאה בתאריך 15/07/1958 בשעה 16:08","StartDate":"1958-07-15T16:08:00+03:00","FinishDate":"1958-07-15T18:55:00+03:00","IsSpecialMeeting":null,"LastUpdatedDate":"2022-04-03T12:13:51.57+03:00"}
{"Id":488991,"Number":496,"KnessetNum":3,"Name":"ישיבת מליאה בתאריך 21/07/1958 בשעה 16:02","StartDate":"1958-07-21T16:02:00+03:00","FinishDate":"1958-07-21T18:15:00+03:00","IsSpecialMeeting":null,"LastUpdatedDate":"2022-04-03T15:06:24.063+03:00"}
{"Id":488992,"Number":498,"KnessetNum":3,"Name":"ישיבת מליאה בתאריך 22/07/1958 בשעה 16:08","StartDate":"1958-07-22T16:08:00+03:00","FinishDate":"1958-07-22T18:27:00+03:00","IsSpecialMeeting":null,"LastUpdatedDate":"2022-04-03T16:01:48.567+03:00"}
{"Id":488993,"Number":499,"KnessetNum":3,"Name":"ישיבת מליאה בתאריך 22/07/1958 בשעה 20:07","StartDate":"1958-07-22T20:07:00+03:00","FinishDate":"1958-07-22T21:18:00+03:00","IsSpecialMeeting":null,"LastUpdatedDate":"2022-04-03T16:15:58.063+03:00"}
{"Id":488994,"Number":502,"KnessetNum":3,"Name":"ישיבת מליאה בתאריך 29/07/1958 בשעה 16:10","StartDate":"1958-07-29T16:10:00+03:00","FinishDate":"1958-07-29T18:55:00+03:00","IsSpecialMeeting":null,"LastUpdatedDate":"2022-04-05T11:02:52.343+03:00"}
{"Id":488995,"Number":507,"KnessetNum":3,"Name":"ישיבת מליאה בתאריך 05/08/1958 בשעה 12:05","StartDate":"1958-08-05T12:05:00+03:00","FinishDate":"1958-08-05T15:00:00+03:00","IsSpecialMeeting":null,"LastUpdatedDate":"2022-04-05T12:05:13.46+03:00"}
{"Id":488996,"Number":508,"KnessetNum":3,"Name":"ישיבת מליאה בתאריך 05/08/1958 בשעה 16:04","StartDate":"1958-08-05T16:04:00+03:00","FinishDate":"1958-08-05T18:58:00+03:00","IsSpecialMeeting":null,"LastUpdatedDate":"2022-04-05T12:37:36.637+03:00"}
{"Id":488997,"Number":509,"KnessetNum":3,"Name":"ישיבת מליאה בתאריך 05/08/1958 בשעה 20:05","StartDate":"1958-08-05T20:05:00+03:00","FinishDate":"1958-08-05T22:40:00+03:00","IsSpecialMeeting":null,"LastUpdatedDate":"2022-04-05T13:00:53.483+03:00"}
{"Id":488998,"Number":510,"KnessetNum":3,"Name":"ישיבת מליאה בתאריך 06/08/1958 בשעה 09:06","StartDate":"1958-08-06T09:06:00+03:00","FinishDate":"1958-08-06T12:58:00+03:00","IsSpecialMeeting":null,"LastUpdatedDate":"2022-04-05T15:47:59.843+03:00"}
{"Id":488999,"Number":514,"KnessetNum":3,"Name":"ישיבת מליאה בתאריך 13/10/1958 בשעה 20:08","StartDate":"1958-10-13T20:08:00+02:00","FinishDate":"1958-10-13T21:20:00+02:00","IsSpecialMeeting":null,"LastUpdatedDate":"2023-11-06T13:15:15.89+02:00"}
{"Id":489000,"Number":518,"KnessetNum":3,"Name":"ישיבת מליאה בתאריך 21/10/1958 בשעה 16:04","StartDate":"1958-10-21T16:04:00+02:00","FinishDate":"1958-10-21T19:05:00+02:00","IsSpecialMeeting":null,"LastUpdatedDate":"2022-06-14T16:58:51.293+03:00"}
{"Id":489001,"Number":521,"KnessetNum":3,"Name":"ישיבת מליאה בתאריך 27/10/1958 בשעה 16:00","StartDate":"1958-10-27T16:00:00+02:00","FinishDate":"1958-10-27T19:02:00+02:00","IsSpecialMeeting":null,"LastUpdatedDate":"2022-04-07T10:13:28.76+03:00"}
{"Id":489002,"Number":530,"KnessetNum":3,"Name":"ישיבת מליאה בתאריך 10/11/1958 בשעה 16:05","StartDate":"1958-11-10T16:05:00+02:00","FinishDate":"1958-11-10T18:44:00+02:00","IsSpecialMeeting":null,"LastUpdatedDate":"2022-04-07T14:26:24.187+03:00"}
{"Id":489003,"Number":537,"KnessetNum":3,"Name":"ישיבת מליאה בתאריך 18/11/1958 בשעה 20:00","StartDate":"1958-11-18T20:00:00+02:00","FinishDate":"1958-11-18T22:00:00+02:00","IsSpecialMeeting":null,"LastUpdatedDate":"2022-04-10T09:36:58.307+03:00"}
{"Id":489004,"Number":548,"KnessetNum":3,"Name":"ישיבת מליאה בתאריך 08/12/1958 בשעה 16:00","StartDate":"1958-12-08T16:00:00+02:00","FinishDate":"1958-12-08T18:56:00+02:00","IsSpecialMeeting":null,"LastUpdatedDate":"2022-04-10T15:42:21.867+03:00"}
{"Id":489005,"Number":550,"KnessetNum":3,"Name":"ישיבת מליאה בתאריך 09/12/1958 בשעה 16:10","StartDate":"1958-12-09T16:10:00+02:00","FinishDate":"1958-12-09T19:56:00+02:00","IsSpecialMeeting":null,"LastUpdatedDate":"2022-04-10T16:00:20.153+03:00"}
{"Id":489006,"Number":553,"KnessetNum":3,"Name":"ישיבת מליאה בתאריך 15/12/1958 בשעה 16:02","StartDate":"1958-12-15T16:02:00+02:00","FinishDate":"1958-12-15T19:10:00+02:00","IsSpecialMeeting":null,"LastUpdatedDate":"2023-11-05T10:39:11.54+02:00"}
{"Id":489007,"Number":555,"KnessetNum":3,"Name":"ישיבת מליאה בתאריך 16/12/1958 בשעה 16:02","StartDate":"1958-12-16T16:02:00+02:00","FinishDate":"1958-12-16T18:48:00+02:00","IsSpecialMeeting":null,"LastUpdatedDate":"2022-04-11T08:44:00.003+03:00"}
{"Id":489008,"Number":558,"KnessetNum":3,"Name":"ישיבת מליאה בתאריך 22/12/1958 בשעה 16:03","StartDate":"1958-12-22T16:03:00+02:00","FinishDate":"1958-12-22T19:59:00+02:00","IsSpecialMeeting":null,"LastUpdatedDate":"2022-04-12T15:32:16.01+03:00"}
{"Id":489009,"Number":559,"KnessetNum":3,"Name":"ישיבת מליאה בתאריך 22/12/1958 בשעה 20:09","StartDate":"1958-12-22T20:09:00+02:00","FinishDate":"1958-12-22T21:02:00+02:00","IsSpecialMeeting":null,"LastUpdatedDate":"2022-04-12T16:03:30.933+03:00"}
{"Id":489010,"Number":563,"KnessetNum":3,"Name":"ישיבת מליאה בתאריך 29/12/1958 בשעה 16:06","StartDate":"1958-12-29T16:06:00+02:00","FinishDate":"1958-12-29T18:58:00+02:00","IsSpecialMeeting":null,"LastUpdatedDate":"2022-04-13T06:49:14.08+03:00"}
{"Id":489011,"Number":564,"KnessetNum":3,"Name":"ישיבת מליאה בתאריך 29/12/1958 בשעה 20:09","StartDate":"1958-12-29T20:09:00+02:00","FinishDate":"1958-12-29T21:52:00+02:00","IsSpecialMeeting":null,"LastUpdatedDate":"2022-04-13T06:56:31.233+03:00"}
{"Id":489012,"Number":568,"KnessetNum":3,"Name":"ישיבת מליאה בתאריך 05/01/1959 בשעה 16:04","StartDate":"1959-01-05T16:04:00+02:00","FinishDate":"1959-01-05T19:15:00+02:00","IsSpecialMeeting":null,"LastUpdatedDate":"2022-04-13T10:48:51.617+03:00"}
{"Id":489013,"Number":569,"KnessetNum":3,"Name":"ישיבת מליאה בתאריך 05/01/1959 בשעה 20:15","StartDate":"1959-01-05T20:15:00+02:00","FinishDate":"1959-01-05T21:55:00+02:00","IsSpecialMeeting":null,"LastUpdatedDate":"2022-04-13T11:00:06.33+03:00"}
{"Id":489014,"Number":570,"KnessetNum":3,"Name":"ישיבת מליאה בתאריך 06/01/1959 בשעה 16:05","StartDate":"1959-01-06T16:05:00+02:00","FinishDate":"1959-01-06T18:53:00+02:00","IsSpecialMeeting":null,"LastUpdatedDate":"2022-04-13T11:21:43.92+03:00"}
{"Id":489015,"Number":573,"KnessetNum":3,"Name":"ישיבת מליאה בתאריך 12/01/1959 בשעה 16:18","StartDate":"1959-01-12T16:18:00+02:00","FinishDate":"1959-01-12T18:25:00+02:00","IsSpecialMeeting":null,"LastUpdatedDate":"2022-04-13T15:39:38.003+03:00"}
{"Id":489016,"Number":575,"KnessetNum":3,"Name":"ישיבת מליאה בתאריך 13/01/1959 בשעה 16:07","StartDate":"1959-01-13T16:07:00+02:00","FinishDate":"1959-01-13T19:10:00+02:00","IsSpecialMeeting":null,"LastUpdatedDate":"2022-04-24T07:38:44.35+03:00"}
{"Id":489017,"Number":576,"KnessetNum":3,"Name":"ישיבת מליאה בתאריך 13/01/1959 בשעה 20:17","StartDate":"1959-01-13T20:17:00+02:00","FinishDate":"1959-01-13T21:50:00+02:00","IsSpecialMeeting":null,"LastUpdatedDate":"2022-04-24T07:44:58.093+03:00"}
{"Id":489018,"Number":586,"KnessetNum":3,"Name":"ישיבת מליאה בתאריך 09/02/1959 בשעה 16:10","StartDate":"1959-02-09T16:10:00+02:00","FinishDate":"1959-02-09T18:50:00+02:00","IsSpecialMeeting":null,"LastUpdatedDate":"2022-04-24T17:20:35.057+03:00"}
{"Id":489019,"Number":591,"KnessetNum":3,"Name":"ישיבת מליאה בתאריך 16/02/1959 בשעה 20:08","StartDate":"1959-02-16T20:08:00+02:00","FinishDate":"1959-02-16T22:20:00+02:00","IsSpecialMeeting":null,"LastUpdatedDate":"2022-05-01T16:30:10.293+03:00"}
{"Id":489020,"Number":594,"KnessetNum":3,"Name":"ישיבת מליאה בתאריך 23/02/1959 בשעה 16:08","StartDate":"1959-02-23T16:08:00+02:00","FinishDate":"1959-02-23T19:10:00+02:00","IsSpecialMeeting":null,"LastUpdatedDate":"2022-06-14T14:04:09.917+03:00"}
{"Id":489021,"Number":596,"KnessetNum":3,"Name":"ישיבת מליאה בתאריך 24/02/1959 בשעה 15:07","StartDate":"1959-02-24T15:07:00+02:00","FinishDate":"1959-02-24T19:05:00+02:00","IsSpecialMeeting":null,"LastUpdatedDate":"2022-05-08T10:06:15.997+03:00"}
{"Id":489022,"Number":599,"KnessetNum":3,"Name":"ישיבת מליאה בתאריך 02/03/1959 בשעה 16:05","StartDate":"1959-03-02T16:05:00+02:00","FinishDate":"1959-03-02T19:00:00+02:00","IsSpecialMeeting":null,"LastUpdatedDate":"2022-05-08T10:15:59.36+03:00"}
{"Id":489023,"Number":607,"KnessetNum":3,"Name":"ישיבת מליאה בתאריך 10/03/1959 בשעה 15:10","StartDate":"1959-03-10T15:10:00+02:00","FinishDate":"1959-03-10T19:03:00+02:00","IsSpecialMeeting":null,"LastUpdatedDate":"2023-10-31T11:25:02.907+02:00"}
{"Id":489024,"Number":609,"KnessetNum":3,"Name":"ישיבת מליאה בתאריך 11/03/1959 בשעה 11:05","StartDate":"1959-03-11T11:05:00+02:00","FinishDate":"1959-03-11T12:59:00+02:00","IsSpecialMeeting":null,"LastUpdatedDate":"2023-10-31T11:02:12.76+02:00"}
{"Id":489025,"Number":614,"KnessetNum":3,"Name":"ישיבת מליאה בתאריך 17/03/1959 בשעה 19:57","StartDate":"1959-03-17T19:57:00+02:00","FinishDate":"1959-03-17T23:05:00+02:00","IsSpecialMeeting":null,"LastUpdatedDate":"2023-10-31T09:36:39.973+02:00"}
{"Id":489026,"Number":616,"KnessetNum":3,"Name":"ישיבת מליאה בתאריך 18/03/1959 בשעה 14:00","StartDate":"1959-03-18T14:00:00+02:00","FinishDate":"1959-03-18T20:45:00+02:00","IsSpecialMeeting":null,"LastUpdatedDate":"2023-10-31T09:09:02.71+02:00"}
{"Id":489027,"Number":625,"KnessetNum":3,"Name":"ישיבת מליאה בתאריך 31/03/1959 בשעה 21:03","StartDate":"1959-03-31T21:03:00+02:00","FinishDate":"1959-03-31T23:47:00+02:00","IsSpecialMeeting":null,"LastUpdatedDate":"2023-10-30T15:53:54.82+02:00"}
{"Id":489028,"Number":627,"KnessetNum":3,"Name":"ישיבת מליאה בתאריך 01/04/1959 בשעה 13:37","StartDate":"1959-04-01T13:37:00+03:00","FinishDate":"1959-04-01T22:51:00+03:00","IsSpecialMeeting":null,"LastUpdatedDate":"2023-10-30T14:59:09.463+02:00"}
{"Id":489029,"Number":629,"KnessetNum":3,"Name":"ישיבת מליאה בתאריך 06/04/1959 בשעה 20:03","StartDate":"1959-04-06T20:03:00+03:00","FinishDate":"1959-04-06T22:50:00+03:00","IsSpecialMeeting":null,"LastUpdatedDate":"2023-10-30T14:25:29.3+02:00"}
{"Id":489030,"Number":631,"KnessetNum":3,"Name":"ישיבת מליאה בתאריך 07/04/1959 בשעה 14:12","StartDate":"1959-04-07T14:12:00+03:00","FinishDate":"1959-04-07T18:27:00+03:00","IsSpecialMeeting":null,"LastUpdatedDate":"2020-03-18T09:55:04.063+02:00"}
{"Id":489031,"Number":632,"KnessetNum":3,"Name":"ישיבת מליאה בתאריך 07/04/1959 בשעה 20:37","StartDate":"1959-04-07T20:37:00+03:00","FinishDate":"1959-04-07T23:38:00+03:00","IsSpecialMeeting":null,"LastUpdatedDate":"2023-10-30T12:02:24.423+02:00"}
{"Id":489032,"Number":640,"KnessetNum":3,"Name":"ישיבת מליאה בתאריך 01/06/1959 בשעה 16:08","StartDate":"1959-06-01T16:08:00+03:00","FinishDate":"1959-06-01T19:05:00+03:00","IsSpecialMeeting":null,"LastUpdatedDate":"2023-10-30T09:52:48.073+02:00"}
{"Id":489033,"Number":641,"KnessetNum":3,"Name":"ישיבת מליאה בתאריך 01/06/1959 בשעה 20:04","StartDate":"1959-06-01T20:04:00+03:00","FinishDate":"1959-06-01T21:03:00+03:00","IsSpecialMeeting":null,"LastUpdatedDate":"2023-10-30T09:44:04.807+02:00"}
{"Id":489034,"Number":645,"KnessetNum":3,"Name":"ישיבת מליאה בתאריך 08/06/1959 בשעה 16:03","StartDate":"1959-06-08T16:03:00+03:00","FinishDate":"1959-06-08T18:27:00+03:00","IsSpecialMeeting":null,"LastUpdatedDate":"2023-10-30T07:52:12.533+02:00"}
{"Id":489035,"Number":650,"KnessetNum":3,"Name":"ישיבת מליאה בתאריך 15/06/1959 בשעה 16:10","StartDate":"1959-06-15T16:10:00+03:00","FinishDate":"1959-06-15T19:57:00+03:00","IsSpecialMeeting":null,"LastUpdatedDate":"2023-10-29T13:15:57.517+02:00"}
{"Id":489036,"Number":651,"KnessetNum":3,"Name":"ישיבת מליאה בתאריך 15/06/1959 בשעה 20:08","StartDate":"1959-06-15T20:08:00+03:00","FinishDate":"1959-06-15T22:04:00+03:00","IsSpecialMeeting":null,"LastUpdatedDate":"2023-10-29T13:04:47.697+02:00"}
{"Id":489037,"Number":655,"KnessetNum":3,"Name":"ישיבת מליאה בתאריך 22/06/1959 בשעה 16:00","StartDate":"1959-06-22T16:00:00+03:00","FinishDate":"1959-06-22T19:00:00+03:00","IsSpecialMeeting":null,"LastUpdatedDate":"2023-10-29T12:00:49.8+02:00"}
{"Id":489038,"Number":664,"KnessetNum":3,"Name":"ישיבת מליאה בתאריך 06/07/1959 בשעה 16:03","StartDate":"1959-07-06T16:03:00+03:00","FinishDate":"1959-07-06T18:40:00+03:00","IsSpecialMeeting":null,"LastUpdatedDate":"2023-10-29T10:52:09.623+02:00"}
{"Id":489039,"Number":665,"KnessetNum":3,"Name":"ישיבת מליאה בתאריך 06/07/1959 בשעה 20:05","StartDate":"1959-07-06T20:05:00+03:00","FinishDate":"1959-07-06T20:25:00+03:00","IsSpecialMeeting":null,"LastUpdatedDate":"2023-10-29T10:30:49.31+02:00"}
{"Id":489040,"Number":666,"KnessetNum":3,"Name":"ישיבת מליאה בתאריך 07/07/1959 בשעה 16:02","StartDate":"1959-07-07T16:02:00+03:00","FinishDate":"1959-07-07T18:55:00+03:00","IsSpecialMeeting":null,"LastUpdatedDate":"2023-10-29T09:55:55.713+02:00"}
{"Id":489041,"Number":667,"KnessetNum":3,"Name":"ישיבת מליאה בתאריך 07/07/1959 בשעה 20:00","StartDate":"1959-07-07T20:00:00+03:00","FinishDate":"1959-07-07T21:55:00+03:00","IsSpecialMeeting":null,"LastUpdatedDate":"2023-10-29T09:49:28.437+02:00"}
{"Id":489042,"Number":670,"KnessetNum":3,"Name":"ישיבת מליאה בתאריך 13/07/1959 בשעה 20:22","StartDate":"1959-07-13T20:22:00+03:00","FinishDate":"1959-07-13T21:53:00+03:00","IsSpecialMeeting":null,"LastUpdatedDate":"2023-10-29T09:39:01.167+02:00"}
{"Id":489043,"Number":671,"KnessetNum":3,"Name":"ישיבת מליאה בתאריך 14/07/1959 בשעה 16:05","StartDate":"1959-07-14T16:05:00+03:00","FinishDate":"1959-07-14T17:45:00+03:00","IsSpecialMeeting":null,"LastUpdatedDate":"2023-10-29T08:59:48.907+02:00"}
{"Id":489044,"Number":672,"KnessetNum":3,"Name":"ישיבת מליאה בתאריך 14/07/1959 בשעה 19:40","StartDate":"1959-07-14T19:40:00+03:00","FinishDate":"1959-07-14T22:00:00+03:00","IsSpecialMeeting":null,"LastUpdatedDate":"2023-10-29T07:55:41.983+02:00"}
{"Id":489045,"Number":674,"KnessetNum":3,"Name":"ישיבת מליאה בתאריך 20/07/1959 בשעה 16:05","StartDate":"1959-07-20T16:05:00+03:00","FinishDate":"1959-07-20T19:12:00+03:00","IsSpecialMeeting":null,"LastUpdatedDate":"2023-08-15T09:57:15.857+03:00"}
{"Id":489046,"Number":675,"KnessetNum":3,"Name":"ישיבת מליאה בתאריך 20/07/1959 בשעה 20:18","StartDate":"1959-07-20T20:18:00+03:00","FinishDate":"1959-07-20T22:45:00+03:00","IsSpecialMeeting":null,"LastUpdatedDate":"2021-04-28T16:17:08.017+03:00"}
{"Id":489047,"Number":676,"KnessetNum":3,"Name":"ישיבת מליאה בתאריך 21/07/1959 בשעה 15:05","StartDate":"1959-07-21T15:05:00+03:00","FinishDate":"1959-07-21T19:15:00+03:00","IsSpecialMeeting":null,"LastUpdatedDate":"2023-10-25T14:19:04.503+03:00"}
{"Id":489048,"Number":677,"KnessetNum":3,"Name":"ישיבת מליאה בתאריך 21/07/1959 בשעה 20:22","StartDate":"1959-07-21T20:22:00+03:00","FinishDate":"1959-07-21T23:00:00+03:00","IsSpecialMeeting":null,"LastUpdatedDate":"2023-09-21T14:23:53.78+03:00"}
{"Id":489049,"Number":678,"KnessetNum":3,"Name":"ישיבת מליאה בתאריך 22/07/1959 בשעה 11:03","StartDate":"1959-07-22T11:03:00+03:00","FinishDate":"1959-07-22T13:13:00+03:00","IsSpecialMeeting":null,"LastUpdatedDate":"2023-10-25T14:17:56.383+03:00"}
{"Id":489050,"Number":679,"KnessetNum":3,"Name":"ישיבת מליאה בתאריך 22/07/1959 בשעה 14:15","StartDate":"1959-07-22T14:15:00+03:00","FinishDate":"1959-07-22T16:45:00+03:00","IsSpecialMeeting":null,"LastUpdatedDate":"2023-10-25T13:58:22.427+03:00"}
{"Id":489051,"Number":681,"KnessetNum":3,"Name":"ישיבת מליאה בתאריך 27/07/1959 בשעה 20:02","StartDate":"1959-07-27T20:02:00+03:00","FinishDate":"1959-07-27T22:53:00+03:00","IsSpecialMeeting":null,"LastUpdatedDate":"2023-10-25T13:45:01.273+03:00"}
{"Id":489052,"Number":682,"KnessetNum":3,"Name":"ישיבת מליאה בתאריך 28/07/1959 בשעה 15:03","StartDate":"1959-07-28T15:03:00+03:00","FinishDate":"1959-07-28T19:09:00+03:00","IsSpecialMeeting":null,"LastUpdatedDate":"2023-10-25T12:18:51.73+03:00"}
{"Id":489053,"Number":683,"KnessetNum":3,"Name":"ישיבת מליאה בתאריך 28/07/1959 בשעה 20:12","StartDate":"1959-07-28T20:12:00+03:00","FinishDate":"1959-07-28T22:55:00+03:00","IsSpecialMeeting":null,"LastUpdatedDate":"2023-10-25T12:12:18.123+03:00"}
{"Id":489054,"Number":684,"KnessetNum":3,"Name":"ישיבת מליאה בתאריך 29/07/1959 בשעה 11:07","StartDate":"1959-07-29T11:07:00+03:00","FinishDate":"1959-07-29T13:30:00+03:00","IsSpecialMeeting":null,"LastUpdatedDate":"2023-10-25T12:01:52.87+03:00"}
{"Id":489055,"Number":686,"KnessetNum":3,"Name":"ישיבת מליאה בתאריך 03/08/1959 בשעה 16:05","StartDate":"1959-08-03T16:05:00+03:00","FinishDate":"1959-08-03T19:08:00+03:00","IsSpecialMeeting":null,"LastUpdatedDate":"2023-10-25T10:10:26.43+03:00"}
{"Id":489056,"Number":688,"KnessetNum":3,"Name":"ישיבת מליאה בתאריך 04/08/1959 בשעה 15:05","StartDate":"1959-08-04T15:05:00+03:00","FinishDate":"1959-08-04T18:50:00+03:00","IsSpecialMeeting":null,"LastUpdatedDate":"2023-10-25T09:49:51.25+03:00"}
{"Id":489057,"Number":689,"KnessetNum":3,"Name":"ישיבת מליאה בתאריך 04/08/1959 בשעה 20:08","StartDate":"1959-08-04T20:08:00+03:00","FinishDate":"1959-08-04T22:30:00+03:00","IsSpecialMeeting":null,"LastUpdatedDate":"2023-10-25T09:47:51.603+03:00"}
{"Id":489058,"Number":690,"KnessetNum":3,"Name":"ישיבת מליאה בתאריך 05/08/1959 בשעה 15:05","StartDate":"1959-08-05T15:05:00+03:00","FinishDate":"1959-08-05T18:58:00+03:00","IsSpecialMeeting":null,"LastUpdatedDate":"2023-10-25T09:42:34.72+03:00"}
{"Id":489059,"Number":692,"KnessetNum":3,"Name":"ישיבת מליאה בתאריך 06/08/1959 בשעה 10:15","StartDate":"1959-08-06T10:15:00+03:00","FinishDate":"1959-08-06T13:47:00+03:00","IsSpecialMeeting":null,"LastUpdatedDate":"2023-10-25T09:37:21.8+03:00"}
{"Id":489060,"Number":693,"KnessetNum":3,"Name":"ישיבת מליאה בתאריך 06/08/1959 בשעה 15:00","StartDate":"1959-08-06T15:00:00+03:00","FinishDate":"1959-08-06T21:45:00+03:00","IsSpecialMeeting":null,"LastUpdatedDate":"2023-10-25T09:33:10.467+03:00"}
{"Id":489061,"Number":4,"KnessetNum":4,"Name":"ישיבת מליאה בתאריך 08/12/1959 בשעה 16:06","StartDate":"1959-12-08T16:06:00+02:00","FinishDate":"1959-12-08T18:42:00+02:00","IsSpecialMeeting":null,"LastUpdatedDate":"2021-12-14T16:39:37.073+02:00"}
{"Id":489062,"Number":8,"KnessetNum":4,"Name":"ישיבת מליאה בתאריך 14/12/1959 בשעה 20:05","StartDate":"1959-12-14T20:05:00+02:00","FinishDate":"1959-12-14T21:30:00+02:00","IsSpecialMeeting":null,"LastUpdatedDate":"2021-12-15T09:48:41.493+02:00"}
{"Id":489063,"Number":12,"KnessetNum":4,"Name":"ישיבת מליאה בתאריך 21/12/1959 בשעה 16:02","StartDate":"1959-12-21T16:02:00+02:00","FinishDate":"1959-12-21T19:08:00+02:00","IsSpecialMeeting":null,"LastUpdatedDate":"2021-12-15T10:47:39.71+02:00"}
{"Id":489064,"Number":13,"KnessetNum":4,"Name":"ישיבת מליאה בתאריך 21/12/1959 בשעה 20:17","StartDate":"1959-12-21T20:17:00+02:00","FinishDate":null,"IsSpecialMeeting":null,"LastUpdatedDate":"2021-12-15T10:55:16.83+02:00"}
{"Id":489065,"Number":26,"KnessetNum":4,"Name":"ישיבת מליאה בתאריך 11/01/1960 בשעה 16:05","StartDate":"1960-01-11T16:05:00+02:00","FinishDate":"1960-01-11T18:47:00+02:00","IsSpecialMeeting":null,"LastUpdatedDate":"2021-12-15T13:40:02.71+02:00"}
{"Id":489066,"Number":28,"KnessetNum":4,"Name":"ישיבת מליאה בתאריך 12/01/1960 בשעה 16:05","StartDate":"1960-01-12T16:05:00+02:00","FinishDate":"1960-01-12T19:00:00+02:00","IsSpecialMeeting":null,"LastUpdatedDate":"2021-12-15T14:06:26.257+02:00"}
{"Id":489067,"Number":31,"KnessetNum":4,"Name":"ישיבת מליאה בתאריך 18/01/1960 בשעה 16:08","StartDate":"1960-01-18T16:08:00+02:00","FinishDate":"1960-01-18T19:10:00+02:00","IsSpecialMeeting":null,"LastUpdatedDate":"2021-12-15T14:35:35.29+02:00"}
{"Id":489068,"Number":36,"KnessetNum":4,"Name":"ישיבת מליאה בתאריך 25/01/1960 בשעה 16:00","StartDate":"1960-01-25T16:00:00+02:00","FinishDate":"1960-01-25T19:00:00+02:00","IsSpecialMeeting":null,"LastUpdatedDate":"2021-12-16T09:52:38.667+02:00"}
{"Id":489069,"Number":37,"KnessetNum":4,"Name":"ישיבת מליאה בתאריך 25/01/1960 בשעה 20:04","StartDate":"1960-01-25T20:04:00+02:00","FinishDate":"1960-01-25T21:41:00+02:00","IsSpecialMeeting":null,"LastUpdatedDate":"2021-12-16T09:20:13.67+02:00"}
{"Id":489070,"Number":38,"KnessetNum":4,"Name":"ישיבת מליאה בתאריך 26/01/1960 בשעה 16:04","StartDate":"1960-01-26T16:04:00+02:00","FinishDate":"1960-01-26T18:52:00+02:00","IsSpecialMeeting":null,"LastUpdatedDate":"2021-12-16T09:31:59.843+02:00"}
{"Id":489071,"Number":46,"KnessetNum":4,"Name":"ישיבת מליאה בתאריך 08/02/1960 בשעה 16:02","StartDate":"1960-02-08T16:02:00+02:00","FinishDate":"1960-02-08T18:17:00+02:00","IsSpecialMeeting":null,"LastUpdatedDate":"2021-12-16T11:45:32.043+02:00"}
{"Id":489072,"Number":47,"KnessetNum":4,"Name":"ישיבת מליאה בתאריך 08/02/1960 בשעה 20:05","StartDate":"1960-02-08T20:05:00+02:00","FinishDate":"1960-02-08T21:04:00+02:00","IsSpecialMeeting":null,"LastUpdatedDate":"2021-12-16T12:02:43.437+02:00"}
{"Id":489073,"Number":48,"KnessetNum":4,"Name":"ישיבת מליאה בתאריך 09/02/1960 בשעה 16:01","StartDate":"1960-02-09T16:01:00+02:00","FinishDate":"1960-02-09T19:25:00+02:00","IsSpecialMeeting":null,"LastUpdatedDate":"2021-12-16T12:06:16.223+02:00"}
{"Id":489074,"Number":52,"KnessetNum":4,"Name":"ישיבת מליאה בתאריך 16/02/1960 בשעה 16:05","StartDate":"1960-02-16T16:05:00+02:00","FinishDate":"1960-02-16T18:55:00+02:00","IsSpecialMeeting":null,"LastUpdatedDate":"2021-12-20T07:26:53.24+02:00"}
{"Id":489075,"Number":53,"KnessetNum":4,"Name":"ישיבת מליאה בתאריך 16/02/1960 בשעה 20:08","StartDate":"1960-02-16T20:08:00+02:00","FinishDate":"1960-02-16T21:03:00+02:00","IsSpecialMeeting":null,"LastUpdatedDate":"2021-12-20T08:00:14.65+02:00"}
{"Id":489076,"Number":55,"KnessetNum":4,"Name":"ישיבת מליאה בתאריך 22/02/1960 בשעה 16:03","StartDate":"1960-02-22T16:03:00+02:00","FinishDate":"1960-02-22T18:55:00+02:00","IsSpecialMeeting":null,"LastUpdatedDate":"2021-12-20T08:07:09.64+02:00"}
{"Id":489077,"Number":57,"KnessetNum":4,"Name":"ישיבת מליאה בתאריך 23/02/1960 בשעה 16:00","StartDate":"1960-02-23T16:00:00+02:00","FinishDate":"1960-02-23T18:50:00+02:00","IsSpecialMeeting":null,"LastUpdatedDate":"2021-12-20T09:02:14.187+02:00"}
{"Id":489078,"Number":60,"KnessetNum":4,"Name":"ישיבת מליאה בתאריך 29/02/1960 בשעה 16:03","StartDate":"1960-02-29T16:03:00+02:00","FinishDate":"1960-02-29T19:00:00+02:00","IsSpecialMeeting":null,"LastUpdatedDate":"2021-12-20T10:02:10.557+02:00"}
{"Id":489079,"Number":67,"KnessetNum":4,"Name":"ישיבת מליאה בתאריך 08/03/1960 בשעה 16:00","StartDate":"1960-03-08T16:00:00+02:00","FinishDate":"1960-03-08T19:05:00+02:00","IsSpecialMeeting":null,"LastUpdatedDate":"2023-10-30T11:32:33.13+02:00"}
{"Id":489080,"Number":68,"KnessetNum":4,"Name":"ישיבת מליאה בתאריך 08/03/1960 בשעה 20:19","StartDate":"1960-03-08T20:19:00+02:00","FinishDate":"1960-03-08T21:15:00+02:00","IsSpecialMeeting":null,"LastUpdatedDate":"2023-07-10T16:56:40.017+03:00"}
{"Id":489081,"Number":71,"KnessetNum":4,"Name":"ישיבת מליאה בתאריך 15/03/1960 בשעה 20:05","StartDate":"1960-03-15T20:05:00+02:00","FinishDate":"1960-03-15T22:50:00+02:00","IsSpecialMeeting":null,"LastUpdatedDate":"2021-12-20T12:46:09.657+02:00"}
{"Id":489082,"Number":79,"KnessetNum":4,"Name":"ישיבת מליאה בתאריך 28/03/1960 בשעה 20:00","StartDate":"1960-03-28T20:00:00+02:00","FinishDate":"1960-03-28T21:50:00+02:00","IsSpecialMeeting":null,"LastUpdatedDate":"2021-12-20T16:03:36.45+02:00"}
{"Id":489083,"Number":81,"KnessetNum":4,"Name":"ישיבת מליאה בתאריך 29/03/1960 בשעה 20:03","StartDate":"1960-03-29T20:03:00+02:00","FinishDate":"1960-03-29T20:15:00+02:00","IsSpecialMeeting":null,"LastUpdatedDate":"2021-12-20T16:20:28.037+02:00"}
{"Id":489084,"Number":83,"KnessetNum":4,"Name":"ישיבת מליאה בתאריך 04/04/1960 בשעה 16:04","StartDate":"1960-04-04T16:04:00+02:00","FinishDate":"1960-04-04T18:55:00+02:00","IsSpecialMeeting":null,"LastUpdatedDate":"2023-07-16T15:48:03.98+03:00"}
{"Id":489085,"Number":84,"KnessetNum":4,"Name":"ישיבת מליאה בתאריך 04/04/1960 בשעה 20:05","StartDate":"1960-04-04T20:05:00+02:00","FinishDate":"1960-04-04T20:44:00+02:00","IsSpecialMeeting":null,"LastUpdatedDate":"2021-12-20T17:16:03.193+02:00"}
{"Id":489086,"Number":87,"KnessetNum":4,"Name":"ישיבת מליאה בתאריך 06/04/1960 בשעה 11:03","StartDate":"1960-04-06T11:03:00+03:00","FinishDate":"1960-04-06T12:30:00+03:00","IsSpecialMeeting":null,"LastUpdatedDate":"2021-12-20T17:56:27.927+02:00"}
{"Id":489087,"Number":88,"KnessetNum":4,"Name":"ישיבת מליאה בתאריך 06/04/1960 בשעה 13:07","StartDate":"1960-04-06T13:07:00+03:00","FinishDate":"1960-04-06T14:15:00+03:00","IsSpecialMeeting":null,"LastUpdatedDate":"2021-12-21T07:42:54.637+02:00"}
{"Id":489088,"Number":110,"KnessetNum":4,"Name":"ישיבת מליאה בתאריך 13/06/1960 בשעה 16:00","StartDate":"1960-06-13T16:00:00+03:00","FinishDate":"1960-06-13T19:02:00+03:00","IsSpecialMeeting":null,"LastUpdatedDate":"2021-12-21T14:53:39.74+02:00"}
{"Id":489089,"Number":120,"KnessetNum":4,"Name":"ישיבת מליאה בתאריך 22/06/1960 בשעה 14:15","StartDate":"1960-06-22T14:15:00+03:00","FinishDate":"1960-06-22T16:48:00+03:00","IsSpecialMeeting":null,"LastUpdatedDate":"2023-07-16T14:28:21.5+03:00"}
{"Id":489090,"Number":122,"KnessetNum":4,"Name":"ישיבת מליאה בתאריך 27/06/1960 בשעה 20:00","StartDate":"1960-06-27T20:00:00+03:00","FinishDate":"1960-06-27T22:00:00+03:00","IsSpecialMeeting":null,"LastUpdatedDate":"2022-01-20T10:01:27.687+02:00"}
{"Id":489091,"Number":124,"KnessetNum":4,"Name":"ישיבת מליאה בתאריך 28/06/1960 בשעה 20:00","StartDate":"1960-06-28T20:00:00+03:00","FinishDate":"1960-06-28T22:17:00+03:00","IsSpecialMeeting":null,"LastUpdatedDate":"2021-12-22T11:25:28.35+02:00"}
{"Id":489092,"Number":126,"KnessetNum":4,"Name":"ישיבת מליאה בתאריך 04/07/1960 בשעה 16:05","StartDate":"1960-07-04T16:05:00+03:00","FinishDate":"1960-07-04T18:30:00+03:00","IsSpecialMeeting":null,"LastUpdatedDate":"2023-07-11T14:52:30.39+03:00"}
{"Id":489093,"Number":127,"KnessetNum":4,"Name":"ישיבת מליאה בתאריך 04/07/1960 בשעה 20:08","StartDate":"1960-07-04T20:08:00+03:00","FinishDate":"1960-07-04T21:10:00+03:00","IsSpecialMeeting":null,"LastUpdatedDate":"2021-12-22T12:32:49.073+02:00"}
{"Id":489094,"Number":128,"KnessetNum":4,"Name":"ישיבת מליאה בתאריך 05/07/1960 בשעה 16:00","StartDate":"1960-07-05T16:00:00+03:00","FinishDate":"1960-07-05T18:58:00+03:00","IsSpecialMeeting":null,"LastUpdatedDate":"2021-12-22T12:49:21.61+02:00"}
{"Id":489095,"Number":129,"KnessetNum":4,"Name":"ישיבת מליאה בתאריך 05/07/1960 בשעה 20:05","StartDate":"1960-07-05T20:05:00+03:00","FinishDate":"1960-07-05T21:10:00+03:00","IsSpecialMeeting":null,"LastUpdatedDate":"2021-12-22T13:01:30.737+02:00"}
{"Id":489096,"Number":131,"KnessetNum":4,"Name":"ישיבת מליאה בתאריך 11/07/1960 בשעה 16:00","StartDate":"1960-07-11T16:00:00+03:00","FinishDate":"1960-07-11T18:58:00+03:00","IsSpecialMeeting":null,"LastUpdatedDate":"2021-12-22T14:26:27.187+02:00"}
{"Id":489097,"Number":136,"KnessetNum":4,"Name":"ישיבת מליאה בתאריך 18/07/1960 בשעה 16:00","StartDate":"1960-07-18T16:00:00+03:00","FinishDate":"1960-07-18T19:00:00+03:00","IsSpecialMeeting":null,"LastUpdatedDate":"2021-12-23T07:54:50.543+02:00"}
{"Id":489098,"Number":138,"KnessetNum":4,"Name":"ישיבת מליאה בתאריך 19/07/1960 בשעה 16:05","StartDate":"1960-07-19T16:05:00+03:00","FinishDate":"1960-07-19T19:00:00+03:00","IsSpecialMeeting":null,"LastUpdatedDate":"2021-12-23T08:11:15.783+02:00"}
{"Id":489099,"Number":139,"KnessetNum":4,"Name":"ישיבת מליאה בתאריך 19/07/1960 בשעה 20:00","StartDate":"1960-07-19T20:00:00+03:00","FinishDate":"1960-07-19T21:49:00+03:00","IsSpecialMeeting":null,"LastUpdatedDate":"2021-12-23T08:38:07.157+02:00"}
{"Id":489100,"Number":141,"KnessetNum":4,"Name":"ישיבת מליאה בתאריך 25/07/1960 בשעה 16:01","StartDate":"1960-07-25T16:01:00+03:00","FinishDate":"1960-07-25T19:00:00+03:00","IsSpecialMeeting":null,"LastUpdatedDate":"2021-12-23T08:55:45.27+02:00"}
{"Id":489101,"Number":142,"KnessetNum":4,"Name":"ישיבת מליאה בתאריך 25/07/1960 בשעה 20:05","StartDate":"1960-07-25T20:05:00+03:00","FinishDate":"1960-07-25T22:05:00+03:00","IsSpecialMeeting":null,"LastUpdatedDate":"2021-12-23T09:29:09.87+02:00"}
{"Id":489102,"Number":148,"KnessetNum":4,"Name":"ישיבת מליאה בתאריך 04/08/1960 בשעה 11:03","StartDate":"1960-08-04T11:03:00+03:00","FinishDate":"1960-08-04T12:50:00+03:00","IsSpecialMeeting":null,"LastUpdatedDate":"2021-12-23T12:10:04.043+02:00"}
{"Id":489103,"Number":150,"KnessetNum":4,"Name":"ישיבת מליאה בתאריך 08/08/1960 בשעה 15:58","StartDate":"1960-08-08T15:58:00+03:00","FinishDate":"1960-08-08T19:15:00+03:00","IsSpecialMeeting":null,"LastUpdatedDate":"2023-07-11T17:55:57.817+03:00"}
{"Id":489104,"Number":151,"KnessetNum":4,"Name":"ישיבת מליאה בתאריך 08/08/1960 בשעה 20:23","StartDate":"1960-08-08T20:23:00+03:00","FinishDate":"1960-08-08T21:26:00+03:00","IsSpecialMeeting":null,"LastUpdatedDate":"2021-12-26T10:02:20.71+02:00"}
{"Id":489105,"Number":152,"KnessetNum":4,"Name":"ישיבת מליאה בתאריך 09/08/1960 בשעה 16:01","StartDate":"1960-08-09T16:01:00+03:00","FinishDate":"1960-08-09T19:45:00+03:00","IsSpecialMeeting":null,"LastUpdatedDate":"2021-12-26T10:03:51.537+02:00"}
{"Id":489106,"Number":153,"KnessetNum":4,"Name":"ישיבת מליאה בתאריך 09/08/1960 בשעה 20:51","StartDate":"1960-08-09T20:51:00+03:00","FinishDate":"1960-08-09T21:50:00+03:00","IsSpecialMeeting":null,"LastUpdatedDate":"2023-07-12T09:18:28.877+03:00"}
{"Id":489107,"Number":162,"KnessetNum":4,"Name":"ישיבת מליאה בתאריך 31/10/1960 בשעה 20:00","StartDate":"1960-10-31T20:00:00+02:00","FinishDate":"1960-10-31T21:52:00+02:00","IsSpecialMeeting":null,"LastUpdatedDate":"2021-12-26T12:16:19.23+02:00"}
{"Id":489108,"Number":166,"KnessetNum":4,"Name":"ישיבת מליאה בתאריך 07/11/1960 בשעה 16:01","StartDate":"1960-11-07T16:01:00+02:00","FinishDate":"1960-11-07T18:47:00+02:00","IsSpecialMeeting":null,"LastUpdatedDate":"2023-07-12T11:25:56.1+03:00"}
{"Id":489109,"Number":167,"KnessetNum":4,"Name":"ישיבת מליאה בתאריך 07/11/1960 בשעה 20:00","StartDate":"1960-11-07T20:00:00+02:00","FinishDate":"1960-11-07T21:00:00+02:00","IsSpecialMeeting":null,"LastUpdatedDate":"2021-12-26T13:56:32.507+02:00"}
{"Id":489110,"Number":168,"KnessetNum":4,"Name":"ישיבת מליאה בתאריך 08/11/1960 בשעה 16:00","StartDate":"1960-11-08T16:00:00+02:00","FinishDate":"1960-11-08T18:45:00+02:00","IsSpecialMeeting":null,"LastUpdatedDate":"2021-12-27T07:37:31.41+02:00"}
{"Id":489111,"Number":169,"KnessetNum":4,"Name":"ישיבת מליאה בתאריך 08/11/1960 בשעה 20:00","StartDate":"1960-11-08T20:00:00+02:00","FinishDate":"1960-11-08T21:35:00+02:00","IsSpecialMeeting":null,"LastUpdatedDate":"2023-07-16T16:05:26.213+03:00"}
{"Id":489112,"Number":171,"KnessetNum":4,"Name":"ישיבת מליאה בתאריך 14/11/1960 בשעה 16:02","StartDate":"1960-11-14T16:02:00+02:00","FinishDate":"1960-11-14T18:50:00+02:00","IsSpecialMeeting":null,"LastUpdatedDate":"2023-07-12T11:54:22.923+03:00"}
{"Id":489113,"Number":173,"KnessetNum":4,"Name":"ישיבת מליאה בתאריך 15/11/1960 בשעה 16:00","StartDate":"1960-11-15T16:00:00+02:00","FinishDate":"1960-11-15T18:45:00+02:00","IsSpecialMeeting":null,"LastUpdatedDate":"2024-02-22T14:46:44.207+02:00"}
{"Id":489114,"Number":174,"KnessetNum":4,"Name":"ישיבת מליאה בתאריך 15/11/1960 בשעה 20:00","StartDate":"1960-11-15T20:00:00+02:00","FinishDate":"1960-11-15T21:30:00+02:00","IsSpecialMeeting":null,"LastUpdatedDate":"2021-12-27T11:00:39.383+02:00"}
{"Id":489115,"Number":176,"KnessetNum":4,"Name":"ישיבת מליאה בתאריך 21/11/1960 בשעה 16:00","StartDate":"1960-11-21T16:00:00+02:00","FinishDate":"1960-11-21T18:45:00+02:00","IsSpecialMeeting":null,"LastUpdatedDate":"2021-12-27T13:01:10.367+02:00"}
{"Id":489116,"Number":177,"KnessetNum":4,"Name":"ישיבת מליאה בתאריך 21/11/1960 בשעה 20:00","StartDate":"1960-11-21T20:00:00+02:00","FinishDate":"1960-11-21T21:38:00+02:00","IsSpecialMeeting":null,"LastUpdatedDate":"2021-12-27T13:19:07.27+02:00"}
{"Id":489117,"Number":178,"KnessetNum":4,"Name":"ישיבת מליאה בתאריך 22/11/1960 בשעה 16:03","StartDate":"1960-11-22T16:03:00+02:00","FinishDate":"1960-11-22T19:00:00+02:00","IsSpecialMeeting":null,"LastUpdatedDate":"2021-12-27T14:14:55.573+02:00"}
{"Id":489118,"Number":181,"KnessetNum":4,"Name":"ישיבת מליאה בתאריך 28/11/1960 בשעה 16:02","StartDate":"1960-11-28T16:02:00+02:00","FinishDate":"1960-11-28T18:18:00+02:00","IsSpecialMeeting":null,"LastUpdatedDate":"2021-12-27T14:53:19.42+02:00"}
{"Id":489119,"Number":182,"KnessetNum":4,"Name":"ישיבת מליאה בתאריך 28/11/1960 בשעה 20:00","StartDate":"1960-11-28T20:00:00+02:00","FinishDate":"1960-11-28T21:16:00+02:00","IsSpecialMeeting":null,"LastUpdatedDate":"2021-12-27T15:18:28.76+02:00"}
{"Id":489120,"Number":183,"KnessetNum":4,"Name":"ישיבת מליאה בתאריך 29/11/1960 בשעה 16:00","StartDate":"1960-11-29T16:00:00+02:00","FinishDate":"1960-11-29T18:27:00+02:00","IsSpecialMeeting":null,"LastUpdatedDate":"2021-12-27T15:55:17.003+02:00"}
{"Id":489121,"Number":184,"KnessetNum":4,"Name":"ישיבת מליאה בתאריך 29/11/1960 בשעה 20:02","StartDate":"1960-11-29T20:02:00+02:00","FinishDate":"1960-11-29T20:55:00+02:00","IsSpecialMeeting":null,"LastUpdatedDate":"2021-12-27T15:59:59.833+02:00"}
{"Id":489122,"Number":187,"KnessetNum":4,"Name":"ישיבת מליאה בתאריך 05/12/1960 בשעה 20:00","StartDate":"1960-12-05T20:00:00+02:00","FinishDate":"1960-12-05T21:30:00+02:00","IsSpecialMeeting":null,"LastUpdatedDate":"2021-12-27T17:13:08.427+02:00"}
{"Id":489123,"Number":192,"KnessetNum":4,"Name":"ישיבת מליאה בתאריך 12/12/1960 בשעה 20:03","StartDate":"1960-12-12T20:03:00+02:00","FinishDate":"1960-12-12T21:17:00+02:00","IsSpecialMeeting":null,"LastUpdatedDate":"2021-12-28T07:52:35.547+02:00"}
{"Id":489124,"Number":200,"KnessetNum":4,"Name":"ישיבת מליאה בתאריך 26/12/1960 בשעה 17:20","StartDate":"1960-12-26T17:20:00+02:00","FinishDate":"1960-12-26T18:00:00+02:00","IsSpecialMeeting":null,"LastUpdatedDate":"2021-12-28T10:59:06.963+02:00"}
{"Id":489125,"Number":203,"KnessetNum":4,"Name":"ישיבת מליאה בתאריך 02/01/1961 בשעה 16:00","StartDate":"1961-01-02T16:00:00+02:00","FinishDate":"1961-01-02T19:13:00+02:00","IsSpecialMeeting":null,"LastUpdatedDate":"2021-12-28T12:03:30.063+02:00"}
{"Id":489126,"Number":215,"KnessetNum":4,"Name":"ישיבת מליאה בתאריך 23/01/1961 בשעה 16:06","StartDate":"1961-01-23T16:06:00+02:00","FinishDate":"1961-01-23T18:56:00+02:00","IsSpecialMeeting":null,"LastUpdatedDate":"2021-12-29T08:27:33.273+02:00"}
{"Id":489127,"Number":217,"KnessetNum":4,"Name":"ישיבת מליאה בתאריך 24/01/1961 בשעה 16:01","StartDate":"1961-01-24T16:01:00+02:00","FinishDate":"1961-01-24T19:00:00+02:00","IsSpecialMeeting":null,"LastUpdatedDate":"2021-12-29T08:51:19.353+02:00"}
{"Id":489128,"Number":218,"KnessetNum":4,"Name":"ישיבת מליאה בתאריך 24/01/1961 בשעה 20:00","StartDate":"1961-01-24T20:00:00+02:00","FinishDate":"1961-01-24T21:23:00+02:00","IsSpecialMeeting":null,"LastUpdatedDate":"2021-12-29T09:12:52.64+02:00"}
{"Id":489129,"Number":225,"KnessetNum":4,"Name":"ישיבת מליאה בתאריך 06/02/1961 בשעה 20:05","StartDate":"1961-02-06T20:05:00+02:00","FinishDate":"1961-02-06T21:46:00+02:00","IsSpecialMeeting":null,"LastUpdatedDate":"2021-12-29T10:57:11.21+02:00"}
{"Id":489130,"Number":227,"KnessetNum":4,"Name":"ישיבת מליאה בתאריך 07/02/1961 בשעה 20:00","StartDate":"1961-02-07T20:00:00+02:00","FinishDate":"1961-02-07T22:10:00+02:00","IsSpecialMeeting":null,"LastUpdatedDate":"2021-12-29T11:12:22.793+02:00"}
{"Id":489131,"Number":229,"KnessetNum":4,"Name":"ישיבת מליאה בתאריך 13/02/1961 בשעה 16:01","StartDate":"1961-02-13T16:01:00+02:00","FinishDate":"1961-02-13T18:58:00+02:00","IsSpecialMeeting":null,"LastUpdatedDate":"2021-12-29T12:13:56.313+02:00"}
{"Id":489132,"Number":230,"KnessetNum":4,"Name":"ישיבת מליאה בתאריך 13/02/1961 בשעה 20:00","StartDate":"1961-02-13T20:00:00+02:00","FinishDate":"1961-02-13T21:03:00+02:00","IsSpecialMeeting":null,"LastUpdatedDate":"2021-12-29T12:17:19.227+02:00"}
{"Id":489133,"Number":231,"KnessetNum":4,"Name":"ישיבת מליאה בתאריך 14/02/1961 בשעה 16:01","StartDate":"1961-02-14T16:01:00+02:00","FinishDate":"1961-02-14T18:57:00+02:00","IsSpecialMeeting":null,"LastUpdatedDate":"2021-12-29T12:43:18.443+02:00"}
{"Id":489134,"Number":232,"KnessetNum":4,"Name":"ישיבת מליאה בתאריך 14/02/1961 בשעה 20:01","StartDate":"1961-02-14T20:01:00+02:00","FinishDate":"1961-02-14T21:11:00+02:00","IsSpecialMeeting":null,"LastUpdatedDate":"2021-12-29T12:53:29.713+02:00"}
{"Id":489135,"Number":234,"KnessetNum":4,"Name":"ישיבת מליאה בתאריך 20/02/1961 בשעה 16:06","StartDate":"1961-02-20T16:06:00+02:00","FinishDate":"1961-02-20T18:57:00+02:00","IsSpecialMeeting":null,"LastUpdatedDate":"2021-12-29T13:33:40.503+02:00"}
{"Id":489136,"Number":235,"KnessetNum":4,"Name":"ישיבת מליאה בתאריך 20/02/1961 בשעה 20:06","StartDate":"1961-02-20T20:06:00+02:00","FinishDate":"1961-02-20T20:37:00+02:00","IsSpecialMeeting":null,"LastUpdatedDate":"2021-12-29T14:14:15.08+02:00"}
{"Id":489137,"Number":236,"KnessetNum":4,"Name":"ישיבת מליאה בתאריך 21/02/1961 בשעה 16:01","StartDate":"1961-02-21T16:01:00+02:00","FinishDate":"1961-02-21T19:27:00+02:00","IsSpecialMeeting":null,"LastUpdatedDate":"2021-12-29T14:37:44.55+02:00"}
{"Id":489138,"Number":239,"KnessetNum":4,"Name":"ישיבת מליאה בתאריך 27/02/1961 בשעה 16:03","StartDate":"1961-02-27T16:03:00+02:00","FinishDate":"1961-02-27T19:04:00+02:00","IsSpecialMeeting":null,"LastUpdatedDate":"2022-01-10T13:38:36.67+02:00"}
{"Id":489139,"Number":242,"KnessetNum":4,"Name":"ישיבת מליאה בתאריך 28/02/1961 בשעה 20:02","StartDate":"1961-02-28T20:02:00+02:00","FinishDate":"1961-02-28T21:53:00+02:00","IsSpecialMeeting":null,"LastUpdatedDate":"2022-01-10T14:33:35.137+02:00"}
{"Id":489140,"Number":249,"KnessetNum":4,"Name":"ישיבת מליאה בתאריך 13/03/1961 בשעה 16:03","StartDate":"1961-03-13T16:03:00+02:00","FinishDate":"1961-03-13T18:55:00+02:00","IsSpecialMeeting":null,"LastUpdatedDate":"2023-07-30T10:53:01.093+03:00"}
{"Id":489141,"Number":250,"KnessetNum":4,"Name":"ישיבת מליאה בתאריך 13/03/1961 בשעה 20:01","StartDate":"1961-03-13T20:01:00+02:00","FinishDate":"1961-03-13T20:01:00+02:00","IsSpecialMeeting":null,"LastUpdatedDate":"2022-01-20T14:10:16.397+02:00"}
{"Id":489142,"Number":255,"KnessetNum":4,"Name":"ישיבת מליאה בתאריך 20/03/1961 בשעה 20:02","StartDate":"1961-03-20T20:02:00+02:00","FinishDate":"1961-03-20T23:00:00+02:00","IsSpecialMeeting":null,"LastUpdatedDate":"2022-01-11T09:33:12.037+02:00"}
{"Id":489143,"Number":257,"KnessetNum":4,"Name":"ישיבת מליאה בתאריך 21/03/1961 בשעה 20:15","StartDate":"1961-03-21T20:15:00+02:00","FinishDate":"1961-03-21T22:50:00+02:00","IsSpecialMeeting":null,"LastUpdatedDate":"2022-01-11T10:05:30.49+02:00"}
{"Id":489144,"Number":260,"KnessetNum":4,"Name":"ישיבת מליאה בתאריך 23/03/1961 בשעה 11:05","StartDate":"1961-03-23T11:05:00+02:00","FinishDate":"1961-03-23T13:30:00+02:00","IsSpecialMeeting":null,"LastUpdatedDate":"2022-01-20T14:14:50.313+02:00"}
{"Id":489145,"Number":264,"KnessetNum":4,"Name":"ישיבת מליאה בתאריך 28/03/1961 בשעה 11:12","StartDate":"1961-03-28T11:12:00+02:00","FinishDate":"1961-03-28T12:45:00+02:00","IsSpecialMeeting":null,"LastUpdatedDate":"2022-01-11T14:04:09.123+02:00"}
{"Id":489146,"Number":265,"KnessetNum":4,"Name":"ישיבת מליאה בתאריך 28/03/1961 בשעה 14:53","StartDate":"1961-03-28T14:53:00+02:00","FinishDate":null,"IsSpecialMeeting":null,"LastUpdatedDate":"2022-01-11T14:17:24.6+02:00"}
{"Id":489147,"Number":267,"KnessetNum":4,"Name":"ישיבת מליאה בתאריך 09/05/1961 בשעה 16:01","StartDate":"1961-05-09T16:01:00+03:00","FinishDate":"1961-05-09T19:05:00+03:00","IsSpecialMeeting":null,"LastUpdatedDate":"2023-10-26T13:44:43.98+03:00"}
{"Id":489148,"Number":268,"KnessetNum":4,"Name":"ישיבת מליאה בתאריך 09/05/1961 בשעה 20:14","StartDate":"1961-05-09T20:14:00+03:00","FinishDate":"1961-05-09T21:05:00+03:00","IsSpecialMeeting":null,"LastUpdatedDate":"2023-10-31T17:17:22.63+02:00"}
{"Id":489149,"Number":272,"KnessetNum":4,"Name":"ישיבת מליאה בתאריך 16/05/1961 בשעה 16:05","StartDate":"1961-05-16T16:05:00+03:00","FinishDate":"1961-05-16T18:50:00+03:00","IsSpecialMeeting":null,"LastUpdatedDate":"2022-01-13T13:18:25.967+02:00"}
{"Id":489150,"Number":273,"KnessetNum":4,"Name":"ישיבת מליאה בתאריך 16/05/1961 בשעה 20:09","StartDate":"1961-05-16T20:09:00+03:00","FinishDate":"1961-05-16T21:49:00+03:00","IsSpecialMeeting":null,"LastUpdatedDate":"2023-10-29T12:30:09.573+02:00"}
{"Id":489151,"Number":275,"KnessetNum":4,"Name":"ישיבת מליאה בתאריך 22/05/1961 בשעה 16:03","StartDate":"1961-05-22T16:03:00+03:00","FinishDate":"1961-05-22T19:05:00+03:00","IsSpecialMeeting":null,"LastUpdatedDate":"2022-01-16T09:16:57.06+02:00"}
{"Id":489152,"Number":276,"KnessetNum":4,"Name":"ישיבת מליאה בתאריך 22/05/1961 בשעה 20:03","StartDate":"1961-05-22T20:03:00+03:00","FinishDate":"1961-05-22T21:38:00+03:00","IsSpecialMeeting":null,"LastUpdatedDate":"2022-01-16T09:33:11.383+02:00"}
{"Id":489153,"Number":279,"KnessetNum":4,"Name":"ישיבת מליאה בתאריך 30/05/1961 בשעה 16:00","StartDate":"1961-05-30T16:00:00+03:00","FinishDate":"1961-05-30T18:34:00+03:00","IsSpecialMeeting":null,"LastUpdatedDate":"2022-01-16T10:49:30.17+02:00"}
{"Id":489154,"Number":282,"KnessetNum":4,"Name":"ישיבת מליאה בתאריך 05/06/1961 בשעה 16:05","StartDate":"1961-06-05T16:05:00+03:00","FinishDate":"1961-06-05T18:45:00+03:00","IsSpecialMeeting":null,"LastUpdatedDate":"2022-01-03T19:24:53.127+02:00"}
{"Id":489155,"Number":283,"KnessetNum":4,"Name":"ישיבת מליאה בתאריך 05/06/1961 בשעה 20:02","StartDate":"1961-06-05T20:02:00+03:00","FinishDate":"1961-06-05T20:31:00+03:00","IsSpecialMeeting":null,"LastUpdatedDate":"2023-07-17T17:17:39.383+03:00"}
{"Id":489156,"Number":284,"KnessetNum":4,"Name":"ישיבת מליאה בתאריך 06/06/1961 בשעה 16:02","StartDate":"1961-06-06T16:02:00+03:00","FinishDate":"1961-06-06T18:38:00+03:00","IsSpecialMeeting":null,"LastUpdatedDate":"2022-01-16T12:55:23.95+02:00"}
{"Id":489157,"Number":289,"KnessetNum":4,"Name":"ישיבת מליאה בתאריך 13/06/1961 בשעה 16:00","StartDate":"1961-06-13T16:00:00+03:00","FinishDate":"1961-06-13T18:51:00+03:00","IsSpecialMeeting":null,"LastUpdatedDate":"2022-01-17T10:04:22.663+02:00"}
{"Id":489158,"Number":290,"KnessetNum":4,"Name":"ישיבת מליאה בתאריך 13/06/1961 בשעה 20:03","StartDate":"1961-06-13T20:03:00+03:00","FinishDate":"1961-06-13T21:15:00+03:00","IsSpecialMeeting":null,"LastUpdatedDate":"2022-01-17T10:20:22.32+02:00"}
{"Id":489159,"Number":5,"KnessetNum":5,"Name":"ישיבת מליאה בתאריך 10/10/1961 בשעה 16:04","StartDate":"1961-10-10T16:04:00+02:00","FinishDate":"1961-10-10T18:55:00+02:00","IsSpecialMeeting":null,"LastUpdatedDate":"2022-01-17T13:24:09.257+02:00"}
{"Id":489160,"Number":6,"KnessetNum":5,"Name":"ישיבת מליאה בתאריך 10/10/1961 בשעה 20:00","StartDate":"1961-10-10T20:00:00+02:00","FinishDate":"1961-10-10T22:00:00+02:00","IsSpecialMeeting":null,"LastUpdatedDate":"2022-01-17T13:51:52.34+02:00"}
{"Id":489161,"Number":8,"KnessetNum":5,"Name":"ישיבת מליאה בתאריך 16/10/1961 בשעה 16:03","StartDate":"1961-10-16T16:03:00+02:00","FinishDate":"1961-10-16T18:53:00+02:00","IsSpecialMeeting":null,"LastUpdatedDate":"2022-01-17T14:24:12.783+02:00"}
{"Id":489162,"Number":12,"KnessetNum":5,"Name":"ישיבת מליאה בתאריך 23/10/1961 בשעה 16:04","StartDate":"1961-10-23T16:04:00+02:00","FinishDate":"1961-10-23T18:07:00+02:00","IsSpecialMeeting":null,"LastUpdatedDate":"2023-11-02T08:48:17.44+02:00"}
{"Id":489163,"Number":24,"KnessetNum":5,"Name":"ישיבת מליאה בתאריך 13/11/1961 בשעה 16:00","StartDate":"1961-11-13T16:00:00+02:00","FinishDate":"1961-11-13T19:00:00+02:00","IsSpecialMeeting":null,"LastUpdatedDate":"2022-01-18T08:16:34.993+02:00"}
{"Id":489164,"Number":27,"KnessetNum":5,"Name":"ישיבת מליאה בתאריך 14/11/1961 בשעה 20:00","StartDate":"1961-11-14T20:00:00+02:00","FinishDate":"1961-11-14T21:35:00+02:00","IsSpecialMeeting":null,"LastUpdatedDate":"2022-01-18T08:50:46.653+02:00"}
{"Id":489165,"Number":30,"KnessetNum":5,"Name":"ישיבת מליאה בתאריך 20/11/1961 בשעה 20:17","StartDate":"1961-11-20T20:17:00+02:00","FinishDate":"1961-11-20T21:05:00+02:00","IsSpecialMeeting":null,"LastUpdatedDate":"2022-01-18T11:19:42.12+02:00"}
{"Id":489166,"Number":36,"KnessetNum":5,"Name":"ישיבת מליאה בתאריך 28/11/1961 בשעה 16:00","StartDate":"1961-11-28T16:00:00+02:00","FinishDate":"1961-11-28T18:47:00+02:00","IsSpecialMeeting":null,"LastUpdatedDate":"2022-01-18T12:43:01.607+02:00"}
{"Id":489167,"Number":37,"KnessetNum":5,"Name":"ישיבת מליאה בתאריך 28/11/1961 בשעה 20:03","StartDate":"1961-11-28T20:03:00+02:00","FinishDate":"1961-11-28T20:28:00+02:00","IsSpecialMeeting":null,"LastUpdatedDate":"2022-01-18T12:54:32.237+02:00"}
{"Id":489168,"Number":39,"KnessetNum":5,"Name":"ישיבת מליאה בתאריך 04/12/1961 בשעה 16:33","StartDate":"1961-12-04T16:33:00+02:00","FinishDate":"1961-12-04T19:15:00+02:00","IsSpecialMeeting":null,"LastUpdatedDate":"2022-01-18T14:54:04.797+02:00"}
{"Id":489169,"Number":44,"KnessetNum":5,"Name":"ישיבת מליאה בתאריך 11/12/1961 בשעה 16:01","StartDate":"1961-12-11T16:01:00+02:00","FinishDate":"1961-12-11T19:09:00+02:00","IsSpecialMeeting":null,"LastUpdatedDate":"2022-01-23T16:17:03.917+02:00"}
{"Id":489170,"Number":45,"KnessetNum":5,"Name":"ישיבת מליאה בתאריך 11/12/1961 בשעה 20:08","StartDate":"1961-12-11T20:08:00+02:00","FinishDate":"1961-12-11T21:15:00+02:00","IsSpecialMeeting":null,"LastUpdatedDate":"2023-11-05T10:40:56.797+02:00"}
{"Id":489171,"Number":49,"KnessetNum":5,"Name":"ישיבת מליאה בתאריך 18/12/1961 בשעה 16:02","StartDate":"1961-12-18T16:02:00+02:00","FinishDate":"1961-12-18T19:12:00+02:00","IsSpecialMeeting":null,"LastUpdatedDate":"2022-01-19T09:32:03.523+02:00"}
{"Id":489172,"Number":51,"KnessetNum":5,"Name":"ישיבת מליאה בתאריך 19/12/1961 בשעה 16:00","StartDate":"1961-12-19T16:00:00+02:00","FinishDate":"1961-12-19T18:34:00+02:00","IsSpecialMeeting":null,"LastUpdatedDate":"2022-01-19T10:13:46.063+02:00"}
{"Id":489173,"Number":52,"KnessetNum":5,"Name":"ישיבת מליאה בתאריך 19/12/1961 בשעה 20:05","StartDate":"1961-12-19T20:05:00+02:00","FinishDate":"1961-12-19T21:52:00+02:00","IsSpecialMeeting":null,"LastUpdatedDate":"2022-07-14T14:43:08.117+03:00"}
{"Id":489174,"Number":54,"KnessetNum":5,"Name":"ישיבת מליאה בתאריך 25/12/1961 בשעה 16:04","StartDate":"1961-12-25T16:04:00+02:00","FinishDate":"1961-12-25T18:45:00+02:00","IsSpecialMeeting":null,"LastUpdatedDate":"2022-01-19T12:37:52.337+02:00"}
{"Id":489175,"Number":55,"KnessetNum":5,"Name":"ישיבת מליאה בתאריך 25/12/1961 בשעה 20:02","StartDate":"1961-12-25T20:02:00+02:00","FinishDate":"1961-12-25T21:58:00+02:00","IsSpecialMeeting":null,"LastUpdatedDate":"2022-01-19T14:35:18.22+02:00"}
{"Id":489176,"Number":56,"KnessetNum":5,"Name":"ישיבת מליאה בתאריך 26/12/1961 בשעה 16:02","StartDate":"1961-12-26T16:02:00+02:00","FinishDate":"1961-12-26T18:58:00+02:00","IsSpecialMeeting":null,"LastUpdatedDate":"2022-01-20T08:30:19.543+02:00"}
{"Id":489177,"Number":57,"KnessetNum":5,"Name":"ישיבת מליאה בתאריך 26/12/1961 בשעה 20:03","StartDate":"1961-12-26T20:03:00+02:00","FinishDate":"1961-12-26T21:00:00+02:00","IsSpecialMeeting":null,"LastUpdatedDate":"2022-01-20T09:09:01.67+02:00"}
{"Id":489178,"Number":59,"KnessetNum":5,"Name":"ישיבת מליאה בתאריך 01/01/1962 בשעה 16:07","StartDate":"1962-01-01T16:07:00+02:00","FinishDate":"1962-01-01T18:24:00+02:00","IsSpecialMeeting":null,"LastUpdatedDate":"2022-01-20T10:05:28.033+02:00"}
{"Id":489179,"Number":64,"KnessetNum":5,"Name":"ישיבת מליאה בתאריך 08/01/1962 בשעה 16:02","StartDate":"1962-01-08T16:02:00+02:00","FinishDate":"1962-01-08T18:50:00+02:00","IsSpecialMeeting":null,"LastUpdatedDate":"2022-02-21T08:22:02.4+02:00"}
{"Id":489180,"Number":65,"KnessetNum":5,"Name":"ישיבת מליאה בתאריך 08/01/1962 בשעה 20:03","StartDate":"1962-01-08T20:03:00+02:00","FinishDate":"1962-01-08T20:34:00+02:00","IsSpecialMeeting":null,"LastUpdatedDate":"2022-01-24T09:56:40.843+02:00"}
{"Id":489181,"Number":69,"KnessetNum":5,"Name":"ישיבת מליאה בתאריך 15/01/1962 בשעה 16:02","StartDate":"1962-01-15T16:02:00+02:00","FinishDate":"1962-01-15T19:55:00+02:00","IsSpecialMeeting":null,"LastUpdatedDate":"2022-01-24T11:49:18.25+02:00"}
{"Id":489182,"Number":71,"KnessetNum":5,"Name":"ישיבת מליאה בתאריך 16/01/1962 בשעה 16:02","StartDate":"1962-01-16T16:02:00+02:00","FinishDate":"1962-01-16T18:10:00+02:00","IsSpecialMeeting":null,"LastUpdatedDate":"2022-01-24T13:39:14.033+02:00"}
{"Id":489183,"Number":72,"KnessetNum":5,"Name":"ישיבת מליאה בתאריך 16/01/1962 בשעה 19:58","StartDate":"1962-01-16T19:58:00+02:00","FinishDate":"1962-01-16T21:45:00+02:00","IsSpecialMeeting":null,"LastUpdatedDate":"2022-01-24T14:17:56.83+02:00"}
{"Id":489184,"Number":76,"KnessetNum":5,"Name":"ישיבת מליאה בתאריך 23/01/1962 בשעה 20:15","StartDate":"1962-01-23T20:15:00+02:00","FinishDate":"1962-01-23T21:55:00+02:00","IsSpecialMeeting":null,"LastUpdatedDate":"2022-01-24T16:01:57.923+02:00"}
{"Id":489185,"Number":79,"KnessetNum":5,"Name":"ישיבת מליאה בתאריך 29/01/1962 בשעה 20:00","StartDate":"1962-01-29T20:00:00+02:00","FinishDate":"1962-01-29T21:45:00+02:00","IsSpecialMeeting":null,"LastUpdatedDate":"2022-01-25T10:34:12.387+02:00"}
{"Id":489186,"Number":82,"KnessetNum":5,"Name":"ישיבת מליאה בתאריך 30/01/1962 בשעה 20:03","StartDate":"1962-01-30T20:03:00+02:00","FinishDate":"1962-01-30T21:30:00+02:00","IsSpecialMeeting":null,"LastUpdatedDate":"2022-01-25T13:03:29.64+02:00"}
{"Id":489187,"Number":84,"KnessetNum":5,"Name":"ישיבת מליאה בתאריך 05/02/1962 בשעה 16:07","StartDate":"1962-02-05T16:07:00+02:00","FinishDate":"1962-02-05T18:58:00+02:00","IsSpecialMeeting":null,"LastUpdatedDate":"2022-01-25T15:22:00.317+02:00"}
{"Id":489188,"Number":85,"KnessetNum":5,"Name":"ישיבת מליאה בתאריך 05/02/1962 בשעה 20:05","StartDate":"1962-02-05T20:05:00+02:00","FinishDate":"1962-02-05T21:08:00+02:00","IsSpecialMeeting":null,"LastUpdatedDate":"2022-01-25T15:56:10.037+02:00"}
{"Id":489189,"Number":87,"KnessetNum":5,"Name":"ישיבת מליאה בתאריך 06/02/1962 בשעה 20:04","StartDate":"1962-02-06T20:04:00+02:00","FinishDate":"1962-02-06T20:55:00+02:00","IsSpecialMeeting":null,"LastUpdatedDate":"2022-01-25T16:11:16.73+02:00"}
{"Id":489190,"Number":95,"KnessetNum":5,"Name":"ישיבת מליאה בתאריך 19/02/1962 בשעה 20:03","StartDate":"1962-02-19T20:03:00+02:00","FinishDate":"1962-02-19T22:03:00+02:00","IsSpecialMeeting":null,"LastUpdatedDate":"2022-07-14T17:57:59.747+03:00"}
{"Id":489191,"Number":96,"KnessetNum":5,"Name":"ישיבת מליאה בתאריך 20/02/1962 בשעה 16:09","StartDate":"1962-02-20T16:09:00+02:00","FinishDate":"1962-02-20T19:50:00+02:00","IsSpecialMeeting":null,"LastUpdatedDate":"2022-01-30T08:05:31.767+02:00"}
{"Id":489192,"Number":97,"KnessetNum":5,"Name":"ישיבת מליאה בתאריך 20/02/1962 בשעה 20:35","StartDate":"1962-02-20T20:35:00+02:00","FinishDate":"1962-02-20T21:40:00+02:00","IsSpecialMeeting":null,"LastUpdatedDate":"2022-01-30T08:26:10.88+02:00"}
{"Id":489193,"Number":101,"KnessetNum":5,"Name":"ישיבת מליאה בתאריך 27/02/1962 בשעה 16:05","StartDate":"1962-02-27T16:05:00+02:00","FinishDate":"1962-02-27T18:56:00+02:00","IsSpecialMeeting":null,"LastUpdatedDate":"2022-01-30T09:24:04.77+02:00"}
{"Id":489194,"Number":104,"KnessetNum":5,"Name":"ישיבת מליאה בתאריך 05/03/1962 בשעה 16:05","StartDate":"1962-03-05T16:05:00+02:00","FinishDate":"1962-03-05T18:45:00+02:00","IsSpecialMeeting":null,"LastUpdatedDate":"2022-01-30T11:06:00.273+02:00"}
{"Id":489195,"Number":106,"KnessetNum":5,"Name":"ישיבת מליאה בתאריך 06/03/1962 בשעה 16:03","StartDate":"1962-03-06T16:03:00+02:00","FinishDate":"1962-03-06T18:58:00+02:00","IsSpecialMeeting":null,"LastUpdatedDate":"2022-01-30T11:21:13.92+02:00"}
{"Id":489196,"Number":109,"KnessetNum":5,"Name":"ישיבת מליאה בתאריך 12/03/1962 בשעה 16:05","StartDate":"1962-03-12T16:05:00+02:00","FinishDate":"1962-03-12T19:20:00+02:00","IsSpecialMeeting":null,"LastUpdatedDate":"2022-01-30T12:56:32.073+02:00"}
{"Id":489197,"Number":119,"KnessetNum":5,"Name":"ישיבת מליאה בתאריך 02/04/1962 בשעה 16:05","StartDate":"1962-04-02T16:05:00+02:00","FinishDate":"1962-04-02T19:45:00+02:00","IsSpecialMeeting":null,"LastUpdatedDate":"2022-01-31T17:05:40.893+02:00"}
{"Id":489198,"Number":120,"KnessetNum":5,"Name":"ישיבת מליאה בתאריך 02/04/1962 בשעה 20:45","StartDate":"1962-04-02T20:45:00+02:00","FinishDate":"1962-04-02T22:15:00+02:00","IsSpecialMeeting":null,"LastUpdatedDate":"2022-01-31T17:27:00.49+02:00"}
{"Id":489199,"Number":124,"KnessetNum":5,"Name":"ישיבת מליאה בתאריך 09/04/1962 בשעה 16:05","StartDate":"1962-04-09T16:05:00+03:00","FinishDate":"1962-04-09T18:53:00+03:00","IsSpecialMeeting":null,"LastUpdatedDate":"2022-02-01T08:23:25.913+02:00"}
{"Id":489200,"Number":125,"KnessetNum":5,"Name":"ישיבת מליאה בתאריך 09/04/1962 בשעה 20:03","StartDate":"1962-04-09T20:03:00+03:00","FinishDate":"1962-04-09T22:37:00+03:00","IsSpecialMeeting":null,"LastUpdatedDate":"2022-02-01T09:53:56.233+02:00"}
{"Id":489201,"Number":175,"KnessetNum":5,"Name":"ישיבת מליאה בתאריך 05/11/1962 בשעה 17:32","StartDate":"1962-11-05T17:32:00+02:00","FinishDate":"1962-11-05T20:48:00+02:00","IsSpecialMeeting":null,"LastUpdatedDate":"2022-02-07T14:10:07.087+02:00"}
{"Id":489202,"Number":273,"KnessetNum":6,"Name":"ישיבת מליאה בתאריך 26/03/1968 בשעה 17:35","StartDate":"1968-03-26T17:35:00+02:00","FinishDate":"1968-03-26T20:23:00+02:00","IsSpecialMeeting":null,"LastUpdatedDate":"2022-10-06T12:47:42.943+03:00"}
{"Id":489203,"Number":277,"KnessetNum":6,"Name":"ישיבת מליאה בתאריך 06/05/1968 בשעה 17:36","StartDate":"1968-05-06T17:36:00+03:00","FinishDate":"1968-05-06T20:23:00+03:00","IsSpecialMeeting":null,"LastUpdatedDate":"2022-08-15T17:48:34.3+03:00"}
{"Id":489204,"Number":389,"KnessetNum":6,"Name":"ישיבת מליאה בתאריך 17/03/1969 בשעה 17:32","StartDate":"1969-03-17T17:32:00+02:00","FinishDate":"1969-03-17T21:09:00+02:00","IsSpecialMeeting":null,"LastUpdatedDate":"2019-12-23T13:12:30.95+02:00"}
{"Id":489205,"Number":107,"KnessetNum":7,"Name":"ישיבת מליאה בתאריך 15/09/1970 בשעה 19:30","StartDate":"1970-09-15T19:30:00+03:00","FinishDate":"1970-09-15T19:57:00+03:00","IsSpecialMeeting":null,"LastUpdatedDate":"2020-12-08T09:19:00.99+02:00"}
{"Id":489206,"Number":336,"KnessetNum":7,"Name":"ישיבת מליאה בתאריך 15/08/1972 בשעה 13:22","StartDate":"1972-08-15T13:22:00+03:00","FinishDate":"1972-08-15T16:15:00+03:00","IsSpecialMeeting":null,"LastUpdatedDate":"2021-02-16T08:55:37.71+02:00"}
{"Id":489207,"Number":469,"KnessetNum":7,"Name":"ישיבת מליאה בתאריך 21/11/1973 בשעה 12:34","StartDate":"1973-11-21T12:34:00+02:00","FinishDate":"1973-11-21T13:20:00+02:00","IsSpecialMeeting":null,"LastUpdatedDate":"2021-05-13T08:50:37.733+03:00"}
{"Id":489208,"Number":471,"KnessetNum":7,"Name":"ישיבת מליאה בתאריך 26/11/1973 בשעה 11:20","StartDate":"1973-11-26T11:20:00+02:00","FinishDate":"1973-11-26T11:25:00+02:00","IsSpecialMeeting":null,"LastUpdatedDate":"2021-05-13T09:04:14.85+03:00"}
{"Id":489209,"Number":472,"KnessetNum":7,"Name":"ישיבת מליאה בתאריך 26/11/1973 בשעה 11:25","StartDate":"1973-11-26T11:25:00+02:00","FinishDate":"1973-11-26T18:15:00+02:00","IsSpecialMeeting":null,"LastUpdatedDate":"2021-05-13T09:06:56.423+03:00"}
{"Id":489210,"Number":476,"KnessetNum":7,"Name":"ישיבת מליאה בתאריך 10/12/1973 בשעה 15:05","StartDate":"1973-12-10T15:05:00+02:00","FinishDate":"1973-12-10T15:42:00+02:00","IsSpecialMeeting":null,"LastUpdatedDate":"2024-01-31T17:04:17.277+02:00"}
{"Id":489211,"Number":477,"KnessetNum":7,"Name":"ישיבת מליאה בתאריך 18/12/1973 בשעה 10:02","StartDate":"1973-12-18T10:02:00+02:00","FinishDate":"1973-12-18T13:38:00+02:00","IsSpecialMeeting":null,"LastUpdatedDate":"2021-05-13T10:32:22.047+03:00"}
{"Id":489212,"Number":480,"KnessetNum":7,"Name":"ישיבת מליאה בתאריך 25/12/1973 בשעה 11:00","StartDate":"1973-12-25T11:00:00+02:00","FinishDate":"1973-12-25T13:00:00+02:00","IsSpecialMeeting":null,"LastUpdatedDate":"2025-01-27T11:36:06.543+02:00"}
{"Id":489213,"Number":93,"KnessetNum":8,"Name":"ישיבת מליאה בתאריך 09/10/1974 בשעה 12:47","StartDate":"1974-10-09T12:47:00+02:00","FinishDate":"1974-10-09T12:55:00+02:00","IsSpecialMeeting":null,"LastUpdatedDate":"2021-10-13T08:50:12.16+03:00"}
{"Id":489214,"Number":147,"KnessetNum":8,"Name":"ישיבת מליאה בתאריך 12/02/1975 בשעה 12:20","StartDate":"1975-02-12T12:20:00+02:00","FinishDate":"1975-02-12T16:43:00+02:00","IsSpecialMeeting":null,"LastUpdatedDate":"2025-06-08T11:08:37.1+03:00"}
{"Id":489215,"Number":261,"KnessetNum":8,"Name":"ישיבת מליאה בתאריך 04/02/1976 בשעה 11:01","StartDate":"1976-02-04T11:01:00+02:00","FinishDate":"1976-02-04T14:15:00+02:00","IsSpecialMeeting":null,"LastUpdatedDate":"2022-04-03T02:35:03.84+03:00"}
{"Id":489216,"Number":286,"KnessetNum":8,"Name":"ישיבת מליאה בתאריך 12/04/1976 בשעה 12:10","StartDate":"1976-04-12T12:10:00+03:00","FinishDate":"1976-04-12T13:02:00+03:00","IsSpecialMeeting":null,"LastUpdatedDate":"2022-05-02T02:08:43.73+03:00"}
{"Id":489217,"Number":288,"KnessetNum":8,"Name":"ישיבת מליאה בתאריך 03/05/1976 בשעה 14:27","StartDate":"1976-05-03T14:27:00+03:00","FinishDate":"1976-05-03T18:23:00+03:00","IsSpecialMeeting":null,"LastUpdatedDate":"2022-05-02T02:21:20.45+03:00"}
{"Id":489218,"Number":327,"KnessetNum":8,"Name":"ישיבת מליאה בתאריך 03/08/1976 בשעה 17:14","StartDate":"1976-08-03T17:14:00+03:00","FinishDate":"1976-08-03T17:17:00+03:00","IsSpecialMeeting":null,"LastUpdatedDate":"2020-04-05T10:24:08.503+03:00"}
{"Id":489219,"Number":329,"KnessetNum":8,"Name":"ישיבת מליאה בתאריך 24/08/1976 בשעה 13:58","StartDate":"1976-08-24T13:58:00+03:00","FinishDate":"1976-08-24T14:56:00+03:00","IsSpecialMeeting":null,"LastUpdatedDate":"2022-06-16T13:44:05.173+03:00"}
{"Id":489220,"Number":331,"KnessetNum":8,"Name":"ישיבת מליאה בתאריך 30/08/1976 בשעה 16:38","StartDate":"1976-08-30T16:38:00+03:00","FinishDate":"1976-08-30T16:53:00+03:00","IsSpecialMeeting":null,"LastUpdatedDate":"2022-06-16T13:49:43.297+03:00"}
{"Id":489221,"Number":399,"KnessetNum":8,"Name":"ישיבת מליאה בתאריך 29/03/1977 בשעה 13:06","StartDate":"1977-03-29T13:06:00+02:00","FinishDate":"1977-03-29T13:10:00+02:00","IsSpecialMeeting":null,"LastUpdatedDate":"2022-03-22T09:54:28.587+02:00"}
{"Id":489222,"Number":402,"KnessetNum":8,"Name":"ישיבת מליאה בתאריך 02/05/1977 בשעה 11:46","StartDate":"1977-05-02T11:46:00+03:00","FinishDate":"1977-05-02T12:30:00+03:00","IsSpecialMeeting":null,"LastUpdatedDate":"2022-03-22T09:39:53.697+02:00"}
{"Id":489223,"Number":404,"KnessetNum":8,"Name":"ישיבת מליאה בתאריך 16/05/1977 בשעה 11:59","StartDate":"1977-05-16T11:59:00+03:00","FinishDate":"1977-05-16T12:02:00+03:00","IsSpecialMeeting":null,"LastUpdatedDate":"2022-03-22T09:30:22.417+02:00"}
{"Id":489224,"Number":26,"KnessetNum":9,"Name":"ישיבת מליאה בתאריך 19/09/1977 בשעה 13:16","StartDate":"1977-09-19T13:16:00+03:00","FinishDate":"1977-09-19T14:15:00+03:00","IsSpecialMeeting":null,"LastUpdatedDate":"2020-09-27T01:26:09.053+03:00"}
{"Id":489225,"Number":101,"KnessetNum":9,"Name":"ישיבת מליאה בתאריך 29/03/1978 בשעה 10:16","StartDate":"1978-03-29T10:16:00+02:00","FinishDate":"1978-03-29T18:24:00+02:00","IsSpecialMeeting":null,"LastUpdatedDate":"2020-10-25T03:21:28.04+02:00"}
{"Id":489226,"Number":144,"KnessetNum":9,"Name":"ישיבת מליאה בתאריך 23/08/1978 בשעה 13:26","StartDate":"1978-08-23T13:26:00+03:00","FinishDate":"1978-08-23T13:34:00+03:00","IsSpecialMeeting":null,"LastUpdatedDate":"2020-11-12T01:56:16.907+02:00"}
{"Id":489227,"Number":165,"KnessetNum":9,"Name":"ישיבת מליאה בתאריך 12/12/1978 בשעה 16:02","StartDate":"1978-12-12T16:02:00+02:00","FinishDate":"1978-12-12T18:30:00+02:00","IsSpecialMeeting":null,"LastUpdatedDate":"2020-11-21T00:45:10.497+02:00"}
{"Id":489228,"Number":449,"KnessetNum":9,"Name":"ישיבת מליאה בתאריך 03/06/1981 בשעה 14:54","StartDate":"1981-06-03T14:54:00+03:00","FinishDate":"1981-06-03T15:45:00+03:00","IsSpecialMeeting":null,"LastUpdatedDate":"2020-06-11T11:32:53.793+03:00"}
{"Id":489229,"Number":132,"KnessetNum":2,"Name":"ישיבת מליאה בתאריך 04/11/1952 בשעה 16:05","StartDate":"1952-11-04T16:05:00+02:00","FinishDate":"1952-11-04T18:55:00+02:00","IsSpecialMeeting":null,"LastUpdatedDate":"2020-10-25T09:21:28.78+02:00"}
{"Id":489230,"Number":141,"KnessetNum":2,"Name":"ישיבת מליאה בתאריך 24/11/1952 בשעה 16:10","StartDate":"1952-11-24T16:10:00+02:00","FinishDate":"1952-11-24T18:35:00+02:00","IsSpecialMeeting":null,"LastUpdatedDate":"2020-10-25T08:46:12.74+02:00"}
{"Id":489231,"Number":160,"KnessetNum":2,"Name":"ישיבת מליאה בתאריך 29/12/1952 בשעה 16:06","StartDate":"1952-12-29T16:06:00+02:00","FinishDate":"1952-12-29T18:50:00+02:00","IsSpecialMeeting":null,"LastUpdatedDate":"2020-10-21T16:44:22.813+03:00"}
{"Id":489232,"Number":165,"KnessetNum":2,"Name":"ישיבת מליאה בתאריך 05/01/1953 בשעה 16:10","StartDate":"1953-01-05T16:10:00+02:00","FinishDate":"1953-01-05T19:00:00+02:00","IsSpecialMeeting":null,"LastUpdatedDate":"2020-10-21T16:29:19.97+03:00"}
{"Id":489233,"Number":184,"KnessetNum":2,"Name":"ישיבת מליאה בתאריך 09/02/1953 בשעה 16:10","StartDate":"1953-02-09T16:10:00+02:00","FinishDate":"1953-02-09T18:50:00+02:00","IsSpecialMeeting":null,"LastUpdatedDate":"2020-10-21T15:31:13.943+03:00"}
{"Id":489234,"Number":209,"KnessetNum":2,"Name":"ישיבת מליאה בתאריך 17/03/1953 בשעה 16:08","StartDate":"1953-03-17T16:08:00+02:00","FinishDate":"1953-03-17T19:05:00+02:00","IsSpecialMeeting":null,"LastUpdatedDate":"2022-01-10T10:55:13.347+02:00"}
{"Id":489235,"Number":217,"KnessetNum":2,"Name":"ישיבת מליאה בתאריך 26/03/1953 בשעה 14:05","StartDate":"1953-03-26T14:05:00+02:00","FinishDate":"1953-03-26T17:25:00+02:00","IsSpecialMeeting":null,"LastUpdatedDate":"2021-09-30T10:59:51.933+03:00"}
{"Id":489236,"Number":219,"KnessetNum":2,"Name":"ישיבת מליאה בתאריך 04/05/1953 בשעה 16:10","StartDate":"1953-05-04T16:10:00+03:00","FinishDate":"1953-05-04T19:30:00+03:00","IsSpecialMeeting":null,"LastUpdatedDate":"2020-10-21T13:30:14.703+03:00"}
{"Id":489237,"Number":232,"KnessetNum":2,"Name":"ישיבת מליאה בתאריך 25/05/1953 בשעה 16:09","StartDate":"1953-05-25T16:09:00+03:00","FinishDate":"1953-05-25T19:07:00+03:00","IsSpecialMeeting":null,"LastUpdatedDate":"2020-10-21T12:21:47.537+03:00"}
{"Id":489238,"Number":237,"KnessetNum":2,"Name":"ישיבת מליאה בתאריך 01/06/1953 בשעה 16:08","StartDate":"1953-06-01T16:08:00+03:00","FinishDate":"1953-06-01T18:53:00+03:00","IsSpecialMeeting":null,"LastUpdatedDate":"2020-10-21T11:35:56.157+03:00"}
{"Id":489239,"Number":252,"KnessetNum":2,"Name":"ישיבת מליאה בתאריך 22/06/1953 בשעה 16:11","StartDate":"1953-06-22T16:11:00+03:00","FinishDate":"1953-06-22T19:03:00+03:00","IsSpecialMeeting":null,"LastUpdatedDate":"2020-10-21T10:39:32.737+03:00"}
{"Id":489240,"Number":262,"KnessetNum":2,"Name":"ישיבת מליאה בתאריך 06/07/1953 בשעה 16:10","StartDate":"1953-07-06T16:10:00+03:00","FinishDate":"1953-07-06T19:00:00+03:00","IsSpecialMeeting":null,"LastUpdatedDate":"2021-10-21T07:37:36.65+03:00"}
{"Id":489241,"Number":269,"KnessetNum":2,"Name":"ישיבת מליאה בתאריך 14/07/1953 בשעה 16:08","StartDate":"1953-07-14T16:08:00+03:00","FinishDate":"1953-07-14T19:15:00+03:00","IsSpecialMeeting":null,"LastUpdatedDate":"2022-01-12T12:34:14.55+02:00"}
{"Id":489242,"Number":272,"KnessetNum":2,"Name":"ישיבת מליאה בתאריך 22/07/1953 בשעה 16:06","StartDate":"1953-07-22T16:06:00+03:00","FinishDate":"1953-07-22T19:03:00+03:00","IsSpecialMeeting":null,"LastUpdatedDate":"2020-10-21T09:30:51.03+03:00"}
{"Id":489243,"Number":280,"KnessetNum":2,"Name":"ישיבת מליאה בתאריך 03/08/1953 בשעה 16:12","StartDate":"1953-08-03T16:12:00+03:00","FinishDate":"1953-08-03T19:23:00+03:00","IsSpecialMeeting":null,"LastUpdatedDate":"2020-10-20T17:21:22.77+03:00"}
{"Id":489244,"Number":285,"KnessetNum":2,"Name":"ישיבת מליאה בתאריך 10/08/1953 בשעה 16:10","StartDate":"1953-08-10T16:10:00+03:00","FinishDate":"1953-08-10T18:50:00+03:00","IsSpecialMeeting":null,"LastUpdatedDate":"2020-10-20T17:12:33.537+03:00"}
{"Id":489245,"Number":287,"KnessetNum":2,"Name":"ישיבת מליאה בתאריך 11/08/1953 בשעה 16:17","StartDate":"1953-08-11T16:17:00+03:00","FinishDate":"1953-08-11T18:55:00+03:00","IsSpecialMeeting":null,"LastUpdatedDate":"2020-10-20T17:06:38.45+03:00"}
{"Id":489246,"Number":307,"KnessetNum":2,"Name":"ישיבת מליאה בתאריך 02/11/1953 בשעה 17:20","StartDate":"1953-11-02T17:20:00+02:00","FinishDate":"1953-11-02T19:05:00+02:00","IsSpecialMeeting":null,"LastUpdatedDate":"2020-10-20T15:33:15.027+03:00"}
{"Id":489247,"Number":309,"KnessetNum":2,"Name":"ישיבת מליאה בתאריך 03/11/1953 בשעה 16:05","StartDate":"1953-11-03T16:05:00+02:00","FinishDate":"1953-11-03T18:47:00+02:00","IsSpecialMeeting":null,"LastUpdatedDate":"2022-01-13T08:57:54.303+02:00"}
{"Id":489248,"Number":312,"KnessetNum":2,"Name":"ישיבת מליאה בתאריך 09/11/1953 בשעה 16:08","StartDate":"1953-11-09T16:08:00+02:00","FinishDate":"1953-11-09T19:10:00+02:00","IsSpecialMeeting":null,"LastUpdatedDate":"2021-11-01T07:47:52.07+02:00"}
{"Id":489249,"Number":319,"KnessetNum":2,"Name":"ישיבת מליאה בתאריך 17/11/1953 בשעה 16:15","StartDate":"1953-11-17T16:15:00+02:00","FinishDate":"1953-11-17T19:00:00+02:00","IsSpecialMeeting":null,"LastUpdatedDate":"2020-10-20T14:54:44.117+03:00"}
{"Id":489250,"Number":322,"KnessetNum":2,"Name":"ישיבת מליאה בתאריך 23/11/1953 בשעה 16:12","StartDate":"1953-11-23T16:12:00+02:00","FinishDate":"1953-11-23T18:55:00+02:00","IsSpecialMeeting":null,"LastUpdatedDate":"2020-10-20T14:50:45.647+03:00"}
{"Id":489251,"Number":347,"KnessetNum":2,"Name":"ישיבת מליאה בתאריך 04/01/1954 בשעה 16:10","StartDate":"1954-01-04T16:10:00+02:00","FinishDate":"1954-01-04T19:00:00+02:00","IsSpecialMeeting":null,"LastUpdatedDate":"2020-10-20T12:10:38.23+03:00"}
{"Id":489252,"Number":366,"KnessetNum":2,"Name":"ישיבת מליאה בתאריך 02/02/1954 בשעה 16:08","StartDate":"1954-02-02T16:08:00+02:00","FinishDate":"1954-02-02T19:07:00+02:00","IsSpecialMeeting":null,"LastUpdatedDate":"2020-10-20T10:17:27.927+03:00"}
{"Id":489253,"Number":392,"KnessetNum":2,"Name":"ישיבת מליאה בתאריך 15/03/1954 בשעה 16:07","StartDate":"1954-03-15T16:07:00+02:00","FinishDate":"1954-03-15T18:55:00+02:00","IsSpecialMeeting":null,"LastUpdatedDate":"2020-10-20T08:36:40.627+03:00"}
{"Id":489254,"Number":397,"KnessetNum":2,"Name":"ישיבת מליאה בתאריך 22/03/1954 בשעה 16:04","StartDate":"1954-03-22T16:04:00+02:00","FinishDate":"1954-03-22T18:54:00+02:00","IsSpecialMeeting":null,"LastUpdatedDate":"2021-12-28T17:46:13.403+02:00"}
{"Id":489255,"Number":406,"KnessetNum":2,"Name":"ישיבת מליאה בתאריך 31/03/1954 בשעה 15:00","StartDate":"1954-03-31T15:00:00+02:00","FinishDate":"1954-03-31T18:30:00+02:00","IsSpecialMeeting":null,"LastUpdatedDate":"2021-11-16T11:14:34.497+02:00"}
{"Id":489256,"Number":409,"KnessetNum":2,"Name":"ישיבת מליאה בתאריך 05/04/1954 בשעה 16:10","StartDate":"1954-04-05T16:10:00+02:00","FinishDate":"1954-04-05T19:55:00+02:00","IsSpecialMeeting":null,"LastUpdatedDate":"2020-10-19T18:14:05.103+03:00"}
{"Id":489257,"Number":421,"KnessetNum":2,"Name":"ישיבת מליאה בתאריך 18/05/1954 בשעה 16:08","StartDate":"1954-05-18T16:08:00+03:00","FinishDate":"1954-05-18T19:00:00+03:00","IsSpecialMeeting":null,"LastUpdatedDate":"2022-01-10T10:35:24.31+02:00"}
{"Id":489258,"Number":424,"KnessetNum":2,"Name":"ישיבת מליאה בתאריך 24/05/1954 בשעה 16:07","StartDate":"1954-05-24T16:07:00+03:00","FinishDate":"1954-05-24T18:58:00+03:00","IsSpecialMeeting":null,"LastUpdatedDate":"2020-10-19T17:12:56.49+03:00"}
{"Id":489259,"Number":437,"KnessetNum":2,"Name":"ישיבת מליאה בתאריך 14/06/1954 בשעה 16:08","StartDate":"1954-06-14T16:08:00+03:00","FinishDate":"1954-06-14T18:53:00+03:00","IsSpecialMeeting":null,"LastUpdatedDate":"2020-10-19T16:28:29.06+03:00"}
{"Id":489260,"Number":442,"KnessetNum":2,"Name":"ישיבת מליאה בתאריך 21/06/1954 בשעה 16:10","StartDate":"1954-06-21T16:10:00+03:00","FinishDate":"1954-06-21T19:07:00+03:00","IsSpecialMeeting":null,"LastUpdatedDate":"2020-10-19T16:14:03.083+03:00"}
{"Id":489261,"Number":462,"KnessetNum":2,"Name":"ישיבת מליאה בתאריך 02/08/1954 בשעה 16:12","StartDate":"1954-08-02T16:12:00+03:00","FinishDate":"1954-08-02T18:55:00+03:00","IsSpecialMeeting":null,"LastUpdatedDate":"2021-11-22T15:59:14.63+02:00"}
{"Id":489262,"Number":464,"KnessetNum":2,"Name":"ישיבת מליאה בתאריך 03/08/1954 בשעה 16:06","StartDate":"1954-08-03T16:06:00+03:00","FinishDate":"1954-08-03T19:10:00+03:00","IsSpecialMeeting":null,"LastUpdatedDate":"2020-10-19T14:36:31.167+03:00"}
{"Id":489263,"Number":473,"KnessetNum":2,"Name":"ישיבת מליאה בתאריך 17/08/1954 בשעה 16:08","StartDate":"1954-08-17T16:08:00+03:00","FinishDate":"1954-08-17T19:05:00+03:00","IsSpecialMeeting":null,"LastUpdatedDate":"2020-10-19T14:11:15.18+03:00"}
{"Id":489264,"Number":476,"KnessetNum":2,"Name":"ישיבת מליאה בתאריך 23/08/1954 בשעה 16:11","StartDate":"1954-08-23T16:11:00+03:00","FinishDate":"1954-08-23T18:42:00+03:00","IsSpecialMeeting":null,"LastUpdatedDate":"2020-10-19T14:04:08.74+03:00"}
{"Id":489265,"Number":488,"KnessetNum":2,"Name":"ישיבת מליאה בתאריך 07/09/1954 בשעה 16:05","StartDate":"1954-09-07T16:05:00+03:00","FinishDate":"1954-09-07T18:50:00+03:00","IsSpecialMeeting":null,"LastUpdatedDate":"2020-10-19T13:02:07.973+03:00"}
{"Id":489267,"Number":509,"KnessetNum":2,"Name":"ישיבת מליאה בתאריך 06/12/1954 בשעה 16:17","StartDate":"1954-12-06T16:17:00+02:00","FinishDate":"1954-12-06T18:57:00+02:00","IsSpecialMeeting":null,"LastUpdatedDate":"2021-12-02T10:47:08.047+02:00"}
{"Id":489268,"Number":529,"KnessetNum":2,"Name":"ישיבת מליאה בתאריך 10/01/1955 בשעה 16:10","StartDate":"1955-01-10T16:10:00+02:00","FinishDate":"1955-01-10T19:15:00+02:00","IsSpecialMeeting":null,"LastUpdatedDate":"2020-10-19T10:06:17.543+03:00"}
{"Id":489270,"Number":537,"KnessetNum":2,"Name":"ישיבת מליאה בתאריך 24/01/1955 בשעה 16:08","StartDate":"1955-01-24T16:08:00+02:00","FinishDate":"1955-01-24T19:08:00+02:00","IsSpecialMeeting":null,"LastUpdatedDate":"2020-10-19T09:23:47.97+03:00"}
{"Id":489271,"Number":546,"KnessetNum":2,"Name":"ישיבת מליאה בתאריך 08/02/1955 בשעה 16:10","StartDate":"1955-02-08T16:10:00+02:00","FinishDate":"1955-02-08T18:35:00+02:00","IsSpecialMeeting":null,"LastUpdatedDate":"2020-10-19T08:19:57.25+03:00"}
{"Id":489272,"Number":575,"KnessetNum":2,"Name":"ישיבת מליאה בתאריך 22/03/1955 בשעה 15:15","StartDate":"1955-03-22T15:15:00+02:00","FinishDate":"1955-03-22T19:00:00+02:00","IsSpecialMeeting":null,"LastUpdatedDate":"2021-01-26T09:06:50.483+02:00"}
{"Id":489273,"Number":577,"KnessetNum":2,"Name":"ישיבת מליאה בתאריך 23/03/1955 בשעה 15:12","StartDate":"1955-03-23T15:12:00+02:00","FinishDate":"1955-03-23T19:02:00+02:00","IsSpecialMeeting":null,"LastUpdatedDate":"2020-10-18T12:27:11.753+03:00"}
{"Id":489275,"Number":593,"KnessetNum":2,"Name":"ישיבת מליאה בתאריך 16/05/1955 בשעה 16:05","StartDate":"1955-05-16T16:05:00+03:00","FinishDate":"1955-05-16T19:45:00+03:00","IsSpecialMeeting":null,"LastUpdatedDate":"2020-10-18T11:09:12.23+03:00"}
{"Id":489279,"Number":615,"KnessetNum":2,"Name":"ישיבת מליאה בתאריך 21/06/1955 בשעה 16:08","StartDate":"1955-06-21T16:08:00+03:00","FinishDate":"1955-06-21T19:06:00+03:00","IsSpecialMeeting":null,"LastUpdatedDate":"2020-10-18T09:08:28.34+03:00"}
{"Id":489280,"Number":112,"KnessetNum":3,"Name":"ישיבת מליאה בתאריך 22/04/1956 בשעה 16:07","StartDate":"1956-04-22T16:07:00+03:00","FinishDate":"1956-04-22T18:57:00+03:00","IsSpecialMeeting":null,"LastUpdatedDate":"2021-12-02T15:40:56.903+02:00"}
{"Id":489281,"Number":115,"KnessetNum":3,"Name":"ישיבת מליאה בתאריך 08/05/1956 בשעה 16:06","StartDate":"1956-05-08T16:06:00+03:00","FinishDate":"1956-05-08T18:53:00+03:00","IsSpecialMeeting":null,"LastUpdatedDate":"2021-12-05T09:16:33.743+02:00"}
{"Id":489282,"Number":120,"KnessetNum":3,"Name":"ישיבת מליאה בתאריך 22/05/1956 בשעה 16:01","StartDate":"1956-05-22T16:01:00+03:00","FinishDate":"1956-05-22T18:50:00+03:00","IsSpecialMeeting":null,"LastUpdatedDate":"2023-12-25T08:37:43.677+02:00"}
{"Id":489287,"Number":159,"KnessetNum":3,"Name":"ישיבת מליאה בתאריך 23/07/1956 בשעה 16:16","StartDate":"1956-07-23T16:16:00+03:00","FinishDate":"1956-07-23T19:02:00+03:00","IsSpecialMeeting":null,"LastUpdatedDate":"2021-12-09T15:39:38.837+02:00"}
{"Id":489288,"Number":161,"KnessetNum":3,"Name":"ישיבת מליאה בתאריך 24/07/1956 בשעה 16:02","StartDate":"1956-07-24T16:02:00+03:00","FinishDate":"1956-07-24T18:52:00+03:00","IsSpecialMeeting":null,"LastUpdatedDate":"2021-12-09T19:42:06.08+02:00"}
{"Id":489290,"Number":178,"KnessetNum":3,"Name":"ישיבת מליאה בתאריך 29/10/1956 בשעה 16:09","StartDate":"1956-10-29T16:09:00+02:00","FinishDate":"1956-10-29T18:20:00+02:00","IsSpecialMeeting":null,"LastUpdatedDate":"2021-12-14T07:41:35.183+02:00"}
{"Id":489292,"Number":184,"KnessetNum":3,"Name":"ישיבת מליאה בתאריך 12/11/1956 בשעה 16:10","StartDate":"1956-11-12T16:10:00+02:00","FinishDate":"1956-11-12T19:03:00+02:00","IsSpecialMeeting":null,"LastUpdatedDate":"2021-12-30T13:25:43.647+02:00"}
{"Id":489293,"Number":194,"KnessetNum":3,"Name":"ישיבת מליאה בתאריך 27/11/1956 בשעה 16:02","StartDate":"1956-11-27T16:02:00+02:00","FinishDate":"1956-11-27T19:49:00+02:00","IsSpecialMeeting":null,"LastUpdatedDate":"2021-12-15T15:05:30.27+02:00"}
{"Id":489294,"Number":197,"KnessetNum":3,"Name":"ישיבת מליאה בתאריך 03/12/1956 בשעה 16:10","StartDate":"1956-12-03T16:10:00+02:00","FinishDate":"1956-12-03T18:55:00+02:00","IsSpecialMeeting":null,"LastUpdatedDate":"2021-12-15T17:28:14.8+02:00"}
{"Id":489295,"Number":246,"KnessetNum":3,"Name":"ישיבת מליאה בתאריך 19/02/1957 בשעה 16:05","StartDate":"1957-02-19T16:05:00+02:00","FinishDate":"1957-02-19T19:05:00+02:00","IsSpecialMeeting":null,"LastUpdatedDate":"2022-02-01T07:51:58.37+02:00"}
{"Id":489300,"Number":297,"KnessetNum":3,"Name":"ישיבת מליאה בתאריך 28/05/1957 בשעה 16:07","StartDate":"1957-05-28T16:07:00+03:00","FinishDate":"1957-05-28T19:00:00+03:00","IsSpecialMeeting":null,"LastUpdatedDate":"2022-02-22T16:47:26.067+02:00"}
{"Id":489301,"Number":308,"KnessetNum":3,"Name":"ישיבת מליאה בתאריך 18/06/1957 בשעה 16:03","StartDate":"1957-06-18T16:03:00+03:00","FinishDate":"1957-06-18T16:51:00+03:00","IsSpecialMeeting":null,"LastUpdatedDate":"2022-02-23T13:22:43.09+02:00"}
{"Id":489303,"Number":330,"KnessetNum":3,"Name":"ישיבת מליאה בתאריך 22/07/1957 בשעה 16:15","StartDate":"1957-07-22T16:15:00+03:00","FinishDate":"1957-07-22T19:04:00+03:00","IsSpecialMeeting":null,"LastUpdatedDate":"2022-02-24T14:20:34.483+02:00"}
{"Id":489307,"Number":341,"KnessetNum":3,"Name":"ישיבת מליאה בתאריך 21/10/1957 בשעה 16:07","StartDate":"1957-10-21T16:07:00+02:00","FinishDate":"1957-10-21T19:10:00+02:00","IsSpecialMeeting":null,"LastUpdatedDate":"2022-03-01T06:39:33.137+02:00"}
{"Id":489311,"Number":409,"KnessetNum":3,"Name":"ישיבת מליאה בתאריך 11/02/1958 בשעה 16:07","StartDate":"1958-02-11T16:07:00+02:00","FinishDate":"1958-02-11T19:14:00+02:00","IsSpecialMeeting":null,"LastUpdatedDate":"2022-03-08T18:24:43.613+02:00"}
{"Id":489312,"Number":411,"KnessetNum":3,"Name":"ישיבת מליאה בתאריך 12/02/1958 בשעה 11:05","StartDate":"1958-02-12T11:05:00+02:00","FinishDate":"1958-02-12T13:20:00+02:00","IsSpecialMeeting":null,"LastUpdatedDate":"2022-03-08T18:35:28.82+02:00"}
{"Id":489313,"Number":454,"KnessetNum":3,"Name":"ישיבת מליאה בתאריך 19/05/1958 בשעה 16:05","StartDate":"1958-05-19T16:05:00+03:00","FinishDate":"1958-05-19T19:00:00+03:00","IsSpecialMeeting":null,"LastUpdatedDate":"2022-03-10T15:43:16.49+02:00"}
{"Id":489317,"Number":513,"KnessetNum":3,"Name":"ישיבת מליאה בתאריך 13/10/1958 בשעה 16:07","StartDate":"1958-10-13T16:07:00+02:00","FinishDate":"1958-10-13T19:16:00+02:00","IsSpecialMeeting":null,"LastUpdatedDate":"2022-04-05T17:33:34.613+03:00"}
{"Id":489319,"Number":525,"KnessetNum":3,"Name":"ישיבת מליאה בתאריך 03/11/1958 בשעה 16:06","StartDate":"1958-11-03T16:06:00+02:00","FinishDate":"1958-11-03T19:00:00+02:00","IsSpecialMeeting":null,"LastUpdatedDate":"2022-04-11T14:12:01.507+03:00"}
{"Id":489320,"Number":527,"KnessetNum":3,"Name":"ישיבת מליאה בתאריך 04/11/1958 בשעה 16:03","StartDate":"1958-11-04T16:03:00+02:00","FinishDate":"1958-11-04T18:55:00+02:00","IsSpecialMeeting":null,"LastUpdatedDate":"2022-04-07T12:59:04.11+03:00"}
{"Id":489321,"Number":534,"KnessetNum":3,"Name":"ישיבת מליאה בתאריך 17/11/1958 בשעה 16:02","StartDate":"1958-11-17T16:02:00+02:00","FinishDate":"1958-11-17T19:00:00+02:00","IsSpecialMeeting":null,"LastUpdatedDate":"2022-04-07T15:11:27.46+03:00"}
{"Id":489324,"Number":565,"KnessetNum":3,"Name":"ישיבת מליאה בתאריך 30/12/1958 בשעה 16:04","StartDate":"1958-12-30T16:04:00+02:00","FinishDate":"1958-12-30T18:50:00+02:00","IsSpecialMeeting":null,"LastUpdatedDate":"2022-04-13T07:05:20.67+03:00"}
{"Id":489328,"Number":605,"KnessetNum":3,"Name":"ישיבת מליאה בתאריך 09/03/1959 בשעה 15:13","StartDate":"1959-03-09T15:13:00+02:00","FinishDate":"1959-03-09T18:58:00+02:00","IsSpecialMeeting":null,"LastUpdatedDate":"2023-10-31T14:02:23.79+02:00"}
{"Id":489329,"Number":628,"KnessetNum":3,"Name":"ישיבת מליאה בתאריך 06/04/1959 בשעה 14:07","StartDate":"1959-04-06T14:07:00+03:00","FinishDate":"1959-04-06T18:50:00+03:00","IsSpecialMeeting":null,"LastUpdatedDate":"2023-10-30T12:08:57.297+02:00"}
{"Id":489330,"Number":637,"KnessetNum":3,"Name":"ישיבת מליאה בתאריך 26/05/1959 בשעה 15:07","StartDate":"1959-05-26T15:07:00+03:00","FinishDate":"1959-05-26T17:10:00+03:00","IsSpecialMeeting":null,"LastUpdatedDate":"2020-03-10T10:24:14.36+02:00"}
{"Id":489331,"Number":652,"KnessetNum":3,"Name":"ישיבת מליאה בתאריך 16/06/1959 בשעה 16:00","StartDate":"1959-06-16T16:00:00+03:00","FinishDate":"1959-06-16T18:55:00+03:00","IsSpecialMeeting":null,"LastUpdatedDate":"2023-10-29T12:55:54.593+02:00"}
{"Id":489337,"Number":191,"KnessetNum":4,"Name":"ישיבת מליאה בתאריך 12/12/1960 בשעה 16:06","StartDate":"1960-12-12T16:06:00+02:00","FinishDate":"1960-12-12T18:40:00+02:00","IsSpecialMeeting":null,"LastUpdatedDate":"2021-12-28T07:28:26.23+02:00"}
{"Id":489338,"Number":199,"KnessetNum":4,"Name":"ישיבת מליאה בתאריך 26/12/1960 בשעה 16:00","StartDate":"1960-12-26T16:00:00+02:00","FinishDate":"1960-12-26T17:20:00+02:00","IsSpecialMeeting":null,"LastUpdatedDate":"2023-07-16T16:13:19.84+03:00"}
{"Id":489341,"Number":244,"KnessetNum":4,"Name":"ישיבת מליאה בתאריך 06/03/1961 בשעה 16:02","StartDate":"1961-03-06T16:02:00+02:00","FinishDate":"1961-03-06T18:55:00+02:00","IsSpecialMeeting":null,"LastUpdatedDate":"2022-01-10T16:03:45.197+02:00"}
{"Id":489343,"Number":287,"KnessetNum":4,"Name":"ישיבת מליאה בתאריך 12/06/1961 בשעה 16:06","StartDate":"1961-06-12T16:06:00+03:00","FinishDate":"1961-06-12T19:15:00+03:00","IsSpecialMeeting":null,"LastUpdatedDate":"2022-01-17T08:40:11.323+02:00"}
{"Id":489347,"Number":365,"KnessetNum":9,"Name":"ישיבת מליאה בתאריך 01/09/1980 בשעה 10:06","StartDate":"1980-09-01T10:06:00+03:00","FinishDate":"1980-09-01T13:28:00+03:00","IsSpecialMeeting":null,"LastUpdatedDate":"2020-10-18T10:44:37.587+03:00"}
{"Id":489348,"Number":133,"KnessetNum":2,"Name":"ישיבת מליאה בתאריך 04/11/1952 בשעה 20:07","StartDate":"1952-11-04T20:07:00+02:00","FinishDate":"1952-11-04T21:45:00+02:00","IsSpecialMeeting":null,"LastUpdatedDate":"2020-10-25T09:22:55.077+02:00"}
{"Id":489349,"Number":142,"KnessetNum":2,"Name":"ישיבת מליאה בתאריך 24/11/1952 בשעה 19:40","StartDate":"1952-11-24T19:40:00+02:00","FinishDate":"1952-11-24T21:35:00+02:00","IsSpecialMeeting":null,"LastUpdatedDate":"2021-12-27T20:56:47.077+02:00"}
{"Id":489350,"Number":166,"KnessetNum":2,"Name":"ישיבת מליאה בתאריך 05/01/1953 בשעה 20:05","StartDate":"1953-01-05T20:05:00+02:00","FinishDate":"1953-01-05T21:52:00+02:00","IsSpecialMeeting":null,"LastUpdatedDate":"2020-10-21T16:31:08.563+03:00"}
{"Id":489351,"Number":185,"KnessetNum":2,"Name":"ישיבת מליאה בתאריך 09/02/1953 בשעה 20:07","StartDate":"1953-02-09T20:07:00+02:00","FinishDate":"1953-02-09T21:40:00+02:00","IsSpecialMeeting":null,"LastUpdatedDate":"2020-10-21T15:32:36.13+03:00"}
{"Id":489352,"Number":210,"KnessetNum":2,"Name":"ישיבת מליאה בתאריך 17/03/1953 בשעה 20:12","StartDate":"1953-03-17T20:12:00+02:00","FinishDate":"1953-03-17T22:35:00+02:00","IsSpecialMeeting":null,"LastUpdatedDate":"2022-01-10T11:45:44.33+02:00"}
{"Id":489353,"Number":220,"KnessetNum":2,"Name":"ישיבת מליאה בתאריך 04/05/1953 בשעה 20:30","StartDate":"1953-05-04T20:30:00+03:00","FinishDate":"1953-05-04T22:00:00+03:00","IsSpecialMeeting":null,"LastUpdatedDate":"2021-09-30T12:27:24.757+03:00"}
{"Id":489354,"Number":233,"KnessetNum":2,"Name":"ישיבת מליאה בתאריך 25/05/1953 בשעה 20:15","StartDate":"1953-05-25T20:15:00+03:00","FinishDate":"1953-05-25T22:00:00+03:00","IsSpecialMeeting":null,"LastUpdatedDate":"2021-10-18T07:57:23.327+03:00"}
{"Id":489355,"Number":238,"KnessetNum":2,"Name":"ישיבת מליאה בתאריך 01/06/1953 בשעה 20:04","StartDate":"1953-06-01T20:04:00+03:00","FinishDate":null,"IsSpecialMeeting":null,"LastUpdatedDate":"2021-10-18T09:03:17.787+03:00"}
{"Id":489356,"Number":253,"KnessetNum":2,"Name":"ישיבת מליאה בתאריך 22/06/1953 בשעה 20:07","StartDate":"1953-06-22T20:07:00+03:00","FinishDate":"1953-06-22T22:00:00+03:00","IsSpecialMeeting":null,"LastUpdatedDate":"2020-10-21T10:46:34.957+03:00"}
{"Id":489357,"Number":263,"KnessetNum":2,"Name":"ישיבת מליאה בתאריך 06/07/1953 בשעה 20:22","StartDate":"1953-07-06T20:22:00+03:00","FinishDate":"1953-07-06T21:45:00+03:00","IsSpecialMeeting":null,"LastUpdatedDate":"2020-10-21T10:07:21.357+03:00"}
{"Id":489358,"Number":273,"KnessetNum":2,"Name":"ישיבת מליאה בתאריך 22/07/1953 בשעה 22:18","StartDate":"1953-07-22T22:18:00+03:00","FinishDate":"1953-07-23T00:15:00+03:00","IsSpecialMeeting":null,"LastUpdatedDate":"2020-10-21T09:34:48.71+03:00"}
{"Id":489359,"Number":281,"KnessetNum":2,"Name":"ישיבת מליאה בתאריך 03/08/1953 בשעה 20:30","StartDate":"1953-08-03T20:30:00+03:00","FinishDate":"1953-08-03T22:05:00+03:00","IsSpecialMeeting":null,"LastUpdatedDate":"2021-10-25T12:53:09.483+03:00"}
{"Id":489360,"Number":288,"KnessetNum":2,"Name":"ישיבת מליאה בתאריך 11/08/1953 בשעה 20:25","StartDate":"1953-08-11T20:25:00+03:00","FinishDate":"1953-08-11T23:00:00+03:00","IsSpecialMeeting":null,"LastUpdatedDate":"2022-01-12T14:15:06.933+02:00"}
{"Id":489361,"Number":308,"KnessetNum":2,"Name":"ישיבת מליאה בתאריך 02/11/1953 בשעה 20:20","StartDate":"1953-11-02T20:20:00+02:00","FinishDate":"1953-11-02T21:30:00+02:00","IsSpecialMeeting":null,"LastUpdatedDate":"2020-10-20T15:39:42.723+03:00"}
{"Id":489362,"Number":313,"KnessetNum":2,"Name":"ישיבת מליאה בתאריך 09/11/1953 בשעה 20:17","StartDate":"1953-11-09T20:17:00+02:00","FinishDate":"1953-11-10T02:45:00+02:00","IsSpecialMeeting":null,"LastUpdatedDate":"2021-11-01T07:53:02.847+02:00"}
{"Id":489363,"Number":320,"KnessetNum":2,"Name":"ישיבת מליאה בתאריך 17/11/1953 בשעה 20:07","StartDate":"1953-11-17T20:07:00+02:00","FinishDate":"1953-11-17T22:00:00+02:00","IsSpecialMeeting":null,"LastUpdatedDate":"2021-11-01T08:59:21.34+02:00"}
{"Id":489364,"Number":348,"KnessetNum":2,"Name":"ישיבת מליאה בתאריך 04/01/1954 בשעה 20:06","StartDate":"1954-01-04T20:06:00+02:00","FinishDate":"1954-01-04T21:55:00+02:00","IsSpecialMeeting":null,"LastUpdatedDate":"2021-11-08T10:48:05.917+02:00"}
{"Id":489365,"Number":367,"KnessetNum":2,"Name":"ישיבת מליאה בתאריך 02/02/1954 בשעה 20:15","StartDate":"1954-02-02T20:15:00+02:00","FinishDate":"1954-02-02T21:56:00+02:00","IsSpecialMeeting":null,"LastUpdatedDate":"2021-11-08T17:06:46.45+02:00"}
{"Id":489366,"Number":393,"KnessetNum":2,"Name":"ישיבת מליאה בתאריך 15/03/1954 בשעה 20:05","StartDate":"1954-03-15T20:05:00+02:00","FinishDate":"1954-03-15T22:17:00+02:00","IsSpecialMeeting":null,"LastUpdatedDate":"2021-12-30T13:10:57.19+02:00"}
{"Id":489367,"Number":425,"KnessetNum":2,"Name":"ישיבת מליאה בתאריך 24/05/1954 בשעה 20:05","StartDate":"1954-05-24T20:05:00+03:00","FinishDate":"1954-05-24T21:57:00+03:00","IsSpecialMeeting":null,"LastUpdatedDate":"2020-10-19T17:14:57.663+03:00"}
{"Id":489368,"Number":438,"KnessetNum":2,"Name":"ישיבת מליאה בתאריך 14/06/1954 בשעה 20:17","StartDate":"1954-06-14T20:17:00+03:00","FinishDate":"1954-06-14T22:05:00+03:00","IsSpecialMeeting":null,"LastUpdatedDate":"2021-11-22T09:04:43.47+02:00"}
{"Id":489369,"Number":443,"KnessetNum":2,"Name":"ישיבת מליאה בתאריך 21/06/1954 בשעה 20:17","StartDate":"1954-06-21T20:17:00+03:00","FinishDate":"1954-06-21T22:10:00+03:00","IsSpecialMeeting":null,"LastUpdatedDate":"2021-11-22T10:15:51.9+02:00"}
{"Id":489370,"Number":474,"KnessetNum":2,"Name":"ישיבת מליאה בתאריך 17/08/1954 בשעה 20:17","StartDate":"1954-08-17T20:17:00+03:00","FinishDate":"1954-08-17T22:45:00+03:00","IsSpecialMeeting":null,"LastUpdatedDate":"2021-11-29T07:46:43.827+02:00"}
{"Id":489371,"Number":477,"KnessetNum":2,"Name":"ישיבת מליאה בתאריך 23/08/1954 בשעה 20:18","StartDate":"1954-08-23T20:18:00+03:00","FinishDate":"1954-08-23T20:36:00+03:00","IsSpecialMeeting":null,"LastUpdatedDate":"2021-11-29T10:12:23.02+02:00"}
{"Id":489372,"Number":506,"KnessetNum":2,"Name":"ישיבת מליאה בתאריך 29/11/1954 בשעה 19:58","StartDate":"1954-11-29T19:58:00+02:00","FinishDate":"1954-11-29T21:50:00+02:00","IsSpecialMeeting":null,"LastUpdatedDate":"2021-12-02T08:48:29.043+02:00"}
{"Id":489373,"Number":534,"KnessetNum":2,"Name":"ישיבת מליאה בתאריך 17/01/1955 בשעה 20:07","StartDate":"1955-01-17T20:07:00+02:00","FinishDate":"1955-01-17T21:35:00+02:00","IsSpecialMeeting":null,"LastUpdatedDate":"2023-08-16T14:59:56.497+03:00"}
{"Id":489374,"Number":538,"KnessetNum":2,"Name":"ישיבת מליאה בתאריך 24/01/1955 בשעה 20:22","StartDate":"1955-01-24T20:22:00+02:00","FinishDate":"1955-01-24T21:48:00+02:00","IsSpecialMeeting":null,"LastUpdatedDate":"2021-12-06T11:45:25.783+02:00"}
{"Id":489375,"Number":547,"KnessetNum":2,"Name":"ישיבת מליאה בתאריך 08/02/1955 בשעה 20:07","StartDate":"1955-02-08T20:07:00+02:00","FinishDate":"1955-02-08T22:07:00+02:00","IsSpecialMeeting":null,"LastUpdatedDate":"2021-12-06T15:40:43.707+02:00"}
{"Id":489376,"Number":576,"KnessetNum":2,"Name":"ישיבת מליאה בתאריך 22/03/1955 בשעה 20:07","StartDate":"1955-03-22T20:07:00+02:00","FinishDate":"1955-03-23T00:13:00+02:00","IsSpecialMeeting":null,"LastUpdatedDate":"2020-10-18T13:30:59.287+03:00"}
{"Id":489377,"Number":591,"KnessetNum":2,"Name":"ישיבת מליאה בתאריך 10/05/1955 בשעה 20:03","StartDate":"1955-05-10T20:03:00+03:00","FinishDate":"1955-05-10T21:40:00+03:00","IsSpecialMeeting":null,"LastUpdatedDate":"2021-12-05T12:28:24.423+02:00"}
{"Id":489378,"Number":602,"KnessetNum":2,"Name":"ישיבת מליאה בתאריך 30/05/1955 בשעה 20:04","StartDate":"1955-05-30T20:04:00+03:00","FinishDate":"1955-05-30T20:55:00+03:00","IsSpecialMeeting":null,"LastUpdatedDate":"2021-12-14T15:50:07.923+02:00"}
{"Id":489379,"Number":113,"KnessetNum":3,"Name":"ישיבת מליאה בתאריך 22/04/1956 בשעה 20:08","StartDate":"1956-04-22T20:08:00+03:00","FinishDate":"1956-04-22T22:05:00+03:00","IsSpecialMeeting":null,"LastUpdatedDate":"2021-12-02T15:46:00.47+02:00"}
{"Id":489380,"Number":124,"KnessetNum":3,"Name":"ישיבת מליאה בתאריך 28/05/1956 בשעה 20:01","StartDate":"1956-05-28T20:01:00+03:00","FinishDate":"1956-05-28T21:22:00+03:00","IsSpecialMeeting":null,"LastUpdatedDate":"2021-12-07T13:06:39.07+02:00"}
{"Id":489381,"Number":135,"KnessetNum":3,"Name":"ישיבת מליאה בתאריך 12/06/1956 בשעה 20:01","StartDate":"1956-06-12T20:01:00+03:00","FinishDate":"1956-06-12T21:25:00+03:00","IsSpecialMeeting":null,"LastUpdatedDate":"2021-12-08T10:47:34.487+02:00"}
{"Id":489382,"Number":160,"KnessetNum":3,"Name":"ישיבת מליאה בתאריך 23/07/1956 בשעה 20:06","StartDate":"1956-07-23T20:06:00+03:00","FinishDate":"1956-07-23T22:10:00+03:00","IsSpecialMeeting":null,"LastUpdatedDate":"2021-12-09T17:29:31.45+02:00"}
{"Id":489383,"Number":175,"KnessetNum":3,"Name":"ישיבת מליאה בתאריך 22/10/1956 בשעה 20:18","StartDate":"1956-10-22T20:18:00+02:00","FinishDate":"1956-10-22T21:40:00+02:00","IsSpecialMeeting":null,"LastUpdatedDate":"2023-12-20T09:14:02.77+02:00"}
{"Id":489384,"Number":179,"KnessetNum":3,"Name":"ישיבת מליאה בתאריך 29/10/1956 בשעה 20:05","StartDate":"1956-10-29T20:05:00+02:00","FinishDate":"1956-10-29T21:05:00+02:00","IsSpecialMeeting":null,"LastUpdatedDate":"2021-12-14T07:49:13.463+02:00"}
{"Id":489385,"Number":181,"KnessetNum":3,"Name":"ישיבת מליאה בתאריך 30/10/1956 בשעה 20:22","StartDate":"1956-10-30T20:22:00+02:00","FinishDate":"1956-10-30T21:00:00+02:00","IsSpecialMeeting":null,"LastUpdatedDate":"2021-12-14T08:26:04.997+02:00"}
{"Id":489386,"Number":185,"KnessetNum":3,"Name":"ישיבת מליאה בתאריך 12/11/1956 בשעה 20:06","StartDate":"1956-11-12T20:06:00+02:00","FinishDate":"1956-11-12T21:30:00+02:00","IsSpecialMeeting":null,"LastUpdatedDate":"2021-12-30T13:37:16.717+02:00"}
{"Id":489387,"Number":198,"KnessetNum":3,"Name":"ישיבת מליאה בתאריך 03/12/1956 בשעה 20:01","StartDate":"1956-12-03T20:01:00+02:00","FinishDate":"1956-12-03T21:30:00+02:00","IsSpecialMeeting":null,"LastUpdatedDate":"2021-12-15T17:29:16.833+02:00"}
{"Id":489388,"Number":247,"KnessetNum":3,"Name":"ישיבת מליאה בתאריך 19/02/1957 בשעה 20:04","StartDate":"1957-02-19T20:04:00+02:00","FinishDate":"1957-02-19T22:07:00+02:00","IsSpecialMeeting":null,"LastUpdatedDate":"2022-02-01T17:46:26.1+02:00"}
{"Id":489389,"Number":267,"KnessetNum":3,"Name":"ישיבת מליאה בתאריך 20/03/1957 בשעה 20:02","StartDate":"1957-03-20T20:02:00+02:00","FinishDate":"1957-03-20T21:25:00+02:00","IsSpecialMeeting":null,"LastUpdatedDate":"2022-02-14T07:02:58.89+02:00"}
{"Id":489390,"Number":309,"KnessetNum":3,"Name":"ישיבת מליאה בתאריך 18/06/1957 בשעה 20:00","StartDate":"1957-06-18T20:00:00+03:00","FinishDate":"1957-06-18T21:57:00+03:00","IsSpecialMeeting":null,"LastUpdatedDate":"2022-02-23T13:34:15.567+02:00"}
{"Id":489391,"Number":333,"KnessetNum":3,"Name":"ישיבת מליאה בתאריך 23/07/1957 בשעה 20:18","StartDate":"1957-07-23T20:18:00+03:00","FinishDate":"1957-07-23T22:10:00+03:00","IsSpecialMeeting":null,"LastUpdatedDate":"2022-02-24T15:00:30.883+02:00"}
{"Id":489392,"Number":338,"KnessetNum":3,"Name":"ישיבת מליאה בתאריך 30/07/1957 בשעה 20:10","StartDate":"1957-07-30T20:10:00+03:00","FinishDate":"1957-07-30T22:10:00+03:00","IsSpecialMeeting":null,"LastUpdatedDate":"2022-02-24T17:01:15.777+02:00"}
{"Id":489393,"Number":376,"KnessetNum":3,"Name":"ישיבת מליאה בתאריך 16/12/1957 בשעה 20:07","StartDate":"1957-12-16T20:07:00+02:00","FinishDate":"1957-12-16T21:40:00+02:00","IsSpecialMeeting":null,"LastUpdatedDate":"2022-03-03T14:48:00.317+02:00"}
{"Id":489394,"Number":410,"KnessetNum":3,"Name":"ישיבת מליאה בתאריך 11/02/1958 בשעה 20:15","StartDate":"1958-02-11T20:15:00+02:00","FinishDate":"1958-02-11T23:03:00+02:00","IsSpecialMeeting":null,"LastUpdatedDate":"2022-03-08T18:31:21.057+02:00"}
{"Id":489395,"Number":412,"KnessetNum":3,"Name":"ישיבת מליאה בתאריך 12/02/1958 בשעה 14:38","StartDate":"1958-02-12T14:38:00+02:00","FinishDate":"1958-02-12T19:30:00+02:00","IsSpecialMeeting":null,"LastUpdatedDate":"2022-03-08T18:38:45.2+02:00"}
{"Id":489396,"Number":455,"KnessetNum":3,"Name":"ישיבת מליאה בתאריך 19/05/1958 בשעה 20:03","StartDate":"1958-05-19T20:03:00+03:00","FinishDate":"1958-05-19T21:25:00+03:00","IsSpecialMeeting":null,"LastUpdatedDate":"2022-03-10T15:47:33.12+02:00"}
{"Id":489397,"Number":511,"KnessetNum":3,"Name":"ישיבת מליאה בתאריך 06/08/1958 בשעה 14:07","StartDate":"1958-08-06T14:07:00+03:00","FinishDate":"1958-08-06T16:30:00+03:00","IsSpecialMeeting":null,"LastUpdatedDate":"2022-04-05T16:32:18.003+03:00"}
{"Id":489398,"Number":522,"KnessetNum":3,"Name":"ישיבת מליאה בתאריך 27/10/1958 בשעה 20:02","StartDate":"1958-10-27T20:02:00+02:00","FinishDate":"1958-10-27T21:35:00+02:00","IsSpecialMeeting":null,"LastUpdatedDate":"2022-04-07T10:20:33.693+03:00"}
{"Id":489399,"Number":526,"KnessetNum":3,"Name":"ישיבת מליאה בתאריך 03/11/1958 בשעה 20:07","StartDate":"1958-11-03T20:07:00+02:00","FinishDate":"1958-11-03T21:51:00+02:00","IsSpecialMeeting":null,"LastUpdatedDate":"2022-04-07T12:52:48.247+03:00"}
{"Id":489400,"Number":528,"KnessetNum":3,"Name":"ישיבת מליאה בתאריך 04/11/1958 בשעה 20:01","StartDate":"1958-11-04T20:01:00+02:00","FinishDate":"1958-11-04T21:06:00+02:00","IsSpecialMeeting":null,"LastUpdatedDate":"2022-04-07T14:13:34.093+03:00"}
{"Id":489401,"Number":535,"KnessetNum":3,"Name":"ישיבת מליאה בתאריך 17/11/1958 בשעה 20:05","StartDate":"1958-11-17T20:05:00+02:00","FinishDate":"1958-11-17T21:30:00+02:00","IsSpecialMeeting":null,"LastUpdatedDate":"2022-04-10T09:26:15.05+03:00"}
{"Id":489402,"Number":549,"KnessetNum":3,"Name":"ישיבת מליאה בתאריך 08/12/1958 בשעה 20:05","StartDate":"1958-12-08T20:05:00+02:00","FinishDate":"1958-12-08T22:10:00+02:00","IsSpecialMeeting":null,"LastUpdatedDate":"2022-04-10T15:53:19.613+03:00"}
{"Id":489403,"Number":566,"KnessetNum":3,"Name":"ישיבת מליאה בתאריך 30/12/1958 בשעה 20:08","StartDate":"1958-12-30T20:08:00+02:00","FinishDate":"1958-12-30T21:13:00+02:00","IsSpecialMeeting":null,"LastUpdatedDate":"2022-04-13T08:07:48.647+03:00"}
{"Id":489404,"Number":595,"KnessetNum":3,"Name":"ישיבת מליאה בתאריך 23/02/1959 בשעה 20:02","StartDate":"1959-02-23T20:02:00+02:00","FinishDate":"1959-02-23T22:45:00+02:00","IsSpecialMeeting":null,"LastUpdatedDate":"2022-05-08T10:05:10.477+03:00"}
{"Id":489405,"Number":597,"KnessetNum":3,"Name":"ישיבת מליאה בתאריך 24/02/1959 בשעה 20:08","StartDate":"1959-02-24T20:08:00+02:00","FinishDate":"1959-02-24T22:22:00+02:00","IsSpecialMeeting":null,"LastUpdatedDate":"2022-05-08T10:08:42.773+03:00"}
{"Id":489406,"Number":606,"KnessetNum":3,"Name":"ישיבת מליאה בתאריך 09/03/1959 בשעה 20:10","StartDate":"1959-03-09T20:10:00+02:00","FinishDate":"1959-03-09T22:36:00+02:00","IsSpecialMeeting":null,"LastUpdatedDate":"2023-10-31T13:55:57.65+02:00"}
{"Id":489407,"Number":638,"KnessetNum":3,"Name":"ישיבת מליאה בתאריך 26/05/1959 בשעה 19:08","StartDate":"1959-05-26T19:08:00+03:00","FinishDate":"1959-05-26T22:07:00+03:00","IsSpecialMeeting":null,"LastUpdatedDate":"2023-10-29T13:46:11.867+02:00"}
{"Id":489408,"Number":653,"KnessetNum":3,"Name":"ישיבת מליאה בתאריך 16/06/1959 בשעה 20:08","StartDate":"1959-06-16T20:08:00+03:00","FinishDate":"1959-06-16T21:50:00+03:00","IsSpecialMeeting":null,"LastUpdatedDate":"2023-10-29T12:50:28.3+02:00"}
{"Id":489409,"Number":149,"KnessetNum":4,"Name":"ישיבת מליאה בתאריך 04/08/1960 בשעה 13:30","StartDate":"1960-08-04T13:30:00+03:00","FinishDate":"1960-08-04T14:45:00+03:00","IsSpecialMeeting":null,"LastUpdatedDate":"2021-12-23T12:48:01.987+02:00"}
{"Id":489410,"Number":237,"KnessetNum":4,"Name":"ישיבת מליאה בתאריך 21/02/1961 בשעה 20:31","StartDate":"1961-02-21T20:31:00+02:00","FinishDate":"1961-02-21T21:54:00+02:00","IsSpecialMeeting":null,"LastUpdatedDate":"2021-12-29T14:40:28.173+02:00"}
{"Id":489411,"Number":240,"KnessetNum":4,"Name":"ישיבת מליאה בתאריך 27/02/1961 בשעה 20:03","StartDate":"1961-02-27T20:03:00+02:00","FinishDate":"1961-02-27T21:55:00+02:00","IsSpecialMeeting":null,"LastUpdatedDate":"2022-01-10T14:07:00.85+02:00"}
{"Id":489412,"Number":245,"KnessetNum":4,"Name":"ישיבת מליאה בתאריך 06/03/1961 בשעה 20:01","StartDate":"1961-03-06T20:01:00+02:00","FinishDate":"1961-03-06T22:12:00+02:00","IsSpecialMeeting":null,"LastUpdatedDate":"2022-01-10T16:30:48.713+02:00"}
{"Id":489413,"Number":285,"KnessetNum":4,"Name":"ישיבת מליאה בתאריך 06/06/1961 בשעה 20:00","StartDate":"1961-06-06T20:00:00+03:00","FinishDate":"1961-06-06T23:59:00+03:00","IsSpecialMeeting":null,"LastUpdatedDate":"2024-02-01T14:52:38.317+02:00"}
{"Id":489414,"Number":288,"KnessetNum":4,"Name":"ישיבת מליאה בתאריך 12/06/1961 בשעה 20:15","StartDate":"1961-06-12T20:15:00+03:00","FinishDate":"1961-06-12T22:17:00+03:00","IsSpecialMeeting":null,"LastUpdatedDate":"2022-01-17T09:18:06.263+02:00"}
{"Id":489415,"Number":102,"KnessetNum":5,"Name":"ישיבת מליאה בתאריך 27/02/1962 בשעה 20:07","StartDate":"1962-02-27T20:07:00+02:00","FinishDate":"1962-02-27T21:18:00+02:00","IsSpecialMeeting":null,"LastUpdatedDate":"2022-01-30T09:55:21.677+02:00"}
{"Id":489416,"Number":105,"KnessetNum":5,"Name":"ישיבת מליאה בתאריך 05/03/1962 בשעה 20:02","StartDate":"1962-03-05T20:02:00+02:00","FinishDate":"1962-03-05T21:35:00+02:00","IsSpecialMeeting":null,"LastUpdatedDate":"2022-01-30T11:15:20.687+02:00"}
{"Id":489417,"Number":107,"KnessetNum":5,"Name":"ישיבת מליאה בתאריך 06/03/1962 בשעה 20:04","StartDate":"1962-03-06T20:04:00+02:00","FinishDate":"1962-03-06T22:25:00+02:00","IsSpecialMeeting":null,"LastUpdatedDate":"2022-01-30T11:45:02.13+02:00"}
{"Id":489418,"Number":366,"KnessetNum":9,"Name":"ישיבת מליאה בתאריך 01/09/1980 בשעה 11:51","StartDate":"1980-09-01T11:51:00+03:00","FinishDate":"1980-09-01T13:28:00+03:00","IsSpecialMeeting":null,"LastUpdatedDate":"2020-10-18T10:58:59.787+03:00"}
{"Id":489419,"Number":4,"KnessetNum":3,"Name":"ישיבת מליאה בתאריך 01/09/1955 בשעה 16:06","StartDate":"1955-09-01T16:06:00+03:00","FinishDate":"1955-09-01T19:07:00+03:00","IsSpecialMeeting":null,"LastUpdatedDate":"2021-09-05T10:16:56.643+03:00"}
{"Id":489425,"Number":33,"KnessetNum":3,"Name":"ישיבת מליאה בתאריך 05/12/1955 בשעה 16:08","StartDate":"1955-12-05T16:08:00+02:00","FinishDate":"1955-12-05T19:05:00+02:00","IsSpecialMeeting":null,"LastUpdatedDate":"2021-11-09T17:45:27.443+02:00"}
{"Id":489427,"Number":59,"KnessetNum":3,"Name":"ישיבת מליאה בתאריך 16/01/1956 בשעה 16:13","StartDate":"1956-01-16T16:13:00+02:00","FinishDate":null,"IsSpecialMeeting":null,"LastUpdatedDate":"2021-12-26T12:45:25.62+02:00"}
{"Id":489431,"Number":505,"KnessetNum":3,"Name":"ישיבת מליאה בתאריך 04/08/1958 בשעה 16:10","StartDate":"1958-08-04T16:10:00+03:00","FinishDate":"1958-08-04T19:10:00+03:00","IsSpecialMeeting":null,"LastUpdatedDate":"2022-04-05T11:33:26.823+03:00"}
{"Id":489432,"Number":601,"KnessetNum":3,"Name":"ישיבת מליאה בתאריך 03/03/1959 בשעה 15:00","StartDate":"1959-03-03T15:00:00+02:00","FinishDate":"1959-03-03T18:56:00+02:00","IsSpecialMeeting":null,"LastUpdatedDate":"2022-05-08T10:45:17.51+03:00"}
{"Id":489434,"Number":18,"KnessetNum":4,"Name":"ישיבת מליאה בתאריך 29/12/1959 בשעה 16:06","StartDate":"1959-12-29T16:06:00+02:00","FinishDate":"1959-12-29T18:08:00+02:00","IsSpecialMeeting":null,"LastUpdatedDate":"2021-12-15T12:02:16.613+02:00"}
{"Id":489435,"Number":23,"KnessetNum":4,"Name":"ישיבת מליאה בתאריך 05/01/1960 בשעה 16:13","StartDate":"1960-01-05T16:13:00+02:00","FinishDate":"1960-01-05T19:10:00+02:00","IsSpecialMeeting":null,"LastUpdatedDate":"2021-12-15T13:12:36.813+02:00"}
{"Id":489440,"Number":90,"KnessetNum":4,"Name":"ישיבת מליאה בתאריך 10/05/1960 בשעה 16:01","StartDate":"1960-05-10T16:01:00+03:00","FinishDate":"1960-05-10T19:00:00+03:00","IsSpecialMeeting":null,"LastUpdatedDate":"2022-01-20T09:26:41.093+02:00"}
{"Id":489442,"Number":34,"KnessetNum":5,"Name":"ישיבת מליאה בתאריך 27/11/1961 בשעה 16:05","StartDate":"1961-11-27T16:05:00+02:00","FinishDate":"1961-11-27T18:59:00+02:00","IsSpecialMeeting":null,"LastUpdatedDate":"2022-01-18T12:21:23.4+02:00"}
{"Id":489444,"Number":209,"KnessetNum":8,"Name":"ישיבת מליאה בתאריך 18/08/1975 בשעה 12:55","StartDate":"1975-08-18T12:55:00+03:00","FinishDate":"1975-08-18T15:45:00+03:00","IsSpecialMeeting":null,"LastUpdatedDate":"2022-01-17T01:04:20.867+02:00"}
{"Id":489445,"Number":328,"KnessetNum":8,"Name":"ישיבת מליאה בתאריך 24/08/1976 בשעה 12:10","StartDate":"1976-08-24T12:10:00+03:00","FinishDate":"1976-08-24T13:58:00+03:00","IsSpecialMeeting":null,"LastUpdatedDate":"2022-06-16T11:34:29.333+03:00"}
{"Id":489446,"Number":5,"KnessetNum":3,"Name":"ישיבת מליאה בתאריך 01/09/1955 בשעה 20:12","StartDate":"1955-09-01T20:12:00+03:00","FinishDate":"1955-09-01T23:00:00+03:00","IsSpecialMeeting":null,"LastUpdatedDate":"2021-09-05T10:13:41.993+03:00"}
{"Id":489447,"Number":12,"KnessetNum":3,"Name":"ישיבת מליאה בתאריך 24/10/1955 בשעה 20:35","StartDate":"1955-10-24T20:35:00+02:00","FinishDate":"1955-10-24T22:43:00+02:00","IsSpecialMeeting":null,"LastUpdatedDate":"2021-08-15T14:52:41.467+03:00"}
{"Id":489448,"Number":14,"KnessetNum":3,"Name":"ישיבת מליאה בתאריך 25/10/1955 בשעה 20:00","StartDate":"1955-10-25T20:00:00+02:00","FinishDate":"1955-10-25T21:47:00+02:00","IsSpecialMeeting":null,"LastUpdatedDate":"2021-08-15T17:19:11.657+03:00"}
{"Id":489449,"Number":25,"KnessetNum":3,"Name":"ישיבת מליאה בתאריך 15/11/1955 בשעה 20:01","StartDate":"1955-11-15T20:01:00+02:00","FinishDate":"1955-11-15T21:59:00+02:00","IsSpecialMeeting":null,"LastUpdatedDate":"2021-11-04T14:34:11.81+02:00"}
{"Id":489450,"Number":34,"KnessetNum":3,"Name":"ישיבת מליאה בתאריך 05/12/1955 בשעה 20:16","StartDate":"1955-12-05T20:16:00+02:00","FinishDate":"1955-12-05T21:47:00+02:00","IsSpecialMeeting":null,"LastUpdatedDate":"2021-11-09T18:51:31.74+02:00"}
{"Id":489451,"Number":57,"KnessetNum":3,"Name":"ישיבת מליאה בתאריך 10/01/1956 בשעה 20:02","StartDate":"1956-01-10T20:02:00+02:00","FinishDate":"1956-01-10T22:28:00+02:00","IsSpecialMeeting":null,"LastUpdatedDate":"2021-11-25T18:50:13.343+02:00"}
{"Id":489452,"Number":287,"KnessetNum":3,"Name":"ישיבת מליאה בתאריך 10/04/1957 בשעה 16:03","StartDate":"1957-04-10T16:03:00+03:00","FinishDate":"1957-04-10T18:45:00+03:00","IsSpecialMeeting":null,"LastUpdatedDate":"2022-02-17T11:43:51.7+02:00"}
{"Id":489453,"Number":408,"KnessetNum":3,"Name":"ישיבת מליאה בתאריך 10/02/1958 בשעה 20:16","StartDate":"1958-02-10T20:16:00+02:00","FinishDate":"1958-02-10T22:41:00+02:00","IsSpecialMeeting":null,"LastUpdatedDate":"2022-03-08T18:19:46.3+02:00"}
{"Id":489454,"Number":506,"KnessetNum":3,"Name":"ישיבת מליאה בתאריך 04/08/1958 בשעה 20:05","StartDate":"1958-08-04T20:05:00+03:00","FinishDate":"1958-08-04T23:15:00+03:00","IsSpecialMeeting":null,"LastUpdatedDate":"2022-04-05T11:37:24.217+03:00"}
{"Id":489455,"Number":602,"KnessetNum":3,"Name":"ישיבת מליאה בתאריך 03/03/1959 בשעה 20:05","StartDate":"1959-03-03T20:05:00+02:00","FinishDate":"1959-03-03T23:10:00+02:00","IsSpecialMeeting":null,"LastUpdatedDate":"2023-11-01T08:04:45.143+02:00"}
{"Id":489456,"Number":5,"KnessetNum":4,"Name":"ישיבת מליאה בתאריך 08/12/1959 בשעה 20:02","StartDate":"1959-12-08T20:02:00+02:00","FinishDate":"1959-12-08T21:26:00+02:00","IsSpecialMeeting":null,"LastUpdatedDate":"2021-12-15T09:20:01.88+02:00"}
{"Id":489457,"Number":19,"KnessetNum":4,"Name":"ישיבת מליאה בתאריך 29/12/1959 בשעה 20:02","StartDate":"1959-12-29T20:02:00+02:00","FinishDate":"1959-12-29T21:17:00+02:00","IsSpecialMeeting":null,"LastUpdatedDate":"2021-12-15T12:08:00.24+02:00"}
{"Id":489458,"Number":24,"KnessetNum":4,"Name":"ישיבת מליאה בתאריך 05/01/1960 בשעה 20:04","StartDate":"1960-01-05T20:04:00+02:00","FinishDate":"1960-01-05T21:47:00+02:00","IsSpecialMeeting":null,"LastUpdatedDate":"2021-12-15T13:20:41.123+02:00"}
{"Id":489459,"Number":29,"KnessetNum":4,"Name":"ישיבת מליאה בתאריך 12/01/1960 בשעה 20:03","StartDate":"1960-01-12T20:03:00+02:00","FinishDate":"1960-01-12T22:15:00+02:00","IsSpecialMeeting":null,"LastUpdatedDate":"2021-12-16T06:59:35.267+02:00"}
{"Id":489460,"Number":32,"KnessetNum":4,"Name":"ישיבת מליאה בתאריך 18/01/1960 בשעה 20:15","StartDate":"1960-01-18T20:15:00+02:00","FinishDate":"1960-01-18T21:45:00+02:00","IsSpecialMeeting":null,"LastUpdatedDate":"2023-07-09T14:55:08.827+03:00"}
{"Id":489461,"Number":56,"KnessetNum":4,"Name":"ישיבת מליאה בתאריך 22/02/1960 בשעה 20:00","StartDate":"1960-02-22T20:00:00+02:00","FinishDate":"1960-02-22T20:09:00+02:00","IsSpecialMeeting":null,"LastUpdatedDate":"2021-12-20T08:39:22.517+02:00"}
{"Id":489462,"Number":91,"KnessetNum":4,"Name":"ישיבת מליאה בתאריך 10/05/1960 בשעה 20:02","StartDate":"1960-05-10T20:02:00+03:00","FinishDate":"1960-05-10T21:20:00+03:00","IsSpecialMeeting":null,"LastUpdatedDate":"2021-12-21T08:38:17.947+02:00"}
{"Id":489463,"Number":25,"KnessetNum":5,"Name":"ישיבת מליאה בתאריך 13/11/1961 בשעה 19:58","StartDate":"1961-11-13T19:58:00+02:00","FinishDate":"1961-11-13T20:53:00+02:00","IsSpecialMeeting":null,"LastUpdatedDate":"2022-01-18T08:40:30.99+02:00"}
{"Id":489464,"Number":35,"KnessetNum":5,"Name":"ישיבת מליאה בתאריך 27/11/1961 בשעה 20:00","StartDate":"1961-11-27T20:00:00+02:00","FinishDate":"1961-11-27T21:09:00+02:00","IsSpecialMeeting":null,"LastUpdatedDate":"2022-01-18T12:34:35.613+02:00"}
{"Id":489465,"Number":40,"KnessetNum":5,"Name":"ישיבת מליאה בתאריך 04/12/1961 בשעה 20:01","StartDate":"1961-12-04T20:01:00+02:00","FinishDate":"1961-12-04T21:15:00+02:00","IsSpecialMeeting":null,"LastUpdatedDate":"2022-01-18T15:11:41.18+02:00"}
{"Id":489466,"Number":288,"KnessetNum":3,"Name":"ישיבת מליאה בתאריך 10/04/1957 בשעה 19:18","StartDate":"1957-04-10T19:18:00+03:00","FinishDate":"1957-04-10T23:52:00+03:00","IsSpecialMeeting":null,"LastUpdatedDate":"2022-02-17T12:47:37.553+02:00"}
{"Id":489467,"Number":363,"KnessetNum":3,"Name":"ישיבת מליאה בתאריך 25/11/1957 בשעה 16:16","StartDate":"1957-11-25T16:16:00+02:00","FinishDate":"1957-11-25T18:51:00+02:00","IsSpecialMeeting":null,"LastUpdatedDate":"2022-03-02T19:37:05.537+02:00"}
{"Id":489468,"Number":354,"KnessetNum":3,"Name":"ישיבת מליאה בתאריך 11/11/1957 בשעה 16:10","StartDate":"1957-11-11T16:10:00+02:00","FinishDate":"1957-11-11T19:03:00+02:00","IsSpecialMeeting":null,"LastUpdatedDate":"2022-03-01T16:45:54.89+02:00"}
{"Id":489469,"Number":351,"KnessetNum":3,"Name":"ישיבת מליאה בתאריך 05/11/1957 בשעה 15:05","StartDate":"1957-11-05T15:05:00+02:00","FinishDate":"1957-11-05T18:40:00+02:00","IsSpecialMeeting":null,"LastUpdatedDate":"2022-03-01T10:05:46.72+02:00"}
{"Id":489470,"Number":352,"KnessetNum":3,"Name":"ישיבת מליאה בתאריך 05/11/1957 בשעה 20:08","StartDate":"1957-11-05T20:08:00+02:00","FinishDate":"1957-11-05T21:31:00+02:00","IsSpecialMeeting":null,"LastUpdatedDate":"2022-03-01T16:29:27.493+02:00"}
{"Id":489471,"Number":371,"KnessetNum":3,"Name":"ישיבת מליאה בתאריך 09/12/1957 בשעה 20:05","StartDate":"1957-12-09T20:05:00+02:00","FinishDate":"1957-12-09T21:33:00+02:00","IsSpecialMeeting":null,"LastUpdatedDate":"2022-03-03T12:09:44.26+02:00"}
{"Id":489472,"Number":372,"KnessetNum":3,"Name":"ישיבת מליאה בתאריך 10/12/1957 בשעה 16:00","StartDate":"1957-12-10T16:00:00+02:00","FinishDate":"1957-12-10T19:20:00+02:00","IsSpecialMeeting":null,"LastUpdatedDate":"2022-03-03T12:14:23.95+02:00"}
{"Id":489473,"Number":1,"KnessetNum":0,"Name":"ישיבת מליאה בתאריך 04/05/1948 בשעה 00:00","StartDate":"1948-05-04T00:00:00+03:00","FinishDate":null,"IsSpecialMeeting":null,"LastUpdatedDate":"2018-05-14T17:39:05.8+03:00"}
{"Id":489474,"Number":2,"KnessetNum":0,"Name":"ישיבת מליאה בתאריך 05/05/1948 בשעה 00:00","StartDate":"1948-05-05T00:00:00+03:00","FinishDate":null,"IsSpecialMeeting":null,"LastUpdatedDate":"2018-05-14T17:42:45.107+03:00"}
{"Id":489475,"Number":3,"KnessetNum":0,"Name":"ישיבת מליאה בתאריך 14/05/1948 בשעה 00:00","StartDate":"1948-05-14T00:00:00+03:00","FinishDate":null,"IsSpecialMeeting":null,"LastUpdatedDate":"2018-05-14T18:23:36.74+03:00"}
{"Id":489476,"Number":4,"KnessetNum":0,"Name":"ישיבת מליאה בתאריך 14/05/1948 בשעה 00:00","StartDate":"1948-05-14T00:00:00+03:00","FinishDate":null,"IsSpecialMeeting":null,"LastUpdatedDate":"2018-05-14T18:25:44.463+03:00"}
{"Id":489477,"Number":1,"KnessetNum":0,"Name":"ישיבת מליאה בתאריך 16/05/1948 בשעה 00:00","StartDate":"1948-05-16T00:00:00+03:00","FinishDate":null,"IsSpecialMeeting":null,"LastUpdatedDate":"2018-05-14T16:40:55.2+03:00"}
{"Id":489478,"Number":2,"KnessetNum":0,"Name":"ישיבת מליאה בתאריך 19/05/1948 בשעה 00:00","StartDate":"1948-05-19T00:00:00+03:00","FinishDate":null,"IsSpecialMeeting":null,"LastUpdatedDate":"2018-05-14T18:03:49.743+03:00"}
{"Id":489479,"Number":3,"KnessetNum":0,"Name":"ישיבת מליאה בתאריך 03/06/1948 בשעה 00:00","StartDate":"1948-06-03T00:00:00+03:00","FinishDate":null,"IsSpecialMeeting":null,"LastUpdatedDate":"2018-05-14T18:04:59.93+03:00"}
{"Id":489480,"Number":4,"KnessetNum":0,"Name":"ישיבת מליאה בתאריך 17/06/1948 בשעה 00:00","StartDate":"1948-06-17T00:00:00+03:00","FinishDate":null,"IsSpecialMeeting":null,"LastUpdatedDate":"2018-05-31T15:49:52.18+03:00"}
{"Id":489481,"Number":5,"KnessetNum":0,"Name":"ישיבת מליאה בתאריך 23/06/1948 בשעה 00:00","StartDate":"1948-06-23T00:00:00+03:00","FinishDate":null,"IsSpecialMeeting":null,"LastUpdatedDate":"2018-05-31T17:42:03.27+03:00"}
{"Id":489482,"Number":6,"KnessetNum":0,"Name":"ישיבת מליאה בתאריך 24/06/1948 בשעה 00:00","StartDate":"1948-06-24T00:00:00+03:00","FinishDate":null,"IsSpecialMeeting":null,"LastUpdatedDate":"2018-06-06T10:21:18.33+03:00"}
{"Id":489483,"Number":7,"KnessetNum":0,"Name":"ישיבת מליאה בתאריך 01/07/1948 בשעה 00:00","StartDate":"1948-07-01T00:00:00+03:00","FinishDate":null,"IsSpecialMeeting":null,"LastUpdatedDate":"2018-06-06T13:08:46.09+03:00"}
{"Id":489484,"Number":8,"KnessetNum":0,"Name":"ישיבת מליאה בתאריך 05/07/1948 בשעה 00:00","StartDate":"1948-07-05T00:00:00+03:00","FinishDate":null,"IsSpecialMeeting":null,"LastUpdatedDate":"2018-06-06T13:26:11.597+03:00"}
{"Id":489485,"Number":9,"KnessetNum":0,"Name":"ישיבת מליאה בתאריך 08/07/1948 בשעה: 00:00:00","StartDate":"1948-07-08T00:00:00+03:00","FinishDate":null,"IsSpecialMeeting":null,"LastUpdatedDate":"2014-08-17T15:12:53+03:00"}
{"Id":489486,"Number":10,"KnessetNum":0,"Name":"ישיבת מליאה בתאריך 15/07/1948 בשעה: 00:00:00","StartDate":"1948-07-15T00:00:00+03:00","FinishDate":null,"IsSpecialMeeting":null,"LastUpdatedDate":"2014-08-17T15:12:53+03:00"}
{"Id":489487,"Number":11,"KnessetNum":0,"Name":"ישיבת מליאה בתאריך 22/07/1948 בשעה: 00:00:00","StartDate":"1948-07-22T00:00:00+03:00","FinishDate":null,"IsSpecialMeeting":null,"LastUpdatedDate":"2014-08-17T15:12:53+03:00"}
{"Id":489488,"Number":12,"KnessetNum":0,"Name":"ישיבת מליאה בתאריך 29/07/1948 בשעה: 00:00:00","StartDate":"1948-07-29T00:00:00+03:00","FinishDate":null,"IsSpecialMeeting":null,"LastUpdatedDate":"2014-08-17T15:12:53+03:00"}
{"Id":489489,"Number":13,"KnessetNum":0,"Name":"ישיבת מליאה בתאריך 05/08/1948 בשעה: 00:00:00","StartDate":"1948-08-05T00:00:00+03:00","FinishDate":null,"IsSpecialMeeting":null,"LastUpdatedDate":"2014-08-17T15:12:53+03:00"}
{"Id":489490,"Number":14,"KnessetNum":0,"Name":"ישיבת מליאה בתאריך 12/08/1948 בשעה: 00:00:00","StartDate":"1948-08-12T00:00:00+03:00","FinishDate":null,"IsSpecialMeeting":null,"LastUpdatedDate":"2014-08-17T15:12:53+03:00"}
{"Id":489491,"Number":15,"KnessetNum":0,"Name":"ישיבת מליאה בתאריך 16/08/1948 בשעה: 00:00:00","StartDate":"1948-08-16T00:00:00+03:00","FinishDate":null,"IsSpecialMeeting":null,"LastUpdatedDate":"2014-08-17T15:12:53+03:00"}
{"Id":489492,"Number":16,"KnessetNum":0,"Name":"ישיבת מליאה בתאריך 02/09/1948 בשעה: 00:00:00","StartDate":"1948-09-02T00:00:00+03:00","FinishDate":null,"IsSpecialMeeting":null,"LastUpdatedDate":"2014-08-17T15:12:53+03:00"}
{"Id":489493,"Number":17,"KnessetNum":0,"Name":"ישיבת מליאה בתאריך 09/09/1948 בשעה: 00:00:00","StartDate":"1948-09-09T00:00:00+03:00","FinishDate":null,"IsSpecialMeeting":null,"LastUpdatedDate":"2014-08-17T15:12:53+03:00"}
{"Id":489494,"Number":18,"KnessetNum":0,"Name":"ישיבת מליאה בתאריך 16/09/1948 בשעה: 00:00:00","StartDate":"1948-09-16T00:00:00+03:00","FinishDate":null,"IsSpecialMeeting":null,"LastUpdatedDate":"2014-08-17T15:12:53+03:00"}
{"Id":489495,"Number":19,"KnessetNum":0,"Name":"ישיבת מליאה בתאריך 23/09/1948 בשעה: 00:00:00","StartDate":"1948-09-23T00:00:00+02:00","FinishDate":null,"IsSpecialMeeting":null,"LastUpdatedDate":"2014-08-17T15:12:53+03:00"}
{"Id":489496,"Number":20,"KnessetNum":0,"Name":"ישיבת מליאה בתאריך 27/09/1948 בשעה: 00:00:00","StartDate":"1948-09-27T00:00:00+02:00","FinishDate":null,"IsSpecialMeeting":null,"LastUpdatedDate":"2014-08-17T15:12:53+03:00"}
{"Id":489497,"Number":21,"KnessetNum":0,"Name":"ישיבת מליאה בתאריך 30/09/1948 בשעה: 00:00:00","StartDate":"1948-09-30T00:00:00+02:00","FinishDate":null,"IsSpecialMeeting":null,"LastUpdatedDate":"2014-08-17T15:12:53+03:00"}
{"Id":489498,"Number":22,"KnessetNum":0,"Name":"ישיבת מליאה בתאריך 07/10/1948 בשעה: 00:00:00","StartDate":"1948-10-07T00:00:00+02:00","FinishDate":null,"IsSpecialMeeting":null,"LastUpdatedDate":"2014-08-17T15:12:53+03:00"}
{"Id":489499,"Number":23,"KnessetNum":0,"Name":"ישיבת מליאה בתאריך 14/10/1948 בשעה: 00:00:00","StartDate":"1948-10-14T00:00:00+02:00","FinishDate":null,"IsSpecialMeeting":null,"LastUpdatedDate":"2014-08-17T15:12:53+03:00"}
{"Id":489500,"Number":24,"KnessetNum":0,"Name":"ישיבת מליאה בתאריך 28/10/1948 בשעה: 00:00:00","StartDate":"1948-10-28T00:00:00+02:00","FinishDate":null,"IsSpecialMeeting":null,"LastUpdatedDate":"2014-08-17T15:12:53+03:00"}
{"Id":489501,"Number":25,"KnessetNum":0,"Name":"ישיבת מליאה בתאריך 06/11/1948 בשעה: 00:00:00","StartDate":"1948-11-06T00:00:00+02:00","FinishDate":null,"IsSpecialMeeting":null,"LastUpdatedDate":"2014-08-17T15:12:53+03:00"}
{"Id":489502,"Number":26,"KnessetNum":0,"Name":"ישיבת מליאה בתאריך 11/11/1948 בשעה: 00:00:00","StartDate":"1948-11-11T00:00:00+02:00","FinishDate":null,"IsSpecialMeeting":null,"LastUpdatedDate":"2014-08-17T15:12:53+03:00"}
{"Id":489503,"Number":27,"KnessetNum":0,"Name":"ישיבת מליאה בתאריך 18/11/1948 בשעה: 00:00:00","StartDate":"1948-11-18T00:00:00+02:00","FinishDate":null,"IsSpecialMeeting":null,"LastUpdatedDate":"2014-08-17T15:12:53+03:00"}
{"Id":489504,"Number":28,"KnessetNum":0,"Name":"ישיבת מליאה בתאריך 25/11/1948 בשעה: 00:00:00","StartDate":"1948-11-25T00:00:00+02:00","FinishDate":null,"IsSpecialMeeting":null,"LastUpdatedDate":"2014-08-17T15:12:53+03:00"}
{"Id":489505,"Number":29,"KnessetNum":0,"Name":"ישיבת מליאה בתאריך 02/12/1948 בשעה: 00:00:00","StartDate":"1948-12-02T00:00:00+02:00","FinishDate":null,"IsSpecialMeeting":null,"LastUpdatedDate":"2014-08-17T15:12:53+03:00"}
{"Id":489506,"Number":30,"KnessetNum":0,"Name":"ישיבת מליאה בתאריך 09/12/1948 בשעה: 00:00:00","StartDate":"1948-12-09T00:00:00+02:00","FinishDate":null,"IsSpecialMeeting":null,"LastUpdatedDate":"2014-08-17T15:12:53+03:00"}
{"Id":489507,"Number":31,"KnessetNum":0,"Name":"ישיבת מליאה בתאריך 16/12/1948 בשעה: 00:00:00","StartDate":"1948-12-16T00:00:00+02:00","FinishDate":null,"IsSpecialMeeting":null,"LastUpdatedDate":"2014-08-17T15:12:53+03:00"}
{"Id":489508,"Number":32,"KnessetNum":0,"Name":"ישיבת מליאה בתאריך 23/12/1948 בשעה 00:00","StartDate":"1948-12-23T00:00:00+02:00","FinishDate":null,"IsSpecialMeeting":false,"LastUpdatedDate":"2019-02-12T11:46:46.31+02:00"}
{"Id":489509,"Number":33,"KnessetNum":0,"Name":"ישיבת מליאה בתאריך 30/12/1948 בשעה: 00:00:00","StartDate":"1948-12-30T00:00:00+02:00","FinishDate":null,"IsSpecialMeeting":null,"LastUpdatedDate":"2014-08-17T15:12:53+03:00"}
{"Id":489510,"Number":34,"KnessetNum":0,"Name":"ישיבת מליאה בתאריך 06/01/1949 בשעה: 00:00:00","StartDate":"1949-01-06T00:00:00+02:00","FinishDate":null,"IsSpecialMeeting":null,"LastUpdatedDate":"2014-08-17T15:12:53+03:00"}
{"Id":489511,"Number":35,"KnessetNum":0,"Name":"ישיבת מליאה בתאריך 11/01/1949 בשעה: 00:00:00","StartDate":"1949-01-11T00:00:00+02:00","FinishDate":null,"IsSpecialMeeting":null,"LastUpdatedDate":"2014-08-17T15:12:53+03:00"}
{"Id":489512,"Number":36,"KnessetNum":0,"Name":"ישיבת מליאה בתאריך 13/01/1949 בשעה: 00:00:00","StartDate":"1949-01-13T00:00:00+02:00","FinishDate":null,"IsSpecialMeeting":null,"LastUpdatedDate":"2014-08-17T15:12:53+03:00"}
{"Id":489513,"Number":37,"KnessetNum":0,"Name":"ישיבת מליאה בתאריך 20/01/1949 בשעה: 00:00:00","StartDate":"1949-01-20T00:00:00+02:00","FinishDate":null,"IsSpecialMeeting":null,"LastUpdatedDate":"2014-08-17T15:12:53+03:00"}
{"Id":489514,"Number":38,"KnessetNum":0,"Name":"ישיבת מליאה בתאריך 27/01/1949 בשעה: 00:00:00","StartDate":"1949-01-27T00:00:00+02:00","FinishDate":null,"IsSpecialMeeting":null,"LastUpdatedDate":"2014-08-17T15:12:53+03:00"}
{"Id":489515,"Number":39,"KnessetNum":0,"Name":"ישיבת מליאה בתאריך 03/02/1949 בשעה: 00:00:00","StartDate":"1949-02-03T00:00:00+02:00","FinishDate":null,"IsSpecialMeeting":null,"LastUpdatedDate":"2014-08-17T15:12:53+03:00"}
{"Id":489516,"Number":40,"KnessetNum":0,"Name":"ישיבת מליאה בתאריך 10/02/1949 בשעה 18:13","StartDate":"1949-02-10T18:13:00+02:00","FinishDate":"1949-02-10T20:37:00+02:00","IsSpecialMeeting":null,"LastUpdatedDate":"2025-01-22T10:13:16.567+02:00"}
{"Id":489517,"Number":1,"KnessetNum":1,"Name":"ישיבת מליאה בתאריך 14/02/1949 בשעה 16:00","StartDate":"1949-02-14T16:00:00+02:00","FinishDate":"1949-02-14T18:00:00+02:00","IsSpecialMeeting":null,"LastUpdatedDate":"2020-10-11T13:32:38.6+03:00"}
{"Id":489518,"Number":2,"KnessetNum":1,"Name":"ישיבת מליאה בתאריך 15/02/1949 בשעה 10:15","StartDate":"1949-02-15T10:15:00+02:00","FinishDate":"1949-02-15T12:25:00+02:00","IsSpecialMeeting":null,"LastUpdatedDate":"2020-10-18T08:34:18.463+03:00"}
{"Id":489519,"Number":3,"KnessetNum":1,"Name":"ישיבת מליאה בתאריך 15/02/1949 בשעה 20:10","StartDate":"1949-02-15T20:10:00+02:00","FinishDate":"1949-02-15T20:40:00+02:00","IsSpecialMeeting":null,"LastUpdatedDate":"2020-10-18T08:35:46.653+03:00"}
{"Id":489520,"Number":5,"KnessetNum":1,"Name":"ישיבת מליאה בתאריך 16/02/1949 בשעה 23:55","StartDate":"1949-02-16T23:55:00+02:00","FinishDate":"1949-02-17T01:10:00+02:00","IsSpecialMeeting":null,"LastUpdatedDate":"2020-10-18T08:31:44.693+03:00"}
{"Id":489521,"Number":6,"KnessetNum":1,"Name":"ישיבת מליאה בתאריך 17/02/1949 בשעה 12:12","StartDate":"1949-02-17T12:12:00+02:00","FinishDate":"1949-02-17T12:45:00+02:00","IsSpecialMeeting":null,"LastUpdatedDate":"2020-10-18T08:27:56.637+03:00"}
{"Id":489522,"Number":7,"KnessetNum":1,"Name":"ישיבת מליאה בתאריך 08/03/1949 בשעה 16:08","StartDate":"1949-03-08T16:08:00+02:00","FinishDate":"1949-03-08T17:25:00+02:00","IsSpecialMeeting":null,"LastUpdatedDate":"2020-10-18T08:23:59.817+03:00"}
{"Id":489523,"Number":8,"KnessetNum":1,"Name":"ישיבת מליאה בתאריך 08/03/1949 בשעה 20:10","StartDate":"1949-03-08T20:10:00+02:00","FinishDate":"1949-03-08T23:05:00+02:00","IsSpecialMeeting":null,"LastUpdatedDate":"2020-10-18T08:25:44.937+03:00"}
{"Id":489524,"Number":10,"KnessetNum":1,"Name":"ישיבת מליאה בתאריך 09/03/1949 בשעה 16:08","StartDate":"1949-03-09T16:08:00+02:00","FinishDate":"1949-03-09T19:03:00+02:00","IsSpecialMeeting":null,"LastUpdatedDate":"2020-10-18T08:14:11.283+03:00"}
{"Id":489525,"Number":11,"KnessetNum":1,"Name":"ישיבת מליאה בתאריך 09/03/1949 בשעה 20:35","StartDate":"1949-03-09T20:35:00+02:00","FinishDate":"1949-03-09T23:00:00+02:00","IsSpecialMeeting":null,"LastUpdatedDate":"2020-10-18T08:20:00.337+03:00"}
{"Id":489526,"Number":9,"KnessetNum":1,"Name":"ישיבת מליאה בתאריך 09/03/1949 בשעה 10:00","StartDate":"1949-03-09T10:00:00+02:00","FinishDate":"1949-03-09T13:07:00+02:00","IsSpecialMeeting":null,"LastUpdatedDate":"2020-10-18T08:22:20.853+03:00"}
{"Id":489527,"Number":12,"KnessetNum":1,"Name":"ישיבת מליאה בתאריך 10/03/1949 בשעה 09:20","StartDate":"1949-03-10T09:20:00+02:00","FinishDate":"1949-03-10T17:05:00+02:00","IsSpecialMeeting":null,"LastUpdatedDate":"2020-10-18T08:11:55.63+03:00"}
{"Id":489528,"Number":16,"KnessetNum":1,"Name":"ישיבת מליאה בתאריך 23/03/1949 בשעה 16:15","StartDate":"1949-03-23T16:15:00+02:00","FinishDate":"1949-03-23T23:30:00+02:00","IsSpecialMeeting":null,"LastUpdatedDate":"2020-10-18T08:03:11.683+03:00"}
{"Id":489529,"Number":18,"KnessetNum":1,"Name":"ישיבת מליאה בתאריך 29/03/1949 בשעה 16:07","StartDate":"1949-03-29T16:07:00+02:00","FinishDate":"1949-03-29T19:50:00+02:00","IsSpecialMeeting":null,"LastUpdatedDate":"2020-10-15T13:41:39.31+03:00"}
{"Id":489530,"Number":26,"KnessetNum":1,"Name":"ישיבת מליאה בתאריך 27/04/1949 בשעה 16:20","StartDate":"1949-04-27T16:20:00+03:00","FinishDate":"1949-04-27T23:15:00+03:00","IsSpecialMeeting":null,"LastUpdatedDate":"2020-10-15T13:18:45.937+03:00"}
{"Id":489531,"Number":27,"KnessetNum":1,"Name":"ישיבת מליאה בתאריך 02/05/1949 בשעה 16:15","StartDate":"1949-05-02T16:15:00+03:00","FinishDate":"1949-05-02T22:45:00+03:00","IsSpecialMeeting":null,"LastUpdatedDate":"2020-10-15T13:16:52.64+03:00"}
{"Id":489532,"Number":29,"KnessetNum":1,"Name":"ישיבת מליאה בתאריך 11/05/1949 בשעה 16:10","StartDate":"1949-05-11T16:10:00+03:00","FinishDate":"1949-05-11T21:45:00+03:00","IsSpecialMeeting":null,"LastUpdatedDate":"2021-05-20T12:18:26.053+03:00"}
{"Id":489533,"Number":30,"KnessetNum":1,"Name":"ישיבת מליאה בתאריך 16/05/1949 בשעה 16:10","StartDate":"1949-05-16T16:10:00+03:00","FinishDate":"1949-05-16T19:00:00+03:00","IsSpecialMeeting":null,"LastUpdatedDate":"2021-05-20T12:31:53.367+03:00"}
{"Id":489534,"Number":31,"KnessetNum":1,"Name":"ישיבת מליאה בתאריך 17/05/1949 בשעה 16:10","StartDate":"1949-05-17T16:10:00+03:00","FinishDate":"1949-05-17T19:02:00+03:00","IsSpecialMeeting":null,"LastUpdatedDate":"2020-10-15T13:06:15.647+03:00"}
{"Id":489535,"Number":33,"KnessetNum":1,"Name":"ישיבת מליאה בתאריך 23/05/1949 בשעה 16:16","StartDate":"1949-05-23T16:16:00+03:00","FinishDate":"1949-05-23T22:35:00+03:00","IsSpecialMeeting":null,"LastUpdatedDate":"2020-10-15T12:40:58.133+03:00"}
{"Id":489536,"Number":37,"KnessetNum":1,"Name":"ישיבת מליאה בתאריך 01/06/1949 בשעה 16:10","StartDate":"1949-06-01T16:10:00+03:00","FinishDate":"1949-06-01T23:45:00+03:00","IsSpecialMeeting":null,"LastUpdatedDate":"2020-10-04T11:30:38.417+03:00"}
{"Id":489537,"Number":44,"KnessetNum":1,"Name":"ישיבת מליאה בתאריך 20/06/1949 בשעה 16:17","StartDate":"1949-06-20T16:17:00+03:00","FinishDate":"1949-06-20T23:15:00+03:00","IsSpecialMeeting":null,"LastUpdatedDate":"2020-10-15T12:06:59.563+03:00"}
{"Id":489538,"Number":48,"KnessetNum":1,"Name":"ישיבת מליאה בתאריך 28/06/1949 בשעה 16:10","StartDate":"1949-06-28T16:10:00+03:00","FinishDate":"1949-06-28T19:30:00+03:00","IsSpecialMeeting":null,"LastUpdatedDate":"2020-10-15T11:54:20.737+03:00"}
{"Id":489539,"Number":49,"KnessetNum":1,"Name":"ישיבת מליאה בתאריך 29/06/1949 בשעה 16:10","StartDate":"1949-06-29T16:10:00+03:00","FinishDate":"1949-06-29T22:35:00+03:00","IsSpecialMeeting":null,"LastUpdatedDate":"2021-05-27T09:57:00.08+03:00"}
{"Id":489540,"Number":50,"KnessetNum":1,"Name":"ישיבת מליאה בתאריך 04/07/1949 בשעה 16:10","StartDate":"1949-07-04T16:10:00+03:00","FinishDate":"1949-07-04T23:05:00+03:00","IsSpecialMeeting":null,"LastUpdatedDate":"2020-10-15T11:46:46.267+03:00"}
{"Id":489541,"Number":53,"KnessetNum":1,"Name":"ישיבת מליאה בתאריך 11/07/1949 בשעה 16:15","StartDate":"1949-07-11T16:15:00+03:00","FinishDate":"1949-07-11T22:45:00+03:00","IsSpecialMeeting":null,"LastUpdatedDate":"2020-10-15T11:36:51.067+03:00"}
{"Id":489542,"Number":55,"KnessetNum":1,"Name":"ישיבת מליאה בתאריך 13/07/1949 בשעה 16:11","StartDate":"1949-07-13T16:11:00+03:00","FinishDate":"1949-07-13T22:50:00+03:00","IsSpecialMeeting":null,"LastUpdatedDate":"2021-06-22T12:38:48.493+03:00"}
{"Id":489543,"Number":58,"KnessetNum":1,"Name":"ישיבת מליאה בתאריך 20/07/1949 בשעה 16:15","StartDate":"1949-07-20T16:15:00+03:00","FinishDate":"1949-07-20T23:00:00+03:00","IsSpecialMeeting":null,"LastUpdatedDate":"2020-10-15T10:57:48.14+03:00"}
{"Id":489544,"Number":64,"KnessetNum":1,"Name":"ישיבת מליאה בתאריך 03/08/1949 בשעה 14:10","StartDate":"1949-08-03T14:10:00+03:00","FinishDate":"1949-08-03T16:45:00+03:00","IsSpecialMeeting":null,"LastUpdatedDate":"2020-10-15T10:26:43.597+03:00"}
{"Id":489545,"Number":65,"KnessetNum":1,"Name":"ישיבת מליאה בתאריך 08/08/1949 בשעה 16:10","StartDate":"1949-08-08T16:10:00+03:00","FinishDate":"1949-08-08T21:10:00+03:00","IsSpecialMeeting":null,"LastUpdatedDate":"2021-05-31T17:22:55.163+03:00"}
{"Id":489546,"Number":69,"KnessetNum":1,"Name":"ישיבת מליאה בתאריך 16/08/1949 בשעה 12:00","StartDate":"1949-08-16T12:00:00+03:00","FinishDate":"1949-08-16T12:25:00+03:00","IsSpecialMeeting":null,"LastUpdatedDate":"2020-10-15T10:12:34.023+03:00"}
{"Id":489547,"Number":73,"KnessetNum":1,"Name":"ישיבת מליאה בתאריך 30/08/1949 בשעה 19:05","StartDate":"1949-08-30T19:05:00+03:00","FinishDate":"1949-08-30T21:25:00+03:00","IsSpecialMeeting":null,"LastUpdatedDate":"2020-10-15T09:52:07.71+03:00"}
{"Id":489548,"Number":75,"KnessetNum":1,"Name":"ישיבת מליאה בתאריך 01/09/1949 בשעה 16:10","StartDate":"1949-09-01T16:10:00+03:00","FinishDate":"1949-09-01T22:15:00+03:00","IsSpecialMeeting":null,"LastUpdatedDate":"2020-10-15T09:43:16.52+03:00"}
{"Id":489549,"Number":78,"KnessetNum":1,"Name":"ישיבת מליאה בתאריך 07/09/1949 בשעה 20:25","StartDate":"1949-09-07T20:25:00+03:00","FinishDate":"1949-09-07T23:05:00+03:00","IsSpecialMeeting":null,"LastUpdatedDate":"2020-10-15T09:21:22.947+03:00"}
{"Id":489550,"Number":81,"KnessetNum":1,"Name":"ישיבת מליאה בתאריך 07/11/1949 בשעה 16:05","StartDate":"1949-11-07T16:05:00+02:00","FinishDate":"1949-11-07T18:05:00+02:00","IsSpecialMeeting":null,"LastUpdatedDate":"2020-10-15T09:08:39.797+03:00"}
{"Id":489551,"Number":82,"KnessetNum":1,"Name":"ישיבת מליאה בתאריך 08/11/1949 בשעה 16:10","StartDate":"1949-11-08T16:10:00+02:00","FinishDate":"1949-11-08T16:45:00+02:00","IsSpecialMeeting":null,"LastUpdatedDate":"2020-10-15T09:05:41.033+03:00"}
{"Id":489552,"Number":83,"KnessetNum":1,"Name":"ישיבת מליאה בתאריך 09/11/1949 בשעה 16:05","StartDate":"1949-11-09T16:05:00+02:00","FinishDate":"1949-11-09T21:45:00+02:00","IsSpecialMeeting":null,"LastUpdatedDate":"2020-10-15T09:01:37.583+03:00"}
{"Id":489553,"Number":85,"KnessetNum":1,"Name":"ישיבת מליאה בתאריך 15/11/1949 בשעה 16:00","StartDate":"1949-11-15T16:00:00+02:00","FinishDate":"1949-11-15T19:06:00+02:00","IsSpecialMeeting":null,"LastUpdatedDate":"2020-10-15T08:47:18.25+03:00"}
{"Id":489554,"Number":86,"KnessetNum":1,"Name":"ישיבת מליאה בתאריך 16/11/1949 בשעה 16:10","StartDate":"1949-11-16T16:10:00+02:00","FinishDate":"1949-11-16T22:35:00+02:00","IsSpecialMeeting":null,"LastUpdatedDate":"2020-10-15T08:44:59.67+03:00"}
{"Id":489555,"Number":87,"KnessetNum":1,"Name":"ישיבת מליאה בתאריך 21/11/1949 בשעה 16:10","StartDate":"1949-11-21T16:10:00+02:00","FinishDate":"1949-11-21T23:25:00+02:00","IsSpecialMeeting":null,"LastUpdatedDate":"2020-10-15T08:42:14.457+03:00"}
{"Id":489556,"Number":88,"KnessetNum":1,"Name":"ישיבת מליאה בתאריך 22/11/1949 בשעה 16:10","StartDate":"1949-11-22T16:10:00+02:00","FinishDate":"1949-11-22T19:00:00+02:00","IsSpecialMeeting":null,"LastUpdatedDate":"2020-10-15T08:40:17.007+03:00"}
{"Id":489557,"Number":89,"KnessetNum":1,"Name":"ישיבת מליאה בתאריך 23/11/1949 בשעה 16:00","StartDate":"1949-11-23T16:00:00+02:00","FinishDate":"1949-11-23T22:25:00+02:00","IsSpecialMeeting":null,"LastUpdatedDate":"2020-10-15T08:38:14.73+03:00"}
{"Id":489558,"Number":91,"KnessetNum":1,"Name":"ישיבת מליאה בתאריך 29/11/1949 בשעה 16:10","StartDate":"1949-11-29T16:10:00+02:00","FinishDate":"1949-11-29T19:00:00+02:00","IsSpecialMeeting":null,"LastUpdatedDate":"2020-10-15T08:30:34.343+03:00"}
{"Id":489559,"Number":94,"KnessetNum":1,"Name":"ישיבת מליאה בתאריך 06/12/1949 בשעה 16:15","StartDate":"1949-12-06T16:15:00+02:00","FinishDate":"1949-12-06T19:05:00+02:00","IsSpecialMeeting":null,"LastUpdatedDate":"2020-10-15T08:19:39.357+03:00"}
{"Id":489560,"Number":96,"KnessetNum":1,"Name":"ישיבת מליאה בתאריך 13/12/1949 בשעה 17:02","StartDate":"1949-12-13T17:02:00+02:00","FinishDate":"1949-12-13T18:25:00+02:00","IsSpecialMeeting":null,"LastUpdatedDate":"2020-10-15T08:05:45.923+03:00"}
{"Id":489561,"Number":101,"KnessetNum":1,"Name":"ישיבת מליאה בתאריך 02/01/1950 בשעה 16:10","StartDate":"1950-01-02T16:10:00+02:00","FinishDate":"1950-01-02T22:25:00+02:00","IsSpecialMeeting":null,"LastUpdatedDate":"2020-10-14T15:34:01.093+03:00"}
{"Id":489562,"Number":102,"KnessetNum":1,"Name":"ישיבת מליאה בתאריך 03/01/1950 בשעה 16:10","StartDate":"1950-01-03T16:10:00+02:00","FinishDate":"1950-01-03T19:50:00+02:00","IsSpecialMeeting":null,"LastUpdatedDate":"2020-10-14T15:31:18.257+03:00"}
{"Id":489563,"Number":103,"KnessetNum":1,"Name":"ישיבת מליאה בתאריך 04/01/1950 בשעה 15:50","StartDate":"1950-01-04T15:50:00+02:00","FinishDate":"1950-01-04T23:40:00+02:00","IsSpecialMeeting":null,"LastUpdatedDate":"2020-10-14T15:28:53.64+03:00"}
{"Id":489564,"Number":105,"KnessetNum":1,"Name":"ישיבת מליאה בתאריך 10/01/1950 בשעה 15:20","StartDate":"1950-01-10T15:20:00+02:00","FinishDate":"1950-01-10T22:45:00+02:00","IsSpecialMeeting":null,"LastUpdatedDate":"2020-10-14T15:23:49.617+03:00"}
{"Id":489565,"Number":112,"KnessetNum":1,"Name":"ישיבת מליאה בתאריך 01/02/1950 בשעה 16:13","StartDate":"1950-02-01T16:13:00+02:00","FinishDate":"1950-02-01T21:30:00+02:00","IsSpecialMeeting":null,"LastUpdatedDate":"2024-01-07T13:19:11.43+02:00"}
{"Id":489566,"Number":113,"KnessetNum":1,"Name":"ישיבת מליאה בתאריך 07/02/1950 בשעה 16:15","StartDate":"1950-02-07T16:15:00+02:00","FinishDate":"1950-02-07T22:00:00+02:00","IsSpecialMeeting":null,"LastUpdatedDate":"2020-10-14T14:50:26.237+03:00"}
{"Id":489567,"Number":115,"KnessetNum":1,"Name":"ישיבת מליאה בתאריך 13/02/1950 בשעה 16:15","StartDate":"1950-02-13T16:15:00+02:00","FinishDate":"1950-02-13T21:50:00+02:00","IsSpecialMeeting":null,"LastUpdatedDate":"2020-10-14T14:46:02.17+03:00"}
{"Id":489568,"Number":116,"KnessetNum":1,"Name":"ישיבת מליאה בתאריך 14/02/1950 בשעה 16:15","StartDate":"1950-02-14T16:15:00+02:00","FinishDate":"1950-02-14T22:00:00+02:00","IsSpecialMeeting":null,"LastUpdatedDate":"2020-10-14T14:42:50.053+03:00"}
{"Id":489569,"Number":117,"KnessetNum":1,"Name":"ישיבת מליאה בתאריך 20/02/1950 בשעה 16:10","StartDate":"1950-02-20T16:10:00+02:00","FinishDate":"1950-02-20T22:35:00+02:00","IsSpecialMeeting":null,"LastUpdatedDate":"2021-06-17T11:21:37.62+03:00"}
{"Id":489570,"Number":121,"KnessetNum":1,"Name":"ישיבת מליאה בתאריך 01/03/1950 בשעה 14:10","StartDate":"1950-03-01T14:10:00+02:00","FinishDate":"1950-03-01T16:30:00+02:00","IsSpecialMeeting":null,"LastUpdatedDate":"2020-10-14T14:28:25.27+03:00"}
{"Id":489571,"Number":124,"KnessetNum":1,"Name":"ישיבת מליאה בתאריך 08/03/1950 בשעה 14:10","StartDate":"1950-03-08T14:10:00+02:00","FinishDate":"1950-03-08T16:00:00+02:00","IsSpecialMeeting":null,"LastUpdatedDate":"2020-10-14T14:26:13.903+03:00"}
{"Id":489572,"Number":134,"KnessetNum":1,"Name":"ישיבת מליאה בתאריך 02/05/1950 בשעה 16:05","StartDate":"1950-05-02T16:05:00+03:00","FinishDate":"1950-05-02T21:50:00+03:00","IsSpecialMeeting":null,"LastUpdatedDate":"2020-10-14T13:54:37.887+03:00"}
{"Id":489573,"Number":135,"KnessetNum":1,"Name":"ישיבת מליאה בתאריך 03/05/1950 בשעה 16:07","StartDate":"1950-05-03T16:07:00+03:00","FinishDate":"1950-05-03T20:00:00+03:00","IsSpecialMeeting":null,"LastUpdatedDate":"2020-10-14T13:51:48.533+03:00"}
{"Id":489574,"Number":136,"KnessetNum":1,"Name":"ישיבת מליאה בתאריך 08/05/1950 בשעה 16:07","StartDate":"1950-05-08T16:07:00+03:00","FinishDate":"1950-05-08T22:00:00+03:00","IsSpecialMeeting":null,"LastUpdatedDate":"2020-10-14T13:49:47.427+03:00"}
{"Id":489575,"Number":140,"KnessetNum":1,"Name":"ישיבת מליאה בתאריך 16/05/1950 בשעה 16:10","StartDate":"1950-05-16T16:10:00+03:00","FinishDate":"1950-05-16T23:00:00+03:00","IsSpecialMeeting":null,"LastUpdatedDate":"2020-10-27T17:41:31.5+02:00"}
{"Id":489576,"Number":145,"KnessetNum":1,"Name":"ישיבת מליאה בתאריך 30/05/1950 בשעה 15:10","StartDate":"1950-05-30T15:10:00+03:00","FinishDate":"1950-05-30T22:55:00+03:00","IsSpecialMeeting":null,"LastUpdatedDate":"2020-10-14T13:15:06.733+03:00"}
{"Id":489577,"Number":146,"KnessetNum":1,"Name":"ישיבת מליאה בתאריך 31/05/1950 בשעה 14:40","StartDate":"1950-05-31T14:40:00+03:00","FinishDate":"1950-05-31T19:05:00+03:00","IsSpecialMeeting":null,"LastUpdatedDate":"2020-10-14T12:26:39.58+03:00"}
{"Id":489578,"Number":148,"KnessetNum":1,"Name":"ישיבת מליאה בתאריך 06/06/1950 בשעה 15:00","StartDate":"1950-06-06T15:00:00+03:00","FinishDate":"1950-06-06T22:00:00+03:00","IsSpecialMeeting":null,"LastUpdatedDate":"2020-10-28T08:08:30.823+02:00"}
{"Id":489579,"Number":150,"KnessetNum":1,"Name":"ישיבת מליאה בתאריך 12/06/1950 בשעה 15:10","StartDate":"1950-06-12T15:10:00+03:00","FinishDate":"1950-06-12T19:30:00+03:00","IsSpecialMeeting":null,"LastUpdatedDate":"2020-10-28T08:05:45.313+02:00"}
{"Id":489580,"Number":152,"KnessetNum":1,"Name":"ישיבת מליאה בתאריך 14/06/1950 בשעה 16:45","StartDate":"1950-06-14T16:45:00+03:00","FinishDate":"1950-06-14T18:15:00+03:00","IsSpecialMeeting":null,"LastUpdatedDate":"2020-10-14T12:10:53.233+03:00"}
{"Id":489581,"Number":153,"KnessetNum":1,"Name":"ישיבת מליאה בתאריך 19/06/1950 בשעה 15:00","StartDate":"1950-06-19T15:00:00+03:00","FinishDate":"1950-06-19T20:05:00+03:00","IsSpecialMeeting":null,"LastUpdatedDate":"2020-10-14T12:07:40.533+03:00"}
{"Id":489582,"Number":154,"KnessetNum":1,"Name":"ישיבת מליאה בתאריך 20/06/1950 בשעה 15:00","StartDate":"1950-06-20T15:00:00+03:00","FinishDate":"1950-06-20T20:20:00+03:00","IsSpecialMeeting":null,"LastUpdatedDate":"2020-10-28T08:16:31.353+02:00"}
{"Id":489583,"Number":155,"KnessetNum":1,"Name":"ישיבת מליאה בתאריך 21/06/1950 בשעה 14:05","StartDate":"1950-06-21T14:05:00+03:00","FinishDate":"1950-06-21T19:15:00+03:00","IsSpecialMeeting":null,"LastUpdatedDate":"2020-10-28T08:16:26.85+02:00"}
{"Id":489584,"Number":158,"KnessetNum":1,"Name":"ישיבת מליאה בתאריך 28/06/1950 בשעה 11:15","StartDate":"1950-06-28T11:15:00+03:00","FinishDate":"1950-06-28T23:50:00+03:00","IsSpecialMeeting":null,"LastUpdatedDate":"2020-10-14T11:45:52.54+03:00"}
{"Id":489585,"Number":168,"KnessetNum":1,"Name":"ישיבת מליאה בתאריך 19/07/1950 בשעה 14:47","StartDate":"1950-07-19T14:47:00+03:00","FinishDate":"1950-07-19T17:40:00+03:00","IsSpecialMeeting":null,"LastUpdatedDate":"2020-10-14T10:50:41.693+03:00"}
{"Id":489586,"Number":175,"KnessetNum":1,"Name":"ישיבת מליאה בתאריך 07/08/1950 בשעה 15:08","StartDate":"1950-08-07T15:08:00+03:00","FinishDate":"1950-08-07T23:50:00+03:00","IsSpecialMeeting":null,"LastUpdatedDate":"2020-10-14T09:55:07.157+03:00"}
{"Id":489587,"Number":176,"KnessetNum":1,"Name":"ישיבת מליאה בתאריך 08/08/1950 בשעה 16:12","StartDate":"1950-08-08T16:12:00+03:00","FinishDate":"1950-08-08T22:40:00+03:00","IsSpecialMeeting":null,"LastUpdatedDate":"2020-10-14T09:52:14.78+03:00"}
{"Id":489588,"Number":179,"KnessetNum":1,"Name":"ישיבת מליאה בתאריך 16/10/1950 בשעה 17:05","StartDate":"1950-10-16T17:05:00+02:00","FinishDate":"1950-10-16T23:25:00+02:00","IsSpecialMeeting":null,"LastUpdatedDate":"2020-10-14T09:33:39.7+03:00"}
{"Id":489589,"Number":180,"KnessetNum":1,"Name":"ישיבת מליאה בתאריך 17/10/1950 בשעה 19:40","StartDate":"1950-10-17T19:40:00+02:00","FinishDate":"1950-10-18T02:20:00+02:00","IsSpecialMeeting":null,"LastUpdatedDate":"2020-10-14T09:23:20.087+03:00"}
{"Id":489590,"Number":184,"KnessetNum":1,"Name":"ישיבת מליאה בתאריך 30/10/1950 בשעה 16:15","StartDate":"1950-10-30T16:15:00+02:00","FinishDate":"1950-10-30T19:30:00+02:00","IsSpecialMeeting":null,"LastUpdatedDate":"2020-10-14T08:54:01.22+03:00"}
{"Id":489591,"Number":185,"KnessetNum":1,"Name":"ישיבת מליאה בתאריך 31/10/1950 בשעה 15:15","StartDate":"1950-10-31T15:15:00+02:00","FinishDate":"1950-10-31T23:10:00+02:00","IsSpecialMeeting":null,"LastUpdatedDate":"2020-10-14T08:51:29.623+03:00"}
{"Id":489592,"Number":186,"KnessetNum":1,"Name":"ישיבת מליאה בתאריך 01/11/1950 בשעה 11:05","StartDate":"1950-11-01T11:05:00+02:00","FinishDate":"1950-11-01T14:50:00+02:00","IsSpecialMeeting":null,"LastUpdatedDate":"2020-10-14T08:11:35.763+03:00"}
{"Id":489593,"Number":190,"KnessetNum":1,"Name":"ישיבת מליאה בתאריך 15/11/1950 בשעה 16:10","StartDate":"1950-11-15T16:10:00+02:00","FinishDate":"1950-11-15T22:00:00+02:00","IsSpecialMeeting":null,"LastUpdatedDate":"2020-10-14T07:57:48.98+03:00"}
{"Id":489594,"Number":192,"KnessetNum":1,"Name":"ישיבת מליאה בתאריך 20/11/1950 בשעה 16:10","StartDate":"1950-11-20T16:10:00+02:00","FinishDate":"1950-11-20T22:45:00+02:00","IsSpecialMeeting":null,"LastUpdatedDate":"2024-01-17T12:31:22.433+02:00"}
{"Id":489595,"Number":195,"KnessetNum":1,"Name":"ישיבת מליאה בתאריך 27/11/1950 בשעה 16:10","StartDate":"1950-11-27T16:10:00+02:00","FinishDate":"1950-11-27T22:07:00+02:00","IsSpecialMeeting":null,"LastUpdatedDate":"2020-10-13T17:34:44.387+03:00"}
{"Id":489596,"Number":198,"KnessetNum":1,"Name":"ישיבת מליאה בתאריך 11/12/1950 בשעה 16:07","StartDate":"1950-12-11T16:07:00+02:00","FinishDate":"1950-12-11T21:15:00+02:00","IsSpecialMeeting":null,"LastUpdatedDate":"2020-10-13T17:23:16.523+03:00"}
{"Id":489597,"Number":199,"KnessetNum":1,"Name":"ישיבת מליאה בתאריך 12/12/1950 בשעה 16:14","StartDate":"1950-12-12T16:14:00+02:00","FinishDate":"1950-12-12T21:50:00+02:00","IsSpecialMeeting":null,"LastUpdatedDate":"2020-10-13T17:18:27.033+03:00"}
{"Id":489598,"Number":200,"KnessetNum":1,"Name":"ישיבת מליאה בתאריך 13/12/1950 בשעה 14:06","StartDate":"1950-12-13T14:06:00+02:00","FinishDate":"1950-12-13T17:40:00+02:00","IsSpecialMeeting":null,"LastUpdatedDate":"2020-10-13T17:13:38.66+03:00"}
{"Id":489599,"Number":201,"KnessetNum":1,"Name":"ישיבת מליאה בתאריך 18/12/1950 בשעה 16:10","StartDate":"1950-12-18T16:10:00+02:00","FinishDate":"1950-12-18T21:45:00+02:00","IsSpecialMeeting":null,"LastUpdatedDate":"2020-10-13T17:09:24.527+03:00"}
{"Id":489600,"Number":203,"KnessetNum":1,"Name":"ישיבת מליאה בתאריך 20/12/1950 בשעה 11:05","StartDate":"1950-12-20T11:05:00+02:00","FinishDate":"1950-12-20T13:55:00+02:00","IsSpecialMeeting":null,"LastUpdatedDate":"2020-10-13T16:52:16.373+03:00"}
{"Id":489601,"Number":204,"KnessetNum":1,"Name":"ישיבת מליאה בתאריך 25/12/1950 בשעה 16:15","StartDate":"1950-12-25T16:15:00+02:00","FinishDate":"1950-12-25T22:15:00+02:00","IsSpecialMeeting":null,"LastUpdatedDate":"2020-10-13T16:50:05.663+03:00"}
{"Id":489602,"Number":205,"KnessetNum":1,"Name":"ישיבת מליאה בתאריך 26/12/1950 בשעה 16:18","StartDate":"1950-12-26T16:18:00+02:00","FinishDate":"1950-12-26T22:00:00+02:00","IsSpecialMeeting":null,"LastUpdatedDate":"2020-10-13T16:45:20.443+03:00"}
{"Id":489603,"Number":206,"KnessetNum":1,"Name":"ישיבת מליאה בתאריך 27/12/1950 בשעה 11:17","StartDate":"1950-12-27T11:17:00+02:00","FinishDate":"1950-12-27T14:00:00+02:00","IsSpecialMeeting":null,"LastUpdatedDate":"2021-07-12T13:07:27.917+03:00"}
{"Id":489604,"Number":207,"KnessetNum":1,"Name":"ישיבת מליאה בתאריך 01/01/1951 בשעה 16:08","StartDate":"1951-01-01T16:08:00+02:00","FinishDate":"1951-01-01T22:50:00+02:00","IsSpecialMeeting":null,"LastUpdatedDate":"2020-10-13T16:39:43.263+03:00"}
{"Id":489605,"Number":209,"KnessetNum":1,"Name":"ישיבת מליאה בתאריך 03/01/1951 בשעה 11:00","StartDate":"1951-01-03T11:00:00+02:00","FinishDate":"1951-01-03T14:20:00+02:00","IsSpecialMeeting":null,"LastUpdatedDate":"2020-10-13T16:33:13.25+03:00"}
{"Id":489606,"Number":217,"KnessetNum":1,"Name":"ישיבת מליאה בתאריך 23/01/1951 בשעה 16:50","StartDate":"1951-01-23T16:50:00+02:00","FinishDate":"1951-01-23T22:05:00+02:00","IsSpecialMeeting":null,"LastUpdatedDate":"2024-01-28T08:41:25.03+02:00"}
{"Id":489607,"Number":218,"KnessetNum":1,"Name":"ישיבת מליאה בתאריך 24/01/1951 בשעה 11:10","StartDate":"1951-01-24T11:10:00+02:00","FinishDate":"1951-01-24T13:35:00+02:00","IsSpecialMeeting":null,"LastUpdatedDate":"2020-10-13T15:54:53.977+03:00"}
{"Id":489608,"Number":220,"KnessetNum":1,"Name":"ישיבת מליאה בתאריך 30/01/1951 בשעה 16:10","StartDate":"1951-01-30T16:10:00+02:00","FinishDate":"1951-01-30T22:30:00+02:00","IsSpecialMeeting":null,"LastUpdatedDate":"2020-10-04T11:44:42.08+03:00"}
{"Id":489609,"Number":225,"KnessetNum":1,"Name":"ישיבת מליאה בתאריך 12/02/1951 בשעה 16:17","StartDate":"1951-02-12T16:17:00+02:00","FinishDate":"1951-02-12T21:50:00+02:00","IsSpecialMeeting":null,"LastUpdatedDate":"2020-10-13T15:08:52.653+03:00"}
{"Id":489610,"Number":226,"KnessetNum":1,"Name":"ישיבת מליאה בתאריך 12/02/1951 בשעה 16:15","StartDate":"1951-02-12T16:15:00+02:00","FinishDate":"1951-02-12T22:35:00+02:00","IsSpecialMeeting":null,"LastUpdatedDate":"2021-12-26T12:40:34.133+02:00"}
{"Id":489611,"Number":227,"KnessetNum":1,"Name":"ישיבת מליאה בתאריך 14/02/1951 בשעה 11:10","StartDate":"1951-02-14T11:10:00+02:00","FinishDate":"1951-02-14T15:10:00+02:00","IsSpecialMeeting":null,"LastUpdatedDate":"2020-10-13T15:06:26.043+03:00"}
{"Id":489612,"Number":229,"KnessetNum":1,"Name":"ישיבת מליאה בתאריך 20/02/1951 בשעה 16:12","StartDate":"1951-02-20T16:12:00+02:00","FinishDate":"1951-02-20T21:40:00+02:00","IsSpecialMeeting":null,"LastUpdatedDate":"2024-01-28T10:33:53.337+02:00"}
{"Id":489613,"Number":230,"KnessetNum":1,"Name":"ישיבת מליאה בתאריך 21/02/1951 בשעה 11:15","StartDate":"1951-02-21T11:15:00+02:00","FinishDate":"1951-02-21T14:00:00+02:00","IsSpecialMeeting":null,"LastUpdatedDate":"2020-10-13T14:41:32.873+03:00"}
{"Id":489614,"Number":233,"KnessetNum":1,"Name":"ישיבת מליאה בתאריך 05/03/1951 בשעה 16:12","StartDate":"1951-03-05T16:12:00+02:00","FinishDate":"1951-03-05T20:00:00+02:00","IsSpecialMeeting":null,"LastUpdatedDate":"2021-12-26T12:41:01.133+02:00"}
{"Id":489615,"Number":238,"KnessetNum":1,"Name":"ישיבת מליאה בתאריך 14/03/1951 בשעה 11:15","StartDate":"1951-03-14T11:15:00+02:00","FinishDate":"1951-03-14T13:10:00+02:00","IsSpecialMeeting":null,"LastUpdatedDate":"2021-11-27T09:27:30.153+02:00"}
{"Id":489616,"Number":241,"KnessetNum":1,"Name":"ישיבת מליאה בתאריך 21/03/1951 בשעה 11:12","StartDate":"1951-03-21T11:12:00+02:00","FinishDate":"1951-03-21T14:00:00+02:00","IsSpecialMeeting":null,"LastUpdatedDate":"2021-11-27T09:59:56.883+02:00"}
{"Id":489617,"Number":249,"KnessetNum":1,"Name":"ישיבת מליאה בתאריך 11/04/1951 בשעה 15:10","StartDate":"1951-04-11T15:10:00+03:00","FinishDate":"1951-04-11T15:10:00+03:00","IsSpecialMeeting":null,"LastUpdatedDate":"2021-12-26T12:41:23.173+02:00"}
{"Id":489618,"Number":254,"KnessetNum":1,"Name":"ישיבת מליאה בתאריך 21/05/1951 בשעה 16:15","StartDate":"1951-05-21T16:15:00+03:00","FinishDate":"1951-05-21T21:40:00+03:00","IsSpecialMeeting":null,"LastUpdatedDate":"2024-01-28T12:42:30.057+02:00"}
{"Id":489619,"Number":255,"KnessetNum":1,"Name":"ישיבת מליאה בתאריך 22/05/1951 בשעה 16:10","StartDate":"1951-05-22T16:10:00+03:00","FinishDate":"1951-05-22T21:55:00+03:00","IsSpecialMeeting":null,"LastUpdatedDate":"2020-10-13T11:46:51.497+03:00"}
{"Id":489620,"Number":256,"KnessetNum":1,"Name":"ישיבת מליאה בתאריך 23/05/1951 בשעה 12:45","StartDate":"1951-05-23T12:45:00+03:00","FinishDate":"1951-05-23T13:40:00+03:00","IsSpecialMeeting":null,"LastUpdatedDate":"2020-10-13T11:34:39.59+03:00"}
{"Id":489621,"Number":257,"KnessetNum":1,"Name":"ישיבת מליאה בתאריך 28/05/1951 בשעה 16:15","StartDate":"1951-05-28T16:15:00+03:00","FinishDate":"1951-05-28T21:55:00+03:00","IsSpecialMeeting":null,"LastUpdatedDate":"2020-10-13T11:27:48.447+03:00"}
{"Id":489622,"Number":259,"KnessetNum":1,"Name":"ישיבת מליאה בתאריך 30/05/1951 בשעה 11:10","StartDate":"1951-05-30T11:10:00+03:00","FinishDate":"1951-05-30T15:20:00+03:00","IsSpecialMeeting":null,"LastUpdatedDate":"2020-10-13T11:15:59.96+03:00"}
{"Id":489623,"Number":263,"KnessetNum":1,"Name":"ישיבת מליאה בתאריך 18/06/1951 בשעה 16:14","StartDate":"1951-06-18T16:14:00+03:00","FinishDate":"1951-06-18T22:15:00+03:00","IsSpecialMeeting":null,"LastUpdatedDate":"2020-10-13T10:56:40.133+03:00"}
{"Id":489624,"Number":267,"KnessetNum":1,"Name":"ישיבת מליאה בתאריך 26/06/1951 בשעה 16:22","StartDate":"1951-06-26T16:22:00+03:00","FinishDate":"1951-06-26T21:55:00+03:00","IsSpecialMeeting":null,"LastUpdatedDate":"2020-10-13T10:41:43.987+03:00"}
{"Id":489625,"Number":1,"KnessetNum":2,"Name":"ישיבת מליאה בתאריך 20/08/1951 בשעה 16:07","StartDate":"1951-08-20T16:07:00+03:00","FinishDate":"1951-08-20T17:25:00+03:00","IsSpecialMeeting":null,"LastUpdatedDate":"2021-01-18T12:16:24.767+02:00"}
{"Id":489626,"Number":272,"KnessetNum":1,"Name":"ישיבת מליאה בתאריך 20/08/1951 בשעה 11:20","StartDate":"1951-08-20T11:20:00+03:00","FinishDate":"1951-08-20T12:05:00+03:00","IsSpecialMeeting":null,"LastUpdatedDate":"2020-10-13T09:45:49.417+03:00"}
{"Id":489627,"Number":2,"KnessetNum":2,"Name":"ישיבת מליאה בתאריך 10/09/1951 בשעה 16:17","StartDate":"1951-09-10T16:17:00+03:00","FinishDate":"1951-09-10T19:40:00+03:00","IsSpecialMeeting":null,"LastUpdatedDate":"2020-10-26T12:43:33.373+02:00"}
{"Id":489628,"Number":3,"KnessetNum":2,"Name":"ישיבת מליאה בתאריך 11/09/1951 בשעה 16:10","StartDate":"1951-09-11T16:10:00+03:00","FinishDate":"1951-09-11T22:00:00+03:00","IsSpecialMeeting":null,"LastUpdatedDate":"2020-10-26T11:00:41.44+02:00"}
{"Id":489629,"Number":4,"KnessetNum":2,"Name":"ישיבת מליאה בתאריך 17/09/1951 בשעה 16:15","StartDate":"1951-09-17T16:15:00+03:00","FinishDate":"1951-09-17T20:38:00+03:00","IsSpecialMeeting":null,"LastUpdatedDate":"2020-10-26T10:59:06.783+02:00"}
{"Id":489630,"Number":6,"KnessetNum":2,"Name":"ישיבת מליאה בתאריך 19/09/1951 בשעה 11:12","StartDate":"1951-09-19T11:12:00+03:00","FinishDate":"1951-09-19T13:10:00+03:00","IsSpecialMeeting":null,"LastUpdatedDate":"2020-10-26T10:55:57.817+02:00"}
{"Id":489631,"Number":7,"KnessetNum":2,"Name":"ישיבת מליאה בתאריך 24/09/1951 בשעה 16:10","StartDate":"1951-09-24T16:10:00+03:00","FinishDate":"1951-09-24T18:00:00+03:00","IsSpecialMeeting":null,"LastUpdatedDate":"2021-07-28T09:03:13.56+03:00"}
{"Id":489632,"Number":8,"KnessetNum":2,"Name":"ישיבת מליאה בתאריך 25/09/1951 בשעה 16:12","StartDate":"1951-09-25T16:12:00+03:00","FinishDate":"1951-09-25T21:55:00+03:00","IsSpecialMeeting":null,"LastUpdatedDate":"2020-10-26T10:53:15.39+02:00"}
{"Id":489633,"Number":12,"KnessetNum":2,"Name":"ישיבת מליאה בתאריך 07/10/1951 בשעה 16:10","StartDate":"1951-10-07T16:10:00+02:00","FinishDate":"1951-10-07T22:05:00+02:00","IsSpecialMeeting":null,"LastUpdatedDate":"2020-10-26T10:45:12.423+02:00"}
{"Id":489634,"Number":13,"KnessetNum":2,"Name":"ישיבת מליאה בתאריך 08/10/1951 בשעה 09:45","StartDate":"1951-10-08T09:45:00+02:00","FinishDate":"1951-10-09T01:10:00+02:00","IsSpecialMeeting":null,"LastUpdatedDate":"2020-10-26T10:43:05.707+02:00"}
{"Id":489635,"Number":14,"KnessetNum":2,"Name":"ישיבת מליאה בתאריך 04/11/1951 בשעה 16:08","StartDate":"1951-11-04T16:08:00+02:00","FinishDate":"1951-11-04T22:00:00+02:00","IsSpecialMeeting":null,"LastUpdatedDate":"2020-10-26T10:40:51.093+02:00"}
{"Id":489636,"Number":15,"KnessetNum":2,"Name":"ישיבת מליאה בתאריך 05/11/1951 בשעה 16:11","StartDate":"1951-11-05T16:11:00+02:00","FinishDate":"1951-11-05T22:30:00+02:00","IsSpecialMeeting":null,"LastUpdatedDate":"2020-10-26T10:39:23.673+02:00"}
{"Id":489637,"Number":19,"KnessetNum":2,"Name":"ישיבת מליאה בתאריך 14/11/1951 בשעה 10:10","StartDate":"1951-11-14T10:10:00+02:00","FinishDate":"1951-11-14T13:40:00+02:00","IsSpecialMeeting":null,"LastUpdatedDate":"2021-08-15T11:34:37.883+03:00"}
{"Id":489638,"Number":20,"KnessetNum":2,"Name":"ישיבת מליאה בתאריך 19/11/1951 בשעה 16:15","StartDate":"1951-11-19T16:15:00+02:00","FinishDate":"1951-11-19T17:25:00+02:00","IsSpecialMeeting":null,"LastUpdatedDate":"2020-10-26T10:18:12.373+02:00"}
{"Id":489639,"Number":23,"KnessetNum":2,"Name":"ישיבת מליאה בתאריך 26/11/1951 בשעה 16:10","StartDate":"1951-11-26T16:10:00+02:00","FinishDate":"1951-11-26T22:07:00+02:00","IsSpecialMeeting":null,"LastUpdatedDate":"2020-10-26T10:13:01.8+02:00"}
{"Id":489640,"Number":25,"KnessetNum":2,"Name":"ישיבת מליאה בתאריך 28/11/1951 בשעה 11:10","StartDate":"1951-11-28T11:10:00+02:00","FinishDate":"1951-11-28T14:10:00+02:00","IsSpecialMeeting":null,"LastUpdatedDate":"2020-10-26T09:51:39.303+02:00"}
{"Id":489641,"Number":27,"KnessetNum":2,"Name":"ישיבת מליאה בתאריך 04/12/1951 בשעה 16:15","StartDate":"1951-12-04T16:15:00+02:00","FinishDate":"1951-12-04T22:15:00+02:00","IsSpecialMeeting":null,"LastUpdatedDate":"2020-10-26T09:44:42.347+02:00"}
{"Id":489642,"Number":28,"KnessetNum":2,"Name":"ישיבת מליאה בתאריך 05/12/1951 בשעה 11:15","StartDate":"1951-12-05T11:15:00+02:00","FinishDate":"1951-12-05T13:00:00+02:00","IsSpecialMeeting":null,"LastUpdatedDate":"2021-01-18T15:45:54.81+02:00"}
{"Id":489643,"Number":29,"KnessetNum":2,"Name":"ישיבת מליאה בתאריך 10/12/1951 בשעה 16:16","StartDate":"1951-12-10T16:16:00+02:00","FinishDate":"1951-12-10T21:55:00+02:00","IsSpecialMeeting":null,"LastUpdatedDate":"2020-10-26T09:40:31.803+02:00"}
{"Id":489644,"Number":31,"KnessetNum":2,"Name":"ישיבת מליאה בתאריך 12/12/1951 בשעה 12:12","StartDate":"1951-12-12T12:12:00+02:00","FinishDate":"1951-12-12T14:45:00+02:00","IsSpecialMeeting":null,"LastUpdatedDate":"2022-01-06T09:21:23.323+02:00"}
{"Id":489645,"Number":33,"KnessetNum":2,"Name":"ישיבת מליאה בתאריך 18/12/1951 בשעה 16:10","StartDate":"1951-12-18T16:10:00+02:00","FinishDate":"1951-12-18T23:00:00+02:00","IsSpecialMeeting":null,"LastUpdatedDate":"2020-10-26T09:29:36.627+02:00"}
{"Id":489646,"Number":35,"KnessetNum":2,"Name":"ישיבת מליאה בתאריך 20/12/1951 בשעה 11:05","StartDate":"1951-12-20T11:05:00+02:00","FinishDate":"1951-12-20T14:50:00+02:00","IsSpecialMeeting":null,"LastUpdatedDate":"2020-10-26T09:25:46.96+02:00"}
{"Id":489647,"Number":36,"KnessetNum":2,"Name":"ישיבת מליאה בתאריך 30/12/1951 בשעה 16:18","StartDate":"1951-12-30T16:18:00+02:00","FinishDate":"1951-12-30T21:25:00+02:00","IsSpecialMeeting":null,"LastUpdatedDate":"2021-12-26T12:41:44.263+02:00"}
{"Id":489648,"Number":38,"KnessetNum":2,"Name":"ישיבת מליאה בתאריך 07/01/1952 בשעה 16:14","StartDate":"1952-01-07T16:14:00+02:00","FinishDate":"1952-01-07T22:15:00+02:00","IsSpecialMeeting":null,"LastUpdatedDate":"2020-10-26T09:19:05.057+02:00"}
{"Id":489649,"Number":39,"KnessetNum":2,"Name":"ישיבת מליאה בתאריך 08/01/1952 בשעה 18:10","StartDate":"1952-01-08T18:10:00+02:00","FinishDate":"1952-01-08T23:22:00+02:00","IsSpecialMeeting":null,"LastUpdatedDate":"2020-10-26T09:09:26.503+02:00"}
{"Id":489650,"Number":40,"KnessetNum":2,"Name":"ישיבת מליאה בתאריך 09/01/1952 בשעה 09:45","StartDate":"1952-01-09T09:45:00+02:00","FinishDate":"1952-01-09T16:00:00+02:00","IsSpecialMeeting":null,"LastUpdatedDate":"2020-10-26T09:01:13.59+02:00"}
{"Id":489651,"Number":41,"KnessetNum":2,"Name":"ישיבת מליאה בתאריך 14/01/1952 בשעה 16:10","StartDate":"1952-01-14T16:10:00+02:00","FinishDate":"1952-01-14T22:00:00+02:00","IsSpecialMeeting":null,"LastUpdatedDate":"2020-10-26T08:59:42.697+02:00"}
{"Id":489652,"Number":42,"KnessetNum":2,"Name":"ישיבת מליאה בתאריך 15/01/1952 בשעה 16:10","StartDate":"1952-01-15T16:10:00+02:00","FinishDate":"1952-01-15T21:25:00+02:00","IsSpecialMeeting":null,"LastUpdatedDate":"2020-10-26T08:57:56.107+02:00"}
{"Id":489653,"Number":43,"KnessetNum":2,"Name":"ישיבת מליאה בתאריך 16/01/1952 בשעה 11:10","StartDate":"1952-01-16T11:10:00+02:00","FinishDate":"1952-01-16T13:40:00+02:00","IsSpecialMeeting":null,"LastUpdatedDate":"2020-10-26T08:55:24.7+02:00"}
{"Id":489654,"Number":44,"KnessetNum":2,"Name":"ישיבת מליאה בתאריך 21/01/1952 בשעה 16:15","StartDate":"1952-01-21T16:15:00+02:00","FinishDate":"1952-01-21T22:55:00+02:00","IsSpecialMeeting":null,"LastUpdatedDate":"2020-10-26T08:51:54.733+02:00"}
{"Id":489655,"Number":46,"KnessetNum":2,"Name":"ישיבת מליאה בתאריך 23/01/1952 בשעה 11:10","StartDate":"1952-01-23T11:10:00+02:00","FinishDate":"1952-01-23T13:30:00+02:00","IsSpecialMeeting":null,"LastUpdatedDate":"2020-10-26T08:47:39.533+02:00"}
{"Id":489656,"Number":48,"KnessetNum":2,"Name":"ישיבת מליאה בתאריך 29/01/1952 בשעה 16:10","StartDate":"1952-01-29T16:10:00+02:00","FinishDate":"1952-01-29T22:05:00+02:00","IsSpecialMeeting":null,"LastUpdatedDate":"2020-10-26T08:28:30.383+02:00"}
{"Id":489657,"Number":49,"KnessetNum":2,"Name":"ישיבת מליאה בתאריך 30/01/1952 בשעה 11:10","StartDate":"1952-01-30T11:10:00+02:00","FinishDate":"1952-01-30T13:20:00+02:00","IsSpecialMeeting":null,"LastUpdatedDate":"2020-10-26T08:23:46.327+02:00"}
{"Id":489658,"Number":50,"KnessetNum":2,"Name":"ישיבת מליאה בתאריך 04/02/1952 בשעה 16:08","StartDate":"1952-02-04T16:08:00+02:00","FinishDate":"1952-02-04T21:45:00+02:00","IsSpecialMeeting":null,"LastUpdatedDate":"2020-10-26T08:19:31.19+02:00"}
{"Id":489659,"Number":53,"KnessetNum":2,"Name":"ישיבת מליאה בתאריך 11/02/1952 בשעה 20:13","StartDate":"1952-02-11T20:13:00+02:00","FinishDate":null,"IsSpecialMeeting":null,"LastUpdatedDate":"2020-10-26T08:13:03.223+02:00"}
{"Id":489660,"Number":54,"KnessetNum":2,"Name":"ישיבת מליאה בתאריך 12/02/1952 בשעה 16:13","StartDate":"1952-02-12T16:13:00+02:00","FinishDate":"1952-02-12T23:00:00+02:00","IsSpecialMeeting":null,"LastUpdatedDate":"2021-08-02T17:34:03.393+03:00"}
{"Id":489661,"Number":56,"KnessetNum":2,"Name":"ישיבת מליאה בתאריך 18/02/1952 בשעה 16:10","StartDate":"1952-02-18T16:10:00+02:00","FinishDate":"1952-02-18T21:45:00+02:00","IsSpecialMeeting":null,"LastUpdatedDate":"2020-10-25T14:13:17.817+02:00"}
{"Id":489662,"Number":57,"KnessetNum":2,"Name":"ישיבת מליאה בתאריך 19/02/1952 בשעה 16:15","StartDate":"1952-02-19T16:15:00+02:00","FinishDate":"1952-02-19T23:00:00+02:00","IsSpecialMeeting":null,"LastUpdatedDate":"2020-10-25T14:06:58.477+02:00"}
{"Id":489663,"Number":58,"KnessetNum":2,"Name":"ישיבת מליאה בתאריך 20/02/1952 בשעה 09:22","StartDate":"1952-02-20T09:22:00+02:00","FinishDate":"1952-02-20T14:35:00+02:00","IsSpecialMeeting":null,"LastUpdatedDate":"2020-10-25T14:01:29.203+02:00"}
{"Id":489664,"Number":61,"KnessetNum":2,"Name":"ישיבת מליאה בתאריך 27/02/1952 בשעה 11:05","StartDate":"1952-02-27T11:05:00+02:00","FinishDate":"1952-02-27T15:00:00+02:00","IsSpecialMeeting":null,"LastUpdatedDate":"2020-10-25T13:46:59.027+02:00"}
{"Id":489665,"Number":62,"KnessetNum":2,"Name":"ישיבת מליאה בתאריך 03/03/1952 בשעה 16:10","StartDate":"1952-03-03T16:10:00+02:00","FinishDate":"1952-03-03T22:00:00+02:00","IsSpecialMeeting":null,"LastUpdatedDate":"2020-10-25T13:44:54.317+02:00"}
{"Id":489666,"Number":67,"KnessetNum":2,"Name":"ישיבת מליאה בתאריך 18/03/1952 בשעה 16:15","StartDate":"1952-03-18T16:15:00+02:00","FinishDate":"1952-03-18T23:25:00+02:00","IsSpecialMeeting":null,"LastUpdatedDate":"2021-08-09T11:58:33.457+03:00"}
{"Id":489667,"Number":68,"KnessetNum":2,"Name":"ישיבת מליאה בתאריך 19/03/1952 בשעה 10:10","StartDate":"1952-03-19T10:10:00+02:00","FinishDate":"1952-03-19T15:00:00+02:00","IsSpecialMeeting":null,"LastUpdatedDate":"2021-08-09T13:09:38.14+03:00"}
{"Id":489668,"Number":73,"KnessetNum":2,"Name":"ישיבת מליאה בתאריך 30/03/1952 בשעה 16:15","StartDate":"1952-03-30T16:15:00+02:00","FinishDate":"1952-03-31T01:00:00+02:00","IsSpecialMeeting":null,"LastUpdatedDate":"2021-08-10T07:46:13.55+03:00"}
{"Id":489669,"Number":74,"KnessetNum":2,"Name":"ישיבת מליאה בתאריך 31/03/1952 בשעה 10:13","StartDate":"1952-03-31T10:13:00+02:00","FinishDate":"1952-04-01T01:00:00+02:00","IsSpecialMeeting":null,"LastUpdatedDate":"2021-08-10T08:06:32.383+03:00"}
{"Id":489670,"Number":76,"KnessetNum":2,"Name":"ישיבת מליאה בתאריך 05/05/1952 בשעה 18:05","StartDate":"1952-05-05T18:05:00+03:00","FinishDate":"1952-05-05T23:10:00+03:00","IsSpecialMeeting":null,"LastUpdatedDate":"2021-02-02T14:24:45.36+02:00"}
{"Id":489671,"Number":77,"KnessetNum":2,"Name":"ישיבת מליאה בתאריך 06/05/1952 בשעה 16:10","StartDate":"1952-05-06T16:10:00+03:00","FinishDate":"1952-05-06T21:50:00+03:00","IsSpecialMeeting":null,"LastUpdatedDate":"2021-08-10T10:20:45.707+03:00"}
{"Id":489672,"Number":78,"KnessetNum":2,"Name":"ישיבת מליאה בתאריך 07/05/1952 בשעה 12:05","StartDate":"1952-05-07T12:05:00+03:00","FinishDate":"1952-05-07T14:20:00+03:00","IsSpecialMeeting":null,"LastUpdatedDate":"2020-10-25T13:01:48.8+02:00"}
{"Id":489673,"Number":81,"KnessetNum":2,"Name":"ישיבת מליאה בתאריך 14/05/1952 בשעה 12:07","StartDate":"1952-05-14T12:07:00+03:00","FinishDate":"1952-05-14T13:15:00+03:00","IsSpecialMeeting":null,"LastUpdatedDate":"2020-10-25T12:53:43.027+02:00"}
{"Id":489674,"Number":87,"KnessetNum":2,"Name":"ישיבת מליאה בתאריך 28/05/1952 בשעה 12:15","StartDate":"1952-05-28T12:15:00+03:00","FinishDate":"1952-05-28T14:00:00+03:00","IsSpecialMeeting":null,"LastUpdatedDate":"2020-10-25T11:58:51.043+02:00"}
{"Id":489675,"Number":88,"KnessetNum":2,"Name":"ישיבת מליאה בתאריך 02/06/1952 בשעה 16:10","StartDate":"1952-06-02T16:10:00+03:00","FinishDate":"1952-06-02T21:35:00+03:00","IsSpecialMeeting":null,"LastUpdatedDate":"2021-08-12T09:00:38.963+03:00"}
{"Id":489676,"Number":92,"KnessetNum":2,"Name":"ישיבת מליאה בתאריך 10/06/1952 בשעה 16:10","StartDate":"1952-06-10T16:10:00+03:00","FinishDate":"1952-06-10T22:25:00+03:00","IsSpecialMeeting":null,"LastUpdatedDate":"2020-10-25T11:48:58.327+02:00"}
{"Id":489677,"Number":93,"KnessetNum":2,"Name":"ישיבת מליאה בתאריך 11/06/1952 בשעה 12:10","StartDate":"1952-06-11T12:10:00+03:00","FinishDate":"1952-06-11T13:50:00+03:00","IsSpecialMeeting":null,"LastUpdatedDate":"2021-08-12T11:21:16.977+03:00"}
{"Id":489678,"Number":96,"KnessetNum":2,"Name":"ישיבת מליאה בתאריך 18/06/1952 בשעה 13:30","StartDate":"1952-06-18T13:30:00+03:00","FinishDate":"1952-06-18T15:30:00+03:00","IsSpecialMeeting":null,"LastUpdatedDate":"2021-08-12T12:09:30.25+03:00"}
{"Id":489679,"Number":99,"KnessetNum":2,"Name":"ישיבת מליאה בתאריך 25/06/1952 בשעה 11:12","StartDate":"1952-06-25T11:12:00+03:00","FinishDate":"1952-06-25T15:05:00+03:00","IsSpecialMeeting":null,"LastUpdatedDate":"2020-10-25T11:28:14.04+02:00"}
{"Id":489680,"Number":102,"KnessetNum":2,"Name":"ישיבת מליאה בתאריך 02/07/1952 בשעה 14:07","StartDate":"1952-07-02T14:07:00+03:00","FinishDate":"1952-07-02T16:30:00+03:00","IsSpecialMeeting":null,"LastUpdatedDate":"2020-10-25T11:17:33.377+02:00"}
{"Id":489681,"Number":105,"KnessetNum":2,"Name":"ישיבת מליאה בתאריך 09/07/1952 בשעה 13:40","StartDate":"1952-07-09T13:40:00+03:00","FinishDate":"1952-07-09T16:05:00+03:00","IsSpecialMeeting":null,"LastUpdatedDate":"2021-08-16T13:41:40.337+03:00"}
{"Id":489682,"Number":106,"KnessetNum":2,"Name":"ישיבת מליאה בתאריך 14/07/1952 בשעה 12:06","StartDate":"1952-07-14T12:06:00+03:00","FinishDate":"1952-07-14T12:17:00+03:00","IsSpecialMeeting":null,"LastUpdatedDate":"2020-10-25T11:02:13.277+02:00"}
{"Id":489683,"Number":107,"KnessetNum":2,"Name":"ישיבת מליאה בתאריך 15/07/1952 בשעה 20:07","StartDate":"1952-07-15T20:07:00+03:00","FinishDate":"1952-07-15T20:08:00+03:00","IsSpecialMeeting":null,"LastUpdatedDate":"2020-10-25T10:58:04.123+02:00"}
{"Id":489684,"Number":111,"KnessetNum":2,"Name":"ישיבת מליאה בתאריך 23/07/1952 בשעה 13:35","StartDate":"1952-07-23T13:35:00+03:00","FinishDate":"1952-07-23T15:50:00+03:00","IsSpecialMeeting":null,"LastUpdatedDate":"2020-10-25T10:36:58.26+02:00"}
{"Id":489685,"Number":114,"KnessetNum":2,"Name":"ישיבת מליאה בתאריך 30/07/1952 בשעה 12:10","StartDate":"1952-07-30T12:10:00+03:00","FinishDate":"1952-07-30T13:52:00+03:00","IsSpecialMeeting":null,"LastUpdatedDate":"2020-10-25T10:22:32.38+02:00"}
{"Id":489686,"Number":115,"KnessetNum":2,"Name":"ישיבת מליאה בתאריך 04/08/1952 בשעה 16:10","StartDate":"1952-08-04T16:10:00+03:00","FinishDate":"1952-08-04T22:00:00+03:00","IsSpecialMeeting":null,"LastUpdatedDate":"2020-10-25T10:20:57.717+02:00"}
{"Id":489687,"Number":116,"KnessetNum":2,"Name":"ישיבת מליאה בתאריך 05/08/1952 בשעה 00:00","StartDate":"1952-08-05T00:00:00+03:00","FinishDate":"1952-08-05T22:50:00+03:00","IsSpecialMeeting":null,"LastUpdatedDate":"2021-12-07T16:09:34.807+02:00"}
{"Id":489688,"Number":117,"KnessetNum":2,"Name":"ישיבת מליאה בתאריך 06/08/1952 בשעה 13:30","StartDate":"1952-08-06T13:30:00+03:00","FinishDate":"1952-08-06T15:55:00+03:00","IsSpecialMeeting":null,"LastUpdatedDate":"2020-10-25T10:17:13.53+02:00"}
{"Id":489689,"Number":121,"KnessetNum":2,"Name":"ישיבת מליאה בתאריך 14/08/1952 בשעה 13:40","StartDate":"1952-08-14T13:40:00+03:00","FinishDate":"1952-08-14T13:45:00+03:00","IsSpecialMeeting":null,"LastUpdatedDate":"2020-10-25T10:09:16.333+02:00"}
{"Id":489690,"Number":124,"KnessetNum":2,"Name":"ישיבת מליאה בתאריך 20/08/1952 בשעה 16:05","StartDate":"1952-08-20T16:05:00+03:00","FinishDate":"1952-08-20T23:00:00+03:00","IsSpecialMeeting":null,"LastUpdatedDate":"2020-10-25T09:57:14.44+02:00"}
{"Id":489691,"Number":130,"KnessetNum":2,"Name":"ישיבת מליאה בתאריך 03/11/1952 בשעה 16:08","StartDate":"1952-11-03T16:08:00+02:00","FinishDate":"1952-11-03T18:25:00+02:00","IsSpecialMeeting":null,"LastUpdatedDate":"2020-10-25T09:34:23.44+02:00"}
{"Id":489692,"Number":134,"KnessetNum":2,"Name":"ישיבת מליאה בתאריך 05/11/1952 בשעה 11:10","StartDate":"1952-11-05T11:10:00+02:00","FinishDate":"1952-11-05T13:45:00+02:00","IsSpecialMeeting":null,"LastUpdatedDate":"2020-10-25T09:13:57.003+02:00"}
{"Id":489693,"Number":135,"KnessetNum":2,"Name":"ישיבת מליאה בתאריך 10/11/1952 בשעה 16:00","StartDate":"1952-11-10T16:00:00+02:00","FinishDate":"1952-11-10T16:30:00+02:00","IsSpecialMeeting":null,"LastUpdatedDate":"2020-10-25T09:12:15.903+02:00"}
{"Id":489694,"Number":136,"KnessetNum":2,"Name":"ישיבת מליאה בתאריך 17/11/1952 בשעה 16:00","StartDate":"1952-11-17T16:00:00+02:00","FinishDate":"1952-11-17T17:30:00+02:00","IsSpecialMeeting":null,"LastUpdatedDate":"2020-10-04T12:36:55.94+03:00"}
{"Id":489695,"Number":138,"KnessetNum":2,"Name":"ישיבת מליאה בתאריך 18/11/1952 בשעה 16:05","StartDate":"1952-11-18T16:05:00+02:00","FinishDate":"1952-11-18T18:47:00+02:00","IsSpecialMeeting":null,"LastUpdatedDate":"2020-10-25T09:05:41.857+02:00"}
{"Id":489696,"Number":139,"KnessetNum":2,"Name":"ישיבת מליאה בתאריך 18/11/1952 בשעה 20:00","StartDate":"1952-11-18T20:00:00+02:00","FinishDate":"1952-11-18T22:05:00+02:00","IsSpecialMeeting":null,"LastUpdatedDate":"2020-10-25T09:09:07.39+02:00"}
{"Id":489697,"Number":140,"KnessetNum":2,"Name":"ישיבת מליאה בתאריך 19/11/1952 בשעה 11:15","StartDate":"1952-11-19T11:15:00+02:00","FinishDate":"1952-11-19T13:25:00+02:00","IsSpecialMeeting":null,"LastUpdatedDate":"2021-09-05T11:48:10.537+03:00"}
{"Id":489698,"Number":143,"KnessetNum":2,"Name":"ישיבת מליאה בתאריך 25/11/1952 בשעה 16:02","StartDate":"1952-11-25T16:02:00+02:00","FinishDate":"1952-11-25T18:50:00+02:00","IsSpecialMeeting":null,"LastUpdatedDate":"2020-10-25T08:42:08.943+02:00"}
{"Id":489699,"Number":144,"KnessetNum":2,"Name":"ישיבת מליאה בתאריך 25/11/1952 בשעה 20:05","StartDate":"1952-11-25T20:05:00+02:00","FinishDate":"1952-11-25T22:40:00+02:00","IsSpecialMeeting":null,"LastUpdatedDate":"2020-10-25T08:44:01.587+02:00"}
{"Id":489700,"Number":146,"KnessetNum":2,"Name":"ישיבת מליאה בתאריך 01/12/1952 בשעה 16:06","StartDate":"1952-12-01T16:06:00+02:00","FinishDate":"1952-12-01T18:30:00+02:00","IsSpecialMeeting":null,"LastUpdatedDate":"2021-12-27T21:05:05.087+02:00"}
{"Id":489701,"Number":147,"KnessetNum":2,"Name":"ישיבת מליאה בתאריך 01/12/1952 בשעה 20:10","StartDate":"1952-12-01T20:10:00+02:00","FinishDate":"1952-12-01T22:00:00+02:00","IsSpecialMeeting":null,"LastUpdatedDate":"2022-01-06T08:13:02.61+02:00"}
{"Id":489702,"Number":148,"KnessetNum":2,"Name":"ישיבת מליאה בתאריך 02/12/1952 בשעה 16:05","StartDate":"1952-12-02T16:05:00+02:00","FinishDate":"1952-12-02T18:50:00+02:00","IsSpecialMeeting":null,"LastUpdatedDate":"2021-11-18T13:49:43.243+02:00"}
{"Id":489703,"Number":150,"KnessetNum":2,"Name":"ישיבת מליאה בתאריך 03/12/1952 בשעה 11:25","StartDate":"1952-12-03T11:25:00+02:00","FinishDate":"1952-12-03T13:00:00+02:00","IsSpecialMeeting":null,"LastUpdatedDate":"2021-09-09T08:33:52.897+03:00"}
{"Id":489704,"Number":151,"KnessetNum":2,"Name":"ישיבת מליאה בתאריך 08/12/1952 בשעה 16:10","StartDate":"1952-12-08T16:10:00+02:00","FinishDate":"1952-12-08T19:24:00+02:00","IsSpecialMeeting":null,"LastUpdatedDate":"2020-10-25T08:24:53.477+02:00"}
{"Id":489705,"Number":154,"KnessetNum":2,"Name":"ישיבת מליאה בתאריך 10/12/1952 בשעה 10:50","StartDate":"1952-12-10T10:50:00+02:00","FinishDate":"1952-12-10T11:20:00+02:00","IsSpecialMeeting":null,"LastUpdatedDate":"2020-10-25T08:12:34.073+02:00"}
{"Id":489706,"Number":155,"KnessetNum":2,"Name":"ישיבת מליאה בתאריך 22/12/1952 בשעה 16:12","StartDate":"1952-12-22T16:12:00+02:00","FinishDate":"1952-12-22T19:00:00+02:00","IsSpecialMeeting":null,"LastUpdatedDate":"2020-10-25T08:05:52.993+02:00"}
{"Id":489707,"Number":156,"KnessetNum":2,"Name":"ישיבת מליאה בתאריך 22/12/1952 בשעה 20:06","StartDate":"1952-12-22T20:06:00+02:00","FinishDate":"1952-12-22T22:10:00+02:00","IsSpecialMeeting":null,"LastUpdatedDate":"2020-10-25T08:07:17.143+02:00"}
{"Id":489708,"Number":157,"KnessetNum":2,"Name":"ישיבת מליאה בתאריך 23/12/1952 בשעה 16:13","StartDate":"1952-12-23T16:13:00+02:00","FinishDate":"1952-12-23T18:50:00+02:00","IsSpecialMeeting":null,"LastUpdatedDate":"2020-10-25T08:02:41.457+02:00"}
{"Id":489709,"Number":158,"KnessetNum":2,"Name":"ישיבת מליאה בתאריך 23/12/1952 בשעה 20:30","StartDate":"1952-12-23T20:30:00+02:00","FinishDate":"1952-12-23T22:10:00+02:00","IsSpecialMeeting":null,"LastUpdatedDate":"2021-12-26T12:42:04.877+02:00"}
{"Id":489710,"Number":169,"KnessetNum":2,"Name":"ישיבת מליאה בתאריך 07/01/1953 בשעה 11:08","StartDate":"1953-01-07T11:08:00+02:00","FinishDate":"1953-01-07T13:18:00+02:00","IsSpecialMeeting":null,"LastUpdatedDate":"2020-10-21T16:23:23.16+03:00"}
{"Id":489711,"Number":170,"KnessetNum":2,"Name":"ישיבת מליאה בתאריך 19/01/1953 בשעה 16:23","StartDate":"1953-01-19T16:23:00+02:00","FinishDate":"1953-01-19T18:40:00+02:00","IsSpecialMeeting":null,"LastUpdatedDate":"2020-10-21T16:21:20.567+03:00"}
{"Id":489712,"Number":173,"KnessetNum":2,"Name":"ישיבת מליאה בתאריך 21/01/1953 בשעה 11:17","StartDate":"1953-01-21T11:17:00+02:00","FinishDate":"1953-01-21T13:13:00+02:00","IsSpecialMeeting":null,"LastUpdatedDate":"2020-10-21T16:15:58.663+03:00"}
{"Id":489713,"Number":174,"KnessetNum":2,"Name":"ישיבת מליאה בתאריך 26/01/1953 בשעה 16:07","StartDate":"1953-01-26T16:07:00+02:00","FinishDate":"1953-01-26T18:50:00+02:00","IsSpecialMeeting":null,"LastUpdatedDate":"2020-10-21T16:11:40.937+03:00"}
{"Id":489714,"Number":175,"KnessetNum":2,"Name":"ישיבת מליאה בתאריך 26/01/1953 בשעה 20:02","StartDate":"1953-01-26T20:02:00+02:00","FinishDate":"1953-01-26T22:30:00+02:00","IsSpecialMeeting":null,"LastUpdatedDate":"2020-10-21T16:13:15.363+03:00"}
{"Id":489715,"Number":177,"KnessetNum":2,"Name":"ישיבת מליאה בתאריך 27/01/1953 בשעה 20:12","StartDate":"1953-01-27T20:12:00+02:00","FinishDate":"1953-01-27T22:05:00+02:00","IsSpecialMeeting":null,"LastUpdatedDate":"2020-10-21T16:05:02.09+03:00"}
{"Id":489716,"Number":178,"KnessetNum":2,"Name":"ישיבת מליאה בתאריך 28/01/1953 בשעה 11:09","StartDate":"1953-01-28T11:09:00+02:00","FinishDate":"1953-01-28T12:43:00+02:00","IsSpecialMeeting":null,"LastUpdatedDate":"2020-10-21T16:01:13.68+03:00"}
{"Id":489717,"Number":179,"KnessetNum":2,"Name":"ישיבת מליאה בתאריך 02/02/1953 בשעה 16:08","StartDate":"1953-02-02T16:08:00+02:00","FinishDate":"1953-02-02T18:55:00+02:00","IsSpecialMeeting":null,"LastUpdatedDate":"2020-10-21T15:57:56.6+03:00"}
{"Id":489718,"Number":188,"KnessetNum":2,"Name":"ישיבת מליאה בתאריך 11/02/1953 בשעה 11:07","StartDate":"1953-02-11T11:07:00+02:00","FinishDate":"1953-02-11T12:55:00+02:00","IsSpecialMeeting":null,"LastUpdatedDate":"2020-10-21T15:26:18.427+03:00"}
{"Id":489719,"Number":189,"KnessetNum":2,"Name":"ישיבת מליאה בתאריך 16/02/1953 בשעה 16:33","StartDate":"1953-02-16T16:33:00+02:00","FinishDate":"1953-02-16T19:20:00+02:00","IsSpecialMeeting":null,"LastUpdatedDate":"2021-09-13T13:58:15.74+03:00"}
{"Id":489720,"Number":190,"KnessetNum":2,"Name":"ישיבת מליאה בתאריך 16/02/1953 בשעה 20:31","StartDate":"1953-02-16T20:31:00+02:00","FinishDate":"1953-02-16T22:00:00+02:00","IsSpecialMeeting":null,"LastUpdatedDate":"2020-10-21T15:24:09.153+03:00"}
{"Id":489721,"Number":191,"KnessetNum":2,"Name":"ישיבת מליאה בתאריך 17/02/1953 בשעה 16:03","StartDate":"1953-02-17T16:03:00+02:00","FinishDate":"1953-02-17T18:00:00+02:00","IsSpecialMeeting":null,"LastUpdatedDate":"2020-10-21T15:19:14.033+03:00"}
{"Id":489722,"Number":192,"KnessetNum":2,"Name":"ישיבת מליאה בתאריך 17/02/1953 בשעה 20:00","StartDate":"1953-02-17T20:00:00+02:00","FinishDate":"1953-02-17T21:40:00+02:00","IsSpecialMeeting":null,"LastUpdatedDate":"2020-10-21T15:20:49.507+03:00"}
{"Id":489723,"Number":193,"KnessetNum":2,"Name":"ישיבת מליאה בתאריך 23/02/1953 בשעה 16:10","StartDate":"1953-02-23T16:10:00+02:00","FinishDate":"1953-02-23T19:08:00+02:00","IsSpecialMeeting":null,"LastUpdatedDate":"2020-10-21T15:09:02.83+03:00"}
{"Id":489724,"Number":194,"KnessetNum":2,"Name":"ישיבת מליאה בתאריך 23/02/1953 בשעה 20:05","StartDate":"1953-02-23T20:05:00+02:00","FinishDate":"1953-02-23T21:40:00+02:00","IsSpecialMeeting":null,"LastUpdatedDate":"2020-10-21T15:11:07.983+03:00"}
{"Id":489725,"Number":195,"KnessetNum":2,"Name":"ישיבת מליאה בתאריך 24/02/1953 בשעה 16:10","StartDate":"1953-02-24T16:10:00+02:00","FinishDate":"1953-02-24T19:00:00+02:00","IsSpecialMeeting":null,"LastUpdatedDate":"2020-10-21T15:01:36.007+03:00"}
{"Id":489726,"Number":196,"KnessetNum":2,"Name":"ישיבת מליאה בתאריך 24/02/1953 בשעה 20:10","StartDate":"1953-02-24T20:10:00+02:00","FinishDate":"1953-02-24T22:00:00+02:00","IsSpecialMeeting":null,"LastUpdatedDate":"2020-10-21T15:03:13.463+03:00"}
{"Id":489727,"Number":198,"KnessetNum":2,"Name":"ישיבת מליאה בתאריך 03/03/1953 בשעה 16:05","StartDate":"1953-03-03T16:05:00+02:00","FinishDate":"1953-03-03T18:45:00+02:00","IsSpecialMeeting":null,"LastUpdatedDate":"2020-10-21T14:55:47.413+03:00"}
{"Id":489728,"Number":199,"KnessetNum":2,"Name":"ישיבת מליאה בתאריך 03/03/1953 בשעה 20:05","StartDate":"1953-03-03T20:05:00+02:00","FinishDate":"1953-03-03T22:55:00+02:00","IsSpecialMeeting":null,"LastUpdatedDate":"2020-10-21T14:57:29.71+03:00"}
{"Id":489729,"Number":207,"KnessetNum":2,"Name":"ישיבת מליאה בתאריך 16/03/1953 בשעה 16:08","StartDate":"1953-03-16T16:08:00+02:00","FinishDate":"1953-03-16T19:02:00+02:00","IsSpecialMeeting":null,"LastUpdatedDate":"2021-09-14T12:55:11.693+03:00"}
{"Id":489730,"Number":208,"KnessetNum":2,"Name":"ישיבת מליאה בתאריך 16/03/1953 בשעה 20:05","StartDate":"1953-03-16T20:05:00+02:00","FinishDate":"1953-03-16T22:00:00+02:00","IsSpecialMeeting":null,"LastUpdatedDate":"2021-09-14T14:07:17.573+03:00"}
{"Id":489731,"Number":212,"KnessetNum":2,"Name":"ישיבת מליאה בתאריך 23/03/1953 בשעה 16:05","StartDate":"1953-03-23T16:05:00+02:00","FinishDate":"1953-03-23T19:03:00+02:00","IsSpecialMeeting":null,"LastUpdatedDate":"2021-11-21T13:49:04.81+02:00"}
{"Id":489732,"Number":213,"KnessetNum":2,"Name":"ישיבת מליאה בתאריך 23/03/1953 בשעה 20:22","StartDate":"1953-03-23T20:22:00+02:00","FinishDate":"1953-03-23T23:50:00+02:00","IsSpecialMeeting":null,"LastUpdatedDate":"2019-11-04T16:56:33.797+02:00"}
{"Id":489733,"Number":221,"KnessetNum":2,"Name":"ישיבת מליאה בתאריך 05/05/1953 בשעה 16:03","StartDate":"1953-05-05T16:03:00+03:00","FinishDate":"1953-05-05T19:10:00+03:00","IsSpecialMeeting":null,"LastUpdatedDate":"2022-01-12T07:07:18.343+02:00"}
{"Id":489734,"Number":222,"KnessetNum":2,"Name":"ישיבת מליאה בתאריך 05/05/1953 בשעה 20:15","StartDate":"1953-05-05T20:15:00+03:00","FinishDate":"1953-05-05T22:00:00+03:00","IsSpecialMeeting":null,"LastUpdatedDate":"2022-01-12T07:14:44.627+02:00"}
{"Id":489735,"Number":223,"KnessetNum":2,"Name":"ישיבת מליאה בתאריך 06/05/1953 בשעה 11:10","StartDate":"1953-05-06T11:10:00+03:00","FinishDate":"1953-05-06T13:35:00+03:00","IsSpecialMeeting":null,"LastUpdatedDate":"2022-01-12T07:55:22.7+02:00"}
{"Id":489736,"Number":224,"KnessetNum":2,"Name":"ישיבת מליאה בתאריך 11/05/1953 בשעה 16:07","StartDate":"1953-05-11T16:07:00+03:00","FinishDate":"1953-05-11T19:13:00+03:00","IsSpecialMeeting":null,"LastUpdatedDate":"2020-10-21T12:59:38.107+03:00"}
{"Id":489737,"Number":225,"KnessetNum":2,"Name":"ישיבת מליאה בתאריך 11/05/1953 בשעה 20:17","StartDate":"1953-05-11T20:17:00+03:00","FinishDate":"1953-05-11T21:45:00+03:00","IsSpecialMeeting":null,"LastUpdatedDate":"2022-01-12T08:08:26.773+02:00"}
{"Id":489738,"Number":226,"KnessetNum":2,"Name":"ישיבת מליאה בתאריך 12/05/1953 בשעה 16:07","StartDate":"1953-05-12T16:07:00+03:00","FinishDate":"1953-05-12T19:25:00+03:00","IsSpecialMeeting":null,"LastUpdatedDate":"2022-01-12T08:12:14.18+02:00"}
{"Id":489739,"Number":229,"KnessetNum":2,"Name":"ישיבת מליאה בתאריך 18/05/1953 בשעה 10:42","StartDate":"1953-05-18T10:42:00+03:00","FinishDate":"1953-05-18T13:05:00+03:00","IsSpecialMeeting":null,"LastUpdatedDate":"2020-10-21T12:36:51.24+03:00"}
{"Id":489740,"Number":230,"KnessetNum":2,"Name":"ישיבת מליאה בתאריך 18/05/1953 בשעה 15:07","StartDate":"1953-05-18T15:07:00+03:00","FinishDate":"1953-05-18T17:05:00+03:00","IsSpecialMeeting":null,"LastUpdatedDate":"2022-01-10T11:54:56.867+02:00"}
{"Id":489741,"Number":236,"KnessetNum":2,"Name":"ישיבת מליאה בתאריך 27/05/1953 בשעה 11:08","StartDate":"1953-05-27T11:08:00+03:00","FinishDate":"1953-05-27T12:05:00+03:00","IsSpecialMeeting":null,"LastUpdatedDate":"2020-10-21T11:47:11.323+03:00"}
{"Id":489742,"Number":239,"KnessetNum":2,"Name":"ישיבת מליאה בתאריך 02/06/1953 בשעה 16:00","StartDate":"1953-06-02T16:00:00+03:00","FinishDate":"1953-06-02T19:00:00+03:00","IsSpecialMeeting":null,"LastUpdatedDate":"2022-01-10T12:13:18.813+02:00"}
{"Id":489743,"Number":240,"KnessetNum":2,"Name":"ישיבת מליאה בתאריך 02/06/1953 בשעה 20:03","StartDate":"1953-06-02T20:03:00+03:00","FinishDate":"1953-06-02T23:00:00+03:00","IsSpecialMeeting":null,"LastUpdatedDate":"2022-01-10T12:55:33.063+02:00"}
{"Id":489744,"Number":241,"KnessetNum":2,"Name":"ישיבת מליאה בתאריך 03/06/1953 בשעה 11:12","StartDate":"1953-06-03T11:12:00+03:00","FinishDate":"1953-06-03T17:45:00+03:00","IsSpecialMeeting":null,"LastUpdatedDate":"2020-10-21T11:17:56.27+03:00"}
{"Id":489745,"Number":242,"KnessetNum":2,"Name":"ישיבת מליאה בתאריך 08/06/1953 בשעה 16:09","StartDate":"1953-06-08T16:09:00+03:00","FinishDate":"1953-06-08T18:49:00+03:00","IsSpecialMeeting":null,"LastUpdatedDate":"2020-10-21T11:15:25.737+03:00"}
{"Id":489746,"Number":246,"KnessetNum":2,"Name":"ישיבת מליאה בתאריך 10/06/1953 בשעה 11:10","StartDate":"1953-06-10T11:10:00+03:00","FinishDate":"1953-06-10T13:20:00+03:00","IsSpecialMeeting":null,"LastUpdatedDate":"2020-10-21T11:03:36.927+03:00"}
{"Id":489747,"Number":247,"KnessetNum":2,"Name":"ישיבת מליאה בתאריך 15/06/1953 בשעה 16:05","StartDate":"1953-06-15T16:05:00+03:00","FinishDate":"1953-06-15T19:14:00+03:00","IsSpecialMeeting":null,"LastUpdatedDate":"2020-10-21T10:59:16.317+03:00"}
{"Id":489748,"Number":248,"KnessetNum":2,"Name":"ישיבת מליאה בתאריך 15/06/1953 בשעה 20:22","StartDate":"1953-06-15T20:22:00+03:00","FinishDate":"1953-06-15T22:00:00+03:00","IsSpecialMeeting":null,"LastUpdatedDate":"2022-01-12T09:19:14.97+02:00"}
{"Id":489749,"Number":249,"KnessetNum":2,"Name":"ישיבת מליאה בתאריך 16/06/1953 בשעה 16:06","StartDate":"1953-06-16T16:06:00+03:00","FinishDate":"1953-06-16T18:50:00+03:00","IsSpecialMeeting":null,"LastUpdatedDate":"2022-01-12T09:43:54.273+02:00"}
{"Id":489750,"Number":250,"KnessetNum":2,"Name":"ישיבת מליאה בתאריך 16/06/1953 בשעה 20:06","StartDate":"1953-06-16T20:06:00+03:00","FinishDate":"1953-06-16T23:45:00+03:00","IsSpecialMeeting":null,"LastUpdatedDate":"2022-01-12T09:48:57.483+02:00"}
{"Id":489751,"Number":251,"KnessetNum":2,"Name":"ישיבת מליאה בתאריך 17/06/1953 בשעה 11:00","StartDate":"1953-06-17T11:00:00+03:00","FinishDate":"1953-06-17T15:00:00+03:00","IsSpecialMeeting":null,"LastUpdatedDate":"2022-01-12T09:55:19.127+02:00"}
{"Id":489752,"Number":254,"KnessetNum":2,"Name":"ישיבת מליאה בתאריך 23/06/1953 בשעה 16:02","StartDate":"1953-06-23T16:02:00+03:00","FinishDate":"1953-06-23T18:55:00+03:00","IsSpecialMeeting":null,"LastUpdatedDate":"2022-01-12T10:10:23.173+02:00"}
{"Id":489753,"Number":256,"KnessetNum":2,"Name":"ישיבת מליאה בתאריך 24/06/1953 בשעה 11:10","StartDate":"1953-06-24T11:10:00+03:00","FinishDate":"1953-06-24T13:32:00+03:00","IsSpecialMeeting":null,"LastUpdatedDate":"2022-01-12T11:17:55.473+02:00"}
{"Id":489754,"Number":257,"KnessetNum":2,"Name":"ישיבת מליאה בתאריך 29/06/1953 בשעה 16:07","StartDate":"1953-06-29T16:07:00+03:00","FinishDate":"1953-06-29T19:07:00+03:00","IsSpecialMeeting":null,"LastUpdatedDate":"2022-01-12T11:21:36.42+02:00"}
{"Id":489755,"Number":259,"KnessetNum":2,"Name":"ישיבת מליאה בתאריך 30/06/1953 בשעה 16:10","StartDate":"1953-06-30T16:10:00+03:00","FinishDate":"1953-06-30T19:00:00+03:00","IsSpecialMeeting":null,"LastUpdatedDate":"2022-01-12T11:33:50.917+02:00"}
{"Id":489756,"Number":260,"KnessetNum":2,"Name":"ישיבת מליאה בתאריך 30/06/1953 בשעה 20:05","StartDate":"1953-06-30T20:05:00+03:00","FinishDate":"1953-06-30T22:53:00+03:00","IsSpecialMeeting":null,"LastUpdatedDate":"2022-01-12T11:56:55.777+02:00"}
{"Id":489757,"Number":264,"KnessetNum":2,"Name":"ישיבת מליאה בתאריך 07/07/1953 בשעה 16:05","StartDate":"1953-07-07T16:05:00+03:00","FinishDate":"1953-07-07T19:05:00+03:00","IsSpecialMeeting":null,"LastUpdatedDate":"2020-10-21T10:03:35.863+03:00"}
{"Id":489758,"Number":279,"KnessetNum":2,"Name":"ישיבת מליאה בתאריך 29/07/1953 בשעה 11:05","StartDate":"1953-07-29T11:05:00+03:00","FinishDate":"1953-07-29T13:45:00+03:00","IsSpecialMeeting":null,"LastUpdatedDate":"2020-10-21T09:19:24.853+03:00"}
{"Id":489759,"Number":282,"KnessetNum":2,"Name":"ישיבת מליאה בתאריך 04/08/1953 בשעה 16:12","StartDate":"1953-08-04T16:12:00+03:00","FinishDate":"1953-08-04T19:12:00+03:00","IsSpecialMeeting":null,"LastUpdatedDate":"2022-01-12T13:55:46.733+02:00"}
{"Id":489760,"Number":283,"KnessetNum":2,"Name":"ישיבת מליאה בתאריך 04/08/1953 בשעה 20:30","StartDate":"1953-08-04T20:30:00+03:00","FinishDate":"1953-08-04T22:29:00+03:00","IsSpecialMeeting":null,"LastUpdatedDate":"2022-01-12T14:02:23.993+02:00"}
{"Id":489761,"Number":284,"KnessetNum":2,"Name":"ישיבת מליאה בתאריך 05/08/1953 בשעה 11:10","StartDate":"1953-08-05T11:10:00+03:00","FinishDate":"1953-08-05T14:52:00+03:00","IsSpecialMeeting":null,"LastUpdatedDate":"2022-01-12T14:06:47.63+02:00"}
{"Id":489762,"Number":291,"KnessetNum":2,"Name":"ישיבת מליאה בתאריך 13/08/1953 בשעה 11:07","StartDate":"1953-08-13T11:07:00+03:00","FinishDate":"1953-08-13T16:40:00+03:00","IsSpecialMeeting":null,"LastUpdatedDate":"2022-01-12T14:22:53.42+02:00"}
{"Id":489763,"Number":292,"KnessetNum":2,"Name":"ישיבת מליאה בתאריך 17/08/1953 בשעה 16:05","StartDate":"1953-08-17T16:05:00+03:00","FinishDate":"1953-08-17T19:15:00+03:00","IsSpecialMeeting":null,"LastUpdatedDate":"2020-10-20T16:52:34.537+03:00"}
{"Id":489764,"Number":293,"KnessetNum":2,"Name":"ישיבת מליאה בתאריך 17/08/1953 בשעה 20:33","StartDate":"1953-08-17T20:33:00+03:00","FinishDate":"1953-08-17T22:00:00+03:00","IsSpecialMeeting":null,"LastUpdatedDate":"2022-01-12T14:38:26.433+02:00"}
{"Id":489765,"Number":294,"KnessetNum":2,"Name":"ישיבת מליאה בתאריך 18/08/1953 בשעה 16:06","StartDate":"1953-08-18T16:06:00+03:00","FinishDate":"1953-08-18T18:58:00+03:00","IsSpecialMeeting":null,"LastUpdatedDate":"2022-01-13T07:33:55.053+02:00"}
{"Id":489766,"Number":299,"KnessetNum":2,"Name":"ישיבת מליאה בתאריך 24/08/1953 בשעה 16:05","StartDate":"1953-08-24T16:05:00+03:00","FinishDate":"1953-08-24T18:55:00+03:00","IsSpecialMeeting":null,"LastUpdatedDate":"2020-10-20T16:33:26.99+03:00"}
{"Id":489767,"Number":300,"KnessetNum":2,"Name":"ישיבת מליאה בתאריך 24/08/1953 בשעה 20:27","StartDate":"1953-08-24T20:27:00+03:00","FinishDate":"1953-08-24T21:55:00+03:00","IsSpecialMeeting":null,"LastUpdatedDate":"2022-01-13T08:31:03.983+02:00"}
{"Id":489768,"Number":306,"KnessetNum":2,"Name":"ישיבת מליאה בתאריך 02/11/1953 בשעה 16:10","StartDate":"1953-11-02T16:10:00+02:00","FinishDate":"1953-11-02T16:22:00+02:00","IsSpecialMeeting":null,"LastUpdatedDate":"2020-10-20T15:41:20.28+03:00"}
{"Id":489769,"Number":311,"KnessetNum":2,"Name":"ישיבת מליאה בתאריך 04/11/1953 בשעה 11:08","StartDate":"1953-11-04T11:08:00+02:00","FinishDate":"1953-11-04T12:25:00+02:00","IsSpecialMeeting":null,"LastUpdatedDate":"2022-01-13T09:01:33.55+02:00"}
{"Id":489770,"Number":316,"KnessetNum":2,"Name":"ישיבת מליאה בתאריך 11/11/1953 בשעה 11:13","StartDate":"1953-11-11T11:13:00+02:00","FinishDate":"1953-11-11T13:38:00+02:00","IsSpecialMeeting":null,"LastUpdatedDate":"2020-10-20T15:04:21.81+03:00"}
{"Id":489771,"Number":317,"KnessetNum":2,"Name":"ישיבת מליאה בתאריך 16/11/1953 בשעה 16:10","StartDate":"1953-11-16T16:10:00+02:00","FinishDate":"1953-11-16T18:20:00+02:00","IsSpecialMeeting":null,"LastUpdatedDate":"2020-10-20T14:59:15.693+03:00"}
{"Id":489772,"Number":318,"KnessetNum":2,"Name":"ישיבת מליאה בתאריך 16/11/1953 בשעה 20:17","StartDate":"1953-11-16T20:17:00+02:00","FinishDate":"1953-11-16T21:35:00+02:00","IsSpecialMeeting":null,"LastUpdatedDate":"2022-01-13T09:38:26.203+02:00"}
{"Id":489773,"Number":324,"KnessetNum":2,"Name":"ישיבת מליאה בתאריך 24/11/1953 בשעה 16:06","StartDate":"1953-11-24T16:06:00+02:00","FinishDate":"1953-11-24T19:50:00+02:00","IsSpecialMeeting":null,"LastUpdatedDate":"2022-01-13T09:41:18.623+02:00"}
{"Id":489774,"Number":325,"KnessetNum":2,"Name":"ישיבת מליאה בתאריך 24/11/1953 בשעה 20:05","StartDate":"1953-11-24T20:05:00+02:00","FinishDate":"1953-11-24T21:30:00+02:00","IsSpecialMeeting":null,"LastUpdatedDate":"2022-01-13T10:05:58.817+02:00"}
{"Id":489775,"Number":326,"KnessetNum":2,"Name":"ישיבת מליאה בתאריך 25/11/1953 בשעה 11:14","StartDate":"1953-11-25T11:14:00+02:00","FinishDate":"1953-11-25T12:46:00+02:00","IsSpecialMeeting":null,"LastUpdatedDate":"2020-10-20T14:41:06.073+03:00"}
{"Id":489776,"Number":327,"KnessetNum":2,"Name":"ישיבת מליאה בתאריך 30/11/1953 בשעה 16:05","StartDate":"1953-11-30T16:05:00+02:00","FinishDate":"1953-11-30T19:57:00+02:00","IsSpecialMeeting":null,"LastUpdatedDate":"2020-10-20T14:32:59.323+03:00"}
{"Id":489777,"Number":328,"KnessetNum":2,"Name":"ישיבת מליאה בתאריך 30/11/1953 בשעה 20:03","StartDate":"1953-11-30T20:03:00+02:00","FinishDate":"1953-11-30T21:55:00+02:00","IsSpecialMeeting":null,"LastUpdatedDate":"2020-10-20T14:34:40.45+03:00"}
{"Id":489778,"Number":329,"KnessetNum":2,"Name":"ישיבת מליאה בתאריך 01/12/1953 בשעה 11:05","StartDate":"1953-12-01T11:05:00+02:00","FinishDate":"1953-12-01T13:40:00+02:00","IsSpecialMeeting":null,"LastUpdatedDate":"2020-10-20T14:30:57.57+03:00"}
{"Id":489779,"Number":330,"KnessetNum":2,"Name":"ישיבת מליאה בתאריך 07/12/1953 בשעה 16:10","StartDate":"1953-12-07T16:10:00+02:00","FinishDate":"1953-12-07T18:10:00+02:00","IsSpecialMeeting":null,"LastUpdatedDate":"2020-10-20T14:25:23.043+03:00"}
{"Id":489780,"Number":331,"KnessetNum":2,"Name":"ישיבת מליאה בתאריך 07/12/1953 בשעה 19:36","StartDate":"1953-12-07T19:36:00+02:00","FinishDate":"1953-12-07T21:43:00+02:00","IsSpecialMeeting":null,"LastUpdatedDate":"2020-10-20T14:28:28.83+03:00"}
{"Id":489781,"Number":333,"KnessetNum":2,"Name":"ישיבת מליאה בתאריך 09/12/1953 בשעה 11:08","StartDate":"1953-12-09T11:08:00+02:00","FinishDate":"1953-12-09T12:48:00+02:00","IsSpecialMeeting":null,"LastUpdatedDate":"2020-10-20T14:08:43.533+03:00"}
{"Id":489782,"Number":334,"KnessetNum":2,"Name":"ישיבת מליאה בתאריך 14/12/1953 בשעה 16:10","StartDate":"1953-12-14T16:10:00+02:00","FinishDate":"1953-12-14T18:35:00+02:00","IsSpecialMeeting":null,"LastUpdatedDate":"2020-10-20T14:05:32.473+03:00"}
{"Id":489783,"Number":337,"KnessetNum":2,"Name":"ישיבת מליאה בתאריך 21/12/1953 בשעה 16:07","StartDate":"1953-12-21T16:07:00+02:00","FinishDate":"1953-12-21T18:55:00+02:00","IsSpecialMeeting":null,"LastUpdatedDate":"2020-10-20T13:23:40.67+03:00"}
{"Id":489784,"Number":341,"KnessetNum":2,"Name":"ישיבת מליאה בתאריך 23/12/1953 בשעה 11:13","StartDate":"1953-12-23T11:13:00+02:00","FinishDate":"1953-12-23T13:55:00+02:00","IsSpecialMeeting":null,"LastUpdatedDate":"2020-10-20T12:53:19.49+03:00"}
{"Id":489785,"Number":342,"KnessetNum":2,"Name":"ישיבת מליאה בתאריך 28/12/1953 בשעה 16:10","StartDate":"1953-12-28T16:10:00+02:00","FinishDate":"1953-12-28T19:08:00+02:00","IsSpecialMeeting":null,"LastUpdatedDate":"2020-10-20T12:33:03.377+03:00"}
{"Id":489786,"Number":343,"KnessetNum":2,"Name":"ישיבת מליאה בתאריך 28/12/1953 בשעה 20:20","StartDate":"1953-12-28T20:20:00+02:00","FinishDate":"1953-12-28T21:42:00+02:00","IsSpecialMeeting":null,"LastUpdatedDate":"2020-10-20T12:48:46.41+03:00"}
{"Id":489787,"Number":344,"KnessetNum":2,"Name":"ישיבת מליאה בתאריך 28/12/1953 בשעה 16:03","StartDate":"1953-12-28T16:03:00+02:00","FinishDate":"1953-12-28T19:00:00+02:00","IsSpecialMeeting":null,"LastUpdatedDate":"2020-10-20T12:51:09.253+03:00"}
{"Id":489788,"Number":350,"KnessetNum":2,"Name":"ישיבת מליאה בתאריך 06/01/1954 בשעה 11:10","StartDate":"1954-01-06T11:10:00+02:00","FinishDate":"1954-01-06T13:40:00+02:00","IsSpecialMeeting":null,"LastUpdatedDate":"2020-10-20T12:06:28.2+03:00"}
{"Id":489789,"Number":351,"KnessetNum":2,"Name":"ישיבת מליאה בתאריך 11/01/1954 בשעה 16:04","StartDate":"1954-01-11T16:04:00+02:00","FinishDate":"1954-01-11T19:15:00+02:00","IsSpecialMeeting":null,"LastUpdatedDate":"2020-10-20T11:52:40.13+03:00"}
{"Id":489790,"Number":352,"KnessetNum":2,"Name":"ישיבת מליאה בתאריך 11/01/1954 בשעה 20:20","StartDate":"1954-01-11T20:20:00+02:00","FinishDate":"1954-01-11T22:00:00+02:00","IsSpecialMeeting":null,"LastUpdatedDate":"2020-10-20T11:54:14.623+03:00"}
{"Id":489791,"Number":353,"KnessetNum":2,"Name":"ישיבת מליאה בתאריך 12/01/1954 בשעה 16:07","StartDate":"1954-01-12T16:07:00+02:00","FinishDate":"1954-01-12T19:15:00+02:00","IsSpecialMeeting":null,"LastUpdatedDate":"2020-10-20T11:41:51.113+03:00"}
{"Id":489792,"Number":354,"KnessetNum":2,"Name":"ישיבת מליאה בתאריך 12/01/1954 בשעה 20:20","StartDate":"1954-01-12T20:20:00+02:00","FinishDate":"1954-01-12T21:47:00+02:00","IsSpecialMeeting":null,"LastUpdatedDate":"2020-10-20T11:44:25.157+03:00"}
{"Id":489793,"Number":355,"KnessetNum":2,"Name":"ישיבת מליאה בתאריך 13/01/1954 בשעה 11:08","StartDate":"1954-01-13T11:08:00+02:00","FinishDate":"1954-01-13T14:20:00+02:00","IsSpecialMeeting":null,"LastUpdatedDate":"2020-10-20T11:40:10.28+03:00"}
{"Id":489794,"Number":358,"KnessetNum":2,"Name":"ישיבת מליאה בתאריך 20/01/1954 בשעה 11:13","StartDate":"1954-01-20T11:13:00+02:00","FinishDate":"1954-01-20T13:21:00+02:00","IsSpecialMeeting":null,"LastUpdatedDate":"2020-10-20T11:34:10.61+03:00"}
{"Id":489795,"Number":359,"KnessetNum":2,"Name":"ישיבת מליאה בתאריך 25/01/1954 בשעה 16:08","StartDate":"1954-01-25T16:08:00+02:00","FinishDate":"1954-01-25T19:13:00+02:00","IsSpecialMeeting":null,"LastUpdatedDate":"2020-10-20T11:28:15.7+03:00"}
{"Id":489796,"Number":360,"KnessetNum":2,"Name":"ישיבת מליאה בתאריך 25/01/1954 בשעה 20:20","StartDate":"1954-01-25T20:20:00+02:00","FinishDate":"1954-01-25T22:00:00+02:00","IsSpecialMeeting":null,"LastUpdatedDate":"2020-10-20T11:30:39.707+03:00"}
{"Id":489797,"Number":361,"KnessetNum":2,"Name":"ישיבת מליאה בתאריך 26/01/1954 בשעה 16:12","StartDate":"1954-01-26T16:12:00+02:00","FinishDate":"1954-01-26T19:15:00+02:00","IsSpecialMeeting":null,"LastUpdatedDate":"2020-10-20T10:56:38.15+03:00"}
{"Id":489798,"Number":362,"KnessetNum":2,"Name":"ישיבת מליאה בתאריך 26/01/1954 בשעה 20:15","StartDate":"1954-01-26T20:15:00+02:00","FinishDate":"1954-01-26T22:37:00+02:00","IsSpecialMeeting":null,"LastUpdatedDate":"2020-10-20T11:26:19.937+03:00"}
{"Id":489799,"Number":364,"KnessetNum":2,"Name":"ישיבת מליאה בתאריך 01/02/1954 בשעה 16:09","StartDate":"1954-02-01T16:09:00+02:00","FinishDate":"1954-02-01T18:45:00+02:00","IsSpecialMeeting":null,"LastUpdatedDate":"2020-10-20T10:45:17.153+03:00"}
{"Id":489800,"Number":368,"KnessetNum":2,"Name":"ישיבת מליאה בתאריך 03/02/1954 בשעה 11:07","StartDate":"1954-02-03T11:07:00+02:00","FinishDate":"1954-02-03T12:57:00+02:00","IsSpecialMeeting":null,"LastUpdatedDate":"2020-10-20T10:14:52.493+03:00"}
{"Id":489801,"Number":376,"KnessetNum":2,"Name":"ישיבת מליאה בתאריך 17/02/1954 בשעה 11:15","StartDate":"1954-02-17T11:15:00+02:00","FinishDate":"1954-02-17T13:01:00+02:00","IsSpecialMeeting":null,"LastUpdatedDate":"2020-10-20T09:27:44.02+03:00"}
{"Id":489802,"Number":379,"KnessetNum":2,"Name":"ישיבת מליאה בתאריך 23/02/1954 בשעה 16:08","StartDate":"1954-02-23T16:08:00+02:00","FinishDate":"1954-02-23T19:34:00+02:00","IsSpecialMeeting":null,"LastUpdatedDate":"2021-12-30T09:38:24.043+02:00"}
{"Id":489803,"Number":380,"KnessetNum":2,"Name":"ישיבת מליאה בתאריך 23/02/1954 בשעה 20:37","StartDate":"1954-02-23T20:37:00+02:00","FinishDate":"1954-02-23T22:10:00+02:00","IsSpecialMeeting":null,"LastUpdatedDate":"2021-12-30T09:43:33.793+02:00"}
{"Id":489804,"Number":381,"KnessetNum":2,"Name":"ישיבת מליאה בתאריך 24/02/1954 בשעה 11:13","StartDate":"1954-02-24T11:13:00+02:00","FinishDate":"1954-02-24T13:35:00+02:00","IsSpecialMeeting":null,"LastUpdatedDate":"2021-12-30T10:15:25.453+02:00"}
{"Id":489805,"Number":382,"KnessetNum":2,"Name":"ישיבת מליאה בתאריך 01/03/1954 בשעה 16:15","StartDate":"1954-03-01T16:15:00+02:00","FinishDate":"1954-03-01T18:56:00+02:00","IsSpecialMeeting":null,"LastUpdatedDate":"2020-10-20T09:08:03.05+03:00"}
{"Id":489806,"Number":383,"KnessetNum":2,"Name":"ישיבת מליאה בתאריך 01/03/1954 בשעה 20:07","StartDate":"1954-03-01T20:07:00+02:00","FinishDate":"1954-03-01T21:55:00+02:00","IsSpecialMeeting":null,"LastUpdatedDate":"2021-12-30T10:23:42.517+02:00"}
{"Id":489807,"Number":384,"KnessetNum":2,"Name":"ישיבת מליאה בתאריך 02/03/1954 בשעה 16:15","StartDate":"1954-03-02T16:15:00+02:00","FinishDate":"1954-03-02T18:47:00+02:00","IsSpecialMeeting":null,"LastUpdatedDate":"2021-12-30T10:29:06.843+02:00"}
{"Id":489808,"Number":385,"KnessetNum":2,"Name":"ישיבת מליאה בתאריך 02/03/1954 בשעה 20:20","StartDate":"1954-03-02T20:20:00+02:00","FinishDate":"1954-03-02T22:51:00+02:00","IsSpecialMeeting":null,"LastUpdatedDate":"2021-12-30T10:43:04.13+02:00"}
{"Id":489809,"Number":386,"KnessetNum":2,"Name":"ישיבת מליאה בתאריך 03/03/1954 בשעה 15:11","StartDate":"1954-03-03T15:11:00+02:00","FinishDate":"1954-03-03T18:22:00+02:00","IsSpecialMeeting":null,"LastUpdatedDate":"2021-12-30T11:04:59.047+02:00"}
{"Id":489810,"Number":387,"KnessetNum":2,"Name":"ישיבת מליאה בתאריך 08/03/1954 בשעה 16:04","StartDate":"1954-03-08T16:04:00+02:00","FinishDate":"1954-03-08T18:50:00+02:00","IsSpecialMeeting":null,"LastUpdatedDate":"2021-12-30T11:19:01.717+02:00"}
{"Id":489811,"Number":388,"KnessetNum":2,"Name":"ישיבת מליאה בתאריך 08/03/1954 בשעה 20:07","StartDate":"1954-03-08T20:07:00+02:00","FinishDate":null,"IsSpecialMeeting":null,"LastUpdatedDate":"2021-12-30T11:32:32.85+02:00"}
{"Id":489812,"Number":389,"KnessetNum":2,"Name":"ישיבת מליאה בתאריך 09/03/1954 בשעה 16:05","StartDate":"1954-03-09T16:05:00+02:00","FinishDate":"1954-03-09T19:22:00+02:00","IsSpecialMeeting":null,"LastUpdatedDate":"2021-12-30T11:39:09.4+02:00"}
{"Id":489813,"Number":390,"KnessetNum":2,"Name":"ישיבת מליאה בתאריך 09/03/1954 בשעה 20:33","StartDate":"1954-03-09T20:33:00+02:00","FinishDate":"1954-03-09T22:17:00+02:00","IsSpecialMeeting":null,"LastUpdatedDate":"2021-12-30T11:44:40.283+02:00"}
{"Id":489814,"Number":394,"KnessetNum":2,"Name":"ישיבת מליאה בתאריך 16/03/1954 בשעה 16:07","StartDate":"1954-03-16T16:07:00+02:00","FinishDate":"1954-03-16T19:08:00+02:00","IsSpecialMeeting":null,"LastUpdatedDate":"2021-12-30T13:15:33.75+02:00"}
{"Id":489815,"Number":395,"KnessetNum":2,"Name":"ישיבת מליאה בתאריך 16/03/1954 בשעה 20:16","StartDate":"1954-03-16T20:16:00+02:00","FinishDate":"1954-03-16T22:48:00+02:00","IsSpecialMeeting":null,"LastUpdatedDate":"2021-12-30T13:19:37.057+02:00"}
{"Id":489816,"Number":396,"KnessetNum":2,"Name":"ישיבת מליאה בתאריך 17/03/1954 בשעה 15:14","StartDate":"1954-03-17T15:14:00+02:00","FinishDate":"1954-03-17T18:35:00+02:00","IsSpecialMeeting":null,"LastUpdatedDate":"2021-12-30T13:35:08.273+02:00"}
{"Id":489817,"Number":399,"KnessetNum":2,"Name":"ישיבת מליאה בתאריך 23/03/1954 בשעה 16:04","StartDate":"1954-03-23T16:04:00+02:00","FinishDate":"1954-03-23T19:10:00+02:00","IsSpecialMeeting":null,"LastUpdatedDate":"2022-01-06T07:31:27.06+02:00"}
{"Id":489818,"Number":400,"KnessetNum":2,"Name":"ישיבת מליאה בתאריך 23/03/1954 בשעה 20:15","StartDate":"1954-03-23T20:15:00+02:00","FinishDate":"1954-03-24T01:55:00+02:00","IsSpecialMeeting":null,"LastUpdatedDate":"2022-01-06T07:47:27.053+02:00"}
{"Id":489819,"Number":401,"KnessetNum":2,"Name":"ישיבת מליאה בתאריך 24/03/1954 בשעה 15:03","StartDate":"1954-03-24T15:03:00+02:00","FinishDate":"1954-03-24T19:42:00+02:00","IsSpecialMeeting":null,"LastUpdatedDate":"2020-10-20T07:57:40.35+03:00"}
{"Id":489820,"Number":403,"KnessetNum":2,"Name":"ישיבת מליאה בתאריך 29/03/1954 בשעה 20:10","StartDate":"1954-03-29T20:10:00+02:00","FinishDate":"1954-03-29T23:55:00+02:00","IsSpecialMeeting":null,"LastUpdatedDate":"2022-01-10T09:13:18.1+02:00"}
{"Id":489821,"Number":404,"KnessetNum":2,"Name":"ישיבת מליאה בתאריך 30/03/1954 בשעה 16:10","StartDate":"1954-03-30T16:10:00+02:00","FinishDate":"1954-03-30T18:34:00+02:00","IsSpecialMeeting":null,"LastUpdatedDate":"2022-01-10T09:21:13.48+02:00"}
{"Id":489822,"Number":405,"KnessetNum":2,"Name":"ישיבת מליאה בתאריך 30/03/1954 בשעה 20:03","StartDate":"1954-03-30T20:03:00+02:00","FinishDate":"1954-03-31T00:24:00+02:00","IsSpecialMeeting":null,"LastUpdatedDate":"2022-01-10T09:45:34.54+02:00"}
{"Id":489823,"Number":412,"KnessetNum":2,"Name":"ישיבת מליאה בתאריך 07/04/1954 בשעה 11:06","StartDate":"1954-04-07T11:06:00+03:00","FinishDate":"1954-04-07T12:50:00+03:00","IsSpecialMeeting":null,"LastUpdatedDate":"2020-10-19T18:08:09.947+03:00"}
{"Id":489824,"Number":414,"KnessetNum":2,"Name":"ישיבת מליאה בתאריך 10/05/1954 בשעה 16:07","StartDate":"1954-05-10T16:07:00+03:00","FinishDate":"1954-05-10T19:40:00+03:00","IsSpecialMeeting":null,"LastUpdatedDate":"2020-10-19T18:00:38.463+03:00"}
{"Id":489825,"Number":415,"KnessetNum":2,"Name":"ישיבת מליאה בתאריך 10/05/1954 בשעה 21:01","StartDate":"1954-05-10T21:01:00+03:00","FinishDate":"1954-05-10T21:11:00+03:00","IsSpecialMeeting":null,"LastUpdatedDate":"2020-10-19T18:03:20.24+03:00"}
{"Id":489826,"Number":416,"KnessetNum":2,"Name":"ישיבת מליאה בתאריך 11/05/1954 בשעה 16:03","StartDate":"1954-05-11T16:03:00+03:00","FinishDate":"1954-05-11T19:00:00+03:00","IsSpecialMeeting":null,"LastUpdatedDate":"2020-10-19T17:53:48.15+03:00"}
{"Id":489827,"Number":417,"KnessetNum":2,"Name":"ישיבת מליאה בתאריך 11/05/1954 בשעה 20:02","StartDate":"1954-05-11T20:02:00+03:00","FinishDate":"1954-05-11T21:17:00+03:00","IsSpecialMeeting":null,"LastUpdatedDate":"2020-10-19T17:57:10.763+03:00"}
{"Id":489828,"Number":419,"KnessetNum":2,"Name":"ישיבת מליאה בתאריך 17/05/1954 בשעה 16:03","StartDate":"1954-05-17T16:03:00+03:00","FinishDate":"1954-05-17T19:13:00+03:00","IsSpecialMeeting":null,"LastUpdatedDate":"2020-10-19T17:45:33.72+03:00"}
{"Id":489829,"Number":420,"KnessetNum":2,"Name":"ישיבת מליאה בתאריך 17/05/1954 בשעה 20:17","StartDate":"1954-05-17T20:17:00+03:00","FinishDate":"1954-05-17T22:05:00+03:00","IsSpecialMeeting":null,"LastUpdatedDate":"2022-01-10T10:29:38.867+02:00"}
{"Id":489830,"Number":428,"KnessetNum":2,"Name":"ישיבת מליאה בתאריך 26/05/1954 בשעה 11:10","StartDate":"1954-05-26T11:10:00+03:00","FinishDate":"1954-05-26T12:32:00+03:00","IsSpecialMeeting":null,"LastUpdatedDate":"2020-10-19T16:47:08.947+03:00"}
{"Id":489831,"Number":429,"KnessetNum":2,"Name":"ישיבת מליאה בתאריך 31/05/1954 בשעה 16:13","StartDate":"1954-05-31T16:13:00+03:00","FinishDate":"1954-05-31T18:40:00+03:00","IsSpecialMeeting":null,"LastUpdatedDate":"2020-08-24T12:07:51.077+03:00"}
{"Id":489832,"Number":431,"KnessetNum":2,"Name":"ישיבת מליאה בתאריך 01/06/1954 בשעה 16:16","StartDate":"1954-06-01T16:16:00+03:00","FinishDate":"1954-06-01T19:11:00+03:00","IsSpecialMeeting":null,"LastUpdatedDate":"2020-10-19T16:43:19.1+03:00"}
{"Id":489833,"Number":432,"KnessetNum":2,"Name":"ישיבת מליאה בתאריך 01/06/1954 בשעה 20:20","StartDate":"1954-06-01T20:20:00+03:00","FinishDate":"1954-06-01T21:37:00+03:00","IsSpecialMeeting":null,"LastUpdatedDate":"2020-10-19T16:45:06.34+03:00"}
{"Id":489834,"Number":433,"KnessetNum":2,"Name":"ישיבת מליאה בתאריך 02/06/1954 בשעה 11:15","StartDate":"1954-06-02T11:15:00+03:00","FinishDate":"1954-06-02T17:15:00+03:00","IsSpecialMeeting":null,"LastUpdatedDate":"2020-10-19T16:41:37.573+03:00"}
{"Id":489835,"Number":435,"KnessetNum":2,"Name":"ישיבת מליאה בתאריך 09/06/1954 בשעה 20:05","StartDate":"1954-06-09T20:05:00+03:00","FinishDate":"1954-06-09T22:15:00+03:00","IsSpecialMeeting":null,"LastUpdatedDate":"2020-10-19T16:33:15.833+03:00"}
{"Id":489836,"Number":436,"KnessetNum":2,"Name":"ישיבת מליאה בתאריך 09/06/1954 בשעה 11:12","StartDate":"1954-06-09T11:12:00+03:00","FinishDate":"1954-06-09T13:32:00+03:00","IsSpecialMeeting":null,"LastUpdatedDate":"2020-10-19T16:35:41.087+03:00"}
{"Id":489837,"Number":439,"KnessetNum":2,"Name":"ישיבת מליאה בתאריך 15/06/1954 בשעה 16:08","StartDate":"1954-06-15T16:08:00+03:00","FinishDate":"1954-06-15T19:00:00+03:00","IsSpecialMeeting":null,"LastUpdatedDate":"2020-10-19T16:20:58.877+03:00"}
{"Id":489838,"Number":440,"KnessetNum":2,"Name":"ישיבת מליאה בתאריך 15/06/1954 בשעה 20:07","StartDate":"1954-06-15T20:07:00+03:00","FinishDate":"1954-06-15T21:52:00+03:00","IsSpecialMeeting":null,"LastUpdatedDate":"2020-10-19T16:26:37.563+03:00"}
{"Id":489839,"Number":441,"KnessetNum":2,"Name":"ישיבת מליאה בתאריך 16/06/1954 בשעה 11:28","StartDate":"1954-06-16T11:28:00+03:00","FinishDate":"1954-06-16T13:15:00+03:00","IsSpecialMeeting":null,"LastUpdatedDate":"2020-10-19T16:19:19.01+03:00"}
{"Id":489840,"Number":444,"KnessetNum":2,"Name":"ישיבת מליאה בתאריך 22/06/1954 בשעה 16:12","StartDate":"1954-06-22T16:12:00+03:00","FinishDate":"1954-06-22T18:52:00+03:00","IsSpecialMeeting":null,"LastUpdatedDate":"2022-01-11T16:03:50.603+02:00"}
{"Id":489841,"Number":445,"KnessetNum":2,"Name":"ישיבת מליאה בתאריך 22/06/1954 בשעה 20:10","StartDate":"1954-06-22T20:10:00+03:00","FinishDate":"1954-06-22T21:25:00+03:00","IsSpecialMeeting":null,"LastUpdatedDate":"2022-01-11T16:06:45.113+02:00"}
{"Id":489842,"Number":446,"KnessetNum":2,"Name":"ישיבת מליאה בתאריך 23/06/1954 בשעה 11:28","StartDate":"1954-06-23T11:28:00+03:00","FinishDate":"1954-06-23T12:40:00+03:00","IsSpecialMeeting":null,"LastUpdatedDate":"2020-10-19T16:02:24.91+03:00"}
{"Id":489843,"Number":449,"KnessetNum":2,"Name":"ישיבת מליאה בתאריך 29/06/1954 בשעה 16:03","StartDate":"1954-06-29T16:03:00+03:00","FinishDate":"1954-06-29T19:03:00+03:00","IsSpecialMeeting":null,"LastUpdatedDate":"2020-10-19T15:53:41.753+03:00"}
{"Id":489844,"Number":450,"KnessetNum":2,"Name":"ישיבת מליאה בתאריך 29/06/1954 בשעה 20:22","StartDate":"1954-06-29T20:22:00+03:00","FinishDate":"1954-06-29T21:47:00+03:00","IsSpecialMeeting":null,"LastUpdatedDate":"2020-10-19T15:55:46.813+03:00"}
{"Id":489845,"Number":451,"KnessetNum":2,"Name":"ישיבת מליאה בתאריך 30/06/1954 בשעה 11:14","StartDate":"1954-06-30T11:14:00+03:00","FinishDate":null,"IsSpecialMeeting":null,"LastUpdatedDate":"2020-10-19T15:50:30.9+03:00"}
{"Id":489846,"Number":452,"KnessetNum":2,"Name":"ישיבת מליאה בתאריך 05/07/1954 בשעה 16:06","StartDate":"1954-07-05T16:06:00+03:00","FinishDate":"1954-07-05T19:00:00+03:00","IsSpecialMeeting":null,"LastUpdatedDate":"2020-10-19T15:45:13.033+03:00"}
{"Id":489847,"Number":453,"KnessetNum":2,"Name":"ישיבת מליאה בתאריך 06/07/1954 בשעה 20:07","StartDate":"1954-07-06T20:07:00+03:00","FinishDate":"1954-07-06T22:52:00+03:00","IsSpecialMeeting":null,"LastUpdatedDate":"2020-10-19T15:41:39.587+03:00"}
{"Id":489848,"Number":455,"KnessetNum":2,"Name":"ישיבת מליאה בתאריך 12/07/1954 בשעה 16:11","StartDate":"1954-07-12T16:11:00+03:00","FinishDate":"1954-07-12T18:31:00+03:00","IsSpecialMeeting":null,"LastUpdatedDate":"2020-10-19T15:37:15.83+03:00"}
{"Id":489849,"Number":458,"KnessetNum":2,"Name":"ישיבת מליאה בתאריך 20/07/1954 בשעה 20:42","StartDate":"1954-07-20T20:42:00+03:00","FinishDate":"1954-07-20T21:55:00+03:00","IsSpecialMeeting":null,"LastUpdatedDate":"2020-10-19T15:13:10.847+03:00"}
{"Id":489850,"Number":459,"KnessetNum":2,"Name":"ישיבת מליאה בתאריך 26/07/1954 בשעה 16:03","StartDate":"1954-07-26T16:03:00+03:00","FinishDate":"1954-07-26T19:09:00+03:00","IsSpecialMeeting":null,"LastUpdatedDate":"2020-10-19T15:05:27.047+03:00"}
{"Id":489851,"Number":466,"KnessetNum":2,"Name":"ישיבת מליאה בתאריך 04/08/1954 בשעה 11:12","StartDate":"1954-08-04T11:12:00+03:00","FinishDate":"1954-08-04T13:20:00+03:00","IsSpecialMeeting":null,"LastUpdatedDate":"2020-10-19T14:31:55.417+03:00"}
{"Id":489852,"Number":467,"KnessetNum":2,"Name":"ישיבת מליאה בתאריך 09/08/1954 בשעה 16:04","StartDate":"1954-08-09T16:04:00+03:00","FinishDate":"1954-08-09T19:50:00+03:00","IsSpecialMeeting":null,"LastUpdatedDate":"2020-10-19T14:28:52.233+03:00"}
{"Id":489853,"Number":469,"KnessetNum":2,"Name":"ישיבת מליאה בתאריך 10/08/1954 בשעה 16:03","StartDate":"1954-08-10T16:03:00+03:00","FinishDate":"1954-08-10T19:10:00+03:00","IsSpecialMeeting":null,"LastUpdatedDate":"2020-10-19T14:24:07.507+03:00"}
{"Id":489854,"Number":471,"KnessetNum":2,"Name":"ישיבת מליאה בתאריך 11/08/1954 בשעה 11:08","StartDate":"1954-08-11T11:08:00+03:00","FinishDate":"1954-08-11T12:45:00+03:00","IsSpecialMeeting":null,"LastUpdatedDate":"2020-10-19T14:18:44.66+03:00"}
{"Id":489855,"Number":481,"KnessetNum":2,"Name":"ישיבת מליאה בתאריך 30/08/1954 בשעה 16:02","StartDate":"1954-08-30T16:02:00+03:00","FinishDate":"1954-08-30T19:50:00+03:00","IsSpecialMeeting":null,"LastUpdatedDate":"2020-10-19T13:41:33.207+03:00"}
{"Id":489856,"Number":482,"KnessetNum":2,"Name":"ישיבת מליאה בתאריך 30/08/1954 בשעה 20:01","StartDate":"1954-08-30T20:01:00+03:00","FinishDate":"1954-08-30T21:50:00+03:00","IsSpecialMeeting":null,"LastUpdatedDate":"2020-10-19T13:44:49.437+03:00"}
{"Id":489857,"Number":486,"KnessetNum":2,"Name":"ישיבת מליאה בתאריך 06/09/1954 בשעה 16:15","StartDate":"1954-09-06T16:15:00+03:00","FinishDate":"1954-09-06T18:50:00+03:00","IsSpecialMeeting":null,"LastUpdatedDate":"2020-10-19T13:04:06.083+03:00"}
{"Id":489858,"Number":487,"KnessetNum":2,"Name":"ישיבת מליאה בתאריך 06/09/1954 בשעה 20:05","StartDate":"1954-09-06T20:05:00+03:00","FinishDate":"1954-09-06T21:30:00+03:00","IsSpecialMeeting":null,"LastUpdatedDate":"2020-10-19T13:05:51.673+03:00"}
{"Id":489859,"Number":491,"KnessetNum":2,"Name":"ישיבת מליאה בתאריך 08/11/1954 בשעה 16:10","StartDate":"1954-11-08T16:10:00+02:00","FinishDate":"1954-11-08T18:46:00+02:00","IsSpecialMeeting":null,"LastUpdatedDate":"2020-10-19T12:46:24.88+03:00"}
{"Id":489860,"Number":492,"KnessetNum":2,"Name":"ישיבת מליאה בתאריך 08/11/1954 בשעה 20:07","StartDate":"1954-11-08T20:07:00+02:00","FinishDate":"1954-11-08T21:00:00+02:00","IsSpecialMeeting":null,"LastUpdatedDate":"2020-10-19T12:48:13.35+03:00"}
{"Id":489861,"Number":493,"KnessetNum":2,"Name":"ישיבת מליאה בתאריך 09/11/1954 בשעה 16:06","StartDate":"1954-11-09T16:06:00+02:00","FinishDate":"1954-11-09T19:02:00+02:00","IsSpecialMeeting":null,"LastUpdatedDate":"2020-10-19T12:38:43.273+03:00"}
{"Id":489862,"Number":495,"KnessetNum":2,"Name":"ישיבת מליאה בתאריך 10/11/1954 בשעה 11:13","StartDate":"1954-11-10T11:13:00+02:00","FinishDate":"1954-11-10T12:30:00+02:00","IsSpecialMeeting":null,"LastUpdatedDate":"2020-10-19T12:30:18.633+03:00"}
{"Id":489863,"Number":496,"KnessetNum":2,"Name":"ישיבת מליאה בתאריך 15/11/1954 בשעה 16:08","StartDate":"1954-11-15T16:08:00+02:00","FinishDate":"1954-11-15T18:55:00+02:00","IsSpecialMeeting":null,"LastUpdatedDate":"2020-10-19T12:24:58.487+03:00"}
{"Id":489864,"Number":497,"KnessetNum":2,"Name":"ישיבת מליאה בתאריך 15/11/1954 בשעה 20:07","StartDate":"1954-11-15T20:07:00+02:00","FinishDate":"1954-11-15T22:00:00+02:00","IsSpecialMeeting":null,"LastUpdatedDate":"2020-10-19T12:26:46.99+03:00"}
{"Id":489865,"Number":499,"KnessetNum":2,"Name":"ישיבת מליאה בתאריך 16/11/1954 בשעה 20:13","StartDate":"1954-11-16T20:13:00+02:00","FinishDate":"1954-11-16T21:40:00+02:00","IsSpecialMeeting":null,"LastUpdatedDate":"2020-10-19T12:21:55.403+03:00"}
{"Id":489866,"Number":500,"KnessetNum":2,"Name":"ישיבת מליאה בתאריך 17/11/1954 בשעה 11:12","StartDate":"1954-11-17T11:12:00+02:00","FinishDate":"1954-11-17T14:08:00+02:00","IsSpecialMeeting":null,"LastUpdatedDate":"2022-01-18T16:17:09.037+02:00"}
{"Id":489867,"Number":507,"KnessetNum":2,"Name":"ישיבת מליאה בתאריך 30/11/1954 בשעה 20:10","StartDate":"1954-11-30T20:10:00+02:00","FinishDate":"1954-11-30T21:52:00+02:00","IsSpecialMeeting":null,"LastUpdatedDate":"2020-10-19T11:40:49.683+03:00"}
{"Id":489868,"Number":508,"KnessetNum":2,"Name":"ישיבת מליאה בתאריך 01/12/1954 בשעה 11:28","StartDate":"1954-12-01T11:28:00+02:00","FinishDate":"1954-12-01T14:21:00+02:00","IsSpecialMeeting":null,"LastUpdatedDate":"2020-10-19T11:39:04.113+03:00"}
{"Id":489869,"Number":516,"KnessetNum":2,"Name":"ישיבת מליאה בתאריך 15/12/1954 בשעה 11:10","StartDate":"1954-12-15T11:10:00+02:00","FinishDate":"1954-12-15T14:42:00+02:00","IsSpecialMeeting":null,"LastUpdatedDate":"2021-12-06T07:44:32.873+02:00"}
{"Id":489870,"Number":517,"KnessetNum":2,"Name":"ישיבת מליאה בתאריך 20/12/1954 בשעה 16:05","StartDate":"1954-12-20T16:05:00+02:00","FinishDate":"1954-12-20T19:55:00+02:00","IsSpecialMeeting":null,"LastUpdatedDate":"2020-10-19T11:02:03.25+03:00"}
{"Id":489871,"Number":518,"KnessetNum":2,"Name":"ישיבת מליאה בתאריך 20/12/1954 בשעה 20:05","StartDate":"1954-12-20T20:05:00+02:00","FinishDate":"1954-12-20T21:50:00+02:00","IsSpecialMeeting":null,"LastUpdatedDate":"2020-10-19T11:03:52.853+03:00"}
{"Id":489872,"Number":519,"KnessetNum":2,"Name":"ישיבת מליאה בתאריך 21/12/1954 בשעה 20:05","StartDate":"1954-12-21T20:05:00+02:00","FinishDate":"1954-12-21T22:15:00+02:00","IsSpecialMeeting":null,"LastUpdatedDate":"2021-02-08T12:52:06.38+02:00"}
{"Id":489873,"Number":520,"KnessetNum":2,"Name":"ישיבת מליאה בתאריך 22/12/1954 בשעה 11:09","StartDate":"1954-12-22T11:09:00+02:00","FinishDate":"1954-12-22T13:45:00+02:00","IsSpecialMeeting":null,"LastUpdatedDate":"2020-10-19T10:47:33.213+03:00"}
{"Id":489874,"Number":521,"KnessetNum":2,"Name":"ישיבת מליאה בתאריך 27/12/1954 בשעה 16:10","StartDate":"1954-12-27T16:10:00+02:00","FinishDate":"1954-12-27T19:02:00+02:00","IsSpecialMeeting":null,"LastUpdatedDate":"2020-10-19T10:43:34.683+03:00"}
{"Id":489875,"Number":527,"KnessetNum":2,"Name":"ישיבת מליאה בתאריך 04/01/1955 בשעה 20:07","StartDate":"1955-01-04T20:07:00+02:00","FinishDate":"1955-01-04T21:52:00+02:00","IsSpecialMeeting":null,"LastUpdatedDate":"2020-10-19T10:25:56.17+03:00"}
{"Id":489876,"Number":528,"KnessetNum":2,"Name":"ישיבת מליאה בתאריך 05/01/1955 בשעה 11:14","StartDate":"1955-01-05T11:14:00+02:00","FinishDate":"1955-01-05T12:57:00+02:00","IsSpecialMeeting":null,"LastUpdatedDate":"2020-10-19T10:13:56.71+03:00"}
{"Id":489877,"Number":531,"KnessetNum":2,"Name":"ישיבת מליאה בתאריך 11/01/1955 בשעה 20:08","StartDate":"1955-01-11T20:08:00+02:00","FinishDate":"1955-01-11T21:57:00+02:00","IsSpecialMeeting":null,"LastUpdatedDate":"2020-10-19T09:49:49.81+03:00"}
{"Id":489878,"Number":532,"KnessetNum":2,"Name":"ישיבת מליאה בתאריך 12/01/1955 בשעה 11:06","StartDate":"1955-01-12T11:06:00+02:00","FinishDate":"1955-01-12T13:45:00+02:00","IsSpecialMeeting":null,"LastUpdatedDate":"2020-10-19T09:42:56.21+03:00"}
{"Id":489879,"Number":536,"KnessetNum":2,"Name":"ישיבת מליאה בתאריך 19/01/1955 בשעה 11:11","StartDate":"1955-01-19T11:11:00+02:00","FinishDate":"1955-01-19T13:15:00+02:00","IsSpecialMeeting":null,"LastUpdatedDate":"2020-10-19T09:28:17.037+03:00"}
{"Id":489880,"Number":539,"KnessetNum":2,"Name":"ישיבת מליאה בתאריך 25/01/1955 בשעה 20:07","StartDate":"1955-01-25T20:07:00+02:00","FinishDate":"1955-01-25T22:05:00+02:00","IsSpecialMeeting":null,"LastUpdatedDate":"2020-10-19T09:16:46.413+03:00"}
{"Id":489881,"Number":540,"KnessetNum":2,"Name":"ישיבת מליאה בתאריך 26/01/1955 בשעה 11:08","StartDate":"1955-01-26T11:08:00+02:00","FinishDate":"1955-01-26T13:48:00+02:00","IsSpecialMeeting":null,"LastUpdatedDate":"2020-10-19T09:09:53.457+03:00"}
{"Id":489882,"Number":541,"KnessetNum":2,"Name":"ישיבת מליאה בתאריך 31/01/1955 בשעה 16:05","StartDate":"1955-01-31T16:05:00+02:00","FinishDate":"1955-01-31T19:13:00+02:00","IsSpecialMeeting":null,"LastUpdatedDate":"2020-10-19T09:06:14.44+03:00"}
{"Id":489883,"Number":543,"KnessetNum":2,"Name":"ישיבת מליאה בתאריך 01/02/1955 בשעה 20:03","StartDate":"1955-02-01T20:03:00+02:00","FinishDate":"1955-02-01T21:32:00+02:00","IsSpecialMeeting":null,"LastUpdatedDate":"2020-10-19T08:56:54.22+03:00"}
{"Id":489884,"Number":544,"KnessetNum":2,"Name":"ישיבת מליאה בתאריך 02/02/1955 בשעה 11:14","StartDate":"1955-02-02T11:14:00+02:00","FinishDate":"1955-02-02T13:13:00+02:00","IsSpecialMeeting":null,"LastUpdatedDate":"2020-10-19T08:47:13.957+03:00"}
{"Id":489885,"Number":545,"KnessetNum":2,"Name":"ישיבת מליאה בתאריך 07/02/1955 בשעה 16:10","StartDate":"1955-02-07T16:10:00+02:00","FinishDate":"1955-02-07T18:50:00+02:00","IsSpecialMeeting":null,"LastUpdatedDate":"2020-10-19T08:29:08.33+03:00"}
{"Id":489886,"Number":548,"KnessetNum":2,"Name":"ישיבת מליאה בתאריך 09/02/1955 בשעה 11:10","StartDate":"1955-02-09T11:10:00+02:00","FinishDate":"1955-02-09T14:00:00+02:00","IsSpecialMeeting":null,"LastUpdatedDate":"2021-12-06T15:59:53.9+02:00"}
{"Id":489887,"Number":549,"KnessetNum":2,"Name":"ישיבת מליאה בתאריך 14/02/1955 בשעה 16:14","StartDate":"1955-02-14T16:14:00+02:00","FinishDate":"1955-02-14T19:13:00+02:00","IsSpecialMeeting":null,"LastUpdatedDate":"2020-10-19T08:03:50+03:00"}
{"Id":489888,"Number":550,"KnessetNum":2,"Name":"ישיבת מליאה בתאריך 14/02/1955 בשעה 20:20","StartDate":"1955-02-14T20:20:00+02:00","FinishDate":"1955-02-14T22:00:00+02:00","IsSpecialMeeting":null,"LastUpdatedDate":"2021-12-13T07:30:32.597+02:00"}
{"Id":489889,"Number":551,"KnessetNum":2,"Name":"ישיבת מליאה בתאריך 15/02/1955 בשעה 16:09","StartDate":"1955-02-15T16:09:00+02:00","FinishDate":"1955-02-15T18:53:00+02:00","IsSpecialMeeting":null,"LastUpdatedDate":"2021-12-13T07:44:03.383+02:00"}
{"Id":489890,"Number":552,"KnessetNum":2,"Name":"ישיבת מליאה בתאריך 15/02/1955 בשעה 20:05","StartDate":"1955-02-15T20:05:00+02:00","FinishDate":"1955-02-15T21:14:00+02:00","IsSpecialMeeting":null,"LastUpdatedDate":"2021-12-13T07:54:08.383+02:00"}
{"Id":489891,"Number":553,"KnessetNum":2,"Name":"ישיבת מליאה בתאריך 16/02/1955 בשעה 11:15","StartDate":"1955-02-16T11:15:00+02:00","FinishDate":"1955-02-16T13:00:00+02:00","IsSpecialMeeting":null,"LastUpdatedDate":"2020-10-18T14:43:31.607+03:00"}
{"Id":489892,"Number":554,"KnessetNum":2,"Name":"ישיבת מליאה בתאריך 21/02/1955 בשעה 16:17","StartDate":"1955-02-21T16:17:00+02:00","FinishDate":"1955-02-21T19:08:00+02:00","IsSpecialMeeting":null,"LastUpdatedDate":"2020-10-18T14:35:07.23+03:00"}
{"Id":489893,"Number":555,"KnessetNum":2,"Name":"ישיבת מליאה בתאריך 21/02/1955 בשעה 20:25","StartDate":"1955-02-21T20:25:00+02:00","FinishDate":"1955-02-21T21:40:00+02:00","IsSpecialMeeting":null,"LastUpdatedDate":"2020-10-18T14:40:44.257+03:00"}
{"Id":489894,"Number":558,"KnessetNum":2,"Name":"ישיבת מליאה בתאריך 23/02/1955 בשעה 11:13","StartDate":"1955-02-23T11:13:00+02:00","FinishDate":"1955-02-23T13:54:00+02:00","IsSpecialMeeting":null,"LastUpdatedDate":"2021-12-13T09:43:46.21+02:00"}
{"Id":489895,"Number":559,"KnessetNum":2,"Name":"ישיבת מליאה בתאריך 28/02/1955 בשעה 16:07","StartDate":"1955-02-28T16:07:00+02:00","FinishDate":"1955-02-28T18:53:00+02:00","IsSpecialMeeting":null,"LastUpdatedDate":"2020-10-18T14:23:07.487+03:00"}
{"Id":489896,"Number":560,"KnessetNum":2,"Name":"ישיבת מליאה בתאריך 28/02/1955 בשעה 20:05","StartDate":"1955-02-28T20:05:00+02:00","FinishDate":"1955-02-28T21:29:00+02:00","IsSpecialMeeting":null,"LastUpdatedDate":"2021-12-13T10:23:29.82+02:00"}
{"Id":489897,"Number":561,"KnessetNum":2,"Name":"ישיבת מליאה בתאריך 01/03/1955 בשעה 16:07","StartDate":"1955-03-01T16:07:00+02:00","FinishDate":"1955-03-01T19:07:00+02:00","IsSpecialMeeting":null,"LastUpdatedDate":"2020-10-18T14:10:18.007+03:00"}
{"Id":489898,"Number":562,"KnessetNum":2,"Name":"ישיבת מליאה בתאריך 01/03/1955 בשעה 20:02","StartDate":"1955-03-01T20:02:00+02:00","FinishDate":"1955-03-01T23:55:00+02:00","IsSpecialMeeting":null,"LastUpdatedDate":"2020-10-18T14:17:28.193+03:00"}
{"Id":489899,"Number":563,"KnessetNum":2,"Name":"ישיבת מליאה בתאריך 02/03/1955 בשעה 16:10","StartDate":"1955-03-02T16:10:00+02:00","FinishDate":"1955-03-02T18:31:00+02:00","IsSpecialMeeting":null,"LastUpdatedDate":"2020-10-18T14:01:26.74+03:00"}
{"Id":489900,"Number":564,"KnessetNum":2,"Name":"ישיבת מליאה בתאריך 02/03/1955 בשעה 19:40","StartDate":"1955-03-02T19:40:00+02:00","FinishDate":"1955-03-02T22:48:00+02:00","IsSpecialMeeting":null,"LastUpdatedDate":"2020-10-18T14:06:05.553+03:00"}
{"Id":489901,"Number":566,"KnessetNum":2,"Name":"ישיבת מליאה בתאריך 14/03/1955 בשעה 16:08","StartDate":"1955-03-14T16:08:00+02:00","FinishDate":"1955-03-14T19:05:00+02:00","IsSpecialMeeting":null,"LastUpdatedDate":"2020-10-18T13:54:02.56+03:00"}
{"Id":489902,"Number":567,"KnessetNum":2,"Name":"ישיבת מליאה בתאריך 14/03/1955 בשעה 20:04","StartDate":"1955-03-14T20:04:00+02:00","FinishDate":"1955-03-14T22:45:00+02:00","IsSpecialMeeting":null,"LastUpdatedDate":"2020-10-18T13:56:57.247+03:00"}
{"Id":489903,"Number":568,"KnessetNum":2,"Name":"ישיבת מליאה בתאריך 15/03/1955 בשעה 16:12","StartDate":"1955-03-15T16:12:00+02:00","FinishDate":"1955-03-15T18:57:00+02:00","IsSpecialMeeting":null,"LastUpdatedDate":"2020-10-18T13:47:50.49+03:00"}
{"Id":489904,"Number":569,"KnessetNum":2,"Name":"ישיבת מליאה בתאריך 15/03/1955 בשעה 20:04","StartDate":"1955-03-15T20:04:00+02:00","FinishDate":"1955-03-15T23:05:00+02:00","IsSpecialMeeting":null,"LastUpdatedDate":"2020-10-18T13:50:19.433+03:00"}
{"Id":489905,"Number":570,"KnessetNum":2,"Name":"ישיבת מליאה בתאריך 16/03/1955 בשעה 16:06","StartDate":"1955-03-16T16:06:00+02:00","FinishDate":"1955-03-16T18:51:00+02:00","IsSpecialMeeting":null,"LastUpdatedDate":"2020-10-18T13:38:11.703+03:00"}
{"Id":489906,"Number":571,"KnessetNum":2,"Name":"ישיבת מליאה בתאריך 16/03/1955 בשעה 20:00","StartDate":"1955-03-16T20:00:00+02:00","FinishDate":"1955-03-16T23:05:00+02:00","IsSpecialMeeting":null,"LastUpdatedDate":"2020-10-18T13:43:28.313+03:00"}
{"Id":489907,"Number":572,"KnessetNum":2,"Name":"ישיבת מליאה בתאריך 17/03/1955 בשעה 11:15","StartDate":"1955-03-17T11:15:00+02:00","FinishDate":"1955-03-17T12:40:00+02:00","IsSpecialMeeting":null,"LastUpdatedDate":"2020-10-18T13:34:00.94+03:00"}
{"Id":489908,"Number":573,"KnessetNum":2,"Name":"ישיבת מליאה בתאריך 21/03/1955 בשעה 15:11","StartDate":"1955-03-21T15:11:00+02:00","FinishDate":"1955-03-21T19:07:00+02:00","IsSpecialMeeting":null,"LastUpdatedDate":"2020-10-18T13:25:57.02+03:00"}
{"Id":489909,"Number":574,"KnessetNum":2,"Name":"ישיבת מליאה בתאריך 21/03/1955 בשעה 20:05","StartDate":"1955-03-21T20:05:00+02:00","FinishDate":"1955-03-22T00:03:00+02:00","IsSpecialMeeting":null,"LastUpdatedDate":"2020-10-18T13:29:42.783+03:00"}
{"Id":489910,"Number":580,"KnessetNum":2,"Name":"ישיבת מליאה בתאריך 28/03/1955 בשעה 15:14","StartDate":"1955-03-28T15:14:00+02:00","FinishDate":"1955-03-28T18:56:00+02:00","IsSpecialMeeting":null,"LastUpdatedDate":"2020-10-18T12:12:39.37+03:00"}
{"Id":489911,"Number":581,"KnessetNum":2,"Name":"ישיבת מליאה בתאריך 28/03/1955 בשעה 20:02","StartDate":"1955-03-28T20:02:00+02:00","FinishDate":"1955-03-28T23:50:00+02:00","IsSpecialMeeting":null,"LastUpdatedDate":"2020-10-18T12:14:34.057+03:00"}
{"Id":489912,"Number":582,"KnessetNum":2,"Name":"ישיבת מליאה בתאריך 29/03/1955 בשעה 15:10","StartDate":"1955-03-29T15:10:00+02:00","FinishDate":"1955-03-29T19:00:00+02:00","IsSpecialMeeting":null,"LastUpdatedDate":"2020-10-18T11:58:18.597+03:00"}
{"Id":489913,"Number":583,"KnessetNum":2,"Name":"ישיבת מליאה בתאריך 29/03/1955 בשעה 20:00","StartDate":"1955-03-29T20:00:00+02:00","FinishDate":null,"IsSpecialMeeting":null,"LastUpdatedDate":"2020-10-18T12:08:50.827+03:00"}
{"Id":489914,"Number":585,"KnessetNum":2,"Name":"ישיבת מליאה בתאריך 30/03/1955 בשעה 20:15","StartDate":"1955-03-30T20:15:00+02:00","FinishDate":"1955-03-31T00:55:00+02:00","IsSpecialMeeting":null,"LastUpdatedDate":"2021-12-26T12:43:31.317+02:00"}
{"Id":489915,"Number":592,"KnessetNum":2,"Name":"ישיבת מליאה בתאריך 11/05/1955 בשעה 11:10","StartDate":"1955-05-11T11:10:00+03:00","FinishDate":"1955-05-11T13:05:00+03:00","IsSpecialMeeting":null,"LastUpdatedDate":"2020-10-18T11:18:58.003+03:00"}
{"Id":489916,"Number":596,"KnessetNum":2,"Name":"ישיבת מליאה בתאריך 18/05/1955 בשעה 12:06","StartDate":"1955-05-18T12:06:00+03:00","FinishDate":"1955-05-18T14:05:00+03:00","IsSpecialMeeting":null,"LastUpdatedDate":"2020-10-18T10:59:34.663+03:00"}
{"Id":489917,"Number":600,"KnessetNum":2,"Name":"ישיבת מליאה בתאריך 25/05/1955 בשעה 11:04","StartDate":"1955-05-25T11:04:00+03:00","FinishDate":"1955-05-25T12:16:00+03:00","IsSpecialMeeting":null,"LastUpdatedDate":"2021-12-05T09:06:52.563+02:00"}
{"Id":489918,"Number":608,"KnessetNum":2,"Name":"ישיבת מליאה בתאריך 08/06/1955 בשעה 11:50","StartDate":"1955-06-08T11:50:00+03:00","FinishDate":"1955-06-08T15:50:00+03:00","IsSpecialMeeting":null,"LastUpdatedDate":"2020-10-18T09:56:07.927+03:00"}
{"Id":489919,"Number":611,"KnessetNum":2,"Name":"ישיבת מליאה בתאריך 14/06/1955 בשעה 20:09","StartDate":"1955-06-14T20:09:00+03:00","FinishDate":"1955-06-14T22:08:00+03:00","IsSpecialMeeting":null,"LastUpdatedDate":"2020-10-18T09:24:54.893+03:00"}
{"Id":489920,"Number":612,"KnessetNum":2,"Name":"ישיבת מליאה בתאריך 15/06/1955 בשעה 11:11","StartDate":"1955-06-15T11:11:00+03:00","FinishDate":"1955-06-15T13:45:00+03:00","IsSpecialMeeting":null,"LastUpdatedDate":"2020-10-18T09:20:19.743+03:00"}
{"Id":489921,"Number":620,"KnessetNum":2,"Name":"ישיבת מליאה בתאריך 28/06/1955 בשעה 16:07","StartDate":"1955-06-28T16:07:00+03:00","FinishDate":"1955-06-28T19:22:00+03:00","IsSpecialMeeting":null,"LastUpdatedDate":"2020-10-18T08:53:43.803+03:00"}
{"Id":489922,"Number":1,"KnessetNum":3,"Name":"ישיבת מליאה בתאריך 15/08/1955 בשעה 16:00","StartDate":"1955-08-15T16:00:00+03:00","FinishDate":"1955-08-15T16:35:00+03:00","IsSpecialMeeting":null,"LastUpdatedDate":"2021-11-03T13:21:02.013+02:00"}
{"Id":489923,"Number":2,"KnessetNum":3,"Name":"ישיבת מליאה בתאריך 15/08/1955 בשעה 17:44","StartDate":"1955-08-15T17:44:00+03:00","FinishDate":"1955-08-15T18:15:00+03:00","IsSpecialMeeting":null,"LastUpdatedDate":"2021-09-05T10:19:14.957+03:00"}
{"Id":489924,"Number":3,"KnessetNum":3,"Name":"ישיבת מליאה בתאריך 17/08/1955 בשעה 11:00","StartDate":"1955-08-17T11:00:00+03:00","FinishDate":"1955-08-17T12:25:00+03:00","IsSpecialMeeting":null,"LastUpdatedDate":"2021-09-05T10:18:02.827+03:00"}
{"Id":489925,"Number":6,"KnessetNum":3,"Name":"ישיבת מליאה בתאריך 12/10/1955 בשעה 11:36","StartDate":"1955-10-12T11:36:00+02:00","FinishDate":"1955-10-12T12:50:00+02:00","IsSpecialMeeting":null,"LastUpdatedDate":"2021-09-05T09:55:33.907+03:00"}
{"Id":489926,"Number":8,"KnessetNum":3,"Name":"ישיבת מליאה בתאריך 18/10/1955 בשעה 16:09","StartDate":"1955-10-18T16:09:00+02:00","FinishDate":"1955-10-18T19:00:00+02:00","IsSpecialMeeting":null,"LastUpdatedDate":"2021-09-05T09:51:47.18+03:00"}
{"Id":489927,"Number":9,"KnessetNum":3,"Name":"ישיבת מליאה בתאריך 18/10/1955 בשעה 19:57","StartDate":"1955-10-18T19:57:00+02:00","FinishDate":"1955-10-18T21:20:00+02:00","IsSpecialMeeting":null,"LastUpdatedDate":"2021-09-05T09:50:40.797+03:00"}
{"Id":489928,"Number":10,"KnessetNum":3,"Name":"ישיבת מליאה בתאריך 19/10/1955 בשעה 11:03","StartDate":"1955-10-19T11:03:00+02:00","FinishDate":"1955-10-19T13:50:00+02:00","IsSpecialMeeting":null,"LastUpdatedDate":"2021-09-05T10:23:09.013+03:00"}
{"Id":489929,"Number":15,"KnessetNum":3,"Name":"ישיבת מליאה בתאריך 26/10/1955 בשעה 11:09","StartDate":"1955-10-26T11:09:00+02:00","FinishDate":"1955-10-26T14:00:00+02:00","IsSpecialMeeting":null,"LastUpdatedDate":"2021-10-04T13:51:43.373+03:00"}
{"Id":489930,"Number":17,"KnessetNum":3,"Name":"ישיבת מליאה בתאריך 31/10/1955 בשעה 20:37","StartDate":"1955-10-31T20:37:00+02:00","FinishDate":"1955-10-31T21:45:00+02:00","IsSpecialMeeting":null,"LastUpdatedDate":"2021-10-11T09:59:26.543+03:00"}
{"Id":489931,"Number":19,"KnessetNum":3,"Name":"ישיבת מליאה בתאריך 02/11/1955 בשעה 10:15","StartDate":"1955-11-02T10:15:00+02:00","FinishDate":"1955-11-02T13:05:00+02:00","IsSpecialMeeting":null,"LastUpdatedDate":"2021-10-17T16:34:19.84+03:00"}
{"Id":489932,"Number":20,"KnessetNum":3,"Name":"ישיבת מליאה בתאריך 03/11/1955 בשעה 10:18","StartDate":"1955-11-03T10:18:00+02:00","FinishDate":"1955-11-03T13:30:00+02:00","IsSpecialMeeting":null,"LastUpdatedDate":"2021-11-03T13:53:30.39+02:00"}
{"Id":489933,"Number":21,"KnessetNum":3,"Name":"ישיבת מליאה בתאריך 03/11/1955 בשעה 15:37","StartDate":"1955-11-03T15:37:00+02:00","FinishDate":"1955-11-03T21:15:00+02:00","IsSpecialMeeting":null,"LastUpdatedDate":"2021-10-24T11:06:05.57+03:00"}
{"Id":489934,"Number":26,"KnessetNum":3,"Name":"ישיבת מליאה בתאריך 16/11/1955 בשעה 11:26","StartDate":"1955-11-16T11:26:00+02:00","FinishDate":"1955-11-16T13:17:00+02:00","IsSpecialMeeting":null,"LastUpdatedDate":"2021-11-04T14:35:41.433+02:00"}
{"Id":489935,"Number":32,"KnessetNum":3,"Name":"ישיבת מליאה בתאריך 29/11/1955 בשעה 11:15","StartDate":"1955-11-29T11:15:00+02:00","FinishDate":"1955-11-29T13:55:00+02:00","IsSpecialMeeting":null,"LastUpdatedDate":"2023-12-31T11:59:25.85+02:00"}
{"Id":489936,"Number":35,"KnessetNum":3,"Name":"ישיבת מליאה בתאריך 06/12/1955 בשעה 16:07","StartDate":"1955-12-06T16:07:00+02:00","FinishDate":"1955-12-06T20:00:00+02:00","IsSpecialMeeting":null,"LastUpdatedDate":"2021-11-27T10:44:25.79+02:00"}
{"Id":489937,"Number":36,"KnessetNum":3,"Name":"ישיבת מליאה בתאריך 07/12/1955 בשעה 11:05","StartDate":"1955-12-07T11:05:00+02:00","FinishDate":"1955-12-07T13:10:00+02:00","IsSpecialMeeting":null,"LastUpdatedDate":"2021-11-27T10:50:32.777+02:00"}
{"Id":489938,"Number":37,"KnessetNum":3,"Name":"ישיבת מליאה בתאריך 12/12/1955 בשעה 16:10","StartDate":"1955-12-12T16:10:00+02:00","FinishDate":"1955-12-12T19:03:00+02:00","IsSpecialMeeting":null,"LastUpdatedDate":"2021-11-10T10:45:32.467+02:00"}
{"Id":489939,"Number":41,"KnessetNum":3,"Name":"ישיבת מליאה בתאריך 14/12/1955 בשעה 11:07","StartDate":"1955-12-14T11:07:00+02:00","FinishDate":"1955-12-14T13:00:00+02:00","IsSpecialMeeting":null,"LastUpdatedDate":"2023-12-31T11:03:14.187+02:00"}
{"Id":489940,"Number":45,"KnessetNum":3,"Name":"ישיבת מליאה בתאריך 20/12/1955 בשעה 16:11","StartDate":"1955-12-20T16:11:00+02:00","FinishDate":"1955-12-20T18:30:00+02:00","IsSpecialMeeting":null,"LastUpdatedDate":"2021-11-17T12:31:06.86+02:00"}
{"Id":489941,"Number":46,"KnessetNum":3,"Name":"ישיבת מליאה בתאריך 21/12/1955 בשעה 11:04","StartDate":"1955-12-21T11:04:00+02:00","FinishDate":"1955-12-21T12:42:00+02:00","IsSpecialMeeting":null,"LastUpdatedDate":"2021-11-21T12:02:52.137+02:00"}
{"Id":489942,"Number":48,"KnessetNum":3,"Name":"ישיבת מליאה בתאריך 26/12/1955 בשעה 20:00","StartDate":"1955-12-26T20:00:00+02:00","FinishDate":"1955-12-26T21:41:00+02:00","IsSpecialMeeting":null,"LastUpdatedDate":"2021-11-25T13:56:01.267+02:00"}
{"Id":489943,"Number":50,"KnessetNum":3,"Name":"ישיבת מליאה בתאריך 02/01/1956 בשעה 16:05","StartDate":"1956-01-02T16:05:00+02:00","FinishDate":"1956-01-02T18:59:00+02:00","IsSpecialMeeting":null,"LastUpdatedDate":"2021-11-25T15:34:23.793+02:00"}
{"Id":489944,"Number":51,"KnessetNum":3,"Name":"ישיבת מליאה בתאריך 02/01/1956 בשעה 20:07","StartDate":"1956-01-02T20:07:00+02:00","FinishDate":"1956-01-02T22:10:00+02:00","IsSpecialMeeting":null,"LastUpdatedDate":"2021-11-25T15:37:54.213+02:00"}
{"Id":489945,"Number":52,"KnessetNum":3,"Name":"ישיבת מליאה בתאריך 03/01/1956 בשעה 16:03","StartDate":"1956-01-03T16:03:00+02:00","FinishDate":"1956-01-03T18:50:00+02:00","IsSpecialMeeting":null,"LastUpdatedDate":"2021-11-25T16:05:26.593+02:00"}
{"Id":489946,"Number":53,"KnessetNum":3,"Name":"ישיבת מליאה בתאריך 04/01/1956 בשעה 11:11","StartDate":"1956-01-04T11:11:00+02:00","FinishDate":"1956-01-04T13:10:00+02:00","IsSpecialMeeting":null,"LastUpdatedDate":"2021-11-25T16:07:59.143+02:00"}
{"Id":489947,"Number":54,"KnessetNum":3,"Name":"ישיבת מליאה בתאריך 09/01/1956 בשעה 16:10","StartDate":"1956-01-09T16:10:00+02:00","FinishDate":"1956-01-09T19:10:00+02:00","IsSpecialMeeting":null,"LastUpdatedDate":"2021-11-25T16:46:42.29+02:00"}
{"Id":489948,"Number":55,"KnessetNum":3,"Name":"ישיבת מליאה בתאריך 09/01/1956 בשעה 20:22","StartDate":"1956-01-09T20:22:00+02:00","FinishDate":"1956-01-09T21:15:00+02:00","IsSpecialMeeting":null,"LastUpdatedDate":"2021-11-25T16:47:54.073+02:00"}
{"Id":489949,"Number":58,"KnessetNum":3,"Name":"ישיבת מליאה בתאריך 11/01/1956 בשעה 11:17","StartDate":"1956-01-11T11:17:00+02:00","FinishDate":"1956-01-11T13:40:00+02:00","IsSpecialMeeting":null,"LastUpdatedDate":"2021-11-25T17:57:33.543+02:00"}
{"Id":489950,"Number":61,"KnessetNum":3,"Name":"ישיבת מליאה בתאריך 17/01/1956 בשעה 16:08","StartDate":"1956-01-17T16:08:00+02:00","FinishDate":"1956-01-17T18:45:00+02:00","IsSpecialMeeting":null,"LastUpdatedDate":"2020-04-22T15:56:31.6+03:00"}
{"Id":489951,"Number":62,"KnessetNum":3,"Name":"ישיבת מליאה בתאריך 18/01/1956 בשעה 11:15","StartDate":"1956-01-18T11:15:00+02:00","FinishDate":"1956-01-18T13:33:00+02:00","IsSpecialMeeting":null,"LastUpdatedDate":"2021-11-25T19:14:40.41+02:00"}
{"Id":489952,"Number":66,"KnessetNum":3,"Name":"ישיבת מליאה בתאריך 25/01/1956 בשעה 11:14","StartDate":"1956-01-25T11:14:00+02:00","FinishDate":"1956-01-25T13:28:00+02:00","IsSpecialMeeting":null,"LastUpdatedDate":"2021-11-28T13:50:21.97+02:00"}
{"Id":489953,"Number":71,"KnessetNum":3,"Name":"ישיבת מליאה בתאריך 06/02/1956 בשעה 16:10","StartDate":"1956-02-06T16:10:00+02:00","FinishDate":"1956-02-06T19:20:00+02:00","IsSpecialMeeting":null,"LastUpdatedDate":"2021-11-28T15:10:54.037+02:00"}
{"Id":489954,"Number":72,"KnessetNum":3,"Name":"ישיבת מליאה בתאריך 06/02/1956 בשעה 20:33","StartDate":"1956-02-06T20:33:00+02:00","FinishDate":"1956-02-06T21:44:00+02:00","IsSpecialMeeting":null,"LastUpdatedDate":"2021-11-28T15:43:43.34+02:00"}
{"Id":489955,"Number":75,"KnessetNum":3,"Name":"ישיבת מליאה בתאריך 13/02/1956 בשעה 16:05","StartDate":"1956-02-13T16:05:00+02:00","FinishDate":"1956-02-13T19:03:00+02:00","IsSpecialMeeting":null,"LastUpdatedDate":"2021-11-28T16:39:07.17+02:00"}
{"Id":489956,"Number":79,"KnessetNum":3,"Name":"ישיבת מליאה בתאריך 15/02/1956 בשעה 11:19","StartDate":"1956-02-15T11:19:00+02:00","FinishDate":"1956-02-15T12:34:00+02:00","IsSpecialMeeting":null,"LastUpdatedDate":"2021-11-28T18:56:15.62+02:00"}
{"Id":489957,"Number":80,"KnessetNum":3,"Name":"ישיבת מליאה בתאריך 20/02/1956 בשעה 16:08","StartDate":"1956-02-20T16:08:00+02:00","FinishDate":"1956-02-20T19:48:00+02:00","IsSpecialMeeting":null,"LastUpdatedDate":"2021-11-28T19:14:04.693+02:00"}
{"Id":489958,"Number":81,"KnessetNum":3,"Name":"ישיבת מליאה בתאריך 20/02/1956 בשעה 20:06","StartDate":"1956-02-20T20:06:00+02:00","FinishDate":"1956-02-20T22:03:00+02:00","IsSpecialMeeting":null,"LastUpdatedDate":"2021-11-28T19:25:21.52+02:00"}
{"Id":489959,"Number":82,"KnessetNum":3,"Name":"ישיבת מליאה בתאריך 21/02/1956 בשעה 16:02","StartDate":"1956-02-21T16:02:00+02:00","FinishDate":"1956-02-21T19:05:00+02:00","IsSpecialMeeting":null,"LastUpdatedDate":"2021-11-28T19:58:10.067+02:00"}
{"Id":489960,"Number":83,"KnessetNum":3,"Name":"ישיבת מליאה בתאריך 21/02/1956 בשעה 20:18","StartDate":"1956-02-21T20:18:00+02:00","FinishDate":"1956-02-21T23:05:00+02:00","IsSpecialMeeting":null,"LastUpdatedDate":"2021-12-01T09:10:14.513+02:00"}
{"Id":489961,"Number":84,"KnessetNum":3,"Name":"ישיבת מליאה בתאריך 22/02/1956 בשעה 14:03","StartDate":"1956-02-22T14:03:00+02:00","FinishDate":"1956-02-22T18:45:00+02:00","IsSpecialMeeting":null,"LastUpdatedDate":"2021-12-01T09:11:41.193+02:00"}
{"Id":489962,"Number":85,"KnessetNum":3,"Name":"ישיבת מליאה בתאריך 28/02/1956 בשעה 16:10","StartDate":"1956-02-28T16:10:00+02:00","FinishDate":"1956-02-28T19:17:00+02:00","IsSpecialMeeting":null,"LastUpdatedDate":"2021-12-01T09:23:35.237+02:00"}
{"Id":489963,"Number":87,"KnessetNum":3,"Name":"ישיבת מליאה בתאריך 29/02/1956 בשעה 16:06","StartDate":"1956-02-29T16:06:00+02:00","FinishDate":"1956-02-29T19:06:00+02:00","IsSpecialMeeting":null,"LastUpdatedDate":"2021-12-01T10:00:40.203+02:00"}
{"Id":489964,"Number":88,"KnessetNum":3,"Name":"ישיבת מליאה בתאריך 29/02/1956 בשעה 20:18","StartDate":"1956-02-29T20:18:00+02:00","FinishDate":"1956-02-29T22:55:00+02:00","IsSpecialMeeting":null,"LastUpdatedDate":"2021-12-01T10:28:03.19+02:00"}
{"Id":489965,"Number":89,"KnessetNum":3,"Name":"ישיבת מליאה בתאריך 01/03/1956 בשעה 14:10","StartDate":"1956-03-01T14:10:00+02:00","FinishDate":"1956-03-01T19:35:00+02:00","IsSpecialMeeting":null,"LastUpdatedDate":"2021-12-01T10:35:15.773+02:00"}
{"Id":489966,"Number":90,"KnessetNum":3,"Name":"ישיבת מליאה בתאריך 05/03/1956 בשעה 16:09","StartDate":"1956-03-05T16:09:00+02:00","FinishDate":"1956-03-05T19:12:00+02:00","IsSpecialMeeting":null,"LastUpdatedDate":"2021-12-01T11:02:48.453+02:00"}
{"Id":489967,"Number":91,"KnessetNum":3,"Name":"ישיבת מליאה בתאריך 05/03/1956 בשעה 20:35","StartDate":"1956-03-05T20:35:00+02:00","FinishDate":"1956-03-05T22:08:00+02:00","IsSpecialMeeting":null,"LastUpdatedDate":"2021-12-01T11:13:38.06+02:00"}
{"Id":489968,"Number":92,"KnessetNum":3,"Name":"ישיבת מליאה בתאריך 06/03/1956 בשעה 16:05","StartDate":"1956-03-06T16:05:00+02:00","FinishDate":"1956-03-06T19:07:00+02:00","IsSpecialMeeting":null,"LastUpdatedDate":"2021-12-01T11:53:22.37+02:00"}
{"Id":489969,"Number":93,"KnessetNum":3,"Name":"ישיבת מליאה בתאריך 06/03/1956 בשעה 20:20","StartDate":"1956-03-06T20:20:00+02:00","FinishDate":"1956-03-06T22:57:00+02:00","IsSpecialMeeting":null,"LastUpdatedDate":"2021-12-01T12:04:41.97+02:00"}
{"Id":489970,"Number":94,"KnessetNum":3,"Name":"ישיבת מליאה בתאריך 07/03/1956 בשעה 16:05","StartDate":"1956-03-07T16:05:00+02:00","FinishDate":"1956-03-07T18:52:00+02:00","IsSpecialMeeting":null,"LastUpdatedDate":"2021-12-01T12:17:54.967+02:00"}
{"Id":489971,"Number":95,"KnessetNum":3,"Name":"ישיבת מליאה בתאריך 07/03/1956 בשעה 20:08","StartDate":"1956-03-07T20:08:00+02:00","FinishDate":"1956-03-07T22:44:00+02:00","IsSpecialMeeting":null,"LastUpdatedDate":"2021-12-01T13:27:16.37+02:00"}
{"Id":489972,"Number":96,"KnessetNum":3,"Name":"ישיבת מליאה בתאריך 08/03/1956 בשעה 14:05","StartDate":"1956-03-08T14:05:00+02:00","FinishDate":"1956-03-08T18:00:00+02:00","IsSpecialMeeting":null,"LastUpdatedDate":"2021-12-01T13:43:24.763+02:00"}
{"Id":489973,"Number":97,"KnessetNum":3,"Name":"ישיבת מליאה בתאריך 12/03/1956 בשעה 16:09","StartDate":"1956-03-12T16:09:00+02:00","FinishDate":"1956-03-12T19:30:00+02:00","IsSpecialMeeting":null,"LastUpdatedDate":"2021-12-01T13:53:34.957+02:00"}
{"Id":489974,"Number":99,"KnessetNum":3,"Name":"ישיבת מליאה בתאריך 13/03/1956 בשעה 16:06","StartDate":"1956-03-13T16:06:00+02:00","FinishDate":"1956-03-13T16:22:00+02:00","IsSpecialMeeting":null,"LastUpdatedDate":"2021-12-02T10:18:11.053+02:00"}
{"Id":489975,"Number":102,"KnessetNum":3,"Name":"ישיבת מליאה בתאריך 19/03/1956 בשעה 16:05","StartDate":"1956-03-19T16:05:00+02:00","FinishDate":"1956-03-19T19:04:00+02:00","IsSpecialMeeting":null,"LastUpdatedDate":"2021-12-02T11:03:19.913+02:00"}
{"Id":489976,"Number":103,"KnessetNum":3,"Name":"ישיבת מליאה בתאריך 19/03/1956 בשעה 20:26","StartDate":"1956-03-19T20:26:00+02:00","FinishDate":"1956-03-19T22:40:00+02:00","IsSpecialMeeting":null,"LastUpdatedDate":"2021-12-02T11:24:06.277+02:00"}
{"Id":489977,"Number":104,"KnessetNum":3,"Name":"ישיבת מליאה בתאריך 20/03/1956 בשעה 16:02","StartDate":"1956-03-20T16:02:00+02:00","FinishDate":"1956-03-20T19:25:00+02:00","IsSpecialMeeting":null,"LastUpdatedDate":"2021-12-02T11:28:48.86+02:00"}
{"Id":489978,"Number":105,"KnessetNum":3,"Name":"ישיבת מליאה בתאריך 20/03/1956 בשעה 20:32","StartDate":"1956-03-20T20:32:00+02:00","FinishDate":"1956-03-20T21:52:00+02:00","IsSpecialMeeting":null,"LastUpdatedDate":"2021-12-02T11:36:59.977+02:00"}
{"Id":489979,"Number":106,"KnessetNum":3,"Name":"ישיבת מליאה בתאריך 21/03/1956 בשעה 11:25","StartDate":"1956-03-21T11:25:00+02:00","FinishDate":"1956-03-21T14:12:00+02:00","IsSpecialMeeting":null,"LastUpdatedDate":"2021-12-02T11:41:10.97+02:00"}
{"Id":489980,"Number":130,"KnessetNum":3,"Name":"ישיבת מליאה בתאריך 05/06/1956 בשעה 16:10","StartDate":"1956-06-05T16:10:00+03:00","FinishDate":"1956-06-05T19:15:00+03:00","IsSpecialMeeting":null,"LastUpdatedDate":"2021-12-07T15:38:19.18+02:00"}
{"Id":489981,"Number":131,"KnessetNum":3,"Name":"ישיבת מליאה בתאריך 06/06/1956 בשעה 11:10","StartDate":"1956-06-06T11:10:00+03:00","FinishDate":"1956-06-06T12:33:00+03:00","IsSpecialMeeting":null,"LastUpdatedDate":"2021-12-07T15:53:45.163+02:00"}
{"Id":489982,"Number":138,"KnessetNum":3,"Name":"ישיבת מליאה בתאריך 18/06/1956 בשעה 20:15","StartDate":"1956-06-18T20:15:00+03:00","FinishDate":"1956-06-18T21:51:00+03:00","IsSpecialMeeting":null,"LastUpdatedDate":"2021-12-08T11:24:18.833+02:00"}
{"Id":489983,"Number":139,"KnessetNum":3,"Name":"ישיבת מליאה בתאריך 19/06/1956 בשעה 16:05","StartDate":"1956-06-19T16:05:00+03:00","FinishDate":"1956-06-19T18:57:00+03:00","IsSpecialMeeting":null,"LastUpdatedDate":"2021-12-08T11:29:12.783+02:00"}
{"Id":489984,"Number":140,"KnessetNum":3,"Name":"ישיבת מליאה בתאריך 19/06/1956 בשעה 20:07","StartDate":"1956-06-19T20:07:00+03:00","FinishDate":"1956-06-19T23:00:00+03:00","IsSpecialMeeting":null,"LastUpdatedDate":"2021-12-08T12:34:28.537+02:00"}
{"Id":489985,"Number":145,"KnessetNum":3,"Name":"ישיבת מליאה בתאריך 27/06/1956 בשעה 11:08","StartDate":"1956-06-27T11:08:00+03:00","FinishDate":"1956-06-27T13:55:00+03:00","IsSpecialMeeting":null,"LastUpdatedDate":"2021-12-08T14:19:42.947+02:00"}
{"Id":489986,"Number":146,"KnessetNum":3,"Name":"ישיבת מליאה בתאריך 02/07/1956 בשעה 16:12","StartDate":"1956-07-02T16:12:00+03:00","FinishDate":"1956-07-02T19:07:00+03:00","IsSpecialMeeting":null,"LastUpdatedDate":"2021-12-08T14:43:38.17+02:00"}
{"Id":489987,"Number":147,"KnessetNum":3,"Name":"ישיבת מליאה בתאריך 02/07/1956 בשעה 20:13","StartDate":"1956-07-02T20:13:00+03:00","FinishDate":"1956-07-02T21:55:00+03:00","IsSpecialMeeting":null,"LastUpdatedDate":"2021-12-08T15:31:01.603+02:00"}
{"Id":489988,"Number":148,"KnessetNum":3,"Name":"ישיבת מליאה בתאריך 03/07/1956 בשעה 16:02","StartDate":"1956-07-03T16:02:00+03:00","FinishDate":"1956-07-03T19:15:00+03:00","IsSpecialMeeting":null,"LastUpdatedDate":"2021-12-08T15:32:51.883+02:00"}
{"Id":489989,"Number":150,"KnessetNum":3,"Name":"ישיבת מליאה בתאריך 04/07/1956 בשעה 11:06","StartDate":"1956-07-04T11:06:00+03:00","FinishDate":"1956-07-04T13:09:00+03:00","IsSpecialMeeting":null,"LastUpdatedDate":"2021-12-08T15:52:00.277+02:00"}
{"Id":489990,"Number":154,"KnessetNum":3,"Name":"ישיבת מליאה בתאריך 11/07/1956 בשעה 11:40","StartDate":"1956-07-11T11:40:00+03:00","FinishDate":"1956-07-11T14:14:00+03:00","IsSpecialMeeting":null,"LastUpdatedDate":"2021-12-09T12:50:44.807+02:00"}
{"Id":489991,"Number":156,"KnessetNum":3,"Name":"ישיבת מליאה בתאריך 18/07/1956 בשעה 20:16","StartDate":"1956-07-18T20:16:00+03:00","FinishDate":"1956-07-18T22:00:00+03:00","IsSpecialMeeting":null,"LastUpdatedDate":"2021-12-09T13:52:47.563+02:00"}
{"Id":489992,"Number":164,"KnessetNum":3,"Name":"ישיבת מליאה בתאריך 08/10/1956 בשעה 16:10","StartDate":"1956-10-08T16:10:00+02:00","FinishDate":"1956-10-08T19:20:00+02:00","IsSpecialMeeting":null,"LastUpdatedDate":"2020-05-18T16:56:43.207+03:00"}
{"Id":489993,"Number":165,"KnessetNum":3,"Name":"ישיבת מליאה בתאריך 08/10/1956 בשעה 20:05","StartDate":"1956-10-08T20:05:00+02:00","FinishDate":"1956-10-08T21:27:00+02:00","IsSpecialMeeting":null,"LastUpdatedDate":"2020-05-18T16:52:18.977+03:00"}
{"Id":489994,"Number":168,"KnessetNum":3,"Name":"ישיבת מליאה בתאריך 10/10/1956 בשעה 11:03","StartDate":"1956-10-10T11:03:00+02:00","FinishDate":"1956-10-10T12:33:00+02:00","IsSpecialMeeting":null,"LastUpdatedDate":"2021-12-30T13:03:17.287+02:00"}
{"Id":489995,"Number":169,"KnessetNum":3,"Name":"ישיבת מליאה בתאריך 15/10/1956 בשעה 16:07","StartDate":"1956-10-15T16:07:00+02:00","FinishDate":"1956-10-15T17:42:00+02:00","IsSpecialMeeting":null,"LastUpdatedDate":"2021-12-12T15:19:20.34+02:00"}
{"Id":489996,"Number":170,"KnessetNum":3,"Name":"ישיבת מליאה בתאריך 15/10/1956 בשעה 20:08","StartDate":"1956-10-15T20:08:00+02:00","FinishDate":"1956-10-15T22:05:00+02:00","IsSpecialMeeting":null,"LastUpdatedDate":"2021-12-12T15:21:16.843+02:00"}
{"Id":489997,"Number":171,"KnessetNum":3,"Name":"ישיבת מליאה בתאריך 16/10/1956 בשעה 16:02","StartDate":"1956-10-16T16:02:00+02:00","FinishDate":"1956-10-16T19:15:00+02:00","IsSpecialMeeting":null,"LastUpdatedDate":"2021-12-12T15:27:05.257+02:00"}
{"Id":489998,"Number":172,"KnessetNum":3,"Name":"ישיבת מליאה בתאריך 16/10/1956 בשעה 20:00","StartDate":"1956-10-16T20:00:00+02:00","FinishDate":"1956-10-16T23:19:00+02:00","IsSpecialMeeting":null,"LastUpdatedDate":"2021-12-12T15:48:44.653+02:00"}
{"Id":489999,"Number":173,"KnessetNum":3,"Name":"ישיבת מליאה בתאריך 17/10/1956 בשעה 11:09","StartDate":"1956-10-17T11:09:00+02:00","FinishDate":"1956-10-17T12:20:00+02:00","IsSpecialMeeting":null,"LastUpdatedDate":"2021-12-12T17:35:17.067+02:00"}