{"Id":174664,"Number":43,"KnessetNum":17,"Name":"ישיבת מליאה בתאריך 22/08/2006 בשעה: 11:00","StartDate":"2006-08-22T11:00:00+03:00","FinishDate":"2006-08-22T15:20:00+03:00","IsSpecialMeeting":false,"LastUpdatedDate":"2013-10-03T16:21:47+03:00"}
{"Id":175868,"Number":44,"KnessetNum":17,"Name":"ישיבת מליאה בתאריך 18/09/2006 בשעה: 11:00","StartDate":"2006-09-18T11:00:00+03:00","FinishDate":"2006-09-18T12:40:00+03:00","IsSpecialMeeting":false,"LastUpdatedDate":"2013-10-03T16:21:47+03:00"}
{"Id":176662,"Number":45,"KnessetNum":17,"Name":"ישיבת מליאה בתאריך 16/10/2006 בשעה: 16:00","StartDate":"2006-10-16T16:00:00+02:00","FinishDate":"2006-10-16T21:00:00+02:00","IsSpecialMeeting":false,"LastUpdatedDate":"2013-10-03T16:21:47+03:00"}
{"Id":176667,"Number":46,"KnessetNum":17,"Name":"ישיבת מליאה בתאריך 17/10/2006 בשעה 16:00","StartDate":"2006-10-17T16:00:00+02:00","FinishDate":"2006-10-17T20:40:00+02:00","IsSpecialMeeting":false,"LastUpdatedDate":"2021-01-05T12:53:34.93+02:00"}
{"Id":176670,"Number":47,"KnessetNum":17,"Name":"ישיבת מליאה בתאריך 18/10/2006 בשעה: 11:00","StartDate":"2006-10-18T11:00:00+02:00","FinishDate":"2006-10-18T17:50:00+02:00","IsSpecialMeeting":false,"LastUpdatedDate":"2013-10-03T16:21:47+03:00"}
{"Id":177529,"Number":48,"KnessetNum":17,"Name":"ישיבת מליאה בתאריך 23/10/2006 בשעה: 18:10","StartDate":"2006-10-23T18:10:00+02:00","FinishDate":"2006-10-23T18:50:00+02:00","IsSpecialMeeting":false,"LastUpdatedDate":"2013-10-03T16:21:47+03:00"}
{"Id":177531,"Number":49,"KnessetNum":17,"Name":"ישיבת מליאה בתאריך 24/10/2006 בשעה: 16:00","StartDate":"2006-10-24T16:00:00+02:00","FinishDate":"2006-10-24T18:50:00+02:00","IsSpecialMeeting":false,"LastUpdatedDate":"2013-10-03T16:21:47+03:00"}
{"Id":177770,"Number":50,"KnessetNum":17,"Name":"ישיבת מליאה בתאריך 25/10/2006 בשעה: 11:00","StartDate":"2006-10-25T11:00:00+02:00","FinishDate":"2006-10-25T18:10:00+02:00","IsSpecialMeeting":false,"LastUpdatedDate":"2013-10-03T16:21:47+03:00"}
{"Id":178107,"Number":51,"KnessetNum":17,"Name":"ישיבת מליאה בתאריך 30/10/2006 בשעה 16:00","StartDate":"2006-10-30T16:00:00+02:00","FinishDate":"2006-10-30T22:20:00+02:00","IsSpecialMeeting":false,"LastUpdatedDate":"2020-02-09T10:56:50.523+02:00"}
{"Id":178108,"Number":52,"KnessetNum":17,"Name":"ישיבת מליאה בתאריך 31/10/2006 בשעה 16:00","StartDate":"2006-10-31T16:00:00+02:00","FinishDate":"2006-10-31T17:50:00+02:00","IsSpecialMeeting":false,"LastUpdatedDate":"2021-01-05T11:45:47.78+02:00"}
{"Id":178109,"Number":53,"KnessetNum":17,"Name":"ישיבת מליאה בתאריך 01/11/2006 בשעה: 11:00","StartDate":"2006-11-01T11:00:00+02:00","FinishDate":"2006-11-01T20:20:00+02:00","IsSpecialMeeting":false,"LastUpdatedDate":"2013-10-03T16:21:47+03:00"}
{"Id":178747,"Number":54,"KnessetNum":17,"Name":"ישיבת מליאה בתאריך 02/11/2006 בשעה: 17:00","StartDate":"2006-11-02T17:00:00+02:00","FinishDate":"2006-11-02T18:00:00+02:00","IsSpecialMeeting":true,"LastUpdatedDate":"2013-10-03T16:21:47+03:00"}
{"Id":178827,"Number":55,"KnessetNum":17,"Name":"ישיבת מליאה בתאריך 06/11/2006 בשעה: 16:00","StartDate":"2006-11-06T16:00:00+02:00","FinishDate":"2006-11-06T22:20:00+02:00","IsSpecialMeeting":false,"LastUpdatedDate":"2013-10-03T16:21:47+03:00"}
{"Id":178941,"Number":56,"KnessetNum":17,"Name":"ישיבת מליאה בתאריך 07/11/2006 בשעה 11:00","StartDate":"2006-11-07T11:00:00+02:00","FinishDate":"2006-11-07T19:30:00+02:00","IsSpecialMeeting":false,"LastUpdatedDate":"2021-01-05T12:38:40.39+02:00"}
{"Id":178942,"Number":57,"KnessetNum":17,"Name":"ישיבת מליאה בתאריך 08/11/2006 בשעה 11:00","StartDate":"2006-11-08T11:00:00+02:00","FinishDate":"2006-11-08T18:00:00+02:00","IsSpecialMeeting":false,"LastUpdatedDate":"2021-01-05T12:52:03.057+02:00"}
{"Id":179580,"Number":58,"KnessetNum":17,"Name":"ישיבת מליאה בתאריך 13/11/2006 בשעה 16:00","StartDate":"2006-11-13T16:00:00+02:00","FinishDate":"2006-11-13T19:50:00+02:00","IsSpecialMeeting":false,"LastUpdatedDate":"2021-01-05T12:40:32.743+02:00"}
{"Id":179581,"Number":59,"KnessetNum":17,"Name":"ישיבת מליאה בתאריך 14/11/2006 בשעה: 16:00","StartDate":"2006-11-14T16:00:00+02:00","FinishDate":"2006-11-14T19:30:00+02:00","IsSpecialMeeting":false,"LastUpdatedDate":"2013-10-03T16:21:47+03:00"}
{"Id":179582,"Number":60,"KnessetNum":17,"Name":"ישיבת מליאה בתאריך 15/11/2006 בשעה: 11:00","StartDate":"2006-11-15T11:00:00+02:00","FinishDate":"2006-11-15T18:10:00+02:00","IsSpecialMeeting":false,"LastUpdatedDate":"2013-10-03T16:21:47+03:00"}