{"Id":160006,"Number":280,"KnessetNum":11,"Name":"ישיבת מליאה בתאריך 13/01/1987 בשעה 16:01","StartDate":"1987-01-13T16:01:00+02:00","FinishDate":"1987-01-13T21:37:00+02:00","IsSpecialMeeting":null,"LastUpdatedDate":"2025-03-17T09:23:49.36+02:00"}
{"Id":160007,"Number":282,"KnessetNum":11,"Name":"ישיבת מליאה בתאריך 19/01/1987 בשעה 16:04","StartDate":"1987-01-19T16:04:00+02:00","FinishDate":"1987-01-19T19:34:00+02:00","IsSpecialMeeting":null,"LastUpdatedDate":"2025-03-17T10:59:59.323+02:00"}
{"Id":160010,"Number":292,"KnessetNum":11,"Name":"ישיבת מליאה בתאריך 09/02/1987 בשעה 16:02","StartDate":"1987-02-09T16:02:00+02:00","FinishDate":"1987-02-09T19:20:00+02:00","IsSpecialMeeting":null,"LastUpdatedDate":"2025-03-26T11:04:45.42+02:00"}
{"Id":160013,"Number":295,"KnessetNum":11,"Name":"ישיבת מליאה בתאריך 16/02/1987 בשעה 16:01","StartDate":"1987-02-16T16:01:00+02:00","FinishDate":"1987-02-16T21:30:00+02:00","IsSpecialMeeting":null,"LastUpdatedDate":"2025-03-10T11:13:34.593+02:00"}
{"Id":160016,"Number":299,"KnessetNum":11,"Name":"ישיבת מליאה בתאריך 24/02/1987 בשעה 16:01","StartDate":"1987-02-24T16:01:00+02:00","FinishDate":"1987-02-24T20:01:00+02:00","IsSpecialMeeting":null,"LastUpdatedDate":"2025-03-30T13:03:59.113+03:00"}
{"Id":160020,"Number":304,"KnessetNum":11,"Name":"ישיבת מליאה בתאריך 09/03/1987 בשעה 16:02","StartDate":"1987-03-09T16:02:00+02:00","FinishDate":"1987-03-09T18:38:00+02:00","IsSpecialMeeting":null,"LastUpdatedDate":"2025-03-10T11:41:18.97+02:00"}
{"Id":160021,"Number":305,"KnessetNum":11,"Name":"ישיבת מליאה בתאריך 10/03/1987 בשעה 16:00","StartDate":"1987-03-10T16:00:00+02:00","FinishDate":"1987-03-10T20:29:00+02:00","IsSpecialMeeting":null,"LastUpdatedDate":"2025-04-06T11:25:14.507+03:00"}
{"Id":160028,"Number":312,"KnessetNum":11,"Name":"ישיבת מליאה בתאריך 25/03/1987 בשעה 11:04","StartDate":"1987-03-25T11:04:00+02:00","FinishDate":"1987-03-25T16:26:00+02:00","IsSpecialMeeting":null,"LastUpdatedDate":"2025-04-27T11:08:40.457+03:00"}
{"Id":160037,"Number":320,"KnessetNum":11,"Name":"ישיבת מליאה בתאריך 19/05/1987 בשעה 16:00","StartDate":"1987-05-19T16:00:00+03:00","FinishDate":"1987-05-19T22:29:00+03:00","IsSpecialMeeting":null,"LastUpdatedDate":"2025-03-10T12:41:43.763+02:00"}
{"Id":160043,"Number":328,"KnessetNum":11,"Name":"ישיבת מליאה בתאריך 10/06/1987 בשעה 11:00","StartDate":"1987-06-10T11:00:00+03:00","FinishDate":"1987-06-10T19:07:00+03:00","IsSpecialMeeting":null,"LastUpdatedDate":"2025-05-14T09:28:01.307+03:00"}
{"Id":160048,"Number":335,"KnessetNum":11,"Name":"ישיבת מליאה בתאריך 29/06/1987 בשעה 16:02","StartDate":"1987-06-29T16:02:00+03:00","FinishDate":"1987-06-29T21:25:00+03:00","IsSpecialMeeting":null,"LastUpdatedDate":"2025-05-19T10:37:50.453+03:00"}
{"Id":160050,"Number":337,"KnessetNum":11,"Name":"ישיבת מליאה בתאריך 01/07/1987 בשעה 11:01","StartDate":"1987-07-01T11:01:00+03:00","FinishDate":"1987-07-01T15:29:00+03:00","IsSpecialMeeting":null,"LastUpdatedDate":"2025-05-19T12:14:54.72+03:00"}
{"Id":160059,"Number":345,"KnessetNum":11,"Name":"ישיבת מליאה בתאריך 21/07/1987 בשעה 16:02","StartDate":"1987-07-21T16:02:00+03:00","FinishDate":"1987-07-21T22:00:00+03:00","IsSpecialMeeting":null,"LastUpdatedDate":"2025-05-25T11:31:26.087+03:00"}
{"Id":160060,"Number":346,"KnessetNum":11,"Name":"ישיבת מליאה בתאריך 22/07/1987 בשעה 11:00","StartDate":"1987-07-22T11:00:00+03:00","FinishDate":"1987-07-22T16:36:00+03:00","IsSpecialMeeting":null,"LastUpdatedDate":"2025-05-26T09:16:02.753+03:00"}
{"Id":160062,"Number":348,"KnessetNum":11,"Name":"ישיבת מליאה בתאריך 28/07/1987 בשעה 14:02","StartDate":"1987-07-28T14:02:00+03:00","FinishDate":"1987-07-28T20:36:00+03:00","IsSpecialMeeting":null,"LastUpdatedDate":"2025-05-26T12:05:39.257+03:00"}
{"Id":160065,"Number":351,"KnessetNum":11,"Name":"ישיבת מליאה בתאריך 24/08/1987 בשעה 10:02","StartDate":"1987-08-24T10:02:00+03:00","FinishDate":"1987-08-24T13:38:00+03:00","IsSpecialMeeting":null,"LastUpdatedDate":"2025-03-10T15:56:57.907+02:00"}
{"Id":160066,"Number":352,"KnessetNum":11,"Name":"ישיבת מליאה בתאריך 14/09/1987 בשעה 11:02","StartDate":"1987-09-14T11:02:00+03:00","FinishDate":"1987-09-14T16:45:00+03:00","IsSpecialMeeting":null,"LastUpdatedDate":"2025-03-10T15:57:52.29+02:00"}
{"Id":160067,"Number":353,"KnessetNum":11,"Name":"ישיבת מליאה בתאריך 19/10/1987 בשעה 16:02","StartDate":"1987-10-19T16:02:00+02:00","FinishDate":"1987-10-19T20:52:00+02:00","IsSpecialMeeting":null,"LastUpdatedDate":"2025-03-10T16:07:13.38+02:00"}
{"Id":160068,"Number":354,"KnessetNum":11,"Name":"ישיבת מליאה בתאריך 20/10/1987 בשעה 16:02","StartDate":"1987-10-20T16:02:00+02:00","FinishDate":"1987-10-20T22:33:00+02:00","IsSpecialMeeting":null,"LastUpdatedDate":"2025-03-10T16:13:16.027+02:00"}
{"Id":160070,"Number":356,"KnessetNum":11,"Name":"ישיבת מליאה בתאריך 26/10/1987 בשעה 16:00","StartDate":"1987-10-26T16:00:00+02:00","FinishDate":"1987-10-26T20:13:00+02:00","IsSpecialMeeting":null,"LastUpdatedDate":"2025-03-10T16:17:25.49+02:00"}
{"Id":160073,"Number":360,"KnessetNum":11,"Name":"ישיבת מליאה בתאריך 03/11/1987 בשעה 16:02","StartDate":"1987-11-03T16:02:00+02:00","FinishDate":"1987-11-03T20:57:00+02:00","IsSpecialMeeting":null,"LastUpdatedDate":"2025-06-08T10:52:00.447+03:00"}
{"Id":160090,"Number":381,"KnessetNum":11,"Name":"ישיבת מליאה בתאריך 22/12/1987 בשעה 16:00","StartDate":"1987-12-22T16:00:00+02:00","FinishDate":"1987-12-22T18:18:00+02:00","IsSpecialMeeting":null,"LastUpdatedDate":"2025-07-21T07:39:35.223+03:00"}
{"Id":160093,"Number":384,"KnessetNum":11,"Name":"ישיבת מליאה בתאריך 29/12/1987 בשעה 16:01","StartDate":"1987-12-29T16:01:00+02:00","FinishDate":"1987-12-29T20:14:00+02:00","IsSpecialMeeting":null,"LastUpdatedDate":"2025-07-21T10:40:36.283+03:00"}
{"Id":160096,"Number":389,"KnessetNum":11,"Name":"ישיבת מליאה בתאריך 11/01/1988 בשעה 16:02","StartDate":"1988-01-11T16:02:00+02:00","FinishDate":"1988-01-11T20:47:00+02:00","IsSpecialMeeting":null,"LastUpdatedDate":"2025-07-30T08:49:31.947+03:00"}
{"Id":160100,"Number":395,"KnessetNum":11,"Name":"ישיבת מליאה בתאריך 25/01/1988 בשעה 16:03","StartDate":"1988-01-25T16:03:00+02:00","FinishDate":"1988-01-25T22:07:00+02:00","IsSpecialMeeting":null,"LastUpdatedDate":"2025-08-06T10:19:32.087+03:00"}
{"Id":160103,"Number":398,"KnessetNum":11,"Name":"ישיבת מליאה בתאריך 01/02/1988 בשעה 16:00","StartDate":"1988-02-01T16:00:00+02:00","FinishDate":"1988-02-01T20:51:00+02:00","IsSpecialMeeting":null,"LastUpdatedDate":"2025-03-11T11:29:11.693+02:00"}
{"Id":160109,"Number":405,"KnessetNum":11,"Name":"ישיבת מליאה בתאריך 16/02/1988 בשעה 16:00","StartDate":"1988-02-16T16:00:00+02:00","FinishDate":"1988-02-16T19:15:00+02:00","IsSpecialMeeting":null,"LastUpdatedDate":"2025-03-11T11:32:51.8+02:00"}
{"Id":160112,"Number":409,"KnessetNum":11,"Name":"ישיבת מליאה בתאריך 23/02/1988 בשעה 18:00","StartDate":"1988-02-23T18:00:00+02:00","FinishDate":"1988-02-23T21:31:00+02:00","IsSpecialMeeting":null,"LastUpdatedDate":"2025-03-11T11:35:21.683+02:00"}
{"Id":160124,"Number":420,"KnessetNum":11,"Name":"ישיבת מליאה בתאריך 21/03/1988 בשעה 16:03","StartDate":"1988-03-21T16:03:00+02:00","FinishDate":"1988-03-21T20:22:00+02:00","IsSpecialMeeting":null,"LastUpdatedDate":"2025-03-11T12:40:54.967+02:00"}
{"Id":160137,"Number":438,"KnessetNum":11,"Name":"ישיבת מליאה בתאריך 30/05/1988 בשעה 16:02","StartDate":"1988-05-30T16:02:00+03:00","FinishDate":"1988-05-30T19:03:00+03:00","IsSpecialMeeting":null,"LastUpdatedDate":"2025-03-11T14:08:20.52+02:00"}
{"Id":160138,"Number":439,"KnessetNum":11,"Name":"ישיבת מליאה בתאריך 31/05/1988 בשעה 16:00","StartDate":"1988-05-31T16:00:00+03:00","FinishDate":"1988-05-31T20:25:00+03:00","IsSpecialMeeting":null,"LastUpdatedDate":"2025-11-09T08:45:32.703+02:00"}
{"Id":160139,"Number":440,"KnessetNum":11,"Name":"ישיבת מליאה בתאריך 01/06/1988 בשעה 11:02","StartDate":"1988-06-01T11:02:00+03:00","FinishDate":"1988-06-01T15:34:00+03:00","IsSpecialMeeting":null,"LastUpdatedDate":"2025-11-09T10:46:20.607+02:00"}
{"Id":160142,"Number":444,"KnessetNum":11,"Name":"ישיבת מליאה בתאריך 13/06/1988 בשעה 16:01","StartDate":"1988-06-13T16:01:00+03:00","FinishDate":"1988-06-13T18:33:00+03:00","IsSpecialMeeting":null,"LastUpdatedDate":"2025-11-09T12:55:36.083+02:00"}
{"Id":160143,"Number":446,"KnessetNum":11,"Name":"ישיבת מליאה בתאריך 14/06/1988 בשעה 15:47","StartDate":"1988-06-14T15:47:00+03:00","FinishDate":"1988-06-14T20:39:00+03:00","IsSpecialMeeting":null,"LastUpdatedDate":"2025-11-10T08:56:57.323+02:00"}
{"Id":160146,"Number":449,"KnessetNum":11,"Name":"ישיבת מליאה בתאריך 21/06/1988 בשעה 16:01","StartDate":"1988-06-21T16:01:00+03:00","FinishDate":"1988-06-21T20:22:00+03:00","IsSpecialMeeting":null,"LastUpdatedDate":"2025-03-11T14:54:46.077+02:00"}
{"Id":160147,"Number":451,"KnessetNum":11,"Name":"ישיבת מליאה בתאריך 27/06/1988 בשעה 16:02","StartDate":"1988-06-27T16:02:00+03:00","FinishDate":"1988-06-27T19:55:00+03:00","IsSpecialMeeting":null,"LastUpdatedDate":"2025-11-16T08:53:31.873+02:00"}
{"Id":160148,"Number":452,"KnessetNum":11,"Name":"ישיבת מליאה בתאריך 28/06/1988 בשעה 16:03","StartDate":"1988-06-28T16:03:00+03:00","FinishDate":"1988-06-28T19:32:00+03:00","IsSpecialMeeting":null,"LastUpdatedDate":"2025-11-16T09:49:39.78+02:00"}
{"Id":160156,"Number":460,"KnessetNum":11,"Name":"ישיבת מליאה בתאריך 18/07/1988 בשעה 16:03","StartDate":"1988-07-18T16:03:00+03:00","FinishDate":"1988-07-18T21:34:00+03:00","IsSpecialMeeting":null,"LastUpdatedDate":"2025-11-17T11:52:39.12+02:00"}
{"Id":160159,"Number":463,"KnessetNum":11,"Name":"ישיבת מליאה בתאריך 25/07/1988 בשעה 16:03","StartDate":"1988-07-25T16:03:00+03:00","FinishDate":"1988-07-26T00:39:00+03:00","IsSpecialMeeting":null,"LastUpdatedDate":"2025-11-24T11:40:12.103+02:00"}
{"Id":160167,"Number":7,"KnessetNum":12,"Name":"ישיבת מליאה בתאריך 12/12/1988 בשעה 16:02","StartDate":"1988-12-12T16:02:00+02:00","FinishDate":"1988-12-12T17:49:00+02:00","IsSpecialMeeting":null,"LastUpdatedDate":"2024-03-17T09:51:54.187+02:00"}
{"Id":160179,"Number":21,"KnessetNum":12,"Name":"ישיבת מליאה בתאריך 11/01/1989 בשעה 11:04","StartDate":"1989-01-11T11:04:00+02:00","FinishDate":"1989-01-11T16:16:00+02:00","IsSpecialMeeting":null,"LastUpdatedDate":"2024-04-30T10:11:59.53+03:00"}
{"Id":160182,"Number":24,"KnessetNum":12,"Name":"ישיבת מליאה בתאריך 18/01/1989 בשעה 11:06","StartDate":"1989-01-18T11:06:00+02:00","FinishDate":"1989-01-18T16:42:00+02:00","IsSpecialMeeting":null,"LastUpdatedDate":"2024-05-07T14:15:20.073+03:00"}
{"Id":160183,"Number":25,"KnessetNum":12,"Name":"ישיבת מליאה בתאריך 23/01/1989 בשעה 16:04","StartDate":"1989-01-23T16:04:00+02:00","FinishDate":"1989-01-23T21:28:00+02:00","IsSpecialMeeting":null,"LastUpdatedDate":"2024-05-07T16:31:04.477+03:00"}
{"Id":160185,"Number":28,"KnessetNum":12,"Name":"ישיבת מליאה בתאריך 30/01/1989 בשעה 16:04","StartDate":"1989-01-30T16:04:00+02:00","FinishDate":"1989-01-30T19:54:00+02:00","IsSpecialMeeting":null,"LastUpdatedDate":"2024-05-29T16:49:09.13+03:00"}
{"Id":160191,"Number":37,"KnessetNum":12,"Name":"ישיבת מליאה בתאריך 20/02/1989 בשעה 16:00","StartDate":"1989-02-20T16:00:00+02:00","FinishDate":"1989-02-20T20:19:00+02:00","IsSpecialMeeting":null,"LastUpdatedDate":"2024-09-26T10:33:56.933+03:00"}
{"Id":160192,"Number":38,"KnessetNum":12,"Name":"ישיבת מליאה בתאריך 21/02/1989 בשעה 16:00","StartDate":"1989-02-21T16:00:00+02:00","FinishDate":"1989-02-21T19:49:00+02:00","IsSpecialMeeting":null,"LastUpdatedDate":"2024-09-26T11:42:26.697+03:00"}
{"Id":160194,"Number":40,"KnessetNum":12,"Name":"ישיבת מליאה בתאריך 27/02/1989 בשעה 16:02","StartDate":"1989-02-27T16:02:00+02:00","FinishDate":"1989-02-27T17:26:00+02:00","IsSpecialMeeting":null,"LastUpdatedDate":"2025-01-22T15:32:19.423+02:00"}
{"Id":160197,"Number":45,"KnessetNum":12,"Name":"ישיבת מליאה בתאריך 13/03/1989 בשעה 16:02","StartDate":"1989-03-13T16:02:00+02:00","FinishDate":"1989-03-13T18:28:00+02:00","IsSpecialMeeting":null,"LastUpdatedDate":"2025-01-28T15:22:56.707+02:00"}
{"Id":160199,"Number":47,"KnessetNum":12,"Name":"ישיבת מליאה בתאריך 15/03/1989 בשעה 11:02","StartDate":"1989-03-15T11:02:00+02:00","FinishDate":"1989-03-15T15:19:00+02:00","IsSpecialMeeting":null,"LastUpdatedDate":"2025-01-29T14:16:42.713+02:00"}
{"Id":160201,"Number":49,"KnessetNum":12,"Name":"ישיבת מליאה בתאריך 23/03/1989 בשעה 10:05","StartDate":"1989-03-23T10:05:00+02:00","FinishDate":"1989-03-23T13:58:00+02:00","IsSpecialMeeting":null,"LastUpdatedDate":"2025-02-02T11:22:42.287+02:00"}
{"Id":160206,"Number":55,"KnessetNum":12,"Name":"ישיבת מליאה בתאריך 05/04/1989 בשעה 11:01","StartDate":"1989-04-05T11:01:00+03:00","FinishDate":"1989-04-05T18:45:00+03:00","IsSpecialMeeting":null,"LastUpdatedDate":"2025-02-10T16:14:30.183+02:00"}
{"Id":160207,"Number":56,"KnessetNum":12,"Name":"ישיבת מליאה בתאריך 10/04/1989 בשעה 16:00","StartDate":"1989-04-10T16:00:00+03:00","FinishDate":"1989-04-10T17:45:00+03:00","IsSpecialMeeting":null,"LastUpdatedDate":"2025-02-12T16:53:49.127+02:00"}
{"Id":160208,"Number":57,"KnessetNum":12,"Name":"ישיבת מליאה בתאריך 11/04/1989 בשעה 16:00","StartDate":"1989-04-11T16:00:00+03:00","FinishDate":"1989-04-11T19:56:00+03:00","IsSpecialMeeting":null,"LastUpdatedDate":"2025-02-23T14:05:22.207+02:00"}
{"Id":160211,"Number":61,"KnessetNum":12,"Name":"ישיבת מליאה בתאריך 16/05/1989 בשעה 16:00","StartDate":"1989-05-16T16:00:00+03:00","FinishDate":"1989-05-16T20:31:00+03:00","IsSpecialMeeting":null,"LastUpdatedDate":"2025-02-24T16:04:34.253+02:00"}
{"Id":160213,"Number":64,"KnessetNum":12,"Name":"ישיבת מליאה בתאריך 23/05/1989 בשעה 16:03","StartDate":"1989-05-23T16:03:00+03:00","FinishDate":"1989-05-23T23:25:00+03:00","IsSpecialMeeting":null,"LastUpdatedDate":"2025-03-03T15:23:29.223+02:00"}
{"Id":160218,"Number":69,"KnessetNum":12,"Name":"ישיבת מליאה בתאריך 05/06/1989 בשעה 16:01","StartDate":"1989-06-05T16:01:00+03:00","FinishDate":"1989-06-05T18:28:00+03:00","IsSpecialMeeting":null,"LastUpdatedDate":"2025-03-03T15:36:30.837+02:00"}
{"Id":160219,"Number":70,"KnessetNum":12,"Name":"ישיבת מליאה בתאריך 06/06/1989 בשעה 16:00","StartDate":"1989-06-06T16:00:00+03:00","FinishDate":"1989-06-06T19:21:00+03:00","IsSpecialMeeting":null,"LastUpdatedDate":"2025-03-03T15:37:05.803+02:00"}
{"Id":160237,"Number":92,"KnessetNum":12,"Name":"ישיבת מליאה בתאריך 26/07/1989 בשעה 09:00","StartDate":"1989-07-26T09:00:00+03:00","FinishDate":"1989-07-26T20:23:00+03:00","IsSpecialMeeting":null,"LastUpdatedDate":"2025-03-03T17:48:08.96+02:00"}
{"Id":160241,"Number":96,"KnessetNum":12,"Name":"ישיבת מליאה בתאריך 04/09/1989 בשעה 11:02","StartDate":"1989-09-04T11:02:00+03:00","FinishDate":"1989-09-04T15:12:00+03:00","IsSpecialMeeting":null,"LastUpdatedDate":"2025-03-03T17:55:26.783+02:00"}
{"Id":160247,"Number":106,"KnessetNum":12,"Name":"ישיבת מליאה בתאריך 31/10/1989 בשעה 16:00","StartDate":"1989-10-31T16:00:00+02:00","FinishDate":"1989-10-31T18:25:00+02:00","IsSpecialMeeting":null,"LastUpdatedDate":"2025-03-03T18:23:08.8+02:00"}
{"Id":160248,"Number":107,"KnessetNum":12,"Name":"ישיבת מליאה בתאריך 01/11/1989 בשעה 11:03","StartDate":"1989-11-01T11:03:00+02:00","FinishDate":"1989-11-01T16:45:00+02:00","IsSpecialMeeting":null,"LastUpdatedDate":"2025-06-19T02:48:01.733+03:00"}
{"Id":160249,"Number":108,"KnessetNum":12,"Name":"ישיבת מליאה בתאריך 06/11/1989 בשעה 16:02","StartDate":"1989-11-06T16:02:00+02:00","FinishDate":"1989-11-06T19:48:00+02:00","IsSpecialMeeting":null,"LastUpdatedDate":"2025-03-03T18:24:39.393+02:00"}
{"Id":160252,"Number":112,"KnessetNum":12,"Name":"ישיבת מליאה בתאריך 14/11/1989 בשעה 16:00","StartDate":"1989-11-14T16:00:00+02:00","FinishDate":"1989-11-14T20:03:00+02:00","IsSpecialMeeting":null,"LastUpdatedDate":"2025-03-04T08:33:36.55+02:00"}
{"Id":160253,"Number":113,"KnessetNum":12,"Name":"ישיבת מליאה בתאריך 15/11/1989 בשעה 11:03","StartDate":"1989-11-15T11:03:00+02:00","FinishDate":"1989-11-15T17:35:00+02:00","IsSpecialMeeting":null,"LastUpdatedDate":"2025-03-04T08:34:16.637+02:00"}
{"Id":160254,"Number":114,"KnessetNum":12,"Name":"ישיבת מליאה בתאריך 20/11/1989 בשעה 16:00","StartDate":"1989-11-20T16:00:00+02:00","FinishDate":"1989-11-20T21:03:00+02:00","IsSpecialMeeting":null,"LastUpdatedDate":"2025-03-04T08:34:55.677+02:00"}
{"Id":160260,"Number":120,"KnessetNum":12,"Name":"ישיבת מליאה בתאריך 04/12/1989 בשעה 16:00","StartDate":"1989-12-04T16:00:00+02:00","FinishDate":"1989-12-04T20:42:00+02:00","IsSpecialMeeting":null,"LastUpdatedDate":"2025-03-04T08:44:08.77+02:00"}
{"Id":160261,"Number":121,"KnessetNum":12,"Name":"ישיבת מליאה בתאריך 05/12/1989 בשעה 16:00","StartDate":"1989-12-05T16:00:00+02:00","FinishDate":"1989-12-05T21:26:00+02:00","IsSpecialMeeting":null,"LastUpdatedDate":"2025-03-04T09:04:16.013+02:00"}
{"Id":160262,"Number":122,"KnessetNum":12,"Name":"ישיבת מליאה בתאריך 06/12/1989 בשעה 11:00","StartDate":"1989-12-06T11:00:00+02:00","FinishDate":"1989-12-06T17:58:00+02:00","IsSpecialMeeting":null,"LastUpdatedDate":"2025-03-04T09:05:26.587+02:00"}
{"Id":160264,"Number":124,"KnessetNum":12,"Name":"ישיבת מליאה בתאריך 12/12/1989 בשעה 16:03","StartDate":"1989-12-12T16:03:00+02:00","FinishDate":"1989-12-12T20:38:00+02:00","IsSpecialMeeting":null,"LastUpdatedDate":"2025-03-04T09:07:04.42+02:00"}
{"Id":160267,"Number":127,"KnessetNum":12,"Name":"ישיבת מליאה בתאריך 19/12/1989 בשעה 16:00","StartDate":"1989-12-19T16:00:00+02:00","FinishDate":"1989-12-19T21:26:00+02:00","IsSpecialMeeting":null,"LastUpdatedDate":"2025-03-04T10:02:20.52+02:00"}
{"Id":160271,"Number":130,"KnessetNum":12,"Name":"ישיבת מליאה בתאריך 26/12/1989 בשעה 16:00","StartDate":"1989-12-26T16:00:00+02:00","FinishDate":"1989-12-26T19:34:00+02:00","IsSpecialMeeting":null,"LastUpdatedDate":"2025-03-04T10:04:49.067+02:00"}
{"Id":160279,"Number":138,"KnessetNum":12,"Name":"ישיבת מליאה בתאריך 15/01/1990 בשעה 16:02","StartDate":"1990-01-15T16:02:00+02:00","FinishDate":"1990-01-15T20:32:00+02:00","IsSpecialMeeting":null,"LastUpdatedDate":"2025-03-04T10:35:21.393+02:00"}
{"Id":160280,"Number":139,"KnessetNum":12,"Name":"ישיבת מליאה בתאריך 16/01/1990 בשעה 16:00","StartDate":"1990-01-16T16:00:00+02:00","FinishDate":"1990-01-16T20:40:00+02:00","IsSpecialMeeting":null,"LastUpdatedDate":"2025-03-04T10:35:45.44+02:00"}
{"Id":160285,"Number":145,"KnessetNum":12,"Name":"ישיבת מליאה בתאריך 30/01/1990 בשעה 16:02","StartDate":"1990-01-30T16:02:00+02:00","FinishDate":"1990-01-30T20:18:00+02:00","IsSpecialMeeting":null,"LastUpdatedDate":"2025-03-04T10:44:29.813+02:00"}
{"Id":160288,"Number":148,"KnessetNum":12,"Name":"ישיבת מליאה בתאריך 06/02/1990 בשעה 16:01","StartDate":"1990-02-06T16:01:00+02:00","FinishDate":"1990-02-06T20:00:00+02:00","IsSpecialMeeting":null,"LastUpdatedDate":"2025-03-04T10:49:31.397+02:00"}
{"Id":160299,"Number":160,"KnessetNum":12,"Name":"ישיבת מליאה בתאריך 06/03/1990 בשעה 16:00","StartDate":"1990-03-06T16:00:00+02:00","FinishDate":"1990-03-06T21:25:00+02:00","IsSpecialMeeting":null,"LastUpdatedDate":"2025-03-04T10:59:42.08+02:00"}
{"Id":160301,"Number":163,"KnessetNum":12,"Name":"ישיבת מליאה בתאריך 14/03/1990 בשעה 16:01","StartDate":"1990-03-14T16:01:00+02:00","FinishDate":"1990-03-14T21:59:00+02:00","IsSpecialMeeting":null,"LastUpdatedDate":"2025-03-04T13:57:23.627+02:00"}
{"Id":160304,"Number":166,"KnessetNum":12,"Name":"ישיבת מליאה בתאריך 20/03/1990 בשעה 16:04","StartDate":"1990-03-20T16:04:00+02:00","FinishDate":"1990-03-20T17:22:00+02:00","IsSpecialMeeting":null,"LastUpdatedDate":"2025-03-04T14:13:10.92+02:00"}
{"Id":160306,"Number":168,"KnessetNum":12,"Name":"ישיבת מליאה בתאריך 25/03/1990 בשעה 16:01","StartDate":"1990-03-25T16:01:00+02:00","FinishDate":"1990-03-25T18:16:00+02:00","IsSpecialMeeting":null,"LastUpdatedDate":"2025-03-04T14:19:28.36+02:00"}
{"Id":160307,"Number":169,"KnessetNum":12,"Name":"ישיבת מליאה בתאריך 26/03/1990 בשעה 16:01","StartDate":"1990-03-26T16:01:00+02:00","FinishDate":"1990-03-26T21:02:00+02:00","IsSpecialMeeting":null,"LastUpdatedDate":"2025-03-04T14:27:04.423+02:00"}
{"Id":160312,"Number":173,"KnessetNum":12,"Name":"ישיבת מליאה בתאריך 08/05/1990 בשעה 16:01","StartDate":"1990-05-08T16:01:00+03:00","FinishDate":"1990-05-08T20:48:00+03:00","IsSpecialMeeting":null,"LastUpdatedDate":"2025-03-04T14:37:10.497+02:00"}
{"Id":160318,"Number":180,"KnessetNum":12,"Name":"ישיבת מליאה בתאריך 23/05/1990 בשעה 11:00","StartDate":"1990-05-23T11:00:00+03:00","FinishDate":"1990-05-23T18:28:00+03:00","IsSpecialMeeting":null,"LastUpdatedDate":"2025-03-04T15:01:31.01+02:00"}
{"Id":160324,"Number":186,"KnessetNum":12,"Name":"ישיבת מליאה בתאריך 12/06/1990 בשעה 16:02","StartDate":"1990-06-12T16:02:00+03:00","FinishDate":"1990-06-12T19:08:00+03:00","IsSpecialMeeting":null,"LastUpdatedDate":"2025-03-04T15:11:08.063+02:00"}
{"Id":160325,"Number":187,"KnessetNum":12,"Name":"ישיבת מליאה בתאריך 13/06/1990 בשעה 11:02","StartDate":"1990-06-13T11:02:00+03:00","FinishDate":"1990-06-13T17:26:00+03:00","IsSpecialMeeting":null,"LastUpdatedDate":"2025-03-04T15:18:29.74+02:00"}
{"Id":160327,"Number":189,"KnessetNum":12,"Name":"ישיבת מליאה בתאריך 19/06/1990 בשעה 16:02","StartDate":"1990-06-19T16:02:00+03:00","FinishDate":"1990-06-19T21:07:00+03:00","IsSpecialMeeting":null,"LastUpdatedDate":"2025-09-25T09:49:49.087+03:00"}
{"Id":160332,"Number":194,"KnessetNum":12,"Name":"ישיבת מליאה בתאריך 02/07/1990 בשעה 16:04","StartDate":"1990-07-02T16:04:00+03:00","FinishDate":"1990-07-02T22:20:00+03:00","IsSpecialMeeting":null,"LastUpdatedDate":"2025-09-25T14:42:14.52+03:00"}
{"Id":160346,"Number":209,"KnessetNum":12,"Name":"ישיבת מליאה בתאריך 12/09/1990 בשעה 10:04","StartDate":"1990-09-12T10:04:00+03:00","FinishDate":"1990-09-12T14:41:00+03:00","IsSpecialMeeting":null,"LastUpdatedDate":"2025-10-28T16:51:59.573+02:00"}
{"Id":160347,"Number":211,"KnessetNum":12,"Name":"ישיבת מליאה בתאריך 26/09/1990 בשעה 10:07","StartDate":"1990-09-26T10:07:00+02:00","FinishDate":"1990-09-26T12:18:00+02:00","IsSpecialMeeting":null,"LastUpdatedDate":"2025-10-29T10:44:41.14+02:00"}
{"Id":160348,"Number":214,"KnessetNum":12,"Name":"ישיבת מליאה בתאריך 15/10/1990 בשעה 16:03","StartDate":"1990-10-15T16:03:00+02:00","FinishDate":"1990-10-15T21:27:00+02:00","IsSpecialMeeting":null,"LastUpdatedDate":"2025-03-06T08:44:49.56+02:00"}
{"Id":160350,"Number":217,"KnessetNum":12,"Name":"ישיבת מליאה בתאריך 22/10/1990 בשעה 16:03","StartDate":"1990-10-22T16:03:00+02:00","FinishDate":"1990-10-22T19:55:00+02:00","IsSpecialMeeting":null,"LastUpdatedDate":"2025-03-06T08:47:21.723+02:00"}
{"Id":160351,"Number":218,"KnessetNum":12,"Name":"ישיבת מליאה בתאריך 23/10/1990 בשעה 16:02","StartDate":"1990-10-23T16:02:00+02:00","FinishDate":"1990-10-23T18:54:00+02:00","IsSpecialMeeting":null,"LastUpdatedDate":"2025-03-06T08:48:03.517+02:00"}
{"Id":160352,"Number":219,"KnessetNum":12,"Name":"ישיבת מליאה בתאריך 24/10/1990 בשעה 11:02","StartDate":"1990-10-24T11:02:00+02:00","FinishDate":"1990-10-24T16:10:00+02:00","IsSpecialMeeting":null,"LastUpdatedDate":"2025-10-29T18:37:55.003+02:00"}
{"Id":160355,"Number":223,"KnessetNum":12,"Name":"ישיבת מליאה בתאריך 05/11/1990 בשעה 16:04","StartDate":"1990-11-05T16:04:00+02:00","FinishDate":"1990-11-05T23:13:00+02:00","IsSpecialMeeting":null,"LastUpdatedDate":"2025-03-06T08:52:08.94+02:00"}
{"Id":160361,"Number":229,"KnessetNum":12,"Name":"ישיבת מליאה בתאריך 19/11/1990 בשעה 16:02","StartDate":"1990-11-19T16:02:00+02:00","FinishDate":"1990-11-19T18:51:00+02:00","IsSpecialMeeting":null,"LastUpdatedDate":"2025-03-06T08:56:59.45+02:00"}
{"Id":160362,"Number":230,"KnessetNum":12,"Name":"ישיבת מליאה בתאריך 20/11/1990 בשעה 16:00","StartDate":"1990-11-20T16:00:00+02:00","FinishDate":"1990-11-21T01:12:00+02:00","IsSpecialMeeting":null,"LastUpdatedDate":"2025-03-06T08:57:56.31+02:00"}
{"Id":160364,"Number":232,"KnessetNum":12,"Name":"ישיבת מליאה בתאריך 26/11/1990 בשעה 16:01","StartDate":"1990-11-26T16:01:00+02:00","FinishDate":"1990-11-26T23:08:00+02:00","IsSpecialMeeting":null,"LastUpdatedDate":"2025-03-06T09:07:46.443+02:00"}
{"Id":160367,"Number":236,"KnessetNum":12,"Name":"ישיבת מליאה בתאריך 04/12/1990 בשעה 16:01","StartDate":"1990-12-04T16:01:00+02:00","FinishDate":"1990-12-04T21:07:00+02:00","IsSpecialMeeting":null,"LastUpdatedDate":"2025-03-06T09:10:44.007+02:00"}
{"Id":160369,"Number":238,"KnessetNum":12,"Name":"ישיבת מליאה בתאריך 10/12/1990 בשעה 16:02","StartDate":"1990-12-10T16:02:00+02:00","FinishDate":"1990-12-10T19:31:00+02:00","IsSpecialMeeting":null,"LastUpdatedDate":"2025-03-06T09:54:35.507+02:00"}
{"Id":160370,"Number":239,"KnessetNum":12,"Name":"ישיבת מליאה בתאריך 11/12/1990 בשעה 16:01","StartDate":"1990-12-11T16:01:00+02:00","FinishDate":"1990-12-11T17:57:00+02:00","IsSpecialMeeting":null,"LastUpdatedDate":"2025-03-06T09:56:08.91+02:00"}
{"Id":160374,"Number":243,"KnessetNum":12,"Name":"ישיבת מליאה בתאריך 19/12/1990 בשעה 11:02","StartDate":"1990-12-19T11:02:00+02:00","FinishDate":"1990-12-19T18:50:00+02:00","IsSpecialMeeting":null,"LastUpdatedDate":"2025-03-06T10:01:17.42+02:00"}
{"Id":160380,"Number":250,"KnessetNum":12,"Name":"ישיבת מליאה בתאריך 07/01/1991 בשעה 16:01","StartDate":"1991-01-07T16:01:00+02:00","FinishDate":"1991-01-07T19:35:00+02:00","IsSpecialMeeting":null,"LastUpdatedDate":"2025-03-06T10:18:26.747+02:00"}
{"Id":160381,"Number":251,"KnessetNum":12,"Name":"ישיבת מליאה בתאריך 08/01/1991 בשעה 16:00","StartDate":"1991-01-08T16:00:00+02:00","FinishDate":"1991-01-08T18:28:00+02:00","IsSpecialMeeting":null,"LastUpdatedDate":"2025-03-06T10:19:03.16+02:00"}
{"Id":160386,"Number":259,"KnessetNum":12,"Name":"ישיבת מליאה בתאריך 28/01/1991 בשעה 16:07","StartDate":"1991-01-28T16:07:00+02:00","FinishDate":"1991-01-28T19:37:00+02:00","IsSpecialMeeting":null,"LastUpdatedDate":"2025-11-27T13:15:46.24+02:00"}
{"Id":160388,"Number":262,"KnessetNum":12,"Name":"ישיבת מליאה בתאריך 04/02/1991 בשעה 16:04","StartDate":"1991-02-04T16:04:00+02:00","FinishDate":"1991-02-04T19:27:00+02:00","IsSpecialMeeting":null,"LastUpdatedDate":"2019-12-17T10:35:32.16+02:00"}
{"Id":160394,"Number":268,"KnessetNum":12,"Name":"ישיבת מליאה בתאריך 18/02/1991 בשעה 16:01","StartDate":"1991-02-18T16:01:00+02:00","FinishDate":"1991-02-18T20:25:00+02:00","IsSpecialMeeting":null,"LastUpdatedDate":"2025-03-06T10:20:21.61+02:00"}
{"Id":160398,"Number":272,"KnessetNum":12,"Name":"ישיבת מליאה בתאריך 26/02/1991 בשעה 16:00","StartDate":"1991-02-26T16:00:00+02:00","FinishDate":"1991-02-26T21:04:00+02:00","IsSpecialMeeting":null,"LastUpdatedDate":"2025-03-06T10:26:30.26+02:00"}
{"Id":160399,"Number":273,"KnessetNum":12,"Name":"ישיבת מליאה בתאריך 27/02/1991 בשעה 11:03","StartDate":"1991-02-27T11:03:00+02:00","FinishDate":"1991-02-27T14:00:00+02:00","IsSpecialMeeting":null,"LastUpdatedDate":"2025-03-06T10:27:40.397+02:00"}
{"Id":160402,"Number":276,"KnessetNum":12,"Name":"ישיבת מליאה בתאריך 06/03/1991 בשעה 11:03","StartDate":"1991-03-06T11:03:00+02:00","FinishDate":"1991-03-06T17:02:00+02:00","IsSpecialMeeting":null,"LastUpdatedDate":"2025-03-06T11:21:49.023+02:00"}
{"Id":160404,"Number":277,"KnessetNum":12,"Name":"ישיבת מליאה בתאריך 11/03/1991 בשעה 16:01","StartDate":"1991-03-11T16:01:00+02:00","FinishDate":"1991-03-11T18:47:00+02:00","IsSpecialMeeting":null,"LastUpdatedDate":"2025-03-06T11:24:44.39+02:00"}
{"Id":160409,"Number":282,"KnessetNum":12,"Name":"ישיבת מליאה בתאריך 20/03/1991 בשעה 09:04","StartDate":"1991-03-20T09:04:00+02:00","FinishDate":"1991-03-20T15:23:00+02:00","IsSpecialMeeting":null,"LastUpdatedDate":"2025-03-06T11:34:21.657+02:00"}
{"Id":160411,"Number":285,"KnessetNum":12,"Name":"ישיבת מליאה בתאריך 22/04/1991 בשעה 16:07","StartDate":"1991-04-22T16:07:00+03:00","FinishDate":"1991-04-22T19:10:00+03:00","IsSpecialMeeting":null,"LastUpdatedDate":"2025-03-06T11:36:56.08+02:00"}
{"Id":160412,"Number":286,"KnessetNum":12,"Name":"ישיבת מליאה בתאריך 23/04/1991 בשעה 16:03","StartDate":"1991-04-23T16:03:00+03:00","FinishDate":"1991-04-23T21:19:00+03:00","IsSpecialMeeting":null,"LastUpdatedDate":"2025-03-09T08:41:41.807+02:00"}
{"Id":160414,"Number":288,"KnessetNum":12,"Name":"ישיבת מליאה בתאריך 29/04/1991 בשעה 16:04","StartDate":"1991-04-29T16:04:00+03:00","FinishDate":"1991-04-29T21:31:00+03:00","IsSpecialMeeting":null,"LastUpdatedDate":"2025-03-09T08:43:26.253+02:00"}
{"Id":160418,"Number":293,"KnessetNum":12,"Name":"ישיבת מליאה בתאריך 08/05/1991 בשעה 11:04","StartDate":"1991-05-08T11:04:00+03:00","FinishDate":"1991-05-08T15:35:00+03:00","IsSpecialMeeting":null,"LastUpdatedDate":"2025-03-09T08:55:03.58+02:00"}
{"Id":160419,"Number":294,"KnessetNum":12,"Name":"ישיבת מליאה בתאריך 13/05/1991 בשעה 16:02","StartDate":"1991-05-13T16:02:00+03:00","FinishDate":"1991-05-13T20:00:00+03:00","IsSpecialMeeting":null,"LastUpdatedDate":"2025-03-13T09:18:58.023+02:00"}
{"Id":160420,"Number":295,"KnessetNum":12,"Name":"ישיבת מליאה בתאריך 14/05/1991 בשעה 16:02","StartDate":"1991-05-14T16:02:00+03:00","FinishDate":"1991-05-14T22:30:00+03:00","IsSpecialMeeting":null,"LastUpdatedDate":"2025-03-09T09:21:05.343+02:00"}
{"Id":160422,"Number":297,"KnessetNum":12,"Name":"ישיבת מליאה בתאריך 20/05/1991 בשעה 16:02","StartDate":"1991-05-20T16:02:00+03:00","FinishDate":"1991-05-20T19:45:00+03:00","IsSpecialMeeting":null,"LastUpdatedDate":"2025-03-09T09:28:23.7+02:00"}
{"Id":160423,"Number":298,"KnessetNum":12,"Name":"ישיבת מליאה בתאריך 21/05/1991 בשעה 16:00","StartDate":"1991-05-21T16:00:00+03:00","FinishDate":"1991-05-21T20:12:00+03:00","IsSpecialMeeting":null,"LastUpdatedDate":"2025-03-09T09:29:05.24+02:00"}
{"Id":160428,"Number":303,"KnessetNum":12,"Name":"ישיבת מליאה בתאריך 03/06/1991 בשעה 16:02","StartDate":"1991-06-03T16:02:00+03:00","FinishDate":"1991-06-03T21:17:00+03:00","IsSpecialMeeting":null,"LastUpdatedDate":"2025-03-09T09:35:36.647+02:00"}
{"Id":160429,"Number":304,"KnessetNum":12,"Name":"ישיבת מליאה בתאריך 04/06/1991 בשעה 16:03","StartDate":"1991-06-04T16:03:00+03:00","FinishDate":"1991-06-04T20:28:00+03:00","IsSpecialMeeting":null,"LastUpdatedDate":"2025-03-09T09:36:14.083+02:00"}
{"Id":160434,"Number":309,"KnessetNum":12,"Name":"ישיבת מליאה בתאריך 17/06/1991 בשעה 16:01","StartDate":"1991-06-17T16:01:00+03:00","FinishDate":"1991-06-17T21:53:00+03:00","IsSpecialMeeting":null,"LastUpdatedDate":"2025-03-09T09:47:18.673+02:00"}
{"Id":160435,"Number":310,"KnessetNum":12,"Name":"ישיבת מליאה בתאריך 18/06/1991 בשעה 16:03","StartDate":"1991-06-18T16:03:00+03:00","FinishDate":"1991-06-18T20:49:00+03:00","IsSpecialMeeting":null,"LastUpdatedDate":"2025-03-09T09:52:12.65+02:00"}
{"Id":160436,"Number":311,"KnessetNum":12,"Name":"ישיבת מליאה בתאריך 19/06/1991 בשעה 11:01","StartDate":"1991-06-19T11:01:00+03:00","FinishDate":"1991-06-19T17:03:00+03:00","IsSpecialMeeting":null,"LastUpdatedDate":"2025-12-31T16:05:20.393+02:00"}
{"Id":160437,"Number":312,"KnessetNum":12,"Name":"ישיבת מליאה בתאריך 24/06/1991 בשעה 16:02","StartDate":"1991-06-24T16:02:00+03:00","FinishDate":"1991-06-24T19:40:00+03:00","IsSpecialMeeting":null,"LastUpdatedDate":"2019-12-16T09:54:15.36+02:00"}
{"Id":160438,"Number":313,"KnessetNum":12,"Name":"ישיבת מליאה בתאריך 25/06/1991 בשעה 16:03","StartDate":"1991-06-25T16:03:00+03:00","FinishDate":"1991-06-25T20:03:00+03:00","IsSpecialMeeting":null,"LastUpdatedDate":"2019-12-16T09:52:46.94+02:00"}
{"Id":160439,"Number":314,"KnessetNum":12,"Name":"ישיבת מליאה בתאריך 26/06/1991 בשעה 11:05","StartDate":"1991-06-26T11:05:00+03:00","FinishDate":"1991-06-26T18:58:00+03:00","IsSpecialMeeting":null,"LastUpdatedDate":"2019-12-16T09:45:22.417+02:00"}
{"Id":160440,"Number":315,"KnessetNum":12,"Name":"ישיבת מליאה בתאריך 01/07/1991 בשעה 16:02","StartDate":"1991-07-01T16:02:00+03:00","FinishDate":"1991-07-01T21:47:00+03:00","IsSpecialMeeting":null,"LastUpdatedDate":"2019-12-16T09:50:20.863+02:00"}
{"Id":160443,"Number":318,"KnessetNum":12,"Name":"ישיבת מליאה בתאריך 08/07/1991 בשעה 16:03","StartDate":"1991-07-08T16:03:00+03:00","FinishDate":"1991-07-08T21:04:00+03:00","IsSpecialMeeting":null,"LastUpdatedDate":"2025-03-09T09:56:51.987+02:00"}
{"Id":160444,"Number":319,"KnessetNum":12,"Name":"ישיבת מליאה בתאריך 09/07/1991 בשעה 16:00","StartDate":"1991-07-09T16:00:00+03:00","FinishDate":"1991-07-09T21:05:00+03:00","IsSpecialMeeting":null,"LastUpdatedDate":"2025-03-09T09:57:48.297+02:00"}
{"Id":160445,"Number":320,"KnessetNum":12,"Name":"ישיבת מליאה בתאריך 10/07/1991 בשעה 11:02","StartDate":"1991-07-10T11:02:00+03:00","FinishDate":"1991-07-10T19:02:00+03:00","IsSpecialMeeting":null,"LastUpdatedDate":"2025-03-09T09:58:33.717+02:00"}
{"Id":160446,"Number":321,"KnessetNum":12,"Name":"ישיבת מליאה בתאריך 15/07/1991 בשעה 16:02","StartDate":"1991-07-15T16:02:00+03:00","FinishDate":"1991-07-15T21:59:00+03:00","IsSpecialMeeting":null,"LastUpdatedDate":"2025-03-09T09:59:11.7+02:00"}
{"Id":160447,"Number":322,"KnessetNum":12,"Name":"ישיבת מליאה בתאריך 16/07/1991 בשעה 16:03","StartDate":"1991-07-16T16:03:00+03:00","FinishDate":"1991-07-16T23:39:00+03:00","IsSpecialMeeting":null,"LastUpdatedDate":"2025-03-09T10:00:01.397+02:00"}
{"Id":160448,"Number":323,"KnessetNum":12,"Name":"ישיבת מליאה בתאריך 17/07/1991 בשעה 11:02","StartDate":"1991-07-17T11:02:00+03:00","FinishDate":"1991-07-17T20:25:00+03:00","IsSpecialMeeting":null,"LastUpdatedDate":"2026-01-20T08:06:45.557+02:00"}
{"Id":160449,"Number":324,"KnessetNum":12,"Name":"ישיבת מליאה בתאריך 22/07/1991 בשעה 16:03","StartDate":"1991-07-22T16:03:00+03:00","FinishDate":"1991-07-22T23:35:00+03:00","IsSpecialMeeting":null,"LastUpdatedDate":"2025-03-09T10:07:24.663+02:00"}
{"Id":160450,"Number":325,"KnessetNum":12,"Name":"ישיבת מליאה בתאריך 23/07/1991 בשעה 16:00","StartDate":"1991-07-23T16:00:00+03:00","FinishDate":"1991-07-23T22:45:00+03:00","IsSpecialMeeting":null,"LastUpdatedDate":"2025-03-09T10:08:00.993+02:00"}
{"Id":160453,"Number":328,"KnessetNum":12,"Name":"ישיבת מליאה בתאריך 07/10/1991 בשעה 16:05","StartDate":"1991-10-07T16:05:00+02:00","FinishDate":"1991-10-07T20:05:00+02:00","IsSpecialMeeting":null,"LastUpdatedDate":"2025-03-09T10:40:34.307+02:00"}
{"Id":160454,"Number":329,"KnessetNum":12,"Name":"ישיבת מליאה בתאריך 08/10/1991 בשעה 16:04","StartDate":"1991-10-08T16:04:00+02:00","FinishDate":"1991-10-08T23:37:00+02:00","IsSpecialMeeting":null,"LastUpdatedDate":"2026-01-29T09:25:10.323+02:00"}
{"Id":160456,"Number":331,"KnessetNum":12,"Name":"ישיבת מליאה בתאריך 14/10/1991 בשעה 16:00","StartDate":"1991-10-14T16:00:00+02:00","FinishDate":"1991-10-14T17:20:00+02:00","IsSpecialMeeting":null,"LastUpdatedDate":"2025-03-09T10:53:41.713+02:00"}
{"Id":160458,"Number":333,"KnessetNum":12,"Name":"ישיבת מליאה בתאריך 16/10/1991 בשעה 11:01","StartDate":"1991-10-16T11:01:00+02:00","FinishDate":"1991-10-16T16:47:00+02:00","IsSpecialMeeting":null,"LastUpdatedDate":"2025-03-09T10:56:37.263+02:00"}
{"Id":160468,"Number":345,"KnessetNum":12,"Name":"ישיבת מליאה בתאריך 13/11/1991 בשעה 11:04","StartDate":"1991-11-13T11:04:00+02:00","FinishDate":"1991-11-13T17:34:00+02:00","IsSpecialMeeting":null,"LastUpdatedDate":"2025-03-09T11:48:41.93+02:00"}
{"Id":160470,"Number":347,"KnessetNum":12,"Name":"ישיבת מליאה בתאריך 19/11/1991 בשעה 16:02","StartDate":"1991-11-19T16:02:00+02:00","FinishDate":"1991-11-19T19:13:00+02:00","IsSpecialMeeting":null,"LastUpdatedDate":"2026-02-10T11:59:55.34+02:00"}
{"Id":160472,"Number":350,"KnessetNum":12,"Name":"ישיבת מליאה בתאריך 26/11/1991 בשעה 16:03","StartDate":"1991-11-26T16:03:00+02:00","FinishDate":"1991-11-26T21:51:00+02:00","IsSpecialMeeting":null,"LastUpdatedDate":"2025-03-09T12:12:53.55+02:00"}
{"Id":160473,"Number":351,"KnessetNum":12,"Name":"ישיבת מליאה בתאריך 27/11/1991 בשעה 11:07","StartDate":"1991-11-27T11:07:00+02:00","FinishDate":"1991-11-27T18:29:00+02:00","IsSpecialMeeting":null,"LastUpdatedDate":"2025-03-09T12:13:29.177+02:00"}
{"Id":160474,"Number":352,"KnessetNum":12,"Name":"ישיבת מליאה בתאריך 02/12/1991 בשעה 16:02","StartDate":"1991-12-02T16:02:00+02:00","FinishDate":"1991-12-02T18:20:00+02:00","IsSpecialMeeting":null,"LastUpdatedDate":"2025-03-09T12:20:08.283+02:00"}
{"Id":160475,"Number":353,"KnessetNum":12,"Name":"ישיבת מליאה בתאריך 03/12/1991 בשעה 16:06","StartDate":"1991-12-03T16:06:00+02:00","FinishDate":"1991-12-03T19:54:00+02:00","IsSpecialMeeting":null,"LastUpdatedDate":"2025-03-09T12:22:04.287+02:00"}
{"Id":160476,"Number":354,"KnessetNum":12,"Name":"ישיבת מליאה בתאריך 04/12/1991 בשעה 11:03","StartDate":"1991-12-04T11:03:00+02:00","FinishDate":"1991-12-04T18:16:00+02:00","IsSpecialMeeting":null,"LastUpdatedDate":"2025-03-09T12:22:50.387+02:00"}
{"Id":160477,"Number":355,"KnessetNum":12,"Name":"ישיבת מליאה בתאריך 09/12/1991 בשעה 16:03","StartDate":"1991-12-09T16:03:00+02:00","FinishDate":"1991-12-09T22:51:00+02:00","IsSpecialMeeting":null,"LastUpdatedDate":"2025-03-09T12:31:14.17+02:00"}
{"Id":160478,"Number":356,"KnessetNum":12,"Name":"ישיבת מליאה בתאריך 10/12/1991 בשעה 16:05","StartDate":"1991-12-10T16:05:00+02:00","FinishDate":"1991-12-10T22:23:00+02:00","IsSpecialMeeting":null,"LastUpdatedDate":"2025-03-09T12:37:30.613+02:00"}
{"Id":160479,"Number":357,"KnessetNum":12,"Name":"ישיבת מליאה בתאריך 11/12/1991 בשעה 11:05","StartDate":"1991-12-11T11:05:00+02:00","FinishDate":"1991-12-11T20:08:00+02:00","IsSpecialMeeting":null,"LastUpdatedDate":"2025-03-09T12:38:03.31+02:00"}
{"Id":160480,"Number":358,"KnessetNum":12,"Name":"ישיבת מליאה בתאריך 16/12/1991 בשעה 16:03","StartDate":"1991-12-16T16:03:00+02:00","FinishDate":"1991-12-16T18:03:00+02:00","IsSpecialMeeting":null,"LastUpdatedDate":"2025-03-09T12:39:03.04+02:00"}
{"Id":160481,"Number":359,"KnessetNum":12,"Name":"ישיבת מליאה בתאריך 17/12/1991 בשעה 16:05","StartDate":"1991-12-17T16:05:00+02:00","FinishDate":"1991-12-17T19:40:00+02:00","IsSpecialMeeting":null,"LastUpdatedDate":"2025-03-09T12:42:52.477+02:00"}
{"Id":160483,"Number":361,"KnessetNum":12,"Name":"ישיבת מליאה בתאריך 23/12/1991 בשעה 16:03","StartDate":"1991-12-23T16:03:00+02:00","FinishDate":"1991-12-23T21:10:00+02:00","IsSpecialMeeting":null,"LastUpdatedDate":"2025-03-09T12:52:45.8+02:00"}
{"Id":160484,"Number":362,"KnessetNum":12,"Name":"ישיבת מליאה בתאריך 24/12/1991 בשעה 16:03","StartDate":"1991-12-24T16:03:00+02:00","FinishDate":"1991-12-24T19:23:00+02:00","IsSpecialMeeting":null,"LastUpdatedDate":"2025-03-09T12:51:40.333+02:00"}
{"Id":160485,"Number":363,"KnessetNum":12,"Name":"ישיבת מליאה בתאריך 25/12/1991 בשעה 11:03","StartDate":"1991-12-25T11:03:00+02:00","FinishDate":"1991-12-25T19:13:00+02:00","IsSpecialMeeting":null,"LastUpdatedDate":"2025-03-09T13:55:28.72+02:00"}
{"Id":160486,"Number":364,"KnessetNum":12,"Name":"ישיבת מליאה בתאריך 30/12/1991 בשעה 16:00","StartDate":"1991-12-30T16:00:00+02:00","FinishDate":"1991-12-30T19:10:00+02:00","IsSpecialMeeting":null,"LastUpdatedDate":"2025-03-09T13:56:30.09+02:00"}
{"Id":160487,"Number":365,"KnessetNum":12,"Name":"ישיבת מליאה בתאריך 31/12/1991 בשעה 09:04","StartDate":"1991-12-31T09:04:00+02:00","FinishDate":"1991-12-31T23:20:00+02:00","IsSpecialMeeting":null,"LastUpdatedDate":"2025-03-09T13:59:34.187+02:00"}
{"Id":160488,"Number":366,"KnessetNum":12,"Name":"ישיבת מליאה בתאריך 02/01/1992 בשעה 10:01","StartDate":"1992-01-02T10:01:00+02:00","FinishDate":"1992-01-03T00:12:00+02:00","IsSpecialMeeting":null,"LastUpdatedDate":"2025-03-09T14:05:31.61+02:00"}
{"Id":160489,"Number":367,"KnessetNum":12,"Name":"ישיבת מליאה בתאריך 06/01/1992 בשעה 16:03","StartDate":"1992-01-06T16:03:00+02:00","FinishDate":"1992-01-07T02:32:00+02:00","IsSpecialMeeting":null,"LastUpdatedDate":"2025-03-09T14:09:58.1+02:00"}
{"Id":160490,"Number":369,"KnessetNum":12,"Name":"ישיבת מליאה בתאריך 08/01/1992 בשעה 11:07","StartDate":"1992-01-08T11:07:00+02:00","FinishDate":"1992-01-08T17:17:00+02:00","IsSpecialMeeting":null,"LastUpdatedDate":"2025-03-09T14:11:53.113+02:00"}
{"Id":160492,"Number":370,"KnessetNum":12,"Name":"ישיבת מליאה בתאריך 13/01/1992 בשעה 16:00","StartDate":"1992-01-13T16:00:00+02:00","FinishDate":"1992-01-13T20:40:00+02:00","IsSpecialMeeting":null,"LastUpdatedDate":"2025-03-09T14:12:27.057+02:00"}
{"Id":160493,"Number":371,"KnessetNum":12,"Name":"ישיבת מליאה בתאריך 14/01/1992 בשעה 16:00","StartDate":"1992-01-14T16:00:00+02:00","FinishDate":"1992-01-14T22:40:00+02:00","IsSpecialMeeting":null,"LastUpdatedDate":"2025-03-09T14:12:56.11+02:00"}
{"Id":160494,"Number":372,"KnessetNum":12,"Name":"ישיבת מליאה בתאריך 15/01/1992 בשעה 11:02","StartDate":"1992-01-15T11:02:00+02:00","FinishDate":"1992-01-15T18:08:00+02:00","IsSpecialMeeting":null,"LastUpdatedDate":"2025-03-09T14:13:40.83+02:00"}
{"Id":160495,"Number":373,"KnessetNum":12,"Name":"ישיבת מליאה בתאריך 20/01/1992 בשעה 16:02","StartDate":"1992-01-20T16:02:00+02:00","FinishDate":"1992-01-20T20:00:00+02:00","IsSpecialMeeting":null,"LastUpdatedDate":"2025-03-09T14:14:53.423+02:00"}
{"Id":160498,"Number":376,"KnessetNum":12,"Name":"ישיבת מליאה בתאריך 27/01/1992 בשעה 16:03","StartDate":"1992-01-27T16:03:00+02:00","FinishDate":"1992-01-27T22:01:00+02:00","IsSpecialMeeting":null,"LastUpdatedDate":"2025-03-09T14:30:39.317+02:00"}
{"Id":160499,"Number":377,"KnessetNum":12,"Name":"ישיבת מליאה בתאריך 28/01/1992 בשעה 16:02","StartDate":"1992-01-28T16:02:00+02:00","FinishDate":"1992-01-28T20:12:00+02:00","IsSpecialMeeting":null,"LastUpdatedDate":"2025-03-09T14:31:05.89+02:00"}
{"Id":160503,"Number":381,"KnessetNum":12,"Name":"ישיבת מליאה בתאריך 05/02/1992 בשעה 11:03","StartDate":"1992-02-05T11:03:00+02:00","FinishDate":"1992-02-05T17:58:00+02:00","IsSpecialMeeting":null,"LastUpdatedDate":"2025-03-10T08:37:55.367+02:00"}
{"Id":160504,"Number":382,"KnessetNum":12,"Name":"ישיבת מליאה בתאריך 10/02/1992 בשעה 16:01","StartDate":"1992-02-10T16:01:00+02:00","FinishDate":"1992-02-10T17:27:00+02:00","IsSpecialMeeting":null,"LastUpdatedDate":"2025-03-10T08:38:36.33+02:00"}
{"Id":160505,"Number":383,"KnessetNum":12,"Name":"ישיבת מליאה בתאריך 11/02/1992 בשעה 16:00","StartDate":"1992-02-11T16:00:00+02:00","FinishDate":"1992-02-11T19:18:00+02:00","IsSpecialMeeting":null,"LastUpdatedDate":"2025-03-10T08:39:21.15+02:00"}
{"Id":160510,"Number":388,"KnessetNum":12,"Name":"ישיבת מליאה בתאריך 24/02/1992 בשעה 16:02","StartDate":"1992-02-24T16:02:00+02:00","FinishDate":"1992-02-24T21:25:00+02:00","IsSpecialMeeting":null,"LastUpdatedDate":"2025-03-10T09:12:51.293+02:00"}
{"Id":160512,"Number":391,"KnessetNum":12,"Name":"ישיבת מליאה בתאריך 02/03/1992 בשעה 16:03","StartDate":"1992-03-02T16:03:00+02:00","FinishDate":"1992-03-02T16:51:00+02:00","IsSpecialMeeting":null,"LastUpdatedDate":"2025-03-10T09:17:18.803+02:00"}
{"Id":160515,"Number":394,"KnessetNum":12,"Name":"ישיבת מליאה בתאריך 09/03/1992 בשעה 18:05","StartDate":"1992-03-09T18:05:00+02:00","FinishDate":"1992-03-09T20:10:00+02:00","IsSpecialMeeting":null,"LastUpdatedDate":"2025-03-10T09:44:19.317+02:00"}
{"Id":160517,"Number":396,"KnessetNum":12,"Name":"ישיבת מליאה בתאריך 11/03/1992 בשעה 11:02","StartDate":"1992-03-11T11:02:00+02:00","FinishDate":"1992-03-11T19:26:00+02:00","IsSpecialMeeting":null,"LastUpdatedDate":"2025-03-10T09:54:43.09+02:00"}
{"Id":160518,"Number":397,"KnessetNum":12,"Name":"ישיבת מליאה בתאריך 16/03/1992 בשעה 16:04","StartDate":"1992-03-16T16:04:00+02:00","FinishDate":"1992-03-16T22:58:00+02:00","IsSpecialMeeting":null,"LastUpdatedDate":"2025-03-10T10:00:59.857+02:00"}
{"Id":160519,"Number":398,"KnessetNum":12,"Name":"ישיבת מליאה בתאריך 17/03/1992 בשעה 16:04","StartDate":"1992-03-17T16:04:00+02:00","FinishDate":"1992-03-18T00:14:00+02:00","IsSpecialMeeting":null,"LastUpdatedDate":"2025-03-10T10:04:01.383+02:00"}
{"Id":160522,"Number":5,"KnessetNum":13,"Name":"ישיבת מליאה בתאריך 22/07/1992 בשעה 11:01","StartDate":"1992-07-22T11:01:00+03:00","FinishDate":"1992-07-22T15:58:00+03:00","IsSpecialMeeting":null,"LastUpdatedDate":"2025-02-12T14:13:52.337+02:00"}
{"Id":160523,"Number":6,"KnessetNum":13,"Name":"ישיבת מליאה בתאריך 27/07/1992 בשעה 16:01","StartDate":"1992-07-27T16:01:00+03:00","FinishDate":"1992-07-27T20:41:00+03:00","IsSpecialMeeting":null,"LastUpdatedDate":"2025-02-12T14:16:27.087+02:00"}
{"Id":160525,"Number":9,"KnessetNum":13,"Name":"ישיבת מליאה בתאריך 03/08/1992 בשעה 16:02","StartDate":"1992-08-03T16:02:00+03:00","FinishDate":"1992-08-03T19:07:00+03:00","IsSpecialMeeting":null,"LastUpdatedDate":"2025-02-12T14:21:06.037+02:00"}
{"Id":160526,"Number":10,"KnessetNum":13,"Name":"ישיבת מליאה בתאריך 04/08/1992 בשעה 16:02","StartDate":"1992-08-04T16:02:00+03:00","FinishDate":"1992-08-04T20:52:00+03:00","IsSpecialMeeting":null,"LastUpdatedDate":"2025-02-12T14:21:56.39+02:00"}
{"Id":160528,"Number":12,"KnessetNum":13,"Name":"ישיבת מליאה בתאריך 25/08/1992 בשעה 10:01","StartDate":"1992-08-25T10:01:00+03:00","FinishDate":"1992-08-25T14:26:00+03:00","IsSpecialMeeting":true,"LastUpdatedDate":"2025-02-12T14:23:13.61+02:00"}
{"Id":160534,"Number":20,"KnessetNum":13,"Name":"ישיבת מליאה בתאריך 04/11/1992 בשעה 10:02","StartDate":"1992-11-04T10:02:00+02:00","FinishDate":"1992-11-04T16:23:00+02:00","IsSpecialMeeting":null,"LastUpdatedDate":"2025-02-12T15:25:54.77+02:00"}
{"Id":160535,"Number":21,"KnessetNum":13,"Name":"ישיבת מליאה בתאריך 09/11/1992 בשעה 16:02","StartDate":"1992-11-09T16:02:00+02:00","FinishDate":"1992-11-09T19:26:00+02:00","IsSpecialMeeting":null,"LastUpdatedDate":"2025-02-12T15:26:23.75+02:00"}
{"Id":160537,"Number":24,"KnessetNum":13,"Name":"ישיבת מליאה בתאריך 16/11/1992 בשעה 16:00","StartDate":"1992-11-16T16:00:00+02:00","FinishDate":"1992-11-16T20:35:00+02:00","IsSpecialMeeting":null,"LastUpdatedDate":"2025-02-12T15:34:32.627+02:00"}
{"Id":160546,"Number":34,"KnessetNum":13,"Name":"ישיבת מליאה בתאריך 08/12/1992 בשעה 16:01","StartDate":"1992-12-08T16:01:00+02:00","FinishDate":"1992-12-08T20:05:00+02:00","IsSpecialMeeting":null,"LastUpdatedDate":"2025-12-31T11:46:28.047+02:00"}
{"Id":160547,"Number":35,"KnessetNum":13,"Name":"ישיבת מליאה בתאריך 09/12/1992 בשעה 11:00","StartDate":"1992-12-09T11:00:00+02:00","FinishDate":"1992-12-09T18:00:00+02:00","IsSpecialMeeting":null,"LastUpdatedDate":"2025-02-12T15:49:48.633+02:00"}
{"Id":160549,"Number":37,"KnessetNum":13,"Name":"ישיבת מליאה בתאריך 15/12/1992 בשעה 16:04","StartDate":"1992-12-15T16:04:00+02:00","FinishDate":"1992-12-15T20:01:00+02:00","IsSpecialMeeting":null,"LastUpdatedDate":"2025-02-12T15:50:55.2+02:00"}
{"Id":160550,"Number":39,"KnessetNum":13,"Name":"ישיבת מליאה בתאריך 21/12/1992 בשעה 16:01","StartDate":"1992-12-21T16:01:00+02:00","FinishDate":"1992-12-21T20:13:00+02:00","IsSpecialMeeting":null,"LastUpdatedDate":"2025-02-12T15:52:15.58+02:00"}
{"Id":160554,"Number":43,"KnessetNum":13,"Name":"ישיבת מליאה בתאריך 29/12/1992 בשעה 14:00","StartDate":"1992-12-29T14:00:00+02:00","FinishDate":"1992-12-30T01:45:00+02:00","IsSpecialMeeting":null,"LastUpdatedDate":"2025-02-13T13:55:34.48+02:00"}
{"Id":160564,"Number":54,"KnessetNum":13,"Name":"ישיבת מליאה בתאריך 20/01/1993 בשעה 11:02","StartDate":"1993-01-20T11:02:00+02:00","FinishDate":"1993-01-20T19:01:00+02:00","IsSpecialMeeting":null,"LastUpdatedDate":"2026-01-25T09:51:22.61+02:00"}
{"Id":160567,"Number":57,"KnessetNum":13,"Name":"ישיבת מליאה בתאריך 27/01/1993 בשעה 11:01","StartDate":"1993-01-27T11:01:00+02:00","FinishDate":"1993-01-27T20:28:00+02:00","IsSpecialMeeting":null,"LastUpdatedDate":"2026-01-26T09:43:29.13+02:00"}
{"Id":160571,"Number":61,"KnessetNum":13,"Name":"ישיבת מליאה בתאריך 08/02/1993 בשעה 16:02","StartDate":"1993-02-08T16:02:00+02:00","FinishDate":"1993-02-08T18:38:00+02:00","IsSpecialMeeting":null,"LastUpdatedDate":"2025-02-13T08:26:47.707+02:00"}
{"Id":160579,"Number":69,"KnessetNum":13,"Name":"ישיבת מליאה בתאריך 24/02/1993 בשעה 11:04","StartDate":"1993-02-24T11:04:00+02:00","FinishDate":"1993-02-24T16:55:00+02:00","IsSpecialMeeting":null,"LastUpdatedDate":"2026-02-04T10:15:06.533+02:00"}
{"Id":160580,"Number":70,"KnessetNum":13,"Name":"ישיבת מליאה בתאריך 01/03/1993 בשעה 16:02","StartDate":"1993-03-01T16:02:00+02:00","FinishDate":"1993-03-01T20:32:00+02:00","IsSpecialMeeting":null,"LastUpdatedDate":"2025-02-13T08:32:00.617+02:00"}
{"Id":160587,"Number":76,"KnessetNum":13,"Name":"ישיבת מליאה בתאריך 15/03/1993 בשעה 16:03","StartDate":"1993-03-15T16:03:00+02:00","FinishDate":"1993-03-15T21:35:00+02:00","IsSpecialMeeting":null,"LastUpdatedDate":"2026-02-11T09:56:30.043+02:00"}
{"Id":160593,"Number":85,"KnessetNum":13,"Name":"ישיבת מליאה בתאריך 03/05/1993 בשעה 16:01","StartDate":"1993-05-03T16:01:00+03:00","FinishDate":"1993-05-03T20:35:00+03:00","IsSpecialMeeting":null,"LastUpdatedDate":"2025-02-13T09:09:53.51+02:00"}
{"Id":160594,"Number":86,"KnessetNum":13,"Name":"ישיבת מליאה בתאריך 04/05/1993 בשעה 16:00","StartDate":"1993-05-04T16:00:00+03:00","FinishDate":"1993-05-04T20:25:00+03:00","IsSpecialMeeting":null,"LastUpdatedDate":"2025-02-13T09:10:27.707+02:00"}
{"Id":160598,"Number":90,"KnessetNum":13,"Name":"ישיבת מליאה בתאריך 12/05/1993 בשעה 11:02","StartDate":"1993-05-12T11:02:00+03:00","FinishDate":"1993-05-12T18:22:00+03:00","IsSpecialMeeting":null,"LastUpdatedDate":"2025-02-13T09:45:23.38+02:00"}
{"Id":160600,"Number":93,"KnessetNum":13,"Name":"ישיבת מליאה בתאריך 18/05/1993 בשעה 16:02","StartDate":"1993-05-18T16:02:00+03:00","FinishDate":"1993-05-18T19:15:00+03:00","IsSpecialMeeting":null,"LastUpdatedDate":"2026-02-04T11:41:38.993+02:00"}
{"Id":160603,"Number":96,"KnessetNum":13,"Name":"ישיבת מליאה בתאריך 27/05/1993 בשעה 11:02","StartDate":"1993-05-27T11:02:00+03:00","FinishDate":"1993-05-27T14:57:00+03:00","IsSpecialMeeting":true,"LastUpdatedDate":"2025-02-13T09:53:46.563+02:00"}
{"Id":160604,"Number":97,"KnessetNum":13,"Name":"ישיבת מליאה בתאריך 31/05/1993 בשעה 16:03","StartDate":"1993-05-31T16:03:00+03:00","FinishDate":"1993-05-31T20:19:00+03:00","IsSpecialMeeting":null,"LastUpdatedDate":"2025-02-13T09:54:17.59+02:00"}
{"Id":160608,"Number":101,"KnessetNum":13,"Name":"ישיבת מליאה בתאריך 08/06/1993 בשעה 16:01","StartDate":"1993-06-08T16:01:00+03:00","FinishDate":"1993-06-08T20:32:00+03:00","IsSpecialMeeting":null,"LastUpdatedDate":"2025-02-13T09:56:36.38+02:00"}
{"Id":160613,"Number":106,"KnessetNum":13,"Name":"ישיבת מליאה בתאריך 21/06/1993 בשעה 16:02","StartDate":"1993-06-21T16:02:00+03:00","FinishDate":"1993-06-21T21:14:00+03:00","IsSpecialMeeting":null,"LastUpdatedDate":"2025-02-13T10:19:25.427+02:00"}
{"Id":160615,"Number":108,"KnessetNum":13,"Name":"ישיבת מליאה בתאריך 23/06/1993 בשעה 11:00","StartDate":"1993-06-23T11:00:00+03:00","FinishDate":"1993-06-23T18:55:00+03:00","IsSpecialMeeting":null,"LastUpdatedDate":"2025-02-13T10:21:45.623+02:00"}
{"Id":160616,"Number":109,"KnessetNum":13,"Name":"ישיבת מליאה בתאריך 28/06/1993 בשעה 16:01","StartDate":"1993-06-28T16:01:00+03:00","FinishDate":"1993-06-28T20:40:00+03:00","IsSpecialMeeting":null,"LastUpdatedDate":"2025-02-13T10:22:19.067+02:00"}
{"Id":160619,"Number":112,"KnessetNum":13,"Name":"ישיבת מליאה בתאריך 05/07/1993 בשעה 16:01","StartDate":"1993-07-05T16:01:00+03:00","FinishDate":"1993-07-05T19:45:00+03:00","IsSpecialMeeting":null,"LastUpdatedDate":"2025-02-13T10:24:35.713+02:00"}
{"Id":160621,"Number":114,"KnessetNum":13,"Name":"ישיבת מליאה בתאריך 07/07/1993 בשעה 11:02","StartDate":"1993-07-07T11:02:00+03:00","FinishDate":"1993-07-07T21:22:00+03:00","IsSpecialMeeting":null,"LastUpdatedDate":"2025-02-13T10:27:36.21+02:00"}
{"Id":160622,"Number":115,"KnessetNum":13,"Name":"ישיבת מליאה בתאריך 12/07/1993 בשעה 16:03","StartDate":"1993-07-12T16:03:00+03:00","FinishDate":"1993-07-12T21:38:00+03:00","IsSpecialMeeting":null,"LastUpdatedDate":"2025-02-13T10:28:13.08+02:00"}
{"Id":160623,"Number":116,"KnessetNum":13,"Name":"ישיבת מליאה בתאריך 13/07/1993 בשעה 16:03","StartDate":"1993-07-13T16:03:00+03:00","FinishDate":"1993-07-13T20:51:00+03:00","IsSpecialMeeting":null,"LastUpdatedDate":"2025-02-13T10:29:46.71+02:00"}
{"Id":160624,"Number":117,"KnessetNum":13,"Name":"ישיבת מליאה בתאריך 14/07/1993 בשעה 11:02","StartDate":"1993-07-14T11:02:00+03:00","FinishDate":"1993-07-14T20:07:00+03:00","IsSpecialMeeting":null,"LastUpdatedDate":"2025-02-13T10:30:31.3+02:00"}
{"Id":160625,"Number":118,"KnessetNum":13,"Name":"ישיבת מליאה בתאריך 19/07/1993 בשעה 16:02","StartDate":"1993-07-19T16:02:00+03:00","FinishDate":"1993-07-19T20:02:00+03:00","IsSpecialMeeting":null,"LastUpdatedDate":"2025-02-13T10:31:05.2+02:00"}
{"Id":160628,"Number":121,"KnessetNum":13,"Name":"ישיבת מליאה בתאריך 28/07/1993 בשעה 14:04","StartDate":"1993-07-28T14:04:00+03:00","FinishDate":"1993-07-28T21:52:00+03:00","IsSpecialMeeting":null,"LastUpdatedDate":"2025-02-13T10:33:34.473+02:00"}
{"Id":160631,"Number":124,"KnessetNum":13,"Name":"ישיבת מליאה בתאריך 03/08/1993 בשעה 16:01","StartDate":"1993-08-03T16:01:00+03:00","FinishDate":"1993-08-04T03:00:00+03:00","IsSpecialMeeting":null,"LastUpdatedDate":"2025-02-13T11:08:14.29+02:00"}
{"Id":160633,"Number":126,"KnessetNum":13,"Name":"ישיבת מליאה בתאריך 17/08/1993 בשעה 11:02","StartDate":"1993-08-17T11:02:00+03:00","FinishDate":"1993-08-17T16:09:00+03:00","IsSpecialMeeting":true,"LastUpdatedDate":"2025-02-13T11:09:51.31+02:00"}
{"Id":160639,"Number":137,"KnessetNum":13,"Name":"ישיבת מליאה בתאריך 20/10/1993 בשעה 11:02","StartDate":"1993-10-20T11:02:00+02:00","FinishDate":"1993-10-20T20:40:00+02:00","IsSpecialMeeting":null,"LastUpdatedDate":"2025-02-13T11:38:51.16+02:00"}
{"Id":160640,"Number":138,"KnessetNum":13,"Name":"ישיבת מליאה בתאריך 25/10/1993 בשעה 16:02","StartDate":"1993-10-25T16:02:00+02:00","FinishDate":"1993-10-25T20:31:00+02:00","IsSpecialMeeting":null,"LastUpdatedDate":"2025-02-13T11:40:03.673+02:00"}
{"Id":160642,"Number":141,"KnessetNum":13,"Name":"ישיבת מליאה בתאריך 01/11/1993 בשעה 16:02","StartDate":"1993-11-01T16:02:00+02:00","FinishDate":"1993-11-01T19:36:00+02:00","IsSpecialMeeting":null,"LastUpdatedDate":"2025-02-13T11:45:45.077+02:00"}
{"Id":160644,"Number":143,"KnessetNum":13,"Name":"ישיבת מליאה בתאריך 03/11/1993 בשעה 11:01","StartDate":"1993-11-03T11:01:00+02:00","FinishDate":"1993-11-03T17:28:00+02:00","IsSpecialMeeting":null,"LastUpdatedDate":"2025-02-13T11:47:02.22+02:00"}
{"Id":160645,"Number":144,"KnessetNum":13,"Name":"ישיבת מליאה בתאריך 08/11/1993 בשעה 16:02","StartDate":"1993-11-08T16:02:00+02:00","FinishDate":"1993-11-08T21:42:00+02:00","IsSpecialMeeting":null,"LastUpdatedDate":"2025-02-13T11:47:59.24+02:00"}
{"Id":160646,"Number":145,"KnessetNum":13,"Name":"ישיבת מליאה בתאריך 09/11/1993 בשעה 16:15","StartDate":"1993-11-09T16:15:00+02:00","FinishDate":"1993-11-09T22:37:00+02:00","IsSpecialMeeting":null,"LastUpdatedDate":"2025-02-13T11:48:34.107+02:00"}
{"Id":160648,"Number":147,"KnessetNum":13,"Name":"ישיבת מליאה בתאריך 15/11/1993 בשעה 16:03","StartDate":"1993-11-15T16:03:00+02:00","FinishDate":"1993-11-15T21:09:00+02:00","IsSpecialMeeting":null,"LastUpdatedDate":"2025-02-13T11:50:17.01+02:00"}
{"Id":160652,"Number":151,"KnessetNum":13,"Name":"ישיבת מליאה בתאריך 23/11/1993 בשעה 16:01","StartDate":"1993-11-23T16:01:00+02:00","FinishDate":"1993-11-23T23:25:00+02:00","IsSpecialMeeting":null,"LastUpdatedDate":"2025-02-13T12:17:48.557+02:00"}
{"Id":160655,"Number":154,"KnessetNum":13,"Name":"ישיבת מליאה בתאריך 30/11/1993 בשעה 16:02","StartDate":"1993-11-30T16:02:00+02:00","FinishDate":"1993-11-30T20:39:00+02:00","IsSpecialMeeting":null,"LastUpdatedDate":"2025-02-13T12:20:03.287+02:00"}
{"Id":160658,"Number":157,"KnessetNum":13,"Name":"ישיבת מליאה בתאריך 07/12/1993 בשעה 16:10","StartDate":"1993-12-07T16:10:00+02:00","FinishDate":"1993-12-07T20:46:00+02:00","IsSpecialMeeting":null,"LastUpdatedDate":"2025-02-13T12:22:10.05+02:00"}
{"Id":160661,"Number":160,"KnessetNum":13,"Name":"ישיבת מליאה בתאריך 14/12/1993 בשעה 16:01","StartDate":"1993-12-14T16:01:00+02:00","FinishDate":"1993-12-14T20:48:00+02:00","IsSpecialMeeting":null,"LastUpdatedDate":"2025-02-13T12:23:46.157+02:00"}
{"Id":160662,"Number":161,"KnessetNum":13,"Name":"ישיבת מליאה בתאריך 15/12/1993 בשעה 11:00","StartDate":"1993-12-15T11:00:00+02:00","FinishDate":"1993-12-15T19:24:00+02:00","IsSpecialMeeting":null,"LastUpdatedDate":"2025-02-13T12:24:46.077+02:00"}
{"Id":160665,"Number":165,"KnessetNum":13,"Name":"ישיבת מליאה בתאריך 27/12/1993 בשעה 10:01","StartDate":"1993-12-27T10:01:00+02:00","FinishDate":"1993-12-28T00:11:00+02:00","IsSpecialMeeting":null,"LastUpdatedDate":"2025-02-13T12:30:35.817+02:00"}
{"Id":160666,"Number":166,"KnessetNum":13,"Name":"ישיבת מליאה בתאריך 28/12/1993 בשעה 10:01","StartDate":"1993-12-28T10:01:00+02:00","FinishDate":"1993-12-29T00:53:00+02:00","IsSpecialMeeting":null,"LastUpdatedDate":"2025-02-13T12:31:17.08+02:00"}
{"Id":160667,"Number":168,"KnessetNum":13,"Name":"ישיבת מליאה בתאריך 30/12/1993 בשעה 09:02","StartDate":"1993-12-30T09:02:00+02:00","FinishDate":"1993-12-31T01:43:00+02:00","IsSpecialMeeting":null,"LastUpdatedDate":"2025-02-13T12:33:20.267+02:00"}
{"Id":160670,"Number":170,"KnessetNum":13,"Name":"ישיבת מליאה בתאריך 04/01/1994 בשעה 16:02","StartDate":"1994-01-04T16:02:00+02:00","FinishDate":"1994-01-04T21:33:00+02:00","IsSpecialMeeting":null,"LastUpdatedDate":"2025-02-13T12:35:29.453+02:00"}
{"Id":160676,"Number":176,"KnessetNum":13,"Name":"ישיבת מליאה בתאריך 18/01/1994 בשעה 16:00","StartDate":"1994-01-18T16:00:00+02:00","FinishDate":"1994-01-18T21:28:00+02:00","IsSpecialMeeting":null,"LastUpdatedDate":"2025-02-13T13:37:39.513+02:00"}
{"Id":160681,"Number":181,"KnessetNum":13,"Name":"ישיבת מליאה בתאריך 31/01/1994 בשעה 16:02","StartDate":"1994-01-31T16:02:00+02:00","FinishDate":"1994-01-31T21:19:00+02:00","IsSpecialMeeting":null,"LastUpdatedDate":"2025-02-13T13:40:38.013+02:00"}
{"Id":160683,"Number":183,"KnessetNum":13,"Name":"ישיבת מליאה בתאריך 02/02/1994 בשעה 11:02","StartDate":"1994-02-02T11:02:00+02:00","FinishDate":"1994-02-02T17:42:00+02:00","IsSpecialMeeting":null,"LastUpdatedDate":"2025-02-13T13:41:52.49+02:00"}
{"Id":160686,"Number":185,"KnessetNum":13,"Name":"ישיבת מליאה בתאריך 08/02/1994 בשעה 16:01","StartDate":"1994-02-08T16:01:00+02:00","FinishDate":"1994-02-08T21:11:00+02:00","IsSpecialMeeting":null,"LastUpdatedDate":"2025-02-13T13:43:11.783+02:00"}
{"Id":160687,"Number":186,"KnessetNum":13,"Name":"ישיבת מליאה בתאריך 09/02/1994 בשעה 11:01","StartDate":"1994-02-09T11:01:00+02:00","FinishDate":"1994-02-09T20:40:00+02:00","IsSpecialMeeting":null,"LastUpdatedDate":"2025-02-13T13:43:46.68+02:00"}
{"Id":160688,"Number":187,"KnessetNum":13,"Name":"ישיבת מליאה בתאריך 14/02/1994 בשעה 16:01","StartDate":"1994-02-14T16:01:00+02:00","FinishDate":"1994-02-14T21:13:00+02:00","IsSpecialMeeting":null,"LastUpdatedDate":"2025-02-13T13:44:27.58+02:00"}
{"Id":160689,"Number":188,"KnessetNum":13,"Name":"ישיבת מליאה בתאריך 15/02/1994 בשעה 16:00","StartDate":"1994-02-15T16:00:00+02:00","FinishDate":"1994-02-15T21:20:00+02:00","IsSpecialMeeting":null,"LastUpdatedDate":"2025-02-13T13:50:45.04+02:00"}
{"Id":160690,"Number":189,"KnessetNum":13,"Name":"ישיבת מליאה בתאריך 16/02/1994 בשעה 11:00","StartDate":"1994-02-16T11:00:00+02:00","FinishDate":"1994-02-16T22:38:00+02:00","IsSpecialMeeting":null,"LastUpdatedDate":"2025-02-13T13:51:51.123+02:00"}
{"Id":160691,"Number":190,"KnessetNum":13,"Name":"ישיבת מליאה בתאריך 21/02/1994 בשעה 16:02","StartDate":"1994-02-21T16:02:00+02:00","FinishDate":"1994-02-21T22:58:00+02:00","IsSpecialMeeting":null,"LastUpdatedDate":"2025-02-13T13:52:37.94+02:00"}
{"Id":160692,"Number":191,"KnessetNum":13,"Name":"ישיבת מליאה בתאריך 22/02/1994 בשעה 16:02","StartDate":"1994-02-22T16:02:00+02:00","FinishDate":"1994-02-22T22:48:00+02:00","IsSpecialMeeting":null,"LastUpdatedDate":"2025-02-13T13:54:03.69+02:00"}
{"Id":160693,"Number":192,"KnessetNum":13,"Name":"ישיבת מליאה בתאריך 23/02/1994 בשעה 11:01","StartDate":"1994-02-23T11:01:00+02:00","FinishDate":"1994-02-23T16:20:00+02:00","IsSpecialMeeting":null,"LastUpdatedDate":"2025-02-13T13:54:40.723+02:00"}
{"Id":160696,"Number":195,"KnessetNum":13,"Name":"ישיבת מליאה בתאריך 02/03/1994 בשעה 11:01","StartDate":"1994-03-02T11:01:00+02:00","FinishDate":"1994-03-02T21:35:00+02:00","IsSpecialMeeting":null,"LastUpdatedDate":"2025-02-13T13:58:00.543+02:00"}
{"Id":160699,"Number":198,"KnessetNum":13,"Name":"ישיבת מליאה בתאריך 09/03/1994 בשעה 11:01","StartDate":"1994-03-09T11:01:00+02:00","FinishDate":"1994-03-09T23:28:00+02:00","IsSpecialMeeting":null,"LastUpdatedDate":"2025-02-13T14:02:50.587+02:00"}
{"Id":160700,"Number":199,"KnessetNum":13,"Name":"ישיבת מליאה בתאריך 14/03/1994 בשעה 10:03","StartDate":"1994-03-14T10:03:00+02:00","FinishDate":"1994-03-15T01:42:00+02:00","IsSpecialMeeting":null,"LastUpdatedDate":"2025-02-13T14:03:39.797+02:00"}
{"Id":160702,"Number":201,"KnessetNum":13,"Name":"ישיבת מליאה בתאריך 16/03/1994 בשעה 09:01","StartDate":"1994-03-16T09:01:00+02:00","FinishDate":"1994-03-17T06:45:00+02:00","IsSpecialMeeting":null,"LastUpdatedDate":"2025-02-13T14:05:49.81+02:00"}
{"Id":160705,"Number":206,"KnessetNum":13,"Name":"ישיבת מליאה בתאריך 20/04/1994 בשעה 11:01","StartDate":"1994-04-20T11:01:00+03:00","FinishDate":"1994-04-20T17:35:00+03:00","IsSpecialMeeting":null,"LastUpdatedDate":"2025-02-13T14:09:46.197+02:00"}
{"Id":160707,"Number":208,"KnessetNum":13,"Name":"ישיבת מליאה בתאריך 26/04/1994 בשעה 16:00","StartDate":"1994-04-26T16:00:00+03:00","FinishDate":"1994-04-26T21:43:00+03:00","IsSpecialMeeting":null,"LastUpdatedDate":"2025-02-13T14:11:28.023+02:00"}
{"Id":160709,"Number":210,"KnessetNum":13,"Name":"ישיבת מליאה בתאריך 02/05/1994 בשעה 16:02","StartDate":"1994-05-02T16:02:00+03:00","FinishDate":"1994-05-03T00:03:00+03:00","IsSpecialMeeting":null,"LastUpdatedDate":"2025-02-13T14:12:52.92+02:00"}
{"Id":160711,"Number":212,"KnessetNum":13,"Name":"ישיבת מליאה בתאריך 04/05/1994 בשעה 11:00","StartDate":"1994-05-04T11:00:00+03:00","FinishDate":"1994-05-04T17:15:00+03:00","IsSpecialMeeting":null,"LastUpdatedDate":"2025-02-16T08:30:39.697+02:00"}
{"Id":160712,"Number":213,"KnessetNum":13,"Name":"ישיבת מליאה בתאריך 09/05/1994 בשעה 16:02","StartDate":"1994-05-09T16:02:00+03:00","FinishDate":"1994-05-09T21:18:00+03:00","IsSpecialMeeting":null,"LastUpdatedDate":"2025-02-16T08:31:30.54+02:00"}
{"Id":160715,"Number":217,"KnessetNum":13,"Name":"ישיבת מליאה בתאריך 18/05/1994 בשעה 16:00","StartDate":"1994-05-18T16:00:00+03:00","FinishDate":"1994-05-18T20:45:00+03:00","IsSpecialMeeting":null,"LastUpdatedDate":"2025-02-16T08:34:02.23+02:00"}
{"Id":160719,"Number":220,"KnessetNum":13,"Name":"ישיבת מליאה בתאריך 24/05/1994 בשעה 16:01","StartDate":"1994-05-24T16:01:00+03:00","FinishDate":"1994-05-24T22:25:00+03:00","IsSpecialMeeting":null,"LastUpdatedDate":"2025-02-16T08:35:30.627+02:00"}
{"Id":160720,"Number":221,"KnessetNum":13,"Name":"ישיבת מליאה בתאריך 25/05/1994 בשעה 11:03","StartDate":"1994-05-25T11:03:00+03:00","FinishDate":"1994-05-25T19:00:00+03:00","IsSpecialMeeting":null,"LastUpdatedDate":"2025-02-16T08:36:00.057+02:00"}
{"Id":160731,"Number":232,"KnessetNum":13,"Name":"ישיבת מליאה בתאריך 21/06/1994 בשעה 16:04","StartDate":"1994-06-21T16:04:00+03:00","FinishDate":"1994-06-21T20:58:00+03:00","IsSpecialMeeting":null,"LastUpdatedDate":"2025-02-16T08:42:14.363+02:00"}
{"Id":160732,"Number":233,"KnessetNum":13,"Name":"ישיבת מליאה בתאריך 22/06/1994 בשעה 11:02","StartDate":"1994-06-22T11:02:00+03:00","FinishDate":"1994-06-22T22:43:00+03:00","IsSpecialMeeting":null,"LastUpdatedDate":"2025-02-16T08:44:06.29+02:00"}
{"Id":160737,"Number":237,"KnessetNum":13,"Name":"ישיבת מליאה בתאריך 04/07/1994 בשעה 15:02","StartDate":"1994-07-04T15:02:00+03:00","FinishDate":"1994-07-05T23:11:00+03:00","IsSpecialMeeting":null,"LastUpdatedDate":"2025-02-16T09:09:24.43+02:00"}
{"Id":160739,"Number":240,"KnessetNum":13,"Name":"ישיבת מליאה בתאריך 11/07/1994 בשעה 16:02","StartDate":"1994-07-11T16:02:00+03:00","FinishDate":"1994-07-11T23:25:00+03:00","IsSpecialMeeting":null,"LastUpdatedDate":"2025-02-16T09:21:15.77+02:00"}
{"Id":160742,"Number":243,"KnessetNum":13,"Name":"ישיבת מליאה בתאריך 18/07/1994 בשעה 16:02","StartDate":"1994-07-18T16:02:00+03:00","FinishDate":"1994-07-18T21:09:00+03:00","IsSpecialMeeting":null,"LastUpdatedDate":"2025-02-16T09:23:09.873+02:00"}
{"Id":160743,"Number":244,"KnessetNum":13,"Name":"ישיבת מליאה בתאריך 19/07/1994 בשעה 16:01","StartDate":"1994-07-19T16:01:00+03:00","FinishDate":"1994-07-20T00:12:00+03:00","IsSpecialMeeting":null,"LastUpdatedDate":"2025-02-16T09:23:55.783+02:00"}
{"Id":160745,"Number":246,"KnessetNum":13,"Name":"ישיבת מליאה בתאריך 25/07/1994 בשעה 16:01","StartDate":"1994-07-25T16:01:00+03:00","FinishDate":"1994-07-26T02:37:00+03:00","IsSpecialMeeting":null,"LastUpdatedDate":"2025-02-16T09:28:47.307+02:00"}
{"Id":160746,"Number":247,"KnessetNum":13,"Name":"ישיבת מליאה בתאריך 26/07/1994 בשעה 15:01","StartDate":"1994-07-26T15:01:00+03:00","FinishDate":"1994-07-27T01:19:00+03:00","IsSpecialMeeting":null,"LastUpdatedDate":"2025-02-16T09:29:50.05+02:00"}
{"Id":160747,"Number":248,"KnessetNum":13,"Name":"ישיבת מליאה בתאריך 27/07/1994 בשעה 09:07","StartDate":"1994-07-27T09:07:00+03:00","FinishDate":"1994-07-27T23:06:00+03:00","IsSpecialMeeting":null,"LastUpdatedDate":"2025-02-16T09:31:11.403+02:00"}
{"Id":160750,"Number":253,"KnessetNum":13,"Name":"ישיבת מליאה בתאריך 04/10/1994 בשעה 16:02","StartDate":"1994-10-04T16:02:00+02:00","FinishDate":"1994-10-04T22:13:00+02:00","IsSpecialMeeting":null,"LastUpdatedDate":"2025-02-16T09:48:54.527+02:00"}
{"Id":160753,"Number":256,"KnessetNum":13,"Name":"ישיבת מליאה בתאריך 11/10/1994 בשעה 16:02","StartDate":"1994-10-11T16:02:00+02:00","FinishDate":"1994-10-12T00:59:00+02:00","IsSpecialMeeting":null,"LastUpdatedDate":"2025-02-16T10:02:15.443+02:00"}
{"Id":160756,"Number":259,"KnessetNum":13,"Name":"ישיבת מליאה בתאריך 18/10/1994 בשעה 16:03","StartDate":"1994-10-18T16:03:00+02:00","FinishDate":"1994-10-18T20:55:00+02:00","IsSpecialMeeting":null,"LastUpdatedDate":"2025-02-16T10:03:56.01+02:00"}
{"Id":160759,"Number":262,"KnessetNum":13,"Name":"ישיבת מליאה בתאריך 25/10/1994 בשעה 09:00","StartDate":"1994-10-25T09:00:00+02:00","FinishDate":"1994-10-25T22:25:00+02:00","IsSpecialMeeting":null,"LastUpdatedDate":"2025-02-16T10:06:48.073+02:00"}
{"Id":160761,"Number":265,"KnessetNum":13,"Name":"ישיבת מליאה בתאריך 31/10/1994 בשעה 16:00","StartDate":"1994-10-31T16:00:00+02:00","FinishDate":"1994-10-31T21:34:00+02:00","IsSpecialMeeting":null,"LastUpdatedDate":"2025-02-16T10:13:32.99+02:00"}
{"Id":160762,"Number":266,"KnessetNum":13,"Name":"ישיבת מליאה בתאריך 01/11/1994 בשעה 16:01","StartDate":"1994-11-01T16:01:00+02:00","FinishDate":"1994-11-01T21:45:00+02:00","IsSpecialMeeting":null,"LastUpdatedDate":"2025-02-16T10:14:11.23+02:00"}
{"Id":160763,"Number":267,"KnessetNum":13,"Name":"ישיבת מליאה בתאריך 02/11/1994 בשעה 09:01","StartDate":"1994-11-02T09:01:00+02:00","FinishDate":"1994-11-03T10:51:00+02:00","IsSpecialMeeting":null,"LastUpdatedDate":"2025-02-16T10:16:32.37+02:00"}
{"Id":160767,"Number":270,"KnessetNum":13,"Name":"ישיבת מליאה בתאריך 09/11/1994 בשעה 11:02","StartDate":"1994-11-09T11:02:00+02:00","FinishDate":"1994-11-09T22:23:00+02:00","IsSpecialMeeting":null,"LastUpdatedDate":"2025-02-16T10:18:06.74+02:00"}
{"Id":160770,"Number":273,"KnessetNum":13,"Name":"ישיבת מליאה בתאריך 16/11/1994 בשעה 11:02","StartDate":"1994-11-16T11:02:00+02:00","FinishDate":"1994-11-16T21:44:00+02:00","IsSpecialMeeting":null,"LastUpdatedDate":"2025-02-16T10:46:10.953+02:00"}
{"Id":160771,"Number":274,"KnessetNum":13,"Name":"ישיבת מליאה בתאריך 21/11/1994 בשעה 16:01","StartDate":"1994-11-21T16:01:00+02:00","FinishDate":"1994-11-22T01:17:00+02:00","IsSpecialMeeting":null,"LastUpdatedDate":"2025-02-16T10:47:09.797+02:00"}
{"Id":160773,"Number":276,"KnessetNum":13,"Name":"ישיבת מליאה בתאריך 23/11/1994 בשעה 16:08","StartDate":"1994-11-23T16:08:00+02:00","FinishDate":"1994-11-23T21:08:00+02:00","IsSpecialMeeting":null,"LastUpdatedDate":"2025-02-16T10:49:24.56+02:00"}
{"Id":160774,"Number":277,"KnessetNum":13,"Name":"ישיבת מליאה בתאריך 28/11/1994 בשעה 16:04","StartDate":"1994-11-28T16:04:00+02:00","FinishDate":"1994-11-28T19:34:00+02:00","IsSpecialMeeting":null,"LastUpdatedDate":"2025-02-16T10:50:15.083+02:00"}
{"Id":160775,"Number":278,"KnessetNum":13,"Name":"ישיבת מליאה בתאריך 29/11/1994 בשעה 16:02","StartDate":"1994-11-29T16:02:00+02:00","FinishDate":"1994-11-29T21:08:00+02:00","IsSpecialMeeting":null,"LastUpdatedDate":"2025-02-16T10:51:55.517+02:00"}
{"Id":160777,"Number":280,"KnessetNum":13,"Name":"ישיבת מליאה בתאריך 05/12/1994 בשעה 16:02","StartDate":"1994-12-05T16:02:00+02:00","FinishDate":"1994-12-05T23:34:00+02:00","IsSpecialMeeting":null,"LastUpdatedDate":"2019-12-12T14:14:39.433+02:00"}
{"Id":160782,"Number":285,"KnessetNum":13,"Name":"ישיבת מליאה בתאריך 14/12/1994 בשעה 11:00","StartDate":"1994-12-14T11:00:00+02:00","FinishDate":"1994-12-14T19:12:00+02:00","IsSpecialMeeting":null,"LastUpdatedDate":"2025-02-16T11:01:11.16+02:00"}
{"Id":160783,"Number":286,"KnessetNum":13,"Name":"ישיבת מליאה בתאריך 19/12/1994 בשעה 16:00","StartDate":"1994-12-19T16:00:00+02:00","FinishDate":"1994-12-19T22:20:00+02:00","IsSpecialMeeting":null,"LastUpdatedDate":"2025-02-16T11:08:08.51+02:00"}
{"Id":160786,"Number":289,"KnessetNum":13,"Name":"ישיבת מליאה בתאריך 26/12/1994 בשעה 16:01","StartDate":"1994-12-26T16:01:00+02:00","FinishDate":"1994-12-27T00:57:00+02:00","IsSpecialMeeting":null,"LastUpdatedDate":"2025-02-16T11:06:05.287+02:00"}
{"Id":160787,"Number":290,"KnessetNum":13,"Name":"ישיבת מליאה בתאריך 27/12/1994 בשעה 15:00","StartDate":"1994-12-27T15:00:00+02:00","FinishDate":"1994-12-28T01:04:00+02:00","IsSpecialMeeting":null,"LastUpdatedDate":"2025-02-16T11:09:09.657+02:00"}
{"Id":160788,"Number":292,"KnessetNum":13,"Name":"ישיבת מליאה בתאריך 29/12/1994 בשעה 10:46","StartDate":"1994-12-29T10:46:00+02:00","FinishDate":"1994-12-30T03:37:00+02:00","IsSpecialMeeting":null,"LastUpdatedDate":"2025-02-16T11:45:33.067+02:00"}
{"Id":160790,"Number":293,"KnessetNum":13,"Name":"ישיבת מליאה בתאריך 02/01/1995 בשעה 16:03","StartDate":"1995-01-02T16:03:00+02:00","FinishDate":"1995-01-02T21:29:00+02:00","IsSpecialMeeting":null,"LastUpdatedDate":"2025-02-16T11:46:15.653+02:00"}
{"Id":160791,"Number":294,"KnessetNum":13,"Name":"ישיבת מליאה בתאריך 03/01/1995 בשעה 15:00","StartDate":"1995-01-03T15:00:00+02:00","FinishDate":"1995-01-03T22:55:00+02:00","IsSpecialMeeting":null,"LastUpdatedDate":"2025-02-16T11:46:53.08+02:00"}
{"Id":160792,"Number":295,"KnessetNum":13,"Name":"ישיבת מליאה בתאריך 04/01/1995 בשעה 11:03","StartDate":"1995-01-04T11:03:00+02:00","FinishDate":"1995-01-04T19:57:00+02:00","IsSpecialMeeting":null,"LastUpdatedDate":"2025-02-16T11:47:31.507+02:00"}
{"Id":160793,"Number":296,"KnessetNum":13,"Name":"ישיבת מליאה בתאריך 09/01/1995 בשעה 16:03","StartDate":"1995-01-09T16:03:00+02:00","FinishDate":"1995-01-09T21:39:00+02:00","IsSpecialMeeting":null,"LastUpdatedDate":"2025-02-16T11:50:12.567+02:00"}
{"Id":160795,"Number":298,"KnessetNum":13,"Name":"ישיבת מליאה בתאריך 11/01/1995 בשעה 11:01","StartDate":"1995-01-11T11:01:00+02:00","FinishDate":"1995-01-11T20:32:00+02:00","IsSpecialMeeting":null,"LastUpdatedDate":"2025-02-16T11:51:34.94+02:00"}
{"Id":160798,"Number":302,"KnessetNum":13,"Name":"ישיבת מליאה בתאריך 23/01/1995 בשעה 16:01","StartDate":"1995-01-23T16:01:00+02:00","FinishDate":"1995-01-23T20:43:00+02:00","IsSpecialMeeting":null,"LastUpdatedDate":"2025-02-16T11:54:57.73+02:00"}
{"Id":160805,"Number":309,"KnessetNum":13,"Name":"ישיבת מליאה בתאריך 07/02/1995 בשעה 15:01","StartDate":"1995-02-07T15:01:00+02:00","FinishDate":"1995-02-07T20:52:00+02:00","IsSpecialMeeting":null,"LastUpdatedDate":"2025-02-16T13:10:44.607+02:00"}
{"Id":160807,"Number":311,"KnessetNum":13,"Name":"ישיבת מליאה בתאריך 13/02/1995 בשעה 16:02","StartDate":"1995-02-13T16:02:00+02:00","FinishDate":"1995-02-13T20:53:00+02:00","IsSpecialMeeting":null,"LastUpdatedDate":"2025-02-16T13:12:42.567+02:00"}
{"Id":160808,"Number":312,"KnessetNum":13,"Name":"ישיבת מליאה בתאריך 14/02/1995 בשעה 15:03","StartDate":"1995-02-14T15:03:00+02:00","FinishDate":"1995-02-14T20:47:00+02:00","IsSpecialMeeting":null,"LastUpdatedDate":"2025-02-16T13:15:06.93+02:00"}
{"Id":160810,"Number":314,"KnessetNum":13,"Name":"ישיבת מליאה בתאריך 20/02/1995 בשעה 16:01","StartDate":"1995-02-20T16:01:00+02:00","FinishDate":"1995-02-20T21:51:00+02:00","IsSpecialMeeting":null,"LastUpdatedDate":"2019-12-16T11:42:18.47+02:00"}
{"Id":160812,"Number":316,"KnessetNum":13,"Name":"ישיבת מליאה בתאריך 22/02/1995 בשעה 11:03","StartDate":"1995-02-22T11:03:00+02:00","FinishDate":"1995-02-22T20:10:00+02:00","IsSpecialMeeting":null,"LastUpdatedDate":"2025-02-16T13:18:21.273+02:00"}
{"Id":160817,"Number":321,"KnessetNum":13,"Name":"ישיבת מליאה בתאריך 07/03/1995 בשעה 15:00","StartDate":"1995-03-07T15:00:00+02:00","FinishDate":"1995-03-08T02:17:00+02:00","IsSpecialMeeting":null,"LastUpdatedDate":"2025-02-16T13:26:47.857+02:00"}
{"Id":160818,"Number":322,"KnessetNum":13,"Name":"ישיבת מליאה בתאריך 08/03/1995 בשעה 11:00","StartDate":"1995-03-08T11:00:00+02:00","FinishDate":"1995-03-08T20:30:00+02:00","IsSpecialMeeting":null,"LastUpdatedDate":"2025-02-16T13:32:02.27+02:00"}
{"Id":160826,"Number":330,"KnessetNum":13,"Name":"ישיבת מליאה בתאריך 28/03/1995 בשעה 16:00","StartDate":"1995-03-28T16:00:00+02:00","FinishDate":"1995-03-28T21:57:00+02:00","IsSpecialMeeting":null,"LastUpdatedDate":"2025-02-16T14:19:46.193+02:00"}
{"Id":160829,"Number":333,"KnessetNum":13,"Name":"ישיבת מליאה בתאריך 03/04/1995 בשעה 15:00","StartDate":"1995-04-03T15:00:00+02:00","FinishDate":"1995-04-04T00:55:00+02:00","IsSpecialMeeting":null,"LastUpdatedDate":"2025-02-16T14:33:39.877+02:00"}
{"Id":160831,"Number":337,"KnessetNum":13,"Name":"ישיבת מליאה בתאריך 15/05/1995 בשעה 16:02","StartDate":"1995-05-15T16:02:00+03:00","FinishDate":"1995-05-15T19:58:00+03:00","IsSpecialMeeting":null,"LastUpdatedDate":"2025-02-16T14:37:58.283+02:00"}
{"Id":160844,"Number":349,"KnessetNum":13,"Name":"ישיבת מליאה בתאריך 12/06/1995 בשעה 16:01","StartDate":"1995-06-12T16:01:00+03:00","FinishDate":"1995-06-12T20:17:00+03:00","IsSpecialMeeting":null,"LastUpdatedDate":"2025-02-16T15:12:07.857+02:00"}
{"Id":160847,"Number":352,"KnessetNum":13,"Name":"ישיבת מליאה בתאריך 19/06/1995 בשעה 16:00","StartDate":"1995-06-19T16:00:00+03:00","FinishDate":"1995-06-19T20:53:00+03:00","IsSpecialMeeting":null,"LastUpdatedDate":"2025-02-16T15:14:10.513+02:00"}
{"Id":160848,"Number":353,"KnessetNum":13,"Name":"ישיבת מליאה בתאריך 20/06/1995 בשעה 15:02","StartDate":"1995-06-20T15:02:00+03:00","FinishDate":"1995-06-20T20:13:00+03:00","IsSpecialMeeting":null,"LastUpdatedDate":"2025-02-16T15:19:31.22+02:00"}
{"Id":160851,"Number":356,"KnessetNum":13,"Name":"ישיבת מליאה בתאריך 27/06/1995 בשעה 15:00","StartDate":"1995-06-27T15:00:00+03:00","FinishDate":"1995-06-28T00:14:00+03:00","IsSpecialMeeting":null,"LastUpdatedDate":"2025-02-16T15:23:35.293+02:00"}
{"Id":160855,"Number":360,"KnessetNum":13,"Name":"ישיבת מליאה בתאריך 05/07/1995 בשעה 11:00","StartDate":"1995-07-05T11:00:00+03:00","FinishDate":"1995-07-05T20:25:00+03:00","IsSpecialMeeting":null,"LastUpdatedDate":"2025-02-16T15:27:08.223+02:00"}
{"Id":160856,"Number":361,"KnessetNum":13,"Name":"ישיבת מליאה בתאריך 10/07/1995 בשעה 16:02","StartDate":"1995-07-10T16:02:00+03:00","FinishDate":"1995-07-10T21:38:00+03:00","IsSpecialMeeting":null,"LastUpdatedDate":"2025-02-16T15:59:23.427+02:00"}
{"Id":160857,"Number":362,"KnessetNum":13,"Name":"ישיבת מליאה בתאריך 11/07/1995 בשעה 15:00","StartDate":"1995-07-11T15:00:00+03:00","FinishDate":"1995-07-11T23:37:00+03:00","IsSpecialMeeting":null,"LastUpdatedDate":"2025-02-16T16:00:04.59+02:00"}
{"Id":160863,"Number":367,"KnessetNum":13,"Name":"ישיבת מליאה בתאריך 24/07/1995 בשעה 16:01","StartDate":"1995-07-24T16:01:00+03:00","FinishDate":"1995-07-24T21:46:00+03:00","IsSpecialMeeting":null,"LastUpdatedDate":"2025-02-16T16:06:59.513+02:00"}
{"Id":160865,"Number":369,"KnessetNum":13,"Name":"ישיבת מליאה בתאריך 26/07/1995 בשעה 11:02","StartDate":"1995-07-26T11:02:00+03:00","FinishDate":"1995-07-26T21:49:00+03:00","IsSpecialMeeting":null,"LastUpdatedDate":"2025-02-16T16:09:48.99+02:00"}
{"Id":160867,"Number":371,"KnessetNum":13,"Name":"ישיבת מליאה בתאריך 01/08/1995 בשעה 14:02","StartDate":"1995-08-01T14:02:00+03:00","FinishDate":"1995-08-02T02:08:00+03:00","IsSpecialMeeting":null,"LastUpdatedDate":"2020-04-30T12:26:03.893+03:00"}
{"Id":160868,"Number":372,"KnessetNum":13,"Name":"ישיבת מליאה בתאריך 02/08/1995 בשעה 11:00","StartDate":"1995-08-02T11:00:00+03:00","FinishDate":"1995-08-02T23:40:00+03:00","IsSpecialMeeting":null,"LastUpdatedDate":"2025-02-16T16:13:23.93+02:00"}
{"Id":160869,"Number":377,"KnessetNum":13,"Name":"ישיבת מליאה בתאריך 23/10/1995 בשעה 16:01","StartDate":"1995-10-23T16:01:00+02:00","FinishDate":"1995-10-23T21:14:00+02:00","IsSpecialMeeting":null,"LastUpdatedDate":"2025-02-16T16:19:38.473+02:00"}
{"Id":160872,"Number":380,"KnessetNum":13,"Name":"ישיבת מליאה בתאריך 30/10/1995 בשעה 16:04","StartDate":"1995-10-30T16:04:00+02:00","FinishDate":"1995-10-30T22:59:00+02:00","IsSpecialMeeting":null,"LastUpdatedDate":"2025-02-16T16:21:32.707+02:00"}
{"Id":160873,"Number":381,"KnessetNum":13,"Name":"ישיבת מליאה בתאריך 31/10/1995 בשעה 15:00","StartDate":"1995-10-31T15:00:00+02:00","FinishDate":"1995-10-31T18:25:00+02:00","IsSpecialMeeting":null,"LastUpdatedDate":"2025-02-23T08:44:01.683+02:00"}
{"Id":160876,"Number":384,"KnessetNum":13,"Name":"ישיבת מליאה בתאריך 14/11/1995 בשעה 15:03","StartDate":"1995-11-14T15:03:00+02:00","FinishDate":"1995-11-14T20:35:00+02:00","IsSpecialMeeting":null,"LastUpdatedDate":"2025-02-23T08:51:21.33+02:00"}
{"Id":160881,"Number":390,"KnessetNum":13,"Name":"ישיבת מליאה בתאריך 28/11/1995 בשעה 15:00","StartDate":"1995-11-28T15:00:00+02:00","FinishDate":"1995-11-28T20:02:00+02:00","IsSpecialMeeting":null,"LastUpdatedDate":"2025-02-23T09:28:10.183+02:00"}
{"Id":160886,"Number":396,"KnessetNum":13,"Name":"ישיבת מליאה בתאריך 12/12/1995 בשעה 15:00","StartDate":"1995-12-12T15:00:00+02:00","FinishDate":"1995-12-12T20:37:00+02:00","IsSpecialMeeting":null,"LastUpdatedDate":"2025-02-23T10:09:18.343+02:00"}
{"Id":160887,"Number":397,"KnessetNum":13,"Name":"ישיבת מליאה בתאריך 13/12/1995 בשעה 11:00","StartDate":"1995-12-13T11:00:00+02:00","FinishDate":"1995-12-13T20:29:00+02:00","IsSpecialMeeting":null,"LastUpdatedDate":"2025-02-23T10:13:03.38+02:00"}
{"Id":160888,"Number":398,"KnessetNum":13,"Name":"ישיבת מליאה בתאריך 18/12/1995 בשעה 15:01","StartDate":"1995-12-18T15:01:00+02:00","FinishDate":"1995-12-18T17:06:00+02:00","IsSpecialMeeting":null,"LastUpdatedDate":"2025-02-23T10:18:49.157+02:00"}
{"Id":160890,"Number":400,"KnessetNum":13,"Name":"ישיבת מליאה בתאריך 20/12/1995 בשעה 11:01","StartDate":"1995-12-20T11:01:00+02:00","FinishDate":"1995-12-20T17:37:00+02:00","IsSpecialMeeting":null,"LastUpdatedDate":"2019-12-16T11:50:34.897+02:00"}
{"Id":160892,"Number":401,"KnessetNum":13,"Name":"ישיבת מליאה בתאריך 25/12/1995 בשעה 16:02","StartDate":"1995-12-25T16:02:00+02:00","FinishDate":"1995-12-29T03:17:00+02:00","IsSpecialMeeting":null,"LastUpdatedDate":"2025-03-13T08:23:38.493+02:00"}
{"Id":160895,"Number":404,"KnessetNum":13,"Name":"ישיבת מליאה בתאריך 03/01/1996 בשעה 11:02","StartDate":"1996-01-03T11:02:00+02:00","FinishDate":"1996-01-03T19:16:00+02:00","IsSpecialMeeting":null,"LastUpdatedDate":"2025-02-23T11:27:51.66+02:00"}
{"Id":160898,"Number":407,"KnessetNum":13,"Name":"ישיבת מליאה בתאריך 10/01/1996 בשעה 11:01","StartDate":"1996-01-10T11:01:00+02:00","FinishDate":"1996-01-10T20:05:00+02:00","IsSpecialMeeting":null,"LastUpdatedDate":"2025-02-23T11:35:42.71+02:00"}
{"Id":160900,"Number":409,"KnessetNum":13,"Name":"ישיבת מליאה בתאריך 16/01/1996 בשעה 10:01","StartDate":"1996-01-16T10:01:00+02:00","FinishDate":"1996-01-16T23:33:00+02:00","IsSpecialMeeting":null,"LastUpdatedDate":"2025-02-23T11:40:59.563+02:00"}
{"Id":160901,"Number":410,"KnessetNum":13,"Name":"ישיבת מליאה בתאריך 17/01/1996 בשעה 11:00","StartDate":"1996-01-17T11:00:00+02:00","FinishDate":"1996-01-17T16:21:00+02:00","IsSpecialMeeting":null,"LastUpdatedDate":"2025-02-23T11:43:55.557+02:00"}
{"Id":160902,"Number":411,"KnessetNum":13,"Name":"ישיבת מליאה בתאריך 22/01/1996 בשעה 16:01","StartDate":"1996-01-22T16:01:00+02:00","FinishDate":"1996-01-22T21:16:00+02:00","IsSpecialMeeting":null,"LastUpdatedDate":"2025-02-23T11:44:45.617+02:00"}
{"Id":160903,"Number":412,"KnessetNum":13,"Name":"ישיבת מליאה בתאריך 23/01/1996 בשעה 15:01","StartDate":"1996-01-23T15:01:00+02:00","FinishDate":"1996-01-23T20:47:00+02:00","IsSpecialMeeting":null,"LastUpdatedDate":"2025-02-23T11:45:33.633+02:00"}
{"Id":160905,"Number":414,"KnessetNum":13,"Name":"ישיבת מליאה בתאריך 29/01/1996 בשעה 16:02","StartDate":"1996-01-29T16:02:00+02:00","FinishDate":"1996-01-29T20:57:00+02:00","IsSpecialMeeting":null,"LastUpdatedDate":"2025-02-23T11:47:05.133+02:00"}
{"Id":160909,"Number":417,"KnessetNum":13,"Name":"ישיבת מליאה בתאריך 05/02/1996 בשעה 16:00","StartDate":"1996-02-05T16:00:00+02:00","FinishDate":"1996-02-05T21:33:00+02:00","IsSpecialMeeting":null,"LastUpdatedDate":"2025-02-23T11:49:41.203+02:00"}
{"Id":160910,"Number":418,"KnessetNum":13,"Name":"ישיבת מליאה בתאריך 06/02/1996 בשעה 15:02","StartDate":"1996-02-06T15:02:00+02:00","FinishDate":"1996-02-06T18:58:00+02:00","IsSpecialMeeting":null,"LastUpdatedDate":"2025-02-23T11:50:49.687+02:00"}
{"Id":160913,"Number":421,"KnessetNum":13,"Name":"ישיבת מליאה בתאריך 13/02/1996 בשעה 15:02","StartDate":"1996-02-13T15:02:00+02:00","FinishDate":"1996-02-13T18:58:00+02:00","IsSpecialMeeting":null,"LastUpdatedDate":"2025-02-23T11:57:17.093+02:00"}
{"Id":160914,"Number":422,"KnessetNum":13,"Name":"ישיבת מליאה בתאריך 14/02/1996 בשעה 11:02","StartDate":"1996-02-14T11:02:00+02:00","FinishDate":"1996-02-14T17:50:00+02:00","IsSpecialMeeting":null,"LastUpdatedDate":"2025-02-23T12:08:01.837+02:00"}
{"Id":160916,"Number":423,"KnessetNum":13,"Name":"ישיבת מליאה בתאריך 19/02/1996 בשעה 16:01","StartDate":"1996-02-19T16:01:00+02:00","FinishDate":"1996-02-19T22:45:00+02:00","IsSpecialMeeting":null,"LastUpdatedDate":"2025-02-23T12:08:50.4+02:00"}
{"Id":160918,"Number":425,"KnessetNum":13,"Name":"ישיבת מליאה בתאריך 21/02/1996 בשעה 11:00","StartDate":"1996-02-21T11:00:00+02:00","FinishDate":"1996-02-21T20:27:00+02:00","IsSpecialMeeting":null,"LastUpdatedDate":"2025-02-12T16:06:09.123+02:00"}
{"Id":160919,"Number":426,"KnessetNum":13,"Name":"ישיבת מליאה בתאריך 26/02/1996 בשעה 16:02","StartDate":"1996-02-26T16:02:00+02:00","FinishDate":"1996-02-26T21:35:00+02:00","IsSpecialMeeting":null,"LastUpdatedDate":"2019-12-11T15:49:41.533+02:00"}
{"Id":160920,"Number":427,"KnessetNum":13,"Name":"ישיבת מליאה בתאריך 27/02/1996 בשעה 15:02","StartDate":"1996-02-27T15:02:00+02:00","FinishDate":"1996-02-27T19:55:00+02:00","IsSpecialMeeting":null,"LastUpdatedDate":"2025-02-23T12:07:16.81+02:00"}
{"Id":160921,"Number":428,"KnessetNum":13,"Name":"ישיבת מליאה בתאריך 28/02/1996 בשעה 11:04","StartDate":"1996-02-28T11:04:00+02:00","FinishDate":"1996-02-28T16:25:00+02:00","IsSpecialMeeting":null,"LastUpdatedDate":"2021-12-26T12:47:34.007+02:00"}
{"Id":160923,"Number":429,"KnessetNum":13,"Name":"ישיבת מליאה בתאריך 04/03/1996 בשעה 10:03","StartDate":"1996-03-04T10:03:00+02:00","FinishDate":"1996-03-04T12:20:00+02:00","IsSpecialMeeting":null,"LastUpdatedDate":"2025-02-23T12:09:38.46+02:00"}
{"Id":160924,"Number":430,"KnessetNum":13,"Name":"ישיבת מליאה בתאריך 07/03/1996 בשעה 10:03","StartDate":"1996-03-07T10:03:00+02:00","FinishDate":"1996-03-07T18:26:00+02:00","IsSpecialMeeting":null,"LastUpdatedDate":"2025-02-23T12:10:25.513+02:00"}
{"Id":160925,"Number":431,"KnessetNum":13,"Name":"ישיבת מליאה בתאריך 11/03/1996 בשעה 16:01","StartDate":"1996-03-11T16:01:00+02:00","FinishDate":"1996-03-11T23:16:00+02:00","IsSpecialMeeting":null,"LastUpdatedDate":"2025-02-23T12:21:27.38+02:00"}
{"Id":160926,"Number":432,"KnessetNum":13,"Name":"ישיבת מליאה בתאריך 12/03/1996 בשעה 15:03","StartDate":"1996-03-12T15:03:00+02:00","FinishDate":"1996-03-12T22:51:00+02:00","IsSpecialMeeting":null,"LastUpdatedDate":"2025-02-23T12:22:29.433+02:00"}
{"Id":160928,"Number":435,"KnessetNum":13,"Name":"ישיבת מליאה בתאריך 01/05/1996 בשעה 10:01","StartDate":"1996-05-01T10:01:00+03:00","FinishDate":"1996-05-01T22:26:00+03:00","IsSpecialMeeting":null,"LastUpdatedDate":"2025-02-23T12:30:13.5+02:00"}
{"Id":160931,"Number":10,"KnessetNum":14,"Name":"ישיבת מליאה בתאריך 10/07/1996 בשעה 11:01","StartDate":"1996-07-10T11:01:00+03:00","FinishDate":"1996-07-10T18:47:00+03:00","IsSpecialMeeting":null,"LastUpdatedDate":"2025-02-23T13:48:41.35+02:00"}
{"Id":160932,"Number":11,"KnessetNum":14,"Name":"ישיבת מליאה בתאריך 15/07/1996 בשעה 16:03","StartDate":"1996-07-15T16:03:00+03:00","FinishDate":"1996-07-15T19:50:00+03:00","IsSpecialMeeting":null,"LastUpdatedDate":"2025-02-23T13:54:32.423+02:00"}
{"Id":160935,"Number":15,"KnessetNum":14,"Name":"ישיבת מליאה בתאריך 23/07/1996 בשעה 16:02","StartDate":"1996-07-23T16:02:00+03:00","FinishDate":"1996-07-23T21:48:00+03:00","IsSpecialMeeting":null,"LastUpdatedDate":"2025-02-23T13:59:07.673+02:00"}
{"Id":160956,"Number":42,"KnessetNum":14,"Name":"ישיבת מליאה בתאריך 25/11/1996 בשעה 16:01","StartDate":"1996-11-25T16:01:00+02:00","FinishDate":"1996-11-25T19:15:00+02:00","IsSpecialMeeting":null,"LastUpdatedDate":"2020-06-11T15:02:20.157+03:00"}
{"Id":160959,"Number":46,"KnessetNum":14,"Name":"ישיבת מליאה בתאריך 03/12/1996 בשעה 16:03","StartDate":"1996-12-03T16:03:00+02:00","FinishDate":"1996-12-03T21:32:00+02:00","IsSpecialMeeting":null,"LastUpdatedDate":"2025-02-23T14:31:26.113+02:00"}
{"Id":160960,"Number":47,"KnessetNum":14,"Name":"ישיבת מליאה בתאריך 04/12/1996 בשעה 11:05","StartDate":"1996-12-04T11:05:00+02:00","FinishDate":"1996-12-04T18:43:00+02:00","IsSpecialMeeting":null,"LastUpdatedDate":"2025-02-23T14:32:10.737+02:00"}
{"Id":160962,"Number":49,"KnessetNum":14,"Name":"ישיבת מליאה בתאריך 10/12/1996 בשעה 15:02","StartDate":"1996-12-10T15:02:00+02:00","FinishDate":"1996-12-10T19:53:00+02:00","IsSpecialMeeting":null,"LastUpdatedDate":"2025-02-23T14:33:22.02+02:00"}
{"Id":160964,"Number":51,"KnessetNum":14,"Name":"ישיבת מליאה בתאריך 16/12/1996 בשעה 16:01","StartDate":"1996-12-16T16:01:00+02:00","FinishDate":"1996-12-16T20:12:00+02:00","IsSpecialMeeting":null,"LastUpdatedDate":"2025-02-23T14:50:58.067+02:00"}
{"Id":160965,"Number":52,"KnessetNum":14,"Name":"ישיבת מליאה בתאריך 17/12/1996 בשעה 16:02","StartDate":"1996-12-17T16:02:00+02:00","FinishDate":"1996-12-17T18:41:00+02:00","IsSpecialMeeting":null,"LastUpdatedDate":"2025-02-23T14:52:23.72+02:00"}
{"Id":160970,"Number":56,"KnessetNum":14,"Name":"ישיבת מליאה בתאריך 06/01/1997 בשעה 16:08","StartDate":"1997-01-06T16:08:00+02:00","FinishDate":"1997-01-06T20:02:00+02:00","IsSpecialMeeting":null,"LastUpdatedDate":"2025-02-23T14:54:16.017+02:00"}
{"Id":160973,"Number":59,"KnessetNum":14,"Name":"ישיבת מליאה בתאריך 13/01/1997 בשעה 16:01","StartDate":"1997-01-13T16:01:00+02:00","FinishDate":"1997-01-13T20:11:00+02:00","IsSpecialMeeting":null,"LastUpdatedDate":"2025-02-23T15:29:56.51+02:00"}
{"Id":160974,"Number":60,"KnessetNum":14,"Name":"ישיבת מליאה בתאריך 14/01/1997 בשעה 16:03","StartDate":"1997-01-14T16:03:00+02:00","FinishDate":"1997-01-14T19:46:00+02:00","IsSpecialMeeting":null,"LastUpdatedDate":"2025-02-23T15:31:58.873+02:00"}
{"Id":160975,"Number":61,"KnessetNum":14,"Name":"ישיבת מליאה בתאריך 15/01/1997 בשעה 11:05","StartDate":"1997-01-15T11:05:00+02:00","FinishDate":"1997-01-15T16:31:00+02:00","IsSpecialMeeting":null,"LastUpdatedDate":"2025-02-23T15:33:12.767+02:00"}
{"Id":160977,"Number":65,"KnessetNum":14,"Name":"ישיבת מליאה בתאריך 22/01/1997 בשעה 11:08","StartDate":"1997-01-22T11:08:00+02:00","FinishDate":"1997-01-22T18:02:00+02:00","IsSpecialMeeting":null,"LastUpdatedDate":"2025-02-23T15:37:48.787+02:00"}
{"Id":160979,"Number":67,"KnessetNum":14,"Name":"ישיבת מליאה בתאריך 28/01/1997 בשעה 16:02","StartDate":"1997-01-28T16:02:00+02:00","FinishDate":"1997-01-28T20:45:00+02:00","IsSpecialMeeting":null,"LastUpdatedDate":"2025-02-23T15:41:11.817+02:00"}
{"Id":160980,"Number":68,"KnessetNum":14,"Name":"ישיבת מליאה בתאריך 29/01/1997 בשעה 11:03","StartDate":"1997-01-29T11:03:00+02:00","FinishDate":"1997-01-29T17:41:00+02:00","IsSpecialMeeting":null,"LastUpdatedDate":"2020-06-11T14:23:16.29+03:00"}
{"Id":160981,"Number":69,"KnessetNum":14,"Name":"ישיבת מליאה בתאריך 03/02/1997 בשעה 16:01","StartDate":"1997-02-03T16:01:00+02:00","FinishDate":"1997-02-03T20:40:00+02:00","IsSpecialMeeting":null,"LastUpdatedDate":"2025-02-23T15:42:07.463+02:00"}
{"Id":160982,"Number":70,"KnessetNum":14,"Name":"ישיבת מליאה בתאריך 04/02/1997 בשעה 16:03","StartDate":"1997-02-04T16:03:00+02:00","FinishDate":"1997-02-04T20:26:00+02:00","IsSpecialMeeting":null,"LastUpdatedDate":"2025-02-23T15:43:17.123+02:00"}
{"Id":160988,"Number":77,"KnessetNum":14,"Name":"ישיבת מליאה בתאריך 19/02/1997 בשעה 11:04","StartDate":"1997-02-19T11:04:00+02:00","FinishDate":"1997-02-19T19:12:00+02:00","IsSpecialMeeting":null,"LastUpdatedDate":"2025-02-24T08:45:20.27+02:00"}
{"Id":160989,"Number":78,"KnessetNum":14,"Name":"ישיבת מליאה בתאריך 24/02/1997 בשעה 16:02","StartDate":"1997-02-24T16:02:00+02:00","FinishDate":"1997-02-24T20:31:00+02:00","IsSpecialMeeting":null,"LastUpdatedDate":"2025-02-24T08:46:01.613+02:00"}
{"Id":160993,"Number":82,"KnessetNum":14,"Name":"ישיבת מליאה בתאריך 04/03/1997 בשעה 16:03","StartDate":"1997-03-04T16:03:00+02:00","FinishDate":"1997-03-04T20:19:00+02:00","IsSpecialMeeting":null,"LastUpdatedDate":"2025-02-24T08:48:43.227+02:00"}
{"Id":160994,"Number":83,"KnessetNum":14,"Name":"ישיבת מליאה בתאריך 05/03/1997 בשעה 11:03","StartDate":"1997-03-05T11:03:00+02:00","FinishDate":"1997-03-05T20:17:00+02:00","IsSpecialMeeting":null,"LastUpdatedDate":"2025-02-24T08:49:23.45+02:00"}
{"Id":160995,"Number":84,"KnessetNum":14,"Name":"ישיבת מליאה בתאריך 10/03/1997 בשעה 16:01","StartDate":"1997-03-10T16:01:00+02:00","FinishDate":"1997-03-10T21:06:00+02:00","IsSpecialMeeting":null,"LastUpdatedDate":"2025-02-24T08:57:32.983+02:00"}
{"Id":160996,"Number":85,"KnessetNum":14,"Name":"ישיבת מליאה בתאריך 11/03/1997 בשעה 16:04","StartDate":"1997-03-11T16:04:00+02:00","FinishDate":"1997-03-11T20:14:00+02:00","IsSpecialMeeting":null,"LastUpdatedDate":"2025-02-24T08:58:30.297+02:00"}
{"Id":160997,"Number":86,"KnessetNum":14,"Name":"ישיבת מליאה בתאריך 12/03/1997 בשעה 11:02","StartDate":"1997-03-12T11:02:00+02:00","FinishDate":"1997-03-12T20:44:00+02:00","IsSpecialMeeting":null,"LastUpdatedDate":"2025-02-24T08:59:13.247+02:00"}
{"Id":160998,"Number":87,"KnessetNum":14,"Name":"ישיבת מליאה בתאריך 17/03/1997 בשעה 16:02","StartDate":"1997-03-17T16:02:00+02:00","FinishDate":"1997-03-17T20:29:00+02:00","IsSpecialMeeting":null,"LastUpdatedDate":"2025-02-24T09:00:51.24+02:00"}
{"Id":160999,"Number":88,"KnessetNum":14,"Name":"ישיבת מליאה בתאריך 18/03/1997 בשעה 16:02","StartDate":"1997-03-18T16:02:00+02:00","FinishDate":"1997-03-18T19:39:00+02:00","IsSpecialMeeting":null,"LastUpdatedDate":"2025-02-24T09:02:02.1+02:00"}
{"Id":161000,"Number":89,"KnessetNum":14,"Name":"ישיבת מליאה בתאריך 19/03/1997 בשעה 11:02","StartDate":"1997-03-19T11:02:00+02:00","FinishDate":"1997-03-19T20:06:00+02:00","IsSpecialMeeting":null,"LastUpdatedDate":"2025-02-24T09:02:34.397+02:00"}
{"Id":161002,"Number":90,"KnessetNum":14,"Name":"ישיבת מליאה בתאריך 24/03/1997 בשעה 16:03","StartDate":"1997-03-24T16:03:00+02:00","FinishDate":"1997-03-24T21:33:00+02:00","IsSpecialMeeting":null,"LastUpdatedDate":"2025-02-24T09:13:05.073+02:00"}
{"Id":161003,"Number":91,"KnessetNum":14,"Name":"ישיבת מליאה בתאריך 25/03/1997 בשעה 11:03","StartDate":"1997-03-25T11:03:00+02:00","FinishDate":"1997-03-25T19:20:00+02:00","IsSpecialMeeting":null,"LastUpdatedDate":"2025-02-24T09:36:52.367+02:00"}
{"Id":161005,"Number":92,"KnessetNum":14,"Name":"ישיבת מליאה בתאריך 31/03/1997 בשעה 15:02","StartDate":"1997-03-31T15:02:00+02:00","FinishDate":"1997-03-31T23:09:00+02:00","IsSpecialMeeting":null,"LastUpdatedDate":"2020-06-11T14:19:17.013+03:00"}
{"Id":161006,"Number":93,"KnessetNum":14,"Name":"ישיבת מליאה בתאריך 31/03/1997 בשעה 15:04","StartDate":"1997-03-31T15:04:00+02:00","FinishDate":"1997-03-31T22:33:00+02:00","IsSpecialMeeting":null,"LastUpdatedDate":"2025-02-24T09:37:43.82+02:00"}
{"Id":161007,"Number":94,"KnessetNum":14,"Name":"ישיבת מליאה בתאריך 29/03/1997 בשעה 10:04","StartDate":"1997-04-02T10:04:00+03:00","FinishDate":"1997-04-02T19:49:00+03:00","IsSpecialMeeting":null,"LastUpdatedDate":"2025-09-02T14:22:41.103+03:00"}
{"Id":161009,"Number":99,"KnessetNum":14,"Name":"ישיבת מליאה בתאריך 20/05/1997 בשעה 16:03","StartDate":"1997-05-20T16:03:00+03:00","FinishDate":"1997-05-20T20:35:00+03:00","IsSpecialMeeting":null,"LastUpdatedDate":"2020-06-11T14:14:31.827+03:00"}
{"Id":161010,"Number":100,"KnessetNum":14,"Name":"ישיבת מליאה בתאריך 21/05/1997 בשעה 11:04","StartDate":"1997-05-21T11:04:00+03:00","FinishDate":"1997-05-21T17:34:00+03:00","IsSpecialMeeting":null,"LastUpdatedDate":"2025-02-24T10:18:00.687+02:00"}
{"Id":161013,"Number":103,"KnessetNum":14,"Name":"ישיבת מליאה בתאריך 28/05/1997 בשעה 11:02","StartDate":"1997-05-28T11:02:00+03:00","FinishDate":"1997-05-28T19:45:00+03:00","IsSpecialMeeting":null,"LastUpdatedDate":"2025-02-24T10:21:30.673+02:00"}
{"Id":161014,"Number":104,"KnessetNum":14,"Name":"ישיבת מליאה בתאריך 02/06/1997 בשעה 16:02","StartDate":"1997-06-02T16:02:00+03:00","FinishDate":"1997-06-02T20:03:00+03:00","IsSpecialMeeting":null,"LastUpdatedDate":"2025-02-24T10:22:12.377+02:00"}
{"Id":161015,"Number":105,"KnessetNum":14,"Name":"ישיבת מליאה בתאריך 03/06/1997 בשעה 16:03","StartDate":"1997-06-03T16:03:00+03:00","FinishDate":"1997-06-03T20:12:00+03:00","IsSpecialMeeting":null,"LastUpdatedDate":"2025-02-24T10:23:06.94+02:00"}
{"Id":161016,"Number":107,"KnessetNum":14,"Name":"ישיבת מליאה בתאריך 09/06/1997 בשעה 11:03","StartDate":"1997-06-09T11:03:00+03:00","FinishDate":"1997-06-09T19:12:00+03:00","IsSpecialMeeting":null,"LastUpdatedDate":"2019-12-26T13:26:54.487+02:00"}
{"Id":161017,"Number":108,"KnessetNum":14,"Name":"ישיבת מליאה בתאריך 16/06/1997 בשעה 16:05","StartDate":"1997-06-16T16:05:00+03:00","FinishDate":"1997-06-16T20:43:00+03:00","IsSpecialMeeting":null,"LastUpdatedDate":"2025-02-24T10:24:10.407+02:00"}
{"Id":161019,"Number":110,"KnessetNum":14,"Name":"ישיבת מליאה בתאריך 18/06/1997 בשעה 11:02","StartDate":"1997-06-18T11:02:00+03:00","FinishDate":"1997-06-18T18:52:00+03:00","IsSpecialMeeting":null,"LastUpdatedDate":"2025-02-24T10:25:53.23+02:00"}
{"Id":161020,"Number":111,"KnessetNum":14,"Name":"ישיבת מליאה בתאריך 23/06/1997 בשעה 16:04","StartDate":"1997-06-23T16:04:00+03:00","FinishDate":"1997-06-23T22:12:00+03:00","IsSpecialMeeting":null,"LastUpdatedDate":"2025-02-24T10:27:45.65+02:00"}
{"Id":161022,"Number":113,"KnessetNum":14,"Name":"ישיבת מליאה בתאריך 25/06/1997 בשעה 11:02","StartDate":"1997-06-25T11:02:00+03:00","FinishDate":"1997-06-25T21:51:00+03:00","IsSpecialMeeting":null,"LastUpdatedDate":"2025-02-24T10:37:42.01+02:00"}
{"Id":161024,"Number":115,"KnessetNum":14,"Name":"ישיבת מליאה בתאריך 01/07/1997 בשעה 16:05","StartDate":"1997-07-01T16:05:00+03:00","FinishDate":"1997-07-01T21:28:00+03:00","IsSpecialMeeting":null,"LastUpdatedDate":"2025-02-24T10:39:10.93+02:00"}
{"Id":161025,"Number":116,"KnessetNum":14,"Name":"ישיבת מליאה בתאריך 02/07/1997 בשעה 11:05","StartDate":"1997-07-02T11:05:00+03:00","FinishDate":"1997-07-02T21:52:00+03:00","IsSpecialMeeting":null,"LastUpdatedDate":"2025-02-24T10:39:56.71+02:00"}
{"Id":161026,"Number":117,"KnessetNum":14,"Name":"ישיבת מליאה בתאריך 07/07/1997 בשעה 16:02","StartDate":"1997-07-07T16:02:00+03:00","FinishDate":"1997-07-07T23:53:00+03:00","IsSpecialMeeting":null,"LastUpdatedDate":"2025-02-24T10:41:42.383+02:00"}
{"Id":161028,"Number":119,"KnessetNum":14,"Name":"ישיבת מליאה בתאריך 09/07/1997 בשעה 10:03","StartDate":"1997-07-09T10:03:00+03:00","FinishDate":"1997-07-09T19:03:00+03:00","IsSpecialMeeting":null,"LastUpdatedDate":"2020-06-11T14:10:01.853+03:00"}
{"Id":161032,"Number":122,"KnessetNum":14,"Name":"ישיבת מליאה בתאריך 16/07/1997 בשעה 11:02","StartDate":"1997-07-16T11:02:00+03:00","FinishDate":"1997-07-16T22:17:00+03:00","IsSpecialMeeting":null,"LastUpdatedDate":"2025-02-24T11:05:10.833+02:00"}
{"Id":161041,"Number":135,"KnessetNum":14,"Name":"ישיבת מליאה בתאריך 28/10/1997 בשעה 16:02","StartDate":"1997-10-28T16:02:00+02:00","FinishDate":"1997-10-28T23:01:00+02:00","IsSpecialMeeting":null,"LastUpdatedDate":"2020-06-11T14:00:35.327+03:00"}
{"Id":161042,"Number":136,"KnessetNum":14,"Name":"ישיבת מליאה בתאריך 29/10/1997 בשעה 11:02","StartDate":"1997-10-29T11:02:00+02:00","FinishDate":"1997-10-29T23:40:00+02:00","IsSpecialMeeting":null,"LastUpdatedDate":"2025-02-24T11:25:08.58+02:00"}
{"Id":161044,"Number":138,"KnessetNum":14,"Name":"ישיבת מליאה בתאריך 04/11/1997 בשעה 16:01","StartDate":"1997-11-04T16:01:00+02:00","FinishDate":"1997-11-04T20:15:00+02:00","IsSpecialMeeting":null,"LastUpdatedDate":"2025-02-24T11:26:21.453+02:00"}
{"Id":161046,"Number":140,"KnessetNum":14,"Name":"ישיבת מליאה בתאריך 10/11/1997 בשעה 16:00","StartDate":"1997-11-10T16:00:00+02:00","FinishDate":"1997-11-10T20:38:00+02:00","IsSpecialMeeting":null,"LastUpdatedDate":"2025-02-24T11:27:59.57+02:00"}
{"Id":161047,"Number":141,"KnessetNum":14,"Name":"ישיבת מליאה בתאריך 11/11/1997 בשעה 16:02","StartDate":"1997-11-11T16:02:00+02:00","FinishDate":"1997-11-11T22:30:00+02:00","IsSpecialMeeting":null,"LastUpdatedDate":"2025-02-24T11:28:47.58+02:00"}
{"Id":161048,"Number":144,"KnessetNum":14,"Name":"ישיבת מליאה בתאריך 17/11/1997 בשעה 16:01","StartDate":"1997-11-17T16:01:00+02:00","FinishDate":"1997-11-17T20:02:00+02:00","IsSpecialMeeting":null,"LastUpdatedDate":"2025-02-24T11:29:35.943+02:00"}
{"Id":161049,"Number":145,"KnessetNum":14,"Name":"ישיבת מליאה בתאריך 18/11/1997 בשעה 16:02","StartDate":"1997-11-18T16:02:00+02:00","FinishDate":"1997-11-18T18:01:00+02:00","IsSpecialMeeting":null,"LastUpdatedDate":"2025-02-24T11:30:20.903+02:00"}
{"Id":161052,"Number":148,"KnessetNum":14,"Name":"ישיבת מליאה בתאריך 25/11/1997 בשעה 16:03","StartDate":"1997-11-25T16:03:00+02:00","FinishDate":"1997-11-25T19:55:00+02:00","IsSpecialMeeting":null,"LastUpdatedDate":"2025-02-24T11:31:44.237+02:00"}
{"Id":161053,"Number":149,"KnessetNum":14,"Name":"ישיבת מליאה בתאריך 26/11/1997 בשעה 11:03","StartDate":"1997-11-26T11:03:00+02:00","FinishDate":"1997-11-26T20:23:00+02:00","IsSpecialMeeting":null,"LastUpdatedDate":"2025-02-24T11:32:28.097+02:00"}
{"Id":161054,"Number":150,"KnessetNum":14,"Name":"ישיבת מליאה בתאריך 01/12/1997 בשעה 16:02","StartDate":"1997-12-01T16:02:00+02:00","FinishDate":"1997-12-01T21:18:00+02:00","IsSpecialMeeting":null,"LastUpdatedDate":"2025-02-24T11:33:15.277+02:00"}
{"Id":161055,"Number":151,"KnessetNum":14,"Name":"ישיבת מליאה בתאריך 02/12/1997 בשעה 16:04","StartDate":"1997-12-02T16:04:00+02:00","FinishDate":"1997-12-02T23:40:00+02:00","IsSpecialMeeting":null,"LastUpdatedDate":"2025-02-24T11:34:22.89+02:00"}
{"Id":161056,"Number":152,"KnessetNum":14,"Name":"ישיבת מליאה בתאריך 03/12/1997 בשעה 11:02","StartDate":"1997-12-03T11:02:00+02:00","FinishDate":"1997-12-03T17:34:00+02:00","IsSpecialMeeting":null,"LastUpdatedDate":"2025-02-24T11:35:37.273+02:00"}
{"Id":161058,"Number":155,"KnessetNum":14,"Name":"ישיבת מליאה בתאריך 10/12/1997 בשעה 11:06","StartDate":"1997-12-10T11:06:00+02:00","FinishDate":"1997-12-10T23:51:00+02:00","IsSpecialMeeting":null,"LastUpdatedDate":"2020-06-11T13:46:46.59+03:00"}
{"Id":161061,"Number":158,"KnessetNum":14,"Name":"ישיבת מליאה בתאריך 17/12/1997 בשעה 11:05","StartDate":"1997-12-17T11:05:00+02:00","FinishDate":"1997-12-17T20:26:00+02:00","IsSpecialMeeting":null,"LastUpdatedDate":"2025-02-24T11:38:50.48+02:00"}
{"Id":161062,"Number":159,"KnessetNum":14,"Name":"ישיבת מליאה בתאריך 22/12/1997 בשעה 15:03","StartDate":"1997-12-22T15:03:00+02:00","FinishDate":"1997-12-22T21:23:00+02:00","IsSpecialMeeting":null,"LastUpdatedDate":"2025-02-24T11:40:19.463+02:00"}
{"Id":161068,"Number":164,"KnessetNum":14,"Name":"ישיבת מליאה בתאריך 07/01/1998 בשעה 11:03","StartDate":"1998-01-07T11:03:00+02:00","FinishDate":"1998-01-07T17:27:00+02:00","IsSpecialMeeting":null,"LastUpdatedDate":"2025-02-24T11:43:54.823+02:00"}
{"Id":161071,"Number":166,"KnessetNum":14,"Name":"ישיבת מליאה בתאריך 13/01/1998 בשעה 16:02","StartDate":"1998-01-13T16:02:00+02:00","FinishDate":"1998-01-13T21:06:00+02:00","IsSpecialMeeting":null,"LastUpdatedDate":"2025-02-24T11:45:30.373+02:00"}
{"Id":161074,"Number":169,"KnessetNum":14,"Name":"ישיבת מליאה בתאריך 21/01/1998 בשעה 11:02","StartDate":"1998-01-21T11:02:00+02:00","FinishDate":"1998-01-21T18:43:00+02:00","IsSpecialMeeting":null,"LastUpdatedDate":"2025-02-24T11:48:34.213+02:00"}
{"Id":161076,"Number":171,"KnessetNum":14,"Name":"ישיבת מליאה בתאריך 27/01/1998 בשעה 16:01","StartDate":"1998-01-27T16:01:00+02:00","FinishDate":"1998-01-27T20:08:00+02:00","IsSpecialMeeting":null,"LastUpdatedDate":"2020-06-11T13:39:20.937+03:00"}
{"Id":161077,"Number":172,"KnessetNum":14,"Name":"ישיבת מליאה בתאריך 28/01/1998 בשעה 11:03","StartDate":"1998-01-28T11:03:00+02:00","FinishDate":"1998-01-28T13:03:00+02:00","IsSpecialMeeting":null,"LastUpdatedDate":"2025-02-24T11:50:35.41+02:00"}
{"Id":161080,"Number":175,"KnessetNum":14,"Name":"ישיבת מליאה בתאריך 04/02/1998 בשעה 11:03","StartDate":"1998-02-04T11:03:00+02:00","FinishDate":"1998-02-04T21:00:00+02:00","IsSpecialMeeting":null,"LastUpdatedDate":"2025-02-24T12:10:29.07+02:00"}
{"Id":161081,"Number":176,"KnessetNum":14,"Name":"ישיבת מליאה בתאריך 09/02/1998 בשעה 16:05","StartDate":"1998-02-09T16:05:00+02:00","FinishDate":"1998-02-09T21:00:00+02:00","IsSpecialMeeting":null,"LastUpdatedDate":"2025-02-24T12:24:55.823+02:00"}
{"Id":161083,"Number":179,"KnessetNum":14,"Name":"ישיבת מליאה בתאריך 16/02/1998 בשעה 16:04","StartDate":"1998-02-16T16:04:00+02:00","FinishDate":"1998-02-16T21:35:00+02:00","IsSpecialMeeting":null,"LastUpdatedDate":"2025-02-24T12:40:42.183+02:00"}
{"Id":161085,"Number":181,"KnessetNum":14,"Name":"ישיבת מליאה בתאריך 18/02/1998 בשעה 11:03","StartDate":"1998-02-18T11:03:00+02:00","FinishDate":"1998-02-18T18:22:00+02:00","IsSpecialMeeting":null,"LastUpdatedDate":"2025-02-24T12:47:34.45+02:00"}
{"Id":161087,"Number":183,"KnessetNum":14,"Name":"ישיבת מליאה בתאריך 24/02/1998 בשעה 16:06","StartDate":"1998-02-24T16:06:00+02:00","FinishDate":"1998-02-24T21:30:00+02:00","IsSpecialMeeting":null,"LastUpdatedDate":"2025-02-24T13:58:32.327+02:00"}
{"Id":161089,"Number":185,"KnessetNum":14,"Name":"ישיבת מליאה בתאריך 02/03/1998 בשעה 16:00","StartDate":"1998-03-02T16:00:00+02:00","FinishDate":"1998-03-02T19:51:00+02:00","IsSpecialMeeting":null,"LastUpdatedDate":"2025-02-24T13:58:59.493+02:00"}
{"Id":161090,"Number":186,"KnessetNum":14,"Name":"ישיבת מליאה בתאריך 03/03/1998 בשעה 16:02","StartDate":"1998-03-03T16:02:00+02:00","FinishDate":"1998-03-03T20:08:00+02:00","IsSpecialMeeting":null,"LastUpdatedDate":"2025-02-24T14:00:04.39+02:00"}
{"Id":161091,"Number":188,"KnessetNum":14,"Name":"ישיבת מליאה בתאריך 09/03/1998 בשעה 16:03","StartDate":"1998-03-09T16:03:00+02:00","FinishDate":"1998-03-09T20:29:00+02:00","IsSpecialMeeting":null,"LastUpdatedDate":"2025-02-24T14:02:16.02+02:00"}
{"Id":161092,"Number":189,"KnessetNum":14,"Name":"ישיבת מליאה בתאריך 10/03/1998 בשעה 16:03","StartDate":"1998-03-10T16:03:00+02:00","FinishDate":"1998-03-10T22:33:00+02:00","IsSpecialMeeting":null,"LastUpdatedDate":"2020-06-11T13:34:23.01+03:00"}
{"Id":161093,"Number":190,"KnessetNum":14,"Name":"ישיבת מליאה בתאריך 11/03/1998 בשעה 11:03","StartDate":"1998-03-11T11:03:00+02:00","FinishDate":"1998-03-11T14:17:00+02:00","IsSpecialMeeting":null,"LastUpdatedDate":"2025-02-24T14:02:54.803+02:00"}
{"Id":161095,"Number":191,"KnessetNum":14,"Name":"ישיבת מליאה בתאריך 16/03/1998 בשעה 16:04","StartDate":"1998-03-16T16:04:00+02:00","FinishDate":"1998-03-16T21:29:00+02:00","IsSpecialMeeting":null,"LastUpdatedDate":"2025-02-24T14:03:30.333+02:00"}
{"Id":161098,"Number":194,"KnessetNum":14,"Name":"ישיבת מליאה בתאריך 22/03/1998 בשעה 16:05","StartDate":"1998-03-22T16:05:00+02:00","FinishDate":"1998-03-23T00:45:00+02:00","IsSpecialMeeting":null,"LastUpdatedDate":"2025-02-24T14:05:48.493+02:00"}
{"Id":161108,"Number":206,"KnessetNum":14,"Name":"ישיבת מליאה בתאריך 20/05/1998 בשעה 11:06","StartDate":"1998-05-20T11:06:00+03:00","FinishDate":"1998-05-20T19:35:00+03:00","IsSpecialMeeting":null,"LastUpdatedDate":"2025-02-25T08:28:42.563+02:00"}
{"Id":161114,"Number":214,"KnessetNum":14,"Name":"ישיבת מליאה בתאריך 10/06/1998 בשעה 11:03","StartDate":"1998-06-10T11:03:00+03:00","FinishDate":"1998-06-10T18:40:00+03:00","IsSpecialMeeting":null,"LastUpdatedDate":"2025-02-25T08:40:41.523+02:00"}
{"Id":161115,"Number":215,"KnessetNum":14,"Name":"ישיבת מליאה בתאריך 15/06/1998 בשעה 16:04","StartDate":"1998-06-15T16:04:00+03:00","FinishDate":"1998-06-15T21:20:00+03:00","IsSpecialMeeting":null,"LastUpdatedDate":"2025-02-25T08:41:25.873+02:00"}
{"Id":161116,"Number":216,"KnessetNum":14,"Name":"ישיבת מליאה בתאריך 16/06/1998 בשעה 16:04","StartDate":"1998-06-16T16:04:00+03:00","FinishDate":"1998-06-16T20:23:00+03:00","IsSpecialMeeting":null,"LastUpdatedDate":"2025-02-25T08:42:36.23+02:00"}
{"Id":161118,"Number":218,"KnessetNum":14,"Name":"ישיבת מליאה בתאריך 22/06/1998 בשעה 16:06","StartDate":"1998-06-22T16:06:00+03:00","FinishDate":"1998-06-22T21:12:00+03:00","IsSpecialMeeting":null,"LastUpdatedDate":"2025-02-25T08:54:39.983+02:00"}
{"Id":161119,"Number":219,"KnessetNum":14,"Name":"ישיבת מליאה בתאריך 23/06/1998 בשעה 16:01","StartDate":"1998-06-23T16:01:00+03:00","FinishDate":"1998-06-23T22:19:00+03:00","IsSpecialMeeting":null,"LastUpdatedDate":"2025-02-25T08:55:18.893+02:00"}
{"Id":161120,"Number":220,"KnessetNum":14,"Name":"ישיבת מליאה בתאריך 24/06/1998 בשעה 11:05","StartDate":"1998-06-24T11:05:00+03:00","FinishDate":"1998-06-24T20:07:00+03:00","IsSpecialMeeting":null,"LastUpdatedDate":"2025-02-25T08:55:54.293+02:00"}
{"Id":161121,"Number":221,"KnessetNum":14,"Name":"ישיבת מליאה בתאריך 29/06/1998 בשעה 16:05","StartDate":"1998-06-29T16:05:00+03:00","FinishDate":"1998-06-29T19:51:00+03:00","IsSpecialMeeting":null,"LastUpdatedDate":"2025-02-25T09:32:58.237+02:00"}
{"Id":161122,"Number":223,"KnessetNum":14,"Name":"ישיבת מליאה בתאריך 01/07/1998 בשעה 11:04","StartDate":"1998-07-01T11:04:00+03:00","FinishDate":"1998-07-01T19:07:00+03:00","IsSpecialMeeting":null,"LastUpdatedDate":"2025-02-25T09:31:39.963+02:00"}
{"Id":161123,"Number":224,"KnessetNum":14,"Name":"ישיבת מליאה בתאריך 06/07/1998 בשעה 16:03","StartDate":"1998-07-06T16:03:00+03:00","FinishDate":"1998-07-06T20:58:00+03:00","IsSpecialMeeting":null,"LastUpdatedDate":"2020-06-11T13:26:11.68+03:00"}
{"Id":161125,"Number":226,"KnessetNum":14,"Name":"ישיבת מליאה בתאריך 08/07/1998 בשעה 11:04","StartDate":"1998-07-08T11:04:00+03:00","FinishDate":"1998-07-08T21:28:00+03:00","IsSpecialMeeting":null,"LastUpdatedDate":"2025-02-25T09:35:36.283+02:00"}
{"Id":161126,"Number":227,"KnessetNum":14,"Name":"ישיבת מליאה בתאריך 13/07/1998 בשעה 16:02","StartDate":"1998-07-13T16:02:00+03:00","FinishDate":"1998-07-13T22:33:00+03:00","IsSpecialMeeting":null,"LastUpdatedDate":"2020-06-11T13:17:41.703+03:00"}
{"Id":161127,"Number":228,"KnessetNum":14,"Name":"ישיבת מליאה בתאריך 14/07/1998 בשעה 16:01","StartDate":"1998-07-14T16:01:00+03:00","FinishDate":"1998-07-14T20:13:00+03:00","IsSpecialMeeting":null,"LastUpdatedDate":"2025-02-25T09:47:07.167+02:00"}
{"Id":161129,"Number":230,"KnessetNum":14,"Name":"ישיבת מליאה בתאריך 20/07/1998 בשעה 16:03","StartDate":"1998-07-20T16:03:00+03:00","FinishDate":"1998-07-20T22:24:00+03:00","IsSpecialMeeting":null,"LastUpdatedDate":"2025-02-25T09:48:55.367+02:00"}
{"Id":161131,"Number":232,"KnessetNum":14,"Name":"ישיבת מליאה בתאריך 22/07/1998 בשעה 11:03","StartDate":"1998-07-22T11:03:00+03:00","FinishDate":"1998-07-22T21:18:00+03:00","IsSpecialMeeting":null,"LastUpdatedDate":"2025-02-25T10:21:45.637+02:00"}
{"Id":161136,"Number":239,"KnessetNum":14,"Name":"ישיבת מליאה בתאריך 20/10/1998 בשעה 16:05","StartDate":"1998-10-20T16:05:00+02:00","FinishDate":"1998-10-20T20:45:00+02:00","IsSpecialMeeting":null,"LastUpdatedDate":"2025-02-25T10:33:42.087+02:00"}
{"Id":161137,"Number":241,"KnessetNum":14,"Name":"ישיבת מליאה בתאריך 26/10/1998 בשעה 16:04","StartDate":"1998-10-26T16:04:00+02:00","FinishDate":"1998-10-26T21:46:00+02:00","IsSpecialMeeting":null,"LastUpdatedDate":"2025-02-25T10:35:28.52+02:00"}
{"Id":161138,"Number":245,"KnessetNum":14,"Name":"ישיבת מליאה בתאריך 02/11/1998 בשעה 16:05","StartDate":"1998-11-02T16:05:00+02:00","FinishDate":"1998-11-02T20:50:00+02:00","IsSpecialMeeting":null,"LastUpdatedDate":"2025-02-25T10:37:33.06+02:00"}
{"Id":161139,"Number":246,"KnessetNum":14,"Name":"ישיבת מליאה בתאריך 03/11/1998 בשעה 16:05","StartDate":"1998-11-03T16:05:00+02:00","FinishDate":"1998-11-03T18:39:00+02:00","IsSpecialMeeting":null,"LastUpdatedDate":"2025-02-25T10:38:37.117+02:00"}
{"Id":161140,"Number":247,"KnessetNum":14,"Name":"ישיבת מליאה בתאריך 04/11/1998 בשעה 11:03","StartDate":"1998-11-04T11:03:00+02:00","FinishDate":"1998-11-04T20:29:00+02:00","IsSpecialMeeting":null,"LastUpdatedDate":"2025-02-25T10:39:17.21+02:00"}
{"Id":161141,"Number":248,"KnessetNum":14,"Name":"ישיבת מליאה בתאריך 11/11/1998 בשעה 11:04","StartDate":"1998-11-11T11:04:00+02:00","FinishDate":"1998-11-11T18:28:00+02:00","IsSpecialMeeting":null,"LastUpdatedDate":"2025-02-25T10:39:55.83+02:00"}
{"Id":161142,"Number":249,"KnessetNum":14,"Name":"ישיבת מליאה בתאריך 12/11/1998 בשעה 09:04","StartDate":"1998-11-12T09:04:00+02:00","FinishDate":"1998-11-12T12:49:00+02:00","IsSpecialMeeting":null,"LastUpdatedDate":"2025-02-25T10:40:38.92+02:00"}
{"Id":161143,"Number":250,"KnessetNum":14,"Name":"ישיבת מליאה בתאריך 16/11/1998 בשעה 16:03","StartDate":"1998-11-16T16:03:00+02:00","FinishDate":"1998-11-16T23:31:00+02:00","IsSpecialMeeting":null,"LastUpdatedDate":"2020-06-11T12:21:50.43+03:00"}
{"Id":161144,"Number":252,"KnessetNum":14,"Name":"ישיבת מליאה בתאריך 18/11/1998 בשעה 11:00","StartDate":"1998-11-18T11:00:00+02:00","FinishDate":"1998-11-18T20:44:00+02:00","IsSpecialMeeting":null,"LastUpdatedDate":"2025-02-25T11:01:52.573+02:00"}
{"Id":161145,"Number":253,"KnessetNum":14,"Name":"ישיבת מליאה בתאריך 23/11/1998 בשעה 16:04","StartDate":"1998-11-23T16:04:00+02:00","FinishDate":"1998-11-23T22:04:00+02:00","IsSpecialMeeting":null,"LastUpdatedDate":"2025-02-25T11:02:36.137+02:00"}
{"Id":161146,"Number":254,"KnessetNum":14,"Name":"ישיבת מליאה בתאריך 24/11/1998 בשעה 16:00","StartDate":"1998-11-24T16:00:00+02:00","FinishDate":"1998-11-24T20:50:00+02:00","IsSpecialMeeting":null,"LastUpdatedDate":"2025-02-25T11:03:07.91+02:00"}
{"Id":161150,"Number":257,"KnessetNum":14,"Name":"ישיבת מליאה בתאריך 01/12/1998 בשעה 16:04","StartDate":"1998-12-01T16:04:00+02:00","FinishDate":"1998-12-01T21:45:00+02:00","IsSpecialMeeting":null,"LastUpdatedDate":"2025-02-25T11:05:57.503+02:00"}
{"Id":161151,"Number":258,"KnessetNum":14,"Name":"ישיבת מליאה בתאריך 02/12/1998 בשעה 11:05","StartDate":"1998-12-02T11:05:00+02:00","FinishDate":"1998-12-02T18:43:00+02:00","IsSpecialMeeting":null,"LastUpdatedDate":"2025-02-25T11:06:40.273+02:00"}
{"Id":161155,"Number":262,"KnessetNum":14,"Name":"ישיבת מליאה בתאריך 14/12/1998 בשעה 15:03","StartDate":"1998-12-14T15:03:00+02:00","FinishDate":"1998-12-14T16:44:00+02:00","IsSpecialMeeting":null,"LastUpdatedDate":"2025-02-25T11:23:10.037+02:00"}
{"Id":161156,"Number":263,"KnessetNum":14,"Name":"ישיבת מליאה בתאריך 15/12/1998 בשעה 15:05","StartDate":"1998-12-15T15:05:00+02:00","FinishDate":"1998-12-15T17:00:00+02:00","IsSpecialMeeting":null,"LastUpdatedDate":"2025-02-25T11:45:21.907+02:00"}
{"Id":161161,"Number":268,"KnessetNum":14,"Name":"ישיבת מליאה בתאריך 28/12/1998 בשעה 16:05","StartDate":"1998-12-28T16:05:00+02:00","FinishDate":"1998-12-28T21:11:00+02:00","IsSpecialMeeting":null,"LastUpdatedDate":"2025-02-25T11:47:47.38+02:00"}
{"Id":161162,"Number":269,"KnessetNum":14,"Name":"ישיבת מליאה בתאריך 29/12/1998 בשעה 16:02","StartDate":"1998-12-29T16:02:00+02:00","FinishDate":"1998-12-30T00:24:00+02:00","IsSpecialMeeting":null,"LastUpdatedDate":"2025-02-25T11:48:41.94+02:00"}
{"Id":161168,"Number":274,"KnessetNum":14,"Name":"ישיבת מליאה בתאריך 11/01/1999 בשעה 16:03","StartDate":"1999-01-11T16:03:00+02:00","FinishDate":"1999-01-11T21:06:00+02:00","IsSpecialMeeting":null,"LastUpdatedDate":"2020-06-11T11:33:25.913+03:00"}
{"Id":161169,"Number":275,"KnessetNum":14,"Name":"ישיבת מליאה בתאריך 12/01/1999 בשעה 16:06","StartDate":"1999-01-12T16:06:00+02:00","FinishDate":"1999-01-12T19:24:00+02:00","IsSpecialMeeting":null,"LastUpdatedDate":"2025-02-25T12:22:10.763+02:00"}
{"Id":161173,"Number":279,"KnessetNum":14,"Name":"ישיבת מליאה בתאריך 20/01/1999 בשעה 11:08","StartDate":"1999-01-20T11:08:00+02:00","FinishDate":"1999-01-20T15:17:00+02:00","IsSpecialMeeting":null,"LastUpdatedDate":"2020-06-11T10:38:46.81+03:00"}
{"Id":161174,"Number":280,"KnessetNum":14,"Name":"ישיבת מליאה בתאריך 25/01/1999 בשעה 16:06","StartDate":"1999-01-25T16:06:00+02:00","FinishDate":"1999-01-26T13:27:00+02:00","IsSpecialMeeting":null,"LastUpdatedDate":"2020-06-11T10:15:57.983+03:00"}
{"Id":161175,"Number":281,"KnessetNum":14,"Name":"ישיבת מליאה בתאריך 26/01/1999 בשעה 16:01","StartDate":"1999-01-26T16:01:00+02:00","FinishDate":"1999-01-26T21:15:00+02:00","IsSpecialMeeting":null,"LastUpdatedDate":"2025-02-25T12:23:46.653+02:00"}
{"Id":161176,"Number":283,"KnessetNum":14,"Name":"ישיבת מליאה בתאריך 01/02/1999 בשעה 16:10","StartDate":"1999-02-01T16:10:00+02:00","FinishDate":"1999-02-01T21:06:00+02:00","IsSpecialMeeting":null,"LastUpdatedDate":"2025-02-25T12:19:53.97+02:00"}
{"Id":161179,"Number":285,"KnessetNum":14,"Name":"ישיבת מליאה בתאריך 23/02/1999 בשעה 11:07","StartDate":"1999-02-23T11:07:00+02:00","FinishDate":"1999-02-23T15:35:00+02:00","IsSpecialMeeting":true,"LastUpdatedDate":"2025-02-25T12:26:52.743+02:00"}
{"Id":161187,"Number":19,"KnessetNum":15,"Name":"ישיבת מליאה בתאריך 26/07/1999 בשעה 16:00","StartDate":"1999-07-26T16:00:00+03:00","FinishDate":"1999-07-26T22:04:00+03:00","IsSpecialMeeting":null,"LastUpdatedDate":"2025-02-25T14:43:11.477+02:00"}
{"Id":161188,"Number":20,"KnessetNum":15,"Name":"ישיבת מליאה בתאריך 27/07/1999 בשעה 16:00","StartDate":"1999-07-27T16:00:00+03:00","FinishDate":"1999-07-28T00:44:00+03:00","IsSpecialMeeting":null,"LastUpdatedDate":"2025-02-25T14:44:05.76+02:00"}
{"Id":161192,"Number":23,"KnessetNum":15,"Name":"ישיבת מליאה בתאריך 05/08/1999 בשעה 12:00","StartDate":"1999-08-05T12:00:00+03:00","FinishDate":"1999-08-05T15:16:00+03:00","IsSpecialMeeting":null,"LastUpdatedDate":"2025-02-25T15:08:05.097+02:00"}
{"Id":161194,"Number":28,"KnessetNum":15,"Name":"ישיבת מליאה בתאריך 04/10/1999 בשעה 16:04","StartDate":"1999-10-04T16:04:00+02:00","FinishDate":"1999-10-04T20:06:00+02:00","IsSpecialMeeting":null,"LastUpdatedDate":"2025-02-25T15:25:44.54+02:00"}
{"Id":161195,"Number":30,"KnessetNum":15,"Name":"ישיבת מליאה בתאריך 06/10/1999 בשעה 11:01","StartDate":"1999-10-06T11:01:00+02:00","FinishDate":"1999-10-06T17:53:00+02:00","IsSpecialMeeting":null,"LastUpdatedDate":"2025-02-25T15:47:35.7+02:00"}
{"Id":161196,"Number":31,"KnessetNum":15,"Name":"ישיבת מליאה בתאריך 11/10/1999 בשעה 16:01","StartDate":"1999-10-11T16:01:00+02:00","FinishDate":"1999-10-11T21:38:00+02:00","IsSpecialMeeting":null,"LastUpdatedDate":"2025-02-25T15:49:37.59+02:00"}
{"Id":161197,"Number":33,"KnessetNum":15,"Name":"ישיבת מליאה בתאריך 13/10/1999 בשעה 11:01","StartDate":"1999-10-13T11:01:00+02:00","FinishDate":"1999-10-13T17:32:00+02:00","IsSpecialMeeting":null,"LastUpdatedDate":"2025-02-25T15:51:07.127+02:00"}
{"Id":161198,"Number":34,"KnessetNum":15,"Name":"ישיבת מליאה בתאריך 18/10/1999 בשעה 16:00","StartDate":"1999-10-18T16:00:00+02:00","FinishDate":"1999-10-18T20:29:00+02:00","IsSpecialMeeting":null,"LastUpdatedDate":"2025-02-25T15:51:41.58+02:00"}
{"Id":161199,"Number":36,"KnessetNum":15,"Name":"ישיבת מליאה בתאריך 20/10/1999 בשעה 11:00","StartDate":"1999-10-20T11:00:00+02:00","FinishDate":"1999-10-20T19:30:00+02:00","IsSpecialMeeting":null,"LastUpdatedDate":"2025-02-25T15:52:59.333+02:00"}
{"Id":161200,"Number":38,"KnessetNum":15,"Name":"ישיבת מליאה בתאריך 25/10/1999 בשעה 16:02","StartDate":"1999-10-25T16:02:00+02:00","FinishDate":"1999-10-25T19:42:00+02:00","IsSpecialMeeting":null,"LastUpdatedDate":"2025-02-25T15:55:37.12+02:00"}
{"Id":161201,"Number":40,"KnessetNum":15,"Name":"ישיבת מליאה בתאריך 27/10/1999 בשעה 11:01","StartDate":"1999-10-27T11:01:00+02:00","FinishDate":"1999-10-27T17:07:00+02:00","IsSpecialMeeting":null,"LastUpdatedDate":"2025-02-25T15:57:07+02:00"}
{"Id":161202,"Number":41,"KnessetNum":15,"Name":"ישיבת מליאה בתאריך 01/11/1999 בשעה 16:01","StartDate":"1999-11-01T16:01:00+02:00","FinishDate":"1999-11-01T20:55:00+02:00","IsSpecialMeeting":null,"LastUpdatedDate":"2025-02-25T15:57:35.063+02:00"}
{"Id":161203,"Number":43,"KnessetNum":15,"Name":"ישיבת מליאה בתאריך 03/11/1999 בשעה 11:01","StartDate":"1999-11-03T11:01:00+02:00","FinishDate":"1999-11-03T17:12:00+02:00","IsSpecialMeeting":null,"LastUpdatedDate":"2025-02-25T16:09:48.277+02:00"}
{"Id":161204,"Number":44,"KnessetNum":15,"Name":"ישיבת מליאה בתאריך 08/11/1999 בשעה 16:01","StartDate":"1999-11-08T16:01:00+02:00","FinishDate":"1999-11-08T19:18:00+02:00","IsSpecialMeeting":null,"LastUpdatedDate":"2025-02-25T16:10:33.53+02:00"}
{"Id":161205,"Number":45,"KnessetNum":15,"Name":"ישיבת מליאה בתאריך 09/11/1999 בשעה 16:01","StartDate":"1999-11-09T16:01:00+02:00","FinishDate":"1999-11-09T20:49:00+02:00","IsSpecialMeeting":null,"LastUpdatedDate":"2025-02-25T16:12:39.38+02:00"}
{"Id":161206,"Number":46,"KnessetNum":15,"Name":"ישיבת מליאה בתאריך 10/11/1999 בשעה 11:01","StartDate":"1999-11-10T11:01:00+02:00","FinishDate":"1999-11-10T19:40:00+02:00","IsSpecialMeeting":null,"LastUpdatedDate":"2025-02-25T16:13:20.96+02:00"}
{"Id":161207,"Number":47,"KnessetNum":15,"Name":"ישיבת מליאה בתאריך 15/11/1999 בשעה 16:05","StartDate":"1999-11-15T16:05:00+02:00","FinishDate":"1999-11-15T19:43:00+02:00","IsSpecialMeeting":null,"LastUpdatedDate":"2025-02-25T16:14:43.553+02:00"}
{"Id":161214,"Number":55,"KnessetNum":15,"Name":"ישיבת מליאה בתאריך 01/12/1999 בשעה 11:02","StartDate":"1999-12-01T11:02:00+02:00","FinishDate":"1999-12-01T17:21:00+02:00","IsSpecialMeeting":null,"LastUpdatedDate":"2025-02-26T08:27:56.45+02:00"}
{"Id":161215,"Number":56,"KnessetNum":15,"Name":"ישיבת מליאה בתאריך 06/12/1999 בשעה 14:02","StartDate":"1999-12-06T14:02:00+02:00","FinishDate":"1999-12-06T16:12:00+02:00","IsSpecialMeeting":null,"LastUpdatedDate":"2025-02-26T08:35:00.943+02:00"}
{"Id":161217,"Number":59,"KnessetNum":15,"Name":"ישיבת מליאה בתאריך 13/12/1999 בשעה 16:02","StartDate":"1999-12-13T16:02:00+02:00","FinishDate":"1999-12-13T23:04:00+02:00","IsSpecialMeeting":null,"LastUpdatedDate":"2025-02-26T08:42:49.533+02:00"}
{"Id":161219,"Number":62,"KnessetNum":15,"Name":"ישיבת מליאה בתאריך 20/12/1999 בשעה 16:02","StartDate":"1999-12-20T16:02:00+02:00","FinishDate":"1999-12-20T19:42:00+02:00","IsSpecialMeeting":null,"LastUpdatedDate":"2025-02-26T09:05:59.563+02:00"}
{"Id":161220,"Number":63,"KnessetNum":15,"Name":"ישיבת מליאה בתאריך 21/12/1999 בשעה 16:01","StartDate":"1999-12-21T16:01:00+02:00","FinishDate":"1999-12-21T21:11:00+02:00","IsSpecialMeeting":null,"LastUpdatedDate":"2025-02-26T09:11:04.227+02:00"}
{"Id":161221,"Number":64,"KnessetNum":15,"Name":"ישיבת מליאה בתאריך 22/12/1999 בשעה 11:02","StartDate":"1999-12-22T11:02:00+02:00","FinishDate":"1999-12-22T18:46:00+02:00","IsSpecialMeeting":null,"LastUpdatedDate":"2025-02-26T09:12:14.55+02:00"}
{"Id":161228,"Number":69,"KnessetNum":15,"Name":"ישיבת מליאה בתאריך 10/01/2000 בשעה 16:03","StartDate":"2000-01-10T16:03:00+02:00","FinishDate":"2000-01-10T19:03:00+02:00","IsSpecialMeeting":null,"LastUpdatedDate":"2025-02-26T09:57:29.453+02:00"}
{"Id":161230,"Number":71,"KnessetNum":15,"Name":"ישיבת מליאה בתאריך 12/01/2000 בשעה 11:01","StartDate":"2000-01-12T11:01:00+02:00","FinishDate":"2000-01-12T22:31:00+02:00","IsSpecialMeeting":null,"LastUpdatedDate":"2025-02-26T10:05:21.767+02:00"}
{"Id":161231,"Number":72,"KnessetNum":15,"Name":"ישיבת מליאה בתאריך 17/01/2000 בשעה 16:02","StartDate":"2000-01-17T16:02:00+02:00","FinishDate":"2000-01-17T22:31:00+02:00","IsSpecialMeeting":null,"LastUpdatedDate":"2025-02-26T10:06:30.547+02:00"}
{"Id":161235,"Number":76,"KnessetNum":15,"Name":"ישיבת מליאה בתאריך 25/01/2000 בשעה 16:00","StartDate":"2000-01-25T16:00:00+02:00","FinishDate":"2000-01-25T19:08:00+02:00","IsSpecialMeeting":null,"LastUpdatedDate":"2025-02-26T10:16:49.43+02:00"}
{"Id":161236,"Number":77,"KnessetNum":15,"Name":"ישיבת מליאה בתאריך 26/01/2000 בשעה 11:02","StartDate":"2000-01-26T11:02:00+02:00","FinishDate":"2000-01-26T17:36:00+02:00","IsSpecialMeeting":null,"LastUpdatedDate":"2025-02-26T10:17:31.497+02:00"}
{"Id":161237,"Number":78,"KnessetNum":15,"Name":"ישיבת מליאה בתאריך 31/01/2000 בשעה 16:03","StartDate":"2000-01-31T16:03:00+02:00","FinishDate":"2000-01-31T19:31:00+02:00","IsSpecialMeeting":null,"LastUpdatedDate":"2025-02-26T10:20:48.53+02:00"}
{"Id":161238,"Number":79,"KnessetNum":15,"Name":"ישיבת מליאה בתאריך 01/02/2000 בשעה 16:02","StartDate":"2000-02-01T16:02:00+02:00","FinishDate":"2000-02-01T21:17:00+02:00","IsSpecialMeeting":null,"LastUpdatedDate":"2025-02-26T10:21:14.947+02:00"}
{"Id":161241,"Number":83,"KnessetNum":15,"Name":"ישיבת מליאה בתאריך 09/02/2000 בשעה 11:00","StartDate":"2000-02-09T11:00:00+02:00","FinishDate":"2000-02-09T18:48:00+02:00","IsSpecialMeeting":null,"LastUpdatedDate":"2025-02-26T10:39:01.033+02:00"}
{"Id":161246,"Number":86,"KnessetNum":15,"Name":"ישיבת מליאה בתאריך 16/02/2000 בשעה 11:01","StartDate":"2000-02-16T11:01:00+02:00","FinishDate":"2000-02-16T19:59:00+02:00","IsSpecialMeeting":null,"LastUpdatedDate":"2025-02-26T10:45:40.627+02:00"}
{"Id":161247,"Number":87,"KnessetNum":15,"Name":"ישיבת מליאה בתאריך 21/02/2000 בשעה 16:03","StartDate":"2000-02-21T16:03:00+02:00","FinishDate":"2000-02-21T22:54:00+02:00","IsSpecialMeeting":null,"LastUpdatedDate":"2025-02-26T10:49:03.083+02:00"}
{"Id":161250,"Number":90,"KnessetNum":15,"Name":"ישיבת מליאה בתאריך 28/02/2000 בשעה 16:02","StartDate":"2000-02-28T16:02:00+02:00","FinishDate":"2000-02-28T21:50:00+02:00","IsSpecialMeeting":null,"LastUpdatedDate":"2025-02-26T10:55:54.333+02:00"}
{"Id":161251,"Number":91,"KnessetNum":15,"Name":"ישיבת מליאה בתאריך 29/02/2000 בשעה 16:01","StartDate":"2000-02-29T16:01:00+02:00","FinishDate":"2000-02-29T21:15:00+02:00","IsSpecialMeeting":null,"LastUpdatedDate":"2025-02-26T10:56:21.86+02:00"}
{"Id":161255,"Number":95,"KnessetNum":15,"Name":"ישיבת מליאה בתאריך 08/03/2000 בשעה 11:02","StartDate":"2000-03-08T11:02:00+02:00","FinishDate":"2000-03-08T18:42:00+02:00","IsSpecialMeeting":null,"LastUpdatedDate":"2025-02-26T11:02:59.303+02:00"}
{"Id":161256,"Number":96,"KnessetNum":15,"Name":"ישיבת מליאה בתאריך 13/03/2000 בשעה 11:02","StartDate":"2000-03-13T11:02:00+02:00","FinishDate":"2000-03-13T21:40:00+02:00","IsSpecialMeeting":null,"LastUpdatedDate":"2025-02-26T11:03:31.843+02:00"}
{"Id":161258,"Number":99,"KnessetNum":15,"Name":"ישיבת מליאה בתאריך 27/03/2000 בשעה 16:03","StartDate":"2000-03-27T16:03:00+02:00","FinishDate":null,"IsSpecialMeeting":null,"LastUpdatedDate":"2025-02-26T11:05:34.333+02:00"}
{"Id":161259,"Number":100,"KnessetNum":15,"Name":"ישיבת מליאה בתאריך 28/03/2000 בשעה 11:01","StartDate":"2000-03-28T11:01:00+02:00","FinishDate":"2000-03-28T23:00:00+02:00","IsSpecialMeeting":null,"LastUpdatedDate":"2025-02-26T11:07:53.777+02:00"}
{"Id":161260,"Number":101,"KnessetNum":15,"Name":"ישיבת מליאה בתאריך 29/03/2000 בשעה 09:02","StartDate":"2000-03-29T09:02:00+02:00","FinishDate":"2000-03-29T17:20:00+02:00","IsSpecialMeeting":null,"LastUpdatedDate":"2025-02-26T11:09:27.183+02:00"}
{"Id":161261,"Number":102,"KnessetNum":15,"Name":"ישיבת מליאה בתאריך 12/04/2000 בשעה 11:01","StartDate":"2000-04-12T11:01:00+03:00","FinishDate":"2000-04-12T13:47:00+03:00","IsSpecialMeeting":true,"LastUpdatedDate":"2025-02-26T11:23:04.737+02:00"}
{"Id":161262,"Number":103,"KnessetNum":15,"Name":"ישיבת מליאה בתאריך 01/05/2000 בשעה 11:07","StartDate":"2000-05-01T11:07:00+03:00","FinishDate":"2000-05-01T14:48:00+03:00","IsSpecialMeeting":null,"LastUpdatedDate":"2025-02-26T11:24:18.83+02:00"}
{"Id":161264,"Number":105,"KnessetNum":15,"Name":"ישיבת מליאה בתאריך 16/05/2000 בשעה 16:02","StartDate":"2000-05-16T16:02:00+03:00","FinishDate":"2000-05-16T20:02:00+03:00","IsSpecialMeeting":null,"LastUpdatedDate":"2025-02-26T11:25:37.817+02:00"}
{"Id":161265,"Number":106,"KnessetNum":15,"Name":"ישיבת מליאה בתאריך 17/05/2000 בשעה 11:00","StartDate":"2000-05-17T11:00:00+03:00","FinishDate":"2000-05-17T18:11:00+03:00","IsSpecialMeeting":null,"LastUpdatedDate":"2025-02-26T11:35:01.053+02:00"}
{"Id":161267,"Number":107,"KnessetNum":15,"Name":"ישיבת מליאה בתאריך 22/05/2000 בשעה 15:03","StartDate":"2000-05-22T15:03:00+03:00","FinishDate":"2000-05-22T20:50:00+03:00","IsSpecialMeeting":null,"LastUpdatedDate":"2025-02-26T11:38:33.343+02:00"}
{"Id":161268,"Number":109,"KnessetNum":15,"Name":"ישיבת מליאה בתאריך 24/05/2000 בשעה 11:02","StartDate":"2000-05-24T11:02:00+03:00","FinishDate":"2000-05-24T15:56:00+03:00","IsSpecialMeeting":null,"LastUpdatedDate":"2025-02-26T11:43:06.273+02:00"}
{"Id":161274,"Number":116,"KnessetNum":15,"Name":"ישיבת מליאה בתאריך 07/06/2000 בשעה 11:02","StartDate":"2000-06-07T11:02:00+03:00","FinishDate":"2000-06-07T19:30:00+03:00","IsSpecialMeeting":null,"LastUpdatedDate":"2025-02-26T11:57:25.52+02:00"}
{"Id":161275,"Number":117,"KnessetNum":15,"Name":"ישיבת מליאה בתאריך 12/06/2000 בשעה 16:02","StartDate":"2000-06-12T16:02:00+03:00","FinishDate":"2000-06-12T21:39:00+03:00","IsSpecialMeeting":null,"LastUpdatedDate":"2025-02-26T11:58:13.45+02:00"}
{"Id":161276,"Number":118,"KnessetNum":15,"Name":"ישיבת מליאה בתאריך 13/06/2000 בשעה 16:03","StartDate":"2000-06-13T16:03:00+03:00","FinishDate":"2000-06-13T19:22:00+03:00","IsSpecialMeeting":null,"LastUpdatedDate":"2025-02-26T12:02:56.207+02:00"}
{"Id":161277,"Number":119,"KnessetNum":15,"Name":"ישיבת מליאה בתאריך 14/06/2000 בשעה 11:03","StartDate":"2000-06-14T11:03:00+03:00","FinishDate":"2000-06-14T18:58:00+03:00","IsSpecialMeeting":null,"LastUpdatedDate":"2025-02-26T12:04:14.993+02:00"}
{"Id":161278,"Number":120,"KnessetNum":15,"Name":"ישיבת מליאה בתאריך 19/06/2000 בשעה 16:02","StartDate":"2000-06-19T16:02:00+03:00","FinishDate":"2000-06-19T22:27:00+03:00","IsSpecialMeeting":null,"LastUpdatedDate":"2025-02-26T12:05:11.687+02:00"}
{"Id":161280,"Number":122,"KnessetNum":15,"Name":"ישיבת מליאה בתאריך 21/06/2000 בשעה 11:04","StartDate":"2000-06-21T11:04:00+03:00","FinishDate":"2000-06-21T19:51:00+03:00","IsSpecialMeeting":null,"LastUpdatedDate":"2025-02-26T12:07:00.9+02:00"}
{"Id":161282,"Number":124,"KnessetNum":15,"Name":"ישיבת מליאה בתאריך 27/06/2000 בשעה 16:03","StartDate":"2000-06-27T16:03:00+03:00","FinishDate":"2000-06-27T19:57:00+03:00","IsSpecialMeeting":null,"LastUpdatedDate":"2025-02-26T12:08:30.63+02:00"}
{"Id":161284,"Number":126,"KnessetNum":15,"Name":"ישיבת מליאה בתאריך 03/07/2000 בשעה 16:03","StartDate":"2000-07-03T16:03:00+03:00","FinishDate":"2000-07-03T22:59:00+03:00","IsSpecialMeeting":null,"LastUpdatedDate":"2025-02-26T12:12:34.437+02:00"}
{"Id":161287,"Number":129,"KnessetNum":15,"Name":"ישיבת מליאה בתאריך 10/07/2000 בשעה 16:03","StartDate":"2000-07-10T16:03:00+03:00","FinishDate":"2000-07-10T21:56:00+03:00","IsSpecialMeeting":null,"LastUpdatedDate":"2025-02-26T12:54:33.24+02:00"}
{"Id":161289,"Number":131,"KnessetNum":15,"Name":"ישיבת מליאה בתאריך 12/07/2000 בשעה 11:02","StartDate":"2000-07-12T11:02:00+03:00","FinishDate":"2000-07-12T18:05:00+03:00","IsSpecialMeeting":null,"LastUpdatedDate":"2025-02-27T08:17:37.507+02:00"}
{"Id":161295,"Number":137,"KnessetNum":15,"Name":"ישיבת מליאה בתאריך 26/07/2000 בשעה 11:02","StartDate":"2000-07-26T11:02:00+03:00","FinishDate":null,"IsSpecialMeeting":null,"LastUpdatedDate":"2024-02-11T12:44:36.347+02:00"}
{"Id":161301,"Number":147,"KnessetNum":15,"Name":"ישיבת מליאה בתאריך 01/11/2000 בשעה 11:01","StartDate":"2000-11-01T11:01:00+02:00","FinishDate":"2000-11-01T15:11:00+02:00","IsSpecialMeeting":null,"LastUpdatedDate":"2025-02-27T09:47:34.723+02:00"}
{"Id":161302,"Number":148,"KnessetNum":15,"Name":"ישיבת מליאה בתאריך 06/11/2000 בשעה 16:00","StartDate":"2000-11-06T16:00:00+02:00","FinishDate":"2000-11-06T20:27:00+02:00","IsSpecialMeeting":null,"LastUpdatedDate":"2025-02-27T09:48:33.233+02:00"}
{"Id":161305,"Number":152,"KnessetNum":15,"Name":"ישיבת מליאה בתאריך 13/11/2000 בשעה 16:01","StartDate":"2000-11-13T16:01:00+02:00","FinishDate":null,"IsSpecialMeeting":null,"LastUpdatedDate":"2025-02-27T09:55:54.477+02:00"}
{"Id":161309,"Number":156,"KnessetNum":15,"Name":"ישיבת מליאה בתאריך 21/11/2000 בשעה 15:02","StartDate":"2000-11-21T15:02:00+02:00","FinishDate":"2000-11-21T21:47:00+02:00","IsSpecialMeeting":null,"LastUpdatedDate":"2025-02-27T10:03:12.387+02:00"}
{"Id":161315,"Number":162,"KnessetNum":15,"Name":"ישיבת מליאה בתאריך 05/12/2000 בשעה 16:01","StartDate":"2000-12-05T16:01:00+02:00","FinishDate":"2000-12-05T22:28:00+02:00","IsSpecialMeeting":null,"LastUpdatedDate":"2025-02-27T10:14:05.43+02:00"}
{"Id":161316,"Number":163,"KnessetNum":15,"Name":"ישיבת מליאה בתאריך 06/12/2000 בשעה 11:02","StartDate":"2000-12-06T11:02:00+02:00","FinishDate":"2000-12-06T18:58:00+02:00","IsSpecialMeeting":null,"LastUpdatedDate":"2025-02-27T10:14:47.43+02:00"}
{"Id":161317,"Number":164,"KnessetNum":15,"Name":"ישיבת מליאה בתאריך 11/12/2000 בשעה 16:03","StartDate":"2000-12-11T16:03:00+02:00","FinishDate":"2000-12-11T20:57:00+02:00","IsSpecialMeeting":null,"LastUpdatedDate":"2025-02-27T10:15:33.06+02:00"}
{"Id":161318,"Number":165,"KnessetNum":15,"Name":"ישיבת מליאה בתאריך 12/12/2000 בשעה 16:04","StartDate":"2000-12-12T16:04:00+02:00","FinishDate":"2000-12-12T20:30:00+02:00","IsSpecialMeeting":null,"LastUpdatedDate":"2025-02-27T10:16:30.16+02:00"}
{"Id":161319,"Number":166,"KnessetNum":15,"Name":"ישיבת מליאה בתאריך 13/12/2000 בשעה 11:02","StartDate":"2000-12-13T11:02:00+02:00","FinishDate":"2000-12-13T19:34:00+02:00","IsSpecialMeeting":null,"LastUpdatedDate":"2025-02-27T10:17:00.99+02:00"}
{"Id":161321,"Number":168,"KnessetNum":15,"Name":"ישיבת מליאה בתאריך 19/12/2000 בשעה 16:01","StartDate":"2000-12-19T16:01:00+02:00","FinishDate":"2000-12-19T21:03:00+02:00","IsSpecialMeeting":null,"LastUpdatedDate":"2025-02-27T10:19:03.23+02:00"}
{"Id":161323,"Number":170,"KnessetNum":15,"Name":"ישיבת מליאה בתאריך 01/01/2001 בשעה 11:02","StartDate":"2001-01-01T11:02:00+02:00","FinishDate":"2001-01-02T01:13:00+02:00","IsSpecialMeeting":null,"LastUpdatedDate":"2025-02-27T10:23:58.957+02:00"}
{"Id":161324,"Number":171,"KnessetNum":15,"Name":"ישיבת מליאה בתאריך 09/01/2001 בשעה 12:04","StartDate":"2001-01-09T12:04:00+02:00","FinishDate":"2001-01-09T12:59:00+02:00","IsSpecialMeeting":true,"LastUpdatedDate":"2025-02-27T10:30:17.66+02:00"}
{"Id":161325,"Number":172,"KnessetNum":15,"Name":"ישיבת מליאה בתאריך 24/01/2001 בשעה 11:02","StartDate":"2001-01-24T11:02:00+02:00","FinishDate":"2001-01-24T12:06:00+02:00","IsSpecialMeeting":null,"LastUpdatedDate":"2025-02-27T10:30:43.003+02:00"}
{"Id":161326,"Number":173,"KnessetNum":15,"Name":"ישיבת מליאה בתאריך 13/02/2001 בשעה 16:02","StartDate":"2001-02-13T16:02:00+02:00","FinishDate":"2001-02-13T21:21:00+02:00","IsSpecialMeeting":null,"LastUpdatedDate":"2025-02-27T10:32:08.267+02:00"}
{"Id":161327,"Number":174,"KnessetNum":15,"Name":"ישיבת מליאה בתאריך 14/02/2001 בשעה 11:05","StartDate":"2001-02-14T11:05:00+02:00","FinishDate":"2001-02-14T17:16:00+02:00","IsSpecialMeeting":null,"LastUpdatedDate":"2025-02-27T10:33:59.763+02:00"}
{"Id":161330,"Number":176,"KnessetNum":15,"Name":"ישיבת מליאה בתאריך 20/02/2001 בשעה 16:01","StartDate":"2001-02-20T16:01:00+02:00","FinishDate":"2001-02-20T20:26:00+02:00","IsSpecialMeeting":null,"LastUpdatedDate":"2025-02-27T10:34:58.92+02:00"}
{"Id":161335,"Number":183,"KnessetNum":15,"Name":"ישיבת מליאה בתאריך 07/03/2001 בשעה 11:00","StartDate":"2001-03-07T11:00:00+02:00","FinishDate":"2001-03-07T23:04:00+02:00","IsSpecialMeeting":null,"LastUpdatedDate":"2025-02-27T11:02:05.68+02:00"}
{"Id":161336,"Number":184,"KnessetNum":15,"Name":"ישיבת מליאה בתאריך 12/03/2001 בשעה 16:02","StartDate":"2001-03-12T16:02:00+02:00","FinishDate":"2001-03-12T19:45:00+02:00","IsSpecialMeeting":null,"LastUpdatedDate":"2025-02-27T11:16:32.903+02:00"}
{"Id":161338,"Number":187,"KnessetNum":15,"Name":"ישיבת מליאה בתאריך 19/03/2001 בשעה 15:03","StartDate":"2001-03-19T15:03:00+02:00","FinishDate":"2001-03-19T20:25:00+02:00","IsSpecialMeeting":null,"LastUpdatedDate":"2025-02-27T11:17:55.03+02:00"}
{"Id":161342,"Number":191,"KnessetNum":15,"Name":"ישיבת מליאה בתאריך 27/03/2001 בשעה 10:01","StartDate":"2001-03-27T10:01:00+02:00","FinishDate":"2001-03-27T23:58:00+02:00","IsSpecialMeeting":null,"LastUpdatedDate":"2025-02-27T11:22:20.497+02:00"}
{"Id":161343,"Number":192,"KnessetNum":15,"Name":"ישיבת מליאה בתאריך 28/03/2001 בשעה 08:08","StartDate":"2001-03-28T08:08:00+02:00","FinishDate":"2001-03-28T17:23:00+02:00","IsSpecialMeeting":null,"LastUpdatedDate":"2025-02-27T11:23:38.223+02:00"}
{"Id":161345,"Number":195,"KnessetNum":15,"Name":"ישיבת מליאה בתאריך 07/05/2001 בשעה 16:01","StartDate":"2001-05-07T16:01:00+03:00","FinishDate":"2001-05-07T23:29:00+03:00","IsSpecialMeeting":null,"LastUpdatedDate":"2025-02-27T11:27:26.827+02:00"}
{"Id":161351,"Number":202,"KnessetNum":15,"Name":"ישיבת מליאה בתאריך 22/05/2001 בשעה 16:01","StartDate":"2001-05-22T16:01:00+03:00","FinishDate":"2001-05-22T19:55:00+03:00","IsSpecialMeeting":null,"LastUpdatedDate":"2025-02-27T11:45:14.23+02:00"}
{"Id":161354,"Number":205,"KnessetNum":15,"Name":"ישיבת מליאה בתאריך 04/06/2001 בשעה 16:01","StartDate":"2001-06-04T16:01:00+03:00","FinishDate":"2001-06-04T21:31:00+03:00","IsSpecialMeeting":null,"LastUpdatedDate":"2025-02-27T11:47:57.563+02:00"}
{"Id":161357,"Number":208,"KnessetNum":15,"Name":"ישיבת מליאה בתאריך 11/06/2001 בשעה 16:02","StartDate":"2001-06-11T16:02:00+03:00","FinishDate":"2001-06-11T21:56:00+03:00","IsSpecialMeeting":null,"LastUpdatedDate":"2025-02-27T11:51:26.233+02:00"}
{"Id":161358,"Number":209,"KnessetNum":15,"Name":"ישיבת מליאה בתאריך 12/06/2001 בשעה 16:02","StartDate":"2001-06-12T16:02:00+03:00","FinishDate":"2001-06-12T21:40:00+03:00","IsSpecialMeeting":null,"LastUpdatedDate":"2025-02-27T11:51:59.06+02:00"}
{"Id":161359,"Number":210,"KnessetNum":15,"Name":"ישיבת מליאה בתאריך 13/06/2001 בשעה 11:02","StartDate":"2001-06-13T11:02:00+03:00","FinishDate":"2001-06-13T16:23:00+03:00","IsSpecialMeeting":null,"LastUpdatedDate":"2025-02-27T11:52:26.637+02:00"}
{"Id":161361,"Number":212,"KnessetNum":15,"Name":"ישיבת מליאה בתאריך 19/06/2001 בשעה 16:02","StartDate":"2001-06-19T16:02:00+03:00","FinishDate":"2001-06-19T19:47:00+03:00","IsSpecialMeeting":null,"LastUpdatedDate":"2025-02-27T11:53:39.093+02:00"}
{"Id":161364,"Number":216,"KnessetNum":15,"Name":"ישיבת מליאה בתאריך 27/06/2001 בשעה 11:03","StartDate":"2001-06-27T11:03:00+03:00","FinishDate":"2001-06-27T19:34:00+03:00","IsSpecialMeeting":null,"LastUpdatedDate":"2025-02-27T11:59:09.16+02:00"}
{"Id":161365,"Number":217,"KnessetNum":15,"Name":"ישיבת מליאה בתאריך 02/07/2001 בשעה 16:03","StartDate":"2001-07-02T16:03:00+03:00","FinishDate":"2001-07-02T19:38:00+03:00","IsSpecialMeeting":null,"LastUpdatedDate":"2025-02-27T11:59:52.523+02:00"}
{"Id":161366,"Number":218,"KnessetNum":15,"Name":"ישיבת מליאה בתאריך 03/07/2001 בשעה 16:03","StartDate":"2001-07-03T16:03:00+03:00","FinishDate":"2001-07-03T19:32:00+03:00","IsSpecialMeeting":null,"LastUpdatedDate":"2025-02-27T12:01:00.167+02:00"}
{"Id":161373,"Number":224,"KnessetNum":15,"Name":"ישיבת מליאה בתאריך 17/07/2001 בשעה 16:04","StartDate":"2001-07-17T16:04:00+03:00","FinishDate":"2001-07-17T22:33:00+03:00","IsSpecialMeeting":null,"LastUpdatedDate":"2025-02-27T13:09:08.017+02:00"}
{"Id":161375,"Number":226,"KnessetNum":15,"Name":"ישיבת מליאה בתאריך 23/07/2001 בשעה 16:03","StartDate":"2001-07-23T16:03:00+03:00","FinishDate":"2001-07-23T22:19:00+03:00","IsSpecialMeeting":null,"LastUpdatedDate":"2025-02-27T13:12:20.503+02:00"}
{"Id":161378,"Number":230,"KnessetNum":15,"Name":"ישיבת מליאה בתאריך 29/08/2001 בשעה 12:06","StartDate":"2001-08-29T12:06:00+03:00","FinishDate":"2001-08-29T17:07:00+03:00","IsSpecialMeeting":true,"LastUpdatedDate":"2025-02-27T13:20:03.967+02:00"}
{"Id":161381,"Number":236,"KnessetNum":15,"Name":"ישיבת מליאה בתאריך 22/10/2001 בשעה 16:02","StartDate":"2001-10-22T16:02:00+02:00","FinishDate":"2001-10-22T19:46:00+02:00","IsSpecialMeeting":null,"LastUpdatedDate":"2025-02-27T13:27:39.477+02:00"}
{"Id":161383,"Number":238,"KnessetNum":15,"Name":"ישיבת מליאה בתאריך 24/10/2001 בשעה 11:01","StartDate":"2001-10-24T11:01:00+02:00","FinishDate":"2001-10-24T21:52:00+02:00","IsSpecialMeeting":null,"LastUpdatedDate":"2025-02-27T13:29:22.187+02:00"}
{"Id":161384,"Number":239,"KnessetNum":15,"Name":"ישיבת מליאה בתאריך 29/10/2001 בשעה 17:03","StartDate":"2001-10-29T17:03:00+02:00","FinishDate":"2001-10-29T17:40:00+02:00","IsSpecialMeeting":null,"LastUpdatedDate":"2025-02-27T13:30:05.71+02:00"}
{"Id":161385,"Number":240,"KnessetNum":15,"Name":"ישיבת מליאה בתאריך 30/10/2001 בשעה 16:03","StartDate":"2001-10-30T16:03:00+02:00","FinishDate":"2001-10-30T22:56:00+02:00","IsSpecialMeeting":null,"LastUpdatedDate":"2025-02-27T13:31:36.007+02:00"}
{"Id":161386,"Number":241,"KnessetNum":15,"Name":"ישיבת מליאה בתאריך 31/10/2001 בשעה 11:04","StartDate":"2001-10-31T11:04:00+02:00","FinishDate":"2001-10-31T19:11:00+02:00","IsSpecialMeeting":null,"LastUpdatedDate":"2025-03-03T08:40:22.747+02:00"}
{"Id":161387,"Number":242,"KnessetNum":15,"Name":"ישיבת מליאה בתאריך 05/11/2001 בשעה 16:05","StartDate":"2001-11-05T16:05:00+02:00","FinishDate":"2001-11-05T22:35:00+02:00","IsSpecialMeeting":null,"LastUpdatedDate":"2025-03-03T08:40:51.38+02:00"}
{"Id":161388,"Number":243,"KnessetNum":15,"Name":"ישיבת מליאה בתאריך 06/11/2001 בשעה 16:02","StartDate":"2001-11-06T16:02:00+02:00","FinishDate":"2001-11-07T01:02:00+02:00","IsSpecialMeeting":null,"LastUpdatedDate":"2025-03-03T08:42:00.56+02:00"}
{"Id":161389,"Number":244,"KnessetNum":15,"Name":"ישיבת מליאה בתאריך 07/11/2001 בשעה 11:03","StartDate":"2001-11-07T11:03:00+02:00","FinishDate":"2001-11-07T20:08:00+02:00","IsSpecialMeeting":null,"LastUpdatedDate":"2025-03-03T08:44:52.367+02:00"}
{"Id":161390,"Number":245,"KnessetNum":15,"Name":"ישיבת מליאה בתאריך 12/11/2001 בשעה 16:01","StartDate":"2001-11-12T16:01:00+02:00","FinishDate":"2001-11-12T19:52:00+02:00","IsSpecialMeeting":null,"LastUpdatedDate":"2025-03-03T08:45:43.933+02:00"}
{"Id":161392,"Number":247,"KnessetNum":15,"Name":"ישיבת מליאה בתאריך 14/11/2001 בשעה 11:05","StartDate":"2001-11-14T11:05:00+02:00","FinishDate":"2001-11-14T19:11:00+02:00","IsSpecialMeeting":null,"LastUpdatedDate":"2025-03-03T08:46:54.937+02:00"}
{"Id":161399,"Number":255,"KnessetNum":15,"Name":"ישיבת מליאה בתאריך 04/12/2001 בשעה 15:02","StartDate":"2001-12-04T15:02:00+02:00","FinishDate":"2001-12-04T19:44:00+02:00","IsSpecialMeeting":null,"LastUpdatedDate":"2025-03-03T09:42:50.56+02:00"}
{"Id":161403,"Number":259,"KnessetNum":15,"Name":"ישיבת מליאה בתאריך 12/12/2001 בשעה 09:02","StartDate":"2001-12-12T09:02:00+02:00","FinishDate":"2001-12-12T15:49:00+02:00","IsSpecialMeeting":null,"LastUpdatedDate":"2025-03-03T09:47:14.483+02:00"}
{"Id":161405,"Number":261,"KnessetNum":15,"Name":"ישיבת מליאה בתאריך 18/12/2001 בשעה 15:02","StartDate":"2001-12-18T15:02:00+02:00","FinishDate":"2001-12-18T21:42:00+02:00","IsSpecialMeeting":null,"LastUpdatedDate":"2025-03-03T09:48:31.613+02:00"}
{"Id":161406,"Number":262,"KnessetNum":15,"Name":"ישיבת מליאה בתאריך 19/12/2001 בשעה 11:02","StartDate":"2001-12-19T11:02:00+02:00","FinishDate":"2001-12-19T20:43:00+02:00","IsSpecialMeeting":null,"LastUpdatedDate":"2025-03-03T09:49:10.383+02:00"}
{"Id":161407,"Number":263,"KnessetNum":15,"Name":"ישיבת מליאה בתאריך 24/12/2001 בשעה 16:02","StartDate":"2001-12-24T16:02:00+02:00","FinishDate":"2001-12-24T20:44:00+02:00","IsSpecialMeeting":null,"LastUpdatedDate":"2025-03-03T09:49:49.763+02:00"}
{"Id":161408,"Number":264,"KnessetNum":15,"Name":"ישיבת מליאה בתאריך 25/12/2001 בשעה 15:00","StartDate":"2001-12-25T15:00:00+02:00","FinishDate":"2001-12-25T18:23:00+02:00","IsSpecialMeeting":null,"LastUpdatedDate":"2025-03-03T09:51:04.17+02:00"}
{"Id":161409,"Number":265,"KnessetNum":15,"Name":"ישיבת מליאה בתאריך 26/12/2001 בשעה 11:02","StartDate":"2001-12-26T11:02:00+02:00","FinishDate":"2001-12-26T18:35:00+02:00","IsSpecialMeeting":null,"LastUpdatedDate":"2025-03-03T09:52:07.107+02:00"}
{"Id":161410,"Number":266,"KnessetNum":15,"Name":"ישיבת מליאה בתאריך 31/12/2001 בשעה 16:01","StartDate":"2001-12-31T16:01:00+02:00","FinishDate":"2001-12-31T22:04:00+02:00","IsSpecialMeeting":null,"LastUpdatedDate":"2025-03-03T09:53:20.437+02:00"}
{"Id":161411,"Number":267,"KnessetNum":15,"Name":"ישיבת מליאה בתאריך 01/01/2002 בשעה 16:02","StartDate":"2002-01-01T16:02:00+02:00","FinishDate":"2002-01-01T19:40:00+02:00","IsSpecialMeeting":null,"LastUpdatedDate":"2025-03-03T09:52:46.34+02:00"}
{"Id":161417,"Number":273,"KnessetNum":15,"Name":"ישיבת מליאה בתאריך 15/01/2002 בשעה 16:01","StartDate":"2002-01-15T16:01:00+02:00","FinishDate":"2002-01-15T20:06:00+02:00","IsSpecialMeeting":null,"LastUpdatedDate":"2025-03-03T10:09:08.83+02:00"}
{"Id":161418,"Number":274,"KnessetNum":15,"Name":"ישיבת מליאה בתאריך 16/01/2002 בשעה 11:03","StartDate":"2002-01-16T11:03:00+02:00","FinishDate":"2002-01-16T19:03:00+02:00","IsSpecialMeeting":null,"LastUpdatedDate":"2025-03-03T10:09:42.197+02:00"}
{"Id":161419,"Number":275,"KnessetNum":15,"Name":"ישיבת מליאה בתאריך 21/01/2002 בשעה 16:02","StartDate":"2002-01-21T16:02:00+02:00","FinishDate":"2002-01-21T23:28:00+02:00","IsSpecialMeeting":null,"LastUpdatedDate":"2025-03-03T10:10:21.323+02:00"}
{"Id":161423,"Number":279,"KnessetNum":15,"Name":"ישיבת מליאה בתאריך 29/01/2002 בשעה 16:03","StartDate":"2002-01-29T16:03:00+02:00","FinishDate":"2002-01-29T20:59:00+02:00","IsSpecialMeeting":null,"LastUpdatedDate":"2025-03-03T10:18:53.653+02:00"}
{"Id":161424,"Number":280,"KnessetNum":15,"Name":"ישיבת מליאה בתאריך 30/01/2002 בשעה 11:04","StartDate":"2002-01-30T11:04:00+02:00","FinishDate":"2002-01-30T18:38:00+02:00","IsSpecialMeeting":null,"LastUpdatedDate":"2025-03-03T10:19:23.707+02:00"}
{"Id":161425,"Number":281,"KnessetNum":15,"Name":"ישיבת מליאה בתאריך 04/02/2002 בשעה 16:02","StartDate":"2002-02-04T16:02:00+02:00","FinishDate":"2002-02-05T00:04:00+02:00","IsSpecialMeeting":null,"LastUpdatedDate":"2025-03-03T10:23:33.04+02:00"}
{"Id":161428,"Number":285,"KnessetNum":15,"Name":"ישיבת מליאה בתאריך 13/02/2002 בשעה 11:02","StartDate":"2002-02-13T11:02:00+02:00","FinishDate":"2002-02-13T18:18:00+02:00","IsSpecialMeeting":null,"LastUpdatedDate":"2025-03-03T10:31:29.48+02:00"}
{"Id":161429,"Number":286,"KnessetNum":15,"Name":"ישיבת מליאה בתאריך 18/02/2002 בשעה 16:00","StartDate":"2002-02-18T16:00:00+02:00","FinishDate":null,"IsSpecialMeeting":null,"LastUpdatedDate":"2025-03-03T10:32:22.687+02:00"}
{"Id":161430,"Number":287,"KnessetNum":15,"Name":"ישיבת מליאה בתאריך 19/02/2002 בשעה 16:01","StartDate":"2002-02-19T16:01:00+02:00","FinishDate":"2002-02-19T20:15:00+02:00","IsSpecialMeeting":null,"LastUpdatedDate":"2025-03-03T10:32:58.357+02:00"}
{"Id":161431,"Number":288,"KnessetNum":15,"Name":"ישיבת מליאה בתאריך 20/02/2002 בשעה 11:03","StartDate":"2002-02-20T11:03:00+02:00","FinishDate":null,"IsSpecialMeeting":null,"LastUpdatedDate":"2025-03-03T10:33:34.073+02:00"}
{"Id":161432,"Number":289,"KnessetNum":15,"Name":"ישיבת מליאה בתאריך 04/03/2002 בשעה 15:02","StartDate":"2002-03-04T15:02:00+02:00","FinishDate":"2002-03-04T21:31:00+02:00","IsSpecialMeeting":null,"LastUpdatedDate":"2025-03-03T10:34:52.663+02:00"}
{"Id":161433,"Number":290,"KnessetNum":15,"Name":"ישיבת מליאה בתאריך 05/03/2002 בשעה 16:02","StartDate":"2002-03-05T16:02:00+02:00","FinishDate":"2002-03-05T20:15:00+02:00","IsSpecialMeeting":null,"LastUpdatedDate":"2025-03-03T10:35:37.463+02:00"}
{"Id":161434,"Number":291,"KnessetNum":15,"Name":"ישיבת מליאה בתאריך 06/03/2002 בשעה 11:04","StartDate":"2002-03-06T11:04:00+02:00","FinishDate":"2002-03-06T20:45:00+02:00","IsSpecialMeeting":null,"LastUpdatedDate":"2025-03-03T11:02:06.317+02:00"}
{"Id":161435,"Number":292,"KnessetNum":15,"Name":"ישיבת מליאה בתאריך 11/03/2002 בשעה 16:01","StartDate":"2002-03-11T16:01:00+02:00","FinishDate":"2002-03-11T22:35:00+02:00","IsSpecialMeeting":null,"LastUpdatedDate":"2025-03-03T11:03:30.673+02:00"}
{"Id":161436,"Number":293,"KnessetNum":15,"Name":"ישיבת מליאה בתאריך 12/03/2002 בשעה 16:03","StartDate":"2002-03-12T16:03:00+02:00","FinishDate":"2002-03-12T23:31:00+02:00","IsSpecialMeeting":null,"LastUpdatedDate":"2025-03-03T11:04:06.017+02:00"}
{"Id":161439,"Number":297,"KnessetNum":15,"Name":"ישיבת מליאה בתאריך 29/04/2002 בשעה 16:02","StartDate":"2002-04-29T16:02:00+03:00","FinishDate":"2002-04-29T19:47:00+03:00","IsSpecialMeeting":null,"LastUpdatedDate":"2025-03-03T11:06:50.697+02:00"}
{"Id":161443,"Number":301,"KnessetNum":15,"Name":"ישיבת מליאה בתאריך 07/05/2002 בשעה 16:02","StartDate":"2002-05-07T16:02:00+03:00","FinishDate":"2002-05-07T20:12:00+03:00","IsSpecialMeeting":null,"LastUpdatedDate":"2025-03-03T11:16:02.097+02:00"}
{"Id":161444,"Number":302,"KnessetNum":15,"Name":"ישיבת מליאה בתאריך 08/05/2002 בשעה 11:04","StartDate":"2002-05-08T11:04:00+03:00","FinishDate":"2002-05-08T17:41:00+03:00","IsSpecialMeeting":null,"LastUpdatedDate":"2025-03-03T11:18:06.217+02:00"}
{"Id":161445,"Number":303,"KnessetNum":15,"Name":"ישיבת מליאה בתאריך 13/05/2002 בשעה 16:04","StartDate":"2002-05-13T16:04:00+03:00","FinishDate":"2002-05-13T19:46:00+03:00","IsSpecialMeeting":null,"LastUpdatedDate":"2025-03-03T11:21:21.69+02:00"}
{"Id":161446,"Number":304,"KnessetNum":15,"Name":"ישיבת מליאה בתאריך 14/05/2002 בשעה 16:02","StartDate":"2002-05-14T16:02:00+03:00","FinishDate":"2002-05-14T21:56:00+03:00","IsSpecialMeeting":null,"LastUpdatedDate":"2025-03-03T11:21:55.127+02:00"}
{"Id":161447,"Number":305,"KnessetNum":15,"Name":"ישיבת מליאה בתאריך 15/05/2002 בשעה 11:02","StartDate":"2002-05-15T11:02:00+03:00","FinishDate":"2002-05-15T20:02:00+03:00","IsSpecialMeeting":null,"LastUpdatedDate":"2025-03-03T11:22:46.64+02:00"}
{"Id":161448,"Number":306,"KnessetNum":15,"Name":"ישיבת מליאה בתאריך 20/05/2002 בשעה 16:02","StartDate":"2002-05-20T16:02:00+03:00","FinishDate":"2002-05-20T22:58:00+03:00","IsSpecialMeeting":null,"LastUpdatedDate":"2025-03-03T11:26:40.68+02:00"}
{"Id":161449,"Number":307,"KnessetNum":15,"Name":"ישיבת מליאה בתאריך 21/05/2002 בשעה 15:06","StartDate":"2002-05-21T15:06:00+03:00","FinishDate":"2002-05-21T20:15:00+03:00","IsSpecialMeeting":null,"LastUpdatedDate":"2025-03-03T11:32:49.767+02:00"}
{"Id":161450,"Number":308,"KnessetNum":15,"Name":"ישיבת מליאה בתאריך 22/05/2002 בשעה 11:04","StartDate":"2002-05-22T11:04:00+03:00","FinishDate":"2002-05-22T19:26:00+03:00","IsSpecialMeeting":null,"LastUpdatedDate":"2025-03-03T11:35:09.947+02:00"}
{"Id":161451,"Number":309,"KnessetNum":15,"Name":"ישיבת מליאה בתאריך 27/05/2002 בשעה 16:02","StartDate":"2002-05-27T16:02:00+03:00","FinishDate":"2002-05-27T19:23:00+03:00","IsSpecialMeeting":null,"LastUpdatedDate":"2025-03-03T11:38:53.16+02:00"}
{"Id":161452,"Number":310,"KnessetNum":15,"Name":"ישיבת מליאה בתאריך 28/05/2002 בשעה 16:02","StartDate":"2002-05-28T16:02:00+03:00","FinishDate":"2002-05-28T18:50:00+03:00","IsSpecialMeeting":null,"LastUpdatedDate":"2025-03-03T11:40:55.003+02:00"}
{"Id":161453,"Number":311,"KnessetNum":15,"Name":"ישיבת מליאה בתאריך 29/05/2002 בשעה 11:06","StartDate":"2002-05-29T11:06:00+03:00","FinishDate":"2002-05-29T18:17:00+03:00","IsSpecialMeeting":null,"LastUpdatedDate":"2025-03-03T11:48:27.273+02:00"}
{"Id":161454,"Number":312,"KnessetNum":15,"Name":"ישיבת מליאה בתאריך 03/06/2002 בשעה 16:01","StartDate":"2002-06-03T16:01:00+03:00","FinishDate":"2002-06-03T21:01:00+03:00","IsSpecialMeeting":null,"LastUpdatedDate":"2025-03-03T11:49:01.303+02:00"}
{"Id":161455,"Number":313,"KnessetNum":15,"Name":"ישיבת מליאה בתאריך 04/06/2002 בשעה 16:02","StartDate":"2002-06-04T16:02:00+03:00","FinishDate":"2002-06-04T20:20:00+03:00","IsSpecialMeeting":null,"LastUpdatedDate":"2025-03-03T11:49:38.667+02:00"}
{"Id":161456,"Number":314,"KnessetNum":15,"Name":"ישיבת מליאה בתאריך 05/06/2002 בשעה 11:01","StartDate":"2002-06-05T11:01:00+03:00","FinishDate":"2002-06-06T01:22:00+03:00","IsSpecialMeeting":null,"LastUpdatedDate":"2025-03-03T11:52:58.123+02:00"}
{"Id":161457,"Number":315,"KnessetNum":15,"Name":"ישיבת מליאה בתאריך 10/06/2002 בשעה 16:01","StartDate":"2002-06-10T16:01:00+03:00","FinishDate":"2002-06-10T19:51:00+03:00","IsSpecialMeeting":null,"LastUpdatedDate":"2025-03-03T11:55:56.307+02:00"}
{"Id":161459,"Number":317,"KnessetNum":15,"Name":"ישיבת מליאה בתאריך 12/06/2002 בשעה 11:04","StartDate":"2002-06-12T11:04:00+03:00","FinishDate":"2002-06-12T18:07:00+03:00","IsSpecialMeeting":null,"LastUpdatedDate":"2025-03-03T11:58:17.783+02:00"}
{"Id":161461,"Number":319,"KnessetNum":15,"Name":"ישיבת מליאה בתאריך 18/06/2002 בשעה 16:05","StartDate":"2002-06-18T16:05:00+03:00","FinishDate":"2002-06-18T20:04:00+03:00","IsSpecialMeeting":null,"LastUpdatedDate":"2025-03-03T12:03:33.723+02:00"}
{"Id":161462,"Number":320,"KnessetNum":15,"Name":"ישיבת מליאה בתאריך 19/06/2002 בשעה 11:00","StartDate":"2002-06-19T11:00:00+03:00","FinishDate":"2002-06-19T16:59:00+03:00","IsSpecialMeeting":null,"LastUpdatedDate":"2025-03-03T12:04:04.363+02:00"}
{"Id":161465,"Number":323,"KnessetNum":15,"Name":"ישיבת מליאה בתאריך 26/06/2002 בשעה 11:02","StartDate":"2002-06-26T11:02:00+03:00","FinishDate":"2002-06-26T20:03:00+03:00","IsSpecialMeeting":null,"LastUpdatedDate":"2025-03-03T12:14:42.137+02:00"}
{"Id":161466,"Number":324,"KnessetNum":15,"Name":"ישיבת מליאה בתאריך 01/07/2002 בשעה 16:03","StartDate":"2002-07-01T16:03:00+03:00","FinishDate":"2002-07-01T19:45:00+03:00","IsSpecialMeeting":null,"LastUpdatedDate":"2025-03-03T12:18:21.733+02:00"}
{"Id":161467,"Number":325,"KnessetNum":15,"Name":"ישיבת מליאה בתאריך 02/07/2002 בשעה 16:02","StartDate":"2002-07-02T16:02:00+03:00","FinishDate":"2002-07-02T19:20:00+03:00","IsSpecialMeeting":null,"LastUpdatedDate":"2025-03-03T12:20:12.627+02:00"}
{"Id":161468,"Number":326,"KnessetNum":15,"Name":"ישיבת מליאה בתאריך 03/07/2002 בשעה 11:02","StartDate":"2002-07-03T11:02:00+03:00","FinishDate":"2002-07-03T19:56:00+03:00","IsSpecialMeeting":null,"LastUpdatedDate":"2025-03-03T12:27:32.657+02:00"}
{"Id":161470,"Number":328,"KnessetNum":15,"Name":"ישיבת מליאה בתאריך 09/07/2002 בשעה 16:02","StartDate":"2002-07-09T16:02:00+03:00","FinishDate":"2002-07-09T22:41:00+03:00","IsSpecialMeeting":null,"LastUpdatedDate":"2025-03-03T12:28:39+02:00"}
{"Id":161473,"Number":331,"KnessetNum":15,"Name":"ישיבת מליאה בתאריך 16/07/2002 בשעה 16:00","StartDate":"2002-07-16T16:00:00+03:00","FinishDate":"2002-07-17T00:23:00+03:00","IsSpecialMeeting":null,"LastUpdatedDate":"2025-03-03T12:33:03.48+02:00"}
{"Id":161476,"Number":334,"KnessetNum":15,"Name":"ישיבת מליאה בתאריך 23/07/2002 בשעה 13:04","StartDate":"2002-07-23T13:04:00+03:00","FinishDate":"2002-07-24T00:35:00+03:00","IsSpecialMeeting":null,"LastUpdatedDate":"2025-03-03T12:42:42.763+02:00"}
{"Id":161478,"Number":340,"KnessetNum":15,"Name":"ישיבת מליאה בתאריך 14/10/2002 בשעה 15:00","StartDate":"2002-10-14T15:00:00+02:00","FinishDate":"2002-10-14T19:17:00+02:00","IsSpecialMeeting":null,"LastUpdatedDate":"2025-03-03T13:03:33.587+02:00"}
{"Id":161479,"Number":341,"KnessetNum":15,"Name":"ישיבת מליאה בתאריך 15/10/2002 בשעה 16:02","StartDate":"2002-10-15T16:02:00+02:00","FinishDate":"2002-10-15T19:49:00+02:00","IsSpecialMeeting":null,"LastUpdatedDate":"2025-03-03T13:04:08.78+02:00"}
{"Id":161480,"Number":342,"KnessetNum":15,"Name":"ישיבת מליאה בתאריך 16/10/2002 בשעה 11:00","StartDate":"2002-10-16T11:00:00+02:00","FinishDate":"2002-10-16T18:57:00+02:00","IsSpecialMeeting":null,"LastUpdatedDate":"2025-03-03T13:05:27.24+02:00"}
{"Id":161482,"Number":345,"KnessetNum":15,"Name":"ישיבת מליאה בתאריך 22/10/2002 בשעה 16:00","StartDate":"2002-10-22T16:00:00+02:00","FinishDate":"2002-10-22T21:12:00+02:00","IsSpecialMeeting":null,"LastUpdatedDate":"2025-03-03T13:08:50.813+02:00"}
{"Id":161484,"Number":347,"KnessetNum":15,"Name":"ישיבת מליאה בתאריך 28/10/2002 בשעה 16:02","StartDate":"2002-10-28T16:02:00+02:00","FinishDate":"2002-10-28T23:39:00+02:00","IsSpecialMeeting":null,"LastUpdatedDate":"2025-03-03T13:16:47.483+02:00"}
{"Id":161485,"Number":349,"KnessetNum":15,"Name":"ישיבת מליאה בתאריך 30/10/2002 בשעה 09:00","StartDate":"2002-10-30T09:00:00+02:00","FinishDate":"2002-10-30T19:46:00+02:00","IsSpecialMeeting":null,"LastUpdatedDate":"2025-03-03T13:19:41.887+02:00"}
{"Id":161487,"Number":350,"KnessetNum":15,"Name":"ישיבת מליאה בתאריך 04/11/2002 בשעה 16:01","StartDate":"2002-11-04T16:01:00+02:00","FinishDate":"2002-11-04T21:57:00+02:00","IsSpecialMeeting":null,"LastUpdatedDate":"2025-03-03T14:25:31.103+02:00"}
{"Id":161488,"Number":351,"KnessetNum":15,"Name":"ישיבת מליאה בתאריך 05/11/2002 בשעה 16:01","StartDate":"2002-11-05T16:01:00+02:00","FinishDate":"2002-11-05T19:11:00+02:00","IsSpecialMeeting":null,"LastUpdatedDate":"2025-03-03T14:32:02.153+02:00"}
{"Id":161491,"Number":354,"KnessetNum":15,"Name":"ישיבת מליאה בתאריך 12/11/2002 בשעה 16:00","StartDate":"2002-11-12T16:00:00+02:00","FinishDate":"2002-11-12T20:27:00+02:00","IsSpecialMeeting":null,"LastUpdatedDate":"2025-03-03T14:39:18.927+02:00"}
{"Id":161492,"Number":355,"KnessetNum":15,"Name":"ישיבת מליאה בתאריך 13/11/2002 בשעה 11:03","StartDate":"2002-11-13T11:03:00+02:00","FinishDate":"2002-11-13T19:44:00+02:00","IsSpecialMeeting":null,"LastUpdatedDate":"2025-03-03T14:43:02.017+02:00"}