{"Id":2160038,"Number":44,"KnessetNum":24,"Name":"ישיבת מליאה בתאריך 19/07/2021 בשעה 16:00","StartDate":"2021-07-19T16:00:00+03:00","FinishDate":"2021-07-19T17:40:00+03:00","IsSpecialMeeting":false,"LastUpdatedDate":"2022-11-10T10:51:59.303+02:00"}
{"Id":2160039,"Number":45,"KnessetNum":24,"Name":"ישיבת מליאה בתאריך 20/07/2021 בשעה 16:00","StartDate":"2021-07-20T16:00:00+03:00","FinishDate":"2021-07-20T17:40:00+03:00","IsSpecialMeeting":false,"LastUpdatedDate":"2022-11-10T10:51:59.303+02:00"}
{"Id":2160040,"Number":46,"KnessetNum":24,"Name":"ישיבת מליאה בתאריך 21/07/2021 בשעה 11:00","StartDate":"2021-07-21T11:00:00+03:00","FinishDate":"2021-07-21T14:00:00+03:00","IsSpecialMeeting":false,"LastUpdatedDate":"2022-11-10T10:51:59.303+02:00"}
{"Id":2160362,"Number":47,"KnessetNum":24,"Name":"ישיבת מליאה בתאריך 26/07/2021 בשעה 16:00","StartDate":"2021-07-26T16:00:00+03:00","FinishDate":"2021-07-28T03:00:00+03:00","IsSpecialMeeting":false,"LastUpdatedDate":"2022-11-10T10:51:59.303+02:00"}
{"Id":2160364,"Number":48,"KnessetNum":24,"Name":"ישיבת מליאה בתאריך 28/07/2021 בשעה 11:00","StartDate":"2021-07-28T11:00:00+03:00","FinishDate":"2021-07-28T21:00:00+03:00","IsSpecialMeeting":false,"LastUpdatedDate":"2022-11-10T10:51:59.303+02:00"}
{"Id":2161016,"Number":49,"KnessetNum":24,"Name":"ישיבת מליאה בתאריך 02/08/2021 בשעה 16:00","StartDate":"2021-08-02T16:00:00+03:00","FinishDate":"2021-08-03T09:20:00+03:00","IsSpecialMeeting":false,"LastUpdatedDate":"2022-11-10T10:51:59.303+02:00"}
{"Id":2161017,"Number":50,"KnessetNum":24,"Name":"ישיבת מליאה בתאריך 03/08/2021 בשעה 16:00","StartDate":"2021-08-03T16:00:00+03:00","FinishDate":"2021-08-04T01:30:00+03:00","IsSpecialMeeting":false,"LastUpdatedDate":"2022-11-10T10:51:59.303+02:00"}
{"Id":2161018,"Number":51,"KnessetNum":24,"Name":"ישיבת מליאה בתאריך 04/08/2021 בשעה 11:00","StartDate":"2021-08-04T11:00:00+03:00","FinishDate":"2021-08-04T22:40:00+03:00","IsSpecialMeeting":false,"LastUpdatedDate":"2022-11-10T10:51:59.303+02:00"}
{"Id":2161417,"Number":52,"KnessetNum":24,"Name":"ישיבת מליאה בתאריך 11/08/2021 בשעה 11:00","StartDate":"2021-08-11T11:00:00+03:00","FinishDate":"2021-08-11T16:30:00+03:00","IsSpecialMeeting":false,"LastUpdatedDate":"2022-11-10T10:51:59.303+02:00"}
{"Id":2161456,"Number":56,"KnessetNum":24,"Name":"ישיבת מליאה בתאריך 04/10/2021 בשעה 16:00","StartDate":"2021-10-04T16:00:00+03:00","FinishDate":"2021-10-04T23:56:00+03:00","IsSpecialMeeting":false,"LastUpdatedDate":"2024-02-22T14:12:45.887+02:00"}
{"Id":2161457,"Number":57,"KnessetNum":24,"Name":"ישיבת מליאה בתאריך 05/10/2021 בשעה 16:00","StartDate":"2021-10-05T16:00:00+03:00","FinishDate":"2021-10-05T18:10:00+03:00","IsSpecialMeeting":false,"LastUpdatedDate":"2022-11-10T10:51:59.303+02:00"}
{"Id":2161458,"Number":58,"KnessetNum":24,"Name":"ישיבת מליאה בתאריך 06/10/2021 בשעה 11:00","StartDate":"2021-10-06T11:00:00+03:00","FinishDate":"2021-10-06T21:50:00+03:00","IsSpecialMeeting":false,"LastUpdatedDate":"2022-11-10T10:51:59.303+02:00"}
{"Id":2161806,"Number":53,"KnessetNum":24,"Name":"ישיבת מליאה בתאריך 31/08/2021 בשעה 14:00","StartDate":"2021-08-31T14:00:00+03:00","FinishDate":"2021-08-31T15:30:00+03:00","IsSpecialMeeting":false,"LastUpdatedDate":"2022-11-10T10:51:59.303+02:00"}
{"Id":2161808,"Number":54,"KnessetNum":24,"Name":"ישיבת מליאה בתאריך 02/09/2021 בשעה 10:00","StartDate":"2021-09-02T10:00:00+03:00","FinishDate":"2021-09-03T00:20:00+03:00","IsSpecialMeeting":false,"LastUpdatedDate":"2022-11-10T10:51:59.303+02:00"}
{"Id":2162004,"Number":55,"KnessetNum":24,"Name":"ישיבת מליאה בתאריך 12/09/2021 בשעה 22:00","StartDate":"2021-09-12T22:00:00+03:00","FinishDate":"2021-09-13T01:45:00+03:00","IsSpecialMeeting":false,"LastUpdatedDate":"2022-11-10T10:51:59.303+02:00"}
{"Id":2162338,"Number":59,"KnessetNum":24,"Name":"ישיבת מליאה בתאריך 11/10/2021 בשעה 16:00","StartDate":"2021-10-11T16:00:00+03:00","FinishDate":"2021-10-11T23:40:00+03:00","IsSpecialMeeting":false,"LastUpdatedDate":"2022-11-10T10:51:59.303+02:00"}
{"Id":2162339,"Number":60,"KnessetNum":24,"Name":"ישיבת מליאה בתאריך 12/10/2021 בשעה 16:00","StartDate":"2021-10-12T16:00:00+03:00","FinishDate":"2021-10-12T19:00:00+03:00","IsSpecialMeeting":false,"LastUpdatedDate":"2022-11-10T10:51:59.303+02:00"}
{"Id":2162340,"Number":61,"KnessetNum":24,"Name":"ישיבת מליאה בתאריך 13/10/2021 בשעה 11:00","StartDate":"2021-10-13T11:00:00+03:00","FinishDate":"2021-10-13T23:10:00+03:00","IsSpecialMeeting":false,"LastUpdatedDate":"2024-02-22T14:53:44.407+02:00"}
{"Id":2162669,"Number":62,"KnessetNum":24,"Name":"ישיבת מליאה בתאריך 18/10/2021 בשעה 17:00","StartDate":"2021-10-18T17:00:00+03:00","FinishDate":"2021-10-19T00:50:00+03:00","IsSpecialMeeting":false,"LastUpdatedDate":"2022-11-10T10:51:59.303+02:00"}
{"Id":2162670,"Number":63,"KnessetNum":24,"Name":"ישיבת מליאה בתאריך 19/10/2021 בשעה 16:00","StartDate":"2021-10-19T16:00:00+03:00","FinishDate":"2021-10-19T19:20:00+03:00","IsSpecialMeeting":false,"LastUpdatedDate":"2022-11-10T10:51:59.303+02:00"}
{"Id":2162671,"Number":64,"KnessetNum":24,"Name":"ישיבת מליאה בתאריך 20/10/2021 בשעה 11:00","StartDate":"2021-10-20T11:00:00+03:00","FinishDate":"2021-10-20T18:40:00+03:00","IsSpecialMeeting":false,"LastUpdatedDate":"2022-11-10T10:51:59.303+02:00"}
{"Id":2163150,"Number":65,"KnessetNum":24,"Name":"ישיבת מליאה בתאריך 25/10/2021 בשעה 16:00","StartDate":"2021-10-25T16:00:00+03:00","FinishDate":"2021-10-26T02:00:00+03:00","IsSpecialMeeting":false,"LastUpdatedDate":"2022-11-10T10:51:59.303+02:00"}
{"Id":2163151,"Number":66,"KnessetNum":24,"Name":"ישיבת מליאה בתאריך 26/10/2021 בשעה 16:00","StartDate":"2021-10-26T16:00:00+03:00","FinishDate":"2021-10-26T20:50:00+03:00","IsSpecialMeeting":false,"LastUpdatedDate":"2022-11-10T10:51:59.303+02:00"}
{"Id":2163152,"Number":67,"KnessetNum":24,"Name":"ישיבת מליאה בתאריך 27/10/2021 בשעה 11:00","StartDate":"2021-10-27T11:00:00+03:00","FinishDate":"2021-10-27T20:30:00+03:00","IsSpecialMeeting":false,"LastUpdatedDate":"2022-11-10T10:51:59.303+02:00"}
{"Id":2163732,"Number":69,"KnessetNum":24,"Name":"ישיבת מליאה בתאריך 02/11/2021 בשעה 09:00","StartDate":"2021-11-02T09:00:00+02:00","FinishDate":"2021-11-05T03:13:00+02:00","IsSpecialMeeting":false,"LastUpdatedDate":"2022-11-10T10:51:59.303+02:00"}
{"Id":2163737,"Number":68,"KnessetNum":24,"Name":"ישיבת מליאה בתאריך 01/11/2021 בשעה 10:00","StartDate":"2021-11-01T10:00:00+02:00","FinishDate":"2021-11-02T09:30:27+02:00","IsSpecialMeeting":false,"LastUpdatedDate":"2022-11-10T10:51:59.303+02:00"}
{"Id":2163940,"Number":70,"KnessetNum":24,"Name":"ישיבת מליאה בתאריך 08/11/2021 בשעה 16:00","StartDate":"2021-11-08T16:00:00+02:00","FinishDate":"2021-11-08T19:40:00+02:00","IsSpecialMeeting":false,"LastUpdatedDate":"2022-11-10T10:51:59.303+02:00"}
{"Id":2163941,"Number":71,"KnessetNum":24,"Name":"ישיבת מליאה בתאריך 09/11/2021 בשעה 16:00","StartDate":"2021-11-09T16:00:00+02:00","FinishDate":"2021-11-09T17:20:00+02:00","IsSpecialMeeting":false,"LastUpdatedDate":"2022-11-10T10:51:59.303+02:00"}
{"Id":2163942,"Number":72,"KnessetNum":24,"Name":"ישיבת מליאה בתאריך 10/11/2021 בשעה 11:00","StartDate":"2021-11-10T11:00:00+02:00","FinishDate":"2021-11-10T23:00:00+02:00","IsSpecialMeeting":false,"LastUpdatedDate":"2022-11-10T10:51:59.303+02:00"}
{"Id":2164432,"Number":73,"KnessetNum":24,"Name":"ישיבת מליאה בתאריך 15/11/2021 בשעה 16:00","StartDate":"2021-11-15T16:00:00+02:00","FinishDate":"2021-11-15T19:40:00+02:00","IsSpecialMeeting":false,"LastUpdatedDate":"2022-11-10T10:51:59.303+02:00"}
{"Id":2164433,"Number":74,"KnessetNum":24,"Name":"ישיבת מליאה בתאריך 16/11/2021 בשעה 16:00","StartDate":"2021-11-16T16:00:00+02:00","FinishDate":"2021-11-16T19:50:00+02:00","IsSpecialMeeting":false,"LastUpdatedDate":"2022-11-10T10:51:59.303+02:00"}
{"Id":2164434,"Number":75,"KnessetNum":24,"Name":"ישיבת מליאה בתאריך 17/11/2021 בשעה 11:00","StartDate":"2021-11-17T11:00:00+02:00","FinishDate":"2021-11-17T18:30:00+02:00","IsSpecialMeeting":false,"LastUpdatedDate":"2022-11-10T10:51:59.303+02:00"}
{"Id":2164708,"Number":76,"KnessetNum":24,"Name":"ישיבת מליאה בתאריך 22/11/2021 בשעה 16:00","StartDate":"2021-11-22T16:00:00+02:00","FinishDate":"2021-11-23T10:10:00+02:00","IsSpecialMeeting":false,"LastUpdatedDate":"2022-11-10T10:51:59.303+02:00"}
{"Id":2164709,"Number":77,"KnessetNum":24,"Name":"ישיבת מליאה בתאריך 23/11/2021 בשעה 16:00","StartDate":"2021-11-23T16:00:00+02:00","FinishDate":"2021-11-23T20:00:00+02:00","IsSpecialMeeting":false,"LastUpdatedDate":"2022-11-10T10:51:59.303+02:00"}
{"Id":2164710,"Number":78,"KnessetNum":24,"Name":"ישיבת מליאה בתאריך 24/11/2021 בשעה 11:00","StartDate":"2021-11-24T11:00:00+02:00","FinishDate":"2021-11-24T20:20:00+02:00","IsSpecialMeeting":false,"LastUpdatedDate":"2022-11-10T10:51:59.303+02:00"}
{"Id":2164930,"Number":79,"KnessetNum":24,"Name":"ישיבת מליאה בתאריך 29/11/2021 בשעה 13:00","StartDate":"2021-11-29T13:00:00+02:00","FinishDate":"2021-11-29T15:30:00+02:00","IsSpecialMeeting":false,"LastUpdatedDate":"2022-11-10T10:51:59.303+02:00"}
{"Id":2164931,"Number":80,"KnessetNum":24,"Name":"ישיבת מליאה בתאריך 30/11/2021 בשעה 13:00","StartDate":"2021-11-30T13:00:00+02:00","FinishDate":"2021-11-30T14:50:00+02:00","IsSpecialMeeting":false,"LastUpdatedDate":"2022-11-10T10:51:59.303+02:00"}
{"Id":2164932,"Number":81,"KnessetNum":24,"Name":"ישיבת מליאה בתאריך 01/12/2021 בשעה 11:00","StartDate":"2021-12-01T11:00:00+02:00","FinishDate":"2021-12-01T15:10:00+02:00","IsSpecialMeeting":false,"LastUpdatedDate":"2022-11-10T10:51:59.303+02:00"}
{"Id":2165336,"Number":82,"KnessetNum":24,"Name":"ישיבת מליאה בתאריך 06/12/2021 בשעה 16:00","StartDate":"2021-12-06T16:00:00+02:00","FinishDate":"2021-12-07T03:00:00+02:00","IsSpecialMeeting":false,"LastUpdatedDate":"2022-11-10T10:51:59.303+02:00"}
{"Id":2165337,"Number":83,"KnessetNum":24,"Name":"ישיבת מליאה בתאריך 07/12/2021 בשעה 16:00","StartDate":"2021-12-07T16:00:00+02:00","FinishDate":"2021-12-07T18:20:00+02:00","IsSpecialMeeting":false,"LastUpdatedDate":"2022-11-10T10:51:59.303+02:00"}
{"Id":2165338,"Number":84,"KnessetNum":24,"Name":"ישיבת מליאה בתאריך 08/12/2021 בשעה 11:00","StartDate":"2021-12-08T11:00:00+02:00","FinishDate":"2021-12-08T22:20:00+02:00","IsSpecialMeeting":false,"LastUpdatedDate":"2022-11-10T10:51:59.303+02:00"}
{"Id":2165525,"Number":85,"KnessetNum":24,"Name":"ישיבת מליאה בתאריך 13/12/2021 בשעה 16:00","StartDate":"2021-12-13T16:00:00+02:00","FinishDate":"2021-12-14T05:00:00+02:00","IsSpecialMeeting":false,"LastUpdatedDate":"2022-11-10T10:51:59.303+02:00"}
{"Id":2165526,"Number":86,"KnessetNum":24,"Name":"ישיבת מליאה בתאריך 14/12/2021 בשעה 16:00","StartDate":"2021-12-14T16:00:00+02:00","FinishDate":"2021-12-14T18:10:00+02:00","IsSpecialMeeting":false,"LastUpdatedDate":"2022-11-10T10:51:59.303+02:00"}
{"Id":2165527,"Number":87,"KnessetNum":24,"Name":"ישיבת מליאה בתאריך 15/12/2021 בשעה 11:00","StartDate":"2021-12-15T11:00:00+02:00","FinishDate":"2021-12-15T19:30:00+02:00","IsSpecialMeeting":false,"LastUpdatedDate":"2022-11-10T10:51:59.303+02:00"}
{"Id":2166092,"Number":88,"KnessetNum":24,"Name":"ישיבת מליאה בתאריך 20/12/2021 בשעה 16:00","StartDate":"2021-12-20T16:00:00+02:00","FinishDate":"2021-12-20T19:30:00+02:00","IsSpecialMeeting":false,"LastUpdatedDate":"2022-11-10T10:51:59.303+02:00"}
{"Id":2166093,"Number":89,"KnessetNum":24,"Name":"ישיבת מליאה בתאריך 21/12/2021 בשעה 16:00","StartDate":"2021-12-21T16:00:00+02:00","FinishDate":"2021-12-21T17:40:00+02:00","IsSpecialMeeting":false,"LastUpdatedDate":"2022-11-10T10:51:59.303+02:00"}
{"Id":2166094,"Number":90,"KnessetNum":24,"Name":"ישיבת מליאה בתאריך 22/12/2021 בשעה 11:00","StartDate":"2021-12-22T11:00:00+02:00","FinishDate":"2021-12-22T22:10:00+02:00","IsSpecialMeeting":false,"LastUpdatedDate":"2022-11-10T10:51:59.303+02:00"}
{"Id":2166747,"Number":91,"KnessetNum":24,"Name":"ישיבת מליאה בתאריך 27/12/2021 בשעה 16:00","StartDate":"2021-12-27T16:00:00+02:00","FinishDate":"2021-12-28T09:10:00+02:00","IsSpecialMeeting":false,"LastUpdatedDate":"2022-11-10T10:51:59.303+02:00"}
{"Id":2166748,"Number":92,"KnessetNum":24,"Name":"ישיבת מליאה בתאריך 28/12/2021 בשעה 16:00","StartDate":"2021-12-28T16:00:00+02:00","FinishDate":"2021-12-28T18:00:00+02:00","IsSpecialMeeting":false,"LastUpdatedDate":"2022-11-10T10:51:59.303+02:00"}
{"Id":2166749,"Number":93,"KnessetNum":24,"Name":"ישיבת מליאה בתאריך 29/12/2021 בשעה 11:00","StartDate":"2021-12-29T11:00:00+02:00","FinishDate":"2021-12-30T03:07:00+02:00","IsSpecialMeeting":false,"LastUpdatedDate":"2022-11-10T10:51:59.303+02:00"}
{"Id":2167033,"Number":94,"KnessetNum":24,"Name":"ישיבת מליאה בתאריך 03/01/2022 בשעה 16:00","StartDate":"2022-01-03T16:00:00+02:00","FinishDate":"2022-01-04T02:50:00+02:00","IsSpecialMeeting":false,"LastUpdatedDate":"2022-11-10T10:51:59.303+02:00"}
{"Id":2167034,"Number":95,"KnessetNum":24,"Name":"ישיבת מליאה בתאריך 04/01/2022 בשעה 16:00","StartDate":"2022-01-04T16:00:00+02:00","FinishDate":"2022-01-05T11:40:00+02:00","IsSpecialMeeting":false,"LastUpdatedDate":"2022-11-10T10:51:59.303+02:00"}
{"Id":2167035,"Number":96,"KnessetNum":24,"Name":"ישיבת מליאה בתאריך 05/01/2022 בשעה 11:00","StartDate":"2022-01-05T11:00:00+02:00","FinishDate":"2022-01-06T02:50:00+02:00","IsSpecialMeeting":false,"LastUpdatedDate":"2022-11-10T10:51:59.303+02:00"}
{"Id":2167224,"Number":97,"KnessetNum":24,"Name":"ישיבת מליאה בתאריך 10/01/2022 בשעה 16:00","StartDate":"2022-01-10T16:00:00+02:00","FinishDate":"2022-01-10T19:20:00+02:00","IsSpecialMeeting":false,"LastUpdatedDate":"2022-11-10T10:51:59.303+02:00"}
{"Id":2167225,"Number":98,"KnessetNum":24,"Name":"ישיבת מליאה בתאריך 11/01/2022 בשעה 16:00","StartDate":"2022-01-11T16:00:00+02:00","FinishDate":"2022-01-11T16:20:00+02:00","IsSpecialMeeting":false,"LastUpdatedDate":"2022-11-10T10:51:59.303+02:00"}
{"Id":2167226,"Number":99,"KnessetNum":24,"Name":"ישיבת מליאה בתאריך 12/01/2022 בשעה 11:00","StartDate":"2022-01-12T11:00:00+02:00","FinishDate":"2022-01-12T19:20:00+02:00","IsSpecialMeeting":false,"LastUpdatedDate":"2022-11-10T10:51:59.303+02:00"}
{"Id":2167701,"Number":100,"KnessetNum":24,"Name":"ישיבת מליאה בתאריך 17/01/2022 בשעה 16:00","StartDate":"2022-01-17T16:00:00+02:00","FinishDate":"2022-01-17T21:50:00+02:00","IsSpecialMeeting":false,"LastUpdatedDate":"2022-11-10T10:51:59.303+02:00"}
{"Id":2167702,"Number":101,"KnessetNum":24,"Name":"ישיבת מליאה בתאריך 18/01/2022 בשעה 16:00","StartDate":"2022-01-18T16:00:00+02:00","FinishDate":"2022-01-18T17:30:00+02:00","IsSpecialMeeting":false,"LastUpdatedDate":"2022-11-10T10:51:59.303+02:00"}
{"Id":2167703,"Number":102,"KnessetNum":24,"Name":"ישיבת מליאה בתאריך 19/01/2022 בשעה 11:00","StartDate":"2022-01-19T11:00:00+02:00","FinishDate":"2022-01-19T20:00:00+02:00","IsSpecialMeeting":false,"LastUpdatedDate":"2022-11-10T10:51:59.303+02:00"}
{"Id":2168278,"Number":103,"KnessetNum":24,"Name":"ישיבת מליאה בתאריך 24/01/2022 בשעה 16:00","StartDate":"2022-01-24T16:00:00+02:00","FinishDate":"2022-01-24T21:10:00+02:00","IsSpecialMeeting":false,"LastUpdatedDate":"2022-11-10T10:51:59.303+02:00"}
{"Id":2168279,"Number":104,"KnessetNum":24,"Name":"ישיבת מליאה בתאריך 25/01/2022 בשעה 16:00","StartDate":"2022-01-25T16:00:00+02:00","FinishDate":"2022-01-25T21:10:00+02:00","IsSpecialMeeting":false,"LastUpdatedDate":"2022-11-10T10:51:59.303+02:00"}
{"Id":2168280,"Number":105,"KnessetNum":24,"Name":"ישיבת מליאה בתאריך 26/01/2022 בשעה 11:00","StartDate":"2022-01-26T11:00:00+02:00","FinishDate":"2022-01-26T14:20:00+02:00","IsSpecialMeeting":false,"LastUpdatedDate":"2022-11-10T10:51:59.303+02:00"}
{"Id":2168709,"Number":106,"KnessetNum":24,"Name":"ישיבת מליאה בתאריך 31/01/2022 בשעה 16:00","StartDate":"2022-01-31T16:00:00+02:00","FinishDate":"2022-02-01T04:20:00+02:00","IsSpecialMeeting":false,"LastUpdatedDate":"2022-11-10T10:51:59.303+02:00"}
{"Id":2168710,"Number":107,"KnessetNum":24,"Name":"ישיבת מליאה בתאריך 01/02/2022 בשעה 16:00","StartDate":"2022-02-01T16:00:00+02:00","FinishDate":"2022-02-01T17:20:00+02:00","IsSpecialMeeting":false,"LastUpdatedDate":"2022-11-10T10:51:59.303+02:00"}
{"Id":2168711,"Number":108,"KnessetNum":24,"Name":"ישיבת מליאה בתאריך 02/02/2022 בשעה 11:00","StartDate":"2022-02-02T11:00:00+02:00","FinishDate":"2022-02-02T22:00:00+02:00","IsSpecialMeeting":false,"LastUpdatedDate":"2022-11-10T10:51:59.303+02:00"}
{"Id":2169233,"Number":109,"KnessetNum":24,"Name":"ישיבת מליאה בתאריך 07/02/2022 בשעה 16:00","StartDate":"2022-02-07T16:00:00+02:00","FinishDate":"2022-02-08T00:20:00+02:00","IsSpecialMeeting":false,"LastUpdatedDate":"2022-11-10T10:51:59.303+02:00"}
{"Id":2169234,"Number":110,"KnessetNum":24,"Name":"ישיבת מליאה בתאריך 08/02/2022 בשעה 16:00","StartDate":"2022-02-08T16:00:00+02:00","FinishDate":"2022-02-08T16:30:00+02:00","IsSpecialMeeting":false,"LastUpdatedDate":"2022-11-10T10:51:59.303+02:00"}
{"Id":2169235,"Number":111,"KnessetNum":24,"Name":"ישיבת מליאה בתאריך 09/02/2022 בשעה 11:00","StartDate":"2022-02-09T11:00:00+02:00","FinishDate":"2022-02-09T20:10:00+02:00","IsSpecialMeeting":false,"LastUpdatedDate":"2022-11-10T10:51:59.303+02:00"}
{"Id":2169529,"Number":112,"KnessetNum":24,"Name":"ישיבת מליאה בתאריך 14/02/2022 בשעה 16:00","StartDate":"2022-02-14T16:00:00+02:00","FinishDate":"2022-02-14T19:00:00+02:00","IsSpecialMeeting":false,"LastUpdatedDate":"2022-11-10T10:51:59.303+02:00"}
{"Id":2169530,"Number":113,"KnessetNum":24,"Name":"ישיבת מליאה בתאריך 15/02/2022 בשעה 16:00","StartDate":"2022-02-15T16:00:00+02:00","FinishDate":"2022-02-15T18:00:00+02:00","IsSpecialMeeting":false,"LastUpdatedDate":"2022-11-10T10:51:59.303+02:00"}
{"Id":2169531,"Number":114,"KnessetNum":24,"Name":"ישיבת מליאה בתאריך 16/02/2022 בשעה 11:00","StartDate":"2022-02-16T11:00:00+02:00","FinishDate":"2022-02-16T23:30:00+02:00","IsSpecialMeeting":false,"LastUpdatedDate":"2022-11-10T10:51:59.303+02:00"}