{"Id":430121,"Number":315,"KnessetNum":18,"Name":"ישיבת מליאה בתאריך 30/01/2012 בשעה: 16:00","StartDate":"2012-01-30T16:00:00+02:00","FinishDate":"2012-01-30T19:30:00+02:00","IsSpecialMeeting":false,"LastUpdatedDate":"2013-10-03T16:21:47+03:00"}
{"Id":430123,"Number":316,"KnessetNum":18,"Name":"ישיבת מליאה בתאריך 31/01/2012 בשעה: 16:00","StartDate":"2012-01-31T16:00:00+02:00","FinishDate":"2012-01-31T17:30:00+02:00","IsSpecialMeeting":false,"LastUpdatedDate":"2013-10-03T16:21:47+03:00"}
{"Id":430124,"Number":317,"KnessetNum":18,"Name":"ישיבת מליאה בתאריך 01/02/2012 בשעה: 11:00","StartDate":"2012-02-01T11:00:00+02:00","FinishDate":"2012-02-01T18:20:00+02:00","IsSpecialMeeting":false,"LastUpdatedDate":"2013-10-03T16:21:47+03:00"}
{"Id":430658,"Number":318,"KnessetNum":18,"Name":"ישיבת מליאה בתאריך 06/02/2012 בשעה 16:00","StartDate":"2012-02-06T16:00:00+02:00","FinishDate":"2012-02-07T00:20:00+02:00","IsSpecialMeeting":false,"LastUpdatedDate":"2020-12-15T18:28:14.363+02:00"}
{"Id":430662,"Number":319,"KnessetNum":18,"Name":"ישיבת מליאה בתאריך 07/02/2012 בשעה: 16:00","StartDate":"2012-02-07T16:00:00+02:00","FinishDate":"2012-02-07T18:30:00+02:00","IsSpecialMeeting":false,"LastUpdatedDate":"2013-10-03T16:21:47+03:00"}
{"Id":430667,"Number":null,"KnessetNum":18,"Name":"ישיבת מליאה בתאריך 08/02/2012 בשעה: 11:00","StartDate":"2012-02-08T11:00:00+02:00","FinishDate":"2012-02-08T16:10:00+02:00","IsSpecialMeeting":true,"LastUpdatedDate":"2013-10-03T16:21:47+03:00"}
{"Id":431140,"Number":320,"KnessetNum":18,"Name":"ישיבת מליאה בתאריך 13/02/2012 בשעה 16:00","StartDate":"2012-02-13T16:00:00+02:00","FinishDate":"2012-02-13T20:10:00+02:00","IsSpecialMeeting":false,"LastUpdatedDate":"2020-12-15T18:30:19.183+02:00"}
{"Id":431150,"Number":321,"KnessetNum":18,"Name":"ישיבת מליאה בתאריך 14/02/2012 בשעה: 16:00","StartDate":"2012-02-14T16:00:00+02:00","FinishDate":"2012-02-14T19:00:00+02:00","IsSpecialMeeting":false,"LastUpdatedDate":"2013-10-03T16:21:47+03:00"}
{"Id":431168,"Number":322,"KnessetNum":18,"Name":"ישיבת מליאה בתאריך 15/02/2012 בשעה: 11:00","StartDate":"2012-02-15T11:00:00+02:00","FinishDate":"2012-02-15T18:00:00+02:00","IsSpecialMeeting":false,"LastUpdatedDate":"2013-10-03T16:21:47+03:00"}
{"Id":431680,"Number":323,"KnessetNum":18,"Name":"ישיבת מליאה בתאריך 20/02/2012 בשעה 16:00","StartDate":"2012-02-20T16:00:00+02:00","FinishDate":"2012-02-20T21:50:00+02:00","IsSpecialMeeting":false,"LastUpdatedDate":"2020-12-15T18:27:30.68+02:00"}
{"Id":431684,"Number":324,"KnessetNum":18,"Name":"ישיבת מליאה בתאריך 21/02/2012 בשעה: 16:00","StartDate":"2012-02-21T16:00:00+02:00","FinishDate":"2012-02-21T19:20:00+02:00","IsSpecialMeeting":false,"LastUpdatedDate":"2013-10-03T16:21:47+03:00"}
{"Id":431686,"Number":325,"KnessetNum":18,"Name":"ישיבת מליאה בתאריך 22/02/2012 בשעה: 11:00","StartDate":"2012-02-22T11:00:00+02:00","FinishDate":"2012-02-22T18:40:00+02:00","IsSpecialMeeting":false,"LastUpdatedDate":"2013-10-03T16:21:47+03:00"}
{"Id":432100,"Number":326,"KnessetNum":18,"Name":"ישיבת מליאה בתאריך 27/02/2012 בשעה 16:00","StartDate":"2012-02-27T16:00:00+02:00","FinishDate":"2012-02-27T20:50:00+02:00","IsSpecialMeeting":false,"LastUpdatedDate":"2020-12-15T18:30:41.127+02:00"}
{"Id":432109,"Number":327,"KnessetNum":18,"Name":"ישיבת מליאה בתאריך 28/02/2012 בשעה: 16:00","StartDate":"2012-02-28T16:00:00+02:00","FinishDate":"2012-02-28T18:30:00+02:00","IsSpecialMeeting":false,"LastUpdatedDate":"2013-10-03T16:21:47+03:00"}
{"Id":432112,"Number":328,"KnessetNum":18,"Name":"ישיבת מליאה בתאריך 29/02/2012 בשעה: 11:00","StartDate":"2012-02-29T11:00:00+02:00","FinishDate":"2012-02-29T17:50:00+02:00","IsSpecialMeeting":false,"LastUpdatedDate":"2013-10-03T16:21:47+03:00"}
{"Id":432681,"Number":329,"KnessetNum":18,"Name":"ישיבת מליאה בתאריך 05/03/2012 בשעה: 16:00","StartDate":"2012-03-05T16:00:00+02:00","FinishDate":"2012-03-05T18:00:00+02:00","IsSpecialMeeting":false,"LastUpdatedDate":"2013-10-03T16:21:47+03:00"}
{"Id":432684,"Number":330,"KnessetNum":18,"Name":"ישיבת מליאה בתאריך 06/03/2012 בשעה: 15:00","StartDate":"2012-03-06T15:00:00+02:00","FinishDate":"2012-03-06T21:20:00+02:00","IsSpecialMeeting":false,"LastUpdatedDate":"2013-10-03T16:21:47+03:00"}
{"Id":432958,"Number":331,"KnessetNum":18,"Name":"ישיבת מליאה בתאריך 12/03/2012 בשעה: 16:00","StartDate":"2012-03-12T16:00:00+02:00","FinishDate":"2012-03-12T21:30:00+02:00","IsSpecialMeeting":false,"LastUpdatedDate":"2013-10-03T16:21:47+03:00"}
{"Id":432971,"Number":332,"KnessetNum":18,"Name":"ישיבת מליאה בתאריך 13/03/2012 בשעה: 16:00","StartDate":"2012-03-13T16:00:00+02:00","FinishDate":"2012-03-13T18:30:00+02:00","IsSpecialMeeting":false,"LastUpdatedDate":"2013-10-03T16:21:47+03:00"}
{"Id":432975,"Number":333,"KnessetNum":18,"Name":"ישיבת מליאה בתאריך 14/03/2012 בשעה: 11:00","StartDate":"2012-03-14T11:00:00+02:00","FinishDate":"2012-03-14T19:20:00+02:00","IsSpecialMeeting":false,"LastUpdatedDate":"2013-10-03T16:21:47+03:00"}
{"Id":433464,"Number":334,"KnessetNum":18,"Name":"ישיבת מליאה בתאריך 19/03/2012 בשעה 16:00","StartDate":"2012-03-19T16:00:00+02:00","FinishDate":"2012-03-20T00:10:00+02:00","IsSpecialMeeting":false,"LastUpdatedDate":"2020-12-15T18:23:15.75+02:00"}
{"Id":433474,"Number":335,"KnessetNum":18,"Name":"ישיבת מליאה בתאריך 20/03/2012 בשעה: 16:00","StartDate":"2012-03-20T16:00:00+02:00","FinishDate":"2012-03-20T17:50:00+02:00","IsSpecialMeeting":false,"LastUpdatedDate":"2013-10-03T16:21:47+03:00"}
{"Id":433476,"Number":336,"KnessetNum":18,"Name":"ישיבת מליאה בתאריך 21/03/2012 בשעה 11:00","StartDate":"2012-03-21T11:00:00+02:00","FinishDate":"2012-03-21T19:00:00+02:00","IsSpecialMeeting":false,"LastUpdatedDate":"2020-12-15T18:31:12.417+02:00"}
{"Id":433961,"Number":337,"KnessetNum":18,"Name":"ישיבת מליאה בתאריך 02/04/2012 בשעה: 12:00","StartDate":"2012-04-02T12:00:00+03:00","FinishDate":"2012-04-02T15:00:00+03:00","IsSpecialMeeting":false,"LastUpdatedDate":"2013-10-03T16:21:47+03:00"}
{"Id":434184,"Number":338,"KnessetNum":18,"Name":"ישיבת מליאה בתאריך 18/04/2012 בשעה: 11:00","StartDate":"2012-04-18T11:00:00+03:00","FinishDate":"2012-04-18T15:40:00+03:00","IsSpecialMeeting":false,"LastUpdatedDate":"2013-10-03T16:21:47+03:00"}
{"Id":434445,"Number":339,"KnessetNum":18,"Name":"ישיבת מליאה בתאריך 30/04/2012 בשעה: 16:00","StartDate":"2012-04-30T16:00:00+03:00","FinishDate":"2012-04-30T16:30:00+03:00","IsSpecialMeeting":false,"LastUpdatedDate":"2013-10-03T16:21:47+03:00"}
{"Id":434463,"Number":340,"KnessetNum":18,"Name":"ישיבת מליאה בתאריך 01/05/2012 בשעה: 16:00","StartDate":"2012-05-01T16:00:00+03:00","FinishDate":"2012-05-01T17:50:00+03:00","IsSpecialMeeting":false,"LastUpdatedDate":"2013-10-03T16:21:47+03:00"}
{"Id":434465,"Number":341,"KnessetNum":18,"Name":"ישיבת מליאה בתאריך 02/05/2012 בשעה 11:00","StartDate":"2012-05-02T11:00:00+03:00","FinishDate":"2012-05-02T18:20:00+03:00","IsSpecialMeeting":false,"LastUpdatedDate":"2020-12-15T18:24:06.123+02:00"}
{"Id":434847,"Number":342,"KnessetNum":18,"Name":"ישיבת מליאה בתאריך 07/05/2012 בשעה 16:00","StartDate":"2012-05-07T16:00:00+03:00","FinishDate":"2012-05-08T03:10:00+03:00","IsSpecialMeeting":false,"LastUpdatedDate":"2020-12-15T18:28:38.947+02:00"}
{"Id":434862,"Number":343,"KnessetNum":18,"Name":"ישיבת מליאה בתאריך 08/05/2012 בשעה: 16:00","StartDate":"2012-05-08T16:00:00+03:00","FinishDate":"2012-05-08T17:30:00+03:00","IsSpecialMeeting":false,"LastUpdatedDate":"2013-10-03T16:21:47+03:00"}
{"Id":434863,"Number":344,"KnessetNum":18,"Name":"ישיבת מליאה בתאריך 09/05/2012 בשעה: 11:00","StartDate":"2012-05-09T11:00:00+03:00","FinishDate":"2012-05-09T18:20:00+03:00","IsSpecialMeeting":false,"LastUpdatedDate":"2013-10-03T16:21:47+03:00"}
{"Id":435120,"Number":346,"KnessetNum":18,"Name":"ישיבת מליאה בתאריך 14/05/2012 בשעה: 18:00","StartDate":"2012-05-14T18:00:00+03:00","FinishDate":"2012-05-14T22:30:00+03:00","IsSpecialMeeting":false,"LastUpdatedDate":"2016-09-05T17:06:05.507+03:00"}
{"Id":435204,"Number":345,"KnessetNum":18,"Name":"ישיבת מליאה בתאריך 14/05/2012 בשעה 16:00","StartDate":"2012-05-14T16:00:00+03:00","FinishDate":"2012-05-14T19:30:00+03:00","IsSpecialMeeting":true,"LastUpdatedDate":"2020-12-15T18:24:39.747+02:00"}
{"Id":435210,"Number":347,"KnessetNum":18,"Name":"ישיבת מליאה בתאריך 15/05/2012 בשעה: 16:00","StartDate":"2012-05-15T16:00:00+03:00","FinishDate":"2012-05-15T18:20:00+03:00","IsSpecialMeeting":false,"LastUpdatedDate":"2013-10-03T16:21:47+03:00"}
{"Id":435213,"Number":348,"KnessetNum":18,"Name":"ישיבת מליאה בתאריך 16/05/2012 בשעה: 11:00","StartDate":"2012-05-16T11:00:00+03:00","FinishDate":"2012-05-16T18:10:00+03:00","IsSpecialMeeting":false,"LastUpdatedDate":"2013-10-03T16:21:47+03:00"}
{"Id":435621,"Number":349,"KnessetNum":18,"Name":"ישיבת מליאה בתאריך 21/05/2012 בשעה: 16:00","StartDate":"2012-05-21T16:00:00+03:00","FinishDate":"2012-05-21T22:40:00+03:00","IsSpecialMeeting":false,"LastUpdatedDate":"2013-10-03T16:21:47+03:00"}
{"Id":435622,"Number":350,"KnessetNum":18,"Name":"ישיבת מליאה בתאריך 22/05/2012 בשעה: 16:00","StartDate":"2012-05-22T16:00:00+03:00","FinishDate":"2012-05-22T19:00:00+03:00","IsSpecialMeeting":false,"LastUpdatedDate":"2013-10-03T16:21:47+03:00"}
{"Id":435661,"Number":212,"KnessetNum":3,"Name":"ישיבת מליאה בתאריך 26/12/1956 בשעה 11:09","StartDate":"1956-12-26T11:09:00+02:00","FinishDate":"1956-12-26T13:10:00+02:00","IsSpecialMeeting":null,"LastUpdatedDate":"2021-12-16T11:59:50.063+02:00"}
{"Id":435664,"Number":276,"KnessetNum":3,"Name":"ישיבת מליאה בתאריך 28/03/1957 בשעה 13:20","StartDate":"1957-03-28T13:20:00+02:00","FinishDate":"1957-03-28T14:30:00+02:00","IsSpecialMeeting":null,"LastUpdatedDate":"2022-02-16T08:17:06.05+02:00"}
{"Id":435668,"Number":295,"KnessetNum":3,"Name":"ישיבת מליאה בתאריך 22/05/1957 בשעה 11:04","StartDate":"1957-05-22T11:04:00+03:00","FinishDate":"1957-05-22T12:17:00+03:00","IsSpecialMeeting":null,"LastUpdatedDate":"2022-02-22T16:27:02.053+02:00"}
{"Id":435673,"Number":307,"KnessetNum":3,"Name":"ישיבת מליאה בתאריך 17/06/1957 בשעה 20:38","StartDate":"1957-06-17T20:38:00+03:00","FinishDate":"1957-06-17T21:40:00+03:00","IsSpecialMeeting":null,"LastUpdatedDate":"2022-02-23T12:55:09.103+02:00"}
{"Id":435675,"Number":312,"KnessetNum":3,"Name":"ישיבת מליאה בתאריך 24/06/1957 בשעה 20:03","StartDate":"1957-06-24T20:03:00+03:00","FinishDate":"1957-06-24T21:02:00+03:00","IsSpecialMeeting":null,"LastUpdatedDate":"2022-02-23T14:16:00.98+02:00"}
{"Id":435678,"Number":324,"KnessetNum":3,"Name":"ישיבת מליאה בתאריך 10/07/1957 בשעה 11:10","StartDate":"1957-07-10T11:10:00+03:00","FinishDate":"1957-07-10T13:52:00+03:00","IsSpecialMeeting":null,"LastUpdatedDate":"2022-02-24T11:58:59.54+02:00"}
{"Id":435679,"Number":343,"KnessetNum":3,"Name":"ישיבת מליאה בתאריך 22/10/1957 בשעה 16:08","StartDate":"1957-10-22T16:08:00+02:00","FinishDate":"1957-10-22T18:56:00+02:00","IsSpecialMeeting":null,"LastUpdatedDate":"2022-03-01T06:57:13.46+02:00"}
{"Id":435680,"Number":344,"KnessetNum":3,"Name":"ישיבת מליאה בתאריך 23/10/1957 בשעה 11:05","StartDate":"1957-10-23T11:05:00+02:00","FinishDate":"1957-10-23T12:07:00+02:00","IsSpecialMeeting":null,"LastUpdatedDate":"2023-11-26T10:39:48.08+02:00"}
{"Id":435683,"Number":369,"KnessetNum":3,"Name":"ישיבת מליאה בתאריך 04/12/1957 בשעה 11:07","StartDate":"1957-12-04T11:07:00+02:00","FinishDate":"1957-12-04T12:05:00+02:00","IsSpecialMeeting":null,"LastUpdatedDate":"2022-03-03T11:42:59.05+02:00"}
{"Id":435687,"Number":377,"KnessetNum":3,"Name":"ישיבת מליאה בתאריך 17/12/1957 בשעה 16:32","StartDate":"1957-12-17T16:32:00+02:00","FinishDate":"1957-12-17T17:45:00+02:00","IsSpecialMeeting":null,"LastUpdatedDate":"2022-03-03T14:56:47.217+02:00"}
{"Id":435688,"Number":379,"KnessetNum":3,"Name":"ישיבת מליאה בתאריך 23/12/1957 בשעה 20:15","StartDate":"1957-12-23T20:15:00+02:00","FinishDate":"1957-12-23T22:10:00+02:00","IsSpecialMeeting":null,"LastUpdatedDate":"2022-03-03T15:05:11.617+02:00"}
{"Id":435692,"Number":405,"KnessetNum":3,"Name":"ישיבת מליאה בתאריך 04/02/1958 בשעה 16:07","StartDate":"1958-02-04T16:07:00+02:00","FinishDate":"1958-02-04T17:40:00+02:00","IsSpecialMeeting":null,"LastUpdatedDate":"2022-03-08T17:30:51.35+02:00"}
{"Id":435696,"Number":417,"KnessetNum":3,"Name":"ישיבת מליאה בתאריך 19/02/1958 בשעה 14:00","StartDate":"1958-02-19T14:00:00+02:00","FinishDate":"1958-02-19T18:32:00+02:00","IsSpecialMeeting":null,"LastUpdatedDate":"2022-03-08T19:48:17.497+02:00"}
{"Id":435699,"Number":422,"KnessetNum":3,"Name":"ישיבת מליאה בתאריך 26/02/1958 בשעה 15:13","StartDate":"1958-02-26T15:13:00+02:00","FinishDate":"1958-02-26T16:50:00+02:00","IsSpecialMeeting":null,"LastUpdatedDate":"2022-03-09T07:27:32.49+02:00"}
{"Id":435703,"Number":434,"KnessetNum":3,"Name":"ישיבת מליאה בתאריך 13/03/1958 בשעה 11:06","StartDate":"1958-03-13T11:06:00+02:00","FinishDate":"1958-03-13T13:55:00+02:00","IsSpecialMeeting":null,"LastUpdatedDate":"2022-03-10T09:31:36.01+02:00"}
{"Id":435704,"Number":437,"KnessetNum":3,"Name":"ישיבת מליאה בתאריך 18/03/1958 בשעה 15:00","StartDate":"1958-03-18T15:00:00+02:00","FinishDate":"1958-03-18T18:55:00+02:00","IsSpecialMeeting":null,"LastUpdatedDate":"2022-03-10T10:08:24.45+02:00"}
{"Id":435710,"Number":468,"KnessetNum":3,"Name":"ישיבת מליאה בתאריך 04/06/1958 בשעה 11:07","StartDate":"1958-06-04T11:07:00+03:00","FinishDate":"1958-06-04T12:10:00+03:00","IsSpecialMeeting":null,"LastUpdatedDate":"2023-11-13T08:23:56.027+02:00"}
{"Id":435714,"Number":478,"KnessetNum":3,"Name":"ישיבת מליאה בתאריך 23/06/1958 בשעה 16:15","StartDate":"1958-06-23T16:15:00+03:00","FinishDate":"1958-06-23T18:00:00+03:00","IsSpecialMeeting":null,"LastUpdatedDate":"2022-03-16T15:46:53.59+02:00"}
{"Id":435716,"Number":484,"KnessetNum":3,"Name":"ישיבת מליאה בתאריך 01/07/1958 בשעה 16:12","StartDate":"1958-07-01T16:12:00+03:00","FinishDate":"1958-07-01T18:40:00+03:00","IsSpecialMeeting":null,"LastUpdatedDate":"2022-03-21T06:47:56.993+02:00"}
{"Id":435721,"Number":500,"KnessetNum":3,"Name":"ישיבת מליאה בתאריך 23/07/1958 בשעה 11:05","StartDate":"1958-07-23T11:05:00+03:00","FinishDate":"1958-07-23T12:31:00+03:00","IsSpecialMeeting":null,"LastUpdatedDate":"2022-04-04T13:29:53.467+03:00"}
{"Id":435726,"Number":532,"KnessetNum":3,"Name":"ישיבת מליאה בתאריך 11/11/1958 בשעה 16:00","StartDate":"1958-11-11T16:00:00+02:00","FinishDate":"1958-11-11T18:50:00+02:00","IsSpecialMeeting":null,"LastUpdatedDate":"2022-04-07T14:33:06.503+03:00"}
{"Id":435727,"Number":538,"KnessetNum":3,"Name":"ישיבת מליאה בתאריך 19/11/1958 בשעה 11:09","StartDate":"1958-11-19T11:09:00+02:00","FinishDate":"1958-11-19T12:45:00+02:00","IsSpecialMeeting":null,"LastUpdatedDate":"2022-04-10T12:44:53.797+03:00"}
{"Id":435728,"Number":541,"KnessetNum":3,"Name":"ישיבת מליאה בתאריך 25/11/1958 בשעה 16:09","StartDate":"1958-11-25T16:09:00+02:00","FinishDate":"1958-11-25T18:55:00+02:00","IsSpecialMeeting":null,"LastUpdatedDate":"2022-04-10T14:41:15.65+03:00"}
{"Id":435733,"Number":562,"KnessetNum":3,"Name":"ישיבת מליאה בתאריך 24/12/1958 בשעה 11:06","StartDate":"1958-12-24T11:06:00+02:00","FinishDate":"1958-12-24T13:00:00+02:00","IsSpecialMeeting":null,"LastUpdatedDate":"2022-04-13T06:44:30.85+03:00"}
{"Id":435736,"Number":567,"KnessetNum":3,"Name":"ישיבת מליאה בתאריך 31/12/1958 בשעה 11:03","StartDate":"1958-12-31T11:03:00+02:00","FinishDate":"1958-12-31T13:47:00+02:00","IsSpecialMeeting":null,"LastUpdatedDate":"2022-04-13T10:39:57.793+03:00"}
{"Id":435740,"Number":577,"KnessetNum":3,"Name":"ישיבת מליאה בתאריך 14/01/1959 בשעה 11:05","StartDate":"1959-01-14T11:05:00+02:00","FinishDate":"1959-01-14T13:07:00+02:00","IsSpecialMeeting":null,"LastUpdatedDate":"2022-04-24T08:01:06.363+03:00"}
{"Id":435741,"Number":578,"KnessetNum":3,"Name":"ישיבת מליאה בתאריך 19/01/1959 בשעה 16:15","StartDate":"1959-01-19T16:15:00+02:00","FinishDate":"1959-01-19T19:20:00+02:00","IsSpecialMeeting":null,"LastUpdatedDate":"2022-04-24T08:06:58.82+03:00"}
{"Id":435742,"Number":581,"KnessetNum":3,"Name":"ישיבת מליאה בתאריך 26/01/1959 בשעה 16:16","StartDate":"1959-01-26T16:16:00+02:00","FinishDate":"1959-01-26T18:30:00+02:00","IsSpecialMeeting":null,"LastUpdatedDate":"2022-04-24T11:22:14.723+03:00"}
{"Id":435744,"Number":588,"KnessetNum":3,"Name":"ישיבת מליאה בתאריך 10/02/1959 בשעה 13:06","StartDate":"1959-02-10T13:06:00+02:00","FinishDate":"1959-02-10T16:57:00+02:00","IsSpecialMeeting":null,"LastUpdatedDate":"2022-04-25T08:29:04.88+03:00"}
{"Id":435746,"Number":592,"KnessetNum":3,"Name":"ישיבת מליאה בתאריך 17/02/1959 בשעה 15:05","StartDate":"1959-02-17T15:05:00+02:00","FinishDate":"1959-02-17T21:02:00+02:00","IsSpecialMeeting":null,"LastUpdatedDate":"2022-05-01T16:47:51.437+03:00"}
{"Id":435747,"Number":598,"KnessetNum":3,"Name":"ישיבת מליאה בתאריך 25/02/1959 בשעה 11:47","StartDate":"1959-02-25T11:47:00+02:00","FinishDate":"1959-02-25T13:25:00+02:00","IsSpecialMeeting":null,"LastUpdatedDate":"2022-05-08T10:13:31.933+03:00"}
{"Id":435763,"Number":2,"KnessetNum":4,"Name":"ישיבת מליאה בתאריך 01/12/1959 בשעה 17:13","StartDate":"1959-12-01T17:13:00+02:00","FinishDate":"1959-12-01T18:50:00+02:00","IsSpecialMeeting":null,"LastUpdatedDate":"2021-12-14T16:23:36.077+02:00"}
{"Id":435764,"Number":6,"KnessetNum":4,"Name":"ישיבת מליאה בתאריך 09/12/1959 בשעה 11:03","StartDate":"1959-12-09T11:03:00+02:00","FinishDate":"1959-12-09T13:43:00+02:00","IsSpecialMeeting":null,"LastUpdatedDate":"2023-07-06T16:48:19.263+03:00"}
{"Id":435768,"Number":30,"KnessetNum":4,"Name":"ישיבת מליאה בתאריך 13/01/1960 בשעה 11:12","StartDate":"1960-01-13T11:12:00+02:00","FinishDate":"1960-01-13T14:15:00+02:00","IsSpecialMeeting":null,"LastUpdatedDate":"2021-12-15T14:21:41.803+02:00"}
{"Id":435770,"Number":35,"KnessetNum":4,"Name":"ישיבת מליאה בתאריך 20/01/1960 בשעה 11:03","StartDate":"1960-01-20T11:03:00+02:00","FinishDate":"1960-01-20T13:17:00+02:00","IsSpecialMeeting":null,"LastUpdatedDate":"2021-12-16T07:45:09.417+02:00"}
{"Id":435773,"Number":45,"KnessetNum":4,"Name":"ישיבת מליאה בתאריך 03/02/1960 בשעה 11:01","StartDate":"1960-02-03T11:01:00+02:00","FinishDate":"1960-02-03T11:40:00+02:00","IsSpecialMeeting":null,"LastUpdatedDate":"2021-12-16T11:19:16.877+02:00"}
{"Id":435775,"Number":51,"KnessetNum":4,"Name":"ישיבת מליאה בתאריך 15/02/1960 בשעה 16:10","StartDate":"1960-02-15T16:10:00+02:00","FinishDate":"1960-02-15T17:52:00+02:00","IsSpecialMeeting":null,"LastUpdatedDate":"2021-12-20T07:13:41.777+02:00"}
{"Id":435777,"Number":64,"KnessetNum":4,"Name":"ישיבת מליאה בתאריך 02/03/1960 בשעה 11:06","StartDate":"1960-03-02T11:06:00+02:00","FinishDate":"1960-03-02T13:13:00+02:00","IsSpecialMeeting":null,"LastUpdatedDate":"2023-07-10T16:49:51.797+03:00"}
{"Id":435779,"Number":69,"KnessetNum":4,"Name":"ישיבת מליאה בתאריך 09/03/1960 בשעה 11:10","StartDate":"1960-03-09T11:10:00+02:00","FinishDate":"1960-03-09T12:03:00+02:00","IsSpecialMeeting":null,"LastUpdatedDate":"2021-12-20T12:33:45.477+02:00"}
{"Id":435781,"Number":82,"KnessetNum":4,"Name":"ישיבת מליאה בתאריך 30/03/1960 בשעה 11:01","StartDate":"1960-03-30T11:01:00+02:00","FinishDate":"1960-03-30T13:45:00+02:00","IsSpecialMeeting":null,"LastUpdatedDate":"2021-12-20T16:34:50.027+02:00"}
{"Id":435784,"Number":109,"KnessetNum":4,"Name":"ישיבת מליאה בתאריך 08/06/1960 בשעה 11:03","StartDate":"1960-06-08T11:03:00+03:00","FinishDate":"1960-06-08T14:40:00+03:00","IsSpecialMeeting":null,"LastUpdatedDate":"2021-12-21T14:36:38.913+02:00"}
{"Id":435786,"Number":133,"KnessetNum":4,"Name":"ישיבת מליאה בתאריך 12/07/1960 בשעה 16:00","StartDate":"1960-07-12T16:00:00+03:00","FinishDate":"1960-07-12T18:45:00+03:00","IsSpecialMeeting":null,"LastUpdatedDate":"2021-12-22T14:45:54.06+02:00"}
{"Id":435789,"Number":140,"KnessetNum":4,"Name":"ישיבת מליאה בתאריך 20/07/1960 בשעה 11:02","StartDate":"1960-07-20T11:02:00+03:00","FinishDate":"1960-07-20T12:49:00+03:00","IsSpecialMeeting":null,"LastUpdatedDate":"2021-12-23T08:44:26.377+02:00"}
{"Id":435791,"Number":145,"KnessetNum":4,"Name":"ישיבת מליאה בתאריך 27/07/1960 בשעה 11:05","StartDate":"1960-07-27T11:05:00+03:00","FinishDate":"1960-07-27T14:00:00+03:00","IsSpecialMeeting":null,"LastUpdatedDate":"2021-12-23T10:16:49.843+02:00"}
{"Id":435797,"Number":170,"KnessetNum":4,"Name":"ישיבת מליאה בתאריך 09/11/1960 בשעה 11:02","StartDate":"1960-11-09T11:02:00+02:00","FinishDate":"1960-11-09T13:11:00+02:00","IsSpecialMeeting":null,"LastUpdatedDate":"2021-12-27T08:14:42.28+02:00"}
{"Id":435801,"Number":201,"KnessetNum":4,"Name":"ישיבת מליאה בתאריך 27/12/1960 בשעה 16:00","StartDate":"1960-12-27T16:00:00+02:00","FinishDate":"1960-12-27T18:15:00+02:00","IsSpecialMeeting":null,"LastUpdatedDate":"2021-12-28T11:39:37.9+02:00"}
{"Id":435802,"Number":202,"KnessetNum":4,"Name":"ישיבת מליאה בתאריך 28/12/1960 בשעה 11:05","StartDate":"1960-12-28T11:05:00+02:00","FinishDate":"1960-12-28T11:45:00+02:00","IsSpecialMeeting":null,"LastUpdatedDate":"2023-07-16T16:07:06.17+03:00"}
{"Id":435803,"Number":205,"KnessetNum":4,"Name":"ישיבת מליאה בתאריך 03/01/1961 בשעה 16:02","StartDate":"1961-01-03T16:02:00+02:00","FinishDate":"1961-01-03T19:52:00+02:00","IsSpecialMeeting":null,"LastUpdatedDate":"2021-12-28T12:45:37.48+02:00"}
{"Id":435804,"Number":207,"KnessetNum":4,"Name":"ישיבת מליאה בתאריך 09/01/1961 בשעה 16:05","StartDate":"1961-01-09T16:05:00+02:00","FinishDate":"1961-01-09T18:39:00+02:00","IsSpecialMeeting":null,"LastUpdatedDate":"2021-12-28T14:16:47.66+02:00"}
{"Id":435805,"Number":208,"KnessetNum":4,"Name":"ישיבת מליאה בתאריך 10/01/1961 בשעה 20:00","StartDate":"1961-01-10T20:00:00+02:00","FinishDate":"1961-01-10T21:40:00+02:00","IsSpecialMeeting":null,"LastUpdatedDate":"2021-12-28T14:29:27.39+02:00"}
{"Id":435806,"Number":209,"KnessetNum":4,"Name":"ישיבת מליאה בתאריך 11/01/1961 בשעה 11:10","StartDate":"1961-01-11T11:10:00+02:00","FinishDate":"1961-01-11T12:58:00+02:00","IsSpecialMeeting":null,"LastUpdatedDate":"2021-12-28T14:48:09.783+02:00"}
{"Id":435807,"Number":214,"KnessetNum":4,"Name":"ישיבת מליאה בתאריך 18/01/1961 בשעה 11:04","StartDate":"1961-01-18T11:04:00+02:00","FinishDate":"1961-01-18T13:06:00+02:00","IsSpecialMeeting":null,"LastUpdatedDate":"2021-12-28T15:47:53.957+02:00"}
{"Id":435813,"Number":263,"KnessetNum":4,"Name":"ישיבת מליאה בתאריך 27/03/1961 בשעה 19:45","StartDate":"1961-03-27T19:45:00+02:00","FinishDate":"1961-03-27T21:15:00+02:00","IsSpecialMeeting":null,"LastUpdatedDate":"2022-01-11T12:36:33.25+02:00"}
{"Id":435817,"Number":278,"KnessetNum":4,"Name":"ישיבת מליאה בתאריך 24/05/1961 בשעה 11:01","StartDate":"1961-05-24T11:01:00+03:00","FinishDate":"1961-05-24T13:23:00+03:00","IsSpecialMeeting":null,"LastUpdatedDate":"2022-01-16T10:13:37.263+02:00"}
{"Id":435823,"Number":291,"KnessetNum":4,"Name":"ישיבת מליאה בתאריך 14/06/1961 בשעה 11:06","StartDate":"1961-06-14T11:06:00+03:00","FinishDate":"1961-06-14T12:11:00+03:00","IsSpecialMeeting":null,"LastUpdatedDate":"2022-01-17T10:32:54.897+02:00"}
{"Id":435824,"Number":293,"KnessetNum":4,"Name":"ישיבת מליאה בתאריך 24/07/1961 בשעה 11:08","StartDate":"1961-07-24T11:08:00+03:00","FinishDate":"1961-07-24T17:07:00+03:00","IsSpecialMeeting":null,"LastUpdatedDate":"2022-01-17T11:15:10.537+02:00"}
{"Id":435825,"Number":3,"KnessetNum":5,"Name":"ישיבת מליאה בתאריך 04/10/1961 בשעה 15:03","StartDate":"1961-10-04T15:03:00+02:00","FinishDate":"1961-10-04T19:01:00+02:00","IsSpecialMeeting":null,"LastUpdatedDate":"2022-01-17T12:20:02.21+02:00"}
{"Id":435826,"Number":4,"KnessetNum":5,"Name":"ישיבת מליאה בתאריך 09/10/1961 בשעה 16:04","StartDate":"1961-10-09T16:04:00+02:00","FinishDate":"1961-10-09T19:03:00+02:00","IsSpecialMeeting":null,"LastUpdatedDate":"2022-01-17T13:12:59.25+02:00"}
{"Id":435834,"Number":77,"KnessetNum":5,"Name":"ישיבת מליאה בתאריך 24/01/1962 בשעה 10:36","StartDate":"1962-01-24T10:36:00+02:00","FinishDate":"1962-01-24T11:25:00+02:00","IsSpecialMeeting":null,"LastUpdatedDate":"2022-01-24T16:31:14.79+02:00"}
{"Id":435837,"Number":93,"KnessetNum":5,"Name":"ישיבת מליאה בתאריך 14/02/1962 בשעה 11:06","StartDate":"1962-02-14T11:06:00+02:00","FinishDate":"1962-02-14T13:43:00+02:00","IsSpecialMeeting":null,"LastUpdatedDate":"2022-01-26T13:18:49.727+02:00"}
{"Id":435839,"Number":103,"KnessetNum":5,"Name":"ישיבת מליאה בתאריך 28/02/1962 בשעה 11:05","StartDate":"1962-02-28T11:05:00+02:00","FinishDate":"1962-02-28T12:25:00+02:00","IsSpecialMeeting":null,"LastUpdatedDate":"2022-01-30T10:24:20.847+02:00"}
{"Id":435841,"Number":115,"KnessetNum":5,"Name":"ישיבת מליאה בתאריך 22/03/1962 בשעה 11:05","StartDate":"1962-03-22T11:05:00+02:00","FinishDate":"1962-03-22T16:33:00+02:00","IsSpecialMeeting":null,"LastUpdatedDate":"2022-01-31T12:20:18.877+02:00"}
{"Id":435842,"Number":117,"KnessetNum":5,"Name":"ישיבת מליאה בתאריך 27/03/1962 בשעה 16:05","StartDate":"1962-03-27T16:05:00+02:00","FinishDate":"1962-03-27T19:05:00+02:00","IsSpecialMeeting":null,"LastUpdatedDate":"2022-07-14T18:50:18.067+03:00"}
{"Id":435843,"Number":118,"KnessetNum":5,"Name":"ישיבת מליאה בתאריך 28/03/1962 בשעה 11:15","StartDate":"1962-03-28T11:15:00+02:00","FinishDate":"1962-03-28T15:15:00+02:00","IsSpecialMeeting":null,"LastUpdatedDate":"2022-01-31T15:45:07.097+02:00"}
{"Id":435846,"Number":127,"KnessetNum":5,"Name":"ישיבת מליאה בתאריך 11/04/1962 בשעה 11:02","StartDate":"1962-04-11T11:02:00+03:00","FinishDate":"1962-04-11T13:20:00+03:00","IsSpecialMeeting":null,"LastUpdatedDate":"2022-02-01T13:23:23.333+02:00"}
{"Id":435847,"Number":129,"KnessetNum":5,"Name":"ישיבת מליאה בתאריך 15/05/1962 בשעה 16:05","StartDate":"1962-05-15T16:05:00+03:00","FinishDate":"1962-05-15T19:50:00+03:00","IsSpecialMeeting":null,"LastUpdatedDate":"2022-02-01T17:17:59.31+02:00"}
{"Id":435848,"Number":130,"KnessetNum":5,"Name":"ישיבת מליאה בתאריך 16/05/1962 בשעה 11:05","StartDate":"1962-05-16T11:05:00+03:00","FinishDate":"1962-05-16T13:50:00+03:00","IsSpecialMeeting":null,"LastUpdatedDate":"2022-02-01T09:45:13.423+02:00"}
{"Id":435850,"Number":135,"KnessetNum":5,"Name":"ישיבת מליאה בתאריך 29/05/1962 בשעה 16:05","StartDate":"1962-05-29T16:05:00+03:00","FinishDate":"1962-05-29T21:12:00+03:00","IsSpecialMeeting":null,"LastUpdatedDate":"2022-02-02T09:13:38.297+02:00"}
{"Id":435851,"Number":136,"KnessetNum":5,"Name":"ישיבת מליאה בתאריך 30/05/1962 בשעה 11:02","StartDate":"1962-05-30T11:02:00+03:00","FinishDate":"1962-05-30T14:15:00+03:00","IsSpecialMeeting":null,"LastUpdatedDate":"2022-02-02T09:46:37.367+02:00"}
{"Id":435852,"Number":137,"KnessetNum":5,"Name":"ישיבת מליאה בתאריך 04/06/1962 בשעה 16:04","StartDate":"1962-06-04T16:04:00+03:00","FinishDate":"1962-06-04T21:00:00+03:00","IsSpecialMeeting":null,"LastUpdatedDate":"2022-02-02T09:59:49.613+02:00"}
{"Id":435853,"Number":140,"KnessetNum":5,"Name":"ישיבת מליאה בתאריך 11/06/1962 בשעה 16:07","StartDate":"1962-06-11T16:07:00+03:00","FinishDate":"1962-06-11T21:26:00+03:00","IsSpecialMeeting":null,"LastUpdatedDate":"2022-02-02T12:03:12.753+02:00"}
{"Id":435854,"Number":144,"KnessetNum":5,"Name":"ישיבת מליאה בתאריך 19/06/1962 בשעה 15:00","StartDate":"1962-06-19T15:00:00+03:00","FinishDate":"1962-06-19T20:55:00+03:00","IsSpecialMeeting":null,"LastUpdatedDate":"2022-02-02T14:16:45.943+02:00"}
{"Id":435855,"Number":146,"KnessetNum":5,"Name":"ישיבת מליאה בתאריך 25/06/1962 בשעה 16:02","StartDate":"1962-06-25T16:02:00+03:00","FinishDate":"1962-06-25T20:50:00+03:00","IsSpecialMeeting":null,"LastUpdatedDate":"2022-02-03T08:37:00.507+02:00"}
{"Id":435856,"Number":152,"KnessetNum":5,"Name":"ישיבת מליאה בתאריך 05/07/1962 בשעה 12:05","StartDate":"1962-07-05T12:05:00+03:00","FinishDate":"1962-07-05T13:47:00+03:00","IsSpecialMeeting":null,"LastUpdatedDate":"2022-02-03T11:35:57.547+02:00"}
{"Id":435857,"Number":156,"KnessetNum":5,"Name":"ישיבת מליאה בתאריך 12/07/1962 בשעה 10:05","StartDate":"1962-07-12T10:05:00+03:00","FinishDate":"1962-07-12T11:45:00+03:00","IsSpecialMeeting":null,"LastUpdatedDate":"2022-02-06T14:25:02.8+02:00"}
{"Id":435858,"Number":157,"KnessetNum":5,"Name":"ישיבת מליאה בתאריך 16/07/1962 בשעה 18:28","StartDate":"1962-07-16T18:28:00+03:00","FinishDate":"1962-07-16T21:33:00+03:00","IsSpecialMeeting":null,"LastUpdatedDate":"2022-02-07T08:01:01.537+02:00"}
{"Id":435860,"Number":182,"KnessetNum":5,"Name":"ישיבת מליאה בתאריך 20/11/1962 בשעה 16:00","StartDate":"1962-11-20T16:00:00+02:00","FinishDate":"1962-11-20T21:16:00+02:00","IsSpecialMeeting":null,"LastUpdatedDate":"2022-02-07T16:14:48.61+02:00"}
{"Id":435861,"Number":185,"KnessetNum":5,"Name":"ישיבת מליאה בתאריך 27/11/1962 בשעה 16:03","StartDate":"1962-11-27T16:03:00+02:00","FinishDate":"1962-11-27T21:14:00+02:00","IsSpecialMeeting":null,"LastUpdatedDate":"2022-02-08T10:31:43.543+02:00"}
{"Id":435862,"Number":186,"KnessetNum":5,"Name":"ישיבת מליאה בתאריך 28/11/1962 בשעה 11:01","StartDate":"1962-11-28T11:01:00+02:00","FinishDate":"1962-11-28T13:28:00+02:00","IsSpecialMeeting":null,"LastUpdatedDate":"2022-02-08T11:08:07.243+02:00"}
{"Id":435863,"Number":187,"KnessetNum":5,"Name":"ישיבת מליאה בתאריך 03/12/1962 בשעה 16:00","StartDate":"1962-12-03T16:00:00+02:00","FinishDate":"1962-12-03T20:25:00+02:00","IsSpecialMeeting":null,"LastUpdatedDate":"2022-02-08T12:41:41.3+02:00"}
{"Id":435864,"Number":192,"KnessetNum":5,"Name":"ישיבת מליאה בתאריך 12/12/1962 בשעה 11:00","StartDate":"1962-12-12T11:00:00+02:00","FinishDate":"1962-12-12T14:03:00+02:00","IsSpecialMeeting":null,"LastUpdatedDate":"2022-02-08T15:37:39.153+02:00"}
{"Id":435865,"Number":193,"KnessetNum":5,"Name":"ישיבת מליאה בתאריך 17/12/1962 בשעה 16:00","StartDate":"1962-12-17T16:00:00+02:00","FinishDate":"1962-12-17T21:24:00+02:00","IsSpecialMeeting":null,"LastUpdatedDate":"2022-02-08T17:17:23.82+02:00"}
{"Id":435866,"Number":194,"KnessetNum":5,"Name":"ישיבת מליאה בתאריך 18/12/1962 בשעה 16:05","StartDate":"1962-12-18T16:05:00+02:00","FinishDate":"1962-12-18T20:26:00+02:00","IsSpecialMeeting":null,"LastUpdatedDate":"2022-02-09T07:25:38.58+02:00"}
{"Id":435867,"Number":196,"KnessetNum":5,"Name":"ישיבת מליאה בתאריך 24/12/1962 בשעה 16:04","StartDate":"1962-12-24T16:04:00+02:00","FinishDate":"1962-12-24T20:30:00+02:00","IsSpecialMeeting":null,"LastUpdatedDate":"2022-02-09T09:23:48.013+02:00"}
{"Id":435868,"Number":198,"KnessetNum":5,"Name":"ישיבת מליאה בתאריך 26/12/1962 בשעה 11:10","StartDate":"1962-12-26T11:10:00+02:00","FinishDate":"1962-12-26T12:50:00+02:00","IsSpecialMeeting":null,"LastUpdatedDate":"2022-02-09T10:47:13.443+02:00"}
{"Id":435869,"Number":199,"KnessetNum":5,"Name":"ישיבת מליאה בתאריך 31/12/1962 בשעה 16:01","StartDate":"1962-12-31T16:01:00+02:00","FinishDate":"1962-12-31T19:20:00+02:00","IsSpecialMeeting":null,"LastUpdatedDate":"2022-02-09T11:20:43.673+02:00"}
{"Id":435870,"Number":203,"KnessetNum":5,"Name":"ישיבת מליאה בתאריך 08/01/1963 בשעה 16:02","StartDate":"1963-01-08T16:02:00+02:00","FinishDate":"1963-01-08T20:30:00+02:00","IsSpecialMeeting":null,"LastUpdatedDate":"2022-02-09T14:08:41.493+02:00"}
{"Id":435871,"Number":204,"KnessetNum":5,"Name":"ישיבת מליאה בתאריך 09/01/1963 בשעה 11:06","StartDate":"1963-01-09T11:06:00+02:00","FinishDate":"1963-01-09T12:50:00+02:00","IsSpecialMeeting":null,"LastUpdatedDate":"2022-02-09T14:24:34.293+02:00"}
{"Id":435872,"Number":205,"KnessetNum":5,"Name":"ישיבת מליאה בתאריך 14/01/1963 בשעה 16:00","StartDate":"1963-01-14T16:00:00+02:00","FinishDate":"1963-01-14T20:57:00+02:00","IsSpecialMeeting":null,"LastUpdatedDate":"2022-02-10T07:21:17.177+02:00"}
{"Id":435873,"Number":209,"KnessetNum":5,"Name":"ישיבת מליאה בתאריך 22/01/1963 בשעה 16:01","StartDate":"1963-01-22T16:01:00+02:00","FinishDate":"1963-01-22T19:52:00+02:00","IsSpecialMeeting":null,"LastUpdatedDate":"2022-02-10T10:01:57.357+02:00"}
{"Id":435874,"Number":210,"KnessetNum":5,"Name":"ישיבת מליאה בתאריך 23/01/1963 בשעה 11:01","StartDate":"1963-01-23T11:01:00+02:00","FinishDate":"1963-01-23T12:41:00+02:00","IsSpecialMeeting":null,"LastUpdatedDate":"2022-02-10T11:16:17.19+02:00"}
{"Id":435875,"Number":211,"KnessetNum":5,"Name":"ישיבת מליאה בתאריך 28/01/1963 בשעה 16:03","StartDate":"1963-01-28T16:03:00+02:00","FinishDate":"1963-01-28T20:39:00+02:00","IsSpecialMeeting":null,"LastUpdatedDate":"2022-02-10T11:24:25.567+02:00"}
{"Id":435876,"Number":215,"KnessetNum":5,"Name":"ישיבת מליאה בתאריך 05/02/1963 בשעה 16:02","StartDate":"1963-02-05T16:02:00+02:00","FinishDate":"1963-02-05T20:44:00+02:00","IsSpecialMeeting":null,"LastUpdatedDate":"2022-02-10T12:40:22.473+02:00"}
{"Id":435877,"Number":216,"KnessetNum":5,"Name":"ישיבת מליאה בתאריך 06/02/1963 בשעה 11:02","StartDate":"1963-02-06T11:02:00+02:00","FinishDate":"1963-02-06T13:20:00+02:00","IsSpecialMeeting":null,"LastUpdatedDate":"2022-02-13T07:53:03.29+02:00"}
{"Id":435878,"Number":221,"KnessetNum":5,"Name":"ישיבת מליאה בתאריך 19/02/1963 בשעה 16:00","StartDate":"1963-02-19T16:00:00+02:00","FinishDate":"1963-02-19T20:04:00+02:00","IsSpecialMeeting":null,"LastUpdatedDate":"2022-02-13T10:16:12.167+02:00"}
{"Id":435879,"Number":222,"KnessetNum":5,"Name":"ישיבת מליאה בתאריך 20/02/1963 בשעה 11:02","StartDate":"1963-02-20T11:02:00+02:00","FinishDate":"1963-02-20T14:20:00+02:00","IsSpecialMeeting":null,"LastUpdatedDate":"2022-02-13T12:55:42.34+02:00"}
{"Id":435880,"Number":223,"KnessetNum":5,"Name":"ישיבת מליאה בתאריך 25/02/1963 בשעה 16:03","StartDate":"1963-02-25T16:03:00+02:00","FinishDate":"1963-02-25T20:55:00+02:00","IsSpecialMeeting":null,"LastUpdatedDate":"2022-02-13T13:12:12.36+02:00"}
{"Id":435881,"Number":224,"KnessetNum":5,"Name":"ישיבת מליאה בתאריך 26/02/1963 בשעה 16:02","StartDate":"1963-02-26T16:02:00+02:00","FinishDate":"1963-02-26T22:05:00+02:00","IsSpecialMeeting":null,"LastUpdatedDate":"2022-02-13T13:26:56.747+02:00"}
{"Id":435882,"Number":227,"KnessetNum":5,"Name":"ישיבת מליאה בתאריך 05/03/1963 בשעה 11:01","StartDate":"1963-03-05T11:01:00+02:00","FinishDate":"1963-03-05T20:50:00+02:00","IsSpecialMeeting":null,"LastUpdatedDate":"2022-02-14T08:29:06.377+02:00"}
{"Id":435883,"Number":228,"KnessetNum":5,"Name":"ישיבת מליאה בתאריך 06/03/1963 בשעה 11:03","StartDate":"1963-03-06T11:03:00+02:00","FinishDate":"1963-03-06T12:40:00+02:00","IsSpecialMeeting":null,"LastUpdatedDate":"2022-02-14T10:43:39.907+02:00"}
{"Id":435884,"Number":229,"KnessetNum":5,"Name":"ישיבת מליאה בתאריך 12/03/1963 בשעה 16:02","StartDate":"1963-03-12T16:02:00+02:00","FinishDate":"1963-03-12T21:09:00+02:00","IsSpecialMeeting":null,"LastUpdatedDate":"2022-02-14T11:19:09.463+02:00"}
{"Id":435885,"Number":236,"KnessetNum":5,"Name":"ישיבת מליאה בתאריך 25/03/1963 בשעה 16:05","StartDate":"1963-03-25T16:05:00+02:00","FinishDate":"1963-03-25T22:10:00+02:00","IsSpecialMeeting":null,"LastUpdatedDate":"2022-02-14T14:35:28.677+02:00"}
{"Id":435886,"Number":238,"KnessetNum":5,"Name":"ישיבת מליאה בתאריך 27/03/1963 בשעה 15:00","StartDate":"1963-03-27T15:00:00+02:00","FinishDate":"1963-03-27T20:59:00+02:00","IsSpecialMeeting":null,"LastUpdatedDate":"2022-02-14T16:03:49.603+02:00"}
{"Id":435887,"Number":239,"KnessetNum":5,"Name":"ישיבת מליאה בתאריך 28/03/1963 בשעה 09:04","StartDate":"1963-03-28T09:04:00+02:00","FinishDate":"1963-03-28T12:40:00+02:00","IsSpecialMeeting":null,"LastUpdatedDate":"2022-02-15T11:25:31.833+02:00"}
{"Id":435888,"Number":261,"KnessetNum":5,"Name":"ישיבת מליאה בתאריך 19/06/1963 בשעה 11:03","StartDate":"1963-06-19T11:03:00+03:00","FinishDate":"1963-06-19T13:17:00+03:00","IsSpecialMeeting":null,"LastUpdatedDate":"2022-02-16T11:47:25.947+02:00"}
{"Id":435889,"Number":263,"KnessetNum":5,"Name":"ישיבת מליאה בתאריך 25/06/1963 בשעה 16:02","StartDate":"1963-06-25T16:02:00+03:00","FinishDate":"1963-06-25T20:55:00+03:00","IsSpecialMeeting":null,"LastUpdatedDate":"2022-02-16T12:39:25.807+02:00"}
{"Id":435891,"Number":279,"KnessetNum":5,"Name":"ישיבת מליאה בתאריך 05/08/1963 בשעה 16:05","StartDate":"1963-08-05T16:05:00+03:00","FinishDate":"1963-08-05T20:55:00+03:00","IsSpecialMeeting":null,"LastUpdatedDate":"2022-02-20T11:24:49.847+02:00"}
{"Id":435892,"Number":281,"KnessetNum":5,"Name":"ישיבת מליאה בתאריך 07/08/1963 בשעה 09:06","StartDate":"1963-08-07T09:06:00+03:00","FinishDate":"1963-08-07T17:55:00+03:00","IsSpecialMeeting":null,"LastUpdatedDate":"2022-02-22T10:21:09.66+02:00"}
{"Id":435893,"Number":282,"KnessetNum":5,"Name":"ישיבת מליאה בתאריך 26/08/1963 בשעה 11:03","StartDate":"1963-08-26T11:03:00+03:00","FinishDate":"1963-08-26T16:50:00+03:00","IsSpecialMeeting":null,"LastUpdatedDate":"2022-02-22T11:36:08.957+02:00"}
{"Id":435894,"Number":290,"KnessetNum":5,"Name":"ישיבת מליאה בתאריך 05/11/1963 בשעה 16:01","StartDate":"1963-11-05T16:01:00+02:00","FinishDate":"1963-11-05T19:58:00+02:00","IsSpecialMeeting":null,"LastUpdatedDate":"2022-02-22T14:16:03.573+02:00"}
{"Id":435895,"Number":291,"KnessetNum":5,"Name":"ישיבת מליאה בתאריך 06/11/1963 בשעה 11:07","StartDate":"1963-11-06T11:07:00+02:00","FinishDate":"1963-11-06T13:26:00+02:00","IsSpecialMeeting":null,"LastUpdatedDate":"2022-02-22T15:13:02.637+02:00"}
{"Id":435896,"Number":293,"KnessetNum":5,"Name":"ישיבת מליאה בתאריך 12/11/1963 בשעה 16:00","StartDate":"1963-11-12T16:00:00+02:00","FinishDate":"1963-11-12T18:51:00+02:00","IsSpecialMeeting":null,"LastUpdatedDate":"2022-02-22T15:24:57.493+02:00"}
{"Id":435897,"Number":295,"KnessetNum":5,"Name":"ישיבת מליאה בתאריך 18/11/1963 בשעה 16:05","StartDate":"1963-11-18T16:05:00+02:00","FinishDate":"1963-11-18T20:10:00+02:00","IsSpecialMeeting":null,"LastUpdatedDate":"2022-02-22T16:30:17.457+02:00"}
{"Id":435898,"Number":299,"KnessetNum":5,"Name":"ישיבת מליאה בתאריך 26/11/1963 בשעה 16:00","StartDate":"1963-11-26T16:00:00+02:00","FinishDate":"1963-11-26T19:30:00+02:00","IsSpecialMeeting":null,"LastUpdatedDate":"2022-02-23T08:06:01.183+02:00"}
{"Id":435899,"Number":302,"KnessetNum":5,"Name":"ישיבת מליאה בתאריך 03/12/1963 בשעה 16:00","StartDate":"1963-12-03T16:00:00+02:00","FinishDate":"1963-12-03T20:30:00+02:00","IsSpecialMeeting":null,"LastUpdatedDate":"2022-02-23T09:23:12.083+02:00"}
{"Id":435900,"Number":304,"KnessetNum":5,"Name":"ישיבת מליאה בתאריך 09/12/1963 בשעה 16:02","StartDate":"1963-12-09T16:02:00+02:00","FinishDate":"1963-12-09T19:46:00+02:00","IsSpecialMeeting":null,"LastUpdatedDate":"2022-02-23T10:27:33.457+02:00"}
{"Id":435901,"Number":305,"KnessetNum":5,"Name":"ישיבת מליאה בתאריך 10/12/1963 בשעה 11:01","StartDate":"1963-12-10T11:01:00+02:00","FinishDate":"1963-12-10T13:08:00+02:00","IsSpecialMeeting":null,"LastUpdatedDate":"2022-02-23T11:15:17.723+02:00"}
{"Id":435902,"Number":307,"KnessetNum":5,"Name":"ישיבת מליאה בתאריך 17/12/1963 בשעה 16:02","StartDate":"1963-12-17T16:02:00+02:00","FinishDate":"1963-12-17T20:35:00+02:00","IsSpecialMeeting":null,"LastUpdatedDate":"2022-02-23T12:22:32.203+02:00"}
{"Id":435903,"Number":308,"KnessetNum":5,"Name":"ישיבת מליאה בתאריך 18/12/1963 בשעה 11:06","StartDate":"1963-12-18T11:06:00+02:00","FinishDate":"1963-12-18T13:47:00+02:00","IsSpecialMeeting":null,"LastUpdatedDate":"2022-02-23T12:37:18.237+02:00"}
{"Id":435904,"Number":310,"KnessetNum":5,"Name":"ישיבת מליאה בתאריך 24/12/1963 בשעה 16:03","StartDate":"1963-12-24T16:03:00+02:00","FinishDate":"1963-12-24T18:54:00+02:00","IsSpecialMeeting":null,"LastUpdatedDate":"2022-02-24T07:16:56.223+02:00"}
{"Id":435905,"Number":313,"KnessetNum":5,"Name":"ישיבת מליאה בתאריך 31/12/1963 בשעה 16:12","StartDate":"1963-12-31T16:12:00+02:00","FinishDate":"1963-12-31T19:27:00+02:00","IsSpecialMeeting":null,"LastUpdatedDate":"2022-02-24T08:44:40.44+02:00"}
{"Id":435906,"Number":314,"KnessetNum":5,"Name":"ישיבת מליאה בתאריך 01/01/1964 בשעה 11:03","StartDate":"1964-01-01T11:03:00+02:00","FinishDate":"1964-01-01T12:37:00+02:00","IsSpecialMeeting":null,"LastUpdatedDate":"2022-02-24T09:46:00.907+02:00"}
{"Id":435907,"Number":315,"KnessetNum":5,"Name":"ישיבת מליאה בתאריך 06/01/1964 בשעה 16:05","StartDate":"1964-01-06T16:05:00+02:00","FinishDate":"1964-01-06T21:05:00+02:00","IsSpecialMeeting":null,"LastUpdatedDate":"2022-02-24T09:52:39.42+02:00"}
{"Id":435908,"Number":318,"KnessetNum":5,"Name":"ישיבת מליאה בתאריך 13/01/1964 בשעה 16:03","StartDate":"1964-01-13T16:03:00+02:00","FinishDate":"1964-01-13T19:58:00+02:00","IsSpecialMeeting":null,"LastUpdatedDate":"2022-02-24T11:17:52.133+02:00"}
{"Id":435909,"Number":319,"KnessetNum":5,"Name":"ישיבת מליאה בתאריך 14/01/1964 בשעה 16:00","StartDate":"1964-01-14T16:00:00+02:00","FinishDate":"1964-01-14T19:50:00+02:00","IsSpecialMeeting":null,"LastUpdatedDate":"2022-02-24T11:29:25.46+02:00"}
{"Id":435910,"Number":320,"KnessetNum":5,"Name":"ישיבת מליאה בתאריך 15/01/1964 בשעה 11:02","StartDate":"1964-01-15T11:02:00+02:00","FinishDate":"1964-01-15T13:28:00+02:00","IsSpecialMeeting":null,"LastUpdatedDate":"2022-02-24T12:26:22.557+02:00"}
{"Id":435911,"Number":321,"KnessetNum":5,"Name":"ישיבת מליאה בתאריך 20/01/1964 בשעה 16:01","StartDate":"1964-01-20T16:01:00+02:00","FinishDate":"1964-01-20T20:30:00+02:00","IsSpecialMeeting":null,"LastUpdatedDate":"2022-02-27T12:17:10.473+02:00"}
{"Id":435912,"Number":331,"KnessetNum":5,"Name":"ישיבת מליאה בתאריך 11/02/1964 בשעה 16:02","StartDate":"1964-02-11T16:02:00+02:00","FinishDate":"1964-02-11T21:04:00+02:00","IsSpecialMeeting":null,"LastUpdatedDate":"2022-02-28T08:45:16.053+02:00"}
{"Id":435913,"Number":335,"KnessetNum":5,"Name":"ישיבת מליאה בתאריך 19/02/1964 בשעה 11:02","StartDate":"1964-02-19T11:02:00+02:00","FinishDate":"1964-02-19T13:20:00+02:00","IsSpecialMeeting":null,"LastUpdatedDate":"2022-02-28T10:42:50.597+02:00"}
{"Id":435914,"Number":336,"KnessetNum":5,"Name":"ישיבת מליאה בתאריך 24/02/1964 בשעה 16:04","StartDate":"1964-02-24T16:04:00+02:00","FinishDate":"1964-02-24T21:01:00+02:00","IsSpecialMeeting":null,"LastUpdatedDate":"2022-02-28T10:54:21.263+02:00"}
{"Id":435915,"Number":337,"KnessetNum":5,"Name":"ישיבת מליאה בתאריך 25/02/1964 בשעה 16:05","StartDate":"1964-02-25T16:05:00+02:00","FinishDate":"1964-02-25T20:35:00+02:00","IsSpecialMeeting":null,"LastUpdatedDate":"2022-02-28T11:46:22.51+02:00"}
{"Id":435916,"Number":338,"KnessetNum":5,"Name":"ישיבת מליאה בתאריך 26/02/1964 בשעה 11:05","StartDate":"1964-02-26T11:05:00+02:00","FinishDate":"1964-02-26T12:50:00+02:00","IsSpecialMeeting":null,"LastUpdatedDate":"2022-02-28T12:17:45.877+02:00"}
{"Id":435917,"Number":340,"KnessetNum":5,"Name":"ישיבת מליאה בתאריך 03/03/1964 בשעה 16:02","StartDate":"1964-03-03T16:02:00+02:00","FinishDate":"1964-03-03T20:17:00+02:00","IsSpecialMeeting":null,"LastUpdatedDate":"2022-02-28T12:34:27.91+02:00"}
{"Id":435918,"Number":341,"KnessetNum":5,"Name":"ישיבת מליאה בתאריך 04/03/1964 בשעה 11:00","StartDate":"1964-03-04T11:00:00+02:00","FinishDate":"1964-03-04T13:38:00+02:00","IsSpecialMeeting":null,"LastUpdatedDate":"2022-02-28T13:57:38.407+02:00"}
{"Id":435919,"Number":342,"KnessetNum":5,"Name":"ישיבת מליאה בתאריך 09/03/1964 בשעה 16:04","StartDate":"1964-03-09T16:04:00+02:00","FinishDate":"1964-03-09T21:10:00+02:00","IsSpecialMeeting":null,"LastUpdatedDate":"2022-02-28T14:05:44.51+02:00"}
{"Id":435920,"Number":347,"KnessetNum":5,"Name":"ישיבת מליאה בתאריך 18/03/1964 בשעה 11:05","StartDate":"1964-03-18T11:05:00+02:00","FinishDate":"1964-03-18T17:57:00+02:00","IsSpecialMeeting":null,"LastUpdatedDate":"2022-03-01T10:26:41.317+02:00"}
{"Id":435921,"Number":348,"KnessetNum":5,"Name":"ישיבת מליאה בתאריך 23/03/1964 בשעה 12:05","StartDate":"1964-03-23T12:05:00+02:00","FinishDate":"1964-03-24T02:06:00+02:00","IsSpecialMeeting":null,"LastUpdatedDate":"2022-03-01T12:36:26.157+02:00"}
{"Id":435922,"Number":349,"KnessetNum":5,"Name":"ישיבת מליאה בתאריך 27/04/1964 בשעה 16:07","StartDate":"1964-04-27T16:07:00+03:00","FinishDate":"1964-04-27T19:25:00+03:00","IsSpecialMeeting":null,"LastUpdatedDate":"2022-03-01T14:28:16.743+02:00"}
{"Id":435923,"Number":351,"KnessetNum":5,"Name":"ישיבת מליאה בתאריך 29/04/1964 בשעה 11:03","StartDate":"1964-04-29T11:03:00+03:00","FinishDate":"1964-04-29T12:42:00+03:00","IsSpecialMeeting":null,"LastUpdatedDate":"2022-03-01T15:22:46.037+02:00"}
{"Id":435924,"Number":352,"KnessetNum":5,"Name":"ישיבת מליאה בתאריך 04/05/1964 בשעה 16:03","StartDate":"1964-05-04T16:03:00+03:00","FinishDate":"1964-05-04T21:08:00+03:00","IsSpecialMeeting":null,"LastUpdatedDate":"2022-03-01T15:33:59.467+02:00"}
{"Id":435925,"Number":356,"KnessetNum":5,"Name":"ישיבת מליאה בתאריך 12/05/1964 בשעה 16:05","StartDate":"1964-05-12T16:05:00+03:00","FinishDate":"1964-05-12T19:36:00+03:00","IsSpecialMeeting":null,"LastUpdatedDate":"2022-03-03T09:11:43.857+02:00"}
{"Id":435926,"Number":357,"KnessetNum":5,"Name":"ישיבת מליאה בתאריך 13/05/1964 בשעה 11:05","StartDate":"1964-05-13T11:05:00+03:00","FinishDate":"1964-05-13T14:00:00+03:00","IsSpecialMeeting":null,"LastUpdatedDate":"2022-03-03T09:14:03.647+02:00"}
{"Id":435927,"Number":358,"KnessetNum":5,"Name":"ישיבת מליאה בתאריך 18/05/1964 בשעה 16:05","StartDate":"1964-05-18T16:05:00+03:00","FinishDate":"1964-05-18T19:46:00+03:00","IsSpecialMeeting":null,"LastUpdatedDate":"2022-03-03T10:41:50.67+02:00"}
{"Id":435928,"Number":359,"KnessetNum":5,"Name":"ישיבת מליאה בתאריך 19/05/1964 בשעה 16:03","StartDate":"1964-05-19T16:03:00+03:00","FinishDate":"1964-05-19T19:10:00+03:00","IsSpecialMeeting":null,"LastUpdatedDate":"2022-03-03T11:01:26.133+02:00"}
{"Id":435929,"Number":364,"KnessetNum":5,"Name":"ישיבת מליאה בתאריך 01/06/1964 בשעה 16:01","StartDate":"1964-06-01T16:01:00+03:00","FinishDate":"1964-06-01T19:44:00+03:00","IsSpecialMeeting":null,"LastUpdatedDate":"2023-12-12T09:58:29.54+02:00"}
{"Id":435930,"Number":371,"KnessetNum":5,"Name":"ישיבת מליאה בתאריך 16/06/1964 בשעה 16:03","StartDate":"1964-06-16T16:03:00+03:00","FinishDate":"1964-06-16T19:14:00+03:00","IsSpecialMeeting":null,"LastUpdatedDate":"2022-03-08T14:39:39.03+02:00"}
{"Id":435931,"Number":373,"KnessetNum":5,"Name":"ישיבת מליאה בתאריך 22/06/1964 בשעה 16:00","StartDate":"1964-06-22T16:00:00+03:00","FinishDate":"1964-06-22T18:12:00+03:00","IsSpecialMeeting":null,"LastUpdatedDate":"2022-03-08T15:12:17.937+02:00"}
{"Id":435932,"Number":374,"KnessetNum":5,"Name":"ישיבת מליאה בתאריך 23/06/1964 בשעה 16:00","StartDate":"1964-06-23T16:00:00+03:00","FinishDate":"1964-06-23T17:20:00+03:00","IsSpecialMeeting":null,"LastUpdatedDate":"2022-03-08T15:57:55.337+02:00"}
{"Id":435933,"Number":382,"KnessetNum":5,"Name":"ישיבת מליאה בתאריך 13/07/1964 בשעה 16:03","StartDate":"1964-07-13T16:03:00+03:00","FinishDate":"1964-07-13T21:10:00+03:00","IsSpecialMeeting":null,"LastUpdatedDate":"2022-03-09T13:46:37.103+02:00"}
{"Id":435934,"Number":385,"KnessetNum":5,"Name":"ישיבת מליאה בתאריך 20/07/1964 בשעה 16:00","StartDate":"1964-07-20T16:00:00+03:00","FinishDate":"1964-07-20T20:23:00+03:00","IsSpecialMeeting":null,"LastUpdatedDate":"2022-03-10T07:40:09.953+02:00"}
{"Id":435935,"Number":391,"KnessetNum":5,"Name":"ישיבת מליאה בתאריך 30/07/1964 בשעה 09:02","StartDate":"1964-07-30T09:02:00+03:00","FinishDate":"1964-07-30T18:55:00+03:00","IsSpecialMeeting":null,"LastUpdatedDate":"2022-03-13T07:27:45.213+02:00"}
{"Id":435937,"Number":394,"KnessetNum":5,"Name":"ישיבת מליאה בתאריך 13/10/1964 בשעה 16:00","StartDate":"1964-10-13T16:00:00+02:00","FinishDate":"1964-10-13T19:13:00+02:00","IsSpecialMeeting":null,"LastUpdatedDate":"2022-03-13T10:35:04.61+02:00"}
{"Id":435938,"Number":397,"KnessetNum":5,"Name":"ישיבת מליאה בתאריך 20/10/1964 בשעה 16:00","StartDate":"1964-10-20T16:00:00+02:00","FinishDate":"1964-10-20T20:42:00+02:00","IsSpecialMeeting":null,"LastUpdatedDate":"2022-03-13T12:05:09.55+02:00"}
{"Id":435939,"Number":399,"KnessetNum":5,"Name":"ישיבת מליאה בתאריך 26/10/1964 בשעה 16:05","StartDate":"1964-10-26T16:05:00+02:00","FinishDate":"1964-10-26T20:00:00+02:00","IsSpecialMeeting":null,"LastUpdatedDate":"2022-03-13T12:47:18.7+02:00"}
{"Id":435940,"Number":401,"KnessetNum":5,"Name":"ישיבת מליאה בתאריך 28/10/1964 בשעה 11:07","StartDate":"1964-10-28T11:07:00+02:00","FinishDate":"1964-10-28T12:40:00+02:00","IsSpecialMeeting":null,"LastUpdatedDate":"2022-03-14T07:49:18.427+02:00"}
{"Id":435941,"Number":405,"KnessetNum":5,"Name":"ישיבת מליאה בתאריך 09/11/1964 בשעה 16:07","StartDate":"1964-11-09T16:07:00+02:00","FinishDate":"1964-11-09T19:35:00+02:00","IsSpecialMeeting":null,"LastUpdatedDate":"2022-03-14T11:15:09.723+02:00"}
{"Id":435942,"Number":407,"KnessetNum":5,"Name":"ישיבת מליאה בתאריך 11/11/1964 בשעה 11:00","StartDate":"1964-11-11T11:00:00+02:00","FinishDate":"1964-11-11T12:51:00+02:00","IsSpecialMeeting":null,"LastUpdatedDate":"2022-03-14T13:14:20.163+02:00"}
{"Id":435943,"Number":409,"KnessetNum":5,"Name":"ישיבת מליאה בתאריך 17/11/1964 בשעה 17:30","StartDate":"1964-11-17T17:30:00+02:00","FinishDate":"1964-11-17T19:20:00+02:00","IsSpecialMeeting":null,"LastUpdatedDate":"2022-03-15T10:49:46.003+02:00"}
{"Id":435945,"Number":412,"KnessetNum":5,"Name":"ישיבת מליאה בתאריך 24/11/1964 בשעה 16:01","StartDate":"1964-11-24T16:01:00+02:00","FinishDate":"1964-11-24T19:30:00+02:00","IsSpecialMeeting":null,"LastUpdatedDate":"2022-03-15T11:53:46.21+02:00"}
{"Id":435946,"Number":413,"KnessetNum":5,"Name":"ישיבת מליאה בתאריך 25/11/1964 בשעה 11:05","StartDate":"1964-11-25T11:05:00+02:00","FinishDate":"1964-11-25T13:40:00+02:00","IsSpecialMeeting":null,"LastUpdatedDate":"2022-03-15T12:56:08.013+02:00"}
{"Id":435947,"Number":414,"KnessetNum":5,"Name":"ישיבת מליאה בתאריך 30/11/1964 בשעה 16:05","StartDate":"1964-11-30T16:05:00+02:00","FinishDate":"1964-11-30T18:00:00+02:00","IsSpecialMeeting":null,"LastUpdatedDate":"2022-03-15T13:03:21.55+02:00"}
{"Id":435948,"Number":415,"KnessetNum":5,"Name":"ישיבת מליאה בתאריך 01/12/1964 בשעה 16:09","StartDate":"1964-12-01T16:09:00+02:00","FinishDate":"1964-12-01T18:00:00+02:00","IsSpecialMeeting":null,"LastUpdatedDate":"2022-03-15T13:41:17.78+02:00"}
{"Id":435949,"Number":419,"KnessetNum":5,"Name":"ישיבת מליאה בתאריך 09/12/1964 בשעה 11:04","StartDate":"1964-12-09T11:04:00+02:00","FinishDate":"1964-12-09T12:26:00+02:00","IsSpecialMeeting":null,"LastUpdatedDate":"2022-03-16T07:59:44.217+02:00"}
{"Id":435950,"Number":420,"KnessetNum":5,"Name":"ישיבת מליאה בתאריך 14/12/1964 בשעה 16:03","StartDate":"1964-12-14T16:03:00+02:00","FinishDate":"1964-12-14T19:28:00+02:00","IsSpecialMeeting":null,"LastUpdatedDate":"2022-03-16T08:03:34.733+02:00"}
{"Id":435951,"Number":425,"KnessetNum":5,"Name":"ישיבת מליאה בתאריך 23/12/1964 בשעה 11:04","StartDate":"1964-12-23T11:04:00+02:00","FinishDate":"1964-12-23T13:06:00+02:00","IsSpecialMeeting":null,"LastUpdatedDate":"2022-03-22T07:25:18.6+02:00"}
{"Id":435952,"Number":426,"KnessetNum":5,"Name":"ישיבת מליאה בתאריך 28/12/1964 בשעה 16:02","StartDate":"1964-12-28T16:02:00+02:00","FinishDate":"1964-12-28T20:50:00+02:00","IsSpecialMeeting":null,"LastUpdatedDate":"2022-03-22T07:30:40.263+02:00"}
{"Id":435953,"Number":428,"KnessetNum":5,"Name":"ישיבת מליאה בתאריך 30/12/1964 בשעה 11:05","StartDate":"1964-12-30T11:05:00+02:00","FinishDate":"1964-12-30T13:45:00+02:00","IsSpecialMeeting":null,"LastUpdatedDate":"2022-03-22T08:50:19.03+02:00"}
{"Id":435954,"Number":429,"KnessetNum":5,"Name":"ישיבת מליאה בתאריך 04/01/1965 בשעה 16:01","StartDate":"1965-01-04T16:01:00+02:00","FinishDate":"1965-01-04T18:15:00+02:00","IsSpecialMeeting":null,"LastUpdatedDate":"2022-03-22T09:02:24.577+02:00"}
{"Id":435955,"Number":430,"KnessetNum":5,"Name":"ישיבת מליאה בתאריך 05/01/1965 בשעה 16:06","StartDate":"1965-01-05T16:06:00+02:00","FinishDate":"1965-01-05T23:20:00+02:00","IsSpecialMeeting":null,"LastUpdatedDate":"2022-03-27T11:14:23.117+03:00"}
{"Id":435956,"Number":432,"KnessetNum":5,"Name":"ישיבת מליאה בתאריך 11/01/1965 בשעה 16:01","StartDate":"1965-01-11T16:01:00+02:00","FinishDate":"1965-01-11T20:55:00+02:00","IsSpecialMeeting":null,"LastUpdatedDate":"2022-03-27T12:15:50.15+03:00"}
{"Id":435957,"Number":433,"KnessetNum":5,"Name":"ישיבת מליאה בתאריך 12/01/1965 בשעה 16:03","StartDate":"1965-01-12T16:03:00+02:00","FinishDate":"1965-01-12T18:40:00+02:00","IsSpecialMeeting":null,"LastUpdatedDate":"2022-03-27T12:58:44.433+03:00"}
{"Id":435958,"Number":457,"KnessetNum":5,"Name":"ישיבת מליאה בתאריך 09/03/1965 בשעה 16:04","StartDate":"1965-03-09T16:04:00+02:00","FinishDate":"1965-03-09T19:36:00+02:00","IsSpecialMeeting":null,"LastUpdatedDate":"2022-03-29T12:05:17.333+03:00"}
{"Id":435959,"Number":459,"KnessetNum":5,"Name":"ישיבת מליאה בתאריך 15/03/1965 בשעה 16:04","StartDate":"1965-03-15T16:04:00+02:00","FinishDate":"1965-03-15T20:20:00+02:00","IsSpecialMeeting":null,"LastUpdatedDate":"2022-03-29T13:02:36.363+03:00"}
{"Id":435960,"Number":463,"KnessetNum":5,"Name":"ישיבת מליאה בתאריך 23/03/1965 בשעה 16:03","StartDate":"1965-03-23T16:03:00+02:00","FinishDate":"1965-03-23T20:28:00+02:00","IsSpecialMeeting":null,"LastUpdatedDate":"2022-03-31T08:56:22.16+03:00"}
{"Id":435961,"Number":464,"KnessetNum":5,"Name":"ישיבת מליאה בתאריך 24/03/1965 בשעה 11:05","StartDate":"1965-03-24T11:05:00+02:00","FinishDate":"1965-03-24T12:47:00+02:00","IsSpecialMeeting":null,"LastUpdatedDate":"2022-03-31T08:59:49.647+03:00"}
{"Id":435962,"Number":469,"KnessetNum":5,"Name":"ישיבת מליאה בתאריך 06/04/1965 בשעה 16:01","StartDate":"1965-04-06T16:01:00+02:00","FinishDate":"1965-04-06T18:43:00+02:00","IsSpecialMeeting":null,"LastUpdatedDate":"2022-03-31T11:08:46.497+03:00"}
{"Id":435963,"Number":474,"KnessetNum":5,"Name":"ישיבת מליאה בתאריך 24/05/1965 בשעה 16:00","StartDate":"1965-05-24T16:00:00+03:00","FinishDate":"1965-05-24T20:20:00+03:00","IsSpecialMeeting":null,"LastUpdatedDate":"2022-04-11T09:23:21.827+03:00"}
{"Id":435964,"Number":478,"KnessetNum":5,"Name":"ישיבת מליאה בתאריך 01/06/1965 בשעה 16:03","StartDate":"1965-06-01T16:03:00+03:00","FinishDate":"1965-06-01T21:03:00+03:00","IsSpecialMeeting":null,"LastUpdatedDate":"2022-04-11T13:28:20.483+03:00"}
{"Id":435965,"Number":480,"KnessetNum":5,"Name":"ישיבת מליאה בתאריך 07/06/1965 בשעה 16:05","StartDate":"1965-06-07T16:05:00+03:00","FinishDate":"1965-06-07T21:07:00+03:00","IsSpecialMeeting":null,"LastUpdatedDate":"2022-04-12T08:09:54.37+03:00"}
{"Id":435966,"Number":481,"KnessetNum":5,"Name":"ישיבת מליאה בתאריך 08/06/1965 בשעה 16:02","StartDate":"1965-06-08T16:02:00+03:00","FinishDate":"1965-06-08T20:55:00+03:00","IsSpecialMeeting":null,"LastUpdatedDate":"2022-04-12T08:38:33.65+03:00"}
{"Id":435967,"Number":482,"KnessetNum":5,"Name":"ישיבת מליאה בתאריך 09/06/1965 בשעה 11:05","StartDate":"1965-06-09T11:05:00+03:00","FinishDate":"1965-06-09T13:13:00+03:00","IsSpecialMeeting":null,"LastUpdatedDate":"2022-04-12T09:15:28.087+03:00"}
{"Id":435968,"Number":483,"KnessetNum":5,"Name":"ישיבת מליאה בתאריך 14/06/1965 בשעה 16:00","StartDate":"1965-06-14T16:00:00+03:00","FinishDate":"1965-06-14T20:56:00+03:00","IsSpecialMeeting":null,"LastUpdatedDate":"2022-04-12T09:29:37.73+03:00"}
{"Id":435969,"Number":485,"KnessetNum":5,"Name":"ישיבת מליאה בתאריך 16/06/1965 בשעה 11:04","StartDate":"1965-06-16T11:04:00+03:00","FinishDate":"1965-06-16T13:57:00+03:00","IsSpecialMeeting":null,"LastUpdatedDate":"2025-05-06T16:53:38.12+03:00"}
{"Id":435970,"Number":486,"KnessetNum":5,"Name":"ישיבת מליאה בתאריך 21/06/1965 בשעה 16:00","StartDate":"1965-06-21T16:00:00+03:00","FinishDate":"1965-06-21T20:25:00+03:00","IsSpecialMeeting":null,"LastUpdatedDate":"2022-04-12T12:01:10.547+03:00"}
{"Id":435971,"Number":487,"KnessetNum":5,"Name":"ישיבת מליאה בתאריך 22/06/1965 בשעה 16:02","StartDate":"1965-06-22T16:02:00+03:00","FinishDate":"1965-06-22T20:40:00+03:00","IsSpecialMeeting":null,"LastUpdatedDate":"2022-04-12T12:43:43.677+03:00"}
{"Id":435972,"Number":491,"KnessetNum":5,"Name":"ישיבת מליאה בתאריך 30/06/1965 בשעה 11:08","StartDate":"1965-06-30T11:08:00+03:00","FinishDate":"1965-06-30T15:06:00+03:00","IsSpecialMeeting":null,"LastUpdatedDate":"2022-04-25T07:56:09.46+03:00"}
{"Id":435973,"Number":494,"KnessetNum":5,"Name":"ישיבת מליאה בתאריך 07/07/1965 בשעה 16:10","StartDate":"1965-07-07T16:10:00+03:00","FinishDate":"1965-07-07T20:43:00+03:00","IsSpecialMeeting":null,"LastUpdatedDate":"2022-04-25T08:46:13.463+03:00"}
{"Id":435974,"Number":495,"KnessetNum":5,"Name":"ישיבת מליאה בתאריך 08/07/1965 בשעה 11:06","StartDate":"1965-07-08T11:06:00+03:00","FinishDate":"1965-07-08T13:01:00+03:00","IsSpecialMeeting":null,"LastUpdatedDate":"2022-04-25T09:20:35.767+03:00"}
{"Id":435975,"Number":498,"KnessetNum":5,"Name":"ישיבת מליאה בתאריך 14/07/1965 בשעה 15:03","StartDate":"1965-07-14T15:03:00+03:00","FinishDate":"1965-07-14T19:05:00+03:00","IsSpecialMeeting":null,"LastUpdatedDate":"2022-02-21T16:14:37.313+02:00"}
{"Id":435976,"Number":500,"KnessetNum":5,"Name":"ישיבת מליאה בתאריך 19/07/1965 בשעה 16:00","StartDate":"1965-07-19T16:00:00+03:00","FinishDate":"1965-07-19T21:03:00+03:00","IsSpecialMeeting":null,"LastUpdatedDate":"2022-02-21T16:02:09.137+02:00"}
{"Id":435977,"Number":501,"KnessetNum":5,"Name":"ישיבת מליאה בתאריך 20/07/1965 בשעה 16:01","StartDate":"1965-07-20T16:01:00+03:00","FinishDate":"1965-07-20T21:37:00+03:00","IsSpecialMeeting":null,"LastUpdatedDate":"2023-12-18T17:59:26.707+02:00"}
{"Id":435978,"Number":4,"KnessetNum":6,"Name":"ישיבת מליאה בתאריך 30/11/1965 בשעה 16:00","StartDate":"1965-11-30T16:00:00+02:00","FinishDate":"1965-11-30T19:45:00+02:00","IsSpecialMeeting":null,"LastUpdatedDate":"2022-04-25T13:17:32.137+03:00"}
{"Id":435979,"Number":6,"KnessetNum":6,"Name":"ישיבת מליאה בתאריך 06/12/1965 בשעה 16:02","StartDate":"1965-12-06T16:02:00+02:00","FinishDate":"1965-12-06T17:15:00+02:00","IsSpecialMeeting":null,"LastUpdatedDate":"2022-04-28T08:07:29.647+03:00"}
{"Id":435980,"Number":10,"KnessetNum":6,"Name":"ישיבת מליאה בתאריך 14/12/1965 בשעה 16:05","StartDate":"1965-12-14T16:05:00+02:00","FinishDate":"1965-12-14T19:30:00+02:00","IsSpecialMeeting":null,"LastUpdatedDate":"2022-04-28T10:14:39.79+03:00"}
{"Id":435981,"Number":12,"KnessetNum":6,"Name":"ישיבת מליאה בתאריך 20/12/1965 בשעה 16:01","StartDate":"1965-12-20T16:01:00+02:00","FinishDate":"1965-12-20T20:05:00+02:00","IsSpecialMeeting":null,"LastUpdatedDate":"2022-04-28T11:40:23.94+03:00"}
{"Id":435982,"Number":13,"KnessetNum":6,"Name":"ישיבת מליאה בתאריך 21/12/1965 בשעה 16:00","StartDate":"1965-12-21T16:00:00+02:00","FinishDate":"1965-12-21T17:48:00+02:00","IsSpecialMeeting":null,"LastUpdatedDate":"2022-05-02T08:29:26.857+03:00"}
{"Id":435983,"Number":19,"KnessetNum":6,"Name":"ישיבת מליאה בתאריך 10/01/1966 בשעה 16:00","StartDate":"1966-01-10T16:00:00+02:00","FinishDate":"1966-01-10T18:20:00+02:00","IsSpecialMeeting":null,"LastUpdatedDate":"2020-06-15T13:07:16.97+03:00"}
{"Id":435984,"Number":22,"KnessetNum":6,"Name":"ישיבת מליאה בתאריך 17/01/1966 בשעה 16:01","StartDate":"1966-01-17T16:01:00+02:00","FinishDate":"1966-01-17T18:45:00+02:00","IsSpecialMeeting":null,"LastUpdatedDate":"2022-05-02T12:54:04.683+03:00"}
{"Id":435985,"Number":25,"KnessetNum":6,"Name":"ישיבת מליאה בתאריך 24/01/1966 בשעה 16:02","StartDate":"1966-01-24T16:02:00+02:00","FinishDate":"1966-01-24T18:35:00+02:00","IsSpecialMeeting":null,"LastUpdatedDate":"2022-05-03T11:01:58.897+03:00"}
{"Id":435986,"Number":26,"KnessetNum":6,"Name":"ישיבת מליאה בתאריך 25/01/1966 בשעה 16:03","StartDate":"1966-01-25T16:03:00+02:00","FinishDate":"1966-01-25T18:55:00+02:00","IsSpecialMeeting":null,"LastUpdatedDate":"2020-08-17T08:57:50.673+03:00"}
{"Id":435987,"Number":27,"KnessetNum":6,"Name":"ישיבת מליאה בתאריך 26/01/1966 בשעה 11:00","StartDate":"1966-01-26T11:00:00+02:00","FinishDate":"1966-01-26T12:26:00+02:00","IsSpecialMeeting":null,"LastUpdatedDate":"2022-05-09T07:56:09.793+03:00"}
{"Id":435988,"Number":28,"KnessetNum":6,"Name":"ישיבת מליאה בתאריך 31/01/1966 בשעה 16:03","StartDate":"1966-01-31T16:03:00+02:00","FinishDate":"1966-01-31T17:23:00+02:00","IsSpecialMeeting":null,"LastUpdatedDate":"2020-08-17T12:57:58.373+03:00"}
{"Id":435989,"Number":29,"KnessetNum":6,"Name":"ישיבת מליאה בתאריך 01/02/1966 בשעה 16:01","StartDate":"1966-02-01T16:01:00+02:00","FinishDate":"1966-02-01T17:27:00+02:00","IsSpecialMeeting":null,"LastUpdatedDate":"2020-08-17T13:00:26.277+03:00"}
{"Id":435990,"Number":32,"KnessetNum":6,"Name":"ישיבת מליאה בתאריך 08/02/1966 בשעה 16:01","StartDate":"1966-02-08T16:01:00+02:00","FinishDate":"1966-02-08T19:46:00+02:00","IsSpecialMeeting":null,"LastUpdatedDate":"2025-01-22T12:00:36.463+02:00"}
{"Id":435991,"Number":33,"KnessetNum":6,"Name":"ישיבת מליאה בתאריך 09/02/1966 בשעה 11:05","StartDate":"1966-02-09T11:05:00+02:00","FinishDate":"1966-02-09T12:45:00+02:00","IsSpecialMeeting":null,"LastUpdatedDate":"2022-05-09T10:47:47.787+03:00"}
{"Id":435992,"Number":34,"KnessetNum":6,"Name":"ישיבת מליאה בתאריך 14/02/1966 בשעה 16:01","StartDate":"1966-02-14T16:01:00+02:00","FinishDate":"1966-02-14T18:24:00+02:00","IsSpecialMeeting":null,"LastUpdatedDate":"2020-08-18T16:17:36.053+03:00"}
{"Id":435993,"Number":37,"KnessetNum":6,"Name":"ישיבת מליאה בתאריך 21/02/1966 בשעה 16:01","StartDate":"1966-02-21T16:01:00+02:00","FinishDate":"1966-02-21T17:52:00+02:00","IsSpecialMeeting":null,"LastUpdatedDate":"2020-08-23T11:18:59.797+03:00"}
{"Id":435994,"Number":38,"KnessetNum":6,"Name":"ישיבת מליאה בתאריך 22/02/1966 בשעה 16:02","StartDate":"1966-02-22T16:02:00+02:00","FinishDate":"1966-02-22T21:01:00+02:00","IsSpecialMeeting":null,"LastUpdatedDate":"2020-08-23T13:44:45.243+03:00"}
{"Id":435995,"Number":41,"KnessetNum":6,"Name":"ישיבת מליאה בתאריך 01/03/1966 בשעה 15:03","StartDate":"1966-03-01T15:03:00+02:00","FinishDate":"1966-03-01T21:07:00+02:00","IsSpecialMeeting":null,"LastUpdatedDate":"2020-08-24T09:48:54.763+03:00"}
{"Id":435996,"Number":45,"KnessetNum":6,"Name":"ישיבת מליאה בתאריך 10/03/1966 בשעה 11:03","StartDate":"1966-03-10T11:03:00+02:00","FinishDate":"1966-03-10T13:50:00+02:00","IsSpecialMeeting":null,"LastUpdatedDate":"2020-09-06T12:43:46.267+03:00"}
{"Id":435997,"Number":47,"KnessetNum":6,"Name":"ישיבת מליאה בתאריך 15/03/1966 בשעה 15:02","StartDate":"1966-03-15T15:02:00+02:00","FinishDate":"1966-03-15T17:48:00+02:00","IsSpecialMeeting":null,"LastUpdatedDate":"2020-09-06T15:37:44.947+03:00"}
{"Id":435998,"Number":48,"KnessetNum":6,"Name":"ישיבת מליאה בתאריך 16/03/1966 בשעה 11:03","StartDate":"1966-03-16T11:03:00+02:00","FinishDate":"1966-03-16T14:36:00+02:00","IsSpecialMeeting":null,"LastUpdatedDate":"2020-09-07T09:18:54.717+03:00"}
{"Id":435999,"Number":53,"KnessetNum":6,"Name":"ישיבת מליאה בתאריך 28/03/1966 בשעה 16:08","StartDate":"1966-03-28T16:08:00+02:00","FinishDate":"1966-03-28T22:07:00+02:00","IsSpecialMeeting":null,"LastUpdatedDate":"2020-09-09T10:39:18.757+03:00"}
{"Id":436000,"Number":55,"KnessetNum":6,"Name":"ישיבת מליאה בתאריך 30/03/1966 בשעה 09:02","StartDate":"1966-03-30T09:02:00+02:00","FinishDate":"1966-03-30T13:07:00+02:00","IsSpecialMeeting":null,"LastUpdatedDate":"2020-09-09T14:44:43.14+03:00"}
{"Id":436001,"Number":58,"KnessetNum":6,"Name":"ישיבת מליאה בתאריך 10/05/1966 בשעה 12:03","StartDate":"1966-05-10T12:03:00+03:00","FinishDate":"1966-05-11T12:40:00+03:00","IsSpecialMeeting":null,"LastUpdatedDate":"2020-09-10T14:13:40.293+03:00"}
{"Id":436002,"Number":61,"KnessetNum":6,"Name":"ישיבת מליאה בתאריך 18/05/1966 בשעה 12:01","StartDate":"1966-05-18T12:01:00+03:00","FinishDate":"1966-05-18T17:05:00+03:00","IsSpecialMeeting":null,"LastUpdatedDate":"2020-09-13T10:43:55+03:00"}
{"Id":436003,"Number":68,"KnessetNum":6,"Name":"ישיבת מליאה בתאריך 07/06/1966 בשעה 12:02","StartDate":"1966-06-07T12:02:00+03:00","FinishDate":"1966-06-08T13:00:00+03:00","IsSpecialMeeting":null,"LastUpdatedDate":"2022-05-19T10:05:37.827+03:00"}
{"Id":436004,"Number":74,"KnessetNum":6,"Name":"ישיבת מליאה בתאריך 22/06/1966 בשעה 11:00","StartDate":"1966-06-22T11:00:00+03:00","FinishDate":"1966-06-22T14:24:00+03:00","IsSpecialMeeting":null,"LastUpdatedDate":"2022-05-30T08:49:51.517+03:00"}
{"Id":436005,"Number":77,"KnessetNum":6,"Name":"ישיבת מליאה בתאריך 28/06/1966 בשעה 12:00","StartDate":"1966-06-28T12:00:00+03:00","FinishDate":"1966-06-29T15:00:00+03:00","IsSpecialMeeting":null,"LastUpdatedDate":"2020-09-21T10:51:03.067+03:00"}
{"Id":436006,"Number":80,"KnessetNum":6,"Name":"ישיבת מליאה בתאריך 06/07/1966 בשעה 12:06","StartDate":"1966-07-06T12:06:00+03:00","FinishDate":"1966-07-06T14:36:00+03:00","IsSpecialMeeting":null,"LastUpdatedDate":"2022-05-30T13:50:27.157+03:00"}
{"Id":436007,"Number":84,"KnessetNum":6,"Name":"ישיבת מליאה בתאריך 18/07/1966 בשעה 17:03","StartDate":"1966-07-18T17:03:00+03:00","FinishDate":"1966-07-18T22:00:00+03:00","IsSpecialMeeting":null,"LastUpdatedDate":"2022-05-30T16:49:48.74+03:00"}
{"Id":436008,"Number":85,"KnessetNum":6,"Name":"ישיבת מליאה בתאריך 19/07/1966 בשעה 17:00","StartDate":"1966-07-19T17:00:00+03:00","FinishDate":"1966-07-19T22:37:00+03:00","IsSpecialMeeting":null,"LastUpdatedDate":"2022-06-02T07:24:06.07+03:00"}
{"Id":436009,"Number":86,"KnessetNum":6,"Name":"ישיבת מליאה בתאריך 20/07/1966 בשעה 12:00","StartDate":"1966-07-20T12:00:00+03:00","FinishDate":"1966-07-20T14:45:00+03:00","IsSpecialMeeting":null,"LastUpdatedDate":"2020-09-23T12:11:56.523+03:00"}
{"Id":436010,"Number":90,"KnessetNum":6,"Name":"ישיבת מליאה בתאריך 02/08/1966 בשעה 16:00","StartDate":"1966-08-02T16:00:00+03:00","FinishDate":"1966-08-02T20:29:00+03:00","IsSpecialMeeting":null,"LastUpdatedDate":"2021-05-27T10:57:35.55+03:00"}
{"Id":436011,"Number":92,"KnessetNum":6,"Name":"ישיבת מליאה בתאריך 08/08/1966 בשעה 17:02","StartDate":"1966-08-08T17:02:00+03:00","FinishDate":"1966-08-08T21:50:00+03:00","IsSpecialMeeting":null,"LastUpdatedDate":"2022-06-02T12:30:30.533+03:00"}
{"Id":436012,"Number":93,"KnessetNum":6,"Name":"ישיבת מליאה בתאריך 09/08/1966 בשעה 16:00","StartDate":"1966-08-09T16:00:00+03:00","FinishDate":"1966-08-09T20:46:00+03:00","IsSpecialMeeting":null,"LastUpdatedDate":"2022-06-06T07:28:00.737+03:00"}
{"Id":436013,"Number":103,"KnessetNum":6,"Name":"ישיבת מליאה בתאריך 31/10/1966 בשעה 16:02","StartDate":"1966-10-31T16:02:00+02:00","FinishDate":"1966-10-31T20:22:00+02:00","IsSpecialMeeting":null,"LastUpdatedDate":"2022-06-06T13:59:44.913+03:00"}
{"Id":436014,"Number":104,"KnessetNum":6,"Name":"ישיבת מליאה בתאריך 01/11/1966 בשעה 16:01","StartDate":"1966-11-01T16:01:00+02:00","FinishDate":"1966-11-01T20:05:00+02:00","IsSpecialMeeting":null,"LastUpdatedDate":"2020-10-11T11:09:11.987+03:00"}
{"Id":436015,"Number":105,"KnessetNum":6,"Name":"ישיבת מליאה בתאריך 02/11/1966 בשעה 11:02","StartDate":"1966-11-02T11:02:00+02:00","FinishDate":"1966-11-02T12:10:00+02:00","IsSpecialMeeting":null,"LastUpdatedDate":"2022-06-06T15:14:03.967+03:00"}
{"Id":436016,"Number":106,"KnessetNum":6,"Name":"ישיבת מליאה בתאריך 07/11/1966 בשעה 16:02","StartDate":"1966-11-07T16:02:00+02:00","FinishDate":"1966-11-07T18:12:00+02:00","IsSpecialMeeting":null,"LastUpdatedDate":"2022-06-06T15:56:03.563+03:00"}
{"Id":436017,"Number":116,"KnessetNum":6,"Name":"ישיבת מליאה בתאריך 29/11/1966 בשעה 16:02","StartDate":"1966-11-29T16:02:00+02:00","FinishDate":"1966-11-29T19:39:00+02:00","IsSpecialMeeting":null,"LastUpdatedDate":"2022-06-13T09:08:37.767+03:00"}
{"Id":436018,"Number":118,"KnessetNum":6,"Name":"ישיבת מליאה בתאריך 05/12/1966 בשעה 16:02","StartDate":"1966-12-05T16:02:00+02:00","FinishDate":"1966-12-05T19:41:00+02:00","IsSpecialMeeting":null,"LastUpdatedDate":"2022-06-13T10:58:06.327+03:00"}
{"Id":436019,"Number":119,"KnessetNum":6,"Name":"ישיבת מליאה בתאריך 06/12/1966 בשעה 16:02","StartDate":"1966-12-06T16:02:00+02:00","FinishDate":"1966-12-06T19:05:00+02:00","IsSpecialMeeting":null,"LastUpdatedDate":"2022-06-13T11:50:45.213+03:00"}
{"Id":436020,"Number":123,"KnessetNum":6,"Name":"ישיבת מליאה בתאריך 14/12/1966 בשעה 11:00","StartDate":"1966-12-14T11:00:00+02:00","FinishDate":"1966-12-14T12:02:00+02:00","IsSpecialMeeting":null,"LastUpdatedDate":"2022-06-13T16:26:59.92+03:00"}
{"Id":436021,"Number":127,"KnessetNum":6,"Name":"ישיבת מליאה בתאריך 26/12/1966 בשעה 16:01","StartDate":"1966-12-26T16:01:00+02:00","FinishDate":"1966-12-26T20:16:00+02:00","IsSpecialMeeting":null,"LastUpdatedDate":"2022-06-16T09:51:36.103+03:00"}
{"Id":436022,"Number":134,"KnessetNum":6,"Name":"ישיבת מליאה בתאריך 10/01/1967 בשעה 16:00","StartDate":"1967-01-10T16:00:00+02:00","FinishDate":"1967-01-10T20:23:00+02:00","IsSpecialMeeting":null,"LastUpdatedDate":"2022-06-20T10:49:02.77+03:00"}
{"Id":436023,"Number":135,"KnessetNum":6,"Name":"ישיבת מליאה בתאריך 11/01/1967 בשעה 11:02","StartDate":"1967-01-11T11:02:00+02:00","FinishDate":"1967-01-11T14:15:00+02:00","IsSpecialMeeting":null,"LastUpdatedDate":"2024-06-16T10:31:50.38+03:00"}
{"Id":436024,"Number":137,"KnessetNum":6,"Name":"ישיבת מליאה בתאריך 17/01/1967 בשעה 16:01","StartDate":"1967-01-17T16:01:00+02:00","FinishDate":"1967-01-17T17:44:00+02:00","IsSpecialMeeting":null,"LastUpdatedDate":"2022-06-20T15:11:55.563+03:00"}
{"Id":436025,"Number":138,"KnessetNum":6,"Name":"ישיבת מליאה בתאריך 18/01/1967 בשעה 11:00","StartDate":"1967-01-18T11:00:00+02:00","FinishDate":"1967-01-18T12:41:00+02:00","IsSpecialMeeting":null,"LastUpdatedDate":"2020-10-15T12:12:51.84+03:00"}
{"Id":436026,"Number":152,"KnessetNum":6,"Name":"ישיבת מליאה בתאריך 21/02/1967 בשעה 16:00","StartDate":"1967-02-21T16:00:00+02:00","FinishDate":"1967-02-21T19:50:00+02:00","IsSpecialMeeting":null,"LastUpdatedDate":"2022-06-22T13:45:34.033+03:00"}
{"Id":436027,"Number":155,"KnessetNum":6,"Name":"ישיבת מליאה בתאריך 28/02/1967 בשעה 16:02","StartDate":"1967-02-28T16:02:00+02:00","FinishDate":"1967-02-28T20:40:00+02:00","IsSpecialMeeting":null,"LastUpdatedDate":"2022-06-26T12:35:43.757+03:00"}
{"Id":436028,"Number":156,"KnessetNum":6,"Name":"ישיבת מליאה בתאריך 01/03/1967 בשעה 11:00","StartDate":"1967-03-01T11:00:00+02:00","FinishDate":"1967-03-01T14:04:00+02:00","IsSpecialMeeting":null,"LastUpdatedDate":"2022-06-27T07:50:21.89+03:00"}
{"Id":436029,"Number":158,"KnessetNum":6,"Name":"ישיבת מליאה בתאריך 07/03/1967 בשעה 16:02","StartDate":"1967-03-07T16:02:00+02:00","FinishDate":"1967-03-07T19:50:00+02:00","IsSpecialMeeting":null,"LastUpdatedDate":"2022-06-27T13:51:43.277+03:00"}
{"Id":436030,"Number":159,"KnessetNum":6,"Name":"ישיבת מליאה בתאריך 08/03/1967 בשעה 11:00","StartDate":"1967-03-08T11:00:00+02:00","FinishDate":"1967-03-08T15:04:00+02:00","IsSpecialMeeting":null,"LastUpdatedDate":"2022-06-30T07:50:04.047+03:00"}
{"Id":436031,"Number":167,"KnessetNum":6,"Name":"ישיבת מליאה בתאריך 29/03/1967 בשעה 16:01","StartDate":"1967-03-29T16:01:00+02:00","FinishDate":"1967-03-29T21:42:00+02:00","IsSpecialMeeting":null,"LastUpdatedDate":"2022-07-05T07:20:14.007+03:00"}
{"Id":436032,"Number":170,"KnessetNum":6,"Name":"ישיבת מליאה בתאריך 04/04/1967 בשעה 16:00","StartDate":"1967-04-04T16:00:00+02:00","FinishDate":"1967-04-04T20:26:00+02:00","IsSpecialMeeting":null,"LastUpdatedDate":"2022-07-05T10:07:09.5+03:00"}
{"Id":436033,"Number":174,"KnessetNum":6,"Name":"ישיבת מליאה בתאריך 12/04/1967 בשעה 09:01","StartDate":"1967-04-12T09:01:00+03:00","FinishDate":"1967-04-12T17:21:00+03:00","IsSpecialMeeting":null,"LastUpdatedDate":"2022-07-05T14:06:52.513+03:00"}
{"Id":436034,"Number":180,"KnessetNum":6,"Name":"ישיבת מליאה בתאריך 30/05/1967 בשעה 16:02","StartDate":"1967-05-30T16:02:00+03:00","FinishDate":"1967-05-30T18:05:00+03:00","IsSpecialMeeting":null,"LastUpdatedDate":"2022-07-06T14:04:40.213+03:00"}
{"Id":436035,"Number":182,"KnessetNum":6,"Name":"ישיבת מליאה בתאריך 05/06/1967 בשעה 16:10","StartDate":"1967-06-05T16:10:00+03:00","FinishDate":"1967-06-05T21:35:00+03:00","IsSpecialMeeting":null,"LastUpdatedDate":"2022-07-10T09:50:35.053+03:00"}
{"Id":436036,"Number":184,"KnessetNum":6,"Name":"ישיבת מליאה בתאריך 19/06/1967 בשעה 16:03","StartDate":"1967-06-19T16:03:00+03:00","FinishDate":"1967-06-19T20:06:00+03:00","IsSpecialMeeting":null,"LastUpdatedDate":"2022-07-07T14:41:58.787+03:00"}
{"Id":436037,"Number":185,"KnessetNum":6,"Name":"ישיבת מליאה בתאריך 20/06/1967 בשעה 16:02","StartDate":"1967-06-20T16:02:00+03:00","FinishDate":"1967-06-20T19:00:00+03:00","IsSpecialMeeting":null,"LastUpdatedDate":"2022-07-07T15:37:03.447+03:00"}
{"Id":436038,"Number":189,"KnessetNum":6,"Name":"ישיבת מליאה בתאריך 28/06/1967 בשעה 11:03","StartDate":"1967-06-28T11:03:00+03:00","FinishDate":"1967-06-28T12:25:00+03:00","IsSpecialMeeting":null,"LastUpdatedDate":"2025-05-07T11:58:32.573+03:00"}
{"Id":436039,"Number":191,"KnessetNum":6,"Name":"ישיבת מליאה בתאריך 04/07/1967 בשעה 16:00","StartDate":"1967-07-04T16:00:00+03:00","FinishDate":"1967-07-04T19:58:00+03:00","IsSpecialMeeting":null,"LastUpdatedDate":"2022-07-12T11:02:11.65+03:00"}
{"Id":436040,"Number":192,"KnessetNum":6,"Name":"ישיבת מליאה בתאריך 05/07/1967 בשעה 11:05","StartDate":"1967-07-05T11:05:00+03:00","FinishDate":"1967-07-05T13:27:00+03:00","IsSpecialMeeting":null,"LastUpdatedDate":"2022-07-12T12:33:28.017+03:00"}
{"Id":436041,"Number":195,"KnessetNum":6,"Name":"ישיבת מליאה בתאריך 12/07/1967 בשעה 12:32","StartDate":"1967-07-12T12:32:00+03:00","FinishDate":"1967-07-12T14:17:00+03:00","IsSpecialMeeting":null,"LastUpdatedDate":"2022-07-12T13:55:50.423+03:00"}
{"Id":436042,"Number":203,"KnessetNum":6,"Name":"ישיבת מליאה בתאריך 01/08/1967 בשעה 16:01","StartDate":"1967-08-01T16:01:00+03:00","FinishDate":"1967-08-01T21:01:00+03:00","IsSpecialMeeting":null,"LastUpdatedDate":"2022-07-13T12:59:40.74+03:00"}
{"Id":436043,"Number":207,"KnessetNum":6,"Name":"ישיבת מליאה בתאריך 11/09/1967 בשעה 11:32","StartDate":"1967-09-11T11:32:00+03:00","FinishDate":"1967-09-11T16:22:00+03:00","IsSpecialMeeting":null,"LastUpdatedDate":"2022-07-14T07:07:13.507+03:00"}
{"Id":436044,"Number":224,"KnessetNum":6,"Name":"ישיבת מליאה בתאריך 04/12/1967 בשעה 16:02","StartDate":"1967-12-04T16:02:00+02:00","FinishDate":"1967-12-04T20:30:00+02:00","IsSpecialMeeting":null,"LastUpdatedDate":"2022-07-21T08:03:26.323+03:00"}
{"Id":436045,"Number":228,"KnessetNum":6,"Name":"ישיבת מליאה בתאריך 12/12/1967 בשעה 16:01","StartDate":"1967-12-12T16:01:00+02:00","FinishDate":"1967-12-12T19:53:00+02:00","IsSpecialMeeting":null,"LastUpdatedDate":"2022-07-24T07:32:40.67+03:00"}
{"Id":436046,"Number":229,"KnessetNum":6,"Name":"ישיבת מליאה בתאריך 13/12/1967 בשעה 12:30","StartDate":"1967-12-13T12:30:00+02:00","FinishDate":"1967-12-13T14:10:00+02:00","IsSpecialMeeting":null,"LastUpdatedDate":"2022-07-21T12:45:12.397+03:00"}
{"Id":436047,"Number":230,"KnessetNum":6,"Name":"ישיבת מליאה בתאריך 18/12/1967 בשעה 16:02","StartDate":"1967-12-18T16:02:00+02:00","FinishDate":"1967-12-18T20:24:00+02:00","IsSpecialMeeting":null,"LastUpdatedDate":"2022-07-24T10:09:31.26+03:00"}
{"Id":436048,"Number":231,"KnessetNum":6,"Name":"ישיבת מליאה בתאריך 19/12/1967 בשעה 16:03","StartDate":"1967-12-19T16:03:00+02:00","FinishDate":"1967-12-19T18:37:00+02:00","IsSpecialMeeting":null,"LastUpdatedDate":"2022-07-26T08:08:28.76+03:00"}
{"Id":436049,"Number":233,"KnessetNum":6,"Name":"ישיבת מליאה בתאריך 25/12/1967 בשעה 16:03","StartDate":"1967-12-25T16:03:00+02:00","FinishDate":"1967-12-25T18:23:00+02:00","IsSpecialMeeting":null,"LastUpdatedDate":"2022-07-26T08:16:34.777+03:00"}
{"Id":436050,"Number":234,"KnessetNum":6,"Name":"ישיבת מליאה בתאריך 26/12/1967 בשעה 16:03","StartDate":"1967-12-26T16:03:00+02:00","FinishDate":"1967-12-26T18:53:00+02:00","IsSpecialMeeting":null,"LastUpdatedDate":"2022-07-25T14:14:51.72+03:00"}
{"Id":436051,"Number":235,"KnessetNum":6,"Name":"ישיבת מליאה בתאריך 27/12/1967 בשעה 12:33","StartDate":"1967-12-27T12:33:00+02:00","FinishDate":"1967-12-27T14:09:00+02:00","IsSpecialMeeting":null,"LastUpdatedDate":"2022-07-26T13:26:27.873+03:00"}
{"Id":436053,"Number":237,"KnessetNum":6,"Name":"ישיבת מליאה בתאריך 02/01/1968 בשעה 16:02","StartDate":"1968-01-02T16:02:00+02:00","FinishDate":"1968-01-02T17:40:00+02:00","IsSpecialMeeting":null,"LastUpdatedDate":"2022-07-27T09:52:25.367+03:00"}
{"Id":436054,"Number":240,"KnessetNum":6,"Name":"ישיבת מליאה בתאריך 09/01/1968 בשעה 16:01","StartDate":"1968-01-09T16:01:00+02:00","FinishDate":"1968-01-09T19:44:00+02:00","IsSpecialMeeting":null,"LastUpdatedDate":"2022-07-27T12:25:26.28+03:00"}
{"Id":436055,"Number":241,"KnessetNum":6,"Name":"ישיבת מליאה בתאריך 10/01/1968 בשעה 12:33","StartDate":"1968-01-10T12:33:00+02:00","FinishDate":"1968-01-10T15:00:00+02:00","IsSpecialMeeting":null,"LastUpdatedDate":"2022-07-28T08:20:49.133+03:00"}
{"Id":436056,"Number":250,"KnessetNum":6,"Name":"ישיבת מליאה בתאריך 06/02/1968 בשעה 16:03","StartDate":"1968-02-06T16:03:00+02:00","FinishDate":"1968-02-06T20:10:00+02:00","IsSpecialMeeting":null,"LastUpdatedDate":"2022-08-01T10:57:21.743+03:00"}
{"Id":436057,"Number":252,"KnessetNum":6,"Name":"ישיבת מליאה בתאריך 12/02/1968 בשעה 16:00","StartDate":"1968-02-12T16:00:00+02:00","FinishDate":"1968-02-12T21:00:00+02:00","IsSpecialMeeting":null,"LastUpdatedDate":"2022-08-02T07:33:33.24+03:00"}
{"Id":436058,"Number":256,"KnessetNum":6,"Name":"ישיבת מליאה בתאריך 20/02/1968 בשעה 16:00","StartDate":"1968-02-20T16:00:00+02:00","FinishDate":"1968-02-20T20:02:00+02:00","IsSpecialMeeting":null,"LastUpdatedDate":"2022-08-02T12:50:04.553+03:00"}
{"Id":436059,"Number":260,"KnessetNum":6,"Name":"ישיבת מליאה בתאריך 28/02/1968 בשעה 12:32","StartDate":"1968-02-28T12:32:00+02:00","FinishDate":"1968-02-28T13:58:00+02:00","IsSpecialMeeting":null,"LastUpdatedDate":"2022-08-09T14:14:35.433+03:00"}
{"Id":436060,"Number":262,"KnessetNum":6,"Name":"ישיבת מליאה בתאריך 05/03/1968 בשעה 16:02","StartDate":"1968-03-05T16:02:00+02:00","FinishDate":"1968-03-05T19:53:00+02:00","IsSpecialMeeting":null,"LastUpdatedDate":"2022-08-09T15:52:41.1+03:00"}
{"Id":436061,"Number":292,"KnessetNum":6,"Name":"ישיבת מליאה בתאריך 05/06/1968 בשעה 12:30","StartDate":"1968-06-05T12:30:00+03:00","FinishDate":"1968-06-05T13:26:00+03:00","IsSpecialMeeting":null,"LastUpdatedDate":"2022-09-11T16:07:31.92+03:00"}
{"Id":436062,"Number":294,"KnessetNum":6,"Name":"ישיבת מליאה בתאריך 11/06/1968 בשעה 16:01","StartDate":"1968-06-11T16:01:00+03:00","FinishDate":"1968-06-11T19:59:00+03:00","IsSpecialMeeting":null,"LastUpdatedDate":"2022-10-19T08:20:06.533+03:00"}
{"Id":436063,"Number":295,"KnessetNum":6,"Name":"ישיבת מליאה בתאריך 12/06/1968 בשעה 12:32","StartDate":"1968-06-12T12:32:00+03:00","FinishDate":"1968-06-12T15:30:00+03:00","IsSpecialMeeting":null,"LastUpdatedDate":"2022-09-11T16:42:59.757+03:00"}
{"Id":436064,"Number":300,"KnessetNum":6,"Name":"ישיבת מליאה בתאריך 25/06/1968 בשעה 16:02","StartDate":"1968-06-25T16:02:00+03:00","FinishDate":"1968-06-25T20:07:00+03:00","IsSpecialMeeting":null,"LastUpdatedDate":"2022-09-13T13:28:49.923+03:00"}
{"Id":436065,"Number":309,"KnessetNum":6,"Name":"ישיבת מליאה בתאריך 16/07/1968 בשעה 16:00","StartDate":"1968-07-16T16:00:00+03:00","FinishDate":"1968-07-16T19:27:00+03:00","IsSpecialMeeting":null,"LastUpdatedDate":"2022-09-28T12:19:13.203+03:00"}
{"Id":436066,"Number":319,"KnessetNum":6,"Name":"ישיבת מליאה בתאריך 06/08/1968 בשעה 16:00","StartDate":"1968-08-06T16:00:00+03:00","FinishDate":"1968-08-06T20:23:00+03:00","IsSpecialMeeting":null,"LastUpdatedDate":"2019-12-16T12:58:15.9+02:00"}
{"Id":436067,"Number":322,"KnessetNum":6,"Name":"ישיבת מליאה בתאריך 12/08/1968 בשעה 11:01","StartDate":"1968-08-12T11:01:00+03:00","FinishDate":"1968-08-12T20:27:00+03:00","IsSpecialMeeting":null,"LastUpdatedDate":"2022-10-23T12:34:06.447+03:00"}
{"Id":436068,"Number":323,"KnessetNum":6,"Name":"ישיבת מליאה בתאריך 13/08/1968 בשעה 09:01","StartDate":"1968-08-13T09:01:00+03:00","FinishDate":"1968-08-13T19:31:00+03:00","IsSpecialMeeting":null,"LastUpdatedDate":"2022-10-25T08:09:23.65+03:00"}
{"Id":436069,"Number":324,"KnessetNum":6,"Name":"ישיבת מליאה בתאריך 14/08/1968 בשעה 09:02","StartDate":"1968-08-14T09:02:00+03:00","FinishDate":"1968-08-14T17:55:00+03:00","IsSpecialMeeting":null,"LastUpdatedDate":"2022-10-25T09:26:45.627+03:00"}
{"Id":436070,"Number":326,"KnessetNum":6,"Name":"ישיבת מליאה בתאריך 22/10/1968 בשעה 16:00","StartDate":"1968-10-22T16:00:00+02:00","FinishDate":"1968-10-22T18:58:00+02:00","IsSpecialMeeting":null,"LastUpdatedDate":"2022-10-25T13:06:22.937+03:00"}
{"Id":436071,"Number":327,"KnessetNum":6,"Name":"ישיבת מליאה בתאריך 23/10/1968 בשעה 11:03","StartDate":"1968-10-23T11:03:00+02:00","FinishDate":"1968-10-23T12:50:00+02:00","IsSpecialMeeting":null,"LastUpdatedDate":"2022-10-03T15:10:47.217+03:00"}
{"Id":436072,"Number":328,"KnessetNum":6,"Name":"ישיבת מליאה בתאריך 28/10/1968 בשעה 16:02","StartDate":"1968-10-28T16:02:00+02:00","FinishDate":"1968-10-28T18:21:00+02:00","IsSpecialMeeting":null,"LastUpdatedDate":"2022-10-18T08:17:31.113+03:00"}
{"Id":436073,"Number":331,"KnessetNum":6,"Name":"ישיבת מליאה בתאריך 04/11/1968 בשעה 16:02","StartDate":"1968-11-04T16:02:00+02:00","FinishDate":"1968-11-04T19:50:00+02:00","IsSpecialMeeting":null,"LastUpdatedDate":"2022-10-20T09:47:48.967+03:00"}
{"Id":436074,"Number":333,"KnessetNum":6,"Name":"ישיבת מליאה בתאריך 06/11/1968 בשעה 12:33","StartDate":"1968-11-06T12:33:00+02:00","FinishDate":"1968-11-06T13:23:00+02:00","IsSpecialMeeting":null,"LastUpdatedDate":"2022-10-24T07:37:19.89+03:00"}
{"Id":436075,"Number":337,"KnessetNum":6,"Name":"ישיבת מליאה בתאריך 18/11/1968 בשעה 16:00","StartDate":"1968-11-18T16:00:00+02:00","FinishDate":"1968-11-18T20:28:00+02:00","IsSpecialMeeting":null,"LastUpdatedDate":"2022-10-24T09:55:49.267+03:00"}
{"Id":436076,"Number":338,"KnessetNum":6,"Name":"ישיבת מליאה בתאריך 19/11/1968 בשעה 16:00","StartDate":"1968-11-19T16:00:00+02:00","FinishDate":"1968-11-19T19:41:00+02:00","IsSpecialMeeting":null,"LastUpdatedDate":"2022-10-26T10:21:35.417+03:00"}
{"Id":436077,"Number":339,"KnessetNum":6,"Name":"ישיבת מליאה בתאריך 20/11/1968 בשעה 12:30","StartDate":"1968-11-20T12:30:00+02:00","FinishDate":"1968-11-20T15:47:00+02:00","IsSpecialMeeting":null,"LastUpdatedDate":"2022-10-26T10:44:15.483+03:00"}
{"Id":436078,"Number":340,"KnessetNum":6,"Name":"ישיבת מליאה בתאריך 25/11/1968 בשעה 16:01","StartDate":"1968-11-25T16:01:00+02:00","FinishDate":"1968-11-25T20:47:00+02:00","IsSpecialMeeting":null,"LastUpdatedDate":"2022-10-26T13:33:46.247+03:00"}
{"Id":436079,"Number":343,"KnessetNum":6,"Name":"ישיבת מליאה בתאריך 02/12/1968 בשעה 16:02","StartDate":"1968-12-02T16:02:00+02:00","FinishDate":"1968-12-02T21:00:00+02:00","IsSpecialMeeting":null,"LastUpdatedDate":"2022-10-31T07:56:26.003+02:00"}
{"Id":436080,"Number":344,"KnessetNum":6,"Name":"ישיבת מליאה בתאריך 03/12/1968 בשעה 16:02","StartDate":"1968-12-03T16:02:00+02:00","FinishDate":"1968-12-03T18:54:00+02:00","IsSpecialMeeting":null,"LastUpdatedDate":"2022-10-30T08:34:00.69+02:00"}
{"Id":436081,"Number":345,"KnessetNum":6,"Name":"ישיבת מליאה בתאריך 04/12/1968 בשעה 11:00","StartDate":"1968-12-04T11:00:00+02:00","FinishDate":"1968-12-04T11:55:00+02:00","IsSpecialMeeting":null,"LastUpdatedDate":"2022-10-30T12:05:42.887+02:00"}
{"Id":436082,"Number":349,"KnessetNum":6,"Name":"ישיבת מליאה בתאריך 16/12/1968 בשעה 16:01","StartDate":"1968-12-16T16:01:00+02:00","FinishDate":"1968-12-16T20:18:00+02:00","IsSpecialMeeting":null,"LastUpdatedDate":"2022-11-02T09:00:42.603+02:00"}
{"Id":436083,"Number":350,"KnessetNum":6,"Name":"ישיבת מליאה בתאריך 17/12/1968 בשעה 16:00","StartDate":"1968-12-17T16:00:00+02:00","FinishDate":"1968-12-17T19:04:00+02:00","IsSpecialMeeting":null,"LastUpdatedDate":"2022-11-02T12:34:24.057+02:00"}
{"Id":436084,"Number":351,"KnessetNum":6,"Name":"ישיבת מליאה בתאריך 18/12/1968 בשעה 11:04","StartDate":"1968-12-18T11:04:00+02:00","FinishDate":"1968-12-18T13:13:00+02:00","IsSpecialMeeting":null,"LastUpdatedDate":"2022-11-16T10:50:07.06+02:00"}
{"Id":436085,"Number":353,"KnessetNum":6,"Name":"ישיבת מליאה בתאריך 24/12/1968 בשעה 16:01","StartDate":"1968-12-24T16:01:00+02:00","FinishDate":"1968-12-24T18:43:00+02:00","IsSpecialMeeting":null,"LastUpdatedDate":"2022-11-16T10:53:13.303+02:00"}
{"Id":436086,"Number":358,"KnessetNum":6,"Name":"ישיבת מליאה בתאריך 06/01/1969 בשעה 16:04","StartDate":"1969-01-06T16:04:00+02:00","FinishDate":"1969-01-06T20:35:00+02:00","IsSpecialMeeting":null,"LastUpdatedDate":"2022-11-21T10:44:00.91+02:00"}
{"Id":436087,"Number":360,"KnessetNum":6,"Name":"ישיבת מליאה בתאריך 08/01/1969 בשעה 11:33","StartDate":"1969-01-08T11:33:00+02:00","FinishDate":"1969-01-08T13:46:00+02:00","IsSpecialMeeting":null,"LastUpdatedDate":"2025-01-22T12:20:03.073+02:00"}
{"Id":436089,"Number":365,"KnessetNum":6,"Name":"ישיבת מליאה בתאריך 21/01/1969 בשעה 16:00","StartDate":"1969-01-21T16:00:00+02:00","FinishDate":"1969-01-21T21:01:00+02:00","IsSpecialMeeting":null,"LastUpdatedDate":"2022-11-16T11:53:10.953+02:00"}
{"Id":436090,"Number":375,"KnessetNum":6,"Name":"ישיבת מליאה בתאריך 12/02/1969 בשעה 11:34","StartDate":"1969-02-12T11:34:00+02:00","FinishDate":"1969-02-12T13:33:00+02:00","IsSpecialMeeting":null,"LastUpdatedDate":"2022-12-05T12:11:43.027+02:00"}
{"Id":436091,"Number":378,"KnessetNum":6,"Name":"ישיבת מליאה בתאריך 19/02/1969 בשעה 11:32","StartDate":"1969-02-19T11:32:00+02:00","FinishDate":"1969-02-19T18:39:00+02:00","IsSpecialMeeting":null,"LastUpdatedDate":"2022-12-11T07:20:28.203+02:00"}
{"Id":436092,"Number":385,"KnessetNum":6,"Name":"ישיבת מליאה בתאריך 11/03/1969 בשעה 16:02","StartDate":"1969-03-11T16:02:00+02:00","FinishDate":"1969-03-11T18:14:00+02:00","IsSpecialMeeting":null,"LastUpdatedDate":"2022-12-13T07:44:49.803+02:00"}
{"Id":436093,"Number":386,"KnessetNum":6,"Name":"ישיבת מליאה בתאריך 12/03/1969 בשעה 11:32","StartDate":"1969-03-12T11:32:00+02:00","FinishDate":"1969-03-12T18:43:00+02:00","IsSpecialMeeting":null,"LastUpdatedDate":"2022-12-13T12:12:15.863+02:00"}
{"Id":436094,"Number":390,"KnessetNum":6,"Name":"ישיבת מליאה בתאריך 18/03/1969 בשעה 16:00","StartDate":"1969-03-18T16:00:00+02:00","FinishDate":"1969-03-18T20:50:00+02:00","IsSpecialMeeting":null,"LastUpdatedDate":"2023-01-25T14:21:18.43+02:00"}
{"Id":436095,"Number":391,"KnessetNum":6,"Name":"ישיבת מליאה בתאריך 19/03/1969 בשעה: 00:00:00","StartDate":"1969-03-19T00:00:00+02:00","FinishDate":null,"IsSpecialMeeting":null,"LastUpdatedDate":"2014-08-17T15:12:51+03:00"}
{"Id":436096,"Number":392,"KnessetNum":6,"Name":"ישיבת מליאה בתאריך 20/03/1969 בשעה 10:30","StartDate":"1969-03-20T10:30:00+02:00","FinishDate":"1969-03-20T14:14:00+02:00","IsSpecialMeeting":null,"LastUpdatedDate":"2023-01-25T13:25:14.667+02:00"}
{"Id":436097,"Number":393,"KnessetNum":6,"Name":"ישיבת מליאה בתאריך 24/03/1969 בשעה 16:03","StartDate":"1969-03-24T16:03:00+02:00","FinishDate":"1969-03-24T22:17:00+02:00","IsSpecialMeeting":null,"LastUpdatedDate":"2023-01-25T13:47:38.813+02:00"}
{"Id":436098,"Number":394,"KnessetNum":6,"Name":"ישיבת מליאה בתאריך 25/03/1969 בשעה 10:03","StartDate":"1969-03-25T10:03:00+02:00","FinishDate":"1969-03-25T20:02:00+02:00","IsSpecialMeeting":null,"LastUpdatedDate":"2023-01-26T08:29:03.943+02:00"}
{"Id":436099,"Number":395,"KnessetNum":6,"Name":"ישיבת מליאה בתאריך 26/03/1969 בשעה 11:01","StartDate":"1969-03-26T11:01:00+02:00","FinishDate":"1969-03-26T15:52:00+02:00","IsSpecialMeeting":null,"LastUpdatedDate":"2023-02-05T08:58:38.047+02:00"}
{"Id":436100,"Number":404,"KnessetNum":6,"Name":"ישיבת מליאה בתאריך 21/05/1969 בשעה 11:30","StartDate":"1969-05-21T11:30:00+03:00","FinishDate":"1969-05-21T17:13:00+03:00","IsSpecialMeeting":null,"LastUpdatedDate":"2022-06-21T14:53:02.757+03:00"}
{"Id":436101,"Number":405,"KnessetNum":6,"Name":"ישיבת מליאה בתאריך 26/05/1969 בשעה 16:01","StartDate":"1969-05-26T16:01:00+03:00","FinishDate":"1969-05-26T21:32:00+03:00","IsSpecialMeeting":null,"LastUpdatedDate":"2022-06-21T13:32:44.427+03:00"}
{"Id":436102,"Number":407,"KnessetNum":6,"Name":"ישיבת מליאה בתאריך 28/05/1969 בשעה 11:32","StartDate":"1969-05-28T11:32:00+03:00","FinishDate":"1969-05-28T14:35:00+03:00","IsSpecialMeeting":null,"LastUpdatedDate":"2022-06-21T08:22:30.287+03:00"}
{"Id":436103,"Number":408,"KnessetNum":6,"Name":"ישיבת מליאה בתאריך 02/06/1969 בשעה 16:01","StartDate":"1969-06-02T16:01:00+03:00","FinishDate":"1969-06-02T21:33:00+03:00","IsSpecialMeeting":null,"LastUpdatedDate":"2022-06-15T14:23:04.767+03:00"}
{"Id":436104,"Number":410,"KnessetNum":6,"Name":"ישיבת מליאה בתאריך 04/06/1969 בשעה 10:02","StartDate":"1969-06-04T10:02:00+03:00","FinishDate":"1969-06-04T16:10:00+03:00","IsSpecialMeeting":null,"LastUpdatedDate":"2022-06-14T14:40:01.013+03:00"}
{"Id":436105,"Number":411,"KnessetNum":6,"Name":"ישיבת מליאה בתאריך 09/06/1969 בשעה 15:04","StartDate":"1969-06-09T15:04:00+03:00","FinishDate":"1969-06-09T20:30:00+03:00","IsSpecialMeeting":null,"LastUpdatedDate":"2024-02-22T14:55:17.513+02:00"}
{"Id":436106,"Number":412,"KnessetNum":6,"Name":"ישיבת מליאה בתאריך 10/06/1969 בשעה 16:02","StartDate":"1969-06-10T16:02:00+03:00","FinishDate":"1969-06-10T18:37:00+03:00","IsSpecialMeeting":null,"LastUpdatedDate":"2022-06-14T11:32:33.803+03:00"}
{"Id":436107,"Number":413,"KnessetNum":6,"Name":"ישיבת מליאה בתאריך 11/06/1969 בשעה 10:01","StartDate":"1969-06-11T10:01:00+03:00","FinishDate":"1969-06-11T17:05:00+03:00","IsSpecialMeeting":null,"LastUpdatedDate":"2022-06-14T09:17:54.01+03:00"}
{"Id":436108,"Number":415,"KnessetNum":6,"Name":"ישיבת מליאה בתאריך 17/06/1969 בשעה 16:00","StartDate":"1969-06-17T16:00:00+03:00","FinishDate":"1969-06-17T20:19:00+03:00","IsSpecialMeeting":null,"LastUpdatedDate":"2022-06-07T10:47:33.563+03:00"}
{"Id":436109,"Number":416,"KnessetNum":6,"Name":"ישיבת מליאה בתאריך 18/06/1969 בשעה 11:01","StartDate":"1969-06-18T11:01:00+03:00","FinishDate":"1969-06-18T15:26:00+03:00","IsSpecialMeeting":null,"LastUpdatedDate":"2023-02-28T17:19:10.13+02:00"}
{"Id":436110,"Number":417,"KnessetNum":6,"Name":"ישיבת מליאה בתאריך 23/06/1969 בשעה 16:00","StartDate":"1969-06-23T16:00:00+03:00","FinishDate":"1969-06-23T21:35:00+03:00","IsSpecialMeeting":null,"LastUpdatedDate":"2022-05-18T13:00:02.203+03:00"}
{"Id":436111,"Number":418,"KnessetNum":6,"Name":"ישיבת מליאה בתאריך 24/06/1969 בשעה 16:00","StartDate":"1969-06-24T16:00:00+03:00","FinishDate":"1969-06-24T19:55:00+03:00","IsSpecialMeeting":null,"LastUpdatedDate":"2022-05-18T10:41:29.543+03:00"}
{"Id":436112,"Number":422,"KnessetNum":6,"Name":"ישיבת מליאה בתאריך 02/07/1969 בשעה 10:01","StartDate":"1969-07-02T10:01:00+03:00","FinishDate":"1969-07-02T15:55:00+03:00","IsSpecialMeeting":null,"LastUpdatedDate":"2025-04-09T09:34:54.96+03:00"}
{"Id":436113,"Number":425,"KnessetNum":6,"Name":"ישיבת מליאה בתאריך 09/07/1969 בשעה 10:00","StartDate":"1969-07-09T10:00:00+03:00","FinishDate":"1969-07-09T16:14:00+03:00","IsSpecialMeeting":null,"LastUpdatedDate":"2022-05-10T10:51:40.9+03:00"}
{"Id":436114,"Number":426,"KnessetNum":6,"Name":"ישיבת מליאה בתאריך 14/07/1969 בשעה 15:01","StartDate":"1969-07-14T15:01:00+03:00","FinishDate":"1969-07-14T21:46:00+03:00","IsSpecialMeeting":null,"LastUpdatedDate":"2022-05-01T13:10:45.07+03:00"}
{"Id":436115,"Number":427,"KnessetNum":6,"Name":"ישיבת מליאה בתאריך 15/07/1969 בשעה 11:01","StartDate":"1969-07-15T11:01:00+03:00","FinishDate":"1969-07-16T00:30:00+03:00","IsSpecialMeeting":null,"LastUpdatedDate":"2022-05-01T09:07:37.047+03:00"}
{"Id":436116,"Number":428,"KnessetNum":6,"Name":"ישיבת מליאה בתאריך 16/07/1969 בשעה 10:02","StartDate":"1969-07-16T10:02:00+03:00","FinishDate":"1969-07-16T20:49:00+03:00","IsSpecialMeeting":null,"LastUpdatedDate":"2024-06-16T10:40:01.747+03:00"}
{"Id":436117,"Number":429,"KnessetNum":6,"Name":"ישיבת מליאה בתאריך 17/07/1969 בשעה 08:07","StartDate":"1969-07-17T08:07:00+03:00","FinishDate":"1969-07-17T20:00:00+03:00","IsSpecialMeeting":null,"LastUpdatedDate":"2022-04-26T09:47:42.303+03:00"}
{"Id":436119,"Number":4,"KnessetNum":7,"Name":"ישיבת מליאה בתאריך 24/11/1969 בשעה 16:02","StartDate":"1969-11-24T16:02:00+02:00","FinishDate":"1969-11-24T18:15:00+02:00","IsSpecialMeeting":null,"LastUpdatedDate":"2020-10-27T16:22:38.057+02:00"}
{"Id":436120,"Number":5,"KnessetNum":7,"Name":"ישיבת מליאה בתאריך 25/11/1969 בשעה 16:07","StartDate":"1969-11-25T16:07:00+02:00","FinishDate":"1969-11-25T18:03:00+02:00","IsSpecialMeeting":null,"LastUpdatedDate":"2020-10-26T13:11:50.18+02:00"}
{"Id":436121,"Number":7,"KnessetNum":7,"Name":"ישיבת מליאה בתאריך 01/12/1969 בשעה 16:01","StartDate":"1969-12-01T16:01:00+02:00","FinishDate":"1969-12-01T19:24:00+02:00","IsSpecialMeeting":null,"LastUpdatedDate":"2020-10-28T11:30:43.513+02:00"}
{"Id":436122,"Number":8,"KnessetNum":7,"Name":"ישיבת מליאה בתאריך 02/12/1969 בשעה 16:02","StartDate":"1969-12-02T16:02:00+02:00","FinishDate":"1969-12-02T20:00:00+02:00","IsSpecialMeeting":null,"LastUpdatedDate":"2020-10-28T11:36:13.79+02:00"}
{"Id":436123,"Number":14,"KnessetNum":7,"Name":"ישיבת מליאה בתאריך 16/12/1969 בשעה 16:00","StartDate":"1969-12-16T16:00:00+02:00","FinishDate":"1969-12-16T18:05:00+02:00","IsSpecialMeeting":null,"LastUpdatedDate":"2020-10-29T12:25:48.263+02:00"}
{"Id":436125,"Number":16,"KnessetNum":7,"Name":"ישיבת מליאה בתאריך 22/12/1969 בשעה 16:02","StartDate":"1969-12-22T16:02:00+02:00","FinishDate":"1969-12-22T17:30:00+02:00","IsSpecialMeeting":null,"LastUpdatedDate":"2020-10-29T13:23:00.463+02:00"}
{"Id":436126,"Number":17,"KnessetNum":7,"Name":"ישיבת מליאה בתאריך 23/12/1969 בשעה 16:03","StartDate":"1969-12-23T16:03:00+02:00","FinishDate":"1969-12-23T18:51:00+02:00","IsSpecialMeeting":null,"LastUpdatedDate":"2020-11-01T07:58:11.843+02:00"}
{"Id":436127,"Number":18,"KnessetNum":7,"Name":"ישיבת מליאה בתאריך 24/12/1969 בשעה 11:00","StartDate":"1969-12-24T11:00:00+02:00","FinishDate":"1969-12-24T12:03:00+02:00","IsSpecialMeeting":null,"LastUpdatedDate":"2020-11-01T08:35:31.833+02:00"}
{"Id":436128,"Number":20,"KnessetNum":7,"Name":"ישיבת מליאה בתאריך 30/12/1969 בשעה 16:00","StartDate":"1969-12-30T16:00:00+02:00","FinishDate":"1969-12-30T19:05:00+02:00","IsSpecialMeeting":null,"LastUpdatedDate":"2020-11-01T11:39:34.91+02:00"}
{"Id":436129,"Number":22,"KnessetNum":7,"Name":"ישיבת מליאה בתאריך 05/01/1970 בשעה 16:01","StartDate":"1970-01-05T16:01:00+02:00","FinishDate":"1970-01-05T17:32:00+02:00","IsSpecialMeeting":null,"LastUpdatedDate":"2020-11-02T09:39:34.663+02:00"}
{"Id":436130,"Number":23,"KnessetNum":7,"Name":"ישיבת מליאה בתאריך 06/01/1970 בשעה 16:00","StartDate":"1970-01-06T16:00:00+02:00","FinishDate":"1970-01-06T19:12:00+02:00","IsSpecialMeeting":null,"LastUpdatedDate":"2020-11-02T10:49:45.473+02:00"}
{"Id":436132,"Number":37,"KnessetNum":7,"Name":"ישיבת מליאה בתאריך 09/02/1970 בשעה 15:00","StartDate":"1970-02-09T15:00:00+02:00","FinishDate":"1970-02-09T20:08:00+02:00","IsSpecialMeeting":null,"LastUpdatedDate":"2020-11-04T14:16:20.457+02:00"}
{"Id":436133,"Number":50,"KnessetNum":7,"Name":"ישיבת מליאה בתאריך 10/03/1970 בשעה 15:03","StartDate":"1970-03-10T15:03:00+02:00","FinishDate":"1970-03-10T23:42:00+02:00","IsSpecialMeeting":null,"LastUpdatedDate":"2020-11-11T09:33:42.807+02:00"}
{"Id":436134,"Number":52,"KnessetNum":7,"Name":"ישיבת מליאה בתאריך 16/03/1970 בשעה 16:00","StartDate":"1970-03-16T16:00:00+02:00","FinishDate":"1970-03-16T21:30:00+02:00","IsSpecialMeeting":null,"LastUpdatedDate":"2020-11-11T14:51:13.183+02:00"}
{"Id":436135,"Number":54,"KnessetNum":7,"Name":"ישיבת מליאה בתאריך 18/03/1970 בשעה 12:30","StartDate":"1970-03-18T12:30:00+02:00","FinishDate":"1970-03-18T17:00:00+02:00","IsSpecialMeeting":null,"LastUpdatedDate":"2020-11-15T09:27:33.127+02:00"}
{"Id":436136,"Number":67,"KnessetNum":7,"Name":"ישיבת מליאה בתאריך 18/05/1970 בשעה 16:00","StartDate":"1970-05-18T16:00:00+03:00","FinishDate":"1970-05-18T19:17:00+03:00","IsSpecialMeeting":null,"LastUpdatedDate":"2020-11-24T10:09:55.13+02:00"}
{"Id":436137,"Number":74,"KnessetNum":7,"Name":"ישיבת מליאה בתאריך 02/06/1970 בשעה 16:00","StartDate":"1970-06-02T16:00:00+03:00","FinishDate":"1970-06-02T19:39:00+03:00","IsSpecialMeeting":null,"LastUpdatedDate":"2020-11-25T15:21:33.27+02:00"}
{"Id":436138,"Number":80,"KnessetNum":7,"Name":"ישיבת מליאה בתאריך 22/06/1970 בשעה 16:03","StartDate":"1970-06-22T16:03:00+03:00","FinishDate":"1970-06-22T20:05:00+03:00","IsSpecialMeeting":null,"LastUpdatedDate":"2020-11-30T10:32:28.733+02:00"}
{"Id":436139,"Number":83,"KnessetNum":7,"Name":"ישיבת מליאה בתאריך 29/06/1970 בשעה 16:03","StartDate":"1970-06-29T16:03:00+03:00","FinishDate":"1970-06-29T19:08:00+03:00","IsSpecialMeeting":null,"LastUpdatedDate":"2020-11-30T14:17:05.387+02:00"}
{"Id":436140,"Number":89,"KnessetNum":7,"Name":"ישיבת מליאה בתאריך 13/07/1970 בשעה 15:02","StartDate":"1970-07-13T15:02:00+03:00","FinishDate":"1970-07-13T20:56:00+03:00","IsSpecialMeeting":null,"LastUpdatedDate":"2020-12-01T11:22:28.833+02:00"}
{"Id":436141,"Number":90,"KnessetNum":7,"Name":"ישיבת מליאה בתאריך 14/07/1970 בשעה 16:00","StartDate":"1970-07-14T16:00:00+03:00","FinishDate":"1970-07-14T20:40:00+03:00","IsSpecialMeeting":null,"LastUpdatedDate":"2020-12-01T16:24:17.243+02:00"}
{"Id":436142,"Number":93,"KnessetNum":7,"Name":"ישיבת מליאה בתאריך 21/07/1970 בשעה 15:01","StartDate":"1970-07-21T15:01:00+03:00","FinishDate":"1970-07-21T19:30:00+03:00","IsSpecialMeeting":null,"LastUpdatedDate":"2020-12-02T09:09:48.123+02:00"}
{"Id":436144,"Number":109,"KnessetNum":7,"Name":"ישיבת מליאה בתאריך 03/11/1970 בשעה 16:00","StartDate":"1970-11-03T16:00:00+02:00","FinishDate":"1970-11-03T19:30:00+02:00","IsSpecialMeeting":null,"LastUpdatedDate":"2020-12-08T10:08:59.62+02:00"}
{"Id":436145,"Number":111,"KnessetNum":7,"Name":"ישיבת מליאה בתאריך 09/11/1970 בשעה 16:21","StartDate":"1970-11-09T16:21:00+02:00","FinishDate":"1970-11-09T18:21:00+02:00","IsSpecialMeeting":null,"LastUpdatedDate":"2020-12-08T12:36:58.423+02:00"}
{"Id":436146,"Number":113,"KnessetNum":7,"Name":"ישיבת מליאה בתאריך 11/11/1970 בשעה 12:32","StartDate":"1970-11-11T12:32:00+02:00","FinishDate":"1970-11-11T13:40:00+02:00","IsSpecialMeeting":null,"LastUpdatedDate":"2020-12-09T09:20:14.73+02:00"}
{"Id":436147,"Number":117,"KnessetNum":7,"Name":"ישיבת מליאה בתאריך 23/11/1970 בשעה 16:00","StartDate":"1970-11-23T16:00:00+02:00","FinishDate":"1970-11-23T19:20:00+02:00","IsSpecialMeeting":null,"LastUpdatedDate":"2020-12-13T10:02:33.173+02:00"}
{"Id":436148,"Number":118,"KnessetNum":7,"Name":"ישיבת מליאה בתאריך 24/11/1970 בשעה 16:00","StartDate":"1970-11-24T16:00:00+02:00","FinishDate":"1970-11-24T20:23:00+02:00","IsSpecialMeeting":null,"LastUpdatedDate":"2020-12-13T10:42:30.777+02:00"}
{"Id":436149,"Number":119,"KnessetNum":7,"Name":"ישיבת מליאה בתאריך 25/11/1970 בשעה 10:30","StartDate":"1970-11-25T10:30:00+02:00","FinishDate":"1970-11-25T14:13:00+02:00","IsSpecialMeeting":null,"LastUpdatedDate":"2020-12-14T11:03:18.973+02:00"}
{"Id":436150,"Number":120,"KnessetNum":7,"Name":"ישיבת מליאה בתאריך 30/11/1970 בשעה 16:00","StartDate":"1970-11-30T16:00:00+02:00","FinishDate":"1970-11-30T20:25:00+02:00","IsSpecialMeeting":null,"LastUpdatedDate":"2020-12-14T11:17:32.25+02:00"}
{"Id":436151,"Number":121,"KnessetNum":7,"Name":"ישיבת מליאה בתאריך 01/12/1970 בשעה 16:01","StartDate":"1970-12-01T16:01:00+02:00","FinishDate":"1970-12-01T18:50:00+02:00","IsSpecialMeeting":null,"LastUpdatedDate":"2020-12-22T08:09:01.283+02:00"}
{"Id":436152,"Number":123,"KnessetNum":7,"Name":"ישיבת מליאה בתאריך 07/12/1970 בשעה 16:01","StartDate":"1970-12-07T16:01:00+02:00","FinishDate":"1970-12-07T20:48:00+02:00","IsSpecialMeeting":null,"LastUpdatedDate":"2020-12-14T14:45:11.257+02:00"}
{"Id":436153,"Number":124,"KnessetNum":7,"Name":"ישיבת מליאה בתאריך 08/12/1970 בשעה 16:01","StartDate":"1970-12-08T16:01:00+02:00","FinishDate":"1970-12-08T21:01:00+02:00","IsSpecialMeeting":null,"LastUpdatedDate":"2020-12-14T15:15:17.273+02:00"}
{"Id":436154,"Number":125,"KnessetNum":7,"Name":"ישיבת מליאה בתאריך 09/12/1970 בשעה 12:30","StartDate":"1970-12-09T12:30:00+02:00","FinishDate":"1970-12-09T15:42:00+02:00","IsSpecialMeeting":null,"LastUpdatedDate":"2020-12-15T09:05:43.757+02:00"}
{"Id":436155,"Number":127,"KnessetNum":7,"Name":"ישיבת מליאה בתאריך 15/12/1970 בשעה 16:02","StartDate":"1970-12-15T16:02:00+02:00","FinishDate":"1970-12-15T20:55:00+02:00","IsSpecialMeeting":null,"LastUpdatedDate":"2020-12-16T08:10:19.26+02:00"}
{"Id":436156,"Number":130,"KnessetNum":7,"Name":"ישיבת מליאה בתאריך 22/12/1970 בשעה 12:01","StartDate":"1970-12-22T12:01:00+02:00","FinishDate":"1970-12-22T15:04:00+02:00","IsSpecialMeeting":null,"LastUpdatedDate":"2020-12-16T15:10:53.257+02:00"}
{"Id":436157,"Number":135,"KnessetNum":7,"Name":"ישיבת מליאה בתאריך 30/12/1970 בשעה 12:32","StartDate":"1970-12-30T12:32:00+02:00","FinishDate":"1970-12-30T15:05:00+02:00","IsSpecialMeeting":null,"LastUpdatedDate":"2020-12-20T12:43:18.47+02:00"}
{"Id":436158,"Number":136,"KnessetNum":7,"Name":"ישיבת מליאה בתאריך 04/01/1971 בשעה 16:00","StartDate":"1971-01-04T16:00:00+02:00","FinishDate":"1971-01-04T22:03:00+02:00","IsSpecialMeeting":null,"LastUpdatedDate":"2020-12-20T13:16:36.19+02:00"}
{"Id":436159,"Number":137,"KnessetNum":7,"Name":"ישיבת מליאה בתאריך 05/01/1971 בשעה 16:00","StartDate":"1971-01-05T16:00:00+02:00","FinishDate":"1971-01-05T22:03:00+02:00","IsSpecialMeeting":null,"LastUpdatedDate":"2020-12-20T14:05:45.937+02:00"}
{"Id":436160,"Number":140,"KnessetNum":7,"Name":"ישיבת מליאה בתאריך 12/01/1971 בשעה 16:01","StartDate":"1971-01-12T16:01:00+02:00","FinishDate":"1971-01-12T20:30:00+02:00","IsSpecialMeeting":null,"LastUpdatedDate":"2020-12-28T08:45:47.1+02:00"}
{"Id":436161,"Number":149,"KnessetNum":7,"Name":"ישיבת מליאה בתאריך 02/02/1971 בשעה 16:00","StartDate":"1971-02-02T16:00:00+02:00","FinishDate":"1971-02-02T20:10:00+02:00","IsSpecialMeeting":null,"LastUpdatedDate":"2020-12-22T16:00:46.603+02:00"}
{"Id":436162,"Number":167,"KnessetNum":7,"Name":"ישיבת מליאה בתאריך 16/03/1971 בשעה 13:00","StartDate":"1971-03-16T13:00:00+02:00","FinishDate":"1971-03-16T19:50:00+02:00","IsSpecialMeeting":null,"LastUpdatedDate":"2020-12-28T16:13:29.64+02:00"}
{"Id":436163,"Number":168,"KnessetNum":7,"Name":"ישיבת מליאה בתאריך 17/03/1971 בשעה 11:00","StartDate":"1971-03-17T11:00:00+02:00","FinishDate":"1971-03-17T12:56:00+02:00","IsSpecialMeeting":null,"LastUpdatedDate":"2020-12-28T17:26:09.333+02:00"}
{"Id":436164,"Number":172,"KnessetNum":7,"Name":"ישיבת מליאה בתאריך 25/03/1971 בשעה 12:03","StartDate":"1971-03-25T12:03:00+02:00","FinishDate":"1971-03-25T15:43:00+02:00","IsSpecialMeeting":null,"LastUpdatedDate":"2020-12-29T13:14:14.677+02:00"}
{"Id":436165,"Number":173,"KnessetNum":7,"Name":"ישיבת מליאה בתאריך 29/03/1971 בשעה 15:00","StartDate":"1971-03-29T15:00:00+02:00","FinishDate":"1971-03-29T20:42:00+02:00","IsSpecialMeeting":null,"LastUpdatedDate":"2020-12-29T14:01:09.057+02:00"}
{"Id":436166,"Number":181,"KnessetNum":7,"Name":"ישיבת מליאה בתאריך 11/05/1971 בשעה 16:00","StartDate":"1971-05-11T16:00:00+03:00","FinishDate":"1971-05-11T19:14:00+03:00","IsSpecialMeeting":null,"LastUpdatedDate":"2021-01-03T15:53:58.067+02:00"}
{"Id":436167,"Number":185,"KnessetNum":7,"Name":"ישיבת מליאה בתאריך 19/05/1971 בשעה 11:01","StartDate":"1971-05-19T11:01:00+03:00","FinishDate":"1971-05-19T12:58:00+03:00","IsSpecialMeeting":null,"LastUpdatedDate":"2021-01-04T15:25:00.277+02:00"}
{"Id":436168,"Number":190,"KnessetNum":7,"Name":"ישיבת מליאה בתאריך 01/06/1971 בשעה 16:00","StartDate":"1971-06-01T16:00:00+03:00","FinishDate":"1971-06-01T19:35:00+03:00","IsSpecialMeeting":null,"LastUpdatedDate":"2021-01-05T09:22:21.203+02:00"}
{"Id":436169,"Number":191,"KnessetNum":7,"Name":"ישיבת מליאה בתאריך 02/06/1971 בשעה 11:00","StartDate":"1971-06-02T11:00:00+03:00","FinishDate":"1971-06-02T11:52:00+03:00","IsSpecialMeeting":null,"LastUpdatedDate":"2021-01-05T09:36:15.72+02:00"}
{"Id":436170,"Number":192,"KnessetNum":7,"Name":"ישיבת מליאה בתאריך 07/06/1971 בשעה 16:00","StartDate":"1971-06-07T16:00:00+03:00","FinishDate":"1971-06-07T20:17:00+03:00","IsSpecialMeeting":null,"LastUpdatedDate":"2021-01-05T10:15:50.523+02:00"}
{"Id":436171,"Number":199,"KnessetNum":7,"Name":"ישיבת מליאה בתאריך 22/06/1971 בשעה 16:00","StartDate":"1971-06-22T16:00:00+03:00","FinishDate":"1971-06-22T20:15:00+03:00","IsSpecialMeeting":null,"LastUpdatedDate":"2021-01-06T11:03:50.52+02:00"}
{"Id":436172,"Number":202,"KnessetNum":7,"Name":"ישיבת מליאה בתאריך 29/06/1971 בשעה 15:00","StartDate":"1971-06-29T15:00:00+03:00","FinishDate":"1971-06-29T20:22:00+03:00","IsSpecialMeeting":null,"LastUpdatedDate":"2021-01-06T14:46:22.947+02:00"}
{"Id":436173,"Number":203,"KnessetNum":7,"Name":"ישיבת מליאה בתאריך 30/06/1971 בשעה 11:00","StartDate":"1971-06-30T11:00:00+03:00","FinishDate":"1971-06-30T16:33:00+03:00","IsSpecialMeeting":null,"LastUpdatedDate":"2021-01-06T15:15:08.297+02:00"}
{"Id":436174,"Number":206,"KnessetNum":7,"Name":"ישיבת מליאה בתאריך 06/07/1971 בשעה 16:00","StartDate":"1971-07-06T16:00:00+03:00","FinishDate":"1971-07-06T20:50:00+03:00","IsSpecialMeeting":null,"LastUpdatedDate":"2025-01-27T08:34:09.483+02:00"}
{"Id":436175,"Number":207,"KnessetNum":7,"Name":"ישיבת מליאה בתאריך 07/07/1971 בשעה 11:00","StartDate":"1971-07-07T11:00:00+03:00","FinishDate":"1971-07-07T13:33:00+03:00","IsSpecialMeeting":null,"LastUpdatedDate":"2025-01-27T08:37:31.313+02:00"}
{"Id":436176,"Number":210,"KnessetNum":7,"Name":"ישיבת מליאה בתאריך 14/07/1971 בשעה 11:00","StartDate":"1971-07-14T11:00:00+03:00","FinishDate":"1971-07-14T15:22:00+03:00","IsSpecialMeeting":null,"LastUpdatedDate":"2025-01-27T08:41:02.72+02:00"}
{"Id":436177,"Number":212,"KnessetNum":7,"Name":"ישיבת מליאה בתאריך 20/07/1971 בשעה 13:00","StartDate":"1971-07-20T13:00:00+03:00","FinishDate":"1971-07-20T20:35:00+03:00","IsSpecialMeeting":null,"LastUpdatedDate":"2025-01-27T08:46:02.847+02:00"}
{"Id":436178,"Number":213,"KnessetNum":7,"Name":"ישיבת מליאה בתאריך 21/07/1971 בשעה 11:00","StartDate":"1971-07-21T11:00:00+03:00","FinishDate":"1971-07-21T20:00:00+03:00","IsSpecialMeeting":null,"LastUpdatedDate":"2025-01-27T08:49:49.363+02:00"}
{"Id":436179,"Number":214,"KnessetNum":7,"Name":"ישיבת מליאה בתאריך 22/07/1971 בשעה 10:02","StartDate":"1971-07-22T10:02:00+03:00","FinishDate":"1971-07-22T14:00:00+03:00","IsSpecialMeeting":null,"LastUpdatedDate":"2025-01-27T08:53:23.457+02:00"}
{"Id":436180,"Number":215,"KnessetNum":7,"Name":"ישיבת מליאה בתאריך 26/07/1971 בשעה 15:00","StartDate":"1971-07-26T15:00:00+03:00","FinishDate":"1971-07-26T21:45:00+03:00","IsSpecialMeeting":null,"LastUpdatedDate":"2025-01-27T09:06:55.73+02:00"}
{"Id":436181,"Number":219,"KnessetNum":7,"Name":"ישיבת מליאה בתאריך 23/08/1971 בשעה: 00:00:00","StartDate":"1971-08-23T00:00:00+03:00","FinishDate":null,"IsSpecialMeeting":null,"LastUpdatedDate":"2014-08-17T15:12:53+03:00"}
{"Id":436183,"Number":225,"KnessetNum":7,"Name":"ישיבת מליאה בתאריך 02/11/1971 בשעה 16:00","StartDate":"1971-11-02T16:00:00+02:00","FinishDate":"1971-11-02T20:04:00+02:00","IsSpecialMeeting":null,"LastUpdatedDate":"2025-01-27T09:37:09.723+02:00"}
{"Id":436184,"Number":227,"KnessetNum":7,"Name":"ישיבת מליאה בתאריך 08/11/1971 בשעה 16:02","StartDate":"1971-11-08T16:02:00+02:00","FinishDate":"1971-11-08T19:05:00+02:00","IsSpecialMeeting":null,"LastUpdatedDate":"2025-01-27T09:43:54.24+02:00"}
{"Id":436185,"Number":228,"KnessetNum":7,"Name":"ישיבת מליאה בתאריך 09/11/1971 בשעה 16:00","StartDate":"1971-11-09T16:00:00+02:00","FinishDate":"1971-11-09T19:05:00+02:00","IsSpecialMeeting":null,"LastUpdatedDate":"2025-01-27T09:52:54.143+02:00"}
{"Id":436186,"Number":233,"KnessetNum":7,"Name":"ישיבת מליאה בתאריך 22/11/1971 בשעה 16:02","StartDate":"1971-11-22T16:02:00+02:00","FinishDate":"1971-11-22T20:11:00+02:00","IsSpecialMeeting":null,"LastUpdatedDate":"2025-01-27T10:21:47.62+02:00"}
{"Id":436187,"Number":234,"KnessetNum":7,"Name":"ישיבת מליאה בתאריך 23/11/1971 בשעה 16:01","StartDate":"1971-11-23T16:01:00+02:00","FinishDate":"1971-11-23T18:55:00+02:00","IsSpecialMeeting":null,"LastUpdatedDate":"2025-01-27T10:26:23.08+02:00"}
{"Id":436188,"Number":236,"KnessetNum":7,"Name":"ישיבת מליאה בתאריך 29/11/1971 בשעה 16:00","StartDate":"1971-11-29T16:00:00+02:00","FinishDate":"1971-11-29T16:00:00+02:00","IsSpecialMeeting":null,"LastUpdatedDate":"2025-01-27T10:47:13.227+02:00"}
{"Id":436189,"Number":237,"KnessetNum":7,"Name":"ישיבת מליאה בתאריך 30/11/1971 בשעה 16:00","StartDate":"1971-11-30T16:00:00+02:00","FinishDate":"1971-11-30T20:08:00+02:00","IsSpecialMeeting":null,"LastUpdatedDate":"2025-01-27T10:50:27.033+02:00"}
{"Id":436190,"Number":239,"KnessetNum":7,"Name":"ישיבת מליאה בתאריך 06/12/1971 בשעה 16:00","StartDate":"1971-12-06T16:00:00+02:00","FinishDate":"1971-12-06T21:20:00+02:00","IsSpecialMeeting":null,"LastUpdatedDate":"2025-01-27T10:54:05.34+02:00"}
{"Id":436191,"Number":240,"KnessetNum":7,"Name":"ישיבת מליאה בתאריך 07/12/1971 בשעה 16:01","StartDate":"1971-12-07T16:01:00+02:00","FinishDate":"1971-12-07T19:35:00+02:00","IsSpecialMeeting":null,"LastUpdatedDate":"2025-01-27T10:57:09.073+02:00"}
{"Id":436192,"Number":241,"KnessetNum":7,"Name":"ישיבת מליאה בתאריך 08/12/1971 בשעה 11:00","StartDate":"1971-12-08T11:00:00+02:00","FinishDate":"1971-12-08T12:05:00+02:00","IsSpecialMeeting":null,"LastUpdatedDate":"2025-01-27T11:01:03.62+02:00"}
{"Id":436193,"Number":247,"KnessetNum":7,"Name":"ישיבת מליאה בתאריך 22/12/1971 בשעה 11:02","StartDate":"1971-12-22T11:02:00+02:00","FinishDate":"1971-12-22T12:47:00+02:00","IsSpecialMeeting":null,"LastUpdatedDate":"2025-04-07T15:58:35.417+03:00"}
{"Id":436194,"Number":248,"KnessetNum":7,"Name":"ישיבת מליאה בתאריך 27/12/1971 בשעה 16:00","StartDate":"1971-12-27T16:00:00+02:00","FinishDate":"1971-12-27T21:19:00+02:00","IsSpecialMeeting":null,"LastUpdatedDate":"2023-11-19T11:27:19.59+02:00"}
{"Id":436195,"Number":249,"KnessetNum":7,"Name":"ישיבת מליאה בתאריך 28/12/1971 בשעה 16:00","StartDate":"1971-12-28T16:00:00+02:00","FinishDate":"1971-12-28T20:10:00+02:00","IsSpecialMeeting":null,"LastUpdatedDate":"2023-11-19T11:29:03.357+02:00"}
{"Id":436196,"Number":251,"KnessetNum":7,"Name":"ישיבת מליאה בתאריך 03/01/1972 בשעה 16:01","StartDate":"1972-01-03T16:01:00+02:00","FinishDate":"1972-01-03T19:13:00+02:00","IsSpecialMeeting":null,"LastUpdatedDate":"2023-11-19T12:16:54.973+02:00"}
{"Id":436197,"Number":252,"KnessetNum":7,"Name":"ישיבת מליאה בתאריך 04/01/1972 בשעה 16:00","StartDate":"1972-01-04T16:00:00+02:00","FinishDate":"1972-01-04T19:58:00+02:00","IsSpecialMeeting":null,"LastUpdatedDate":"2023-11-19T12:24:12.22+02:00"}
{"Id":436198,"Number":253,"KnessetNum":7,"Name":"ישיבת מליאה בתאריך 05/01/1972 בשעה 11:00","StartDate":"1972-01-05T11:00:00+02:00","FinishDate":"1972-01-05T13:15:00+02:00","IsSpecialMeeting":null,"LastUpdatedDate":"2023-11-20T00:42:05.123+02:00"}
{"Id":436199,"Number":257,"KnessetNum":7,"Name":"ישיבת מליאה בתאריך 17/01/1972 בשעה 16:00","StartDate":"1972-01-17T16:00:00+02:00","FinishDate":"1972-01-17T20:00:00+02:00","IsSpecialMeeting":null,"LastUpdatedDate":"2023-11-20T01:04:16.953+02:00"}
{"Id":436200,"Number":258,"KnessetNum":7,"Name":"ישיבת מליאה בתאריך 18/01/1972 בשעה 16:00","StartDate":"1972-01-18T16:00:00+02:00","FinishDate":"1972-01-18T19:02:00+02:00","IsSpecialMeeting":null,"LastUpdatedDate":"2023-11-20T01:06:47.953+02:00"}
{"Id":436201,"Number":271,"KnessetNum":7,"Name":"ישיבת מליאה בתאריך 16/02/1972 בשעה 11:02","StartDate":"1972-02-16T11:02:00+02:00","FinishDate":"1972-02-16T16:17:00+02:00","IsSpecialMeeting":null,"LastUpdatedDate":"2023-11-20T02:09:19.727+02:00"}
{"Id":436202,"Number":277,"KnessetNum":7,"Name":"ישיבת מליאה בתאריך 06/03/1972 בשעה 15:00","StartDate":"1972-03-06T15:00:00+02:00","FinishDate":"1972-03-06T19:15:00+02:00","IsSpecialMeeting":null,"LastUpdatedDate":"2023-11-20T02:40:38.023+02:00"}
{"Id":436203,"Number":279,"KnessetNum":7,"Name":"ישיבת מליאה בתאריך 08/03/1972 בשעה 11:02","StartDate":"1972-03-08T11:02:00+02:00","FinishDate":"1972-03-08T16:37:00+02:00","IsSpecialMeeting":null,"LastUpdatedDate":"2023-11-20T02:51:34.78+02:00"}
{"Id":436204,"Number":283,"KnessetNum":7,"Name":"ישיבת מליאה בתאריך 15/03/1972 בשעה 11:03","StartDate":"1972-03-15T11:03:00+02:00","FinishDate":"1972-03-15T14:45:00+02:00","IsSpecialMeeting":null,"LastUpdatedDate":"2023-11-20T03:07:41.49+02:00"}
{"Id":436205,"Number":314,"KnessetNum":7,"Name":"ישיבת מליאה בתאריך 13/06/1972 בשעה 15:02","StartDate":"1972-06-13T15:02:00+03:00","FinishDate":"1972-06-13T19:02:00+03:00","IsSpecialMeeting":null,"LastUpdatedDate":"2023-11-21T01:15:33.977+02:00"}
{"Id":436206,"Number":318,"KnessetNum":7,"Name":"ישיבת מליאה בתאריך 20/06/1972 בשעה 15:01","StartDate":"1972-06-20T15:01:00+03:00","FinishDate":"1972-06-20T19:30:00+03:00","IsSpecialMeeting":null,"LastUpdatedDate":"2021-02-25T08:47:25.517+02:00"}
{"Id":436207,"Number":321,"KnessetNum":7,"Name":"ישיבת מליאה בתאריך 27/06/1972 בשעה 15:00","StartDate":"1972-06-27T15:00:00+03:00","FinishDate":"1972-06-27T20:43:00+03:00","IsSpecialMeeting":null,"LastUpdatedDate":"2023-11-24T01:38:16.65+02:00"}
{"Id":436208,"Number":322,"KnessetNum":7,"Name":"ישיבת מליאה בתאריך 28/06/1972 בשעה 09:00","StartDate":"1972-06-28T09:00:00+03:00","FinishDate":"1972-06-28T13:55:00+03:00","IsSpecialMeeting":null,"LastUpdatedDate":"2023-11-24T01:40:52.66+02:00"}
{"Id":436209,"Number":325,"KnessetNum":7,"Name":"ישיבת מליאה בתאריך 05/07/1972 בשעה 11:02","StartDate":"1972-07-05T11:02:00+03:00","FinishDate":"1972-07-05T14:50:00+03:00","IsSpecialMeeting":null,"LastUpdatedDate":"2023-11-24T01:56:42.317+02:00"}
{"Id":436210,"Number":327,"KnessetNum":7,"Name":"ישיבת מליאה בתאריך 11/07/1972 בשעה 15:00","StartDate":"1972-07-11T15:00:00+03:00","FinishDate":"1972-07-11T20:15:00+03:00","IsSpecialMeeting":null,"LastUpdatedDate":"2023-11-24T02:05:13.94+02:00"}
{"Id":436211,"Number":328,"KnessetNum":7,"Name":"ישיבת מליאה בתאריך 12/07/1972 בשעה 11:15","StartDate":"1972-07-12T11:15:00+03:00","FinishDate":"1972-07-12T17:15:00+03:00","IsSpecialMeeting":null,"LastUpdatedDate":"2023-11-24T02:14:20.613+02:00"}
{"Id":436212,"Number":329,"KnessetNum":7,"Name":"ישיבת מליאה בתאריך 17/07/1972 בשעה 16:00","StartDate":"1972-07-17T16:00:00+03:00","FinishDate":"1972-07-17T20:31:00+03:00","IsSpecialMeeting":null,"LastUpdatedDate":"2023-11-24T02:22:05.447+02:00"}
{"Id":436213,"Number":330,"KnessetNum":7,"Name":"ישיבת מליאה בתאריך 18/07/1972 בשעה 15:04","StartDate":"1972-07-18T15:04:00+03:00","FinishDate":"1972-07-18T18:55:00+03:00","IsSpecialMeeting":null,"LastUpdatedDate":"2021-06-13T07:48:14.237+03:00"}
{"Id":436214,"Number":332,"KnessetNum":7,"Name":"ישיבת מליאה בתאריך 24/07/1972 בשעה 15:00","StartDate":"1972-07-24T15:00:00+03:00","FinishDate":"1972-07-24T22:15:00+03:00","IsSpecialMeeting":null,"LastUpdatedDate":"2021-02-11T10:47:57.967+02:00"}
{"Id":436215,"Number":344,"KnessetNum":7,"Name":"ישיבת מליאה בתאריך 23/10/1972 בשעה 16:08","StartDate":"1972-10-23T16:08:00+02:00","FinishDate":"1972-10-23T20:30:00+02:00","IsSpecialMeeting":null,"LastUpdatedDate":"2021-02-17T08:31:09.293+02:00"}
{"Id":436216,"Number":345,"KnessetNum":7,"Name":"ישיבת מליאה בתאריך 24/10/1972 בשעה 16:00","StartDate":"1972-10-24T16:00:00+02:00","FinishDate":"1972-10-24T19:13:00+02:00","IsSpecialMeeting":null,"LastUpdatedDate":"2021-02-17T09:21:35.69+02:00"}
{"Id":436217,"Number":346,"KnessetNum":7,"Name":"ישיבת מליאה בתאריך 25/10/1972 בשעה 11:01","StartDate":"1972-10-25T11:01:00+02:00","FinishDate":"1972-10-25T16:35:00+02:00","IsSpecialMeeting":null,"LastUpdatedDate":"2021-03-08T17:56:39.017+02:00"}
{"Id":436218,"Number":347,"KnessetNum":7,"Name":"ישיבת מליאה בתאריך 30/10/1972 בשעה 16:00","StartDate":"1972-10-30T16:00:00+02:00","FinishDate":"1972-10-30T19:15:00+02:00","IsSpecialMeeting":null,"LastUpdatedDate":"2021-02-17T11:57:11.013+02:00"}
{"Id":436219,"Number":351,"KnessetNum":7,"Name":"ישיבת מליאה בתאריך 07/11/1972 בשעה 15:00","StartDate":"1972-11-07T15:00:00+02:00","FinishDate":"1972-11-07T17:07:00+02:00","IsSpecialMeeting":null,"LastUpdatedDate":"2021-02-18T09:26:22.037+02:00"}
{"Id":436220,"Number":357,"KnessetNum":7,"Name":"ישיבת מליאה בתאריך 21/11/1972 בשעה 16:01","StartDate":"1972-11-21T16:01:00+02:00","FinishDate":"1972-11-21T20:52:00+02:00","IsSpecialMeeting":null,"LastUpdatedDate":"2021-02-22T10:49:33.353+02:00"}
{"Id":436221,"Number":358,"KnessetNum":7,"Name":"ישיבת מליאה בתאריך 22/11/1972 בשעה 11:02","StartDate":"1972-11-22T11:02:00+02:00","FinishDate":"1972-11-22T13:41:00+02:00","IsSpecialMeeting":null,"LastUpdatedDate":"2025-03-10T14:40:16.407+02:00"}
{"Id":436222,"Number":359,"KnessetNum":7,"Name":"ישיבת מליאה בתאריך 27/11/1972 בשעה 16:03","StartDate":"1972-11-27T16:03:00+02:00","FinishDate":"1972-11-27T19:57:00+02:00","IsSpecialMeeting":null,"LastUpdatedDate":"2021-02-22T14:09:10.87+02:00"}
{"Id":436223,"Number":364,"KnessetNum":7,"Name":"ישיבת מליאה בתאריך 11/12/1972 בשעה 16:00","StartDate":"1972-12-11T16:00:00+02:00","FinishDate":"1972-12-11T20:53:00+02:00","IsSpecialMeeting":null,"LastUpdatedDate":"2021-02-23T11:20:59.373+02:00"}
{"Id":436224,"Number":365,"KnessetNum":7,"Name":"ישיבת מליאה בתאריך 12/12/1972 בשעה 16:00","StartDate":"1972-12-12T16:00:00+02:00","FinishDate":"1972-12-12T19:40:00+02:00","IsSpecialMeeting":null,"LastUpdatedDate":"2021-02-23T12:25:10.577+02:00"}
{"Id":436225,"Number":369,"KnessetNum":7,"Name":"ישיבת מליאה בתאריך 20/12/1972 בשעה 11:01","StartDate":"1972-12-20T11:01:00+02:00","FinishDate":"1972-12-20T13:56:00+02:00","IsSpecialMeeting":null,"LastUpdatedDate":"2021-02-25T12:12:39.603+02:00"}
{"Id":436226,"Number":371,"KnessetNum":7,"Name":"ישיבת מליאה בתאריך 26/12/1972 בשעה 16:03","StartDate":"1972-12-26T16:03:00+02:00","FinishDate":"1972-12-26T20:25:00+02:00","IsSpecialMeeting":null,"LastUpdatedDate":"2021-03-01T10:27:39.6+02:00"}
{"Id":436227,"Number":372,"KnessetNum":7,"Name":"ישיבת מליאה בתאריך 27/12/1972 בשעה 11:02","StartDate":"1972-12-27T11:02:00+02:00","FinishDate":"1972-12-27T13:46:00+02:00","IsSpecialMeeting":null,"LastUpdatedDate":"2021-03-01T10:33:45.57+02:00"}
{"Id":436228,"Number":373,"KnessetNum":7,"Name":"ישיבת מליאה בתאריך 01/01/1973 בשעה 16:00","StartDate":"1973-01-01T16:00:00+02:00","FinishDate":"1973-01-02T04:58:00+02:00","IsSpecialMeeting":null,"LastUpdatedDate":"2021-03-01T11:04:51.813+02:00"}
{"Id":436229,"Number":375,"KnessetNum":7,"Name":"ישיבת מליאה בתאריך 03/01/1973 בשעה 11:02","StartDate":"1973-01-03T11:02:00+02:00","FinishDate":"1973-01-03T16:00:00+02:00","IsSpecialMeeting":null,"LastUpdatedDate":"2023-12-28T12:37:36.56+02:00"}
{"Id":436230,"Number":376,"KnessetNum":7,"Name":"ישיבת מליאה בתאריך 08/01/1973 בשעה 16:00","StartDate":"1973-01-08T16:00:00+02:00","FinishDate":"1973-01-08T18:11:00+02:00","IsSpecialMeeting":null,"LastUpdatedDate":"2021-03-01T14:23:58.413+02:00"}
{"Id":436231,"Number":377,"KnessetNum":7,"Name":"ישיבת מליאה בתאריך 09/01/1973 בשעה 16:00","StartDate":"1973-01-09T16:00:00+02:00","FinishDate":"1973-01-09T19:47:00+02:00","IsSpecialMeeting":null,"LastUpdatedDate":"2021-03-02T07:48:19.94+02:00"}
{"Id":436232,"Number":378,"KnessetNum":7,"Name":"ישיבת מליאה בתאריך 10/01/1973 בשעה 11:00","StartDate":"1973-01-10T11:00:00+02:00","FinishDate":"1973-01-10T13:14:00+02:00","IsSpecialMeeting":null,"LastUpdatedDate":"2021-03-02T08:12:21.36+02:00"}
{"Id":436233,"Number":380,"KnessetNum":7,"Name":"ישיבת מליאה בתאריך 16/01/1973 בשעה 16:00","StartDate":"1973-01-16T16:00:00+02:00","FinishDate":"1973-01-16T20:00:00+02:00","IsSpecialMeeting":null,"LastUpdatedDate":"2021-03-02T09:53:00.387+02:00"}
{"Id":436234,"Number":384,"KnessetNum":7,"Name":"ישיבת מליאה בתאריך 24/01/1973 בשעה 10:04","StartDate":"1973-01-24T10:04:00+02:00","FinishDate":"1973-01-24T17:11:00+02:00","IsSpecialMeeting":null,"LastUpdatedDate":"2021-03-02T11:18:01.78+02:00"}
{"Id":436235,"Number":386,"KnessetNum":7,"Name":"ישיבת מליאה בתאריך 30/01/1973 בשעה 15:00","StartDate":"1973-01-30T15:00:00+02:00","FinishDate":"1973-01-30T19:12:00+02:00","IsSpecialMeeting":null,"LastUpdatedDate":"2024-01-02T13:11:36.803+02:00"}
{"Id":436236,"Number":387,"KnessetNum":7,"Name":"ישיבת מליאה בתאריך 31/01/1973 בשעה 11:01","StartDate":"1973-01-31T11:01:00+02:00","FinishDate":"1973-01-31T15:36:00+02:00","IsSpecialMeeting":null,"LastUpdatedDate":"2021-03-04T09:15:49.173+02:00"}
{"Id":436237,"Number":390,"KnessetNum":7,"Name":"ישיבת מליאה בתאריך 07/02/1973 בשעה 11:00","StartDate":"1973-02-07T11:00:00+02:00","FinishDate":"1973-02-07T12:18:00+02:00","IsSpecialMeeting":null,"LastUpdatedDate":"2021-03-04T13:25:33.913+02:00"}
{"Id":436238,"Number":392,"KnessetNum":7,"Name":"ישיבת מליאה בתאריך 13/02/1973 בשעה 15:02","StartDate":"1973-02-13T15:02:00+02:00","FinishDate":"1973-02-13T20:06:00+02:00","IsSpecialMeeting":null,"LastUpdatedDate":"2021-03-09T07:46:14.207+02:00"}
{"Id":436239,"Number":393,"KnessetNum":7,"Name":"ישיבת מליאה בתאריך 14/02/1973 בשעה 11:00","StartDate":"1973-02-14T11:00:00+02:00","FinishDate":"1973-02-14T14:12:00+02:00","IsSpecialMeeting":null,"LastUpdatedDate":"2021-03-09T10:30:13.553+02:00"}
{"Id":436240,"Number":395,"KnessetNum":7,"Name":"ישיבת מליאה בתאריך 20/02/1973 בשעה 15:00","StartDate":"1973-02-20T15:00:00+02:00","FinishDate":"1973-02-20T21:37:00+02:00","IsSpecialMeeting":null,"LastUpdatedDate":"2021-03-09T11:09:46.72+02:00"}
{"Id":436241,"Number":398,"KnessetNum":7,"Name":"ישיבת מליאה בתאריך 27/02/1973 בשעה 15:00","StartDate":"1973-02-27T15:00:00+02:00","FinishDate":"1973-02-27T18:42:00+02:00","IsSpecialMeeting":null,"LastUpdatedDate":"2024-01-03T10:25:01.78+02:00"}
{"Id":436242,"Number":399,"KnessetNum":7,"Name":"ישיבת מליאה בתאריך 28/02/1973 בשעה 11:00","StartDate":"1973-02-28T11:00:00+02:00","FinishDate":"1973-02-28T15:22:00+02:00","IsSpecialMeeting":null,"LastUpdatedDate":"2024-01-03T10:18:07.777+02:00"}
{"Id":436243,"Number":402,"KnessetNum":7,"Name":"ישיבת מליאה בתאריך 07/03/1973 בשעה 11:01","StartDate":"1973-03-07T11:01:00+02:00","FinishDate":"1973-03-07T14:07:00+02:00","IsSpecialMeeting":null,"LastUpdatedDate":"2021-04-12T15:22:19.913+03:00"}
{"Id":436245,"Number":403,"KnessetNum":7,"Name":"ישיבת מליאה בתאריך 12/03/1973 בשעה 16:02","StartDate":"1973-03-12T16:02:00+02:00","FinishDate":"1973-03-12T22:47:00+02:00","IsSpecialMeeting":null,"LastUpdatedDate":"2021-03-16T07:59:57.427+02:00"}
{"Id":436246,"Number":404,"KnessetNum":7,"Name":"ישיבת מליאה בתאריך 13/03/1973 בשעה 15:02","StartDate":"1973-03-13T15:02:00+02:00","FinishDate":"1973-03-13T20:49:00+02:00","IsSpecialMeeting":null,"LastUpdatedDate":"2021-03-16T08:54:38.55+02:00"}
{"Id":436247,"Number":405,"KnessetNum":7,"Name":"ישיבת מליאה בתאריך 14/03/1973 בשעה 11:02","StartDate":"1973-03-14T11:02:00+02:00","FinishDate":"1973-03-14T13:47:00+02:00","IsSpecialMeeting":null,"LastUpdatedDate":"2024-01-08T09:36:46.853+02:00"}
{"Id":436248,"Number":407,"KnessetNum":7,"Name":"ישיבת מליאה בתאריך 21/03/1973 בשעה 16:00","StartDate":"1973-03-21T16:00:00+02:00","FinishDate":"1973-03-21T19:27:00+02:00","IsSpecialMeeting":null,"LastUpdatedDate":"2021-03-16T14:33:51.707+02:00"}
{"Id":436249,"Number":408,"KnessetNum":7,"Name":"ישיבת מליאה בתאריך 22/03/1973 בשעה 11:01","StartDate":"1973-03-22T11:01:00+02:00","FinishDate":"1973-03-22T14:06:00+02:00","IsSpecialMeeting":null,"LastUpdatedDate":"2021-04-07T11:48:21.11+03:00"}
{"Id":436250,"Number":411,"KnessetNum":7,"Name":"ישיבת מליאה בתאריך 28/03/1973 בשעה 15:02","StartDate":"1973-03-28T15:02:00+02:00","FinishDate":"1973-03-29T03:40:00+02:00","IsSpecialMeeting":null,"LastUpdatedDate":"2021-06-02T14:03:58.493+03:00"}
{"Id":436251,"Number":419,"KnessetNum":7,"Name":"ישיבת מליאה בתאריך 11/04/1973 בשעה 09:02","StartDate":"1973-04-11T09:02:00+03:00","FinishDate":"1973-04-11T16:13:00+03:00","IsSpecialMeeting":null,"LastUpdatedDate":"2021-04-13T09:22:31.67+03:00"}
{"Id":436252,"Number":424,"KnessetNum":7,"Name":"ישיבת מליאה בתאריך 16/05/1973 בשעה 11:00","StartDate":"1973-05-16T11:00:00+03:00","FinishDate":"1973-05-16T14:17:00+03:00","IsSpecialMeeting":null,"LastUpdatedDate":"2021-04-13T13:40:02.073+03:00"}
{"Id":436253,"Number":425,"KnessetNum":7,"Name":"ישיבת מליאה בתאריך 21/05/1973 בשעה 16:02","StartDate":"1973-05-21T16:02:00+03:00","FinishDate":"1973-05-21T20:38:00+03:00","IsSpecialMeeting":null,"LastUpdatedDate":"2021-04-14T07:51:48.627+03:00"}
{"Id":436254,"Number":430,"KnessetNum":7,"Name":"ישיבת מליאה בתאריך 29/05/1973 בשעה 16:01","StartDate":"1973-05-29T16:01:00+03:00","FinishDate":"1973-05-29T18:12:00+03:00","IsSpecialMeeting":null,"LastUpdatedDate":"2021-06-03T09:51:23.68+03:00"}
{"Id":436255,"Number":431,"KnessetNum":7,"Name":"ישיבת מליאה בתאריך 30/05/1973 בשעה 11:03","StartDate":"1973-05-30T11:03:00+03:00","FinishDate":"1973-05-30T16:22:00+03:00","IsSpecialMeeting":null,"LastUpdatedDate":"2021-04-19T07:53:31.747+03:00"}
{"Id":436256,"Number":432,"KnessetNum":7,"Name":"ישיבת מליאה בתאריך 04/06/1973 בשעה 11:02","StartDate":"1973-06-04T11:02:00+03:00","FinishDate":"1973-06-04T18:27:00+03:00","IsSpecialMeeting":null,"LastUpdatedDate":"2021-04-19T09:02:26.007+03:00"}
{"Id":436257,"Number":433,"KnessetNum":7,"Name":"ישיבת מליאה בתאריך 07/06/1973 בשעה 11:03","StartDate":"1973-06-07T11:03:00+03:00","FinishDate":"1973-06-07T18:10:00+03:00","IsSpecialMeeting":null,"LastUpdatedDate":"2021-04-19T10:01:31.537+03:00"}
{"Id":436258,"Number":438,"KnessetNum":7,"Name":"ישיבת מליאה בתאריך 19/06/1973 בשעה 15:00","StartDate":"1973-06-19T15:00:00+03:00","FinishDate":"1973-06-19T21:35:00+03:00","IsSpecialMeeting":null,"LastUpdatedDate":"2023-02-20T12:27:29.587+02:00"}
{"Id":436259,"Number":439,"KnessetNum":7,"Name":"ישיבת מליאה בתאריך 20/06/1973 בשעה 11:01","StartDate":"1973-06-20T11:01:00+03:00","FinishDate":"1973-06-20T13:04:00+03:00","IsSpecialMeeting":null,"LastUpdatedDate":"2021-04-27T11:29:03.957+03:00"}
{"Id":436260,"Number":441,"KnessetNum":7,"Name":"ישיבת מליאה בתאריך 26/06/1973 בשעה 15:02","StartDate":"1973-06-26T15:02:00+03:00","FinishDate":"1973-06-26T19:58:00+03:00","IsSpecialMeeting":null,"LastUpdatedDate":"2021-04-27T12:51:21.737+03:00"}
{"Id":436261,"Number":442,"KnessetNum":7,"Name":"ישיבת מליאה בתאריך 27/06/1973 בשעה 11:00","StartDate":"1973-06-27T11:00:00+03:00","FinishDate":"1973-06-27T16:00:00+03:00","IsSpecialMeeting":null,"LastUpdatedDate":"2025-01-27T11:19:45.093+02:00"}
{"Id":436262,"Number":443,"KnessetNum":7,"Name":"ישיבת מליאה בתאריך 02/07/1973 בשעה 16:02","StartDate":"1973-07-02T16:02:00+03:00","FinishDate":"1973-07-02T20:00:00+03:00","IsSpecialMeeting":null,"LastUpdatedDate":"2025-01-27T11:32:01.677+02:00"}
{"Id":436263,"Number":444,"KnessetNum":7,"Name":"ישיבת מליאה בתאריך 03/07/1973 בשעה 15:01","StartDate":"1973-07-03T15:01:00+03:00","FinishDate":"1973-07-03T21:27:00+03:00","IsSpecialMeeting":null,"LastUpdatedDate":"2021-04-27T16:29:27.733+03:00"}
{"Id":436264,"Number":445,"KnessetNum":7,"Name":"ישיבת מליאה בתאריך 04/07/1973 בשעה 11:00","StartDate":"1973-07-04T11:00:00+03:00","FinishDate":"1973-07-04T14:40:00+03:00","IsSpecialMeeting":null,"LastUpdatedDate":"2021-04-29T09:55:35.797+03:00"}
{"Id":436265,"Number":452,"KnessetNum":7,"Name":"ישיבת מליאה בתאריך 17/07/1973 בשעה 15:03","StartDate":"1973-07-17T15:03:00+03:00","FinishDate":"1973-07-17T23:20:00+03:00","IsSpecialMeeting":null,"LastUpdatedDate":"2021-05-03T10:40:59.65+03:00"}
{"Id":436266,"Number":454,"KnessetNum":7,"Name":"ישיבת מליאה בתאריך 19/07/1973 בשעה 11:01","StartDate":"1973-07-19T11:01:00+03:00","FinishDate":"1973-07-19T15:35:00+03:00","IsSpecialMeeting":null,"LastUpdatedDate":"2019-12-16T13:53:22.167+02:00"}
{"Id":436267,"Number":455,"KnessetNum":7,"Name":"ישיבת מליאה בתאריך 23/07/1973 בשעה 16:03","StartDate":"1973-07-23T16:03:00+03:00","FinishDate":"1973-07-23T22:45:00+03:00","IsSpecialMeeting":null,"LastUpdatedDate":"2019-12-16T13:56:53.727+02:00"}
{"Id":436268,"Number":456,"KnessetNum":7,"Name":"ישיבת מליאה בתאריך 24/07/1973 בשעה 09:04","StartDate":"1973-07-24T09:04:00+03:00","FinishDate":"1973-07-24T20:35:00+03:00","IsSpecialMeeting":null,"LastUpdatedDate":"2021-05-03T16:39:00.53+03:00"}
{"Id":436270,"Number":458,"KnessetNum":7,"Name":"ישיבת מליאה בתאריך 17/09/1973 בשעה 11:04","StartDate":"1973-09-17T11:04:00+03:00","FinishDate":"1973-09-17T12:21:00+03:00","IsSpecialMeeting":null,"LastUpdatedDate":"2021-05-06T11:02:31.53+03:00"}
{"Id":436271,"Number":461,"KnessetNum":7,"Name":"ישיבת מליאה בתאריך 16/10/1973 בשעה 16:03","StartDate":"1973-10-16T16:03:00+02:00","FinishDate":"1973-10-16T22:00:00+02:00","IsSpecialMeeting":null,"LastUpdatedDate":"2021-05-06T11:55:51.623+03:00"}
{"Id":436272,"Number":463,"KnessetNum":7,"Name":"ישיבת מליאה בתאריך 24/10/1973 בשעה 10:45","StartDate":"1973-10-24T10:45:00+02:00","FinishDate":"1973-10-24T14:31:00+02:00","IsSpecialMeeting":null,"LastUpdatedDate":"2021-05-06T13:17:53.913+03:00"}
{"Id":436273,"Number":464,"KnessetNum":7,"Name":"ישיבת מליאה בתאריך 25/10/1973 בשעה 10:00","StartDate":"1973-10-25T10:00:00+02:00","FinishDate":"1973-10-25T16:58:00+02:00","IsSpecialMeeting":null,"LastUpdatedDate":"2021-02-11T09:04:01.15+02:00"}
{"Id":436274,"Number":467,"KnessetNum":7,"Name":"ישיבת מליאה בתאריך 14/11/1973 בשעה 09:02","StartDate":"1973-11-14T09:02:00+02:00","FinishDate":"1973-11-14T15:30:00+02:00","IsSpecialMeeting":null,"LastUpdatedDate":"2021-05-13T08:05:23.18+03:00"}
{"Id":436276,"Number":474,"KnessetNum":7,"Name":"ישיבת מליאה בתאריך 04/12/1973 בשעה 11:05","StartDate":"1973-12-04T11:05:00+02:00","FinishDate":"1973-12-04T14:40:00+02:00","IsSpecialMeeting":null,"LastUpdatedDate":"2021-05-13T09:54:57.397+03:00"}
{"Id":436278,"Number":13,"KnessetNum":8,"Name":"ישיבת מליאה בתאריך 19/02/1974 בשעה 16:03","StartDate":"1974-02-19T16:03:00+02:00","FinishDate":"1974-02-19T19:44:00+02:00","IsSpecialMeeting":null,"LastUpdatedDate":"2020-09-21T13:45:18.013+03:00"}
{"Id":436279,"Number":15,"KnessetNum":8,"Name":"ישיבת מליאה בתאריך 25/02/1974 בשעה 16:03","StartDate":"1974-02-25T16:03:00+02:00","FinishDate":"1974-02-25T20:05:00+02:00","IsSpecialMeeting":null,"LastUpdatedDate":"2021-05-18T17:35:52.76+03:00"}
{"Id":436280,"Number":16,"KnessetNum":8,"Name":"ישיבת מליאה בתאריך 26/02/1974 בשעה 16:00","StartDate":"1974-02-26T16:00:00+02:00","FinishDate":"1974-02-26T19:10:00+02:00","IsSpecialMeeting":null,"LastUpdatedDate":"2021-05-18T17:45:47.957+03:00"}
{"Id":436281,"Number":18,"KnessetNum":8,"Name":"ישיבת מליאה בתאריך 04/03/1974 בשעה 16:03","StartDate":"1974-03-04T16:03:00+02:00","FinishDate":"1974-03-04T18:45:00+02:00","IsSpecialMeeting":null,"LastUpdatedDate":"2021-05-18T22:24:53.623+03:00"}
{"Id":436282,"Number":19,"KnessetNum":8,"Name":"ישיבת מליאה בתאריך 05/03/1974 בשעה 16:04","StartDate":"1974-03-05T16:04:00+02:00","FinishDate":"1974-03-05T17:29:00+02:00","IsSpecialMeeting":null,"LastUpdatedDate":"2021-05-22T17:47:55.667+03:00"}
{"Id":436283,"Number":22,"KnessetNum":8,"Name":"ישיבת מליאה בתאריך 11/03/1974 בשעה 16:06","StartDate":"1974-03-11T16:06:00+02:00","FinishDate":"1974-03-11T16:53:00+02:00","IsSpecialMeeting":null,"LastUpdatedDate":"2021-05-22T17:54:39.747+03:00"}
{"Id":436284,"Number":23,"KnessetNum":8,"Name":"ישיבת מליאה בתאריך 12/03/1974 בשעה 16:01","StartDate":"1974-03-12T16:01:00+02:00","FinishDate":"1974-03-12T19:05:00+02:00","IsSpecialMeeting":null,"LastUpdatedDate":"2021-05-27T08:50:44.203+03:00"}
{"Id":436285,"Number":26,"KnessetNum":8,"Name":"ישיבת מליאה בתאריך 18/03/1974 בשעה 16:02","StartDate":"1974-03-18T16:02:00+02:00","FinishDate":"1974-03-18T19:21:00+02:00","IsSpecialMeeting":null,"LastUpdatedDate":"2019-12-26T09:45:16.193+02:00"}
{"Id":436286,"Number":31,"KnessetNum":8,"Name":"ישיבת מליאה בתאריך 26/03/1974 בשעה 15:00","StartDate":"1974-03-26T15:00:00+02:00","FinishDate":"1974-03-26T20:10:00+02:00","IsSpecialMeeting":null,"LastUpdatedDate":"2021-05-30T09:00:24.92+03:00"}
{"Id":436287,"Number":33,"KnessetNum":8,"Name":"ישיבת מליאה בתאריך 01/04/1974 בשעה 16:03","StartDate":"1974-04-01T16:03:00+02:00","FinishDate":"1974-04-01T20:50:00+02:00","IsSpecialMeeting":null,"LastUpdatedDate":"2021-05-30T10:24:22.297+03:00"}
{"Id":436288,"Number":34,"KnessetNum":8,"Name":"ישיבת מליאה בתאריך 02/04/1974 בשעה 16:03","StartDate":"1974-04-02T16:03:00+02:00","FinishDate":"1974-04-02T21:38:00+02:00","IsSpecialMeeting":null,"LastUpdatedDate":"2021-06-06T01:15:41.117+03:00"}
{"Id":436289,"Number":35,"KnessetNum":8,"Name":"ישיבת מליאה בתאריך 03/04/1974 בשעה 09:03","StartDate":"1974-04-03T09:03:00+03:00","FinishDate":"1974-04-03T10:18:00+03:00","IsSpecialMeeting":null,"LastUpdatedDate":"2021-05-30T09:09:27.237+03:00"}
{"Id":436290,"Number":44,"KnessetNum":8,"Name":"ישיבת מליאה בתאריך 13/05/1974 בשעה 16:03","StartDate":"1974-05-13T16:03:00+03:00","FinishDate":"1974-05-13T19:18:00+03:00","IsSpecialMeeting":null,"LastUpdatedDate":"2021-06-05T16:05:53.487+03:00"}
{"Id":436291,"Number":46,"KnessetNum":8,"Name":"ישיבת מליאה בתאריך 15/05/1974 בשעה 13:32","StartDate":"1974-05-15T13:32:00+03:00","FinishDate":"1974-05-15T13:56:00+03:00","IsSpecialMeeting":null,"LastUpdatedDate":"2021-06-06T00:20:15.043+03:00"}
{"Id":436292,"Number":56,"KnessetNum":8,"Name":"ישיבת מליאה בתאריך 10/06/1974 בשעה 16:02","StartDate":"1974-06-10T16:02:00+03:00","FinishDate":"1974-06-10T20:00:00+03:00","IsSpecialMeeting":null,"LastUpdatedDate":"2021-07-03T13:32:50.067+03:00"}
{"Id":436293,"Number":58,"KnessetNum":8,"Name":"ישיבת מליאה בתאריך 12/06/1974 בשעה 11:04","StartDate":"1974-06-12T11:04:00+03:00","FinishDate":"1974-06-12T13:40:00+03:00","IsSpecialMeeting":null,"LastUpdatedDate":"2021-07-03T14:32:47.843+03:00"}
{"Id":436294,"Number":61,"KnessetNum":8,"Name":"ישיבת מליאה בתאריך 19/06/1974 בשעה 11:03","StartDate":"1974-06-19T11:03:00+03:00","FinishDate":"1974-06-19T15:20:00+03:00","IsSpecialMeeting":null,"LastUpdatedDate":"2021-07-04T00:15:07.3+03:00"}
{"Id":436295,"Number":64,"KnessetNum":8,"Name":"ישיבת מליאה בתאריך 26/06/1974 בשעה 11:00","StartDate":"1974-06-26T11:00:00+03:00","FinishDate":"1974-06-27T01:22:00+03:00","IsSpecialMeeting":null,"LastUpdatedDate":"2021-07-04T03:41:52.047+03:00"}
{"Id":436296,"Number":65,"KnessetNum":8,"Name":"ישיבת מליאה בתאריך 01/07/1974 בשעה 16:03","StartDate":"1974-07-01T16:03:00+03:00","FinishDate":"1974-07-01T20:00:00+03:00","IsSpecialMeeting":null,"LastUpdatedDate":"2021-07-04T00:57:02.383+03:00"}
{"Id":436297,"Number":66,"KnessetNum":8,"Name":"ישיבת מליאה בתאריך 02/07/1974 בשעה 15:03","StartDate":"1974-07-02T15:03:00+03:00","FinishDate":"1974-07-02T19:04:00+03:00","IsSpecialMeeting":null,"LastUpdatedDate":"2021-07-04T01:38:15.85+03:00"}
{"Id":436298,"Number":68,"KnessetNum":8,"Name":"ישיבת מליאה בתאריך 08/07/1974 בשעה 16:04","StartDate":"1974-07-08T16:04:00+03:00","FinishDate":"1974-07-08T19:50:00+03:00","IsSpecialMeeting":null,"LastUpdatedDate":"2021-07-04T02:41:20.93+03:00"}
{"Id":436299,"Number":71,"KnessetNum":8,"Name":"ישיבת מליאה בתאריך 11/07/1974 בשעה 11:03","StartDate":"1974-07-11T11:03:00+03:00","FinishDate":"1974-07-11T15:23:00+03:00","IsSpecialMeeting":null,"LastUpdatedDate":"2021-07-04T03:38:04.063+03:00"}
{"Id":436300,"Number":73,"KnessetNum":8,"Name":"ישיבת מליאה בתאריך 16/07/1974 בשעה 16:02","StartDate":"1974-07-16T16:02:00+03:00","FinishDate":"1974-07-16T20:25:00+03:00","IsSpecialMeeting":null,"LastUpdatedDate":"2021-07-17T03:23:58.377+03:00"}
{"Id":436301,"Number":74,"KnessetNum":8,"Name":"ישיבת מליאה בתאריך 17/07/1974 בשעה 11:02","StartDate":"1974-07-17T11:02:00+03:00","FinishDate":"1974-07-17T17:00:00+03:00","IsSpecialMeeting":null,"LastUpdatedDate":"2021-07-17T04:20:51.05+03:00"}
{"Id":436303,"Number":75,"KnessetNum":8,"Name":"ישיבת מליאה בתאריך 22/07/1974 בשעה 16:04","StartDate":"1974-07-22T16:04:00+03:00","FinishDate":"1974-07-22T19:10:00+03:00","IsSpecialMeeting":null,"LastUpdatedDate":"2021-07-17T04:57:59.443+03:00"}
{"Id":436304,"Number":77,"KnessetNum":8,"Name":"ישיבת מליאה בתאריך 24/07/1974 בשעה 11:00","StartDate":"1974-07-24T11:00:00+03:00","FinishDate":"1974-07-24T15:07:00+03:00","IsSpecialMeeting":null,"LastUpdatedDate":"2021-08-09T19:41:44.34+03:00"}
{"Id":436305,"Number":81,"KnessetNum":8,"Name":"ישיבת מליאה בתאריך 31/07/1974 בשעה 11:01","StartDate":"1974-07-31T11:01:00+03:00","FinishDate":"1974-07-31T17:10:00+03:00","IsSpecialMeeting":null,"LastUpdatedDate":"2021-07-31T15:28:57.9+03:00"}
{"Id":436306,"Number":85,"KnessetNum":8,"Name":"ישיבת מליאה בתאריך 12/08/1974 בשעה 16:00","StartDate":"1974-08-12T16:00:00+03:00","FinishDate":"1974-08-12T19:06:00+03:00","IsSpecialMeeting":null,"LastUpdatedDate":"2021-09-01T03:01:06.253+03:00"}
{"Id":436307,"Number":86,"KnessetNum":8,"Name":"ישיבת מליאה בתאריך 13/08/1974 בשעה 13:00","StartDate":"1974-08-13T13:00:00+03:00","FinishDate":"1974-08-13T22:25:00+03:00","IsSpecialMeeting":null,"LastUpdatedDate":"2021-09-02T02:52:56.57+03:00"}
{"Id":436308,"Number":88,"KnessetNum":8,"Name":"ישיבת מליאה בתאריך 15/08/1974 בשעה 08:32","StartDate":"1974-08-15T08:32:00+03:00","FinishDate":"1974-08-15T16:47:00+03:00","IsSpecialMeeting":null,"LastUpdatedDate":"2025-05-20T14:30:49.91+03:00"}
{"Id":436310,"Number":96,"KnessetNum":8,"Name":"ישיבת מליאה בתאריך 22/10/1974 בשעה 16:01","StartDate":"1974-10-22T16:01:00+02:00","FinishDate":"1974-10-22T19:00:00+02:00","IsSpecialMeeting":null,"LastUpdatedDate":"2021-10-13T11:19:41.427+03:00"}
{"Id":436311,"Number":98,"KnessetNum":8,"Name":"ישיבת מליאה בתאריך 28/10/1974 בשעה 16:00","StartDate":"1974-10-28T16:00:00+02:00","FinishDate":"1974-10-28T20:10:00+02:00","IsSpecialMeeting":null,"LastUpdatedDate":"2021-10-13T18:19:18.93+03:00"}
{"Id":436312,"Number":99,"KnessetNum":8,"Name":"ישיבת מליאה בתאריך 29/10/1974 בשעה 16:00","StartDate":"1974-10-29T16:00:00+02:00","FinishDate":"1974-10-29T19:00:00+02:00","IsSpecialMeeting":null,"LastUpdatedDate":"2021-10-18T23:52:17.657+03:00"}
{"Id":436313,"Number":107,"KnessetNum":8,"Name":"ישיבת מליאה בתאריך 13/11/1974 בשעה 11:02","StartDate":"1974-11-13T11:02:00+02:00","FinishDate":"1974-11-13T13:17:00+02:00","IsSpecialMeeting":null,"LastUpdatedDate":"2021-10-13T23:32:21.737+03:00"}
{"Id":436314,"Number":108,"KnessetNum":8,"Name":"ישיבת מליאה בתאריך 18/11/1974 בשעה 16:03","StartDate":"1974-11-18T16:03:00+02:00","FinishDate":"1974-11-18T19:33:00+02:00","IsSpecialMeeting":null,"LastUpdatedDate":"2021-10-31T23:54:28.65+02:00"}
{"Id":436315,"Number":110,"KnessetNum":8,"Name":"ישיבת מליאה בתאריך 20/11/1974 בשעה 11:00","StartDate":"1974-11-20T11:00:00+02:00","FinishDate":"1974-11-20T13:18:00+02:00","IsSpecialMeeting":null,"LastUpdatedDate":"2021-10-19T00:07:49.553+03:00"}
{"Id":436316,"Number":112,"KnessetNum":8,"Name":"ישיבת מליאה בתאריך 26/11/1974 בשעה 15:03","StartDate":"1974-11-26T15:03:00+02:00","FinishDate":"1974-11-26T20:43:00+02:00","IsSpecialMeeting":null,"LastUpdatedDate":"2021-10-26T09:53:54.613+03:00"}
{"Id":436317,"Number":114,"KnessetNum":8,"Name":"ישיבת מליאה בתאריך 02/12/1974 בשעה 16:03","StartDate":"1974-12-02T16:03:00+02:00","FinishDate":"1974-12-02T19:29:00+02:00","IsSpecialMeeting":null,"LastUpdatedDate":"2021-10-27T00:12:58.657+03:00"}
{"Id":436318,"Number":116,"KnessetNum":8,"Name":"ישיבת מליאה בתאריך 04/12/1974 בשעה 11:03","StartDate":"1974-12-04T11:03:00+02:00","FinishDate":"1974-12-04T15:47:00+02:00","IsSpecialMeeting":null,"LastUpdatedDate":"2021-10-31T19:18:35.503+02:00"}
{"Id":436319,"Number":117,"KnessetNum":8,"Name":"ישיבת מליאה בתאריך 09/12/1974 בשעה 16:03","StartDate":"1974-12-09T16:03:00+02:00","FinishDate":"1974-12-09T18:18:00+02:00","IsSpecialMeeting":null,"LastUpdatedDate":"2021-11-04T10:27:24.863+02:00"}
{"Id":436320,"Number":118,"KnessetNum":8,"Name":"ישיבת מליאה בתאריך 10/12/1974 בשעה 16:01","StartDate":"1974-12-10T16:01:00+02:00","FinishDate":"1974-12-10T19:00:00+02:00","IsSpecialMeeting":null,"LastUpdatedDate":"2021-10-27T00:20:18.273+03:00"}
{"Id":436321,"Number":120,"KnessetNum":8,"Name":"ישיבת מליאה בתאריך 16/12/1974 בשעה 16:03","StartDate":"1974-12-16T16:03:00+02:00","FinishDate":"1974-12-16T20:01:00+02:00","IsSpecialMeeting":null,"LastUpdatedDate":"2021-11-15T22:05:06.897+02:00"}
{"Id":436322,"Number":121,"KnessetNum":8,"Name":"ישיבת מליאה בתאריך 17/12/1974 בשעה 16:03","StartDate":"1974-12-17T16:03:00+02:00","FinishDate":"1974-12-17T19:39:00+02:00","IsSpecialMeeting":null,"LastUpdatedDate":"2021-11-06T07:54:32.337+02:00"}
{"Id":436323,"Number":124,"KnessetNum":8,"Name":"ישיבת מליאה בתאריך 24/12/1974 בשעה 16:04","StartDate":"1974-12-24T16:04:00+02:00","FinishDate":"1974-12-24T20:19:00+02:00","IsSpecialMeeting":null,"LastUpdatedDate":"2021-11-06T09:44:06.357+02:00"}
{"Id":436324,"Number":132,"KnessetNum":8,"Name":"ישיבת מליאה בתאריך 13/01/1975 בשעה 16:03","StartDate":"1975-01-13T16:03:00+02:00","FinishDate":"1975-01-13T19:55:00+02:00","IsSpecialMeeting":null,"LastUpdatedDate":"2021-11-20T02:03:18.767+02:00"}
{"Id":436325,"Number":133,"KnessetNum":8,"Name":"ישיבת מליאה בתאריך 14/01/1975 בשעה 16:00","StartDate":"1975-01-14T16:00:00+02:00","FinishDate":"1975-01-14T20:37:00+02:00","IsSpecialMeeting":null,"LastUpdatedDate":"2021-11-24T02:26:34.983+02:00"}
{"Id":436326,"Number":134,"KnessetNum":8,"Name":"ישיבת מליאה בתאריך 15/01/1975 בשעה 11:00","StartDate":"1975-01-15T11:00:00+02:00","FinishDate":"1975-01-15T14:40:00+02:00","IsSpecialMeeting":null,"LastUpdatedDate":"2025-06-09T14:21:39.983+03:00"}
{"Id":436327,"Number":135,"KnessetNum":8,"Name":"ישיבת מליאה בתאריך 20/01/1975 בשעה 16:04","StartDate":"1975-01-20T16:04:00+02:00","FinishDate":"1975-01-20T20:53:00+02:00","IsSpecialMeeting":null,"LastUpdatedDate":"2021-12-12T01:16:56.47+02:00"}
{"Id":436328,"Number":136,"KnessetNum":8,"Name":"ישיבת מליאה בתאריך 21/01/1975 בשעה 15:03","StartDate":"1975-01-21T15:03:00+02:00","FinishDate":"1975-01-21T20:52:00+02:00","IsSpecialMeeting":null,"LastUpdatedDate":"2021-11-20T02:51:06.943+02:00"}
{"Id":436329,"Number":138,"KnessetNum":8,"Name":"ישיבת מליאה בתאריך 27/01/1975 בשעה 16:02","StartDate":"1975-01-27T16:02:00+02:00","FinishDate":"1975-01-27T18:23:00+02:00","IsSpecialMeeting":null,"LastUpdatedDate":"2021-11-20T03:02:52.297+02:00"}
{"Id":436331,"Number":148,"KnessetNum":8,"Name":"ישיבת מליאה בתאריך 17/02/1975 בשעה 16:04","StartDate":"1975-02-17T16:04:00+02:00","FinishDate":"1975-02-17T19:47:00+02:00","IsSpecialMeeting":null,"LastUpdatedDate":"2021-12-21T00:59:45.12+02:00"}
{"Id":436332,"Number":149,"KnessetNum":8,"Name":"ישיבת מליאה בתאריך 18/02/1975 בשעה 15:02","StartDate":"1975-02-18T15:02:00+02:00","FinishDate":"1975-02-18T19:14:00+02:00","IsSpecialMeeting":null,"LastUpdatedDate":"2021-12-20T23:18:44.593+02:00"}
{"Id":436333,"Number":150,"KnessetNum":8,"Name":"ישיבת מליאה בתאריך 19/02/1975 בשעה 11:05","StartDate":"1975-02-19T11:05:00+02:00","FinishDate":"1975-02-19T15:10:00+02:00","IsSpecialMeeting":null,"LastUpdatedDate":"2021-12-20T22:58:24.903+02:00"}
{"Id":436334,"Number":151,"KnessetNum":8,"Name":"ישיבת מליאה בתאריך 24/02/1975 בשעה 10:04","StartDate":"1975-02-24T10:04:00+02:00","FinishDate":"1975-02-24T14:50:00+02:00","IsSpecialMeeting":null,"LastUpdatedDate":"2021-12-20T02:06:35.367+02:00"}
{"Id":436335,"Number":154,"KnessetNum":8,"Name":"ישיבת מליאה בתאריך 04/03/1975 בשעה 15:00","StartDate":"1975-03-04T15:00:00+02:00","FinishDate":"1975-03-04T18:53:00+02:00","IsSpecialMeeting":null,"LastUpdatedDate":"2021-12-21T00:11:49.907+02:00"}
{"Id":436336,"Number":167,"KnessetNum":8,"Name":"ישיבת מליאה בתאריך 30/04/1975 בשעה 11:03","StartDate":"1975-04-30T11:03:00+03:00","FinishDate":"1975-04-30T14:38:00+03:00","IsSpecialMeeting":null,"LastUpdatedDate":"2025-06-09T14:40:47.14+03:00"}
{"Id":436337,"Number":168,"KnessetNum":8,"Name":"ישיבת מליאה בתאריך 05/05/1975 בשעה 16:03","StartDate":"1975-05-05T16:03:00+03:00","FinishDate":"1975-05-05T19:14:00+03:00","IsSpecialMeeting":null,"LastUpdatedDate":"2021-12-27T11:12:44.647+02:00"}
{"Id":436338,"Number":174,"KnessetNum":8,"Name":"ישיבת מליאה בתאריך 19/05/1975 בשעה 16:02","StartDate":"1975-05-19T16:02:00+03:00","FinishDate":"1975-05-19T21:34:00+03:00","IsSpecialMeeting":null,"LastUpdatedDate":"2022-01-07T03:00:38.023+02:00"}
{"Id":436339,"Number":176,"KnessetNum":8,"Name":"ישיבת מליאה בתאריך 21/05/1975 בשעה 11:01","StartDate":"1975-05-21T11:01:00+03:00","FinishDate":"1975-05-21T13:10:00+03:00","IsSpecialMeeting":null,"LastUpdatedDate":"2024-07-25T09:33:22.6+03:00"}
{"Id":436340,"Number":179,"KnessetNum":8,"Name":"ישיבת מליאה בתאריך 28/05/1975 בשעה 11:04","StartDate":"1975-05-28T11:04:00+03:00","FinishDate":"1975-05-28T14:22:00+03:00","IsSpecialMeeting":null,"LastUpdatedDate":"2022-01-13T02:29:41.337+02:00"}
{"Id":436341,"Number":183,"KnessetNum":8,"Name":"ישיבת מליאה בתאריך 09/06/1975 בשעה 16:02","StartDate":"1975-06-09T16:02:00+03:00","FinishDate":"1975-06-09T20:04:00+03:00","IsSpecialMeeting":null,"LastUpdatedDate":"2019-12-26T12:31:28.617+02:00"}
{"Id":436342,"Number":184,"KnessetNum":8,"Name":"ישיבת מליאה בתאריך 10/06/1975 בשעה 15:00","StartDate":"1975-06-10T15:00:00+03:00","FinishDate":"1975-06-10T20:37:00+03:00","IsSpecialMeeting":null,"LastUpdatedDate":"2022-01-22T01:54:32.113+02:00"}
{"Id":436343,"Number":185,"KnessetNum":8,"Name":"ישיבת מליאה בתאריך 11/06/1975 בשעה 10:01","StartDate":"1975-06-11T10:01:00+03:00","FinishDate":"1975-06-11T13:20:00+03:00","IsSpecialMeeting":null,"LastUpdatedDate":"2022-01-22T03:00:35.173+02:00"}
{"Id":436344,"Number":186,"KnessetNum":8,"Name":"ישיבת מליאה בתאריך 16/06/1975 בשעה 16:02","StartDate":"1975-06-16T16:02:00+03:00","FinishDate":"1975-06-16T19:50:00+03:00","IsSpecialMeeting":null,"LastUpdatedDate":"2022-01-26T03:32:36.963+02:00"}
{"Id":436345,"Number":188,"KnessetNum":8,"Name":"ישיבת מליאה בתאריך 18/06/1975 בשעה 11:00","StartDate":"1975-06-18T11:00:00+03:00","FinishDate":"1975-06-18T13:33:00+03:00","IsSpecialMeeting":null,"LastUpdatedDate":"2022-02-07T16:17:10.217+02:00"}
{"Id":436346,"Number":191,"KnessetNum":8,"Name":"ישיבת מליאה בתאריך 25/06/1975 בשעה 11:03","StartDate":"1975-06-25T11:03:00+03:00","FinishDate":"1975-06-25T13:59:00+03:00","IsSpecialMeeting":null,"LastUpdatedDate":"2022-02-07T16:39:20.493+02:00"}
{"Id":436347,"Number":192,"KnessetNum":8,"Name":"ישיבת מליאה בתאריך 30/06/1975 בשעה 10:03","StartDate":"1975-06-30T10:03:00+03:00","FinishDate":null,"IsSpecialMeeting":null,"LastUpdatedDate":"2022-02-09T01:32:02.813+02:00"}
{"Id":436348,"Number":193,"KnessetNum":8,"Name":"ישיבת מליאה בתאריך 01/07/1975 בשעה 15:04","StartDate":"1975-07-01T15:04:00+03:00","FinishDate":"1975-07-01T18:45:00+03:00","IsSpecialMeeting":null,"LastUpdatedDate":"2022-02-10T23:53:02.367+02:00"}
{"Id":436349,"Number":194,"KnessetNum":8,"Name":"ישיבת מליאה בתאריך 02/07/1975 בשעה 11:02","StartDate":"1975-07-02T11:02:00+03:00","FinishDate":"1975-07-02T15:54:00+03:00","IsSpecialMeeting":null,"LastUpdatedDate":"2022-02-22T12:07:50.287+02:00"}
{"Id":436350,"Number":196,"KnessetNum":8,"Name":"ישיבת מליאה בתאריך 08/07/1975 בשעה 15:10","StartDate":"1975-07-08T15:10:00+03:00","FinishDate":"1975-07-08T22:15:00+03:00","IsSpecialMeeting":null,"LastUpdatedDate":"2022-02-23T01:32:11.293+02:00"}
{"Id":436351,"Number":197,"KnessetNum":8,"Name":"ישיבת מליאה בתאריך 09/07/1975 בשעה 11:03","StartDate":"1975-07-09T11:03:00+03:00","FinishDate":"1975-07-09T14:00:00+03:00","IsSpecialMeeting":null,"LastUpdatedDate":"2022-02-26T03:29:42.107+02:00"}
{"Id":436352,"Number":198,"KnessetNum":8,"Name":"ישיבת מליאה בתאריך 10/07/1975 בשעה 10:01","StartDate":"1975-07-10T10:01:00+03:00","FinishDate":"1975-07-10T15:25:00+03:00","IsSpecialMeeting":null,"LastUpdatedDate":"2022-02-23T01:57:28.193+02:00"}
{"Id":436353,"Number":200,"KnessetNum":8,"Name":"ישיבת מליאה בתאריך 15/07/1975 בשעה 15:01","StartDate":"1975-07-15T15:01:00+03:00","FinishDate":"1975-07-15T20:42:00+03:00","IsSpecialMeeting":null,"LastUpdatedDate":"2022-02-26T01:22:39.167+02:00"}
{"Id":436354,"Number":203,"KnessetNum":8,"Name":"ישיבת מליאה בתאריך 22/07/1975 בשעה 15:11","StartDate":"1975-07-22T15:11:00+03:00","FinishDate":"1975-07-22T21:08:00+03:00","IsSpecialMeeting":null,"LastUpdatedDate":"2022-02-26T02:36:05.01+02:00"}
{"Id":436355,"Number":204,"KnessetNum":8,"Name":"ישיבת מליאה בתאריך 23/07/1975 בשעה 11:01","StartDate":"1975-07-23T11:01:00+03:00","FinishDate":"1975-07-23T17:35:00+03:00","IsSpecialMeeting":null,"LastUpdatedDate":"2022-02-26T02:59:25.6+02:00"}
{"Id":436356,"Number":205,"KnessetNum":8,"Name":"ישיבת מליאה בתאריך 28/07/1975 בשעה 16:03","StartDate":"1975-07-28T16:03:00+03:00","FinishDate":"1975-07-28T21:12:00+03:00","IsSpecialMeeting":null,"LastUpdatedDate":"2022-02-24T10:00:31.81+02:00"}
{"Id":436357,"Number":207,"KnessetNum":8,"Name":"ישיבת מליאה בתאריך 30/07/1975 בשעה 09:01","StartDate":"1975-07-30T09:01:00+03:00","FinishDate":"1975-07-30T14:15:00+03:00","IsSpecialMeeting":null,"LastUpdatedDate":"2022-01-17T01:54:03.46+02:00"}
{"Id":436359,"Number":215,"KnessetNum":8,"Name":"ישיבת מליאה בתאריך 21/10/1975 בשעה 16:01","StartDate":"1975-10-21T16:01:00+02:00","FinishDate":"1975-10-21T18:15:00+02:00","IsSpecialMeeting":null,"LastUpdatedDate":"2022-02-27T00:57:20.82+02:00"}
{"Id":436360,"Number":217,"KnessetNum":8,"Name":"ישיבת מליאה בתאריך 27/10/1975 בשעה 16:03","StartDate":"1975-10-27T16:03:00+02:00","FinishDate":"1975-10-27T20:02:00+02:00","IsSpecialMeeting":null,"LastUpdatedDate":"2025-05-20T14:51:48.727+03:00"}
{"Id":436361,"Number":218,"KnessetNum":8,"Name":"ישיבת מליאה בתאריך 28/10/1975 בשעה 16:00","StartDate":"1975-10-28T16:00:00+02:00","FinishDate":"1975-10-28T19:45:00+02:00","IsSpecialMeeting":null,"LastUpdatedDate":"2022-02-28T12:47:31.993+02:00"}
{"Id":436362,"Number":223,"KnessetNum":8,"Name":"ישיבת מליאה בתאריך 10/11/1975 בשעה 16:03","StartDate":"1975-11-10T16:03:00+02:00","FinishDate":"1975-11-10T18:24:00+02:00","IsSpecialMeeting":null,"LastUpdatedDate":"2022-02-28T11:04:52.277+02:00"}
{"Id":436363,"Number":226,"KnessetNum":8,"Name":"ישיבת מליאה בתאריך 17/11/1975 בשעה 16:01","StartDate":"1975-11-17T16:01:00+02:00","FinishDate":"1975-11-17T20:13:00+02:00","IsSpecialMeeting":null,"LastUpdatedDate":"2022-03-03T12:02:34.093+02:00"}
{"Id":436364,"Number":227,"KnessetNum":8,"Name":"ישיבת מליאה בתאריך 18/11/1975 בשעה 16:03","StartDate":"1975-11-18T16:03:00+02:00","FinishDate":"1975-11-18T19:55:00+02:00","IsSpecialMeeting":null,"LastUpdatedDate":"2022-03-03T12:31:32.397+02:00"}
{"Id":436365,"Number":229,"KnessetNum":8,"Name":"ישיבת מליאה בתאריך 24/11/1975 בשעה 16:02","StartDate":"1975-11-24T16:02:00+02:00","FinishDate":"1975-11-24T19:15:00+02:00","IsSpecialMeeting":null,"LastUpdatedDate":"2022-03-03T12:30:42.97+02:00"}
{"Id":436366,"Number":230,"KnessetNum":8,"Name":"ישיבת מליאה בתאריך 25/11/1975 בשעה 16:02","StartDate":"1975-11-25T16:02:00+02:00","FinishDate":"1975-11-25T16:43:00+02:00","IsSpecialMeeting":null,"LastUpdatedDate":"2022-03-11T00:59:36.72+02:00"}
{"Id":436367,"Number":235,"KnessetNum":8,"Name":"ישיבת מליאה בתאריך 08/12/1975 בשעה 16:02","StartDate":"1975-12-08T16:02:00+02:00","FinishDate":"1975-12-08T20:19:00+02:00","IsSpecialMeeting":null,"LastUpdatedDate":"2022-03-16T09:18:31.493+02:00"}
{"Id":436368,"Number":239,"KnessetNum":8,"Name":"ישיבת מליאה בתאריך 16/12/1975 בשעה 16:03","StartDate":"1975-12-16T16:03:00+02:00","FinishDate":"1975-12-16T20:35:00+02:00","IsSpecialMeeting":null,"LastUpdatedDate":"2022-03-18T07:57:51.95+02:00"}
{"Id":436369,"Number":240,"KnessetNum":8,"Name":"ישיבת מליאה בתאריך 17/12/1975 בשעה 11:02","StartDate":"1975-12-17T11:02:00+02:00","FinishDate":"1975-12-17T14:01:00+02:00","IsSpecialMeeting":null,"LastUpdatedDate":"2022-03-19T23:35:15.037+02:00"}
{"Id":436370,"Number":242,"KnessetNum":8,"Name":"ישיבת מליאה בתאריך 23/12/1975 בשעה 16:05","StartDate":"1975-12-23T16:05:00+02:00","FinishDate":"1975-12-23T18:02:00+02:00","IsSpecialMeeting":null,"LastUpdatedDate":"2022-03-20T00:27:41.633+02:00"}
{"Id":436371,"Number":243,"KnessetNum":8,"Name":"ישיבת מליאה בתאריך 24/12/1975 בשעה 11:04","StartDate":"1975-12-24T11:04:00+02:00","FinishDate":"1975-12-24T15:34:00+02:00","IsSpecialMeeting":null,"LastUpdatedDate":"2022-03-20T00:37:50.583+02:00"}
{"Id":436372,"Number":244,"KnessetNum":8,"Name":"ישיבת מליאה בתאריך 29/12/1975 בשעה 16:03","StartDate":"1975-12-29T16:03:00+02:00","FinishDate":"1975-12-29T21:24:00+02:00","IsSpecialMeeting":null,"LastUpdatedDate":"2022-03-20T00:43:21.59+02:00"}
{"Id":436373,"Number":245,"KnessetNum":8,"Name":"ישיבת מליאה בתאריך 30/12/1975 בשעה 16:01","StartDate":"1975-12-30T16:01:00+02:00","FinishDate":"1975-12-30T20:25:00+02:00","IsSpecialMeeting":null,"LastUpdatedDate":"2022-03-20T01:41:19.373+02:00"}
{"Id":436374,"Number":246,"KnessetNum":8,"Name":"ישיבת מליאה בתאריך 31/12/1975 בשעה 11:02","StartDate":"1975-12-31T11:02:00+02:00","FinishDate":"1975-12-31T13:50:00+02:00","IsSpecialMeeting":null,"LastUpdatedDate":"2022-03-20T22:42:14.68+02:00"}
{"Id":436375,"Number":247,"KnessetNum":8,"Name":"ישיבת מליאה בתאריך 05/01/1976 בשעה 16:03","StartDate":"1976-01-05T16:03:00+02:00","FinishDate":"1976-01-05T18:26:00+02:00","IsSpecialMeeting":null,"LastUpdatedDate":"2022-03-20T11:19:19+02:00"}
{"Id":436376,"Number":248,"KnessetNum":8,"Name":"ישיבת מליאה בתאריך 06/01/1976 בשעה 16:01","StartDate":"1976-01-06T16:01:00+02:00","FinishDate":"1976-01-06T20:30:00+02:00","IsSpecialMeeting":null,"LastUpdatedDate":"2022-03-20T10:16:53.157+02:00"}
{"Id":436377,"Number":249,"KnessetNum":8,"Name":"ישיבת מליאה בתאריך 07/01/1976 בשעה 11:03","StartDate":"1976-01-07T11:03:00+02:00","FinishDate":"1976-01-07T14:05:00+02:00","IsSpecialMeeting":null,"LastUpdatedDate":"2022-03-20T11:27:49.237+02:00"}
{"Id":436378,"Number":251,"KnessetNum":8,"Name":"ישיבת מליאה בתאריך 13/01/1976 בשעה 16:04","StartDate":"1976-01-13T16:04:00+02:00","FinishDate":"1976-01-13T19:53:00+02:00","IsSpecialMeeting":null,"LastUpdatedDate":"2022-03-20T23:58:52.887+02:00"}
{"Id":436379,"Number":252,"KnessetNum":8,"Name":"ישיבת מליאה בתאריך 14/01/1976 בשעה 16:01","StartDate":"1976-01-14T16:01:00+02:00","FinishDate":"1976-01-14T19:41:00+02:00","IsSpecialMeeting":null,"LastUpdatedDate":"2022-03-21T00:57:50.423+02:00"}
{"Id":436380,"Number":253,"KnessetNum":8,"Name":"ישיבת מליאה בתאריך 19/01/1976 בשעה 16:04","StartDate":"1976-01-19T16:04:00+02:00","FinishDate":"1976-01-19T19:14:00+02:00","IsSpecialMeeting":null,"LastUpdatedDate":"2022-03-31T02:57:02.333+03:00"}
{"Id":436381,"Number":254,"KnessetNum":8,"Name":"ישיבת מליאה בתאריך 20/01/1976 בשעה 15:02","StartDate":"1976-01-20T15:02:00+02:00","FinishDate":"1976-01-20T21:02:00+02:00","IsSpecialMeeting":null,"LastUpdatedDate":"2022-03-21T01:12:35.47+02:00"}
{"Id":436382,"Number":256,"KnessetNum":8,"Name":"ישיבת מליאה בתאריך 26/01/1976 בשעה 16:04","StartDate":"1976-01-26T16:04:00+02:00","FinishDate":"1976-01-26T20:30:00+02:00","IsSpecialMeeting":null,"LastUpdatedDate":"2022-03-28T09:35:07.25+03:00"}
{"Id":436383,"Number":258,"KnessetNum":8,"Name":"ישיבת מליאה בתאריך 28/01/1976 בשעה 11:02","StartDate":"1976-01-28T11:02:00+02:00","FinishDate":"1976-01-28T14:40:00+02:00","IsSpecialMeeting":null,"LastUpdatedDate":"2022-03-28T12:11:45.293+03:00"}
{"Id":436385,"Number":263,"KnessetNum":8,"Name":"ישיבת מליאה בתאריך 10/02/1976 בשעה 16:02","StartDate":"1976-02-10T16:02:00+02:00","FinishDate":"1976-02-10T19:40:00+02:00","IsSpecialMeeting":null,"LastUpdatedDate":"2022-04-04T00:35:51.787+03:00"}
{"Id":436386,"Number":266,"KnessetNum":8,"Name":"ישיבת מליאה בתאריך 17/02/1976 בשעה 16:03","StartDate":"1976-02-17T16:03:00+02:00","FinishDate":"1976-02-17T20:53:00+02:00","IsSpecialMeeting":null,"LastUpdatedDate":"2022-04-03T23:41:56.99+03:00"}
{"Id":436387,"Number":269,"KnessetNum":8,"Name":"ישיבת מליאה בתאריך 24/02/1976 בשעה 14:03","StartDate":"1976-02-24T14:03:00+02:00","FinishDate":"1976-02-24T19:13:00+02:00","IsSpecialMeeting":null,"LastUpdatedDate":"2022-04-10T02:33:12.767+03:00"}
{"Id":436388,"Number":284,"KnessetNum":8,"Name":"ישיבת מליאה בתאריך 31/03/1976 בשעה 09:00","StartDate":"1976-03-31T09:00:00+02:00","FinishDate":"1976-03-31T17:01:00+02:00","IsSpecialMeeting":null,"LastUpdatedDate":"2023-02-20T08:14:18.75+02:00"}
{"Id":436390,"Number":289,"KnessetNum":8,"Name":"ישיבת מליאה בתאריך 10/05/1976 בשעה 16:02","StartDate":"1976-05-10T16:02:00+03:00","FinishDate":"1976-05-10T19:43:00+03:00","IsSpecialMeeting":null,"LastUpdatedDate":"2022-05-02T02:26:54.89+03:00"}
{"Id":436391,"Number":294,"KnessetNum":8,"Name":"ישיבת מליאה בתאריך 19/05/1976 בשעה 11:04","StartDate":"1976-05-19T11:04:00+03:00","FinishDate":"1976-05-19T14:35:00+03:00","IsSpecialMeeting":null,"LastUpdatedDate":"2022-05-03T01:20:14.653+03:00"}
{"Id":436392,"Number":295,"KnessetNum":8,"Name":"ישיבת מליאה בתאריך 24/05/1976 בשעה 16:00","StartDate":"1976-05-24T16:00:00+03:00","FinishDate":"1976-05-24T19:17:00+03:00","IsSpecialMeeting":null,"LastUpdatedDate":"2022-05-03T01:26:54.833+03:00"}
{"Id":436393,"Number":297,"KnessetNum":8,"Name":"ישיבת מליאה בתאריך 26/05/1976 בשעה 11:03","StartDate":"1976-05-26T11:03:00+03:00","FinishDate":"1976-05-26T13:14:00+03:00","IsSpecialMeeting":null,"LastUpdatedDate":"2025-06-25T15:05:43.62+03:00"}
{"Id":436394,"Number":298,"KnessetNum":8,"Name":"ישיבת מליאה בתאריך 31/05/1976 בשעה 16:01","StartDate":"1976-05-31T16:01:00+03:00","FinishDate":"1976-05-31T19:35:00+03:00","IsSpecialMeeting":null,"LastUpdatedDate":"2022-05-20T02:18:52.76+03:00"}
{"Id":436395,"Number":307,"KnessetNum":8,"Name":"ישיבת מליאה בתאריך 21/06/1976 בשעה 16:04","StartDate":"1976-06-21T16:04:00+03:00","FinishDate":"1976-06-21T19:51:00+03:00","IsSpecialMeeting":null,"LastUpdatedDate":"2022-06-06T00:59:13.977+03:00"}
{"Id":436396,"Number":308,"KnessetNum":8,"Name":"ישיבת מליאה בתאריך 22/06/1976 בשעה 16:00","StartDate":"1976-06-22T16:00:00+03:00","FinishDate":"1976-06-22T19:12:00+03:00","IsSpecialMeeting":null,"LastUpdatedDate":"2022-05-31T00:17:51.93+03:00"}
{"Id":436397,"Number":309,"KnessetNum":8,"Name":"ישיבת מליאה בתאריך 23/06/1976 בשעה 11:04","StartDate":"1976-06-23T11:04:00+03:00","FinishDate":"1976-06-23T15:54:00+03:00","IsSpecialMeeting":null,"LastUpdatedDate":"2022-05-30T23:57:26.777+03:00"}
{"Id":436398,"Number":310,"KnessetNum":8,"Name":"ישיבת מליאה בתאריך 28/06/1976 בשעה 16:04","StartDate":"1976-06-28T16:04:00+03:00","FinishDate":"1976-06-28T19:38:00+03:00","IsSpecialMeeting":null,"LastUpdatedDate":"2022-05-30T23:34:15.72+03:00"}
{"Id":436399,"Number":311,"KnessetNum":8,"Name":"ישיבת מליאה בתאריך 29/06/1976 בשעה 11:05","StartDate":"1976-06-29T11:05:00+03:00","FinishDate":"1976-06-29T20:50:00+03:00","IsSpecialMeeting":null,"LastUpdatedDate":"2022-05-31T00:27:36.683+03:00"}
{"Id":436400,"Number":312,"KnessetNum":8,"Name":"ישיבת מליאה בתאריך 30/06/1976 בשעה 11:01","StartDate":"1976-06-30T11:01:00+03:00","FinishDate":"1976-06-30T14:17:00+03:00","IsSpecialMeeting":null,"LastUpdatedDate":"2022-06-02T00:46:03.19+03:00"}
{"Id":436401,"Number":314,"KnessetNum":8,"Name":"ישיבת מליאה בתאריך 05/07/1976 בשעה 16:04","StartDate":"1976-07-05T16:04:00+03:00","FinishDate":"1976-07-05T20:17:00+03:00","IsSpecialMeeting":null,"LastUpdatedDate":"2022-06-06T02:34:58.75+03:00"}
{"Id":436402,"Number":315,"KnessetNum":8,"Name":"ישיבת מליאה בתאריך 06/07/1976 בשעה 16:03","StartDate":"1976-07-06T16:03:00+03:00","FinishDate":"1976-07-06T20:00:00+03:00","IsSpecialMeeting":null,"LastUpdatedDate":"2022-05-31T00:44:55.477+03:00"}
{"Id":436403,"Number":317,"KnessetNum":8,"Name":"ישיבת מליאה בתאריך 12/07/1976 בשעה 16:02","StartDate":"1976-07-12T16:02:00+03:00","FinishDate":"1976-07-12T18:48:00+03:00","IsSpecialMeeting":null,"LastUpdatedDate":"2022-06-06T01:38:15.903+03:00"}
{"Id":436404,"Number":318,"KnessetNum":8,"Name":"ישיבת מליאה בתאריך 13/07/1976 בשעה 16:03","StartDate":"1976-07-13T16:03:00+03:00","FinishDate":"1976-07-13T19:11:00+03:00","IsSpecialMeeting":null,"LastUpdatedDate":"2022-06-06T02:34:18.06+03:00"}
{"Id":436405,"Number":319,"KnessetNum":8,"Name":"ישיבת מליאה בתאריך 14/07/1976 בשעה 11:00","StartDate":"1976-07-14T11:00:00+03:00","FinishDate":"1976-07-14T15:12:00+03:00","IsSpecialMeeting":null,"LastUpdatedDate":"2022-06-14T01:35:42.127+03:00"}
{"Id":436406,"Number":320,"KnessetNum":8,"Name":"ישיבת מליאה בתאריך 19/07/1976 בשעה 16:03","StartDate":"1976-07-19T16:03:00+03:00","FinishDate":"1976-07-19T21:59:00+03:00","IsSpecialMeeting":null,"LastUpdatedDate":"2022-06-14T02:07:56.313+03:00"}
{"Id":436407,"Number":321,"KnessetNum":8,"Name":"ישיבת מליאה בתאריך 20/07/1976 בשעה 16:02","StartDate":"1976-07-20T16:02:00+03:00","FinishDate":"1976-07-20T21:01:00+03:00","IsSpecialMeeting":null,"LastUpdatedDate":"2022-06-15T23:47:05.6+03:00"}
{"Id":436408,"Number":322,"KnessetNum":8,"Name":"ישיבת מליאה בתאריך 21/07/1976 בשעה 11:04","StartDate":"1976-07-21T11:04:00+03:00","FinishDate":"1976-07-21T16:12:00+03:00","IsSpecialMeeting":null,"LastUpdatedDate":"2022-06-16T12:55:10.5+03:00"}
{"Id":436409,"Number":344,"KnessetNum":8,"Name":"ישיבת מליאה בתאריך 15/11/1976 בשעה 16:04","StartDate":"1976-11-15T16:04:00+02:00","FinishDate":"1976-11-15T18:53:00+02:00","IsSpecialMeeting":null,"LastUpdatedDate":"2022-09-01T02:48:28.773+03:00"}
{"Id":436410,"Number":345,"KnessetNum":8,"Name":"ישיבת מליאה בתאריך 16/11/1976 בשעה 16:05","StartDate":"1976-11-16T16:05:00+02:00","FinishDate":"1976-11-16T19:00:00+02:00","IsSpecialMeeting":null,"LastUpdatedDate":"2022-09-03T12:46:58.327+03:00"}
{"Id":436411,"Number":347,"KnessetNum":8,"Name":"ישיבת מליאה בתאריך 22/11/1976 בשעה 16:04","StartDate":"1976-11-22T16:04:00+02:00","FinishDate":"1976-11-22T18:08:00+02:00","IsSpecialMeeting":null,"LastUpdatedDate":"2022-09-03T16:24:47.59+03:00"}
{"Id":436412,"Number":348,"KnessetNum":8,"Name":"ישיבת מליאה בתאריך 23/11/1976 בשעה 16:03","StartDate":"1976-11-23T16:03:00+02:00","FinishDate":"1976-11-23T19:55:00+02:00","IsSpecialMeeting":null,"LastUpdatedDate":"2022-10-27T08:41:17.193+03:00"}
{"Id":436413,"Number":349,"KnessetNum":8,"Name":"ישיבת מליאה בתאריך 24/11/1976 בשעה 11:08","StartDate":"1976-11-24T11:08:00+02:00","FinishDate":"1976-11-24T13:12:00+02:00","IsSpecialMeeting":null,"LastUpdatedDate":"2022-10-27T09:55:43.477+03:00"}
{"Id":436414,"Number":350,"KnessetNum":8,"Name":"ישיבת מליאה בתאריך 29/11/1976 בשעה 16:03","StartDate":"1976-11-29T16:03:00+02:00","FinishDate":"1976-11-29T17:47:00+02:00","IsSpecialMeeting":null,"LastUpdatedDate":"2022-10-27T10:20:17.457+03:00"}
{"Id":436415,"Number":351,"KnessetNum":8,"Name":"ישיבת מליאה בתאריך 30/11/1976 בשעה 16:01","StartDate":"1976-11-30T16:01:00+02:00","FinishDate":"1976-11-30T17:00:00+02:00","IsSpecialMeeting":null,"LastUpdatedDate":"2022-10-27T10:24:28.923+03:00"}
{"Id":436416,"Number":353,"KnessetNum":8,"Name":"ישיבת מליאה בתאריך 06/12/1976 בשעה 16:04","StartDate":"1976-12-06T16:04:00+02:00","FinishDate":"1976-12-06T18:10:00+02:00","IsSpecialMeeting":null,"LastUpdatedDate":"2022-11-16T10:31:11.467+02:00"}
{"Id":436417,"Number":354,"KnessetNum":8,"Name":"ישיבת מליאה בתאריך 07/12/1976 בשעה 16:04","StartDate":"1976-12-07T16:04:00+02:00","FinishDate":"1976-12-07T20:08:00+02:00","IsSpecialMeeting":null,"LastUpdatedDate":"2022-11-16T10:32:31.923+02:00"}
{"Id":436418,"Number":355,"KnessetNum":8,"Name":"ישיבת מליאה בתאריך 08/12/1976 בשעה 11:03","StartDate":"1976-12-08T11:03:00+02:00","FinishDate":"1976-12-08T14:41:00+02:00","IsSpecialMeeting":null,"LastUpdatedDate":"2022-11-16T10:33:17.717+02:00"}
{"Id":436419,"Number":356,"KnessetNum":8,"Name":"ישיבת מליאה בתאריך 13/12/1976 בשעה 16:04","StartDate":"1976-12-13T16:04:00+02:00","FinishDate":"1976-12-13T20:05:00+02:00","IsSpecialMeeting":null,"LastUpdatedDate":"2022-11-16T10:34:15.433+02:00"}
{"Id":436420,"Number":357,"KnessetNum":8,"Name":"ישיבת מליאה בתאריך 14/12/1976 בשעה 16:03","StartDate":"1976-12-14T16:03:00+02:00","FinishDate":"1976-12-14T19:35:00+02:00","IsSpecialMeeting":null,"LastUpdatedDate":"2022-11-16T10:35:04.143+02:00"}
{"Id":436421,"Number":358,"KnessetNum":8,"Name":"ישיבת מליאה בתאריך 15/12/1976 בשעה 11:02","StartDate":"1976-12-15T11:02:00+02:00","FinishDate":"1976-12-15T13:15:00+02:00","IsSpecialMeeting":null,"LastUpdatedDate":"2022-11-16T10:35:49.85+02:00"}
{"Id":436422,"Number":359,"KnessetNum":8,"Name":"ישיבת מליאה בתאריך 20/12/1976 בשעה 16:04","StartDate":"1976-12-20T16:04:00+02:00","FinishDate":"1976-12-20T19:46:00+02:00","IsSpecialMeeting":null,"LastUpdatedDate":"2022-11-16T11:33:36.923+02:00"}
{"Id":436423,"Number":360,"KnessetNum":8,"Name":"ישיבת מליאה בתאריך 21/12/1976 בשעה 16:03","StartDate":"1976-12-21T16:03:00+02:00","FinishDate":"1976-12-21T19:49:00+02:00","IsSpecialMeeting":null,"LastUpdatedDate":"2020-09-30T08:42:03.603+03:00"}
{"Id":436424,"Number":361,"KnessetNum":8,"Name":"ישיבת מליאה בתאריך 22/12/1976 בשעה 11:03","StartDate":"1976-12-22T11:03:00+02:00","FinishDate":"1976-12-22T15:21:00+02:00","IsSpecialMeeting":null,"LastUpdatedDate":"2022-11-17T15:31:29.603+02:00"}
{"Id":436425,"Number":363,"KnessetNum":8,"Name":"ישיבת מליאה בתאריך 28/12/1976 בשעה 16:04","StartDate":"1976-12-28T16:04:00+02:00","FinishDate":"1976-12-28T19:17:00+02:00","IsSpecialMeeting":null,"LastUpdatedDate":"2022-11-17T12:32:14.713+02:00"}
{"Id":436426,"Number":364,"KnessetNum":8,"Name":"ישיבת מליאה בתאריך 29/12/1976 בשעה 11:05","StartDate":"1976-12-29T11:05:00+02:00","FinishDate":"1976-12-29T13:32:00+02:00","IsSpecialMeeting":null,"LastUpdatedDate":"2022-11-17T11:57:14.107+02:00"}
{"Id":436427,"Number":366,"KnessetNum":8,"Name":"ישיבת מליאה בתאריך 04/01/1977 בשעה 16:05","StartDate":"1977-01-04T16:05:00+02:00","FinishDate":"1977-01-04T19:00:00+02:00","IsSpecialMeeting":null,"LastUpdatedDate":"2022-11-17T02:10:27.103+02:00"}
{"Id":436428,"Number":368,"KnessetNum":8,"Name":"ישיבת מליאה בתאריך 10/01/1977 בשעה 16:03","StartDate":"1977-01-10T16:03:00+02:00","FinishDate":"1977-01-10T18:20:00+02:00","IsSpecialMeeting":null,"LastUpdatedDate":"2022-11-17T11:28:08.79+02:00"}
{"Id":436429,"Number":369,"KnessetNum":8,"Name":"ישיבת מליאה בתאריך 11/01/1977 בשעה 16:04","StartDate":"1977-01-11T16:04:00+02:00","FinishDate":"1977-01-11T18:53:00+02:00","IsSpecialMeeting":null,"LastUpdatedDate":"2022-11-20T01:33:51.443+02:00"}
{"Id":436430,"Number":370,"KnessetNum":8,"Name":"ישיבת מליאה בתאריך 12/01/1977 בשעה 11:04","StartDate":"1977-01-12T11:04:00+02:00","FinishDate":"1977-01-12T15:34:00+02:00","IsSpecialMeeting":null,"LastUpdatedDate":"2022-12-05T01:07:25.707+02:00"}
{"Id":436431,"Number":376,"KnessetNum":8,"Name":"ישיבת מליאה בתאריך 26/01/1977 בשעה 11:03","StartDate":"1977-01-26T11:03:00+02:00","FinishDate":"1977-01-26T13:57:00+02:00","IsSpecialMeeting":null,"LastUpdatedDate":"2022-12-04T11:19:46.837+02:00"}
{"Id":436432,"Number":382,"KnessetNum":8,"Name":"ישיבת מליאה בתאריך 09/02/1977 בשעה 11:02","StartDate":"1977-02-09T11:02:00+02:00","FinishDate":"1977-02-09T14:10:00+02:00","IsSpecialMeeting":null,"LastUpdatedDate":"2025-01-27T12:33:24.51+02:00"}
{"Id":436433,"Number":386,"KnessetNum":8,"Name":"ישיבת מליאה בתאריך 21/02/1977 בשעה 16:02","StartDate":"1977-02-21T16:02:00+02:00","FinishDate":"1977-02-21T19:00:00+02:00","IsSpecialMeeting":null,"LastUpdatedDate":"2022-12-10T03:29:15.36+02:00"}
{"Id":436434,"Number":387,"KnessetNum":8,"Name":"ישיבת מליאה בתאריך 22/02/1977 בשעה 16:02","StartDate":"1977-02-22T16:02:00+02:00","FinishDate":"1977-02-22T17:45:00+02:00","IsSpecialMeeting":null,"LastUpdatedDate":"2022-12-10T03:33:00.11+02:00"}
{"Id":436435,"Number":388,"KnessetNum":8,"Name":"ישיבת מליאה בתאריך 23/02/1977 בשעה 11:03","StartDate":"1977-02-23T11:03:00+02:00","FinishDate":"1977-02-23T11:14:00+02:00","IsSpecialMeeting":null,"LastUpdatedDate":"2022-12-10T03:35:30.573+02:00"}
{"Id":436436,"Number":389,"KnessetNum":8,"Name":"ישיבת מליאה בתאריך 28/02/1977 בשעה 16:06","StartDate":"1977-02-28T16:06:00+02:00","FinishDate":"1977-02-28T18:45:00+02:00","IsSpecialMeeting":null,"LastUpdatedDate":"2022-12-24T16:27:46.527+02:00"}
{"Id":436437,"Number":390,"KnessetNum":8,"Name":"ישיבת מליאה בתאריך 01/03/1977 בשעה 16:00","StartDate":"1977-03-01T16:00:00+02:00","FinishDate":"1977-03-01T20:27:00+02:00","IsSpecialMeeting":null,"LastUpdatedDate":"2022-12-10T03:58:04.007+02:00"}
{"Id":436438,"Number":391,"KnessetNum":8,"Name":"ישיבת מליאה בתאריך 02/03/1977 בשעה 11:02","StartDate":"1977-03-02T11:02:00+02:00","FinishDate":"1977-03-02T23:00:00+02:00","IsSpecialMeeting":null,"LastUpdatedDate":"2022-12-24T15:45:48.537+02:00"}
{"Id":436439,"Number":392,"KnessetNum":8,"Name":"ישיבת מליאה בתאריך 07/03/1977 בשעה 16:02","StartDate":"1977-03-07T16:02:00+02:00","FinishDate":"1977-03-07T19:55:00+02:00","IsSpecialMeeting":null,"LastUpdatedDate":"2022-12-04T14:35:04.677+02:00"}
{"Id":436440,"Number":393,"KnessetNum":8,"Name":"ישיבת מליאה בתאריך 08/03/1977 בשעה 16:03","StartDate":"1977-03-08T16:03:00+02:00","FinishDate":"1977-03-08T19:57:00+02:00","IsSpecialMeeting":null,"LastUpdatedDate":"2022-08-01T00:57:12.367+03:00"}
{"Id":436441,"Number":394,"KnessetNum":8,"Name":"ישיבת מליאה בתאריך 09/03/1977 בשעה 11:02","StartDate":"1977-03-09T11:02:00+02:00","FinishDate":"1977-03-09T15:58:00+02:00","IsSpecialMeeting":null,"LastUpdatedDate":"2022-08-01T00:41:01.887+03:00"}
{"Id":436442,"Number":395,"KnessetNum":8,"Name":"ישיבת מליאה בתאריך 14/03/1977 בשעה 16:05","StartDate":"1977-03-14T16:05:00+02:00","FinishDate":"1977-03-14T19:12:00+02:00","IsSpecialMeeting":null,"LastUpdatedDate":"2022-08-01T00:09:52.953+03:00"}
{"Id":436443,"Number":396,"KnessetNum":8,"Name":"ישיבת מליאה בתאריך 15/03/1977 בשעה 14:03","StartDate":"1977-03-15T14:03:00+02:00","FinishDate":"1977-03-15T21:10:00+02:00","IsSpecialMeeting":null,"LastUpdatedDate":"2022-04-27T15:50:18.77+03:00"}
{"Id":436444,"Number":397,"KnessetNum":8,"Name":"ישיבת מליאה בתאריך 16/03/1977 בשעה 09:04","StartDate":"1977-03-16T09:04:00+02:00","FinishDate":"1977-03-16T15:08:00+02:00","IsSpecialMeeting":null,"LastUpdatedDate":"2022-04-25T14:17:26.693+03:00"}
{"Id":436447,"Number":8,"KnessetNum":9,"Name":"ישיבת מליאה בתאריך 05/07/1977 בשעה 16:02","StartDate":"1977-07-05T16:02:00+03:00","FinishDate":"1977-07-05T19:59:00+03:00","IsSpecialMeeting":null,"LastUpdatedDate":"2020-08-22T01:13:27.92+03:00"}
{"Id":436448,"Number":11,"KnessetNum":9,"Name":"ישיבת מליאה בתאריך 12/07/1977 בשעה 16:03","StartDate":"1977-07-12T16:03:00+03:00","FinishDate":"1977-07-12T20:05:00+03:00","IsSpecialMeeting":null,"LastUpdatedDate":"2020-08-22T02:51:28.317+03:00"}
{"Id":436449,"Number":13,"KnessetNum":9,"Name":"ישיבת מליאה בתאריך 18/07/1977 בשעה 16:01","StartDate":"1977-07-18T16:01:00+03:00","FinishDate":"1977-07-18T18:30:00+03:00","IsSpecialMeeting":null,"LastUpdatedDate":"2020-08-23T10:06:34.253+03:00"}
{"Id":436450,"Number":16,"KnessetNum":9,"Name":"ישיבת מליאה בתאריך 25/07/1977 בשעה 16:02","StartDate":"1977-07-25T16:02:00+03:00","FinishDate":"1977-07-25T18:57:00+03:00","IsSpecialMeeting":null,"LastUpdatedDate":"2020-08-23T16:11:58.86+03:00"}
{"Id":436451,"Number":19,"KnessetNum":9,"Name":"ישיבת מליאה בתאריך 01/08/1977 בשעה 16:04","StartDate":"1977-08-01T16:04:00+03:00","FinishDate":"1977-08-01T20:12:00+03:00","IsSpecialMeeting":null,"LastUpdatedDate":"2020-08-24T17:13:44.633+03:00"}
{"Id":436452,"Number":20,"KnessetNum":9,"Name":"ישיבת מליאה בתאריך 02/08/1977 בשעה 16:02","StartDate":"1977-08-02T16:02:00+03:00","FinishDate":"1977-08-02T22:42:00+03:00","IsSpecialMeeting":null,"LastUpdatedDate":"2020-09-26T23:55:33.157+03:00"}
{"Id":436453,"Number":23,"KnessetNum":9,"Name":"ישיבת מליאה בתאריך 24/08/1977 בשעה 11:04","StartDate":"1977-08-24T11:04:00+03:00","FinishDate":"1977-08-24T14:50:00+03:00","IsSpecialMeeting":null,"LastUpdatedDate":"2021-04-07T10:33:38.73+03:00"}
{"Id":436454,"Number":28,"KnessetNum":9,"Name":"ישיבת מליאה בתאריך 17/10/1977 בשעה 16:02","StartDate":"1977-10-17T16:02:00+02:00","FinishDate":"1977-10-17T18:28:00+02:00","IsSpecialMeeting":null,"LastUpdatedDate":"2020-09-27T01:48:27.49+03:00"}
{"Id":436455,"Number":29,"KnessetNum":9,"Name":"ישיבת מליאה בתאריך 18/10/1977 בשעה 16:02","StartDate":"1977-10-18T16:02:00+02:00","FinishDate":"1977-10-18T18:49:00+02:00","IsSpecialMeeting":null,"LastUpdatedDate":"2020-09-27T01:56:50.173+03:00"}
{"Id":436456,"Number":30,"KnessetNum":9,"Name":"ישיבת מליאה בתאריך 19/10/1977 בשעה 11:01","StartDate":"1977-10-19T11:01:00+02:00","FinishDate":"1977-10-19T14:42:00+02:00","IsSpecialMeeting":null,"LastUpdatedDate":"2020-09-27T02:24:38.72+03:00"}
{"Id":436457,"Number":33,"KnessetNum":9,"Name":"ישיבת מליאה בתאריך 26/10/1977 בשעה 11:02","StartDate":"1977-10-26T11:02:00+02:00","FinishDate":"1977-10-26T13:45:00+02:00","IsSpecialMeeting":null,"LastUpdatedDate":"2020-09-28T01:27:56.723+03:00"}
{"Id":436458,"Number":35,"KnessetNum":9,"Name":"ישיבת מליאה בתאריך 01/11/1977 בשעה 16:01","StartDate":"1977-11-01T16:01:00+02:00","FinishDate":"1977-11-01T19:33:00+02:00","IsSpecialMeeting":null,"LastUpdatedDate":"2020-09-28T03:18:32.283+03:00"}
{"Id":436459,"Number":37,"KnessetNum":9,"Name":"ישיבת מליאה בתאריך 07/11/1977 בשעה 15:02","StartDate":"1977-11-07T15:02:00+02:00","FinishDate":"1977-11-07T15:33:00+02:00","IsSpecialMeeting":null,"LastUpdatedDate":"2020-09-29T00:22:30.903+03:00"}
{"Id":436460,"Number":38,"KnessetNum":9,"Name":"ישיבת מליאה בתאריך 08/11/1977 בשעה 16:02","StartDate":"1977-11-08T16:02:00+02:00","FinishDate":"1977-11-08T20:20:00+02:00","IsSpecialMeeting":null,"LastUpdatedDate":"2020-10-07T13:17:54.933+03:00"}
{"Id":436461,"Number":42,"KnessetNum":9,"Name":"ישיבת מליאה בתאריך 16/11/1977 בשעה 11:02","StartDate":"1977-11-16T11:02:00+02:00","FinishDate":"1977-11-16T15:19:00+02:00","IsSpecialMeeting":null,"LastUpdatedDate":"2020-10-09T01:31:19.073+03:00"}
{"Id":436462,"Number":45,"KnessetNum":9,"Name":"ישיבת מליאה בתאריך 22/11/1977 בשעה 16:02","StartDate":"1977-11-22T16:02:00+02:00","FinishDate":"1977-11-22T19:15:00+02:00","IsSpecialMeeting":null,"LastUpdatedDate":"2020-10-09T01:51:32.583+03:00"}
{"Id":436463,"Number":49,"KnessetNum":9,"Name":"ישיבת מליאה בתאריך 30/11/1977 בשעה 11:00","StartDate":"1977-11-30T11:00:00+02:00","FinishDate":"1977-11-30T14:50:00+02:00","IsSpecialMeeting":null,"LastUpdatedDate":"2021-04-07T13:18:52.247+03:00"}
{"Id":436464,"Number":50,"KnessetNum":9,"Name":"ישיבת מליאה בתאריך 05/12/1977 בשעה 16:02","StartDate":"1977-12-05T16:02:00+02:00","FinishDate":"1977-12-05T19:00:00+02:00","IsSpecialMeeting":null,"LastUpdatedDate":"2020-10-14T11:28:06.61+03:00"}
{"Id":436465,"Number":60,"KnessetNum":9,"Name":"ישיבת מליאה בתאריך 27/12/1977 בשעה 16:02","StartDate":"1977-12-27T16:02:00+02:00","FinishDate":"1977-12-27T19:45:00+02:00","IsSpecialMeeting":null,"LastUpdatedDate":"2020-10-15T09:09:42.007+03:00"}
{"Id":436466,"Number":61,"KnessetNum":9,"Name":"ישיבת מליאה בתאריך 28/12/1977 בשעה 10:07","StartDate":"1977-12-28T10:07:00+02:00","FinishDate":"1977-12-28T21:30:00+02:00","IsSpecialMeeting":null,"LastUpdatedDate":"2020-10-15T09:31:03.92+03:00"}
{"Id":436467,"Number":63,"KnessetNum":9,"Name":"ישיבת מליאה בתאריך 03/01/1978 בשעה 16:02","StartDate":"1978-01-03T16:02:00+02:00","FinishDate":"1978-01-03T18:55:00+02:00","IsSpecialMeeting":null,"LastUpdatedDate":"2020-10-16T20:57:45.497+03:00"}
{"Id":436468,"Number":75,"KnessetNum":9,"Name":"ישיבת מליאה בתאריך 31/01/1978 בשעה 16:02","StartDate":"1978-01-31T16:02:00+02:00","FinishDate":"1978-01-31T19:26:00+02:00","IsSpecialMeeting":null,"LastUpdatedDate":"2020-10-18T03:05:33.8+03:00"}
{"Id":436469,"Number":77,"KnessetNum":9,"Name":"ישיבת מליאה בתאריך 06/02/1978 בשעה 16:04","StartDate":"1978-02-06T16:04:00+02:00","FinishDate":"1978-02-06T19:28:00+02:00","IsSpecialMeeting":null,"LastUpdatedDate":"2020-10-18T03:41:21.14+03:00"}
{"Id":436470,"Number":83,"KnessetNum":9,"Name":"ישיבת מליאה בתאריך 20/02/1978 בשעה 16:02","StartDate":"1978-02-20T16:02:00+02:00","FinishDate":"1978-02-20T16:23:00+02:00","IsSpecialMeeting":null,"LastUpdatedDate":"2020-10-20T22:24:07.707+03:00"}
{"Id":436471,"Number":92,"KnessetNum":9,"Name":"ישיבת מליאה בתאריך 13/03/1978 בשעה 16:01","StartDate":"1978-03-13T16:01:00+02:00","FinishDate":"1978-03-13T20:15:00+02:00","IsSpecialMeeting":null,"LastUpdatedDate":"2020-10-21T01:38:26.813+03:00"}
{"Id":436472,"Number":93,"KnessetNum":9,"Name":"ישיבת מליאה בתאריך 14/03/1978 בשעה 16:01","StartDate":"1978-03-14T16:01:00+02:00","FinishDate":"1978-03-14T20:35:00+02:00","IsSpecialMeeting":null,"LastUpdatedDate":"2020-10-21T09:57:44.847+03:00"}
{"Id":436473,"Number":94,"KnessetNum":9,"Name":"ישיבת מליאה בתאריך 15/03/1978 בשעה 11:06","StartDate":"1978-03-15T11:06:00+02:00","FinishDate":"1978-03-15T13:51:00+02:00","IsSpecialMeeting":null,"LastUpdatedDate":"2020-10-21T23:28:32.673+03:00"}
{"Id":436474,"Number":95,"KnessetNum":9,"Name":"ישיבת מליאה בתאריך 20/03/1978 בשעה 16:03","StartDate":"1978-03-20T16:03:00+02:00","FinishDate":"1978-03-20T17:23:00+02:00","IsSpecialMeeting":null,"LastUpdatedDate":"2020-10-22T00:25:54.7+03:00"}
{"Id":436475,"Number":98,"KnessetNum":9,"Name":"ישיבת מליאה בתאריך 27/03/1978 בשעה 16:00","StartDate":"1978-03-27T16:00:00+02:00","FinishDate":"1978-03-27T21:30:00+02:00","IsSpecialMeeting":null,"LastUpdatedDate":"2021-04-12T15:49:59.67+03:00"}
{"Id":436476,"Number":103,"KnessetNum":9,"Name":"ישיבת מליאה בתאריך 04/04/1978 בשעה 16:03","StartDate":"1978-04-04T16:03:00+02:00","FinishDate":"1978-04-04T21:45:00+02:00","IsSpecialMeeting":null,"LastUpdatedDate":"2020-10-26T23:24:12.227+02:00"}
{"Id":436477,"Number":104,"KnessetNum":9,"Name":"ישיבת מליאה בתאריך 05/04/1978 בשעה 11:01","StartDate":"1978-04-05T11:01:00+03:00","FinishDate":"1978-04-05T18:47:00+03:00","IsSpecialMeeting":null,"LastUpdatedDate":"2023-12-20T10:45:47.563+02:00"}
{"Id":436478,"Number":108,"KnessetNum":9,"Name":"ישיבת מליאה בתאריך 16/05/1978 בשעה 16:00","StartDate":"1978-05-16T16:00:00+03:00","FinishDate":"1978-05-16T18:55:00+03:00","IsSpecialMeeting":null,"LastUpdatedDate":"2020-10-27T01:02:40.35+02:00"}
{"Id":436479,"Number":109,"KnessetNum":9,"Name":"ישיבת מליאה בתאריך 17/05/1978 בשעה 11:00","StartDate":"1978-05-17T11:00:00+03:00","FinishDate":"1978-05-17T13:08:00+03:00","IsSpecialMeeting":null,"LastUpdatedDate":"2020-10-27T01:33:42.407+02:00"}
{"Id":436480,"Number":111,"KnessetNum":9,"Name":"ישיבת מליאה בתאריך 23/05/1978 בשעה 16:03","StartDate":"1978-05-23T16:03:00+03:00","FinishDate":"1978-05-23T18:38:00+03:00","IsSpecialMeeting":null,"LastUpdatedDate":"2020-10-27T01:43:40.187+02:00"}
{"Id":436481,"Number":115,"KnessetNum":9,"Name":"ישיבת מליאה בתאריך 31/05/1978 בשעה 11:03","StartDate":"1978-05-31T11:03:00+03:00","FinishDate":"1978-05-31T13:47:00+03:00","IsSpecialMeeting":null,"LastUpdatedDate":"2020-11-01T01:28:04.623+02:00"}
{"Id":436482,"Number":118,"KnessetNum":9,"Name":"ישיבת מליאה בתאריך 07/06/1978 בשעה 11:02","StartDate":"1978-06-07T11:02:00+03:00","FinishDate":"1978-06-07T15:20:00+03:00","IsSpecialMeeting":null,"LastUpdatedDate":"2021-04-12T16:36:44.507+03:00"}
{"Id":436483,"Number":119,"KnessetNum":9,"Name":"ישיבת מליאה בתאריך 12/06/1978 בשעה 16:02","StartDate":"1978-06-12T16:02:00+03:00","FinishDate":"1978-06-12T19:33:00+03:00","IsSpecialMeeting":null,"LastUpdatedDate":"2020-11-02T10:32:32.943+02:00"}
{"Id":436484,"Number":120,"KnessetNum":9,"Name":"ישיבת מליאה בתאריך 13/06/1978 בשעה 16:02","StartDate":"1978-06-13T16:02:00+03:00","FinishDate":"1978-06-13T19:15:00+03:00","IsSpecialMeeting":null,"LastUpdatedDate":"2020-11-06T01:44:34.273+02:00"}
{"Id":436485,"Number":121,"KnessetNum":9,"Name":"ישיבת מליאה בתאריך 14/06/1978 בשעה 11:02","StartDate":"1978-06-14T11:02:00+03:00","FinishDate":"1978-06-14T17:37:00+03:00","IsSpecialMeeting":null,"LastUpdatedDate":"2020-11-06T02:57:37.753+02:00"}
{"Id":436486,"Number":124,"KnessetNum":9,"Name":"ישיבת מליאה בתאריך 21/06/1978 בשעה 11:01","StartDate":"1978-06-21T11:01:00+03:00","FinishDate":"1978-06-21T15:31:00+03:00","IsSpecialMeeting":null,"LastUpdatedDate":"2020-11-08T02:14:44.067+02:00"}
{"Id":436487,"Number":125,"KnessetNum":9,"Name":"ישיבת מליאה בתאריך 26/06/1978 בשעה 16:02","StartDate":"1978-06-26T16:02:00+03:00","FinishDate":"1978-06-26T19:12:00+03:00","IsSpecialMeeting":null,"LastUpdatedDate":"2020-11-06T03:36:56.05+02:00"}
{"Id":436488,"Number":127,"KnessetNum":9,"Name":"ישיבת מליאה בתאריך 28/06/1978 בשעה 11:01","StartDate":"1978-06-28T11:01:00+03:00","FinishDate":"1978-06-28T15:41:00+03:00","IsSpecialMeeting":null,"LastUpdatedDate":"2020-11-08T00:06:42.663+02:00"}
{"Id":436489,"Number":129,"KnessetNum":9,"Name":"ישיבת מליאה בתאריך 04/07/1978 בשעה 16:05","StartDate":"1978-07-04T16:05:00+03:00","FinishDate":"1978-07-04T22:56:00+03:00","IsSpecialMeeting":null,"LastUpdatedDate":"2020-11-08T00:39:46.977+02:00"}
{"Id":436490,"Number":135,"KnessetNum":9,"Name":"ישיבת מליאה בתאריך 18/07/1978 בשעה 16:02","StartDate":"1978-07-18T16:02:00+03:00","FinishDate":"1978-07-18T20:03:00+03:00","IsSpecialMeeting":null,"LastUpdatedDate":"2020-11-08T23:49:34.517+02:00"}
{"Id":436491,"Number":138,"KnessetNum":9,"Name":"ישיבת מליאה בתאריך 25/07/1978 בשעה 16:02","StartDate":"1978-07-25T16:02:00+03:00","FinishDate":"1978-07-25T18:50:00+03:00","IsSpecialMeeting":null,"LastUpdatedDate":"2020-11-09T00:41:54.967+02:00"}
{"Id":436492,"Number":142,"KnessetNum":9,"Name":"ישיבת מליאה בתאריך 02/08/1978 בשעה 09:04","StartDate":"1978-08-02T09:04:00+03:00","FinishDate":"1978-08-02T18:14:00+03:00","IsSpecialMeeting":null,"LastUpdatedDate":"2020-11-16T21:02:34.083+02:00"}
{"Id":436493,"Number":148,"KnessetNum":9,"Name":"ישיבת מליאה בתאריך 30/10/1978 בשעה 16:03","StartDate":"1978-10-30T16:03:00+02:00","FinishDate":"1978-10-30T19:23:00+02:00","IsSpecialMeeting":null,"LastUpdatedDate":"2020-11-16T21:28:14.647+02:00"}
{"Id":436494,"Number":149,"KnessetNum":9,"Name":"ישיבת מליאה בתאריך 31/10/1978 בשעה 16:00","StartDate":"1978-10-31T16:00:00+02:00","FinishDate":"1978-10-31T18:18:00+02:00","IsSpecialMeeting":null,"LastUpdatedDate":"2020-11-16T21:47:01.233+02:00"}
{"Id":436495,"Number":151,"KnessetNum":9,"Name":"ישיבת מליאה בתאריך 06/11/1978 בשעה 16:00","StartDate":"1978-11-06T16:00:00+02:00","FinishDate":"1978-11-06T18:35:00+02:00","IsSpecialMeeting":null,"LastUpdatedDate":"2020-11-16T23:47:03.293+02:00"}
{"Id":436496,"Number":152,"KnessetNum":9,"Name":"ישיבת מליאה בתאריך 08/11/1978 בשעה 11:02","StartDate":"1978-11-08T11:02:00+02:00","FinishDate":"1978-11-08T14:05:00+02:00","IsSpecialMeeting":null,"LastUpdatedDate":"2020-11-22T01:12:01.463+02:00"}
{"Id":436497,"Number":154,"KnessetNum":9,"Name":"ישיבת מליאה בתאריך 14/11/1978 בשעה 16:10","StartDate":"1978-11-14T16:10:00+02:00","FinishDate":"1978-11-14T19:33:00+02:00","IsSpecialMeeting":null,"LastUpdatedDate":"2020-11-18T00:52:05.123+02:00"}
{"Id":436498,"Number":157,"KnessetNum":9,"Name":"ישיבת מליאה בתאריך 21/11/1978 בשעה 16:00","StartDate":"1978-11-21T16:00:00+02:00","FinishDate":"1978-11-21T19:17:00+02:00","IsSpecialMeeting":null,"LastUpdatedDate":"2021-04-19T14:30:37.643+03:00"}
{"Id":436499,"Number":160,"KnessetNum":9,"Name":"ישיבת מליאה בתאריך 28/11/1978 בשעה 16:00","StartDate":"1978-11-28T16:00:00+02:00","FinishDate":"1978-11-28T19:40:00+02:00","IsSpecialMeeting":null,"LastUpdatedDate":"2020-11-18T00:57:57.023+02:00"}
{"Id":436500,"Number":162,"KnessetNum":9,"Name":"ישיבת מליאה בתאריך 04/12/1978 בשעה 16:01","StartDate":"1978-12-04T16:01:00+02:00","FinishDate":"1978-12-04T20:05:00+02:00","IsSpecialMeeting":null,"LastUpdatedDate":"2020-11-19T08:47:22.017+02:00"}
{"Id":436501,"Number":163,"KnessetNum":9,"Name":"ישיבת מליאה בתאריך 05/12/1978 בשעה 16:03","StartDate":"1978-12-05T16:03:00+02:00","FinishDate":"1978-12-05T20:08:00+02:00","IsSpecialMeeting":null,"LastUpdatedDate":"2020-11-21T00:57:38.537+02:00"}
{"Id":436503,"Number":169,"KnessetNum":9,"Name":"ישיבת מליאה בתאריך 20/12/1978 בשעה 11:03","StartDate":"1978-12-20T11:03:00+02:00","FinishDate":"1978-12-20T15:25:00+02:00","IsSpecialMeeting":null,"LastUpdatedDate":"2020-11-23T21:45:41.007+02:00"}
{"Id":436504,"Number":171,"KnessetNum":9,"Name":"ישיבת מליאה בתאריך 26/12/1978 בשעה 16:01","StartDate":"1978-12-26T16:01:00+02:00","FinishDate":"1978-12-26T17:40:00+02:00","IsSpecialMeeting":null,"LastUpdatedDate":"2020-11-22T01:44:37.11+02:00"}
{"Id":436505,"Number":173,"KnessetNum":9,"Name":"ישיבת מליאה בתאריך 01/01/1979 בשעה 16:01","StartDate":"1979-01-01T16:01:00+02:00","FinishDate":"1979-01-01T17:16:00+02:00","IsSpecialMeeting":null,"LastUpdatedDate":"2020-11-23T22:38:12.623+02:00"}
{"Id":436506,"Number":175,"KnessetNum":9,"Name":"ישיבת מליאה בתאריך 03/01/1979 בשעה 11:01","StartDate":"1979-01-03T11:01:00+02:00","FinishDate":"1979-01-03T17:27:00+02:00","IsSpecialMeeting":null,"LastUpdatedDate":"2020-11-25T22:51:49.933+02:00"}
{"Id":436507,"Number":176,"KnessetNum":9,"Name":"ישיבת מליאה בתאריך 08/01/1979 בשעה 16:00","StartDate":"1979-01-08T16:00:00+02:00","FinishDate":"1979-01-08T19:26:00+02:00","IsSpecialMeeting":null,"LastUpdatedDate":"2020-11-28T02:44:45.277+02:00"}
{"Id":436508,"Number":200,"KnessetNum":9,"Name":"ישיבת מליאה בתאריך 05/03/1979 בשעה 16:02","StartDate":"1979-03-05T16:02:00+02:00","FinishDate":"1979-03-05T19:30:00+02:00","IsSpecialMeeting":null,"LastUpdatedDate":"2020-12-02T13:13:56.963+02:00"}
{"Id":436509,"Number":208,"KnessetNum":9,"Name":"ישיבת מליאה בתאריך 26/03/1979 בשעה 16:01","StartDate":"1979-03-26T16:01:00+02:00","FinishDate":"1979-03-26T18:32:00+02:00","IsSpecialMeeting":null,"LastUpdatedDate":"2020-12-09T13:04:03.427+02:00"}
{"Id":436510,"Number":209,"KnessetNum":9,"Name":"ישיבת מליאה בתאריך 27/03/1979 בשעה 16:00","StartDate":"1979-03-27T16:00:00+02:00","FinishDate":"1979-03-27T19:30:00+02:00","IsSpecialMeeting":null,"LastUpdatedDate":"2020-12-09T14:47:09.27+02:00"}
{"Id":436511,"Number":210,"KnessetNum":9,"Name":"ישיבת מליאה בתאריך 28/03/1979 בשעה 11:03","StartDate":"1979-03-28T11:03:00+02:00","FinishDate":"1979-03-28T15:46:00+02:00","IsSpecialMeeting":null,"LastUpdatedDate":"2020-12-04T01:03:12.547+02:00"}
{"Id":436512,"Number":211,"KnessetNum":9,"Name":"ישיבת מליאה בתאריך 02/04/1979 בשעה 16:02","StartDate":"1979-04-02T16:02:00+02:00","FinishDate":"1979-04-02T20:31:00+02:00","IsSpecialMeeting":null,"LastUpdatedDate":"2020-12-04T01:54:24.107+02:00"}
{"Id":436513,"Number":212,"KnessetNum":9,"Name":"ישיבת מליאה בתאריך 03/04/1979 בשעה 11:02","StartDate":"1979-04-03T11:02:00+02:00","FinishDate":"1979-04-03T13:55:00+02:00","IsSpecialMeeting":null,"LastUpdatedDate":"2020-12-05T02:48:25.95+02:00"}
{"Id":436514,"Number":220,"KnessetNum":9,"Name":"ישיבת מליאה בתאריך 14/05/1979 בשעה 16:00","StartDate":"1979-05-14T16:00:00+03:00","FinishDate":"1979-05-14T20:35:00+03:00","IsSpecialMeeting":null,"LastUpdatedDate":"2020-12-04T02:41:42.107+02:00"}
{"Id":436515,"Number":231,"KnessetNum":9,"Name":"ישיבת מליאה בתאריך 06/06/1979 בשעה 11:01","StartDate":"1979-06-06T11:01:00+03:00","FinishDate":"1979-06-06T13:27:00+03:00","IsSpecialMeeting":null,"LastUpdatedDate":"2021-04-19T15:19:25.617+03:00"}
{"Id":436516,"Number":232,"KnessetNum":9,"Name":"ישיבת מליאה בתאריך 11/06/1979 בשעה 16:03","StartDate":"1979-06-11T16:03:00+03:00","FinishDate":"1979-06-11T17:55:00+03:00","IsSpecialMeeting":null,"LastUpdatedDate":"2020-12-12T23:48:35.727+02:00"}
{"Id":436517,"Number":237,"KnessetNum":9,"Name":"ישיבת מליאה בתאריך 20/06/1979 בשעה 11:02","StartDate":"1979-06-20T11:02:00+03:00","FinishDate":"1979-06-20T15:18:00+03:00","IsSpecialMeeting":null,"LastUpdatedDate":"2020-12-13T01:44:49.763+02:00"}
{"Id":436518,"Number":244,"KnessetNum":9,"Name":"ישיבת מליאה בתאריך 09/07/1979 בשעה 16:03","StartDate":"1979-07-09T16:03:00+03:00","FinishDate":"1979-07-09T20:20:00+03:00","IsSpecialMeeting":null,"LastUpdatedDate":"2020-12-16T01:35:53.42+02:00"}
{"Id":436519,"Number":247,"KnessetNum":9,"Name":"ישיבת מליאה בתאריך 16/07/1979 בשעה 16:02","StartDate":"1979-07-16T16:02:00+03:00","FinishDate":"1979-07-16T22:09:00+03:00","IsSpecialMeeting":null,"LastUpdatedDate":"2020-12-16T02:19:50.6+02:00"}
{"Id":436520,"Number":248,"KnessetNum":9,"Name":"ישיבת מליאה בתאריך 17/07/1979 בשעה 16:02","StartDate":"1979-07-17T16:02:00+03:00","FinishDate":"1979-07-17T19:00:00+03:00","IsSpecialMeeting":null,"LastUpdatedDate":"2020-12-16T02:43:44.61+02:00"}
{"Id":436521,"Number":249,"KnessetNum":9,"Name":"ישיבת מליאה בתאריך 18/07/1979 בשעה 11:01","StartDate":"1979-07-18T11:01:00+03:00","FinishDate":"1979-07-18T17:22:00+03:00","IsSpecialMeeting":null,"LastUpdatedDate":"2020-12-16T11:22:02.953+02:00"}
{"Id":436522,"Number":250,"KnessetNum":9,"Name":"ישיבת מליאה בתאריך 23/07/1979 בשעה 16:02","StartDate":"1979-07-23T16:02:00+03:00","FinishDate":"1979-07-23T21:50:00+03:00","IsSpecialMeeting":null,"LastUpdatedDate":"2020-12-16T11:43:31.09+02:00"}
{"Id":436523,"Number":251,"KnessetNum":9,"Name":"ישיבת מליאה בתאריך 24/07/1979 בשעה 16:02","StartDate":"1979-07-24T16:02:00+03:00","FinishDate":"1979-07-24T21:35:00+03:00","IsSpecialMeeting":null,"LastUpdatedDate":"2020-12-17T02:11:27.007+02:00"}
{"Id":436524,"Number":252,"KnessetNum":9,"Name":"ישיבת מליאה בתאריך 25/07/1979 בשעה 11:01","StartDate":"1979-07-25T11:01:00+03:00","FinishDate":"1979-07-25T20:23:00+03:00","IsSpecialMeeting":null,"LastUpdatedDate":"2020-12-20T01:00:55.007+02:00"}
{"Id":436526,"Number":253,"KnessetNum":9,"Name":"ישיבת מליאה בתאריך 30/07/1979 בשעה 16:02","StartDate":"1979-07-30T16:02:00+03:00","FinishDate":"1979-07-30T22:25:00+03:00","IsSpecialMeeting":null,"LastUpdatedDate":"2020-12-17T02:27:17.79+02:00"}
{"Id":436527,"Number":254,"KnessetNum":9,"Name":"ישיבת מליאה בתאריך 31/07/1979 בשעה 15:00","StartDate":"1979-07-31T15:00:00+03:00","FinishDate":"1979-07-31T22:47:00+03:00","IsSpecialMeeting":null,"LastUpdatedDate":"2020-12-17T03:17:16.033+02:00"}
{"Id":436528,"Number":255,"KnessetNum":9,"Name":"ישיבת מליאה בתאריך 01/08/1979 בשעה 09:02","StartDate":"1979-08-01T09:02:00+03:00","FinishDate":"1979-08-01T14:23:00+03:00","IsSpecialMeeting":null,"LastUpdatedDate":"2021-01-02T01:09:56.503+02:00"}
{"Id":436529,"Number":259,"KnessetNum":9,"Name":"ישיבת מליאה בתאריך 22/10/1979 בשעה 16:02","StartDate":"1979-10-22T16:02:00+02:00","FinishDate":"1979-10-22T19:57:00+02:00","IsSpecialMeeting":null,"LastUpdatedDate":"2020-12-20T01:37:25.607+02:00"}
{"Id":436530,"Number":260,"KnessetNum":9,"Name":"ישיבת מליאה בתאריך 23/10/1979 בשעה 16:00","StartDate":"1979-10-23T16:00:00+02:00","FinishDate":"1979-10-23T22:02:00+02:00","IsSpecialMeeting":null,"LastUpdatedDate":"2020-12-20T01:50:23.867+02:00"}
{"Id":436531,"Number":263,"KnessetNum":9,"Name":"ישיבת מליאה בתאריך 30/10/1979 בשעה 16:00","StartDate":"1979-10-30T16:00:00+02:00","FinishDate":"1979-10-30T22:25:00+02:00","IsSpecialMeeting":null,"LastUpdatedDate":"2021-04-28T16:30:00.837+03:00"}
{"Id":436532,"Number":283,"KnessetNum":9,"Name":"ישיבת מליאה בתאריך 17/12/1979 בשעה 16:01","StartDate":"1979-12-17T16:01:00+02:00","FinishDate":"1979-12-17T19:43:00+02:00","IsSpecialMeeting":null,"LastUpdatedDate":"2021-04-28T19:40:47.19+03:00"}
{"Id":436533,"Number":284,"KnessetNum":9,"Name":"ישיבת מליאה בתאריך 18/12/1979 בשעה 16:02","StartDate":"1979-12-18T16:02:00+02:00","FinishDate":"1979-12-18T19:22:00+02:00","IsSpecialMeeting":null,"LastUpdatedDate":"2021-04-28T19:41:38.757+03:00"}
{"Id":436534,"Number":300,"KnessetNum":9,"Name":"ישיבת מליאה בתאריך 23/01/1980 בשעה 11:00","StartDate":"1980-01-23T11:00:00+02:00","FinishDate":"1980-01-23T14:38:00+02:00","IsSpecialMeeting":null,"LastUpdatedDate":"2021-02-15T01:29:18.08+02:00"}
{"Id":436535,"Number":312,"KnessetNum":9,"Name":"ישיבת מליאה בתאריך 20/02/1980 בשעה 11:01","StartDate":"1980-02-20T11:01:00+02:00","FinishDate":"1980-02-20T16:36:00+02:00","IsSpecialMeeting":null,"LastUpdatedDate":"2021-02-17T05:47:00.667+02:00"}
{"Id":436536,"Number":330,"KnessetNum":9,"Name":"ישיבת מליאה בתאריך 07/05/1980 בשעה 11:02","StartDate":"1980-05-07T11:02:00+03:00","FinishDate":"1980-05-07T12:54:00+03:00","IsSpecialMeeting":null,"LastUpdatedDate":"2021-02-24T02:58:34.523+02:00"}
{"Id":436537,"Number":334,"KnessetNum":9,"Name":"ישיבת מליאה בתאריך 19/05/1980 בשעה 16:03","StartDate":"1980-05-19T16:03:00+03:00","FinishDate":"1980-05-19T19:08:00+03:00","IsSpecialMeeting":null,"LastUpdatedDate":"2021-04-01T02:27:11.187+03:00"}
{"Id":436538,"Number":335,"KnessetNum":9,"Name":"ישיבת מליאה בתאריך 26/05/1980 בשעה 16:03","StartDate":"1980-05-26T16:03:00+03:00","FinishDate":"1980-05-26T22:27:00+03:00","IsSpecialMeeting":null,"LastUpdatedDate":"2021-04-01T03:31:22.35+03:00"}
{"Id":436539,"Number":336,"KnessetNum":9,"Name":"ישיבת מליאה בתאריך 27/05/1980 בשעה 16:02","StartDate":"1980-05-27T16:02:00+03:00","FinishDate":"1980-05-27T20:35:00+03:00","IsSpecialMeeting":null,"LastUpdatedDate":"2021-04-01T03:41:16.36+03:00"}
{"Id":436540,"Number":339,"KnessetNum":9,"Name":"ישיבת מליאה בתאריך 03/06/1980 בשעה 16:04","StartDate":"1980-06-03T16:04:00+03:00","FinishDate":"1980-06-03T20:23:00+03:00","IsSpecialMeeting":null,"LastUpdatedDate":"2025-01-29T11:12:30.837+02:00"}
{"Id":436541,"Number":340,"KnessetNum":9,"Name":"ישיבת מליאה בתאריך 04/06/1980 בשעה 11:02","StartDate":"1980-06-04T11:02:00+03:00","FinishDate":"1980-06-04T17:21:00+03:00","IsSpecialMeeting":null,"LastUpdatedDate":"2021-04-11T01:29:20.477+03:00"}
{"Id":436542,"Number":343,"KnessetNum":9,"Name":"ישיבת מליאה בתאריך 11/06/1980 בשעה 11:04","StartDate":"1980-06-11T11:04:00+03:00","FinishDate":"1980-06-11T17:17:00+03:00","IsSpecialMeeting":null,"LastUpdatedDate":"2021-05-03T17:44:10.61+03:00"}
{"Id":436543,"Number":344,"KnessetNum":9,"Name":"ישיבת מליאה בתאריך 16/06/1980 בשעה 16:02","StartDate":"1980-06-16T16:02:00+03:00","FinishDate":"1980-06-16T19:34:00+03:00","IsSpecialMeeting":null,"LastUpdatedDate":"2021-05-03T17:56:34.733+03:00"}
{"Id":436544,"Number":345,"KnessetNum":9,"Name":"ישיבת מליאה בתאריך 17/06/1980 בשעה 16:02","StartDate":"1980-06-17T16:02:00+03:00","FinishDate":"1980-06-17T19:20:00+03:00","IsSpecialMeeting":null,"LastUpdatedDate":"2021-05-03T22:10:36.263+03:00"}
{"Id":436545,"Number":346,"KnessetNum":9,"Name":"ישיבת מליאה בתאריך 18/06/1980 בשעה 11:01","StartDate":"1980-06-18T11:01:00+03:00","FinishDate":"1980-06-18T17:31:00+03:00","IsSpecialMeeting":null,"LastUpdatedDate":"2021-05-03T18:08:22.96+03:00"}
{"Id":436546,"Number":347,"KnessetNum":9,"Name":"ישיבת מליאה בתאריך 23/06/1980 בשעה 16:02","StartDate":"1980-06-23T16:02:00+03:00","FinishDate":"1980-06-23T20:35:00+03:00","IsSpecialMeeting":null,"LastUpdatedDate":"2021-05-03T18:13:45.01+03:00"}
{"Id":436547,"Number":349,"KnessetNum":9,"Name":"ישיבת מליאה בתאריך 25/06/1980 בשעה 11:04","StartDate":"1980-06-25T11:04:00+03:00","FinishDate":"1980-06-25T18:18:00+03:00","IsSpecialMeeting":null,"LastUpdatedDate":"2021-05-09T11:46:56.847+03:00"}
{"Id":436548,"Number":350,"KnessetNum":9,"Name":"ישיבת מליאה בתאריך 30/06/1980 בשעה 16:03","StartDate":"1980-06-30T16:03:00+03:00","FinishDate":"1980-06-30T19:09:00+03:00","IsSpecialMeeting":null,"LastUpdatedDate":"2021-05-17T13:29:44.423+03:00"}
{"Id":436549,"Number":351,"KnessetNum":9,"Name":"ישיבת מליאה בתאריך 01/07/1980 בשעה 16:00","StartDate":"1980-07-01T16:00:00+03:00","FinishDate":"1980-07-01T20:53:00+03:00","IsSpecialMeeting":null,"LastUpdatedDate":"2021-05-17T14:55:11.42+03:00"}
{"Id":436550,"Number":352,"KnessetNum":9,"Name":"ישיבת מליאה בתאריך 02/07/1980 בשעה 11:02","StartDate":"1980-07-02T11:02:00+03:00","FinishDate":"1980-07-02T13:50:00+03:00","IsSpecialMeeting":null,"LastUpdatedDate":"2021-05-18T01:42:12.487+03:00"}
{"Id":436551,"Number":357,"KnessetNum":9,"Name":"ישיבת מליאה בתאריך 15/07/1980 בשעה 16:01","StartDate":"1980-07-15T16:01:00+03:00","FinishDate":"1980-07-15T20:36:00+03:00","IsSpecialMeeting":null,"LastUpdatedDate":"2020-10-21T08:25:49.133+03:00"}
{"Id":436552,"Number":359,"KnessetNum":9,"Name":"ישיבת מליאה בתאריך 21/07/1980 בשעה 10:04","StartDate":"1980-07-21T10:04:00+03:00","FinishDate":"1980-07-21T14:15:00+03:00","IsSpecialMeeting":null,"LastUpdatedDate":"2020-10-20T11:39:22.92+03:00"}
{"Id":436553,"Number":363,"KnessetNum":9,"Name":"ישיבת מליאה בתאריך 30/07/1980 בשעה 10:05","StartDate":"1980-07-30T10:05:00+03:00","FinishDate":"1980-07-30T22:55:00+03:00","IsSpecialMeeting":null,"LastUpdatedDate":"2020-10-18T18:05:21.47+03:00"}
{"Id":436554,"Number":368,"KnessetNum":9,"Name":"ישיבת מליאה בתאריך 14/10/1980 בשעה 16:01","StartDate":"1980-10-14T16:01:00+02:00","FinishDate":"1980-10-14T19:50:00+02:00","IsSpecialMeeting":null,"LastUpdatedDate":"2020-10-18T10:03:00.28+03:00"}
{"Id":436555,"Number":369,"KnessetNum":9,"Name":"ישיבת מליאה בתאריך 15/10/1980 בשעה 11:02","StartDate":"1980-10-15T11:02:00+02:00","FinishDate":"1980-10-15T15:12:00+02:00","IsSpecialMeeting":null,"LastUpdatedDate":"2020-09-16T11:14:54.15+03:00"}
{"Id":436556,"Number":373,"KnessetNum":9,"Name":"ישיבת מליאה בתאריך 27/10/1980 בשעה 16:02","StartDate":"1980-10-27T16:02:00+02:00","FinishDate":"1980-10-27T19:12:00+02:00","IsSpecialMeeting":null,"LastUpdatedDate":"2020-09-09T13:52:43.717+03:00"}
{"Id":436557,"Number":415,"KnessetNum":9,"Name":"ישיבת מליאה בתאריך 02/02/1981 בשעה 16:03","StartDate":"1981-02-02T16:03:00+02:00","FinishDate":"1981-02-02T17:40:00+02:00","IsSpecialMeeting":null,"LastUpdatedDate":"2020-06-23T15:28:27.633+03:00"}
{"Id":436558,"Number":416,"KnessetNum":9,"Name":"ישיבת מליאה בתאריך 03/02/1981 בשעה 16:01","StartDate":"1981-02-03T16:01:00+02:00","FinishDate":"1981-02-03T19:40:00+02:00","IsSpecialMeeting":null,"LastUpdatedDate":"2020-06-24T15:54:02.057+03:00"}
{"Id":436559,"Number":417,"KnessetNum":9,"Name":"ישיבת מליאה בתאריך 04/02/1981 בשעה 11:02","StartDate":"1981-02-04T11:02:00+02:00","FinishDate":"1981-02-04T14:08:00+02:00","IsSpecialMeeting":null,"LastUpdatedDate":"2020-06-23T11:07:11.753+03:00"}
{"Id":436560,"Number":418,"KnessetNum":9,"Name":"ישיבת מליאה בתאריך 09/02/1981 בשעה 16:03","StartDate":"1981-02-09T16:03:00+02:00","FinishDate":"1981-02-09T19:18:00+02:00","IsSpecialMeeting":null,"LastUpdatedDate":"2020-06-23T09:55:50.497+03:00"}
{"Id":436561,"Number":419,"KnessetNum":9,"Name":"ישיבת מליאה בתאריך 10/02/1981 בשעה 16:01","StartDate":"1981-02-10T16:01:00+02:00","FinishDate":"1981-02-11T00:15:00+02:00","IsSpecialMeeting":null,"LastUpdatedDate":"2020-06-22T15:24:33.953+03:00"}
{"Id":436562,"Number":420,"KnessetNum":9,"Name":"ישיבת מליאה בתאריך 11/02/1981 בשעה 11:02","StartDate":"1981-02-11T11:02:00+02:00","FinishDate":"1981-02-11T16:09:00+02:00","IsSpecialMeeting":null,"LastUpdatedDate":"2020-06-22T14:06:14.52+03:00"}
{"Id":436563,"Number":421,"KnessetNum":9,"Name":"ישיבת מליאה בתאריך 16/02/1981 בשעה 16:05","StartDate":"1981-02-16T16:05:00+02:00","FinishDate":"1981-02-16T18:45:00+02:00","IsSpecialMeeting":null,"LastUpdatedDate":"2020-06-22T13:46:56.657+03:00"}
{"Id":436564,"Number":422,"KnessetNum":9,"Name":"ישיבת מליאה בתאריך 17/02/1981 בשעה 16:05","StartDate":"1981-02-17T16:05:00+02:00","FinishDate":"1981-02-17T19:32:00+02:00","IsSpecialMeeting":null,"LastUpdatedDate":"2020-06-22T13:30:24.747+03:00"}
{"Id":436565,"Number":423,"KnessetNum":9,"Name":"ישיבת מליאה בתאריך 18/02/1981 בשעה 11:02","StartDate":"1981-02-18T11:02:00+02:00","FinishDate":"1981-02-18T14:12:00+02:00","IsSpecialMeeting":null,"LastUpdatedDate":"2020-06-22T12:55:12.657+03:00"}
{"Id":436566,"Number":424,"KnessetNum":9,"Name":"ישיבת מליאה בתאריך 23/02/1981 בשעה 16:02","StartDate":"1981-02-23T16:02:00+02:00","FinishDate":"1981-02-23T20:53:00+02:00","IsSpecialMeeting":null,"LastUpdatedDate":"2020-06-22T10:14:57.683+03:00"}
{"Id":436567,"Number":426,"KnessetNum":9,"Name":"ישיבת מליאה בתאריך 25/02/1981 בשעה 11:00","StartDate":"1981-02-25T11:00:00+02:00","FinishDate":"1981-02-25T15:24:00+02:00","IsSpecialMeeting":null,"LastUpdatedDate":"2020-06-18T15:07:05.863+03:00"}
{"Id":436568,"Number":427,"KnessetNum":9,"Name":"ישיבת מליאה בתאריך 02/03/1981 בשעה 16:03","StartDate":"1981-03-02T16:03:00+02:00","FinishDate":"1981-03-02T19:22:00+02:00","IsSpecialMeeting":null,"LastUpdatedDate":"2020-06-18T14:37:14.487+03:00"}
{"Id":436569,"Number":428,"KnessetNum":9,"Name":"ישיבת מליאה בתאריך 03/03/1981 בשעה 16:01","StartDate":"1981-03-03T16:01:00+02:00","FinishDate":"1981-03-03T19:44:00+02:00","IsSpecialMeeting":null,"LastUpdatedDate":"2020-06-18T12:30:08.81+03:00"}
{"Id":436570,"Number":429,"KnessetNum":9,"Name":"ישיבת מליאה בתאריך 04/03/1981 בשעה 11:02","StartDate":"1981-03-04T11:02:00+02:00","FinishDate":"1981-03-04T16:19:00+02:00","IsSpecialMeeting":null,"LastUpdatedDate":"2020-10-27T17:34:54.527+02:00"}
{"Id":436571,"Number":430,"KnessetNum":9,"Name":"ישיבת מליאה בתאריך 09/03/1981 בשעה 16:04","StartDate":"1981-03-09T16:04:00+02:00","FinishDate":"1981-03-09T17:47:00+02:00","IsSpecialMeeting":null,"LastUpdatedDate":"2020-10-27T17:37:06.437+02:00"}
{"Id":436572,"Number":431,"KnessetNum":9,"Name":"ישיבת מליאה בתאריך 10/03/1981 בשעה 16:03","StartDate":"1981-03-10T16:03:00+02:00","FinishDate":"1981-03-10T22:05:00+02:00","IsSpecialMeeting":null,"LastUpdatedDate":"2020-06-17T19:48:29.49+03:00"}
{"Id":436573,"Number":432,"KnessetNum":9,"Name":"ישיבת מליאה בתאריך 11/03/1981 בשעה 11:02","StartDate":"1981-03-11T11:02:00+02:00","FinishDate":"1981-03-11T16:30:00+02:00","IsSpecialMeeting":null,"LastUpdatedDate":"2020-10-27T14:34:07.71+02:00"}
{"Id":436574,"Number":434,"KnessetNum":9,"Name":"ישיבת מליאה בתאריך 17/03/1981 בשעה 16:04","StartDate":"1981-03-17T16:04:00+02:00","FinishDate":"1981-03-17T23:58:00+02:00","IsSpecialMeeting":null,"LastUpdatedDate":"2020-06-15T10:53:18.23+03:00"}
{"Id":436575,"Number":435,"KnessetNum":9,"Name":"ישיבת מליאה בתאריך 18/03/1981 בשעה 11:01","StartDate":"1981-03-18T11:01:00+02:00","FinishDate":"1981-03-18T14:34:00+02:00","IsSpecialMeeting":null,"LastUpdatedDate":"2020-06-15T09:59:21.67+03:00"}
{"Id":436576,"Number":436,"KnessetNum":9,"Name":"ישיבת מליאה בתאריך 23/03/1981 בשעה 16:04","StartDate":"1981-03-23T16:04:00+02:00","FinishDate":"1981-03-23T20:21:00+02:00","IsSpecialMeeting":null,"LastUpdatedDate":"2020-06-15T08:09:51.973+03:00"}
{"Id":436577,"Number":437,"KnessetNum":9,"Name":"ישיבת מליאה בתאריך 24/03/1981 בשעה 16:03","StartDate":"1981-03-24T16:03:00+02:00","FinishDate":"1981-03-24T19:25:00+02:00","IsSpecialMeeting":null,"LastUpdatedDate":"2020-06-14T15:18:49.02+03:00"}
{"Id":436578,"Number":438,"KnessetNum":9,"Name":"ישיבת מליאה בתאריך 25/03/1981 בשעה 11:01","StartDate":"1981-03-25T11:01:00+02:00","FinishDate":"1981-03-25T17:30:00+02:00","IsSpecialMeeting":null,"LastUpdatedDate":"2020-06-14T11:31:50.867+03:00"}
{"Id":436579,"Number":439,"KnessetNum":9,"Name":"ישיבת מליאה בתאריך 30/03/1981 בשעה 16:04","StartDate":"1981-03-30T16:04:00+02:00","FinishDate":"1981-03-30T20:54:00+02:00","IsSpecialMeeting":null,"LastUpdatedDate":"2020-06-14T08:46:23.167+03:00"}
{"Id":436580,"Number":441,"KnessetNum":9,"Name":"ישיבת מליאה בתאריך 01/04/1981 בשעה 11:05","StartDate":"1981-04-01T11:05:00+03:00","FinishDate":"1981-04-01T19:06:00+03:00","IsSpecialMeeting":null,"LastUpdatedDate":"2020-06-11T11:55:58.747+03:00"}
{"Id":436581,"Number":443,"KnessetNum":9,"Name":"ישיבת מליאה בתאריך 12/05/1981 בשעה 16:07","StartDate":"1981-05-12T16:07:00+03:00","FinishDate":"1981-05-12T18:47:00+03:00","IsSpecialMeeting":null,"LastUpdatedDate":"2020-06-11T11:34:27.18+03:00"}
{"Id":436582,"Number":444,"KnessetNum":9,"Name":"ישיבת מליאה בתאריך 13/05/1981 בשעה 11:04","StartDate":"1981-05-13T11:04:00+03:00","FinishDate":"1981-05-13T13:23:00+03:00","IsSpecialMeeting":null,"LastUpdatedDate":"2020-06-11T11:33:39.573+03:00"}
{"Id":436583,"Number":445,"KnessetNum":9,"Name":"ישיבת מליאה בתאריך 18/05/1981 בשעה 16:04","StartDate":"1981-05-18T16:04:00+03:00","FinishDate":"1981-05-18T17:50:00+03:00","IsSpecialMeeting":null,"LastUpdatedDate":"2019-12-17T08:25:37.987+02:00"}
{"Id":436584,"Number":446,"KnessetNum":9,"Name":"ישיבת מליאה בתאריך 19/05/1981 בשעה 16:02","StartDate":"1981-05-19T16:02:00+03:00","FinishDate":"1981-05-19T19:14:00+03:00","IsSpecialMeeting":null,"LastUpdatedDate":"2020-06-10T17:03:49.06+03:00"}
{"Id":436585,"Number":447,"KnessetNum":9,"Name":"ישיבת מליאה בתאריך 20/05/1981 בשעה 11:02","StartDate":"1981-05-20T11:02:00+03:00","FinishDate":"1981-05-20T19:06:00+03:00","IsSpecialMeeting":null,"LastUpdatedDate":"2020-06-09T10:46:47.95+03:00"}
{"Id":436587,"Number":450,"KnessetNum":9,"Name":"ישיבת מליאה בתאריך 15/06/1981 בשעה 10:04","StartDate":"1981-06-15T10:04:00+03:00","FinishDate":"1981-06-15T13:35:00+03:00","IsSpecialMeeting":null,"LastUpdatedDate":"2018-05-15T12:37:20.553+03:00"}
{"Id":436588,"Number":5,"KnessetNum":10,"Name":"ישיבת מליאה בתאריך 03/08/1981 בשעה 16:03","StartDate":"1981-08-03T16:03:00+03:00","FinishDate":"1981-08-03T19:10:00+03:00","IsSpecialMeeting":null,"LastUpdatedDate":"2025-01-29T12:39:58.527+02:00"}
{"Id":436589,"Number":9,"KnessetNum":10,"Name":"ישיבת מליאה בתאריך 11/08/1981 בשעה 16:01","StartDate":"1981-08-11T16:01:00+03:00","FinishDate":"1981-08-11T20:23:00+03:00","IsSpecialMeeting":null,"LastUpdatedDate":"2023-02-26T08:20:30.34+02:00"}
{"Id":436590,"Number":10,"KnessetNum":10,"Name":"ישיבת מליאה בתאריך 12/08/1981 בשעה 11:02","StartDate":"1981-08-12T11:02:00+03:00","FinishDate":"1981-08-12T15:48:00+03:00","IsSpecialMeeting":null,"LastUpdatedDate":"2023-02-26T08:23:14.627+02:00"}
{"Id":436591,"Number":13,"KnessetNum":10,"Name":"ישיבת מליאה בתאריך 26/08/1981 בשעה 11:06","StartDate":"1981-08-26T11:06:00+03:00","FinishDate":"1981-08-26T13:36:00+03:00","IsSpecialMeeting":null,"LastUpdatedDate":"2023-03-01T09:19:25.52+02:00"}
{"Id":436592,"Number":16,"KnessetNum":10,"Name":"ישיבת מליאה בתאריך 04/11/1981 בשעה 11:01","StartDate":"1981-11-04T11:01:00+02:00","FinishDate":"1981-11-04T14:00:00+02:00","IsSpecialMeeting":null,"LastUpdatedDate":"2023-03-01T12:52:07.733+02:00"}
{"Id":436593,"Number":17,"KnessetNum":10,"Name":"ישיבת מליאה בתאריך 09/11/1981 בשעה 16:03","StartDate":"1981-11-09T16:03:00+02:00","FinishDate":"1981-11-09T17:58:00+02:00","IsSpecialMeeting":null,"LastUpdatedDate":"2024-01-29T11:40:20.86+02:00"}
{"Id":436594,"Number":18,"KnessetNum":10,"Name":"ישיבת מליאה בתאריך 10/11/1981 בשעה 16:03","StartDate":"1981-11-10T16:03:00+02:00","FinishDate":"1981-11-10T19:46:00+02:00","IsSpecialMeeting":null,"LastUpdatedDate":"2023-03-01T14:38:00.317+02:00"}
{"Id":436595,"Number":20,"KnessetNum":10,"Name":"ישיבת מליאה בתאריך 16/11/1981 בשעה 16:04","StartDate":"1981-11-16T16:04:00+02:00","FinishDate":"1981-11-16T18:46:00+02:00","IsSpecialMeeting":null,"LastUpdatedDate":"2023-03-02T10:43:32.203+02:00"}
{"Id":436596,"Number":21,"KnessetNum":10,"Name":"ישיבת מליאה בתאריך 17/11/1981 בשעה 16:02","StartDate":"1981-11-17T16:02:00+02:00","FinishDate":"1981-11-17T20:21:00+02:00","IsSpecialMeeting":null,"LastUpdatedDate":"2023-03-02T11:46:52.787+02:00"}
{"Id":436597,"Number":23,"KnessetNum":10,"Name":"ישיבת מליאה בתאריך 23/11/1981 בשעה 16:03","StartDate":"1981-11-23T16:03:00+02:00","FinishDate":"1981-11-23T18:25:00+02:00","IsSpecialMeeting":null,"LastUpdatedDate":"2023-03-13T11:02:22.467+02:00"}
{"Id":436598,"Number":24,"KnessetNum":10,"Name":"ישיבת מליאה בתאריך 24/11/1981 בשעה 16:00","StartDate":"1981-11-24T16:00:00+02:00","FinishDate":"1981-11-24T17:42:00+02:00","IsSpecialMeeting":null,"LastUpdatedDate":"2023-03-13T11:47:41.463+02:00"}
{"Id":436599,"Number":25,"KnessetNum":10,"Name":"ישיבת מליאה בתאריך 25/11/1981 בשעה 11:00","StartDate":"1981-11-25T11:00:00+02:00","FinishDate":"1981-11-25T15:18:00+02:00","IsSpecialMeeting":null,"LastUpdatedDate":"2023-03-13T16:34:16.677+02:00"}
{"Id":436600,"Number":26,"KnessetNum":10,"Name":"ישיבת מליאה בתאריך 30/11/1981 בשעה 16:04","StartDate":"1981-11-30T16:04:00+02:00","FinishDate":"1981-11-30T18:40:00+02:00","IsSpecialMeeting":null,"LastUpdatedDate":"2023-03-16T07:51:41.933+02:00"}
{"Id":436601,"Number":30,"KnessetNum":10,"Name":"ישיבת מליאה בתאריך 08/12/1981 בשעה 16:01","StartDate":"1981-12-08T16:01:00+02:00","FinishDate":"1981-12-08T19:15:00+02:00","IsSpecialMeeting":null,"LastUpdatedDate":"2023-03-20T10:55:25.787+02:00"}
{"Id":436602,"Number":38,"KnessetNum":10,"Name":"ישיבת מליאה בתאריך 29/12/1981 בשעה 16:03","StartDate":"1981-12-29T16:03:00+02:00","FinishDate":"1981-12-29T20:05:00+02:00","IsSpecialMeeting":null,"LastUpdatedDate":"2023-03-21T14:26:35.137+02:00"}
{"Id":436603,"Number":40,"KnessetNum":10,"Name":"ישיבת מליאה בתאריך 04/01/1982 בשעה 16:04","StartDate":"1982-01-04T16:04:00+02:00","FinishDate":"1982-01-04T19:05:00+02:00","IsSpecialMeeting":null,"LastUpdatedDate":"2023-03-23T12:54:09.35+02:00"}
{"Id":436604,"Number":41,"KnessetNum":10,"Name":"ישיבת מליאה בתאריך 05/01/1982 בשעה 16:02","StartDate":"1982-01-05T16:02:00+02:00","FinishDate":"1982-01-05T17:01:00+02:00","IsSpecialMeeting":null,"LastUpdatedDate":"2023-03-26T11:51:51.56+03:00"}
{"Id":436605,"Number":43,"KnessetNum":10,"Name":"ישיבת מליאה בתאריך 11/01/1982 בשעה 16:04","StartDate":"1982-01-11T16:04:00+02:00","FinishDate":"1982-01-11T18:12:00+02:00","IsSpecialMeeting":null,"LastUpdatedDate":"2024-01-29T11:45:10.463+02:00"}
{"Id":436606,"Number":45,"KnessetNum":10,"Name":"ישיבת מליאה בתאריך 13/01/1982 בשעה 11:04","StartDate":"1982-01-13T11:04:00+02:00","FinishDate":"1982-01-13T14:15:00+02:00","IsSpecialMeeting":null,"LastUpdatedDate":"2023-03-27T11:05:27.983+03:00"}
{"Id":436607,"Number":51,"KnessetNum":10,"Name":"ישיבת מליאה בתאריך 27/01/1982 בשעה 11:05","StartDate":"1982-01-27T11:05:00+02:00","FinishDate":"1982-01-27T15:51:00+02:00","IsSpecialMeeting":null,"LastUpdatedDate":"2023-03-30T10:06:59.557+03:00"}
{"Id":436608,"Number":55,"KnessetNum":10,"Name":"ישיבת מליאה בתאריך 08/02/1982 בשעה 16:02","StartDate":"1982-02-08T16:02:00+02:00","FinishDate":"1982-02-08T17:04:00+02:00","IsSpecialMeeting":null,"LastUpdatedDate":"2023-04-03T09:07:44.183+03:00"}
{"Id":436609,"Number":56,"KnessetNum":10,"Name":"ישיבת מליאה בתאריך 09/02/1982 בשעה 16:04","StartDate":"1982-02-09T16:04:00+02:00","FinishDate":"1982-02-09T20:25:00+02:00","IsSpecialMeeting":null,"LastUpdatedDate":"2023-04-03T09:12:35.14+03:00"}
{"Id":436610,"Number":57,"KnessetNum":10,"Name":"ישיבת מליאה בתאריך 10/02/1982 בשעה 11:03","StartDate":"1982-02-10T11:03:00+02:00","FinishDate":"1982-02-10T16:10:00+02:00","IsSpecialMeeting":null,"LastUpdatedDate":"2024-02-18T09:34:23.293+02:00"}
{"Id":436611,"Number":59,"KnessetNum":10,"Name":"ישיבת מליאה בתאריך 16/02/1982 בשעה 16:04","StartDate":"1982-02-16T16:04:00+02:00","FinishDate":"1982-02-16T21:01:00+02:00","IsSpecialMeeting":null,"LastUpdatedDate":"2023-04-17T11:14:24.213+03:00"}
{"Id":436612,"Number":60,"KnessetNum":10,"Name":"ישיבת מליאה בתאריך 17/02/1982 בשעה 11:08","StartDate":"1982-02-17T11:08:00+02:00","FinishDate":"1982-02-17T15:35:00+02:00","IsSpecialMeeting":null,"LastUpdatedDate":"2023-04-18T08:15:11.02+03:00"}
{"Id":436613,"Number":61,"KnessetNum":10,"Name":"ישיבת מליאה בתאריך 22/02/1982 בשעה 16:05","StartDate":"1982-02-22T16:05:00+02:00","FinishDate":"1982-02-22T18:36:00+02:00","IsSpecialMeeting":null,"LastUpdatedDate":"2023-04-20T08:18:05.287+03:00"}
{"Id":436614,"Number":62,"KnessetNum":10,"Name":"ישיבת מליאה בתאריך 23/02/1982 בשעה 16:00","StartDate":"1982-02-23T16:00:00+02:00","FinishDate":"1982-02-23T19:28:00+02:00","IsSpecialMeeting":null,"LastUpdatedDate":"2023-04-20T10:17:57.823+03:00"}
{"Id":436615,"Number":63,"KnessetNum":10,"Name":"ישיבת מליאה בתאריך 24/02/1982 בשעה 11:10","StartDate":"1982-02-24T11:10:00+02:00","FinishDate":"1982-02-24T12:45:00+02:00","IsSpecialMeeting":null,"LastUpdatedDate":"2019-12-23T13:31:01.38+02:00"}
{"Id":436616,"Number":64,"KnessetNum":10,"Name":"ישיבת מליאה בתאריך 01/03/1982 בשעה 16:03","StartDate":"1982-03-01T16:03:00+02:00","FinishDate":"1982-03-01T19:17:00+02:00","IsSpecialMeeting":null,"LastUpdatedDate":"2023-04-20T11:24:00.013+03:00"}
{"Id":436617,"Number":65,"KnessetNum":10,"Name":"ישיבת מליאה בתאריך 02/03/1982 בשעה 15:03","StartDate":"1982-03-02T15:03:00+02:00","FinishDate":"1982-03-02T22:43:00+02:00","IsSpecialMeeting":null,"LastUpdatedDate":"2023-04-20T11:46:31.683+03:00"}
{"Id":436618,"Number":66,"KnessetNum":10,"Name":"ישיבת מליאה בתאריך 03/03/1982 בשעה 11:12","StartDate":"1982-03-03T11:12:00+02:00","FinishDate":"1982-03-03T13:18:00+02:00","IsSpecialMeeting":null,"LastUpdatedDate":"2023-04-24T07:59:38.163+03:00"}
{"Id":436619,"Number":68,"KnessetNum":10,"Name":"ישיבת מליאה בתאריך 08/03/1982 בשעה 10:04","StartDate":"1982-03-08T10:04:00+02:00","FinishDate":"1982-03-08T12:39:00+02:00","IsSpecialMeeting":null,"LastUpdatedDate":"2023-04-24T11:29:19.423+03:00"}
{"Id":436620,"Number":70,"KnessetNum":10,"Name":"ישיבת מליאה בתאריך 15/03/1982 בשעה 14:06","StartDate":"1982-03-15T14:06:00+02:00","FinishDate":"1982-03-15T17:58:00+02:00","IsSpecialMeeting":null,"LastUpdatedDate":"2023-04-24T13:26:24.343+03:00"}
{"Id":436621,"Number":71,"KnessetNum":10,"Name":"ישיבת מליאה בתאריך 16/03/1982 בשעה 16:04","StartDate":"1982-03-16T16:04:00+02:00","FinishDate":"1982-03-16T18:03:00+02:00","IsSpecialMeeting":null,"LastUpdatedDate":"2023-04-27T11:06:13.63+03:00"}
{"Id":436622,"Number":72,"KnessetNum":10,"Name":"ישיבת מליאה בתאריך 17/03/1982 בשעה 11:04","StartDate":"1982-03-17T11:04:00+02:00","FinishDate":"1982-03-17T12:55:00+02:00","IsSpecialMeeting":null,"LastUpdatedDate":"2023-04-30T09:30:35.16+03:00"}
{"Id":436623,"Number":73,"KnessetNum":10,"Name":"ישיבת מליאה בתאריך 22/03/1982 בשעה 16:04","StartDate":"1982-03-22T16:04:00+02:00","FinishDate":"1982-03-22T18:31:00+02:00","IsSpecialMeeting":null,"LastUpdatedDate":"2023-04-30T09:58:18.613+03:00"}
{"Id":436625,"Number":105,"KnessetNum":10,"Name":"ישיבת מליאה בתאריך 05/07/1982 בשעה 16:05","StartDate":"1982-07-05T16:05:00+03:00","FinishDate":"1982-07-05T19:40:00+03:00","IsSpecialMeeting":null,"LastUpdatedDate":"2023-05-09T16:17:48.42+03:00"}
{"Id":436626,"Number":109,"KnessetNum":10,"Name":"ישיבת מליאה בתאריך 13/07/1982 בשעה 16:03","StartDate":"1982-07-13T16:03:00+03:00","FinishDate":"1982-07-13T17:35:00+03:00","IsSpecialMeeting":null,"LastUpdatedDate":"2023-05-10T14:05:00.197+03:00"}
{"Id":436627,"Number":111,"KnessetNum":10,"Name":"ישיבת מליאה בתאריך 19/07/1982 בשעה 16:03","StartDate":"1982-07-19T16:03:00+03:00","FinishDate":"1982-07-19T21:25:00+03:00","IsSpecialMeeting":null,"LastUpdatedDate":"2023-05-14T08:09:17.09+03:00"}
{"Id":436628,"Number":128,"KnessetNum":10,"Name":"ישיבת מליאה בתאריך 27/10/1982 בשעה 11:04","StartDate":"1982-10-27T11:04:00+02:00","FinishDate":"1982-10-27T14:29:00+02:00","IsSpecialMeeting":null,"LastUpdatedDate":"2023-05-21T09:52:08.167+03:00"}
{"Id":436629,"Number":129,"KnessetNum":10,"Name":"ישיבת מליאה בתאריך 01/11/1982 בשעה 16:04","StartDate":"1982-11-01T16:04:00+02:00","FinishDate":"1982-11-01T18:16:00+02:00","IsSpecialMeeting":null,"LastUpdatedDate":"2023-05-21T10:35:07.95+03:00"}
{"Id":436630,"Number":131,"KnessetNum":10,"Name":"ישיבת מליאה בתאריך 03/11/1982 בשעה 11:02","StartDate":"1982-11-03T11:02:00+02:00","FinishDate":"1982-11-03T15:13:00+02:00","IsSpecialMeeting":null,"LastUpdatedDate":"2023-05-22T08:17:34.267+03:00"}
{"Id":436631,"Number":132,"KnessetNum":10,"Name":"ישיבת מליאה בתאריך 08/11/1982 בשעה 16:02","StartDate":"1982-11-08T16:02:00+02:00","FinishDate":"1982-11-08T18:03:00+02:00","IsSpecialMeeting":null,"LastUpdatedDate":"2024-03-13T12:20:46.533+02:00"}
{"Id":436632,"Number":134,"KnessetNum":10,"Name":"ישיבת מליאה בתאריך 10/11/1982 בשעה 11:04","StartDate":"1982-11-10T11:04:00+02:00","FinishDate":"1982-11-10T15:11:00+02:00","IsSpecialMeeting":null,"LastUpdatedDate":"2023-05-22T09:44:14.11+03:00"}
{"Id":436633,"Number":136,"KnessetNum":10,"Name":"ישיבת מליאה בתאריך 16/11/1982 בשעה 16:03","StartDate":"1982-11-16T16:03:00+02:00","FinishDate":"1982-11-16T19:22:00+02:00","IsSpecialMeeting":null,"LastUpdatedDate":"2023-05-22T10:51:52.463+03:00"}
{"Id":436634,"Number":137,"KnessetNum":10,"Name":"ישיבת מליאה בתאריך 17/11/1982 בשעה 11:07","StartDate":"1982-11-17T11:07:00+02:00","FinishDate":"1982-11-17T13:31:00+02:00","IsSpecialMeeting":null,"LastUpdatedDate":"2023-05-23T08:45:58.78+03:00"}
{"Id":436635,"Number":138,"KnessetNum":10,"Name":"ישיבת מליאה בתאריך 22/11/1982 בשעה 16:03","StartDate":"1982-11-22T16:03:00+02:00","FinishDate":"1982-11-22T17:35:00+02:00","IsSpecialMeeting":null,"LastUpdatedDate":"2023-05-23T10:49:43.45+03:00"}
{"Id":436636,"Number":141,"KnessetNum":10,"Name":"ישיבת מליאה בתאריך 29/11/1982 בשעה 16:03","StartDate":"1982-11-29T16:03:00+02:00","FinishDate":"1982-11-29T20:52:00+02:00","IsSpecialMeeting":null,"LastUpdatedDate":"2023-05-23T12:40:00.187+03:00"}
{"Id":436637,"Number":142,"KnessetNum":10,"Name":"ישיבת מליאה בתאריך 30/11/1982 בשעה 16:05","StartDate":"1982-11-30T16:05:00+02:00","FinishDate":"1982-11-30T20:13:00+02:00","IsSpecialMeeting":null,"LastUpdatedDate":"2023-05-23T14:23:10.27+03:00"}
{"Id":436638,"Number":143,"KnessetNum":10,"Name":"ישיבת מליאה בתאריך 01/12/1982 בשעה 11:04","StartDate":"1982-12-01T11:04:00+02:00","FinishDate":"1982-12-01T15:02:00+02:00","IsSpecialMeeting":null,"LastUpdatedDate":"2023-05-23T14:29:00.997+03:00"}
{"Id":436639,"Number":144,"KnessetNum":10,"Name":"ישיבת מליאה בתאריך 06/12/1982 בשעה 16:07","StartDate":"1982-12-06T16:07:00+02:00","FinishDate":"1982-12-06T19:03:00+02:00","IsSpecialMeeting":null,"LastUpdatedDate":"2023-05-23T15:16:43.94+03:00"}
{"Id":436640,"Number":145,"KnessetNum":10,"Name":"ישיבת מליאה בתאריך 07/12/1982 בשעה 16:01","StartDate":"1982-12-07T16:01:00+02:00","FinishDate":"1982-12-07T17:04:00+02:00","IsSpecialMeeting":null,"LastUpdatedDate":"2023-05-23T15:21:40.567+03:00"}
{"Id":436641,"Number":146,"KnessetNum":10,"Name":"ישיבת מליאה בתאריך 08/12/1982 בשעה 11:03","StartDate":"1982-12-08T11:03:00+02:00","FinishDate":"1982-12-08T13:19:00+02:00","IsSpecialMeeting":null,"LastUpdatedDate":"2023-05-28T08:34:23.42+03:00"}
{"Id":436642,"Number":147,"KnessetNum":10,"Name":"ישיבת מליאה בתאריך 13/12/1982 בשעה 16:04","StartDate":"1982-12-13T16:04:00+02:00","FinishDate":"1982-12-13T17:29:00+02:00","IsSpecialMeeting":null,"LastUpdatedDate":"2023-05-28T08:39:28.353+03:00"}
{"Id":436643,"Number":148,"KnessetNum":10,"Name":"ישיבת מליאה בתאריך 14/12/1982 בשעה 16:06","StartDate":"1982-12-14T16:06:00+02:00","FinishDate":"1982-12-14T18:59:00+02:00","IsSpecialMeeting":null,"LastUpdatedDate":"2023-05-28T09:21:23.517+03:00"}
{"Id":436644,"Number":149,"KnessetNum":10,"Name":"ישיבת מליאה בתאריך 15/12/1982 בשעה 11:02","StartDate":"1982-12-15T11:02:00+02:00","FinishDate":"1982-12-15T14:00:00+02:00","IsSpecialMeeting":null,"LastUpdatedDate":"2023-05-28T12:06:55.23+03:00"}
{"Id":436645,"Number":150,"KnessetNum":10,"Name":"ישיבת מליאה בתאריך 20/12/1982 בשעה 16:03","StartDate":"1982-12-20T16:03:00+02:00","FinishDate":"1982-12-20T20:57:00+02:00","IsSpecialMeeting":null,"LastUpdatedDate":"2023-05-28T12:18:15.307+03:00"}
{"Id":436646,"Number":151,"KnessetNum":10,"Name":"ישיבת מליאה בתאריך 21/12/1982 בשעה 16:04","StartDate":"1982-12-21T16:04:00+02:00","FinishDate":"1982-12-21T18:16:00+02:00","IsSpecialMeeting":null,"LastUpdatedDate":"2023-05-29T09:23:57.523+03:00"}
{"Id":436647,"Number":152,"KnessetNum":10,"Name":"ישיבת מליאה בתאריך 22/12/1982 בשעה 11:01","StartDate":"1982-12-22T11:01:00+02:00","FinishDate":"1982-12-22T15:23:00+02:00","IsSpecialMeeting":null,"LastUpdatedDate":"2023-05-29T09:42:02.773+03:00"}
{"Id":436648,"Number":153,"KnessetNum":10,"Name":"ישיבת מליאה בתאריך 27/12/1982 בשעה 16:02","StartDate":"1982-12-27T16:02:00+02:00","FinishDate":"1982-12-27T18:21:00+02:00","IsSpecialMeeting":null,"LastUpdatedDate":"2023-05-29T10:44:34.757+03:00"}
{"Id":436649,"Number":154,"KnessetNum":10,"Name":"ישיבת מליאה בתאריך 28/12/1982 בשעה 16:02","StartDate":"1982-12-28T16:02:00+02:00","FinishDate":"1982-12-28T20:06:00+02:00","IsSpecialMeeting":null,"LastUpdatedDate":"2023-05-29T15:12:18.71+03:00"}
{"Id":436650,"Number":156,"KnessetNum":10,"Name":"ישיבת מליאה בתאריך 03/01/1983 בשעה 16:03","StartDate":"1983-01-03T16:03:00+02:00","FinishDate":"1983-01-03T19:27:00+02:00","IsSpecialMeeting":null,"LastUpdatedDate":"2023-06-04T12:14:55.277+03:00"}
{"Id":436651,"Number":158,"KnessetNum":10,"Name":"ישיבת מליאה בתאריך 05/01/1983 בשעה 11:04","StartDate":"1983-01-05T11:04:00+02:00","FinishDate":"1983-01-05T15:17:00+02:00","IsSpecialMeeting":null,"LastUpdatedDate":"2023-06-05T12:49:03.667+03:00"}
{"Id":436652,"Number":159,"KnessetNum":10,"Name":"ישיבת מליאה בתאריך 10/01/1983 בשעה 16:03","StartDate":"1983-01-10T16:03:00+02:00","FinishDate":"1983-01-10T18:38:00+02:00","IsSpecialMeeting":null,"LastUpdatedDate":"2023-06-05T13:50:55.26+03:00"}
{"Id":436653,"Number":163,"KnessetNum":10,"Name":"ישיבת מליאה בתאריך 18/01/1983 בשעה 16:00","StartDate":"1983-01-18T16:00:00+02:00","FinishDate":"1983-01-18T19:05:00+02:00","IsSpecialMeeting":null,"LastUpdatedDate":"2023-06-06T13:40:16.993+03:00"}
{"Id":436654,"Number":164,"KnessetNum":10,"Name":"ישיבת מליאה בתאריך 19/01/1983 בשעה 11:03","StartDate":"1983-01-19T11:03:00+02:00","FinishDate":"1983-01-19T16:23:00+02:00","IsSpecialMeeting":null,"LastUpdatedDate":"2023-06-06T14:32:02.9+03:00"}
{"Id":436655,"Number":165,"KnessetNum":10,"Name":"ישיבת מליאה בתאריך 24/01/1983 בשעה 16:03","StartDate":"1983-01-24T16:03:00+02:00","FinishDate":"1983-01-24T21:02:00+02:00","IsSpecialMeeting":null,"LastUpdatedDate":"2023-06-07T08:15:51.56+03:00"}
{"Id":436656,"Number":166,"KnessetNum":10,"Name":"ישיבת מליאה בתאריך 25/01/1983 בשעה 16:01","StartDate":"1983-01-25T16:01:00+02:00","FinishDate":"1983-01-25T21:52:00+02:00","IsSpecialMeeting":null,"LastUpdatedDate":"2023-06-07T08:27:56.22+03:00"}
{"Id":436657,"Number":167,"KnessetNum":10,"Name":"ישיבת מליאה בתאריך 26/01/1983 בשעה 11:04","StartDate":"1983-01-26T11:04:00+02:00","FinishDate":"1983-01-26T14:57:00+02:00","IsSpecialMeeting":null,"LastUpdatedDate":"2023-06-08T11:30:10.153+03:00"}
{"Id":436658,"Number":172,"KnessetNum":10,"Name":"ישיבת מליאה בתאריך 08/02/1983 בשעה 11:02","StartDate":"1983-02-08T11:02:00+02:00","FinishDate":"1983-02-08T18:32:00+02:00","IsSpecialMeeting":null,"LastUpdatedDate":"2023-06-12T10:57:37.29+03:00"}
{"Id":436659,"Number":173,"KnessetNum":10,"Name":"ישיבת מליאה בתאריך 09/02/1983 בשעה 11:02","StartDate":"1983-02-09T11:02:00+02:00","FinishDate":"1983-02-09T12:50:00+02:00","IsSpecialMeeting":null,"LastUpdatedDate":"2023-06-14T09:55:05.53+03:00"}
{"Id":436660,"Number":174,"KnessetNum":10,"Name":"ישיבת מליאה בתאריך 14/02/1983 בשעה 16:04","StartDate":"1983-02-14T16:04:00+02:00","FinishDate":"1983-02-14T21:37:00+02:00","IsSpecialMeeting":null,"LastUpdatedDate":"2023-06-14T09:57:38.523+03:00"}
{"Id":436661,"Number":177,"KnessetNum":10,"Name":"ישיבת מליאה בתאריך 21/02/1983 בשעה 16:03","StartDate":"1983-02-21T16:03:00+02:00","FinishDate":"1983-02-21T18:04:00+02:00","IsSpecialMeeting":null,"LastUpdatedDate":"2023-06-14T11:18:20.81+03:00"}
{"Id":436662,"Number":178,"KnessetNum":10,"Name":"ישיבת מליאה בתאריך 22/02/1983 בשעה 16:03","StartDate":"1983-02-22T16:03:00+02:00","FinishDate":"1983-02-22T19:32:00+02:00","IsSpecialMeeting":null,"LastUpdatedDate":"2023-06-14T11:57:20.173+03:00"}
{"Id":436663,"Number":180,"KnessetNum":10,"Name":"ישיבת מליאה בתאריך 01/03/1983 בשעה 16:01","StartDate":"1983-03-01T16:01:00+02:00","FinishDate":"1983-03-01T19:08:00+02:00","IsSpecialMeeting":null,"LastUpdatedDate":"2023-06-18T11:13:41.07+03:00"}
{"Id":436664,"Number":181,"KnessetNum":10,"Name":"ישיבת מליאה בתאריך 02/03/1983 בשעה 16:02","StartDate":"1983-03-02T16:02:00+02:00","FinishDate":"1983-03-02T20:29:00+02:00","IsSpecialMeeting":null,"LastUpdatedDate":"2023-06-19T10:30:28.707+03:00"}
{"Id":436665,"Number":182,"KnessetNum":10,"Name":"ישיבת מליאה בתאריך 03/03/1983 בשעה 11:03","StartDate":"1983-03-03T11:03:00+02:00","FinishDate":"1983-03-03T16:27:00+02:00","IsSpecialMeeting":null,"LastUpdatedDate":"2023-06-19T10:38:42.42+03:00"}
{"Id":436666,"Number":183,"KnessetNum":10,"Name":"ישיבת מליאה בתאריך 07/03/1983 בשעה 16:08","StartDate":"1983-03-07T16:08:00+02:00","FinishDate":"1983-03-07T19:50:00+02:00","IsSpecialMeeting":null,"LastUpdatedDate":"2023-06-20T07:51:50.35+03:00"}
{"Id":436667,"Number":187,"KnessetNum":10,"Name":"ישיבת מליאה בתאריך 14/03/1983 בשעה 16:02","StartDate":"1983-03-14T16:02:00+02:00","FinishDate":"1983-03-14T18:25:00+02:00","IsSpecialMeeting":null,"LastUpdatedDate":"2024-02-04T09:42:22.303+02:00"}
{"Id":436668,"Number":188,"KnessetNum":10,"Name":"ישיבת מליאה בתאריך 15/03/1983 בשעה 16:01","StartDate":"1983-03-15T16:01:00+02:00","FinishDate":"1983-03-15T19:30:00+02:00","IsSpecialMeeting":null,"LastUpdatedDate":"2023-06-20T12:48:55.48+03:00"}
{"Id":436669,"Number":189,"KnessetNum":10,"Name":"ישיבת מליאה בתאריך 16/03/1983 בשעה 11:03","StartDate":"1983-03-16T11:03:00+02:00","FinishDate":"1983-03-16T13:40:00+02:00","IsSpecialMeeting":null,"LastUpdatedDate":"2023-06-20T13:39:47.693+03:00"}
{"Id":436670,"Number":190,"KnessetNum":10,"Name":"ישיבת מליאה בתאריך 21/03/1983 בשעה 16:04","StartDate":"1983-03-21T16:04:00+02:00","FinishDate":"1983-03-21T22:26:00+02:00","IsSpecialMeeting":null,"LastUpdatedDate":"2023-06-20T15:04:19.127+03:00"}
{"Id":436671,"Number":193,"KnessetNum":10,"Name":"ישיבת מליאה בתאריך 23/03/1983 בשעה 09:04","StartDate":"1983-03-23T09:04:00+02:00","FinishDate":"1983-03-23T18:18:00+02:00","IsSpecialMeeting":null,"LastUpdatedDate":"2023-06-22T08:52:43.663+03:00"}
{"Id":436672,"Number":195,"KnessetNum":10,"Name":"ישיבת מליאה בתאריך 02/05/1983 בשעה 16:03","StartDate":"1983-05-02T16:03:00+03:00","FinishDate":"1983-05-02T19:10:00+03:00","IsSpecialMeeting":null,"LastUpdatedDate":"2023-06-25T13:02:52.497+03:00"}
{"Id":436673,"Number":197,"KnessetNum":10,"Name":"ישיבת מליאה בתאריך 04/05/1983 בשעה 11:02","StartDate":"1983-05-04T11:02:00+03:00","FinishDate":"1983-05-04T13:42:00+03:00","IsSpecialMeeting":null,"LastUpdatedDate":"2023-06-25T13:15:04.063+03:00"}
{"Id":436674,"Number":199,"KnessetNum":10,"Name":"ישיבת מליאה בתאריך 09/05/1983 בשעה 16:02","StartDate":"1983-05-09T16:02:00+03:00","FinishDate":"1983-05-09T20:02:00+03:00","IsSpecialMeeting":null,"LastUpdatedDate":"2024-02-04T09:46:00.56+02:00"}
{"Id":436675,"Number":206,"KnessetNum":10,"Name":"ישיבת מליאה בתאריך 30/05/1983 בשעה 16:04","StartDate":"1983-05-30T16:04:00+03:00","FinishDate":"1983-05-30T17:21:00+03:00","IsSpecialMeeting":null,"LastUpdatedDate":"2023-06-27T08:31:35.74+03:00"}
{"Id":436676,"Number":211,"KnessetNum":10,"Name":"ישיבת מליאה בתאריך 08/06/1983 בשעה 11:04","StartDate":"1983-06-08T11:04:00+03:00","FinishDate":"1983-06-08T14:34:00+03:00","IsSpecialMeeting":null,"LastUpdatedDate":"2023-06-29T11:07:10.16+03:00"}
{"Id":436677,"Number":212,"KnessetNum":10,"Name":"ישיבת מליאה בתאריך 13/06/1983 בשעה 16:03","StartDate":"1983-06-13T16:03:00+03:00","FinishDate":"1983-06-13T19:07:00+03:00","IsSpecialMeeting":null,"LastUpdatedDate":"2023-07-02T08:28:02.817+03:00"}
{"Id":436678,"Number":213,"KnessetNum":10,"Name":"ישיבת מליאה בתאריך 14/06/1983 בשעה 16:02","StartDate":"1983-06-14T16:02:00+03:00","FinishDate":"1983-06-14T18:59:00+03:00","IsSpecialMeeting":null,"LastUpdatedDate":"2023-07-02T08:02:18.39+03:00"}
{"Id":436679,"Number":216,"KnessetNum":10,"Name":"ישיבת מליאה בתאריך 21/06/1983 בשעה 16:01","StartDate":"1983-06-21T16:01:00+03:00","FinishDate":"1983-06-21T19:06:00+03:00","IsSpecialMeeting":null,"LastUpdatedDate":"2025-01-29T13:10:58.423+02:00"}
{"Id":436680,"Number":218,"KnessetNum":10,"Name":"ישיבת מליאה בתאריך 27/06/1983 בשעה 16:01","StartDate":"1983-06-27T16:01:00+03:00","FinishDate":"1983-06-27T20:49:00+03:00","IsSpecialMeeting":null,"LastUpdatedDate":"2023-07-03T09:33:35.14+03:00"}
{"Id":436681,"Number":219,"KnessetNum":10,"Name":"ישיבת מליאה בתאריך 28/06/1983 בשעה 16:00","StartDate":"1983-06-28T16:00:00+03:00","FinishDate":"1983-06-28T21:13:00+03:00","IsSpecialMeeting":null,"LastUpdatedDate":"2023-07-03T10:29:10.167+03:00"}
{"Id":436682,"Number":223,"KnessetNum":10,"Name":"ישיבת מליאה בתאריך 06/07/1983 בשעה 11:03","StartDate":"1983-07-06T11:03:00+03:00","FinishDate":"1983-07-06T14:57:00+03:00","IsSpecialMeeting":null,"LastUpdatedDate":"2023-07-04T07:58:00.477+03:00"}
{"Id":436683,"Number":224,"KnessetNum":10,"Name":"ישיבת מליאה בתאריך 11/07/1983 בשעה 16:02","StartDate":"1983-07-11T16:02:00+03:00","FinishDate":"1983-07-11T20:25:00+03:00","IsSpecialMeeting":null,"LastUpdatedDate":"2023-07-04T15:17:07.41+03:00"}
{"Id":436684,"Number":225,"KnessetNum":10,"Name":"ישיבת מליאה בתאריך 12/07/1983 בשעה 16:00","StartDate":"1983-07-12T16:00:00+03:00","FinishDate":"1983-07-12T20:24:00+03:00","IsSpecialMeeting":null,"LastUpdatedDate":"2023-07-04T15:19:03.997+03:00"}
{"Id":436685,"Number":226,"KnessetNum":10,"Name":"ישיבת מליאה בתאריך 13/07/1983 בשעה 11:03","StartDate":"1983-07-13T11:03:00+03:00","FinishDate":"1983-07-13T17:51:00+03:00","IsSpecialMeeting":null,"LastUpdatedDate":"2023-07-05T11:43:45.23+03:00"}
{"Id":436686,"Number":227,"KnessetNum":10,"Name":"ישיבת מליאה בתאריך 20/07/1983 בשעה 11:02","StartDate":"1983-07-20T11:02:00+03:00","FinishDate":"1983-07-20T15:25:00+03:00","IsSpecialMeeting":null,"LastUpdatedDate":"2023-07-05T11:48:12.913+03:00"}
{"Id":436688,"Number":229,"KnessetNum":10,"Name":"ישיבת מליאה בתאריך 25/07/1983 בשעה 16:02","StartDate":"1983-07-25T16:02:00+03:00","FinishDate":"1983-07-25T23:50:00+03:00","IsSpecialMeeting":null,"LastUpdatedDate":"2019-12-23T13:37:10.927+02:00"}
{"Id":436689,"Number":231,"KnessetNum":10,"Name":"ישיבת מליאה בתאריך 27/07/1983 בשעה 09:04","StartDate":"1983-07-27T09:04:00+03:00","FinishDate":"1983-07-28T00:28:00+03:00","IsSpecialMeeting":null,"LastUpdatedDate":"2019-12-23T13:39:18.163+02:00"}
{"Id":436690,"Number":232,"KnessetNum":10,"Name":"ישיבת מליאה בתאריך 14/09/1983 בשעה 10:11","StartDate":"1983-09-14T10:11:00+03:00","FinishDate":"1983-09-14T14:47:00+03:00","IsSpecialMeeting":null,"LastUpdatedDate":"2023-07-10T08:26:25.09+03:00"}
{"Id":436693,"Number":234,"KnessetNum":10,"Name":"ישיבת מליאה בתאריך 17/10/1983 בשעה 16:05","StartDate":"1983-10-17T16:05:00+02:00","FinishDate":"1983-10-17T18:35:00+02:00","IsSpecialMeeting":null,"LastUpdatedDate":"2025-05-07T14:08:37.32+03:00"}
{"Id":436694,"Number":237,"KnessetNum":10,"Name":"ישיבת מליאה בתאריך 24/10/1983 בשעה 16:04","StartDate":"1983-10-24T16:04:00+02:00","FinishDate":"1983-10-24T18:12:00+02:00","IsSpecialMeeting":null,"LastUpdatedDate":"2023-07-10T11:59:10.263+03:00"}
{"Id":436695,"Number":238,"KnessetNum":10,"Name":"ישיבת מליאה בתאריך 26/10/1983 בשעה 11:10","StartDate":"1983-10-26T11:10:00+02:00","FinishDate":"1983-10-26T11:33:00+02:00","IsSpecialMeeting":null,"LastUpdatedDate":"2023-07-10T12:24:40.38+03:00"}
{"Id":436696,"Number":239,"KnessetNum":10,"Name":"ישיבת מליאה בתאריך 31/10/1983 בשעה 16:03","StartDate":"1983-10-31T16:03:00+02:00","FinishDate":"1983-10-31T18:02:00+02:00","IsSpecialMeeting":null,"LastUpdatedDate":"2023-07-10T12:34:13.377+03:00"}
{"Id":436697,"Number":240,"KnessetNum":10,"Name":"ישיבת מליאה בתאריך 01/11/1983 בשעה 16:04","StartDate":"1983-11-01T16:04:00+02:00","FinishDate":"1983-11-01T18:10:00+02:00","IsSpecialMeeting":null,"LastUpdatedDate":"2023-07-10T13:24:35.02+03:00"}
{"Id":436698,"Number":242,"KnessetNum":10,"Name":"ישיבת מליאה בתאריך 07/11/1983 בשעה 16:02","StartDate":"1983-11-07T16:02:00+02:00","FinishDate":"1983-11-07T17:10:00+02:00","IsSpecialMeeting":null,"LastUpdatedDate":"2023-07-10T16:08:23.973+03:00"}
{"Id":436699,"Number":244,"KnessetNum":10,"Name":"ישיבת מליאה בתאריך 09/11/1983 בשעה 11:02","StartDate":"1983-11-09T11:02:00+02:00","FinishDate":"1983-11-09T15:00:00+02:00","IsSpecialMeeting":null,"LastUpdatedDate":"2023-07-11T09:20:13.77+03:00"}
{"Id":436700,"Number":245,"KnessetNum":10,"Name":"ישיבת מליאה בתאריך 14/11/1983 בשעה 16:03","StartDate":"1983-11-14T16:03:00+02:00","FinishDate":"1983-11-14T18:45:00+02:00","IsSpecialMeeting":null,"LastUpdatedDate":"2023-07-11T09:40:07.84+03:00"}
{"Id":436701,"Number":246,"KnessetNum":10,"Name":"ישיבת מליאה בתאריך 15/11/1983 בשעה 16:02","StartDate":"1983-11-15T16:02:00+02:00","FinishDate":"1983-11-15T20:39:00+02:00","IsSpecialMeeting":null,"LastUpdatedDate":"2023-07-16T08:27:46.397+03:00"}
{"Id":436702,"Number":248,"KnessetNum":10,"Name":"ישיבת מליאה בתאריך 21/11/1983 בשעה 16:01","StartDate":"1983-11-21T16:01:00+02:00","FinishDate":"1983-11-21T17:46:00+02:00","IsSpecialMeeting":null,"LastUpdatedDate":"2023-07-16T09:39:08.907+03:00"}
{"Id":436703,"Number":249,"KnessetNum":10,"Name":"ישיבת מליאה בתאריך 22/11/1983 בשעה 16:01","StartDate":"1983-11-22T16:01:00+02:00","FinishDate":"1983-11-22T19:15:00+02:00","IsSpecialMeeting":null,"LastUpdatedDate":"2023-07-18T08:19:21.287+03:00"}
{"Id":436704,"Number":251,"KnessetNum":10,"Name":"ישיבת מליאה בתאריך 28/11/1983 בשעה 16:02","StartDate":"1983-11-28T16:02:00+02:00","FinishDate":"1983-11-28T16:41:00+02:00","IsSpecialMeeting":null,"LastUpdatedDate":"2023-07-18T13:06:01.913+03:00"}
{"Id":436705,"Number":252,"KnessetNum":10,"Name":"ישיבת מליאה בתאריך 29/11/1983 בשעה 16:04","StartDate":"1983-11-29T16:04:00+02:00","FinishDate":"1983-11-29T20:37:00+02:00","IsSpecialMeeting":null,"LastUpdatedDate":"2023-07-18T16:31:21.72+03:00"}
{"Id":436706,"Number":253,"KnessetNum":10,"Name":"ישיבת מליאה בתאריך 30/11/1983 בשעה 11:03","StartDate":"1983-11-30T11:03:00+02:00","FinishDate":"1983-11-30T14:48:00+02:00","IsSpecialMeeting":null,"LastUpdatedDate":"2023-07-19T08:26:26.317+03:00"}
{"Id":436707,"Number":254,"KnessetNum":10,"Name":"ישיבת מליאה בתאריך 05/12/1983 בשעה 16:02","StartDate":"1983-12-05T16:02:00+02:00","FinishDate":"1983-12-05T19:47:00+02:00","IsSpecialMeeting":null,"LastUpdatedDate":"2023-07-19T09:48:56.797+03:00"}
{"Id":436708,"Number":255,"KnessetNum":10,"Name":"ישיבת מליאה בתאריך 06/12/1983 בשעה 16:03","StartDate":"1983-12-06T16:03:00+02:00","FinishDate":"1983-12-06T23:06:00+02:00","IsSpecialMeeting":null,"LastUpdatedDate":"2023-07-19T12:37:38.55+03:00"}
{"Id":436709,"Number":256,"KnessetNum":10,"Name":"ישיבת מליאה בתאריך 07/12/1983 בשעה 11:03","StartDate":"1983-12-07T11:03:00+02:00","FinishDate":null,"IsSpecialMeeting":null,"LastUpdatedDate":"2023-07-19T12:17:38.68+03:00"}
{"Id":436710,"Number":257,"KnessetNum":10,"Name":"ישיבת מליאה בתאריך 12/12/1983 בשעה 16:02","StartDate":"1983-12-12T16:02:00+02:00","FinishDate":"1983-12-12T20:23:00+02:00","IsSpecialMeeting":null,"LastUpdatedDate":"2024-02-04T13:27:02.04+02:00"}
{"Id":436711,"Number":258,"KnessetNum":10,"Name":"ישיבת מליאה בתאריך 13/12/1983 בשעה 16:00","StartDate":"1983-12-13T16:00:00+02:00","FinishDate":"1983-12-13T21:15:00+02:00","IsSpecialMeeting":null,"LastUpdatedDate":"2024-02-05T08:27:00.893+02:00"}
{"Id":436712,"Number":259,"KnessetNum":10,"Name":"ישיבת מליאה בתאריך 14/12/1983 בשעה 11:03","StartDate":"1983-12-14T11:03:00+02:00","FinishDate":"1983-12-14T18:44:00+02:00","IsSpecialMeeting":null,"LastUpdatedDate":"2023-07-24T11:28:20.74+03:00"}
{"Id":436713,"Number":260,"KnessetNum":10,"Name":"ישיבת מליאה בתאריך 19/12/1983 בשעה 16:03","StartDate":"1983-12-19T16:03:00+02:00","FinishDate":"1983-12-19T20:30:00+02:00","IsSpecialMeeting":null,"LastUpdatedDate":"2025-05-21T16:14:07.33+03:00"}
{"Id":436714,"Number":265,"KnessetNum":10,"Name":"ישיבת מליאה בתאריך 28/12/1983 בשעה 11:03","StartDate":"1983-12-28T11:03:00+02:00","FinishDate":"1983-12-28T16:25:00+02:00","IsSpecialMeeting":null,"LastUpdatedDate":"2023-07-25T09:17:52.56+03:00"}
{"Id":436715,"Number":271,"KnessetNum":10,"Name":"ישיבת מליאה בתאריך 11/01/1984 בשעה 11:02","StartDate":"1984-01-11T11:02:00+02:00","FinishDate":"1984-01-11T16:02:00+02:00","IsSpecialMeeting":null,"LastUpdatedDate":"2023-07-25T14:46:19.853+03:00"}
{"Id":436716,"Number":273,"KnessetNum":10,"Name":"ישיבת מליאה בתאריך 17/01/1984 בשעה 15:03","StartDate":"1984-01-17T15:03:00+02:00","FinishDate":"1984-01-17T18:28:00+02:00","IsSpecialMeeting":null,"LastUpdatedDate":"2023-07-26T09:19:45.187+03:00"}
{"Id":436717,"Number":275,"KnessetNum":10,"Name":"ישיבת מליאה בתאריך 23/01/1984 בשעה 16:04","StartDate":"1984-01-23T16:04:00+02:00","FinishDate":"1984-01-23T17:17:00+02:00","IsSpecialMeeting":null,"LastUpdatedDate":"2023-07-26T11:41:17.8+03:00"}
{"Id":436720,"Number":278,"KnessetNum":10,"Name":"ישיבת מליאה בתאריך 30/01/1984 בשעה 16:02","StartDate":"1984-01-30T16:02:00+02:00","FinishDate":"1984-01-30T19:20:00+02:00","IsSpecialMeeting":null,"LastUpdatedDate":"2023-07-26T13:51:23.07+03:00"}
{"Id":436722,"Number":281,"KnessetNum":10,"Name":"ישיבת מליאה בתאריך 06/02/1984 בשעה 16:03","StartDate":"1984-02-06T16:03:00+02:00","FinishDate":"1984-02-06T19:10:00+02:00","IsSpecialMeeting":null,"LastUpdatedDate":"2023-07-30T10:17:54.877+03:00"}
{"Id":436723,"Number":285,"KnessetNum":10,"Name":"ישיבת מליאה בתאריך 14/02/1984 בשעה 16:02","StartDate":"1984-02-14T16:02:00+02:00","FinishDate":"1984-02-14T19:01:00+02:00","IsSpecialMeeting":null,"LastUpdatedDate":"2024-02-05T10:56:57.37+02:00"}
{"Id":436724,"Number":286,"KnessetNum":10,"Name":"ישיבת מליאה בתאריך 15/02/1984 בשעה 11:05","StartDate":"1984-02-15T11:05:00+02:00","FinishDate":"1984-02-15T14:42:00+02:00","IsSpecialMeeting":null,"LastUpdatedDate":"2023-07-31T08:41:20.403+03:00"}
{"Id":436725,"Number":287,"KnessetNum":10,"Name":"ישיבת מליאה בתאריך 20/02/1984 בשעה 16:03","StartDate":"1984-02-20T16:03:00+02:00","FinishDate":"1984-02-20T19:07:00+02:00","IsSpecialMeeting":null,"LastUpdatedDate":"2023-07-31T10:48:04.777+03:00"}
{"Id":436726,"Number":288,"KnessetNum":10,"Name":"ישיבת מליאה בתאריך 21/02/1984 בשעה 16:06","StartDate":"1984-02-21T16:06:00+02:00","FinishDate":"1984-02-21T20:26:00+02:00","IsSpecialMeeting":null,"LastUpdatedDate":"2023-07-31T11:04:34.733+03:00"}
{"Id":436727,"Number":290,"KnessetNum":10,"Name":"ישיבת מליאה בתאריך 27/02/1984 בשעה 16:04","StartDate":"1984-02-27T16:04:00+02:00","FinishDate":"1984-02-27T21:47:00+02:00","IsSpecialMeeting":null,"LastUpdatedDate":"2023-07-31T11:26:46.347+03:00"}
{"Id":436728,"Number":292,"KnessetNum":10,"Name":"ישיבת מליאה בתאריך 29/02/1984 בשעה 11:03","StartDate":"1984-02-29T11:03:00+02:00","FinishDate":"1984-02-29T14:29:00+02:00","IsSpecialMeeting":null,"LastUpdatedDate":"2023-08-01T09:12:01.323+03:00"}
{"Id":436729,"Number":298,"KnessetNum":10,"Name":"ישיבת מליאה בתאריך 14/03/1984 בשעה 11:03","StartDate":"1984-03-14T11:03:00+02:00","FinishDate":"1984-03-14T16:47:00+02:00","IsSpecialMeeting":null,"LastUpdatedDate":"2024-02-05T12:24:48.89+02:00"}
{"Id":436730,"Number":299,"KnessetNum":10,"Name":"ישיבת מליאה בתאריך 20/03/1984 בשעה 16:03","StartDate":"1984-03-20T16:03:00+02:00","FinishDate":"1984-03-20T17:15:00+02:00","IsSpecialMeeting":null,"LastUpdatedDate":"2024-02-05T12:26:53.047+02:00"}
{"Id":436731,"Number":300,"KnessetNum":10,"Name":"ישיבת מליאה בתאריך 21/03/1984 בשעה 16:02","StartDate":"1984-03-21T16:02:00+02:00","FinishDate":"1984-03-21T20:42:00+02:00","IsSpecialMeeting":null,"LastUpdatedDate":"2023-08-08T11:18:14.673+03:00"}
{"Id":436732,"Number":301,"KnessetNum":10,"Name":"ישיבת מליאה בתאריך 22/03/1984 בשעה 11:02","StartDate":"1984-03-22T11:02:00+02:00","FinishDate":"1984-03-22T23:15:00+02:00","IsSpecialMeeting":null,"LastUpdatedDate":"2023-08-08T11:53:59.42+03:00"}
{"Id":436733,"Number":302,"KnessetNum":10,"Name":"ישיבת מליאה בתאריך 26/03/1984 בשעה 16:02","StartDate":"1984-03-26T16:02:00+02:00","FinishDate":"1984-03-26T21:21:00+02:00","IsSpecialMeeting":null,"LastUpdatedDate":"2023-08-09T09:28:45.54+03:00"}
{"Id":436734,"Number":303,"KnessetNum":10,"Name":"ישיבת מליאה בתאריך 27/03/1984 בשעה 15:03","StartDate":"1984-03-27T15:03:00+02:00","FinishDate":"1984-03-27T19:44:00+02:00","IsSpecialMeeting":null,"LastUpdatedDate":"2023-08-09T10:35:41.423+03:00"}
{"Id":436735,"Number":304,"KnessetNum":10,"Name":"ישיבת מליאה בתאריך 28/03/1984 בשעה 09:02","StartDate":"1984-03-28T09:02:00+02:00","FinishDate":"1984-03-28T21:32:00+02:00","IsSpecialMeeting":null,"LastUpdatedDate":"2024-02-05T13:44:21.827+02:00"}
{"Id":436737,"Number":306,"KnessetNum":10,"Name":"ישיבת מליאה בתאריך 14/05/1984 בשעה 16:02","StartDate":"1984-05-14T16:02:00+03:00","FinishDate":"1984-05-14T18:50:00+03:00","IsSpecialMeeting":null,"LastUpdatedDate":"2023-08-09T12:09:24.757+03:00"}
{"Id":436738,"Number":307,"KnessetNum":10,"Name":"ישיבת מליאה בתאריך 15/05/1984 בשעה 16:03","StartDate":"1984-05-15T16:03:00+03:00","FinishDate":"1984-05-15T16:38:00+03:00","IsSpecialMeeting":null,"LastUpdatedDate":"2023-08-09T12:14:26.97+03:00"}
{"Id":436739,"Number":314,"KnessetNum":10,"Name":"ישיבת מליאה בתאריך 30/05/1984 בשעה 11:02","StartDate":"1984-05-30T11:02:00+03:00","FinishDate":"1984-05-30T17:18:00+03:00","IsSpecialMeeting":null,"LastUpdatedDate":"2023-08-14T08:20:46.42+03:00"}
{"Id":436740,"Number":315,"KnessetNum":10,"Name":"ישיבת מליאה בתאריך 04/06/1984 בשעה 10:04","StartDate":"1984-06-04T10:04:00+03:00","FinishDate":"1984-06-04T13:55:00+03:00","IsSpecialMeeting":null,"LastUpdatedDate":"2023-08-14T09:44:19.24+03:00"}
{"Id":436741,"Number":316,"KnessetNum":10,"Name":"ישיבת מליאה בתאריך 11/06/1984 בשעה 16:03","StartDate":"1984-06-11T16:03:00+03:00","FinishDate":"1984-06-11T19:01:00+03:00","IsSpecialMeeting":null,"LastUpdatedDate":"2023-08-14T10:24:29.597+03:00"}
{"Id":436742,"Number":317,"KnessetNum":10,"Name":"ישיבת מליאה בתאריך 12/06/1984 בשעה 16:02","StartDate":"1984-06-12T16:02:00+03:00","FinishDate":"1984-06-12T18:53:00+03:00","IsSpecialMeeting":null,"LastUpdatedDate":"2023-09-04T10:08:26.617+03:00"}
{"Id":436743,"Number":318,"KnessetNum":10,"Name":"ישיבת מליאה בתאריך 13/06/1984 בשעה 11:04","StartDate":"1984-06-13T11:04:00+03:00","FinishDate":"1984-06-13T15:37:00+03:00","IsSpecialMeeting":null,"LastUpdatedDate":"2024-08-14T11:48:14.963+03:00"}
{"Id":436745,"Number":319,"KnessetNum":10,"Name":"ישיבת מליאה בתאריך 02/07/1984 בשעה 16:00","StartDate":"1984-07-02T16:00:00+03:00","FinishDate":"1984-07-02T18:01:00+03:00","IsSpecialMeeting":null,"LastUpdatedDate":"2025-02-02T08:25:41.413+02:00"}
{"Id":436746,"Number":6,"KnessetNum":11,"Name":"ישיבת מליאה בתאריך 13/09/1984 בשעה 12:02","StartDate":"1984-09-13T12:02:00+03:00","FinishDate":"1984-09-14T01:00:00+03:00","IsSpecialMeeting":null,"LastUpdatedDate":"2019-12-17T08:46:02.777+02:00"}
{"Id":436747,"Number":8,"KnessetNum":11,"Name":"ישיבת מליאה בתאריך 22/10/1984 בשעה 16:04","StartDate":"1984-10-22T16:04:00+02:00","FinishDate":"1984-10-22T20:02:00+02:00","IsSpecialMeeting":null,"LastUpdatedDate":"2023-09-05T09:17:24.05+03:00"}
{"Id":436748,"Number":10,"KnessetNum":11,"Name":"ישיבת מליאה בתאריך 24/10/1984 בשעה 11:02","StartDate":"1984-10-24T11:02:00+02:00","FinishDate":"1984-10-24T15:25:00+02:00","IsSpecialMeeting":null,"LastUpdatedDate":"2023-09-05T10:11:58.903+03:00"}
{"Id":436749,"Number":11,"KnessetNum":11,"Name":"ישיבת מליאה בתאריך 29/10/1984 בשעה 16:02","StartDate":"1984-10-29T16:02:00+02:00","FinishDate":"1984-10-29T19:48:00+02:00","IsSpecialMeeting":null,"LastUpdatedDate":"2023-09-07T08:47:23.08+03:00"}
{"Id":436750,"Number":14,"KnessetNum":11,"Name":"ישיבת מליאה בתאריך 05/11/1984 בשעה 16:02","StartDate":"1984-11-05T16:02:00+02:00","FinishDate":"1984-11-05T20:20:00+02:00","IsSpecialMeeting":null,"LastUpdatedDate":"2023-09-07T10:23:54.1+03:00"}
{"Id":436751,"Number":15,"KnessetNum":11,"Name":"ישיבת מליאה בתאריך 06/11/1984 בשעה 16:00","StartDate":"1984-11-06T16:00:00+02:00","FinishDate":"1984-11-06T20:12:00+02:00","IsSpecialMeeting":null,"LastUpdatedDate":"2025-05-27T12:21:47.207+03:00"}
{"Id":436752,"Number":18,"KnessetNum":11,"Name":"ישיבת מליאה בתאריך 13/11/1984 בשעה 16:00","StartDate":"1984-11-13T16:00:00+02:00","FinishDate":"1984-11-13T18:40:00+02:00","IsSpecialMeeting":null,"LastUpdatedDate":"2023-09-10T09:46:09.073+03:00"}
{"Id":436753,"Number":23,"KnessetNum":11,"Name":"ישיבת מליאה בתאריך 26/11/1984 בשעה 16:01","StartDate":"1984-11-26T16:01:00+02:00","FinishDate":"1984-11-26T17:56:00+02:00","IsSpecialMeeting":null,"LastUpdatedDate":"2023-09-11T10:06:15.817+03:00"}
{"Id":436754,"Number":29,"KnessetNum":11,"Name":"ישיבת מליאה בתאריך 10/12/1984 בשעה 16:01","StartDate":"1984-12-10T16:01:00+02:00","FinishDate":"1984-12-10T19:28:00+02:00","IsSpecialMeeting":null,"LastUpdatedDate":"2023-09-12T13:40:46.977+03:00"}
{"Id":436755,"Number":30,"KnessetNum":11,"Name":"ישיבת מליאה בתאריך 11/12/1984 בשעה 16:01","StartDate":"1984-12-11T16:01:00+02:00","FinishDate":"1984-12-11T19:21:00+02:00","IsSpecialMeeting":null,"LastUpdatedDate":"2023-09-13T09:54:37.803+03:00"}
{"Id":436756,"Number":32,"KnessetNum":11,"Name":"ישיבת מליאה בתאריך 17/12/1984 בשעה 16:01","StartDate":"1984-12-17T16:01:00+02:00","FinishDate":"1984-12-17T19:00:00+02:00","IsSpecialMeeting":null,"LastUpdatedDate":"2023-09-13T10:38:04.713+03:00"}
{"Id":436757,"Number":34,"KnessetNum":11,"Name":"ישיבת מליאה בתאריך 19/12/1984 בשעה 11:00","StartDate":"1984-12-19T11:00:00+02:00","FinishDate":"1984-12-19T14:07:00+02:00","IsSpecialMeeting":null,"LastUpdatedDate":"2023-09-14T09:27:16.447+03:00"}
{"Id":436758,"Number":35,"KnessetNum":11,"Name":"ישיבת מליאה בתאריך 24/12/1984 בשעה 16:00","StartDate":"1984-12-24T16:00:00+02:00","FinishDate":null,"IsSpecialMeeting":null,"LastUpdatedDate":"2023-09-14T09:48:38.223+03:00"}
{"Id":436759,"Number":36,"KnessetNum":11,"Name":"ישיבת מליאה בתאריך 25/12/1984 בשעה 16:00","StartDate":"1984-12-25T16:00:00+02:00","FinishDate":"1984-12-25T20:25:00+02:00","IsSpecialMeeting":null,"LastUpdatedDate":"2023-09-18T07:23:09.893+03:00"}
{"Id":436760,"Number":38,"KnessetNum":11,"Name":"ישיבת מליאה בתאריך 31/12/1984 בשעה 16:01","StartDate":"1984-12-31T16:01:00+02:00","FinishDate":"1984-12-31T19:28:00+02:00","IsSpecialMeeting":null,"LastUpdatedDate":"2023-09-18T10:05:29.593+03:00"}
{"Id":436761,"Number":39,"KnessetNum":11,"Name":"ישיבת מליאה בתאריך 01/01/1985 בשעה 16:01","StartDate":"1985-01-01T16:01:00+02:00","FinishDate":"1985-01-01T20:07:00+02:00","IsSpecialMeeting":null,"LastUpdatedDate":"2023-09-18T11:42:23.393+03:00"}
{"Id":436762,"Number":40,"KnessetNum":11,"Name":"ישיבת מליאה בתאריך 02/01/1985 בשעה 11:01","StartDate":"1985-01-02T11:01:00+02:00","FinishDate":"1985-01-02T15:45:00+02:00","IsSpecialMeeting":null,"LastUpdatedDate":"2023-09-19T07:55:04.98+03:00"}
{"Id":436763,"Number":41,"KnessetNum":11,"Name":"ישיבת מליאה בתאריך 07/01/1985 בשעה 16:00","StartDate":"1985-01-07T16:00:00+02:00","FinishDate":"1985-01-07T19:16:00+02:00","IsSpecialMeeting":null,"LastUpdatedDate":"2023-09-19T11:27:20.243+03:00"}
{"Id":436764,"Number":44,"KnessetNum":11,"Name":"ישיבת מליאה בתאריך 14/01/1985 בשעה 16:01","StartDate":"1985-01-14T16:01:00+02:00","FinishDate":"1985-01-14T19:30:00+02:00","IsSpecialMeeting":null,"LastUpdatedDate":"2023-09-20T07:17:12.833+03:00"}
{"Id":436765,"Number":46,"KnessetNum":11,"Name":"ישיבת מליאה בתאריך 16/01/1985 בשעה 11:02","StartDate":"1985-01-16T11:02:00+02:00","FinishDate":"1985-01-16T15:34:00+02:00","IsSpecialMeeting":null,"LastUpdatedDate":"2023-09-20T10:38:25.407+03:00"}
{"Id":436767,"Number":47,"KnessetNum":11,"Name":"ישיבת מליאה בתאריך 21/01/1985 בשעה 16:01","StartDate":"1985-01-21T16:01:00+02:00","FinishDate":"1985-01-21T18:30:00+02:00","IsSpecialMeeting":null,"LastUpdatedDate":"2023-09-20T12:58:52.65+03:00"}
{"Id":436768,"Number":50,"KnessetNum":11,"Name":"ישיבת מליאה בתאריך 28/01/1985 בשעה 16:01","StartDate":"1985-01-28T16:01:00+02:00","FinishDate":"1985-01-28T21:17:00+02:00","IsSpecialMeeting":null,"LastUpdatedDate":"2023-09-21T11:03:00.497+03:00"}
{"Id":436769,"Number":51,"KnessetNum":11,"Name":"ישיבת מליאה בתאריך 29/01/1985 בשעה 16:01","StartDate":"1985-01-29T16:01:00+02:00","FinishDate":"1985-01-29T21:29:00+02:00","IsSpecialMeeting":null,"LastUpdatedDate":"2023-09-21T11:07:39.487+03:00"}
{"Id":436770,"Number":53,"KnessetNum":11,"Name":"ישיבת מליאה בתאריך 04/02/1985 בשעה 16:01","StartDate":"1985-02-04T16:01:00+02:00","FinishDate":"1985-02-04T18:33:00+02:00","IsSpecialMeeting":null,"LastUpdatedDate":"2023-09-26T10:03:07.59+03:00"}
{"Id":436771,"Number":54,"KnessetNum":11,"Name":"ישיבת מליאה בתאריך 05/02/1985 בשעה 16:00","StartDate":"1985-02-05T16:00:00+02:00","FinishDate":"1985-02-05T20:04:00+02:00","IsSpecialMeeting":null,"LastUpdatedDate":"2023-09-26T10:04:30.13+03:00"}
{"Id":436772,"Number":55,"KnessetNum":11,"Name":"ישיבת מליאה בתאריך 06/02/1985 בשעה 11:00","StartDate":"1985-02-06T11:00:00+02:00","FinishDate":"1985-02-06T13:22:00+02:00","IsSpecialMeeting":null,"LastUpdatedDate":"2023-09-26T11:03:31.227+03:00"}
{"Id":436773,"Number":56,"KnessetNum":11,"Name":"ישיבת מליאה בתאריך 11/02/1985 בשעה 16:00","StartDate":"1985-02-11T16:00:00+02:00","FinishDate":"1985-02-11T18:46:00+02:00","IsSpecialMeeting":null,"LastUpdatedDate":"2024-10-14T11:54:19.21+03:00"}
{"Id":436774,"Number":59,"KnessetNum":11,"Name":"ישיבת מליאה בתאריך 18/02/1985 בשעה 16:01","StartDate":"1985-02-18T16:01:00+02:00","FinishDate":"1985-02-18T20:53:00+02:00","IsSpecialMeeting":null,"LastUpdatedDate":"2023-09-27T12:53:03.183+03:00"}
{"Id":436775,"Number":60,"KnessetNum":11,"Name":"ישיבת מליאה בתאריך 19/02/1985 בשעה 16:02","StartDate":"1985-02-19T16:02:00+02:00","FinishDate":"1985-02-19T20:38:00+02:00","IsSpecialMeeting":null,"LastUpdatedDate":"2023-09-28T08:33:39.633+03:00"}
{"Id":436776,"Number":62,"KnessetNum":11,"Name":"ישיבת מליאה בתאריך 25/02/1985 בשעה 16:02","StartDate":"1985-02-25T16:02:00+02:00","FinishDate":"1985-02-25T18:47:00+02:00","IsSpecialMeeting":null,"LastUpdatedDate":"2023-10-09T07:39:33.583+03:00"}
{"Id":436777,"Number":65,"KnessetNum":11,"Name":"ישיבת מליאה בתאריך 04/03/1985 בשעה 16:03","StartDate":"1985-03-04T16:03:00+02:00","FinishDate":"1985-03-04T19:52:00+02:00","IsSpecialMeeting":null,"LastUpdatedDate":"2023-10-10T10:51:27.843+03:00"}
{"Id":436778,"Number":72,"KnessetNum":11,"Name":"ישיבת מליאה בתאריך 19/03/1985 בשעה 16:01","StartDate":"1985-03-19T16:01:00+02:00","FinishDate":"1985-03-19T19:08:00+02:00","IsSpecialMeeting":null,"LastUpdatedDate":"2023-10-17T12:18:21.567+03:00"}
{"Id":436779,"Number":74,"KnessetNum":11,"Name":"ישיבת מליאה בתאריך 25/03/1985 בשעה 16:01","StartDate":"1985-03-25T16:01:00+02:00","FinishDate":"1985-03-25T18:45:00+02:00","IsSpecialMeeting":null,"LastUpdatedDate":"2023-10-19T14:11:23.86+03:00"}
{"Id":436780,"Number":75,"KnessetNum":11,"Name":"ישיבת מליאה בתאריך 26/03/1985 בשעה 16:03","StartDate":"1985-03-26T16:03:00+02:00","FinishDate":"1985-03-26T20:15:00+02:00","IsSpecialMeeting":null,"LastUpdatedDate":"2019-02-21T08:54:49.633+02:00"}
{"Id":436781,"Number":76,"KnessetNum":11,"Name":"ישיבת מליאה בתאריך 27/03/1985 בשעה 09:00","StartDate":"1985-03-27T09:00:00+02:00","FinishDate":"1985-03-27T20:10:00+02:00","IsSpecialMeeting":null,"LastUpdatedDate":"2023-10-22T11:13:45.493+03:00"}
{"Id":436782,"Number":77,"KnessetNum":11,"Name":"ישיבת מליאה בתאריך 28/03/1985 בשעה 22:46","StartDate":"1985-03-28T22:46:00+02:00","FinishDate":"1985-03-29T01:51:00+02:00","IsSpecialMeeting":null,"LastUpdatedDate":"2025-02-02T10:37:31.737+02:00"}
{"Id":436784,"Number":78,"KnessetNum":11,"Name":"ישיבת מליאה בתאריך 17/04/1985 בשעה 10:04","StartDate":"1985-04-17T10:04:00+03:00","FinishDate":"1985-04-17T16:12:00+03:00","IsSpecialMeeting":null,"LastUpdatedDate":"2024-11-03T09:58:53.803+02:00"}
{"Id":436785,"Number":79,"KnessetNum":11,"Name":"ישיבת מליאה בתאריך 22/04/1985 בשעה 10:03","StartDate":"1985-04-22T10:03:00+03:00","FinishDate":"1985-04-22T16:16:00+03:00","IsSpecialMeeting":null,"LastUpdatedDate":"2023-10-22T12:53:45.11+03:00"}
{"Id":436786,"Number":80,"KnessetNum":11,"Name":"ישיבת מליאה בתאריך 06/05/1985 בשעה 16:02","StartDate":"1985-05-06T16:02:00+03:00","FinishDate":"1985-05-06T17:08:00+03:00","IsSpecialMeeting":null,"LastUpdatedDate":"2023-10-22T13:18:28.083+03:00"}
{"Id":436787,"Number":81,"KnessetNum":11,"Name":"ישיבת מליאה בתאריך 07/05/1985 בשעה 16:03","StartDate":"1985-05-07T16:03:00+03:00","FinishDate":"1985-05-07T19:06:00+03:00","IsSpecialMeeting":null,"LastUpdatedDate":"2023-10-23T09:06:28.717+03:00"}
{"Id":436788,"Number":83,"KnessetNum":11,"Name":"ישיבת מליאה בתאריך 13/05/1985 בשעה 16:00","StartDate":"1985-05-13T16:00:00+03:00","FinishDate":"1985-05-13T17:59:00+03:00","IsSpecialMeeting":null,"LastUpdatedDate":"2023-10-23T10:28:07.957+03:00"}
{"Id":436789,"Number":86,"KnessetNum":11,"Name":"ישיבת מליאה בתאריך 20/05/1985 בשעה 16:02","StartDate":"1985-05-20T16:02:00+03:00","FinishDate":"1985-05-20T21:22:00+03:00","IsSpecialMeeting":null,"LastUpdatedDate":"2023-10-23T16:29:29.997+03:00"}
{"Id":436790,"Number":87,"KnessetNum":11,"Name":"ישיבת מליאה בתאריך 21/05/1985 בשעה 16:01","StartDate":"1985-05-21T16:01:00+03:00","FinishDate":"1985-05-21T20:29:00+03:00","IsSpecialMeeting":null,"LastUpdatedDate":"2023-10-23T16:46:18.757+03:00"}
{"Id":436791,"Number":90,"KnessetNum":11,"Name":"ישיבת מליאה בתאריך 28/05/1985 בשעה 16:01","StartDate":"1985-05-28T16:01:00+03:00","FinishDate":"1985-05-28T20:02:00+03:00","IsSpecialMeeting":null,"LastUpdatedDate":"2023-10-24T07:42:38.233+03:00"}
{"Id":436792,"Number":92,"KnessetNum":11,"Name":"ישיבת מליאה בתאריך 03/06/1985 בשעה 16:03","StartDate":"1985-06-03T16:03:00+03:00","FinishDate":"1985-06-03T20:07:00+03:00","IsSpecialMeeting":null,"LastUpdatedDate":"2023-10-24T09:59:54.597+03:00"}
{"Id":436793,"Number":95,"KnessetNum":11,"Name":"ישיבת מליאה בתאריך 10/06/1985 בשעה 16:02","StartDate":"1985-06-10T16:02:00+03:00","FinishDate":"1985-06-10T22:03:00+03:00","IsSpecialMeeting":null,"LastUpdatedDate":"2023-10-25T07:46:28.417+03:00"}
{"Id":436794,"Number":102,"KnessetNum":11,"Name":"ישיבת מליאה בתאריך 25/06/1985 בשעה 16:01","StartDate":"1985-06-25T16:01:00+03:00","FinishDate":"1985-06-25T21:59:00+03:00","IsSpecialMeeting":null,"LastUpdatedDate":"2024-11-06T10:35:00.653+02:00"}
{"Id":436796,"Number":104,"KnessetNum":11,"Name":"ישיבת מליאה בתאריך 01/07/1985 בשעה 16:01","StartDate":"1985-07-01T16:01:00+03:00","FinishDate":"1985-07-01T22:20:00+03:00","IsSpecialMeeting":null,"LastUpdatedDate":"2024-11-10T10:12:29.217+02:00"}
{"Id":436797,"Number":108,"KnessetNum":11,"Name":"ישיבת מליאה בתאריך 09/07/1985 בשעה 16:02","StartDate":"1985-07-09T16:02:00+03:00","FinishDate":"1985-07-09T19:54:00+03:00","IsSpecialMeeting":null,"LastUpdatedDate":"2024-11-11T12:37:22.053+02:00"}
{"Id":436798,"Number":111,"KnessetNum":11,"Name":"ישיבת מליאה בתאריך 16/07/1985 בשעה: 00:00:00","StartDate":"1985-07-16T00:00:00+03:00","FinishDate":null,"IsSpecialMeeting":null,"LastUpdatedDate":"2014-08-17T15:12:53+03:00"}
{"Id":436799,"Number":113,"KnessetNum":11,"Name":"ישיבת מליאה בתאריך 22/07/1985 בשעה 16:01","StartDate":"1985-07-22T16:01:00+03:00","FinishDate":"1985-07-22T22:58:00+03:00","IsSpecialMeeting":null,"LastUpdatedDate":"2024-11-17T07:28:05.5+02:00"}
{"Id":436800,"Number":114,"KnessetNum":11,"Name":"ישיבת מליאה בתאריך 23/07/1985 בשעה 15:00","StartDate":"1985-07-23T15:00:00+03:00","FinishDate":"1985-07-23T19:27:00+03:00","IsSpecialMeeting":null,"LastUpdatedDate":"2024-11-17T10:25:05.78+02:00"}
{"Id":436801,"Number":115,"KnessetNum":11,"Name":"ישיבת מליאה בתאריך 24/07/1985 בשעה 11:00","StartDate":"1985-07-24T11:00:00+03:00","FinishDate":"1985-07-24T20:44:00+03:00","IsSpecialMeeting":null,"LastUpdatedDate":"2024-11-17T12:33:24.07+02:00"}
{"Id":436802,"Number":116,"KnessetNum":11,"Name":"ישיבת מליאה בתאריך 29/07/1985 בשעה 16:06","StartDate":"1985-07-29T16:06:00+03:00","FinishDate":"1985-07-29T21:52:00+03:00","IsSpecialMeeting":null,"LastUpdatedDate":"2024-11-17T13:31:20.517+02:00"}
{"Id":436803,"Number":117,"KnessetNum":11,"Name":"ישיבת מליאה בתאריך 30/07/1985 בשעה 15:02","StartDate":"1985-07-30T15:02:00+03:00","FinishDate":"1985-07-30T23:17:00+03:00","IsSpecialMeeting":null,"LastUpdatedDate":"2024-11-18T09:30:47.817+02:00"}
{"Id":436804,"Number":119,"KnessetNum":11,"Name":"ישיבת מליאה בתאריך 02/09/1985 בשעה 10:06","StartDate":"1985-09-02T10:06:00+03:00","FinishDate":"1985-09-02T13:57:00+03:00","IsSpecialMeeting":null,"LastUpdatedDate":"2024-11-24T10:44:27.97+02:00"}
{"Id":436805,"Number":120,"KnessetNum":11,"Name":"ישיבת מליאה בתאריך 09/09/1985 בשעה 11:04","StartDate":"1985-09-09T11:04:00+03:00","FinishDate":"1985-09-09T14:53:00+03:00","IsSpecialMeeting":null,"LastUpdatedDate":"2024-11-24T11:15:50.26+02:00"}
{"Id":436806,"Number":125,"KnessetNum":11,"Name":"ישיבת מליאה בתאריך 16/10/1985 בשעה 11:01","StartDate":"1985-10-16T11:01:00+02:00","FinishDate":"1985-10-16T12:21:00+02:00","IsSpecialMeeting":null,"LastUpdatedDate":"2024-11-24T13:04:56.667+02:00"}
{"Id":436807,"Number":127,"KnessetNum":11,"Name":"ישיבת מליאה בתאריך 22/10/1985 בשעה 16:01","StartDate":"1985-10-22T16:01:00+02:00","FinishDate":"1985-10-22T20:41:00+02:00","IsSpecialMeeting":null,"LastUpdatedDate":"2024-11-24T13:21:09.907+02:00"}
{"Id":436808,"Number":128,"KnessetNum":11,"Name":"ישיבת מליאה בתאריך 23/10/1985 בשעה 11:03","StartDate":"1985-10-23T11:03:00+02:00","FinishDate":"1985-10-23T13:39:00+02:00","IsSpecialMeeting":null,"LastUpdatedDate":"2024-11-25T10:16:05.957+02:00"}
{"Id":436809,"Number":130,"KnessetNum":11,"Name":"ישיבת מליאה בתאריך 29/10/1985 בשעה 16:03","StartDate":"1985-10-29T16:03:00+02:00","FinishDate":"1985-10-29T19:07:00+02:00","IsSpecialMeeting":null,"LastUpdatedDate":"2024-11-25T11:48:23.72+02:00"}
{"Id":436810,"Number":131,"KnessetNum":11,"Name":"ישיבת מליאה בתאריך 30/10/1985 בשעה 11:02","StartDate":"1985-10-30T11:02:00+02:00","FinishDate":"1985-10-30T17:29:00+02:00","IsSpecialMeeting":null,"LastUpdatedDate":"2024-11-27T08:26:04.603+02:00"}
{"Id":436811,"Number":132,"KnessetNum":11,"Name":"ישיבת מליאה בתאריך 04/11/1985 בשעה 16:02","StartDate":"1985-11-04T16:02:00+02:00","FinishDate":"1985-11-04T19:50:00+02:00","IsSpecialMeeting":null,"LastUpdatedDate":"2024-11-27T09:46:35.143+02:00"}
{"Id":436812,"Number":133,"KnessetNum":11,"Name":"ישיבת מליאה בתאריך 05/11/1985 בשעה 16:00","StartDate":"1985-11-05T16:00:00+02:00","FinishDate":"1985-11-05T17:49:00+02:00","IsSpecialMeeting":null,"LastUpdatedDate":"2024-11-27T10:27:47.673+02:00"}
{"Id":436813,"Number":134,"KnessetNum":11,"Name":"ישיבת מליאה בתאריך 06/11/1985 בשעה 11:02","StartDate":"1985-11-06T11:02:00+02:00","FinishDate":"1985-11-06T16:04:00+02:00","IsSpecialMeeting":null,"LastUpdatedDate":"2024-11-27T11:59:28.797+02:00"}
{"Id":436814,"Number":135,"KnessetNum":11,"Name":"ישיבת מליאה בתאריך 11/11/1985 בשעה 16:02","StartDate":"1985-11-11T16:02:00+02:00","FinishDate":"1985-11-11T20:31:00+02:00","IsSpecialMeeting":null,"LastUpdatedDate":"2024-11-27T12:12:05.393+02:00"}
{"Id":436815,"Number":137,"KnessetNum":11,"Name":"ישיבת מליאה בתאריך 13/11/1985 בשעה 11:03","StartDate":"1985-11-13T11:03:00+02:00","FinishDate":"1985-11-13T16:00:00+02:00","IsSpecialMeeting":null,"LastUpdatedDate":"2024-12-01T09:15:10.92+02:00"}
{"Id":436816,"Number":138,"KnessetNum":11,"Name":"ישיבת מליאה בתאריך 18/11/1985 בשעה 16:03","StartDate":"1985-11-18T16:03:00+02:00","FinishDate":"1985-11-18T20:49:00+02:00","IsSpecialMeeting":null,"LastUpdatedDate":"2024-12-01T08:25:29.6+02:00"}
{"Id":436817,"Number":141,"KnessetNum":11,"Name":"ישיבת מליאה בתאריך 25/11/1985 בשעה 16:01","StartDate":"1985-11-25T16:01:00+02:00","FinishDate":"1985-11-25T19:17:00+02:00","IsSpecialMeeting":null,"LastUpdatedDate":"2024-12-01T12:32:19.09+02:00"}
{"Id":436818,"Number":144,"KnessetNum":11,"Name":"ישיבת מליאה בתאריך 02/12/1985 בשעה 16:03","StartDate":"1985-12-02T16:03:00+02:00","FinishDate":"1985-12-02T20:25:00+02:00","IsSpecialMeeting":null,"LastUpdatedDate":"2024-12-02T12:02:11.563+02:00"}
{"Id":436819,"Number":147,"KnessetNum":11,"Name":"ישיבת מליאה בתאריך 09/12/1985 בשעה 16:00","StartDate":"1985-12-09T16:00:00+02:00","FinishDate":"1985-12-09T17:33:00+02:00","IsSpecialMeeting":null,"LastUpdatedDate":"2024-12-04T09:42:06.83+02:00"}
{"Id":436820,"Number":148,"KnessetNum":11,"Name":"ישיבת מליאה בתאריך 10/12/1985 בשעה 16:01","StartDate":"1985-12-10T16:01:00+02:00","FinishDate":"1985-12-10T20:34:00+02:00","IsSpecialMeeting":null,"LastUpdatedDate":"2024-12-04T10:27:55.81+02:00"}
{"Id":436821,"Number":149,"KnessetNum":11,"Name":"ישיבת מליאה בתאריך 11/12/1985 בשעה 11:01","StartDate":"1985-12-11T11:01:00+02:00","FinishDate":"1985-12-11T15:40:00+02:00","IsSpecialMeeting":null,"LastUpdatedDate":"2024-12-08T09:28:09.68+02:00"}
{"Id":436822,"Number":150,"KnessetNum":11,"Name":"ישיבת מליאה בתאריך 16/12/1985 בשעה 16:02","StartDate":"1985-12-16T16:02:00+02:00","FinishDate":"1985-12-16T19:05:00+02:00","IsSpecialMeeting":null,"LastUpdatedDate":"2024-12-08T10:07:50.82+02:00"}
{"Id":436823,"Number":151,"KnessetNum":11,"Name":"ישיבת מליאה בתאריך 17/12/1985 בשעה 16:03","StartDate":"1985-12-17T16:03:00+02:00","FinishDate":"1985-12-17T18:46:00+02:00","IsSpecialMeeting":null,"LastUpdatedDate":"2024-12-08T10:32:00.913+02:00"}
{"Id":436824,"Number":152,"KnessetNum":11,"Name":"ישיבת מליאה בתאריך 18/12/1985 בשעה 11:01","StartDate":"1985-12-18T11:01:00+02:00","FinishDate":"1985-12-18T14:55:00+02:00","IsSpecialMeeting":null,"LastUpdatedDate":"2024-12-09T09:21:04.737+02:00"}
{"Id":436825,"Number":153,"KnessetNum":11,"Name":"ישיבת מליאה בתאריך 23/12/1985 בשעה 16:00","StartDate":"1985-12-23T16:00:00+02:00","FinishDate":"1985-12-23T20:17:00+02:00","IsSpecialMeeting":null,"LastUpdatedDate":"2024-12-09T10:02:45.05+02:00"}
{"Id":436826,"Number":156,"KnessetNum":11,"Name":"ישיבת מליאה בתאריך 30/12/1985 בשעה 16:02","StartDate":"1985-12-30T16:02:00+02:00","FinishDate":"1985-12-30T19:36:00+02:00","IsSpecialMeeting":null,"LastUpdatedDate":"2020-09-30T09:57:13.34+03:00"}
{"Id":436827,"Number":157,"KnessetNum":11,"Name":"ישיבת מליאה בתאריך 31/12/1985 בשעה 16:03","StartDate":"1985-12-31T16:03:00+02:00","FinishDate":"1985-12-31T19:34:00+02:00","IsSpecialMeeting":null,"LastUpdatedDate":"2024-12-15T12:08:17.883+02:00"}
{"Id":436828,"Number":159,"KnessetNum":11,"Name":"ישיבת מליאה בתאריך 06/01/1986 בשעה 16:02","StartDate":"1986-01-06T16:02:00+02:00","FinishDate":"1986-01-06T21:02:00+02:00","IsSpecialMeeting":null,"LastUpdatedDate":"2024-12-16T08:25:19.003+02:00"}
{"Id":436829,"Number":160,"KnessetNum":11,"Name":"ישיבת מליאה בתאריך 07/01/1986 בשעה 16:01","StartDate":"1986-01-07T16:01:00+02:00","FinishDate":"1986-01-07T19:42:00+02:00","IsSpecialMeeting":null,"LastUpdatedDate":"2024-12-16T10:11:49.323+02:00"}
{"Id":436830,"Number":162,"KnessetNum":11,"Name":"ישיבת מליאה בתאריך 13/01/1986 בשעה 16:02","StartDate":"1986-01-13T16:02:00+02:00","FinishDate":"1986-01-13T19:42:00+02:00","IsSpecialMeeting":null,"LastUpdatedDate":"2024-12-16T12:59:03.18+02:00"}
{"Id":436831,"Number":163,"KnessetNum":11,"Name":"ישיבת מליאה בתאריך 14/01/1986 בשעה 16:02","StartDate":"1986-01-14T16:02:00+02:00","FinishDate":"1986-01-14T20:00:00+02:00","IsSpecialMeeting":null,"LastUpdatedDate":"2024-12-18T10:50:07.483+02:00"}
{"Id":436832,"Number":164,"KnessetNum":11,"Name":"ישיבת מליאה בתאריך 15/01/1986 בשעה 11:01","StartDate":"1986-01-15T11:01:00+02:00","FinishDate":"1986-01-15T18:19:00+02:00","IsSpecialMeeting":null,"LastUpdatedDate":"2024-12-18T10:42:51.69+02:00"}
{"Id":436833,"Number":165,"KnessetNum":11,"Name":"ישיבת מליאה בתאריך 20/01/1986 בשעה 16:02","StartDate":"1986-01-20T16:02:00+02:00","FinishDate":"1986-01-20T18:15:00+02:00","IsSpecialMeeting":null,"LastUpdatedDate":"2024-12-18T11:54:26.993+02:00"}
{"Id":436834,"Number":166,"KnessetNum":11,"Name":"ישיבת מליאה בתאריך 21/01/1986 בשעה 16:00","StartDate":"1986-01-21T16:00:00+02:00","FinishDate":"1986-01-21T20:29:00+02:00","IsSpecialMeeting":null,"LastUpdatedDate":"2024-12-18T12:12:33.143+02:00"}
{"Id":436835,"Number":167,"KnessetNum":11,"Name":"ישיבת מליאה בתאריך 22/01/1986 בשעה 11:01","StartDate":"1986-01-22T11:01:00+02:00","FinishDate":"1986-01-22T16:05:00+02:00","IsSpecialMeeting":null,"LastUpdatedDate":"2024-12-18T13:24:02.433+02:00"}
{"Id":436836,"Number":168,"KnessetNum":11,"Name":"ישיבת מליאה בתאריך 27/01/1986 בשעה 16:00","StartDate":"1986-01-27T16:00:00+02:00","FinishDate":"1986-01-27T21:35:00+02:00","IsSpecialMeeting":null,"LastUpdatedDate":"2024-12-23T09:38:10.32+02:00"}
{"Id":436837,"Number":171,"KnessetNum":11,"Name":"ישיבת מליאה בתאריך 03/02/1986 בשעה 16:01","StartDate":"1986-02-03T16:01:00+02:00","FinishDate":"1986-02-03T19:51:00+02:00","IsSpecialMeeting":null,"LastUpdatedDate":"2024-12-23T11:13:50.08+02:00"}
{"Id":436839,"Number":177,"KnessetNum":11,"Name":"ישיבת מליאה בתאריך 17/02/1986 בשעה 16:02","StartDate":"1986-02-17T16:02:00+02:00","FinishDate":"1986-02-17T20:06:00+02:00","IsSpecialMeeting":null,"LastUpdatedDate":"2024-12-29T08:57:17.237+02:00"}
{"Id":436840,"Number":178,"KnessetNum":11,"Name":"ישיבת מליאה בתאריך 18/02/1986 בשעה 16:00","StartDate":"1986-02-18T16:00:00+02:00","FinishDate":"1986-02-18T18:00:00+02:00","IsSpecialMeeting":null,"LastUpdatedDate":"2024-12-29T09:45:13+02:00"}
{"Id":436841,"Number":187,"KnessetNum":11,"Name":"ישיבת מליאה בתאריך 11/03/1986 בשעה 16:04","StartDate":"1986-03-11T16:04:00+02:00","FinishDate":"1986-03-11T19:50:00+02:00","IsSpecialMeeting":null,"LastUpdatedDate":"2025-01-08T11:20:04.667+02:00"}
{"Id":436842,"Number":191,"KnessetNum":11,"Name":"ישיבת מליאה בתאריך 19/03/1986 בשעה 11:01","StartDate":"1986-03-19T11:01:00+02:00","FinishDate":"1986-03-19T18:30:00+02:00","IsSpecialMeeting":null,"LastUpdatedDate":"2025-01-12T12:16:34.377+02:00"}
{"Id":436843,"Number":192,"KnessetNum":11,"Name":"ישיבת מליאה בתאריך 24/03/1986 בשעה 10:01","StartDate":"1986-03-24T10:01:00+02:00","FinishDate":"1986-03-24T14:53:00+02:00","IsSpecialMeeting":null,"LastUpdatedDate":"2025-01-12T12:28:46.92+02:00"}
{"Id":436844,"Number":193,"KnessetNum":11,"Name":"ישיבת מליאה בתאריך 27/03/1986 בשעה 10:00","StartDate":"1986-03-27T10:00:00+02:00","FinishDate":"1986-03-27T14:21:00+02:00","IsSpecialMeeting":null,"LastUpdatedDate":"2025-01-13T08:35:27.247+02:00"}
{"Id":436845,"Number":194,"KnessetNum":11,"Name":"ישיבת מליאה בתאריך 31/03/1986 בשעה 16:02","StartDate":"1986-03-31T16:02:00+02:00","FinishDate":"1986-03-31T21:55:00+02:00","IsSpecialMeeting":null,"LastUpdatedDate":"2025-01-13T09:14:06.923+02:00"}
{"Id":436846,"Number":195,"KnessetNum":11,"Name":"ישיבת מליאה בתאריך 01/04/1986 בשעה 16:01","StartDate":"1986-04-01T16:01:00+02:00","FinishDate":"1986-04-01T21:15:00+02:00","IsSpecialMeeting":null,"LastUpdatedDate":"2025-01-13T09:51:09.783+02:00"}
{"Id":436847,"Number":197,"KnessetNum":11,"Name":"ישיבת מליאה בתאריך 07/04/1986 בשעה 16:02","StartDate":"1986-04-07T16:02:00+03:00","FinishDate":"1986-04-07T23:04:00+03:00","IsSpecialMeeting":null,"LastUpdatedDate":"2025-01-15T09:24:43.74+02:00"}
{"Id":436848,"Number":198,"KnessetNum":11,"Name":"ישיבת מליאה בתאריך 08/04/1986 בשעה 16:01","StartDate":"1986-04-08T16:01:00+03:00","FinishDate":"1986-04-08T18:37:00+03:00","IsSpecialMeeting":null,"LastUpdatedDate":"2025-01-15T10:25:47.99+02:00"}
{"Id":436849,"Number":200,"KnessetNum":11,"Name":"ישיבת מליאה בתאריך 16/04/1986 בשעה 10:02","StartDate":"1986-04-16T10:02:00+03:00","FinishDate":"1986-04-16T15:05:00+03:00","IsSpecialMeeting":null,"LastUpdatedDate":"2025-01-15T11:13:21.68+02:00"}
{"Id":436850,"Number":203,"KnessetNum":11,"Name":"ישיבת מליאה בתאריך 21/05/1986 בשעה 11:03","StartDate":"1986-05-21T11:03:00+03:00","FinishDate":"1986-05-21T14:32:00+03:00","IsSpecialMeeting":null,"LastUpdatedDate":"2025-01-15T12:10:25.773+02:00"}
{"Id":436851,"Number":204,"KnessetNum":11,"Name":"ישיבת מליאה בתאריך 26/05/1986 בשעה 16:02","StartDate":"1986-05-26T16:02:00+03:00","FinishDate":"1986-05-26T20:38:00+03:00","IsSpecialMeeting":null,"LastUpdatedDate":"2025-01-15T12:42:10.28+02:00"}
{"Id":436852,"Number":206,"KnessetNum":11,"Name":"ישיבת מליאה בתאריך 28/05/1986 בשעה 11:00","StartDate":"1986-05-28T11:00:00+03:00","FinishDate":"1986-05-28T16:35:00+03:00","IsSpecialMeeting":null,"LastUpdatedDate":"2025-01-19T09:47:57.967+02:00"}
{"Id":436853,"Number":207,"KnessetNum":11,"Name":"ישיבת מליאה בתאריך 02/06/1986 בשעה 16:04","StartDate":"1986-06-02T16:04:00+03:00","FinishDate":"1986-06-02T20:27:00+03:00","IsSpecialMeeting":null,"LastUpdatedDate":"2025-02-02T12:06:00.827+02:00"}
{"Id":436854,"Number":208,"KnessetNum":11,"Name":"ישיבת מליאה בתאריך 03/06/1986 בשעה 16:00","StartDate":"1986-06-03T16:00:00+03:00","FinishDate":"1986-06-03T20:02:00+03:00","IsSpecialMeeting":null,"LastUpdatedDate":"2025-02-02T12:16:02.17+02:00"}
{"Id":436855,"Number":209,"KnessetNum":11,"Name":"ישיבת מליאה בתאריך 04/06/1986 בשעה 11:00","StartDate":"1986-06-04T11:00:00+03:00","FinishDate":"1986-06-04T17:27:00+03:00","IsSpecialMeeting":null,"LastUpdatedDate":"2025-01-20T08:51:49.883+02:00"}
{"Id":436856,"Number":219,"KnessetNum":11,"Name":"ישיבת מליאה בתאריך 30/06/1986 בשעה 16:02","StartDate":"1986-06-30T16:02:00+03:00","FinishDate":"1986-06-30T21:45:00+03:00","IsSpecialMeeting":null,"LastUpdatedDate":"2025-02-03T10:40:59.613+02:00"}
{"Id":436857,"Number":220,"KnessetNum":11,"Name":"ישיבת מליאה בתאריך 01/07/1986 בשעה 16:01","StartDate":"1986-07-01T16:01:00+03:00","FinishDate":"1986-07-01T18:45:00+03:00","IsSpecialMeeting":null,"LastUpdatedDate":"2025-02-03T12:44:49.31+02:00"}
{"Id":436858,"Number":221,"KnessetNum":11,"Name":"ישיבת מליאה בתאריך 02/07/1986 בשעה 11:01","StartDate":"1986-07-02T11:01:00+03:00","FinishDate":"1986-07-02T15:01:00+03:00","IsSpecialMeeting":null,"LastUpdatedDate":"2025-02-05T09:24:52.993+02:00"}
{"Id":436859,"Number":222,"KnessetNum":11,"Name":"ישיבת מליאה בתאריך 07/07/1986 בשעה 16:02","StartDate":"1986-07-07T16:02:00+03:00","FinishDate":"1986-07-07T23:23:00+03:00","IsSpecialMeeting":null,"LastUpdatedDate":"2025-02-05T09:48:32.593+02:00"}
{"Id":436860,"Number":223,"KnessetNum":11,"Name":"ישיבת מליאה בתאריך 08/07/1986 בשעה 16:01","StartDate":"1986-07-08T16:01:00+03:00","FinishDate":"1986-07-08T16:01:00+03:00","IsSpecialMeeting":null,"LastUpdatedDate":"2025-02-05T10:40:43.377+02:00"}
{"Id":436861,"Number":226,"KnessetNum":11,"Name":"ישיבת מליאה בתאריך 15/07/1986 בשעה 16:00","StartDate":"1986-07-15T16:00:00+03:00","FinishDate":"1986-07-15T16:00:00+03:00","IsSpecialMeeting":null,"LastUpdatedDate":"2025-02-09T11:59:12.007+02:00"}
{"Id":436862,"Number":227,"KnessetNum":11,"Name":"ישיבת מליאה בתאריך 16/07/1986 בשעה 11:00","StartDate":"1986-07-16T11:00:00+03:00","FinishDate":"1986-07-16T16:25:00+03:00","IsSpecialMeeting":null,"LastUpdatedDate":"2025-02-10T10:20:36.057+02:00"}
{"Id":436863,"Number":228,"KnessetNum":11,"Name":"ישיבת מליאה בתאריך 21/07/1986 בשעה 16:03","StartDate":"1986-07-21T16:03:00+03:00","FinishDate":"1986-07-21T18:02:00+03:00","IsSpecialMeeting":null,"LastUpdatedDate":"2025-02-10T10:49:14.31+02:00"}
{"Id":436864,"Number":229,"KnessetNum":11,"Name":"ישיבת מליאה בתאריך 22/07/1986 בשעה 16:00","StartDate":"1986-07-22T16:00:00+03:00","FinishDate":"1986-07-22T20:01:00+03:00","IsSpecialMeeting":null,"LastUpdatedDate":"2025-02-10T11:25:56.503+02:00"}
{"Id":436865,"Number":230,"KnessetNum":11,"Name":"ישיבת מליאה בתאריך 23/07/1986 בשעה 11:02","StartDate":"1986-07-23T11:02:00+03:00","FinishDate":"1986-07-23T16:09:00+03:00","IsSpecialMeeting":null,"LastUpdatedDate":"2025-02-12T08:23:35.953+02:00"}
{"Id":436866,"Number":232,"KnessetNum":11,"Name":"ישיבת מליאה בתאריך 29/07/1986 בשעה 15:00","StartDate":"1986-07-29T15:00:00+03:00","FinishDate":"1986-07-30T00:43:00+03:00","IsSpecialMeeting":null,"LastUpdatedDate":"2025-02-12T10:13:09.407+02:00"}
{"Id":436867,"Number":233,"KnessetNum":11,"Name":"ישיבת מליאה בתאריך 30/07/1986 בשעה 09:00","StartDate":"1986-07-30T09:00:00+03:00","FinishDate":"1986-07-30T13:28:00+03:00","IsSpecialMeeting":null,"LastUpdatedDate":"2025-02-12T11:34:48.927+02:00"}
{"Id":436868,"Number":235,"KnessetNum":11,"Name":"ישיבת מליאה בתאריך 05/08/1986 בשעה 15:00","StartDate":"1986-08-05T15:00:00+03:00","FinishDate":"1987-08-06T03:30:00+03:00","IsSpecialMeeting":null,"LastUpdatedDate":"2025-02-17T10:20:45.523+02:00"}
{"Id":436869,"Number":237,"KnessetNum":11,"Name":"ישיבת מליאה בתאריך 03/09/1986 בשעה 11:00","StartDate":"1986-09-03T11:00:00+03:00","FinishDate":"1986-09-03T12:33:00+03:00","IsSpecialMeeting":null,"LastUpdatedDate":"2025-02-19T10:56:51.14+02:00"}
{"Id":436870,"Number":244,"KnessetNum":11,"Name":"ישיבת מליאה בתאריך 07/10/1986 בשעה 10:02","StartDate":"1986-10-07T10:02:00+02:00","FinishDate":"1986-10-07T17:01:00+02:00","IsSpecialMeeting":null,"LastUpdatedDate":"2025-02-19T13:15:41.79+02:00"}
{"Id":436871,"Number":246,"KnessetNum":11,"Name":"ישיבת מליאה בתאריך 27/10/1986 בשעה 16:01","StartDate":"1986-10-27T16:01:00+02:00","FinishDate":"1986-10-27T19:31:00+02:00","IsSpecialMeeting":null,"LastUpdatedDate":"2025-02-23T09:22:28.927+02:00"}
{"Id":436872,"Number":248,"KnessetNum":11,"Name":"ישיבת מליאה בתאריך 29/10/1986 בשעה 11:00","StartDate":"1986-10-29T11:00:00+02:00","FinishDate":"1986-10-29T15:04:00+02:00","IsSpecialMeeting":null,"LastUpdatedDate":"2025-02-23T10:18:36.227+02:00"}
{"Id":436873,"Number":251,"KnessetNum":11,"Name":"ישיבת מליאה בתאריך 05/11/1986 בשעה 11:00","StartDate":"1986-11-05T11:00:00+02:00","FinishDate":"1986-11-05T17:42:00+02:00","IsSpecialMeeting":null,"LastUpdatedDate":"2025-02-23T12:13:47+02:00"}
{"Id":436875,"Number":252,"KnessetNum":11,"Name":"ישיבת מליאה בתאריך 10/11/1986 בשעה 16:00","StartDate":"1986-11-10T16:00:00+02:00","FinishDate":"1986-11-10T19:15:00+02:00","IsSpecialMeeting":null,"LastUpdatedDate":"2025-02-26T08:33:12.843+02:00"}
{"Id":436876,"Number":253,"KnessetNum":11,"Name":"ישיבת מליאה בתאריך 11/11/1986 בשעה 16:00","StartDate":"1986-11-11T16:00:00+02:00","FinishDate":"1986-11-11T16:00:00+02:00","IsSpecialMeeting":null,"LastUpdatedDate":"2025-02-26T09:12:06.143+02:00"}
{"Id":436877,"Number":255,"KnessetNum":11,"Name":"ישיבת מליאה בתאריך 17/11/1986 בשעה 16:00","StartDate":"1986-11-17T16:00:00+02:00","FinishDate":"1986-11-17T20:13:00+02:00","IsSpecialMeeting":null,"LastUpdatedDate":"2025-02-26T10:50:17.027+02:00"}
{"Id":436878,"Number":260,"KnessetNum":11,"Name":"ישיבת מליאה בתאריך 26/11/1986 בשעה 11:04","StartDate":"1986-11-26T11:04:00+02:00","FinishDate":"1986-11-26T17:12:00+02:00","IsSpecialMeeting":null,"LastUpdatedDate":"2025-03-02T10:42:09.267+02:00"}
{"Id":436879,"Number":261,"KnessetNum":11,"Name":"ישיבת מליאה בתאריך 01/12/1986 בשעה 16:02","StartDate":"1986-12-01T16:02:00+02:00","FinishDate":"1986-12-01T19:16:00+02:00","IsSpecialMeeting":null,"LastUpdatedDate":"2025-03-02T11:35:36.163+02:00"}
{"Id":436880,"Number":263,"KnessetNum":11,"Name":"ישיבת מליאה בתאריך 03/12/1986 בשעה 11:00","StartDate":"1986-12-03T11:00:00+02:00","FinishDate":"1986-12-03T18:43:00+02:00","IsSpecialMeeting":null,"LastUpdatedDate":"2025-03-03T10:59:46.663+02:00"}
{"Id":436881,"Number":264,"KnessetNum":11,"Name":"ישיבת מליאה בתאריך 08/12/1986 בשעה 16:04","StartDate":"1986-12-08T16:04:00+02:00","FinishDate":"1986-12-08T19:22:00+02:00","IsSpecialMeeting":null,"LastUpdatedDate":"2025-03-03T11:30:51.293+02:00"}
{"Id":436882,"Number":265,"KnessetNum":11,"Name":"ישיבת מליאה בתאריך 09/12/1986 בשעה 16:02","StartDate":"1986-12-09T16:02:00+02:00","FinishDate":"1986-12-09T20:40:00+02:00","IsSpecialMeeting":null,"LastUpdatedDate":"2025-03-03T11:54:33.79+02:00"}
{"Id":436883,"Number":266,"KnessetNum":11,"Name":"ישיבת מליאה בתאריך 10/12/1986 בשעה 11:02","StartDate":"1986-12-10T11:02:00+02:00","FinishDate":"1986-12-10T17:27:00+02:00","IsSpecialMeeting":null,"LastUpdatedDate":"2025-03-05T09:25:55.8+02:00"}
{"Id":436884,"Number":267,"KnessetNum":11,"Name":"ישיבת מליאה בתאריך 15/12/1986 בשעה 16:01","StartDate":"1986-12-15T16:01:00+02:00","FinishDate":"1986-12-15T19:32:00+02:00","IsSpecialMeeting":null,"LastUpdatedDate":"2025-03-05T09:53:12.347+02:00"}
{"Id":436885,"Number":269,"KnessetNum":11,"Name":"ישיבת מליאה בתאריך 17/12/1986 בשעה 11:00","StartDate":"1986-12-17T11:00:00+02:00","FinishDate":"1986-12-17T17:34:00+02:00","IsSpecialMeeting":null,"LastUpdatedDate":"2025-03-05T11:45:18.187+02:00"}
{"Id":436886,"Number":270,"KnessetNum":11,"Name":"ישיבת מליאה בתאריך 22/12/1986 בשעה 16:02","StartDate":"1986-12-22T16:02:00+02:00","FinishDate":"1986-12-22T19:25:00+02:00","IsSpecialMeeting":null,"LastUpdatedDate":"2025-03-05T11:56:17.08+02:00"}
{"Id":436887,"Number":271,"KnessetNum":11,"Name":"ישיבת מליאה בתאריך 23/12/1986 בשעה 16:01","StartDate":"1986-12-23T16:01:00+02:00","FinishDate":"1986-12-23T19:23:00+02:00","IsSpecialMeeting":null,"LastUpdatedDate":"2025-03-05T12:21:10.3+02:00"}
{"Id":436888,"Number":272,"KnessetNum":11,"Name":"ישיבת מליאה בתאריך 24/12/1986 בשעה 11:00","StartDate":"1986-12-24T11:00:00+02:00","FinishDate":"1986-12-24T16:05:00+02:00","IsSpecialMeeting":null,"LastUpdatedDate":"2025-03-09T10:15:52.36+02:00"}
{"Id":436889,"Number":273,"KnessetNum":11,"Name":"ישיבת מליאה בתאריך 29/12/1986 בשעה 16:02","StartDate":"1986-12-29T16:02:00+02:00","FinishDate":"1986-12-29T18:48:00+02:00","IsSpecialMeeting":null,"LastUpdatedDate":"2025-03-09T11:08:32.023+02:00"}
{"Id":436890,"Number":274,"KnessetNum":11,"Name":"ישיבת מליאה בתאריך 30/12/1986 בשעה 16:02","StartDate":"1986-12-30T16:02:00+02:00","FinishDate":"1986-12-30T19:20:00+02:00","IsSpecialMeeting":null,"LastUpdatedDate":"2025-03-09T11:17:21.8+02:00"}
{"Id":436891,"Number":275,"KnessetNum":11,"Name":"ישיבת מליאה בתאריך 31/12/1986 בשעה 11:04","StartDate":"1986-12-31T11:04:00+02:00","FinishDate":"1986-12-31T18:29:00+02:00","IsSpecialMeeting":null,"LastUpdatedDate":"2025-03-09T11:56:15.4+02:00"}
{"Id":436892,"Number":276,"KnessetNum":11,"Name":"ישיבת מליאה בתאריך 05/01/1987 בשעה 16:00","StartDate":"1987-01-05T16:00:00+02:00","FinishDate":"1987-01-05T20:01:00+02:00","IsSpecialMeeting":null,"LastUpdatedDate":"2025-03-10T10:17:32.71+02:00"}
{"Id":436893,"Number":277,"KnessetNum":11,"Name":"ישיבת מליאה בתאריך 06/01/1987 בשעה 16:02","StartDate":"1987-01-06T16:02:00+02:00","FinishDate":"1987-01-06T19:50:00+02:00","IsSpecialMeeting":null,"LastUpdatedDate":"2025-03-10T10:19:27.763+02:00"}
{"Id":436894,"Number":278,"KnessetNum":11,"Name":"ישיבת מליאה בתאריך 07/01/1987 בשעה 11:00","StartDate":"1987-01-07T11:00:00+02:00","FinishDate":"1987-01-07T17:58:00+02:00","IsSpecialMeeting":null,"LastUpdatedDate":"2025-03-12T12:54:09.017+02:00"}
{"Id":436895,"Number":279,"KnessetNum":11,"Name":"ישיבת מליאה בתאריך 12/01/1987 בשעה 16:02","StartDate":"1987-01-12T16:02:00+02:00","FinishDate":"1987-01-12T19:35:00+02:00","IsSpecialMeeting":null,"LastUpdatedDate":"2025-03-17T08:53:36.94+02:00"}
{"Id":436896,"Number":283,"KnessetNum":11,"Name":"ישיבת מליאה בתאריך 20/01/1987 בשעה 16:02","StartDate":"1987-01-20T16:02:00+02:00","FinishDate":"1987-01-20T21:27:00+02:00","IsSpecialMeeting":null,"LastUpdatedDate":"2025-03-17T12:00:58.417+02:00"}
{"Id":436897,"Number":289,"KnessetNum":11,"Name":"ישיבת מליאה בתאריך 02/02/1987 בשעה 16:02","StartDate":"1987-02-02T16:02:00+02:00","FinishDate":"1987-02-02T21:08:00+02:00","IsSpecialMeeting":null,"LastUpdatedDate":"2025-03-10T11:10:38.73+02:00"}
{"Id":436898,"Number":293,"KnessetNum":11,"Name":"ישיבת מליאה בתאריך 10/02/1987 בשעה 16:00","StartDate":"1987-02-10T16:00:00+02:00","FinishDate":"1987-02-10T21:32:00+02:00","IsSpecialMeeting":null,"LastUpdatedDate":"2025-03-10T11:12:28.873+02:00"}
{"Id":436899,"Number":294,"KnessetNum":11,"Name":"ישיבת מליאה בתאריך 11/02/1987 בשעה 11:02","StartDate":"1987-02-11T11:02:00+02:00","FinishDate":"1987-02-11T18:04:00+02:00","IsSpecialMeeting":null,"LastUpdatedDate":"2025-03-10T11:13:07.28+02:00"}
{"Id":436900,"Number":297,"KnessetNum":11,"Name":"ישיבת מליאה בתאריך 18/02/1987 בשעה 11:00","StartDate":"1987-02-18T11:00:00+02:00","FinishDate":"1987-02-18T17:27:00+02:00","IsSpecialMeeting":null,"LastUpdatedDate":"2025-03-30T10:58:09.28+03:00"}
{"Id":436901,"Number":298,"KnessetNum":11,"Name":"ישיבת מליאה בתאריך 23/02/1987 בשעה 16:03","StartDate":"1987-02-23T16:03:00+02:00","FinishDate":"1987-02-23T20:26:00+02:00","IsSpecialMeeting":null,"LastUpdatedDate":"2025-03-30T11:27:32.167+03:00"}
{"Id":436902,"Number":300,"KnessetNum":11,"Name":"ישיבת מליאה בתאריך 25/02/1987 בשעה 11:02","StartDate":"1987-02-25T11:02:00+02:00","FinishDate":"1987-02-25T17:07:00+02:00","IsSpecialMeeting":null,"LastUpdatedDate":"2025-03-31T12:41:48.373+03:00"}
{"Id":436903,"Number":301,"KnessetNum":11,"Name":"ישיבת מליאה בתאריך 02/03/1987 בשעה 16:02","StartDate":"1987-03-02T16:02:00+02:00","FinishDate":"1987-03-02T19:35:00+02:00","IsSpecialMeeting":null,"LastUpdatedDate":"2025-04-02T08:38:41.987+03:00"}
{"Id":436904,"Number":302,"KnessetNum":11,"Name":"ישיבת מליאה בתאריך 03/03/1987 בשעה 16:01","StartDate":"1987-03-03T16:01:00+02:00","FinishDate":"1987-03-03T19:29:00+02:00","IsSpecialMeeting":null,"LastUpdatedDate":"2025-03-10T11:36:15.187+02:00"}
{"Id":436905,"Number":306,"KnessetNum":11,"Name":"ישיבת מליאה בתאריך 11/03/1987 בשעה 11:02","StartDate":"1987-03-11T11:02:00+02:00","FinishDate":"1987-03-11T15:42:00+02:00","IsSpecialMeeting":null,"LastUpdatedDate":"2025-04-06T12:03:18.163+03:00"}
{"Id":436906,"Number":307,"KnessetNum":11,"Name":"ישיבת מליאה בתאריך 17/03/1987 בשעה 16:02","StartDate":"1987-03-17T16:02:00+02:00","FinishDate":"1987-03-17T19:39:00+02:00","IsSpecialMeeting":null,"LastUpdatedDate":"2025-03-10T11:48:06.283+02:00"}
{"Id":436907,"Number":308,"KnessetNum":11,"Name":"ישיבת מליאה בתאריך 18/03/1987 בשעה 14:05","StartDate":"1987-03-18T14:05:00+02:00","FinishDate":"1987-03-18T21:06:00+02:00","IsSpecialMeeting":null,"LastUpdatedDate":"2025-03-10T11:49:20.78+02:00"}
{"Id":436908,"Number":309,"KnessetNum":11,"Name":"ישיבת מליאה בתאריך 19/03/1987 בשעה 10:00","StartDate":"1987-03-19T10:00:00+02:00","FinishDate":"1987-03-19T15:24:00+02:00","IsSpecialMeeting":null,"LastUpdatedDate":"2025-04-20T11:00:38.73+03:00"}
{"Id":436909,"Number":310,"KnessetNum":11,"Name":"ישיבת מליאה בתאריך 23/03/1987 בשעה 16:03","StartDate":"1987-03-23T16:03:00+02:00","FinishDate":"1987-03-23T20:26:00+02:00","IsSpecialMeeting":null,"LastUpdatedDate":"2025-04-20T12:02:46.897+03:00"}
{"Id":436910,"Number":311,"KnessetNum":11,"Name":"ישיבת מליאה בתאריך 24/03/1987 בשעה 16:02","StartDate":"1987-03-24T16:02:00+02:00","FinishDate":"1987-03-24T21:28:00+02:00","IsSpecialMeeting":null,"LastUpdatedDate":"2025-04-27T08:02:04.963+03:00"}
{"Id":436911,"Number":313,"KnessetNum":11,"Name":"ישיבת מליאה בתאריך 30/03/1987 בשעה 16:03","StartDate":"1987-03-30T16:03:00+02:00","FinishDate":"1987-03-30T21:47:00+02:00","IsSpecialMeeting":null,"LastUpdatedDate":"2025-04-27T12:02:20.397+03:00"}
{"Id":436912,"Number":314,"KnessetNum":11,"Name":"ישיבת מליאה בתאריך 31/03/1987 בשעה 10:02","StartDate":"1987-03-31T10:02:00+02:00","FinishDate":"1987-03-31T23:30:00+02:00","IsSpecialMeeting":null,"LastUpdatedDate":"2025-03-10T12:28:00.19+02:00"}
{"Id":436913,"Number":315,"KnessetNum":11,"Name":"ישיבת מליאה בתאריך 01/04/1987 בשעה 11:01","StartDate":"1987-04-01T11:01:00+03:00","FinishDate":"1987-04-01T14:20:00+03:00","IsSpecialMeeting":null,"LastUpdatedDate":"2025-03-10T12:33:33.467+02:00"}
{"Id":436914,"Number":316,"KnessetNum":11,"Name":"ישיבת מליאה בתאריך 11/05/1987 בשעה 16:02","StartDate":"1987-05-11T16:02:00+03:00","FinishDate":"1987-05-11T18:15:00+03:00","IsSpecialMeeting":null,"LastUpdatedDate":"2025-03-10T12:35:32+02:00"}
{"Id":436915,"Number":317,"KnessetNum":11,"Name":"ישיבת מליאה בתאריך 12/05/1987 בשעה 16:02","StartDate":"1987-05-12T16:02:00+03:00","FinishDate":"1987-05-12T20:55:00+03:00","IsSpecialMeeting":null,"LastUpdatedDate":"2025-05-04T11:43:25.63+03:00"}
{"Id":436917,"Number":319,"KnessetNum":11,"Name":"ישיבת מליאה בתאריך 18/05/1987 בשעה 16:02","StartDate":"1987-05-18T16:02:00+03:00","FinishDate":"1987-05-18T19:54:00+03:00","IsSpecialMeeting":null,"LastUpdatedDate":"2025-03-10T12:41:12.17+02:00"}
{"Id":436918,"Number":322,"KnessetNum":11,"Name":"ישיבת מליאה בתאריך 25/05/1987 בשעה 16:03","StartDate":"1987-05-25T16:03:00+03:00","FinishDate":"1987-05-25T18:06:00+03:00","IsSpecialMeeting":null,"LastUpdatedDate":"2025-03-10T12:44:29.98+02:00"}
{"Id":436919,"Number":323,"KnessetNum":11,"Name":"ישיבת מליאה בתאריך 26/05/1987 בשעה 16:02","StartDate":"1987-05-26T16:02:00+03:00","FinishDate":"1987-05-26T18:55:00+03:00","IsSpecialMeeting":null,"LastUpdatedDate":"2025-05-05T10:46:44.327+03:00"}
{"Id":436920,"Number":324,"KnessetNum":11,"Name":"ישיבת מליאה בתאריך 27/05/1987 בשעה 11:02","StartDate":"1987-05-27T11:02:00+03:00","FinishDate":"1987-05-27T16:46:00+03:00","IsSpecialMeeting":null,"LastUpdatedDate":"2025-05-05T11:33:14.92+03:00"}
{"Id":436921,"Number":326,"KnessetNum":11,"Name":"ישיבת מליאה בתאריך 08/06/1987 בשעה 16:03","StartDate":"1987-06-08T16:03:00+03:00","FinishDate":"1987-06-08T20:29:00+03:00","IsSpecialMeeting":null,"LastUpdatedDate":"2025-03-10T12:50:54.17+02:00"}
{"Id":436922,"Number":327,"KnessetNum":11,"Name":"ישיבת מליאה בתאריך 09/06/1987 בשעה 16:03","StartDate":"1987-06-09T16:03:00+03:00","FinishDate":"1987-06-09T20:25:00+03:00","IsSpecialMeeting":null,"LastUpdatedDate":"2025-03-10T12:51:27.29+02:00"}
{"Id":436923,"Number":329,"KnessetNum":11,"Name":"ישיבת מליאה בתאריך 15/06/1987 בשעה 16:02","StartDate":"1987-06-15T16:02:00+03:00","FinishDate":"1987-06-15T18:13:00+03:00","IsSpecialMeeting":null,"LastUpdatedDate":"2025-05-14T10:36:22.59+03:00"}
{"Id":436924,"Number":331,"KnessetNum":11,"Name":"ישיבת מליאה בתאריך 17/06/1987 בשעה 11:02","StartDate":"1987-06-17T11:02:00+03:00","FinishDate":"1987-06-17T16:03:00+03:00","IsSpecialMeeting":null,"LastUpdatedDate":"2025-05-14T11:17:43.287+03:00"}
{"Id":436925,"Number":332,"KnessetNum":11,"Name":"ישיבת מליאה בתאריך 22/06/1987 בשעה 16:03","StartDate":"1987-06-22T16:03:00+03:00","FinishDate":"1987-06-22T19:51:00+03:00","IsSpecialMeeting":null,"LastUpdatedDate":"2025-03-10T15:10:10.88+02:00"}
{"Id":436926,"Number":334,"KnessetNum":11,"Name":"ישיבת מליאה בתאריך 24/06/1987 בשעה 11:03","StartDate":"1987-06-24T11:03:00+03:00","FinishDate":"1987-06-24T17:38:00+03:00","IsSpecialMeeting":null,"LastUpdatedDate":"2025-05-19T09:20:28.917+03:00"}
{"Id":436927,"Number":336,"KnessetNum":11,"Name":"ישיבת מליאה בתאריך 30/06/1987 בשעה 16:01","StartDate":"1987-06-30T16:01:00+03:00","FinishDate":"1987-06-30T23:15:00+03:00","IsSpecialMeeting":null,"LastUpdatedDate":"2025-05-19T11:32:18.407+03:00"}
{"Id":436928,"Number":338,"KnessetNum":11,"Name":"ישיבת מליאה בתאריך 06/07/1987 בשעה 16:01","StartDate":"1987-07-06T16:01:00+03:00","FinishDate":"1987-07-06T20:23:00+03:00","IsSpecialMeeting":null,"LastUpdatedDate":"2025-03-10T15:23:10.05+02:00"}
{"Id":436929,"Number":339,"KnessetNum":11,"Name":"ישיבת מליאה בתאריך 07/07/1987 בשעה 16:03","StartDate":"1987-07-07T16:03:00+03:00","FinishDate":"1987-07-07T22:11:00+03:00","IsSpecialMeeting":null,"LastUpdatedDate":"2025-05-21T10:21:20.67+03:00"}
{"Id":436930,"Number":340,"KnessetNum":11,"Name":"ישיבת מליאה בתאריך 08/07/1987 בשעה 11:02","StartDate":"1987-07-08T11:02:00+03:00","FinishDate":"1987-07-08T20:37:00+03:00","IsSpecialMeeting":null,"LastUpdatedDate":"2025-05-21T12:21:24.953+03:00"}
{"Id":436932,"Number":341,"KnessetNum":11,"Name":"ישיבת מליאה בתאריך 13/07/1987 בשעה 16:02","StartDate":"1987-07-13T16:02:00+03:00","FinishDate":"1987-07-13T19:18:00+03:00","IsSpecialMeeting":null,"LastUpdatedDate":"2025-03-10T15:33:12.983+02:00"}
{"Id":436933,"Number":342,"KnessetNum":11,"Name":"ישיבת מליאה בתאריך 14/07/1987 בשעה 16:00","StartDate":"1987-07-14T16:00:00+03:00","FinishDate":"1987-07-14T20:50:00+03:00","IsSpecialMeeting":null,"LastUpdatedDate":"2025-05-25T08:16:04.94+03:00"}
{"Id":436934,"Number":343,"KnessetNum":11,"Name":"ישיבת מליאה בתאריך 15/07/1987 בשעה 11:01","StartDate":"1987-07-15T11:01:00+03:00","FinishDate":"1987-07-15T18:50:00+03:00","IsSpecialMeeting":null,"LastUpdatedDate":"2025-05-25T10:30:21.297+03:00"}
{"Id":436935,"Number":344,"KnessetNum":11,"Name":"ישיבת מליאה בתאריך 20/07/1987 בשעה 16:02","StartDate":"1987-07-20T16:02:00+03:00","FinishDate":"1987-07-20T20:23:00+03:00","IsSpecialMeeting":null,"LastUpdatedDate":"2025-03-10T15:36:55.143+02:00"}
{"Id":436936,"Number":347,"KnessetNum":11,"Name":"ישיבת מליאה בתאריך 27/07/1987 בשעה 16:04","StartDate":"1987-07-27T16:04:00+03:00","FinishDate":"1987-07-27T22:42:00+03:00","IsSpecialMeeting":null,"LastUpdatedDate":"2025-05-26T10:13:23.953+03:00"}
{"Id":436937,"Number":349,"KnessetNum":11,"Name":"ישיבת מליאה בתאריך 29/07/1987 בשעה 09:02","StartDate":"1987-07-29T09:02:00+03:00","FinishDate":"1987-07-29T16:30:00+03:00","IsSpecialMeeting":null,"LastUpdatedDate":"2025-05-28T09:53:45.18+03:00"}
{"Id":436938,"Number":350,"KnessetNum":11,"Name":"ישיבת מליאה בתאריך 05/08/1987 בשעה 10:02","StartDate":"1987-08-05T10:02:00+03:00","FinishDate":"1987-08-05T17:37:00+03:00","IsSpecialMeeting":null,"LastUpdatedDate":"2025-06-04T08:27:25.84+03:00"}
{"Id":436939,"Number":355,"KnessetNum":11,"Name":"ישיבת מליאה בתאריך 21/10/1987 בשעה 11:02","StartDate":"1987-10-21T11:02:00+02:00","FinishDate":"1987-10-21T15:48:00+02:00","IsSpecialMeeting":null,"LastUpdatedDate":"2025-06-04T12:28:49.377+03:00"}
{"Id":436940,"Number":358,"KnessetNum":11,"Name":"ישיבת מליאה בתאריך 28/10/1987 בשעה 11:00","StartDate":"1987-10-28T11:00:00+02:00","FinishDate":"1987-10-28T16:03:00+02:00","IsSpecialMeeting":null,"LastUpdatedDate":"2025-06-08T09:25:08.447+03:00"}
{"Id":436941,"Number":359,"KnessetNum":11,"Name":"ישיבת מליאה בתאריך 02/11/1987 בשעה 16:04","StartDate":"1987-11-02T16:04:00+02:00","FinishDate":"1987-11-02T19:21:00+02:00","IsSpecialMeeting":null,"LastUpdatedDate":"2025-03-10T16:48:56.627+02:00"}
{"Id":436942,"Number":361,"KnessetNum":11,"Name":"ישיבת מליאה בתאריך 04/11/1987 בשעה 11:02","StartDate":"1987-11-04T11:02:00+02:00","FinishDate":"1987-11-04T18:23:00+02:00","IsSpecialMeeting":null,"LastUpdatedDate":"2025-06-08T12:34:16.47+03:00"}
{"Id":436943,"Number":362,"KnessetNum":11,"Name":"ישיבת מליאה בתאריך 09/11/1987 בשעה 16:00","StartDate":"1987-11-09T16:00:00+02:00","FinishDate":"1987-11-09T17:15:00+02:00","IsSpecialMeeting":null,"LastUpdatedDate":"2025-03-10T16:54:15.84+02:00"}
{"Id":436944,"Number":364,"KnessetNum":11,"Name":"ישיבת מליאה בתאריך 11/11/1987 בשעה 11:00","StartDate":"1987-11-11T11:00:00+02:00","FinishDate":"1987-11-11T15:18:00+02:00","IsSpecialMeeting":null,"LastUpdatedDate":"2025-03-10T17:04:34.497+02:00"}
{"Id":436945,"Number":365,"KnessetNum":11,"Name":"ישיבת מליאה בתאריך 16/11/1987 בשעה 16:03","StartDate":"1987-11-16T16:03:00+02:00","FinishDate":"1987-11-16T19:06:00+02:00","IsSpecialMeeting":null,"LastUpdatedDate":"2025-06-09T09:49:53.18+03:00"}
{"Id":436946,"Number":366,"KnessetNum":11,"Name":"ישיבת מליאה בתאריך 17/11/1987 בשעה 16:04","StartDate":"1987-11-17T16:04:00+02:00","FinishDate":"1987-11-17T19:09:00+02:00","IsSpecialMeeting":null,"LastUpdatedDate":"2025-03-10T17:06:12.48+02:00"}
{"Id":436947,"Number":367,"KnessetNum":11,"Name":"ישיבת מליאה בתאריך 18/11/1987 בשעה 11:02","StartDate":"1987-11-18T11:02:00+02:00","FinishDate":"1987-11-18T15:27:00+02:00","IsSpecialMeeting":null,"LastUpdatedDate":"2025-06-09T11:31:56.357+03:00"}
{"Id":436948,"Number":368,"KnessetNum":11,"Name":"ישיבת מליאה בתאריך 23/11/1987 בשעה 16:00","StartDate":"1987-11-23T16:00:00+02:00","FinishDate":"1987-11-23T19:36:00+02:00","IsSpecialMeeting":null,"LastUpdatedDate":"2025-03-10T17:09:01.943+02:00"}
{"Id":436949,"Number":369,"KnessetNum":11,"Name":"ישיבת מליאה בתאריך 24/11/1987 בשעה 16:02","StartDate":"1987-11-24T16:02:00+02:00","FinishDate":"1987-11-24T22:18:00+02:00","IsSpecialMeeting":null,"LastUpdatedDate":"2025-06-11T08:12:12.74+03:00"}
{"Id":436950,"Number":370,"KnessetNum":11,"Name":"ישיבת מליאה בתאריך 25/11/1987 בשעה 11:02","StartDate":"1987-11-25T11:02:00+02:00","FinishDate":"1987-11-25T14:55:00+02:00","IsSpecialMeeting":null,"LastUpdatedDate":"2025-06-11T10:04:12.51+03:00"}
{"Id":436951,"Number":371,"KnessetNum":11,"Name":"ישיבת מליאה בתאריך 30/11/1987 בשעה 16:02","StartDate":"1987-11-30T16:02:00+02:00","FinishDate":"1987-11-30T19:48:00+02:00","IsSpecialMeeting":null,"LastUpdatedDate":"2025-03-10T17:16:36.437+02:00"}
{"Id":436952,"Number":373,"KnessetNum":11,"Name":"ישיבת מליאה בתאריך 02/12/1987 בשעה 11:01","StartDate":"1987-12-02T11:01:00+02:00","FinishDate":"1987-12-02T16:37:00+02:00","IsSpecialMeeting":null,"LastUpdatedDate":"2025-06-11T11:54:16.327+03:00"}
{"Id":436953,"Number":374,"KnessetNum":11,"Name":"ישיבת מליאה בתאריך 07/12/1987 בשעה 16:01","StartDate":"1987-12-07T16:01:00+02:00","FinishDate":"1987-12-07T19:31:00+02:00","IsSpecialMeeting":null,"LastUpdatedDate":"2025-06-11T13:12:14.483+03:00"}
{"Id":436954,"Number":376,"KnessetNum":11,"Name":"ישיבת מליאה בתאריך 09/12/1987 בשעה 11:00","StartDate":"1987-12-09T11:00:00+02:00","FinishDate":"1987-12-09T18:13:00+02:00","IsSpecialMeeting":null,"LastUpdatedDate":"2025-03-10T17:26:52.167+02:00"}
{"Id":436955,"Number":377,"KnessetNum":11,"Name":"ישיבת מליאה בתאריך 14/12/1987 בשעה 16:00","StartDate":"1987-12-14T16:00:00+02:00","FinishDate":"1987-12-14T19:47:00+02:00","IsSpecialMeeting":null,"LastUpdatedDate":"2025-07-20T11:00:34.95+03:00"}
{"Id":436956,"Number":378,"KnessetNum":11,"Name":"ישיבת מליאה בתאריך 15/12/1987 בשעה 16:02","StartDate":"1987-12-15T16:02:00+02:00","FinishDate":"1987-12-15T19:01:00+02:00","IsSpecialMeeting":null,"LastUpdatedDate":"2025-03-11T09:04:32.85+02:00"}
{"Id":436957,"Number":380,"KnessetNum":11,"Name":"ישיבת מליאה בתאריך 21/12/1987 בשעה 16:03","StartDate":"1987-12-21T16:03:00+02:00","FinishDate":"1987-12-21T18:15:00+02:00","IsSpecialMeeting":null,"LastUpdatedDate":"2025-03-11T09:10:10.677+02:00"}
{"Id":436958,"Number":382,"KnessetNum":11,"Name":"ישיבת מליאה בתאריך 23/12/1987 בשעה 11:00","StartDate":"1987-12-23T11:00:00+02:00","FinishDate":"1987-12-23T16:42:00+02:00","IsSpecialMeeting":null,"LastUpdatedDate":"2025-03-11T09:49:49.133+02:00"}
{"Id":436959,"Number":383,"KnessetNum":11,"Name":"ישיבת מליאה בתאריך 28/12/1987 בשעה 16:00","StartDate":"1987-12-28T16:00:00+02:00","FinishDate":"1987-12-28T20:47:00+02:00","IsSpecialMeeting":null,"LastUpdatedDate":"2025-07-21T09:55:28.207+03:00"}
{"Id":436960,"Number":386,"KnessetNum":11,"Name":"ישיבת מליאה בתאריך 04/01/1988 בשעה 16:03","StartDate":"1988-01-04T16:03:00+02:00","FinishDate":"1988-01-04T19:58:00+02:00","IsSpecialMeeting":null,"LastUpdatedDate":"2025-07-28T08:29:00.833+03:00"}
{"Id":436961,"Number":387,"KnessetNum":11,"Name":"ישיבת מליאה בתאריך 05/01/1988 בשעה 16:00","StartDate":"1988-01-05T16:00:00+02:00","FinishDate":"1988-01-05T19:17:00+02:00","IsSpecialMeeting":null,"LastUpdatedDate":"2025-07-28T11:09:43.02+03:00"}
{"Id":436962,"Number":390,"KnessetNum":11,"Name":"ישיבת מליאה בתאריך 12/01/1988 בשעה 16:00","StartDate":"1988-01-12T16:00:00+02:00","FinishDate":"1988-01-12T20:43:00+02:00","IsSpecialMeeting":null,"LastUpdatedDate":"2025-07-30T10:20:28.807+03:00"}
{"Id":436963,"Number":391,"KnessetNum":11,"Name":"ישיבת מליאה בתאריך 13/01/1988 בשעה 11:00","StartDate":"1988-01-13T11:00:00+02:00","FinishDate":"1988-01-13T16:03:00+02:00","IsSpecialMeeting":null,"LastUpdatedDate":"2025-08-04T12:28:17.303+03:00"}
{"Id":436964,"Number":392,"KnessetNum":11,"Name":"ישיבת מליאה בתאריך 18/01/1988 בשעה 16:00","StartDate":"1988-01-18T16:00:00+02:00","FinishDate":"1988-01-18T20:03:00+02:00","IsSpecialMeeting":null,"LastUpdatedDate":"2025-08-04T12:46:57.993+03:00"}
{"Id":436965,"Number":396,"KnessetNum":11,"Name":"ישיבת מליאה בתאריך 26/01/1988 בשעה 16:03","StartDate":"1988-01-26T16:03:00+02:00","FinishDate":"1988-01-26T19:53:00+02:00","IsSpecialMeeting":null,"LastUpdatedDate":"2025-03-11T11:28:04.843+02:00"}
{"Id":436966,"Number":397,"KnessetNum":11,"Name":"ישיבת מליאה בתאריך 27/01/1988 בשעה 11:00","StartDate":"1988-01-27T11:00:00+02:00","FinishDate":"1988-01-27T16:24:00+02:00","IsSpecialMeeting":null,"LastUpdatedDate":"2025-03-11T11:28:41.563+02:00"}
{"Id":436967,"Number":401,"KnessetNum":11,"Name":"ישיבת מליאה בתאריך 08/02/1988 בשעה 16:02","StartDate":"1988-02-08T16:02:00+02:00","FinishDate":"1988-02-08T19:06:00+02:00","IsSpecialMeeting":null,"LastUpdatedDate":"2025-03-11T11:30:16.923+02:00"}
{"Id":436968,"Number":402,"KnessetNum":11,"Name":"ישיבת מליאה בתאריך 09/02/1988 בשעה 16:00","StartDate":"1988-02-09T16:00:00+02:00","FinishDate":"1988-02-09T21:12:00+02:00","IsSpecialMeeting":null,"LastUpdatedDate":"2025-08-10T11:20:02.63+03:00"}
{"Id":436969,"Number":403,"KnessetNum":11,"Name":"ישיבת מליאה בתאריך 10/02/1988 בשעה 11:00","StartDate":"1988-02-10T11:00:00+02:00","FinishDate":"1988-02-10T16:55:00+02:00","IsSpecialMeeting":null,"LastUpdatedDate":"2025-03-11T11:31:41.397+02:00"}
{"Id":436970,"Number":404,"KnessetNum":11,"Name":"ישיבת מליאה בתאריך 15/02/1988 בשעה 16:00","StartDate":"1988-02-15T16:00:00+02:00","FinishDate":"1988-02-15T18:31:00+02:00","IsSpecialMeeting":null,"LastUpdatedDate":"2025-08-13T08:48:36.437+03:00"}
{"Id":436971,"Number":406,"KnessetNum":11,"Name":"ישיבת מליאה בתאריך 17/02/1988 בשעה 11:00","StartDate":"1988-02-17T11:00:00+02:00","FinishDate":"1988-02-17T16:15:00+02:00","IsSpecialMeeting":null,"LastUpdatedDate":"2025-08-13T10:43:57.26+03:00"}
{"Id":436972,"Number":407,"KnessetNum":11,"Name":"ישיבת מליאה בתאריך 22/02/1988 בשעה 16:01","StartDate":"1988-02-22T16:01:00+02:00","FinishDate":"1988-02-22T19:16:00+02:00","IsSpecialMeeting":null,"LastUpdatedDate":"2025-08-13T11:39:21.393+03:00"}
{"Id":436973,"Number":410,"KnessetNum":11,"Name":"ישיבת מליאה בתאריך 24/02/1988 בשעה 11:00","StartDate":"1988-02-24T11:00:00+02:00","FinishDate":"1988-02-24T16:56:00+02:00","IsSpecialMeeting":null,"LastUpdatedDate":"2025-09-03T12:11:25.363+03:00"}
{"Id":436975,"Number":411,"KnessetNum":11,"Name":"ישיבת מליאה בתאריך 29/02/1988 בשעה 16:03","StartDate":"1988-02-29T16:03:00+02:00","FinishDate":"1988-02-29T20:31:00+02:00","IsSpecialMeeting":null,"LastUpdatedDate":"2025-09-03T12:31:21.917+03:00"}
{"Id":436976,"Number":412,"KnessetNum":11,"Name":"ישיבת מליאה בתאריך 01/03/1988 בשעה 16:01","StartDate":"1988-03-01T16:01:00+02:00","FinishDate":"1988-03-01T22:01:00+02:00","IsSpecialMeeting":null,"LastUpdatedDate":"2025-03-11T11:50:25.5+02:00"}
{"Id":436977,"Number":413,"KnessetNum":11,"Name":"ישיבת מליאה בתאריך 02/03/1988 בשעה 11:00","StartDate":"1988-03-02T11:00:00+02:00","FinishDate":"1988-03-02T14:10:00+02:00","IsSpecialMeeting":null,"LastUpdatedDate":"2025-09-17T09:29:06.07+03:00"}
{"Id":436978,"Number":414,"KnessetNum":11,"Name":"ישיבת מליאה בתאריך 07/03/1988 בשעה 16:02","StartDate":"1988-03-07T16:02:00+02:00","FinishDate":"1988-03-07T21:11:00+02:00","IsSpecialMeeting":null,"LastUpdatedDate":"2025-03-11T11:55:37.077+02:00"}
{"Id":436979,"Number":415,"KnessetNum":11,"Name":"ישיבת מליאה בתאריך 08/03/1988 בשעה 16:00","StartDate":"1988-03-08T16:00:00+02:00","FinishDate":"1988-03-08T19:50:00+02:00","IsSpecialMeeting":null,"LastUpdatedDate":"2025-03-11T11:59:10.227+02:00"}
{"Id":436980,"Number":416,"KnessetNum":11,"Name":"ישיבת מליאה בתאריך 09/03/1988 בשעה 11:01","StartDate":"1988-03-09T11:01:00+02:00","FinishDate":"1988-03-09T17:39:00+02:00","IsSpecialMeeting":null,"LastUpdatedDate":"2025-09-17T12:16:09.533+03:00"}
{"Id":436981,"Number":417,"KnessetNum":11,"Name":"ישיבת מליאה בתאריך 14/03/1988 בשעה 16:04","StartDate":"1988-03-14T16:04:00+02:00","FinishDate":"1988-03-14T20:23:00+02:00","IsSpecialMeeting":null,"LastUpdatedDate":"2025-10-22T09:06:43.53+03:00"}
{"Id":436982,"Number":418,"KnessetNum":11,"Name":"ישיבת מליאה בתאריך 15/03/1988 בשעה 16:03","StartDate":"1988-03-15T16:03:00+02:00","FinishDate":"1988-03-15T21:13:00+02:00","IsSpecialMeeting":null,"LastUpdatedDate":"2025-03-11T12:26:23.74+02:00"}
{"Id":436983,"Number":419,"KnessetNum":11,"Name":"ישיבת מליאה בתאריך 16/03/1988 בשעה 11:02","StartDate":"1988-03-16T11:02:00+02:00","FinishDate":"1988-03-16T17:50:00+02:00","IsSpecialMeeting":null,"LastUpdatedDate":"2025-10-27T11:12:50.41+02:00"}
{"Id":436984,"Number":421,"KnessetNum":11,"Name":"ישיבת מליאה בתאריך 22/03/1988 בשעה 16:02","StartDate":"1988-03-22T16:02:00+02:00","FinishDate":"1988-03-22T18:59:00+02:00","IsSpecialMeeting":null,"LastUpdatedDate":"2025-03-11T12:41:24.633+02:00"}
{"Id":436985,"Number":422,"KnessetNum":11,"Name":"ישיבת מליאה בתאריך 23/03/1988 בשעה 10:02","StartDate":"1988-03-23T10:02:00+02:00","FinishDate":"1988-03-23T22:37:00+02:00","IsSpecialMeeting":null,"LastUpdatedDate":"2025-03-11T12:42:17.037+02:00"}
{"Id":436986,"Number":426,"KnessetNum":11,"Name":"ישיבת מליאה בתאריך 02/05/1988 בשעה 16:03","StartDate":"1988-05-02T16:03:00+03:00","FinishDate":"1988-05-02T19:22:00+03:00","IsSpecialMeeting":null,"LastUpdatedDate":"2025-03-11T13:51:39.253+02:00"}
{"Id":436987,"Number":427,"KnessetNum":11,"Name":"ישיבת מליאה בתאריך 03/05/1988 בשעה 16:01","StartDate":"1988-05-03T16:01:00+03:00","FinishDate":"1988-05-03T17:38:00+03:00","IsSpecialMeeting":null,"LastUpdatedDate":"2025-03-11T13:52:13.047+02:00"}
{"Id":436988,"Number":428,"KnessetNum":11,"Name":"ישיבת מליאה בתאריך 04/05/1988 בשעה 11:03","StartDate":"1988-05-04T11:03:00+03:00","FinishDate":"1988-05-04T15:55:00+03:00","IsSpecialMeeting":null,"LastUpdatedDate":"2025-11-03T09:58:46.173+02:00"}
{"Id":436989,"Number":430,"KnessetNum":11,"Name":"ישיבת מליאה בתאריך 10/05/1988 בשעה 16:01","StartDate":"1988-05-10T16:01:00+03:00","FinishDate":"1988-05-10T19:00:00+03:00","IsSpecialMeeting":null,"LastUpdatedDate":"2025-11-03T11:09:27.79+02:00"}
{"Id":436990,"Number":431,"KnessetNum":11,"Name":"ישיבת מליאה בתאריך 11/05/1988 בשעה 11:02","StartDate":"1988-05-11T11:02:00+03:00","FinishDate":"1988-05-11T16:25:00+03:00","IsSpecialMeeting":null,"LastUpdatedDate":"2025-11-03T12:45:46.45+02:00"}
{"Id":436991,"Number":432,"KnessetNum":11,"Name":"ישיבת מליאה בתאריך 16/05/1988 בשעה 16:01","StartDate":"1988-05-16T16:01:00+03:00","FinishDate":"1988-05-16T18:36:00+03:00","IsSpecialMeeting":null,"LastUpdatedDate":"2025-11-05T09:01:39.893+02:00"}
{"Id":436992,"Number":434,"KnessetNum":11,"Name":"ישיבת מליאה בתאריך 18/05/1988 בשעה 11:04","StartDate":"1988-05-18T11:04:00+03:00","FinishDate":"1988-05-18T15:10:00+03:00","IsSpecialMeeting":null,"LastUpdatedDate":"2025-11-05T10:54:12.767+02:00"}
{"Id":436993,"Number":435,"KnessetNum":11,"Name":"ישיבת מליאה בתאריך 23/05/1988 בשעה 16:01","StartDate":"1988-05-23T16:01:00+03:00","FinishDate":"1988-05-23T17:39:00+03:00","IsSpecialMeeting":null,"LastUpdatedDate":"2025-03-11T14:04:18.583+02:00"}
{"Id":436994,"Number":436,"KnessetNum":11,"Name":"ישיבת מליאה בתאריך 24/05/1988 בשעה 16:01","StartDate":"1988-05-24T16:01:00+03:00","FinishDate":"1988-05-24T17:31:00+03:00","IsSpecialMeeting":null,"LastUpdatedDate":"2025-03-11T14:05:04.787+02:00"}
{"Id":436995,"Number":437,"KnessetNum":11,"Name":"ישיבת מליאה בתאריך 25/05/1988 בשעה 11:02","StartDate":"1988-05-25T11:02:00+03:00","FinishDate":"1988-05-25T17:18:00+03:00","IsSpecialMeeting":null,"LastUpdatedDate":"2025-11-05T12:50:19.713+02:00"}
{"Id":436996,"Number":441,"KnessetNum":11,"Name":"ישיבת מליאה בתאריך 06/06/1988 בשעה 16:02","StartDate":"1988-06-06T16:02:00+03:00","FinishDate":"1988-06-06T20:41:00+03:00","IsSpecialMeeting":null,"LastUpdatedDate":"2025-03-11T14:11:33.773+02:00"}
{"Id":436997,"Number":443,"KnessetNum":11,"Name":"ישיבת מליאה בתאריך 08/06/1988 בשעה 11:03","StartDate":"1988-06-08T11:03:00+03:00","FinishDate":"1988-06-08T16:45:00+03:00","IsSpecialMeeting":null,"LastUpdatedDate":"2025-11-09T12:40:06.033+02:00"}
{"Id":436998,"Number":447,"KnessetNum":11,"Name":"ישיבת מליאה בתאריך 15/06/1988 בשעה 11:02","StartDate":"1988-06-15T11:02:00+03:00","FinishDate":"1988-06-15T12:59:00+03:00","IsSpecialMeeting":null,"LastUpdatedDate":"2025-11-10T10:17:57.16+02:00"}
{"Id":436999,"Number":448,"KnessetNum":11,"Name":"ישיבת מליאה בתאריך 20/06/1988 בשעה 16:20","StartDate":"1988-06-20T16:20:00+03:00","FinishDate":"1988-06-20T18:31:00+03:00","IsSpecialMeeting":null,"LastUpdatedDate":"2025-03-11T14:54:15.017+02:00"}
{"Id":437000,"Number":453,"KnessetNum":11,"Name":"ישיבת מליאה בתאריך 29/06/1988 בשעה 11:02","StartDate":"1988-06-29T11:02:00+03:00","FinishDate":"1988-06-29T13:04:00+03:00","IsSpecialMeeting":null,"LastUpdatedDate":"2025-11-16T10:17:07.447+02:00"}
{"Id":437001,"Number":454,"KnessetNum":11,"Name":"ישיבת מליאה בתאריך 04/07/1988 בשעה 16:03","StartDate":"1988-07-04T16:03:00+03:00","FinishDate":"1988-07-04T19:04:00+03:00","IsSpecialMeeting":null,"LastUpdatedDate":"2025-11-16T11:04:30.087+02:00"}
{"Id":437002,"Number":455,"KnessetNum":11,"Name":"ישיבת מליאה בתאריך 05/07/1988 בשעה 16:01","StartDate":"1988-07-05T16:01:00+03:00","FinishDate":"1988-07-05T21:12:00+03:00","IsSpecialMeeting":null,"LastUpdatedDate":"2025-03-11T15:02:03.653+02:00"}
{"Id":437003,"Number":456,"KnessetNum":11,"Name":"ישיבת מליאה בתאריך 06/07/1988 בשעה 11:01","StartDate":"1988-07-06T11:01:00+03:00","FinishDate":"1988-07-06T13:35:00+03:00","IsSpecialMeeting":null,"LastUpdatedDate":"2025-11-16T13:04:20.96+02:00"}
{"Id":437004,"Number":457,"KnessetNum":11,"Name":"ישיבת מליאה בתאריך 11/07/1988 בשעה 16:01","StartDate":"1988-07-11T16:01:00+03:00","FinishDate":"1988-07-11T20:58:00+03:00","IsSpecialMeeting":null,"LastUpdatedDate":"2025-11-17T08:22:16.563+02:00"}
{"Id":437005,"Number":458,"KnessetNum":11,"Name":"ישיבת מליאה בתאריך 12/07/1988 בשעה 16:03","StartDate":"1988-07-12T16:03:00+03:00","FinishDate":"1988-07-12T19:01:00+03:00","IsSpecialMeeting":null,"LastUpdatedDate":"2025-03-11T15:04:14.1+02:00"}
{"Id":437006,"Number":459,"KnessetNum":11,"Name":"ישיבת מליאה בתאריך 13/07/1988 בשעה 11:02","StartDate":"1988-07-13T11:02:00+03:00","FinishDate":"1988-07-13T16:55:00+03:00","IsSpecialMeeting":null,"LastUpdatedDate":"2025-11-17T11:19:30.413+02:00"}
{"Id":437007,"Number":461,"KnessetNum":11,"Name":"ישיבת מליאה בתאריך 19/07/1988 בשעה 16:01","StartDate":"1988-07-19T16:01:00+03:00","FinishDate":"1988-07-19T21:29:00+03:00","IsSpecialMeeting":null,"LastUpdatedDate":"2025-11-19T08:44:20.053+02:00"}
{"Id":437008,"Number":462,"KnessetNum":11,"Name":"ישיבת מליאה בתאריך 20/07/1988 בשעה 11:02","StartDate":"1988-07-20T11:02:00+03:00","FinishDate":"1988-07-20T21:55:00+03:00","IsSpecialMeeting":null,"LastUpdatedDate":"2025-11-24T10:25:14.327+02:00"}
{"Id":437009,"Number":464,"KnessetNum":11,"Name":"ישיבת מליאה בתאריך 26/07/1988 בשעה 16:02","StartDate":"1988-07-26T16:02:00+03:00","FinishDate":"1988-07-26T22:19:00+03:00","IsSpecialMeeting":null,"LastUpdatedDate":"2025-11-24T12:18:13.383+02:00"}
{"Id":437010,"Number":465,"KnessetNum":11,"Name":"ישיבת מליאה בתאריך 27/07/1988 בשעה 09:00","StartDate":"1988-07-27T09:00:00+03:00","FinishDate":"1988-07-27T21:10:00+03:00","IsSpecialMeeting":null,"LastUpdatedDate":"2025-11-26T11:59:23.087+02:00"}
{"Id":437012,"Number":467,"KnessetNum":11,"Name":"ישיבת מליאה בתאריך 29/08/1988 בשעה 10:02","StartDate":"1988-08-29T10:02:00+03:00","FinishDate":"1988-08-29T11:25:00+03:00","IsSpecialMeeting":null,"LastUpdatedDate":"2025-03-11T15:12:04.007+02:00"}
{"Id":437013,"Number":3,"KnessetNum":12,"Name":"ישיבת מליאה בתאריך 29/11/1988 בשעה 16:03","StartDate":"1988-11-29T16:03:00+02:00","FinishDate":"1988-11-29T18:02:00+02:00","IsSpecialMeeting":null,"LastUpdatedDate":"2024-02-18T13:19:35.053+02:00"}
{"Id":437014,"Number":5,"KnessetNum":12,"Name":"ישיבת מליאה בתאריך 05/12/1988 בשעה 16:03","StartDate":"1988-12-05T16:03:00+02:00","FinishDate":"1988-12-05T18:22:00+02:00","IsSpecialMeeting":null,"LastUpdatedDate":"2024-03-13T11:57:20.04+02:00"}
{"Id":437015,"Number":8,"KnessetNum":12,"Name":"ישיבת מליאה בתאריך 13/12/1988 בשעה 16:01","StartDate":"1988-12-13T16:01:00+02:00","FinishDate":"1988-12-13T20:04:00+02:00","IsSpecialMeeting":null,"LastUpdatedDate":"2024-03-17T14:43:44.02+02:00"}
{"Id":437016,"Number":10,"KnessetNum":12,"Name":"ישיבת מליאה בתאריך 19/12/1988 בשעה 16:03","StartDate":"1988-12-19T16:03:00+02:00","FinishDate":"1988-12-19T18:14:00+02:00","IsSpecialMeeting":null,"LastUpdatedDate":"2024-03-27T16:36:48.04+02:00"}
{"Id":437017,"Number":11,"KnessetNum":12,"Name":"ישיבת מליאה בתאריך 20/12/1988 בשעה 16:04","StartDate":"1988-12-20T16:04:00+02:00","FinishDate":"1988-12-20T16:21:00+02:00","IsSpecialMeeting":null,"LastUpdatedDate":"2024-03-27T16:40:01.767+02:00"}
{"Id":437018,"Number":12,"KnessetNum":12,"Name":"ישיבת מליאה בתאריך 22/12/1988 בשעה 10:02","StartDate":"1988-12-22T10:02:00+02:00","FinishDate":"1988-12-22T16:25:00+02:00","IsSpecialMeeting":null,"LastUpdatedDate":"2024-03-27T16:49:16.94+02:00"}
{"Id":437019,"Number":13,"KnessetNum":12,"Name":"ישיבת מליאה בתאריך 26/12/1988 בשעה 16:02","StartDate":"1988-12-26T16:02:00+02:00","FinishDate":"1988-12-26T20:04:00+02:00","IsSpecialMeeting":null,"LastUpdatedDate":"2024-03-27T18:11:32.34+02:00"}
{"Id":437020,"Number":14,"KnessetNum":12,"Name":"ישיבת מליאה בתאריך 27/12/1988 בשעה 16:00","StartDate":"1988-12-27T16:00:00+02:00","FinishDate":"1988-12-27T20:30:00+02:00","IsSpecialMeeting":null,"LastUpdatedDate":"2024-03-27T18:28:22.9+02:00"}
{"Id":437021,"Number":15,"KnessetNum":12,"Name":"ישיבת מליאה בתאריך 28/12/1988 בשעה 11:01","StartDate":"1988-12-28T11:01:00+02:00","FinishDate":"1988-12-28T14:37:00+02:00","IsSpecialMeeting":null,"LastUpdatedDate":"2024-04-01T12:07:31.703+03:00"}
{"Id":437022,"Number":16,"KnessetNum":12,"Name":"ישיבת מליאה בתאריך 02/01/1989 בשעה 16:00","StartDate":"1989-01-02T16:00:00+02:00","FinishDate":"1989-01-02T20:11:00+02:00","IsSpecialMeeting":null,"LastUpdatedDate":"2024-04-01T13:27:53.587+03:00"}
{"Id":437023,"Number":19,"KnessetNum":12,"Name":"ישיבת מליאה בתאריך 09/01/1989 בשעה 16:00","StartDate":"1989-01-09T16:00:00+02:00","FinishDate":"1989-01-09T18:00:00+02:00","IsSpecialMeeting":null,"LastUpdatedDate":"2024-05-07T16:55:52.5+03:00"}
{"Id":437024,"Number":20,"KnessetNum":12,"Name":"ישיבת מליאה בתאריך 10/01/1989 בשעה 16:00","StartDate":"1989-01-10T16:00:00+02:00","FinishDate":"1989-01-10T20:55:00+02:00","IsSpecialMeeting":null,"LastUpdatedDate":"2024-04-30T10:09:17.743+03:00"}
{"Id":437025,"Number":22,"KnessetNum":12,"Name":"ישיבת מליאה בתאריך 16/01/1989 בשעה 16:02","StartDate":"1989-01-16T16:02:00+02:00","FinishDate":"1989-01-16T18:28:00+02:00","IsSpecialMeeting":null,"LastUpdatedDate":"2024-04-30T15:14:47.9+03:00"}
{"Id":437026,"Number":23,"KnessetNum":12,"Name":"ישיבת מליאה בתאריך 17/01/1989 בשעה 16:00","StartDate":"1989-01-17T16:00:00+02:00","FinishDate":"1989-01-17T17:58:00+02:00","IsSpecialMeeting":null,"LastUpdatedDate":"2024-04-30T15:20:01.91+03:00"}
{"Id":437027,"Number":27,"KnessetNum":12,"Name":"ישיבת מליאה בתאריך 25/01/1989 בשעה 11:02","StartDate":"1989-01-25T11:02:00+02:00","FinishDate":"1989-01-25T17:43:00+02:00","IsSpecialMeeting":null,"LastUpdatedDate":"2024-05-28T16:30:54.99+03:00"}
{"Id":437028,"Number":29,"KnessetNum":12,"Name":"ישיבת מליאה בתאריך 31/01/1989 בשעה 16:01","StartDate":"1989-01-31T16:01:00+02:00","FinishDate":"1989-01-31T18:47:00+02:00","IsSpecialMeeting":null,"LastUpdatedDate":"2024-06-02T02:23:53.163+03:00"}
{"Id":437029,"Number":31,"KnessetNum":12,"Name":"ישיבת מליאה בתאריך 06/02/1989 בשעה 16:00","StartDate":"1989-02-06T16:00:00+02:00","FinishDate":"1989-02-06T18:38:00+02:00","IsSpecialMeeting":null,"LastUpdatedDate":"2024-06-03T02:39:42.857+03:00"}
{"Id":437030,"Number":32,"KnessetNum":12,"Name":"ישיבת מליאה בתאריך 07/02/1989 בשעה 16:00","StartDate":"1989-02-07T16:00:00+02:00","FinishDate":"1989-02-07T18:02:00+02:00","IsSpecialMeeting":null,"LastUpdatedDate":"2024-06-03T02:59:48.023+03:00"}
{"Id":437031,"Number":33,"KnessetNum":12,"Name":"ישיבת מליאה בתאריך 08/02/1989 בשעה 11:04","StartDate":"1989-02-08T11:04:00+02:00","FinishDate":"1989-02-08T18:00:00+02:00","IsSpecialMeeting":null,"LastUpdatedDate":"2024-06-23T13:31:19.3+03:00"}
{"Id":437032,"Number":34,"KnessetNum":12,"Name":"ישיבת מליאה בתאריך 13/02/1989 בשעה 16:01","StartDate":"1989-02-13T16:01:00+02:00","FinishDate":"1989-02-13T19:33:00+02:00","IsSpecialMeeting":null,"LastUpdatedDate":"2024-06-23T14:48:49.847+03:00"}
{"Id":437033,"Number":39,"KnessetNum":12,"Name":"ישיבת מליאה בתאריך 22/02/1989 בשעה 11:01","StartDate":"1989-02-22T11:01:00+02:00","FinishDate":"1989-02-22T16:25:00+02:00","IsSpecialMeeting":null,"LastUpdatedDate":"2025-01-22T14:50:55.577+02:00"}
{"Id":437034,"Number":41,"KnessetNum":12,"Name":"ישיבת מליאה בתאריך 01/03/1989 בשעה 11:04","StartDate":"1989-03-01T11:04:00+02:00","FinishDate":"1989-03-01T13:02:00+02:00","IsSpecialMeeting":null,"LastUpdatedDate":"2025-01-27T11:31:32.357+02:00"}
{"Id":437035,"Number":42,"KnessetNum":12,"Name":"ישיבת מליאה בתאריך 06/03/1989 בשעה 16:01","StartDate":"1989-03-06T16:01:00+02:00","FinishDate":"1989-03-06T18:34:00+02:00","IsSpecialMeeting":null,"LastUpdatedDate":"2025-01-27T11:51:25.537+02:00"}
{"Id":437036,"Number":46,"KnessetNum":12,"Name":"ישיבת מליאה בתאריך 14/03/1989 בשעה 16:00","StartDate":"1989-03-14T16:00:00+02:00","FinishDate":"1989-03-14T17:30:00+02:00","IsSpecialMeeting":null,"LastUpdatedDate":"2025-01-29T11:42:23.44+02:00"}
{"Id":437037,"Number":48,"KnessetNum":12,"Name":"ישיבת מליאה בתאריך 20/03/1989 בשעה 10:00","StartDate":"1989-03-20T10:00:00+02:00","FinishDate":"1989-03-20T13:13:00+02:00","IsSpecialMeeting":null,"LastUpdatedDate":"2025-01-29T15:44:43.897+02:00"}
{"Id":437038,"Number":50,"KnessetNum":12,"Name":"ישיבת מליאה בתאריך 27/03/1989 בשעה 16:01","StartDate":"1989-03-27T16:01:00+02:00","FinishDate":"1989-03-27T22:16:00+02:00","IsSpecialMeeting":null,"LastUpdatedDate":"2025-02-02T14:15:47.117+02:00"}
{"Id":437039,"Number":52,"KnessetNum":12,"Name":"ישיבת מליאה בתאריך 29/03/1989 בשעה 10:01","StartDate":"1989-03-29T10:01:00+02:00","FinishDate":"1989-03-29T23:15:00+02:00","IsSpecialMeeting":null,"LastUpdatedDate":"2025-02-03T15:08:30.133+02:00"}
{"Id":437040,"Number":53,"KnessetNum":12,"Name":"ישיבת מליאה בתאריך 03/04/1989 בשעה 16:11","StartDate":"1989-04-03T16:11:00+02:00","FinishDate":"1989-04-03T20:40:00+02:00","IsSpecialMeeting":null,"LastUpdatedDate":"2025-02-03T16:05:04.807+02:00"}
{"Id":437041,"Number":54,"KnessetNum":12,"Name":"ישיבת מליאה בתאריך 04/04/1989 בשעה 16:01","StartDate":"1989-04-04T16:01:00+02:00","FinishDate":"1989-04-04T19:19:00+02:00","IsSpecialMeeting":null,"LastUpdatedDate":"2025-02-10T10:30:27.61+02:00"}
{"Id":437042,"Number":58,"KnessetNum":12,"Name":"ישיבת מליאה בתאריך 12/04/1989 בשעה 09:02","StartDate":"1989-04-12T09:02:00+03:00","FinishDate":"1989-04-12T14:30:00+03:00","IsSpecialMeeting":null,"LastUpdatedDate":"2025-02-24T13:55:21.797+02:00"}
{"Id":437043,"Number":60,"KnessetNum":12,"Name":"ישיבת מליאה בתאריך 15/05/1989 בשעה 16:02","StartDate":"1989-05-15T16:02:00+03:00","FinishDate":"1989-05-15T18:23:00+03:00","IsSpecialMeeting":null,"LastUpdatedDate":"2025-02-24T14:07:09.173+02:00"}
{"Id":437044,"Number":63,"KnessetNum":12,"Name":"ישיבת מליאה בתאריך 22/05/1989 בשעה 16:02","StartDate":"1989-05-22T16:02:00+03:00","FinishDate":"1989-05-22T20:28:00+03:00","IsSpecialMeeting":null,"LastUpdatedDate":"2025-03-03T15:22:54.703+02:00"}
{"Id":437045,"Number":65,"KnessetNum":12,"Name":"ישיבת מליאה בתאריך 24/05/1989 בשעה 11:02","StartDate":"1989-05-24T11:02:00+03:00","FinishDate":"1989-05-24T18:19:00+03:00","IsSpecialMeeting":null,"LastUpdatedDate":"2025-03-03T15:24:03.57+02:00"}
{"Id":437046,"Number":66,"KnessetNum":12,"Name":"ישיבת מליאה בתאריך 29/05/1989 בשעה 16:03","StartDate":"1989-05-29T16:03:00+03:00","FinishDate":"1989-05-29T20:20:00+03:00","IsSpecialMeeting":null,"LastUpdatedDate":"2025-03-03T15:34:50.783+02:00"}
{"Id":437047,"Number":67,"KnessetNum":12,"Name":"ישיבת מליאה בתאריך 30/05/1989 בשעה 16:00","StartDate":"1989-05-30T16:00:00+03:00","FinishDate":"1989-05-30T20:36:00+03:00","IsSpecialMeeting":null,"LastUpdatedDate":"2025-03-03T15:35:25.22+02:00"}
{"Id":437048,"Number":68,"KnessetNum":12,"Name":"ישיבת מליאה בתאריך 31/05/1989 בשעה 11:07","StartDate":"1989-05-31T11:07:00+03:00","FinishDate":"1989-05-31T17:30:00+03:00","IsSpecialMeeting":null,"LastUpdatedDate":"2025-03-03T15:36:02.447+02:00"}
{"Id":437049,"Number":71,"KnessetNum":12,"Name":"ישיבת מליאה בתאריך 07/06/1989 בשעה 11:00","StartDate":"1989-06-07T11:00:00+03:00","FinishDate":"1989-06-07T16:05:00+03:00","IsSpecialMeeting":null,"LastUpdatedDate":"2025-03-03T15:37:45.227+02:00"}
{"Id":437050,"Number":72,"KnessetNum":12,"Name":"ישיבת מליאה בתאריך 12/06/1989 בשעה 16:03","StartDate":"1989-06-12T16:03:00+03:00","FinishDate":"1989-06-12T20:25:00+03:00","IsSpecialMeeting":null,"LastUpdatedDate":"2025-03-03T15:42:25.3+02:00"}
{"Id":437051,"Number":74,"KnessetNum":12,"Name":"ישיבת מליאה בתאריך 14/06/1989 בשעה 11:03","StartDate":"1989-06-14T11:03:00+03:00","FinishDate":"1989-06-14T18:21:00+03:00","IsSpecialMeeting":null,"LastUpdatedDate":"2025-03-19T14:31:34.233+02:00"}
{"Id":437052,"Number":75,"KnessetNum":12,"Name":"ישיבת מליאה בתאריך 19/06/1989 בשעה 16:02","StartDate":"1989-06-19T16:02:00+03:00","FinishDate":"1989-06-19T19:56:00+03:00","IsSpecialMeeting":null,"LastUpdatedDate":"2025-03-19T15:07:29.51+02:00"}
{"Id":437053,"Number":76,"KnessetNum":12,"Name":"ישיבת מליאה בתאריך 20/06/1989 בשעה 16:01","StartDate":"1989-06-20T16:01:00+03:00","FinishDate":"1989-06-20T21:26:00+03:00","IsSpecialMeeting":null,"LastUpdatedDate":"2025-04-03T10:13:22.923+03:00"}
{"Id":437054,"Number":77,"KnessetNum":12,"Name":"ישיבת מליאה בתאריך 21/06/1989 בשעה 11:03","StartDate":"1989-06-21T11:03:00+03:00","FinishDate":"1989-06-21T16:12:00+03:00","IsSpecialMeeting":null,"LastUpdatedDate":"2025-03-03T15:57:39.98+02:00"}
{"Id":437055,"Number":78,"KnessetNum":12,"Name":"ישיבת מליאה בתאריך 26/06/1989 בשעה 16:02","StartDate":"1989-06-26T16:02:00+03:00","FinishDate":"1989-06-26T22:22:00+03:00","IsSpecialMeeting":null,"LastUpdatedDate":"2025-03-03T15:59:03.437+02:00"}
{"Id":437056,"Number":79,"KnessetNum":12,"Name":"ישיבת מליאה בתאריך 27/06/1989 בשעה 16:12","StartDate":"1989-06-27T16:12:00+03:00","FinishDate":"1989-06-27T21:12:00+03:00","IsSpecialMeeting":null,"LastUpdatedDate":"2025-03-03T15:59:39.01+02:00"}
{"Id":437057,"Number":81,"KnessetNum":12,"Name":"ישיבת מליאה בתאריך 03/07/1989 בשעה 16:03","StartDate":"1989-07-03T16:03:00+03:00","FinishDate":"1989-07-03T18:55:00+03:00","IsSpecialMeeting":null,"LastUpdatedDate":"2025-03-03T16:34:35.203+02:00"}
{"Id":437058,"Number":82,"KnessetNum":12,"Name":"ישיבת מליאה בתאריך 04/07/1989 בשעה 16:01","StartDate":"1989-07-04T16:01:00+03:00","FinishDate":"1989-07-04T20:18:00+03:00","IsSpecialMeeting":null,"LastUpdatedDate":"2025-03-03T16:35:05.14+02:00"}
{"Id":437059,"Number":84,"KnessetNum":12,"Name":"ישיבת מליאה בתאריך 10/07/1989 בשעה 16:01","StartDate":"1989-07-10T16:01:00+03:00","FinishDate":"1989-07-10T21:08:00+03:00","IsSpecialMeeting":null,"LastUpdatedDate":"2025-03-03T17:01:21.98+02:00"}
{"Id":437060,"Number":85,"KnessetNum":12,"Name":"ישיבת מליאה בתאריך 11/07/1989 בשעה 16:01","StartDate":"1989-07-11T16:01:00+03:00","FinishDate":"1989-07-11T18:30:00+03:00","IsSpecialMeeting":null,"LastUpdatedDate":"2025-03-03T17:05:34.397+02:00"}
{"Id":437061,"Number":86,"KnessetNum":12,"Name":"ישיבת מליאה בתאריך 12/07/1989 בשעה 11:02","StartDate":"1989-07-12T11:02:00+03:00","FinishDate":"1989-07-12T19:48:00+03:00","IsSpecialMeeting":null,"LastUpdatedDate":"2025-03-03T17:10:12.153+02:00"}
{"Id":437062,"Number":87,"KnessetNum":12,"Name":"ישיבת מליאה בתאריך 17/07/1989 בשעה 16:02","StartDate":"1989-07-17T16:02:00+03:00","FinishDate":"1989-07-17T20:35:00+03:00","IsSpecialMeeting":null,"LastUpdatedDate":"2025-03-03T17:11:43.327+02:00"}
{"Id":437063,"Number":89,"KnessetNum":12,"Name":"ישיבת מליאה בתאריך 19/07/1989 בשעה 11:00","StartDate":"1989-07-19T11:00:00+03:00","FinishDate":"1989-07-19T20:36:00+03:00","IsSpecialMeeting":null,"LastUpdatedDate":"2025-03-03T17:23:20.367+02:00"}
{"Id":437064,"Number":90,"KnessetNum":12,"Name":"ישיבת מליאה בתאריך 24/07/1989 בשעה 16:00","StartDate":"1989-07-24T16:00:00+03:00","FinishDate":"1989-07-24T22:13:00+03:00","IsSpecialMeeting":null,"LastUpdatedDate":"2025-03-03T17:23:58.447+02:00"}
{"Id":437065,"Number":91,"KnessetNum":12,"Name":"ישיבת מליאה בתאריך 25/07/1989 בשעה 16:01","StartDate":"1989-07-25T16:01:00+03:00","FinishDate":"1989-07-25T23:46:00+03:00","IsSpecialMeeting":null,"LastUpdatedDate":"2025-03-03T17:24:26.153+02:00"}
{"Id":437066,"Number":93,"KnessetNum":12,"Name":"ישיבת מליאה בתאריך 31/07/1989 בשעה 16:01","StartDate":"1989-07-31T16:01:00+03:00","FinishDate":"1989-07-31T20:16:00+03:00","IsSpecialMeeting":null,"LastUpdatedDate":"2025-03-03T17:46:21.467+02:00"}
{"Id":437067,"Number":94,"KnessetNum":12,"Name":"ישיבת מליאה בתאריך 01/08/1989 בשעה 15:00","StartDate":"1989-08-01T15:00:00+03:00","FinishDate":"1989-08-01T20:21:00+03:00","IsSpecialMeeting":null,"LastUpdatedDate":"2025-03-03T17:49:04.453+02:00"}
{"Id":437068,"Number":95,"KnessetNum":12,"Name":"ישיבת מליאה בתאריך 02/08/1989 בשעה 09:09","StartDate":"1989-08-02T09:09:00+03:00","FinishDate":"1989-08-03T12:16:00+03:00","IsSpecialMeeting":null,"LastUpdatedDate":"2025-06-17T19:13:52.233+03:00"}
{"Id":437069,"Number":99,"KnessetNum":12,"Name":"ישיבת מליאה בתאריך 25/09/1989 בשעה 10:46","StartDate":"1989-09-25T10:46:00+03:00","FinishDate":"1989-09-25T11:52:00+03:00","IsSpecialMeeting":null,"LastUpdatedDate":"2022-04-10T16:17:43.737+03:00"}
{"Id":437070,"Number":102,"KnessetNum":12,"Name":"ישיבת מליאה בתאריך 23/10/1989 בשעה 16:00","StartDate":"1989-10-23T16:00:00+02:00","FinishDate":"1989-10-23T20:44:00+02:00","IsSpecialMeeting":null,"LastUpdatedDate":"2025-03-03T18:02:45.873+02:00"}
{"Id":437071,"Number":103,"KnessetNum":12,"Name":"ישיבת מליאה בתאריך 24/10/1989 בשעה 16:01","StartDate":"1989-10-24T16:01:00+02:00","FinishDate":"1989-10-24T23:45:00+02:00","IsSpecialMeeting":null,"LastUpdatedDate":"2025-03-03T18:03:29.947+02:00"}
{"Id":437072,"Number":104,"KnessetNum":12,"Name":"ישיבת מליאה בתאריך 25/10/1989 בשעה 11:00","StartDate":"1989-10-25T11:00:00+02:00","FinishDate":"1989-10-25T13:15:00+02:00","IsSpecialMeeting":null,"LastUpdatedDate":"2025-03-03T18:04:32.583+02:00"}
{"Id":437073,"Number":105,"KnessetNum":12,"Name":"ישיבת מליאה בתאריך 30/10/1989 בשעה 16:00","StartDate":"1989-10-30T16:00:00+02:00","FinishDate":"1989-10-30T19:41:00+02:00","IsSpecialMeeting":null,"LastUpdatedDate":"2025-06-19T01:43:58.203+03:00"}
{"Id":437074,"Number":110,"KnessetNum":12,"Name":"ישיבת מליאה בתאריך 08/11/1989 בשעה 11:04","StartDate":"1989-11-08T11:04:00+02:00","FinishDate":"1989-11-08T17:51:00+02:00","IsSpecialMeeting":null,"LastUpdatedDate":"2025-03-04T08:32:33.523+02:00"}
{"Id":437075,"Number":111,"KnessetNum":12,"Name":"ישיבת מליאה בתאריך 13/11/1989 בשעה 16:01","StartDate":"1989-11-13T16:01:00+02:00","FinishDate":"1989-11-13T16:51:00+02:00","IsSpecialMeeting":null,"LastUpdatedDate":"2025-03-04T08:33:10.687+02:00"}
{"Id":437076,"Number":115,"KnessetNum":12,"Name":"ישיבת מליאה בתאריך 21/11/1989 בשעה 16:02","StartDate":"1989-11-21T16:02:00+02:00","FinishDate":"1989-11-21T19:14:00+02:00","IsSpecialMeeting":null,"LastUpdatedDate":"2025-03-04T08:35:34.147+02:00"}
{"Id":437077,"Number":116,"KnessetNum":12,"Name":"ישיבת מליאה בתאריך 22/11/1989 בשעה 09:00","StartDate":"1989-11-22T09:00:00+02:00","FinishDate":"1989-11-22T12:37:00+02:00","IsSpecialMeeting":null,"LastUpdatedDate":"2025-03-04T08:41:39.23+02:00"}
{"Id":437078,"Number":117,"KnessetNum":12,"Name":"ישיבת מליאה בתאריך 27/11/1989 בשעה 16:03","StartDate":"1989-11-27T16:03:00+02:00","FinishDate":"1989-11-27T21:47:00+02:00","IsSpecialMeeting":null,"LastUpdatedDate":"2025-06-25T16:22:17.88+03:00"}
{"Id":437079,"Number":118,"KnessetNum":12,"Name":"ישיבת מליאה בתאריך 28/11/1989 בשעה 16:01","StartDate":"1989-11-28T16:01:00+02:00","FinishDate":"1989-11-28T21:20:00+02:00","IsSpecialMeeting":null,"LastUpdatedDate":"2025-06-25T10:26:06.947+03:00"}
{"Id":437080,"Number":119,"KnessetNum":12,"Name":"ישיבת מליאה בתאריך 29/11/1989 בשעה 11:00","StartDate":"1989-11-29T11:00:00+02:00","FinishDate":"1989-11-29T19:14:00+02:00","IsSpecialMeeting":null,"LastUpdatedDate":"2025-03-04T08:43:39.703+02:00"}
{"Id":437081,"Number":123,"KnessetNum":12,"Name":"ישיבת מליאה בתאריך 11/12/1989 בשעה 16:01","StartDate":"1989-12-11T16:01:00+02:00","FinishDate":"1989-12-11T20:39:00+02:00","IsSpecialMeeting":null,"LastUpdatedDate":"2025-03-04T09:06:20.33+02:00"}
{"Id":437082,"Number":125,"KnessetNum":12,"Name":"ישיבת מליאה בתאריך 13/12/1989 בשעה 11:00","StartDate":"1989-12-13T11:00:00+02:00","FinishDate":"1989-12-13T17:43:00+02:00","IsSpecialMeeting":null,"LastUpdatedDate":"2025-03-04T09:08:00.623+02:00"}
{"Id":437083,"Number":126,"KnessetNum":12,"Name":"ישיבת מליאה בתאריך 18/12/1989 בשעה 16:02","StartDate":"1989-12-18T16:02:00+02:00","FinishDate":"1989-12-18T21:40:00+02:00","IsSpecialMeeting":null,"LastUpdatedDate":"2025-03-04T09:45:30.127+02:00"}
{"Id":437084,"Number":128,"KnessetNum":12,"Name":"ישיבת מליאה בתאריך 20/12/1989 בשעה 11:02","StartDate":"1989-12-20T11:02:00+02:00","FinishDate":"1989-12-20T17:55:00+02:00","IsSpecialMeeting":null,"LastUpdatedDate":"2025-03-04T10:03:28.713+02:00"}
{"Id":437086,"Number":129,"KnessetNum":12,"Name":"ישיבת מליאה בתאריך 25/12/1989 בשעה 16:03","StartDate":"1989-12-25T16:03:00+02:00","FinishDate":"1989-12-25T18:40:00+02:00","IsSpecialMeeting":null,"LastUpdatedDate":"2025-03-04T10:04:00.63+02:00"}
{"Id":437087,"Number":131,"KnessetNum":12,"Name":"ישיבת מליאה בתאריך 27/12/1989 בשעה 11:03","StartDate":"1989-12-27T11:03:00+02:00","FinishDate":"1989-12-27T15:03:00+02:00","IsSpecialMeeting":null,"LastUpdatedDate":"2025-03-04T10:05:35.537+02:00"}
{"Id":437088,"Number":132,"KnessetNum":12,"Name":"ישיבת מליאה בתאריך 01/01/1990 בשעה 16:02","StartDate":"1990-01-01T16:02:00+02:00","FinishDate":"1990-01-01T19:36:00+02:00","IsSpecialMeeting":null,"LastUpdatedDate":"2025-06-30T18:43:36.023+03:00"}
{"Id":437089,"Number":133,"KnessetNum":12,"Name":"ישיבת מליאה בתאריך 02/01/1990 בשעה 16:02","StartDate":"1990-01-02T16:02:00+02:00","FinishDate":"1990-01-02T20:07:00+02:00","IsSpecialMeeting":null,"LastUpdatedDate":"2025-03-04T10:23:26.527+02:00"}
{"Id":437090,"Number":134,"KnessetNum":12,"Name":"ישיבת מליאה בתאריך 03/01/1990 בשעה 11:04","StartDate":"1990-01-03T11:04:00+02:00","FinishDate":"1990-01-03T17:31:00+02:00","IsSpecialMeeting":null,"LastUpdatedDate":"2025-03-04T10:24:41.803+02:00"}
{"Id":437091,"Number":135,"KnessetNum":12,"Name":"ישיבת מליאה בתאריך 08/01/1990 בשעה 16:02","StartDate":"1990-01-08T16:02:00+02:00","FinishDate":"1990-01-08T22:04:00+02:00","IsSpecialMeeting":null,"LastUpdatedDate":"2025-03-04T10:25:11.143+02:00"}
{"Id":437092,"Number":136,"KnessetNum":12,"Name":"ישיבת מליאה בתאריך 09/01/1990 בשעה 16:01","StartDate":"1990-01-09T16:01:00+02:00","FinishDate":"1990-01-09T20:43:00+02:00","IsSpecialMeeting":null,"LastUpdatedDate":"2025-03-04T10:25:41.357+02:00"}
{"Id":437093,"Number":137,"KnessetNum":12,"Name":"ישיבת מליאה בתאריך 10/01/1990 בשעה 11:02","StartDate":"1990-01-10T11:02:00+02:00","FinishDate":"1990-01-10T20:29:00+02:00","IsSpecialMeeting":null,"LastUpdatedDate":"2025-03-04T10:26:27.277+02:00"}
{"Id":437094,"Number":140,"KnessetNum":12,"Name":"ישיבת מליאה בתאריך 17/01/1990 בשעה 11:01","StartDate":"1990-01-17T11:01:00+02:00","FinishDate":"1990-01-17T18:33:00+02:00","IsSpecialMeeting":null,"LastUpdatedDate":"2025-03-04T10:36:19.053+02:00"}
{"Id":437095,"Number":141,"KnessetNum":12,"Name":"ישיבת מליאה בתאריך 22/01/1990 בשעה 16:01","StartDate":"1990-01-22T16:01:00+02:00","FinishDate":"1990-01-22T20:00:00+02:00","IsSpecialMeeting":null,"LastUpdatedDate":"2025-03-04T10:36:52.05+02:00"}
{"Id":437096,"Number":143,"KnessetNum":12,"Name":"ישיבת מליאה בתאריך 24/01/1990 בשעה 11:00","StartDate":"1990-01-24T11:00:00+02:00","FinishDate":"1990-01-24T18:44:00+02:00","IsSpecialMeeting":null,"LastUpdatedDate":"2025-07-14T13:58:09.663+03:00"}
{"Id":437097,"Number":144,"KnessetNum":12,"Name":"ישיבת מליאה בתאריך 29/01/1990 בשעה 16:03","StartDate":"1990-01-29T16:03:00+02:00","FinishDate":"1990-01-29T20:23:00+02:00","IsSpecialMeeting":null,"LastUpdatedDate":"2022-12-27T09:52:03.7+02:00"}
{"Id":437098,"Number":146,"KnessetNum":12,"Name":"ישיבת מליאה בתאריך 31/01/1990 בשעה 11:00","StartDate":"1990-01-31T11:00:00+02:00","FinishDate":"1990-01-31T18:08:00+02:00","IsSpecialMeeting":null,"LastUpdatedDate":"2025-03-04T10:48:05.133+02:00"}
{"Id":437099,"Number":147,"KnessetNum":12,"Name":"ישיבת מליאה בתאריך 05/02/1990 בשעה 16:04","StartDate":"1990-02-05T16:04:00+02:00","FinishDate":"1990-02-05T18:08:00+02:00","IsSpecialMeeting":null,"LastUpdatedDate":"2025-03-04T10:48:48.537+02:00"}
{"Id":437100,"Number":149,"KnessetNum":12,"Name":"ישיבת מליאה בתאריך 07/02/1990 בשעה 11:02","StartDate":"1990-02-07T11:02:00+02:00","FinishDate":"1990-02-07T17:31:00+02:00","IsSpecialMeeting":null,"LastUpdatedDate":"2025-03-04T10:50:12.7+02:00"}
{"Id":437101,"Number":150,"KnessetNum":12,"Name":"ישיבת מליאה בתאריך 12/02/1990 בשעה 16:01","StartDate":"1990-02-12T16:01:00+02:00","FinishDate":"1990-02-12T17:45:00+02:00","IsSpecialMeeting":null,"LastUpdatedDate":"2025-03-04T10:51:17.61+02:00"}
{"Id":437102,"Number":152,"KnessetNum":12,"Name":"ישיבת מליאה בתאריך 14/02/1990 בשעה 11:06","StartDate":"1990-02-14T11:06:00+02:00","FinishDate":"1990-02-14T16:47:00+02:00","IsSpecialMeeting":null,"LastUpdatedDate":"2025-03-04T10:52:28.887+02:00"}
{"Id":437103,"Number":153,"KnessetNum":12,"Name":"ישיבת מליאה בתאריך 19/02/1990 בשעה 16:00","StartDate":"1990-02-19T16:00:00+02:00","FinishDate":"1990-02-19T21:17:00+02:00","IsSpecialMeeting":null,"LastUpdatedDate":"2025-08-04T01:34:38.003+03:00"}
{"Id":437104,"Number":154,"KnessetNum":12,"Name":"ישיבת מליאה בתאריך 20/02/1990 בשעה 16:00","StartDate":"1990-02-20T16:00:00+02:00","FinishDate":"1990-02-20T20:41:00+02:00","IsSpecialMeeting":null,"LastUpdatedDate":"2025-03-04T10:56:29+02:00"}
{"Id":437105,"Number":155,"KnessetNum":12,"Name":"ישיבת מליאה בתאריך 21/02/1990 בשעה 11:01","StartDate":"1990-02-21T11:01:00+02:00","FinishDate":"1990-02-21T15:41:00+02:00","IsSpecialMeeting":null,"LastUpdatedDate":"2025-08-04T17:37:31.15+03:00"}
{"Id":437106,"Number":156,"KnessetNum":12,"Name":"ישיבת מליאה בתאריך 26/02/1990 בשעה 16:02","StartDate":"1990-02-26T16:02:00+02:00","FinishDate":"1990-02-26T22:09:00+02:00","IsSpecialMeeting":null,"LastUpdatedDate":"2025-03-04T10:57:36.543+02:00"}
{"Id":437107,"Number":157,"KnessetNum":12,"Name":"ישיבת מליאה בתאריך 27/02/1990 בשעה 16:01","StartDate":"1990-02-27T16:01:00+02:00","FinishDate":"1990-02-27T22:38:00+02:00","IsSpecialMeeting":null,"LastUpdatedDate":"2025-03-04T10:58:04.507+02:00"}
{"Id":437108,"Number":158,"KnessetNum":12,"Name":"ישיבת מליאה בתאריך 28/02/1990 בשעה 11:01","StartDate":"1990-02-28T11:01:00+02:00","FinishDate":"1990-02-28T16:05:00+02:00","IsSpecialMeeting":null,"LastUpdatedDate":"2025-03-04T10:58:39.59+02:00"}
{"Id":437109,"Number":159,"KnessetNum":12,"Name":"ישיבת מליאה בתאריך 05/03/1990 בשעה 16:01","StartDate":"1990-03-05T16:01:00+02:00","FinishDate":"1990-03-05T21:47:00+02:00","IsSpecialMeeting":null,"LastUpdatedDate":"2025-03-04T10:59:10.01+02:00"}
{"Id":437110,"Number":162,"KnessetNum":12,"Name":"ישיבת מליאה בתאריך 13/03/1990 בשעה 16:03","StartDate":"1990-03-13T16:03:00+02:00","FinishDate":"1990-03-13T21:10:00+02:00","IsSpecialMeeting":null,"LastUpdatedDate":"2025-09-04T14:39:31.303+03:00"}
{"Id":437111,"Number":164,"KnessetNum":12,"Name":"ישיבת מליאה בתאריך 15/03/1990 בשעה 10:03","StartDate":"1990-03-15T10:03:00+02:00","FinishDate":"1990-03-15T20:46:00+02:00","IsSpecialMeeting":null,"LastUpdatedDate":"2025-09-07T11:32:02.343+03:00"}
{"Id":437112,"Number":165,"KnessetNum":12,"Name":"ישיבת מליאה בתאריך 19/03/1990 בשעה 16:03","StartDate":"1990-03-19T16:03:00+02:00","FinishDate":"1990-03-19T19:33:00+02:00","IsSpecialMeeting":null,"LastUpdatedDate":"2025-03-04T14:02:21.19+02:00"}
{"Id":437113,"Number":167,"KnessetNum":12,"Name":"ישיבת מליאה בתאריך 21/03/1990 בשעה 11:02","StartDate":"1990-03-21T11:02:00+02:00","FinishDate":"1990-03-21T20:07:00+02:00","IsSpecialMeeting":null,"LastUpdatedDate":"2025-03-04T14:17:36.203+02:00"}
{"Id":437114,"Number":170,"KnessetNum":12,"Name":"ישיבת מליאה בתאריך 27/03/1990 בשעה 11:03","StartDate":"1990-03-27T11:03:00+02:00","FinishDate":"1990-03-28T00:29:00+02:00","IsSpecialMeeting":null,"LastUpdatedDate":"2025-03-04T14:32:35.697+02:00"}
{"Id":437117,"Number":172,"KnessetNum":12,"Name":"ישיבת מליאה בתאריך 07/05/1990 בשעה 16:01","StartDate":"1990-05-07T16:01:00+03:00","FinishDate":"1990-05-07T20:52:00+03:00","IsSpecialMeeting":null,"LastUpdatedDate":"2025-03-04T14:36:23.49+02:00"}
{"Id":437118,"Number":174,"KnessetNum":12,"Name":"ישיבת מליאה בתאריך 09/05/1990 בשעה 11:07","StartDate":"1990-05-09T11:07:00+03:00","FinishDate":"1990-05-09T16:47:00+03:00","IsSpecialMeeting":null,"LastUpdatedDate":"2025-03-04T14:39:28.68+02:00"}
{"Id":437119,"Number":175,"KnessetNum":12,"Name":"ישיבת מליאה בתאריך 14/05/1990 בשעה 16:01","StartDate":"1990-05-14T16:01:00+03:00","FinishDate":"1990-05-14T20:07:00+03:00","IsSpecialMeeting":null,"LastUpdatedDate":"2025-03-04T14:40:30.63+02:00"}
{"Id":437120,"Number":177,"KnessetNum":12,"Name":"ישיבת מליאה בתאריך 16/05/1990 בשעה 11:03","StartDate":"1990-05-16T11:03:00+03:00","FinishDate":"1990-05-16T14:46:00+03:00","IsSpecialMeeting":null,"LastUpdatedDate":"2025-09-16T16:04:39.313+03:00"}
{"Id":437121,"Number":178,"KnessetNum":12,"Name":"ישיבת מליאה בתאריך 21/05/1990 בשעה 16:01","StartDate":"1990-05-21T16:01:00+03:00","FinishDate":"1990-05-21T20:07:00+03:00","IsSpecialMeeting":null,"LastUpdatedDate":"2025-03-04T14:56:06.84+02:00"}
{"Id":437122,"Number":179,"KnessetNum":12,"Name":"ישיבת מליאה בתאריך 22/05/1990 בשעה 16:02","StartDate":"1990-05-22T16:02:00+03:00","FinishDate":"1990-05-22T21:51:00+03:00","IsSpecialMeeting":null,"LastUpdatedDate":"2025-03-04T14:56:56.047+02:00"}
{"Id":437123,"Number":181,"KnessetNum":12,"Name":"ישיבת מליאה בתאריך 28/05/1990 בשעה 10:00","StartDate":"1990-05-28T10:00:00+03:00","FinishDate":"1990-05-28T16:37:00+03:00","IsSpecialMeeting":null,"LastUpdatedDate":"2025-03-04T15:02:34.023+02:00"}
{"Id":437125,"Number":182,"KnessetNum":12,"Name":"ישיבת מליאה בתאריך 04/06/1990 בשעה 16:03","StartDate":"1990-06-04T16:03:00+03:00","FinishDate":"1990-06-04T20:33:00+03:00","IsSpecialMeeting":null,"LastUpdatedDate":"2025-03-04T15:03:15.907+02:00"}
{"Id":437126,"Number":183,"KnessetNum":12,"Name":"ישיבת מליאה בתאריך 05/06/1990 בשעה 16:00","StartDate":"1990-06-05T16:00:00+03:00","FinishDate":"1990-06-05T20:25:00+03:00","IsSpecialMeeting":null,"LastUpdatedDate":"2025-03-04T15:03:42.67+02:00"}
{"Id":437127,"Number":185,"KnessetNum":12,"Name":"ישיבת מליאה בתאריך 11/06/1990 בשעה 16:04","StartDate":"1990-06-11T16:04:00+03:00","FinishDate":"1990-06-11T22:25:00+03:00","IsSpecialMeeting":null,"LastUpdatedDate":"2025-03-04T15:09:29.007+02:00"}
{"Id":437128,"Number":188,"KnessetNum":12,"Name":"ישיבת מליאה בתאריך 18/06/1990 בשעה 16:02","StartDate":"1990-06-18T16:02:00+03:00","FinishDate":"1990-06-18T20:34:00+03:00","IsSpecialMeeting":null,"LastUpdatedDate":"2025-03-04T15:19:02.89+02:00"}
{"Id":437129,"Number":190,"KnessetNum":12,"Name":"ישיבת מליאה בתאריך 20/06/1990 בשעה 11:04","StartDate":"1990-06-20T11:04:00+03:00","FinishDate":"1990-06-20T15:48:00+03:00","IsSpecialMeeting":null,"LastUpdatedDate":"2025-03-04T15:20:37.763+02:00"}
{"Id":437130,"Number":191,"KnessetNum":12,"Name":"ישיבת מליאה בתאריך 25/06/1990 בשעה 16:05","StartDate":"1990-06-25T16:05:00+03:00","FinishDate":"1990-06-25T21:42:00+03:00","IsSpecialMeeting":null,"LastUpdatedDate":"2025-03-04T16:04:39.98+02:00"}
{"Id":437131,"Number":192,"KnessetNum":12,"Name":"ישיבת מליאה בתאריך 26/06/1990 בשעה 16:03","StartDate":"1990-06-26T16:03:00+03:00","FinishDate":"1990-06-26T20:01:00+03:00","IsSpecialMeeting":null,"LastUpdatedDate":"2025-03-04T16:05:23.9+02:00"}
{"Id":437132,"Number":193,"KnessetNum":12,"Name":"ישיבת מליאה בתאריך 27/06/1990 בשעה 11:02","StartDate":"1990-06-27T11:02:00+03:00","FinishDate":"1990-06-27T15:57:00+03:00","IsSpecialMeeting":null,"LastUpdatedDate":"2025-03-04T16:06:15.387+02:00"}
{"Id":437133,"Number":195,"KnessetNum":12,"Name":"ישיבת מליאה בתאריך 03/07/1990 בשעה 16:02","StartDate":"1990-07-03T16:02:00+03:00","FinishDate":"1990-07-03T20:55:00+03:00","IsSpecialMeeting":null,"LastUpdatedDate":"2025-03-04T16:07:44.143+02:00"}
{"Id":437134,"Number":196,"KnessetNum":12,"Name":"ישיבת מליאה בתאריך 04/07/1990 בשעה 11:02","StartDate":"1990-07-04T11:02:00+03:00","FinishDate":"1990-07-04T18:55:00+03:00","IsSpecialMeeting":null,"LastUpdatedDate":"2025-03-04T16:08:33.47+02:00"}
{"Id":437135,"Number":197,"KnessetNum":12,"Name":"ישיבת מליאה בתאריך 09/07/1990 בשעה 16:01","StartDate":"1990-07-09T16:01:00+03:00","FinishDate":"1990-07-09T21:52:00+03:00","IsSpecialMeeting":null,"LastUpdatedDate":"2025-03-04T16:14:42.9+02:00"}
{"Id":437136,"Number":198,"KnessetNum":12,"Name":"ישיבת מליאה בתאריך 10/07/1990 בשעה 16:00","StartDate":"1990-07-10T16:00:00+03:00","FinishDate":"1990-07-10T20:38:00+03:00","IsSpecialMeeting":null,"LastUpdatedDate":"2025-03-04T16:15:18.947+02:00"}
{"Id":437137,"Number":199,"KnessetNum":12,"Name":"ישיבת מליאה בתאריך 11/07/1990 בשעה 11:03","StartDate":"1990-07-11T11:03:00+03:00","FinishDate":"1990-07-11T19:31:00+03:00","IsSpecialMeeting":null,"LastUpdatedDate":"2025-03-04T16:16:32.463+02:00"}
{"Id":437138,"Number":200,"KnessetNum":12,"Name":"ישיבת מליאה בתאריך 16/07/1990 בשעה 16:01","StartDate":"1990-07-16T16:01:00+03:00","FinishDate":"1990-07-16T20:15:00+03:00","IsSpecialMeeting":null,"LastUpdatedDate":"2025-03-04T16:17:31.247+02:00"}
{"Id":437139,"Number":201,"KnessetNum":12,"Name":"ישיבת מליאה בתאריך 17/07/1990 בשעה 16:00","StartDate":"1990-07-17T16:00:00+03:00","FinishDate":"1990-07-17T20:40:00+03:00","IsSpecialMeeting":null,"LastUpdatedDate":"2025-03-04T16:18:05.403+02:00"}
{"Id":437140,"Number":202,"KnessetNum":12,"Name":"ישיבת מליאה בתאריך 18/07/1990 בשעה 11:02","StartDate":"1990-07-18T11:02:00+03:00","FinishDate":"1990-07-18T17:00:00+03:00","IsSpecialMeeting":null,"LastUpdatedDate":"2025-03-04T16:19:50.39+02:00"}
{"Id":437141,"Number":203,"KnessetNum":12,"Name":"ישיבת מליאה בתאריך 23/07/1990 בשעה 16:04","StartDate":"1990-07-23T16:04:00+03:00","FinishDate":"1990-07-23T18:19:00+03:00","IsSpecialMeeting":null,"LastUpdatedDate":"2025-03-04T16:20:42.733+02:00"}
{"Id":437142,"Number":204,"KnessetNum":12,"Name":"ישיבת מליאה בתאריך 24/07/1990 בשעה 16:00","StartDate":"1990-07-24T16:00:00+03:00","FinishDate":"1990-07-24T20:07:00+03:00","IsSpecialMeeting":null,"LastUpdatedDate":"2025-10-26T14:51:05.353+02:00"}
{"Id":437143,"Number":205,"KnessetNum":12,"Name":"ישיבת מליאה בתאריך 25/07/1990 בשעה 11:02","StartDate":"1990-07-25T11:02:00+03:00","FinishDate":"1990-07-25T19:31:00+03:00","IsSpecialMeeting":null,"LastUpdatedDate":"2025-10-27T12:17:18.663+02:00"}
{"Id":437144,"Number":206,"KnessetNum":12,"Name":"ישיבת מליאה בתאריך 01/08/1990 בשעה 11:04","StartDate":"1990-08-01T11:04:00+03:00","FinishDate":"1990-08-01T22:17:00+03:00","IsSpecialMeeting":null,"LastUpdatedDate":"2023-08-13T10:30:18.17+03:00"}
{"Id":437145,"Number":207,"KnessetNum":12,"Name":"ישיבת מליאה בתאריך 02/08/1990 בשעה 11:02","StartDate":"1990-08-02T11:02:00+03:00","FinishDate":"1990-08-02T21:38:00+03:00","IsSpecialMeeting":null,"LastUpdatedDate":"2025-03-06T08:20:31.163+02:00"}
{"Id":437146,"Number":215,"KnessetNum":12,"Name":"ישיבת מליאה בתאריך 16/10/1990 בשעה 16:00","StartDate":"1990-10-16T16:00:00+02:00","FinishDate":"1990-10-16T21:02:00+02:00","IsSpecialMeeting":null,"LastUpdatedDate":"2025-03-06T08:45:34.737+02:00"}
{"Id":437147,"Number":220,"KnessetNum":12,"Name":"ישיבת מליאה בתאריך 29/10/1990 בשעה 16:02","StartDate":"1990-10-29T16:02:00+02:00","FinishDate":"1990-10-29T19:52:00+02:00","IsSpecialMeeting":null,"LastUpdatedDate":"2025-03-06T08:49:36.84+02:00"}
{"Id":437148,"Number":222,"KnessetNum":12,"Name":"ישיבת מליאה בתאריך 31/10/1990 בשעה 11:03","StartDate":"1990-10-31T11:03:00+02:00","FinishDate":"1990-10-31T18:06:00+02:00","IsSpecialMeeting":null,"LastUpdatedDate":"2025-03-06T08:51:10.377+02:00"}
{"Id":437149,"Number":224,"KnessetNum":12,"Name":"ישיבת מליאה בתאריך 06/11/1990 בשעה 16:00","StartDate":"1990-11-06T16:00:00+02:00","FinishDate":"1990-11-06T20:27:00+02:00","IsSpecialMeeting":null,"LastUpdatedDate":"2025-11-02T10:22:19.87+02:00"}
{"Id":437150,"Number":225,"KnessetNum":12,"Name":"ישיבת מליאה בתאריך 07/11/1990 בשעה 11:02","StartDate":"1990-11-07T11:02:00+02:00","FinishDate":"1990-11-07T15:30:00+02:00","IsSpecialMeeting":null,"LastUpdatedDate":"2025-03-06T08:53:31.523+02:00"}
{"Id":437151,"Number":226,"KnessetNum":12,"Name":"ישיבת מליאה בתאריך 12/11/1990 בשעה 16:00","StartDate":"1990-11-12T16:00:00+02:00","FinishDate":"1990-11-12T20:24:00+02:00","IsSpecialMeeting":null,"LastUpdatedDate":"2025-03-06T08:54:14.437+02:00"}
{"Id":437152,"Number":227,"KnessetNum":12,"Name":"ישיבת מליאה בתאריך 13/11/1990 בשעה 16:00","StartDate":"1990-11-13T16:00:00+02:00","FinishDate":"1990-11-13T20:28:00+02:00","IsSpecialMeeting":null,"LastUpdatedDate":"2025-03-06T08:54:53.653+02:00"}
{"Id":437153,"Number":228,"KnessetNum":12,"Name":"ישיבת מליאה בתאריך 14/11/1990 בשעה 11:00","StartDate":"1990-11-14T11:00:00+02:00","FinishDate":"1990-11-14T16:42:00+02:00","IsSpecialMeeting":null,"LastUpdatedDate":"2025-11-05T13:32:02.2+02:00"}
{"Id":437154,"Number":231,"KnessetNum":12,"Name":"ישיבת מליאה בתאריך 21/11/1990 בשעה 11:01","StartDate":"1990-11-21T11:01:00+02:00","FinishDate":"1990-11-21T13:53:00+02:00","IsSpecialMeeting":null,"LastUpdatedDate":"2025-03-06T08:59:09.147+02:00"}
{"Id":437155,"Number":233,"KnessetNum":12,"Name":"ישיבת מליאה בתאריך 27/11/1990 בשעה 16:00","StartDate":"1990-11-27T16:00:00+02:00","FinishDate":"1990-11-27T21:00:00+02:00","IsSpecialMeeting":null,"LastUpdatedDate":"2025-03-06T09:08:47.45+02:00"}
{"Id":437156,"Number":235,"KnessetNum":12,"Name":"ישיבת מליאה בתאריך 03/12/1990 בשעה 16:01","StartDate":"1990-12-03T16:01:00+02:00","FinishDate":"1990-12-03T22:20:00+02:00","IsSpecialMeeting":null,"LastUpdatedDate":"2025-03-06T09:10:12.417+02:00"}
{"Id":437157,"Number":237,"KnessetNum":12,"Name":"ישיבת מליאה בתאריך 05/12/1990 בשעה 11:00","StartDate":"1990-12-05T11:00:00+02:00","FinishDate":"1990-12-05T17:12:00+02:00","IsSpecialMeeting":null,"LastUpdatedDate":"2025-03-06T09:12:30.803+02:00"}
{"Id":437158,"Number":240,"KnessetNum":12,"Name":"ישיבת מליאה בתאריך 12/12/1990 בשעה 11:01","StartDate":"1990-12-12T11:01:00+02:00","FinishDate":"1990-12-12T17:20:00+02:00","IsSpecialMeeting":null,"LastUpdatedDate":"2025-03-06T09:57:52.327+02:00"}
{"Id":437159,"Number":241,"KnessetNum":12,"Name":"ישיבת מליאה בתאריך 17/12/1990 בשעה 16:03","StartDate":"1990-12-17T16:03:00+02:00","FinishDate":"1990-12-17T19:56:00+02:00","IsSpecialMeeting":null,"LastUpdatedDate":"2025-03-06T09:58:32.29+02:00"}
{"Id":437160,"Number":242,"KnessetNum":12,"Name":"ישיבת מליאה בתאריך 18/12/1990 בשעה 16:00","StartDate":"1990-12-18T16:00:00+02:00","FinishDate":"1990-12-18T19:26:00+02:00","IsSpecialMeeting":null,"LastUpdatedDate":"2025-03-06T10:00:26.177+02:00"}
{"Id":437161,"Number":244,"KnessetNum":12,"Name":"ישיבת מליאה בתאריך 24/12/1990 בשעה 16:01","StartDate":"1990-12-24T16:01:00+02:00","FinishDate":"1990-12-24T19:50:00+02:00","IsSpecialMeeting":null,"LastUpdatedDate":"2025-03-06T10:02:11.373+02:00"}
{"Id":437162,"Number":246,"KnessetNum":12,"Name":"ישיבת מליאה בתאריך 26/12/1990 בשעה 11:01","StartDate":"1990-12-26T11:01:00+02:00","FinishDate":"1990-12-26T17:30:00+02:00","IsSpecialMeeting":null,"LastUpdatedDate":"2025-03-06T10:04:57.977+02:00"}
{"Id":437163,"Number":247,"KnessetNum":12,"Name":"ישיבת מליאה בתאריך 31/12/1990 בשעה 16:03","StartDate":"1990-12-31T16:03:00+02:00","FinishDate":"1990-12-31T20:44:00+02:00","IsSpecialMeeting":null,"LastUpdatedDate":"2025-03-06T10:07:59.943+02:00"}
{"Id":437164,"Number":248,"KnessetNum":12,"Name":"ישיבת מליאה בתאריך 01/01/1991 בשעה 16:03","StartDate":"1991-01-01T16:03:00+02:00","FinishDate":"1991-01-01T20:44:00+02:00","IsSpecialMeeting":null,"LastUpdatedDate":"2025-03-06T10:09:00.753+02:00"}
{"Id":437165,"Number":249,"KnessetNum":12,"Name":"ישיבת מליאה בתאריך 02/01/1991 בשעה 11:02","StartDate":"1991-01-02T11:02:00+02:00","FinishDate":"1991-01-02T18:03:00+02:00","IsSpecialMeeting":null,"LastUpdatedDate":"2025-11-25T13:44:30.86+02:00"}
{"Id":437166,"Number":253,"KnessetNum":12,"Name":"ישיבת מליאה בתאריך 14/01/1991 בשעה 16:04","StartDate":"1991-01-14T16:04:00+02:00","FinishDate":"1991-01-14T19:27:00+02:00","IsSpecialMeeting":null,"LastUpdatedDate":"2025-03-06T10:22:01.33+02:00"}
{"Id":437167,"Number":254,"KnessetNum":12,"Name":"ישיבת מליאה בתאריך 15/01/1991 בשעה 16:01","StartDate":"1991-01-15T16:01:00+02:00","FinishDate":"1991-01-15T18:56:00+02:00","IsSpecialMeeting":null,"LastUpdatedDate":"2025-03-06T10:22:50.937+02:00"}
{"Id":437168,"Number":256,"KnessetNum":12,"Name":"ישיבת מליאה בתאריך 21/01/1991 בשעה 16:05","StartDate":"1991-01-21T16:05:00+02:00","FinishDate":"1991-01-21T20:44:00+02:00","IsSpecialMeeting":null,"LastUpdatedDate":"2025-03-06T11:17:03.477+02:00"}
{"Id":437169,"Number":257,"KnessetNum":12,"Name":"ישיבת מליאה בתאריך 22/01/1991 בשעה 16:00","StartDate":"1991-01-22T16:00:00+02:00","FinishDate":"1991-01-22T18:45:00+02:00","IsSpecialMeeting":null,"LastUpdatedDate":"2025-03-06T11:20:25.277+02:00"}
{"Id":437170,"Number":260,"KnessetNum":12,"Name":"ישיבת מליאה בתאריך 29/01/1991 בשעה 16:02","StartDate":"1991-01-29T16:02:00+02:00","FinishDate":"1991-01-29T19:39:00+02:00","IsSpecialMeeting":null,"LastUpdatedDate":"2019-12-17T10:33:14.223+02:00"}
{"Id":437171,"Number":263,"KnessetNum":12,"Name":"ישיבת מליאה בתאריך 05/02/1991 בשעה 16:03","StartDate":"1991-02-05T16:03:00+02:00","FinishDate":"1991-02-05T20:04:00+02:00","IsSpecialMeeting":null,"LastUpdatedDate":"2019-12-17T10:31:26.447+02:00"}
{"Id":437172,"Number":264,"KnessetNum":12,"Name":"ישיבת מליאה בתאריך 06/02/1991 בשעה 11:03","StartDate":"1991-02-06T11:03:00+02:00","FinishDate":"1991-02-06T17:24:00+02:00","IsSpecialMeeting":null,"LastUpdatedDate":"2025-03-06T09:04:19.323+02:00"}
{"Id":437173,"Number":265,"KnessetNum":12,"Name":"ישיבת מליאה בתאריך 11/02/1991 בשעה 16:03","StartDate":"1991-02-11T16:03:00+02:00","FinishDate":"1991-02-11T20:17:00+02:00","IsSpecialMeeting":null,"LastUpdatedDate":"2025-03-06T09:11:40.25+02:00"}
{"Id":437174,"Number":266,"KnessetNum":12,"Name":"ישיבת מליאה בתאריך 12/02/1991 בשעה 16:00","StartDate":"1991-02-12T16:00:00+02:00","FinishDate":"1991-02-12T21:07:00+02:00","IsSpecialMeeting":null,"LastUpdatedDate":"2019-12-16T11:26:32.323+02:00"}
{"Id":437175,"Number":267,"KnessetNum":12,"Name":"ישיבת מליאה בתאריך 13/02/1991 בשעה 11:04","StartDate":"1991-02-13T11:04:00+02:00","FinishDate":"1991-02-13T16:06:00+02:00","IsSpecialMeeting":null,"LastUpdatedDate":"2025-03-06T10:03:28.513+02:00"}
{"Id":437176,"Number":269,"KnessetNum":12,"Name":"ישיבת מליאה בתאריך 19/02/1991 בשעה 16:01","StartDate":"1991-02-19T16:01:00+02:00","FinishDate":"1991-02-19T20:56:00+02:00","IsSpecialMeeting":null,"LastUpdatedDate":"2025-03-06T10:23:27.887+02:00"}
{"Id":437177,"Number":270,"KnessetNum":12,"Name":"ישיבת מליאה בתאריך 20/02/1991 בשעה 11:05","StartDate":"1991-02-20T11:05:00+02:00","FinishDate":"1991-02-20T16:37:00+02:00","IsSpecialMeeting":null,"LastUpdatedDate":"2025-03-06T10:24:07.387+02:00"}
{"Id":437178,"Number":271,"KnessetNum":12,"Name":"ישיבת מליאה בתאריך 25/02/1991 בשעה 16:03","StartDate":"1991-02-25T16:03:00+02:00","FinishDate":"1991-02-25T19:29:00+02:00","IsSpecialMeeting":null,"LastUpdatedDate":"2025-03-06T10:25:37.09+02:00"}
{"Id":437179,"Number":274,"KnessetNum":12,"Name":"ישיבת מליאה בתאריך 04/03/1991 בשעה 16:04","StartDate":"1991-03-04T16:04:00+02:00","FinishDate":"1991-03-04T20:25:00+02:00","IsSpecialMeeting":null,"LastUpdatedDate":"2025-12-02T14:57:24.023+02:00"}
{"Id":437180,"Number":275,"KnessetNum":12,"Name":"ישיבת מליאה בתאריך 05/03/1991 בשעה 16:02","StartDate":"1991-03-05T16:02:00+02:00","FinishDate":"1991-03-05T21:08:00+02:00","IsSpecialMeeting":null,"LastUpdatedDate":"2025-12-02T16:53:34.277+02:00"}
{"Id":437182,"Number":278,"KnessetNum":12,"Name":"ישיבת מליאה בתאריך 12/03/1991 בשעה 16:04","StartDate":"1991-03-12T16:04:00+02:00","FinishDate":"1991-03-12T21:06:00+02:00","IsSpecialMeeting":null,"LastUpdatedDate":"2025-03-06T11:28:53.083+02:00"}
{"Id":437183,"Number":279,"KnessetNum":12,"Name":"ישיבת מליאה בתאריך 13/03/1991 בשעה 11:01","StartDate":"1991-03-13T11:01:00+02:00","FinishDate":"1991-03-13T19:08:00+02:00","IsSpecialMeeting":null,"LastUpdatedDate":"2025-03-06T11:30:28.52+02:00"}
{"Id":437184,"Number":280,"KnessetNum":12,"Name":"ישיבת מליאה בתאריך 18/03/1991 בשעה 16:02","StartDate":"1991-03-18T16:02:00+02:00","FinishDate":"1991-03-18T21:05:00+02:00","IsSpecialMeeting":null,"LastUpdatedDate":"2025-03-06T11:32:23.35+02:00"}
{"Id":437185,"Number":281,"KnessetNum":12,"Name":"ישיבת מליאה בתאריך 19/03/1991 בשעה 16:01","StartDate":"1991-03-19T16:01:00+02:00","FinishDate":"1991-03-19T18:55:00+02:00","IsSpecialMeeting":null,"LastUpdatedDate":"2025-03-06T11:33:15.503+02:00"}
{"Id":437186,"Number":287,"KnessetNum":12,"Name":"ישיבת מליאה בתאריך 24/04/1991 בשעה 11:04","StartDate":"1991-04-24T11:04:00+03:00","FinishDate":"1991-04-24T17:00:00+03:00","IsSpecialMeeting":null,"LastUpdatedDate":"2025-03-09T08:42:36.44+02:00"}
{"Id":437187,"Number":289,"KnessetNum":12,"Name":"ישיבת מליאה בתאריך 30/04/1991 בשעה 16:00","StartDate":"1991-04-30T16:00:00+03:00","FinishDate":"1991-04-30T21:57:00+03:00","IsSpecialMeeting":null,"LastUpdatedDate":"2025-03-09T08:43:57.223+02:00"}
{"Id":437188,"Number":291,"KnessetNum":12,"Name":"ישיבת מליאה בתאריך 06/05/1991 בשעה 16:03","StartDate":"1991-05-06T16:03:00+03:00","FinishDate":"1991-05-06T21:23:00+03:00","IsSpecialMeeting":null,"LastUpdatedDate":"2025-03-09T08:45:21.123+02:00"}
{"Id":437189,"Number":292,"KnessetNum":12,"Name":"ישיבת מליאה בתאריך 07/05/1991 בשעה 16:04","StartDate":"1991-05-07T16:04:00+03:00","FinishDate":"1991-05-07T20:50:00+03:00","IsSpecialMeeting":null,"LastUpdatedDate":"2025-03-09T08:46:09.31+02:00"}
{"Id":437190,"Number":296,"KnessetNum":12,"Name":"ישיבת מליאה בתאריך 15/05/1991 בשעה 11:03","StartDate":"1991-05-15T11:03:00+03:00","FinishDate":"1991-05-15T16:45:00+03:00","IsSpecialMeeting":null,"LastUpdatedDate":"2025-12-15T14:09:34.153+02:00"}
{"Id":437191,"Number":299,"KnessetNum":12,"Name":"ישיבת מליאה בתאריך 22/05/1991 בשעה 11:05","StartDate":"1991-05-22T11:05:00+03:00","FinishDate":"1991-05-22T17:03:00+03:00","IsSpecialMeeting":null,"LastUpdatedDate":"2025-03-09T09:29:50.253+02:00"}
{"Id":437192,"Number":300,"KnessetNum":12,"Name":"ישיבת מליאה בתאריך 27/05/1991 בשעה 16:03","StartDate":"1991-05-27T16:03:00+03:00","FinishDate":"1991-05-27T21:02:00+03:00","IsSpecialMeeting":null,"LastUpdatedDate":"2025-03-09T09:30:45.22+02:00"}
{"Id":437193,"Number":301,"KnessetNum":12,"Name":"ישיבת מליאה בתאריך 28/05/1991 בשעה 16:00","StartDate":"1991-05-28T16:00:00+03:00","FinishDate":"1991-05-28T21:05:00+03:00","IsSpecialMeeting":null,"LastUpdatedDate":"2025-03-09T09:31:42.63+02:00"}
{"Id":437194,"Number":302,"KnessetNum":12,"Name":"ישיבת מליאה בתאריך 29/05/1991 בשעה 11:02","StartDate":"1991-05-29T11:02:00+03:00","FinishDate":"1991-05-29T21:12:00+03:00","IsSpecialMeeting":null,"LastUpdatedDate":"2025-12-16T13:44:23.64+02:00"}
{"Id":437195,"Number":305,"KnessetNum":12,"Name":"ישיבת מליאה בתאריך 05/06/1991 בשעה 11:05","StartDate":"1991-06-05T11:05:00+03:00","FinishDate":"1991-06-05T20:18:00+03:00","IsSpecialMeeting":null,"LastUpdatedDate":"2025-03-09T09:38:26.503+02:00"}
{"Id":437196,"Number":306,"KnessetNum":12,"Name":"ישיבת מליאה בתאריך 10/06/1991 בשעה 16:03","StartDate":"1991-06-10T16:03:00+03:00","FinishDate":"1991-06-10T19:58:00+03:00","IsSpecialMeeting":null,"LastUpdatedDate":"2025-12-17T14:55:20.28+02:00"}
{"Id":437197,"Number":307,"KnessetNum":12,"Name":"ישיבת מליאה בתאריך 11/06/1991 בשעה 16:00","StartDate":"1991-06-11T16:00:00+03:00","FinishDate":"1991-06-11T20:02:00+03:00","IsSpecialMeeting":null,"LastUpdatedDate":"2025-03-09T09:46:17.173+02:00"}
{"Id":437198,"Number":308,"KnessetNum":12,"Name":"ישיבת מליאה בתאריך 12/06/1991 בשעה 11:01","StartDate":"1991-06-12T11:01:00+03:00","FinishDate":"1991-06-12T18:37:00+03:00","IsSpecialMeeting":null,"LastUpdatedDate":"2025-03-09T09:46:50.943+02:00"}
{"Id":437199,"Number":316,"KnessetNum":12,"Name":"ישיבת מליאה בתאריך 02/07/1991 בשעה 16:01","StartDate":"1991-07-02T16:01:00+03:00","FinishDate":"1991-07-02T21:49:00+03:00","IsSpecialMeeting":null,"LastUpdatedDate":"2019-12-16T09:51:41.233+02:00"}
{"Id":437200,"Number":317,"KnessetNum":12,"Name":"ישיבת מליאה בתאריך 03/07/1991 בשעה 11:04","StartDate":"1991-07-03T11:04:00+03:00","FinishDate":"1991-07-03T19:37:00+03:00","IsSpecialMeeting":null,"LastUpdatedDate":"2025-03-09T09:56:11.72+02:00"}
{"Id":437201,"Number":326,"KnessetNum":12,"Name":"ישיבת מליאה בתאריך 24/07/1991 בשעה 11:03","StartDate":"1991-07-24T11:03:00+03:00","FinishDate":"1991-07-24T20:58:00+03:00","IsSpecialMeeting":null,"LastUpdatedDate":"2026-01-28T16:22:06.893+02:00"}
{"Id":437203,"Number":330,"KnessetNum":12,"Name":"ישיבת מליאה בתאריך 09/10/1991 בשעה 11:03","StartDate":"1991-10-09T11:03:00+02:00","FinishDate":"1991-10-09T16:51:00+02:00","IsSpecialMeeting":null,"LastUpdatedDate":"2025-03-09T10:46:19.35+02:00"}
{"Id":437204,"Number":332,"KnessetNum":12,"Name":"ישיבת מליאה בתאריך 15/10/1991 בשעה 16:02","StartDate":"1991-10-15T16:02:00+02:00","FinishDate":"1991-10-15T21:45:00+02:00","IsSpecialMeeting":null,"LastUpdatedDate":"2025-03-09T10:55:32.347+02:00"}
{"Id":437205,"Number":334,"KnessetNum":12,"Name":"ישיבת מליאה בתאריך 21/10/1991 בשעה 16:00","StartDate":"1991-10-21T16:00:00+02:00","FinishDate":"1991-10-21T18:26:00+02:00","IsSpecialMeeting":null,"LastUpdatedDate":"2025-03-09T10:58:45.657+02:00"}
{"Id":437206,"Number":335,"KnessetNum":12,"Name":"ישיבת מליאה בתאריך 22/10/1991 בשעה 16:01","StartDate":"1991-10-22T16:01:00+02:00","FinishDate":"1991-10-22T21:01:00+02:00","IsSpecialMeeting":null,"LastUpdatedDate":"2025-03-09T11:05:12.437+02:00"}
{"Id":437207,"Number":336,"KnessetNum":12,"Name":"ישיבת מליאה בתאריך 23/10/1991 בשעה 11:03","StartDate":"1991-10-23T11:03:00+02:00","FinishDate":"1991-10-23T18:30:00+02:00","IsSpecialMeeting":null,"LastUpdatedDate":"2026-02-03T13:49:03.203+02:00"}
{"Id":437208,"Number":337,"KnessetNum":12,"Name":"ישיבת מליאה בתאריך 28/10/1991 בשעה 16:03","StartDate":"1991-10-28T16:03:00+02:00","FinishDate":"1991-10-28T18:32:00+02:00","IsSpecialMeeting":null,"LastUpdatedDate":"2025-03-09T11:06:41.057+02:00"}
{"Id":437209,"Number":340,"KnessetNum":12,"Name":"ישיבת מליאה בתאריך 04/11/1991 בשעה 16:02","StartDate":"1991-11-04T16:02:00+02:00","FinishDate":"1991-11-04T19:58:00+02:00","IsSpecialMeeting":null,"LastUpdatedDate":"2025-03-09T11:34:35.477+02:00"}
{"Id":437210,"Number":341,"KnessetNum":12,"Name":"ישיבת מליאה בתאריך 05/11/1991 בשעה 16:03","StartDate":"1991-11-05T16:03:00+02:00","FinishDate":"1991-11-05T20:32:00+02:00","IsSpecialMeeting":null,"LastUpdatedDate":"2025-03-09T11:37:22.35+02:00"}
{"Id":437211,"Number":342,"KnessetNum":12,"Name":"ישיבת מליאה בתאריך 06/11/1991 בשעה 11:02","StartDate":"1991-11-06T11:02:00+02:00","FinishDate":"1991-11-06T15:39:00+02:00","IsSpecialMeeting":null,"LastUpdatedDate":"2025-03-09T11:43:12.203+02:00"}
{"Id":437212,"Number":343,"KnessetNum":12,"Name":"ישיבת מליאה בתאריך 11/11/1991 בשעה 16:03","StartDate":"1991-11-11T16:03:00+02:00","FinishDate":"1991-11-11T20:21:00+02:00","IsSpecialMeeting":null,"LastUpdatedDate":"2025-03-09T11:43:41.983+02:00"}
{"Id":437213,"Number":344,"KnessetNum":12,"Name":"ישיבת מליאה בתאריך 12/11/1991 בשעה 16:00","StartDate":"1991-11-12T16:00:00+02:00","FinishDate":"1991-11-12T20:43:00+02:00","IsSpecialMeeting":null,"LastUpdatedDate":"2026-02-09T12:02:29.893+02:00"}
{"Id":437214,"Number":346,"KnessetNum":12,"Name":"ישיבת מליאה בתאריך 18/11/1991 בשעה 16:03","StartDate":"1991-11-18T16:03:00+02:00","FinishDate":"1991-11-18T21:13:00+02:00","IsSpecialMeeting":null,"LastUpdatedDate":"2025-03-09T11:59:41.973+02:00"}
{"Id":437215,"Number":349,"KnessetNum":12,"Name":"ישיבת מליאה בתאריך 25/11/1991 בשעה 16:02","StartDate":"1991-11-25T16:02:00+02:00","FinishDate":"1991-11-25T20:34:00+02:00","IsSpecialMeeting":null,"LastUpdatedDate":"2025-03-09T12:04:29.697+02:00"}
{"Id":437216,"Number":360,"KnessetNum":12,"Name":"ישיבת מליאה בתאריך 18/12/1991 בשעה 11:07","StartDate":"1991-12-18T11:07:00+02:00","FinishDate":"1991-12-18T17:46:00+02:00","IsSpecialMeeting":null,"LastUpdatedDate":"2025-03-09T12:50:40.04+02:00"}
{"Id":437218,"Number":374,"KnessetNum":12,"Name":"ישיבת מליאה בתאריך 21/01/1992 בשעה 16:03","StartDate":"1992-01-21T16:03:00+02:00","FinishDate":"1992-01-21T20:29:00+02:00","IsSpecialMeeting":null,"LastUpdatedDate":"2025-03-09T14:15:27.043+02:00"}
{"Id":437219,"Number":375,"KnessetNum":12,"Name":"ישיבת מליאה בתאריך 22/01/1992 בשעה 11:05","StartDate":"1992-01-22T11:05:00+02:00","FinishDate":"1992-01-22T17:29:00+02:00","IsSpecialMeeting":null,"LastUpdatedDate":"2025-03-09T14:17:04.94+02:00"}
{"Id":437220,"Number":378,"KnessetNum":12,"Name":"ישיבת מליאה בתאריך 29/01/1992 בשעה 11:00","StartDate":"1992-01-29T11:00:00+02:00","FinishDate":"1992-01-29T17:52:00+02:00","IsSpecialMeeting":null,"LastUpdatedDate":"2025-03-09T14:31:39.733+02:00"}
{"Id":437221,"Number":379,"KnessetNum":12,"Name":"ישיבת מליאה בתאריך 03/02/1992 בשעה 16:02","StartDate":"1992-02-03T16:02:00+02:00","FinishDate":"1992-02-03T18:29:00+02:00","IsSpecialMeeting":null,"LastUpdatedDate":"2025-03-10T08:35:10.183+02:00"}
{"Id":437222,"Number":380,"KnessetNum":12,"Name":"ישיבת מליאה בתאריך 04/02/1992 בשעה 16:01","StartDate":"1992-02-04T16:01:00+02:00","FinishDate":"1992-02-04T21:37:00+02:00","IsSpecialMeeting":null,"LastUpdatedDate":"2025-03-10T08:35:51.96+02:00"}
{"Id":437223,"Number":384,"KnessetNum":12,"Name":"ישיבת מליאה בתאריך 12/02/1992 בשעה 11:07","StartDate":"1992-02-12T11:07:00+02:00","FinishDate":"1992-02-12T17:37:00+02:00","IsSpecialMeeting":null,"LastUpdatedDate":"2025-03-10T08:57:11.317+02:00"}
{"Id":437224,"Number":385,"KnessetNum":12,"Name":"ישיבת מליאה בתאריך 17/02/1992 בשעה: 00:00:00","StartDate":"1992-02-17T00:00:00+02:00","FinishDate":null,"IsSpecialMeeting":null,"LastUpdatedDate":"2014-08-17T15:12:51+03:00"}
{"Id":437225,"Number":386,"KnessetNum":12,"Name":"ישיבת מליאה בתאריך 18/02/1992 בשעה 16:03","StartDate":"1992-02-18T16:03:00+02:00","FinishDate":"1992-02-18T21:39:00+02:00","IsSpecialMeeting":null,"LastUpdatedDate":"2025-03-10T09:09:31.153+02:00"}
{"Id":437226,"Number":387,"KnessetNum":12,"Name":"ישיבת מליאה בתאריך 19/02/1992 בשעה 11:04","StartDate":"1992-02-19T11:04:00+02:00","FinishDate":"1992-02-19T17:22:00+02:00","IsSpecialMeeting":null,"LastUpdatedDate":"2025-03-10T09:11:25.073+02:00"}
{"Id":437227,"Number":390,"KnessetNum":12,"Name":"ישיבת מליאה בתאריך 26/02/1992 בשעה 11:03","StartDate":"1992-02-26T11:03:00+02:00","FinishDate":"1992-02-26T17:40:00+02:00","IsSpecialMeeting":null,"LastUpdatedDate":"2025-03-10T09:16:11.137+02:00"}
{"Id":437228,"Number":392,"KnessetNum":12,"Name":"ישיבת מליאה בתאריך 03/03/1992 בשעה 16:03","StartDate":"1992-03-03T16:03:00+02:00","FinishDate":"1992-03-03T22:00:00+02:00","IsSpecialMeeting":null,"LastUpdatedDate":"2025-03-10T09:42:14.663+02:00"}
{"Id":437229,"Number":393,"KnessetNum":12,"Name":"ישיבת מליאה בתאריך 04/03/1992 בשעה 11:08","StartDate":"1992-03-04T11:08:00+02:00","FinishDate":"1992-03-04T19:54:00+02:00","IsSpecialMeeting":null,"LastUpdatedDate":"2025-03-10T09:43:38.39+02:00"}
{"Id":437230,"Number":395,"KnessetNum":12,"Name":"ישיבת מליאה בתאריך 10/03/1992 בשעה 16:04","StartDate":"1992-03-10T16:04:00+02:00","FinishDate":"1992-03-10T23:25:00+02:00","IsSpecialMeeting":null,"LastUpdatedDate":"2025-03-10T09:52:10.893+02:00"}
{"Id":437231,"Number":399,"KnessetNum":12,"Name":"ישיבת מליאה בתאריך 18/03/1992 בשעה 09:04","StartDate":"1992-03-18T09:04:00+02:00","FinishDate":"1992-03-18T14:43:00+02:00","IsSpecialMeeting":null,"LastUpdatedDate":"2025-03-10T10:11:44.243+02:00"}
{"Id":437232,"Number":7,"KnessetNum":13,"Name":"ישיבת מליאה בתאריך 28/07/1992 בשעה 16:05","StartDate":"1992-07-28T16:05:00+03:00","FinishDate":"1992-07-28T17:47:00+03:00","IsSpecialMeeting":null,"LastUpdatedDate":"2025-02-12T14:17:17.773+02:00"}
{"Id":437233,"Number":11,"KnessetNum":13,"Name":"ישיבת מליאה בתאריך 05/08/1992 בשעה 11:03","StartDate":"1992-08-05T11:03:00+03:00","FinishDate":"1992-08-05T21:27:00+03:00","IsSpecialMeeting":null,"LastUpdatedDate":"2025-02-12T14:22:36.343+02:00"}
{"Id":437234,"Number":13,"KnessetNum":13,"Name":"ישיבת מליאה בתאריך 09/09/1992 בשעה 11:01","StartDate":"1992-09-09T11:01:00+03:00","FinishDate":"1992-09-09T17:02:00+03:00","IsSpecialMeeting":true,"LastUpdatedDate":"2025-02-12T14:40:56.4+02:00"}
{"Id":437235,"Number":14,"KnessetNum":13,"Name":"ישיבת מליאה בתאריך 21/09/1992 בשעה 10:02","StartDate":"1992-09-21T10:02:00+03:00","FinishDate":"1992-09-21T15:31:00+03:00","IsSpecialMeeting":true,"LastUpdatedDate":"2025-02-12T14:41:35.5+02:00"}
{"Id":437236,"Number":15,"KnessetNum":13,"Name":"ישיבת מליאה בתאריך 26/10/1992 בשעה 16:13","StartDate":"1992-10-26T16:13:00+02:00","FinishDate":"1992-10-26T20:47:00+02:00","IsSpecialMeeting":null,"LastUpdatedDate":"2025-02-12T14:42:07.273+02:00"}
{"Id":437237,"Number":18,"KnessetNum":13,"Name":"ישיבת מליאה בתאריך 02/11/1992 בשעה 16:02","StartDate":"1992-11-02T16:02:00+02:00","FinishDate":"1992-11-02T21:52:00+02:00","IsSpecialMeeting":null,"LastUpdatedDate":"2025-02-12T15:24:45.523+02:00"}
{"Id":437238,"Number":23,"KnessetNum":13,"Name":"ישיבת מליאה בתאריך 11/11/1992 בשעה 11:01","StartDate":"1992-11-11T11:01:00+02:00","FinishDate":"1992-11-11T17:52:00+02:00","IsSpecialMeeting":null,"LastUpdatedDate":"2025-12-07T11:18:15.653+02:00"}
{"Id":437239,"Number":25,"KnessetNum":13,"Name":"ישיבת מליאה בתאריך 17/11/1992 בשעה 16:06","StartDate":"1992-11-17T16:06:00+02:00","FinishDate":"1992-11-17T19:32:00+02:00","IsSpecialMeeting":null,"LastUpdatedDate":"2025-02-12T15:35:02.647+02:00"}
{"Id":437240,"Number":26,"KnessetNum":13,"Name":"ישיבת מליאה בתאריך 18/11/1992 בשעה 11:00","StartDate":"1992-11-18T11:00:00+02:00","FinishDate":"1992-11-18T19:20:00+02:00","IsSpecialMeeting":null,"LastUpdatedDate":"2025-12-08T10:14:20.577+02:00"}
{"Id":437241,"Number":27,"KnessetNum":13,"Name":"ישיבת מליאה בתאריך 23/11/1992 בשעה 16:01","StartDate":"1992-11-23T16:01:00+02:00","FinishDate":"1992-11-23T19:41:00+02:00","IsSpecialMeeting":null,"LastUpdatedDate":"2025-02-12T15:36:20.213+02:00"}
{"Id":437242,"Number":29,"KnessetNum":13,"Name":"ישיבת מליאה בתאריך 25/11/1992 בשעה 11:01","StartDate":"1992-11-25T11:01:00+02:00","FinishDate":"1992-11-25T18:58:00+02:00","IsSpecialMeeting":null,"LastUpdatedDate":"2025-12-08T12:00:03.28+02:00"}
{"Id":437243,"Number":30,"KnessetNum":13,"Name":"ישיבת מליאה בתאריך 30/11/1992 בשעה 16:02","StartDate":"1992-11-30T16:02:00+02:00","FinishDate":"1992-11-30T20:24:00+02:00","IsSpecialMeeting":null,"LastUpdatedDate":"2025-12-29T11:05:57.443+02:00"}
{"Id":437244,"Number":31,"KnessetNum":13,"Name":"ישיבת מליאה בתאריך 01/12/1992 בשעה 16:03","StartDate":"1992-12-01T16:03:00+02:00","FinishDate":"1992-12-01T19:15:00+02:00","IsSpecialMeeting":null,"LastUpdatedDate":"2025-02-12T15:38:32.743+02:00"}
{"Id":437245,"Number":32,"KnessetNum":13,"Name":"ישיבת מליאה בתאריך 02/12/1992 בשעה 11:00","StartDate":"1992-12-02T11:00:00+02:00","FinishDate":"1992-12-02T20:49:00+02:00","IsSpecialMeeting":null,"LastUpdatedDate":"2025-12-29T12:54:00.793+02:00"}
{"Id":437246,"Number":33,"KnessetNum":13,"Name":"ישיבת מליאה בתאריך 07/12/1992 בשעה 16:03","StartDate":"1992-12-07T16:03:00+02:00","FinishDate":"1992-12-07T20:19:00+02:00","IsSpecialMeeting":null,"LastUpdatedDate":"2025-02-12T15:39:38.587+02:00"}
{"Id":437247,"Number":36,"KnessetNum":13,"Name":"ישיבת מליאה בתאריך 14/12/1992 בשעה 16:01","StartDate":"1992-12-14T16:01:00+02:00","FinishDate":"1992-12-14T19:20:00+02:00","IsSpecialMeeting":null,"LastUpdatedDate":"2025-02-12T15:50:24.45+02:00"}
{"Id":437248,"Number":40,"KnessetNum":13,"Name":"ישיבת מליאה בתאריך 22/12/1992 בשעה 16:02","StartDate":"1992-12-22T16:02:00+02:00","FinishDate":"1992-12-22T20:45:00+02:00","IsSpecialMeeting":null,"LastUpdatedDate":"2025-02-12T15:52:42.02+02:00"}
{"Id":437249,"Number":41,"KnessetNum":13,"Name":"ישיבת מליאה בתאריך 23/12/1992 בשעה 11:01","StartDate":"1992-12-23T11:01:00+02:00","FinishDate":"1992-12-23T16:53:00+02:00","IsSpecialMeeting":null,"LastUpdatedDate":"2026-01-05T10:35:46.543+02:00"}
{"Id":437250,"Number":42,"KnessetNum":13,"Name":"ישיבת מליאה בתאריך 28/12/1992 בשעה 16:00","StartDate":"1992-12-28T16:00:00+02:00","FinishDate":"1992-12-29T04:25:00+02:00","IsSpecialMeeting":null,"LastUpdatedDate":"2025-02-12T15:57:10.18+02:00"}
{"Id":437251,"Number":45,"KnessetNum":13,"Name":"ישיבת מליאה בתאריך 31/12/1992 בשעה 10:02","StartDate":"1992-12-31T10:02:00+02:00","FinishDate":"1993-01-01T07:39:00+02:00","IsSpecialMeeting":null,"LastUpdatedDate":"2020-10-26T19:36:57.017+02:00"}
{"Id":437253,"Number":46,"KnessetNum":13,"Name":"ישיבת מליאה בתאריך 04/01/1993 בשעה 16:03","StartDate":"1993-01-04T16:03:00+02:00","FinishDate":"1993-01-04T20:16:00+02:00","IsSpecialMeeting":null,"LastUpdatedDate":"2026-01-12T08:01:26.547+02:00"}
{"Id":437254,"Number":47,"KnessetNum":13,"Name":"ישיבת מליאה בתאריך 05/01/1993 בשעה 16:02","StartDate":"1993-01-05T16:02:00+02:00","FinishDate":"1993-01-05T20:18:00+02:00","IsSpecialMeeting":null,"LastUpdatedDate":"2026-01-12T09:07:24.693+02:00"}
{"Id":437255,"Number":48,"KnessetNum":13,"Name":"ישיבת מליאה בתאריך 06/01/1993 בשעה 11:00","StartDate":"1993-01-06T11:00:00+02:00","FinishDate":"1993-01-06T19:30:00+02:00","IsSpecialMeeting":null,"LastUpdatedDate":"2026-01-12T11:36:50.55+02:00"}
{"Id":437256,"Number":49,"KnessetNum":13,"Name":"ישיבת מליאה בתאריך 11/01/1993 בשעה 16:02","StartDate":"1993-01-11T16:02:00+02:00","FinishDate":"1993-01-11T19:03:00+02:00","IsSpecialMeeting":null,"LastUpdatedDate":"2026-01-12T12:25:10.327+02:00"}
{"Id":437257,"Number":51,"KnessetNum":13,"Name":"ישיבת מליאה בתאריך 13/01/1993 בשעה 11:01","StartDate":"1993-01-13T11:01:00+02:00","FinishDate":"1993-01-13T19:28:00+02:00","IsSpecialMeeting":null,"LastUpdatedDate":"2026-01-18T10:34:18.183+02:00"}
{"Id":437258,"Number":52,"KnessetNum":13,"Name":"ישיבת מליאה בתאריך 18/01/1993 בשעה 16:00","StartDate":"1993-01-18T16:00:00+02:00","FinishDate":"1993-01-19T00:57:00+02:00","IsSpecialMeeting":null,"LastUpdatedDate":"2026-01-18T11:25:57.607+02:00"}
{"Id":437259,"Number":53,"KnessetNum":13,"Name":"ישיבת מליאה בתאריך 19/01/1993 בשעה 16:03","StartDate":"1993-01-19T16:03:00+02:00","FinishDate":"1993-01-19T22:42:00+02:00","IsSpecialMeeting":null,"LastUpdatedDate":"2025-02-12T16:08:28.257+02:00"}
{"Id":437260,"Number":55,"KnessetNum":13,"Name":"ישיבת מליאה בתאריך 25/01/1993 בשעה 16:02","StartDate":"1993-01-25T16:02:00+02:00","FinishDate":"1993-01-25T20:51:00+02:00","IsSpecialMeeting":null,"LastUpdatedDate":"2025-02-12T16:09:57.587+02:00"}
{"Id":437261,"Number":56,"KnessetNum":13,"Name":"ישיבת מליאה בתאריך 26/01/1993 בשעה 16:01","StartDate":"1993-01-26T16:01:00+02:00","FinishDate":"1993-01-26T19:46:00+02:00","IsSpecialMeeting":null,"LastUpdatedDate":"2026-01-25T10:37:16.59+02:00"}
{"Id":437262,"Number":58,"KnessetNum":13,"Name":"ישיבת מליאה בתאריך 01/02/1993 בשעה 16:01","StartDate":"1993-02-01T16:01:00+02:00","FinishDate":"1993-02-01T20:30:00+02:00","IsSpecialMeeting":null,"LastUpdatedDate":"2025-02-12T16:12:57.473+02:00"}
{"Id":437263,"Number":59,"KnessetNum":13,"Name":"ישיבת מליאה בתאריך 02/02/1993 בשעה 16:01","StartDate":"1993-02-02T16:01:00+02:00","FinishDate":"1993-02-02T22:17:00+02:00","IsSpecialMeeting":null,"LastUpdatedDate":"2026-01-26T12:41:03.933+02:00"}
{"Id":437264,"Number":60,"KnessetNum":13,"Name":"ישיבת מליאה בתאריך 03/02/1993 בשעה 11:01","StartDate":"1993-02-03T11:01:00+02:00","FinishDate":"1993-02-03T17:05:00+02:00","IsSpecialMeeting":null,"LastUpdatedDate":"2026-01-28T09:18:10.84+02:00"}
{"Id":437265,"Number":62,"KnessetNum":13,"Name":"ישיבת מליאה בתאריך 09/02/1993 בשעה 16:01","StartDate":"1993-02-09T16:01:00+02:00","FinishDate":"1993-02-09T20:10:00+02:00","IsSpecialMeeting":null,"LastUpdatedDate":"2026-01-28T11:04:00.79+02:00"}
{"Id":437266,"Number":63,"KnessetNum":13,"Name":"ישיבת מליאה בתאריך 10/02/1993 בשעה 11:02","StartDate":"1993-02-10T11:02:00+02:00","FinishDate":"1993-02-10T15:33:00+02:00","IsSpecialMeeting":null,"LastUpdatedDate":"2025-02-13T08:27:48.707+02:00"}
{"Id":437267,"Number":64,"KnessetNum":13,"Name":"ישיבת מליאה בתאריך 15/02/1993 בשעה 16:02","StartDate":"1993-02-15T16:02:00+02:00","FinishDate":"1993-02-15T20:09:00+02:00","IsSpecialMeeting":null,"LastUpdatedDate":"2026-02-01T12:57:51.427+02:00"}
{"Id":437268,"Number":65,"KnessetNum":13,"Name":"ישיבת מליאה בתאריך 16/02/1993 בשעה 16:03","StartDate":"1993-02-16T16:03:00+02:00","FinishDate":"1993-02-16T21:13:00+02:00","IsSpecialMeeting":null,"LastUpdatedDate":"2026-02-02T08:41:47.433+02:00"}
{"Id":437269,"Number":66,"KnessetNum":13,"Name":"ישיבת מליאה בתאריך 17/02/1993 בשעה 11:02","StartDate":"1993-02-17T11:02:00+02:00","FinishDate":"1993-02-17T18:55:00+02:00","IsSpecialMeeting":null,"LastUpdatedDate":"2026-02-02T10:47:01.89+02:00"}
{"Id":437270,"Number":67,"KnessetNum":13,"Name":"ישיבת מליאה בתאריך 22/02/1993 בשעה 16:02","StartDate":"1993-02-22T16:02:00+02:00","FinishDate":"1993-02-22T21:03:00+02:00","IsSpecialMeeting":null,"LastUpdatedDate":"2025-02-13T08:29:43.68+02:00"}
{"Id":437271,"Number":68,"KnessetNum":13,"Name":"ישיבת מליאה בתאריך 23/02/1993 בשעה 16:03","StartDate":"1993-02-23T16:03:00+02:00","FinishDate":"1993-02-23T20:23:00+02:00","IsSpecialMeeting":null,"LastUpdatedDate":"2026-02-04T08:56:24.307+02:00"}
{"Id":437272,"Number":71,"KnessetNum":13,"Name":"ישיבת מליאה בתאריך 02/03/1993 בשעה 16:04","StartDate":"1993-03-02T16:04:00+02:00","FinishDate":"1993-03-02T19:44:00+02:00","IsSpecialMeeting":null,"LastUpdatedDate":"2025-02-13T08:32:41.423+02:00"}
{"Id":437273,"Number":72,"KnessetNum":13,"Name":"ישיבת מליאה בתאריך 03/03/1993 בשעה 11:02","StartDate":"1993-03-03T11:02:00+02:00","FinishDate":"1993-03-03T19:23:00+02:00","IsSpecialMeeting":null,"LastUpdatedDate":"2026-02-09T08:52:10.49+02:00"}
{"Id":437274,"Number":73,"KnessetNum":13,"Name":"ישיבת מליאה בתאריך 09/03/1993 בשעה 16:02","StartDate":"1993-03-09T16:02:00+02:00","FinishDate":"1993-03-09T19:13:00+02:00","IsSpecialMeeting":null,"LastUpdatedDate":"2025-02-13T08:33:46.423+02:00"}
{"Id":437275,"Number":74,"KnessetNum":13,"Name":"ישיבת מליאה בתאריך 10/03/1993 בשעה 16:03","StartDate":"1993-03-10T16:03:00+02:00","FinishDate":"1993-03-10T23:08:00+02:00","IsSpecialMeeting":null,"LastUpdatedDate":"2026-02-09T10:55:26.07+02:00"}
{"Id":437276,"Number":75,"KnessetNum":13,"Name":"ישיבת מליאה בתאריך 11/03/1993 בשעה 11:03","StartDate":"1993-03-11T11:03:00+02:00","FinishDate":"1993-03-11T16:43:00+02:00","IsSpecialMeeting":null,"LastUpdatedDate":"2026-02-09T12:15:20.273+02:00"}
{"Id":437277,"Number":77,"KnessetNum":13,"Name":"ישיבת מליאה בתאריך 16/03/1993 בשעה 16:03","StartDate":"1993-03-16T16:03:00+02:00","FinishDate":"1993-03-16T20:49:00+02:00","IsSpecialMeeting":null,"LastUpdatedDate":"2025-02-13T08:36:25.523+02:00"}
{"Id":437278,"Number":78,"KnessetNum":13,"Name":"ישיבת מליאה בתאריך 17/03/1993 בשעה 11:01","StartDate":"1993-03-17T11:01:00+02:00","FinishDate":"1993-03-17T21:40:00+02:00","IsSpecialMeeting":null,"LastUpdatedDate":"2025-02-13T08:37:02.607+02:00"}
{"Id":437279,"Number":79,"KnessetNum":13,"Name":"ישיבת מליאה בתאריך 22/03/1993 בשעה 16:02","StartDate":"1993-03-22T16:02:00+02:00","FinishDate":"1993-03-22T22:09:00+02:00","IsSpecialMeeting":null,"LastUpdatedDate":"2025-02-13T09:05:27.74+02:00"}
{"Id":437280,"Number":80,"KnessetNum":13,"Name":"ישיבת מליאה בתאריך 23/03/1993 בשעה 16:02","StartDate":"1993-03-23T16:02:00+02:00","FinishDate":"1993-03-23T21:24:00+02:00","IsSpecialMeeting":null,"LastUpdatedDate":"2025-02-13T09:06:10.29+02:00"}
{"Id":437281,"Number":83,"KnessetNum":13,"Name":"ישיבת מליאה בתאריך 21/04/1993 בשעה 11:02","StartDate":"1993-04-21T11:02:00+03:00","FinishDate":"1993-04-21T15:57:00+03:00","IsSpecialMeeting":true,"LastUpdatedDate":"2025-02-13T09:08:21.75+02:00"}
{"Id":437282,"Number":87,"KnessetNum":13,"Name":"ישיבת מליאה בתאריך 05/05/1993 בשעה 11:01","StartDate":"1993-05-05T11:01:00+03:00","FinishDate":"1993-05-05T18:14:00+03:00","IsSpecialMeeting":null,"LastUpdatedDate":"2025-02-13T09:10:58.263+02:00"}
{"Id":437283,"Number":88,"KnessetNum":13,"Name":"ישיבת מליאה בתאריך 10/05/1993 בשעה 16:02","StartDate":"1993-05-10T16:02:00+03:00","FinishDate":"1993-05-10T22:05:00+03:00","IsSpecialMeeting":null,"LastUpdatedDate":"2025-02-13T09:11:32.347+02:00"}
{"Id":437284,"Number":89,"KnessetNum":13,"Name":"ישיבת מליאה בתאריך 11/05/1993 בשעה 16:01","StartDate":"1993-05-11T16:01:00+03:00","FinishDate":"1993-05-11T20:56:00+03:00","IsSpecialMeeting":null,"LastUpdatedDate":"2025-02-13T09:16:19.147+02:00"}
{"Id":437285,"Number":92,"KnessetNum":13,"Name":"ישיבת מליאה בתאריך 17/05/1993 בשעה 16:00","StartDate":"1993-05-17T16:00:00+03:00","FinishDate":"1993-05-17T18:35:00+03:00","IsSpecialMeeting":null,"LastUpdatedDate":"2025-02-13T09:48:42.33+02:00"}
{"Id":437286,"Number":94,"KnessetNum":13,"Name":"ישיבת מליאה בתאריך 19/05/1993 בשעה 11:01","StartDate":"1993-05-19T11:01:00+03:00","FinishDate":"1993-05-20T18:03:00+03:00","IsSpecialMeeting":null,"LastUpdatedDate":"2025-02-13T09:52:21.997+02:00"}
{"Id":437287,"Number":95,"KnessetNum":13,"Name":"ישיבת מליאה בתאריך 24/05/1993 בשעה 14:32","StartDate":"1993-05-24T14:32:00+03:00","FinishDate":"1993-05-24T18:48:00+03:00","IsSpecialMeeting":null,"LastUpdatedDate":"2025-02-13T09:53:01.863+02:00"}
{"Id":437288,"Number":98,"KnessetNum":13,"Name":"ישיבת מליאה בתאריך 01/06/1993 בשעה 16:00","StartDate":"1993-06-01T16:00:00+03:00","FinishDate":"1993-06-01T21:08:00+03:00","IsSpecialMeeting":null,"LastUpdatedDate":"2025-02-13T09:54:53.543+02:00"}
{"Id":437289,"Number":99,"KnessetNum":13,"Name":"ישיבת מליאה בתאריך 02/06/1993 בשעה 11:01","StartDate":"1993-06-02T11:01:00+03:00","FinishDate":"1993-06-02T21:22:00+03:00","IsSpecialMeeting":null,"LastUpdatedDate":"2025-02-13T09:55:32.273+02:00"}
{"Id":437290,"Number":100,"KnessetNum":13,"Name":"ישיבת מליאה בתאריך 07/06/1993 בשעה 16:01","StartDate":"1993-06-07T16:01:00+03:00","FinishDate":"1993-06-07T19:05:00+03:00","IsSpecialMeeting":null,"LastUpdatedDate":"2025-02-13T09:56:02.877+02:00"}
{"Id":437291,"Number":102,"KnessetNum":13,"Name":"ישיבת מליאה בתאריך 09/06/1993 בשעה 11:02","StartDate":"1993-06-09T11:02:00+03:00","FinishDate":"1993-06-09T18:51:00+03:00","IsSpecialMeeting":null,"LastUpdatedDate":"2025-02-13T10:08:45.06+02:00"}
{"Id":437292,"Number":103,"KnessetNum":13,"Name":"ישיבת מליאה בתאריך 14/06/1993 בשעה 16:02","StartDate":"1993-06-14T16:02:00+03:00","FinishDate":"1993-06-14T20:41:00+03:00","IsSpecialMeeting":null,"LastUpdatedDate":"2025-02-13T10:09:25.217+02:00"}
{"Id":437293,"Number":104,"KnessetNum":13,"Name":"ישיבת מליאה בתאריך 15/06/1993 בשעה 16:03","StartDate":"1993-06-15T16:03:00+03:00","FinishDate":"1993-06-15T21:18:00+03:00","IsSpecialMeeting":null,"LastUpdatedDate":"2025-02-13T10:09:56.35+02:00"}
{"Id":437294,"Number":105,"KnessetNum":13,"Name":"ישיבת מליאה בתאריך 16/06/1993 בשעה 11:03","StartDate":"1993-06-16T11:03:00+03:00","FinishDate":"1993-06-16T19:12:00+03:00","IsSpecialMeeting":null,"LastUpdatedDate":"2025-02-13T10:11:23.617+02:00"}
{"Id":437295,"Number":107,"KnessetNum":13,"Name":"ישיבת מליאה בתאריך 22/06/1993 בשעה 16:01","StartDate":"1993-06-22T16:01:00+03:00","FinishDate":"1993-06-22T21:26:00+03:00","IsSpecialMeeting":null,"LastUpdatedDate":"2025-02-13T10:21:15.65+02:00"}
{"Id":437296,"Number":110,"KnessetNum":13,"Name":"ישיבת מליאה בתאריך 29/06/1993 בשעה 16:02","StartDate":"1993-06-29T16:02:00+03:00","FinishDate":"1993-06-29T21:15:00+03:00","IsSpecialMeeting":null,"LastUpdatedDate":"2025-02-13T10:23:24.483+02:00"}
{"Id":437297,"Number":111,"KnessetNum":13,"Name":"ישיבת מליאה בתאריך 30/06/1993 בשעה 11:05","StartDate":"1993-06-30T11:05:00+03:00","FinishDate":"1993-06-30T18:07:00+03:00","IsSpecialMeeting":null,"LastUpdatedDate":"2025-02-13T10:23:57.457+02:00"}
{"Id":437298,"Number":113,"KnessetNum":13,"Name":"ישיבת מליאה בתאריך 06/07/1993 בשעה 16:03","StartDate":"1993-07-06T16:03:00+03:00","FinishDate":"1993-07-06T22:21:00+03:00","IsSpecialMeeting":null,"LastUpdatedDate":"2025-02-13T10:26:34.233+02:00"}
{"Id":437299,"Number":119,"KnessetNum":13,"Name":"ישיבת מליאה בתאריך 20/07/1993 בשעה 16:02","StartDate":"1993-07-20T16:02:00+03:00","FinishDate":"1993-07-20T19:49:00+03:00","IsSpecialMeeting":null,"LastUpdatedDate":"2025-02-13T10:31:36.87+02:00"}
{"Id":437300,"Number":120,"KnessetNum":13,"Name":"ישיבת מליאה בתאריך 21/07/1993 בשעה 11:02","StartDate":"1993-07-21T11:02:00+03:00","FinishDate":"1993-07-21T19:54:00+03:00","IsSpecialMeeting":null,"LastUpdatedDate":"2025-02-13T10:32:50.753+02:00"}
{"Id":437301,"Number":122,"KnessetNum":13,"Name":"ישיבת מליאה בתאריך 29/07/1993 בשעה 11:03","StartDate":"1993-07-29T11:03:00+03:00","FinishDate":"1993-07-29T16:30:00+03:00","IsSpecialMeeting":null,"LastUpdatedDate":"2025-02-13T11:06:04.207+02:00"}
{"Id":437302,"Number":123,"KnessetNum":13,"Name":"ישיבת מליאה בתאריך 02/08/1993 בשעה 16:04","StartDate":"1993-08-02T16:04:00+03:00","FinishDate":"1993-08-02T23:57:00+03:00","IsSpecialMeeting":null,"LastUpdatedDate":"2025-02-13T11:07:11.19+02:00"}
{"Id":437303,"Number":125,"KnessetNum":13,"Name":"ישיבת מליאה בתאריך 04/08/1993 בשעה 11:02","StartDate":"1993-08-04T11:02:00+03:00","FinishDate":"1993-08-04T21:03:00+03:00","IsSpecialMeeting":null,"LastUpdatedDate":"2025-02-13T11:09:06.853+02:00"}
{"Id":437304,"Number":131,"KnessetNum":13,"Name":"ישיבת מליאה בתאריך 23/09/1993 בשעה 08:32","StartDate":"1993-09-23T08:32:00+02:00","FinishDate":"1993-09-23T15:37:00+02:00","IsSpecialMeeting":true,"LastUpdatedDate":"2025-02-13T11:14:02.013+02:00"}
{"Id":437305,"Number":132,"KnessetNum":13,"Name":"ישיבת מליאה בתאריך 11/10/1993 בשעה 16:01","StartDate":"1993-10-11T16:01:00+02:00","FinishDate":"1993-10-11T20:52:00+02:00","IsSpecialMeeting":null,"LastUpdatedDate":"2025-02-13T11:15:07.5+02:00"}
{"Id":437306,"Number":134,"KnessetNum":13,"Name":"ישיבת מליאה בתאריך 13/10/1993 בשעה 11:01","StartDate":"1993-10-13T11:01:00+02:00","FinishDate":"1993-10-13T15:15:00+02:00","IsSpecialMeeting":null,"LastUpdatedDate":"2025-02-13T11:16:21.027+02:00"}
{"Id":437307,"Number":135,"KnessetNum":13,"Name":"ישיבת מליאה בתאריך 18/10/1993 בשעה 16:00","StartDate":"1993-10-18T16:00:00+02:00","FinishDate":"1993-10-18T22:07:00+02:00","IsSpecialMeeting":null,"LastUpdatedDate":"2025-02-13T11:16:48.647+02:00"}
{"Id":437308,"Number":136,"KnessetNum":13,"Name":"ישיבת מליאה בתאריך 19/10/1993 בשעה 16:00","StartDate":"1993-10-19T16:00:00+02:00","FinishDate":"1993-10-19T19:35:00+02:00","IsSpecialMeeting":null,"LastUpdatedDate":"2025-02-13T11:17:38.913+02:00"}
{"Id":437309,"Number":140,"KnessetNum":13,"Name":"ישיבת מליאה בתאריך 27/10/1993 בשעה 10:01","StartDate":"1993-10-27T10:01:00+02:00","FinishDate":"1993-10-27T18:11:00+02:00","IsSpecialMeeting":null,"LastUpdatedDate":"2025-02-13T11:42:26.803+02:00"}
{"Id":437310,"Number":142,"KnessetNum":13,"Name":"ישיבת מליאה בתאריך 02/11/1993 בשעה 16:00","StartDate":"1993-11-02T16:00:00+02:00","FinishDate":"1993-11-02T17:07:00+02:00","IsSpecialMeeting":null,"LastUpdatedDate":"2025-02-13T11:46:29.83+02:00"}
{"Id":437311,"Number":146,"KnessetNum":13,"Name":"ישיבת מליאה בתאריך 10/11/1993 בשעה 11:00","StartDate":"1993-11-10T11:00:00+02:00","FinishDate":"1993-11-10T20:15:00+02:00","IsSpecialMeeting":null,"LastUpdatedDate":"2025-02-13T11:49:10.77+02:00"}
{"Id":437312,"Number":149,"KnessetNum":13,"Name":"ישיבת מליאה בתאריך 17/11/1993 בשעה 11:01","StartDate":"1993-11-17T11:01:00+02:00","FinishDate":"1993-11-17T21:46:00+02:00","IsSpecialMeeting":null,"LastUpdatedDate":"2025-02-13T11:51:59.293+02:00"}
{"Id":437314,"Number":150,"KnessetNum":13,"Name":"ישיבת מליאה בתאריך 22/11/1993 בשעה 16:01","StartDate":"1993-11-22T16:01:00+02:00","FinishDate":"1993-11-22T21:03:00+02:00","IsSpecialMeeting":null,"LastUpdatedDate":"2025-02-13T11:57:36.83+02:00"}
{"Id":437315,"Number":152,"KnessetNum":13,"Name":"ישיבת מליאה בתאריך 24/11/1993 בשעה 11:00","StartDate":"1993-11-24T11:00:00+02:00","FinishDate":"1993-11-24T19:12:00+02:00","IsSpecialMeeting":null,"LastUpdatedDate":"2025-02-13T12:18:31.057+02:00"}
{"Id":437316,"Number":153,"KnessetNum":13,"Name":"ישיבת מליאה בתאריך 29/11/1993 בשעה 16:01","StartDate":"1993-11-29T16:01:00+02:00","FinishDate":"1993-11-29T21:31:00+02:00","IsSpecialMeeting":null,"LastUpdatedDate":"2025-02-13T12:19:24.37+02:00"}
{"Id":437317,"Number":155,"KnessetNum":13,"Name":"ישיבת מליאה בתאריך 01/12/1993 בשעה 11:02","StartDate":"1993-12-01T11:02:00+02:00","FinishDate":"1993-12-01T20:28:00+02:00","IsSpecialMeeting":null,"LastUpdatedDate":"2025-02-13T12:20:45.59+02:00"}
{"Id":437318,"Number":156,"KnessetNum":13,"Name":"ישיבת מליאה בתאריך 06/12/1993 בשעה 16:02","StartDate":"1993-12-06T16:02:00+02:00","FinishDate":"1993-12-06T20:52:00+02:00","IsSpecialMeeting":true,"LastUpdatedDate":"2025-02-13T12:21:41.41+02:00"}
{"Id":437319,"Number":158,"KnessetNum":13,"Name":"ישיבת מליאה בתאריך 08/12/1993 בשעה 09:00","StartDate":"1993-12-08T09:00:00+02:00","FinishDate":"1993-12-08T15:07:00+02:00","IsSpecialMeeting":null,"LastUpdatedDate":"2025-02-13T12:22:43.71+02:00"}
{"Id":437320,"Number":159,"KnessetNum":13,"Name":"ישיבת מליאה בתאריך 13/12/1993 בשעה 16:01","StartDate":"1993-12-13T16:01:00+02:00","FinishDate":"1993-12-13T20:42:00+02:00","IsSpecialMeeting":null,"LastUpdatedDate":"2025-02-13T12:23:16.59+02:00"}
{"Id":437321,"Number":162,"KnessetNum":13,"Name":"ישיבת מליאה בתאריך 20/12/1993 בשעה 16:02","StartDate":"1993-12-20T16:02:00+02:00","FinishDate":"1993-12-20T21:31:00+02:00","IsSpecialMeeting":null,"LastUpdatedDate":"2025-02-13T12:25:40.787+02:00"}
{"Id":437322,"Number":164,"KnessetNum":13,"Name":"ישיבת מליאה בתאריך 22/12/1993 בשעה 09:00","StartDate":"1993-12-22T09:00:00+02:00","FinishDate":"1993-12-23T00:42:00+02:00","IsSpecialMeeting":null,"LastUpdatedDate":"2025-02-13T12:27:57.06+02:00"}
{"Id":437324,"Number":169,"KnessetNum":13,"Name":"ישיבת מליאה בתאריך 03/01/1994 בשעה 16:02","StartDate":"1994-01-03T16:02:00+02:00","FinishDate":"1994-01-03T21:07:00+02:00","IsSpecialMeeting":null,"LastUpdatedDate":"2025-02-13T12:34:14.913+02:00"}
{"Id":437325,"Number":171,"KnessetNum":13,"Name":"ישיבת מליאה בתאריך 05/01/1994 בשעה 11:00","StartDate":"1994-01-05T11:00:00+02:00","FinishDate":"1994-01-05T22:09:00+02:00","IsSpecialMeeting":null,"LastUpdatedDate":"2025-02-13T13:31:16.603+02:00"}
{"Id":437326,"Number":172,"KnessetNum":13,"Name":"ישיבת מליאה בתאריך 10/01/1994 בשעה 16:03","StartDate":"1994-01-10T16:03:00+02:00","FinishDate":"1994-01-11T00:00:00+02:00","IsSpecialMeeting":null,"LastUpdatedDate":"2025-02-13T13:32:03.393+02:00"}
{"Id":437327,"Number":173,"KnessetNum":13,"Name":"ישיבת מליאה בתאריך 11/01/1994 בשעה 16:09","StartDate":"1994-01-11T16:09:00+02:00","FinishDate":"1994-01-11T20:38:00+02:00","IsSpecialMeeting":null,"LastUpdatedDate":"2025-02-13T13:32:36.867+02:00"}
{"Id":437328,"Number":174,"KnessetNum":13,"Name":"ישיבת מליאה בתאריך 12/01/1994 בשעה 11:01","StartDate":"1994-01-12T11:01:00+02:00","FinishDate":"1994-01-12T20:38:00+02:00","IsSpecialMeeting":null,"LastUpdatedDate":"2025-02-13T13:33:25.72+02:00"}
{"Id":437329,"Number":175,"KnessetNum":13,"Name":"ישיבת מליאה בתאריך 17/01/1994 בשעה 16:01","StartDate":"1994-01-17T16:01:00+02:00","FinishDate":"1994-01-17T21:14:00+02:00","IsSpecialMeeting":null,"LastUpdatedDate":"2025-02-13T13:37:03.117+02:00"}
{"Id":437330,"Number":177,"KnessetNum":13,"Name":"ישיבת מליאה בתאריך 19/01/1994 בשעה 11:00","StartDate":"1994-01-19T11:00:00+02:00","FinishDate":"1994-01-19T19:55:00+02:00","IsSpecialMeeting":null,"LastUpdatedDate":"2025-02-13T13:38:09.653+02:00"}
{"Id":437331,"Number":178,"KnessetNum":13,"Name":"ישיבת מליאה בתאריך 24/01/1994 בשעה 16:01","StartDate":"1994-01-24T16:01:00+02:00","FinishDate":"1994-01-24T22:29:00+02:00","IsSpecialMeeting":null,"LastUpdatedDate":"2025-02-13T13:38:45.85+02:00"}
{"Id":437332,"Number":179,"KnessetNum":13,"Name":"ישיבת מליאה בתאריך 25/01/1994 בשעה 16:00","StartDate":"1994-01-25T16:00:00+02:00","FinishDate":"1994-01-25T21:16:00+02:00","IsSpecialMeeting":null,"LastUpdatedDate":"2025-02-13T13:39:19.07+02:00"}
{"Id":437333,"Number":180,"KnessetNum":13,"Name":"ישיבת מליאה בתאריך 26/01/1994 בשעה 11:02","StartDate":"1994-01-26T11:02:00+02:00","FinishDate":"1994-01-26T19:15:00+02:00","IsSpecialMeeting":null,"LastUpdatedDate":"2025-02-13T13:39:57.04+02:00"}
{"Id":437334,"Number":182,"KnessetNum":13,"Name":"ישיבת מליאה בתאריך 01/02/1994 בשעה 16:00","StartDate":"1994-02-01T16:00:00+02:00","FinishDate":"1994-02-01T20:24:00+02:00","IsSpecialMeeting":null,"LastUpdatedDate":"2025-02-13T13:41:12.687+02:00"}
{"Id":437335,"Number":184,"KnessetNum":13,"Name":"ישיבת מליאה בתאריך 07/02/1994 בשעה 16:02","StartDate":"1994-02-07T16:02:00+02:00","FinishDate":"1994-02-07T20:25:00+02:00","IsSpecialMeeting":null,"LastUpdatedDate":"2025-02-13T13:42:36.53+02:00"}
{"Id":437336,"Number":193,"KnessetNum":13,"Name":"ישיבת מליאה בתאריך 28/02/1994 בשעה 16:02","StartDate":"1994-02-28T16:02:00+02:00","FinishDate":"1994-02-28T21:01:00+02:00","IsSpecialMeeting":null,"LastUpdatedDate":"2025-02-13T13:56:21.99+02:00"}
{"Id":437337,"Number":194,"KnessetNum":13,"Name":"ישיבת מליאה בתאריך 01/03/1994 בשעה 16:01","StartDate":"1994-03-01T16:01:00+02:00","FinishDate":"1994-03-01T22:41:00+02:00","IsSpecialMeeting":null,"LastUpdatedDate":"2025-02-13T13:56:58.333+02:00"}
{"Id":437338,"Number":196,"KnessetNum":13,"Name":"ישיבת מליאה בתאריך 07/03/1994 בשעה 16:03","StartDate":"1994-03-07T16:03:00+02:00","FinishDate":"1994-03-07T21:33:00+02:00","IsSpecialMeeting":null,"LastUpdatedDate":"2025-02-13T13:58:45.217+02:00"}
{"Id":437339,"Number":197,"KnessetNum":13,"Name":"ישיבת מליאה בתאריך 08/03/1994 בשעה 16:03","StartDate":"1994-03-08T16:03:00+02:00","FinishDate":"1994-03-09T00:58:00+02:00","IsSpecialMeeting":null,"LastUpdatedDate":"2025-02-13T14:02:06.093+02:00"}
{"Id":437340,"Number":200,"KnessetNum":13,"Name":"ישיבת מליאה בתאריך 15/03/1994 בשעה 10:05","StartDate":"1994-03-15T10:05:00+02:00","FinishDate":"1994-03-16T04:07:00+02:00","IsSpecialMeeting":null,"LastUpdatedDate":"2025-02-13T14:04:46.423+02:00"}
{"Id":437341,"Number":204,"KnessetNum":13,"Name":"ישיבת מליאה בתאריך 18/04/1994 בשעה 16:02","StartDate":"1994-04-18T16:02:00+03:00","FinishDate":"1994-04-18T20:59:00+03:00","IsSpecialMeeting":null,"LastUpdatedDate":"2025-02-13T14:08:22.19+02:00"}
{"Id":437342,"Number":205,"KnessetNum":13,"Name":"ישיבת מליאה בתאריך 19/04/1994 בשעה 16:01","StartDate":"1994-04-19T16:01:00+03:00","FinishDate":"1994-04-19T19:27:00+03:00","IsSpecialMeeting":null,"LastUpdatedDate":"2025-02-13T14:08:51.553+02:00"}
{"Id":437343,"Number":207,"KnessetNum":13,"Name":"ישיבת מליאה בתאריך 25/04/1994 בשעה 16:03","StartDate":"1994-04-25T16:03:00+03:00","FinishDate":"1994-04-26T00:58:00+03:00","IsSpecialMeeting":null,"LastUpdatedDate":"2025-02-13T14:10:54.8+02:00"}
{"Id":437344,"Number":209,"KnessetNum":13,"Name":"ישיבת מליאה בתאריך 27/04/1994 בשעה 11:01","StartDate":"1994-04-27T11:01:00+03:00","FinishDate":"1994-04-27T20:21:00+03:00","IsSpecialMeeting":null,"LastUpdatedDate":"2025-02-13T14:12:10.42+02:00"}
{"Id":437345,"Number":211,"KnessetNum":13,"Name":"ישיבת מליאה בתאריך 03/05/1994 בשעה 16:02","StartDate":"1994-05-03T16:02:00+03:00","FinishDate":"1994-05-03T20:01:00+03:00","IsSpecialMeeting":null,"LastUpdatedDate":"2025-02-16T08:27:32.587+02:00"}
{"Id":437346,"Number":215,"KnessetNum":13,"Name":"ישיבת מליאה בתאריך 12/05/1994 בשעה 09:02","StartDate":"1994-05-12T09:02:00+03:00","FinishDate":"1994-05-12T14:23:00+03:00","IsSpecialMeeting":null,"LastUpdatedDate":"2025-02-16T08:32:41.913+02:00"}
{"Id":437347,"Number":216,"KnessetNum":13,"Name":"ישיבת מליאה בתאריך 17/05/1994 בשעה 16:03","StartDate":"1994-05-17T16:03:00+03:00","FinishDate":"1994-05-17T20:50:00+03:00","IsSpecialMeeting":null,"LastUpdatedDate":"2025-02-16T08:33:32.697+02:00"}
{"Id":437348,"Number":218,"KnessetNum":13,"Name":"ישיבת מליאה בתאריך 19/05/1994 בשעה 11:00","StartDate":"1994-05-19T11:00:00+03:00","FinishDate":"1994-05-19T19:08:00+03:00","IsSpecialMeeting":null,"LastUpdatedDate":"2025-02-16T08:34:30.163+02:00"}
{"Id":437349,"Number":219,"KnessetNum":13,"Name":"ישיבת מליאה בתאריך 23/05/1994 בשעה 16:02","StartDate":"1994-05-23T16:02:00+03:00","FinishDate":"1994-05-23T22:57:00+03:00","IsSpecialMeeting":null,"LastUpdatedDate":"2025-02-16T08:35:04.013+02:00"}
{"Id":437350,"Number":222,"KnessetNum":13,"Name":"ישיבת מליאה בתאריך 30/05/1994 בשעה 16:01","StartDate":"1994-05-30T16:01:00+03:00","FinishDate":"1994-05-30T19:46:00+03:00","IsSpecialMeeting":null,"LastUpdatedDate":"2025-02-16T08:36:28.703+02:00"}
{"Id":437351,"Number":223,"KnessetNum":13,"Name":"ישיבת מליאה בתאריך 31/05/1994 בשעה 16:02","StartDate":"1994-05-31T16:02:00+03:00","FinishDate":"1994-05-31T21:45:00+03:00","IsSpecialMeeting":null,"LastUpdatedDate":"2025-02-16T08:37:07.56+02:00"}
{"Id":437352,"Number":224,"KnessetNum":13,"Name":"ישיבת מליאה בתאריך 01/06/1994 בשעה 11:01","StartDate":"1994-06-01T11:01:00+03:00","FinishDate":"1994-06-01T20:47:00+03:00","IsSpecialMeeting":null,"LastUpdatedDate":"2025-02-16T08:37:42.223+02:00"}
{"Id":437353,"Number":225,"KnessetNum":13,"Name":"ישיבת מליאה בתאריך 06/06/1994 בשעה 16:01","StartDate":"1994-06-06T16:01:00+03:00","FinishDate":"1994-06-06T21:37:00+03:00","IsSpecialMeeting":null,"LastUpdatedDate":"2025-02-16T08:38:10.693+02:00"}
{"Id":437354,"Number":226,"KnessetNum":13,"Name":"ישיבת מליאה בתאריך 07/06/1994 בשעה 16:01","StartDate":"1994-06-07T16:01:00+03:00","FinishDate":"1994-06-07T23:16:00+03:00","IsSpecialMeeting":null,"LastUpdatedDate":"2025-02-16T08:38:40.497+02:00"}
{"Id":437355,"Number":227,"KnessetNum":13,"Name":"ישיבת מליאה בתאריך 08/06/1994 בשעה 11:01","StartDate":"1994-06-08T11:01:00+03:00","FinishDate":"1994-06-08T21:08:00+03:00","IsSpecialMeeting":null,"LastUpdatedDate":"2025-02-16T08:39:15.58+02:00"}
{"Id":437356,"Number":228,"KnessetNum":13,"Name":"ישיבת מליאה בתאריך 13/06/1994 בשעה 16:03","StartDate":"1994-06-13T16:03:00+03:00","FinishDate":"1994-06-14T02:49:00+03:00","IsSpecialMeeting":null,"LastUpdatedDate":"2025-02-16T08:40:03.53+02:00"}
{"Id":437357,"Number":229,"KnessetNum":13,"Name":"ישיבת מליאה בתאריך 14/06/1994 בשעה 16:00","StartDate":"1994-06-14T16:00:00+03:00","FinishDate":"1994-06-15T02:50:00+03:00","IsSpecialMeeting":null,"LastUpdatedDate":"2025-02-16T08:40:41.907+02:00"}
{"Id":437358,"Number":230,"KnessetNum":13,"Name":"ישיבת מליאה בתאריך 15/06/1994 בשעה 11:02","StartDate":"1994-06-15T11:02:00+03:00","FinishDate":"1994-06-15T19:50:00+03:00","IsSpecialMeeting":null,"LastUpdatedDate":"2025-02-16T08:41:12.107+02:00"}
{"Id":437359,"Number":231,"KnessetNum":13,"Name":"ישיבת מליאה בתאריך 20/06/1994 בשעה 16:02","StartDate":"1994-06-20T16:02:00+03:00","FinishDate":"1994-06-20T22:10:00+03:00","IsSpecialMeeting":null,"LastUpdatedDate":"2025-02-16T08:41:47.343+02:00"}
{"Id":437361,"Number":234,"KnessetNum":13,"Name":"ישיבת מליאה בתאריך 27/06/1994 בשעה 16:01","StartDate":"1994-06-27T16:01:00+03:00","FinishDate":"1994-06-27T22:47:00+03:00","IsSpecialMeeting":null,"LastUpdatedDate":"2025-02-16T09:06:34.483+02:00"}
{"Id":437362,"Number":235,"KnessetNum":13,"Name":"ישיבת מליאה בתאריך 28/06/1994 בשעה 16:00","StartDate":"1994-06-28T16:00:00+03:00","FinishDate":"1994-06-28T23:30:00+03:00","IsSpecialMeeting":null,"LastUpdatedDate":"2025-02-16T09:07:12.433+02:00"}
{"Id":437363,"Number":236,"KnessetNum":13,"Name":"ישיבת מליאה בתאריך 29/06/1994 בשעה 11:00","StartDate":"1994-06-29T11:00:00+03:00","FinishDate":"1994-06-29T21:26:00+03:00","IsSpecialMeeting":null,"LastUpdatedDate":"2025-02-16T09:07:59.777+02:00"}
{"Id":437364,"Number":238,"KnessetNum":13,"Name":"ישיבת מליאה בתאריך 05/07/1994 בשעה 16:02","StartDate":"1994-07-05T16:02:00+03:00","FinishDate":"1994-07-05T23:44:00+03:00","IsSpecialMeeting":null,"LastUpdatedDate":"2025-02-16T09:19:13.727+02:00"}
{"Id":437365,"Number":241,"KnessetNum":13,"Name":"ישיבת מליאה בתאריך 12/07/1994 בשעה 16:01","StartDate":"1994-07-12T16:01:00+03:00","FinishDate":"1994-07-12T23:36:00+03:00","IsSpecialMeeting":null,"LastUpdatedDate":"2025-02-16T09:21:56.053+02:00"}
{"Id":437366,"Number":242,"KnessetNum":13,"Name":"ישיבת מליאה בתאריך 13/07/1994 בשעה 11:01","StartDate":"1994-07-13T11:01:00+03:00","FinishDate":"1994-07-13T21:40:00+03:00","IsSpecialMeeting":null,"LastUpdatedDate":"2025-02-16T09:22:34.247+02:00"}
{"Id":437367,"Number":245,"KnessetNum":13,"Name":"ישיבת מליאה בתאריך 20/07/1994 בשעה 11:01","StartDate":"1994-07-20T11:01:00+03:00","FinishDate":"1994-07-20T21:46:00+03:00","IsSpecialMeeting":null,"LastUpdatedDate":"2025-02-16T09:24:39.563+02:00"}
{"Id":437368,"Number":250,"KnessetNum":13,"Name":"ישיבת מליאה בתאריך 31/08/1994 בשעה 10:02","StartDate":"1994-08-31T10:02:00+03:00","FinishDate":"1994-08-31T17:55:00+03:00","IsSpecialMeeting":true,"LastUpdatedDate":"2025-02-16T09:33:13.83+02:00"}
{"Id":437369,"Number":252,"KnessetNum":13,"Name":"ישיבת מליאה בתאריך 03/10/1994 בשעה 16:02","StartDate":"1994-10-03T16:02:00+02:00","FinishDate":"1994-10-03T21:21:00+02:00","IsSpecialMeeting":null,"LastUpdatedDate":"2025-02-16T09:48:21.587+02:00"}
{"Id":437370,"Number":254,"KnessetNum":13,"Name":"ישיבת מליאה בתאריך 05/10/1994 בשעה 11:02","StartDate":"1994-10-05T11:02:00+02:00","FinishDate":"1994-10-05T18:13:00+02:00","IsSpecialMeeting":null,"LastUpdatedDate":"2025-02-16T09:49:34.437+02:00"}
{"Id":437371,"Number":255,"KnessetNum":13,"Name":"ישיבת מליאה בתאריך 10/10/1994 בשעה 16:03","StartDate":"1994-10-10T16:03:00+02:00","FinishDate":"1994-10-10T22:07:00+02:00","IsSpecialMeeting":null,"LastUpdatedDate":"2025-02-16T09:53:21.687+02:00"}
{"Id":437372,"Number":257,"KnessetNum":13,"Name":"ישיבת מליאה בתאריך 12/10/1994 בשעה 11:02","StartDate":"1994-10-12T11:02:00+02:00","FinishDate":"1994-10-12T18:15:00+02:00","IsSpecialMeeting":null,"LastUpdatedDate":"2025-02-16T10:01:50.71+02:00"}
{"Id":437373,"Number":258,"KnessetNum":13,"Name":"ישיבת מליאה בתאריך 17/10/1994 בשעה 16:01","StartDate":"1994-10-17T16:01:00+02:00","FinishDate":"1994-10-17T22:49:00+02:00","IsSpecialMeeting":null,"LastUpdatedDate":"2025-02-16T10:02:51.367+02:00"}
{"Id":437374,"Number":260,"KnessetNum":13,"Name":"ישיבת מליאה בתאריך 19/10/1994 בשעה 11:02","StartDate":"1994-10-19T11:02:00+02:00","FinishDate":"1994-10-19T17:26:00+02:00","IsSpecialMeeting":null,"LastUpdatedDate":"2025-02-16T10:04:37.063+02:00"}
{"Id":437375,"Number":261,"KnessetNum":13,"Name":"ישיבת מליאה בתאריך 24/10/1994 בשעה 15:00","StartDate":"1994-10-24T15:00:00+02:00","FinishDate":"1994-10-25T01:05:00+02:00","IsSpecialMeeting":null,"LastUpdatedDate":"2025-02-16T10:05:30.243+02:00"}
{"Id":437376,"Number":263,"KnessetNum":13,"Name":"ישיבת מליאה בתאריך 27/10/1994 בשעה 09:01","StartDate":"1994-10-27T09:01:00+02:00","FinishDate":"1994-10-27T13:25:00+02:00","IsSpecialMeeting":null,"LastUpdatedDate":"2025-02-16T10:07:36.853+02:00"}
{"Id":437378,"Number":268,"KnessetNum":13,"Name":"ישיבת מליאה בתאריך 07/11/1994 בשעה 16:02","StartDate":"1994-11-07T16:02:00+02:00","FinishDate":"1994-11-08T01:11:00+02:00","IsSpecialMeeting":null,"LastUpdatedDate":"2019-12-16T08:45:47.807+02:00"}
{"Id":437379,"Number":269,"KnessetNum":13,"Name":"ישיבת מליאה בתאריך 08/11/1994 בשעה 16:02","StartDate":"1994-11-08T16:02:00+02:00","FinishDate":"1994-11-08T21:47:00+02:00","IsSpecialMeeting":null,"LastUpdatedDate":"2025-02-16T10:17:18.743+02:00"}
{"Id":437380,"Number":271,"KnessetNum":13,"Name":"ישיבת מליאה בתאריך 14/11/1994 בשעה 16:02","StartDate":"1994-11-14T16:02:00+02:00","FinishDate":"1994-11-15T00:01:00+02:00","IsSpecialMeeting":null,"LastUpdatedDate":"2019-12-12T14:05:47.167+02:00"}
{"Id":437381,"Number":272,"KnessetNum":13,"Name":"ישיבת מליאה בתאריך 15/11/1994 בשעה 16:10","StartDate":"1994-11-15T16:10:00+02:00","FinishDate":"1994-11-16T00:40:00+02:00","IsSpecialMeeting":null,"LastUpdatedDate":"2025-02-16T10:45:22.35+02:00"}
{"Id":437382,"Number":275,"KnessetNum":13,"Name":"ישיבת מליאה בתאריך 22/11/1994 בשעה 16:02","StartDate":"1994-11-22T16:02:00+02:00","FinishDate":"1994-11-23T16:08:00+02:00","IsSpecialMeeting":null,"LastUpdatedDate":"2025-02-16T10:48:14.097+02:00"}
{"Id":437383,"Number":279,"KnessetNum":13,"Name":"ישיבת מליאה בתאריך 30/11/1994 בשעה 11:02","StartDate":"1994-11-30T11:02:00+02:00","FinishDate":"1994-11-30T20:27:00+02:00","IsSpecialMeeting":null,"LastUpdatedDate":"2025-02-16T10:52:45.91+02:00"}
{"Id":437384,"Number":281,"KnessetNum":13,"Name":"ישיבת מליאה בתאריך 06/12/1994 בשעה 15:06","StartDate":"1994-12-06T15:06:00+02:00","FinishDate":"1994-12-07T01:42:00+02:00","IsSpecialMeeting":null,"LastUpdatedDate":"2019-12-12T14:10:26.82+02:00"}
{"Id":437385,"Number":282,"KnessetNum":13,"Name":"ישיבת מליאה בתאריך 07/12/1994 בשעה 11:02","StartDate":"1994-12-07T11:02:00+02:00","FinishDate":"1994-12-07T23:32:00+02:00","IsSpecialMeeting":null,"LastUpdatedDate":"2025-02-16T10:53:50.747+02:00"}
{"Id":437386,"Number":283,"KnessetNum":13,"Name":"ישיבת מליאה בתאריך 12/12/1994 בשעה 16:00","StartDate":"1994-12-12T16:00:00+02:00","FinishDate":"1994-12-13T01:09:00+02:00","IsSpecialMeeting":null,"LastUpdatedDate":"2025-02-16T10:54:40.203+02:00"}
{"Id":437387,"Number":284,"KnessetNum":13,"Name":"ישיבת מליאה בתאריך 13/12/1994 בשעה 15:02","StartDate":"1994-12-13T15:02:00+02:00","FinishDate":"1994-12-13T20:34:00+02:00","IsSpecialMeeting":null,"LastUpdatedDate":"2025-02-16T10:55:52.347+02:00"}
{"Id":437388,"Number":287,"KnessetNum":13,"Name":"ישיבת מליאה בתאריך 20/12/1994 בשעה 15:00","StartDate":"1994-12-20T15:00:00+02:00","FinishDate":"1994-12-21T16:25:00+02:00","IsSpecialMeeting":null,"LastUpdatedDate":"2020-04-30T15:07:46.48+03:00"}
{"Id":437389,"Number":288,"KnessetNum":13,"Name":"ישיבת מליאה בתאריך 21/12/1994 בשעה 11:00","StartDate":"1994-12-21T11:00:00+02:00","FinishDate":"1994-12-22T00:45:00+02:00","IsSpecialMeeting":null,"LastUpdatedDate":"2025-02-16T11:05:02.313+02:00"}
{"Id":437390,"Number":297,"KnessetNum":13,"Name":"ישיבת מליאה בתאריך 10/01/1995 בשעה 15:02","StartDate":"1995-01-10T15:02:00+02:00","FinishDate":"1995-01-10T21:21:00+02:00","IsSpecialMeeting":null,"LastUpdatedDate":"2025-02-16T11:50:50.9+02:00"}
{"Id":437391,"Number":299,"KnessetNum":13,"Name":"ישיבת מליאה בתאריך 16/01/1995 בשעה 16:02","StartDate":"1995-01-16T16:02:00+02:00","FinishDate":"1995-01-17T02:05:00+02:00","IsSpecialMeeting":null,"LastUpdatedDate":"2025-02-16T11:52:29.907+02:00"}
{"Id":437392,"Number":301,"KnessetNum":13,"Name":"ישיבת מליאה בתאריך 18/01/1995 בשעה 11:01","StartDate":"1995-01-18T11:01:00+02:00","FinishDate":"1995-01-18T18:31:00+02:00","IsSpecialMeeting":null,"LastUpdatedDate":"2025-02-16T11:54:07.727+02:00"}
{"Id":437393,"Number":303,"KnessetNum":13,"Name":"ישיבת מליאה בתאריך 24/01/1995 בשעה 15:01","StartDate":"1995-01-24T15:01:00+02:00","FinishDate":"1995-01-25T01:06:00+02:00","IsSpecialMeeting":null,"LastUpdatedDate":"2025-02-16T11:56:02.743+02:00"}
{"Id":437394,"Number":304,"KnessetNum":13,"Name":"ישיבת מליאה בתאריך 25/01/1995 בשעה 11:03","StartDate":"1995-01-25T11:03:00+02:00","FinishDate":"1995-01-25T20:02:00+02:00","IsSpecialMeeting":null,"LastUpdatedDate":"2025-02-16T11:57:05.543+02:00"}
{"Id":437395,"Number":305,"KnessetNum":13,"Name":"ישיבת מליאה בתאריך 30/01/1995 בשעה 16:00","StartDate":"1995-01-30T16:00:00+02:00","FinishDate":"1995-01-30T22:20:00+02:00","IsSpecialMeeting":null,"LastUpdatedDate":"2025-02-16T11:57:52.273+02:00"}
{"Id":437396,"Number":306,"KnessetNum":13,"Name":"ישיבת מליאה בתאריך 31/01/1995 בשעה 15:00","StartDate":"1995-01-31T15:00:00+02:00","FinishDate":"1995-01-31T21:30:00+02:00","IsSpecialMeeting":null,"LastUpdatedDate":"2025-02-16T11:58:31.767+02:00"}
{"Id":437397,"Number":307,"KnessetNum":13,"Name":"ישיבת מליאה בתאריך 01/02/1995 בשעה 11:01","StartDate":"1995-02-01T11:01:00+02:00","FinishDate":"1995-02-01T21:06:00+02:00","IsSpecialMeeting":null,"LastUpdatedDate":"2025-02-16T11:59:46.423+02:00"}
{"Id":437398,"Number":308,"KnessetNum":13,"Name":"ישיבת מליאה בתאריך 06/02/1995 בשעה 16:02","StartDate":"1995-02-06T16:02:00+02:00","FinishDate":"1995-02-07T00:07:00+02:00","IsSpecialMeeting":null,"LastUpdatedDate":"2025-02-16T12:55:06.897+02:00"}
{"Id":437399,"Number":310,"KnessetNum":13,"Name":"ישיבת מליאה בתאריך 08/02/1995 בשעה 11:02","StartDate":"1995-02-08T11:02:00+02:00","FinishDate":"1995-02-08T21:53:00+02:00","IsSpecialMeeting":null,"LastUpdatedDate":"2025-02-16T13:11:42.557+02:00"}
{"Id":437400,"Number":313,"KnessetNum":13,"Name":"ישיבת מליאה בתאריך 15/02/1995 בשעה 11:02","StartDate":"1995-02-15T11:02:00+02:00","FinishDate":"1995-02-15T19:41:00+02:00","IsSpecialMeeting":null,"LastUpdatedDate":"2025-02-16T13:16:47.52+02:00"}
{"Id":437401,"Number":315,"KnessetNum":13,"Name":"ישיבת מליאה בתאריך 21/02/1995 בשעה 15:02","StartDate":"1995-02-21T15:02:00+02:00","FinishDate":"1995-02-21T23:04:00+02:00","IsSpecialMeeting":null,"LastUpdatedDate":"2025-02-16T13:17:29.683+02:00"}
{"Id":437402,"Number":317,"KnessetNum":13,"Name":"ישיבת מליאה בתאריך 27/02/1995 בשעה 16:02","StartDate":"1995-02-27T16:02:00+02:00","FinishDate":"1995-02-27T20:35:00+02:00","IsSpecialMeeting":null,"LastUpdatedDate":"2025-02-16T13:19:16.217+02:00"}
{"Id":437403,"Number":318,"KnessetNum":13,"Name":"ישיבת מליאה בתאריך 28/02/1995 בשעה 15:01","StartDate":"1995-02-28T15:01:00+02:00","FinishDate":"1995-02-28T20:46:00+02:00","IsSpecialMeeting":null,"LastUpdatedDate":"2025-02-16T13:24:29.26+02:00"}
{"Id":437404,"Number":319,"KnessetNum":13,"Name":"ישיבת מליאה בתאריך 01/03/1995 בשעה 11:06","StartDate":"1995-03-01T11:06:00+02:00","FinishDate":"1995-03-01T20:01:00+02:00","IsSpecialMeeting":null,"LastUpdatedDate":"2025-02-16T13:25:14.047+02:00"}
{"Id":437405,"Number":320,"KnessetNum":13,"Name":"ישיבת מליאה בתאריך 06/03/1995 בשעה 16:01","StartDate":"1995-03-06T16:01:00+02:00","FinishDate":"1995-03-06T21:18:00+02:00","IsSpecialMeeting":null,"LastUpdatedDate":"2025-02-16T13:25:59.74+02:00"}
{"Id":437406,"Number":323,"KnessetNum":13,"Name":"ישיבת מליאה בתאריך 13/03/1995 בשעה 16:01","StartDate":"1995-03-13T16:01:00+02:00","FinishDate":"1995-03-13T21:20:00+02:00","IsSpecialMeeting":null,"LastUpdatedDate":"2025-02-16T13:32:47.76+02:00"}
{"Id":437407,"Number":324,"KnessetNum":13,"Name":"ישיבת מליאה בתאריך 14/03/1995 בשעה 15:02","StartDate":"1995-03-14T15:02:00+02:00","FinishDate":"1995-03-14T20:37:00+02:00","IsSpecialMeeting":null,"LastUpdatedDate":"2025-02-16T13:33:25.947+02:00"}
{"Id":437408,"Number":325,"KnessetNum":13,"Name":"ישיבת מליאה בתאריך 15/03/1995 בשעה 11:01","StartDate":"1995-03-15T11:01:00+02:00","FinishDate":"1995-03-15T13:56:00+02:00","IsSpecialMeeting":null,"LastUpdatedDate":"2025-02-16T13:34:24.2+02:00"}
{"Id":437409,"Number":326,"KnessetNum":13,"Name":"ישיבת מליאה בתאריך 20/03/1995 בשעה 16:03","StartDate":"1995-03-20T16:03:00+02:00","FinishDate":"1995-03-20T21:17:00+02:00","IsSpecialMeeting":null,"LastUpdatedDate":"2025-02-16T13:35:32.26+02:00"}
{"Id":437410,"Number":327,"KnessetNum":13,"Name":"ישיבת מליאה בתאריך 21/03/1995 בשעה 15:02","StartDate":"1995-03-21T15:02:00+02:00","FinishDate":"1995-03-21T20:55:00+02:00","IsSpecialMeeting":null,"LastUpdatedDate":"2025-02-16T14:13:50.987+02:00"}
{"Id":437411,"Number":328,"KnessetNum":13,"Name":"ישיבת מליאה בתאריך 22/03/1995 בשעה 11:02","StartDate":"1995-03-22T11:02:00+02:00","FinishDate":"1995-03-22T19:41:00+02:00","IsSpecialMeeting":null,"LastUpdatedDate":"2025-02-16T14:14:52.373+02:00"}
{"Id":437412,"Number":329,"KnessetNum":13,"Name":"ישיבת מליאה בתאריך 27/03/1995 בשעה 16:02","StartDate":"1995-03-27T16:02:00+02:00","FinishDate":"1995-03-27T23:05:00+02:00","IsSpecialMeeting":null,"LastUpdatedDate":"2025-02-16T14:19:10.493+02:00"}
{"Id":437413,"Number":331,"KnessetNum":13,"Name":"ישיבת מליאה בתאריך 29/03/1995 בשעה 11:00","StartDate":"1995-03-29T11:00:00+02:00","FinishDate":"1995-03-29T17:59:00+02:00","IsSpecialMeeting":null,"LastUpdatedDate":"2025-02-16T14:21:43.583+02:00"}
{"Id":437414,"Number":332,"KnessetNum":13,"Name":"ישיבת מליאה בתאריך 02/04/1995 בשעה 16:01","StartDate":"1995-04-02T16:01:00+02:00","FinishDate":"1995-04-02T23:10:00+02:00","IsSpecialMeeting":null,"LastUpdatedDate":"2025-02-16T14:30:04.193+02:00"}
{"Id":437415,"Number":334,"KnessetNum":13,"Name":"ישיבת מליאה בתאריך 04/04/1995 בשעה 11:00","StartDate":"1995-04-04T11:00:00+02:00","FinishDate":"1995-04-04T19:42:00+02:00","IsSpecialMeeting":null,"LastUpdatedDate":"2025-02-16T14:35:41.66+02:00"}
{"Id":437416,"Number":338,"KnessetNum":13,"Name":"ישיבת מליאה בתאריך 16/05/1995 בשעה 15:01","StartDate":"1995-05-16T15:01:00+03:00","FinishDate":"1995-05-16T20:42:00+03:00","IsSpecialMeeting":null,"LastUpdatedDate":"2025-02-16T14:38:27.41+02:00"}
{"Id":437417,"Number":339,"KnessetNum":13,"Name":"ישיבת מליאה בתאריך 17/05/1995 בשעה 11:00","StartDate":"1995-05-17T11:00:00+03:00","FinishDate":"1995-05-17T17:03:00+03:00","IsSpecialMeeting":null,"LastUpdatedDate":"2025-02-16T14:39:09.113+02:00"}
{"Id":437418,"Number":340,"KnessetNum":13,"Name":"ישיבת מליאה בתאריך 22/05/1995 בשעה 16:03","StartDate":"1995-05-22T16:03:00+03:00","FinishDate":"1995-05-22T19:45:00+03:00","IsSpecialMeeting":null,"LastUpdatedDate":"2025-02-16T14:39:48.927+02:00"}
{"Id":437419,"Number":341,"KnessetNum":13,"Name":"ישיבת מליאה בתאריך 23/05/1995 בשעה 15:01","StartDate":"1995-05-23T15:01:00+03:00","FinishDate":"1995-05-23T18:11:00+03:00","IsSpecialMeeting":null,"LastUpdatedDate":"2025-02-16T14:40:20.957+02:00"}
{"Id":437420,"Number":342,"KnessetNum":13,"Name":"ישיבת מליאה בתאריך 24/05/1995 בשעה 11:00","StartDate":"1995-05-24T11:00:00+03:00","FinishDate":"1995-05-24T19:31:00+03:00","IsSpecialMeeting":null,"LastUpdatedDate":"2025-02-16T14:50:14.74+02:00"}
{"Id":437421,"Number":343,"KnessetNum":13,"Name":"ישיבת מליאה בתאריך 29/05/1995 בשעה 16:03","StartDate":"1995-05-29T16:03:00+03:00","FinishDate":"1995-05-30T00:06:00+03:00","IsSpecialMeeting":null,"LastUpdatedDate":"2025-02-16T15:06:23.8+02:00"}
{"Id":437422,"Number":344,"KnessetNum":13,"Name":"ישיבת מליאה בתאריך 30/05/1995 בשעה 15:00","StartDate":"1995-05-30T15:00:00+03:00","FinishDate":"1995-05-30T20:13:00+03:00","IsSpecialMeeting":null,"LastUpdatedDate":"2025-02-16T15:08:09.837+02:00"}
{"Id":437423,"Number":345,"KnessetNum":13,"Name":"ישיבת מליאה בתאריך 31/05/1995 בשעה 11:02","StartDate":"1995-05-31T11:02:00+03:00","FinishDate":"1995-05-31T20:53:00+03:00","IsSpecialMeeting":null,"LastUpdatedDate":"2025-02-16T15:08:52.377+02:00"}
{"Id":437424,"Number":346,"KnessetNum":13,"Name":"ישיבת מליאה בתאריך 06/06/1995 בשעה 16:01","StartDate":"1995-06-06T16:01:00+03:00","FinishDate":"1995-06-06T20:23:00+03:00","IsSpecialMeeting":null,"LastUpdatedDate":"2025-02-16T15:09:55.19+02:00"}
{"Id":437425,"Number":347,"KnessetNum":13,"Name":"ישיבת מליאה בתאריך 07/06/1995 בשעה 15:00","StartDate":"1995-06-07T15:00:00+03:00","FinishDate":"1995-06-07T21:07:00+03:00","IsSpecialMeeting":null,"LastUpdatedDate":"2025-02-16T15:10:41.247+02:00"}
{"Id":437426,"Number":348,"KnessetNum":13,"Name":"ישיבת מליאה בתאריך 08/06/1995 בשעה 10:03","StartDate":"1995-06-08T10:03:00+03:00","FinishDate":"1995-06-08T16:05:00+03:00","IsSpecialMeeting":null,"LastUpdatedDate":"2025-02-16T15:11:19.33+02:00"}
{"Id":437427,"Number":350,"KnessetNum":13,"Name":"ישיבת מליאה בתאריך 13/06/1995 בשעה 15:00","StartDate":"1995-06-13T15:00:00+03:00","FinishDate":"1995-06-13T21:42:00+03:00","IsSpecialMeeting":null,"LastUpdatedDate":"2025-02-16T15:21:00.033+02:00"}
{"Id":437428,"Number":351,"KnessetNum":13,"Name":"ישיבת מליאה בתאריך 14/06/1995 בשעה 11:00","StartDate":"1995-06-14T11:00:00+03:00","FinishDate":"1995-06-14T20:04:00+03:00","IsSpecialMeeting":null,"LastUpdatedDate":"2020-04-30T16:12:47.933+03:00"}
{"Id":437429,"Number":354,"KnessetNum":13,"Name":"ישיבת מליאה בתאריך 21/06/1995 בשעה 11:02","StartDate":"1995-06-21T11:02:00+03:00","FinishDate":"1995-06-21T20:08:00+03:00","IsSpecialMeeting":null,"LastUpdatedDate":"2025-02-16T15:21:34.373+02:00"}
{"Id":437430,"Number":355,"KnessetNum":13,"Name":"ישיבת מליאה בתאריך 26/06/1995 בשעה 16:00","StartDate":"1995-06-26T16:00:00+03:00","FinishDate":"1995-06-26T20:34:00+03:00","IsSpecialMeeting":null,"LastUpdatedDate":"2025-02-16T15:22:58.563+02:00"}
{"Id":437431,"Number":357,"KnessetNum":13,"Name":"ישיבת מליאה בתאריך 28/06/1995 בשעה 11:00","StartDate":"1995-06-28T11:00:00+03:00","FinishDate":"1995-06-28T21:59:00+03:00","IsSpecialMeeting":null,"LastUpdatedDate":"2025-02-16T15:24:44.867+02:00"}
{"Id":437432,"Number":358,"KnessetNum":13,"Name":"ישיבת מליאה בתאריך 03/07/1995 בשעה 16:01","StartDate":"1995-07-03T16:01:00+03:00","FinishDate":"1995-07-03T21:10:00+03:00","IsSpecialMeeting":null,"LastUpdatedDate":"2025-02-16T15:25:46.067+02:00"}
{"Id":437433,"Number":359,"KnessetNum":13,"Name":"ישיבת מליאה בתאריך 04/07/1995 בשעה 15:03","StartDate":"1995-07-04T15:03:00+03:00","FinishDate":"1995-07-04T22:20:00+03:00","IsSpecialMeeting":null,"LastUpdatedDate":"2025-02-16T15:26:25.613+02:00"}
{"Id":437434,"Number":363,"KnessetNum":13,"Name":"ישיבת מליאה בתאריך 12/07/1995 בשעה 11:01","StartDate":"1995-07-12T11:01:00+03:00","FinishDate":"1995-07-12T20:14:00+03:00","IsSpecialMeeting":null,"LastUpdatedDate":"2025-02-16T16:04:06.8+02:00"}
{"Id":437435,"Number":364,"KnessetNum":13,"Name":"ישיבת מליאה בתאריך 17/07/1995 בשעה 16:00","StartDate":"1995-07-17T16:00:00+03:00","FinishDate":"1995-07-17T20:00:00+03:00","IsSpecialMeeting":null,"LastUpdatedDate":"2025-02-16T16:04:48.89+02:00"}
{"Id":437436,"Number":365,"KnessetNum":13,"Name":"ישיבת מליאה בתאריך 18/07/1995 בשעה 15:01","StartDate":"1995-07-18T15:01:00+03:00","FinishDate":"1995-07-18T22:17:00+03:00","IsSpecialMeeting":null,"LastUpdatedDate":"2025-02-16T16:05:32.863+02:00"}
{"Id":437437,"Number":366,"KnessetNum":13,"Name":"ישיבת מליאה בתאריך 19/07/1995 בשעה 11:04","StartDate":"1995-07-19T11:04:00+03:00","FinishDate":"1995-07-19T20:37:00+03:00","IsSpecialMeeting":null,"LastUpdatedDate":"2025-02-16T16:06:16.697+02:00"}
{"Id":437439,"Number":368,"KnessetNum":13,"Name":"ישיבת מליאה בתאריך 25/07/1995 בשעה 15:00","StartDate":"1995-07-25T15:00:00+03:00","FinishDate":"1995-07-26T03:05:00+03:00","IsSpecialMeeting":null,"LastUpdatedDate":"2025-02-16T16:07:58.083+02:00"}
{"Id":437440,"Number":370,"KnessetNum":13,"Name":"ישיבת מליאה בתאריך 31/07/1995 בשעה 16:01","StartDate":"1995-07-31T16:01:00+03:00","FinishDate":"1995-08-01T01:24:00+03:00","IsSpecialMeeting":null,"LastUpdatedDate":"2025-02-16T16:11:35.577+02:00"}
{"Id":437441,"Number":378,"KnessetNum":13,"Name":"ישיבת מליאה בתאריך 24/10/1995 בשעה 15:02","StartDate":"1995-10-24T15:02:00+02:00","FinishDate":"1995-10-24T21:02:00+02:00","IsSpecialMeeting":null,"LastUpdatedDate":"2025-02-16T16:20:16.25+02:00"}
{"Id":437442,"Number":379,"KnessetNum":13,"Name":"ישיבת מליאה בתאריך 25/10/1995 בשעה 11:01","StartDate":"1995-10-25T11:01:00+02:00","FinishDate":"1995-10-25T21:19:00+02:00","IsSpecialMeeting":null,"LastUpdatedDate":"2025-02-16T16:20:55.043+02:00"}
{"Id":437443,"Number":382,"KnessetNum":13,"Name":"ישיבת מליאה בתאריך 01/11/1995 בשעה 10:00","StartDate":"1995-11-01T10:00:00+02:00","FinishDate":"1995-11-01T16:45:00+02:00","IsSpecialMeeting":null,"LastUpdatedDate":"2025-02-23T08:44:48.823+02:00"}
{"Id":437444,"Number":383,"KnessetNum":13,"Name":"ישיבת מליאה בתאריך 13/11/1995 בשעה 16:00","StartDate":"1995-11-13T16:00:00+02:00","FinishDate":"1995-11-13T16:50:00+02:00","IsSpecialMeeting":null,"LastUpdatedDate":"2025-02-23T08:48:53.443+02:00"}
{"Id":437445,"Number":385,"KnessetNum":13,"Name":"ישיבת מליאה בתאריך 15/11/1995 בשעה 11:01","StartDate":"1995-11-15T11:01:00+02:00","FinishDate":"1995-11-15T17:26:00+02:00","IsSpecialMeeting":null,"LastUpdatedDate":"2025-02-23T08:59:48.113+02:00"}
{"Id":437446,"Number":386,"KnessetNum":13,"Name":"ישיבת מליאה בתאריך 20/11/1995 בשעה 16:01","StartDate":"1995-11-20T16:01:00+02:00","FinishDate":"1995-11-20T21:02:00+02:00","IsSpecialMeeting":null,"LastUpdatedDate":"2025-02-23T09:22:33.44+02:00"}
{"Id":437447,"Number":387,"KnessetNum":13,"Name":"ישיבת מליאה בתאריך 21/11/1995 בשעה 15:00","StartDate":"1995-11-21T15:00:00+02:00","FinishDate":"1995-11-21T19:28:00+02:00","IsSpecialMeeting":null,"LastUpdatedDate":"2025-02-23T09:23:13.247+02:00"}
{"Id":437448,"Number":389,"KnessetNum":13,"Name":"ישיבת מליאה בתאריך 27/11/1995 בשעה 16:02","StartDate":"1995-11-27T16:02:00+02:00","FinishDate":"1995-11-27T23:46:00+02:00","IsSpecialMeeting":null,"LastUpdatedDate":"2025-02-23T09:27:01.167+02:00"}
{"Id":437449,"Number":391,"KnessetNum":13,"Name":"ישיבת מליאה בתאריך 29/11/1995 בשעה 11:00","StartDate":"1995-11-29T11:00:00+02:00","FinishDate":"1995-11-29T20:20:00+02:00","IsSpecialMeeting":null,"LastUpdatedDate":"2025-02-23T09:34:27.39+02:00"}
{"Id":437450,"Number":392,"KnessetNum":13,"Name":"ישיבת מליאה בתאריך 04/12/1995 בשעה 15:31","StartDate":"1995-12-04T15:31:00+02:00","FinishDate":"1995-12-04T23:33:00+02:00","IsSpecialMeeting":null,"LastUpdatedDate":"2025-02-23T09:36:43.25+02:00"}
{"Id":437451,"Number":394,"KnessetNum":13,"Name":"ישיבת מליאה בתאריך 06/12/1995 בשעה 11:01","StartDate":"1995-12-06T11:01:00+02:00","FinishDate":"1995-12-06T19:55:00+02:00","IsSpecialMeeting":null,"LastUpdatedDate":"2025-02-23T10:05:49.31+02:00"}
{"Id":437452,"Number":395,"KnessetNum":13,"Name":"ישיבת מליאה בתאריך 11/12/1995 בשעה 16:04","StartDate":"1995-12-11T16:04:00+02:00","FinishDate":"1995-12-11T19:54:00+02:00","IsSpecialMeeting":null,"LastUpdatedDate":"2025-02-23T10:07:01.68+02:00"}
{"Id":437453,"Number":399,"KnessetNum":13,"Name":"ישיבת מליאה בתאריך 19/12/1995 בשעה 13:59","StartDate":"1995-12-19T13:59:00+02:00","FinishDate":"1995-12-19T16:43:00+02:00","IsSpecialMeeting":null,"LastUpdatedDate":"2025-02-23T10:19:44.4+02:00"}
{"Id":437455,"Number":402,"KnessetNum":13,"Name":"ישיבת מליאה בתאריך 01/01/1996 בשעה 16:00","StartDate":"1996-01-01T16:00:00+02:00","FinishDate":"1996-01-01T23:01:00+02:00","IsSpecialMeeting":null,"LastUpdatedDate":"2025-02-23T11:17:54.647+02:00"}
{"Id":437456,"Number":403,"KnessetNum":13,"Name":"ישיבת מליאה בתאריך 02/01/1996 בשעה 15:03","StartDate":"1996-01-02T15:03:00+02:00","FinishDate":"1996-01-02T21:56:00+02:00","IsSpecialMeeting":null,"LastUpdatedDate":"2025-02-23T11:18:33.857+02:00"}
{"Id":437457,"Number":405,"KnessetNum":13,"Name":"ישיבת מליאה בתאריך 08/01/1996 בשעה 16:02","StartDate":"1996-01-08T16:02:00+02:00","FinishDate":"1996-01-08T23:13:00+02:00","IsSpecialMeeting":null,"LastUpdatedDate":"2025-02-23T11:31:45.717+02:00"}
{"Id":437458,"Number":406,"KnessetNum":13,"Name":"ישיבת מליאה בתאריך 09/01/1996 בשעה 15:02","StartDate":"1996-01-09T15:02:00+02:00","FinishDate":"1996-01-09T20:50:00+02:00","IsSpecialMeeting":null,"LastUpdatedDate":"2025-02-23T11:33:23.13+02:00"}
{"Id":437459,"Number":408,"KnessetNum":13,"Name":"ישיבת מליאה בתאריך 15/01/1996 בשעה 10:02","StartDate":"1996-01-15T10:02:00+02:00","FinishDate":"1996-01-16T00:01:00+02:00","IsSpecialMeeting":null,"LastUpdatedDate":"2025-02-23T11:36:44.227+02:00"}
{"Id":437460,"Number":413,"KnessetNum":13,"Name":"ישיבת מליאה בתאריך 24/01/1996 בשעה 11:02","StartDate":"1996-01-24T11:02:00+02:00","FinishDate":"1996-01-24T17:10:00+02:00","IsSpecialMeeting":null,"LastUpdatedDate":"2025-02-23T11:46:28.043+02:00"}
{"Id":437461,"Number":415,"KnessetNum":13,"Name":"ישיבת מליאה בתאריך 30/01/1996 בשעה 15:00","StartDate":"1996-01-30T15:00:00+02:00","FinishDate":"1996-01-30T19:40:00+02:00","IsSpecialMeeting":null,"LastUpdatedDate":"2025-02-23T11:47:54.48+02:00"}
{"Id":437462,"Number":416,"KnessetNum":13,"Name":"ישיבת מליאה בתאריך 31/01/1996 בשעה 11:01","StartDate":"1996-01-31T11:01:00+02:00","FinishDate":"1996-01-31T21:14:00+02:00","IsSpecialMeeting":null,"LastUpdatedDate":"2025-02-23T11:48:55.517+02:00"}
{"Id":437463,"Number":419,"KnessetNum":13,"Name":"ישיבת מליאה בתאריך 07/02/1996 בשעה 11:02","StartDate":"1996-02-07T11:02:00+02:00","FinishDate":"1996-02-07T17:47:00+02:00","IsSpecialMeeting":null,"LastUpdatedDate":"2025-02-23T11:51:41.747+02:00"}
{"Id":437464,"Number":420,"KnessetNum":13,"Name":"ישיבת מליאה בתאריך 12/02/1996 בשעה 16:01","StartDate":"1996-02-12T16:01:00+02:00","FinishDate":"1996-02-12T19:00:00+02:00","IsSpecialMeeting":null,"LastUpdatedDate":"2025-02-23T11:53:24.407+02:00"}
{"Id":437465,"Number":424,"KnessetNum":13,"Name":"ישיבת מליאה בתאריך 20/02/1996 בשעה 15:00","StartDate":"1996-02-20T15:00:00+02:00","FinishDate":"1996-02-20T17:53:00+02:00","IsSpecialMeeting":null,"LastUpdatedDate":"2019-12-16T11:37:06.98+02:00"}
{"Id":437467,"Number":433,"KnessetNum":13,"Name":"ישיבת מליאה בתאריך 13/03/1996 בשעה 11:02","StartDate":"1996-03-13T11:02:00+02:00","FinishDate":"1996-03-14T00:38:00+02:00","IsSpecialMeeting":null,"LastUpdatedDate":"2025-02-23T12:24:07.633+02:00"}
{"Id":437468,"Number":436,"KnessetNum":13,"Name":"ישיבת מליאה בתאריך 20/05/1996 בשעה 11:00","StartDate":"1996-05-20T11:00:00+03:00","FinishDate":"1996-05-20T13:28:00+03:00","IsSpecialMeeting":true,"LastUpdatedDate":"2025-02-23T12:37:55.027+02:00"}
{"Id":437469,"Number":9,"KnessetNum":14,"Name":"ישיבת מליאה בתאריך 09/07/1996 בשעה 16:02","StartDate":"1996-07-09T16:02:00+03:00","FinishDate":"1996-07-09T20:51:00+03:00","IsSpecialMeeting":null,"LastUpdatedDate":"2025-02-23T13:48:04.583+02:00"}
{"Id":437470,"Number":12,"KnessetNum":14,"Name":"ישיבת מליאה בתאריך 16/07/1996 בשעה 16:02","StartDate":"1996-07-16T16:02:00+03:00","FinishDate":"1996-07-16T20:56:00+03:00","IsSpecialMeeting":null,"LastUpdatedDate":"2025-02-23T13:55:19.837+02:00"}
{"Id":437471,"Number":14,"KnessetNum":14,"Name":"ישיבת מליאה בתאריך 22/07/1996 בשעה 16:03","StartDate":"1996-07-22T16:03:00+03:00","FinishDate":"1996-07-22T19:50:00+03:00","IsSpecialMeeting":null,"LastUpdatedDate":"2025-02-23T13:58:38.267+02:00"}
{"Id":437472,"Number":17,"KnessetNum":14,"Name":"ישיבת מליאה בתאריך 13/08/1996 בשעה 10:02","StartDate":"1996-08-13T10:02:00+03:00","FinishDate":"1996-08-13T16:03:00+03:00","IsSpecialMeeting":true,"LastUpdatedDate":"2025-02-23T14:03:26.57+02:00"}
{"Id":437474,"Number":20,"KnessetNum":14,"Name":"ישיבת מליאה בתאריך 07/10/1996 בשעה 16:02","StartDate":"1996-10-07T16:02:00+02:00","FinishDate":"1996-10-07T20:47:00+02:00","IsSpecialMeeting":null,"LastUpdatedDate":"2020-06-11T15:09:02.003+03:00"}
{"Id":437475,"Number":22,"KnessetNum":14,"Name":"ישיבת מליאה בתאריך 09/10/1996 בשעה 11:02","StartDate":"1996-10-09T11:02:00+02:00","FinishDate":"1996-10-09T14:22:00+02:00","IsSpecialMeeting":null,"LastUpdatedDate":"2025-02-23T14:06:46.497+02:00"}
{"Id":437476,"Number":23,"KnessetNum":14,"Name":"ישיבת מליאה בתאריך 14/10/1996 בשעה 16:02","StartDate":"1996-10-14T16:02:00+02:00","FinishDate":"1996-10-14T19:34:00+02:00","IsSpecialMeeting":null,"LastUpdatedDate":"2025-02-23T14:07:15.763+02:00"}
{"Id":437477,"Number":24,"KnessetNum":14,"Name":"ישיבת מליאה בתאריך 15/10/1996 בשעה 16:02","StartDate":"1996-10-15T16:02:00+02:00","FinishDate":"1996-10-15T20:44:00+02:00","IsSpecialMeeting":null,"LastUpdatedDate":"2020-06-11T15:07:40.537+03:00"}
{"Id":437478,"Number":25,"KnessetNum":14,"Name":"ישיבת מליאה בתאריך 16/10/1996 בשעה 11:02","StartDate":"1996-10-16T11:02:00+02:00","FinishDate":"1996-10-16T21:12:00+02:00","IsSpecialMeeting":null,"LastUpdatedDate":"2025-02-23T14:08:03.303+02:00"}
{"Id":437479,"Number":26,"KnessetNum":14,"Name":"ישיבת מליאה בתאריך 21/10/1996 בשעה 16:01","StartDate":"1996-10-21T16:01:00+02:00","FinishDate":"1996-10-21T21:52:00+02:00","IsSpecialMeeting":null,"LastUpdatedDate":"2025-02-23T14:08:38.32+02:00"}
{"Id":437480,"Number":27,"KnessetNum":14,"Name":"ישיבת מליאה בתאריך 22/10/1996 בשעה 16:26","StartDate":"1996-10-22T16:26:00+02:00","FinishDate":"1996-10-22T19:51:00+02:00","IsSpecialMeeting":null,"LastUpdatedDate":"2025-02-23T14:09:18.793+02:00"}
{"Id":437481,"Number":28,"KnessetNum":14,"Name":"ישיבת מליאה בתאריך 23/10/1996 בשעה 11:03","StartDate":"1996-10-23T11:03:00+02:00","FinishDate":"1996-10-23T21:58:00+02:00","IsSpecialMeeting":null,"LastUpdatedDate":"2025-02-23T14:20:44.623+02:00"}
{"Id":437482,"Number":30,"KnessetNum":14,"Name":"ישיבת מליאה בתאריך 28/10/1996 בשעה 16:03","StartDate":"1996-10-28T16:03:00+02:00","FinishDate":"1996-10-28T21:25:00+02:00","IsSpecialMeeting":null,"LastUpdatedDate":"2020-06-10T15:45:37.693+03:00"}
{"Id":437483,"Number":32,"KnessetNum":14,"Name":"ישיבת מליאה בתאריך 30/10/1996 בשעה 09:04","StartDate":"1996-10-30T09:04:00+02:00","FinishDate":"1996-10-30T18:48:00+02:00","IsSpecialMeeting":null,"LastUpdatedDate":"2025-02-23T14:23:05.443+02:00"}
{"Id":437484,"Number":33,"KnessetNum":14,"Name":"ישיבת מליאה בתאריך 04/11/1996 בשעה 16:03","StartDate":"1996-11-04T16:03:00+02:00","FinishDate":"1996-11-04T17:59:00+02:00","IsSpecialMeeting":null,"LastUpdatedDate":"2025-02-23T14:24:25.443+02:00"}
{"Id":437485,"Number":35,"KnessetNum":14,"Name":"ישיבת מליאה בתאריך 06/11/1996 בשעה 11:01","StartDate":"1996-11-06T11:01:00+02:00","FinishDate":"1996-11-06T19:13:00+02:00","IsSpecialMeeting":null,"LastUpdatedDate":"2025-02-23T14:25:28.217+02:00"}
{"Id":437486,"Number":36,"KnessetNum":14,"Name":"ישיבת מליאה בתאריך 11/11/1996 בשעה 16:03","StartDate":"1996-11-11T16:03:00+02:00","FinishDate":"1996-11-11T21:48:00+02:00","IsSpecialMeeting":null,"LastUpdatedDate":"2025-02-23T14:26:00.35+02:00"}
{"Id":437487,"Number":37,"KnessetNum":14,"Name":"ישיבת מליאה בתאריך 12/11/1996 בשעה 16:02","StartDate":"1996-11-12T16:02:00+02:00","FinishDate":"1996-11-12T19:42:00+02:00","IsSpecialMeeting":null,"LastUpdatedDate":"2020-06-11T15:04:34.503+03:00"}
{"Id":437488,"Number":38,"KnessetNum":14,"Name":"ישיבת מליאה בתאריך 13/11/1996 בשעה 11:03","StartDate":"1996-11-13T11:03:00+02:00","FinishDate":"1996-11-13T19:42:00+02:00","IsSpecialMeeting":null,"LastUpdatedDate":"2025-02-23T14:27:08.28+02:00"}
{"Id":437489,"Number":39,"KnessetNum":14,"Name":"ישיבת מליאה בתאריך 18/11/1996 בשעה 16:04","StartDate":"1996-11-18T16:04:00+02:00","FinishDate":"1996-11-18T19:27:00+02:00","IsSpecialMeeting":null,"LastUpdatedDate":"2025-02-23T14:27:42.3+02:00"}
{"Id":437490,"Number":40,"KnessetNum":14,"Name":"ישיבת מליאה בתאריך 19/11/1996 בשעה 16:03","StartDate":"1996-11-19T16:03:00+02:00","FinishDate":"1996-11-19T20:33:00+02:00","IsSpecialMeeting":null,"LastUpdatedDate":"2025-02-23T14:28:13.81+02:00"}
{"Id":437491,"Number":41,"KnessetNum":14,"Name":"ישיבת מליאה בתאריך 20/11/1996 בשעה 11:02","StartDate":"1996-11-20T11:02:00+02:00","FinishDate":"1996-11-20T22:07:00+02:00","IsSpecialMeeting":null,"LastUpdatedDate":"2025-02-23T14:29:04.697+02:00"}
{"Id":437492,"Number":43,"KnessetNum":14,"Name":"ישיבת מליאה בתאריך 26/11/1996 בשעה 16:03","StartDate":"1996-11-26T16:03:00+02:00","FinishDate":"1996-11-26T19:35:00+02:00","IsSpecialMeeting":null,"LastUpdatedDate":"2025-02-23T14:29:40.6+02:00"}
{"Id":437493,"Number":45,"KnessetNum":14,"Name":"ישיבת מליאה בתאריך 02/12/1996 בשעה 16:02","StartDate":"1996-12-02T16:02:00+02:00","FinishDate":"1996-12-02T18:42:00+02:00","IsSpecialMeeting":null,"LastUpdatedDate":"2025-02-23T14:30:55.033+02:00"}
{"Id":437494,"Number":48,"KnessetNum":14,"Name":"ישיבת מליאה בתאריך 09/12/1996 בשעה 15:01","StartDate":"1996-12-09T15:01:00+02:00","FinishDate":"1996-12-09T18:15:00+02:00","IsSpecialMeeting":null,"LastUpdatedDate":"2025-02-23T14:32:48.2+02:00"}
{"Id":437495,"Number":50,"KnessetNum":14,"Name":"ישיבת מליאה בתאריך 11/12/1996 בשעה 11:04","StartDate":"1996-12-11T11:04:00+02:00","FinishDate":"1996-12-11T17:18:00+02:00","IsSpecialMeeting":null,"LastUpdatedDate":"2025-02-23T14:34:21.76+02:00"}
{"Id":437496,"Number":53,"KnessetNum":14,"Name":"ישיבת מליאה בתאריך 18/12/1996 בשעה 11:02","StartDate":"1996-12-18T11:02:00+02:00","FinishDate":"1996-12-18T21:09:00+02:00","IsSpecialMeeting":null,"LastUpdatedDate":"2025-02-23T14:53:06.2+02:00"}
{"Id":437497,"Number":54,"KnessetNum":14,"Name":"ישיבת מליאה בתאריך 23/12/1996 בשעה 16:03","StartDate":"1996-12-23T16:03:00+02:00","FinishDate":"1996-12-25T17:00:00+02:00","IsSpecialMeeting":null,"LastUpdatedDate":"2024-02-22T16:45:48.037+02:00"}
{"Id":437498,"Number":55,"KnessetNum":14,"Name":"ישיבת מליאה בתאריך 30/12/1996 בשעה 10:04","StartDate":"1996-12-30T10:04:00+02:00","FinishDate":"1996-12-31T04:56:00+02:00","IsSpecialMeeting":null,"LastUpdatedDate":"2020-01-12T15:40:51.657+02:00"}
{"Id":437500,"Number":57,"KnessetNum":14,"Name":"ישיבת מליאה בתאריך 07/01/1997 בשעה 16:03","StartDate":"1997-01-07T16:03:00+02:00","FinishDate":"1997-01-07T19:25:00+02:00","IsSpecialMeeting":null,"LastUpdatedDate":"2025-02-23T15:00:25.857+02:00"}
{"Id":437501,"Number":58,"KnessetNum":14,"Name":"ישיבת מליאה בתאריך 08/01/1997 בשעה 11:03","StartDate":"1997-01-08T11:03:00+02:00","FinishDate":"1997-01-08T17:37:00+02:00","IsSpecialMeeting":null,"LastUpdatedDate":"2025-02-23T15:03:52.813+02:00"}
{"Id":437502,"Number":63,"KnessetNum":14,"Name":"ישיבת מליאה בתאריך 20/01/1997 בשעה 16:04","StartDate":"1997-01-20T16:04:00+02:00","FinishDate":"1997-01-20T21:12:00+02:00","IsSpecialMeeting":null,"LastUpdatedDate":"2025-02-23T15:35:46.337+02:00"}
{"Id":437503,"Number":66,"KnessetNum":14,"Name":"ישיבת מליאה בתאריך 27/01/1997 בשעה 16:03","StartDate":"1997-01-27T16:03:00+02:00","FinishDate":"1997-01-27T20:08:00+02:00","IsSpecialMeeting":null,"LastUpdatedDate":"2021-12-26T12:48:14.2+02:00"}
{"Id":437504,"Number":72,"KnessetNum":14,"Name":"ישיבת מליאה בתאריך 10/02/1997 בשעה 16:03","StartDate":"1997-02-10T16:03:00+02:00","FinishDate":"1997-02-10T22:14:00+02:00","IsSpecialMeeting":null,"LastUpdatedDate":"2025-02-23T15:45:03.397+02:00"}
{"Id":437505,"Number":73,"KnessetNum":14,"Name":"ישיבת מליאה בתאריך 11/02/1997 בשעה 16:02","StartDate":"1997-02-11T16:02:00+02:00","FinishDate":"1997-02-11T19:50:00+02:00","IsSpecialMeeting":null,"LastUpdatedDate":"2025-02-23T15:45:51.743+02:00"}
{"Id":437506,"Number":74,"KnessetNum":14,"Name":"ישיבת מליאה בתאריך 12/02/1997 בשעה 11:03","StartDate":"1997-02-12T11:03:00+02:00","FinishDate":"1997-02-12T17:16:00+02:00","IsSpecialMeeting":null,"LastUpdatedDate":"2025-02-23T15:49:09.233+02:00"}
{"Id":437507,"Number":75,"KnessetNum":14,"Name":"ישיבת מליאה בתאריך 17/02/1997 בשעה 16:05","StartDate":"1997-02-17T16:05:00+02:00","FinishDate":"1997-02-17T20:40:00+02:00","IsSpecialMeeting":null,"LastUpdatedDate":"2025-02-23T15:50:31.54+02:00"}
{"Id":437508,"Number":76,"KnessetNum":14,"Name":"ישיבת מליאה בתאריך 18/02/1997 בשעה 16:00","StartDate":"1997-02-18T16:00:00+02:00","FinishDate":"1997-02-18T21:00:00+02:00","IsSpecialMeeting":null,"LastUpdatedDate":"2025-02-24T08:41:53.03+02:00"}
{"Id":437509,"Number":79,"KnessetNum":14,"Name":"ישיבת מליאה בתאריך 25/02/1997 בשעה 16:01","StartDate":"1997-02-25T16:01:00+02:00","FinishDate":"1997-02-25T21:46:00+02:00","IsSpecialMeeting":null,"LastUpdatedDate":"2025-02-24T08:46:32.107+02:00"}
{"Id":437510,"Number":80,"KnessetNum":14,"Name":"ישיבת מליאה בתאריך 26/02/1997 בשעה 11:01","StartDate":"1997-02-26T11:01:00+02:00","FinishDate":"1997-02-26T17:32:00+02:00","IsSpecialMeeting":null,"LastUpdatedDate":"2025-02-24T08:47:04.32+02:00"}
{"Id":437511,"Number":81,"KnessetNum":14,"Name":"ישיבת מליאה בתאריך 03/03/1997 בשעה 16:03","StartDate":"1997-03-03T16:03:00+02:00","FinishDate":"1997-03-03T22:23:00+02:00","IsSpecialMeeting":null,"LastUpdatedDate":"2025-02-24T08:47:49.503+02:00"}
{"Id":437513,"Number":98,"KnessetNum":14,"Name":"ישיבת מליאה בתאריך 19/05/1997 בשעה 16:03","StartDate":"1997-05-19T16:03:00+03:00","FinishDate":"1997-05-19T22:08:00+03:00","IsSpecialMeeting":null,"LastUpdatedDate":"2020-06-11T14:16:37.48+03:00"}
{"Id":437514,"Number":101,"KnessetNum":14,"Name":"ישיבת מליאה בתאריך 26/05/1997 בשעה 16:03","StartDate":"1997-05-26T16:03:00+03:00","FinishDate":"1997-05-26T21:31:00+03:00","IsSpecialMeeting":null,"LastUpdatedDate":"2025-02-24T10:20:09.043+02:00"}
{"Id":437515,"Number":102,"KnessetNum":14,"Name":"ישיבת מליאה בתאריך 27/05/1997 בשעה 16:03","StartDate":"1997-05-27T16:03:00+03:00","FinishDate":"1997-05-27T20:32:00+03:00","IsSpecialMeeting":null,"LastUpdatedDate":"2025-02-24T10:20:50.743+02:00"}
{"Id":437516,"Number":109,"KnessetNum":14,"Name":"ישיבת מליאה בתאריך 17/06/1997 בשעה 16:01","StartDate":"1997-06-17T16:01:00+03:00","FinishDate":"1997-06-17T20:23:00+03:00","IsSpecialMeeting":null,"LastUpdatedDate":"2025-02-24T10:25:18.173+02:00"}
{"Id":437517,"Number":112,"KnessetNum":14,"Name":"ישיבת מליאה בתאריך 24/06/1997 בשעה 16:03","StartDate":"1997-06-24T16:03:00+03:00","FinishDate":"1997-06-25T00:13:00+03:00","IsSpecialMeeting":null,"LastUpdatedDate":"2019-12-26T13:33:45.227+02:00"}
{"Id":437518,"Number":114,"KnessetNum":14,"Name":"ישיבת מליאה בתאריך 30/06/1997 בשעה 16:01","StartDate":"1997-06-30T16:01:00+03:00","FinishDate":"1997-06-30T20:14:00+03:00","IsSpecialMeeting":null,"LastUpdatedDate":"2025-02-24T10:38:28.78+02:00"}
{"Id":437519,"Number":118,"KnessetNum":14,"Name":"ישיבת מליאה בתאריך 08/07/1997 בשעה 16:02","StartDate":"1997-07-08T16:02:00+03:00","FinishDate":"1997-07-08T18:32:00+03:00","IsSpecialMeeting":null,"LastUpdatedDate":"2019-12-26T13:32:57.333+02:00"}
{"Id":437520,"Number":120,"KnessetNum":14,"Name":"ישיבת מליאה בתאריך 14/07/1997 בשעה 16:04","StartDate":"1997-07-14T16:04:00+03:00","FinishDate":"1997-07-14T20:15:00+03:00","IsSpecialMeeting":null,"LastUpdatedDate":"2025-02-24T10:42:20.6+02:00"}
{"Id":437521,"Number":121,"KnessetNum":14,"Name":"ישיבת מליאה בתאריך 15/07/1997 בשעה 16:01","StartDate":"1997-07-15T16:01:00+03:00","FinishDate":"1997-07-15T21:22:00+03:00","IsSpecialMeeting":null,"LastUpdatedDate":"2025-02-24T10:43:03.79+02:00"}
{"Id":437522,"Number":123,"KnessetNum":14,"Name":"ישיבת מליאה בתאריך 21/07/1997 בשעה 16:02","StartDate":"1997-07-21T16:02:00+03:00","FinishDate":"1997-07-21T23:54:00+03:00","IsSpecialMeeting":null,"LastUpdatedDate":"2025-02-24T11:11:34.777+02:00"}
{"Id":437523,"Number":124,"KnessetNum":14,"Name":"ישיבת מליאה בתאריך 22/07/1997 בשעה 16:03","StartDate":"1997-07-22T16:03:00+03:00","FinishDate":"1997-07-22T22:29:00+03:00","IsSpecialMeeting":null,"LastUpdatedDate":"2025-02-24T11:12:40.443+02:00"}
{"Id":437524,"Number":125,"KnessetNum":14,"Name":"ישיבת מליאה בתאריך 23/07/1997 בשעה 11:03","StartDate":"1997-07-23T11:03:00+03:00","FinishDate":"1997-07-23T18:08:00+03:00","IsSpecialMeeting":null,"LastUpdatedDate":"2025-02-24T11:13:58.63+02:00"}
{"Id":437525,"Number":126,"KnessetNum":14,"Name":"ישיבת מליאה בתאריך 28/07/1997 בשעה 16:08","StartDate":"1997-07-28T16:08:00+03:00","FinishDate":"1997-07-29T00:13:00+03:00","IsSpecialMeeting":null,"LastUpdatedDate":"2025-02-24T11:16:56.097+02:00"}
{"Id":437526,"Number":127,"KnessetNum":14,"Name":"ישיבת מליאה בתאריך 29/07/1997 בשעה 16:03","StartDate":"1997-07-29T16:03:00+03:00","FinishDate":"1997-07-30T02:15:00+03:00","IsSpecialMeeting":null,"LastUpdatedDate":"2025-02-24T11:18:12.097+02:00"}
{"Id":437527,"Number":128,"KnessetNum":14,"Name":"ישיבת מליאה בתאריך 30/07/1997 בשעה 10:05","StartDate":"1997-07-30T10:05:00+03:00","FinishDate":"1997-07-30T14:09:00+03:00","IsSpecialMeeting":null,"LastUpdatedDate":"2025-02-24T11:19:16.767+02:00"}
{"Id":437529,"Number":134,"KnessetNum":14,"Name":"ישיבת מליאה בתאריך 27/10/1997 בשעה 16:03","StartDate":"1997-10-27T16:03:00+02:00","FinishDate":"1997-10-27T20:48:00+02:00","IsSpecialMeeting":null,"LastUpdatedDate":"2025-02-24T11:23:36.323+02:00"}
{"Id":437530,"Number":137,"KnessetNum":14,"Name":"ישיבת מליאה בתאריך 03/11/1997 בשעה 16:03","StartDate":"1997-11-03T16:03:00+02:00","FinishDate":"1997-11-03T20:50:00+02:00","IsSpecialMeeting":null,"LastUpdatedDate":"2025-02-24T11:25:40.503+02:00"}
{"Id":437531,"Number":139,"KnessetNum":14,"Name":"ישיבת מליאה בתאריך 05/11/1997 בשעה 11:01","StartDate":"1997-11-05T11:01:00+02:00","FinishDate":"1997-11-05T20:00:00+02:00","IsSpecialMeeting":null,"LastUpdatedDate":"2025-02-24T11:27:13.35+02:00"}
{"Id":437532,"Number":146,"KnessetNum":14,"Name":"ישיבת מליאה בתאריך 19/11/1997 בשעה 11:05","StartDate":"1997-11-19T11:05:00+02:00","FinishDate":"1997-11-19T20:02:00+02:00","IsSpecialMeeting":null,"LastUpdatedDate":"2025-02-24T11:31:01.72+02:00"}
{"Id":437533,"Number":147,"KnessetNum":14,"Name":"ישיבת מליאה בתאריך 24/11/1997 בשעה 16:02","StartDate":"1997-11-24T16:02:00+02:00","FinishDate":"1997-11-24T21:39:00+02:00","IsSpecialMeeting":null,"LastUpdatedDate":"2020-06-11T13:49:41.793+03:00"}
{"Id":437534,"Number":153,"KnessetNum":14,"Name":"ישיבת מליאה בתאריך 08/12/1997 בשעה 16:02","StartDate":"1997-12-08T16:02:00+02:00","FinishDate":"1997-12-08T20:52:00+02:00","IsSpecialMeeting":null,"LastUpdatedDate":"2025-02-24T11:36:21.52+02:00"}
{"Id":437535,"Number":156,"KnessetNum":14,"Name":"ישיבת מליאה בתאריך 15/12/1997 בשעה 16:04","StartDate":"1997-12-15T16:04:00+02:00","FinishDate":"1997-12-15T21:07:00+02:00","IsSpecialMeeting":null,"LastUpdatedDate":"2025-02-24T11:37:29.897+02:00"}
{"Id":437536,"Number":157,"KnessetNum":14,"Name":"ישיבת מליאה בתאריך 16/12/1997 בשעה 16:03","StartDate":"1997-12-16T16:03:00+02:00","FinishDate":"1997-12-16T20:01:00+02:00","IsSpecialMeeting":null,"LastUpdatedDate":"2025-02-24T11:38:02.35+02:00"}
{"Id":437539,"Number":162,"KnessetNum":14,"Name":"ישיבת מליאה בתאריך 05/01/1998 בשעה 14:03","StartDate":"1998-01-05T14:03:00+02:00","FinishDate":"1998-01-05T18:00:00+02:00","IsSpecialMeeting":null,"LastUpdatedDate":"2020-06-10T16:01:54.673+03:00"}
{"Id":437540,"Number":163,"KnessetNum":14,"Name":"ישיבת מליאה בתאריך 06/01/1998 בשעה 16:02","StartDate":"1998-01-06T16:02:00+02:00","FinishDate":"1998-01-06T20:18:00+02:00","IsSpecialMeeting":null,"LastUpdatedDate":"2025-02-24T11:43:21.29+02:00"}
{"Id":437542,"Number":165,"KnessetNum":14,"Name":"ישיבת מליאה בתאריך 12/01/1998 בשעה 15:03","StartDate":"1998-01-12T15:03:00+02:00","FinishDate":"1998-01-12T18:20:00+02:00","IsSpecialMeeting":null,"LastUpdatedDate":"2025-02-24T11:44:32.287+02:00"}
{"Id":437543,"Number":167,"KnessetNum":14,"Name":"ישיבת מליאה בתאריך 14/01/1998 בשעה 11:03","StartDate":"1998-01-14T11:03:00+02:00","FinishDate":"1998-01-14T18:38:00+02:00","IsSpecialMeeting":null,"LastUpdatedDate":"2025-02-24T11:46:07.473+02:00"}
{"Id":437544,"Number":168,"KnessetNum":14,"Name":"ישיבת מליאה בתאריך 19/01/1998 בשעה 16:02","StartDate":"1998-01-19T16:02:00+02:00","FinishDate":"1998-01-19T21:18:00+02:00","IsSpecialMeeting":null,"LastUpdatedDate":"2025-02-24T11:46:56.79+02:00"}
{"Id":437545,"Number":170,"KnessetNum":14,"Name":"ישיבת מליאה בתאריך 26/01/1998 בשעה 16:02","StartDate":"1998-01-26T16:02:00+02:00","FinishDate":"1998-01-26T20:09:00+02:00","IsSpecialMeeting":null,"LastUpdatedDate":"2025-02-24T11:49:34.237+02:00"}
{"Id":437546,"Number":173,"KnessetNum":14,"Name":"ישיבת מליאה בתאריך 02/02/1998 בשעה 16:03","StartDate":"1998-02-02T16:03:00+02:00","FinishDate":"1998-02-02T20:24:00+02:00","IsSpecialMeeting":null,"LastUpdatedDate":"2025-02-24T11:51:25.36+02:00"}
{"Id":437547,"Number":174,"KnessetNum":14,"Name":"ישיבת מליאה בתאריך 03/02/1998 בשעה 16:03","StartDate":"1998-02-03T16:03:00+02:00","FinishDate":"1998-02-03T20:24:00+02:00","IsSpecialMeeting":null,"LastUpdatedDate":"2025-02-24T11:52:40.63+02:00"}
{"Id":437548,"Number":177,"KnessetNum":14,"Name":"ישיבת מליאה בתאריך 10/02/1998 בשעה 16:03","StartDate":"1998-02-10T16:03:00+02:00","FinishDate":"1998-02-10T20:05:00+02:00","IsSpecialMeeting":null,"LastUpdatedDate":"2025-02-24T12:30:30.397+02:00"}
{"Id":437549,"Number":180,"KnessetNum":14,"Name":"ישיבת מליאה בתאריך 17/02/1998 בשעה 16:04","StartDate":"1998-02-17T16:04:00+02:00","FinishDate":"1998-02-17T22:25:00+02:00","IsSpecialMeeting":null,"LastUpdatedDate":"2025-02-24T12:42:27.497+02:00"}
{"Id":437550,"Number":182,"KnessetNum":14,"Name":"ישיבת מליאה בתאריך 23/02/1998 בשעה 16:03","StartDate":"1998-02-23T16:03:00+02:00","FinishDate":"1998-02-23T23:34:00+02:00","IsSpecialMeeting":null,"LastUpdatedDate":"2025-02-24T13:57:57.607+02:00"}
{"Id":437551,"Number":184,"KnessetNum":14,"Name":"ישיבת מליאה בתאריך 25/02/1998 בשעה 11:06","StartDate":"1998-02-25T11:06:00+02:00","FinishDate":"1998-02-25T19:55:00+02:00","IsSpecialMeeting":null,"LastUpdatedDate":"2020-06-11T13:36:54.637+03:00"}
{"Id":437552,"Number":192,"KnessetNum":14,"Name":"ישיבת מליאה בתאריך 17/03/1998 בשעה 16:04","StartDate":"1998-03-17T16:04:00+02:00","FinishDate":"1998-03-17T21:55:00+02:00","IsSpecialMeeting":null,"LastUpdatedDate":"2025-02-24T14:04:10.297+02:00"}
{"Id":437553,"Number":193,"KnessetNum":14,"Name":"ישיבת מליאה בתאריך 18/03/1998 בשעה 11:03","StartDate":"1998-03-18T11:03:00+02:00","FinishDate":"1998-03-18T18:46:00+02:00","IsSpecialMeeting":null,"LastUpdatedDate":"2025-02-24T14:04:52.32+02:00"}
{"Id":437554,"Number":195,"KnessetNum":14,"Name":"ישיבת מליאה בתאריך 24/03/1998 בשעה 16:03","StartDate":"1998-03-24T16:03:00+02:00","FinishDate":"1998-03-24T22:26:00+02:00","IsSpecialMeeting":null,"LastUpdatedDate":"2020-04-05T12:32:13.467+03:00"}
{"Id":437555,"Number":196,"KnessetNum":14,"Name":"ישיבת מליאה בתאריך 24/03/1998 בשעה 10:03","StartDate":"1998-03-24T10:03:00+02:00","FinishDate":"1998-03-24T18:13:00+02:00","IsSpecialMeeting":null,"LastUpdatedDate":"2025-02-24T14:22:17.467+02:00"}
{"Id":437556,"Number":198,"KnessetNum":14,"Name":"ישיבת מליאה בתאריך 04/05/1998 בשעה 16:03","StartDate":"1998-05-04T16:03:00+03:00","FinishDate":"1998-05-04T21:37:00+03:00","IsSpecialMeeting":null,"LastUpdatedDate":"2025-02-24T14:26:49.567+02:00"}
{"Id":437557,"Number":200,"KnessetNum":14,"Name":"ישיבת מליאה בתאריך 06/05/1998 בשעה 11:04","StartDate":"1998-05-06T11:04:00+03:00","FinishDate":"1998-05-06T17:59:00+03:00","IsSpecialMeeting":null,"LastUpdatedDate":"2025-02-24T14:28:32.187+02:00"}
{"Id":437558,"Number":201,"KnessetNum":14,"Name":"ישיבת מליאה בתאריך 11/05/1998 בשעה 16:04","StartDate":"1998-05-11T16:04:00+03:00","FinishDate":"1998-05-11T21:03:00+03:00","IsSpecialMeeting":null,"LastUpdatedDate":"2025-02-24T14:29:09.137+02:00"}
{"Id":437559,"Number":202,"KnessetNum":14,"Name":"ישיבת מליאה בתאריך 12/05/1998 בשעה 16:04","StartDate":"1998-05-12T16:04:00+03:00","FinishDate":"1998-05-12T20:05:00+03:00","IsSpecialMeeting":null,"LastUpdatedDate":"2025-02-24T14:30:37.317+02:00"}
{"Id":437560,"Number":203,"KnessetNum":14,"Name":"ישיבת מליאה בתאריך 13/05/1998 בשעה 11:03","StartDate":"1998-05-13T11:03:00+03:00","FinishDate":"1998-05-13T16:48:00+03:00","IsSpecialMeeting":null,"LastUpdatedDate":"2025-02-24T14:31:10.277+02:00"}
{"Id":437561,"Number":204,"KnessetNum":14,"Name":"ישיבת מליאה בתאריך 18/05/1998 בשעה 19:30","StartDate":"1998-05-18T19:30:00+03:00","FinishDate":"1998-05-18T20:01:00+03:00","IsSpecialMeeting":null,"LastUpdatedDate":"2025-02-24T14:31:57.543+02:00"}
{"Id":437562,"Number":205,"KnessetNum":14,"Name":"ישיבת מליאה בתאריך 19/05/1998 בשעה 16:04","StartDate":"1998-05-19T16:04:00+03:00","FinishDate":"1998-05-19T21:03:00+03:00","IsSpecialMeeting":null,"LastUpdatedDate":"2025-02-24T14:32:50.187+02:00"}
{"Id":437563,"Number":207,"KnessetNum":14,"Name":"ישיבת מליאה בתאריך 25/05/1998 בשעה 16:07","StartDate":"1998-05-25T16:07:00+03:00","FinishDate":"1998-05-25T20:37:00+03:00","IsSpecialMeeting":null,"LastUpdatedDate":"2025-02-25T08:30:17.22+02:00"}
{"Id":437564,"Number":209,"KnessetNum":14,"Name":"ישיבת מליאה בתאריך 27/05/1998 בשעה 11:03","StartDate":"1998-05-27T11:03:00+03:00","FinishDate":"1998-05-27T19:24:00+03:00","IsSpecialMeeting":null,"LastUpdatedDate":"2025-02-25T08:31:33.177+02:00"}
{"Id":437565,"Number":210,"KnessetNum":14,"Name":"ישיבת מליאה בתאריך 02/06/1998 בשעה 16:06","StartDate":"1998-06-02T16:06:00+03:00","FinishDate":"1998-06-02T20:25:00+03:00","IsSpecialMeeting":null,"LastUpdatedDate":"2025-02-25T08:33:41.683+02:00"}
{"Id":437566,"Number":211,"KnessetNum":14,"Name":"ישיבת מליאה בתאריך 03/06/1998 בשעה 11:08","StartDate":"1998-06-03T11:08:00+03:00","FinishDate":"1998-06-03T20:43:00+03:00","IsSpecialMeeting":null,"LastUpdatedDate":"2025-02-25T08:34:29.833+02:00"}
{"Id":437567,"Number":212,"KnessetNum":14,"Name":"ישיבת מליאה בתאריך 08/06/1998 בשעה 16:06","StartDate":"1998-06-08T16:06:00+03:00","FinishDate":"1998-06-08T20:11:00+03:00","IsSpecialMeeting":null,"LastUpdatedDate":"2025-02-25T08:39:03.25+02:00"}
{"Id":437568,"Number":217,"KnessetNum":14,"Name":"ישיבת מליאה בתאריך 17/06/1998 בשעה 11:04","StartDate":"1998-06-17T11:04:00+03:00","FinishDate":"1998-06-17T19:52:00+03:00","IsSpecialMeeting":null,"LastUpdatedDate":"2025-02-25T08:53:50.06+02:00"}
{"Id":437569,"Number":225,"KnessetNum":14,"Name":"ישיבת מליאה בתאריך 07/07/1998 בשעה 16:05","StartDate":"1998-07-07T16:05:00+03:00","FinishDate":"1998-07-07T20:38:00+03:00","IsSpecialMeeting":null,"LastUpdatedDate":"2025-02-25T09:33:32.4+02:00"}
{"Id":437570,"Number":229,"KnessetNum":14,"Name":"ישיבת מליאה בתאריך 15/07/1998 בשעה 11:03","StartDate":"1998-07-15T11:03:00+03:00","FinishDate":"1998-07-15T20:58:00+03:00","IsSpecialMeeting":null,"LastUpdatedDate":"2025-02-25T09:47:59.31+02:00"}
{"Id":437571,"Number":231,"KnessetNum":14,"Name":"ישיבת מליאה בתאריך 21/07/1998 בשעה 16:02","StartDate":"1998-07-21T16:02:00+03:00","FinishDate":"1998-07-21T22:33:00+03:00","IsSpecialMeeting":null,"LastUpdatedDate":"2025-02-25T10:20:56.117+02:00"}
{"Id":437572,"Number":233,"KnessetNum":14,"Name":"ישיבת מליאה בתאריך 27/07/1998 בשעה 16:05","StartDate":"1998-07-27T16:05:00+03:00","FinishDate":"1998-07-28T01:00:00+03:00","IsSpecialMeeting":null,"LastUpdatedDate":"2025-02-25T10:25:38.94+02:00"}
{"Id":437573,"Number":234,"KnessetNum":14,"Name":"ישיבת מליאה בתאריך 28/07/1998 בשעה: 00:00:00","StartDate":"1998-07-28T00:00:00+03:00","FinishDate":null,"IsSpecialMeeting":null,"LastUpdatedDate":"2014-08-17T15:12:51+03:00"}
{"Id":437574,"Number":235,"KnessetNum":14,"Name":"ישיבת מליאה בתאריך 29/07/1998 בשעה 11:03","StartDate":"1998-07-29T11:03:00+03:00","FinishDate":"1998-07-29T23:23:00+03:00","IsSpecialMeeting":null,"LastUpdatedDate":"2020-06-11T12:49:55.783+03:00"}
{"Id":437575,"Number":238,"KnessetNum":14,"Name":"ישיבת מליאה בתאריך 19/10/1998 בשעה 16:00","StartDate":"1998-10-19T16:00:00+02:00","FinishDate":"1998-10-19T22:08:00+02:00","IsSpecialMeeting":null,"LastUpdatedDate":"2025-02-25T10:28:56.987+02:00"}
{"Id":437576,"Number":255,"KnessetNum":14,"Name":"ישיבת מליאה בתאריך 25/11/1998 בשעה 11:03","StartDate":"1998-11-25T11:03:00+02:00","FinishDate":"1998-11-25T20:26:00+02:00","IsSpecialMeeting":null,"LastUpdatedDate":"2025-02-25T11:04:57.263+02:00"}
{"Id":437578,"Number":256,"KnessetNum":14,"Name":"ישיבת מליאה בתאריך 30/11/1998 בשעה 16:02","StartDate":"1998-11-30T16:02:00+02:00","FinishDate":"1998-11-30T22:12:00+02:00","IsSpecialMeeting":null,"LastUpdatedDate":"2020-06-11T12:16:54.177+03:00"}
{"Id":437579,"Number":259,"KnessetNum":14,"Name":"ישיבת מליאה בתאריך 07/12/1998 בשעה 16:05","StartDate":"1998-12-07T16:05:00+02:00","FinishDate":"1998-12-07T21:52:00+02:00","IsSpecialMeeting":null,"LastUpdatedDate":"2025-02-25T11:08:18.197+02:00"}
{"Id":437580,"Number":260,"KnessetNum":14,"Name":"ישיבת מליאה בתאריך 08/12/1998 בשעה 16:00","StartDate":"1998-12-08T16:00:00+02:00","FinishDate":"1998-12-08T22:24:00+02:00","IsSpecialMeeting":null,"LastUpdatedDate":"2025-02-25T11:08:56.37+02:00"}
{"Id":437581,"Number":261,"KnessetNum":14,"Name":"ישיבת מליאה בתאריך 09/12/1998 בשעה 11:04","StartDate":"1998-12-09T11:04:00+02:00","FinishDate":"1998-12-09T21:31:00+02:00","IsSpecialMeeting":null,"LastUpdatedDate":"2025-02-25T11:22:23.173+02:00"}
{"Id":437582,"Number":264,"KnessetNum":14,"Name":"ישיבת מליאה בתאריך 16/12/1998 בשעה 11:03","StartDate":"1998-12-16T11:03:00+02:00","FinishDate":"1998-12-16T18:29:00+02:00","IsSpecialMeeting":null,"LastUpdatedDate":"2020-06-11T12:11:12.163+03:00"}
{"Id":437583,"Number":265,"KnessetNum":14,"Name":"ישיבת מליאה בתאריך 21/12/1998 בשעה 16:47","StartDate":"1998-12-21T16:47:00+02:00","FinishDate":"1998-12-21T22:24:00+02:00","IsSpecialMeeting":null,"LastUpdatedDate":"2020-06-11T12:07:36.117+03:00"}
{"Id":437584,"Number":266,"KnessetNum":14,"Name":"ישיבת מליאה בתאריך 22/12/1998 בשעה 16:04","StartDate":"1998-12-22T16:04:00+02:00","FinishDate":"1998-12-22T20:59:00+02:00","IsSpecialMeeting":null,"LastUpdatedDate":"2025-02-25T11:46:00.22+02:00"}
{"Id":437585,"Number":267,"KnessetNum":14,"Name":"ישיבת מליאה בתאריך 23/12/1998 בשעה 11:03","StartDate":"1998-12-23T11:03:00+02:00","FinishDate":"1998-12-23T18:40:00+02:00","IsSpecialMeeting":null,"LastUpdatedDate":"2025-02-25T11:46:45.137+02:00"}
{"Id":437586,"Number":270,"KnessetNum":14,"Name":"ישיבת מליאה בתאריך 30/12/1998 בשעה 11:08","StartDate":"1998-12-30T11:08:00+02:00","FinishDate":"1998-12-30T18:54:00+02:00","IsSpecialMeeting":null,"LastUpdatedDate":"2025-02-25T11:49:30.84+02:00"}
{"Id":437587,"Number":271,"KnessetNum":14,"Name":"ישיבת מליאה בתאריך 04/01/1999 בשעה 16:04","StartDate":"1999-01-04T16:04:00+02:00","FinishDate":"1999-01-04T21:01:00+02:00","IsSpecialMeeting":null,"LastUpdatedDate":"2025-02-25T12:18:47.563+02:00"}
{"Id":437588,"Number":272,"KnessetNum":14,"Name":"ישיבת מליאה בתאריך 05/01/1999 בשעה 16:04","StartDate":"1999-01-05T16:04:00+02:00","FinishDate":"1999-01-05T20:38:00+02:00","IsSpecialMeeting":null,"LastUpdatedDate":"2025-02-25T12:20:38.657+02:00"}
{"Id":437589,"Number":273,"KnessetNum":14,"Name":"ישיבת מליאה בתאריך 06/01/1999 בשעה 11:05","StartDate":"1999-01-06T11:05:00+02:00","FinishDate":"1999-01-06T17:48:00+02:00","IsSpecialMeeting":null,"LastUpdatedDate":"2025-02-25T12:21:23.847+02:00"}
{"Id":437590,"Number":276,"KnessetNum":14,"Name":"ישיבת מליאה בתאריך 13/01/1999 בשעה 11:04","StartDate":"1999-01-13T11:04:00+02:00","FinishDate":"1999-01-13T19:56:00+02:00","IsSpecialMeeting":null,"LastUpdatedDate":"2025-02-25T12:22:49.267+02:00"}
{"Id":437591,"Number":277,"KnessetNum":14,"Name":"ישיבת מליאה בתאריך 18/01/1999 בשעה 16:05","StartDate":"1999-01-18T16:05:00+02:00","FinishDate":"1999-01-18T21:29:00+02:00","IsSpecialMeeting":null,"LastUpdatedDate":"2025-02-25T12:29:21.963+02:00"}
{"Id":437592,"Number":278,"KnessetNum":14,"Name":"ישיבת מליאה בתאריך 19/01/1999 בשעה 16:06","StartDate":"1999-01-19T16:06:00+02:00","FinishDate":"1999-01-19T18:54:00+02:00","IsSpecialMeeting":null,"LastUpdatedDate":"2025-02-25T12:30:11.813+02:00"}
{"Id":437594,"Number":284,"KnessetNum":14,"Name":"ישיבת מליאה בתאריך 04/02/1999 בשעה 16:07","StartDate":"1999-02-04T16:07:00+02:00","FinishDate":"1999-02-05T05:45:00+02:00","IsSpecialMeeting":true,"LastUpdatedDate":"2025-02-25T12:24:47.15+02:00"}
{"Id":437595,"Number":286,"KnessetNum":14,"Name":"ישיבת מליאה בתאריך 14/04/1999 בשעה 10:05","StartDate":"1999-04-14T10:05:00+03:00","FinishDate":"1999-04-14T15:10:00+03:00","IsSpecialMeeting":true,"LastUpdatedDate":"2025-02-25T12:27:31.72+02:00"}
{"Id":437596,"Number":287,"KnessetNum":14,"Name":"ישיבת מליאה בתאריך 19/04/1999 בשעה 10:03","StartDate":"1999-04-19T10:03:00+03:00","FinishDate":"1999-04-19T16:59:00+03:00","IsSpecialMeeting":true,"LastUpdatedDate":"2025-02-25T12:28:14.867+02:00"}
{"Id":437597,"Number":13,"KnessetNum":15,"Name":"ישיבת מליאה בתאריך 12/07/1999 בשעה 16:02","StartDate":"1999-07-12T16:02:00+03:00","FinishDate":"1999-07-13T00:26:00+03:00","IsSpecialMeeting":null,"LastUpdatedDate":"2025-02-25T14:36:27.657+02:00"}
{"Id":437598,"Number":14,"KnessetNum":15,"Name":"ישיבת מליאה בתאריך 13/07/1999 בשעה 16:00","StartDate":"1999-07-13T16:00:00+03:00","FinishDate":"1999-07-13T19:33:00+03:00","IsSpecialMeeting":null,"LastUpdatedDate":"2025-02-25T14:39:51.24+02:00"}
{"Id":437599,"Number":16,"KnessetNum":15,"Name":"ישיבת מליאה בתאריך 19/07/1999 בשעה 16:00","StartDate":"1999-07-19T16:00:00+03:00","FinishDate":"1999-07-19T21:07:00+03:00","IsSpecialMeeting":null,"LastUpdatedDate":"2025-02-25T14:41:36.76+02:00"}
{"Id":437600,"Number":17,"KnessetNum":15,"Name":"ישיבת מליאה בתאריך 20/07/1999 בשעה 16:00","StartDate":"1999-07-20T16:00:00+03:00","FinishDate":"1999-07-20T22:20:00+03:00","IsSpecialMeeting":null,"LastUpdatedDate":"2025-02-25T14:42:11.197+02:00"}
{"Id":437601,"Number":21,"KnessetNum":15,"Name":"ישיבת מליאה בתאריך 28/07/1999 בשעה 09:00","StartDate":"1999-07-28T09:00:00+03:00","FinishDate":null,"IsSpecialMeeting":null,"LastUpdatedDate":"2025-02-25T15:05:59.423+02:00"}
{"Id":437602,"Number":22,"KnessetNum":15,"Name":"ישיבת מליאה בתאריך 01/08/1999 בשעה 16:00","StartDate":"1999-08-01T16:00:00+03:00","FinishDate":"1999-08-01T19:14:00+03:00","IsSpecialMeeting":null,"LastUpdatedDate":"2020-11-02T16:13:25.113+02:00"}
{"Id":437604,"Number":25,"KnessetNum":15,"Name":"ישיבת מליאה בתאריך 01/09/1999 בשעה 16:01","StartDate":"1999-09-01T16:01:00+03:00","FinishDate":"1999-09-01T18:51:00+03:00","IsSpecialMeeting":null,"LastUpdatedDate":"2025-02-25T15:10:52.96+02:00"}
{"Id":437605,"Number":48,"KnessetNum":15,"Name":"ישיבת מליאה בתאריך 16/11/1999 בשעה 16:01","StartDate":"1999-11-16T16:01:00+02:00","FinishDate":"1999-11-16T23:01:00+02:00","IsSpecialMeeting":null,"LastUpdatedDate":"2025-02-25T16:15:37.11+02:00"}
{"Id":437606,"Number":49,"KnessetNum":15,"Name":"ישיבת מליאה בתאריך 17/11/1999 בשעה 11:00","StartDate":"1999-11-17T11:00:00+02:00","FinishDate":"1999-11-17T20:42:00+02:00","IsSpecialMeeting":null,"LastUpdatedDate":"2025-02-25T16:16:17.49+02:00"}
{"Id":437608,"Number":50,"KnessetNum":15,"Name":"ישיבת מליאה בתאריך 22/11/1999 בשעה 16:03","StartDate":"1999-11-22T16:03:00+02:00","FinishDate":"1999-11-22T22:25:00+02:00","IsSpecialMeeting":null,"LastUpdatedDate":"2025-02-25T16:17:47.553+02:00"}
{"Id":437609,"Number":52,"KnessetNum":15,"Name":"ישיבת מליאה בתאריך 24/11/1999 בשעה 11:02","StartDate":"1999-11-24T11:02:00+02:00","FinishDate":"1999-11-24T21:28:00+02:00","IsSpecialMeeting":null,"LastUpdatedDate":"2025-02-25T16:20:12.917+02:00"}
{"Id":437610,"Number":53,"KnessetNum":15,"Name":"ישיבת מליאה בתאריך 29/11/1999 בשעה 16:00","StartDate":"1999-11-29T16:00:00+02:00","FinishDate":"1999-11-29T21:23:00+02:00","IsSpecialMeeting":null,"LastUpdatedDate":"2025-02-25T16:25:51.473+02:00"}
{"Id":437611,"Number":58,"KnessetNum":15,"Name":"ישיבת מליאה בתאריך 08/12/1999 בשעה 11:02","StartDate":"1999-12-08T11:02:00+02:00","FinishDate":"1999-12-08T15:57:00+02:00","IsSpecialMeeting":null,"LastUpdatedDate":"2025-02-26T08:40:14.837+02:00"}
{"Id":437612,"Number":61,"KnessetNum":15,"Name":"ישיבת מליאה בתאריך 15/12/1999 בשעה 11:01","StartDate":"1999-12-15T11:01:00+02:00","FinishDate":"1999-12-15T16:43:00+02:00","IsSpecialMeeting":null,"LastUpdatedDate":"2025-02-26T08:51:49.573+02:00"}
{"Id":437613,"Number":65,"KnessetNum":15,"Name":"ישיבת מליאה בתאריך 27/12/1999 בשעה 10:02","StartDate":"1999-12-27T10:02:00+02:00","FinishDate":"1999-12-27T23:17:00+02:00","IsSpecialMeeting":null,"LastUpdatedDate":"2025-02-26T09:31:12.967+02:00"}
{"Id":437615,"Number":66,"KnessetNum":15,"Name":"ישיבת מליאה בתאריך 03/01/2000 בשעה 16:03","StartDate":"2000-01-03T16:03:00+02:00","FinishDate":"2000-01-03T20:03:00+02:00","IsSpecialMeeting":null,"LastUpdatedDate":"2025-02-26T09:44:53.33+02:00"}
{"Id":437616,"Number":67,"KnessetNum":15,"Name":"ישיבת מליאה בתאריך 04/01/2000 בשעה 16:02","StartDate":"2000-01-04T16:02:00+02:00","FinishDate":"2000-01-04T23:48:00+02:00","IsSpecialMeeting":null,"LastUpdatedDate":"2025-02-26T09:50:22.297+02:00"}
{"Id":437617,"Number":68,"KnessetNum":15,"Name":"ישיבת מליאה בתאריך 05/01/2000 בשעה 11:03","StartDate":"2000-01-05T11:03:00+02:00","FinishDate":"2000-01-05T17:20:00+02:00","IsSpecialMeeting":null,"LastUpdatedDate":"2025-02-26T09:51:03.77+02:00"}
{"Id":437618,"Number":70,"KnessetNum":15,"Name":"ישיבת מליאה בתאריך 11/01/2000 בשעה 16:02","StartDate":"2000-01-11T16:02:00+02:00","FinishDate":"2000-01-11T20:25:00+02:00","IsSpecialMeeting":null,"LastUpdatedDate":"2025-02-26T10:04:27.257+02:00"}
{"Id":437619,"Number":73,"KnessetNum":15,"Name":"ישיבת מליאה בתאריך 18/01/2000 בשעה 16:02","StartDate":"2000-01-18T16:02:00+02:00","FinishDate":"2000-01-18T19:40:00+02:00","IsSpecialMeeting":null,"LastUpdatedDate":"2025-02-26T10:07:15.38+02:00"}
{"Id":437620,"Number":74,"KnessetNum":15,"Name":"ישיבת מליאה בתאריך 19/01/2000 בשעה 11:01","StartDate":"2000-01-19T11:01:00+02:00","FinishDate":"2000-01-19T19:46:00+02:00","IsSpecialMeeting":null,"LastUpdatedDate":"2025-02-26T10:07:47.337+02:00"}
{"Id":437621,"Number":75,"KnessetNum":15,"Name":"ישיבת מליאה בתאריך 24/01/2000 בשעה 16:02","StartDate":"2000-01-24T16:02:00+02:00","FinishDate":"2000-01-24T20:54:00+02:00","IsSpecialMeeting":null,"LastUpdatedDate":"2025-02-26T10:16:10.273+02:00"}
{"Id":437622,"Number":81,"KnessetNum":15,"Name":"ישיבת מליאה בתאריך 07/02/2000 בשעה 16:00","StartDate":"2000-02-07T16:00:00+02:00","FinishDate":"2000-02-07T20:41:00+02:00","IsSpecialMeeting":null,"LastUpdatedDate":"2025-02-26T10:36:01.6+02:00"}
{"Id":437623,"Number":82,"KnessetNum":15,"Name":"ישיבת מליאה בתאריך 08/02/2000 בשעה 16:02","StartDate":"2000-02-08T16:02:00+02:00","FinishDate":"2000-02-08T21:48:00+02:00","IsSpecialMeeting":null,"LastUpdatedDate":"2025-02-26T10:38:28.95+02:00"}
{"Id":437625,"Number":84,"KnessetNum":15,"Name":"ישיבת מליאה בתאריך 14/02/2000 בשעה 16:02","StartDate":"2000-02-14T16:02:00+02:00","FinishDate":"2000-02-14T22:24:00+02:00","IsSpecialMeeting":null,"LastUpdatedDate":"2025-02-26T10:39:44.25+02:00"}
{"Id":437626,"Number":85,"KnessetNum":15,"Name":"ישיבת מליאה בתאריך 15/02/2000 בשעה 16:01","StartDate":"2000-02-15T16:01:00+02:00","FinishDate":"2000-02-15T21:20:00+02:00","IsSpecialMeeting":null,"LastUpdatedDate":"2025-02-26T10:44:58.473+02:00"}
{"Id":437627,"Number":88,"KnessetNum":15,"Name":"ישיבת מליאה בתאריך 22/02/2000 בשעה 16:01","StartDate":"2000-02-22T16:01:00+02:00","FinishDate":"2000-02-22T22:16:00+02:00","IsSpecialMeeting":null,"LastUpdatedDate":"2025-02-26T10:50:09.853+02:00"}
{"Id":437628,"Number":89,"KnessetNum":15,"Name":"ישיבת מליאה בתאריך 23/02/2000 בשעה 11:00","StartDate":"2000-02-23T11:00:00+02:00","FinishDate":"2000-02-23T18:51:00+02:00","IsSpecialMeeting":null,"LastUpdatedDate":"2025-02-26T10:55:18.81+02:00"}
{"Id":437629,"Number":92,"KnessetNum":15,"Name":"ישיבת מליאה בתאריך 01/03/2000 בשעה 11:02","StartDate":"2000-03-01T11:02:00+02:00","FinishDate":"2000-03-01T20:40:00+02:00","IsSpecialMeeting":null,"LastUpdatedDate":"2025-02-26T10:56:56.083+02:00"}
{"Id":437630,"Number":93,"KnessetNum":15,"Name":"ישיבת מליאה בתאריך 06/03/2000 בשעה 16:02","StartDate":"2000-03-06T16:02:00+02:00","FinishDate":"2000-03-06T20:32:00+02:00","IsSpecialMeeting":null,"LastUpdatedDate":"2025-02-26T10:57:45.067+02:00"}
{"Id":437631,"Number":94,"KnessetNum":15,"Name":"ישיבת מליאה בתאריך 07/03/2000 בשעה 16:18","StartDate":"2000-03-07T16:18:00+02:00","FinishDate":"2000-03-07T21:23:00+02:00","IsSpecialMeeting":null,"LastUpdatedDate":"2025-02-26T11:00:58.167+02:00"}
{"Id":437632,"Number":97,"KnessetNum":15,"Name":"ישיבת מליאה בתאריך 14/03/2000 בשעה 15:00","StartDate":"2000-03-14T15:00:00+02:00","FinishDate":"2000-03-14T23:18:00+02:00","IsSpecialMeeting":null,"LastUpdatedDate":"2025-02-26T11:04:07.087+02:00"}
{"Id":437633,"Number":104,"KnessetNum":15,"Name":"ישיבת מליאה בתאריך 15/05/2000 בשעה 16:02","StartDate":"2000-05-15T16:02:00+03:00","FinishDate":"2000-05-15T19:48:00+03:00","IsSpecialMeeting":null,"LastUpdatedDate":"2025-02-26T11:24:57.11+02:00"}
{"Id":437635,"Number":111,"KnessetNum":15,"Name":"ישיבת מליאה בתאריך 29/05/2000 בשעה 16:03","StartDate":"2000-05-29T16:03:00+03:00","FinishDate":"2000-05-29T22:31:00+03:00","IsSpecialMeeting":null,"LastUpdatedDate":"2025-02-26T11:53:15.723+02:00"}
{"Id":437636,"Number":112,"KnessetNum":15,"Name":"ישיבת מליאה בתאריך 30/05/2000 בשעה 16:02","StartDate":"2000-05-30T16:02:00+03:00","FinishDate":"2000-05-30T21:20:00+03:00","IsSpecialMeeting":null,"LastUpdatedDate":"2025-02-26T11:53:47.813+02:00"}
{"Id":437637,"Number":113,"KnessetNum":15,"Name":"ישיבת מליאה בתאריך 31/05/2000 בשעה 11:02","StartDate":"2000-05-31T11:02:00+03:00","FinishDate":"2000-05-31T18:43:00+03:00","IsSpecialMeeting":null,"LastUpdatedDate":"2025-02-26T11:54:30.467+02:00"}
{"Id":437638,"Number":114,"KnessetNum":15,"Name":"ישיבת מליאה בתאריך 05/06/2000 בשעה 16:02","StartDate":"2000-06-05T16:02:00+03:00","FinishDate":"2000-06-05T21:53:00+03:00","IsSpecialMeeting":null,"LastUpdatedDate":"2025-02-26T11:55:22.66+02:00"}
{"Id":437639,"Number":115,"KnessetNum":15,"Name":"ישיבת מליאה בתאריך 06/06/2000 בשעה 16:03","StartDate":"2000-06-06T16:03:00+03:00","FinishDate":null,"IsSpecialMeeting":null,"LastUpdatedDate":"2025-02-26T11:56:53.06+02:00"}
{"Id":437640,"Number":121,"KnessetNum":15,"Name":"ישיבת מליאה בתאריך 20/06/2000 בשעה 16:02","StartDate":"2000-06-20T16:02:00+03:00","FinishDate":"2000-06-20T20:54:00+03:00","IsSpecialMeeting":null,"LastUpdatedDate":"2025-02-26T12:05:57.397+02:00"}
{"Id":437641,"Number":123,"KnessetNum":15,"Name":"ישיבת מליאה בתאריך 26/06/2000 בשעה 16:03","StartDate":"2000-06-26T16:03:00+03:00","FinishDate":"2000-06-26T19:40:00+03:00","IsSpecialMeeting":null,"LastUpdatedDate":"2025-02-26T12:07:49.017+02:00"}
{"Id":437642,"Number":125,"KnessetNum":15,"Name":"ישיבת מליאה בתאריך 28/06/2000 בשעה 11:02","StartDate":"2000-06-28T11:02:00+03:00","FinishDate":"2000-06-28T16:02:00+03:00","IsSpecialMeeting":null,"LastUpdatedDate":"2025-02-26T12:11:54.857+02:00"}
{"Id":437643,"Number":127,"KnessetNum":15,"Name":"ישיבת מליאה בתאריך 04/07/2000 בשעה 16:03","StartDate":"2000-07-04T16:03:00+03:00","FinishDate":"2000-07-04T21:40:00+03:00","IsSpecialMeeting":null,"LastUpdatedDate":"2025-02-26T12:13:09.477+02:00"}
{"Id":437644,"Number":128,"KnessetNum":15,"Name":"ישיבת מליאה בתאריך 05/07/2000 בשעה 11:02","StartDate":"2000-07-05T11:02:00+03:00","FinishDate":"2000-07-05T19:47:00+03:00","IsSpecialMeeting":null,"LastUpdatedDate":"2025-02-26T12:17:12.937+02:00"}
{"Id":437645,"Number":130,"KnessetNum":15,"Name":"ישיבת מליאה בתאריך 11/07/2000 בשעה 15:06","StartDate":"2000-07-11T15:06:00+03:00","FinishDate":"2000-07-11T21:02:00+03:00","IsSpecialMeeting":null,"LastUpdatedDate":"2025-02-26T12:53:39.183+02:00"}
{"Id":437646,"Number":132,"KnessetNum":15,"Name":"ישיבת מליאה בתאריך 17/07/2000 בשעה 16:03","StartDate":"2000-07-17T16:03:00+03:00","FinishDate":"2000-07-17T23:06:00+03:00","IsSpecialMeeting":null,"LastUpdatedDate":"2025-02-27T08:21:27.173+02:00"}
{"Id":437647,"Number":133,"KnessetNum":15,"Name":"ישיבת מליאה בתאריך 18/07/2000 בשעה 16:00","StartDate":"2000-07-18T16:00:00+03:00","FinishDate":"2000-07-18T21:36:00+03:00","IsSpecialMeeting":null,"LastUpdatedDate":"2025-02-27T08:38:01.353+02:00"}
{"Id":437648,"Number":134,"KnessetNum":15,"Name":"ישיבת מליאה בתאריך 19/07/2000 בשעה 11:02","StartDate":"2000-07-19T11:02:00+03:00","FinishDate":"2000-07-19T21:30:00+03:00","IsSpecialMeeting":null,"LastUpdatedDate":"2025-02-27T08:40:13.317+02:00"}
{"Id":437649,"Number":135,"KnessetNum":15,"Name":"ישיבת מליאה בתאריך 24/07/2000 בשעה 16:00","StartDate":"2000-07-24T16:00:00+03:00","FinishDate":"2000-07-24T21:30:00+03:00","IsSpecialMeeting":null,"LastUpdatedDate":"2025-02-27T08:41:34.943+02:00"}
{"Id":437650,"Number":136,"KnessetNum":15,"Name":"ישיבת מליאה בתאריך 25/07/2000 בשעה 16:01","StartDate":"2000-07-25T16:01:00+03:00","FinishDate":"2000-07-25T21:43:00+03:00","IsSpecialMeeting":null,"LastUpdatedDate":"2025-02-27T08:42:25.317+02:00"}
{"Id":437651,"Number":139,"KnessetNum":15,"Name":"ישיבת מליאה בתאריך 31/07/2000 בשעה 16:02","StartDate":"2000-07-31T16:02:00+03:00","FinishDate":"2000-08-01T00:02:00+03:00","IsSpecialMeeting":null,"LastUpdatedDate":"2025-02-27T09:05:20.03+02:00"}
{"Id":437652,"Number":141,"KnessetNum":15,"Name":"ישיבת מליאה בתאריך 02/08/2000 בשעה 11:03","StartDate":"2000-08-02T11:03:00+03:00","FinishDate":"2000-08-03T00:30:00+03:00","IsSpecialMeeting":null,"LastUpdatedDate":"2020-10-28T10:54:06.58+02:00"}
{"Id":437654,"Number":145,"KnessetNum":15,"Name":"ישיבת מליאה בתאריך 30/10/2000 בשעה 16:03","StartDate":"2000-10-30T16:03:00+02:00","FinishDate":"2000-10-30T21:59:00+02:00","IsSpecialMeeting":null,"LastUpdatedDate":"2025-02-27T09:19:26.96+02:00"}
{"Id":437655,"Number":149,"KnessetNum":15,"Name":"ישיבת מליאה בתאריך 07/11/2000 בשעה 16:00","StartDate":"2000-11-07T16:00:00+02:00","FinishDate":"2000-11-07T21:36:00+02:00","IsSpecialMeeting":null,"LastUpdatedDate":"2025-02-27T09:49:26.62+02:00"}
{"Id":437656,"Number":150,"KnessetNum":15,"Name":"ישיבת מליאה בתאריך 08/11/2000 בשעה 11:01","StartDate":"2000-11-08T11:01:00+02:00","FinishDate":"2000-11-08T19:34:00+02:00","IsSpecialMeeting":null,"LastUpdatedDate":"2025-02-27T09:51:08.207+02:00"}
{"Id":437657,"Number":153,"KnessetNum":15,"Name":"ישיבת מליאה בתאריך 14/11/2000 בשעה 16:01","StartDate":"2000-11-14T16:01:00+02:00","FinishDate":"2000-11-14T20:56:00+02:00","IsSpecialMeeting":null,"LastUpdatedDate":"2025-02-27T09:56:43.227+02:00"}
{"Id":437658,"Number":154,"KnessetNum":15,"Name":"ישיבת מליאה בתאריך 15/11/2000 בשעה 11:00","StartDate":"2000-11-15T11:00:00+02:00","FinishDate":"2000-11-15T14:01:00+02:00","IsSpecialMeeting":null,"LastUpdatedDate":"2025-02-27T09:59:03.18+02:00"}
{"Id":437659,"Number":155,"KnessetNum":15,"Name":"ישיבת מליאה בתאריך 20/11/2000 בשעה 16:00","StartDate":"2000-11-20T16:00:00+02:00","FinishDate":"2000-11-20T22:49:00+02:00","IsSpecialMeeting":null,"LastUpdatedDate":"2025-02-27T10:02:12.763+02:00"}
{"Id":437660,"Number":157,"KnessetNum":15,"Name":"ישיבת מליאה בתאריך 22/11/2000 בשעה 11:00","StartDate":"2000-11-22T11:00:00+02:00","FinishDate":"2000-11-22T18:25:00+02:00","IsSpecialMeeting":null,"LastUpdatedDate":"2025-02-27T10:04:02.43+02:00"}
{"Id":437661,"Number":158,"KnessetNum":15,"Name":"ישיבת מליאה בתאריך 27/11/2000 בשעה 16:02","StartDate":"2000-11-27T16:02:00+02:00","FinishDate":"2000-11-27T20:32:00+02:00","IsSpecialMeeting":null,"LastUpdatedDate":"2025-02-27T10:04:39.677+02:00"}
{"Id":437662,"Number":159,"KnessetNum":15,"Name":"ישיבת מליאה בתאריך 28/11/2000 בשעה 16:05","StartDate":"2000-11-28T16:05:00+02:00","FinishDate":"2000-11-28T22:38:00+02:00","IsSpecialMeeting":null,"LastUpdatedDate":"2025-02-27T10:05:44.503+02:00"}
{"Id":437663,"Number":160,"KnessetNum":15,"Name":"ישיבת מליאה בתאריך 29/11/2000 בשעה 11:04","StartDate":"2000-11-29T11:04:00+02:00","FinishDate":"2000-11-29T16:56:00+02:00","IsSpecialMeeting":null,"LastUpdatedDate":"2025-02-27T10:06:12.893+02:00"}
{"Id":437664,"Number":161,"KnessetNum":15,"Name":"ישיבת מליאה בתאריך 04/12/2000 בשעה 16:04","StartDate":"2000-12-04T16:04:00+02:00","FinishDate":"2000-12-04T22:00:00+02:00","IsSpecialMeeting":null,"LastUpdatedDate":"2025-02-27T10:11:55.003+02:00"}
{"Id":437665,"Number":167,"KnessetNum":15,"Name":"ישיבת מליאה בתאריך 18/12/2000 בשעה 11:02","StartDate":"2000-12-18T11:02:00+02:00","FinishDate":"2000-12-19T01:13:00+02:00","IsSpecialMeeting":null,"LastUpdatedDate":"2025-02-27T10:17:49.577+02:00"}
{"Id":437666,"Number":169,"KnessetNum":15,"Name":"ישיבת מליאה בתאריך 20/12/2000 בשעה 11:01","StartDate":"2000-12-20T11:01:00+02:00","FinishDate":"2000-12-20T21:33:00+02:00","IsSpecialMeeting":null,"LastUpdatedDate":"2025-02-27T10:20:20.943+02:00"}
{"Id":437667,"Number":175,"KnessetNum":15,"Name":"ישיבת מליאה בתאריך 19/02/2001 בשעה 16:03","StartDate":"2001-02-19T16:03:00+02:00","FinishDate":"2001-02-19T21:26:00+02:00","IsSpecialMeeting":null,"LastUpdatedDate":"2025-02-27T10:34:31.417+02:00"}
{"Id":437668,"Number":178,"KnessetNum":15,"Name":"ישיבת מליאה בתאריך 26/02/2001 בשעה 16:02","StartDate":"2001-02-26T16:02:00+02:00","FinishDate":"2001-02-26T19:00:00+02:00","IsSpecialMeeting":null,"LastUpdatedDate":"2025-02-27T10:35:58.99+02:00"}
{"Id":437669,"Number":179,"KnessetNum":15,"Name":"ישיבת מליאה בתאריך 27/02/2001 בשעה 16:03","StartDate":"2001-02-27T16:03:00+02:00","FinishDate":"2001-02-27T21:06:00+02:00","IsSpecialMeeting":null,"LastUpdatedDate":"2025-02-27T10:43:23.687+02:00"}
{"Id":437670,"Number":181,"KnessetNum":15,"Name":"ישיבת מליאה בתאריך 05/03/2001 בשעה 15:04","StartDate":"2001-03-05T15:04:00+02:00","FinishDate":"2001-03-05T20:10:00+02:00","IsSpecialMeeting":null,"LastUpdatedDate":"2025-02-27T10:46:51.86+02:00"}
{"Id":437671,"Number":182,"KnessetNum":15,"Name":"ישיבת מליאה בתאריך 06/03/2001 בשעה 16:06","StartDate":"2001-03-06T16:06:00+02:00","FinishDate":"2001-03-06T19:25:00+02:00","IsSpecialMeeting":null,"LastUpdatedDate":"2025-02-27T10:58:23.547+02:00"}
{"Id":437672,"Number":185,"KnessetNum":15,"Name":"ישיבת מליאה בתאריך 13/03/2001 בשעה 16:02","StartDate":"2001-03-13T16:02:00+02:00","FinishDate":"2001-03-13T18:29:00+02:00","IsSpecialMeeting":null,"LastUpdatedDate":"2025-02-27T11:14:55.777+02:00"}
{"Id":437673,"Number":188,"KnessetNum":15,"Name":"ישיבת מליאה בתאריך 20/03/2001 בשעה 16:02","StartDate":"2001-03-20T16:02:00+02:00","FinishDate":"2001-03-20T20:43:00+02:00","IsSpecialMeeting":null,"LastUpdatedDate":"2025-02-27T11:18:27.103+02:00"}
{"Id":437674,"Number":189,"KnessetNum":15,"Name":"ישיבת מליאה בתאריך 21/03/2001 בשעה 11:01","StartDate":"2001-03-21T11:01:00+02:00","FinishDate":"2001-03-21T20:18:00+02:00","IsSpecialMeeting":null,"LastUpdatedDate":"2025-02-27T11:20:04.957+02:00"}
{"Id":437675,"Number":190,"KnessetNum":15,"Name":"ישיבת מליאה בתאריך 26/03/2001 בשעה 09:02","StartDate":"2001-03-26T09:02:00+02:00","FinishDate":"2001-03-26T23:32:00+02:00","IsSpecialMeeting":null,"LastUpdatedDate":"2025-02-27T11:20:58.28+02:00"}
{"Id":437676,"Number":193,"KnessetNum":15,"Name":"ישיבת מליאה בתאריך 16/04/2001 בשעה 11:02","StartDate":"2001-04-16T11:02:00+03:00","FinishDate":"2001-04-16T13:57:00+03:00","IsSpecialMeeting":null,"LastUpdatedDate":"2025-02-27T11:24:57.917+02:00"}
{"Id":437677,"Number":196,"KnessetNum":15,"Name":"ישיבת מליאה בתאריך 08/05/2001 בשעה 16:03","StartDate":"2001-05-08T16:03:00+03:00","FinishDate":"2001-05-08T19:31:00+03:00","IsSpecialMeeting":null,"LastUpdatedDate":"2025-02-27T11:27:58.693+02:00"}
{"Id":437678,"Number":197,"KnessetNum":15,"Name":"ישיבת מליאה בתאריך 09/05/2001 בשעה 11:01","StartDate":"2001-05-09T11:01:00+03:00","FinishDate":null,"IsSpecialMeeting":null,"LastUpdatedDate":"2025-02-27T11:31:54.003+02:00"}
{"Id":437679,"Number":198,"KnessetNum":15,"Name":"ישיבת מליאה בתאריך 14/05/2001 בשעה 16:02","StartDate":"2001-05-14T16:02:00+03:00","FinishDate":"2001-05-14T21:03:00+03:00","IsSpecialMeeting":null,"LastUpdatedDate":"2025-02-27T11:32:40.39+02:00"}
{"Id":437680,"Number":200,"KnessetNum":15,"Name":"ישיבת מליאה בתאריך 16/05/2001 בשעה 11:02","StartDate":"2001-05-16T11:02:00+03:00","FinishDate":"2001-05-16T20:05:00+03:00","IsSpecialMeeting":null,"LastUpdatedDate":"2025-02-27T11:44:07.653+02:00"}
{"Id":437681,"Number":201,"KnessetNum":15,"Name":"ישיבת מליאה בתאריך 21/05/2001 בשעה 16:02","StartDate":"2001-05-21T16:02:00+03:00","FinishDate":"2001-05-21T18:33:00+03:00","IsSpecialMeeting":null,"LastUpdatedDate":"2025-02-27T11:44:46.91+02:00"}
{"Id":437682,"Number":203,"KnessetNum":15,"Name":"ישיבת מליאה בתאריך 23/05/2001 בשעה 11:03","StartDate":"2001-05-23T11:03:00+03:00","FinishDate":"2001-05-23T20:35:00+03:00","IsSpecialMeeting":null,"LastUpdatedDate":"2025-02-27T11:45:51.26+02:00"}
{"Id":437683,"Number":204,"KnessetNum":15,"Name":"ישיבת מליאה בתאריך 30/05/2001 בשעה 11:02","StartDate":"2001-05-30T11:02:00+03:00","FinishDate":null,"IsSpecialMeeting":null,"LastUpdatedDate":"2025-02-27T11:46:29.273+02:00"}
{"Id":437684,"Number":206,"KnessetNum":15,"Name":"ישיבת מליאה בתאריך 05/06/2001 בשעה 15:20","StartDate":"2001-06-05T15:20:00+03:00","FinishDate":"2001-06-05T19:30:00+03:00","IsSpecialMeeting":null,"LastUpdatedDate":"2025-02-27T11:49:20.8+02:00"}
{"Id":437685,"Number":207,"KnessetNum":15,"Name":"ישיבת מליאה בתאריך 06/06/2001 בשעה 11:03","StartDate":"2001-06-06T11:03:00+03:00","FinishDate":"2001-06-06T17:40:00+03:00","IsSpecialMeeting":null,"LastUpdatedDate":"2025-02-27T11:50:41.053+02:00"}
{"Id":437686,"Number":211,"KnessetNum":15,"Name":"ישיבת מליאה בתאריך 18/06/2001 בשעה 16:01","StartDate":"2001-06-18T16:01:00+03:00","FinishDate":"2001-06-18T20:46:00+03:00","IsSpecialMeeting":null,"LastUpdatedDate":"2025-02-27T11:53:08.387+02:00"}
{"Id":437687,"Number":213,"KnessetNum":15,"Name":"ישיבת מליאה בתאריך 20/06/2001 בשעה 11:02","StartDate":"2001-06-20T11:02:00+03:00","FinishDate":"2001-06-20T19:38:00+03:00","IsSpecialMeeting":null,"LastUpdatedDate":"2025-02-27T11:54:07.993+02:00"}
{"Id":437688,"Number":214,"KnessetNum":15,"Name":"ישיבת מליאה בתאריך 25/06/2001 בשעה 16:02","StartDate":"2001-06-25T16:02:00+03:00","FinishDate":"2001-06-25T19:45:00+03:00","IsSpecialMeeting":null,"LastUpdatedDate":"2025-02-27T11:54:50.973+02:00"}
{"Id":437689,"Number":219,"KnessetNum":15,"Name":"ישיבת מליאה בתאריך 04/07/2001 בשעה 11:03","StartDate":"2001-07-04T11:03:00+03:00","FinishDate":"2001-07-04T19:51:00+03:00","IsSpecialMeeting":null,"LastUpdatedDate":"2025-02-27T12:01:53.787+02:00"}
{"Id":437691,"Number":220,"KnessetNum":15,"Name":"ישיבת מליאה בתאריך 09/07/2001 בשעה 16:02","StartDate":"2001-07-09T16:02:00+03:00","FinishDate":"2001-07-09T20:57:00+03:00","IsSpecialMeeting":null,"LastUpdatedDate":"2025-02-27T13:04:22.51+02:00"}
{"Id":437692,"Number":221,"KnessetNum":15,"Name":"ישיבת מליאה בתאריך 10/07/2001 בשעה 15:07","StartDate":"2001-07-10T15:07:00+03:00","FinishDate":"2001-07-10T21:39:00+03:00","IsSpecialMeeting":null,"LastUpdatedDate":"2025-02-27T13:05:17.963+02:00"}
{"Id":437693,"Number":222,"KnessetNum":15,"Name":"ישיבת מליאה בתאריך 11/07/2001 בשעה 11:03","StartDate":"2001-07-11T11:03:00+03:00","FinishDate":"2001-07-11T21:14:00+03:00","IsSpecialMeeting":null,"LastUpdatedDate":"2025-02-27T13:06:56.39+02:00"}
{"Id":437694,"Number":223,"KnessetNum":15,"Name":"ישיבת מליאה בתאריך 16/07/2001 בשעה 16:04","StartDate":"2001-07-16T16:04:00+03:00","FinishDate":"2001-07-16T21:46:00+03:00","IsSpecialMeeting":null,"LastUpdatedDate":"2025-02-27T13:08:06.243+02:00"}
{"Id":437695,"Number":225,"KnessetNum":15,"Name":"ישיבת מליאה בתאריך 18/07/2001 בשעה 11:03","StartDate":"2001-07-18T11:03:00+03:00","FinishDate":"2001-07-18T21:20:00+03:00","IsSpecialMeeting":null,"LastUpdatedDate":"2025-02-27T13:11:07.647+02:00"}
{"Id":437696,"Number":227,"KnessetNum":15,"Name":"ישיבת מליאה בתאריך 24/07/2001 בשעה 16:02","StartDate":"2001-07-24T16:02:00+03:00","FinishDate":"2001-07-25T00:16:00+03:00","IsSpecialMeeting":null,"LastUpdatedDate":"2025-02-27T13:15:05.383+02:00"}
{"Id":437697,"Number":228,"KnessetNum":15,"Name":"ישיבת מליאה בתאריך 25/07/2001 בשעה 11:04","StartDate":"2001-07-25T11:04:00+03:00","FinishDate":"2001-07-25T22:12:00+03:00","IsSpecialMeeting":null,"LastUpdatedDate":"2025-02-27T13:16:14.68+02:00"}
{"Id":437698,"Number":233,"KnessetNum":15,"Name":"ישיבת מליאה בתאריך 15/10/2001 בשעה 16:02","StartDate":"2001-10-15T16:02:00+02:00","FinishDate":"2001-10-15T20:45:00+02:00","IsSpecialMeeting":null,"LastUpdatedDate":"2025-02-27T13:24:25.59+02:00"}
{"Id":437699,"Number":234,"KnessetNum":15,"Name":"ישיבת מליאה בתאריך 16/10/2001 בשעה 16:00","StartDate":"2001-10-16T16:00:00+02:00","FinishDate":"2001-10-16T20:22:00+02:00","IsSpecialMeeting":null,"LastUpdatedDate":"2025-02-27T13:25:13.173+02:00"}
{"Id":437700,"Number":237,"KnessetNum":15,"Name":"ישיבת מליאה בתאריך 23/10/2001 בשעה 16:01","StartDate":"2001-10-23T16:01:00+02:00","FinishDate":"2001-10-23T22:51:00+02:00","IsSpecialMeeting":null,"LastUpdatedDate":"2025-02-27T13:28:17.34+02:00"}
{"Id":437701,"Number":246,"KnessetNum":15,"Name":"ישיבת מליאה בתאריך 13/11/2001 בשעה 16:04","StartDate":"2001-11-13T16:04:00+02:00","FinishDate":"2001-11-13T19:21:00+02:00","IsSpecialMeeting":null,"LastUpdatedDate":"2025-03-03T08:46:18.607+02:00"}
{"Id":437702,"Number":248,"KnessetNum":15,"Name":"ישיבת מליאה בתאריך 19/11/2001 בשעה 15:02","StartDate":"2001-11-19T15:02:00+02:00","FinishDate":"2001-11-19T22:34:00+02:00","IsSpecialMeeting":null,"LastUpdatedDate":"2025-03-03T08:47:39.12+02:00"}
{"Id":437703,"Number":250,"KnessetNum":15,"Name":"ישיבת מליאה בתאריך 21/11/2001 בשעה 11:01","StartDate":"2001-11-21T11:01:00+02:00","FinishDate":"2001-11-21T18:15:00+02:00","IsSpecialMeeting":null,"LastUpdatedDate":"2025-03-03T08:48:37.903+02:00"}
{"Id":437704,"Number":251,"KnessetNum":15,"Name":"ישיבת מליאה בתאריך 26/11/2001 בשעה 16:01","StartDate":"2001-11-26T16:01:00+02:00","FinishDate":"2001-11-26T19:48:00+02:00","IsSpecialMeeting":null,"LastUpdatedDate":"2025-03-03T09:18:49.25+02:00"}
{"Id":437705,"Number":252,"KnessetNum":15,"Name":"ישיבת מליאה בתאריך 27/11/2001 בשעה 15:03","StartDate":"2001-11-27T15:03:00+02:00","FinishDate":"2001-11-27T20:16:00+02:00","IsSpecialMeeting":null,"LastUpdatedDate":"2025-03-03T09:20:47.877+02:00"}
{"Id":437706,"Number":253,"KnessetNum":15,"Name":"ישיבת מליאה בתאריך 28/11/2001 בשעה 11:04","StartDate":"2001-11-28T11:04:00+02:00","FinishDate":"2001-11-28T20:36:00+02:00","IsSpecialMeeting":null,"LastUpdatedDate":"2025-03-03T09:21:21.38+02:00"}
{"Id":437707,"Number":254,"KnessetNum":15,"Name":"ישיבת מליאה בתאריך 03/12/2001 בשעה 16:02","StartDate":"2001-12-03T16:02:00+02:00","FinishDate":"2001-12-03T18:45:00+02:00","IsSpecialMeeting":null,"LastUpdatedDate":"2025-03-03T09:22:00.643+02:00"}
{"Id":437708,"Number":256,"KnessetNum":15,"Name":"ישיבת מליאה בתאריך 05/12/2001 בשעה 11:03","StartDate":"2001-12-05T11:03:00+02:00","FinishDate":"2001-12-05T17:29:00+02:00","IsSpecialMeeting":null,"LastUpdatedDate":"2025-03-03T09:45:21.787+02:00"}
{"Id":437709,"Number":257,"KnessetNum":15,"Name":"ישיבת מליאה בתאריך 10/12/2001 בשעה 14:02","StartDate":"2001-12-10T14:02:00+02:00","FinishDate":"2001-12-10T15:57:00+02:00","IsSpecialMeeting":null,"LastUpdatedDate":"2025-03-03T09:46:00.057+02:00"}
{"Id":437710,"Number":258,"KnessetNum":15,"Name":"ישיבת מליאה בתאריך 11/12/2001 בשעה 14:03","StartDate":"2001-12-11T14:03:00+02:00","FinishDate":"2001-12-11T16:59:00+02:00","IsSpecialMeeting":null,"LastUpdatedDate":"2025-03-03T09:46:35.687+02:00"}
{"Id":437711,"Number":260,"KnessetNum":15,"Name":"ישיבת מליאה בתאריך 17/12/2001 בשעה 16:02","StartDate":"2001-12-17T16:02:00+02:00","FinishDate":"2001-12-17T19:09:00+02:00","IsSpecialMeeting":null,"LastUpdatedDate":"2025-03-03T09:47:54.603+02:00"}
{"Id":437712,"Number":268,"KnessetNum":15,"Name":"ישיבת מליאה בתאריך 02/01/2002 בשעה 11:02","StartDate":"2002-01-02T11:02:00+02:00","FinishDate":"2002-01-02T19:03:00+02:00","IsSpecialMeeting":null,"LastUpdatedDate":"2025-03-03T09:53:56.33+02:00"}
{"Id":437713,"Number":269,"KnessetNum":15,"Name":"ישיבת מליאה בתאריך 07/01/2002 בשעה 16:03","StartDate":"2002-01-07T16:03:00+02:00","FinishDate":"2002-01-07T17:55:00+02:00","IsSpecialMeeting":null,"LastUpdatedDate":"2025-03-03T09:54:40.657+02:00"}
{"Id":437714,"Number":270,"KnessetNum":15,"Name":"ישיבת מליאה בתאריך 08/01/2002 בשעה 16:03","StartDate":"2002-01-08T16:03:00+02:00","FinishDate":"2002-01-08T20:33:00+02:00","IsSpecialMeeting":null,"LastUpdatedDate":"2025-03-03T09:55:32.22+02:00"}
{"Id":437715,"Number":271,"KnessetNum":15,"Name":"ישיבת מליאה בתאריך 09/01/2002 בשעה 11:03","StartDate":"2002-01-09T11:03:00+02:00","FinishDate":"2002-01-09T17:59:00+02:00","IsSpecialMeeting":null,"LastUpdatedDate":"2025-03-03T10:00:17.697+02:00"}
{"Id":437716,"Number":272,"KnessetNum":15,"Name":"ישיבת מליאה בתאריך 14/01/2002 בשעה 16:02","StartDate":"2002-01-14T16:02:00+02:00","FinishDate":"2002-01-14T19:14:00+02:00","IsSpecialMeeting":null,"LastUpdatedDate":"2025-03-03T10:05:43.87+02:00"}
{"Id":437717,"Number":276,"KnessetNum":15,"Name":"ישיבת מליאה בתאריך 22/01/2002 בשעה 16:01","StartDate":"2002-01-22T16:01:00+02:00","FinishDate":"2002-01-22T20:26:00+02:00","IsSpecialMeeting":null,"LastUpdatedDate":"2025-03-03T10:10:51.98+02:00"}
{"Id":437718,"Number":277,"KnessetNum":15,"Name":"ישיבת מליאה בתאריך 23/01/2002 בשעה 11:01","StartDate":"2002-01-23T11:01:00+02:00","FinishDate":"2002-01-23T21:05:00+02:00","IsSpecialMeeting":null,"LastUpdatedDate":"2025-03-03T10:13:59.577+02:00"}
{"Id":437719,"Number":278,"KnessetNum":15,"Name":"ישיבת מליאה בתאריך 28/01/2002 בשעה 17:15","StartDate":"2002-01-28T17:15:00+02:00","FinishDate":"2002-01-28T18:27:00+02:00","IsSpecialMeeting":null,"LastUpdatedDate":"2025-03-03T10:18:26.42+02:00"}
{"Id":437720,"Number":283,"KnessetNum":15,"Name":"ישיבת מליאה בתאריך 11/02/2002 בשעה 15:06","StartDate":"2002-02-11T15:06:00+02:00","FinishDate":"2002-02-11T20:59:00+02:00","IsSpecialMeeting":null,"LastUpdatedDate":"2025-03-03T10:24:49.187+02:00"}
{"Id":437721,"Number":294,"KnessetNum":15,"Name":"ישיבת מליאה בתאריך 13/03/2002 בשעה 11:00","StartDate":"2002-03-13T11:00:00+02:00","FinishDate":"2002-03-13T22:52:00+02:00","IsSpecialMeeting":null,"LastUpdatedDate":"2025-03-03T11:04:48.433+02:00"}
{"Id":437722,"Number":298,"KnessetNum":15,"Name":"ישיבת מליאה בתאריך 30/04/2002 בשעה 16:02","StartDate":"2002-04-30T16:02:00+03:00","FinishDate":"2002-04-30T20:48:00+03:00","IsSpecialMeeting":null,"LastUpdatedDate":"2025-03-03T11:07:24.207+02:00"}
{"Id":437723,"Number":299,"KnessetNum":15,"Name":"ישיבת מליאה בתאריך 01/05/2002 בשעה 11:05","StartDate":"2002-05-01T11:05:00+03:00","FinishDate":"2002-05-01T18:13:00+03:00","IsSpecialMeeting":null,"LastUpdatedDate":"2025-03-03T11:08:00.277+02:00"}
{"Id":437724,"Number":300,"KnessetNum":15,"Name":"ישיבת מליאה בתאריך 06/05/2002 בשעה 16:01","StartDate":"2002-05-06T16:01:00+03:00","FinishDate":"2002-05-06T19:40:00+03:00","IsSpecialMeeting":null,"LastUpdatedDate":"2025-03-03T11:15:25.85+02:00"}
{"Id":437725,"Number":122,"KnessetNum":2,"Name":"ישיבת מליאה בתאריך 18/08/1952 בשעה 16:07","StartDate":"1952-08-18T16:07:00+03:00","FinishDate":"1952-08-18T21:40:00+03:00","IsSpecialMeeting":null,"LastUpdatedDate":"2020-10-25T10:02:36.2+02:00"}
{"Id":437726,"Number":123,"KnessetNum":2,"Name":"ישיבת מליאה בתאריך 19/08/1952 בשעה 16:03","StartDate":"1952-08-19T16:03:00+03:00","FinishDate":"1952-08-19T22:35:00+03:00","IsSpecialMeeting":null,"LastUpdatedDate":"2020-10-25T09:58:45.487+02:00"}
{"Id":437727,"Number":127,"KnessetNum":2,"Name":"ישיבת מליאה בתאריך 26/08/1952 בשעה 16:05","StartDate":"1952-08-26T16:05:00+03:00","FinishDate":"1952-08-26T22:30:00+03:00","IsSpecialMeeting":null,"LastUpdatedDate":"2020-10-25T09:51:29.833+02:00"}
{"Id":437728,"Number":129,"KnessetNum":2,"Name":"ישיבת מליאה בתאריך 28/08/1952 בשעה 17:05","StartDate":"1952-08-28T17:05:00+03:00","FinishDate":"1952-08-29T02:30:00+03:00","IsSpecialMeeting":null,"LastUpdatedDate":"2020-10-25T09:39:27.693+02:00"}
{"Id":437733,"Number":159,"KnessetNum":2,"Name":"ישיבת מליאה בתאריך 24/12/1952 בשעה 11:08","StartDate":"1952-12-24T11:08:00+02:00","FinishDate":"1952-12-24T13:10:00+02:00","IsSpecialMeeting":null,"LastUpdatedDate":"2020-10-25T08:00:29.037+02:00"}
{"Id":437736,"Number":164,"KnessetNum":2,"Name":"ישיבת מליאה בתאריך 31/12/1952 בשעה 11:10","StartDate":"1952-12-31T11:10:00+02:00","FinishDate":"1952-12-31T13:27:00+02:00","IsSpecialMeeting":null,"LastUpdatedDate":"2020-10-21T16:34:10.107+03:00"}
{"Id":437740,"Number":183,"KnessetNum":2,"Name":"ישיבת מליאה בתאריך 04/02/1953 בשעה 11:07","StartDate":"1953-02-04T11:07:00+02:00","FinishDate":"1953-02-04T13:15:00+02:00","IsSpecialMeeting":null,"LastUpdatedDate":"2020-10-21T15:46:00.603+03:00"}
{"Id":437745,"Number":206,"KnessetNum":2,"Name":"ישיבת מליאה בתאריך 11/03/1953 בשעה 11:50","StartDate":"1953-03-11T11:50:00+02:00","FinishDate":"1953-03-11T13:00:00+02:00","IsSpecialMeeting":null,"LastUpdatedDate":"2020-10-21T14:38:36.623+03:00"}
{"Id":437747,"Number":211,"KnessetNum":2,"Name":"ישיבת מליאה בתאריך 18/03/1953 בשעה 14:02","StartDate":"1953-03-18T14:02:00+02:00","FinishDate":"1953-03-18T15:35:00+02:00","IsSpecialMeeting":null,"LastUpdatedDate":"2022-01-10T11:52:02.99+02:00"}
{"Id":437756,"Number":261,"KnessetNum":2,"Name":"ישיבת מליאה בתאריך 01/07/1953 בשעה 11:12","StartDate":"1953-07-01T11:12:00+03:00","FinishDate":"1953-07-01T13:45:00+03:00","IsSpecialMeeting":null,"LastUpdatedDate":"2020-10-21T10:09:05.42+03:00"}
{"Id":437759,"Number":266,"KnessetNum":2,"Name":"ישיבת מליאה בתאריך 08/07/1953 בשעה 12:10","StartDate":"1953-07-08T12:10:00+03:00","FinishDate":"1953-07-08T15:04:00+03:00","IsSpecialMeeting":null,"LastUpdatedDate":"2022-01-12T12:24:07.523+02:00"}
{"Id":437762,"Number":271,"KnessetNum":2,"Name":"ישיבת מליאה בתאריך 15/07/1953 בשעה 11:05","StartDate":"1953-07-15T11:05:00+03:00","FinishDate":"1953-07-15T14:20:00+03:00","IsSpecialMeeting":null,"LastUpdatedDate":"2020-10-21T09:37:55.26+03:00"}
{"Id":437774,"Number":321,"KnessetNum":2,"Name":"ישיבת מליאה בתאריך 18/11/1953 בשעה 11:07","StartDate":"1953-11-18T11:07:00+02:00","FinishDate":"1953-11-18T13:20:00+02:00","IsSpecialMeeting":null,"LastUpdatedDate":"2021-11-01T09:08:19.213+02:00"}
{"Id":437777,"Number":336,"KnessetNum":2,"Name":"ישיבת מליאה בתאריך 16/12/1953 בשעה 11:03","StartDate":"1953-12-16T11:03:00+02:00","FinishDate":"1953-12-16T13:10:00+02:00","IsSpecialMeeting":null,"LastUpdatedDate":"2021-11-01T15:23:58.227+02:00"}
{"Id":437780,"Number":346,"KnessetNum":2,"Name":"ישיבת מליאה בתאריך 30/12/1953 בשעה 11:05","StartDate":"1953-12-30T11:05:00+02:00","FinishDate":"1953-12-30T13:15:00+02:00","IsSpecialMeeting":null,"LastUpdatedDate":"2020-10-20T12:17:47.83+03:00"}
{"Id":437781,"Number":349,"KnessetNum":2,"Name":"ישיבת מליאה בתאריך 05/01/1954 בשעה 16:08","StartDate":"1954-01-05T16:08:00+02:00","FinishDate":"1954-01-05T19:04:00+02:00","IsSpecialMeeting":null,"LastUpdatedDate":"2020-10-20T12:08:35.31+03:00"}
{"Id":437782,"Number":363,"KnessetNum":2,"Name":"ישיבת מליאה בתאריך 27/01/1954 בשעה 11:04","StartDate":"1954-01-27T11:04:00+02:00","FinishDate":"1954-01-27T12:35:00+02:00","IsSpecialMeeting":null,"LastUpdatedDate":"2020-10-20T10:48:22.037+03:00"}
{"Id":437786,"Number":373,"KnessetNum":2,"Name":"ישיבת מליאה בתאריך 10/02/1954 בשעה 20:07","StartDate":"1954-02-10T20:07:00+02:00","FinishDate":"1954-02-10T22:53:00+02:00","IsSpecialMeeting":null,"LastUpdatedDate":"2020-10-20T09:47:59.483+03:00"}
{"Id":437787,"Number":374,"KnessetNum":2,"Name":"ישיבת מליאה בתאריך 15/02/1954 בשעה 16:07","StartDate":"1954-02-15T16:07:00+02:00","FinishDate":"1954-02-15T17:30:00+02:00","IsSpecialMeeting":null,"LastUpdatedDate":"2020-04-23T12:05:35.96+03:00"}
{"Id":437788,"Number":375,"KnessetNum":2,"Name":"ישיבת מליאה בתאריך 16/02/1954 בשעה 16:01","StartDate":"1954-02-16T16:01:00+02:00","FinishDate":"1954-02-16T19:03:00+02:00","IsSpecialMeeting":null,"LastUpdatedDate":"2020-10-20T09:42:32.04+03:00"}
{"Id":437790,"Number":391,"KnessetNum":2,"Name":"ישיבת מליאה בתאריך 10/03/1954 בשעה 15:06","StartDate":"1954-03-10T15:06:00+02:00","FinishDate":"1954-03-10T18:54:00+02:00","IsSpecialMeeting":null,"LastUpdatedDate":"2021-12-30T11:47:54.4+02:00"}
{"Id":437792,"Number":408,"KnessetNum":2,"Name":"ישיבת מליאה בתאריך 01/04/1954 בשעה 11:02","StartDate":"1954-04-01T11:02:00+02:00","FinishDate":"1954-04-01T12:50:00+02:00","IsSpecialMeeting":null,"LastUpdatedDate":"2020-10-19T18:18:13.33+03:00"}
{"Id":437794,"Number":423,"KnessetNum":2,"Name":"ישיבת מליאה בתאריך 19/05/1954 בשעה 11:13","StartDate":"1954-05-19T11:13:00+03:00","FinishDate":"1954-05-19T14:15:00+03:00","IsSpecialMeeting":null,"LastUpdatedDate":"2020-10-19T17:38:16.183+03:00"}
{"Id":437797,"Number":434,"KnessetNum":2,"Name":"ישיבת מליאה בתאריך 08/06/1954 בשעה 16:05","StartDate":"1954-06-08T16:05:00+03:00","FinishDate":"1954-06-08T18:40:00+03:00","IsSpecialMeeting":null,"LastUpdatedDate":"2021-11-18T12:28:08.37+02:00"}
{"Id":437799,"Number":456,"KnessetNum":2,"Name":"ישיבת מליאה בתאריך 14/07/1954 בשעה 11:05","StartDate":"1954-07-14T11:05:00+03:00","FinishDate":"1954-07-14T12:58:00+03:00","IsSpecialMeeting":null,"LastUpdatedDate":"2020-10-19T15:20:37.653+03:00"}
{"Id":437800,"Number":457,"KnessetNum":2,"Name":"ישיבת מליאה בתאריך 19/07/1954 בשעה 16:06","StartDate":"1954-07-19T16:06:00+03:00","FinishDate":"1954-07-19T18:50:00+03:00","IsSpecialMeeting":null,"LastUpdatedDate":"2020-10-19T15:14:50.323+03:00"}
{"Id":437801,"Number":460,"KnessetNum":2,"Name":"ישיבת מליאה בתאריך 27/07/1954 בשעה 20:02","StartDate":"1954-07-27T20:02:00+03:00","FinishDate":"1954-07-27T22:12:00+03:00","IsSpecialMeeting":null,"LastUpdatedDate":"2020-10-19T15:01:14.297+03:00"}
{"Id":437803,"Number":472,"KnessetNum":2,"Name":"ישיבת מליאה בתאריך 16/08/1954 בשעה 16:08","StartDate":"1954-08-16T16:08:00+03:00","FinishDate":"1954-08-16T19:50:00+03:00","IsSpecialMeeting":null,"LastUpdatedDate":"2020-10-19T14:16:30.16+03:00"}
{"Id":437805,"Number":485,"KnessetNum":2,"Name":"ישיבת מליאה בתאריך 01/09/1954 בשעה 11:10","StartDate":"1954-09-01T11:10:00+03:00","FinishDate":"1954-09-01T13:15:00+03:00","IsSpecialMeeting":null,"LastUpdatedDate":"2020-10-19T13:07:55.887+03:00"}
{"Id":437807,"Number":490,"KnessetNum":2,"Name":"ישיבת מליאה בתאריך 08/09/1954 בשעה 11:14","StartDate":"1954-09-08T11:14:00+03:00","FinishDate":"1954-09-08T14:07:00+03:00","IsSpecialMeeting":null,"LastUpdatedDate":"2020-10-19T12:51:22.57+03:00"}
{"Id":437808,"Number":498,"KnessetNum":2,"Name":"ישיבת מליאה בתאריך 16/11/1954 בשעה 16:07","StartDate":"1954-11-16T16:07:00+02:00","FinishDate":"1954-11-16T18:23:00+02:00","IsSpecialMeeting":null,"LastUpdatedDate":"2020-10-19T12:11:34.4+03:00"}
{"Id":437811,"Number":512,"KnessetNum":2,"Name":"ישיבת מליאה בתאריך 08/12/1954 בשעה 11:14","StartDate":"1954-12-08T11:14:00+02:00","FinishDate":"1954-12-08T11:40:00+02:00","IsSpecialMeeting":null,"LastUpdatedDate":"2020-10-19T11:17:42.403+03:00"}
{"Id":437813,"Number":515,"KnessetNum":2,"Name":"ישיבת מליאה בתאריך 14/12/1954 בשעה 20:07","StartDate":"1954-12-14T20:07:00+02:00","FinishDate":"1954-12-14T21:53:00+02:00","IsSpecialMeeting":null,"LastUpdatedDate":"2021-12-06T07:19:07.233+02:00"}
{"Id":437815,"Number":524,"KnessetNum":2,"Name":"ישיבת מליאה בתאריך 29/12/1954 בשעה 11:03","StartDate":"1954-12-29T11:03:00+02:00","FinishDate":"1954-12-29T14:28:00+02:00","IsSpecialMeeting":null,"LastUpdatedDate":"2020-10-19T10:35:23.05+03:00"}
{"Id":437818,"Number":535,"KnessetNum":2,"Name":"ישיבת מליאה בתאריך 18/01/1955 בשעה 20:19","StartDate":"1955-01-18T20:19:00+02:00","FinishDate":"1955-01-18T21:38:00+02:00","IsSpecialMeeting":null,"LastUpdatedDate":"2020-10-19T09:31:56.34+03:00"}
{"Id":437822,"Number":565,"KnessetNum":2,"Name":"ישיבת מליאה בתאריך 03/03/1955 בשעה 11:10","StartDate":"1955-03-03T11:10:00+02:00","FinishDate":"1955-03-03T13:49:00+02:00","IsSpecialMeeting":null,"LastUpdatedDate":"2020-10-18T13:59:03.07+03:00"}
{"Id":437824,"Number":579,"KnessetNum":2,"Name":"ישיבת מליאה בתאריך 24/03/1955 בשעה 11:20","StartDate":"1955-03-24T11:20:00+02:00","FinishDate":"1955-03-24T14:07:00+02:00","IsSpecialMeeting":null,"LastUpdatedDate":"2020-10-18T12:21:54.853+03:00"}
{"Id":437828,"Number":604,"KnessetNum":2,"Name":"ישיבת מליאה בתאריך 01/06/1955 בשעה 12:08","StartDate":"1955-06-01T12:08:00+03:00","FinishDate":"1955-06-01T14:30:00+03:00","IsSpecialMeeting":null,"LastUpdatedDate":"2020-10-18T10:19:52.14+03:00"}
{"Id":437831,"Number":617,"KnessetNum":2,"Name":"ישיבת מליאה בתאריך 22/06/1955 בשעה 11:10","StartDate":"1955-06-22T11:10:00+03:00","FinishDate":"1955-06-22T16:30:00+03:00","IsSpecialMeeting":null,"LastUpdatedDate":"2020-10-18T09:04:39.473+03:00"}
{"Id":437835,"Number":624,"KnessetNum":2,"Name":"ישיבת מליאה בתאריך 30/06/1955 בשעה 10:34","StartDate":"1955-06-30T10:34:00+03:00","FinishDate":"1955-06-30T13:08:00+03:00","IsSpecialMeeting":null,"LastUpdatedDate":"2020-10-18T08:42:06.97+03:00"}
{"Id":437837,"Number":7,"KnessetNum":3,"Name":"ישיבת מליאה בתאריך 17/10/1955 בשעה 16:08","StartDate":"1955-10-17T16:08:00+02:00","FinishDate":null,"IsSpecialMeeting":null,"LastUpdatedDate":"2021-09-05T09:52:32.453+03:00"}
{"Id":437838,"Number":18,"KnessetNum":3,"Name":"ישיבת מליאה בתאריך 01/11/1955 בשעה 16:05","StartDate":"1955-11-01T16:05:00+02:00","FinishDate":"1955-11-01T19:24:00+02:00","IsSpecialMeeting":null,"LastUpdatedDate":"2021-10-17T08:35:29.23+03:00"}
{"Id":437842,"Number":29,"KnessetNum":3,"Name":"ישיבת מליאה בתאריך 23/11/1955 בשעה 11:18","StartDate":"1955-11-23T11:18:00+02:00","FinishDate":"1955-11-23T12:25:00+02:00","IsSpecialMeeting":null,"LastUpdatedDate":"2021-11-07T16:02:02.963+02:00"}
{"Id":437848,"Number":49,"KnessetNum":3,"Name":"ישיבת מליאה בתאריך 27/12/1955 בשעה 16:02","StartDate":"1955-12-27T16:02:00+02:00","FinishDate":"1955-12-27T20:10:00+02:00","IsSpecialMeeting":null,"LastUpdatedDate":"2021-11-25T14:47:34.427+02:00"}
{"Id":437851,"Number":63,"KnessetNum":3,"Name":"ישיבת מליאה בתאריך 23/01/1956 בשעה 16:15","StartDate":"1956-01-23T16:15:00+02:00","FinishDate":"1956-01-23T19:24:00+02:00","IsSpecialMeeting":null,"LastUpdatedDate":"2021-11-25T19:39:00.36+02:00"}
{"Id":437853,"Number":67,"KnessetNum":3,"Name":"ישיבת מליאה בתאריך 30/01/1956 בשעה 16:10","StartDate":"1956-01-30T16:10:00+02:00","FinishDate":"1956-01-30T19:07:00+02:00","IsSpecialMeeting":null,"LastUpdatedDate":"2021-11-28T13:59:23.56+02:00"}
{"Id":437855,"Number":70,"KnessetNum":3,"Name":"ישיבת מליאה בתאריך 01/02/1956 בשעה 11:08","StartDate":"1956-02-01T11:08:00+02:00","FinishDate":"1956-02-01T12:23:00+02:00","IsSpecialMeeting":null,"LastUpdatedDate":"2021-11-28T14:49:31.497+02:00"}
{"Id":437856,"Number":73,"KnessetNum":3,"Name":"ישיבת מליאה בתאריך 07/02/1956 בשעה 16:10","StartDate":"1956-02-07T16:10:00+02:00","FinishDate":"1956-02-07T19:52:00+02:00","IsSpecialMeeting":null,"LastUpdatedDate":"2021-11-28T16:08:13.273+02:00"}
{"Id":437857,"Number":74,"KnessetNum":3,"Name":"ישיבת מליאה בתאריך 08/02/1956 בשעה 11:20","StartDate":"1956-02-08T11:20:00+02:00","FinishDate":"1956-02-08T13:00:00+02:00","IsSpecialMeeting":null,"LastUpdatedDate":"2021-11-28T16:09:05.74+02:00"}
{"Id":437860,"Number":127,"KnessetNum":3,"Name":"ישיבת מליאה בתאריך 30/05/1956 בשעה 11:03","StartDate":"1956-05-30T11:03:00+03:00","FinishDate":"1956-05-30T12:20:00+03:00","IsSpecialMeeting":null,"LastUpdatedDate":"2021-12-07T13:29:59.74+02:00"}
{"Id":437861,"Number":136,"KnessetNum":3,"Name":"ישיבת מליאה בתאריך 13/06/1956 בשעה 11:10","StartDate":"1956-06-13T11:10:00+03:00","FinishDate":"1956-06-13T12:48:00+03:00","IsSpecialMeeting":null,"LastUpdatedDate":"2022-01-30T14:26:33.373+02:00"}
{"Id":437863,"Number":141,"KnessetNum":3,"Name":"ישיבת מליאה בתאריך 20/06/1956 בשעה 11:06","StartDate":"1956-06-20T11:06:00+03:00","FinishDate":"1956-06-20T12:00:00+03:00","IsSpecialMeeting":null,"LastUpdatedDate":"2021-12-08T12:57:43.173+02:00"}
{"Id":437864,"Number":144,"KnessetNum":3,"Name":"ישיבת מליאה בתאריך 26/06/1956 בשעה 16:02","StartDate":"1956-06-26T16:02:00+03:00","FinishDate":"1956-06-26T19:30:00+03:00","IsSpecialMeeting":null,"LastUpdatedDate":"2021-12-08T13:31:10.61+02:00"}
{"Id":437866,"Number":153,"KnessetNum":3,"Name":"ישיבת מליאה בתאריך 10/07/1956 בשעה 16:13","StartDate":"1956-07-10T16:13:00+03:00","FinishDate":"1956-07-10T19:30:00+03:00","IsSpecialMeeting":null,"LastUpdatedDate":"2023-12-24T09:16:33.777+02:00"}
{"Id":437871,"Number":176,"KnessetNum":3,"Name":"ישיבת מליאה בתאריך 23/10/1956 בשעה 16:05","StartDate":"1956-10-23T16:05:00+02:00","FinishDate":"1956-10-23T18:35:00+02:00","IsSpecialMeeting":null,"LastUpdatedDate":"2021-12-12T19:09:14.993+02:00"}
{"Id":437875,"Number":196,"KnessetNum":3,"Name":"ישיבת מליאה בתאריך 28/11/1956 בשעה 11:25","StartDate":"1956-11-28T11:25:00+02:00","FinishDate":"1956-11-28T12:30:00+02:00","IsSpecialMeeting":null,"LastUpdatedDate":"2021-12-15T15:28:51.84+02:00"}
{"Id":437877,"Number":202,"KnessetNum":3,"Name":"ישיבת מליאה בתאריך 11/12/1956 בשעה 16:06","StartDate":"1956-12-11T16:06:00+02:00","FinishDate":"1956-12-11T18:36:00+02:00","IsSpecialMeeting":null,"LastUpdatedDate":"2021-12-15T18:53:35.28+02:00"}
{"Id":437879,"Number":207,"KnessetNum":3,"Name":"ישיבת מליאה בתאריך 19/12/1956 בשעה 11:05","StartDate":"1956-12-19T11:05:00+02:00","FinishDate":"1956-12-19T12:03:00+02:00","IsSpecialMeeting":null,"LastUpdatedDate":"2021-12-16T11:00:41.177+02:00"}
{"Id":437882,"Number":316,"KnessetNum":15,"Name":"ישיבת מליאה בתאריך 11/06/2002 בשעה 16:02","StartDate":"2002-06-11T16:02:00+03:00","FinishDate":"2002-06-11T19:22:00+03:00","IsSpecialMeeting":null,"LastUpdatedDate":"2025-03-03T11:56:44.043+02:00"}
{"Id":437883,"Number":318,"KnessetNum":15,"Name":"ישיבת מליאה בתאריך 17/06/2002 בשעה 15:03","StartDate":"2002-06-17T15:03:00+03:00","FinishDate":"2002-06-17T17:58:00+03:00","IsSpecialMeeting":null,"LastUpdatedDate":"2025-03-03T12:00:05.147+02:00"}
{"Id":437884,"Number":321,"KnessetNum":15,"Name":"ישיבת מליאה בתאריך 24/06/2002 בשעה 16:01","StartDate":"2002-06-24T16:01:00+03:00","FinishDate":"2002-06-24T21:14:00+03:00","IsSpecialMeeting":null,"LastUpdatedDate":"2025-03-03T12:13:31.177+02:00"}
{"Id":437885,"Number":322,"KnessetNum":15,"Name":"ישיבת מליאה בתאריך 25/06/2002 בשעה 16:00","StartDate":"2002-06-25T16:00:00+03:00","FinishDate":"2002-06-25T22:31:00+03:00","IsSpecialMeeting":null,"LastUpdatedDate":"2025-03-03T12:14:02.1+02:00"}
{"Id":437886,"Number":327,"KnessetNum":15,"Name":"ישיבת מליאה בתאריך 08/07/2002 בשעה 16:03","StartDate":"2002-07-08T16:03:00+03:00","FinishDate":"2002-07-08T21:35:00+03:00","IsSpecialMeeting":null,"LastUpdatedDate":"2025-03-03T12:28:08.74+02:00"}
{"Id":437887,"Number":329,"KnessetNum":15,"Name":"ישיבת מליאה בתאריך 10/07/2002 בשעה 11:03","StartDate":"2002-07-10T11:03:00+03:00","FinishDate":"2002-07-10T22:05:00+03:00","IsSpecialMeeting":null,"LastUpdatedDate":"2025-03-03T12:29:14.86+02:00"}
{"Id":437888,"Number":330,"KnessetNum":15,"Name":"ישיבת מליאה בתאריך 15/07/2002 בשעה 16:03","StartDate":"2002-07-15T16:03:00+03:00","FinishDate":"2002-07-15T22:16:00+03:00","IsSpecialMeeting":null,"LastUpdatedDate":"2025-03-03T12:29:55.097+02:00"}
{"Id":437889,"Number":332,"KnessetNum":15,"Name":"ישיבת מליאה בתאריך 17/07/2002 בשעה 09:04","StartDate":"2002-07-17T09:04:00+03:00","FinishDate":"2002-07-17T14:26:00+03:00","IsSpecialMeeting":null,"LastUpdatedDate":"2025-03-03T12:33:41.27+02:00"}
{"Id":437890,"Number":333,"KnessetNum":15,"Name":"ישיבת מליאה בתאריך 22/07/2002 בשעה 16:02","StartDate":"2002-07-22T16:02:00+03:00","FinishDate":"2002-07-23T00:08:00+03:00","IsSpecialMeeting":null,"LastUpdatedDate":"2025-03-03T12:35:06.137+02:00"}
{"Id":437891,"Number":335,"KnessetNum":15,"Name":"ישיבת מליאה בתאריך 24/07/2002 בשעה 09:01","StartDate":"2002-07-24T09:01:00+03:00","FinishDate":"2002-07-24T17:40:00+03:00","IsSpecialMeeting":null,"LastUpdatedDate":"2025-03-03T12:43:23.39+02:00"}
{"Id":437892,"Number":344,"KnessetNum":15,"Name":"ישיבת מליאה בתאריך 21/10/2002 בשעה 16:00","StartDate":"2002-10-21T16:00:00+02:00","FinishDate":"2002-10-21T20:42:00+02:00","IsSpecialMeeting":null,"LastUpdatedDate":"2025-03-03T13:08:22+02:00"}
{"Id":437893,"Number":346,"KnessetNum":15,"Name":"ישיבת מליאה בתאריך 23/10/2002 בשעה 11:01","StartDate":"2002-10-23T11:01:00+02:00","FinishDate":"2002-10-23T16:12:00+02:00","IsSpecialMeeting":null,"LastUpdatedDate":"2025-03-03T13:10:50.797+02:00"}
{"Id":437895,"Number":352,"KnessetNum":15,"Name":"ישיבת מליאה בתאריך 06/11/2002 בשעה 11:03","StartDate":"2002-11-06T11:03:00+02:00","FinishDate":"2002-11-06T18:34:00+02:00","IsSpecialMeeting":null,"LastUpdatedDate":"2025-03-03T14:32:39.847+02:00"}
{"Id":437896,"Number":353,"KnessetNum":15,"Name":"ישיבת מליאה בתאריך 11/11/2002 בשעה 16:02","StartDate":"2002-11-11T16:02:00+02:00","FinishDate":"2002-11-11T19:20:00+02:00","IsSpecialMeeting":null,"LastUpdatedDate":"2025-03-03T14:33:19.027+02:00"}
{"Id":437898,"Number":356,"KnessetNum":15,"Name":"ישיבת מליאה בתאריך 17/12/2002 בשעה 12:05","StartDate":"2002-12-17T12:05:00+02:00","FinishDate":"2002-12-18T00:17:00+02:00","IsSpecialMeeting":null,"LastUpdatedDate":"2025-03-03T14:46:32.433+02:00"}
{"Id":437902,"Number":13,"KnessetNum":1,"Name":"ישיבת מליאה בתאריך 17/03/1949 בשעה 16:00","StartDate":"1949-03-17T16:00:00+02:00","FinishDate":"1949-03-17T21:00:00+02:00","IsSpecialMeeting":null,"LastUpdatedDate":"2020-10-25T13:26:07.037+02:00"}
{"Id":437903,"Number":14,"KnessetNum":1,"Name":"ישיבת מליאה בתאריך 21/03/1949 בשעה 16:10","StartDate":"1949-03-21T16:10:00+02:00","FinishDate":"1949-03-21T19:30:00+02:00","IsSpecialMeeting":null,"LastUpdatedDate":"2020-10-18T08:07:25.193+03:00"}
{"Id":437905,"Number":19,"KnessetNum":1,"Name":"ישיבת מליאה בתאריך 30/03/1949 בשעה 16:10","StartDate":"1949-03-30T16:10:00+02:00","FinishDate":"1949-03-30T22:20:00+02:00","IsSpecialMeeting":null,"LastUpdatedDate":"2020-10-15T13:35:48.46+03:00"}
{"Id":437906,"Number":20,"KnessetNum":1,"Name":"ישיבת מליאה בתאריך 04/04/1949 בשעה 16:08","StartDate":"1949-04-04T16:08:00+02:00","FinishDate":"1949-04-04T21:50:00+02:00","IsSpecialMeeting":null,"LastUpdatedDate":"2020-10-15T13:33:41.167+03:00"}
{"Id":437907,"Number":22,"KnessetNum":1,"Name":"ישיבת מליאה בתאריך 11/04/1949 בשעה 16:00","StartDate":"1949-04-11T16:00:00+03:00","FinishDate":"1949-04-11T22:05:00+03:00","IsSpecialMeeting":null,"LastUpdatedDate":"2021-06-22T09:16:41.847+03:00"}
{"Id":437908,"Number":23,"KnessetNum":1,"Name":"ישיבת מליאה בתאריך 12/04/1949 בשעה 10:20","StartDate":"1949-04-12T10:20:00+03:00","FinishDate":"1949-04-12T13:50:00+03:00","IsSpecialMeeting":null,"LastUpdatedDate":"2024-01-03T09:26:22.937+02:00"}
{"Id":437909,"Number":24,"KnessetNum":1,"Name":"ישיבת מליאה בתאריך 25/04/1949 בשעה 16:00","StartDate":"1949-04-25T16:00:00+03:00","FinishDate":"1949-04-25T20:00:00+03:00","IsSpecialMeeting":null,"LastUpdatedDate":"2020-10-15T13:22:44.7+03:00"}
{"Id":437910,"Number":25,"KnessetNum":1,"Name":"ישיבת מליאה בתאריך 26/04/1949 בשעה 16:00","StartDate":"1949-04-26T16:00:00+03:00","FinishDate":"1949-04-26T18:15:00+03:00","IsSpecialMeeting":null,"LastUpdatedDate":"2021-06-23T11:56:33.633+03:00"}
{"Id":437911,"Number":28,"KnessetNum":1,"Name":"ישיבת מליאה בתאריך 03/05/1949 בשעה 14:10","StartDate":"1949-05-03T14:10:00+03:00","FinishDate":"1949-05-03T18:55:00+03:00","IsSpecialMeeting":null,"LastUpdatedDate":"2020-10-15T13:14:43.6+03:00"}
{"Id":437913,"Number":32,"KnessetNum":1,"Name":"ישיבת מליאה בתאריך 18/05/1949 בשעה 16:12","StartDate":"1949-05-18T16:12:00+03:00","FinishDate":"1949-05-18T21:05:00+03:00","IsSpecialMeeting":null,"LastUpdatedDate":"2020-10-15T12:59:53.05+03:00"}
{"Id":437914,"Number":34,"KnessetNum":1,"Name":"ישיבת מליאה בתאריך 24/05/1949 בשעה 16:15","StartDate":"1949-05-24T16:15:00+03:00","FinishDate":"1949-05-24T19:30:00+03:00","IsSpecialMeeting":null,"LastUpdatedDate":"2020-10-15T12:29:15.88+03:00"}
{"Id":437915,"Number":35,"KnessetNum":1,"Name":"ישיבת מליאה בתאריך 30/05/1949 בשעה 16:10","StartDate":"1949-05-30T16:10:00+03:00","FinishDate":"1949-05-30T20:15:00+03:00","IsSpecialMeeting":null,"LastUpdatedDate":"2021-05-24T09:10:28.927+03:00"}
{"Id":437916,"Number":39,"KnessetNum":1,"Name":"ישיבת מליאה בתאריך 07/06/1949 בשעה 16:20","StartDate":"1949-06-07T16:20:00+03:00","FinishDate":"1949-06-07T17:50:00+03:00","IsSpecialMeeting":null,"LastUpdatedDate":"2020-10-15T12:17:32.08+03:00"}
{"Id":437917,"Number":40,"KnessetNum":1,"Name":"ישיבת מליאה בתאריך 08/06/1949 בשעה 16:15","StartDate":"1949-06-08T16:15:00+03:00","FinishDate":"1949-06-08T17:40:00+03:00","IsSpecialMeeting":null,"LastUpdatedDate":"2021-05-24T12:29:55.37+03:00"}
{"Id":437918,"Number":41,"KnessetNum":1,"Name":"ישיבת מליאה בתאריך 13/06/1949 בשעה 16:10","StartDate":"1949-06-13T16:10:00+03:00","FinishDate":"1949-06-13T23:04:00+03:00","IsSpecialMeeting":null,"LastUpdatedDate":"2020-10-15T12:13:33.37+03:00"}
{"Id":437919,"Number":51,"KnessetNum":1,"Name":"ישיבת מליאה בתאריך 05/07/1949 בשעה 16:12","StartDate":"1949-07-05T16:12:00+03:00","FinishDate":"1949-07-05T19:50:00+03:00","IsSpecialMeeting":null,"LastUpdatedDate":"2020-10-15T11:44:39.97+03:00"}
{"Id":437920,"Number":70,"KnessetNum":1,"Name":"ישיבת מליאה בתאריך 24/08/1949 בשעה 16:15","StartDate":"1949-08-24T16:15:00+03:00","FinishDate":"1949-08-24T22:35:00+03:00","IsSpecialMeeting":null,"LastUpdatedDate":"2021-06-07T10:25:45.38+03:00"}
{"Id":437921,"Number":71,"KnessetNum":1,"Name":"ישיבת מליאה בתאריך 25/08/1949 בשעה 16:45","StartDate":"1949-08-25T16:45:00+03:00","FinishDate":"1949-08-25T20:15:00+03:00","IsSpecialMeeting":null,"LastUpdatedDate":"2020-10-15T09:58:47.407+03:00"}
{"Id":437922,"Number":72,"KnessetNum":1,"Name":"ישיבת מליאה בתאריך 29/08/1949 בשעה 16:10","StartDate":"1949-08-29T16:10:00+03:00","FinishDate":"1949-08-29T22:10:00+03:00","IsSpecialMeeting":null,"LastUpdatedDate":"2020-10-15T09:55:43.377+03:00"}
{"Id":437923,"Number":76,"KnessetNum":1,"Name":"ישיבת מליאה בתאריך 05/09/1949 בשעה 15:05","StartDate":"1949-09-05T15:05:00+03:00","FinishDate":"1949-09-05T22:10:00+03:00","IsSpecialMeeting":null,"LastUpdatedDate":"2020-10-15T09:27:31.01+03:00"}
{"Id":437924,"Number":77,"KnessetNum":1,"Name":"ישיבת מליאה בתאריך 06/09/1949 בשעה 16:20","StartDate":"1949-09-06T16:20:00+03:00","FinishDate":"1949-09-06T22:30:00+03:00","IsSpecialMeeting":null,"LastUpdatedDate":"2020-10-15T09:25:04.373+03:00"}
{"Id":437925,"Number":79,"KnessetNum":1,"Name":"ישיבת מליאה בתאריך 08/09/1949 בשעה 11:05","StartDate":"1949-09-08T11:05:00+03:00","FinishDate":"1949-09-08T22:30:00+03:00","IsSpecialMeeting":null,"LastUpdatedDate":"2021-06-07T15:49:11.72+03:00"}
{"Id":437926,"Number":84,"KnessetNum":1,"Name":"ישיבת מליאה בתאריך 14/11/1949 בשעה 16:07","StartDate":"1949-11-14T16:07:00+02:00","FinishDate":"1949-11-14T21:55:00+02:00","IsSpecialMeeting":null,"LastUpdatedDate":"2020-10-15T08:59:13.877+03:00"}
{"Id":437927,"Number":92,"KnessetNum":1,"Name":"ישיבת מליאה בתאריך 30/11/1949 בשעה 16:15","StartDate":"1949-11-30T16:15:00+02:00","FinishDate":"1949-11-30T18:15:00+02:00","IsSpecialMeeting":null,"LastUpdatedDate":"2020-10-15T08:28:24.25+03:00"}
{"Id":437928,"Number":93,"KnessetNum":1,"Name":"ישיבת מליאה בתאריך 05/12/1949 בשעה 16:10","StartDate":"1949-12-05T16:10:00+02:00","FinishDate":"1949-12-05T22:00:00+02:00","IsSpecialMeeting":null,"LastUpdatedDate":"2020-10-15T08:21:57.393+03:00"}
{"Id":437929,"Number":95,"KnessetNum":1,"Name":"ישיבת מליאה בתאריך 07/12/1949 בשעה 16:10","StartDate":"1949-12-07T16:10:00+02:00","FinishDate":"1949-12-07T22:25:00+02:00","IsSpecialMeeting":null,"LastUpdatedDate":"2020-10-15T08:17:06.347+03:00"}
{"Id":437930,"Number":98,"KnessetNum":1,"Name":"ישיבת מליאה בתאריך 26/12/1949 בשעה 16:07","StartDate":"1949-12-26T16:07:00+02:00","FinishDate":"1949-12-26T19:30:00+02:00","IsSpecialMeeting":null,"LastUpdatedDate":"2020-10-14T15:46:18.617+03:00"}
{"Id":437931,"Number":99,"KnessetNum":1,"Name":"ישיבת מליאה בתאריך 27/12/1949 בשעה 16:10","StartDate":"1949-12-27T16:10:00+02:00","FinishDate":"1949-12-27T19:20:00+02:00","IsSpecialMeeting":null,"LastUpdatedDate":"2020-10-14T15:39:41.013+03:00"}
{"Id":437932,"Number":100,"KnessetNum":1,"Name":"ישיבת מליאה בתאריך 28/12/1949 בשעה 16:10","StartDate":"1949-12-28T16:10:00+02:00","FinishDate":"1949-12-28T20:20:00+02:00","IsSpecialMeeting":null,"LastUpdatedDate":"2020-10-14T15:36:42.583+03:00"}
{"Id":437933,"Number":104,"KnessetNum":1,"Name":"ישיבת מליאה בתאריך 09/01/1950 בשעה 15:20","StartDate":"1950-01-09T15:20:00+02:00","FinishDate":"1950-01-09T20:10:00+02:00","IsSpecialMeeting":null,"LastUpdatedDate":"2020-10-14T15:26:44.023+03:00"}
{"Id":437934,"Number":106,"KnessetNum":1,"Name":"ישיבת מליאה בתאריך 16/01/1950 בשעה 16:10","StartDate":"1950-01-16T16:10:00+02:00","FinishDate":"1950-01-16T23:40:00+02:00","IsSpecialMeeting":null,"LastUpdatedDate":"2020-10-14T15:18:25.223+03:00"}
{"Id":437935,"Number":107,"KnessetNum":1,"Name":"ישיבת מליאה בתאריך 17/01/1950 בשעה 16:15","StartDate":"1950-01-17T16:15:00+02:00","FinishDate":"1950-01-18T00:30:00+02:00","IsSpecialMeeting":null,"LastUpdatedDate":"2025-01-21T09:12:39.877+02:00"}
{"Id":437936,"Number":108,"KnessetNum":1,"Name":"ישיבת מליאה בתאריך 23/01/1950 בשעה 16:15","StartDate":"1950-01-23T16:15:00+02:00","FinishDate":"1950-01-23T23:30:00+02:00","IsSpecialMeeting":null,"LastUpdatedDate":"2020-10-14T15:11:06.84+03:00"}
{"Id":437937,"Number":110,"KnessetNum":1,"Name":"ישיבת מליאה בתאריך 30/01/1950 בשעה 16:10","StartDate":"1950-01-30T16:10:00+02:00","FinishDate":"1950-01-30T20:25:00+02:00","IsSpecialMeeting":null,"LastUpdatedDate":"2021-06-23T13:11:47.717+03:00"}
{"Id":437938,"Number":111,"KnessetNum":1,"Name":"ישיבת מליאה בתאריך 31/01/1950 בשעה 16:10","StartDate":"1950-01-31T16:10:00+02:00","FinishDate":"1950-01-31T23:25:00+02:00","IsSpecialMeeting":null,"LastUpdatedDate":"2020-10-14T15:04:28.187+03:00"}
{"Id":437939,"Number":114,"KnessetNum":1,"Name":"ישיבת מליאה בתאריך 08/02/1950 בשעה 13:40","StartDate":"1950-02-08T13:40:00+02:00","FinishDate":"1950-02-08T15:50:00+02:00","IsSpecialMeeting":null,"LastUpdatedDate":"2020-10-14T14:48:07.343+03:00"}
{"Id":437940,"Number":119,"KnessetNum":1,"Name":"ישיבת מליאה בתאריך 27/02/1950 בשעה 16:15","StartDate":"1950-02-27T16:15:00+02:00","FinishDate":"1950-02-27T22:30:00+02:00","IsSpecialMeeting":null,"LastUpdatedDate":"2020-10-14T14:34:48.293+03:00"}
{"Id":437941,"Number":122,"KnessetNum":1,"Name":"ישיבת מליאה בתאריך 06/03/1950 בשעה 16:10","StartDate":"1950-03-06T16:10:00+02:00","FinishDate":"1950-03-06T22:40:00+02:00","IsSpecialMeeting":null,"LastUpdatedDate":"2020-10-04T12:00:45.087+03:00"}
{"Id":437942,"Number":125,"KnessetNum":1,"Name":"ישיבת מליאה בתאריך 13/03/1950 בשעה 16:07","StartDate":"1950-03-13T16:07:00+02:00","FinishDate":"1950-03-13T20:15:00+02:00","IsSpecialMeeting":null,"LastUpdatedDate":"2024-01-08T09:59:13.49+02:00"}
{"Id":437943,"Number":126,"KnessetNum":1,"Name":"ישיבת מליאה בתאריך 14/03/1950 בשעה 17:00","StartDate":"1950-03-14T17:00:00+02:00","FinishDate":"1950-03-14T20:23:00+02:00","IsSpecialMeeting":null,"LastUpdatedDate":"2020-10-14T14:18:52.083+03:00"}
{"Id":437944,"Number":127,"KnessetNum":1,"Name":"ישיבת מליאה בתאריך 15/03/1950 בשעה 13:35","StartDate":"1950-03-15T13:35:00+02:00","FinishDate":"1950-03-15T16:00:00+02:00","IsSpecialMeeting":null,"LastUpdatedDate":"2025-05-18T14:14:39.263+03:00"}
{"Id":437945,"Number":128,"KnessetNum":1,"Name":"ישיבת מליאה בתאריך 20/03/1950 בשעה 15:10","StartDate":"1950-03-20T15:10:00+02:00","FinishDate":"1950-03-20T22:00:00+02:00","IsSpecialMeeting":null,"LastUpdatedDate":"2021-06-29T09:22:35.11+03:00"}
{"Id":437946,"Number":129,"KnessetNum":1,"Name":"ישיבת מליאה בתאריך 21/03/1950 בשעה 15:35","StartDate":"1950-03-21T15:35:00+02:00","FinishDate":"1950-03-21T22:00:00+02:00","IsSpecialMeeting":null,"LastUpdatedDate":"2020-10-14T14:08:55.263+03:00"}
{"Id":437947,"Number":130,"KnessetNum":1,"Name":"ישיבת מליאה בתאריך 22/03/1950 בשעה 09:48","StartDate":"1950-03-22T09:48:00+02:00","FinishDate":"1950-03-22T16:30:00+02:00","IsSpecialMeeting":null,"LastUpdatedDate":"2020-10-14T14:06:08.46+03:00"}
{"Id":437948,"Number":147,"KnessetNum":1,"Name":"ישיבת מליאה בתאריך 05/06/1950 בשעה 15:10","StartDate":"1950-06-05T15:10:00+03:00","FinishDate":"1950-06-05T22:17:00+03:00","IsSpecialMeeting":null,"LastUpdatedDate":"2020-10-28T08:04:18.567+02:00"}
{"Id":437949,"Number":149,"KnessetNum":1,"Name":"ישיבת מליאה בתאריך 07/06/1950 בשעה 14:40","StartDate":"1950-06-07T14:40:00+03:00","FinishDate":"1950-06-07T17:25:00+03:00","IsSpecialMeeting":null,"LastUpdatedDate":"2020-10-14T12:18:31.77+03:00"}
{"Id":437950,"Number":151,"KnessetNum":1,"Name":"ישיבת מליאה בתאריך 13/06/1950 בשעה 15:20","StartDate":"1950-06-13T15:20:00+03:00","FinishDate":"1950-06-13T20:30:00+03:00","IsSpecialMeeting":null,"LastUpdatedDate":"2024-01-08T12:15:04.003+02:00"}
{"Id":437951,"Number":156,"KnessetNum":1,"Name":"ישיבת מליאה בתאריך 26/06/1950 בשעה 15:20","StartDate":"1950-06-26T15:20:00+03:00","FinishDate":"1950-06-26T20:00:00+03:00","IsSpecialMeeting":null,"LastUpdatedDate":"2020-10-14T11:50:51.237+03:00"}
