{"Id":470464,"Number":352,"KnessetNum":18,"Name":"ישיבת מליאה בתאריך 29/05/2012 בשעה 16:00","StartDate":"2012-05-29T16:00:00+03:00","FinishDate":"2012-05-29T19:50:00+03:00","IsSpecialMeeting":false,"LastUpdatedDate":"2020-12-15T17:42:08.52+02:00"}
{"Id":470465,"Number":353,"KnessetNum":18,"Name":"ישיבת מליאה בתאריך 30/05/2012 בשעה: 11:00","StartDate":"2012-05-30T11:00:00+03:00","FinishDate":"2012-05-30T16:20:00+03:00","IsSpecialMeeting":false,"LastUpdatedDate":"2013-10-03T16:21:47+03:00"}
{"Id":470868,"Number":354,"KnessetNum":18,"Name":"ישיבת מליאה בתאריך 04/06/2012 בשעה 16:00","StartDate":"2012-06-04T16:00:00+03:00","FinishDate":"2012-06-04T18:30:00+03:00","IsSpecialMeeting":false,"LastUpdatedDate":"2020-12-15T18:09:55.447+02:00"}
{"Id":470871,"Number":355,"KnessetNum":18,"Name":"ישיבת מליאה בתאריך 05/06/2012 בשעה: 16:00","StartDate":"2012-06-05T16:00:00+03:00","FinishDate":"2012-06-05T18:30:00+03:00","IsSpecialMeeting":false,"LastUpdatedDate":"2013-10-03T16:21:47+03:00"}
{"Id":470872,"Number":356,"KnessetNum":18,"Name":"ישיבת מליאה בתאריך 06/06/2012 בשעה: 11:00","StartDate":"2012-06-06T11:00:00+03:00","FinishDate":"2012-06-06T17:50:00+03:00","IsSpecialMeeting":false,"LastUpdatedDate":"2013-10-03T16:21:47+03:00"}
{"Id":471249,"Number":357,"KnessetNum":18,"Name":"ישיבת מליאה בתאריך 11/06/2012 בשעה 16:00","StartDate":"2012-06-11T16:00:00+03:00","FinishDate":"2012-06-11T19:10:00+03:00","IsSpecialMeeting":false,"LastUpdatedDate":"2020-12-15T17:48:42.84+02:00"}
{"Id":471454,"Number":358,"KnessetNum":18,"Name":"ישיבת מליאה בתאריך 12/06/2012 בשעה: 16:00","StartDate":"2012-06-12T16:00:00+03:00","FinishDate":"2012-06-12T19:20:00+03:00","IsSpecialMeeting":false,"LastUpdatedDate":"2013-10-03T16:21:47+03:00"}
{"Id":471455,"Number":359,"KnessetNum":18,"Name":"ישיבת מליאה בתאריך 13/06/2012 בשעה: 11:00","StartDate":"2012-06-13T11:00:00+03:00","FinishDate":"2012-06-13T16:10:00+03:00","IsSpecialMeeting":false,"LastUpdatedDate":"2013-10-03T16:21:47+03:00"}
{"Id":471690,"Number":360,"KnessetNum":18,"Name":"ישיבת מליאה בתאריך 18/06/2012 בשעה 16:00","StartDate":"2012-06-18T16:00:00+03:00","FinishDate":"2012-06-18T21:20:00+03:00","IsSpecialMeeting":false,"LastUpdatedDate":"2020-12-15T17:58:35.453+02:00"}
{"Id":471694,"Number":361,"KnessetNum":18,"Name":"ישיבת מליאה בתאריך 19/06/2012 בשעה: 16:00","StartDate":"2012-06-19T16:00:00+03:00","FinishDate":"2012-06-19T18:40:00+03:00","IsSpecialMeeting":false,"LastUpdatedDate":"2013-10-03T16:21:47+03:00"}
{"Id":471701,"Number":362,"KnessetNum":18,"Name":"ישיבת מליאה בתאריך 20/06/2012 בשעה 11:00","StartDate":"2012-06-20T11:00:00+03:00","FinishDate":"2012-06-20T16:30:00+03:00","IsSpecialMeeting":false,"LastUpdatedDate":"2020-12-15T17:49:24.963+02:00"}
{"Id":472066,"Number":363,"KnessetNum":18,"Name":"ישיבת מליאה בתאריך 25/06/2012 בשעה 16:00","StartDate":"2012-06-25T16:00:00+03:00","FinishDate":"2012-06-25T20:20:00+03:00","IsSpecialMeeting":false,"LastUpdatedDate":"2020-12-15T17:55:06.403+02:00"}
{"Id":472067,"Number":364,"KnessetNum":18,"Name":"ישיבת מליאה בתאריך 26/06/2012 בשעה 16:00","StartDate":"2012-06-26T16:00:00+03:00","FinishDate":"2012-06-26T19:10:00+03:00","IsSpecialMeeting":false,"LastUpdatedDate":"2020-12-15T17:49:45.71+02:00"}
{"Id":472068,"Number":365,"KnessetNum":18,"Name":"ישיבת מליאה בתאריך 27/06/2012 בשעה: 11:00","StartDate":"2012-06-27T11:00:00+03:00","FinishDate":"2012-06-27T18:10:00+03:00","IsSpecialMeeting":false,"LastUpdatedDate":"2013-10-03T16:21:47+03:00"}
{"Id":472508,"Number":366,"KnessetNum":18,"Name":"ישיבת מליאה בתאריך 03/07/2012 בשעה: 16:00","StartDate":"2012-07-03T16:00:00+03:00","FinishDate":"2012-07-03T18:00:00+03:00","IsSpecialMeeting":false,"LastUpdatedDate":"2013-10-03T16:21:47+03:00"}
{"Id":472509,"Number":367,"KnessetNum":18,"Name":"ישיבת מליאה בתאריך 04/07/2012 בשעה 11:00","StartDate":"2012-07-04T11:00:00+03:00","FinishDate":"2012-07-04T17:40:00+03:00","IsSpecialMeeting":false,"LastUpdatedDate":"2020-12-15T17:36:02.28+02:00"}
{"Id":472925,"Number":368,"KnessetNum":18,"Name":"ישיבת מליאה בתאריך 09/07/2012 בשעה 16:00","StartDate":"2012-07-09T16:00:00+03:00","FinishDate":"2012-07-09T22:00:00+03:00","IsSpecialMeeting":false,"LastUpdatedDate":"2020-12-15T18:22:34.887+02:00"}
{"Id":472974,"Number":369,"KnessetNum":18,"Name":"ישיבת מליאה בתאריך 10/07/2012 בשעה: 16:00","StartDate":"2012-07-10T16:00:00+03:00","FinishDate":"2012-07-10T19:40:00+03:00","IsSpecialMeeting":false,"LastUpdatedDate":"2013-10-03T16:21:47+03:00"}
{"Id":472980,"Number":370,"KnessetNum":18,"Name":"ישיבת מליאה בתאריך 11/07/2012 בשעה: 11:00","StartDate":"2012-07-11T11:00:00+03:00","FinishDate":"2012-07-11T18:10:00+03:00","IsSpecialMeeting":false,"LastUpdatedDate":"2013-10-03T16:21:47+03:00"}
{"Id":473408,"Number":371,"KnessetNum":18,"Name":"ישיבת מליאה בתאריך 16/07/2012 בשעה 16:00","StartDate":"2012-07-16T16:00:00+03:00","FinishDate":"2012-07-16T22:00:00+03:00","IsSpecialMeeting":false,"LastUpdatedDate":"2020-12-15T18:16:18.81+02:00"}
{"Id":473461,"Number":372,"KnessetNum":18,"Name":"ישיבת מליאה בתאריך 17/07/2012 בשעה: 16:00","StartDate":"2012-07-17T16:00:00+03:00","FinishDate":"2012-07-17T20:40:00+03:00","IsSpecialMeeting":false,"LastUpdatedDate":"2013-10-03T16:21:47+03:00"}
{"Id":473472,"Number":373,"KnessetNum":18,"Name":"ישיבת מליאה בתאריך 18/07/2012 בשעה 11:00","StartDate":"2012-07-18T11:00:00+03:00","FinishDate":"2012-07-18T21:00:00+03:00","IsSpecialMeeting":false,"LastUpdatedDate":"2020-12-15T17:17:30.7+02:00"}
{"Id":473911,"Number":374,"KnessetNum":18,"Name":"ישיבת מליאה בתאריך 23/07/2012 בשעה: 14:00","StartDate":"2012-07-23T14:00:00+03:00","FinishDate":"2012-07-23T18:30:00+03:00","IsSpecialMeeting":false,"LastUpdatedDate":"2013-10-03T16:21:47+03:00"}
{"Id":473926,"Number":375,"KnessetNum":18,"Name":"ישיבת מליאה בתאריך 24/07/2012 בשעה 16:00","StartDate":"2012-07-24T16:00:00+03:00","FinishDate":"2012-07-24T18:40:00+03:00","IsSpecialMeeting":false,"LastUpdatedDate":"2020-12-15T18:15:42.64+02:00"}
{"Id":473929,"Number":376,"KnessetNum":18,"Name":"ישיבת מליאה בתאריך 25/07/2012 בשעה 11:00","StartDate":"2012-07-25T11:00:00+03:00","FinishDate":"2012-07-25T22:10:00+03:00","IsSpecialMeeting":false,"LastUpdatedDate":"2020-12-15T18:31:51.513+02:00"}
{"Id":474391,"Number":377,"KnessetNum":18,"Name":"ישיבת מליאה בתאריך 06/08/2012 בשעה 12:00","StartDate":"2012-08-06T12:00:00+03:00","FinishDate":"2012-08-06T22:00:00+03:00","IsSpecialMeeting":false,"LastUpdatedDate":"2020-12-15T17:03:28.017+02:00"}
{"Id":474591,"Number":378,"KnessetNum":18,"Name":"ישיבת מליאה בתאריך 16/08/2012 בשעה: 11:00","StartDate":"2012-08-16T11:00:00+03:00","FinishDate":"2012-08-16T14:20:00+03:00","IsSpecialMeeting":false,"LastUpdatedDate":"2013-10-03T16:21:47+03:00"}
{"Id":474649,"Number":379,"KnessetNum":18,"Name":"ישיבת מליאה בתאריך 29/08/2012 בשעה: 11:00","StartDate":"2012-08-29T11:00:00+03:00","FinishDate":"2012-08-29T14:10:00+03:00","IsSpecialMeeting":false,"LastUpdatedDate":"2013-10-03T16:21:47+03:00"}
{"Id":474929,"Number":380,"KnessetNum":18,"Name":"ישיבת מליאה בתאריך 12/09/2012 בשעה: 11:00","StartDate":"2012-09-12T11:00:00+03:00","FinishDate":"2012-09-12T14:00:00+03:00","IsSpecialMeeting":false,"LastUpdatedDate":"2013-10-03T16:21:47+03:00"}
{"Id":475376,"Number":381,"KnessetNum":18,"Name":"ישיבת מליאה בתאריך 15/10/2012 בשעה: 16:00","StartDate":"2012-10-15T16:00:00+02:00","FinishDate":"2012-10-16T01:00:00+02:00","IsSpecialMeeting":false,"LastUpdatedDate":"2013-10-03T16:21:47+03:00"}
{"Id":475469,"Number":382,"KnessetNum":18,"Name":"ישיבת מליאה בתאריך 16/10/2012 בשעה: 17:30","StartDate":"2012-10-16T17:30:00+02:00","FinishDate":"2012-10-16T18:40:00+02:00","IsSpecialMeeting":true,"LastUpdatedDate":"2013-10-03T16:21:47+03:00"}
{"Id":475671,"Number":383,"KnessetNum":18,"Name":"ישיבת מליאה בתאריך 28/10/2012 בשעה: 17:00","StartDate":"2012-10-28T17:00:00+02:00","FinishDate":"2012-10-28T18:20:00+02:00","IsSpecialMeeting":true,"LastUpdatedDate":"2013-10-03T16:21:47+03:00"}
{"Id":475752,"Number":384,"KnessetNum":18,"Name":"ישיבת מליאה בתאריך 05/11/2012 בשעה 11:00","StartDate":"2012-11-05T11:00:00+02:00","FinishDate":"2012-11-05T16:00:00+02:00","IsSpecialMeeting":false,"LastUpdatedDate":"2020-12-15T18:08:33.93+02:00"}
{"Id":476212,"Number":385,"KnessetNum":18,"Name":"ישיבת מליאה בתאריך 03/12/2012 בשעה: 11:00","StartDate":"2012-12-03T11:00:00+02:00","FinishDate":"2012-12-03T13:10:00+02:00","IsSpecialMeeting":false,"LastUpdatedDate":"2013-10-03T16:21:47+03:00"}
{"Id":476489,"Number":386,"KnessetNum":18,"Name":"ישיבת מליאה בתאריך 20/12/2012 בשעה 13:00","StartDate":"2012-12-20T13:00:00+02:00","FinishDate":"2012-12-21T02:20:00+02:00","IsSpecialMeeting":false,"LastUpdatedDate":"2020-12-15T17:08:38.033+02:00"}
{"Id":477029,"Number":1,"KnessetNum":19,"Name":"ישיבת מליאה בתאריך 05/02/2013 בשעה: 16:00","StartDate":"2013-02-05T16:00:00+02:00","FinishDate":"2013-02-05T17:10:00+02:00","IsSpecialMeeting":false,"LastUpdatedDate":"2015-03-17T20:01:23+02:00"}
{"Id":477049,"Number":44,"KnessetNum":13,"Name":"ישיבת מליאה בתאריך 30/12/1992 בשעה 09:00","StartDate":"1992-12-30T09:00:00+02:00","FinishDate":"1992-12-31T03:58:00+02:00","IsSpecialMeeting":null,"LastUpdatedDate":"2021-12-26T13:01:00.13+02:00"}
{"Id":477050,"Number":129,"KnessetNum":13,"Name":"ישיבת מליאה בתאריך 21/09/1993 בשעה 11:02","StartDate":"1993-09-21T11:02:00+03:00","FinishDate":"1993-09-21T22:08:00+03:00","IsSpecialMeeting":true,"LastUpdatedDate":"2025-02-13T11:11:28.137+02:00"}
{"Id":477051,"Number":130,"KnessetNum":13,"Name":"ישיבת מליאה בתאריך 22/09/1993 בשעה 09:00","StartDate":"1993-09-22T09:00:00+02:00","FinishDate":"1993-09-23T00:34:00+02:00","IsSpecialMeeting":true,"LastUpdatedDate":"2025-02-13T11:13:11.437+02:00"}
{"Id":477052,"Number":139,"KnessetNum":13,"Name":"ישיבת מליאה בתאריך 26/10/1993 בשעה 15:01","StartDate":"1993-10-26T15:01:00+02:00","FinishDate":"1993-10-26T20:13:00+02:00","IsSpecialMeeting":null,"LastUpdatedDate":"2025-02-13T11:41:29.6+02:00"}
{"Id":477053,"Number":167,"KnessetNum":13,"Name":"ישיבת מליאה בתאריך 29/12/1993 בשעה 09:00","StartDate":"1993-12-29T09:00:00+02:00","FinishDate":"1993-12-30T01:25:00+02:00","IsSpecialMeeting":null,"LastUpdatedDate":"2025-02-13T12:32:18.52+02:00"}
{"Id":477054,"Number":249,"KnessetNum":13,"Name":"ישיבת מליאה בתאריך 03/08/1994 בשעה 11:03","StartDate":"1994-08-03T11:03:00+03:00","FinishDate":"1994-08-03T15:28:00+03:00","IsSpecialMeeting":true,"LastUpdatedDate":"2025-02-16T09:32:18.15+02:00"}
{"Id":477055,"Number":291,"KnessetNum":13,"Name":"ישיבת מליאה בתאריך 28/12/1994 בשעה 11:01","StartDate":"1994-12-28T11:01:00+02:00","FinishDate":"1994-12-29T10:59:00+02:00","IsSpecialMeeting":null,"LastUpdatedDate":"2025-02-16T11:44:45.767+02:00"}
{"Id":477056,"Number":1,"KnessetNum":14,"Name":"ישיבת מליאה בתאריך 17/06/1996 בשעה 16:01","StartDate":"1996-06-17T16:01:00+03:00","FinishDate":"1996-06-17T17:22:00+03:00","IsSpecialMeeting":null,"LastUpdatedDate":"2025-02-23T12:46:06.337+02:00"}
{"Id":477057,"Number":2,"KnessetNum":14,"Name":"ישיבת מליאה בתאריך 18/06/1996 בשעה 16:01","StartDate":"1996-06-18T16:01:00+03:00","FinishDate":"1996-06-18T23:09:00+03:00","IsSpecialMeeting":null,"LastUpdatedDate":"2025-02-23T13:38:54.937+02:00"}
{"Id":477058,"Number":129,"KnessetNum":14,"Name":"ישיבת מליאה בתאריך 05/08/1997 בשעה 11:03","StartDate":"1997-08-05T11:03:00+03:00","FinishDate":"1997-08-05T14:37:00+03:00","IsSpecialMeeting":true,"LastUpdatedDate":"2025-02-24T11:20:05.397+02:00"}
{"Id":477059,"Number":131,"KnessetNum":14,"Name":"ישיבת מליאה בתאריך 09/09/1997 בשעה 11:03","StartDate":"1997-09-09T11:03:00+03:00","FinishDate":"1997-09-09T14:02:00+03:00","IsSpecialMeeting":true,"LastUpdatedDate":"2025-02-24T11:21:36.657+02:00"}
{"Id":477060,"Number":376,"KnessetNum":13,"Name":"ישיבת מליאה בתאריך 05/10/1995 בשעה 12:42","StartDate":"1995-10-05T12:42:00+02:00","FinishDate":"1995-10-06T04:15:00+02:00","IsSpecialMeeting":true,"LastUpdatedDate":"2025-02-16T16:18:36.103+02:00"}
{"Id":477061,"Number":161,"KnessetNum":14,"Name":"ישיבת מליאה בתאריך 28/12/1997 בשעה 16:02","StartDate":"1997-12-28T16:02:00+02:00","FinishDate":"1997-12-28T23:24:00+02:00","IsSpecialMeeting":null,"LastUpdatedDate":"2025-02-24T11:42:51.46+02:00"}
{"Id":477062,"Number":178,"KnessetNum":14,"Name":"ישיבת מליאה בתאריך 11/02/1998 בשעה 11:03","StartDate":"1998-02-11T11:03:00+02:00","FinishDate":"1998-02-11T12:58:00+02:00","IsSpecialMeeting":null,"LastUpdatedDate":"2020-06-10T15:51:34.103+03:00"}
{"Id":477063,"Number":213,"KnessetNum":14,"Name":"ישיבת מליאה בתאריך 09/06/1998 בשעה 16:02","StartDate":"1998-06-09T16:02:00+03:00","FinishDate":"1998-06-09T19:46:00+03:00","IsSpecialMeeting":null,"LastUpdatedDate":"2025-02-25T08:39:39.547+02:00"}
{"Id":477064,"Number":242,"KnessetNum":14,"Name":"ישיבת מליאה בתאריך 27/10/1998 בשעה 16:03","StartDate":"1998-10-27T16:03:00+02:00","FinishDate":"1998-10-27T21:59:00+02:00","IsSpecialMeeting":null,"LastUpdatedDate":"2025-02-25T10:36:14.107+02:00"}
{"Id":477065,"Number":1,"KnessetNum":15,"Name":"ישיבת מליאה בתאריך 07/06/1999 בשעה 16:01","StartDate":"1999-06-07T16:01:00+03:00","FinishDate":"1999-06-07T16:39:00+03:00","IsSpecialMeeting":null,"LastUpdatedDate":"2025-02-25T13:19:25.987+02:00"}
{"Id":477066,"Number":11,"KnessetNum":15,"Name":"ישיבת מליאה בתאריך 06/07/1999 בשעה 16:00","StartDate":"1999-07-06T16:00:00+03:00","FinishDate":"1999-07-06T22:42:00+03:00","IsSpecialMeeting":null,"LastUpdatedDate":"2025-02-25T14:29:31.147+02:00"}
{"Id":477067,"Number":26,"KnessetNum":15,"Name":"ישיבת מליאה בתאריך 08/09/1999 בשעה 14:02","StartDate":"1999-09-08T14:02:00+03:00","FinishDate":"1999-09-08T20:47:00+03:00","IsSpecialMeeting":true,"LastUpdatedDate":"2025-02-25T15:12:21.337+02:00"}
{"Id":477068,"Number":37,"KnessetNum":15,"Name":"ישיבת מליאה בתאריך 21/10/1999 בשעה 17:00","StartDate":"1999-10-21T17:00:00+02:00","FinishDate":"1999-10-21T17:42:00+02:00","IsSpecialMeeting":true,"LastUpdatedDate":"2025-02-25T15:54:27.26+02:00"}
{"Id":477069,"Number":39,"KnessetNum":15,"Name":"ישיבת מליאה בתאריך 26/10/1999 בשעה 16:00","StartDate":"1999-10-26T16:00:00+02:00","FinishDate":"1999-10-26T21:55:00+02:00","IsSpecialMeeting":null,"LastUpdatedDate":"2025-02-25T15:56:29.233+02:00"}
{"Id":477070,"Number":60,"KnessetNum":15,"Name":"ישיבת מליאה בתאריך 14/12/1999 בשעה 16:02","StartDate":"1999-12-14T16:02:00+02:00","FinishDate":"1999-12-14T20:28:00+02:00","IsSpecialMeeting":null,"LastUpdatedDate":"2025-02-26T08:43:25.003+02:00"}
{"Id":477071,"Number":110,"KnessetNum":15,"Name":"ישיבת מליאה בתאריך 25/05/2000 בשעה 16:20","StartDate":"2000-05-25T16:20:00+03:00","FinishDate":"2000-05-25T19:43:00+03:00","IsSpecialMeeting":null,"LastUpdatedDate":"2025-02-26T11:52:45.367+02:00"}
{"Id":477072,"Number":140,"KnessetNum":15,"Name":"ישיבת מליאה בתאריך 01/08/2000 בשעה 18:32","StartDate":"2000-08-01T18:32:00+03:00","FinishDate":"2000-08-01T19:29:00+03:00","IsSpecialMeeting":null,"LastUpdatedDate":"2025-02-27T09:09:03.977+02:00"}
{"Id":477073,"Number":146,"KnessetNum":15,"Name":"ישיבת מליאה בתאריך 31/10/2000 בשעה 15:00","StartDate":"2000-10-31T15:00:00+02:00","FinishDate":"2000-10-31T20:47:00+02:00","IsSpecialMeeting":null,"LastUpdatedDate":"2025-02-27T09:46:16.877+02:00"}
{"Id":477074,"Number":151,"KnessetNum":15,"Name":"ישיבת מליאה בתאריך 09/11/2000 בשעה 17:01","StartDate":"2000-11-09T17:01:00+02:00","FinishDate":"2000-11-09T17:42:00+02:00","IsSpecialMeeting":null,"LastUpdatedDate":"2025-02-27T09:52:37.21+02:00"}
{"Id":477075,"Number":231,"KnessetNum":15,"Name":"ישיבת מליאה בתאריך 16/09/2001 בשעה 11:32","StartDate":"2001-09-16T11:32:00+03:00","FinishDate":"2001-09-16T14:05:00+03:00","IsSpecialMeeting":null,"LastUpdatedDate":"2025-02-27T13:21:46.533+02:00"}
{"Id":477076,"Number":232,"KnessetNum":15,"Name":"ישיבת מליאה בתאריך 11/10/2001 בשעה 11:03","StartDate":"2001-10-11T11:03:00+02:00","FinishDate":"2001-10-11T12:35:00+02:00","IsSpecialMeeting":null,"LastUpdatedDate":"2025-02-27T13:22:46.923+02:00"}
{"Id":477077,"Number":296,"KnessetNum":15,"Name":"ישיבת מליאה בתאריך 08/04/2002 בשעה 11:05","StartDate":"2002-04-08T11:05:00+03:00","FinishDate":"2002-04-08T15:49:00+03:00","IsSpecialMeeting":true,"LastUpdatedDate":"2025-03-03T11:06:12.087+02:00"}
{"Id":477078,"Number":343,"KnessetNum":15,"Name":"ישיבת מליאה בתאריך 17/10/2002 בשעה 17:00","StartDate":"2002-10-17T17:00:00+02:00","FinishDate":"2002-10-17T17:40:00+02:00","IsSpecialMeeting":null,"LastUpdatedDate":"2025-03-03T13:07:30.087+02:00"}
{"Id":477079,"Number":348,"KnessetNum":15,"Name":"ישיבת מליאה בתאריך 29/10/2002 בשעה 16:02","StartDate":"2002-10-29T16:02:00+02:00","FinishDate":"2002-10-29T22:17:00+02:00","IsSpecialMeeting":null,"LastUpdatedDate":"2025-03-03T13:17:42.057+02:00"}
{"Id":477080,"Number":368,"KnessetNum":12,"Name":"ישיבת מליאה בתאריך 07/01/1992 בשעה 16:04","StartDate":"1992-01-07T16:04:00+02:00","FinishDate":"1992-01-08T05:31:00+02:00","IsSpecialMeeting":null,"LastUpdatedDate":"2025-03-09T14:10:45.777+02:00"}
{"Id":477081,"Number":338,"KnessetNum":12,"Name":"ישיבת מליאה בתאריך 29/10/1991 בשעה 16:02","StartDate":"1991-10-29T16:02:00+02:00","FinishDate":"1991-10-29T20:43:00+02:00","IsSpecialMeeting":null,"LastUpdatedDate":"2025-03-09T11:11:41.93+02:00"}
{"Id":477082,"Number":245,"KnessetNum":12,"Name":"ישיבת מליאה בתאריך 25/12/1990 בשעה 16:01","StartDate":"1990-12-25T16:01:00+02:00","FinishDate":"1990-12-25T20:34:00+02:00","IsSpecialMeeting":null,"LastUpdatedDate":"2025-03-06T10:04:12.867+02:00"}
{"Id":477083,"Number":258,"KnessetNum":12,"Name":"ישיבת מליאה בתאריך 23/01/1991 בשעה 11:04","StartDate":"1991-01-23T11:04:00+02:00","FinishDate":"1991-01-23T14:47:00+02:00","IsSpecialMeeting":null,"LastUpdatedDate":"2025-03-06T11:22:49.59+02:00"}
{"Id":477084,"Number":221,"KnessetNum":12,"Name":"ישיבת מליאה בתאריך 30/10/1990 בשעה 16:01","StartDate":"1990-10-30T16:01:00+02:00","FinishDate":"1990-10-30T20:11:00+02:00","IsSpecialMeeting":null,"LastUpdatedDate":"2025-03-06T08:50:28.993+02:00"}
{"Id":477085,"Number":171,"KnessetNum":12,"Name":"ישיבת מליאה בתאריך 11/04/1990 בשעה 09:03","StartDate":"1990-04-11T09:03:00+03:00","FinishDate":"1990-04-11T12:07:00+03:00","IsSpecialMeeting":null,"LastUpdatedDate":"2025-03-04T14:35:02.097+02:00"}
{"Id":477086,"Number":176,"KnessetNum":12,"Name":"ישיבת מליאה בתאריך 15/05/1990 בשעה 16:02","StartDate":"1990-05-15T16:02:00+03:00","FinishDate":"1990-05-15T23:01:00+03:00","IsSpecialMeeting":null,"LastUpdatedDate":"2025-09-11T14:39:18.837+03:00"}
{"Id":477087,"Number":1,"KnessetNum":13,"Name":"ישיבת מליאה בתאריך 13/07/1992 בשעה 16:01","StartDate":"1992-07-13T16:01:00+03:00","FinishDate":"1992-07-13T22:48:00+03:00","IsSpecialMeeting":null,"LastUpdatedDate":"2025-02-12T11:27:30.693+02:00"}
{"Id":477088,"Number":2,"KnessetNum":13,"Name":"ישיבת מליאה בתאריך 14/07/1992 בשעה 16:00","StartDate":"1992-07-14T16:00:00+03:00","FinishDate":"1992-07-14T16:46:00+03:00","IsSpecialMeeting":null,"LastUpdatedDate":"2025-02-12T11:56:38.8+02:00"}
{"Id":477089,"Number":1,"KnessetNum":12,"Name":"ישיבת מליאה בתאריך 21/11/1988 בשעה 16:01","StartDate":"1988-11-21T16:01:00+02:00","FinishDate":"1988-11-21T17:55:00+02:00","IsSpecialMeeting":null,"LastUpdatedDate":"2024-02-18T12:33:35.52+02:00"}
{"Id":477090,"Number":4,"KnessetNum":12,"Name":"ישיבת מליאה בתאריך 30/11/1988 בשעה 11:03","StartDate":"1988-11-30T11:03:00+02:00","FinishDate":"1988-11-30T12:00:00+02:00","IsSpecialMeeting":null,"LastUpdatedDate":"2024-03-13T10:26:37.773+02:00"}
{"Id":477091,"Number":17,"KnessetNum":12,"Name":"ישיבת מליאה בתאריך 03/01/1989 בשעה 16:02","StartDate":"1989-01-03T16:02:00+02:00","FinishDate":"1989-01-03T20:12:00+02:00","IsSpecialMeeting":null,"LastUpdatedDate":"2024-04-01T15:22:11.59+03:00"}
{"Id":477092,"Number":26,"KnessetNum":12,"Name":"ישיבת מליאה בתאריך 24/01/1989 בשעה 16:04","StartDate":"1989-01-24T16:04:00+02:00","FinishDate":"1989-01-24T17:53:00+02:00","IsSpecialMeeting":null,"LastUpdatedDate":"2024-05-07T16:37:22.433+03:00"}
{"Id":477093,"Number":30,"KnessetNum":12,"Name":"ישיבת מליאה בתאריך 01/02/1989 בשעה 11:05","StartDate":"1989-02-01T11:05:00+02:00","FinishDate":"1989-02-01T15:10:00+02:00","IsSpecialMeeting":null,"LastUpdatedDate":"2024-06-03T01:33:04.41+03:00"}
{"Id":478114,"Number":2,"KnessetNum":19,"Name":"ישיבת מליאה בתאריך 11/02/2013 בשעה: 16:00","StartDate":"2013-02-11T16:00:00+02:00","FinishDate":"2013-02-11T20:00:00+02:00","IsSpecialMeeting":false,"LastUpdatedDate":"2015-03-17T20:22:16+02:00"}
{"Id":478272,"Number":3,"KnessetNum":19,"Name":"ישיבת מליאה בתאריך 12/02/2013 בשעה: 16:00","StartDate":"2013-02-12T16:00:00+02:00","FinishDate":"2013-02-12T19:00:00+02:00","IsSpecialMeeting":false,"LastUpdatedDate":"2015-03-17T20:15:11+02:00"}
{"Id":478333,"Number":4,"KnessetNum":19,"Name":"ישיבת מליאה בתאריך 13/02/2013 בשעה: 11:00","StartDate":"2013-02-13T11:00:00+02:00","FinishDate":"2013-02-13T14:00:00+02:00","IsSpecialMeeting":false,"LastUpdatedDate":"2015-03-17T20:17:10+02:00"}
{"Id":478579,"Number":5,"KnessetNum":19,"Name":"ישיבת מליאה בתאריך 18/02/2013 בשעה: 16:00","StartDate":"2013-02-18T16:00:00+02:00","FinishDate":"2013-02-18T22:30:00+02:00","IsSpecialMeeting":false,"LastUpdatedDate":"2015-03-17T20:12:43+02:00"}
{"Id":478753,"Number":6,"KnessetNum":19,"Name":"ישיבת מליאה בתאריך 19/02/2013 בשעה: 16:00","StartDate":"2013-02-19T16:00:00+02:00","FinishDate":"2013-02-19T21:00:00+02:00","IsSpecialMeeting":false,"LastUpdatedDate":"2015-03-17T20:19:21+02:00"}
{"Id":478837,"Number":7,"KnessetNum":19,"Name":"ישיבת מליאה בתאריך 20/02/2013 בשעה: 11:00","StartDate":"2013-02-20T11:00:00+02:00","FinishDate":"2013-02-20T16:10:00+02:00","IsSpecialMeeting":false,"LastUpdatedDate":"2015-03-17T19:56:58+02:00"}
{"Id":479053,"Number":8,"KnessetNum":19,"Name":"ישיבת מליאה בתאריך 26/02/2013 בשעה: 16:00","StartDate":"2013-02-26T16:00:00+02:00","FinishDate":"2013-02-26T18:50:00+02:00","IsSpecialMeeting":false,"LastUpdatedDate":"2015-03-17T20:21:11+02:00"}
{"Id":479113,"Number":9,"KnessetNum":19,"Name":"ישיבת מליאה בתאריך 27/02/2013 בשעה: 11:00","StartDate":"2013-02-27T11:00:00+02:00","FinishDate":"2013-02-27T17:40:00+02:00","IsSpecialMeeting":false,"LastUpdatedDate":"2015-03-17T20:19:40+02:00"}
{"Id":479349,"Number":10,"KnessetNum":19,"Name":"ישיבת מליאה בתאריך 04/03/2013 בשעה: 16:00","StartDate":"2013-03-04T16:00:00+02:00","FinishDate":"2013-03-04T18:50:00+02:00","IsSpecialMeeting":false,"LastUpdatedDate":"2015-03-17T20:03:20+02:00"}
{"Id":479389,"Number":11,"KnessetNum":19,"Name":"ישיבת מליאה בתאריך 05/03/2013 בשעה: 16:00","StartDate":"2013-03-05T16:00:00+02:00","FinishDate":"2013-03-05T19:50:00+02:00","IsSpecialMeeting":false,"LastUpdatedDate":"2015-03-17T20:09:45+02:00"}
{"Id":479395,"Number":12,"KnessetNum":19,"Name":"ישיבת מליאה בתאריך 06/03/2013 בשעה: 11:00","StartDate":"2013-03-06T11:00:00+02:00","FinishDate":"2013-03-06T16:50:00+02:00","IsSpecialMeeting":false,"LastUpdatedDate":"2015-03-17T20:13:20+02:00"}
{"Id":479661,"Number":13,"KnessetNum":19,"Name":"ישיבת מליאה בתאריך 11/03/2013 בשעה: 16:00","StartDate":"2013-03-11T16:00:00+02:00","FinishDate":"2013-03-11T18:40:00+02:00","IsSpecialMeeting":false,"LastUpdatedDate":"2015-03-17T20:06:20+02:00"}
{"Id":479793,"Number":14,"KnessetNum":19,"Name":"ישיבת מליאה בתאריך 12/03/2013 בשעה: 16:00","StartDate":"2013-03-12T16:00:00+02:00","FinishDate":"2013-03-12T17:20:00+02:00","IsSpecialMeeting":false,"LastUpdatedDate":"2015-03-17T20:17:19+02:00"}
{"Id":479833,"Number":15,"KnessetNum":19,"Name":"ישיבת מליאה בתאריך 13/03/2013 בשעה: 11:00","StartDate":"2013-03-13T11:00:00+02:00","FinishDate":"2013-03-13T13:10:00+02:00","IsSpecialMeeting":false,"LastUpdatedDate":"2015-03-17T20:06:29+02:00"}
{"Id":479917,"Number":16,"KnessetNum":19,"Name":"ישיבת מליאה בתאריך 18/03/2013 בשעה 15:00","StartDate":"2013-03-18T15:00:00+02:00","FinishDate":"2013-03-18T20:50:00+02:00","IsSpecialMeeting":false,"LastUpdatedDate":"2020-11-23T20:30:18.95+02:00"}