{"Id":370289,"Number":158,"KnessetNum":18,"Name":"ישיבת מליאה בתאריך 19/07/2010 בשעה: 11:00","StartDate":"2010-07-19T11:00:00+03:00","FinishDate":"2010-07-19T14:10:00+03:00","IsSpecialMeeting":false,"LastUpdatedDate":"2013-10-03T16:21:47+03:00"}
{"Id":370291,"Number":159,"KnessetNum":18,"Name":"ישיבת מליאה בתאריך 21/07/2010 בשעה 11:00","StartDate":"2010-07-21T11:00:00+03:00","FinishDate":"2010-07-21T21:10:00+03:00","IsSpecialMeeting":false,"LastUpdatedDate":"2020-12-14T18:23:34.147+02:00"}
{"Id":373009,"Number":160,"KnessetNum":18,"Name":"ישיבת מליאה בתאריך 09/08/2010 בשעה: 11:00","StartDate":"2010-08-09T11:00:00+03:00","FinishDate":"2010-08-09T14:50:00+03:00","IsSpecialMeeting":true,"LastUpdatedDate":"2013-10-03T16:21:47+03:00"}
{"Id":378720,"Number":6,"KnessetNum":12,"Name":"ישיבת מליאה בתאריך 07/12/1988 בשעה 11:01","StartDate":"1988-12-07T11:01:00+02:00","FinishDate":"1988-12-07T15:40:00+02:00","IsSpecialMeeting":null,"LastUpdatedDate":"2024-03-13T15:06:35.903+02:00"}
{"Id":378721,"Number":9,"KnessetNum":12,"Name":"ישיבת מליאה בתאריך 14/12/1988 בשעה 11:05","StartDate":"1988-12-14T11:05:00+02:00","FinishDate":"1988-12-14T15:23:00+02:00","IsSpecialMeeting":null,"LastUpdatedDate":"2024-03-27T16:37:41.01+02:00"}
{"Id":378722,"Number":18,"KnessetNum":12,"Name":"ישיבת מליאה בתאריך 04/01/1989 בשעה 11:30","StartDate":"1989-01-04T11:30:00+02:00","FinishDate":"1989-01-04T15:03:00+02:00","IsSpecialMeeting":null,"LastUpdatedDate":"2024-04-01T16:48:58.95+03:00"}
{"Id":378723,"Number":35,"KnessetNum":12,"Name":"ישיבת מליאה בתאריך 14/02/1989 בשעה 16:00","StartDate":"1989-02-14T16:00:00+02:00","FinishDate":"1989-02-14T21:09:00+02:00","IsSpecialMeeting":null,"LastUpdatedDate":"2024-06-23T15:31:57.26+03:00"}
{"Id":378724,"Number":36,"KnessetNum":12,"Name":"ישיבת מליאה בתאריך 15/02/1989 בשעה 11:01","StartDate":"1989-02-15T11:01:00+02:00","FinishDate":"1989-02-15T18:22:00+02:00","IsSpecialMeeting":null,"LastUpdatedDate":"2024-09-26T10:22:23.93+03:00"}
{"Id":378725,"Number":43,"KnessetNum":12,"Name":"ישיבת מליאה בתאריך 07/03/1989 בשעה 16:00","StartDate":"1989-03-07T16:00:00+02:00","FinishDate":"1989-03-07T20:14:00+02:00","IsSpecialMeeting":null,"LastUpdatedDate":"2025-01-27T14:33:28.053+02:00"}
{"Id":378726,"Number":44,"KnessetNum":12,"Name":"ישיבת מליאה בתאריך 08/03/1989 בשעה 11:02","StartDate":"1989-03-08T11:02:00+02:00","FinishDate":"1989-03-08T15:40:00+02:00","IsSpecialMeeting":null,"LastUpdatedDate":"2025-01-28T14:24:10.31+02:00"}
{"Id":378727,"Number":59,"KnessetNum":12,"Name":"ישיבת מליאה בתאריך 03/05/1989 בשעה 11:03","StartDate":"1989-05-03T11:03:00+03:00","FinishDate":"1989-05-03T12:15:00+03:00","IsSpecialMeeting":null,"LastUpdatedDate":"2025-02-24T13:59:11.987+02:00"}
{"Id":378728,"Number":80,"KnessetNum":12,"Name":"ישיבת מליאה בתאריך 28/06/1989 בשעה 11:00","StartDate":"1989-06-28T11:00:00+03:00","FinishDate":"1989-06-28T18:00:00+03:00","IsSpecialMeeting":null,"LastUpdatedDate":"2025-05-06T18:38:54.073+03:00"}
{"Id":378729,"Number":83,"KnessetNum":12,"Name":"ישיבת מליאה בתאריך 05/07/1989 בשעה 11:00","StartDate":"1989-07-05T11:00:00+03:00","FinishDate":"1989-07-05T16:31:00+03:00","IsSpecialMeeting":null,"LastUpdatedDate":"2025-03-03T16:56:17.683+02:00"}
{"Id":378730,"Number":88,"KnessetNum":12,"Name":"ישיבת מליאה בתאריך 18/07/1989 בשעה 16:00","StartDate":"1989-07-18T16:00:00+03:00","FinishDate":"1989-07-18T20:20:00+03:00","IsSpecialMeeting":null,"LastUpdatedDate":"2025-03-03T17:12:10.007+02:00"}
{"Id":378731,"Number":100,"KnessetNum":12,"Name":"ישיבת מליאה בתאריך 11/10/1989 בשעה 12:03","StartDate":"1989-10-11T12:03:00+02:00","FinishDate":"1989-10-11T13:45:00+02:00","IsSpecialMeeting":null,"LastUpdatedDate":"2025-06-17T20:57:25.143+03:00"}
{"Id":378732,"Number":109,"KnessetNum":12,"Name":"ישיבת מליאה בתאריך 07/11/1989 בשעה 16:00","StartDate":"1989-11-07T16:00:00+02:00","FinishDate":"1989-11-07T20:25:00+02:00","IsSpecialMeeting":null,"LastUpdatedDate":"2025-03-04T08:31:44.56+02:00"}
{"Id":378733,"Number":142,"KnessetNum":12,"Name":"ישיבת מליאה בתאריך 23/01/1990 בשעה 16:00","StartDate":"1990-01-23T16:00:00+02:00","FinishDate":"1990-01-23T22:10:00+02:00","IsSpecialMeeting":null,"LastUpdatedDate":"2025-07-09T12:55:45.807+03:00"}
{"Id":378734,"Number":184,"KnessetNum":12,"Name":"ישיבת מליאה בתאריך 06/06/1990 בשעה 11:01","StartDate":"1990-06-06T11:01:00+03:00","FinishDate":"1990-06-06T16:30:00+03:00","IsSpecialMeeting":null,"LastUpdatedDate":"2025-03-04T15:05:33.183+02:00"}
{"Id":378735,"Number":208,"KnessetNum":12,"Name":"ישיבת מליאה בתאריך 07/08/1990 בשעה 12:01","StartDate":"1990-08-07T12:01:00+03:00","FinishDate":"1990-08-07T15:25:00+03:00","IsSpecialMeeting":null,"LastUpdatedDate":"2025-03-06T08:21:58.647+02:00"}
{"Id":378736,"Number":216,"KnessetNum":12,"Name":"ישיבת מליאה בתאריך 17/10/1990 בשעה 11:03","StartDate":"1990-10-17T11:03:00+02:00","FinishDate":"1990-10-17T15:57:00+02:00","IsSpecialMeeting":null,"LastUpdatedDate":"2025-03-06T08:46:20.077+02:00"}
{"Id":378737,"Number":234,"KnessetNum":12,"Name":"ישיבת מליאה בתאריך 28/11/1990 בשעה 11:02","StartDate":"1990-11-28T11:02:00+02:00","FinishDate":"1990-11-28T18:58:00+02:00","IsSpecialMeeting":null,"LastUpdatedDate":"2025-11-10T11:57:52.923+02:00"}
{"Id":378738,"Number":252,"KnessetNum":12,"Name":"ישיבת מליאה בתאריך 09/01/1991 בשעה 11:03","StartDate":"1991-01-09T11:03:00+02:00","FinishDate":"1991-01-09T13:57:00+02:00","IsSpecialMeeting":null,"LastUpdatedDate":"2025-03-06T10:21:14.507+02:00"}
{"Id":378739,"Number":255,"KnessetNum":12,"Name":"ישיבת מליאה בתאריך 16/01/1991 בשעה 11:07","StartDate":"1991-01-16T11:07:00+02:00","FinishDate":"1991-01-16T15:34:00+02:00","IsSpecialMeeting":null,"LastUpdatedDate":"2025-03-06T10:24:48.123+02:00"}
{"Id":378740,"Number":283,"KnessetNum":12,"Name":"ישיבת מליאה בתאריך 10/04/1991 בשעה 10:03","StartDate":"1991-04-10T10:03:00+03:00","FinishDate":"1991-04-10T11:15:00+03:00","IsSpecialMeeting":null,"LastUpdatedDate":"2025-03-06T11:35:09.747+02:00"}
{"Id":378741,"Number":284,"KnessetNum":12,"Name":"ישיבת מליאה בתאריך 15/04/1991 בשעה 10:04","StartDate":"1991-04-15T10:04:00+03:00","FinishDate":"1991-04-15T11:00:00+03:00","IsSpecialMeeting":null,"LastUpdatedDate":"2025-03-06T11:35:57.953+02:00"}
{"Id":378742,"Number":290,"KnessetNum":12,"Name":"ישיבת מליאה בתאריך 01/05/1991 בשעה 11:03","StartDate":"1991-05-01T11:03:00+03:00","FinishDate":"1991-05-01T16:39:00+03:00","IsSpecialMeeting":null,"LastUpdatedDate":"2025-03-09T08:44:46.507+02:00"}
{"Id":378743,"Number":327,"KnessetNum":12,"Name":"ישיבת מליאה בתאריך 26/08/1991 בשעה 11:02","StartDate":"1991-08-26T11:02:00+03:00","FinishDate":"1991-08-26T13:09:00+03:00","IsSpecialMeeting":null,"LastUpdatedDate":"2026-01-28T16:32:08.53+02:00"}
{"Id":378744,"Number":339,"KnessetNum":12,"Name":"ישיבת מליאה בתאריך 30/10/1991 בשעה 11:00","StartDate":"1991-10-30T11:00:00+02:00","FinishDate":"1991-10-30T15:42:00+02:00","IsSpecialMeeting":null,"LastUpdatedDate":"2025-03-09T11:32:54.823+02:00"}
{"Id":378745,"Number":348,"KnessetNum":12,"Name":"ישיבת מליאה בתאריך 20/11/1991 בשעה 11:03","StartDate":"1991-11-20T11:03:00+02:00","FinishDate":"1991-11-20T14:28:00+02:00","IsSpecialMeeting":null,"LastUpdatedDate":"2025-03-09T12:02:58.95+02:00"}
{"Id":378746,"Number":128,"KnessetNum":13,"Name":"ישיבת מליאה בתאריך 09/09/1993 בשעה 11:02","StartDate":"1993-09-09T11:02:00+03:00","FinishDate":"1993-09-09T18:57:00+03:00","IsSpecialMeeting":true,"LastUpdatedDate":"2025-02-13T11:10:58.227+02:00"}
{"Id":378747,"Number":295,"KnessetNum":15,"Name":"ישיבת מליאה בתאריך 04/04/2002 בשעה 11:04","StartDate":"2002-04-04T11:04:00+03:00","FinishDate":"2002-04-04T13:19:00+03:00","IsSpecialMeeting":true,"LastUpdatedDate":"2025-03-03T11:05:33.787+02:00"}