{"Id":157346,"Number":21,"KnessetNum":1,"Name":"ישיבת מליאה בתאריך 06/04/1949 בשעה 16:10","StartDate":"1949-04-06T16:10:00+03:00","FinishDate":"1949-04-06T19:10:00+03:00","IsSpecialMeeting":null,"LastUpdatedDate":"2020-10-15T13:30:59.42+03:00"}
{"Id":157356,"Number":38,"KnessetNum":1,"Name":"ישיבת מליאה בתאריך 06/06/1949 בשעה 16:10","StartDate":"1949-06-06T16:10:00+03:00","FinishDate":"1949-06-06T22:00:00+03:00","IsSpecialMeeting":null,"LastUpdatedDate":"2021-05-24T10:31:20.89+03:00"}
{"Id":157360,"Number":42,"KnessetNum":1,"Name":"ישיבת מליאה בתאריך 14/06/1949 בשעה 16:08","StartDate":"1949-06-14T16:08:00+03:00","FinishDate":"1949-06-14T18:50:00+03:00","IsSpecialMeeting":null,"LastUpdatedDate":"2021-05-24T16:08:43.29+03:00"}
{"Id":157361,"Number":43,"KnessetNum":1,"Name":"ישיבת מליאה בתאריך 15/06/1949 בשעה 16:10","StartDate":"1949-06-15T16:10:00+03:00","FinishDate":"1949-06-15T22:40:00+03:00","IsSpecialMeeting":null,"LastUpdatedDate":"2020-10-15T12:08:47.427+03:00"}
{"Id":157362,"Number":45,"KnessetNum":1,"Name":"ישיבת מליאה בתאריך 21/06/1949 בשעה 16:20","StartDate":"1949-06-21T16:20:00+03:00","FinishDate":"1949-06-21T20:00:00+03:00","IsSpecialMeeting":null,"LastUpdatedDate":"2021-05-24T17:43:55.01+03:00"}
{"Id":157363,"Number":46,"KnessetNum":1,"Name":"ישיבת מליאה בתאריך 22/06/1949 בשעה 16:25","StartDate":"1949-06-22T16:25:00+03:00","FinishDate":"1949-06-22T23:00:00+03:00","IsSpecialMeeting":null,"LastUpdatedDate":"2021-06-22T12:11:51.163+03:00"}
{"Id":157364,"Number":47,"KnessetNum":1,"Name":"ישיבת מליאה בתאריך 27/06/1949 בשעה 16:10","StartDate":"1949-06-27T16:10:00+03:00","FinishDate":"1949-06-27T23:03:00+03:00","IsSpecialMeeting":null,"LastUpdatedDate":"2021-05-27T08:49:54.917+03:00"}
{"Id":157366,"Number":52,"KnessetNum":1,"Name":"ישיבת מליאה בתאריך 06/07/1949 בשעה 16:11","StartDate":"1949-07-06T16:11:00+03:00","FinishDate":"1949-07-06T22:25:00+03:00","IsSpecialMeeting":null,"LastUpdatedDate":"2020-10-15T11:41:07.81+03:00"}
{"Id":157367,"Number":54,"KnessetNum":1,"Name":"ישיבת מליאה בתאריך 12/07/1949 בשעה 16:15","StartDate":"1949-07-12T16:15:00+03:00","FinishDate":"1949-07-12T22:55:00+03:00","IsSpecialMeeting":null,"LastUpdatedDate":"2025-01-21T08:55:01.46+02:00"}
{"Id":157368,"Number":56,"KnessetNum":1,"Name":"ישיבת מליאה בתאריך 18/07/1949 בשעה 16:10","StartDate":"1949-07-18T16:10:00+03:00","FinishDate":"1949-07-18T22:40:00+03:00","IsSpecialMeeting":null,"LastUpdatedDate":"2020-10-15T11:04:28.063+03:00"}
{"Id":157369,"Number":57,"KnessetNum":1,"Name":"ישיבת מליאה בתאריך 19/07/1949 בשעה 16:10","StartDate":"1949-07-19T16:10:00+03:00","FinishDate":"1949-07-19T23:00:00+03:00","IsSpecialMeeting":null,"LastUpdatedDate":"2020-10-15T11:01:16.23+03:00"}
{"Id":157370,"Number":59,"KnessetNum":1,"Name":"ישיבת מליאה בתאריך 25/07/1949 בשעה 16:10","StartDate":"1949-07-25T16:10:00+03:00","FinishDate":"1949-07-25T23:00:00+03:00","IsSpecialMeeting":null,"LastUpdatedDate":"2020-10-15T10:54:08.157+03:00"}
{"Id":157371,"Number":60,"KnessetNum":1,"Name":"ישיבת מליאה בתאריך 26/07/1949 בשעה 16:10","StartDate":"1949-07-26T16:10:00+03:00","FinishDate":"1949-07-26T20:50:00+03:00","IsSpecialMeeting":null,"LastUpdatedDate":"2020-10-15T10:46:12.263+03:00"}
{"Id":157372,"Number":61,"KnessetNum":1,"Name":"ישיבת מליאה בתאריך 27/07/1949 בשעה 16:05","StartDate":"1949-07-27T16:05:00+03:00","FinishDate":"1949-07-27T20:15:00+03:00","IsSpecialMeeting":null,"LastUpdatedDate":"2021-05-31T14:51:24.74+03:00"}
{"Id":157374,"Number":62,"KnessetNum":1,"Name":"ישיבת מליאה בתאריך 01/08/1949 בשעה 16:10","StartDate":"1949-08-01T16:10:00+03:00","FinishDate":"1949-08-01T23:00:00+03:00","IsSpecialMeeting":null,"LastUpdatedDate":"2020-10-15T10:33:44.707+03:00"}
{"Id":157375,"Number":63,"KnessetNum":1,"Name":"ישיבת מליאה בתאריך 02/08/1949 בשעה 16:10","StartDate":"1949-08-02T16:10:00+03:00","FinishDate":"1949-08-02T20:30:00+03:00","IsSpecialMeeting":null,"LastUpdatedDate":"2020-10-15T10:31:10.623+03:00"}
{"Id":157376,"Number":66,"KnessetNum":1,"Name":"ישיבת מליאה בתאריך 09/08/1949 בשעה 16:10","StartDate":"1949-08-09T16:10:00+03:00","FinishDate":"1949-08-09T20:20:00+03:00","IsSpecialMeeting":null,"LastUpdatedDate":"2020-10-15T10:19:46.003+03:00"}
{"Id":157377,"Number":67,"KnessetNum":1,"Name":"ישיבת מליאה בתאריך 10/08/1949 בשעה 16:10","StartDate":"1949-08-10T16:10:00+03:00","FinishDate":"1949-08-10T21:00:00+03:00","IsSpecialMeeting":null,"LastUpdatedDate":"2020-10-15T10:17:36.877+03:00"}
{"Id":157378,"Number":68,"KnessetNum":1,"Name":"ישיבת מליאה בתאריך 15/08/1949 בשעה 15:15","StartDate":"1949-08-15T15:15:00+03:00","FinishDate":"1949-08-15T21:10:00+03:00","IsSpecialMeeting":null,"LastUpdatedDate":"2020-10-15T10:14:46.863+03:00"}
{"Id":157383,"Number":74,"KnessetNum":1,"Name":"ישיבת מליאה בתאריך 31/08/1949 בשעה 12:00","StartDate":"1949-08-31T12:00:00+03:00","FinishDate":"1949-09-01T02:25:00+03:00","IsSpecialMeeting":null,"LastUpdatedDate":"2020-10-15T09:47:12.903+03:00"}
{"Id":157387,"Number":80,"KnessetNum":1,"Name":"ישיבת מליאה בתאריך 12/09/1949 בשעה 11:15","StartDate":"1949-09-12T11:15:00+03:00","FinishDate":"1949-09-12T22:45:00+03:00","IsSpecialMeeting":null,"LastUpdatedDate":"2021-06-10T12:08:25.083+03:00"}
{"Id":157389,"Number":90,"KnessetNum":1,"Name":"ישיבת מליאה בתאריך 28/11/1949 בשעה 16:13","StartDate":"1949-11-28T16:13:00+02:00","FinishDate":"1949-11-28T22:25:00+02:00","IsSpecialMeeting":null,"LastUpdatedDate":"2020-10-15T08:35:42.023+03:00"}
{"Id":157393,"Number":97,"KnessetNum":1,"Name":"ישיבת מליאה בתאריך 14/12/1949 בשעה 16:15","StartDate":"1949-12-14T16:15:00+02:00","FinishDate":"1949-12-14T22:35:00+02:00","IsSpecialMeeting":null,"LastUpdatedDate":"2021-06-29T11:42:38.567+03:00"}
{"Id":157401,"Number":109,"KnessetNum":1,"Name":"ישיבת מליאה בתאריך 24/01/1950 בשעה 16:10","StartDate":"1950-01-24T16:10:00+02:00","FinishDate":"1950-01-24T22:10:00+02:00","IsSpecialMeeting":null,"LastUpdatedDate":"2021-12-26T12:40:12.697+02:00"}
{"Id":157405,"Number":118,"KnessetNum":1,"Name":"ישיבת מליאה בתאריך 21/02/1950 בשעה 16:10","StartDate":"1950-02-21T16:10:00+02:00","FinishDate":"1950-02-21T21:55:00+02:00","IsSpecialMeeting":null,"LastUpdatedDate":"2021-06-23T15:16:40.233+03:00"}
{"Id":157407,"Number":120,"KnessetNum":1,"Name":"ישיבת מליאה בתאריך 28/02/1950 בשעה 16:20","StartDate":"1950-02-28T16:20:00+02:00","FinishDate":"1950-02-28T22:30:00+02:00","IsSpecialMeeting":null,"LastUpdatedDate":"2020-10-14T14:32:28.52+03:00"}
{"Id":157415,"Number":131,"KnessetNum":1,"Name":"ישיבת מליאה בתאריך 27/03/1950 בשעה 15:15","StartDate":"1950-03-27T15:15:00+02:00","FinishDate":"1950-03-27T22:20:00+02:00","IsSpecialMeeting":null,"LastUpdatedDate":"2020-10-14T14:03:56.68+03:00"}
{"Id":157416,"Number":132,"KnessetNum":1,"Name":"ישיבת מליאה בתאריך 28/03/1950 בשעה 15:20","StartDate":"1950-03-28T15:20:00+02:00","FinishDate":"1950-03-29T00:05:00+02:00","IsSpecialMeeting":null,"LastUpdatedDate":"2020-10-14T14:01:44.393+03:00"}
{"Id":157417,"Number":133,"KnessetNum":1,"Name":"ישיבת מליאה בתאריך 29/03/1950 בשעה 10:13","StartDate":"1950-03-29T10:13:00+02:00","FinishDate":"1950-03-29T16:20:00+02:00","IsSpecialMeeting":null,"LastUpdatedDate":"2020-10-14T13:58:14.07+03:00"}
{"Id":157418,"Number":137,"KnessetNum":1,"Name":"ישיבת מליאה בתאריך 09/05/1950 בשעה 16:10","StartDate":"1950-05-09T16:10:00+03:00","FinishDate":"1950-05-09T17:50:00+03:00","IsSpecialMeeting":null,"LastUpdatedDate":"2020-10-14T13:46:10.163+03:00"}
{"Id":157419,"Number":138,"KnessetNum":1,"Name":"ישיבת מליאה בתאריך 10/05/1950 בשעה 16:10","StartDate":"1950-05-10T16:10:00+03:00","FinishDate":"1950-05-10T20:55:00+03:00","IsSpecialMeeting":null,"LastUpdatedDate":"2020-10-14T13:43:55.88+03:00"}
{"Id":157420,"Number":139,"KnessetNum":1,"Name":"ישיבת מליאה בתאריך 15/05/1950 בשעה 16:00","StartDate":"1950-05-15T16:00:00+03:00","FinishDate":"1950-05-15T22:10:00+03:00","IsSpecialMeeting":null,"LastUpdatedDate":"2020-10-14T13:37:14.26+03:00"}
{"Id":157421,"Number":141,"KnessetNum":1,"Name":"ישיבת מליאה בתאריך 17/05/1950 בשעה 14:45","StartDate":"1950-05-17T14:45:00+03:00","FinishDate":"1950-05-17T18:25:00+03:00","IsSpecialMeeting":null,"LastUpdatedDate":"2020-10-27T17:42:39.677+02:00"}
{"Id":157422,"Number":143,"KnessetNum":1,"Name":"ישיבת מליאה בתאריך 24/05/1950 בשעה 14:45","StartDate":"1950-05-24T14:45:00+03:00","FinishDate":"1950-05-24T21:20:00+03:00","IsSpecialMeeting":null,"LastUpdatedDate":"2020-10-27T17:44:31.967+02:00"}
{"Id":157423,"Number":144,"KnessetNum":1,"Name":"ישיבת מליאה בתאריך 29/05/1950 בשעה 15:10","StartDate":"1950-05-29T15:10:00+03:00","FinishDate":"1950-05-29T22:50:00+03:00","IsSpecialMeeting":null,"LastUpdatedDate":"2020-10-27T17:45:39.377+02:00"}
{"Id":157430,"Number":159,"KnessetNum":1,"Name":"ישיבת מליאה בתאריך 29/06/1950 בשעה 09:40","StartDate":"1950-06-29T09:40:00+03:00","FinishDate":"1950-06-29T14:00:00+03:00","IsSpecialMeeting":null,"LastUpdatedDate":"2020-10-28T08:30:30.3+02:00"}
{"Id":157431,"Number":160,"KnessetNum":1,"Name":"ישיבת מליאה בתאריך 03/07/1950 בשעה 15:15","StartDate":"1950-07-03T15:15:00+03:00","FinishDate":"1950-07-03T20:15:00+03:00","IsSpecialMeeting":null,"LastUpdatedDate":"2020-10-14T11:23:29.377+03:00"}
{"Id":157432,"Number":161,"KnessetNum":1,"Name":"ישיבת מליאה בתאריך 04/07/1950 בשעה 15:10","StartDate":"1950-07-04T15:10:00+03:00","FinishDate":"1950-07-05T00:50:00+03:00","IsSpecialMeeting":null,"LastUpdatedDate":"2025-01-21T09:11:21.163+02:00"}
{"Id":157434,"Number":163,"KnessetNum":1,"Name":"ישיבת מליאה בתאריך 10/07/1950 בשעה 15:15","StartDate":"1950-07-10T15:15:00+03:00","FinishDate":"1950-07-10T22:05:00+03:00","IsSpecialMeeting":null,"LastUpdatedDate":"2020-10-14T11:06:18.967+03:00"}
{"Id":157435,"Number":164,"KnessetNum":1,"Name":"ישיבת מליאה בתאריך 11/07/1950 בשעה 15:10","StartDate":"1950-07-11T15:10:00+03:00","FinishDate":"1950-07-11T22:25:00+03:00","IsSpecialMeeting":null,"LastUpdatedDate":"2020-10-14T11:03:39.617+03:00"}
{"Id":157436,"Number":165,"KnessetNum":1,"Name":"ישיבת מליאה בתאריך 12/07/1950 בשעה 14:40","StartDate":"1950-07-12T14:40:00+03:00","FinishDate":"1950-07-12T17:20:00+03:00","IsSpecialMeeting":null,"LastUpdatedDate":"2020-10-14T11:01:07.903+03:00"}
{"Id":157437,"Number":166,"KnessetNum":1,"Name":"ישיבת מליאה בתאריך 17/07/1950 בשעה 15:08","StartDate":"1950-07-17T15:08:00+03:00","FinishDate":"1950-07-17T21:10:00+03:00","IsSpecialMeeting":null,"LastUpdatedDate":"2020-10-14T10:58:03.753+03:00"}
{"Id":157438,"Number":167,"KnessetNum":1,"Name":"ישיבת מליאה בתאריך 18/07/1950 בשעה 15:10","StartDate":"1950-07-18T15:10:00+03:00","FinishDate":"1950-07-18T22:10:00+03:00","IsSpecialMeeting":null,"LastUpdatedDate":"2021-11-25T08:19:01.18+02:00"}
{"Id":157439,"Number":170,"KnessetNum":1,"Name":"ישיבת מליאה בתאריך 25/07/1950 בשעה 15:25","StartDate":"1950-07-25T15:25:00+03:00","FinishDate":"1950-07-25T21:40:00+03:00","IsSpecialMeeting":null,"LastUpdatedDate":"2020-10-14T10:39:24.897+03:00"}
{"Id":157440,"Number":171,"KnessetNum":1,"Name":"ישיבת מליאה בתאריך 26/07/1950 בשעה 14:40","StartDate":"1950-07-26T14:40:00+03:00","FinishDate":"1950-07-26T17:30:00+03:00","IsSpecialMeeting":null,"LastUpdatedDate":"2020-10-14T10:34:26.97+03:00"}
{"Id":157441,"Number":172,"KnessetNum":1,"Name":"ישיבת מליאה בתאריך 31/07/1950 בשעה 15:10","StartDate":"1950-07-31T15:10:00+03:00","FinishDate":"1950-07-31T22:00:00+03:00","IsSpecialMeeting":null,"LastUpdatedDate":"2021-11-22T18:55:08.267+02:00"}
{"Id":157442,"Number":173,"KnessetNum":1,"Name":"ישיבת מליאה בתאריך 01/08/1950 בשעה 15:10","StartDate":"1950-08-01T15:10:00+03:00","FinishDate":"1950-08-01T20:15:00+03:00","IsSpecialMeeting":null,"LastUpdatedDate":"2021-11-23T08:52:44.6+02:00"}
{"Id":157443,"Number":174,"KnessetNum":1,"Name":"ישיבת מליאה בתאריך 02/08/1950 בשעה 14:35","StartDate":"1950-08-02T14:35:00+03:00","FinishDate":"1950-08-02T18:00:00+03:00","IsSpecialMeeting":null,"LastUpdatedDate":"2020-10-14T10:09:27.927+03:00"}
{"Id":157445,"Number":178,"KnessetNum":1,"Name":"ישיבת מליאה בתאריך 10/08/1950 בשעה 09:10","StartDate":"1950-08-10T09:10:00+03:00","FinishDate":"1950-08-10T21:15:00+03:00","IsSpecialMeeting":null,"LastUpdatedDate":"2021-11-22T14:26:44.52+02:00"}
{"Id":157446,"Number":182,"KnessetNum":1,"Name":"ישיבת מליאה בתאריך 24/10/1950 בשעה 16:05","StartDate":"1950-10-24T16:05:00+02:00","FinishDate":"1950-10-24T18:55:00+02:00","IsSpecialMeeting":null,"LastUpdatedDate":"2020-10-14T09:01:54.617+03:00"}
{"Id":157447,"Number":183,"KnessetNum":1,"Name":"ישיבת מליאה בתאריך 25/10/1950 בשעה 16:05","StartDate":"1950-10-25T16:05:00+02:00","FinishDate":"1950-10-25T17:25:00+02:00","IsSpecialMeeting":null,"LastUpdatedDate":"2024-01-17T12:10:40.103+02:00"}
{"Id":157448,"Number":187,"KnessetNum":1,"Name":"ישיבת מליאה בתאריך 06/11/1950 בשעה 16:08","StartDate":"1950-11-06T16:08:00+02:00","FinishDate":"1950-11-06T22:05:00+02:00","IsSpecialMeeting":null,"LastUpdatedDate":"2020-10-14T08:09:20.16+03:00"}
{"Id":157449,"Number":188,"KnessetNum":1,"Name":"ישיבת מליאה בתאריך 07/11/1950 בשעה 16:10","StartDate":"1950-11-07T16:10:00+02:00","FinishDate":"1950-11-07T18:40:00+02:00","IsSpecialMeeting":null,"LastUpdatedDate":"2020-10-14T08:04:37.793+03:00"}
{"Id":157450,"Number":189,"KnessetNum":1,"Name":"ישיבת מליאה בתאריך 08/11/1950 בשעה 14:40","StartDate":"1950-11-08T14:40:00+02:00","FinishDate":"1950-11-08T15:20:00+02:00","IsSpecialMeeting":null,"LastUpdatedDate":"2024-01-17T12:22:19.92+02:00"}
{"Id":157451,"Number":191,"KnessetNum":1,"Name":"ישיבת מליאה בתאריך 16/11/1950 בשעה 11:10","StartDate":"1950-11-16T11:10:00+02:00","FinishDate":"1950-11-16T14:50:00+02:00","IsSpecialMeeting":null,"LastUpdatedDate":"2024-01-17T12:29:14.267+02:00"}
{"Id":157452,"Number":193,"KnessetNum":1,"Name":"ישיבת מליאה בתאריך 21/11/1950 בשעה 16:12","StartDate":"1950-11-21T16:12:00+02:00","FinishDate":"1950-11-21T16:12:00+02:00","IsSpecialMeeting":null,"LastUpdatedDate":"2020-10-13T17:32:22.583+03:00"}
{"Id":157457,"Number":208,"KnessetNum":1,"Name":"ישיבת מליאה בתאריך 02/01/1951 בשעה 16:10","StartDate":"1951-01-02T16:10:00+02:00","FinishDate":"1951-01-02T23:05:00+02:00","IsSpecialMeeting":null,"LastUpdatedDate":"2020-10-13T16:36:19.81+03:00"}
{"Id":157460,"Number":212,"KnessetNum":1,"Name":"ישיבת מליאה בתאריך 10/01/1951 בשעה 11:15","StartDate":"1951-01-10T11:15:00+02:00","FinishDate":"1951-01-10T13:55:00+02:00","IsSpecialMeeting":null,"LastUpdatedDate":"2020-10-13T16:23:01.393+03:00"}
{"Id":157461,"Number":213,"KnessetNum":1,"Name":"ישיבת מליאה בתאריך 15/01/1951 בשעה 16:10","StartDate":"1951-01-15T16:10:00+02:00","FinishDate":"1951-01-15T16:10:00+02:00","IsSpecialMeeting":null,"LastUpdatedDate":"2020-10-13T16:20:06.22+03:00"}
{"Id":157465,"Number":221,"KnessetNum":1,"Name":"ישיבת מליאה בתאריך 31/01/1951 בשעה 11:05","StartDate":"1951-01-31T11:05:00+02:00","FinishDate":"1951-01-31T13:55:00+02:00","IsSpecialMeeting":null,"LastUpdatedDate":"2020-10-13T15:47:02.973+03:00"}
{"Id":157467,"Number":223,"KnessetNum":1,"Name":"ישיבת מליאה בתאריך 06/02/1951 בשעה 16:18","StartDate":"1951-02-06T16:18:00+02:00","FinishDate":"1951-02-06T20:20:00+02:00","IsSpecialMeeting":null,"LastUpdatedDate":"2020-10-13T15:38:56.673+03:00"}
{"Id":157470,"Number":231,"KnessetNum":1,"Name":"ישיבת מליאה בתאריך 26/02/1951 בשעה 16:10","StartDate":"1951-02-26T16:10:00+02:00","FinishDate":"1951-02-26T21:15:00+02:00","IsSpecialMeeting":null,"LastUpdatedDate":"2020-10-13T14:37:27.707+03:00"}
{"Id":157472,"Number":234,"KnessetNum":1,"Name":"ישיבת מליאה בתאריך 06/03/1951 בשעה 16:10","StartDate":"1951-03-06T16:10:00+02:00","FinishDate":"1951-03-06T23:30:00+02:00","IsSpecialMeeting":null,"LastUpdatedDate":"2024-01-28T10:53:29.517+02:00"}
{"Id":157473,"Number":235,"KnessetNum":1,"Name":"ישיבת מליאה בתאריך 07/03/1951 בשעה 11:15","StartDate":"1951-03-07T11:15:00+02:00","FinishDate":"1951-03-07T13:50:00+02:00","IsSpecialMeeting":null,"LastUpdatedDate":"2020-10-13T14:25:10.327+03:00"}
{"Id":157474,"Number":236,"KnessetNum":1,"Name":"ישיבת מליאה בתאריך 12/03/1951 בשעה 16:15","StartDate":"1951-03-12T16:15:00+02:00","FinishDate":"1951-03-12T18:50:00+02:00","IsSpecialMeeting":null,"LastUpdatedDate":"2021-11-27T09:27:08.443+02:00"}
{"Id":157477,"Number":240,"KnessetNum":1,"Name":"ישיבת מליאה בתאריך 20/03/1951 בשעה 16:12","StartDate":"1951-03-20T16:12:00+02:00","FinishDate":"1951-03-20T20:03:00+02:00","IsSpecialMeeting":null,"LastUpdatedDate":"2021-11-27T09:36:30.87+02:00"}
{"Id":157478,"Number":242,"KnessetNum":1,"Name":"ישיבת מליאה בתאריך 26/03/1951 בשעה 16:10","StartDate":"1951-03-26T16:10:00+02:00","FinishDate":"1951-03-26T21:20:00+02:00","IsSpecialMeeting":null,"LastUpdatedDate":"2021-11-27T10:07:04.263+02:00"}
{"Id":157480,"Number":244,"KnessetNum":1,"Name":"ישיבת מליאה בתאריך 28/03/1951 בשעה 08:40","StartDate":"1951-03-28T08:40:00+02:00","FinishDate":"1951-03-28T22:55:00+02:00","IsSpecialMeeting":null,"LastUpdatedDate":"2020-10-13T12:55:21.853+03:00"}
{"Id":157481,"Number":245,"KnessetNum":1,"Name":"ישיבת מליאה בתאריך 02/04/1951 בשעה 16:15","StartDate":"1951-04-02T16:15:00+02:00","FinishDate":"1951-04-02T22:55:00+02:00","IsSpecialMeeting":null,"LastUpdatedDate":"2020-10-13T12:50:20.783+03:00"}
{"Id":157482,"Number":246,"KnessetNum":1,"Name":"ישיבת מליאה בתאריך 04/04/1951 בשעה 11:25","StartDate":"1951-04-04T11:25:00+03:00","FinishDate":"1951-04-04T15:25:00+03:00","IsSpecialMeeting":null,"LastUpdatedDate":"2020-10-13T12:23:30.51+03:00"}
{"Id":157484,"Number":248,"KnessetNum":1,"Name":"ישיבת מליאה בתאריך 10/04/1951 בשעה 16:15","StartDate":"1951-04-10T16:15:00+03:00","FinishDate":"1951-04-10T23:40:00+03:00","IsSpecialMeeting":null,"LastUpdatedDate":"2020-10-13T12:15:17.443+03:00"}
{"Id":157486,"Number":252,"KnessetNum":1,"Name":"ישיבת מליאה בתאריך 15/05/1951 בשעה 16:10","StartDate":"1951-05-15T16:10:00+03:00","FinishDate":"1951-05-15T22:30:00+03:00","IsSpecialMeeting":null,"LastUpdatedDate":"2021-12-05T12:55:05.573+02:00"}
{"Id":157487,"Number":253,"KnessetNum":1,"Name":"ישיבת מליאה בתאריך 16/05/1951 בשעה 11:15","StartDate":"1951-05-16T11:15:00+03:00","FinishDate":"1951-05-16T13:45:00+03:00","IsSpecialMeeting":null,"LastUpdatedDate":"2020-10-13T11:49:39.857+03:00"}
{"Id":157491,"Number":262,"KnessetNum":1,"Name":"ישיבת מליאה בתאריך 06/06/1951 בשעה 11:20","StartDate":"1951-06-06T11:20:00+03:00","FinishDate":"1951-06-06T15:10:00+03:00","IsSpecialMeeting":null,"LastUpdatedDate":"2024-01-29T09:11:51.54+02:00"}
{"Id":157492,"Number":268,"KnessetNum":1,"Name":"ישיבת מליאה בתאריך 27/06/1951 בשעה 11:15","StartDate":"1951-06-27T11:15:00+03:00","FinishDate":"1951-06-27T13:40:00+03:00","IsSpecialMeeting":null,"LastUpdatedDate":"2020-10-13T10:36:53.03+03:00"}
{"Id":157494,"Number":265,"KnessetNum":1,"Name":"ישיבת מליאה בתאריך 20/06/1951 בשעה 11:15","StartDate":"1951-06-20T11:15:00+03:00","FinishDate":"1951-06-20T12:55:00+03:00","IsSpecialMeeting":null,"LastUpdatedDate":"2020-10-13T10:49:18.16+03:00"}
{"Id":157497,"Number":270,"KnessetNum":1,"Name":"ישיבת מליאה בתאריך 03/07/1951 בשעה 16:20","StartDate":"1951-07-03T16:20:00+03:00","FinishDate":"1951-07-03T21:25:00+03:00","IsSpecialMeeting":null,"LastUpdatedDate":"2020-10-13T09:58:59.163+03:00"}
{"Id":157498,"Number":271,"KnessetNum":1,"Name":"ישיבת מליאה בתאריך 17/07/1951 בשעה 16:20","StartDate":"1951-07-17T16:20:00+03:00","FinishDate":"1951-07-17T23:25:00+03:00","IsSpecialMeeting":null,"LastUpdatedDate":"2025-01-21T09:05:59.997+02:00"}
{"Id":157500,"Number":9,"KnessetNum":2,"Name":"ישיבת מליאה בתאריך 26/09/1951 בשעה 11:15","StartDate":"1951-09-26T11:15:00+02:00","FinishDate":"1951-09-26T13:20:00+02:00","IsSpecialMeeting":null,"LastUpdatedDate":"2020-10-26T10:51:35.077+02:00"}
{"Id":157502,"Number":11,"KnessetNum":2,"Name":"ישיבת מליאה בתאריך 04/10/1951 בשעה 16:25","StartDate":"1951-10-04T16:25:00+02:00","FinishDate":"1951-10-04T18:35:00+02:00","IsSpecialMeeting":null,"LastUpdatedDate":"2020-10-26T10:46:44.797+02:00"}
{"Id":157504,"Number":16,"KnessetNum":2,"Name":"ישיבת מליאה בתאריך 06/11/1951 בשעה 16:15","StartDate":"1951-11-06T16:15:00+02:00","FinishDate":"1951-11-06T19:20:00+02:00","IsSpecialMeeting":null,"LastUpdatedDate":"2020-10-26T10:36:22.42+02:00"}
{"Id":157505,"Number":17,"KnessetNum":2,"Name":"ישיבת מליאה בתאריך 12/11/1951 בשעה 16:15","StartDate":"1951-11-12T16:15:00+02:00","FinishDate":"1951-11-12T21:30:00+02:00","IsSpecialMeeting":null,"LastUpdatedDate":"2021-12-26T15:20:50.02+02:00"}
{"Id":157506,"Number":18,"KnessetNum":2,"Name":"ישיבת מליאה בתאריך 13/11/1951 בשעה 16:10","StartDate":"1951-11-13T16:10:00+02:00","FinishDate":"1951-11-13T21:35:00+02:00","IsSpecialMeeting":null,"LastUpdatedDate":"2020-10-26T10:31:59.33+02:00"}
{"Id":157507,"Number":21,"KnessetNum":2,"Name":"ישיבת מליאה בתאריך 20/11/1951 בשעה 16:00","StartDate":"1951-11-20T16:00:00+02:00","FinishDate":"1951-11-20T21:50:00+02:00","IsSpecialMeeting":null,"LastUpdatedDate":"2020-10-26T10:16:04.273+02:00"}
{"Id":157511,"Number":30,"KnessetNum":2,"Name":"ישיבת מליאה בתאריך 11/12/1951 בשעה 16:10","StartDate":"1951-12-11T16:10:00+02:00","FinishDate":"1951-12-11T23:00:00+02:00","IsSpecialMeeting":null,"LastUpdatedDate":"2020-10-26T09:37:04.887+02:00"}
{"Id":157516,"Number":47,"KnessetNum":2,"Name":"ישיבת מליאה בתאריך 28/01/1952 בשעה 16:07","StartDate":"1952-01-28T16:07:00+02:00","FinishDate":"1952-01-28T21:25:00+02:00","IsSpecialMeeting":null,"LastUpdatedDate":"2020-10-26T08:30:49.803+02:00"}
{"Id":157517,"Number":51,"KnessetNum":2,"Name":"ישיבת מליאה בתאריך 05/02/1952 בשעה 12:10","StartDate":"1952-02-05T12:10:00+02:00","FinishDate":"1952-02-05T14:30:00+02:00","IsSpecialMeeting":null,"LastUpdatedDate":"2020-10-26T08:16:35.563+02:00"}
{"Id":157518,"Number":52,"KnessetNum":2,"Name":"ישיבת מליאה בתאריך 06/02/1952 בשעה 12:10","StartDate":"1952-02-06T12:10:00+02:00","FinishDate":"1952-02-06T14:30:00+02:00","IsSpecialMeeting":null,"LastUpdatedDate":"2020-10-26T08:15:10.33+02:00"}
{"Id":157519,"Number":55,"KnessetNum":2,"Name":"ישיבת מליאה בתאריך 13/02/1952 בשעה 12:07","StartDate":"1952-02-13T12:07:00+02:00","FinishDate":"1952-02-13T15:50:00+02:00","IsSpecialMeeting":null,"LastUpdatedDate":"2021-08-09T07:23:46.063+03:00"}
{"Id":157520,"Number":59,"KnessetNum":2,"Name":"ישיבת מליאה בתאריך 25/02/1952 בשעה 16:07","StartDate":"1952-02-25T16:07:00+02:00","FinishDate":"1952-02-25T21:35:00+02:00","IsSpecialMeeting":null,"LastUpdatedDate":"2021-08-09T09:04:17.893+03:00"}
{"Id":157521,"Number":60,"KnessetNum":2,"Name":"ישיבת מליאה בתאריך 26/02/1952 בשעה 16:15","StartDate":"1952-02-26T16:15:00+02:00","FinishDate":"1952-02-26T21:50:00+02:00","IsSpecialMeeting":null,"LastUpdatedDate":"2020-10-25T13:48:43.297+02:00"}
{"Id":157523,"Number":64,"KnessetNum":2,"Name":"ישיבת מליאה בתאריך 05/03/1952 בשעה 16:10","StartDate":"1952-03-05T16:10:00+02:00","FinishDate":"1952-03-05T22:25:00+02:00","IsSpecialMeeting":null,"LastUpdatedDate":"2023-12-14T12:21:18.607+02:00"}
{"Id":157527,"Number":70,"KnessetNum":2,"Name":"ישיבת מליאה בתאריך 25/03/1952 בשעה 16:10","StartDate":"1952-03-25T16:10:00+02:00","FinishDate":"1952-03-25T19:25:00+02:00","IsSpecialMeeting":null,"LastUpdatedDate":"2020-10-25T13:29:09.3+02:00"}
{"Id":157528,"Number":71,"KnessetNum":2,"Name":"ישיבת מליאה בתאריך 26/03/1952 בשעה 20:05","StartDate":"1952-03-26T20:05:00+02:00","FinishDate":"1952-03-26T23:00:00+02:00","IsSpecialMeeting":null,"LastUpdatedDate":"2020-10-25T13:27:25.897+02:00"}
{"Id":157529,"Number":72,"KnessetNum":2,"Name":"ישיבת מליאה בתאריך 27/03/1952 בשעה 12:10","StartDate":"1952-03-27T12:10:00+02:00","FinishDate":"1952-03-27T14:30:00+02:00","IsSpecialMeeting":null,"LastUpdatedDate":"2020-10-25T13:25:02.83+02:00"}
{"Id":157530,"Number":75,"KnessetNum":2,"Name":"ישיבת מליאה בתאריך 01/04/1952 בשעה 09:10","StartDate":"1952-04-01T09:10:00+02:00","FinishDate":"1952-04-01T16:10:00+02:00","IsSpecialMeeting":null,"LastUpdatedDate":"2021-08-10T09:18:36.567+03:00"}
{"Id":157531,"Number":79,"KnessetNum":2,"Name":"ישיבת מליאה בתאריך 12/05/1952 בשעה 16:08","StartDate":"1952-05-12T16:08:00+03:00","FinishDate":"1952-05-12T22:10:00+03:00","IsSpecialMeeting":null,"LastUpdatedDate":"2021-08-10T11:20:04.867+03:00"}
{"Id":157532,"Number":80,"KnessetNum":2,"Name":"ישיבת מליאה בתאריך 13/05/1952 בשעה 16:07","StartDate":"1952-05-13T16:07:00+03:00","FinishDate":"1952-05-13T21:35:00+03:00","IsSpecialMeeting":null,"LastUpdatedDate":"2021-12-27T20:18:35.66+02:00"}
{"Id":157533,"Number":82,"KnessetNum":2,"Name":"ישיבת מליאה בתאריך 19/05/1952 בשעה 16:12","StartDate":"1952-05-19T16:12:00+03:00","FinishDate":"1952-05-19T21:33:00+03:00","IsSpecialMeeting":null,"LastUpdatedDate":"2020-10-25T12:11:42.347+02:00"}
{"Id":157534,"Number":83,"KnessetNum":2,"Name":"ישיבת מליאה בתאריך 20/05/1952 בשעה 16:08","StartDate":"1952-05-20T16:08:00+03:00","FinishDate":"1952-05-20T21:40:00+03:00","IsSpecialMeeting":null,"LastUpdatedDate":"2020-10-25T12:10:20.097+02:00"}
{"Id":157536,"Number":85,"KnessetNum":2,"Name":"ישיבת מליאה בתאריך 26/05/1952 בשעה 16:10","StartDate":"1952-05-26T16:10:00+03:00","FinishDate":"1952-05-26T21:50:00+03:00","IsSpecialMeeting":null,"LastUpdatedDate":"2020-10-25T12:06:16.553+02:00"}
{"Id":157539,"Number":90,"KnessetNum":2,"Name":"ישיבת מליאה בתאריך 04/06/1952 בשעה 12:10","StartDate":"1952-06-04T12:10:00+03:00","FinishDate":"1952-06-04T13:55:00+03:00","IsSpecialMeeting":null,"LastUpdatedDate":"2020-10-25T11:52:17.487+02:00"}
{"Id":157544,"Number":98,"KnessetNum":2,"Name":"ישיבת מליאה בתאריך 24/06/1952 בשעה 16:10","StartDate":"1952-06-24T16:10:00+03:00","FinishDate":"1952-06-24T20:20:00+03:00","IsSpecialMeeting":null,"LastUpdatedDate":"2020-10-25T11:30:58.593+02:00"}
{"Id":157545,"Number":100,"KnessetNum":2,"Name":"ישיבת מליאה בתאריך 30/06/1952 בשעה 16:07","StartDate":"1952-06-30T16:07:00+03:00","FinishDate":"1952-06-30T21:55:00+03:00","IsSpecialMeeting":null,"LastUpdatedDate":"2021-08-15T10:25:31.437+03:00"}
{"Id":157546,"Number":101,"KnessetNum":2,"Name":"ישיבת מליאה בתאריך 01/07/1952 בשעה 16:10","StartDate":"1952-07-01T16:10:00+03:00","FinishDate":"1952-07-01T22:15:00+03:00","IsSpecialMeeting":null,"LastUpdatedDate":"2021-08-15T11:02:13.247+03:00"}
{"Id":157548,"Number":104,"KnessetNum":2,"Name":"ישיבת מליאה בתאריך 08/07/1952 בשעה 16:10","StartDate":"1952-07-08T16:10:00+03:00","FinishDate":"1952-07-08T21:55:00+03:00","IsSpecialMeeting":null,"LastUpdatedDate":"2021-08-15T13:55:52.823+03:00"}
{"Id":157549,"Number":108,"KnessetNum":2,"Name":"ישיבת מליאה בתאריך 16/07/1952 בשעה 11:10","StartDate":"1952-07-16T11:10:00+03:00","FinishDate":"1952-07-16T14:45:00+03:00","IsSpecialMeeting":null,"LastUpdatedDate":"2021-08-16T13:48:17.5+03:00"}
{"Id":157550,"Number":109,"KnessetNum":2,"Name":"ישיבת מליאה בתאריך 21/07/1952 בשעה 16:10","StartDate":"1952-07-21T16:10:00+03:00","FinishDate":"1952-07-21T21:55:00+03:00","IsSpecialMeeting":null,"LastUpdatedDate":"2020-10-25T10:41:31.503+02:00"}
{"Id":157552,"Number":112,"KnessetNum":2,"Name":"ישיבת מליאה בתאריך 28/07/1952 בשעה 16:05","StartDate":"1952-07-28T16:05:00+03:00","FinishDate":"1952-07-28T21:51:00+03:00","IsSpecialMeeting":null,"LastUpdatedDate":"2020-10-25T10:35:14.033+02:00"}
{"Id":157553,"Number":113,"KnessetNum":2,"Name":"ישיבת מליאה בתאריך 29/07/1952 בשעה 16:12","StartDate":"1952-07-29T16:12:00+03:00","FinishDate":"1952-07-29T22:00:00+03:00","IsSpecialMeeting":null,"LastUpdatedDate":"2021-09-02T09:17:03.127+03:00"}
{"Id":157554,"Number":118,"KnessetNum":2,"Name":"ישיבת מליאה בתאריך 11/08/1952 בשעה 10:10","StartDate":"1952-08-11T10:10:00+03:00","FinishDate":"1952-08-11T22:00:00+03:00","IsSpecialMeeting":null,"LastUpdatedDate":"2020-10-25T10:15:33.757+02:00"}
{"Id":157555,"Number":119,"KnessetNum":2,"Name":"ישיבת מליאה בתאריך 12/08/1952 בשעה 16:10","StartDate":"1952-08-12T16:10:00+03:00","FinishDate":"1952-08-12T22:00:00+03:00","IsSpecialMeeting":null,"LastUpdatedDate":"2020-10-25T10:13:19.117+02:00"}
{"Id":157556,"Number":120,"KnessetNum":2,"Name":"ישיבת מליאה בתאריך 13/08/1952 בשעה 16:05","StartDate":"1952-08-13T16:05:00+03:00","FinishDate":"1952-08-13T22:25:00+03:00","IsSpecialMeeting":null,"LastUpdatedDate":"2020-10-25T10:11:22.57+02:00"}
{"Id":157559,"Number":125,"KnessetNum":2,"Name":"ישיבת מליאה בתאריך 21/08/1952 בשעה 10:03","StartDate":"1952-08-21T10:03:00+03:00","FinishDate":"1952-08-21T14:10:00+03:00","IsSpecialMeeting":null,"LastUpdatedDate":"2020-10-25T09:54:42.11+02:00"}
{"Id":157560,"Number":126,"KnessetNum":2,"Name":"ישיבת מליאה בתאריך 25/08/1952 בשעה 16:07","StartDate":"1952-08-25T16:07:00+03:00","FinishDate":"1952-08-25T22:10:00+03:00","IsSpecialMeeting":null,"LastUpdatedDate":"2021-10-31T14:10:32.547+02:00"}
{"Id":157562,"Number":128,"KnessetNum":2,"Name":"ישיבת מליאה בתאריך 27/08/1952 בשעה 16:07","StartDate":"1952-08-27T16:07:00+03:00","FinishDate":"1952-08-27T21:55:00+03:00","IsSpecialMeeting":null,"LastUpdatedDate":"2020-10-25T09:49:28.963+02:00"}
{"Id":157568,"Number":145,"KnessetNum":2,"Name":"ישיבת מליאה בתאריך 26/11/1952 בשעה 11:05","StartDate":"1952-11-26T11:05:00+02:00","FinishDate":"1952-11-26T12:45:00+02:00","IsSpecialMeeting":null,"LastUpdatedDate":"2021-09-05T13:38:46.537+03:00"}
{"Id":157584,"Number":197,"KnessetNum":2,"Name":"ישיבת מליאה בתאריך 25/02/1953 בשעה 11:12","StartDate":"1953-02-25T11:12:00+02:00","FinishDate":"1953-02-25T13:30:00+02:00","IsSpecialMeeting":null,"LastUpdatedDate":"2020-10-21T14:59:19.22+03:00"}
{"Id":157593,"Number":216,"KnessetNum":2,"Name":"ישיבת מליאה בתאריך 25/03/1953 בשעה 16:18","StartDate":"1953-03-25T16:18:00+02:00","FinishDate":"1953-03-25T21:25:00+02:00","IsSpecialMeeting":null,"LastUpdatedDate":"2021-09-30T10:27:53.657+03:00"}
{"Id":157597,"Number":228,"KnessetNum":2,"Name":"ישיבת מליאה בתאריך 13/05/1953 בשעה 11:15","StartDate":"1953-05-13T11:15:00+03:00","FinishDate":"1953-05-13T13:40:00+03:00","IsSpecialMeeting":null,"LastUpdatedDate":"2020-10-21T12:42:37.66+03:00"}
{"Id":157615,"Number":274,"KnessetNum":2,"Name":"ישיבת מליאה בתאריך 23/07/1953 בשעה 11:13","StartDate":"1953-07-23T11:13:00+03:00","FinishDate":"1953-07-23T13:30:00+03:00","IsSpecialMeeting":null,"LastUpdatedDate":"2020-10-21T09:29:08.067+03:00"}
{"Id":157625,"Number":298,"KnessetNum":2,"Name":"ישיבת מליאה בתאריך 20/08/1953 בשעה 11:05","StartDate":"1953-08-20T11:05:00+03:00","FinishDate":"1953-08-20T15:00:00+03:00","IsSpecialMeeting":null,"LastUpdatedDate":"2020-10-20T16:36:52.997+03:00"}
{"Id":157628,"Number":305,"KnessetNum":2,"Name":"ישיבת מליאה בתאריך 27/08/1953 בשעה 11:24","StartDate":"1953-08-27T11:24:00+03:00","FinishDate":"1953-08-27T15:00:00+03:00","IsSpecialMeeting":null,"LastUpdatedDate":"2020-10-20T15:44:19.983+03:00"}
{"Id":157636,"Number":332,"KnessetNum":2,"Name":"ישיבת מליאה בתאריך 08/12/1953 בשעה 16:10","StartDate":"1953-12-08T16:10:00+02:00","FinishDate":"1953-12-08T18:40:00+02:00","IsSpecialMeeting":null,"LastUpdatedDate":"2020-10-20T14:22:58.187+03:00"}
{"Id":157641,"Number":345,"KnessetNum":2,"Name":"ישיבת מליאה בתאריך 29/12/1953 בשעה 20:37","StartDate":"1953-12-29T20:37:00+02:00","FinishDate":"1953-12-29T21:50:00+02:00","IsSpecialMeeting":null,"LastUpdatedDate":"2020-10-20T12:19:40.363+03:00"}
{"Id":157645,"Number":356,"KnessetNum":2,"Name":"ישיבת מליאה בתאריך 18/01/1954 בשעה 16:10","StartDate":"1954-01-18T16:10:00+02:00","FinishDate":"1954-01-18T18:50:00+02:00","IsSpecialMeeting":null,"LastUpdatedDate":"2020-10-20T11:38:22.58+03:00"}
{"Id":157646,"Number":357,"KnessetNum":2,"Name":"ישיבת מליאה בתאריך 19/01/1954 בשעה 16:12","StartDate":"1954-01-19T16:12:00+02:00","FinishDate":"1954-01-19T18:35:00+02:00","IsSpecialMeeting":null,"LastUpdatedDate":"2020-10-20T11:35:47.757+03:00"}
{"Id":157663,"Number":411,"KnessetNum":2,"Name":"ישיבת מליאה בתאריך 06/04/1954 בשעה 20:04","StartDate":"1954-04-06T20:04:00+02:00","FinishDate":"1954-04-06T22:30:00+02:00","IsSpecialMeeting":null,"LastUpdatedDate":"2022-01-10T09:57:12.267+02:00"}
{"Id":157665,"Number":418,"KnessetNum":2,"Name":"ישיבת מליאה בתאריך 12/05/1954 בשעה 11:17","StartDate":"1954-05-12T11:17:00+03:00","FinishDate":"1954-05-12T12:50:00+03:00","IsSpecialMeeting":null,"LastUpdatedDate":"2020-10-19T17:49:37.183+03:00"}
{"Id":157675,"Number":454,"KnessetNum":2,"Name":"ישיבת מליאה בתאריך 07/07/1954 בשעה 11:10","StartDate":"1954-07-07T11:10:00+03:00","FinishDate":"1954-07-07T12:17:00+03:00","IsSpecialMeeting":null,"LastUpdatedDate":"2020-10-19T15:39:32.507+03:00"}
{"Id":157679,"Number":461,"KnessetNum":2,"Name":"ישיבת מליאה בתאריך 28/07/1954 בשעה 11:09","StartDate":"1954-07-28T11:09:00+03:00","FinishDate":"1954-07-28T13:25:00+03:00","IsSpecialMeeting":null,"LastUpdatedDate":"2022-01-18T12:23:41.283+02:00"}
{"Id":157686,"Number":475,"KnessetNum":2,"Name":"ישיבת מליאה בתאריך 18/08/1954 בשעה 11:02","StartDate":"1954-08-18T11:02:00+03:00","FinishDate":"1954-08-18T13:35:00+03:00","IsSpecialMeeting":null,"LastUpdatedDate":"2020-10-19T14:08:55.75+03:00"}
{"Id":157689,"Number":480,"KnessetNum":2,"Name":"ישיבת מליאה בתאריך 25/08/1954 בשעה 11:10","StartDate":"1954-08-25T11:10:00+03:00","FinishDate":"1954-08-25T12:50:00+03:00","IsSpecialMeeting":null,"LastUpdatedDate":"2020-10-19T13:47:52.943+03:00"}
{"Id":157697,"Number":503,"KnessetNum":2,"Name":"ישיבת מליאה בתאריך 23/11/1954 בשעה 20:07","StartDate":"1954-11-23T20:07:00+02:00","FinishDate":"1954-11-23T21:48:00+02:00","IsSpecialMeeting":null,"LastUpdatedDate":"2020-10-19T12:03:20.533+03:00"}
{"Id":157698,"Number":504,"KnessetNum":2,"Name":"ישיבת מליאה בתאריך 24/11/1954 בשעה 11:10","StartDate":"1954-11-24T11:10:00+02:00","FinishDate":"1954-11-24T13:20:00+02:00","IsSpecialMeeting":null,"LastUpdatedDate":"2020-10-19T12:01:20.39+03:00"}
{"Id":157701,"Number":511,"KnessetNum":2,"Name":"ישיבת מליאה בתאריך 07/12/1954 בשעה 20:05","StartDate":"1954-12-07T20:05:00+02:00","FinishDate":"1954-12-07T22:27:00+02:00","IsSpecialMeeting":null,"LastUpdatedDate":"2021-12-02T11:02:51.34+02:00"}
{"Id":157706,"Number":523,"KnessetNum":2,"Name":"ישיבת מליאה בתאריך 28/12/1954 בשעה 20:05","StartDate":"1954-12-28T20:05:00+02:00","FinishDate":"1954-12-28T21:53:00+02:00","IsSpecialMeeting":null,"LastUpdatedDate":"2020-10-19T10:39:29.14+03:00"}
{"Id":157721,"Number":586,"KnessetNum":2,"Name":"ישיבת מליאה בתאריך 31/03/1955 בשעה 15:05","StartDate":"1955-03-31T15:05:00+02:00","FinishDate":"1955-03-31T18:15:00+02:00","IsSpecialMeeting":null,"LastUpdatedDate":"2021-12-05T13:37:33.17+02:00"}
{"Id":157722,"Number":587,"KnessetNum":2,"Name":"ישיבת מליאה בתאריך 01/04/1955 בשעה 10:46","StartDate":"1955-04-01T10:46:00+02:00","FinishDate":"1955-04-01T14:43:00+02:00","IsSpecialMeeting":null,"LastUpdatedDate":"2021-12-26T12:44:05.51+02:00"}
{"Id":157726,"Number":595,"KnessetNum":2,"Name":"ישיבת מליאה בתאריך 17/05/1955 בשעה 20:05","StartDate":"1955-05-17T20:05:00+03:00","FinishDate":"1955-05-17T22:10:00+03:00","IsSpecialMeeting":null,"LastUpdatedDate":"2020-10-18T11:04:56.963+03:00"}
{"Id":157728,"Number":599,"KnessetNum":2,"Name":"ישיבת מליאה בתאריך 24/05/1955 בשעה 20:02","StartDate":"1955-05-24T20:02:00+03:00","FinishDate":"1955-05-24T22:20:00+03:00","IsSpecialMeeting":null,"LastUpdatedDate":"2020-10-18T10:51:08.687+03:00"}
{"Id":157730,"Number":603,"KnessetNum":2,"Name":"ישיבת מליאה בתאריך 31/05/1955 בשעה 10:10","StartDate":"1955-05-31T10:10:00+03:00","FinishDate":"1955-05-31T21:55:00+03:00","IsSpecialMeeting":null,"LastUpdatedDate":"2020-10-18T10:28:46.573+03:00"}
{"Id":157733,"Number":607,"KnessetNum":2,"Name":"ישיבת מליאה בתאריך 07/06/1955 בשעה 20:04","StartDate":"1955-06-07T20:04:00+03:00","FinishDate":"1955-06-07T22:00:00+03:00","IsSpecialMeeting":null,"LastUpdatedDate":"2020-10-18T09:58:26.547+03:00"}
{"Id":157772,"Number":101,"KnessetNum":3,"Name":"ישיבת מליאה בתאריך 14/03/1956 בשעה 11:05","StartDate":"1956-03-14T11:05:00+02:00","FinishDate":"1956-03-14T13:44:00+02:00","IsSpecialMeeting":null,"LastUpdatedDate":"2021-12-02T10:36:40.54+02:00"}
{"Id":157780,"Number":122,"KnessetNum":3,"Name":"ישיבת מליאה בתאריך 23/05/1956 בשעה 11:07","StartDate":"1956-05-23T11:07:00+03:00","FinishDate":"1956-05-23T13:05:00+03:00","IsSpecialMeeting":null,"LastUpdatedDate":"2021-12-05T12:22:23.91+02:00"}
{"Id":157799,"Number":163,"KnessetNum":3,"Name":"ישיבת מליאה בתאריך 25/07/1956 בשעה 20:05","StartDate":"1956-07-25T20:05:00+03:00","FinishDate":"1956-07-25T21:27:00+03:00","IsSpecialMeeting":null,"LastUpdatedDate":"2021-12-12T13:50:48.227+02:00"}
{"Id":157810,"Number":199,"KnessetNum":3,"Name":"ישיבת מליאה בתאריך 04/12/1956 בשעה 16:00","StartDate":"1956-12-04T16:00:00+02:00","FinishDate":"1956-12-04T19:35:00+02:00","IsSpecialMeeting":null,"LastUpdatedDate":"2021-12-15T17:45:26.02+02:00"}
{"Id":157811,"Number":201,"KnessetNum":3,"Name":"ישיבת מליאה בתאריך 10/12/1956 בשעה 16:10","StartDate":"1956-12-10T16:10:00+02:00","FinishDate":"1956-12-10T19:08:00+02:00","IsSpecialMeeting":null,"LastUpdatedDate":"2022-01-03T18:17:15.023+02:00"}
{"Id":157814,"Number":206,"KnessetNum":3,"Name":"ישיבת מליאה בתאריך 18/12/1956 בשעה 16:04","StartDate":"1956-12-18T16:04:00+02:00","FinishDate":"1956-12-18T19:45:00+02:00","IsSpecialMeeting":null,"LastUpdatedDate":"2021-12-16T10:55:19.533+02:00"}
{"Id":157821,"Number":222,"KnessetNum":3,"Name":"ישיבת מליאה בתאריך 14/01/1957 בשעה 16:11","StartDate":"1957-01-14T16:11:00+02:00","FinishDate":"1957-01-14T19:39:00+02:00","IsSpecialMeeting":null,"LastUpdatedDate":"2022-01-04T16:59:54.077+02:00"}
{"Id":157822,"Number":223,"KnessetNum":3,"Name":"ישיבת מליאה בתאריך 15/01/1957 בשעה 16:03","StartDate":"1957-01-15T16:03:00+02:00","FinishDate":"1957-01-15T19:02:00+02:00","IsSpecialMeeting":null,"LastUpdatedDate":"2022-01-04T17:33:53.803+02:00"}
{"Id":157823,"Number":230,"KnessetNum":3,"Name":"ישיבת מליאה בתאריך 28/01/1957 בשעה 20:15","StartDate":"1957-01-28T20:15:00+02:00","FinishDate":"1957-01-28T22:30:00+02:00","IsSpecialMeeting":null,"LastUpdatedDate":"2022-01-11T07:34:18.833+02:00"}
{"Id":157824,"Number":233,"KnessetNum":3,"Name":"ישיבת מליאה בתאריך 30/01/1957 בשעה 11:06","StartDate":"1957-01-30T11:06:00+02:00","FinishDate":"1957-01-30T13:52:00+02:00","IsSpecialMeeting":null,"LastUpdatedDate":"2022-01-11T16:50:22.187+02:00"}
{"Id":157844,"Number":296,"KnessetNum":3,"Name":"ישיבת מליאה בתאריך 27/05/1957 בשעה 16:08","StartDate":"1957-05-27T16:08:00+03:00","FinishDate":"1957-05-27T20:35:00+03:00","IsSpecialMeeting":null,"LastUpdatedDate":"2022-02-22T16:37:07.227+02:00"}
{"Id":157852,"Number":315,"KnessetNum":3,"Name":"ישיבת מליאה בתאריך 26/06/1957 בשעה 11:08","StartDate":"1957-06-26T11:08:00+03:00","FinishDate":"1957-06-26T12:50:00+03:00","IsSpecialMeeting":null,"LastUpdatedDate":"2022-02-23T14:34:30.567+02:00"}
{"Id":157854,"Number":318,"KnessetNum":3,"Name":"ישיבת מליאה בתאריך 02/07/1957 בשעה 20:34","StartDate":"1957-07-02T20:34:00+03:00","FinishDate":"1957-07-02T21:42:00+03:00","IsSpecialMeeting":null,"LastUpdatedDate":"2022-02-23T15:00:06.16+02:00"}
{"Id":157860,"Number":334,"KnessetNum":3,"Name":"ישיבת מליאה בתאריך 24/07/1957 בשעה 11:07","StartDate":"1957-07-24T11:07:00+03:00","FinishDate":"1957-07-24T13:55:00+03:00","IsSpecialMeeting":null,"LastUpdatedDate":"2022-02-24T15:24:16.823+02:00"}
{"Id":157868,"Number":356,"KnessetNum":3,"Name":"ישיבת מליאה בתאריך 12/11/1957 בשעה 16:10","StartDate":"1957-11-12T16:10:00+02:00","FinishDate":"1957-11-12T18:55:00+02:00","IsSpecialMeeting":null,"LastUpdatedDate":"2022-03-02T16:46:21.597+02:00"}
{"Id":157869,"Number":362,"KnessetNum":3,"Name":"ישיבת מליאה בתאריך 20/11/1957 בשעה 11:05","StartDate":"1957-11-20T11:05:00+02:00","FinishDate":"1957-11-20T12:43:00+02:00","IsSpecialMeeting":null,"LastUpdatedDate":"2022-03-02T19:23:24.633+02:00"}
{"Id":157871,"Number":368,"KnessetNum":3,"Name":"ישיבת מליאה בתאריך 03/12/1957 בשעה 16:08","StartDate":"1957-12-03T16:08:00+02:00","FinishDate":"1957-12-03T18:45:00+02:00","IsSpecialMeeting":null,"LastUpdatedDate":"2022-03-03T11:35:52.747+02:00"}
{"Id":157877,"Number":378,"KnessetNum":3,"Name":"ישיבת מליאה בתאריך 18/12/1957 בשעה 11:07","StartDate":"1957-12-18T11:07:00+02:00","FinishDate":"1957-12-18T11:39:00+02:00","IsSpecialMeeting":null,"LastUpdatedDate":"2022-03-03T15:03:02.16+02:00"}
{"Id":157883,"Number":401,"KnessetNum":3,"Name":"ישיבת מליאה בתאריך 28/01/1958 בשעה 16:03","StartDate":"1958-01-28T16:03:00+02:00","FinishDate":"1958-01-28T18:39:00+02:00","IsSpecialMeeting":null,"LastUpdatedDate":"2022-03-08T17:03:25.047+02:00"}
{"Id":157884,"Number":402,"KnessetNum":3,"Name":"ישיבת מליאה בתאריך 29/01/1958 בשעה 11:07","StartDate":"1958-01-29T11:07:00+02:00","FinishDate":"1958-01-29T13:01:00+02:00","IsSpecialMeeting":null,"LastUpdatedDate":"2022-03-08T17:08:31.98+02:00"}
{"Id":157906,"Number":452,"KnessetNum":3,"Name":"ישיבת מליאה בתאריך 31/03/1958 בשעה 11:50","StartDate":"1958-03-31T11:50:00+02:00","FinishDate":"1958-03-31T18:37:00+02:00","IsSpecialMeeting":null,"LastUpdatedDate":"2022-03-10T15:27:08.437+02:00"}
{"Id":157923,"Number":504,"KnessetNum":3,"Name":"ישיבת מליאה בתאריך 30/07/1958 בשעה 11:03","StartDate":"1958-07-30T11:03:00+03:00","FinishDate":"1958-07-30T12:02:00+03:00","IsSpecialMeeting":null,"LastUpdatedDate":"2022-04-05T11:24:34.56+03:00"}
{"Id":157929,"Number":523,"KnessetNum":3,"Name":"ישיבת מליאה בתאריך 28/10/1958 בשעה 16:10","StartDate":"1958-10-28T16:10:00+02:00","FinishDate":"1958-10-28T17:50:00+02:00","IsSpecialMeeting":null,"LastUpdatedDate":"2022-04-07T11:08:29.187+03:00"}
{"Id":157932,"Number":529,"KnessetNum":3,"Name":"ישיבת מליאה בתאריך 05/11/1958 בשעה 11:02","StartDate":"1958-11-05T11:02:00+02:00","FinishDate":"1958-11-05T12:30:00+02:00","IsSpecialMeeting":null,"LastUpdatedDate":"2022-04-07T14:18:28.533+03:00"}
{"Id":157954,"Number":579,"KnessetNum":3,"Name":"ישיבת מליאה בתאריך 20/01/1959 בשעה 16:04","StartDate":"1959-01-20T16:04:00+02:00","FinishDate":"1959-01-20T20:15:00+02:00","IsSpecialMeeting":null,"LastUpdatedDate":"2023-11-01T11:29:27.277+02:00"}
{"Id":157955,"Number":580,"KnessetNum":3,"Name":"ישיבת מליאה בתאריך 21/01/1959 בשעה 11:08","StartDate":"1959-01-21T11:08:00+02:00","FinishDate":"1959-01-21T13:00:00+02:00","IsSpecialMeeting":null,"LastUpdatedDate":"2022-04-24T09:40:03.83+03:00"}
{"Id":157973,"Number":633,"KnessetNum":3,"Name":"ישיבת מליאה בתאריך 08/04/1959 בשעה 12:09","StartDate":"1959-04-08T12:09:00+03:00","FinishDate":"1959-04-08T13:55:00+03:00","IsSpecialMeeting":null,"LastUpdatedDate":"2023-10-30T11:06:30.683+02:00"}
{"Id":157974,"Number":634,"KnessetNum":3,"Name":"ישיבת מליאה בתאריך 27/04/1959 בשעה 12:04","StartDate":"1959-04-27T12:04:00+03:00","FinishDate":"1959-04-27T13:38:00+03:00","IsSpecialMeeting":null,"LastUpdatedDate":"2025-05-11T10:16:09.09+03:00"}
{"Id":157975,"Number":636,"KnessetNum":3,"Name":"ישיבת מליאה בתאריך 25/05/1959 בשעה 16:00","StartDate":"1959-05-25T16:00:00+03:00","FinishDate":"1959-05-25T19:00:00+03:00","IsSpecialMeeting":null,"LastUpdatedDate":"2023-10-30T10:33:24.23+02:00"}
{"Id":157985,"Number":668,"KnessetNum":3,"Name":"ישיבת מליאה בתאריך 08/07/1959 בשעה 11:02","StartDate":"1959-07-08T11:02:00+03:00","FinishDate":"1959-07-08T13:57:00+03:00","IsSpecialMeeting":null,"LastUpdatedDate":"2023-10-29T09:44:02.24+02:00"}
{"Id":158004,"Number":20,"KnessetNum":4,"Name":"ישיבת מליאה בתאריך 30/12/1959 בשעה 11:00","StartDate":"1959-12-30T11:00:00+02:00","FinishDate":"1959-12-30T12:50:00+02:00","IsSpecialMeeting":null,"LastUpdatedDate":"2021-12-15T12:21:49.17+02:00"}
{"Id":158013,"Number":40,"KnessetNum":4,"Name":"ישיבת מליאה בתאריך 27/01/1960 בשעה 11:03","StartDate":"1960-01-27T11:03:00+02:00","FinishDate":"1960-01-27T12:53:00+02:00","IsSpecialMeeting":null,"LastUpdatedDate":"2021-12-16T09:58:36.33+02:00"}
{"Id":158022,"Number":59,"KnessetNum":4,"Name":"ישיבת מליאה בתאריך 24/02/1960 בשעה 11:07","StartDate":"1960-02-24T11:07:00+02:00","FinishDate":"1960-02-24T13:45:00+02:00","IsSpecialMeeting":null,"LastUpdatedDate":"2021-12-20T10:00:44.513+02:00"}
{"Id":158028,"Number":77,"KnessetNum":4,"Name":"ישיבת מליאה בתאריך 23/03/1960 בשעה 11:05","StartDate":"1960-03-23T11:05:00+02:00","FinishDate":"1960-03-23T12:52:00+02:00","IsSpecialMeeting":null,"LastUpdatedDate":"2021-12-20T15:36:32.49+02:00"}
{"Id":158035,"Number":92,"KnessetNum":4,"Name":"ישיבת מליאה בתאריך 11/05/1960 בשעה 11:05","StartDate":"1960-05-11T11:05:00+03:00","FinishDate":"1960-05-11T13:00:00+03:00","IsSpecialMeeting":null,"LastUpdatedDate":"2021-12-21T08:42:44.487+02:00"}
{"Id":158036,"Number":97,"KnessetNum":4,"Name":"ישיבת מליאה בתאריך 18/05/1960 בשעה 11:05","StartDate":"1960-05-18T11:05:00+03:00","FinishDate":"1960-05-18T13:25:00+03:00","IsSpecialMeeting":null,"LastUpdatedDate":"2021-12-21T10:22:30.313+02:00"}
{"Id":158037,"Number":102,"KnessetNum":4,"Name":"ישיבת מליאה בתאריך 25/05/1960 בשעה 11:00","StartDate":"1960-05-25T11:00:00+03:00","FinishDate":"1960-05-25T13:10:00+03:00","IsSpecialMeeting":null,"LastUpdatedDate":"2021-12-21T11:26:39.193+02:00"}
{"Id":158043,"Number":125,"KnessetNum":4,"Name":"ישיבת מליאה בתאריך 29/06/1960 בשעה 11:05","StartDate":"1960-06-29T11:05:00+03:00","FinishDate":"1960-06-29T15:43:00+03:00","IsSpecialMeeting":null,"LastUpdatedDate":"2022-01-20T10:11:29.687+02:00"}
{"Id":158057,"Number":154,"KnessetNum":4,"Name":"ישיבת מליאה בתאריך 10/08/1960 בשעה 11:00","StartDate":"1960-08-10T11:00:00+03:00","FinishDate":"1960-08-10T14:35:00+03:00","IsSpecialMeeting":null,"LastUpdatedDate":"2021-12-26T10:08:07.353+02:00"}
{"Id":158066,"Number":180,"KnessetNum":4,"Name":"ישיבת מליאה בתאריך 23/11/1960 בשעה 11:00","StartDate":"1960-11-23T11:00:00+02:00","FinishDate":"1960-11-23T13:00:00+02:00","IsSpecialMeeting":null,"LastUpdatedDate":"2021-12-27T14:40:15.177+02:00"}
{"Id":158070,"Number":190,"KnessetNum":4,"Name":"ישיבת מליאה בתאריך 07/12/1960 בשעה 11:00","StartDate":"1960-12-07T11:00:00+02:00","FinishDate":"1960-12-07T12:07:00+02:00","IsSpecialMeeting":null,"LastUpdatedDate":"2021-12-27T17:35:47.027+02:00"}
{"Id":158072,"Number":198,"KnessetNum":4,"Name":"ישיבת מליאה בתאריך 21/12/1960 בשעה 11:05","StartDate":"1960-12-21T11:05:00+02:00","FinishDate":"1960-12-21T13:00:00+02:00","IsSpecialMeeting":null,"LastUpdatedDate":"2021-12-28T10:40:36.787+02:00"}
{"Id":158077,"Number":206,"KnessetNum":4,"Name":"ישיבת מליאה בתאריך 04/01/1961 בשעה 11:03","StartDate":"1961-01-04T11:03:00+02:00","FinishDate":"1961-01-04T11:49:00+02:00","IsSpecialMeeting":null,"LastUpdatedDate":"2023-07-24T14:25:03.293+03:00"}
{"Id":158084,"Number":219,"KnessetNum":4,"Name":"ישיבת מליאה בתאריך 25/01/1961 בשעה 11:12","StartDate":"1961-01-25T11:12:00+02:00","FinishDate":"1961-01-25T13:43:00+02:00","IsSpecialMeeting":null,"LastUpdatedDate":"2021-12-29T09:16:55.923+02:00"}
{"Id":158085,"Number":222,"KnessetNum":4,"Name":"ישיבת מליאה בתאריך 31/01/1961 בשעה 16:00","StartDate":"1961-01-31T16:00:00+02:00","FinishDate":"1961-01-31T18:42:00+02:00","IsSpecialMeeting":null,"LastUpdatedDate":"2021-12-29T10:12:14.613+02:00"}
{"Id":158086,"Number":223,"KnessetNum":4,"Name":"ישיבת מליאה בתאריך 01/02/1961 בשעה 11:02","StartDate":"1961-02-01T11:02:00+02:00","FinishDate":"1961-02-01T13:24:00+02:00","IsSpecialMeeting":null,"LastUpdatedDate":"2023-07-24T12:03:03.397+03:00"}
{"Id":158089,"Number":228,"KnessetNum":4,"Name":"ישיבת מליאה בתאריך 08/02/1961 בשעה 11:00","StartDate":"1961-02-08T11:00:00+02:00","FinishDate":"1961-02-08T12:25:00+02:00","IsSpecialMeeting":null,"LastUpdatedDate":"2021-12-29T11:27:30.847+02:00"}
{"Id":158094,"Number":238,"KnessetNum":4,"Name":"ישיבת מליאה בתאריך 22/02/1961 בשעה 11:00","StartDate":"1961-02-22T11:00:00+02:00","FinishDate":"1961-02-22T14:20:00+02:00","IsSpecialMeeting":null,"LastUpdatedDate":"2022-01-06T10:40:22.99+02:00"}
{"Id":158097,"Number":243,"KnessetNum":4,"Name":"ישיבת מליאה בתאריך 01/03/1961 בשעה 11:03","StartDate":"1961-03-01T11:03:00+02:00","FinishDate":"1961-03-01T12:30:00+02:00","IsSpecialMeeting":null,"LastUpdatedDate":"2022-01-10T15:44:39.1+02:00"}
{"Id":158099,"Number":248,"KnessetNum":4,"Name":"ישיבת מליאה בתאריך 08/03/1961 בשעה 11:03","StartDate":"1961-03-08T11:03:00+02:00","FinishDate":"1961-03-08T13:36:00+02:00","IsSpecialMeeting":null,"LastUpdatedDate":"2022-01-10T17:08:27.657+02:00"}
{"Id":158101,"Number":253,"KnessetNum":4,"Name":"ישיבת מליאה בתאריך 15/03/1961 בשעה 11:03","StartDate":"1961-03-15T11:03:00+02:00","FinishDate":"1961-03-15T13:15:00+02:00","IsSpecialMeeting":null,"LastUpdatedDate":"2022-01-11T08:45:35.05+02:00"}
{"Id":158107,"Number":266,"KnessetNum":4,"Name":"ישיבת מליאה בתאריך 08/05/1961 בשעה 16:03","StartDate":"1961-05-08T16:03:00+03:00","FinishDate":"1961-05-08T19:08:00+03:00","IsSpecialMeeting":null,"LastUpdatedDate":"2022-01-11T14:41:16.22+02:00"}
{"Id":158109,"Number":269,"KnessetNum":4,"Name":"ישיבת מליאה בתאריך 10/05/1961 בשעה 11:07","StartDate":"1961-05-10T11:07:00+03:00","FinishDate":"1961-05-10T13:00:00+03:00","IsSpecialMeeting":null,"LastUpdatedDate":"2022-01-13T12:02:22.03+02:00"}
{"Id":158110,"Number":270,"KnessetNum":4,"Name":"ישיבת מליאה בתאריך 15/05/1961 בשעה 16:05","StartDate":"1961-05-15T16:05:00+03:00","FinishDate":"1961-05-15T19:03:00+03:00","IsSpecialMeeting":null,"LastUpdatedDate":"2022-01-13T12:17:40.51+02:00"}
{"Id":158113,"Number":277,"KnessetNum":4,"Name":"ישיבת מליאה בתאריך 23/05/1961 בשעה 16:00","StartDate":"1961-05-23T16:00:00+03:00","FinishDate":"1961-05-23T19:13:00+03:00","IsSpecialMeeting":null,"LastUpdatedDate":"2022-01-16T09:47:12.957+02:00"}
{"Id":158117,"Number":281,"KnessetNum":4,"Name":"ישיבת מליאה בתאריך 31/05/1961 בשעה 10:15","StartDate":"1961-05-31T10:15:00+03:00","FinishDate":"1961-05-31T12:10:00+03:00","IsSpecialMeeting":null,"LastUpdatedDate":"2022-01-16T11:36:24.087+02:00"}
{"Id":158120,"Number":286,"KnessetNum":4,"Name":"ישיבת מליאה בתאריך 07/06/1961 בשעה 11:07","StartDate":"1961-06-07T11:07:00+03:00","FinishDate":"1961-06-07T14:50:00+03:00","IsSpecialMeeting":null,"LastUpdatedDate":"2024-02-22T14:44:58.743+02:00"}
{"Id":158130,"Number":10,"KnessetNum":5,"Name":"ישיבת מליאה בתאריך 17/10/1961 בשעה 16:02","StartDate":"1961-10-17T16:02:00+02:00","FinishDate":"1961-10-17T17:25:00+02:00","IsSpecialMeeting":null,"LastUpdatedDate":"2022-01-17T14:58:40.687+02:00"}
{"Id":158132,"Number":14,"KnessetNum":5,"Name":"ישיבת מליאה בתאריך 24/10/1961 בשעה 16:00","StartDate":"1961-10-24T16:00:00+02:00","FinishDate":"1961-10-24T18:15:00+02:00","IsSpecialMeeting":null,"LastUpdatedDate":"2022-01-17T16:08:01.523+02:00"}
{"Id":158133,"Number":15,"KnessetNum":5,"Name":"ישיבת מליאה בתאריך 25/10/1961 בשעה 11:00","StartDate":"1961-10-25T11:00:00+02:00","FinishDate":"1961-10-25T12:13:00+02:00","IsSpecialMeeting":null,"LastUpdatedDate":"2022-01-17T16:32:40.46+02:00"}
{"Id":158134,"Number":22,"KnessetNum":5,"Name":"ישיבת מליאה בתאריך 07/11/1961 בשעה 16:01","StartDate":"1961-11-07T16:01:00+02:00","FinishDate":"1961-11-07T18:06:00+02:00","IsSpecialMeeting":null,"LastUpdatedDate":"2022-01-18T07:36:20.117+02:00"}
{"Id":158135,"Number":23,"KnessetNum":5,"Name":"ישיבת מליאה בתאריך 08/11/1961 בשעה 11:05","StartDate":"1961-11-08T11:05:00+02:00","FinishDate":"1961-11-08T12:55:00+02:00","IsSpecialMeeting":null,"LastUpdatedDate":"2022-01-18T07:46:41.977+02:00"}
{"Id":158141,"Number":38,"KnessetNum":5,"Name":"ישיבת מליאה בתאריך 29/11/1961 בשעה 11:05","StartDate":"1961-11-29T11:05:00+02:00","FinishDate":"1961-11-29T13:36:00+02:00","IsSpecialMeeting":null,"LastUpdatedDate":"2022-01-18T12:58:22.167+02:00"}
{"Id":158143,"Number":41,"KnessetNum":5,"Name":"ישיבת מליאה בתאריך 05/12/1961 בשעה 16:00","StartDate":"1961-12-05T16:00:00+02:00","FinishDate":"1961-12-05T18:52:00+02:00","IsSpecialMeeting":null,"LastUpdatedDate":"2023-10-29T10:55:53.623+02:00"}
{"Id":158144,"Number":42,"KnessetNum":5,"Name":"ישיבת מליאה בתאריך 06/12/1961 בשעה 11:06","StartDate":"1961-12-06T11:06:00+02:00","FinishDate":"1961-12-06T14:27:00+02:00","IsSpecialMeeting":null,"LastUpdatedDate":"2022-01-18T16:06:46.527+02:00"}
{"Id":158160,"Number":88,"KnessetNum":5,"Name":"ישיבת מליאה בתאריך 07/02/1962 בשעה 11:06","StartDate":"1962-02-07T11:06:00+02:00","FinishDate":"1962-02-07T13:28:00+02:00","IsSpecialMeeting":null,"LastUpdatedDate":"2022-01-25T16:15:07.83+02:00"}
{"Id":158170,"Number":116,"KnessetNum":5,"Name":"ישיבת מליאה בתאריך 26/03/1962 בשעה 16:17","StartDate":"1962-03-26T16:17:00+02:00","FinishDate":"1962-03-26T19:03:00+02:00","IsSpecialMeeting":null,"LastUpdatedDate":"2022-07-14T18:51:50.143+03:00"}
{"Id":158176,"Number":128,"KnessetNum":5,"Name":"ישיבת מליאה בתאריך 14/05/1962 בשעה 16:06","StartDate":"1962-05-14T16:06:00+03:00","FinishDate":"1962-05-14T19:00:00+03:00","IsSpecialMeeting":null,"LastUpdatedDate":"2022-02-01T13:24:51.517+02:00"}
{"Id":158180,"Number":132,"KnessetNum":5,"Name":"ישיבת מליאה בתאריך 22/05/1962 בשעה 16:00","StartDate":"1962-05-22T16:00:00+03:00","FinishDate":"1962-05-22T20:23:00+03:00","IsSpecialMeeting":null,"LastUpdatedDate":"2022-02-02T07:38:17.977+02:00"}
{"Id":158191,"Number":161,"KnessetNum":5,"Name":"ישיבת מליאה בתאריך 23/07/1962 בשעה 16:02","StartDate":"1962-07-23T16:02:00+03:00","FinishDate":"1962-07-23T20:50:00+03:00","IsSpecialMeeting":null,"LastUpdatedDate":"2022-02-07T10:01:26.657+02:00"}
{"Id":158192,"Number":164,"KnessetNum":5,"Name":"ישיבת מליאה בתאריך 26/07/1962 בשעה 12:02","StartDate":"1962-07-26T12:02:00+03:00","FinishDate":"1962-07-26T14:50:00+03:00","IsSpecialMeeting":null,"LastUpdatedDate":"2022-02-07T11:37:52.263+02:00"}
{"Id":158193,"Number":165,"KnessetNum":5,"Name":"ישיבת מליאה בתאריך 30/07/1962 בשעה 16:00","StartDate":"1962-07-30T16:00:00+03:00","FinishDate":"1962-07-30T20:02:00+03:00","IsSpecialMeeting":null,"LastUpdatedDate":"2022-02-07T11:58:11.583+02:00"}
{"Id":158194,"Number":169,"KnessetNum":5,"Name":"ישיבת מליאה בתאריך 07/08/1962 בשעה 20:06","StartDate":"1962-08-07T20:06:00+03:00","FinishDate":"1962-08-07T21:00:00+03:00","IsSpecialMeeting":null,"LastUpdatedDate":"2022-02-06T10:54:51.293+02:00"}
{"Id":158195,"Number":170,"KnessetNum":5,"Name":"ישיבת מליאה בתאריך 08/08/1962 בשעה 09:06","StartDate":"1962-08-08T09:06:00+03:00","FinishDate":"1962-08-08T15:37:00+03:00","IsSpecialMeeting":null,"LastUpdatedDate":"2022-02-06T11:23:50.23+02:00"}
{"Id":158196,"Number":171,"KnessetNum":5,"Name":"ישיבת מליאה בתאריך 29/10/1962 בשעה 16:00","StartDate":"1962-10-29T16:00:00+02:00","FinishDate":"1962-10-29T19:30:00+02:00","IsSpecialMeeting":null,"LastUpdatedDate":"2022-02-06T14:00:41.577+02:00"}
{"Id":158198,"Number":180,"KnessetNum":5,"Name":"ישיבת מליאה בתאריך 14/11/1962 בשעה 11:02","StartDate":"1962-11-14T11:02:00+02:00","FinishDate":"1962-11-14T15:00:00+02:00","IsSpecialMeeting":null,"LastUpdatedDate":"2022-02-07T15:51:11.92+02:00"}
{"Id":158199,"Number":181,"KnessetNum":5,"Name":"ישיבת מליאה בתאריך 19/11/1962 בשעה 16:05","StartDate":"1962-11-19T16:05:00+02:00","FinishDate":"1962-11-19T20:42:00+02:00","IsSpecialMeeting":null,"LastUpdatedDate":"2022-02-07T16:06:42.21+02:00"}
{"Id":158204,"Number":190,"KnessetNum":5,"Name":"ישיבת מליאה בתאריך 10/12/1962 בשעה 16:10","StartDate":"1962-12-10T16:10:00+02:00","FinishDate":"1962-12-10T20:10:00+02:00","IsSpecialMeeting":null,"LastUpdatedDate":"2022-02-08T14:53:06.543+02:00"}
{"Id":158209,"Number":197,"KnessetNum":5,"Name":"ישיבת מליאה בתאריך 25/12/1962 בשעה 16:04","StartDate":"1962-12-25T16:04:00+02:00","FinishDate":"1962-12-25T20:30:00+02:00","IsSpecialMeeting":null,"LastUpdatedDate":"2022-02-09T09:56:18.553+02:00"}
{"Id":158212,"Number":202,"KnessetNum":5,"Name":"ישיבת מליאה בתאריך 07/01/1963 בשעה 16:02","StartDate":"1963-01-07T16:02:00+02:00","FinishDate":"1963-01-07T20:54:00+02:00","IsSpecialMeeting":null,"LastUpdatedDate":"2022-02-09T12:58:47.867+02:00"}
{"Id":158216,"Number":206,"KnessetNum":5,"Name":"ישיבת מליאה בתאריך 15/01/1963 בשעה 16:04","StartDate":"1963-01-15T16:04:00+02:00","FinishDate":"1963-01-15T20:55:00+02:00","IsSpecialMeeting":null,"LastUpdatedDate":"2022-02-10T08:04:10.707+02:00"}
{"Id":158217,"Number":208,"KnessetNum":5,"Name":"ישיבת מליאה בתאריך 21/01/1963 בשעה 16:00","StartDate":"1963-01-21T16:00:00+02:00","FinishDate":"1963-01-21T20:47:00+02:00","IsSpecialMeeting":null,"LastUpdatedDate":"2022-02-10T09:04:55.167+02:00"}
{"Id":158221,"Number":212,"KnessetNum":5,"Name":"ישיבת מליאה בתאריך 29/01/1963 בשעה 16:02","StartDate":"1963-01-29T16:02:00+02:00","FinishDate":"1963-01-29T20:40:00+02:00","IsSpecialMeeting":null,"LastUpdatedDate":"2022-02-10T11:33:29.69+02:00"}
{"Id":158224,"Number":217,"KnessetNum":5,"Name":"ישיבת מליאה בתאריך 11/02/1963 בשעה 16:02","StartDate":"1963-02-11T16:02:00+02:00","FinishDate":"1963-02-11T18:10:00+02:00","IsSpecialMeeting":null,"LastUpdatedDate":"2019-12-31T09:01:45.393+02:00"}
{"Id":158232,"Number":231,"KnessetNum":5,"Name":"ישיבת מליאה בתאריך 14/03/1963 בשעה 11:03","StartDate":"1963-03-14T11:03:00+02:00","FinishDate":"1963-03-14T14:12:00+02:00","IsSpecialMeeting":null,"LastUpdatedDate":"2022-02-14T12:29:21.337+02:00"}
{"Id":158233,"Number":234,"KnessetNum":5,"Name":"ישיבת מליאה בתאריך 20/03/1963 בשעה 16:02","StartDate":"1963-03-20T16:02:00+02:00","FinishDate":"1963-03-20T21:00:00+02:00","IsSpecialMeeting":null,"LastUpdatedDate":"2022-02-14T13:45:42.347+02:00"}
{"Id":158237,"Number":244,"KnessetNum":5,"Name":"ישיבת מליאה בתאריך 07/05/1963 בשעה 16:02","StartDate":"1963-05-07T16:02:00+03:00","FinishDate":"1963-05-07T19:52:00+03:00","IsSpecialMeeting":null,"LastUpdatedDate":"2022-02-15T12:45:14.803+02:00"}
{"Id":158238,"Number":247,"KnessetNum":5,"Name":"ישיבת מליאה בתאריך 14/05/1963 בשעה 16:02","StartDate":"1963-05-14T16:02:00+03:00","FinishDate":"1963-05-14T19:55:00+03:00","IsSpecialMeeting":null,"LastUpdatedDate":"2022-02-15T14:13:27.25+02:00"}
{"Id":158239,"Number":252,"KnessetNum":5,"Name":"ישיבת מליאה בתאריך 27/05/1963 בשעה 15:00","StartDate":"1963-05-27T15:00:00+03:00","FinishDate":"1963-05-27T20:10:00+03:00","IsSpecialMeeting":null,"LastUpdatedDate":"2022-02-15T16:48:04.203+02:00"}
{"Id":158240,"Number":253,"KnessetNum":5,"Name":"ישיבת מליאה בתאריך 03/06/1963 בשעה 16:05","StartDate":"1963-06-03T16:05:00+03:00","FinishDate":"1963-06-03T21:03:00+03:00","IsSpecialMeeting":null,"LastUpdatedDate":"2022-02-15T17:34:21.387+02:00"}
{"Id":158241,"Number":254,"KnessetNum":5,"Name":"ישיבת מליאה בתאריך 04/06/1963 בשעה 16:00","StartDate":"1963-06-04T16:00:00+03:00","FinishDate":"1963-06-04T19:55:00+03:00","IsSpecialMeeting":null,"LastUpdatedDate":"2022-02-15T17:46:34.777+02:00"}
{"Id":158242,"Number":255,"KnessetNum":5,"Name":"ישיבת מליאה בתאריך 05/06/1963 בשעה 11:06","StartDate":"1963-06-05T11:06:00+03:00","FinishDate":"1963-06-05T13:40:00+03:00","IsSpecialMeeting":null,"LastUpdatedDate":"2022-02-16T07:21:37.707+02:00"}
{"Id":158243,"Number":256,"KnessetNum":5,"Name":"ישיבת מליאה בתאריך 10/06/1963 בשעה 16:02","StartDate":"1963-06-10T16:02:00+03:00","FinishDate":"1963-06-10T20:55:00+03:00","IsSpecialMeeting":null,"LastUpdatedDate":"2022-02-16T07:40:12.153+02:00"}
{"Id":158244,"Number":257,"KnessetNum":5,"Name":"ישיבת מליאה בתאריך 11/06/1963 בשעה 16:02","StartDate":"1963-06-11T16:02:00+03:00","FinishDate":"1963-06-11T19:10:00+03:00","IsSpecialMeeting":null,"LastUpdatedDate":"2022-02-16T08:30:56.823+02:00"}
{"Id":158245,"Number":259,"KnessetNum":5,"Name":"ישיבת מליאה בתאריך 17/06/1963 בשעה 16:01","StartDate":"1963-06-17T16:01:00+03:00","FinishDate":"1963-06-17T19:48:00+03:00","IsSpecialMeeting":null,"LastUpdatedDate":"2022-02-16T10:47:35.59+02:00"}
{"Id":158246,"Number":260,"KnessetNum":5,"Name":"ישיבת מליאה בתאריך 18/06/1963 בשעה 16:05","StartDate":"1963-06-18T16:05:00+03:00","FinishDate":"1963-06-18T20:15:00+03:00","IsSpecialMeeting":null,"LastUpdatedDate":"2022-02-16T11:35:56.28+02:00"}
{"Id":158250,"Number":265,"KnessetNum":5,"Name":"ישיבת מליאה בתאריך 01/07/1963 בשעה 16:04","StartDate":"1963-07-01T16:04:00+03:00","FinishDate":"1963-07-01T20:47:00+03:00","IsSpecialMeeting":null,"LastUpdatedDate":"2022-02-16T14:40:33.173+02:00"}
{"Id":158251,"Number":266,"KnessetNum":5,"Name":"ישיבת מליאה בתאריך 02/07/1963 בשעה 16:01","StartDate":"1963-07-02T16:01:00+03:00","FinishDate":"1963-07-02T20:38:00+03:00","IsSpecialMeeting":null,"LastUpdatedDate":"2022-02-17T09:03:39.143+02:00"}
{"Id":158252,"Number":268,"KnessetNum":5,"Name":"ישיבת מליאה בתאריך 08/07/1963 בשעה 16:06","StartDate":"1963-07-08T16:06:00+03:00","FinishDate":"1963-07-08T20:20:00+03:00","IsSpecialMeeting":null,"LastUpdatedDate":"2022-02-17T10:33:39.527+02:00"}
{"Id":158253,"Number":269,"KnessetNum":5,"Name":"ישיבת מליאה בתאריך 09/07/1963 בשעה 16:00","StartDate":"1963-07-09T16:00:00+03:00","FinishDate":"1963-07-09T21:00:00+03:00","IsSpecialMeeting":null,"LastUpdatedDate":"2022-02-17T11:04:50.97+02:00"}
{"Id":158254,"Number":270,"KnessetNum":5,"Name":"ישיבת מליאה בתאריך 10/07/1963 בשעה 11:00","StartDate":"1963-07-10T11:00:00+03:00","FinishDate":"1963-07-10T13:02:00+03:00","IsSpecialMeeting":null,"LastUpdatedDate":"2022-02-17T12:48:20.38+02:00"}
{"Id":158255,"Number":271,"KnessetNum":5,"Name":"ישיבת מליאה בתאריך 15/07/1963 בשעה 16:02","StartDate":"1963-07-15T16:02:00+03:00","FinishDate":"1963-07-15T20:17:00+03:00","IsSpecialMeeting":null,"LastUpdatedDate":"2022-02-17T13:02:01.433+02:00"}
{"Id":158256,"Number":272,"KnessetNum":5,"Name":"ישיבת מליאה בתאריך 16/07/1963 בשעה 16:03","StartDate":"1963-07-16T16:03:00+03:00","FinishDate":"1963-07-16T20:20:00+03:00","IsSpecialMeeting":null,"LastUpdatedDate":"2022-02-17T13:09:32.433+02:00"}
{"Id":158257,"Number":274,"KnessetNum":5,"Name":"ישיבת מליאה בתאריך 22/07/1963 בשעה 16:03","StartDate":"1963-07-22T16:03:00+03:00","FinishDate":"1963-07-22T20:25:00+03:00","IsSpecialMeeting":null,"LastUpdatedDate":"2022-02-20T08:40:55.063+02:00"}
{"Id":158258,"Number":276,"KnessetNum":5,"Name":"ישיבת מליאה בתאריך 24/07/1963 בשעה 11:05","StartDate":"1963-07-24T11:05:00+03:00","FinishDate":"1963-07-24T12:07:00+03:00","IsSpecialMeeting":null,"LastUpdatedDate":"2022-02-20T09:44:33.587+02:00"}
{"Id":158259,"Number":277,"KnessetNum":5,"Name":"ישיבת מליאה בתאריך 31/07/1963 בשעה 15:03","StartDate":"1963-07-31T15:03:00+03:00","FinishDate":"1963-07-31T20:42:00+03:00","IsSpecialMeeting":null,"LastUpdatedDate":"2022-02-20T10:01:55.317+02:00"}
{"Id":158260,"Number":278,"KnessetNum":5,"Name":"ישיבת מליאה בתאריך 01/08/1963 בשעה 10:02","StartDate":"1963-08-01T10:02:00+03:00","FinishDate":"1963-08-01T13:48:00+03:00","IsSpecialMeeting":null,"LastUpdatedDate":"2022-02-20T11:16:52.703+02:00"}
{"Id":158262,"Number":280,"KnessetNum":5,"Name":"ישיבת מליאה בתאריך 06/08/1963 בשעה 15:04","StartDate":"1963-08-06T15:04:00+03:00","FinishDate":"1963-08-06T19:22:00+03:00","IsSpecialMeeting":null,"LastUpdatedDate":"2022-02-20T12:22:49.007+02:00"}
{"Id":158265,"Number":286,"KnessetNum":5,"Name":"ישיבת מליאה בתאריך 28/10/1963 בשעה 16:06","StartDate":"1963-10-28T16:06:00+02:00","FinishDate":"1963-10-28T20:03:00+02:00","IsSpecialMeeting":null,"LastUpdatedDate":"2022-02-22T12:36:03.393+02:00"}
{"Id":158266,"Number":287,"KnessetNum":5,"Name":"ישיבת מליאה בתאריך 29/10/1963 בשעה 16:01","StartDate":"1963-10-29T16:01:00+02:00","FinishDate":"1963-10-29T19:30:00+02:00","IsSpecialMeeting":null,"LastUpdatedDate":"2022-02-22T12:56:21.297+02:00"}
{"Id":158267,"Number":289,"KnessetNum":5,"Name":"ישיבת מליאה בתאריך 04/11/1963 בשעה 16:01","StartDate":"1963-11-04T16:01:00+02:00","FinishDate":"1963-11-04T19:50:00+02:00","IsSpecialMeeting":null,"LastUpdatedDate":"2022-02-22T14:09:33.12+02:00"}
{"Id":158272,"Number":296,"KnessetNum":5,"Name":"ישיבת מליאה בתאריך 19/11/1963 בשעה 16:00","StartDate":"1963-11-19T16:00:00+02:00","FinishDate":"1963-11-19T20:32:00+02:00","IsSpecialMeeting":null,"LastUpdatedDate":"2022-02-22T17:35:22.7+02:00"}
{"Id":158273,"Number":297,"KnessetNum":5,"Name":"ישיבת מליאה בתאריך 20/11/1963 בשעה 11:01","StartDate":"1963-11-20T11:01:00+02:00","FinishDate":"1963-11-20T12:10:00+02:00","IsSpecialMeeting":null,"LastUpdatedDate":"2022-02-23T07:29:16.997+02:00"}
{"Id":158278,"Number":306,"KnessetNum":5,"Name":"ישיבת מליאה בתאריך 16/12/1963 בשעה 16:03","StartDate":"1963-12-16T16:03:00+02:00","FinishDate":"1963-12-16T20:12:00+02:00","IsSpecialMeeting":null,"LastUpdatedDate":"2022-02-23T11:22:26.833+02:00"}
{"Id":158281,"Number":309,"KnessetNum":5,"Name":"ישיבת מליאה בתאריך 23/12/1963 בשעה 16:02","StartDate":"1963-12-23T16:02:00+02:00","FinishDate":"1963-12-23T19:39:00+02:00","IsSpecialMeeting":null,"LastUpdatedDate":"2022-02-23T13:10:16.927+02:00"}
{"Id":158283,"Number":312,"KnessetNum":5,"Name":"ישיבת מליאה בתאריך 30/12/1963 בשעה 16:02","StartDate":"1963-12-30T16:02:00+02:00","FinishDate":"1963-12-30T17:50:00+02:00","IsSpecialMeeting":null,"LastUpdatedDate":"2022-02-24T08:39:03.173+02:00"}
{"Id":158292,"Number":328,"KnessetNum":5,"Name":"ישיבת מליאה בתאריך 04/02/1964 בשעה 16:05","StartDate":"1964-02-04T16:05:00+02:00","FinishDate":"1964-02-04T20:05:00+02:00","IsSpecialMeeting":null,"LastUpdatedDate":"2022-02-28T07:19:13.387+02:00"}
{"Id":158294,"Number":332,"KnessetNum":5,"Name":"ישיבת מליאה בתאריך 12/02/1964 בשעה 11:03","StartDate":"1964-02-12T11:03:00+02:00","FinishDate":"1964-02-12T13:48:00+02:00","IsSpecialMeeting":null,"LastUpdatedDate":"2022-02-28T09:43:18.207+02:00"}
{"Id":158307,"Number":355,"KnessetNum":5,"Name":"ישיבת מליאה בתאריך 11/05/1964 בשעה 16:05","StartDate":"1964-05-11T16:05:00+03:00","FinishDate":"1964-05-11T20:25:00+03:00","IsSpecialMeeting":null,"LastUpdatedDate":"2022-03-03T08:08:53.58+02:00"}
{"Id":158312,"Number":361,"KnessetNum":5,"Name":"ישיבת מליאה בתאריך 25/05/1964 בשעה 16:04","StartDate":"1964-05-25T16:04:00+03:00","FinishDate":"1964-05-25T20:00:00+03:00","IsSpecialMeeting":null,"LastUpdatedDate":"2022-03-03T11:55:22.783+02:00"}
{"Id":158313,"Number":362,"KnessetNum":5,"Name":"ישיבת מליאה בתאריך 26/05/1964 בשעה 16:01","StartDate":"1964-05-26T16:01:00+03:00","FinishDate":"1964-05-26T19:43:00+03:00","IsSpecialMeeting":null,"LastUpdatedDate":"2022-03-03T12:11:46.023+02:00"}
{"Id":158314,"Number":363,"KnessetNum":5,"Name":"ישיבת מליאה בתאריך 27/05/1964 בשעה 11:04","StartDate":"1964-05-27T11:04:00+03:00","FinishDate":"1964-05-27T13:13:00+03:00","IsSpecialMeeting":null,"LastUpdatedDate":"2022-03-08T08:40:54.267+02:00"}
{"Id":158316,"Number":365,"KnessetNum":5,"Name":"ישיבת מליאה בתאריך 02/06/1964 בשעה 16:00","StartDate":"1964-06-02T16:00:00+03:00","FinishDate":"1964-06-02T19:05:00+03:00","IsSpecialMeeting":null,"LastUpdatedDate":"2022-03-08T09:09:34.173+02:00"}
{"Id":158317,"Number":366,"KnessetNum":5,"Name":"ישיבת מליאה בתאריך 03/06/1964 בשעה 11:00","StartDate":"1964-06-03T11:00:00+03:00","FinishDate":"1964-06-03T14:17:00+03:00","IsSpecialMeeting":null,"LastUpdatedDate":"2022-03-08T09:15:43.073+02:00"}
{"Id":158318,"Number":367,"KnessetNum":5,"Name":"ישיבת מליאה בתאריך 08/06/1964 בשעה 16:31","StartDate":"1964-06-08T16:31:00+03:00","FinishDate":"1964-06-08T20:08:00+03:00","IsSpecialMeeting":null,"LastUpdatedDate":"2022-03-08T11:08:58.887+02:00"}
{"Id":158319,"Number":368,"KnessetNum":5,"Name":"ישיבת מליאה בתאריך 09/06/1964 בשעה 16:02","StartDate":"1964-06-09T16:02:00+03:00","FinishDate":"1964-06-09T20:45:00+03:00","IsSpecialMeeting":null,"LastUpdatedDate":"2022-03-08T11:11:40.2+02:00"}
{"Id":158320,"Number":369,"KnessetNum":5,"Name":"ישיבת מליאה בתאריך 10/06/1964 בשעה 11:05","StartDate":"1964-06-10T11:05:00+03:00","FinishDate":"1964-06-10T12:58:00+03:00","IsSpecialMeeting":null,"LastUpdatedDate":"2022-03-08T12:37:08.743+02:00"}
{"Id":158321,"Number":370,"KnessetNum":5,"Name":"ישיבת מליאה בתאריך 15/06/1964 בשעה 16:04","StartDate":"1964-06-15T16:04:00+03:00","FinishDate":"1964-06-15T19:15:00+03:00","IsSpecialMeeting":null,"LastUpdatedDate":"2022-03-08T14:04:43.107+02:00"}
{"Id":158325,"Number":375,"KnessetNum":5,"Name":"ישיבת מליאה בתאריך 24/06/1964 בשעה 11:00","StartDate":"1964-06-24T11:00:00+03:00","FinishDate":"1964-06-24T13:13:00+03:00","IsSpecialMeeting":null,"LastUpdatedDate":"2022-03-09T07:42:20.017+02:00"}
{"Id":158326,"Number":377,"KnessetNum":5,"Name":"ישיבת מליאה בתאריך 30/06/1964 בשעה 16:00","StartDate":"1964-06-30T16:00:00+03:00","FinishDate":"1964-06-30T18:50:00+03:00","IsSpecialMeeting":null,"LastUpdatedDate":"2022-03-09T09:11:09.58+02:00"}
{"Id":158327,"Number":379,"KnessetNum":5,"Name":"ישיבת מליאה בתאריך 06/07/1964 בשעה 16:03","StartDate":"1964-07-06T16:03:00+03:00","FinishDate":"1964-07-06T20:43:00+03:00","IsSpecialMeeting":null,"LastUpdatedDate":"2022-03-09T11:12:40.38+02:00"}
{"Id":158328,"Number":380,"KnessetNum":5,"Name":"ישיבת מליאה בתאריך 07/07/1964 בשעה 16:10","StartDate":"1964-07-07T16:10:00+03:00","FinishDate":"1964-07-07T20:12:00+03:00","IsSpecialMeeting":null,"LastUpdatedDate":"2022-03-09T12:01:55.62+02:00"}
{"Id":158329,"Number":381,"KnessetNum":5,"Name":"ישיבת מליאה בתאריך 08/07/1964 בשעה 11:02","StartDate":"1964-07-08T11:02:00+03:00","FinishDate":"1964-07-08T13:17:00+03:00","IsSpecialMeeting":null,"LastUpdatedDate":"2022-03-09T13:36:34.173+02:00"}
{"Id":158332,"Number":386,"KnessetNum":5,"Name":"ישיבת מליאה בתאריך 21/07/1964 בשעה 16:00","StartDate":"1964-07-21T16:00:00+03:00","FinishDate":"1964-07-21T19:20:00+03:00","IsSpecialMeeting":null,"LastUpdatedDate":"2022-03-10T08:23:00.97+02:00"}
{"Id":158333,"Number":387,"KnessetNum":5,"Name":"ישיבת מליאה בתאריך 22/07/1964 בשעה 11:05","StartDate":"1964-07-22T11:05:00+03:00","FinishDate":"1964-07-22T13:48:00+03:00","IsSpecialMeeting":null,"LastUpdatedDate":"2022-03-10T09:13:22.613+02:00"}
{"Id":158334,"Number":388,"KnessetNum":5,"Name":"ישיבת מליאה בתאריך 27/07/1964 בשעה 16:00","StartDate":"1964-07-27T16:00:00+03:00","FinishDate":"1964-07-27T20:35:00+03:00","IsSpecialMeeting":null,"LastUpdatedDate":"2022-03-10T10:04:56.01+02:00"}
{"Id":158335,"Number":389,"KnessetNum":5,"Name":"ישיבת מליאה בתאריך 28/07/1964 בשעה 16:02","StartDate":"1964-07-28T16:02:00+03:00","FinishDate":"1964-07-28T20:16:00+03:00","IsSpecialMeeting":null,"LastUpdatedDate":"2022-03-10T10:46:08.21+02:00"}
{"Id":158336,"Number":390,"KnessetNum":5,"Name":"ישיבת מליאה בתאריך 29/07/1964 בשעה 16:04","StartDate":"1964-07-29T16:04:00+03:00","FinishDate":"1964-07-29T19:20:00+03:00","IsSpecialMeeting":null,"LastUpdatedDate":"2022-03-10T11:25:19.58+02:00"}
{"Id":158344,"Number":406,"KnessetNum":5,"Name":"ישיבת מליאה בתאריך 10/11/1964 בשעה 16:02","StartDate":"1964-11-10T16:02:00+02:00","FinishDate":"1964-11-10T20:45:00+02:00","IsSpecialMeeting":null,"LastUpdatedDate":"2022-03-15T09:15:31.893+02:00"}
{"Id":158346,"Number":408,"KnessetNum":5,"Name":"ישיבת מליאה בתאריך 16/11/1964 בשעה 16:06","StartDate":"1964-11-16T16:06:00+02:00","FinishDate":"1964-11-16T19:40:00+02:00","IsSpecialMeeting":null,"LastUpdatedDate":"2022-03-15T09:47:22.647+02:00"}
{"Id":158349,"Number":411,"KnessetNum":5,"Name":"ישיבת מליאה בתאריך 23/11/1964 בשעה 16:04","StartDate":"1964-11-23T16:04:00+02:00","FinishDate":"1964-11-23T20:09:00+02:00","IsSpecialMeeting":null,"LastUpdatedDate":"2022-03-15T11:21:21.697+02:00"}
{"Id":158354,"Number":417,"KnessetNum":5,"Name":"ישיבת מליאה בתאריך 07/12/1964 בשעה 16:05","StartDate":"1964-12-07T16:05:00+02:00","FinishDate":"1964-12-07T20:05:00+02:00","IsSpecialMeeting":null,"LastUpdatedDate":"2022-03-15T14:36:45.623+02:00"}
{"Id":158357,"Number":423,"KnessetNum":5,"Name":"ישיבת מליאה בתאריך 21/12/1964 בשעה 16:01","StartDate":"1964-12-21T16:01:00+02:00","FinishDate":"1964-12-21T20:13:00+02:00","IsSpecialMeeting":null,"LastUpdatedDate":"2022-03-16T11:14:13.82+02:00"}
{"Id":158365,"Number":434,"KnessetNum":5,"Name":"ישיבת מליאה בתאריך 13/01/1965 בשעה 11:05","StartDate":"1965-01-13T11:05:00+02:00","FinishDate":"1965-01-13T12:07:00+02:00","IsSpecialMeeting":null,"LastUpdatedDate":"2022-03-27T13:02:46.893+03:00"}
{"Id":158366,"Number":436,"KnessetNum":5,"Name":"ישיבת מליאה בתאריך 19/01/1965 בשעה 16:07","StartDate":"1965-01-19T16:07:00+02:00","FinishDate":"1965-01-19T21:08:00+02:00","IsSpecialMeeting":null,"LastUpdatedDate":"2022-03-27T13:34:49.98+03:00"}
{"Id":158367,"Number":441,"KnessetNum":5,"Name":"ישיבת מליאה בתאריך 01/02/1965 בשעה 16:00","StartDate":"1965-02-01T16:00:00+02:00","FinishDate":"1965-02-01T20:52:00+02:00","IsSpecialMeeting":null,"LastUpdatedDate":"2022-03-27T15:31:39.833+03:00"}
{"Id":158368,"Number":442,"KnessetNum":5,"Name":"ישיבת מליאה בתאריך 02/02/1965 בשעה 16:02","StartDate":"1965-02-02T16:02:00+02:00","FinishDate":"1965-02-02T21:17:00+02:00","IsSpecialMeeting":null,"LastUpdatedDate":"2022-03-27T16:10:44.26+03:00"}
{"Id":158369,"Number":443,"KnessetNum":5,"Name":"ישיבת מליאה בתאריך 03/02/1965 בשעה 11:00","StartDate":"1965-02-03T11:00:00+02:00","FinishDate":"1965-02-03T13:09:00+02:00","IsSpecialMeeting":null,"LastUpdatedDate":"2022-03-28T08:20:54.197+03:00"}
{"Id":158370,"Number":445,"KnessetNum":5,"Name":"ישיבת מליאה בתאריך 09/02/1965 בשעה 16:00","StartDate":"1965-02-09T16:00:00+02:00","FinishDate":"1965-02-09T18:50:00+02:00","IsSpecialMeeting":null,"LastUpdatedDate":"2022-03-28T09:22:46.367+03:00"}
{"Id":158371,"Number":448,"KnessetNum":5,"Name":"ישיבת מליאה בתאריך 16/02/1965 בשעה 16:00","StartDate":"1965-02-16T16:00:00+02:00","FinishDate":"1965-02-16T18:32:00+02:00","IsSpecialMeeting":null,"LastUpdatedDate":"2022-03-28T12:47:40.217+03:00"}
{"Id":158372,"Number":451,"KnessetNum":5,"Name":"ישיבת מליאה בתאריך 23/02/1965 בשעה 16:00","StartDate":"1965-02-23T16:00:00+02:00","FinishDate":"1965-02-23T20:30:00+02:00","IsSpecialMeeting":null,"LastUpdatedDate":"2022-03-29T08:10:52.047+03:00"}
{"Id":158373,"Number":454,"KnessetNum":5,"Name":"ישיבת מליאה בתאריך 02/03/1965 בשעה 16:00","StartDate":"1965-03-02T16:00:00+02:00","FinishDate":"1965-03-02T21:02:00+02:00","IsSpecialMeeting":null,"LastUpdatedDate":"2022-03-29T10:14:35.887+03:00"}
{"Id":158374,"Number":455,"KnessetNum":5,"Name":"ישיבת מליאה בתאריך 03/03/1965 בשעה 11:02","StartDate":"1965-03-03T11:02:00+02:00","FinishDate":"1965-03-03T12:12:00+02:00","IsSpecialMeeting":null,"LastUpdatedDate":"2022-03-29T10:36:54.25+03:00"}
{"Id":158375,"Number":456,"KnessetNum":5,"Name":"ישיבת מליאה בתאריך 08/03/1965 בשעה 16:02","StartDate":"1965-03-08T16:02:00+02:00","FinishDate":"1965-03-08T19:11:00+02:00","IsSpecialMeeting":null,"LastUpdatedDate":"2022-03-29T11:34:32.307+03:00"}
{"Id":158378,"Number":461,"KnessetNum":5,"Name":"ישיבת מליאה בתאריך 17/03/1965 בשעה 10:05","StartDate":"1965-03-17T10:05:00+02:00","FinishDate":"1965-03-17T12:24:00+02:00","IsSpecialMeeting":null,"LastUpdatedDate":"2022-03-30T07:49:03.33+03:00"}
{"Id":158381,"Number":466,"KnessetNum":5,"Name":"ישיבת מליאה בתאריך 30/03/1965 בשעה 16:03","StartDate":"1965-03-30T16:03:00+02:00","FinishDate":"1965-03-30T22:07:00+02:00","IsSpecialMeeting":null,"LastUpdatedDate":"2022-03-31T09:11:35.867+03:00"}
{"Id":158382,"Number":467,"KnessetNum":5,"Name":"ישיבת מליאה בתאריך 31/03/1965 בשעה 11:01","StartDate":"1965-03-31T11:01:00+02:00","FinishDate":"1965-03-31T13:15:00+02:00","IsSpecialMeeting":null,"LastUpdatedDate":"2022-03-31T09:57:15.627+03:00"}
{"Id":158383,"Number":468,"KnessetNum":5,"Name":"ישיבת מליאה בתאריך 05/04/1965 בשעה 16:05","StartDate":"1965-04-05T16:05:00+02:00","FinishDate":"1965-04-05T21:10:00+02:00","IsSpecialMeeting":null,"LastUpdatedDate":"2022-03-31T10:05:13.06+03:00"}
{"Id":158385,"Number":470,"KnessetNum":5,"Name":"ישיבת מליאה בתאריך 07/04/1965 בשעה 11:02","StartDate":"1965-04-07T11:02:00+03:00","FinishDate":"1965-04-07T14:00:00+03:00","IsSpecialMeeting":null,"LastUpdatedDate":"2022-03-31T11:32:30.263+03:00"}
{"Id":158387,"Number":477,"KnessetNum":5,"Name":"ישיבת מליאה בתאריך 31/05/1965 בשעה 14:04","StartDate":"1965-05-31T14:04:00+03:00","FinishDate":"1965-05-31T20:32:00+03:00","IsSpecialMeeting":null,"LastUpdatedDate":"2022-04-11T12:54:18.04+03:00"}
{"Id":158389,"Number":479,"KnessetNum":5,"Name":"ישיבת מליאה בתאריך 02/06/1965 בשעה 11:05","StartDate":"1965-06-02T11:05:00+03:00","FinishDate":"1965-06-02T13:11:00+03:00","IsSpecialMeeting":null,"LastUpdatedDate":"2022-04-12T07:40:15.847+03:00"}
{"Id":158397,"Number":489,"KnessetNum":5,"Name":"ישיבת מליאה בתאריך 28/06/1965 בשעה 16:05","StartDate":"1965-06-28T16:05:00+03:00","FinishDate":"1965-06-28T19:50:00+03:00","IsSpecialMeeting":null,"LastUpdatedDate":"2022-04-24T13:15:53.32+03:00"}
{"Id":158398,"Number":490,"KnessetNum":5,"Name":"ישיבת מליאה בתאריך 29/06/1965 בשעה 16:04","StartDate":"1965-06-29T16:04:00+03:00","FinishDate":"1965-06-29T20:22:00+03:00","IsSpecialMeeting":null,"LastUpdatedDate":"2022-04-25T07:18:46.717+03:00"}
{"Id":158400,"Number":493,"KnessetNum":5,"Name":"ישיבת מליאה בתאריך 06/07/1965 בשעה 16:00","StartDate":"1965-07-06T16:00:00+03:00","FinishDate":"1965-07-06T21:01:00+03:00","IsSpecialMeeting":null,"LastUpdatedDate":"2022-04-25T08:24:54.14+03:00"}
{"Id":158403,"Number":496,"KnessetNum":5,"Name":"ישיבת מליאה בתאריך 12/07/1965 בשעה 16:03","StartDate":"1965-07-12T16:03:00+03:00","FinishDate":"1965-07-12T21:20:00+03:00","IsSpecialMeeting":null,"LastUpdatedDate":"2023-12-18T17:18:21.4+02:00"}
{"Id":158404,"Number":497,"KnessetNum":5,"Name":"ישיבת מליאה בתאריך 13/07/1965 בשעה 16:02","StartDate":"1965-07-13T16:02:00+03:00","FinishDate":"1965-07-13T20:35:00+03:00","IsSpecialMeeting":null,"LastUpdatedDate":"2022-02-27T09:53:06.22+02:00"}
{"Id":158408,"Number":502,"KnessetNum":5,"Name":"ישיבת מליאה בתאריך 21/07/1965 בשעה 16:00","StartDate":"1965-07-21T16:00:00+03:00","FinishDate":"1965-07-21T22:15:00+03:00","IsSpecialMeeting":null,"LastUpdatedDate":"2023-12-18T18:04:56.16+02:00"}
{"Id":158409,"Number":503,"KnessetNum":5,"Name":"ישיבת מליאה בתאריך 22/07/1965 בשעה 09:05","StartDate":"1965-07-22T09:05:00+03:00","FinishDate":"1965-07-22T22:17:00+03:00","IsSpecialMeeting":null,"LastUpdatedDate":"2022-02-21T09:39:57.993+02:00"}
{"Id":158411,"Number":3,"KnessetNum":6,"Name":"ישיבת מליאה בתאריך 29/11/1965 בשעה 16:02","StartDate":"1965-11-29T16:02:00+02:00","FinishDate":"1965-11-29T19:50:00+02:00","IsSpecialMeeting":null,"LastUpdatedDate":"2022-04-25T12:13:25.717+03:00"}
{"Id":158414,"Number":8,"KnessetNum":6,"Name":"ישיבת מליאה בתאריך 08/12/1965 בשעה 11:01","StartDate":"1965-12-08T11:01:00+02:00","FinishDate":"1965-12-08T13:30:00+02:00","IsSpecialMeeting":null,"LastUpdatedDate":"2020-06-10T12:23:29.033+03:00"}
{"Id":158434,"Number":50,"KnessetNum":6,"Name":"ישיבת מליאה בתאריך 22/03/1966 בשעה 15:00","StartDate":"1966-03-22T15:00:00+02:00","FinishDate":"1966-03-22T21:00:00+02:00","IsSpecialMeeting":null,"LastUpdatedDate":"2022-05-12T13:04:01.377+03:00"}
{"Id":158440,"Number":72,"KnessetNum":6,"Name":"ישיבת מליאה בתאריך 20/06/1966 בשעה 17:02","StartDate":"1966-06-20T17:02:00+03:00","FinishDate":"1966-06-20T20:40:00+03:00","IsSpecialMeeting":null,"LastUpdatedDate":"2020-09-17T14:18:34.947+03:00"}
{"Id":158444,"Number":81,"KnessetNum":6,"Name":"ישיבת מליאה בתאריך 11/07/1966 בשעה 17:10","StartDate":"1966-07-11T17:10:00+03:00","FinishDate":"1966-07-11T21:41:00+03:00","IsSpecialMeeting":null,"LastUpdatedDate":"2020-09-22T10:55:29.133+03:00"}
{"Id":158445,"Number":83,"KnessetNum":6,"Name":"ישיבת מליאה בתאריך 13/07/1966 בשעה 12:10","StartDate":"1966-07-13T12:10:00+03:00","FinishDate":"1966-07-13T13:55:00+03:00","IsSpecialMeeting":null,"LastUpdatedDate":"2020-09-22T16:07:11.943+03:00"}
{"Id":158449,"Number":87,"KnessetNum":6,"Name":"ישיבת מליאה בתאריך 27/07/1966 בשעה 16:03","StartDate":"1966-07-27T16:03:00+03:00","FinishDate":"1966-07-27T19:55:00+03:00","IsSpecialMeeting":null,"LastUpdatedDate":"2021-05-27T15:03:18.537+03:00"}
{"Id":158453,"Number":94,"KnessetNum":6,"Name":"ישיבת מליאה בתאריך 10/08/1966 בשעה 11:20","StartDate":"1966-08-10T11:20:00+03:00","FinishDate":"1966-08-10T15:10:00+03:00","IsSpecialMeeting":null,"LastUpdatedDate":"2020-10-01T08:12:22.577+03:00"}
{"Id":158454,"Number":95,"KnessetNum":6,"Name":"ישיבת מליאה בתאריך 31/08/1966 בשעה 10:34","StartDate":"1966-08-31T10:34:00+03:00","FinishDate":"1966-08-31T16:26:00+03:00","IsSpecialMeeting":null,"LastUpdatedDate":"2020-10-01T09:48:47.49+03:00"}
{"Id":158455,"Number":100,"KnessetNum":6,"Name":"ישיבת מליאה בתאריך 24/10/1966 בשעה 16:00","StartDate":"1966-10-24T16:00:00+02:00","FinishDate":"1966-10-24T21:12:00+02:00","IsSpecialMeeting":null,"LastUpdatedDate":"2022-06-06T12:14:14.553+03:00"}
{"Id":158456,"Number":101,"KnessetNum":6,"Name":"ישיבת מליאה בתאריך 25/10/1966 בשעה 16:07","StartDate":"1966-10-25T16:07:00+02:00","FinishDate":"1966-10-25T19:55:00+02:00","IsSpecialMeeting":null,"LastUpdatedDate":"2022-06-06T13:21:05.83+03:00"}
{"Id":158461,"Number":109,"KnessetNum":6,"Name":"ישיבת מליאה בתאריך 14/11/1966 בשעה 16:03","StartDate":"1966-11-14T16:03:00+02:00","FinishDate":"1966-11-14T17:44:00+02:00","IsSpecialMeeting":null,"LastUpdatedDate":"2022-06-06T16:52:44.717+03:00"}
{"Id":158462,"Number":111,"KnessetNum":6,"Name":"ישיבת מליאה בתאריך 16/11/1966 בשעה 11:00","StartDate":"1966-11-16T11:00:00+02:00","FinishDate":"1966-11-16T13:20:00+02:00","IsSpecialMeeting":null,"LastUpdatedDate":"2020-10-12T07:28:15.223+03:00"}
{"Id":158463,"Number":115,"KnessetNum":6,"Name":"ישיבת מליאה בתאריך 28/11/1966 בשעה 16:02","StartDate":"1966-11-28T16:02:00+02:00","FinishDate":"1966-11-28T18:00:00+02:00","IsSpecialMeeting":null,"LastUpdatedDate":"2020-10-12T11:04:57.643+03:00"}
{"Id":158467,"Number":121,"KnessetNum":6,"Name":"ישיבת מליאה בתאריך 12/12/1966 בשעה 16:00","StartDate":"1966-12-12T16:00:00+02:00","FinishDate":"1966-12-12T19:05:00+02:00","IsSpecialMeeting":null,"LastUpdatedDate":"2022-06-13T13:49:29.913+03:00"}
{"Id":158468,"Number":122,"KnessetNum":6,"Name":"ישיבת מליאה בתאריך 13/12/1966 בשעה 16:02","StartDate":"1966-12-13T16:02:00+02:00","FinishDate":"1966-12-13T18:52:00+02:00","IsSpecialMeeting":null,"LastUpdatedDate":"2021-05-26T13:13:05.837+03:00"}
{"Id":158470,"Number":125,"KnessetNum":6,"Name":"ישיבת מליאה בתאריך 20/12/1966 בשעה 16:02","StartDate":"1966-12-20T16:02:00+02:00","FinishDate":"1966-12-20T17:30:00+02:00","IsSpecialMeeting":null,"LastUpdatedDate":"2020-10-13T11:49:12.453+03:00"}
{"Id":158476,"Number":141,"KnessetNum":6,"Name":"ישיבת מליאה בתאריך 25/01/1967 בשעה 11:09","StartDate":"1967-01-25T11:09:00+02:00","FinishDate":"1967-01-25T13:10:00+02:00","IsSpecialMeeting":null,"LastUpdatedDate":"2020-10-18T12:50:10.683+03:00"}
{"Id":158478,"Number":143,"KnessetNum":6,"Name":"ישיבת מליאה בתאריך 31/01/1967 בשעה 16:03","StartDate":"1967-01-31T16:03:00+02:00","FinishDate":"1967-01-31T21:22:00+02:00","IsSpecialMeeting":null,"LastUpdatedDate":"2020-10-18T14:16:50.9+03:00"}
{"Id":158479,"Number":146,"KnessetNum":6,"Name":"ישיבת מליאה בתאריך 07/02/1967 בשעה 16:02","StartDate":"1967-02-07T16:02:00+02:00","FinishDate":"1967-02-07T21:05:00+02:00","IsSpecialMeeting":null,"LastUpdatedDate":"2020-10-18T19:24:24.81+03:00"}
{"Id":158485,"Number":161,"KnessetNum":6,"Name":"ישיבת מליאה בתאריך 14/03/1967 בשעה 16:02","StartDate":"1967-03-14T16:02:00+02:00","FinishDate":"1967-03-14T20:40:00+02:00","IsSpecialMeeting":null,"LastUpdatedDate":"2022-07-03T07:45:04.743+03:00"}
{"Id":158487,"Number":168,"KnessetNum":6,"Name":"ישיבת מליאה בתאריך 30/03/1967 בשעה 10:02","StartDate":"1967-03-30T10:02:00+02:00","FinishDate":"1967-03-30T13:25:00+02:00","IsSpecialMeeting":null,"LastUpdatedDate":"2022-07-05T09:47:32.06+03:00"}
{"Id":158494,"Number":188,"KnessetNum":6,"Name":"ישיבת מליאה בתאריך 27/06/1967 בשעה 16:00","StartDate":"1967-06-27T16:00:00+03:00","FinishDate":"1967-06-27T19:42:00+03:00","IsSpecialMeeting":null,"LastUpdatedDate":"2022-07-11T09:38:36.583+03:00"}
{"Id":158498,"Number":193,"KnessetNum":6,"Name":"ישיבת מליאה בתאריך 10/07/1967 בשעה 16:02","StartDate":"1967-07-10T16:02:00+03:00","FinishDate":"1967-07-10T20:55:00+03:00","IsSpecialMeeting":null,"LastUpdatedDate":"2022-07-12T12:36:08.433+03:00"}
{"Id":158499,"Number":194,"KnessetNum":6,"Name":"ישיבת מליאה בתאריך 11/07/1967 בשעה 16:05","StartDate":"1967-07-11T16:05:00+03:00","FinishDate":"1967-07-11T20:08:00+03:00","IsSpecialMeeting":null,"LastUpdatedDate":"2022-07-12T13:16:46.677+03:00"}
{"Id":158501,"Number":197,"KnessetNum":6,"Name":"ישיבת מליאה בתאריך 18/07/1967 בשעה 16:02","StartDate":"1967-07-18T16:02:00+03:00","FinishDate":"1967-07-18T20:09:00+03:00","IsSpecialMeeting":null,"LastUpdatedDate":"2022-07-13T07:21:43.233+03:00"}
{"Id":158502,"Number":199,"KnessetNum":6,"Name":"ישיבת מליאה בתאריך 24/07/1967 בשעה 16:01","StartDate":"1967-07-24T16:01:00+03:00","FinishDate":"1967-07-24T20:51:00+03:00","IsSpecialMeeting":null,"LastUpdatedDate":"2022-07-19T07:57:36.84+03:00"}
{"Id":158503,"Number":200,"KnessetNum":6,"Name":"ישיבת מליאה בתאריך 25/07/1967 בשעה 16:04","StartDate":"1967-07-25T16:04:00+03:00","FinishDate":"1967-07-25T18:09:00+03:00","IsSpecialMeeting":null,"LastUpdatedDate":"2022-07-19T08:09:14.533+03:00"}
{"Id":158504,"Number":201,"KnessetNum":6,"Name":"ישיבת מליאה בתאריך 26/07/1967 בשעה 12:37","StartDate":"1967-07-26T12:37:00+03:00","FinishDate":"1967-07-26T15:51:00+03:00","IsSpecialMeeting":null,"LastUpdatedDate":"2022-07-13T08:32:33.41+03:00"}
{"Id":158506,"Number":204,"KnessetNum":6,"Name":"ישיבת מליאה בתאריך 02/08/1967 בשעה 12:37","StartDate":"1967-08-02T12:37:00+03:00","FinishDate":"1967-08-02T14:02:00+03:00","IsSpecialMeeting":null,"LastUpdatedDate":"2022-07-19T09:44:47.04+03:00"}
{"Id":158507,"Number":205,"KnessetNum":6,"Name":"ישיבת מליאה בתאריך 07/08/1967 בשעה 16:02","StartDate":"1967-08-07T16:02:00+03:00","FinishDate":"1967-08-07T21:31:00+03:00","IsSpecialMeeting":null,"LastUpdatedDate":"2022-07-19T10:40:20.95+03:00"}
{"Id":158508,"Number":206,"KnessetNum":6,"Name":"ישיבת מליאה בתאריך 08/08/1967 בשעה 21:07","StartDate":"1967-08-08T21:07:00+03:00","FinishDate":null,"IsSpecialMeeting":null,"LastUpdatedDate":"2022-07-19T14:04:56.293+03:00"}
{"Id":158510,"Number":208,"KnessetNum":6,"Name":"ישיבת מליאה בתאריך 25/09/1967 בשעה 11:30","StartDate":"1967-09-25T11:30:00+03:00","FinishDate":"1967-09-25T13:01:00+03:00","IsSpecialMeeting":null,"LastUpdatedDate":"2022-07-20T10:42:01.573+03:00"}
{"Id":158511,"Number":210,"KnessetNum":6,"Name":"ישיבת מליאה בתאריך 31/10/1967 בשעה 16:00","StartDate":"1967-10-31T16:00:00+02:00","FinishDate":"1967-10-31T18:32:00+02:00","IsSpecialMeeting":null,"LastUpdatedDate":"2022-07-20T10:52:04.983+03:00"}
{"Id":158512,"Number":217,"KnessetNum":6,"Name":"ישיבת מליאה בתאריך 15/11/1967 בשעה 12:30","StartDate":"1967-11-15T12:30:00+02:00","FinishDate":"1967-11-15T14:03:00+02:00","IsSpecialMeeting":null,"LastUpdatedDate":"2022-07-18T07:47:23.35+03:00"}
{"Id":158513,"Number":221,"KnessetNum":6,"Name":"ישיבת מליאה בתאריך 27/11/1967 בשעה 16:02","StartDate":"1967-11-27T16:02:00+02:00","FinishDate":"1967-11-27T19:33:00+02:00","IsSpecialMeeting":null,"LastUpdatedDate":"2022-07-18T10:47:19.177+03:00"}
{"Id":158514,"Number":223,"KnessetNum":6,"Name":"ישיבת מליאה בתאריך 29/11/1967 בשעה 12:32","StartDate":"1967-11-29T12:32:00+02:00","FinishDate":"1967-11-29T14:13:00+02:00","IsSpecialMeeting":null,"LastUpdatedDate":"2022-07-18T13:02:58.84+03:00"}
{"Id":158527,"Number":244,"KnessetNum":6,"Name":"ישיבת מליאה בתאריך 23/01/1968 בשעה 16:01","StartDate":"1968-01-23T16:01:00+02:00","FinishDate":"1968-01-23T20:15:00+02:00","IsSpecialMeeting":null,"LastUpdatedDate":"2022-08-01T14:12:56.693+03:00"}
{"Id":158528,"Number":247,"KnessetNum":6,"Name":"ישיבת מליאה בתאריך 30/01/1968 בשעה 16:01","StartDate":"1968-01-30T16:01:00+02:00","FinishDate":"1968-01-30T20:10:00+02:00","IsSpecialMeeting":null,"LastUpdatedDate":"2022-08-01T07:22:48.727+03:00"}
{"Id":158531,"Number":254,"KnessetNum":6,"Name":"ישיבת מליאה בתאריך 14/02/1968 בשעה 12:32","StartDate":"1968-02-14T12:32:00+02:00","FinishDate":"1968-02-14T14:48:00+02:00","IsSpecialMeeting":null,"LastUpdatedDate":"2022-08-02T09:50:33.63+03:00"}
{"Id":158534,"Number":261,"KnessetNum":6,"Name":"ישיבת מליאה בתאריך 04/03/1968 בשעה 16:01","StartDate":"1968-03-04T16:01:00+02:00","FinishDate":"1968-03-04T21:27:00+02:00","IsSpecialMeeting":null,"LastUpdatedDate":"2022-08-14T11:03:11.997+03:00"}
{"Id":158536,"Number":265,"KnessetNum":6,"Name":"ישיבת מליאה בתאריך 12/03/1968 בשעה 16:00","StartDate":"1968-03-12T16:00:00+02:00","FinishDate":"1968-03-12T21:23:00+02:00","IsSpecialMeeting":null,"LastUpdatedDate":"2022-10-06T10:05:15.113+03:00"}
{"Id":158537,"Number":268,"KnessetNum":6,"Name":"ישיבת מליאה בתאריך 19/03/1968 בשעה 16:02","StartDate":"1968-03-19T16:02:00+02:00","FinishDate":"1968-03-19T20:35:00+02:00","IsSpecialMeeting":null,"LastUpdatedDate":"2022-10-06T10:32:28.903+03:00"}
{"Id":158538,"Number":271,"KnessetNum":6,"Name":"ישיבת מליאה בתאריך 25/03/1968 בשעה 16:02","StartDate":"1968-03-25T16:02:00+02:00","FinishDate":"1968-03-25T22:02:00+02:00","IsSpecialMeeting":null,"LastUpdatedDate":"2022-08-15T16:01:45.193+03:00"}
{"Id":158540,"Number":274,"KnessetNum":6,"Name":"ישיבת מליאה בתאריך 27/03/1968 בשעה 09:00","StartDate":"1968-03-27T09:00:00+02:00","FinishDate":"1968-03-27T14:45:00+02:00","IsSpecialMeeting":null,"LastUpdatedDate":"2022-10-18T09:58:05.703+03:00"}
{"Id":158542,"Number":278,"KnessetNum":6,"Name":"ישיבת מליאה בתאריך 07/05/1968 בשעה 16:01","StartDate":"1968-05-07T16:01:00+03:00","FinishDate":"1968-05-07T20:03:00+03:00","IsSpecialMeeting":null,"LastUpdatedDate":"2022-08-16T07:21:18.47+03:00"}
{"Id":158543,"Number":279,"KnessetNum":6,"Name":"ישיבת מליאה בתאריך 08/05/1968 בשעה 12:30","StartDate":"1968-05-08T12:30:00+03:00","FinishDate":"1968-05-08T13:57:00+03:00","IsSpecialMeeting":null,"LastUpdatedDate":"2022-10-19T07:10:57.507+03:00"}
{"Id":158544,"Number":286,"KnessetNum":6,"Name":"ישיבת מליאה בתאריך 22/05/1968 בשעה 12:32","StartDate":"1968-05-22T12:32:00+03:00","FinishDate":"1968-05-22T13:52:00+03:00","IsSpecialMeeting":null,"LastUpdatedDate":"2022-09-06T13:41:25.697+03:00"}
{"Id":158545,"Number":287,"KnessetNum":6,"Name":"ישיבת מליאה בתאריך 27/05/1968 בשעה 16:01","StartDate":"1968-05-27T16:01:00+03:00","FinishDate":"1968-05-27T20:52:00+03:00","IsSpecialMeeting":null,"LastUpdatedDate":"2022-09-06T16:36:08.283+03:00"}
{"Id":158546,"Number":288,"KnessetNum":6,"Name":"ישיבת מליאה בתאריך 28/05/1968 בשעה 16:00","StartDate":"1968-05-28T16:00:00+03:00","FinishDate":"1968-05-28T20:02:00+03:00","IsSpecialMeeting":null,"LastUpdatedDate":"2022-09-06T16:45:11.4+03:00"}
{"Id":158547,"Number":291,"KnessetNum":6,"Name":"ישיבת מליאה בתאריך 04/06/1968 בשעה 16:04","StartDate":"1968-06-04T16:04:00+03:00","FinishDate":"1968-06-04T20:00:00+03:00","IsSpecialMeeting":null,"LastUpdatedDate":"2022-09-11T15:06:09.403+03:00"}
{"Id":158551,"Number":296,"KnessetNum":6,"Name":"ישיבת מליאה בתאריך 17/06/1968 בשעה 16:00","StartDate":"1968-06-17T16:00:00+03:00","FinishDate":"1968-06-17T21:17:00+03:00","IsSpecialMeeting":null,"LastUpdatedDate":"2022-10-19T10:58:37.153+03:00"}
{"Id":158552,"Number":298,"KnessetNum":6,"Name":"ישיבת מליאה בתאריך 19/06/1968 בשעה 11:00","StartDate":"1968-06-19T11:00:00+03:00","FinishDate":"1968-06-19T15:41:00+03:00","IsSpecialMeeting":null,"LastUpdatedDate":"2022-10-23T08:52:11.74+03:00"}
{"Id":158554,"Number":301,"KnessetNum":6,"Name":"ישיבת מליאה בתאריך 26/06/1968 בשעה 11:02","StartDate":"1968-06-26T11:02:00+03:00","FinishDate":"1968-06-26T15:39:00+03:00","IsSpecialMeeting":null,"LastUpdatedDate":"2022-09-13T16:21:05.02+03:00"}
{"Id":158555,"Number":302,"KnessetNum":6,"Name":"ישיבת מליאה בתאריך 01/07/1968 בשעה 16:02","StartDate":"1968-07-01T16:02:00+03:00","FinishDate":"1968-07-01T21:04:00+03:00","IsSpecialMeeting":null,"LastUpdatedDate":"2022-09-18T13:26:19.027+03:00"}
{"Id":158556,"Number":304,"KnessetNum":6,"Name":"ישיבת מליאה בתאריך 03/07/1968 בשעה 11:02","StartDate":"1968-07-03T11:02:00+03:00","FinishDate":"1968-07-03T15:12:00+03:00","IsSpecialMeeting":null,"LastUpdatedDate":"2022-09-18T14:44:19.597+03:00"}
{"Id":158557,"Number":306,"KnessetNum":6,"Name":"ישיבת מליאה בתאריך 09/07/1968 בשעה 16:02","StartDate":"1968-07-09T16:02:00+03:00","FinishDate":"1968-07-09T21:00:00+03:00","IsSpecialMeeting":null,"LastUpdatedDate":"2022-10-23T09:20:36.423+03:00"}
{"Id":158558,"Number":308,"KnessetNum":6,"Name":"ישיבת מליאה בתאריך 15/07/1968 בשעה 16:03","StartDate":"1968-07-15T16:03:00+03:00","FinishDate":"1968-07-15T21:00:00+03:00","IsSpecialMeeting":null,"LastUpdatedDate":"2022-09-20T15:20:54.517+03:00"}
{"Id":158560,"Number":310,"KnessetNum":6,"Name":"ישיבת מליאה בתאריך 17/07/1968 בשעה 11:00","StartDate":"1968-07-17T11:00:00+03:00","FinishDate":"1968-07-17T14:07:00+03:00","IsSpecialMeeting":null,"LastUpdatedDate":"2022-10-23T10:17:30.87+03:00"}
{"Id":158561,"Number":314,"KnessetNum":6,"Name":"ישיבת מליאה בתאריך 25/07/1968 בשעה 09:02","StartDate":"1968-07-25T09:02:00+03:00","FinishDate":"1968-07-25T13:42:00+03:00","IsSpecialMeeting":null,"LastUpdatedDate":"2022-10-23T11:27:37.47+03:00"}
{"Id":158562,"Number":315,"KnessetNum":6,"Name":"ישיבת מליאה בתאריך 29/07/1968 בשעה 16:00","StartDate":"1968-07-29T16:00:00+03:00","FinishDate":"1968-07-29T21:22:00+03:00","IsSpecialMeeting":null,"LastUpdatedDate":"2022-10-02T13:16:55.723+03:00"}
{"Id":158563,"Number":316,"KnessetNum":6,"Name":"ישיבת מליאה בתאריך 30/07/1968 בשעה 16:04","StartDate":"1968-07-30T16:04:00+03:00","FinishDate":"1968-07-30T20:25:00+03:00","IsSpecialMeeting":null,"LastUpdatedDate":"2022-10-18T07:31:36.56+03:00"}
{"Id":158564,"Number":317,"KnessetNum":6,"Name":"ישיבת מליאה בתאריך 31/07/1968 בשעה 11:01","StartDate":"1968-07-31T11:01:00+03:00","FinishDate":"1968-07-31T15:32:00+03:00","IsSpecialMeeting":null,"LastUpdatedDate":"2022-10-18T08:57:53.917+03:00"}
{"Id":158565,"Number":318,"KnessetNum":6,"Name":"ישיבת מליאה בתאריך 05/08/1968 בשעה 16:03","StartDate":"1968-08-05T16:03:00+03:00","FinishDate":"1968-08-05T21:15:00+03:00","IsSpecialMeeting":null,"LastUpdatedDate":"2019-12-16T13:08:32.59+02:00"}
{"Id":158567,"Number":320,"KnessetNum":6,"Name":"ישיבת מליאה בתאריך 07/08/1968 בשעה 11:03","StartDate":"1968-08-07T11:03:00+03:00","FinishDate":"1968-08-07T15:40:00+03:00","IsSpecialMeeting":null,"LastUpdatedDate":"2022-10-23T11:56:03.81+03:00"}
{"Id":158568,"Number":321,"KnessetNum":6,"Name":"ישיבת מליאה בתאריך 08/08/1968 בשעה 09:02","StartDate":"1968-08-08T09:02:00+03:00","FinishDate":"1968-08-08T15:41:00+03:00","IsSpecialMeeting":null,"LastUpdatedDate":"2022-10-03T12:52:47.717+03:00"}
{"Id":158572,"Number":325,"KnessetNum":6,"Name":"ישיבת מליאה בתאריך 21/10/1968 בשעה 16:00","StartDate":"1968-10-21T16:00:00+02:00","FinishDate":"1968-10-21T19:46:00+02:00","IsSpecialMeeting":null,"LastUpdatedDate":"2022-10-03T14:13:56.583+03:00"}
{"Id":158585,"Number":346,"KnessetNum":6,"Name":"ישיבת מליאה בתאריך 09/12/1968 בשעה 16:03","StartDate":"1968-12-09T16:03:00+02:00","FinishDate":"1968-12-09T20:06:00+02:00","IsSpecialMeeting":null,"LastUpdatedDate":"2022-10-30T12:18:43.433+02:00"}
{"Id":158586,"Number":347,"KnessetNum":6,"Name":"ישיבת מליאה בתאריך 10/12/1968 בשעה 16:00","StartDate":"1968-12-10T16:00:00+02:00","FinishDate":"1968-12-10T19:52:00+02:00","IsSpecialMeeting":null,"LastUpdatedDate":"2022-10-31T10:43:09.8+02:00"}
{"Id":158590,"Number":352,"KnessetNum":6,"Name":"ישיבת מליאה בתאריך 23/12/1968 בשעה 16:01","StartDate":"1968-12-23T16:01:00+02:00","FinishDate":"1968-12-23T20:46:00+02:00","IsSpecialMeeting":null,"LastUpdatedDate":"2022-11-16T10:51:41.527+02:00"}
{"Id":158592,"Number":355,"KnessetNum":6,"Name":"ישיבת מליאה בתאריך 30/12/1968 בשעה 16:00","StartDate":"1968-12-30T16:00:00+02:00","FinishDate":"1968-12-30T21:14:00+02:00","IsSpecialMeeting":null,"LastUpdatedDate":"2025-01-22T12:12:34.097+02:00"}
{"Id":158593,"Number":357,"KnessetNum":6,"Name":"ישיבת מליאה בתאריך 01/01/1969 בשעה 11:32","StartDate":"1969-01-01T11:32:00+02:00","FinishDate":"1969-01-01T13:25:00+02:00","IsSpecialMeeting":null,"LastUpdatedDate":"2022-11-16T07:29:04.503+02:00"}
{"Id":158598,"Number":369,"KnessetNum":6,"Name":"ישיבת מליאה בתאריך 29/01/1969 בשעה 11:32","StartDate":"1969-01-29T11:32:00+02:00","FinishDate":"1969-01-29T16:00:00+02:00","IsSpecialMeeting":null,"LastUpdatedDate":"2022-11-21T08:17:32.85+02:00"}
{"Id":158610,"Number":398,"KnessetNum":6,"Name":"ישיבת מליאה בתאריך 07/05/1969 בשעה 11:30","StartDate":"1969-05-07T11:30:00+03:00","FinishDate":"1969-05-07T14:01:00+03:00","IsSpecialMeeting":null,"LastUpdatedDate":"2025-01-22T12:57:32.887+02:00"}
{"Id":158624,"Number":423,"KnessetNum":6,"Name":"ישיבת מליאה בתאריך 07/07/1969 בשעה 15:02","StartDate":"1969-07-07T15:02:00+03:00","FinishDate":"1969-07-07T21:18:00+03:00","IsSpecialMeeting":null,"LastUpdatedDate":"2022-05-10T13:46:26.87+03:00"}
{"Id":158631,"Number":431,"KnessetNum":6,"Name":"ישיבת מליאה בתאריך 25/09/1969 בשעה 11:06","StartDate":"1969-09-25T11:06:00+02:00","FinishDate":"1969-09-25T16:37:00+02:00","IsSpecialMeeting":null,"LastUpdatedDate":"2022-04-26T07:39:34.117+03:00"}
{"Id":158636,"Number":11,"KnessetNum":7,"Name":"ישיבת מליאה בתאריך 09/12/1969 בשעה 16:00","StartDate":"1969-12-09T16:00:00+02:00","FinishDate":"1969-12-09T17:05:00+02:00","IsSpecialMeeting":null,"LastUpdatedDate":"2020-10-28T13:38:37.177+02:00"}
{"Id":158643,"Number":21,"KnessetNum":7,"Name":"ישיבת מליאה בתאריך 31/12/1969 בשעה 11:00","StartDate":"1969-12-31T11:00:00+02:00","FinishDate":"1969-12-31T13:15:00+02:00","IsSpecialMeeting":null,"LastUpdatedDate":"2020-11-01T14:34:59.773+02:00"}
{"Id":158647,"Number":25,"KnessetNum":7,"Name":"ישיבת מליאה בתאריך 12/01/1970 בשעה 16:00","StartDate":"1970-01-12T16:00:00+02:00","FinishDate":"1970-01-12T19:35:00+02:00","IsSpecialMeeting":null,"LastUpdatedDate":"2020-10-27T09:04:52.437+02:00"}
{"Id":158648,"Number":27,"KnessetNum":7,"Name":"ישיבת מליאה בתאריך 14/01/1970 בשעה 11:01","StartDate":"1970-01-14T11:01:00+02:00","FinishDate":"1970-01-14T14:23:00+02:00","IsSpecialMeeting":null,"LastUpdatedDate":"2020-11-04T11:02:38.223+02:00"}
{"Id":158649,"Number":29,"KnessetNum":7,"Name":"ישיבת מליאה בתאריך 20/01/1970 בשעה 16:00","StartDate":"1970-01-20T16:00:00+02:00","FinishDate":"1970-01-20T19:19:00+02:00","IsSpecialMeeting":null,"LastUpdatedDate":"2020-10-27T10:17:34.09+02:00"}
{"Id":158650,"Number":30,"KnessetNum":7,"Name":"ישיבת מליאה בתאריך 21/01/1970 בשעה 11:03","StartDate":"1970-01-21T11:03:00+02:00","FinishDate":"1970-01-21T12:20:00+02:00","IsSpecialMeeting":null,"LastUpdatedDate":"2020-10-27T10:37:52.367+02:00"}
{"Id":158651,"Number":31,"KnessetNum":7,"Name":"ישיבת מליאה בתאריך 26/01/1970 בשעה 16:01","StartDate":"1970-01-26T16:01:00+02:00","FinishDate":"1970-01-26T18:13:00+02:00","IsSpecialMeeting":null,"LastUpdatedDate":"2020-11-03T09:08:33.273+02:00"}
{"Id":158652,"Number":33,"KnessetNum":7,"Name":"ישיבת מליאה בתאריך 28/01/1970 בשעה 11:02","StartDate":"1970-01-28T11:02:00+02:00","FinishDate":"1970-01-28T12:07:00+02:00","IsSpecialMeeting":null,"LastUpdatedDate":"2020-11-03T14:14:20.673+02:00"}
{"Id":158654,"Number":35,"KnessetNum":7,"Name":"ישיבת מליאה בתאריך 03/02/1970 בשעה 16:05","StartDate":"1970-02-03T16:05:00+02:00","FinishDate":"1970-02-03T19:30:00+02:00","IsSpecialMeeting":null,"LastUpdatedDate":"2020-11-03T16:41:29.947+02:00"}
{"Id":158656,"Number":39,"KnessetNum":7,"Name":"ישיבת מליאה בתאריך 11/02/1970 בשעה 11:02","StartDate":"1970-02-11T11:02:00+02:00","FinishDate":"1970-02-11T13:23:00+02:00","IsSpecialMeeting":null,"LastUpdatedDate":"2020-11-04T15:42:10.673+02:00"}
{"Id":158657,"Number":40,"KnessetNum":7,"Name":"ישיבת מליאה בתאריך 16/02/1970 בשעה 16:00","StartDate":"1970-02-16T16:00:00+02:00","FinishDate":"1970-02-16T20:25:00+02:00","IsSpecialMeeting":null,"LastUpdatedDate":"2020-10-27T13:31:12.12+02:00"}
{"Id":158658,"Number":43,"KnessetNum":7,"Name":"ישיבת מליאה בתאריך 23/02/1970 בשעה 16:02","StartDate":"1970-02-23T16:02:00+02:00","FinishDate":"1970-02-23T20:50:00+02:00","IsSpecialMeeting":null,"LastUpdatedDate":"2025-01-22T13:09:07.973+02:00"}
{"Id":158659,"Number":44,"KnessetNum":7,"Name":"ישיבת מליאה בתאריך 24/02/1970 בשעה 16:01","StartDate":"1970-02-24T16:01:00+02:00","FinishDate":"1970-02-24T21:13:00+02:00","IsSpecialMeeting":null,"LastUpdatedDate":"2020-11-10T10:25:17.897+02:00"}
{"Id":158660,"Number":48,"KnessetNum":7,"Name":"ישיבת מליאה בתאריך 04/03/1970 בשעה 11:01","StartDate":"1970-03-04T11:01:00+02:00","FinishDate":"1970-03-04T13:48:00+02:00","IsSpecialMeeting":null,"LastUpdatedDate":"2020-11-10T15:48:07.937+02:00"}
{"Id":158664,"Number":53,"KnessetNum":7,"Name":"ישיבת מליאה בתאריך 17/03/1970 בשעה 16:02","StartDate":"1970-03-17T16:02:00+02:00","FinishDate":"1970-03-17T21:13:00+02:00","IsSpecialMeeting":null,"LastUpdatedDate":"2020-11-15T10:29:28.32+02:00"}
{"Id":158666,"Number":56,"KnessetNum":7,"Name":"ישיבת מליאה בתאריך 25/03/1970 בשעה 15:00","StartDate":"1970-03-25T15:00:00+02:00","FinishDate":"1970-03-25T18:48:00+02:00","IsSpecialMeeting":null,"LastUpdatedDate":"2020-11-15T12:55:38.243+02:00"}
{"Id":158667,"Number":57,"KnessetNum":7,"Name":"ישיבת מליאה בתאריך 26/03/1970 בשעה 15:00","StartDate":"1970-03-26T15:00:00+02:00","FinishDate":"1970-03-26T17:45:00+02:00","IsSpecialMeeting":null,"LastUpdatedDate":"2020-11-15T15:02:13.883+02:00"}
{"Id":158668,"Number":58,"KnessetNum":7,"Name":"ישיבת מליאה בתאריך 30/03/1970 בשעה 15:00","StartDate":"1970-03-30T15:00:00+02:00","FinishDate":"1970-03-30T20:49:00+02:00","IsSpecialMeeting":null,"LastUpdatedDate":"2020-11-16T16:12:05.96+02:00"}
{"Id":158669,"Number":59,"KnessetNum":7,"Name":"ישיבת מליאה בתאריך 31/03/1970 בשעה 11:02","StartDate":"1970-03-31T11:02:00+02:00","FinishDate":"1970-03-31T17:37:00+02:00","IsSpecialMeeting":null,"LastUpdatedDate":"2020-11-23T17:56:51.963+02:00"}
{"Id":158670,"Number":63,"KnessetNum":7,"Name":"ישיבת מליאה בתאריך 08/04/1970 בשעה 12:32","StartDate":"1970-04-08T12:32:00+03:00","FinishDate":"1970-04-08T18:05:00+03:00","IsSpecialMeeting":null,"LastUpdatedDate":"2020-11-23T18:01:33.163+02:00"}
{"Id":158671,"Number":64,"KnessetNum":7,"Name":"ישיבת מליאה בתאריך 13/04/1970 בשעה 11:01","StartDate":"1970-04-13T11:01:00+03:00","FinishDate":"1970-04-13T20:51:00+03:00","IsSpecialMeeting":null,"LastUpdatedDate":"2020-11-23T14:33:47.933+02:00"}
{"Id":158672,"Number":65,"KnessetNum":7,"Name":"ישיבת מליאה בתאריך 14/04/1970 בשעה 15:01","StartDate":"1970-04-14T15:01:00+03:00","FinishDate":"1970-04-14T18:17:00+03:00","IsSpecialMeeting":null,"LastUpdatedDate":"2020-11-23T14:36:06.12+02:00"}
{"Id":158674,"Number":68,"KnessetNum":7,"Name":"ישיבת מליאה בתאריך 19/05/1970 בשעה 16:02","StartDate":"1970-05-19T16:02:00+03:00","FinishDate":"1970-05-19T19:09:00+03:00","IsSpecialMeeting":null,"LastUpdatedDate":"2020-11-24T10:29:25.267+02:00"}
{"Id":158676,"Number":76,"KnessetNum":7,"Name":"ישיבת מליאה בתאריך 08/06/1970 בשעה 12:00","StartDate":"1970-06-08T12:00:00+03:00","FinishDate":"1970-06-08T20:00:00+03:00","IsSpecialMeeting":null,"LastUpdatedDate":"2020-11-29T09:47:41.027+02:00"}
{"Id":158678,"Number":82,"KnessetNum":7,"Name":"ישיבת מליאה בתאריך 24/06/1970 בשעה 12:30","StartDate":"1970-06-24T12:30:00+03:00","FinishDate":"1970-06-24T14:17:00+03:00","IsSpecialMeeting":null,"LastUpdatedDate":"2020-11-30T12:05:39.12+02:00"}
{"Id":158680,"Number":85,"KnessetNum":7,"Name":"ישיבת מליאה בתאריך 01/07/1970 בשעה 12:31","StartDate":"1970-07-01T12:31:00+03:00","FinishDate":"1970-07-01T15:48:00+03:00","IsSpecialMeeting":null,"LastUpdatedDate":"2020-12-01T08:51:54.48+02:00"}
{"Id":158684,"Number":94,"KnessetNum":7,"Name":"ישיבת מליאה בתאריך 22/07/1970 בשעה 12:33","StartDate":"1970-07-22T12:33:00+03:00","FinishDate":"1970-07-22T14:30:00+03:00","IsSpecialMeeting":null,"LastUpdatedDate":"2020-12-02T10:13:37.303+02:00"}
{"Id":158685,"Number":96,"KnessetNum":7,"Name":"ישיבת מליאה בתאריך 28/07/1970 בשעה 15:01","StartDate":"1970-07-28T15:01:00+03:00","FinishDate":"1970-07-28T20:42:00+03:00","IsSpecialMeeting":null,"LastUpdatedDate":"2020-12-02T14:17:07.923+02:00"}
{"Id":158686,"Number":97,"KnessetNum":7,"Name":"ישיבת מליאה בתאריך 29/07/1970 בשעה 12:31","StartDate":"1970-07-29T12:31:00+03:00","FinishDate":"1970-07-29T18:02:00+03:00","IsSpecialMeeting":null,"LastUpdatedDate":"2020-12-06T09:09:55.217+02:00"}
{"Id":158687,"Number":100,"KnessetNum":7,"Name":"ישיבת מליאה בתאריך 05/08/1970 בשעה 11:00","StartDate":"1970-08-05T11:00:00+03:00","FinishDate":"1970-08-05T19:39:00+03:00","IsSpecialMeeting":null,"LastUpdatedDate":"2020-12-06T12:52:29.57+02:00"}
{"Id":158688,"Number":101,"KnessetNum":7,"Name":"ישיבת מליאה בתאריך 12/08/1970 בשעה 10:02","StartDate":"1970-08-12T10:02:00+03:00","FinishDate":"1970-08-12T19:20:00+03:00","IsSpecialMeeting":null,"LastUpdatedDate":"2020-12-07T09:10:58.743+02:00"}
{"Id":158689,"Number":102,"KnessetNum":7,"Name":"ישיבת מליאה בתאריך 13/08/1970 בשעה 10:00","StartDate":"1970-08-13T10:00:00+03:00","FinishDate":"1970-08-13T16:44:00+03:00","IsSpecialMeeting":null,"LastUpdatedDate":"2020-12-07T12:39:16.697+02:00"}
{"Id":158690,"Number":103,"KnessetNum":7,"Name":"ישיבת מליאה בתאריך 24/08/1970 בשעה 11:00","StartDate":"1970-08-24T11:00:00+03:00","FinishDate":"1970-08-24T19:36:00+03:00","IsSpecialMeeting":null,"LastUpdatedDate":"2020-12-07T14:35:40.283+02:00"}
{"Id":158691,"Number":105,"KnessetNum":7,"Name":"ישיבת מליאה בתאריך 01/09/1970 בשעה 11:03","StartDate":"1970-09-01T11:03:00+03:00","FinishDate":"1970-09-01T19:29:00+03:00","IsSpecialMeeting":null,"LastUpdatedDate":"2020-12-07T18:10:57.13+02:00"}
{"Id":158693,"Number":108,"KnessetNum":7,"Name":"ישיבת מליאה בתאריך 02/11/1970 בשעה 16:00","StartDate":"1970-11-02T16:00:00+02:00","FinishDate":"1970-11-02T19:40:00+02:00","IsSpecialMeeting":null,"LastUpdatedDate":"2020-12-08T09:24:36.587+02:00"}
{"Id":158696,"Number":112,"KnessetNum":7,"Name":"ישיבת מליאה בתאריך 10/11/1970 בשעה 16:00","StartDate":"1970-11-10T16:00:00+02:00","FinishDate":"1970-11-10T20:20:00+02:00","IsSpecialMeeting":null,"LastUpdatedDate":"2020-12-08T16:57:14.807+02:00"}
{"Id":158707,"Number":129,"KnessetNum":7,"Name":"ישיבת מליאה בתאריך 21/12/1970 בשעה 16:00","StartDate":"1970-12-21T16:00:00+02:00","FinishDate":"1970-12-21T21:35:00+02:00","IsSpecialMeeting":null,"LastUpdatedDate":"2020-12-16T15:08:52.857+02:00"}
{"Id":158709,"Number":131,"KnessetNum":7,"Name":"ישיבת מליאה בתאריך 23/12/1970 בשעה 12:30","StartDate":"1970-12-23T12:30:00+02:00","FinishDate":"1970-12-23T16:40:00+02:00","IsSpecialMeeting":null,"LastUpdatedDate":"2020-12-17T11:31:12.513+02:00"}
{"Id":158710,"Number":134,"KnessetNum":7,"Name":"ישיבת מליאה בתאריך 29/12/1970 בשעה 14:00","StartDate":"1970-12-29T14:00:00+02:00","FinishDate":"1970-12-29T22:44:00+02:00","IsSpecialMeeting":null,"LastUpdatedDate":"2025-01-27T08:14:39.693+02:00"}
{"Id":158714,"Number":138,"KnessetNum":7,"Name":"ישיבת מליאה בתאריך 06/01/1971 בשעה 11:00","StartDate":"1971-01-06T11:00:00+02:00","FinishDate":"1971-01-06T16:30:00+02:00","IsSpecialMeeting":null,"LastUpdatedDate":"2023-09-12T14:27:22.977+03:00"}
{"Id":158716,"Number":141,"KnessetNum":7,"Name":"ישיבת מליאה בתאריך 13/01/1971 בשעה 11:00","StartDate":"1971-01-13T11:00:00+02:00","FinishDate":"1971-01-13T15:15:00+02:00","IsSpecialMeeting":null,"LastUpdatedDate":"2023-09-12T15:41:29.583+03:00"}
{"Id":158717,"Number":143,"KnessetNum":7,"Name":"ישיבת מליאה בתאריך 19/01/1971 בשעה 16:00","StartDate":"1971-01-19T16:00:00+02:00","FinishDate":"1971-01-19T16:00:00+02:00","IsSpecialMeeting":null,"LastUpdatedDate":"2020-12-28T09:03:59.933+02:00"}
{"Id":158718,"Number":146,"KnessetNum":7,"Name":"ישיבת מליאה בתאריך 26/01/1971 בשעה 16:01","StartDate":"1971-01-26T16:01:00+02:00","FinishDate":"1971-01-26T20:22:00+02:00","IsSpecialMeeting":null,"LastUpdatedDate":"2020-12-22T14:03:33.983+02:00"}
{"Id":158719,"Number":147,"KnessetNum":7,"Name":"ישיבת מליאה בתאריך 27/01/1971 בשעה 11:00","StartDate":"1971-01-27T11:00:00+02:00","FinishDate":"1971-01-27T13:50:00+02:00","IsSpecialMeeting":null,"LastUpdatedDate":"2023-09-12T16:02:01.107+03:00"}
{"Id":158721,"Number":152,"KnessetNum":7,"Name":"ישיבת מליאה בתאריך 09/02/1971 בשעה 16:00","StartDate":"1971-02-09T16:00:00+02:00","FinishDate":"1971-02-09T20:55:00+02:00","IsSpecialMeeting":null,"LastUpdatedDate":"2020-12-23T10:47:37.547+02:00"}
{"Id":158722,"Number":155,"KnessetNum":7,"Name":"ישיבת מליאה בתאריך 16/02/1971 בשעה 15:02","StartDate":"1971-02-16T15:02:00+02:00","FinishDate":"1971-02-16T20:48:00+02:00","IsSpecialMeeting":null,"LastUpdatedDate":"2020-12-28T09:05:54.47+02:00"}
{"Id":158723,"Number":157,"KnessetNum":7,"Name":"ישיבת מליאה בתאריך 22/02/1971 בשעה 15:01","StartDate":"1971-02-22T15:01:00+02:00","FinishDate":"1971-02-22T21:39:00+02:00","IsSpecialMeeting":null,"LastUpdatedDate":"2020-12-24T11:58:58.29+02:00"}
{"Id":158724,"Number":159,"KnessetNum":7,"Name":"ישיבת מליאה בתאריך 24/02/1971 בשעה 11:00","StartDate":"1971-02-24T11:00:00+02:00","FinishDate":"1971-02-24T14:45:00+02:00","IsSpecialMeeting":null,"LastUpdatedDate":"2023-09-13T13:31:01.847+03:00"}
{"Id":158725,"Number":166,"KnessetNum":7,"Name":"ישיבת מליאה בתאריך 15/03/1971 בשעה 15:00","StartDate":"1971-03-15T15:00:00+02:00","FinishDate":"1971-03-15T19:50:00+02:00","IsSpecialMeeting":null,"LastUpdatedDate":"2020-12-28T15:56:18.177+02:00"}
{"Id":158728,"Number":169,"KnessetNum":7,"Name":"ישיבת מליאה בתאריך 22/03/1971 בשעה 15:00","StartDate":"1971-03-22T15:00:00+02:00","FinishDate":"1971-03-22T21:29:00+02:00","IsSpecialMeeting":null,"LastUpdatedDate":"2020-12-30T13:25:50.517+02:00"}
{"Id":158729,"Number":171,"KnessetNum":7,"Name":"ישיבת מליאה בתאריך 24/03/1971 בשעה 15:00","StartDate":"1971-03-24T15:00:00+02:00","FinishDate":"1971-03-24T20:30:00+02:00","IsSpecialMeeting":null,"LastUpdatedDate":"2020-12-31T11:40:20.537+02:00"}
{"Id":158732,"Number":174,"KnessetNum":7,"Name":"ישיבת מליאה בתאריך 30/03/1971 בשעה 15:00","StartDate":"1971-03-30T15:00:00+02:00","FinishDate":"1971-03-30T21:45:00+02:00","IsSpecialMeeting":null,"LastUpdatedDate":"2020-12-29T17:15:42.77+02:00"}
{"Id":158733,"Number":175,"KnessetNum":7,"Name":"ישיבת מליאה בתאריך 31/03/1971 בשעה 09:00","StartDate":"1971-03-31T09:00:00+02:00","FinishDate":"1971-03-31T14:34:00+02:00","IsSpecialMeeting":null,"LastUpdatedDate":"2020-12-30T10:41:27.55+02:00"}
{"Id":158734,"Number":177,"KnessetNum":7,"Name":"ישיבת מליאה בתאריך 03/05/1971 בשעה 16:00","StartDate":"1971-05-03T16:00:00+03:00","FinishDate":"1971-05-03T19:40:00+03:00","IsSpecialMeeting":null,"LastUpdatedDate":"2020-12-31T13:13:56.637+02:00"}
{"Id":158736,"Number":182,"KnessetNum":7,"Name":"ישיבת מליאה בתאריך 12/05/1971 בשעה 11:00","StartDate":"1971-05-12T11:00:00+03:00","FinishDate":"1971-05-12T14:14:00+03:00","IsSpecialMeeting":null,"LastUpdatedDate":"2021-01-03T15:56:47.44+02:00"}
{"Id":158737,"Number":183,"KnessetNum":7,"Name":"ישיבת מליאה בתאריך 17/05/1971 בשעה 16:00","StartDate":"1971-05-17T16:00:00+03:00","FinishDate":"1971-05-17T19:55:00+03:00","IsSpecialMeeting":null,"LastUpdatedDate":"2021-01-04T10:06:22.677+02:00"}
{"Id":158738,"Number":184,"KnessetNum":7,"Name":"ישיבת מליאה בתאריך 18/05/1971 בשעה 16:00","StartDate":"1971-05-18T16:00:00+03:00","FinishDate":"1971-05-18T19:22:00+03:00","IsSpecialMeeting":null,"LastUpdatedDate":"2021-01-04T10:08:11.1+02:00"}
{"Id":158740,"Number":186,"KnessetNum":7,"Name":"ישיבת מליאה בתאריך 24/05/1971 בשעה 16:00","StartDate":"1971-05-24T16:00:00+03:00","FinishDate":"1971-05-24T19:55:00+03:00","IsSpecialMeeting":null,"LastUpdatedDate":"2021-01-04T15:29:01.123+02:00"}
{"Id":158741,"Number":187,"KnessetNum":7,"Name":"ישיבת מליאה בתאריך 25/05/1971 בשעה 16:01","StartDate":"1971-05-25T16:01:00+03:00","FinishDate":"1971-05-25T20:25:00+03:00","IsSpecialMeeting":null,"LastUpdatedDate":"2021-01-04T16:05:13.417+02:00"}
{"Id":158742,"Number":188,"KnessetNum":7,"Name":"ישיבת מליאה בתאריך 26/05/1971 בשעה 11:00","StartDate":"1971-05-26T11:00:00+03:00","FinishDate":"1971-05-26T13:55:00+03:00","IsSpecialMeeting":null,"LastUpdatedDate":"2021-01-04T17:08:00.763+02:00"}
{"Id":158746,"Number":197,"KnessetNum":7,"Name":"ישיבת מליאה בתאריך 16/06/1971 בשעה 11:00","StartDate":"1971-06-16T11:00:00+03:00","FinishDate":"1971-06-16T16:33:00+03:00","IsSpecialMeeting":null,"LastUpdatedDate":"2023-09-18T12:26:29.113+03:00"}
{"Id":158750,"Number":204,"KnessetNum":7,"Name":"ישיבת מליאה בתאריך 01/07/1971 בשעה 10:01","StartDate":"1971-07-01T10:01:00+03:00","FinishDate":"1971-07-01T13:50:00+03:00","IsSpecialMeeting":null,"LastUpdatedDate":"2021-01-07T11:44:58.563+02:00"}
{"Id":158758,"Number":216,"KnessetNum":7,"Name":"ישיבת מליאה בתאריך 27/07/1971 בשעה: 00:00:00","StartDate":"1971-07-27T00:00:00+03:00","FinishDate":null,"IsSpecialMeeting":null,"LastUpdatedDate":"2014-08-17T15:12:53+03:00"}
{"Id":158761,"Number":223,"KnessetNum":7,"Name":"ישיבת מליאה בתאריך 27/10/1971 בשעה 11:02","StartDate":"1971-10-27T11:02:00+02:00","FinishDate":"1971-10-27T14:12:00+02:00","IsSpecialMeeting":null,"LastUpdatedDate":"2025-01-27T09:33:37.987+02:00"}
{"Id":158765,"Number":229,"KnessetNum":7,"Name":"ישיבת מליאה בתאריך 10/11/1971 בשעה 11:02","StartDate":"1971-11-10T11:02:00+02:00","FinishDate":"1971-11-10T14:30:00+02:00","IsSpecialMeeting":null,"LastUpdatedDate":"2025-01-27T09:56:06.857+02:00"}
{"Id":158766,"Number":231,"KnessetNum":7,"Name":"ישיבת מליאה בתאריך 16/11/1971 בשעה 16:00","StartDate":"1971-11-16T16:00:00+02:00","FinishDate":"1971-11-16T19:43:00+02:00","IsSpecialMeeting":null,"LastUpdatedDate":"2025-01-27T10:15:40.14+02:00"}
{"Id":158769,"Number":235,"KnessetNum":7,"Name":"ישיבת מליאה בתאריך 24/11/1971 בשעה 11:00","StartDate":"1971-11-24T11:00:00+02:00","FinishDate":"1971-11-24T12:08:00+02:00","IsSpecialMeeting":null,"LastUpdatedDate":"2025-01-27T10:43:34.42+02:00"}
{"Id":158775,"Number":245,"KnessetNum":7,"Name":"ישיבת מליאה בתאריך 20/12/1971 בשעה 16:00","StartDate":"1971-12-20T16:00:00+02:00","FinishDate":"1971-12-20T20:15:00+02:00","IsSpecialMeeting":null,"LastUpdatedDate":"2023-11-19T10:51:48.387+02:00"}
{"Id":158776,"Number":246,"KnessetNum":7,"Name":"ישיבת מליאה בתאריך 21/12/1971 בשעה 16:03","StartDate":"1971-12-21T16:03:00+02:00","FinishDate":"1971-12-21T18:28:00+02:00","IsSpecialMeeting":null,"LastUpdatedDate":"2023-11-19T11:16:40.74+02:00"}
{"Id":158780,"Number":250,"KnessetNum":7,"Name":"ישיבת מליאה בתאריך 29/12/1971 בשעה 11:00","StartDate":"1971-12-29T11:00:00+02:00","FinishDate":"1971-12-29T15:28:00+02:00","IsSpecialMeeting":null,"LastUpdatedDate":"2023-11-19T11:40:48.907+02:00"}
{"Id":158784,"Number":255,"KnessetNum":7,"Name":"ישיבת מליאה בתאריך 11/01/1972 בשעה 16:00","StartDate":"1972-01-11T16:00:00+02:00","FinishDate":"1972-01-11T20:35:00+02:00","IsSpecialMeeting":null,"LastUpdatedDate":"2023-11-20T00:59:10.747+02:00"}
{"Id":158787,"Number":259,"KnessetNum":7,"Name":"ישיבת מליאה בתאריך 19/01/1972 בשעה 11:05","StartDate":"1972-01-19T11:05:00+02:00","FinishDate":"1972-01-19T15:02:00+02:00","IsSpecialMeeting":null,"LastUpdatedDate":"2023-11-20T01:12:20.703+02:00"}
{"Id":158788,"Number":260,"KnessetNum":7,"Name":"ישיבת מליאה בתאריך 24/01/1972 בשעה 16:00","StartDate":"1972-01-24T16:00:00+02:00","FinishDate":"1972-01-24T19:35:00+02:00","IsSpecialMeeting":null,"LastUpdatedDate":"2023-11-20T01:17:29.503+02:00"}
{"Id":158789,"Number":261,"KnessetNum":7,"Name":"ישיבת מליאה בתאריך 25/01/1972 בשעה 16:00","StartDate":"1972-01-25T16:00:00+02:00","FinishDate":"1972-01-25T19:45:00+02:00","IsSpecialMeeting":null,"LastUpdatedDate":"2023-11-20T01:28:10.64+02:00"}
{"Id":158791,"Number":265,"KnessetNum":7,"Name":"ישיבת מליאה בתאריך 02/02/1972 בשעה 11:00","StartDate":"1972-02-02T11:00:00+02:00","FinishDate":"1972-02-02T13:50:00+02:00","IsSpecialMeeting":null,"LastUpdatedDate":"2023-11-20T01:39:04.833+02:00"}
{"Id":158792,"Number":267,"KnessetNum":7,"Name":"ישיבת מליאה בתאריך 08/02/1972 בשעה 16:10","StartDate":"1972-02-08T16:10:00+02:00","FinishDate":"1972-02-08T20:00:00+02:00","IsSpecialMeeting":null,"LastUpdatedDate":"2023-11-20T01:47:01.07+02:00"}
{"Id":158793,"Number":268,"KnessetNum":7,"Name":"ישיבת מליאה בתאריך 09/02/1972 בשעה 11:01","StartDate":"1972-02-09T11:01:00+02:00","FinishDate":"1972-02-09T13:05:00+02:00","IsSpecialMeeting":null,"LastUpdatedDate":"2023-11-20T01:55:00.71+02:00"}
{"Id":158795,"Number":272,"KnessetNum":7,"Name":"ישיבת מליאה בתאריך 21/02/1972 בשעה 16:01","StartDate":"1972-02-21T16:01:00+02:00","FinishDate":"1972-02-21T20:33:00+02:00","IsSpecialMeeting":null,"LastUpdatedDate":"2023-11-20T02:17:04.947+02:00"}
{"Id":158796,"Number":273,"KnessetNum":7,"Name":"ישיבת מליאה בתאריך 22/02/1972 בשעה 16:00","StartDate":"1972-02-22T16:00:00+02:00","FinishDate":"1972-02-22T19:00:00+02:00","IsSpecialMeeting":null,"LastUpdatedDate":"2023-11-20T02:23:31.097+02:00"}
{"Id":158799,"Number":280,"KnessetNum":7,"Name":"ישיבת מליאה בתאריך 09/03/1972 בשעה 09:02","StartDate":"1972-03-09T09:02:00+02:00","FinishDate":"1972-03-09T13:13:00+02:00","IsSpecialMeeting":null,"LastUpdatedDate":"2023-11-20T02:54:52.21+02:00"}
{"Id":158800,"Number":281,"KnessetNum":7,"Name":"ישיבת מליאה בתאריך 13/03/1972 בשעה 16:02","StartDate":"1972-03-13T16:02:00+02:00","FinishDate":"1972-03-13T19:59:00+02:00","IsSpecialMeeting":null,"LastUpdatedDate":"2023-11-20T02:59:16.123+02:00"}
{"Id":158802,"Number":285,"KnessetNum":7,"Name":"ישיבת מליאה בתאריך 20/03/1972 בשעה 15:03","StartDate":"1972-03-20T15:03:00+02:00","FinishDate":"1972-03-20T22:01:00+02:00","IsSpecialMeeting":null,"LastUpdatedDate":"2023-11-20T03:20:52.903+02:00"}
{"Id":158803,"Number":286,"KnessetNum":7,"Name":"ישיבת מליאה בתאריך 21/03/1972 בשעה 15:00","StartDate":"1972-03-21T15:00:00+02:00","FinishDate":"1972-03-21T20:40:00+02:00","IsSpecialMeeting":null,"LastUpdatedDate":"2023-11-20T03:40:28.727+02:00"}
{"Id":158804,"Number":287,"KnessetNum":7,"Name":"ישיבת מליאה בתאריך 22/03/1972 בשעה 10:00","StartDate":"1972-03-22T10:00:00+02:00","FinishDate":"1972-03-22T17:37:00+02:00","IsSpecialMeeting":null,"LastUpdatedDate":"2023-11-20T03:44:21.843+02:00"}
{"Id":158805,"Number":288,"KnessetNum":7,"Name":"ישיבת מליאה בתאריך 23/03/1972 בשעה 11:03","StartDate":"1972-03-23T11:03:00+02:00","FinishDate":"1972-03-23T17:23:00+02:00","IsSpecialMeeting":null,"LastUpdatedDate":"2023-11-20T03:52:18.737+02:00"}
{"Id":158806,"Number":292,"KnessetNum":7,"Name":"ישיבת מליאה בתאריך 25/04/1972 בשעה 16:02","StartDate":"1972-04-25T16:02:00+03:00","FinishDate":"1972-04-25T20:22:00+03:00","IsSpecialMeeting":null,"LastUpdatedDate":"2023-11-20T11:03:55.913+02:00"}
{"Id":158807,"Number":293,"KnessetNum":7,"Name":"ישיבת מליאה בתאריך 26/04/1972 בשעה 11:06","StartDate":"1972-04-26T11:06:00+03:00","FinishDate":"1972-04-26T13:18:00+03:00","IsSpecialMeeting":null,"LastUpdatedDate":"2023-11-20T11:07:10.763+02:00"}
{"Id":158808,"Number":294,"KnessetNum":7,"Name":"ישיבת מליאה בתאריך 02/05/1972 בשעה 16:01","StartDate":"1972-05-02T16:01:00+03:00","FinishDate":"1972-05-02T18:47:00+03:00","IsSpecialMeeting":null,"LastUpdatedDate":"2021-02-25T07:42:08.703+02:00"}
{"Id":158809,"Number":301,"KnessetNum":7,"Name":"ישיבת מליאה בתאריך 16/05/1972 בשעה 15:00","StartDate":"1972-05-16T15:00:00+03:00","FinishDate":"1972-05-16T20:30:00+03:00","IsSpecialMeeting":null,"LastUpdatedDate":"2021-02-25T08:06:34.02+02:00"}
{"Id":158810,"Number":305,"KnessetNum":7,"Name":"ישיבת מליאה בתאריך 24/05/1972 בשעה 11:04","StartDate":"1972-05-24T11:04:00+03:00","FinishDate":"1972-05-24T14:05:00+03:00","IsSpecialMeeting":null,"LastUpdatedDate":"2021-02-25T08:13:40.993+02:00"}
{"Id":158811,"Number":307,"KnessetNum":7,"Name":"ישיבת מליאה בתאריך 30/05/1972 בשעה 15:00","StartDate":"1972-05-30T15:00:00+03:00","FinishDate":"1972-05-30T20:10:00+03:00","IsSpecialMeeting":null,"LastUpdatedDate":"2023-11-21T00:54:45.04+02:00"}
{"Id":158812,"Number":311,"KnessetNum":7,"Name":"ישיבת מליאה בתאריך 07/06/1972 בשעה 11:00","StartDate":"1972-06-07T11:00:00+03:00","FinishDate":"1972-06-07T15:36:00+03:00","IsSpecialMeeting":null,"LastUpdatedDate":"2025-04-07T16:23:33.767+03:00"}
{"Id":158814,"Number":315,"KnessetNum":7,"Name":"ישיבת מליאה בתאריך 14/06/1972 בשעה 11:01","StartDate":"1972-06-14T11:01:00+03:00","FinishDate":"1972-06-14T13:47:00+03:00","IsSpecialMeeting":null,"LastUpdatedDate":"2021-02-25T08:43:42.777+02:00"}
{"Id":158816,"Number":319,"KnessetNum":7,"Name":"ישיבת מליאה בתאריך 21/06/1972 בשעה 11:00","StartDate":"1972-06-21T11:00:00+03:00","FinishDate":"1972-06-21T15:47:00+03:00","IsSpecialMeeting":null,"LastUpdatedDate":"2021-02-25T09:10:27.033+02:00"}
{"Id":158817,"Number":320,"KnessetNum":7,"Name":"ישיבת מליאה בתאריך 26/06/1972 בשעה 16:01","StartDate":"1972-06-26T16:01:00+03:00","FinishDate":"1972-06-26T20:23:00+03:00","IsSpecialMeeting":null,"LastUpdatedDate":"2021-02-25T09:39:57.357+02:00"}
{"Id":158820,"Number":324,"KnessetNum":7,"Name":"ישיבת מליאה בתאריך 04/07/1972 בשעה 15:02","StartDate":"1972-07-04T15:02:00+03:00","FinishDate":"1972-07-04T20:12:00+03:00","IsSpecialMeeting":null,"LastUpdatedDate":"2023-11-24T01:50:51.36+02:00"}
{"Id":158826,"Number":331,"KnessetNum":7,"Name":"ישיבת מליאה בתאריך 19/07/1972 בשעה 11:02","StartDate":"1972-07-19T11:02:00+03:00","FinishDate":"1972-07-19T14:17:00+03:00","IsSpecialMeeting":null,"LastUpdatedDate":"2021-02-11T10:13:44.42+02:00"}
{"Id":158828,"Number":333,"KnessetNum":7,"Name":"ישיבת מליאה בתאריך 25/07/1972 בשעה 10:32","StartDate":"1972-07-25T10:32:00+03:00","FinishDate":"1972-07-25T21:28:00+03:00","IsSpecialMeeting":null,"LastUpdatedDate":"2021-02-11T11:29:55.417+02:00"}
{"Id":158830,"Number":342,"KnessetNum":7,"Name":"ישיבת מליאה בתאריך 17/10/1972 בשעה 16:00","StartDate":"1972-10-17T16:00:00+02:00","FinishDate":"1972-10-17T19:54:00+02:00","IsSpecialMeeting":null,"LastUpdatedDate":"2021-02-16T14:11:57.723+02:00"}
{"Id":158831,"Number":343,"KnessetNum":7,"Name":"ישיבת מליאה בתאריך 18/10/1972 בשעה 11:02","StartDate":"1972-10-18T11:02:00+02:00","FinishDate":"1972-10-18T13:14:00+02:00","IsSpecialMeeting":null,"LastUpdatedDate":"2021-02-17T08:11:06.283+02:00"}
{"Id":158837,"Number":354,"KnessetNum":7,"Name":"ישיבת מליאה בתאריך 14/11/1972 בשעה 16:01","StartDate":"1972-11-14T16:01:00+02:00","FinishDate":"1972-11-14T19:12:00+02:00","IsSpecialMeeting":null,"LastUpdatedDate":"2021-03-09T11:35:07.44+02:00"}
{"Id":158838,"Number":356,"KnessetNum":7,"Name":"ישיבת מליאה בתאריך 20/11/1972 בשעה 16:03","StartDate":"1972-11-20T16:03:00+02:00","FinishDate":"1972-11-20T20:34:00+02:00","IsSpecialMeeting":null,"LastUpdatedDate":"2021-02-22T09:47:59.27+02:00"}
{"Id":158842,"Number":363,"KnessetNum":7,"Name":"ישיבת מליאה בתאריך 05/12/1972 בשעה 16:02","StartDate":"1972-12-05T16:02:00+02:00","FinishDate":"1972-12-05T17:27:00+02:00","IsSpecialMeeting":null,"LastUpdatedDate":"2021-02-23T09:40:54.607+02:00"}
{"Id":158845,"Number":366,"KnessetNum":7,"Name":"ישיבת מליאה בתאריך 13/12/1972 בשעה 11:02","StartDate":"1972-12-13T11:02:00+02:00","FinishDate":"1972-12-13T15:15:00+02:00","IsSpecialMeeting":null,"LastUpdatedDate":"2021-02-23T12:33:06.807+02:00"}
{"Id":158846,"Number":367,"KnessetNum":7,"Name":"ישיבת מליאה בתאריך 18/12/1972 בשעה 16:02","StartDate":"1972-12-18T16:02:00+02:00","FinishDate":"1972-12-18T20:15:00+02:00","IsSpecialMeeting":null,"LastUpdatedDate":"2021-02-25T10:28:21.867+02:00"}
{"Id":158847,"Number":368,"KnessetNum":7,"Name":"ישיבת מליאה בתאריך 19/12/1972 בשעה 16:07","StartDate":"1972-12-19T16:07:00+02:00","FinishDate":"1972-12-19T19:19:00+02:00","IsSpecialMeeting":null,"LastUpdatedDate":"2021-02-25T11:27:24.897+02:00"}
{"Id":158850,"Number":370,"KnessetNum":7,"Name":"ישיבת מליאה בתאריך 25/12/1972 בשעה 16:06","StartDate":"1972-12-25T16:06:00+02:00","FinishDate":"1972-12-25T20:08:00+02:00","IsSpecialMeeting":null,"LastUpdatedDate":"2021-02-25T12:26:43.497+02:00"}
{"Id":158854,"Number":374,"KnessetNum":7,"Name":"ישיבת מליאה בתאריך 02/01/1973 בשעה 16:00","StartDate":"1973-01-02T16:00:00+02:00","FinishDate":"1973-01-02T18:05:00+02:00","IsSpecialMeeting":null,"LastUpdatedDate":"2021-03-01T12:53:20.77+02:00"}
{"Id":158863,"Number":388,"KnessetNum":7,"Name":"ישיבת מליאה בתאריך 05/02/1973 בשעה 16:03","StartDate":"1973-02-05T16:03:00+02:00","FinishDate":"1973-02-05T20:37:00+02:00","IsSpecialMeeting":null,"LastUpdatedDate":"2021-03-04T11:48:05.61+02:00"}
{"Id":158864,"Number":389,"KnessetNum":7,"Name":"ישיבת מליאה בתאריך 06/02/1973 בשעה 16:04","StartDate":"1973-02-06T16:04:00+02:00","FinishDate":"1973-02-06T19:37:00+02:00","IsSpecialMeeting":null,"LastUpdatedDate":"2021-03-04T12:06:19.65+02:00"}
{"Id":158868,"Number":394,"KnessetNum":7,"Name":"ישיבת מליאה בתאריך 19/02/1973 בשעה 16:00","StartDate":"1973-02-19T16:00:00+02:00","FinishDate":"1973-02-19T18:45:00+02:00","IsSpecialMeeting":null,"LastUpdatedDate":"2021-03-09T10:42:19.867+02:00"}
{"Id":158870,"Number":396,"KnessetNum":7,"Name":"ישיבת מליאה בתאריך 21/02/1973 בשעה 11:01","StartDate":"1973-02-21T11:01:00+02:00","FinishDate":"1973-02-21T13:50:00+02:00","IsSpecialMeeting":null,"LastUpdatedDate":"2021-03-09T11:33:36.18+02:00"}
{"Id":158881,"Number":412,"KnessetNum":7,"Name":"ישיבת מליאה בתאריך 29/03/1973 בשעה 08:33","StartDate":"1973-03-29T08:33:00+02:00","FinishDate":"1973-03-29T12:50:00+02:00","IsSpecialMeeting":null,"LastUpdatedDate":"2021-04-12T09:04:43.513+03:00"}
{"Id":158882,"Number":415,"KnessetNum":7,"Name":"ישיבת מליאה בתאריך 04/04/1973 בשעה 11:00","StartDate":"1973-04-04T11:00:00+03:00","FinishDate":"1973-04-04T14:25:00+03:00","IsSpecialMeeting":null,"LastUpdatedDate":"2021-04-12T12:19:46.177+03:00"}
{"Id":158887,"Number":427,"KnessetNum":7,"Name":"ישיבת מליאה בתאריך 23/05/1973 בשעה 11:01","StartDate":"1973-05-23T11:01:00+03:00","FinishDate":"1973-05-23T17:38:00+03:00","IsSpecialMeeting":null,"LastUpdatedDate":"2021-04-14T09:38:45.95+03:00"}
{"Id":158892,"Number":436,"KnessetNum":7,"Name":"ישיבת מליאה בתאריך 13/06/1973 בשעה 10:03","StartDate":"1973-06-13T10:03:00+03:00","FinishDate":"1973-06-13T18:00:00+03:00","IsSpecialMeeting":null,"LastUpdatedDate":"2021-04-19T16:50:51.38+03:00"}
{"Id":158900,"Number":446,"KnessetNum":7,"Name":"ישיבת מליאה בתאריך 05/07/1973 בשעה 11:00","StartDate":"1973-07-05T11:00:00+03:00","FinishDate":"1973-07-05T13:42:00+03:00","IsSpecialMeeting":null,"LastUpdatedDate":"2021-04-29T11:12:04.923+03:00"}
{"Id":158901,"Number":447,"KnessetNum":7,"Name":"ישיבת מליאה בתאריך 09/07/1973 בשעה 16:02","StartDate":"1973-07-09T16:02:00+03:00","FinishDate":"1973-07-09T20:30:00+03:00","IsSpecialMeeting":null,"LastUpdatedDate":"2024-02-04T02:28:27.603+02:00"}
{"Id":158902,"Number":448,"KnessetNum":7,"Name":"ישיבת מליאה בתאריך 10/07/1973 בשעה 11:01","StartDate":"1973-07-10T11:01:00+03:00","FinishDate":"1973-07-10T21:23:00+03:00","IsSpecialMeeting":null,"LastUpdatedDate":"2021-04-29T12:53:02.343+03:00"}
{"Id":158903,"Number":449,"KnessetNum":7,"Name":"ישיבת מליאה בתאריך 11/07/1973 בשעה 11:01","StartDate":"1973-07-11T11:01:00+03:00","FinishDate":"1973-07-11T19:10:00+03:00","IsSpecialMeeting":null,"LastUpdatedDate":"2024-02-04T02:19:27.01+02:00"}
{"Id":158904,"Number":450,"KnessetNum":7,"Name":"ישיבת מליאה בתאריך 12/07/1973 בשעה 11:00","StartDate":"1973-07-12T11:00:00+03:00","FinishDate":"1973-07-12T14:34:00+03:00","IsSpecialMeeting":null,"LastUpdatedDate":"2024-02-04T02:06:56.873+02:00"}
{"Id":158906,"Number":451,"KnessetNum":7,"Name":"ישיבת מליאה בתאריך 16/07/1973 בשעה 16:01","StartDate":"1973-07-16T16:01:00+03:00","FinishDate":"1973-07-16T21:35:00+03:00","IsSpecialMeeting":null,"LastUpdatedDate":"2021-06-03T11:28:27.383+03:00"}
{"Id":158908,"Number":453,"KnessetNum":7,"Name":"ישיבת מליאה בתאריך 18/07/1973 בשעה 11:06","StartDate":"1973-07-18T11:06:00+03:00","FinishDate":"1973-07-18T16:50:00+03:00","IsSpecialMeeting":null,"LastUpdatedDate":"2021-05-03T12:48:41.157+03:00"}
{"Id":158924,"Number":3,"KnessetNum":8,"Name":"ישיבת מליאה בתאריך 28/01/1974 בשעה 16:04","StartDate":"1974-01-28T16:04:00+02:00","FinishDate":"1974-01-28T21:09:00+02:00","IsSpecialMeeting":null,"LastUpdatedDate":"2020-08-17T10:46:04.283+03:00"}
{"Id":158925,"Number":5,"KnessetNum":8,"Name":"ישיבת מליאה בתאריך 30/01/1974 בשעה 11:05","StartDate":"1974-01-30T11:05:00+02:00","FinishDate":"1974-01-30T14:22:00+02:00","IsSpecialMeeting":null,"LastUpdatedDate":"2021-05-18T02:59:36.01+03:00"}
{"Id":158926,"Number":6,"KnessetNum":8,"Name":"ישיבת מליאה בתאריך 04/02/1974 בשעה 16:04","StartDate":"1974-02-04T16:04:00+02:00","FinishDate":"1974-02-04T20:05:00+02:00","IsSpecialMeeting":null,"LastUpdatedDate":"2021-05-18T03:06:45.14+03:00"}
{"Id":158927,"Number":7,"KnessetNum":8,"Name":"ישיבת מליאה בתאריך 05/02/1974 בשעה 16:02","StartDate":"1974-02-05T16:02:00+02:00","FinishDate":"1974-02-05T19:21:00+02:00","IsSpecialMeeting":null,"LastUpdatedDate":"2020-08-18T10:51:44.037+03:00"}
{"Id":158928,"Number":8,"KnessetNum":8,"Name":"ישיבת מליאה בתאריך 06/02/1974 בשעה 11:03","StartDate":"1974-02-06T11:03:00+02:00","FinishDate":"1974-02-06T14:02:00+02:00","IsSpecialMeeting":null,"LastUpdatedDate":"2020-08-18T12:10:36.267+03:00"}
{"Id":158929,"Number":9,"KnessetNum":8,"Name":"ישיבת מליאה בתאריך 11/02/1974 בשעה 16:02","StartDate":"1974-02-11T16:02:00+02:00","FinishDate":"1974-02-11T20:05:00+02:00","IsSpecialMeeting":null,"LastUpdatedDate":"2021-05-18T03:33:53.257+03:00"}
{"Id":158930,"Number":12,"KnessetNum":8,"Name":"ישיבת מליאה בתאריך 18/02/1974 בשעה 16:00","StartDate":"1974-02-18T16:00:00+02:00","FinishDate":"1974-02-18T19:05:00+02:00","IsSpecialMeeting":null,"LastUpdatedDate":"2021-05-18T15:57:28.407+03:00"}
{"Id":158932,"Number":14,"KnessetNum":8,"Name":"ישיבת מליאה בתאריך 20/02/1974 בשעה 11:00","StartDate":"1974-02-20T11:00:00+02:00","FinishDate":"1974-02-20T14:06:00+02:00","IsSpecialMeeting":null,"LastUpdatedDate":"2021-05-18T16:51:29.473+03:00"}
{"Id":158939,"Number":25,"KnessetNum":8,"Name":"ישיבת מליאה בתאריך 14/03/1974 בשעה 10:02","StartDate":"1974-03-14T10:02:00+02:00","FinishDate":"1974-03-14T11:25:00+02:00","IsSpecialMeeting":null,"LastUpdatedDate":"2021-05-27T09:08:51.74+03:00"}
{"Id":158941,"Number":28,"KnessetNum":8,"Name":"ישיבת מליאה בתאריך 20/03/1974 בשעה 11:02","StartDate":"1974-03-20T11:02:00+02:00","FinishDate":"1974-03-20T15:48:00+02:00","IsSpecialMeeting":null,"LastUpdatedDate":"2021-05-29T01:10:54.423+03:00"}
{"Id":158942,"Number":30,"KnessetNum":8,"Name":"ישיבת מליאה בתאריך 25/03/1974 בשעה 16:03","StartDate":"1974-03-25T16:03:00+02:00","FinishDate":"1974-03-25T19:17:00+02:00","IsSpecialMeeting":null,"LastUpdatedDate":"2019-12-26T09:36:31.347+02:00"}
{"Id":158944,"Number":32,"KnessetNum":8,"Name":"ישיבת מליאה בתאריך 27/03/1974 בשעה 11:01","StartDate":"1974-03-27T11:01:00+02:00","FinishDate":"1974-03-27T14:01:00+02:00","IsSpecialMeeting":null,"LastUpdatedDate":"2021-05-29T02:04:19.673+03:00"}
{"Id":158950,"Number":48,"KnessetNum":8,"Name":"ישיבת מליאה בתאריך 21/05/1974 בשעה 16:01","StartDate":"1974-05-21T16:01:00+03:00","FinishDate":"1974-05-21T19:22:00+03:00","IsSpecialMeeting":null,"LastUpdatedDate":"2021-06-24T10:17:04.06+03:00"}
{"Id":158951,"Number":49,"KnessetNum":8,"Name":"ישיבת מליאה בתאריך 22/05/1974 בשעה 11:00","StartDate":"1974-05-22T11:00:00+03:00","FinishDate":"1974-05-22T15:00:00+03:00","IsSpecialMeeting":null,"LastUpdatedDate":"2021-06-24T12:43:18.383+03:00"}
{"Id":158952,"Number":50,"KnessetNum":8,"Name":"ישיבת מליאה בתאריך 28/05/1974 בשעה 16:02","StartDate":"1974-05-28T16:02:00+03:00","FinishDate":"1974-05-28T16:40:00+03:00","IsSpecialMeeting":null,"LastUpdatedDate":"2021-06-24T11:38:35.773+03:00"}
{"Id":158953,"Number":54,"KnessetNum":8,"Name":"ישיבת מליאה בתאריך 04/06/1974 בשעה 16:00","StartDate":"1974-06-04T16:00:00+03:00","FinishDate":"1974-06-04T20:00:00+03:00","IsSpecialMeeting":null,"LastUpdatedDate":"2021-06-24T11:03:35.55+03:00"}
{"Id":158955,"Number":57,"KnessetNum":8,"Name":"ישיבת מליאה בתאריך 11/06/1974 בשעה 15:00","StartDate":"1974-06-11T15:00:00+03:00","FinishDate":"1974-06-11T20:18:00+03:00","IsSpecialMeeting":null,"LastUpdatedDate":"2021-07-03T13:59:17.63+03:00"}
{"Id":158957,"Number":59,"KnessetNum":8,"Name":"ישיבת מליאה בתאריך 17/06/1974 בשעה 16:00","StartDate":"1974-06-17T16:00:00+03:00","FinishDate":"1974-06-17T20:25:00+03:00","IsSpecialMeeting":null,"LastUpdatedDate":"2021-07-03T15:33:41.837+03:00"}
{"Id":158959,"Number":63,"KnessetNum":8,"Name":"ישיבת מליאה בתאריך 25/06/1974 בשעה 15:00","StartDate":"1974-06-25T15:00:00+03:00","FinishDate":"1974-06-25T22:02:00+03:00","IsSpecialMeeting":null,"LastUpdatedDate":"2021-06-26T08:10:22.063+03:00"}
{"Id":158964,"Number":69,"KnessetNum":8,"Name":"ישיבת מליאה בתאריך 09/07/1974 בשעה 16:02","StartDate":"1974-07-09T16:02:00+03:00","FinishDate":"1974-07-09T20:14:00+03:00","IsSpecialMeeting":null,"LastUpdatedDate":"2021-07-04T03:05:57.247+03:00"}
{"Id":158966,"Number":72,"KnessetNum":8,"Name":"ישיבת מליאה בתאריך 15/07/1974 בשעה 16:03","StartDate":"1974-07-15T16:03:00+03:00","FinishDate":"1974-07-15T19:07:00+03:00","IsSpecialMeeting":null,"LastUpdatedDate":"2021-07-04T03:46:07.77+03:00"}
{"Id":158972,"Number":80,"KnessetNum":8,"Name":"ישיבת מליאה בתאריך 30/07/1974 בשעה 16:00","StartDate":"1974-07-30T16:00:00+03:00","FinishDate":"1974-07-30T21:00:00+03:00","IsSpecialMeeting":null,"LastUpdatedDate":"2021-07-31T15:14:30.783+03:00"}
{"Id":158974,"Number":84,"KnessetNum":8,"Name":"ישיבת מליאה בתאריך 07/08/1974 בשעה 11:01","StartDate":"1974-08-07T11:01:00+03:00","FinishDate":"1974-08-07T14:32:00+03:00","IsSpecialMeeting":null,"LastUpdatedDate":"2021-09-01T00:01:42.14+03:00"}
{"Id":158977,"Number":87,"KnessetNum":8,"Name":"ישיבת מליאה בתאריך 14/08/1974 בשעה 10:03","StartDate":"1974-08-14T10:03:00+03:00","FinishDate":"1974-08-14T18:10:00+03:00","IsSpecialMeeting":null,"LastUpdatedDate":"2021-10-03T00:26:49.88+03:00"}
{"Id":158981,"Number":97,"KnessetNum":8,"Name":"ישיבת מליאה בתאריך 23/10/1974 בשעה 11:02","StartDate":"1974-10-23T11:02:00+02:00","FinishDate":"1974-10-23T12:34:00+02:00","IsSpecialMeeting":null,"LastUpdatedDate":"2021-10-13T13:38:31.203+03:00"}
{"Id":158984,"Number":104,"KnessetNum":8,"Name":"ישיבת מליאה בתאריך 06/11/1974 בשעה 11:00","StartDate":"1974-11-06T11:00:00+02:00","FinishDate":"1974-11-06T15:20:00+02:00","IsSpecialMeeting":null,"LastUpdatedDate":"2021-10-18T23:29:20.213+03:00"}
{"Id":158985,"Number":106,"KnessetNum":8,"Name":"ישיבת מליאה בתאריך 12/11/1974 בשעה 16:04","StartDate":"1974-11-12T16:04:00+02:00","FinishDate":"1974-11-12T19:40:00+02:00","IsSpecialMeeting":null,"LastUpdatedDate":"2021-10-13T23:19:37.61+03:00"}
{"Id":158988,"Number":109,"KnessetNum":8,"Name":"ישיבת מליאה בתאריך 19/11/1974 בשעה 16:00","StartDate":"1974-11-19T16:00:00+02:00","FinishDate":"1974-11-19T18:00:00+02:00","IsSpecialMeeting":null,"LastUpdatedDate":"2021-10-26T12:08:18.533+03:00"}
{"Id":158991,"Number":113,"KnessetNum":8,"Name":"ישיבת מליאה בתאריך 27/11/1974 בשעה 11:00","StartDate":"1974-11-27T11:00:00+02:00","FinishDate":"1974-11-27T15:36:00+02:00","IsSpecialMeeting":null,"LastUpdatedDate":"2021-10-26T23:52:00.977+03:00"}
{"Id":158993,"Number":115,"KnessetNum":8,"Name":"ישיבת מליאה בתאריך 03/12/1974 בשעה 16:01","StartDate":"1974-12-03T16:01:00+02:00","FinishDate":"1974-12-03T20:17:00+02:00","IsSpecialMeeting":null,"LastUpdatedDate":"2022-06-07T17:29:29.773+03:00"}
{"Id":158997,"Number":119,"KnessetNum":8,"Name":"ישיבת מליאה בתאריך 11/12/1974 בשעה 11:03","StartDate":"1974-12-11T11:03:00+02:00","FinishDate":"1974-12-11T15:45:00+02:00","IsSpecialMeeting":null,"LastUpdatedDate":"2021-11-04T11:34:46.633+02:00"}
{"Id":159000,"Number":122,"KnessetNum":8,"Name":"ישיבת מליאה בתאריך 18/12/1974 בשעה 11:03","StartDate":"1974-12-18T11:03:00+02:00","FinishDate":"1974-12-18T15:26:00+02:00","IsSpecialMeeting":null,"LastUpdatedDate":"2021-11-06T08:39:48.64+02:00"}
{"Id":159001,"Number":123,"KnessetNum":8,"Name":"ישיבת מליאה בתאריך 23/12/1974 בשעה 16:04","StartDate":"1974-12-23T16:04:00+02:00","FinishDate":"1974-12-23T20:38:00+02:00","IsSpecialMeeting":null,"LastUpdatedDate":"2021-11-06T08:56:12.65+02:00"}
{"Id":159003,"Number":125,"KnessetNum":8,"Name":"ישיבת מליאה בתאריך 25/12/1974 בשעה 11:04","StartDate":"1974-12-25T11:04:00+02:00","FinishDate":"1974-12-25T16:42:00+02:00","IsSpecialMeeting":null,"LastUpdatedDate":"2021-11-16T08:09:40.52+02:00"}
{"Id":159004,"Number":127,"KnessetNum":8,"Name":"ישיבת מליאה בתאריך 31/12/1974 בשעה 16:01","StartDate":"1974-12-31T16:01:00+02:00","FinishDate":"1974-12-31T20:27:00+02:00","IsSpecialMeeting":null,"LastUpdatedDate":"2021-11-17T00:13:41.41+02:00"}
{"Id":159005,"Number":130,"KnessetNum":8,"Name":"ישיבת מליאה בתאריך 07/01/1975 בשעה 16:02","StartDate":"1975-01-07T16:02:00+02:00","FinishDate":"1975-01-07T20:48:00+02:00","IsSpecialMeeting":null,"LastUpdatedDate":"2021-11-20T01:33:50.09+02:00"}
{"Id":159011,"Number":137,"KnessetNum":8,"Name":"ישיבת מליאה בתאריך 22/01/1975 בשעה 11:03","StartDate":"1975-01-22T11:03:00+02:00","FinishDate":"1975-01-22T14:39:00+02:00","IsSpecialMeeting":null,"LastUpdatedDate":"2021-11-20T02:58:33.433+02:00"}
{"Id":159013,"Number":139,"KnessetNum":8,"Name":"ישיבת מליאה בתאריך 28/01/1975 בשעה 16:04","StartDate":"1975-01-28T16:04:00+02:00","FinishDate":"1975-01-28T19:15:00+02:00","IsSpecialMeeting":null,"LastUpdatedDate":"2021-12-12T01:37:06.897+02:00"}
{"Id":159014,"Number":140,"KnessetNum":8,"Name":"ישיבת מליאה בתאריך 29/01/1975 בשעה 11:04","StartDate":"1975-01-29T11:04:00+02:00","FinishDate":"1975-01-29T16:14:00+02:00","IsSpecialMeeting":null,"LastUpdatedDate":"2021-12-12T10:48:48.837+02:00"}
{"Id":159015,"Number":141,"KnessetNum":8,"Name":"ישיבת מליאה בתאריך 03/02/1975 בשעה 16:04","StartDate":"1975-02-03T16:04:00+02:00","FinishDate":"1975-02-03T19:03:00+02:00","IsSpecialMeeting":null,"LastUpdatedDate":"2021-12-14T01:45:06.303+02:00"}
{"Id":159016,"Number":142,"KnessetNum":8,"Name":"ישיבת מליאה בתאריך 04/02/1975 בשעה 15:00","StartDate":"1975-02-04T15:00:00+02:00","FinishDate":"1975-02-04T20:37:00+02:00","IsSpecialMeeting":null,"LastUpdatedDate":"2021-12-14T02:04:45.183+02:00"}
{"Id":159017,"Number":144,"KnessetNum":8,"Name":"ישיבת מליאה בתאריך 10/02/1975 בשעה 16:02","StartDate":"1975-02-10T16:02:00+02:00","FinishDate":"1975-02-10T19:40:00+02:00","IsSpecialMeeting":null,"LastUpdatedDate":"2021-12-15T01:17:46.773+02:00"}
{"Id":159018,"Number":145,"KnessetNum":8,"Name":"ישיבת מליאה בתאריך 11/02/1975 בשעה 15:03","StartDate":"1975-02-11T15:03:00+02:00","FinishDate":"1975-02-11T20:42:00+02:00","IsSpecialMeeting":null,"LastUpdatedDate":"2021-12-20T01:45:35.41+02:00"}
{"Id":159025,"Number":156,"KnessetNum":8,"Name":"ישיבת מליאה בתאריך 10/03/1975 בשעה 16:03","StartDate":"1975-03-10T16:03:00+02:00","FinishDate":"1975-03-10T20:01:00+02:00","IsSpecialMeeting":null,"LastUpdatedDate":"2021-12-24T01:43:36.837+02:00"}
{"Id":159026,"Number":160,"KnessetNum":8,"Name":"ישיבת מליאה בתאריך 18/03/1975 בשעה 15:09","StartDate":"1975-03-18T15:09:00+02:00","FinishDate":"1975-03-18T20:50:00+02:00","IsSpecialMeeting":null,"LastUpdatedDate":"2021-12-23T01:35:03.96+02:00"}
{"Id":159027,"Number":162,"KnessetNum":8,"Name":"ישיבת מליאה בתאריך 20/03/1975 בשעה 09:01","StartDate":"1975-03-20T09:01:00+02:00","FinishDate":"1975-03-20T13:20:00+02:00","IsSpecialMeeting":null,"LastUpdatedDate":"2021-12-24T01:57:03.25+02:00"}
{"Id":159030,"Number":171,"KnessetNum":8,"Name":"ישיבת מליאה בתאריך 12/05/1975 בשעה 16:02","StartDate":"1975-05-12T16:02:00+03:00","FinishDate":"1975-05-12T19:50:00+03:00","IsSpecialMeeting":null,"LastUpdatedDate":"2021-12-27T16:58:19.433+02:00"}
{"Id":159031,"Number":173,"KnessetNum":8,"Name":"ישיבת מליאה בתאריך 14/05/1975 בשעה 11:02","StartDate":"1975-05-14T11:02:00+03:00","FinishDate":"1975-05-14T15:07:00+03:00","IsSpecialMeeting":null,"LastUpdatedDate":"2022-01-07T01:30:20.433+02:00"}
{"Id":159033,"Number":175,"KnessetNum":8,"Name":"ישיבת מליאה בתאריך 20/05/1975 בשעה 15:02","StartDate":"1975-05-20T15:02:00+03:00","FinishDate":"1975-05-20T19:03:00+03:00","IsSpecialMeeting":null,"LastUpdatedDate":"2021-12-27T17:39:09.487+02:00"}
{"Id":159035,"Number":177,"KnessetNum":8,"Name":"ישיבת מליאה בתאריך 26/05/1975 בשעה 16:04","StartDate":"1975-05-26T16:04:00+03:00","FinishDate":"1975-05-26T19:03:00+03:00","IsSpecialMeeting":null,"LastUpdatedDate":"2022-01-11T23:35:55.49+02:00"}
{"Id":159036,"Number":178,"KnessetNum":8,"Name":"ישיבת מליאה בתאריך 27/05/1975 בשעה 15:03","StartDate":"1975-05-27T15:03:00+03:00","FinishDate":"1975-05-27T20:18:00+03:00","IsSpecialMeeting":null,"LastUpdatedDate":"2022-01-12T00:26:38.88+02:00"}
{"Id":159038,"Number":181,"KnessetNum":8,"Name":"ישיבת מליאה בתאריך 03/06/1975 בשעה 15:01","StartDate":"1975-06-03T15:01:00+03:00","FinishDate":"1975-06-03T19:50:00+03:00","IsSpecialMeeting":null,"LastUpdatedDate":"2022-01-18T02:23:13.59+02:00"}
{"Id":159039,"Number":182,"KnessetNum":8,"Name":"ישיבת מליאה בתאריך 04/06/1975 בשעה 11:00","StartDate":"1975-06-04T11:00:00+03:00","FinishDate":"1975-06-04T15:02:00+03:00","IsSpecialMeeting":null,"LastUpdatedDate":"2022-01-18T02:57:12.93+02:00"}
{"Id":159045,"Number":190,"KnessetNum":8,"Name":"ישיבת מליאה בתאריך 24/06/1975 בשעה 15:00","StartDate":"1975-06-24T15:00:00+03:00","FinishDate":"1975-06-24T19:45:00+03:00","IsSpecialMeeting":null,"LastUpdatedDate":"2022-01-13T02:38:14.53+02:00"}
{"Id":159050,"Number":195,"KnessetNum":8,"Name":"ישיבת מליאה בתאריך 07/07/1975 בשעה 16:02","StartDate":"1975-07-07T16:02:00+03:00","FinishDate":"1975-07-07T20:00:00+03:00","IsSpecialMeeting":null,"LastUpdatedDate":"2022-02-22T12:25:42.507+02:00"}
{"Id":159054,"Number":199,"KnessetNum":8,"Name":"ישיבת מליאה בתאריך 14/07/1975 בשעה 16:02","StartDate":"1975-07-14T16:02:00+03:00","FinishDate":"1975-07-14T22:55:00+03:00","IsSpecialMeeting":null,"LastUpdatedDate":"2022-02-23T14:38:57.93+02:00"}
{"Id":159056,"Number":201,"KnessetNum":8,"Name":"ישיבת מליאה בתאריך 16/07/1975 בשעה 11:02","StartDate":"1975-07-16T11:02:00+03:00","FinishDate":"1975-07-16T14:41:00+03:00","IsSpecialMeeting":null,"LastUpdatedDate":"2022-02-27T00:19:59.54+02:00"}
{"Id":159057,"Number":202,"KnessetNum":8,"Name":"ישיבת מליאה בתאריך 21/07/1975 בשעה 16:01","StartDate":"1975-07-21T16:01:00+03:00","FinishDate":"1975-07-21T18:40:00+03:00","IsSpecialMeeting":null,"LastUpdatedDate":"2022-02-25T14:27:46.527+02:00"}
{"Id":159061,"Number":206,"KnessetNum":8,"Name":"ישיבת מליאה בתאריך 29/07/1975 בשעה 13:02","StartDate":"1975-07-29T13:02:00+03:00","FinishDate":"1975-07-29T20:13:00+03:00","IsSpecialMeeting":null,"LastUpdatedDate":"2022-03-23T14:52:19.373+02:00"}
{"Id":159067,"Number":219,"KnessetNum":8,"Name":"ישיבת מליאה בתאריך 29/10/1975 בשעה 11:00","StartDate":"1975-10-29T11:00:00+02:00","FinishDate":"1975-10-29T17:09:00+02:00","IsSpecialMeeting":null,"LastUpdatedDate":"2022-02-28T11:49:37.057+02:00"}
{"Id":159068,"Number":220,"KnessetNum":8,"Name":"ישיבת מליאה בתאריך 03/11/1975 בשעה 16:04","StartDate":"1975-11-03T16:04:00+02:00","FinishDate":"1975-11-03T19:26:00+02:00","IsSpecialMeeting":null,"LastUpdatedDate":"2022-03-01T00:08:23.14+02:00"}
{"Id":159069,"Number":221,"KnessetNum":8,"Name":"ישיבת מליאה בתאריך 04/11/1975 בשעה 16:00","StartDate":"1975-11-04T16:00:00+02:00","FinishDate":"1975-11-04T20:04:00+02:00","IsSpecialMeeting":null,"LastUpdatedDate":"2022-02-28T11:24:23.76+02:00"}
{"Id":159070,"Number":222,"KnessetNum":8,"Name":"ישיבת מליאה בתאריך 05/11/1975 בשעה 11:01","StartDate":"1975-11-05T11:01:00+02:00","FinishDate":"1975-11-05T13:55:00+02:00","IsSpecialMeeting":null,"LastUpdatedDate":"2022-02-28T11:11:26.307+02:00"}
{"Id":159072,"Number":224,"KnessetNum":8,"Name":"ישיבת מליאה בתאריך 11/11/1975 בשעה 16:04","StartDate":"1975-11-11T16:04:00+02:00","FinishDate":"1975-11-11T20:57:00+02:00","IsSpecialMeeting":null,"LastUpdatedDate":"2022-02-28T12:59:10.497+02:00"}
{"Id":159073,"Number":225,"KnessetNum":8,"Name":"ישיבת מליאה בתאריך 12/11/1975 בשעה 11:02","StartDate":"1975-11-12T11:02:00+02:00","FinishDate":"1975-11-12T14:55:00+02:00","IsSpecialMeeting":null,"LastUpdatedDate":"2022-02-28T23:29:43.15+02:00"}
{"Id":159076,"Number":228,"KnessetNum":8,"Name":"ישיבת מליאה בתאריך 19/11/1975 בשעה 11:02","StartDate":"1975-11-19T11:02:00+02:00","FinishDate":"1975-11-19T13:05:00+02:00","IsSpecialMeeting":null,"LastUpdatedDate":"2022-03-03T12:20:20.353+02:00"}
{"Id":159080,"Number":236,"KnessetNum":8,"Name":"ישיבת מליאה בתאריך 09/12/1975 בשעה 16:02","StartDate":"1975-12-09T16:02:00+02:00","FinishDate":"1975-12-09T19:29:00+02:00","IsSpecialMeeting":null,"LastUpdatedDate":"2022-03-16T10:09:52.423+02:00"}
{"Id":159083,"Number":241,"KnessetNum":8,"Name":"ישיבת מליאה בתאריך 22/12/1975 בשעה 16:02","StartDate":"1975-12-22T16:02:00+02:00","FinishDate":"1975-12-22T18:52:00+02:00","IsSpecialMeeting":null,"LastUpdatedDate":"2022-03-20T00:06:16.117+02:00"}
{"Id":159097,"Number":257,"KnessetNum":8,"Name":"ישיבת מליאה בתאריך 27/01/1976 בשעה 15:15","StartDate":"1976-01-27T15:15:00+02:00","FinishDate":"1976-01-27T20:43:00+02:00","IsSpecialMeeting":null,"LastUpdatedDate":"2022-03-28T10:40:06.923+03:00"}
{"Id":159100,"Number":259,"KnessetNum":8,"Name":"ישיבת מליאה בתאריך 02/02/1976 בשעה 16:02","StartDate":"1976-02-02T16:02:00+02:00","FinishDate":"1976-02-02T20:45:00+02:00","IsSpecialMeeting":null,"LastUpdatedDate":"2022-03-31T00:10:41.88+03:00"}
{"Id":159104,"Number":264,"KnessetNum":8,"Name":"ישיבת מליאה בתאריך 11/02/1976 בשעה 11:05","StartDate":"1976-02-11T11:05:00+02:00","FinishDate":"1976-02-11T14:48:00+02:00","IsSpecialMeeting":null,"LastUpdatedDate":"2022-04-04T13:06:56.043+03:00"}
{"Id":159105,"Number":265,"KnessetNum":8,"Name":"ישיבת מליאה בתאריך 16/02/1976 בשעה 16:03","StartDate":"1976-02-16T16:03:00+02:00","FinishDate":"1976-02-16T18:48:00+02:00","IsSpecialMeeting":null,"LastUpdatedDate":"2022-04-04T00:01:09.363+03:00"}
{"Id":159107,"Number":267,"KnessetNum":8,"Name":"ישיבת מליאה בתאריך 18/02/1976 בשעה 11:02","StartDate":"1976-02-18T11:02:00+02:00","FinishDate":"1976-02-18T14:30:00+02:00","IsSpecialMeeting":null,"LastUpdatedDate":"2022-04-04T13:05:30.713+03:00"}
{"Id":159108,"Number":268,"KnessetNum":8,"Name":"ישיבת מליאה בתאריך 23/02/1976 בשעה 16:03","StartDate":"1976-02-23T16:03:00+02:00","FinishDate":"1976-02-23T20:06:00+02:00","IsSpecialMeeting":null,"LastUpdatedDate":"2022-04-04T00:42:33.993+03:00"}
{"Id":159110,"Number":271,"KnessetNum":8,"Name":"ישיבת מליאה בתאריך 01/03/1976 בשעה 16:03","StartDate":"1976-03-01T16:03:00+02:00","FinishDate":"1976-03-01T19:35:00+02:00","IsSpecialMeeting":null,"LastUpdatedDate":"2022-04-04T11:06:15.727+03:00"}
{"Id":159111,"Number":272,"KnessetNum":8,"Name":"ישיבת מליאה בתאריך 02/03/1976 בשעה 16:02","StartDate":"1976-03-02T16:02:00+02:00","FinishDate":"1976-03-02T19:43:00+02:00","IsSpecialMeeting":null,"LastUpdatedDate":"2022-04-04T00:57:30.783+03:00"}
{"Id":159112,"Number":274,"KnessetNum":8,"Name":"ישיבת מליאה בתאריך 08/03/1976 בשעה 16:04","StartDate":"1976-03-08T16:04:00+02:00","FinishDate":"1976-03-08T19:18:00+02:00","IsSpecialMeeting":null,"LastUpdatedDate":"2022-04-10T01:06:08.787+03:00"}
{"Id":159113,"Number":275,"KnessetNum":8,"Name":"ישיבת מליאה בתאריך 09/03/1976 בשעה 15:00","StartDate":"1976-03-09T15:00:00+02:00","FinishDate":"1976-03-09T19:40:00+02:00","IsSpecialMeeting":null,"LastUpdatedDate":"2022-04-10T01:37:45.013+03:00"}
{"Id":159114,"Number":277,"KnessetNum":8,"Name":"ישיבת מליאה בתאריך 15/03/1976 בשעה 11:04","StartDate":"1976-03-15T11:04:00+02:00","FinishDate":"1976-03-15T14:47:00+02:00","IsSpecialMeeting":null,"LastUpdatedDate":"2022-04-10T01:54:44.9+03:00"}
{"Id":159115,"Number":280,"KnessetNum":8,"Name":"ישיבת מליאה בתאריך 23/03/1976 בשעה 15:02","StartDate":"1976-03-23T15:02:00+02:00","FinishDate":"1976-03-23T20:22:00+02:00","IsSpecialMeeting":null,"LastUpdatedDate":"2022-05-02T01:03:14.897+03:00"}
{"Id":159116,"Number":283,"KnessetNum":8,"Name":"ישיבת מליאה בתאריך 30/03/1976 בשעה 16:00","StartDate":"1976-03-30T16:00:00+02:00","FinishDate":"1976-03-30T21:07:00+02:00","IsSpecialMeeting":null,"LastUpdatedDate":"2022-05-02T02:01:54.043+03:00"}
{"Id":159121,"Number":290,"KnessetNum":8,"Name":"ישיבת מליאה בתאריך 11/05/1976 בשעה 16:03","StartDate":"1976-05-11T16:03:00+03:00","FinishDate":"1976-05-11T20:42:00+03:00","IsSpecialMeeting":null,"LastUpdatedDate":"2022-05-03T00:40:52.407+03:00"}
{"Id":159122,"Number":291,"KnessetNum":8,"Name":"ישיבת מליאה בתאריך 12/05/1976 בשעה 11:03","StartDate":"1976-05-12T11:03:00+03:00","FinishDate":"1976-05-12T13:35:00+03:00","IsSpecialMeeting":null,"LastUpdatedDate":"2022-05-20T00:15:18.037+03:00"}
{"Id":159123,"Number":292,"KnessetNum":8,"Name":"ישיבת מליאה בתאריך 17/05/1976 בשעה 16:03","StartDate":"1976-05-17T16:03:00+03:00","FinishDate":"1976-05-17T19:37:00+03:00","IsSpecialMeeting":null,"LastUpdatedDate":"2022-05-03T01:01:12.737+03:00"}
{"Id":159126,"Number":296,"KnessetNum":8,"Name":"ישיבת מליאה בתאריך 25/05/1976 בשעה 16:04","StartDate":"1976-05-25T16:04:00+03:00","FinishDate":"1976-05-25T18:30:00+03:00","IsSpecialMeeting":null,"LastUpdatedDate":"2022-05-03T01:32:32.92+03:00"}
{"Id":159129,"Number":299,"KnessetNum":8,"Name":"ישיבת מליאה בתאריך 01/06/1976 בשעה 16:03","StartDate":"1976-06-01T16:03:00+03:00","FinishDate":"1976-06-01T20:27:00+03:00","IsSpecialMeeting":null,"LastUpdatedDate":"2022-05-23T10:38:12.793+03:00"}
{"Id":159130,"Number":300,"KnessetNum":8,"Name":"ישיבת מליאה בתאריך 02/06/1976 בשעה 11:04","StartDate":"1976-06-02T11:04:00+03:00","FinishDate":"1976-06-02T13:35:00+03:00","IsSpecialMeeting":null,"LastUpdatedDate":"2025-06-25T12:09:50.32+03:00"}
{"Id":159131,"Number":303,"KnessetNum":8,"Name":"ישיבת מליאה בתאריך 09/06/1976 בשעה 11:02","StartDate":"1976-06-09T11:02:00+03:00","FinishDate":"1976-06-09T15:27:00+03:00","IsSpecialMeeting":null,"LastUpdatedDate":"2022-05-23T08:47:43.433+03:00"}
{"Id":159132,"Number":304,"KnessetNum":8,"Name":"ישיבת מליאה בתאריך 14/06/1976 בשעה 16:00","StartDate":"1976-06-14T16:00:00+03:00","FinishDate":"1976-06-14T19:53:00+03:00","IsSpecialMeeting":null,"LastUpdatedDate":"2020-05-06T14:08:57.827+03:00"}
{"Id":159133,"Number":306,"KnessetNum":8,"Name":"ישיבת מליאה בתאריך 16/06/1976 בשעה 11:02","StartDate":"1976-06-16T11:02:00+03:00","FinishDate":"1976-06-16T16:19:00+03:00","IsSpecialMeeting":null,"LastUpdatedDate":"2022-05-23T13:09:42.78+03:00"}
{"Id":159148,"Number":323,"KnessetNum":8,"Name":"ישיבת מליאה בתאריך 26/07/1976 בשעה 16:03","StartDate":"1976-07-26T16:03:00+03:00","FinishDate":"1976-07-26T20:25:00+03:00","IsSpecialMeeting":null,"LastUpdatedDate":"2022-09-01T01:08:12.403+03:00"}
{"Id":159149,"Number":324,"KnessetNum":8,"Name":"ישיבת מליאה בתאריך 27/07/1976 בשעה 16:07","StartDate":"1976-07-27T16:07:00+03:00","FinishDate":"1976-07-27T21:01:00+03:00","IsSpecialMeeting":null,"LastUpdatedDate":"2023-02-20T11:14:16.68+02:00"}
{"Id":159150,"Number":325,"KnessetNum":8,"Name":"ישיבת מליאה בתאריך 28/07/1976 בשעה 09:03","StartDate":"1976-07-28T09:03:00+03:00","FinishDate":"1976-07-28T17:20:00+03:00","IsSpecialMeeting":null,"LastUpdatedDate":"2025-06-24T09:42:50.49+03:00"}
{"Id":159154,"Number":336,"KnessetNum":8,"Name":"ישיבת מליאה בתאריך 26/10/1976 בשעה 16:01","StartDate":"1976-10-26T16:01:00+02:00","FinishDate":"1976-10-26T19:45:00+02:00","IsSpecialMeeting":null,"LastUpdatedDate":"2022-07-03T02:02:33.257+03:00"}
{"Id":159155,"Number":338,"KnessetNum":8,"Name":"ישיבת מליאה בתאריך 01/11/1976 בשעה 16:05","StartDate":"1976-11-01T16:05:00+02:00","FinishDate":"1976-11-01T19:20:00+02:00","IsSpecialMeeting":null,"LastUpdatedDate":"2022-08-12T00:29:11+03:00"}
{"Id":159156,"Number":339,"KnessetNum":8,"Name":"ישיבת מליאה בתאריך 02/11/1976 בשעה 16:02","StartDate":"1976-11-02T16:02:00+02:00","FinishDate":"1976-11-02T19:39:00+02:00","IsSpecialMeeting":null,"LastUpdatedDate":"2022-08-12T01:09:40.533+03:00"}
{"Id":159157,"Number":340,"KnessetNum":8,"Name":"ישיבת מליאה בתאריך 03/11/1976 בשעה 11:10","StartDate":"1976-11-03T11:10:00+02:00","FinishDate":"1976-11-03T13:56:00+02:00","IsSpecialMeeting":null,"LastUpdatedDate":"2022-09-01T02:07:14.343+03:00"}
{"Id":159158,"Number":341,"KnessetNum":8,"Name":"ישיבת מליאה בתאריך 08/11/1976 בשעה 16:03","StartDate":"1976-11-08T16:03:00+02:00","FinishDate":"1976-11-08T20:20:00+02:00","IsSpecialMeeting":null,"LastUpdatedDate":"2022-09-01T02:29:48.467+03:00"}
{"Id":159159,"Number":343,"KnessetNum":8,"Name":"ישיבת מליאה בתאריך 10/11/1976 בשעה 11:02","StartDate":"1976-11-10T11:02:00+02:00","FinishDate":"1976-11-10T14:40:00+02:00","IsSpecialMeeting":null,"LastUpdatedDate":"2022-09-03T14:16:25.143+03:00"}
{"Id":159179,"Number":367,"KnessetNum":8,"Name":"ישיבת מליאה בתאריך 05/01/1977 בשעה 11:07","StartDate":"1977-01-05T11:07:00+02:00","FinishDate":"1977-01-05T11:26:00+02:00","IsSpecialMeeting":null,"LastUpdatedDate":"2022-11-16T23:19:57.57+02:00"}
{"Id":159183,"Number":372,"KnessetNum":8,"Name":"ישיבת מליאה בתאריך 18/01/1977 בשעה 16:02","StartDate":"1977-01-18T16:02:00+02:00","FinishDate":"1977-01-18T20:17:00+02:00","IsSpecialMeeting":null,"LastUpdatedDate":"2022-11-19T02:24:01.38+02:00"}
{"Id":159184,"Number":373,"KnessetNum":8,"Name":"ישיבת מליאה בתאריך 19/01/1977 בשעה 11:01","StartDate":"1977-01-19T11:01:00+02:00","FinishDate":"1977-01-19T15:26:00+02:00","IsSpecialMeeting":null,"LastUpdatedDate":"2022-11-19T23:46:49+02:00"}
{"Id":159185,"Number":374,"KnessetNum":8,"Name":"ישיבת מליאה בתאריך 24/01/1977 בשעה 16:03","StartDate":"1977-01-24T16:03:00+02:00","FinishDate":"1977-01-24T19:20:00+02:00","IsSpecialMeeting":null,"LastUpdatedDate":"2022-12-04T09:45:02.087+02:00"}
{"Id":159186,"Number":375,"KnessetNum":8,"Name":"ישיבת מליאה בתאריך 25/01/1977 בשעה 15:04","StartDate":"1977-01-25T15:04:00+02:00","FinishDate":"1977-01-25T21:10:00+02:00","IsSpecialMeeting":null,"LastUpdatedDate":"2022-12-04T10:17:45.793+02:00"}
{"Id":159188,"Number":377,"KnessetNum":8,"Name":"ישיבת מליאה בתאריך 31/01/1977 בשעה 16:04","StartDate":"1977-01-31T16:04:00+02:00","FinishDate":"1977-01-31T18:44:00+02:00","IsSpecialMeeting":null,"LastUpdatedDate":"2025-01-27T11:52:34.527+02:00"}
{"Id":159189,"Number":378,"KnessetNum":8,"Name":"ישיבת מליאה בתאריך 01/02/1977 בשעה 16:03","StartDate":"1977-02-01T16:03:00+02:00","FinishDate":"1977-02-01T18:34:00+02:00","IsSpecialMeeting":null,"LastUpdatedDate":"2022-12-04T11:46:00.863+02:00"}
{"Id":159190,"Number":379,"KnessetNum":8,"Name":"ישיבת מליאה בתאריך 02/02/1977 בשעה 11:05","StartDate":"1977-02-02T11:05:00+02:00","FinishDate":"1977-02-02T13:49:00+02:00","IsSpecialMeeting":null,"LastUpdatedDate":"2022-12-04T14:14:58.703+02:00"}
{"Id":159191,"Number":380,"KnessetNum":8,"Name":"ישיבת מליאה בתאריך 07/02/1977 בשעה 16:04","StartDate":"1977-02-07T16:04:00+02:00","FinishDate":"1977-02-07T17:40:00+02:00","IsSpecialMeeting":null,"LastUpdatedDate":"2022-12-10T04:56:21.827+02:00"}
{"Id":159192,"Number":381,"KnessetNum":8,"Name":"ישיבת מליאה בתאריך 08/02/1977 בשעה 16:00","StartDate":"1977-02-08T16:00:00+02:00","FinishDate":"1977-02-08T19:44:00+02:00","IsSpecialMeeting":null,"LastUpdatedDate":"2022-12-10T04:24:41.683+02:00"}
{"Id":159194,"Number":384,"KnessetNum":8,"Name":"ישיבת מליאה בתאריך 15/02/1977 בשעה 16:02","StartDate":"1977-02-15T16:02:00+02:00","FinishDate":"1977-02-15T18:30:00+02:00","IsSpecialMeeting":null,"LastUpdatedDate":"2022-12-10T04:08:55.9+02:00"}
{"Id":159195,"Number":385,"KnessetNum":8,"Name":"ישיבת מליאה בתאריך 16/02/1977 בשעה 11:02","StartDate":"1977-02-16T11:02:00+02:00","FinishDate":"1977-02-16T15:37:00+02:00","IsSpecialMeeting":null,"LastUpdatedDate":"2022-12-10T03:47:06.073+02:00"}
{"Id":159212,"Number":7,"KnessetNum":9,"Name":"ישיבת מליאה בתאריך 04/07/1977 בשעה 16:01","StartDate":"1977-07-04T16:01:00+03:00","FinishDate":"1977-07-04T17:57:00+03:00","IsSpecialMeeting":null,"LastUpdatedDate":"2020-08-22T00:50:13.337+03:00"}
{"Id":159217,"Number":17,"KnessetNum":9,"Name":"ישיבת מליאה בתאריך 26/07/1977 בשעה 16:01","StartDate":"1977-07-26T16:01:00+03:00","FinishDate":"1977-07-26T19:15:00+03:00","IsSpecialMeeting":null,"LastUpdatedDate":"2020-08-23T17:30:25.283+03:00"}
{"Id":159220,"Number":21,"KnessetNum":9,"Name":"ישיבת מליאה בתאריך 03/08/1977 בשעה 09:00","StartDate":"1977-08-03T09:00:00+03:00","FinishDate":"1977-08-03T15:32:00+03:00","IsSpecialMeeting":null,"LastUpdatedDate":"2020-09-26T23:55:41.647+03:00"}
{"Id":159226,"Number":32,"KnessetNum":9,"Name":"ישיבת מליאה בתאריך 25/10/1977 בשעה 16:03","StartDate":"1977-10-25T16:03:00+02:00","FinishDate":"1977-10-25T19:05:00+02:00","IsSpecialMeeting":null,"LastUpdatedDate":"2020-09-28T00:56:31.59+03:00"}
{"Id":159229,"Number":36,"KnessetNum":9,"Name":"ישיבת מליאה בתאריך 02/11/1977 בשעה 11:01","StartDate":"1977-11-02T11:01:00+02:00","FinishDate":"1977-11-02T13:56:00+02:00","IsSpecialMeeting":null,"LastUpdatedDate":"2020-09-28T23:13:29.057+03:00"}
{"Id":159233,"Number":44,"KnessetNum":9,"Name":"ישיבת מליאה בתאריך 21/11/1977 בשעה 16:00","StartDate":"1977-11-21T16:00:00+02:00","FinishDate":"1977-11-21T16:21:00+02:00","IsSpecialMeeting":null,"LastUpdatedDate":"2020-10-09T01:40:12.85+03:00"}
{"Id":159235,"Number":46,"KnessetNum":9,"Name":"ישיבת מליאה בתאריך 23/11/1977 בשעה 11:02","StartDate":"1977-11-23T11:02:00+02:00","FinishDate":"1977-11-23T12:45:00+02:00","IsSpecialMeeting":null,"LastUpdatedDate":"2020-10-14T08:30:26.103+03:00"}
{"Id":159238,"Number":52,"KnessetNum":9,"Name":"ישיבת מליאה בתאריך 07/12/1977 בשעה 11:01","StartDate":"1977-12-07T11:01:00+02:00","FinishDate":"1977-12-07T14:45:00+02:00","IsSpecialMeeting":null,"LastUpdatedDate":"2020-10-14T13:08:45.603+03:00"}
{"Id":159239,"Number":54,"KnessetNum":9,"Name":"ישיבת מליאה בתאריך 13/12/1977 בשעה 16:02","StartDate":"1977-12-13T16:02:00+02:00","FinishDate":"1977-12-13T19:04:00+02:00","IsSpecialMeeting":null,"LastUpdatedDate":"2020-10-14T22:40:34.07+03:00"}
{"Id":159240,"Number":57,"KnessetNum":9,"Name":"ישיבת מליאה בתאריך 20/12/1977 בשעה 16:02","StartDate":"1977-12-20T16:02:00+02:00","FinishDate":"1977-12-20T17:40:00+02:00","IsSpecialMeeting":null,"LastUpdatedDate":"2020-10-14T23:28:30.77+03:00"}
{"Id":159241,"Number":58,"KnessetNum":9,"Name":"ישיבת מליאה בתאריך 21/12/1977 בשעה 11:00","StartDate":"1977-12-21T11:00:00+02:00","FinishDate":"1977-12-21T15:22:00+02:00","IsSpecialMeeting":null,"LastUpdatedDate":"2020-10-14T23:40:13.92+03:00"}
{"Id":159242,"Number":59,"KnessetNum":9,"Name":"ישיבת מליאה בתאריך 26/12/1977 בשעה 16:04","StartDate":"1977-12-26T16:04:00+02:00","FinishDate":"1977-12-26T19:40:00+02:00","IsSpecialMeeting":null,"LastUpdatedDate":"2020-10-15T08:51:20.323+03:00"}
{"Id":159246,"Number":64,"KnessetNum":9,"Name":"ישיבת מליאה בתאריך 04/01/1978 בשעה 11:01","StartDate":"1978-01-04T11:01:00+02:00","FinishDate":"1978-01-04T15:43:00+02:00","IsSpecialMeeting":null,"LastUpdatedDate":"2021-04-07T13:44:13.15+03:00"}
{"Id":159247,"Number":65,"KnessetNum":9,"Name":"ישיבת מליאה בתאריך 09/01/1978 בשעה 16:01","StartDate":"1978-01-09T16:01:00+02:00","FinishDate":"1978-01-09T18:25:00+02:00","IsSpecialMeeting":null,"LastUpdatedDate":"2020-10-16T23:33:41.633+03:00"}
{"Id":159248,"Number":66,"KnessetNum":9,"Name":"ישיבת מליאה בתאריך 10/01/1978 בשעה 16:02","StartDate":"1978-01-10T16:02:00+02:00","FinishDate":"1978-01-10T21:10:00+02:00","IsSpecialMeeting":null,"LastUpdatedDate":"2020-10-16T23:47:51.74+03:00"}
{"Id":159249,"Number":67,"KnessetNum":9,"Name":"ישיבת מליאה בתאריך 11/01/1978 בשעה 11:07","StartDate":"1978-01-11T11:07:00+02:00","FinishDate":"1978-01-11T15:40:00+02:00","IsSpecialMeeting":null,"LastUpdatedDate":"2020-10-17T00:34:53.747+03:00"}
{"Id":159250,"Number":69,"KnessetNum":9,"Name":"ישיבת מליאה בתאריך 17/01/1978 בשעה 16:03","StartDate":"1978-01-17T16:03:00+02:00","FinishDate":"1978-01-17T19:30:00+02:00","IsSpecialMeeting":null,"LastUpdatedDate":"2021-04-07T13:56:47.91+03:00"}
{"Id":159252,"Number":76,"KnessetNum":9,"Name":"ישיבת מליאה בתאריך 01/02/1978 בשעה 11:01","StartDate":"1978-02-01T11:01:00+02:00","FinishDate":"1978-02-01T14:02:00+02:00","IsSpecialMeeting":null,"LastUpdatedDate":"2020-10-18T03:22:55.007+03:00"}
{"Id":159254,"Number":78,"KnessetNum":9,"Name":"ישיבת מליאה בתאריך 07/02/1978 בשעה 16:05","StartDate":"1978-02-07T16:05:00+02:00","FinishDate":"1978-02-07T19:12:00+02:00","IsSpecialMeeting":null,"LastUpdatedDate":"2020-10-18T23:29:00.997+03:00"}
{"Id":159255,"Number":82,"KnessetNum":9,"Name":"ישיבת מליאה בתאריך 15/02/1978 בשעה 11:03","StartDate":"1978-02-15T11:03:00+02:00","FinishDate":"1978-02-15T15:04:00+02:00","IsSpecialMeeting":null,"LastUpdatedDate":"2020-10-20T21:14:05.31+03:00"}
{"Id":159257,"Number":87,"KnessetNum":9,"Name":"ישיבת מליאה בתאריך 28/02/1978 בשעה 16:03","StartDate":"1978-02-28T16:03:00+02:00","FinishDate":"1978-02-28T23:10:00+02:00","IsSpecialMeeting":null,"LastUpdatedDate":"2020-10-21T00:07:23.997+03:00"}
{"Id":159258,"Number":88,"KnessetNum":9,"Name":"ישיבת מליאה בתאריך 01/03/1978 בשעה 11:02","StartDate":"1978-03-01T11:02:00+02:00","FinishDate":"1978-03-01T13:37:00+02:00","IsSpecialMeeting":null,"LastUpdatedDate":"2020-10-21T01:04:01.897+03:00"}
{"Id":159259,"Number":89,"KnessetNum":9,"Name":"ישיבת מליאה בתאריך 06/03/1978 בשעה 16:02","StartDate":"1978-03-06T16:02:00+02:00","FinishDate":"1978-03-06T19:27:00+02:00","IsSpecialMeeting":null,"LastUpdatedDate":"2020-10-21T00:17:04.087+03:00"}
{"Id":159260,"Number":90,"KnessetNum":9,"Name":"ישיבת מליאה בתאריך 07/03/1978 בשעה 16:02","StartDate":"1978-03-07T16:02:00+02:00","FinishDate":"1978-03-07T21:25:00+02:00","IsSpecialMeeting":null,"LastUpdatedDate":"2020-10-21T01:22:57.67+03:00"}
{"Id":159261,"Number":91,"KnessetNum":9,"Name":"ישיבת מליאה בתאריך 08/03/1978 בשעה 11:03","StartDate":"1978-03-08T11:03:00+02:00","FinishDate":"1978-03-08T15:45:00+02:00","IsSpecialMeeting":null,"LastUpdatedDate":"2021-04-12T15:26:46.58+03:00"}
{"Id":159266,"Number":96,"KnessetNum":9,"Name":"ישיבת מליאה בתאריך 21/03/1978 בשעה 16:08","StartDate":"1978-03-21T16:08:00+02:00","FinishDate":"1978-03-21T16:54:00+02:00","IsSpecialMeeting":null,"LastUpdatedDate":"2020-10-22T00:36:20.707+03:00"}
{"Id":159267,"Number":97,"KnessetNum":9,"Name":"ישיבת מליאה בתאריך 22/03/1978 בשעה 11:00","StartDate":"1978-03-22T11:00:00+02:00","FinishDate":"1978-03-22T15:01:00+02:00","IsSpecialMeeting":null,"LastUpdatedDate":"2020-10-25T03:09:09.76+02:00"}
{"Id":159269,"Number":99,"KnessetNum":9,"Name":"ישיבת מליאה בתאריך 28/03/1978 בשעה 12:01","StartDate":"1978-03-28T12:01:00+02:00","FinishDate":"1978-03-28T21:50:00+02:00","IsSpecialMeeting":null,"LastUpdatedDate":"2020-10-22T00:54:03.66+03:00"}
{"Id":159281,"Number":123,"KnessetNum":9,"Name":"ישיבת מליאה בתאריך 20/06/1978 בשעה 16:01","StartDate":"1978-06-20T16:01:00+03:00","FinishDate":"1978-06-20T19:55:00+03:00","IsSpecialMeeting":null,"LastUpdatedDate":"2020-11-07T19:41:55.067+02:00"}
{"Id":159284,"Number":126,"KnessetNum":9,"Name":"ישיבת מליאה בתאריך 27/06/1978 בשעה 16:01","StartDate":"1978-06-27T16:01:00+03:00","FinishDate":"1978-06-27T21:32:00+03:00","IsSpecialMeeting":null,"LastUpdatedDate":"2020-11-07T21:02:20.207+02:00"}
{"Id":159286,"Number":128,"KnessetNum":9,"Name":"ישיבת מליאה בתאריך 03/07/1978 בשעה 16:02","StartDate":"1978-07-03T16:02:00+03:00","FinishDate":"1978-07-03T17:32:00+03:00","IsSpecialMeeting":null,"LastUpdatedDate":"2020-11-08T00:16:23.347+02:00"}
{"Id":159288,"Number":130,"KnessetNum":9,"Name":"ישיבת מליאה בתאריך 05/07/1978 בשעה 11:03","StartDate":"1978-07-05T11:03:00+03:00","FinishDate":"1978-07-05T13:39:00+03:00","IsSpecialMeeting":null,"LastUpdatedDate":"2020-11-08T01:35:39.937+02:00"}
{"Id":159289,"Number":132,"KnessetNum":9,"Name":"ישיבת מליאה בתאריך 11/07/1978 בשעה 16:01","StartDate":"1978-07-11T16:01:00+03:00","FinishDate":"1978-07-11T20:02:00+03:00","IsSpecialMeeting":null,"LastUpdatedDate":"2020-11-08T02:42:20.783+02:00"}
{"Id":159290,"Number":133,"KnessetNum":9,"Name":"ישיבת מליאה בתאריך 12/07/1978 בשעה 11:01","StartDate":"1978-07-12T11:01:00+03:00","FinishDate":"1978-07-12T15:28:00+03:00","IsSpecialMeeting":null,"LastUpdatedDate":"2020-11-08T23:33:13.873+02:00"}
{"Id":159294,"Number":139,"KnessetNum":9,"Name":"ישיבת מליאה בתאריך 26/07/1978 בשעה 11:01","StartDate":"1978-07-26T11:01:00+03:00","FinishDate":"1978-07-26T18:26:00+03:00","IsSpecialMeeting":null,"LastUpdatedDate":"2020-11-15T09:25:51.413+02:00"}
{"Id":159295,"Number":140,"KnessetNum":9,"Name":"ישיבת מליאה בתאריך 31/07/1978 בשעה 16:04","StartDate":"1978-07-31T16:04:00+03:00","FinishDate":"1978-07-31T20:07:00+03:00","IsSpecialMeeting":null,"LastUpdatedDate":"2020-11-08T21:55:39.57+02:00"}
{"Id":159296,"Number":141,"KnessetNum":9,"Name":"ישיבת מליאה בתאריך 01/08/1978 בשעה 15:03","StartDate":"1978-08-01T15:03:00+03:00","FinishDate":"1978-08-01T21:04:00+03:00","IsSpecialMeeting":null,"LastUpdatedDate":"2021-06-13T12:33:13.727+03:00"}
{"Id":159300,"Number":145,"KnessetNum":9,"Name":"ישיבת מליאה בתאריך 25/09/1978 בשעה 10:05","StartDate":"1978-09-25T10:05:00+03:00","FinishDate":"1978-09-25T12:04:00+03:00","IsSpecialMeeting":null,"LastUpdatedDate":"2020-11-12T02:01:30.74+02:00"}
{"Id":159301,"Number":146,"KnessetNum":9,"Name":"ישיבת מליאה בתאריך 27/09/1978 בשעה 10:02","StartDate":"1978-09-27T10:02:00+02:00","FinishDate":"1978-09-28T03:32:00+02:00","IsSpecialMeeting":null,"LastUpdatedDate":"2020-11-12T02:34:43.687+02:00"}
{"Id":159302,"Number":147,"KnessetNum":9,"Name":"ישיבת מליאה בתאריך 12/10/1978 בשעה 11:10","StartDate":"1978-10-12T11:10:00+02:00","FinishDate":"1978-10-12T11:54:00+02:00","IsSpecialMeeting":null,"LastUpdatedDate":"2020-11-16T21:14:44.393+02:00"}
{"Id":159305,"Number":150,"KnessetNum":9,"Name":"ישיבת מליאה בתאריך 01/11/1978 בשעה 11:02","StartDate":"1978-11-01T11:02:00+02:00","FinishDate":"1978-11-01T15:12:00+02:00","IsSpecialMeeting":null,"LastUpdatedDate":"2021-04-19T14:21:42.75+03:00"}
{"Id":159309,"Number":155,"KnessetNum":9,"Name":"ישיבת מליאה בתאריך 15/11/1978 בשעה 11:01","StartDate":"1978-11-15T11:01:00+02:00","FinishDate":"1978-11-15T13:57:00+02:00","IsSpecialMeeting":null,"LastUpdatedDate":"2020-11-18T00:53:17.387+02:00"}
{"Id":159310,"Number":156,"KnessetNum":9,"Name":"ישיבת מליאה בתאריך 20/11/1978 בשעה 16:03","StartDate":"1978-11-20T16:03:00+02:00","FinishDate":"1978-11-20T18:31:00+02:00","IsSpecialMeeting":null,"LastUpdatedDate":"2020-11-19T08:14:24.19+02:00"}
{"Id":159312,"Number":158,"KnessetNum":9,"Name":"ישיבת מליאה בתאריך 22/11/1978 בשעה 11:01","StartDate":"1978-11-22T11:01:00+02:00","FinishDate":"1978-11-22T15:24:00+02:00","IsSpecialMeeting":null,"LastUpdatedDate":"2020-11-18T00:56:26.747+02:00"}
{"Id":159313,"Number":159,"KnessetNum":9,"Name":"ישיבת מליאה בתאריך 27/11/1978 בשעה 16:01","StartDate":"1978-11-27T16:01:00+02:00","FinishDate":"1978-11-27T18:50:00+02:00","IsSpecialMeeting":null,"LastUpdatedDate":"2021-04-19T14:32:22.91+03:00"}
{"Id":159317,"Number":164,"KnessetNum":9,"Name":"ישיבת מליאה בתאריך 06/12/1978 בשעה 11:02","StartDate":"1978-12-06T11:02:00+02:00","FinishDate":"1978-12-06T14:47:00+02:00","IsSpecialMeeting":null,"LastUpdatedDate":"2020-11-19T09:05:59.88+02:00"}
{"Id":159320,"Number":170,"KnessetNum":9,"Name":"ישיבת מליאה בתאריך 25/12/1978 בשעה 16:01","StartDate":"1978-12-25T16:01:00+02:00","FinishDate":"1978-12-25T18:22:00+02:00","IsSpecialMeeting":null,"LastUpdatedDate":"2020-11-22T01:38:55.013+02:00"}
{"Id":159325,"Number":178,"KnessetNum":9,"Name":"ישיבת מליאה בתאריך 10/01/1979 בשעה 11:02","StartDate":"1979-01-10T11:02:00+02:00","FinishDate":"1979-01-10T15:12:00+02:00","IsSpecialMeeting":null,"LastUpdatedDate":"2020-11-29T14:42:43.47+02:00"}
{"Id":159326,"Number":180,"KnessetNum":9,"Name":"ישיבת מליאה בתאריך 16/01/1979 בשעה 16:00","StartDate":"1979-01-16T16:00:00+02:00","FinishDate":"1979-01-16T19:59:00+02:00","IsSpecialMeeting":null,"LastUpdatedDate":"2020-11-28T03:35:09.05+02:00"}
{"Id":159327,"Number":182,"KnessetNum":9,"Name":"ישיבת מליאה בתאריך 22/01/1979 בשעה 16:02","StartDate":"1979-01-22T16:02:00+02:00","FinishDate":"1979-01-22T18:51:00+02:00","IsSpecialMeeting":null,"LastUpdatedDate":"2020-12-01T00:45:07.3+02:00"}
{"Id":159328,"Number":183,"KnessetNum":9,"Name":"ישיבת מליאה בתאריך 23/01/1979 בשעה 16:01","StartDate":"1979-01-23T16:01:00+02:00","FinishDate":"1979-01-23T18:39:00+02:00","IsSpecialMeeting":null,"LastUpdatedDate":"2020-11-29T18:29:57.55+02:00"}
{"Id":159329,"Number":184,"KnessetNum":9,"Name":"ישיבת מליאה בתאריך 24/01/1979 בשעה 11:02","StartDate":"1979-01-24T11:02:00+02:00","FinishDate":"1979-01-24T16:13:00+02:00","IsSpecialMeeting":null,"LastUpdatedDate":"2020-11-29T19:28:15.353+02:00"}
{"Id":159330,"Number":185,"KnessetNum":9,"Name":"ישיבת מליאה בתאריך 29/01/1979 בשעה 16:02","StartDate":"1979-01-29T16:02:00+02:00","FinishDate":"1979-01-29T17:56:00+02:00","IsSpecialMeeting":null,"LastUpdatedDate":"2020-11-30T10:23:59.763+02:00"}
{"Id":159331,"Number":189,"KnessetNum":9,"Name":"ישיבת מליאה בתאריך 06/02/1979 בשעה 16:00","StartDate":"1979-02-06T16:00:00+02:00","FinishDate":"1979-02-06T20:07:00+02:00","IsSpecialMeeting":null,"LastUpdatedDate":"2020-12-01T00:26:11.12+02:00"}
{"Id":159332,"Number":190,"KnessetNum":9,"Name":"ישיבת מליאה בתאריך 07/02/1979 בשעה 11:03","StartDate":"1979-02-07T11:03:00+02:00","FinishDate":"1979-02-07T16:04:00+02:00","IsSpecialMeeting":null,"LastUpdatedDate":"2020-12-02T00:54:27.493+02:00"}
{"Id":159333,"Number":193,"KnessetNum":9,"Name":"ישיבת מליאה בתאריך 14/02/1979 בשעה 11:01","StartDate":"1979-02-14T11:01:00+02:00","FinishDate":"1979-02-14T13:38:00+02:00","IsSpecialMeeting":null,"LastUpdatedDate":"2020-12-01T01:14:12.873+02:00"}
{"Id":159334,"Number":194,"KnessetNum":9,"Name":"ישיבת מליאה בתאריך 19/02/1979 בשעה 16:03","StartDate":"1979-02-19T16:03:00+02:00","FinishDate":"1979-02-19T19:34:00+02:00","IsSpecialMeeting":null,"LastUpdatedDate":"2020-12-01T18:44:22.223+02:00"}
{"Id":159335,"Number":196,"KnessetNum":9,"Name":"ישיבת מליאה בתאריך 21/02/1979 בשעה 11:02","StartDate":"1979-02-21T11:02:00+02:00","FinishDate":"1979-02-21T15:41:00+02:00","IsSpecialMeeting":null,"LastUpdatedDate":"2020-12-02T00:47:03.9+02:00"}
{"Id":159336,"Number":197,"KnessetNum":9,"Name":"ישיבת מליאה בתאריך 26/02/1979 בשעה 16:01","StartDate":"1979-02-26T16:01:00+02:00","FinishDate":"1979-02-26T21:36:00+02:00","IsSpecialMeeting":null,"LastUpdatedDate":"2020-12-02T00:05:37.22+02:00"}
{"Id":159337,"Number":199,"KnessetNum":9,"Name":"ישיבת מליאה בתאריך 28/02/1979 בשעה 11:01","StartDate":"1979-02-28T11:01:00+02:00","FinishDate":"1979-02-28T13:45:00+02:00","IsSpecialMeeting":null,"LastUpdatedDate":"2020-12-02T13:06:39.797+02:00"}
{"Id":159339,"Number":201,"KnessetNum":9,"Name":"ישיבת מליאה בתאריך 06/03/1979 בשעה 16:02","StartDate":"1979-03-06T16:02:00+02:00","FinishDate":"1979-03-06T20:07:00+02:00","IsSpecialMeeting":null,"LastUpdatedDate":"2020-12-03T20:51:05.583+02:00"}
{"Id":159340,"Number":205,"KnessetNum":9,"Name":"ישיבת מליאה בתאריך 19/03/1979 בשעה 16:01","StartDate":"1979-03-19T16:01:00+02:00","FinishDate":"1979-03-19T18:36:00+02:00","IsSpecialMeeting":null,"LastUpdatedDate":"2020-12-04T00:04:40+02:00"}
{"Id":159347,"Number":221,"KnessetNum":9,"Name":"ישיבת מליאה בתאריך 15/05/1979 בשעה 16:00","StartDate":"1979-05-15T16:00:00+03:00","FinishDate":"1979-05-15T19:21:00+03:00","IsSpecialMeeting":null,"LastUpdatedDate":"2020-12-07T22:36:51.75+02:00"}
{"Id":159348,"Number":222,"KnessetNum":9,"Name":"ישיבת מליאה בתאריך 16/05/1979 בשעה 11:01","StartDate":"1979-05-16T11:01:00+03:00","FinishDate":"1979-05-16T16:17:00+03:00","IsSpecialMeeting":null,"LastUpdatedDate":"2020-12-07T23:35:40.043+02:00"}
{"Id":159349,"Number":223,"KnessetNum":9,"Name":"ישיבת מליאה בתאריך 21/05/1979 בשעה 16:00","StartDate":"1979-05-21T16:00:00+03:00","FinishDate":"1979-05-21T20:09:00+03:00","IsSpecialMeeting":null,"LastUpdatedDate":"2020-12-05T03:18:57.18+02:00"}
{"Id":159350,"Number":225,"KnessetNum":9,"Name":"ישיבת מליאה בתאריך 23/05/1979 בשעה 11:05","StartDate":"1979-05-23T11:05:00+03:00","FinishDate":"1979-05-23T14:37:00+03:00","IsSpecialMeeting":null,"LastUpdatedDate":"2020-12-11T02:49:46.067+02:00"}
{"Id":159353,"Number":233,"KnessetNum":9,"Name":"ישיבת מליאה בתאריך 12/06/1979 בשעה 16:02","StartDate":"1979-06-12T16:02:00+03:00","FinishDate":"1979-06-12T19:34:00+03:00","IsSpecialMeeting":null,"LastUpdatedDate":"2020-12-12T23:55:45.3+02:00"}
{"Id":159354,"Number":234,"KnessetNum":9,"Name":"ישיבת מליאה בתאריך 13/06/1979 בשעה 11:07","StartDate":"1979-06-13T11:07:00+03:00","FinishDate":"1979-06-13T17:11:00+03:00","IsSpecialMeeting":null,"LastUpdatedDate":"2020-12-13T00:15:51.913+02:00"}
{"Id":159355,"Number":235,"KnessetNum":9,"Name":"ישיבת מליאה בתאריך 18/06/1979 בשעה 16:02","StartDate":"1979-06-18T16:02:00+03:00","FinishDate":"1979-06-18T20:03:00+03:00","IsSpecialMeeting":null,"LastUpdatedDate":"2021-04-19T14:51:46.287+03:00"}
{"Id":159357,"Number":239,"KnessetNum":9,"Name":"ישיבת מליאה בתאריך 26/06/1979 בשעה 16:00","StartDate":"1979-06-26T16:00:00+03:00","FinishDate":"1979-06-26T18:08:00+03:00","IsSpecialMeeting":null,"LastUpdatedDate":"2020-12-13T02:19:55.22+02:00"}
{"Id":159358,"Number":240,"KnessetNum":9,"Name":"ישיבת מליאה בתאריך 27/06/1979 בשעה 09:04","StartDate":"1979-06-27T09:04:00+03:00","FinishDate":"1979-06-27T19:55:00+03:00","IsSpecialMeeting":null,"LastUpdatedDate":"2020-12-16T11:23:20.793+02:00"}
{"Id":159359,"Number":241,"KnessetNum":9,"Name":"ישיבת מליאה בתאריך 02/07/1979 בשעה 16:01","StartDate":"1979-07-02T16:01:00+03:00","FinishDate":"1979-07-02T18:01:00+03:00","IsSpecialMeeting":null,"LastUpdatedDate":"2020-12-13T02:32:50.627+02:00"}
{"Id":159360,"Number":242,"KnessetNum":9,"Name":"ישיבת מליאה בתאריך 03/07/1979 בשעה 16:02","StartDate":"1979-07-03T16:02:00+03:00","FinishDate":"1979-07-03T20:51:00+03:00","IsSpecialMeeting":null,"LastUpdatedDate":"2020-12-13T02:42:47.683+02:00"}
{"Id":159362,"Number":245,"KnessetNum":9,"Name":"ישיבת מליאה בתאריך 10/07/1979 בשעה 16:00","StartDate":"1979-07-10T16:00:00+03:00","FinishDate":"1979-07-10T20:14:00+03:00","IsSpecialMeeting":null,"LastUpdatedDate":"2021-04-19T17:31:16.873+03:00"}
{"Id":159363,"Number":246,"KnessetNum":9,"Name":"ישיבת מליאה בתאריך 11/07/1979 בשעה 11:00","StartDate":"1979-07-11T11:00:00+03:00","FinishDate":"1979-07-11T17:30:00+03:00","IsSpecialMeeting":null,"LastUpdatedDate":"2020-12-16T02:08:32.067+02:00"}
{"Id":159376,"Number":261,"KnessetNum":9,"Name":"ישיבת מליאה בתאריך 24/10/1979 בשעה 11:03","StartDate":"1979-10-24T11:03:00+02:00","FinishDate":"1979-10-24T16:02:00+02:00","IsSpecialMeeting":null,"LastUpdatedDate":"2025-01-27T13:27:35.893+02:00"}
{"Id":159377,"Number":262,"KnessetNum":9,"Name":"ישיבת מליאה בתאריך 29/10/1979 בשעה 16:01","StartDate":"1979-10-29T16:01:00+02:00","FinishDate":"1979-10-29T20:35:00+02:00","IsSpecialMeeting":null,"LastUpdatedDate":"2021-04-28T16:29:19.77+03:00"}
{"Id":159379,"Number":265,"KnessetNum":9,"Name":"ישיבת מליאה בתאריך 05/11/1979 בשעה 16:04","StartDate":"1979-11-05T16:04:00+02:00","FinishDate":"1979-11-05T20:12:00+02:00","IsSpecialMeeting":null,"LastUpdatedDate":"2021-04-28T16:31:39.747+03:00"}
{"Id":159380,"Number":266,"KnessetNum":9,"Name":"ישיבת מליאה בתאריך 06/11/1979 בשעה 16:02","StartDate":"1979-11-06T16:02:00+02:00","FinishDate":"1979-11-06T21:22:00+02:00","IsSpecialMeeting":null,"LastUpdatedDate":"2021-04-28T16:32:31.263+03:00"}
{"Id":159381,"Number":268,"KnessetNum":9,"Name":"ישיבת מליאה בתאריך 12/11/1979 בשעה 16:03","StartDate":"1979-11-12T16:03:00+02:00","FinishDate":"1979-11-12T20:05:00+02:00","IsSpecialMeeting":null,"LastUpdatedDate":"2021-01-12T16:25:15.933+02:00"}
{"Id":159382,"Number":269,"KnessetNum":9,"Name":"ישיבת מליאה בתאריך 13/11/1979 בשעה 16:01","StartDate":"1979-11-13T16:01:00+02:00","FinishDate":"1979-11-13T18:45:00+02:00","IsSpecialMeeting":null,"LastUpdatedDate":"2021-04-28T16:25:56.56+03:00"}
{"Id":159383,"Number":271,"KnessetNum":9,"Name":"ישיבת מליאה בתאריך 19/11/1979 בשעה 16:02","StartDate":"1979-11-19T16:02:00+02:00","FinishDate":"1979-11-19T17:17:00+02:00","IsSpecialMeeting":null,"LastUpdatedDate":"2021-04-28T16:27:51.71+03:00"}
{"Id":159384,"Number":274,"KnessetNum":9,"Name":"ישיבת מליאה בתאריך 26/11/1979 בשעה 16:02","StartDate":"1979-11-26T16:02:00+02:00","FinishDate":"1979-11-26T19:38:00+02:00","IsSpecialMeeting":null,"LastUpdatedDate":"2021-04-28T16:52:16.633+03:00"}
{"Id":159385,"Number":275,"KnessetNum":9,"Name":"ישיבת מליאה בתאריך 27/11/1979 בשעה 16:01","StartDate":"1979-11-27T16:01:00+02:00","FinishDate":"1979-11-27T19:13:00+02:00","IsSpecialMeeting":null,"LastUpdatedDate":"2021-04-28T19:33:14.987+03:00"}
{"Id":159386,"Number":276,"KnessetNum":9,"Name":"ישיבת מליאה בתאריך 28/11/1979 בשעה 11:02","StartDate":"1979-11-28T11:02:00+02:00","FinishDate":"1979-11-28T14:34:00+02:00","IsSpecialMeeting":null,"LastUpdatedDate":"2021-04-28T19:34:09.01+03:00"}
{"Id":159387,"Number":277,"KnessetNum":9,"Name":"ישיבת מליאה בתאריך 03/12/1979 בשעה 16:03","StartDate":"1979-12-03T16:03:00+02:00","FinishDate":"1979-12-03T21:41:00+02:00","IsSpecialMeeting":null,"LastUpdatedDate":"2021-04-28T19:34:55.547+03:00"}
{"Id":159388,"Number":278,"KnessetNum":9,"Name":"ישיבת מליאה בתאריך 04/12/1979 בשעה 16:00","StartDate":"1979-12-04T16:00:00+02:00","FinishDate":"1979-12-04T20:40:00+02:00","IsSpecialMeeting":null,"LastUpdatedDate":"2023-09-06T17:33:45.797+03:00"}
{"Id":159389,"Number":279,"KnessetNum":9,"Name":"ישיבת מליאה בתאריך 05/12/1979 בשעה 11:02","StartDate":"1979-12-05T11:02:00+02:00","FinishDate":"1979-12-05T16:26:00+02:00","IsSpecialMeeting":null,"LastUpdatedDate":"2021-04-28T19:36:37.36+03:00"}
{"Id":159390,"Number":280,"KnessetNum":9,"Name":"ישיבת מליאה בתאריך 10/12/1979 בשעה 16:04","StartDate":"1979-12-10T16:04:00+02:00","FinishDate":"1979-12-10T19:57:00+02:00","IsSpecialMeeting":null,"LastUpdatedDate":"2021-04-28T19:37:23.823+03:00"}
{"Id":159391,"Number":281,"KnessetNum":9,"Name":"ישיבת מליאה בתאריך 11/12/1979 בשעה 16:01","StartDate":"1979-12-11T16:01:00+02:00","FinishDate":"1979-12-11T19:45:00+02:00","IsSpecialMeeting":null,"LastUpdatedDate":"2021-04-28T19:38:06.063+03:00"}
{"Id":159394,"Number":286,"KnessetNum":9,"Name":"ישיבת מליאה בתאריך 24/12/1979 בשעה 16:01","StartDate":"1979-12-24T16:01:00+02:00","FinishDate":"1979-12-24T22:08:00+02:00","IsSpecialMeeting":null,"LastUpdatedDate":"2021-04-28T20:18:26.303+03:00"}
{"Id":159395,"Number":287,"KnessetNum":9,"Name":"ישיבת מליאה בתאריך 25/12/1979 בשעה 16:01","StartDate":"1979-12-25T16:01:00+02:00","FinishDate":"1979-12-25T20:42:00+02:00","IsSpecialMeeting":null,"LastUpdatedDate":"2021-04-28T20:19:08.663+03:00"}
{"Id":159396,"Number":289,"KnessetNum":9,"Name":"ישיבת מליאה בתאריך 31/12/1979 בשעה 16:01","StartDate":"1979-12-31T16:01:00+02:00","FinishDate":"1979-12-31T21:04:00+02:00","IsSpecialMeeting":null,"LastUpdatedDate":"2021-02-11T01:39:39.67+02:00"}
{"Id":159397,"Number":290,"KnessetNum":9,"Name":"ישיבת מליאה בתאריך 01/01/1980 בשעה 16:03","StartDate":"1980-01-01T16:03:00+02:00","FinishDate":"1980-01-01T19:55:00+02:00","IsSpecialMeeting":null,"LastUpdatedDate":"2021-02-11T01:38:44.82+02:00"}
{"Id":159398,"Number":292,"KnessetNum":9,"Name":"ישיבת מליאה בתאריך 07/01/1980 בשעה 16:02","StartDate":"1980-01-07T16:02:00+02:00","FinishDate":"1980-01-07T19:40:00+02:00","IsSpecialMeeting":null,"LastUpdatedDate":"2021-02-11T01:34:32.277+02:00"}
{"Id":159399,"Number":293,"KnessetNum":9,"Name":"ישיבת מליאה בתאריך 08/01/1980 בשעה 16:04","StartDate":"1980-01-08T16:04:00+02:00","FinishDate":"1980-01-08T18:00:00+02:00","IsSpecialMeeting":null,"LastUpdatedDate":"2021-02-11T01:33:07.7+02:00"}
{"Id":159400,"Number":294,"KnessetNum":9,"Name":"ישיבת מליאה בתאריך 09/01/1980 בשעה 11:02","StartDate":"1980-01-09T11:02:00+02:00","FinishDate":"1980-01-09T15:03:00+02:00","IsSpecialMeeting":null,"LastUpdatedDate":"2021-02-11T01:32:00.927+02:00"}
{"Id":159401,"Number":295,"KnessetNum":9,"Name":"ישיבת מליאה בתאריך 14/01/1980 בשעה 16:02","StartDate":"1980-01-14T16:02:00+02:00","FinishDate":"1980-01-14T20:06:00+02:00","IsSpecialMeeting":null,"LastUpdatedDate":"2021-02-11T01:30:56.433+02:00"}
{"Id":159402,"Number":298,"KnessetNum":9,"Name":"ישיבת מליאה בתאריך 21/01/1980 בשעה 16:01","StartDate":"1980-01-21T16:01:00+02:00","FinishDate":"1980-01-21T18:41:00+02:00","IsSpecialMeeting":null,"LastUpdatedDate":"2021-02-11T01:27:48.563+02:00"}
{"Id":159403,"Number":299,"KnessetNum":9,"Name":"ישיבת מליאה בתאריך 22/01/1980 בשעה 16:02","StartDate":"1980-01-22T16:02:00+02:00","FinishDate":"1980-01-22T18:25:00+02:00","IsSpecialMeeting":null,"LastUpdatedDate":"2021-02-11T01:26:39.653+02:00"}
{"Id":159405,"Number":301,"KnessetNum":9,"Name":"ישיבת מליאה בתאריך 28/01/1980 בשעה 16:07","StartDate":"1980-01-28T16:07:00+02:00","FinishDate":"1980-01-28T20:22:00+02:00","IsSpecialMeeting":null,"LastUpdatedDate":"2021-02-15T02:11:03.9+02:00"}
{"Id":159406,"Number":302,"KnessetNum":9,"Name":"ישיבת מליאה בתאריך 29/01/1980 בשעה 16:02","StartDate":"1980-01-29T16:02:00+02:00","FinishDate":"1980-01-29T18:15:00+02:00","IsSpecialMeeting":null,"LastUpdatedDate":"2021-02-15T02:37:26.047+02:00"}
{"Id":159407,"Number":303,"KnessetNum":9,"Name":"ישיבת מליאה בתאריך 30/01/1980 בשעה 11:01","StartDate":"1980-01-30T11:01:00+02:00","FinishDate":"1980-01-30T17:29:00+02:00","IsSpecialMeeting":null,"LastUpdatedDate":"2021-05-20T12:10:11.7+03:00"}
{"Id":159408,"Number":305,"KnessetNum":9,"Name":"ישיבת מליאה בתאריך 05/02/1980 בשעה 16:01","StartDate":"1980-02-05T16:01:00+02:00","FinishDate":"1980-02-05T21:22:00+02:00","IsSpecialMeeting":null,"LastUpdatedDate":"2021-02-17T03:05:56.687+02:00"}
{"Id":159409,"Number":306,"KnessetNum":9,"Name":"ישיבת מליאה בתאריך 06/02/1980 בשעה 11:02","StartDate":"1980-02-06T11:02:00+02:00","FinishDate":"1980-02-06T15:52:00+02:00","IsSpecialMeeting":null,"LastUpdatedDate":"2021-02-17T03:22:59.857+02:00"}
{"Id":159410,"Number":308,"KnessetNum":9,"Name":"ישיבת מליאה בתאריך 12/02/1980 בשעה 16:00","StartDate":"1980-02-12T16:00:00+02:00","FinishDate":"1980-02-12T21:26:00+02:00","IsSpecialMeeting":null,"LastUpdatedDate":"2021-02-17T03:46:35.963+02:00"}
{"Id":159411,"Number":309,"KnessetNum":9,"Name":"ישיבת מליאה בתאריך 13/02/1980 בשעה 11:01","StartDate":"1980-02-13T11:01:00+02:00","FinishDate":"1980-02-13T17:57:00+02:00","IsSpecialMeeting":null,"LastUpdatedDate":"2023-02-21T10:33:46.82+02:00"}
{"Id":159412,"Number":310,"KnessetNum":9,"Name":"ישיבת מליאה בתאריך 18/02/1980 בשעה 16:03","StartDate":"1980-02-18T16:03:00+02:00","FinishDate":"1980-02-18T19:53:00+02:00","IsSpecialMeeting":null,"LastUpdatedDate":"2021-02-17T04:17:50.277+02:00"}
{"Id":159414,"Number":313,"KnessetNum":9,"Name":"ישיבת מליאה בתאריך 25/02/1980 בשעה 16:02","StartDate":"1980-02-25T16:02:00+02:00","FinishDate":"1980-02-25T18:50:00+02:00","IsSpecialMeeting":null,"LastUpdatedDate":"2021-02-17T05:54:07.413+02:00"}
{"Id":159415,"Number":317,"KnessetNum":9,"Name":"ישיבת מליאה בתאריך 05/03/1980 בשעה 16:02","StartDate":"1980-03-05T16:02:00+02:00","FinishDate":"1980-03-05T18:48:00+02:00","IsSpecialMeeting":null,"LastUpdatedDate":"2021-02-18T03:31:04.133+02:00"}
{"Id":159416,"Number":320,"KnessetNum":9,"Name":"ישיבת מליאה בתאריך 11/03/1980 בשעה 16:01","StartDate":"1980-03-11T16:01:00+02:00","FinishDate":"1980-03-11T22:15:00+02:00","IsSpecialMeeting":null,"LastUpdatedDate":"2021-02-18T12:13:34.847+02:00"}
{"Id":159417,"Number":321,"KnessetNum":9,"Name":"ישיבת מליאה בתאריך 12/03/1980 בשעה 12:07","StartDate":"1980-03-12T12:07:00+02:00","FinishDate":"1980-03-12T16:46:00+02:00","IsSpecialMeeting":null,"LastUpdatedDate":"2021-02-21T01:09:28.623+02:00"}
{"Id":159418,"Number":322,"KnessetNum":9,"Name":"ישיבת מליאה בתאריך 17/03/1980 בשעה 16:02","StartDate":"1980-03-17T16:02:00+02:00","FinishDate":"1980-03-17T19:37:00+02:00","IsSpecialMeeting":null,"LastUpdatedDate":"2021-02-20T20:37:33.94+02:00"}
{"Id":159419,"Number":323,"KnessetNum":9,"Name":"ישיבת מליאה בתאריך 18/03/1980 בשעה 16:00","StartDate":"1980-03-18T16:00:00+02:00","FinishDate":"1980-03-18T20:00:00+02:00","IsSpecialMeeting":null,"LastUpdatedDate":"2021-02-20T21:10:06.78+02:00"}
{"Id":159420,"Number":324,"KnessetNum":9,"Name":"ישיבת מליאה בתאריך 19/03/1980 בשעה 12:00","StartDate":"1980-03-19T12:00:00+02:00","FinishDate":"1980-03-19T19:28:00+02:00","IsSpecialMeeting":null,"LastUpdatedDate":"2021-02-20T23:56:34.677+02:00"}
{"Id":159422,"Number":325,"KnessetNum":9,"Name":"ישיבת מליאה בתאריך 24/03/1980 בשעה 16:01","StartDate":"1980-03-24T16:01:00+02:00","FinishDate":"1980-03-24T20:15:00+02:00","IsSpecialMeeting":null,"LastUpdatedDate":"2021-03-18T14:29:18.213+02:00"}
{"Id":159423,"Number":326,"KnessetNum":9,"Name":"ישיבת מליאה בתאריך 25/03/1980 בשעה 16:02","StartDate":"1980-03-25T16:02:00+02:00","FinishDate":"1980-03-25T18:44:00+02:00","IsSpecialMeeting":null,"LastUpdatedDate":"2021-02-22T02:46:28.747+02:00"}
{"Id":159424,"Number":327,"KnessetNum":9,"Name":"ישיבת מליאה בתאריך 26/03/1980 בשעה 09:02","StartDate":"1980-03-26T09:02:00+02:00","FinishDate":"1980-03-26T21:17:00+02:00","IsSpecialMeeting":null,"LastUpdatedDate":"2021-02-24T01:19:47.77+02:00"}
{"Id":159425,"Number":329,"KnessetNum":9,"Name":"ישיבת מליאה בתאריך 06/05/1980 בשעה 16:01","StartDate":"1980-05-06T16:01:00+03:00","FinishDate":"1980-05-06T19:28:00+03:00","IsSpecialMeeting":null,"LastUpdatedDate":"2021-02-24T01:44:41.103+02:00"}
{"Id":159427,"Number":331,"KnessetNum":9,"Name":"ישיבת מליאה בתאריך 12/05/1980 בשעה 16:00","StartDate":"1980-05-12T16:00:00+03:00","FinishDate":"1980-05-12T20:10:00+03:00","IsSpecialMeeting":null,"LastUpdatedDate":"2021-02-24T01:54:16.477+02:00"}
{"Id":159428,"Number":332,"KnessetNum":9,"Name":"ישיבת מליאה בתאריך 13/05/1980 בשעה 16:00","StartDate":"1980-05-13T16:00:00+03:00","FinishDate":"1980-05-13T18:42:00+03:00","IsSpecialMeeting":null,"LastUpdatedDate":"2021-03-01T09:16:30.833+02:00"}
{"Id":159429,"Number":333,"KnessetNum":9,"Name":"ישיבת מליאה בתאריך 14/05/1980 בשעה 11:02","StartDate":"1980-05-14T11:02:00+03:00","FinishDate":"1980-05-14T16:35:00+03:00","IsSpecialMeeting":null,"LastUpdatedDate":"2021-04-01T03:19:46.47+03:00"}
{"Id":159433,"Number":337,"KnessetNum":9,"Name":"ישיבת מליאה בתאריך 28/05/1980 בשעה 11:02","StartDate":"1980-05-28T11:02:00+03:00","FinishDate":"1980-05-28T16:40:00+03:00","IsSpecialMeeting":null,"LastUpdatedDate":"2021-04-01T04:07:06.947+03:00"}
{"Id":159441,"Number":348,"KnessetNum":9,"Name":"ישיבת מליאה בתאריך 24/06/1980 בשעה 16:00","StartDate":"1980-06-24T16:00:00+03:00","FinishDate":"1980-06-24T20:07:00+03:00","IsSpecialMeeting":null,"LastUpdatedDate":"2021-05-09T10:48:59.227+03:00"}
{"Id":159446,"Number":353,"KnessetNum":9,"Name":"ישיבת מליאה בתאריך 07/07/1980 בשעה 16:02","StartDate":"1980-07-07T16:02:00+03:00","FinishDate":"1980-07-07T17:35:00+03:00","IsSpecialMeeting":null,"LastUpdatedDate":"2021-05-18T02:03:16.487+03:00"}
{"Id":159447,"Number":354,"KnessetNum":9,"Name":"ישיבת מליאה בתאריך 08/07/1980 בשעה 16:01","StartDate":"1980-07-08T16:01:00+03:00","FinishDate":"1980-07-08T22:25:00+03:00","IsSpecialMeeting":null,"LastUpdatedDate":"2020-10-21T16:03:31.033+03:00"}
{"Id":159448,"Number":355,"KnessetNum":9,"Name":"ישיבת מליאה בתאריך 09/07/1980 בשעה 11:01","StartDate":"1980-07-09T11:01:00+03:00","FinishDate":"1980-07-09T17:08:00+03:00","IsSpecialMeeting":null,"LastUpdatedDate":"2020-10-21T16:02:35.393+03:00"}
{"Id":159450,"Number":358,"KnessetNum":9,"Name":"ישיבת מליאה בתאריך 16/07/1980 בשעה 11:01","StartDate":"1980-07-16T11:01:00+03:00","FinishDate":"1980-07-16T18:44:00+03:00","IsSpecialMeeting":null,"LastUpdatedDate":"2020-10-27T14:57:37.017+02:00"}
{"Id":159452,"Number":360,"KnessetNum":9,"Name":"ישיבת מליאה בתאריך 23/07/1980 בשעה 11:02","StartDate":"1980-07-23T11:02:00+03:00","FinishDate":"1980-07-23T23:10:00+03:00","IsSpecialMeeting":null,"LastUpdatedDate":"2020-10-27T15:03:56.233+02:00"}
{"Id":159453,"Number":361,"KnessetNum":9,"Name":"ישיבת מליאה בתאריך 28/07/1980 בשעה 16:02","StartDate":"1980-07-28T16:02:00+03:00","FinishDate":"1980-07-28T22:12:00+03:00","IsSpecialMeeting":null,"LastUpdatedDate":"2020-10-19T16:48:10.683+03:00"}
{"Id":159454,"Number":362,"KnessetNum":9,"Name":"ישיבת מליאה בתאריך 29/07/1980 בשעה 16:03","StartDate":"1980-07-29T16:03:00+03:00","FinishDate":"1980-07-30T00:45:00+03:00","IsSpecialMeeting":null,"LastUpdatedDate":"2020-10-27T15:37:27.4+02:00"}
{"Id":159459,"Number":370,"KnessetNum":9,"Name":"ישיבת מליאה בתאריך 20/10/1980 בשעה 16:00","StartDate":"1980-10-20T16:00:00+02:00","FinishDate":"1980-10-20T18:00:00+02:00","IsSpecialMeeting":null,"LastUpdatedDate":"2020-09-16T09:57:03.76+03:00"}
{"Id":159460,"Number":371,"KnessetNum":9,"Name":"ישיבת מליאה בתאריך 21/10/1980 בשעה 16:01","StartDate":"1980-10-21T16:01:00+02:00","FinishDate":"1980-10-21T21:37:00+02:00","IsSpecialMeeting":null,"LastUpdatedDate":"2020-09-16T08:57:23.297+03:00"}
{"Id":159462,"Number":374,"KnessetNum":9,"Name":"ישיבת מליאה בתאריך 28/10/1980 בשעה 16:02","StartDate":"1980-10-28T16:02:00+02:00","FinishDate":"1980-10-28T18:48:00+02:00","IsSpecialMeeting":null,"LastUpdatedDate":"2020-09-09T13:51:32.69+03:00"}
{"Id":159463,"Number":375,"KnessetNum":9,"Name":"ישיבת מליאה בתאריך 29/10/1980 בשעה 11:02","StartDate":"1980-10-29T11:02:00+02:00","FinishDate":"1980-10-29T14:05:00+02:00","IsSpecialMeeting":null,"LastUpdatedDate":"2020-10-27T16:05:57.97+02:00"}
{"Id":159464,"Number":376,"KnessetNum":9,"Name":"ישיבת מליאה בתאריך 03/11/1980 בשעה 16:02","StartDate":"1980-11-03T16:02:00+02:00","FinishDate":"1980-11-03T19:55:00+02:00","IsSpecialMeeting":null,"LastUpdatedDate":"2020-10-27T16:09:45.783+02:00"}
{"Id":159465,"Number":377,"KnessetNum":9,"Name":"ישיבת מליאה בתאריך 04/11/1980 בשעה 16:00","StartDate":"1980-11-04T16:00:00+02:00","FinishDate":"1980-11-04T20:21:00+02:00","IsSpecialMeeting":null,"LastUpdatedDate":"2020-10-27T16:27:49.507+02:00"}
{"Id":159466,"Number":378,"KnessetNum":9,"Name":"ישיבת מליאה בתאריך 05/11/1980 בשעה 11:01","StartDate":"1980-11-05T11:01:00+02:00","FinishDate":"1980-11-05T14:31:00+02:00","IsSpecialMeeting":null,"LastUpdatedDate":"2020-07-07T15:03:36.567+03:00"}
{"Id":159467,"Number":379,"KnessetNum":9,"Name":"ישיבת מליאה בתאריך 10/11/1980 בשעה 16:02","StartDate":"1980-11-10T16:02:00+02:00","FinishDate":"1980-11-10T20:56:00+02:00","IsSpecialMeeting":null,"LastUpdatedDate":"2020-07-07T09:41:05.51+03:00"}
{"Id":159468,"Number":380,"KnessetNum":9,"Name":"ישיבת מליאה בתאריך 11/11/1980 בשעה 16:01","StartDate":"1980-11-11T16:01:00+02:00","FinishDate":"1980-11-11T18:51:00+02:00","IsSpecialMeeting":null,"LastUpdatedDate":"2020-07-05T15:45:19.487+03:00"}
{"Id":159469,"Number":381,"KnessetNum":9,"Name":"ישיבת מליאה בתאריך 12/11/1980 בשעה 11:01","StartDate":"1980-11-12T11:01:00+02:00","FinishDate":"1980-11-12T13:48:00+02:00","IsSpecialMeeting":null,"LastUpdatedDate":"2020-07-05T14:58:54.407+03:00"}
{"Id":159470,"Number":382,"KnessetNum":9,"Name":"ישיבת מליאה בתאריך 17/11/1980 בשעה 16:03","StartDate":"1980-11-17T16:03:00+02:00","FinishDate":"1980-11-17T18:24:00+02:00","IsSpecialMeeting":null,"LastUpdatedDate":"2020-10-27T16:38:33.773+02:00"}
{"Id":159471,"Number":383,"KnessetNum":9,"Name":"ישיבת מליאה בתאריך 18/11/1980 בשעה 16:02","StartDate":"1980-11-18T16:02:00+02:00","FinishDate":"1980-11-18T18:31:00+02:00","IsSpecialMeeting":null,"LastUpdatedDate":"2020-07-05T10:49:46.007+03:00"}
{"Id":159472,"Number":385,"KnessetNum":9,"Name":"ישיבת מליאה בתאריך 24/11/1980 בשעה 16:03","StartDate":"1980-11-24T16:03:00+02:00","FinishDate":"1980-11-24T21:42:00+02:00","IsSpecialMeeting":null,"LastUpdatedDate":"2020-07-05T10:01:08.863+03:00"}
{"Id":159473,"Number":386,"KnessetNum":9,"Name":"ישיבת מליאה בתאריך 25/11/1980 בשעה 16:00","StartDate":"1980-11-25T16:00:00+02:00","FinishDate":"1980-11-25T17:48:00+02:00","IsSpecialMeeting":null,"LastUpdatedDate":"2020-10-27T16:41:29.023+02:00"}
{"Id":159474,"Number":388,"KnessetNum":9,"Name":"ישיבת מליאה בתאריך 01/12/1980 בשעה 16:04","StartDate":"1980-12-01T16:04:00+02:00","FinishDate":"1980-12-02T01:27:00+02:00","IsSpecialMeeting":null,"LastUpdatedDate":"2020-09-09T11:14:49.703+03:00"}
{"Id":159475,"Number":389,"KnessetNum":9,"Name":"ישיבת מליאה בתאריך 02/12/1980 בשעה 16:03","StartDate":"1980-12-02T16:03:00+02:00","FinishDate":"1980-12-02T18:36:00+02:00","IsSpecialMeeting":null,"LastUpdatedDate":"2020-07-09T10:07:37.553+03:00"}
{"Id":159476,"Number":390,"KnessetNum":9,"Name":"ישיבת מליאה בתאריך 03/12/1980 בשעה 11:04","StartDate":"1980-12-03T11:04:00+02:00","FinishDate":"1980-12-03T13:50:00+02:00","IsSpecialMeeting":null,"LastUpdatedDate":"2020-07-02T09:32:59.243+03:00"}
{"Id":159477,"Number":391,"KnessetNum":9,"Name":"ישיבת מליאה בתאריך 08/12/1980 בשעה 16:03","StartDate":"1980-12-08T16:03:00+02:00","FinishDate":"1980-12-08T19:55:00+02:00","IsSpecialMeeting":null,"LastUpdatedDate":"2020-07-01T15:53:23.53+03:00"}
{"Id":159478,"Number":392,"KnessetNum":9,"Name":"ישיבת מליאה בתאריך 09/12/1980 בשעה 16:03","StartDate":"1980-12-09T16:03:00+02:00","FinishDate":"1980-12-09T17:20:00+02:00","IsSpecialMeeting":null,"LastUpdatedDate":"2020-07-01T15:35:07.293+03:00"}
{"Id":159479,"Number":393,"KnessetNum":9,"Name":"ישיבת מליאה בתאריך 10/12/1980 בשעה 11:02","StartDate":"1980-12-10T11:02:00+02:00","FinishDate":"1980-12-10T13:17:00+02:00","IsSpecialMeeting":null,"LastUpdatedDate":"2020-10-27T16:59:09.43+02:00"}
{"Id":159480,"Number":394,"KnessetNum":9,"Name":"ישיבת מליאה בתאריך 15/12/1980 בשעה 16:03","StartDate":"1980-12-15T16:03:00+02:00","FinishDate":"1980-12-15T19:20:00+02:00","IsSpecialMeeting":null,"LastUpdatedDate":"2020-07-01T13:16:09.197+03:00"}
{"Id":159481,"Number":395,"KnessetNum":9,"Name":"ישיבת מליאה בתאריך 16/12/1980 בשעה 16:01","StartDate":"1980-12-16T16:01:00+02:00","FinishDate":"1980-12-16T19:18:00+02:00","IsSpecialMeeting":null,"LastUpdatedDate":"2020-07-01T13:14:38.023+03:00"}
{"Id":159482,"Number":396,"KnessetNum":9,"Name":"ישיבת מליאה בתאריך 17/12/1980 בשעה 11:02","StartDate":"1980-12-17T11:02:00+02:00","FinishDate":"1980-12-17T14:55:00+02:00","IsSpecialMeeting":null,"LastUpdatedDate":"2020-10-27T17:20:53.287+02:00"}
{"Id":159483,"Number":397,"KnessetNum":9,"Name":"ישיבת מליאה בתאריך 22/12/1980 בשעה 16:02","StartDate":"1980-12-22T16:02:00+02:00","FinishDate":"1980-12-22T18:42:00+02:00","IsSpecialMeeting":null,"LastUpdatedDate":"2020-08-12T12:45:19.473+03:00"}
{"Id":159484,"Number":398,"KnessetNum":9,"Name":"ישיבת מליאה בתאריך 23/12/1980 בשעה 16:02","StartDate":"1980-12-23T16:02:00+02:00","FinishDate":"1980-12-23T18:13:00+02:00","IsSpecialMeeting":null,"LastUpdatedDate":"2020-06-30T13:50:56.183+03:00"}
{"Id":159485,"Number":399,"KnessetNum":9,"Name":"ישיבת מליאה בתאריך 24/12/1980 בשעה 11:00","StartDate":"1980-12-24T11:00:00+02:00","FinishDate":"1980-12-24T14:30:00+02:00","IsSpecialMeeting":null,"LastUpdatedDate":"2020-06-30T12:02:00.65+03:00"}
{"Id":159486,"Number":402,"KnessetNum":9,"Name":"ישיבת מליאה בתאריך 31/12/1980 בשעה 11:02","StartDate":"1980-12-31T11:02:00+02:00","FinishDate":"1980-12-31T13:10:00+02:00","IsSpecialMeeting":null,"LastUpdatedDate":"2020-06-29T15:50:47.227+03:00"}
{"Id":159487,"Number":403,"KnessetNum":9,"Name":"ישיבת מליאה בתאריך 05/01/1981 בשעה 16:01","StartDate":"1981-01-05T16:01:00+02:00","FinishDate":"1981-01-05T18:28:00+02:00","IsSpecialMeeting":null,"LastUpdatedDate":"2020-06-29T15:26:12.117+03:00"}
{"Id":159488,"Number":404,"KnessetNum":9,"Name":"ישיבת מליאה בתאריך 06/01/1981 בשעה 16:02","StartDate":"1981-01-06T16:02:00+02:00","FinishDate":"1981-01-06T19:36:00+02:00","IsSpecialMeeting":null,"LastUpdatedDate":"2020-06-29T13:48:19.38+03:00"}
{"Id":159489,"Number":406,"KnessetNum":9,"Name":"ישיבת מליאה בתאריך 12/01/1981 בשעה 16:01","StartDate":"1981-01-12T16:01:00+02:00","FinishDate":"1981-01-12T18:46:00+02:00","IsSpecialMeeting":null,"LastUpdatedDate":"2020-06-29T11:11:18.437+03:00"}
{"Id":159490,"Number":407,"KnessetNum":9,"Name":"ישיבת מליאה בתאריך 13/01/1981 בשעה 18:02","StartDate":"1981-01-13T18:02:00+02:00","FinishDate":"1981-01-13T19:15:00+02:00","IsSpecialMeeting":null,"LastUpdatedDate":"2020-06-29T10:48:12.073+03:00"}
{"Id":159491,"Number":408,"KnessetNum":9,"Name":"ישיבת מליאה בתאריך 14/01/1981 בשעה 11:04","StartDate":"1981-01-14T11:04:00+02:00","FinishDate":"1981-01-14T13:25:00+02:00","IsSpecialMeeting":null,"LastUpdatedDate":"2020-05-24T16:24:03.787+03:00"}
{"Id":159492,"Number":409,"KnessetNum":9,"Name":"ישיבת מליאה בתאריך 19/01/1981 בשעה 16:02","StartDate":"1981-01-19T16:02:00+02:00","FinishDate":"1981-01-19T18:38:00+02:00","IsSpecialMeeting":null,"LastUpdatedDate":"2020-06-25T13:53:19.49+03:00"}
{"Id":159493,"Number":411,"KnessetNum":9,"Name":"ישיבת מליאה בתאריך 21/01/1981 בשעה 11:01","StartDate":"1981-01-21T11:01:00+02:00","FinishDate":"1981-01-21T13:44:00+02:00","IsSpecialMeeting":null,"LastUpdatedDate":"2020-06-25T13:23:58.563+03:00"}
{"Id":159494,"Number":412,"KnessetNum":9,"Name":"ישיבת מליאה בתאריך 26/01/1981 בשעה 16:01","StartDate":"1981-01-26T16:01:00+02:00","FinishDate":"1981-01-26T19:43:00+02:00","IsSpecialMeeting":null,"LastUpdatedDate":"2020-06-25T12:00:11.717+03:00"}
{"Id":159495,"Number":413,"KnessetNum":9,"Name":"ישיבת מליאה בתאריך 27/01/1981 בשעה 16:02","StartDate":"1981-01-27T16:02:00+02:00","FinishDate":"1981-01-27T18:15:00+02:00","IsSpecialMeeting":null,"LastUpdatedDate":"2020-06-25T09:31:33.577+03:00"}
{"Id":159496,"Number":414,"KnessetNum":9,"Name":"ישיבת מליאה בתאריך 28/01/1981 בשעה 11:01","StartDate":"1981-01-28T11:01:00+02:00","FinishDate":"1981-01-28T16:54:00+02:00","IsSpecialMeeting":null,"LastUpdatedDate":"2020-06-23T15:41:38.43+03:00"}
{"Id":159520,"Number":440,"KnessetNum":9,"Name":"ישיבת מליאה בתאריך 31/03/1981 בשעה 09:02","StartDate":"1981-03-31T09:02:00+02:00","FinishDate":"1981-03-31T17:33:00+02:00","IsSpecialMeeting":null,"LastUpdatedDate":"2020-06-11T15:38:49.663+03:00"}
{"Id":159530,"Number":6,"KnessetNum":10,"Name":"ישיבת מליאה בתאריך 04/08/1981 בשעה 16:02","StartDate":"1981-08-04T16:02:00+03:00","FinishDate":"1981-08-04T17:27:00+03:00","IsSpecialMeeting":null,"LastUpdatedDate":"2023-02-23T10:41:47.953+02:00"}
{"Id":159531,"Number":8,"KnessetNum":10,"Name":"ישיבת מליאה בתאריך 10/08/1981 בשעה 16:00","StartDate":"1981-08-10T16:00:00+03:00","FinishDate":"1981-08-10T18:52:00+03:00","IsSpecialMeeting":null,"LastUpdatedDate":"2023-02-23T11:27:25.807+02:00"}
{"Id":159534,"Number":11,"KnessetNum":10,"Name":"ישיבת מליאה בתאריך 17/08/1981 בשעה 16:05","StartDate":"1981-08-17T16:05:00+03:00","FinishDate":"1981-08-17T18:59:00+03:00","IsSpecialMeeting":null,"LastUpdatedDate":"2023-02-26T09:32:02.553+02:00"}
{"Id":159536,"Number":14,"KnessetNum":10,"Name":"ישיבת מליאה בתאריך 02/11/1981 בשעה 16:04","StartDate":"1981-11-02T16:04:00+02:00","FinishDate":"1981-11-02T21:02:00+02:00","IsSpecialMeeting":null,"LastUpdatedDate":"2023-03-01T10:18:08.883+02:00"}
{"Id":159546,"Number":27,"KnessetNum":10,"Name":"ישיבת מליאה בתאריך 01/12/1981 בשעה 16:04","StartDate":"1981-12-01T16:04:00+02:00","FinishDate":"1981-12-01T20:08:00+02:00","IsSpecialMeeting":null,"LastUpdatedDate":"2023-03-16T08:42:44.897+02:00"}
{"Id":159548,"Number":31,"KnessetNum":10,"Name":"ישיבת מליאה בתאריך 09/12/1981 בשעה 11:03","StartDate":"1981-12-09T11:03:00+02:00","FinishDate":"1981-12-09T14:27:00+02:00","IsSpecialMeeting":null,"LastUpdatedDate":"2023-03-20T11:17:23.65+02:00"}
{"Id":159549,"Number":32,"KnessetNum":10,"Name":"ישיבת מליאה בתאריך 14/12/1981 בשעה 17:22","StartDate":"1981-12-14T17:22:00+02:00","FinishDate":"1981-12-14T23:15:00+02:00","IsSpecialMeeting":null,"LastUpdatedDate":"2023-03-20T11:30:47.92+02:00"}
{"Id":159550,"Number":33,"KnessetNum":10,"Name":"ישיבת מליאה בתאריך 15/12/1981 בשעה 16:07","StartDate":"1981-12-15T16:07:00+02:00","FinishDate":"1981-12-15T17:26:00+02:00","IsSpecialMeeting":null,"LastUpdatedDate":"2023-03-20T12:06:50.69+02:00"}
{"Id":159551,"Number":34,"KnessetNum":10,"Name":"ישיבת מליאה בתאריך 16/12/1981 בשעה 11:03","StartDate":"1981-12-16T11:03:00+02:00","FinishDate":"1981-12-16T14:48:00+02:00","IsSpecialMeeting":null,"LastUpdatedDate":"2023-03-21T08:26:41.687+02:00"}
{"Id":159553,"Number":35,"KnessetNum":10,"Name":"ישיבת מליאה בתאריך 22/12/1981 בשעה 16:04","StartDate":"1981-12-22T16:04:00+02:00","FinishDate":"1981-12-22T18:36:00+02:00","IsSpecialMeeting":null,"LastUpdatedDate":"2023-03-20T16:22:01.467+02:00"}
{"Id":159554,"Number":36,"KnessetNum":10,"Name":"ישיבת מליאה בתאריך 23/12/1981 בשעה 11:07","StartDate":"1981-12-23T11:07:00+02:00","FinishDate":"1981-12-23T15:08:00+02:00","IsSpecialMeeting":null,"LastUpdatedDate":"2023-03-21T10:58:27.42+02:00"}
{"Id":159555,"Number":37,"KnessetNum":10,"Name":"ישיבת מליאה בתאריך 28/12/1981 בשעה 16:10","StartDate":"1981-12-28T16:10:00+02:00","FinishDate":"1981-12-28T19:27:00+02:00","IsSpecialMeeting":null,"LastUpdatedDate":"2023-03-21T11:21:50.593+02:00"}
{"Id":159557,"Number":39,"KnessetNum":10,"Name":"ישיבת מליאה בתאריך 30/12/1981 בשעה 11:04","StartDate":"1981-12-30T11:04:00+02:00","FinishDate":"1981-12-30T14:50:00+02:00","IsSpecialMeeting":null,"LastUpdatedDate":"2023-03-21T15:21:51.007+02:00"}
{"Id":159560,"Number":42,"KnessetNum":10,"Name":"ישיבת מליאה בתאריך 06/01/1982 בשעה 11:04","StartDate":"1982-01-06T11:04:00+02:00","FinishDate":"1982-01-06T14:33:00+02:00","IsSpecialMeeting":null,"LastUpdatedDate":"2024-02-12T09:35:44.523+02:00"}
{"Id":159562,"Number":44,"KnessetNum":10,"Name":"ישיבת מליאה בתאריך 12/01/1982 בשעה 16:01","StartDate":"1982-01-12T16:01:00+02:00","FinishDate":"1982-01-12T18:23:00+02:00","IsSpecialMeeting":null,"LastUpdatedDate":"2023-11-28T09:51:41.69+02:00"}
{"Id":159564,"Number":46,"KnessetNum":10,"Name":"ישיבת מליאה בתאריך 18/01/1982 בשעה 17:03","StartDate":"1982-01-18T17:03:00+02:00","FinishDate":"1982-01-18T18:45:00+02:00","IsSpecialMeeting":null,"LastUpdatedDate":"2023-03-27T15:30:15.227+03:00"}
{"Id":159565,"Number":47,"KnessetNum":10,"Name":"ישיבת מליאה בתאריך 19/01/1982 בשעה 16:04","StartDate":"1982-01-19T16:04:00+02:00","FinishDate":"1982-01-19T19:02:00+02:00","IsSpecialMeeting":null,"LastUpdatedDate":"2023-03-27T15:32:55.1+03:00"}
{"Id":159566,"Number":49,"KnessetNum":10,"Name":"ישיבת מליאה בתאריך 25/01/1982 בשעה 16:04","StartDate":"1982-01-25T16:04:00+02:00","FinishDate":"1982-01-25T19:07:00+02:00","IsSpecialMeeting":null,"LastUpdatedDate":"2023-03-30T08:25:28.047+03:00"}
{"Id":159567,"Number":50,"KnessetNum":10,"Name":"ישיבת מליאה בתאריך 26/01/1982 בשעה 16:04","StartDate":"1982-01-26T16:04:00+02:00","FinishDate":"1982-01-26T19:31:00+02:00","IsSpecialMeeting":null,"LastUpdatedDate":"2023-03-30T09:57:18.89+03:00"}
{"Id":159569,"Number":52,"KnessetNum":10,"Name":"ישיבת מליאה בתאריך 01/02/1982 בשעה 16:06","StartDate":"1982-02-01T16:06:00+02:00","FinishDate":"1982-02-01T19:10:00+02:00","IsSpecialMeeting":null,"LastUpdatedDate":"2023-04-02T10:38:09.72+03:00"}
{"Id":159570,"Number":53,"KnessetNum":10,"Name":"ישיבת מליאה בתאריך 02/02/1982 בשעה 16:01","StartDate":"1982-02-02T16:01:00+02:00","FinishDate":"1982-02-02T18:42:00+02:00","IsSpecialMeeting":null,"LastUpdatedDate":"2023-04-02T11:14:17.723+03:00"}
{"Id":159574,"Number":58,"KnessetNum":10,"Name":"ישיבת מליאה בתאריך 15/02/1982 בשעה 16:03","StartDate":"1982-02-15T16:03:00+02:00","FinishDate":"1982-02-15T18:27:00+02:00","IsSpecialMeeting":null,"LastUpdatedDate":"2023-04-17T08:39:21.957+03:00"}
{"Id":159588,"Number":75,"KnessetNum":10,"Name":"ישיבת מליאה בתאריך 24/03/1982 בשעה 11:01","StartDate":"1982-03-24T11:01:00+02:00","FinishDate":"1982-03-24T17:22:00+02:00","IsSpecialMeeting":null,"LastUpdatedDate":"2023-05-01T08:20:08.95+03:00"}
{"Id":159589,"Number":76,"KnessetNum":10,"Name":"ישיבת מליאה בתאריך 29/03/1982 בשעה 16:06","StartDate":"1982-03-29T16:06:00+02:00","FinishDate":"1982-03-29T21:56:00+02:00","IsSpecialMeeting":null,"LastUpdatedDate":"2023-05-01T09:47:21.587+03:00"}
{"Id":159590,"Number":77,"KnessetNum":10,"Name":"ישיבת מליאה בתאריך 30/03/1982 בשעה 16:06","StartDate":"1982-03-30T16:06:00+02:00","FinishDate":"1982-03-30T23:05:00+02:00","IsSpecialMeeting":null,"LastUpdatedDate":"2024-01-29T12:46:06.967+02:00"}
{"Id":159591,"Number":78,"KnessetNum":10,"Name":"ישיבת מליאה בתאריך 31/03/1982 בשעה 11:05","StartDate":"1982-03-31T11:05:00+02:00","FinishDate":"1982-04-01T03:43:00+02:00","IsSpecialMeeting":null,"LastUpdatedDate":"2024-01-29T12:49:21.39+02:00"}
{"Id":159593,"Number":82,"KnessetNum":10,"Name":"ישיבת מליאה בתאריך 10/05/1982 בשעה 16:06","StartDate":"1982-05-10T16:06:00+03:00","FinishDate":"1982-05-10T21:11:00+03:00","IsSpecialMeeting":null,"LastUpdatedDate":"2023-05-02T15:24:46.643+03:00"}
{"Id":159594,"Number":83,"KnessetNum":10,"Name":"ישיבת מליאה בתאריך 11/05/1982 בשעה 16:04","StartDate":"1982-05-11T16:04:00+03:00","FinishDate":"1982-05-11T21:58:00+03:00","IsSpecialMeeting":null,"LastUpdatedDate":"2023-05-02T16:35:16.02+03:00"}
{"Id":159595,"Number":85,"KnessetNum":10,"Name":"ישיבת מליאה בתאריך 17/05/1982 בשעה 16:06","StartDate":"1982-05-17T16:06:00+03:00","FinishDate":"1982-05-17T19:06:00+03:00","IsSpecialMeeting":null,"LastUpdatedDate":"2023-05-03T09:46:18.737+03:00"}
{"Id":159596,"Number":87,"KnessetNum":10,"Name":"ישיבת מליאה בתאריך 19/05/1982 בשעה 11:07","StartDate":"1982-05-19T11:07:00+03:00","FinishDate":"1982-05-19T16:48:00+03:00","IsSpecialMeeting":null,"LastUpdatedDate":"2023-05-03T10:11:39.17+03:00"}
{"Id":159597,"Number":88,"KnessetNum":10,"Name":"ישיבת מליאה בתאריך 24/05/1982 בשעה 16:05","StartDate":"1982-05-24T16:05:00+03:00","FinishDate":"1982-05-24T20:41:00+03:00","IsSpecialMeeting":null,"LastUpdatedDate":"2023-05-03T10:44:49.177+03:00"}
{"Id":159598,"Number":90,"KnessetNum":10,"Name":"ישיבת מליאה בתאריך 26/05/1982 בשעה 11:02","StartDate":"1982-05-26T11:02:00+03:00","FinishDate":"1982-05-26T15:41:00+03:00","IsSpecialMeeting":null,"LastUpdatedDate":"2023-05-03T14:05:29.663+03:00"}
{"Id":159599,"Number":92,"KnessetNum":10,"Name":"ישיבת מליאה בתאריך 01/06/1982 בשעה 16:03","StartDate":"1982-06-01T16:03:00+03:00","FinishDate":"1982-06-01T20:10:00+03:00","IsSpecialMeeting":null,"LastUpdatedDate":"2024-01-29T12:55:26.957+02:00"}
{"Id":159600,"Number":93,"KnessetNum":10,"Name":"ישיבת מליאה בתאריך 02/06/1982 בשעה 11:06","StartDate":"1982-06-02T11:06:00+03:00","FinishDate":"1982-06-02T17:50:00+03:00","IsSpecialMeeting":null,"LastUpdatedDate":"2023-05-07T11:17:51.507+03:00"}
{"Id":159601,"Number":96,"KnessetNum":10,"Name":"ישיבת מליאה בתאריך 14/06/1982 בשעה 16:05","StartDate":"1982-06-14T16:05:00+03:00","FinishDate":"1982-06-14T19:17:00+03:00","IsSpecialMeeting":null,"LastUpdatedDate":"2023-05-07T12:37:53.067+03:00"}
{"Id":159602,"Number":98,"KnessetNum":10,"Name":"ישיבת מליאה בתאריך 16/06/1982 בשעה 11:02","StartDate":"1982-06-16T11:02:00+03:00","FinishDate":"1982-06-16T12:19:00+03:00","IsSpecialMeeting":null,"LastUpdatedDate":"2023-05-09T09:04:57.263+03:00"}
{"Id":159603,"Number":99,"KnessetNum":10,"Name":"ישיבת מליאה בתאריך 21/06/1982 בשעה 16:03","StartDate":"1982-06-21T16:03:00+03:00","FinishDate":"1982-06-21T18:49:00+03:00","IsSpecialMeeting":null,"LastUpdatedDate":"2023-05-09T09:09:18.69+03:00"}
{"Id":159604,"Number":100,"KnessetNum":10,"Name":"ישיבת מליאה בתאריך 22/06/1982 בשעה 16:04","StartDate":"1982-06-22T16:04:00+03:00","FinishDate":"1982-06-22T20:47:00+03:00","IsSpecialMeeting":null,"LastUpdatedDate":"2023-05-09T11:35:26.183+03:00"}
{"Id":159605,"Number":104,"KnessetNum":10,"Name":"ישיבת מליאה בתאריך 30/06/1982 בשעה 09:03","StartDate":"1982-06-30T09:03:00+03:00","FinishDate":"1982-06-30T18:04:00+03:00","IsSpecialMeeting":null,"LastUpdatedDate":"2023-05-09T14:57:57.427+03:00"}
{"Id":159607,"Number":106,"KnessetNum":10,"Name":"ישיבת מליאה בתאריך 06/07/1982 בשעה 16:02","StartDate":"1982-07-06T16:02:00+03:00","FinishDate":"1982-07-06T18:28:00+03:00","IsSpecialMeeting":null,"LastUpdatedDate":"2024-02-22T14:48:54.223+02:00"}
{"Id":159608,"Number":107,"KnessetNum":10,"Name":"ישיבת מליאה בתאריך 07/07/1982 בשעה 11:02","StartDate":"1982-07-07T11:02:00+03:00","FinishDate":"1982-07-07T13:22:00+03:00","IsSpecialMeeting":null,"LastUpdatedDate":"2023-05-10T10:34:51.747+03:00"}
{"Id":159610,"Number":110,"KnessetNum":10,"Name":"ישיבת מליאה בתאריך 14/07/1982 בשעה 11:01","StartDate":"1982-07-14T11:01:00+03:00","FinishDate":"1982-07-14T14:33:00+03:00","IsSpecialMeeting":null,"LastUpdatedDate":"2023-05-11T10:33:00.103+03:00"}
{"Id":159612,"Number":112,"KnessetNum":10,"Name":"ישיבת מליאה בתאריך 20/07/1982 בשעה 16:04","StartDate":"1982-07-20T16:04:00+03:00","FinishDate":"1982-07-21T12:24:00+03:00","IsSpecialMeeting":null,"LastUpdatedDate":"2025-01-29T12:46:24.997+02:00"}
{"Id":159613,"Number":113,"KnessetNum":10,"Name":"ישיבת מליאה בתאריך 21/07/1982 בשעה 11:04","StartDate":"1982-07-21T11:04:00+03:00","FinishDate":"1982-07-21T16:12:00+03:00","IsSpecialMeeting":null,"LastUpdatedDate":"2023-05-14T09:06:53.693+03:00"}
{"Id":159614,"Number":114,"KnessetNum":10,"Name":"ישיבת מליאה בתאריך 26/07/1982 בשעה 16:04","StartDate":"1982-07-26T16:04:00+03:00","FinishDate":"1982-07-26T21:28:00+03:00","IsSpecialMeeting":null,"LastUpdatedDate":"2023-05-14T12:51:54.473+03:00"}
{"Id":159615,"Number":115,"KnessetNum":10,"Name":"ישיבת מליאה בתאריך 27/07/1982 בשעה 16:03","StartDate":"1982-07-27T16:03:00+03:00","FinishDate":"1982-07-27T22:03:00+03:00","IsSpecialMeeting":null,"LastUpdatedDate":"2023-05-14T13:30:50.58+03:00"}
{"Id":159616,"Number":116,"KnessetNum":10,"Name":"ישיבת מליאה בתאריך 28/07/1982 בשעה 09:10","StartDate":"1982-07-28T09:10:00+03:00","FinishDate":"1982-07-28T13:20:00+03:00","IsSpecialMeeting":null,"LastUpdatedDate":"2024-01-29T13:08:32.097+02:00"}
{"Id":159617,"Number":117,"KnessetNum":10,"Name":"ישיבת מליאה בתאריך 12/08/1982 בשעה 10:10","StartDate":"1982-08-12T10:10:00+03:00","FinishDate":"1982-08-12T13:31:00+03:00","IsSpecialMeeting":null,"LastUpdatedDate":"2022-03-01T17:45:24.21+02:00"}
{"Id":159618,"Number":119,"KnessetNum":10,"Name":"ישיבת מליאה בתאריך 18/08/1982 בשעה 11:06","StartDate":"1982-08-18T11:06:00+03:00","FinishDate":"1982-08-18T14:35:00+03:00","IsSpecialMeeting":null,"LastUpdatedDate":"2023-05-18T08:15:22.443+03:00"}
{"Id":159620,"Number":120,"KnessetNum":10,"Name":"ישיבת מליאה בתאריך 26/08/1982 בשעה 10:22","StartDate":"1982-08-26T10:22:00+03:00","FinishDate":"1982-08-26T13:27:00+03:00","IsSpecialMeeting":null,"LastUpdatedDate":"2023-05-18T08:44:35.653+03:00"}
{"Id":159621,"Number":125,"KnessetNum":10,"Name":"ישיבת מליאה בתאריך 20/10/1982 בשעה 11:07","StartDate":"1982-10-20T11:07:00+02:00","FinishDate":"1982-10-20T14:50:00+02:00","IsSpecialMeeting":null,"LastUpdatedDate":"2023-05-21T08:01:17.547+03:00"}
{"Id":159622,"Number":126,"KnessetNum":10,"Name":"ישיבת מליאה בתאריך 25/10/1982 בשעה 16:05","StartDate":"1982-10-25T16:05:00+02:00","FinishDate":"1982-10-25T18:34:00+02:00","IsSpecialMeeting":null,"LastUpdatedDate":"2023-05-21T08:49:01.073+03:00"}
{"Id":159623,"Number":127,"KnessetNum":10,"Name":"ישיבת מליאה בתאריך 26/10/1982 בשעה 16:05","StartDate":"1982-10-26T16:05:00+02:00","FinishDate":"1982-10-26T20:53:00+02:00","IsSpecialMeeting":null,"LastUpdatedDate":"2023-06-26T12:02:43.537+03:00"}
{"Id":159628,"Number":133,"KnessetNum":10,"Name":"ישיבת מליאה בתאריך 09/11/1982 בשעה 16:03","StartDate":"1982-11-09T16:03:00+02:00","FinishDate":"1982-11-09T18:25:00+02:00","IsSpecialMeeting":null,"LastUpdatedDate":"2023-05-22T09:05:25.067+03:00"}
{"Id":159650,"Number":162,"KnessetNum":10,"Name":"ישיבת מליאה בתאריך 17/01/1983 בשעה 16:01","StartDate":"1983-01-17T16:01:00+02:00","FinishDate":"1983-01-17T17:44:00+02:00","IsSpecialMeeting":null,"LastUpdatedDate":"2023-06-06T11:30:23.367+03:00"}
{"Id":159656,"Number":168,"KnessetNum":10,"Name":"ישיבת מליאה בתאריך 31/01/1983 בשעה 16:04","StartDate":"1983-01-31T16:04:00+02:00","FinishDate":"1983-01-31T17:58:00+02:00","IsSpecialMeeting":null,"LastUpdatedDate":"2023-06-08T12:10:28.71+03:00"}
{"Id":159657,"Number":171,"KnessetNum":10,"Name":"ישיבת מליאה בתאריך 07/02/1983 בשעה 16:03","StartDate":"1983-02-07T16:03:00+02:00","FinishDate":"1983-02-07T20:40:00+02:00","IsSpecialMeeting":null,"LastUpdatedDate":"2023-06-12T10:13:08.507+03:00"}
{"Id":159667,"Number":186,"KnessetNum":10,"Name":"ישיבת מליאה בתאריך 09/03/1983 בשעה 11:03","StartDate":"1983-03-09T11:03:00+02:00","FinishDate":"1983-03-09T16:01:00+02:00","IsSpecialMeeting":null,"LastUpdatedDate":"2023-06-20T11:29:42.91+03:00"}
{"Id":159672,"Number":192,"KnessetNum":10,"Name":"ישיבת מליאה בתאריך 22/03/1983 בשעה 16:05","StartDate":"1983-03-22T16:05:00+02:00","FinishDate":"1983-03-22T17:22:00+02:00","IsSpecialMeeting":null,"LastUpdatedDate":"2023-06-20T15:50:18.703+03:00"}
{"Id":159677,"Number":200,"KnessetNum":10,"Name":"ישיבת מליאה בתאריך 10/05/1983 בשעה 16:02","StartDate":"1983-05-10T16:02:00+03:00","FinishDate":"1983-05-10T20:15:00+03:00","IsSpecialMeeting":null,"LastUpdatedDate":"2024-04-17T10:22:37.21+03:00"}
{"Id":159679,"Number":202,"KnessetNum":10,"Name":"ישיבת מליאה בתאריך 16/05/1983 בשעה 10:03","StartDate":"1983-05-16T10:03:00+03:00","FinishDate":"1983-05-16T19:03:00+03:00","IsSpecialMeeting":null,"LastUpdatedDate":"2023-06-26T10:29:29.093+03:00"}
{"Id":159680,"Number":203,"KnessetNum":10,"Name":"ישיבת מליאה בתאריך 23/05/1983 בשעה 16:04","StartDate":"1983-05-23T16:04:00+03:00","FinishDate":"1983-05-23T21:01:00+03:00","IsSpecialMeeting":null,"LastUpdatedDate":"2023-06-26T10:49:48.007+03:00"}
{"Id":159681,"Number":205,"KnessetNum":10,"Name":"ישיבת מליאה בתאריך 25/05/1983 בשעה 11:05","StartDate":"1983-05-25T11:05:00+03:00","FinishDate":"1983-05-25T16:08:00+03:00","IsSpecialMeeting":null,"LastUpdatedDate":"2024-04-17T12:49:27.153+03:00"}
{"Id":159683,"Number":208,"KnessetNum":10,"Name":"ישיבת מליאה בתאריך 01/06/1983 בשעה 11:02","StartDate":"1983-06-01T11:02:00+03:00","FinishDate":"1983-06-01T17:05:00+03:00","IsSpecialMeeting":null,"LastUpdatedDate":"2023-06-27T13:31:20.607+03:00"}
{"Id":159684,"Number":209,"KnessetNum":10,"Name":"ישיבת מליאה בתאריך 06/06/1983 בשעה 16:03","StartDate":"1983-06-06T16:03:00+03:00","FinishDate":"1983-06-06T18:19:00+03:00","IsSpecialMeeting":null,"LastUpdatedDate":"2023-06-27T14:07:16.117+03:00"}
{"Id":159691,"Number":220,"KnessetNum":10,"Name":"ישיבת מליאה בתאריך 29/06/1983 בשעה 11:02","StartDate":"1983-06-29T11:02:00+03:00","FinishDate":"1983-06-29T15:21:00+03:00","IsSpecialMeeting":null,"LastUpdatedDate":"2023-07-03T14:14:58.237+03:00"}
{"Id":159692,"Number":221,"KnessetNum":10,"Name":"ישיבת מליאה בתאריך 04/07/1983 בשעה 16:00","StartDate":"1983-07-04T16:00:00+03:00","FinishDate":"1983-07-04T18:53:00+03:00","IsSpecialMeeting":null,"LastUpdatedDate":"2023-07-03T17:03:28.133+03:00"}
{"Id":159700,"Number":230,"KnessetNum":10,"Name":"ישיבת מליאה בתאריך 26/07/1983 בשעה 11:03","StartDate":"1983-07-26T11:03:00+03:00","FinishDate":"1983-07-26T21:09:00+03:00","IsSpecialMeeting":null,"LastUpdatedDate":"2025-05-21T11:17:42.273+03:00"}
{"Id":159706,"Number":236,"KnessetNum":10,"Name":"ישיבת מליאה בתאריך 19/10/1983 בשעה 11:04","StartDate":"1983-10-19T11:04:00+02:00","FinishDate":"1983-10-19T14:44:00+02:00","IsSpecialMeeting":null,"LastUpdatedDate":"2023-07-10T11:52:48.9+03:00"}
{"Id":159715,"Number":247,"KnessetNum":10,"Name":"ישיבת מליאה בתאריך 16/11/1983 בשעה 11:03","StartDate":"1983-11-16T11:03:00+02:00","FinishDate":"1983-11-16T14:00:00+02:00","IsSpecialMeeting":null,"LastUpdatedDate":"2023-07-16T09:09:06.783+03:00"}
{"Id":159718,"Number":250,"KnessetNum":10,"Name":"ישיבת מליאה בתאריך 23/11/1983 בשעה 11:02","StartDate":"1983-11-23T11:02:00+02:00","FinishDate":"1983-11-23T15:35:00+02:00","IsSpecialMeeting":null,"LastUpdatedDate":"2023-07-18T08:41:18.627+03:00"}
{"Id":159729,"Number":261,"KnessetNum":10,"Name":"ישיבת מליאה בתאריך 20/12/1983 בשעה 16:04","StartDate":"1983-12-20T16:04:00+02:00","FinishDate":"1983-12-20T21:35:00+02:00","IsSpecialMeeting":null,"LastUpdatedDate":"2023-07-24T12:17:55.783+03:00"}
{"Id":159730,"Number":262,"KnessetNum":10,"Name":"ישיבת מליאה בתאריך 21/12/1983 בשעה 11:01","StartDate":"1983-12-21T11:01:00+02:00","FinishDate":"1983-12-21T16:13:00+02:00","IsSpecialMeeting":null,"LastUpdatedDate":"2024-02-05T09:11:50.587+02:00"}
{"Id":159731,"Number":263,"KnessetNum":10,"Name":"ישיבת מליאה בתאריך 26/12/1983 בשעה 16:02","StartDate":"1983-12-26T16:02:00+02:00","FinishDate":"1983-12-26T18:14:00+02:00","IsSpecialMeeting":null,"LastUpdatedDate":"2023-07-24T16:55:23.76+03:00"}
{"Id":159732,"Number":264,"KnessetNum":10,"Name":"ישיבת מליאה בתאריך 27/12/1983 בשעה 16:00","StartDate":"1983-12-27T16:00:00+02:00","FinishDate":"1983-12-27T22:31:00+02:00","IsSpecialMeeting":null,"LastUpdatedDate":"2023-07-25T07:47:47.127+03:00"}
{"Id":159734,"Number":266,"KnessetNum":10,"Name":"ישיבת מליאה בתאריך 02/01/1984 בשעה 16:03","StartDate":"1984-01-02T16:03:00+02:00","FinishDate":"1984-01-02T19:23:00+02:00","IsSpecialMeeting":null,"LastUpdatedDate":"2023-07-25T10:45:13.377+03:00"}
{"Id":159735,"Number":267,"KnessetNum":10,"Name":"ישיבת מליאה בתאריך 03/01/1984 בשעה 16:04","StartDate":"1984-01-03T16:04:00+02:00","FinishDate":"1984-01-03T21:07:00+02:00","IsSpecialMeeting":null,"LastUpdatedDate":"2023-07-25T11:33:07.233+03:00"}
{"Id":159736,"Number":269,"KnessetNum":10,"Name":"ישיבת מליאה בתאריך 09/01/1984 בשעה 16:04","StartDate":"1984-01-09T16:04:00+02:00","FinishDate":"1984-01-09T18:31:00+02:00","IsSpecialMeeting":null,"LastUpdatedDate":"2023-07-25T13:46:48.303+03:00"}
{"Id":159739,"Number":272,"KnessetNum":10,"Name":"ישיבת מליאה בתאריך 16/01/1984 בשעה 16:02","StartDate":"1984-01-16T16:02:00+02:00","FinishDate":"1984-01-16T19:36:00+02:00","IsSpecialMeeting":null,"LastUpdatedDate":"2023-07-30T07:35:06.293+03:00"}
{"Id":159742,"Number":276,"KnessetNum":10,"Name":"ישיבת מליאה בתאריך 24/01/1984 בשעה 16:04","StartDate":"1984-01-24T16:04:00+02:00","FinishDate":"1984-01-24T20:02:00+02:00","IsSpecialMeeting":null,"LastUpdatedDate":"2023-07-26T11:52:02.357+03:00"}
{"Id":159746,"Number":279,"KnessetNum":10,"Name":"ישיבת מליאה בתאריך 31/01/1984 בשעה 16:00","StartDate":"1984-01-31T16:00:00+02:00","FinishDate":"1984-01-31T19:12:00+02:00","IsSpecialMeeting":null,"LastUpdatedDate":"2023-07-26T14:01:09.587+03:00"}
{"Id":159747,"Number":280,"KnessetNum":10,"Name":"ישיבת מליאה בתאריך 01/02/1984 בשעה 11:03","StartDate":"1984-02-01T11:03:00+02:00","FinishDate":"1984-02-01T16:50:00+02:00","IsSpecialMeeting":null,"LastUpdatedDate":"2023-07-30T09:48:14.91+03:00"}
{"Id":159750,"Number":282,"KnessetNum":10,"Name":"ישיבת מליאה בתאריך 07/02/1984 בשעה 16:03","StartDate":"1984-02-07T16:03:00+02:00","FinishDate":null,"IsSpecialMeeting":null,"LastUpdatedDate":"2023-07-30T10:26:27.463+03:00"}
{"Id":159751,"Number":284,"KnessetNum":10,"Name":"ישיבת מליאה בתאריך 13/02/1984 בשעה 16:03","StartDate":"1984-02-13T16:03:00+02:00","FinishDate":"1984-02-13T18:48:00+02:00","IsSpecialMeeting":null,"LastUpdatedDate":"2024-02-05T10:47:50.937+02:00"}
{"Id":159757,"Number":291,"KnessetNum":10,"Name":"ישיבת מליאה בתאריך 28/02/1984 בשעה 16:03","StartDate":"1984-02-28T16:03:00+02:00","FinishDate":"1984-02-28T19:36:00+02:00","IsSpecialMeeting":null,"LastUpdatedDate":"2023-07-31T14:05:57.697+03:00"}
{"Id":159759,"Number":293,"KnessetNum":10,"Name":"ישיבת מליאה בתאריך 05/03/1984 בשעה 16:03","StartDate":"1984-03-05T16:03:00+02:00","FinishDate":"1984-03-05T19:13:00+02:00","IsSpecialMeeting":null,"LastUpdatedDate":"2025-05-07T14:39:58.833+03:00"}
{"Id":159760,"Number":294,"KnessetNum":10,"Name":"ישיבת מליאה בתאריך 06/03/1984 בשעה 16:02","StartDate":"1984-03-06T16:02:00+02:00","FinishDate":"1984-03-06T20:41:00+02:00","IsSpecialMeeting":null,"LastUpdatedDate":"2023-08-01T11:35:10.22+03:00"}
{"Id":159761,"Number":295,"KnessetNum":10,"Name":"ישיבת מליאה בתאריך 07/03/1984 בשעה 11:03","StartDate":"1984-03-07T11:03:00+02:00","FinishDate":"1984-03-07T17:31:00+02:00","IsSpecialMeeting":null,"LastUpdatedDate":"2024-02-05T11:58:26.72+02:00"}
{"Id":159762,"Number":296,"KnessetNum":10,"Name":"ישיבת מליאה בתאריך 12/03/1984 בשעה 12:00","StartDate":"1984-03-12T12:00:00+02:00","FinishDate":"1984-03-12T20:32:00+02:00","IsSpecialMeeting":null,"LastUpdatedDate":"2023-08-07T07:35:57.46+03:00"}
{"Id":159763,"Number":297,"KnessetNum":10,"Name":"ישיבת מליאה בתאריך 13/03/1984 בשעה 16:02","StartDate":"1984-03-13T16:02:00+02:00","FinishDate":"1984-03-13T20:36:00+02:00","IsSpecialMeeting":null,"LastUpdatedDate":"2024-08-12T08:34:10.273+03:00"}
{"Id":159771,"Number":305,"KnessetNum":10,"Name":"ישיבת מליאה בתאריך 04/04/1984 בשעה 11:04","StartDate":"1984-04-04T11:04:00+03:00","FinishDate":"1984-04-04T16:00:00+03:00","IsSpecialMeeting":null,"LastUpdatedDate":"2023-08-09T11:50:21.393+03:00"}
{"Id":159775,"Number":308,"KnessetNum":10,"Name":"ישיבת מליאה בתאריך 16/05/1984 בשעה 11:01","StartDate":"1984-05-16T11:01:00+03:00","FinishDate":"1984-05-16T12:27:00+03:00","IsSpecialMeeting":null,"LastUpdatedDate":"2023-08-09T13:02:16.783+03:00"}
{"Id":159776,"Number":309,"KnessetNum":10,"Name":"ישיבת מליאה בתאריך 21/05/1984 בשעה 16:02","StartDate":"1984-05-21T16:02:00+03:00","FinishDate":"1984-05-21T19:44:00+03:00","IsSpecialMeeting":null,"LastUpdatedDate":"2023-08-09T13:20:03.09+03:00"}
{"Id":159777,"Number":310,"KnessetNum":10,"Name":"ישיבת מליאה בתאריך 22/05/1984 בשעה 16:00","StartDate":"1984-05-22T16:00:00+03:00","FinishDate":"1984-05-22T19:09:00+03:00","IsSpecialMeeting":null,"LastUpdatedDate":"2023-08-10T08:25:15.183+03:00"}
{"Id":159778,"Number":311,"KnessetNum":10,"Name":"ישיבת מליאה בתאריך 23/05/1984 בשעה 11:04","StartDate":"1984-05-23T11:04:00+03:00","FinishDate":"1984-05-23T14:16:00+03:00","IsSpecialMeeting":null,"LastUpdatedDate":"2023-08-10T10:27:33.343+03:00"}
{"Id":159779,"Number":312,"KnessetNum":10,"Name":"ישיבת מליאה בתאריך 28/05/1984 בשעה 16:03","StartDate":"1984-05-28T16:03:00+03:00","FinishDate":"1984-05-28T18:49:00+03:00","IsSpecialMeeting":null,"LastUpdatedDate":"2023-08-10T10:30:09.893+03:00"}
{"Id":159780,"Number":313,"KnessetNum":10,"Name":"ישיבת מליאה בתאריך 29/05/1984 בשעה 16:03","StartDate":"1984-05-29T16:03:00+03:00","FinishDate":"1984-05-29T19:45:00+03:00","IsSpecialMeeting":null,"LastUpdatedDate":"2023-08-10T11:11:01.99+03:00"}
{"Id":159788,"Number":3,"KnessetNum":11,"Name":"ישיבת מליאה בתאריך 04/09/1984 בשעה 16:04","StartDate":"1984-09-04T16:04:00+03:00","FinishDate":"1984-09-04T18:22:00+03:00","IsSpecialMeeting":null,"LastUpdatedDate":"2023-09-04T12:44:09.8+03:00"}
{"Id":159791,"Number":9,"KnessetNum":11,"Name":"ישיבת מליאה בתאריך 23/10/1984 בשעה 16:00","StartDate":"1984-10-23T16:00:00+02:00","FinishDate":"1984-10-23T21:19:00+02:00","IsSpecialMeeting":null,"LastUpdatedDate":"2023-09-05T10:07:38.087+03:00"}
{"Id":159796,"Number":17,"KnessetNum":11,"Name":"ישיבת מליאה בתאריך 12/11/1984 בשעה 16:00","StartDate":"1984-11-12T16:00:00+02:00","FinishDate":"1984-11-12T21:14:00+02:00","IsSpecialMeeting":null,"LastUpdatedDate":"2023-09-10T08:08:41.803+03:00"}
{"Id":159798,"Number":20,"KnessetNum":11,"Name":"ישיבת מליאה בתאריך 19/11/1984 בשעה 16:00","StartDate":"1984-11-19T16:00:00+02:00","FinishDate":"1984-11-19T18:45:00+02:00","IsSpecialMeeting":null,"LastUpdatedDate":"2023-09-10T12:08:47.323+03:00"}
{"Id":159810,"Number":43,"KnessetNum":11,"Name":"ישיבת מליאה בתאריך 09/01/1985 בשעה 11:02","StartDate":"1985-01-09T11:02:00+02:00","FinishDate":"1985-01-09T16:37:00+02:00","IsSpecialMeeting":null,"LastUpdatedDate":"2023-09-19T12:30:30.957+03:00"}
{"Id":159812,"Number":45,"KnessetNum":11,"Name":"ישיבת מליאה בתאריך 15/01/1985 בשעה 16:00","StartDate":"1985-01-15T16:00:00+02:00","FinishDate":"1985-01-15T23:07:00+02:00","IsSpecialMeeting":null,"LastUpdatedDate":"2023-09-20T09:24:01.473+03:00"}
{"Id":159816,"Number":48,"KnessetNum":11,"Name":"ישיבת מליאה בתאריך 22/01/1985 בשעה 16:01","StartDate":"1985-01-22T16:01:00+02:00","FinishDate":"1985-01-22T18:58:00+02:00","IsSpecialMeeting":null,"LastUpdatedDate":"2023-09-21T08:07:12.273+03:00"}
{"Id":159819,"Number":52,"KnessetNum":11,"Name":"ישיבת מליאה בתאריך 30/01/1985 בשעה 11:00","StartDate":"1985-01-30T11:00:00+02:00","FinishDate":"1985-01-30T15:57:00+02:00","IsSpecialMeeting":null,"LastUpdatedDate":"2023-09-26T09:22:07.317+03:00"}
{"Id":159827,"Number":64,"KnessetNum":11,"Name":"ישיבת מליאה בתאריך 27/02/1985 בשעה 10:01","StartDate":"1985-02-27T10:01:00+02:00","FinishDate":"1985-02-27T15:20:00+02:00","IsSpecialMeeting":null,"LastUpdatedDate":"2023-10-09T08:41:29.46+03:00"}
{"Id":159830,"Number":68,"KnessetNum":11,"Name":"ישיבת מליאה בתאריך 11/03/1985 בשעה 16:00","StartDate":"1985-03-11T16:00:00+02:00","FinishDate":"1985-03-11T20:45:00+02:00","IsSpecialMeeting":null,"LastUpdatedDate":"2023-10-16T13:15:20.117+03:00"}
{"Id":159831,"Number":69,"KnessetNum":11,"Name":"ישיבת מליאה בתאריך 12/03/1985 בשעה 16:03","StartDate":"1985-03-12T16:03:00+02:00","FinishDate":"1985-03-12T17:42:00+02:00","IsSpecialMeeting":null,"LastUpdatedDate":"2019-02-20T17:31:18.253+02:00"}
{"Id":159832,"Number":71,"KnessetNum":11,"Name":"ישיבת מליאה בתאריך 18/03/1985 בשעה 16:01","StartDate":"1985-03-18T16:01:00+02:00","FinishDate":"1985-03-18T20:21:00+02:00","IsSpecialMeeting":null,"LastUpdatedDate":"2023-10-17T09:28:48.81+03:00"}
{"Id":159834,"Number":73,"KnessetNum":11,"Name":"ישיבת מליאה בתאריך 20/03/1985 בשעה 11:01","StartDate":"1985-03-20T11:01:00+02:00","FinishDate":"1985-03-20T14:18:00+02:00","IsSpecialMeeting":null,"LastUpdatedDate":"2025-05-07T16:51:45.04+03:00"}
{"Id":159847,"Number":89,"KnessetNum":11,"Name":"ישיבת מליאה בתאריך 27/05/1985 בשעה 16:01","StartDate":"1985-05-27T16:01:00+03:00","FinishDate":"1985-05-27T18:40:00+03:00","IsSpecialMeeting":null,"LastUpdatedDate":"2023-10-24T07:28:52.707+03:00"}
{"Id":159849,"Number":91,"KnessetNum":11,"Name":"ישיבת מליאה בתאריך 29/05/1985 בשעה 11:03","StartDate":"1985-05-29T11:03:00+03:00","FinishDate":"1985-05-29T19:30:00+03:00","IsSpecialMeeting":null,"LastUpdatedDate":"2023-10-24T08:23:44.043+03:00"}
{"Id":159851,"Number":93,"KnessetNum":11,"Name":"ישיבת מליאה בתאריך 04/06/1985 בשעה 16:00","StartDate":"1985-06-04T16:00:00+03:00","FinishDate":"1985-06-04T20:23:00+03:00","IsSpecialMeeting":null,"LastUpdatedDate":"2023-10-24T10:10:00.173+03:00"}
{"Id":159852,"Number":94,"KnessetNum":11,"Name":"ישיבת מליאה בתאריך 05/06/1985 בשעה 11:03","StartDate":"1985-06-05T11:03:00+03:00","FinishDate":"1985-06-05T17:39:00+03:00","IsSpecialMeeting":null,"LastUpdatedDate":"2023-10-24T13:54:04.58+03:00"}
{"Id":159854,"Number":96,"KnessetNum":11,"Name":"ישיבת מליאה בתאריך 11/06/1985 בשעה 16:02","StartDate":"1985-06-11T16:02:00+03:00","FinishDate":"1985-06-11T19:30:00+03:00","IsSpecialMeeting":null,"LastUpdatedDate":"2023-10-25T07:56:50.503+03:00"}
{"Id":159855,"Number":98,"KnessetNum":11,"Name":"ישיבת מליאה בתאריך 17/06/1985 בשעה 16:01","StartDate":"1985-06-17T16:01:00+03:00","FinishDate":"1985-06-17T20:14:00+03:00","IsSpecialMeeting":null,"LastUpdatedDate":"2024-01-29T10:36:07.29+02:00"}
{"Id":159856,"Number":100,"KnessetNum":11,"Name":"ישיבת מליאה בתאריך 19/06/1985 בשעה 11:00","StartDate":"1985-06-19T11:00:00+03:00","FinishDate":"1985-06-19T15:04:00+03:00","IsSpecialMeeting":null,"LastUpdatedDate":"2024-11-06T08:56:42.65+02:00"}
{"Id":159857,"Number":101,"KnessetNum":11,"Name":"ישיבת מליאה בתאריך 24/06/1985 בשעה 16:01","StartDate":"1985-06-24T16:01:00+03:00","FinishDate":"1985-06-24T22:00:00+03:00","IsSpecialMeeting":null,"LastUpdatedDate":"2024-11-06T09:12:09.97+02:00"}
{"Id":159859,"Number":103,"KnessetNum":11,"Name":"ישיבת מליאה בתאריך 26/06/1985 בשעה 11:00","StartDate":"1985-06-26T11:00:00+03:00","FinishDate":"1985-06-26T20:22:00+03:00","IsSpecialMeeting":null,"LastUpdatedDate":"2024-11-10T09:58:40.047+02:00"}
{"Id":159862,"Number":105,"KnessetNum":11,"Name":"ישיבת מליאה בתאריך 02/07/1985 בשעה 15:31","StartDate":"1985-07-02T15:31:00+03:00","FinishDate":"1985-07-02T21:47:00+03:00","IsSpecialMeeting":null,"LastUpdatedDate":"2024-11-11T08:01:16.233+02:00"}
{"Id":159863,"Number":106,"KnessetNum":11,"Name":"ישיבת מליאה בתאריך 03/07/1985 בשעה 11:01","StartDate":"1985-07-03T11:01:00+03:00","FinishDate":"1985-07-03T16:15:00+03:00","IsSpecialMeeting":null,"LastUpdatedDate":"2024-11-11T08:45:47.86+02:00"}
{"Id":159864,"Number":107,"KnessetNum":11,"Name":"ישיבת מליאה בתאריך 08/07/1985 בשעה 16:01","StartDate":"1985-07-08T16:01:00+03:00","FinishDate":"1985-07-08T21:05:00+03:00","IsSpecialMeeting":null,"LastUpdatedDate":"2024-11-11T10:30:38.58+02:00"}
{"Id":159866,"Number":109,"KnessetNum":11,"Name":"ישיבת מליאה בתאריך 10/07/1985 בשעה 11:00","StartDate":"1985-07-10T11:00:00+03:00","FinishDate":"1985-07-10T14:46:00+03:00","IsSpecialMeeting":null,"LastUpdatedDate":"2024-11-11T12:48:37.2+02:00"}
{"Id":159867,"Number":110,"KnessetNum":11,"Name":"ישיבת מליאה בתאריך 15/07/1985 בשעה 16:01","StartDate":"1985-07-15T16:01:00+03:00","FinishDate":"1985-07-15T21:03:00+03:00","IsSpecialMeeting":null,"LastUpdatedDate":"2024-11-13T08:14:51.69+02:00"}
{"Id":159869,"Number":112,"KnessetNum":11,"Name":"ישיבת מליאה בתאריך 17/07/1985 בשעה 11:02","StartDate":"1985-07-17T11:02:00+03:00","FinishDate":"1985-07-17T18:55:00+03:00","IsSpecialMeeting":null,"LastUpdatedDate":"2024-11-13T11:50:34.78+02:00"}
{"Id":159875,"Number":118,"KnessetNum":11,"Name":"ישיבת מליאה בתאריך 31/07/1985 בשעה 09:06","StartDate":"1985-07-31T09:06:00+03:00","FinishDate":"1985-07-31T18:48:00+03:00","IsSpecialMeeting":null,"LastUpdatedDate":"2024-11-24T09:52:36.653+02:00"}
{"Id":159878,"Number":121,"KnessetNum":11,"Name":"ישיבת מליאה בתאריך 23/09/1985 בשעה 12:05","StartDate":"1985-09-23T12:05:00+03:00","FinishDate":"1985-09-23T15:22:00+03:00","IsSpecialMeeting":null,"LastUpdatedDate":"2024-11-24T11:45:36.527+02:00"}
{"Id":159879,"Number":122,"KnessetNum":11,"Name":"ישיבת מליאה בתאריך 26/09/1985 בשעה 21:35","StartDate":"1985-09-26T21:35:00+02:00","FinishDate":"1985-09-26T23:00:00+02:00","IsSpecialMeeting":null,"LastUpdatedDate":"2024-11-24T11:56:31.367+02:00"}
{"Id":159880,"Number":123,"KnessetNum":11,"Name":"ישיבת מליאה בתאריך 14/10/1985 בשעה 16:00","StartDate":"1985-10-14T16:00:00+02:00","FinishDate":"1985-10-14T19:22:00+02:00","IsSpecialMeeting":null,"LastUpdatedDate":"2024-11-24T12:22:39.423+02:00"}
{"Id":159884,"Number":129,"KnessetNum":11,"Name":"ישיבת מליאה בתאריך 28/10/1985 בשעה 16:05","StartDate":"1985-10-28T16:05:00+02:00","FinishDate":"1985-10-28T22:54:00+02:00","IsSpecialMeeting":null,"LastUpdatedDate":"2024-11-25T10:26:13.193+02:00"}
{"Id":159894,"Number":142,"KnessetNum":11,"Name":"ישיבת מליאה בתאריך 26/11/1985 בשעה 16:00","StartDate":"1985-11-26T16:00:00+02:00","FinishDate":"1985-11-26T20:25:00+02:00","IsSpecialMeeting":null,"LastUpdatedDate":"2024-12-02T10:40:25.02+02:00"}
{"Id":159897,"Number":145,"KnessetNum":11,"Name":"ישיבת מליאה בתאריך 03/12/1985 בשעה 16:01","StartDate":"1985-12-03T16:01:00+02:00","FinishDate":"1985-12-03T18:45:00+02:00","IsSpecialMeeting":null,"LastUpdatedDate":"2024-12-02T12:50:52.277+02:00"}
{"Id":159906,"Number":154,"KnessetNum":11,"Name":"ישיבת מליאה בתאריך 24/12/1985 בשעה 16:00","StartDate":"1985-12-24T16:00:00+02:00","FinishDate":"1985-12-24T19:16:00+02:00","IsSpecialMeeting":null,"LastUpdatedDate":"2024-12-09T12:54:36.137+02:00"}
{"Id":159918,"Number":170,"KnessetNum":11,"Name":"ישיבת מליאה בתאריך 29/01/1986 בשעה 11:03","StartDate":"1986-01-29T11:03:00+02:00","FinishDate":"1986-01-29T14:40:00+02:00","IsSpecialMeeting":null,"LastUpdatedDate":"2024-12-23T11:03:40.957+02:00"}
{"Id":159920,"Number":173,"KnessetNum":11,"Name":"ישיבת מליאה בתאריך 05/02/1986 בשעה 11:04","StartDate":"1986-02-05T11:04:00+02:00","FinishDate":"1986-02-05T14:48:00+02:00","IsSpecialMeeting":null,"LastUpdatedDate":"2024-12-25T08:35:15.303+02:00"}
{"Id":159921,"Number":174,"KnessetNum":11,"Name":"ישיבת מליאה בתאריך 10/02/1986 בשעה 16:02","StartDate":"1986-02-10T16:02:00+02:00","FinishDate":"1986-02-10T20:20:00+02:00","IsSpecialMeeting":null,"LastUpdatedDate":"2024-12-25T09:04:31.7+02:00"}
{"Id":159922,"Number":175,"KnessetNum":11,"Name":"ישיבת מליאה בתאריך 11/02/1986 בשעה 16:00","StartDate":"1986-02-11T16:00:00+02:00","FinishDate":"1986-02-11T19:34:00+02:00","IsSpecialMeeting":null,"LastUpdatedDate":"2024-12-25T11:10:24.247+02:00"}
{"Id":159926,"Number":179,"KnessetNum":11,"Name":"ישיבת מליאה בתאריך 19/02/1986 בשעה 11:00","StartDate":"1986-02-19T11:00:00+02:00","FinishDate":"1986-02-19T15:31:00+02:00","IsSpecialMeeting":null,"LastUpdatedDate":"2025-02-02T11:52:37.95+02:00"}
{"Id":159927,"Number":180,"KnessetNum":11,"Name":"ישיבת מליאה בתאריך 24/02/1986 בשעה 16:01","StartDate":"1986-02-24T16:01:00+02:00","FinishDate":"1986-02-24T19:25:00+02:00","IsSpecialMeeting":null,"LastUpdatedDate":"2024-12-29T11:04:35.153+02:00"}
{"Id":159928,"Number":182,"KnessetNum":11,"Name":"ישיבת מליאה בתאריך 26/02/1986 בשעה 11:00","StartDate":"1986-02-26T11:00:00+02:00","FinishDate":"1986-02-26T17:54:00+02:00","IsSpecialMeeting":null,"LastUpdatedDate":"2024-12-30T11:30:30.363+02:00"}
{"Id":159929,"Number":183,"KnessetNum":11,"Name":"ישיבת מליאה בתאריך 03/03/1986 בשעה 16:01","StartDate":"1986-03-03T16:01:00+02:00","FinishDate":"1986-03-03T18:46:00+02:00","IsSpecialMeeting":null,"LastUpdatedDate":"2025-01-05T12:46:07.057+02:00"}
{"Id":159930,"Number":185,"KnessetNum":11,"Name":"ישיבת מליאה בתאריך 05/03/1986 בשעה 11:02","StartDate":"1986-03-05T11:02:00+02:00","FinishDate":"1986-03-05T18:00:00+02:00","IsSpecialMeeting":null,"LastUpdatedDate":"2025-01-06T10:56:14.067+02:00"}
{"Id":159937,"Number":196,"KnessetNum":11,"Name":"ישיבת מליאה בתאריך 02/04/1986 בשעה 11:01","StartDate":"1986-04-02T11:01:00+03:00","FinishDate":"1986-04-02T16:35:00+03:00","IsSpecialMeeting":null,"LastUpdatedDate":"2025-01-13T11:12:49.263+02:00"}
{"Id":159942,"Number":201,"KnessetNum":11,"Name":"ישיבת מליאה בתאריך 19/05/1986 בשעה 16:04","StartDate":"1986-05-19T16:04:00+03:00","FinishDate":"1986-05-19T19:47:00+03:00","IsSpecialMeeting":null,"LastUpdatedDate":"2025-01-15T11:35:09.757+02:00"}
{"Id":159945,"Number":205,"KnessetNum":11,"Name":"ישיבת מליאה בתאריך 27/05/1986 בשעה 16:00","StartDate":"1986-05-27T16:00:00+03:00","FinishDate":"1986-05-27T22:17:00+03:00","IsSpecialMeeting":null,"LastUpdatedDate":"2025-01-15T12:50:10.14+02:00"}
{"Id":159950,"Number":210,"KnessetNum":11,"Name":"ישיבת מליאה בתאריך 09/06/1986 בשעה 16:02","StartDate":"1986-06-09T16:02:00+03:00","FinishDate":"1986-06-09T20:59:00+03:00","IsSpecialMeeting":null,"LastUpdatedDate":"2025-01-20T09:15:16.653+02:00"}
{"Id":159951,"Number":212,"KnessetNum":11,"Name":"ישיבת מליאה בתאריך 11/06/1986 בשעה 11:00","StartDate":"1986-06-11T11:00:00+03:00","FinishDate":"1986-06-11T14:57:00+03:00","IsSpecialMeeting":null,"LastUpdatedDate":"2025-01-20T11:43:42.513+02:00"}
{"Id":159952,"Number":213,"KnessetNum":11,"Name":"ישיבת מליאה בתאריך 16/06/1986 בשעה 16:01","StartDate":"1986-06-16T16:01:00+03:00","FinishDate":"1986-06-16T22:29:00+03:00","IsSpecialMeeting":null,"LastUpdatedDate":"2025-01-20T11:54:55.057+02:00"}
{"Id":159953,"Number":215,"KnessetNum":11,"Name":"ישיבת מליאה בתאריך 18/06/1986 בשעה 11:00","StartDate":"1986-06-18T11:00:00+03:00","FinishDate":"1986-06-18T15:30:00+03:00","IsSpecialMeeting":null,"LastUpdatedDate":"2025-02-09T11:23:01.167+02:00"}
{"Id":159954,"Number":216,"KnessetNum":11,"Name":"ישיבת מליאה בתאריך 23/06/1986 בשעה 16:02","StartDate":"1986-06-23T16:02:00+03:00","FinishDate":"1986-06-23T21:15:00+03:00","IsSpecialMeeting":null,"LastUpdatedDate":"2025-01-22T09:10:10.747+02:00"}
{"Id":159955,"Number":217,"KnessetNum":11,"Name":"ישיבת מליאה בתאריך 24/06/1986 בשעה 16:00","StartDate":"1986-06-24T16:00:00+03:00","FinishDate":"1986-06-24T19:51:00+03:00","IsSpecialMeeting":null,"LastUpdatedDate":"2025-02-03T08:26:11.793+02:00"}
{"Id":159956,"Number":218,"KnessetNum":11,"Name":"ישיבת מליאה בתאריך 25/06/1986 בשעה 11:00","StartDate":"1986-06-25T11:00:00+03:00","FinishDate":"1986-06-25T11:43:00+03:00","IsSpecialMeeting":null,"LastUpdatedDate":"2025-02-03T10:24:24.51+02:00"}
{"Id":159962,"Number":225,"KnessetNum":11,"Name":"ישיבת מליאה בתאריך 14/07/1986 בשעה 16:02","StartDate":"1986-07-14T16:02:00+03:00","FinishDate":"1986-07-14T20:39:00+03:00","IsSpecialMeeting":null,"LastUpdatedDate":"2025-02-09T10:29:57.62+02:00"}
{"Id":159968,"Number":231,"KnessetNum":11,"Name":"ישיבת מליאה בתאריך 28/07/1986 בשעה 16:03","StartDate":"1986-07-28T16:03:00+03:00","FinishDate":"1986-07-28T19:01:00+03:00","IsSpecialMeeting":null,"LastUpdatedDate":"2025-02-12T08:34:45.94+02:00"}
{"Id":159971,"Number":234,"KnessetNum":11,"Name":"ישיבת מליאה בתאריך 04/08/1986 בשעה 16:02","StartDate":"1986-08-04T16:02:00+03:00","FinishDate":"1986-08-04T23:29:00+03:00","IsSpecialMeeting":null,"LastUpdatedDate":"2025-02-12T12:52:58.353+02:00"}
{"Id":159973,"Number":236,"KnessetNum":11,"Name":"ישיבת מליאה בתאריך 06/08/1986 בשעה 09:03","StartDate":"1986-08-06T09:03:00+03:00","FinishDate":"1986-08-06T23:03:00+03:00","IsSpecialMeeting":null,"LastUpdatedDate":"2025-02-19T10:06:27.037+02:00"}
{"Id":159975,"Number":241,"KnessetNum":11,"Name":"ישיבת מליאה בתאריך 11/09/1986 בשעה 10:03","StartDate":"1986-09-11T10:03:00+03:00","FinishDate":"1986-09-11T11:22:00+03:00","IsSpecialMeeting":null,"LastUpdatedDate":"2025-02-19T12:47:36.123+02:00"}
{"Id":159980,"Number":249,"KnessetNum":11,"Name":"ישיבת מליאה בתאריך 03/11/1986 בשעה 16:02","StartDate":"1986-11-03T16:02:00+02:00","FinishDate":"1986-11-03T17:21:00+02:00","IsSpecialMeeting":null,"LastUpdatedDate":"2025-02-23T10:53:22.58+02:00"}
{"Id":159986,"Number":257,"KnessetNum":11,"Name":"ישיבת מליאה בתאריך 19/11/1986 בשעה 11:00","StartDate":"1986-11-19T11:00:00+02:00","FinishDate":"1986-11-19T17:22:00+02:00","IsSpecialMeeting":null,"LastUpdatedDate":"2025-02-26T11:57:26.827+02:00"}
{"Id":159987,"Number":258,"KnessetNum":11,"Name":"ישיבת מליאה בתאריך 24/11/1986 בשעה 16:00","StartDate":"1986-11-24T16:00:00+02:00","FinishDate":"1986-11-24T19:32:00+02:00","IsSpecialMeeting":null,"LastUpdatedDate":"2025-02-26T13:03:00.833+02:00"}