{"Id":321329,"Number":6,"KnessetNum":18,"Name":"ישיבת מליאה בתאריך 16/03/2009 בשעה: 16:00","StartDate":"2009-03-16T16:00:00+02:00","FinishDate":"2009-03-16T19:40:00+02:00","IsSpecialMeeting":false,"LastUpdatedDate":"2013-10-03T16:21:47+03:00"}
{"Id":321335,"Number":7,"KnessetNum":18,"Name":"ישיבת מליאה בתאריך 17/03/2009 בשעה: 16:00","StartDate":"2009-03-17T16:00:00+02:00","FinishDate":"2009-03-17T19:50:00+02:00","IsSpecialMeeting":false,"LastUpdatedDate":"2013-10-03T16:21:47+03:00"}
{"Id":321467,"Number":8,"KnessetNum":18,"Name":"ישיבת מליאה בתאריך 18/03/2009 בשעה: 11:00","StartDate":"2009-03-18T11:00:00+02:00","FinishDate":"2009-03-18T18:40:00+02:00","IsSpecialMeeting":false,"LastUpdatedDate":"2013-10-03T16:21:47+03:00"}
{"Id":321628,"Number":9,"KnessetNum":18,"Name":"ישיבת מליאה בתאריך 23/03/2009 בשעה: 16:00","StartDate":"2009-03-23T16:00:00+02:00","FinishDate":"2009-03-23T19:40:00+02:00","IsSpecialMeeting":false,"LastUpdatedDate":"2013-10-03T16:21:47+03:00"}
{"Id":321878,"Number":10,"KnessetNum":18,"Name":"ישיבת מליאה בתאריך 24/03/2009 בשעה: 16:00","StartDate":"2009-03-24T16:00:00+02:00","FinishDate":"2009-03-24T19:20:00+02:00","IsSpecialMeeting":false,"LastUpdatedDate":"2013-10-03T16:21:47+03:00"}
{"Id":321879,"Number":11,"KnessetNum":18,"Name":"ישיבת מליאה בתאריך 25/03/2009 בשעה: 11:00","StartDate":"2009-03-25T11:00:00+02:00","FinishDate":"2009-03-25T17:30:00+02:00","IsSpecialMeeting":false,"LastUpdatedDate":"2013-10-03T16:21:47+03:00"}
{"Id":322072,"Number":12,"KnessetNum":18,"Name":"ישיבת מליאה בתאריך 30/03/2009 בשעה: 16:00","StartDate":"2009-03-30T16:00:00+03:00","FinishDate":"2009-03-30T17:40:00+03:00","IsSpecialMeeting":false,"LastUpdatedDate":"2013-10-03T16:21:47+03:00"}
{"Id":322083,"Number":13,"KnessetNum":18,"Name":"ישיבת מליאה בתאריך 31/03/2009 בשעה 16:03","StartDate":"2009-03-31T16:03:00+03:00","FinishDate":"2009-03-31T23:58:00+03:00","IsSpecialMeeting":false,"LastUpdatedDate":"2023-07-06T12:32:39.023+03:00"}
{"Id":322084,"Number":14,"KnessetNum":18,"Name":"ישיבת מליאה בתאריך 01/04/2009 בשעה: 11:00","StartDate":"2009-04-01T11:00:00+03:00","FinishDate":"2009-04-01T13:50:00+03:00","IsSpecialMeeting":false,"LastUpdatedDate":"2013-10-03T16:21:47+03:00"}
{"Id":322358,"Number":15,"KnessetNum":18,"Name":"ישיבת מליאה בתאריך 06/04/2009 בשעה 11:00","StartDate":"2009-04-06T11:00:00+03:00","FinishDate":"2009-04-07T08:12:00+03:00","IsSpecialMeeting":false,"LastUpdatedDate":"2023-07-06T12:39:03.007+03:00"}
{"Id":322550,"Number":16,"KnessetNum":18,"Name":"ישיבת מליאה בתאריך 04/05/2009 בשעה: 16:00","StartDate":"2009-05-04T16:00:00+03:00","FinishDate":"2009-05-04T20:50:00+03:00","IsSpecialMeeting":false,"LastUpdatedDate":"2013-10-03T16:21:47+03:00"}
{"Id":322551,"Number":17,"KnessetNum":18,"Name":"ישיבת מליאה בתאריך 05/05/2009 בשעה 16:00","StartDate":"2009-05-05T16:00:00+03:00","FinishDate":"2009-05-05T20:30:00+03:00","IsSpecialMeeting":false,"LastUpdatedDate":"2020-12-03T14:00:38.703+02:00"}
{"Id":322552,"Number":18,"KnessetNum":18,"Name":"ישיבת מליאה בתאריך 06/05/2009 בשעה: 11:00","StartDate":"2009-05-06T11:00:00+03:00","FinishDate":"2009-05-06T16:10:00+03:00","IsSpecialMeeting":false,"LastUpdatedDate":"2013-10-03T16:21:47+03:00"}
{"Id":323228,"Number":19,"KnessetNum":18,"Name":"ישיבת מליאה בתאריך 11/05/2009 בשעה 13:00","StartDate":"2009-05-11T13:00:00+03:00","FinishDate":"2009-05-11T15:10:00+03:00","IsSpecialMeeting":false,"LastUpdatedDate":"2019-09-16T08:26:48.023+03:00"}
{"Id":323229,"Number":20,"KnessetNum":18,"Name":"ישיבת מליאה בתאריך 12/05/2009 בשעה: 16:00","StartDate":"2009-05-12T16:00:00+03:00","FinishDate":"2009-05-12T18:00:00+03:00","IsSpecialMeeting":false,"LastUpdatedDate":"2013-10-03T16:21:47+03:00"}
{"Id":323230,"Number":21,"KnessetNum":18,"Name":"ישיבת מליאה בתאריך 13/05/2009 בשעה: 11:00","StartDate":"2009-05-13T11:00:00+03:00","FinishDate":"2009-05-13T15:10:00+03:00","IsSpecialMeeting":false,"LastUpdatedDate":"2013-10-03T16:21:47+03:00"}
{"Id":323629,"Number":22,"KnessetNum":18,"Name":"ישיבת מליאה בתאריך 18/05/2009 בשעה 16:00","StartDate":"2009-05-18T16:00:00+03:00","FinishDate":"2009-05-18T20:20:00+03:00","IsSpecialMeeting":false,"LastUpdatedDate":"2020-12-07T17:28:29.817+02:00"}
{"Id":323648,"Number":23,"KnessetNum":18,"Name":"ישיבת מליאה בתאריך 19/05/2009 בשעה: 16:00","StartDate":"2009-05-19T16:00:00+03:00","FinishDate":"2009-05-19T19:30:00+03:00","IsSpecialMeeting":false,"LastUpdatedDate":"2013-10-03T16:21:47+03:00"}
{"Id":323653,"Number":24,"KnessetNum":18,"Name":"ישיבת מליאה בתאריך 20/05/2009 בשעה 11:00","StartDate":"2009-05-20T11:00:00+03:00","FinishDate":"2009-05-20T21:20:00+03:00","IsSpecialMeeting":false,"LastUpdatedDate":"2020-12-07T17:26:31.497+02:00"}
{"Id":324165,"Number":25,"KnessetNum":18,"Name":"ישיבת מליאה בתאריך 25/05/2009 בשעה: 16:00","StartDate":"2009-05-25T16:00:00+03:00","FinishDate":"2009-05-25T19:20:00+03:00","IsSpecialMeeting":false,"LastUpdatedDate":"2013-10-03T16:21:47+03:00"}
{"Id":324166,"Number":26,"KnessetNum":18,"Name":"ישיבת מליאה בתאריך 26/05/2009 בשעה: 16:00","StartDate":"2009-05-26T16:00:00+03:00","FinishDate":"2009-05-26T19:00:00+03:00","IsSpecialMeeting":false,"LastUpdatedDate":"2013-10-03T16:21:47+03:00"}
{"Id":324167,"Number":27,"KnessetNum":18,"Name":"ישיבת מליאה בתאריך 27/05/2009 בשעה: 11:00","StartDate":"2009-05-27T11:00:00+03:00","FinishDate":"2009-05-27T19:30:00+03:00","IsSpecialMeeting":false,"LastUpdatedDate":"2013-10-03T16:21:47+03:00"}
{"Id":324745,"Number":28,"KnessetNum":18,"Name":"ישיבת מליאה בתאריך 01/06/2009 בשעה 16:00","StartDate":"2009-06-01T16:00:00+03:00","FinishDate":"2009-06-01T20:40:00+03:00","IsSpecialMeeting":false,"LastUpdatedDate":"2020-02-10T10:00:52.35+02:00"}
{"Id":324869,"Number":29,"KnessetNum":18,"Name":"ישיבת מליאה בתאריך 02/06/2009 בשעה: 16:00","StartDate":"2009-06-02T16:00:00+03:00","FinishDate":"2009-06-02T20:00:00+03:00","IsSpecialMeeting":false,"LastUpdatedDate":"2013-10-03T16:21:47+03:00"}
{"Id":324871,"Number":30,"KnessetNum":18,"Name":"ישיבת מליאה בתאריך 03/06/2009 בשעה: 11:00","StartDate":"2009-06-03T11:00:00+03:00","FinishDate":"2009-06-03T18:00:00+03:00","IsSpecialMeeting":false,"LastUpdatedDate":"2013-10-03T16:21:47+03:00"}
{"Id":325099,"Number":31,"KnessetNum":18,"Name":"ישיבת מליאה בתאריך 08/06/2009 בשעה 16:00","StartDate":"2009-06-08T16:00:00+03:00","FinishDate":"2009-06-08T21:20:00+03:00","IsSpecialMeeting":false,"LastUpdatedDate":"2020-12-07T17:32:42.51+02:00"}
{"Id":325100,"Number":32,"KnessetNum":18,"Name":"ישיבת מליאה בתאריך 09/06/2009 בשעה: 16:00","StartDate":"2009-06-09T16:00:00+03:00","FinishDate":"2009-06-09T20:20:00+03:00","IsSpecialMeeting":false,"LastUpdatedDate":"2013-10-03T16:21:47+03:00"}
{"Id":325101,"Number":33,"KnessetNum":18,"Name":"ישיבת מליאה בתאריך 10/06/2009 בשעה: 11:00","StartDate":"2009-06-10T11:00:00+03:00","FinishDate":"2009-06-10T20:10:00+03:00","IsSpecialMeeting":false,"LastUpdatedDate":"2013-10-03T16:21:47+03:00"}
{"Id":325552,"Number":34,"KnessetNum":18,"Name":"ישיבת מליאה בתאריך 15/06/2009 בשעה 16:00","StartDate":"2009-06-15T16:00:00+03:00","FinishDate":"2009-06-15T18:50:00+03:00","IsSpecialMeeting":false,"LastUpdatedDate":"2020-12-07T17:23:31.363+02:00"}
{"Id":325564,"Number":35,"KnessetNum":18,"Name":"ישיבת מליאה בתאריך 16/06/2009 בשעה 16:00","StartDate":"2009-06-16T16:00:00+03:00","FinishDate":"2009-06-16T18:50:00+03:00","IsSpecialMeeting":false,"LastUpdatedDate":"2020-02-09T13:04:13.953+02:00"}
{"Id":325566,"Number":36,"KnessetNum":18,"Name":"ישיבת מליאה בתאריך 17/06/2009 בשעה: 11:00","StartDate":"2009-06-17T11:00:00+03:00","FinishDate":"2009-06-17T16:00:00+03:00","IsSpecialMeeting":false,"LastUpdatedDate":"2013-10-03T16:21:47+03:00"}
{"Id":325963,"Number":38,"KnessetNum":18,"Name":"ישיבת מליאה בתאריך 22/06/2009 בשעה 16:00","StartDate":"2009-06-22T16:00:00+03:00","FinishDate":"2009-06-22T20:40:00+03:00","IsSpecialMeeting":false,"LastUpdatedDate":"2020-12-07T17:38:46.777+02:00"}
{"Id":325964,"Number":39,"KnessetNum":18,"Name":"ישיבת מליאה בתאריך 23/06/2009 בשעה: 16:00","StartDate":"2009-06-23T16:00:00+03:00","FinishDate":"2009-06-23T18:50:00+03:00","IsSpecialMeeting":false,"LastUpdatedDate":"2013-10-03T16:21:47+03:00"}
{"Id":325965,"Number":40,"KnessetNum":18,"Name":"ישיבת מליאה בתאריך 24/06/2009 בשעה: 11:00","StartDate":"2009-06-24T11:00:00+03:00","FinishDate":"2009-06-24T19:50:00+03:00","IsSpecialMeeting":false,"LastUpdatedDate":"2013-10-03T16:21:47+03:00"}
{"Id":325977,"Number":37,"KnessetNum":18,"Name":"ישיבת מליאה בתאריך 18/06/2009 בשעה: 16:00","StartDate":"2009-06-18T16:00:00+03:00","FinishDate":"2009-06-18T16:20:00+03:00","IsSpecialMeeting":false,"LastUpdatedDate":"2013-10-03T16:21:47+03:00"}
{"Id":326469,"Number":41,"KnessetNum":18,"Name":"ישיבת מליאה בתאריך 29/06/2009 בשעה 16:00","StartDate":"2009-06-29T16:00:00+03:00","FinishDate":"2009-06-29T19:40:00+03:00","IsSpecialMeeting":false,"LastUpdatedDate":"2020-12-07T17:44:38.703+02:00"}
{"Id":326470,"Number":42,"KnessetNum":18,"Name":"ישיבת מליאה בתאריך 30/06/2009 בשעה: 16:00","StartDate":"2009-06-30T16:00:00+03:00","FinishDate":"2009-06-30T18:30:00+03:00","IsSpecialMeeting":false,"LastUpdatedDate":"2013-10-03T16:21:47+03:00"}
{"Id":326471,"Number":43,"KnessetNum":18,"Name":"ישיבת מליאה בתאריך 01/07/2009 בשעה: 11:00","StartDate":"2009-07-01T11:00:00+03:00","FinishDate":"2009-07-01T18:00:00+03:00","IsSpecialMeeting":false,"LastUpdatedDate":"2013-10-03T16:21:47+03:00"}
{"Id":326799,"Number":44,"KnessetNum":18,"Name":"ישיבת מליאה בתאריך 06/07/2009 בשעה 16:00","StartDate":"2009-07-06T16:00:00+03:00","FinishDate":"2009-07-06T20:20:00+03:00","IsSpecialMeeting":false,"LastUpdatedDate":"2020-12-07T17:49:37.327+02:00"}
{"Id":326800,"Number":45,"KnessetNum":18,"Name":"ישיבת מליאה בתאריך 07/07/2009 בשעה: 16:00","StartDate":"2009-07-07T16:00:00+03:00","FinishDate":"2009-07-07T19:20:00+03:00","IsSpecialMeeting":false,"LastUpdatedDate":"2013-10-03T16:21:47+03:00"}
{"Id":326801,"Number":46,"KnessetNum":18,"Name":"ישיבת מליאה בתאריך 08/07/2009 בשעה: 11:00","StartDate":"2009-07-08T11:00:00+03:00","FinishDate":"2009-07-08T20:00:00+03:00","IsSpecialMeeting":false,"LastUpdatedDate":"2013-10-03T16:21:47+03:00"}
{"Id":327335,"Number":47,"KnessetNum":18,"Name":"ישיבת מליאה בתאריך 13/07/2009 בשעה 11:00","StartDate":"2009-07-13T11:00:00+03:00","FinishDate":"2009-07-13T18:50:00+03:00","IsSpecialMeeting":false,"LastUpdatedDate":"2020-12-07T17:47:43.15+02:00"}
{"Id":327602,"Number":48,"KnessetNum":18,"Name":"ישיבת מליאה בתאריך 15/07/2009 בשעה: 09:00","StartDate":"2009-07-15T09:00:00+03:00","FinishDate":"2009-07-15T21:00:00+03:00","IsSpecialMeeting":false,"LastUpdatedDate":"2013-10-03T16:21:47+03:00"}
{"Id":327680,"Number":49,"KnessetNum":18,"Name":"ישיבת מליאה בתאריך 20/07/2009 בשעה 16:00","StartDate":"2009-07-20T16:00:00+03:00","FinishDate":"2009-07-20T22:30:00+03:00","IsSpecialMeeting":false,"LastUpdatedDate":"2020-12-07T17:56:20.663+02:00"}
{"Id":327779,"Number":50,"KnessetNum":18,"Name":"ישיבת מליאה בתאריך 21/07/2009 בשעה 16:00","StartDate":"2009-07-21T16:00:00+03:00","FinishDate":"2009-07-21T22:00:00+03:00","IsSpecialMeeting":false,"LastUpdatedDate":"2020-12-03T13:05:30.75+02:00"}
{"Id":327780,"Number":51,"KnessetNum":18,"Name":"ישיבת מליאה בתאריך 22/07/2009 בשעה: 11:00","StartDate":"2009-07-22T11:00:00+03:00","FinishDate":"2009-07-22T22:00:00+03:00","IsSpecialMeeting":false,"LastUpdatedDate":"2013-10-03T16:21:47+03:00"}
{"Id":328083,"Number":52,"KnessetNum":18,"Name":"ישיבת מליאה בתאריך 27/07/2009 בשעה 16:00","StartDate":"2009-07-27T16:00:00+03:00","FinishDate":"2009-07-27T23:20:00+03:00","IsSpecialMeeting":false,"LastUpdatedDate":"2020-12-07T17:54:45.003+02:00"}
{"Id":328187,"Number":53,"KnessetNum":18,"Name":"ישיבת מליאה בתאריך 28/07/2009 בשעה 14:30","StartDate":"2009-07-28T14:30:00+03:00","FinishDate":"2009-07-29T14:10:00+03:00","IsSpecialMeeting":false,"LastUpdatedDate":"2019-09-16T08:34:26.973+03:00"}
{"Id":328419,"Number":54,"KnessetNum":18,"Name":"ישיבת מליאה בתאריך 03/08/2009 בשעה: 10:00","StartDate":"2009-08-03T10:00:00+03:00","FinishDate":"2009-08-03T16:00:00+03:00","IsSpecialMeeting":false,"LastUpdatedDate":"2013-10-03T16:21:47+03:00"}
{"Id":328593,"Number":55,"KnessetNum":18,"Name":"ישיבת מליאה בתאריך 02/09/2009 בשעה: 12:00","StartDate":"2009-09-02T12:00:00+03:00","FinishDate":"2009-09-02T14:00:00+03:00","IsSpecialMeeting":false,"LastUpdatedDate":"2013-10-03T16:21:47+03:00"}
{"Id":328945,"Number":56,"KnessetNum":18,"Name":"ישיבת מליאה בתאריך 12/10/2009 בשעה 16:00","StartDate":"2009-10-12T16:00:00+02:00","FinishDate":"2009-10-12T20:30:00+02:00","IsSpecialMeeting":false,"LastUpdatedDate":"2020-12-07T18:02:20.103+02:00"}
{"Id":329015,"Number":57,"KnessetNum":18,"Name":"ישיבת מליאה בתאריך 13/10/2009 בשעה: 16:00","StartDate":"2009-10-13T16:00:00+02:00","FinishDate":"2009-10-13T20:30:00+02:00","IsSpecialMeeting":false,"LastUpdatedDate":"2013-10-03T16:21:47+03:00"}
{"Id":329016,"Number":58,"KnessetNum":18,"Name":"ישיבת מליאה בתאריך 14/10/2009 בשעה: 11:00","StartDate":"2009-10-14T11:00:00+02:00","FinishDate":"2009-10-14T17:10:00+02:00","IsSpecialMeeting":false,"LastUpdatedDate":"2013-10-03T16:21:47+03:00"}
{"Id":329528,"Number":59,"KnessetNum":18,"Name":"ישיבת מליאה בתאריך 19/10/2009 בשעה 16:00","StartDate":"2009-10-19T16:00:00+02:00","FinishDate":"2009-10-19T19:10:00+02:00","IsSpecialMeeting":false,"LastUpdatedDate":"2020-12-07T18:01:17.557+02:00"}
{"Id":329529,"Number":60,"KnessetNum":18,"Name":"ישיבת מליאה בתאריך 20/10/2009 בשעה 16:00","StartDate":"2009-10-20T16:00:00+02:00","FinishDate":"2009-10-20T18:40:00+02:00","IsSpecialMeeting":false,"LastUpdatedDate":"2020-12-07T17:55:37.25+02:00"}
{"Id":329531,"Number":61,"KnessetNum":18,"Name":"ישיבת מליאה בתאריך 21/10/2009 בשעה: 11:00","StartDate":"2009-10-21T11:00:00+02:00","FinishDate":"2009-10-21T16:30:00+02:00","IsSpecialMeeting":false,"LastUpdatedDate":"2013-10-03T16:21:47+03:00"}
{"Id":329852,"Number":62,"KnessetNum":18,"Name":"ישיבת מליאה בתאריך 26/10/2009 בשעה 16:00","StartDate":"2009-10-26T16:00:00+02:00","FinishDate":"2009-10-26T18:30:00+02:00","IsSpecialMeeting":false,"LastUpdatedDate":"2020-12-07T18:02:53.227+02:00"}
{"Id":329853,"Number":63,"KnessetNum":18,"Name":"ישיבת מליאה בתאריך 27/10/2009 בשעה: 16:00","StartDate":"2009-10-27T16:00:00+02:00","FinishDate":"2009-10-27T17:50:00+02:00","IsSpecialMeeting":false,"LastUpdatedDate":"2013-10-03T16:21:47+03:00"}
{"Id":329854,"Number":64,"KnessetNum":18,"Name":"ישיבת מליאה בתאריך 28/10/2009 בשעה: 11:00","StartDate":"2009-10-28T11:00:00+02:00","FinishDate":"2009-10-28T18:10:00+02:00","IsSpecialMeeting":false,"LastUpdatedDate":"2013-10-03T16:21:47+03:00"}
{"Id":329855,"Number":65,"KnessetNum":18,"Name":"ישיבת מליאה בתאריך 29/10/2009 בשעה: 17:00","StartDate":"2009-10-29T17:00:00+02:00","FinishDate":"2009-10-29T17:50:00+02:00","IsSpecialMeeting":true,"LastUpdatedDate":"2013-10-03T16:21:47+03:00"}