{"Id":310040,"Number":269,"KnessetNum":17,"Name":"ישיבת מליאה בתאריך 27/10/2008 בשעה 16:00","StartDate":"2008-10-27T16:00:00+02:00","FinishDate":"2008-10-27T19:30:00+02:00","IsSpecialMeeting":false,"LastUpdatedDate":"2021-02-10T14:48:52.037+02:00"}
{"Id":310045,"Number":270,"KnessetNum":17,"Name":"ישיבת מליאה בתאריך 28/10/2008 בשעה: 16:00","StartDate":"2008-10-28T16:00:00+02:00","FinishDate":"2008-10-28T17:00:00+02:00","IsSpecialMeeting":false,"LastUpdatedDate":"2013-10-03T16:21:47+03:00"}
{"Id":310046,"Number":271,"KnessetNum":17,"Name":"ישיבת מליאה בתאריך 29/10/2008 בשעה: 11:00","StartDate":"2008-10-29T11:00:00+02:00","FinishDate":"2008-10-29T17:30:00+02:00","IsSpecialMeeting":false,"LastUpdatedDate":"2013-10-03T16:21:47+03:00"}
{"Id":311213,"Number":272,"KnessetNum":17,"Name":"ישיבת מליאה בתאריך 03/11/2008 בשעה: 16:00","StartDate":"2008-11-03T16:00:00+02:00","FinishDate":"2008-11-03T19:10:00+02:00","IsSpecialMeeting":false,"LastUpdatedDate":"2013-10-03T16:21:47+03:00"}
{"Id":311214,"Number":273,"KnessetNum":17,"Name":"ישיבת מליאה בתאריך 04/11/2008 בשעה: 16:00","StartDate":"2008-11-04T16:00:00+02:00","FinishDate":"2008-11-04T19:30:00+02:00","IsSpecialMeeting":false,"LastUpdatedDate":"2013-10-03T16:21:47+03:00"}
{"Id":311215,"Number":274,"KnessetNum":17,"Name":"ישיבת מליאה בתאריך 05/11/2008 בשעה: 11:00","StartDate":"2008-11-05T11:00:00+02:00","FinishDate":"2008-11-05T18:30:00+02:00","IsSpecialMeeting":false,"LastUpdatedDate":"2013-10-03T16:21:47+03:00"}
{"Id":312172,"Number":275,"KnessetNum":17,"Name":"ישיבת מליאה בתאריך 10/11/2008 בשעה: 16:00","StartDate":"2008-11-10T16:00:00+02:00","FinishDate":"2008-11-10T18:20:00+02:00","IsSpecialMeeting":true,"LastUpdatedDate":"2013-10-03T16:21:47+03:00"}
{"Id":312472,"Number":276,"KnessetNum":17,"Name":"ישיבת מליאה בתאריך 24/11/2008 בשעה: 12:30","StartDate":"2008-11-24T12:30:00+02:00","FinishDate":"2008-11-24T14:30:00+02:00","IsSpecialMeeting":false,"LastUpdatedDate":"2013-10-03T16:21:47+03:00"}
{"Id":313872,"Number":277,"KnessetNum":17,"Name":"ישיבת מליאה בתאריך 29/12/2008 בשעה: 11:00","StartDate":"2008-12-29T11:00:00+02:00","FinishDate":"2008-12-29T16:30:00+02:00","IsSpecialMeeting":false,"LastUpdatedDate":"2014-12-08T13:56:06+02:00"}
{"Id":316019,"Number":15,"KnessetNum":1,"Name":"ישיבת מליאה בתאריך 22/03/1949 בשעה 16:12","StartDate":"1949-03-22T16:12:00+02:00","FinishDate":"1949-03-23T17:45:00+02:00","IsSpecialMeeting":null,"LastUpdatedDate":"2020-10-18T08:05:01.073+03:00"}
{"Id":316020,"Number":36,"KnessetNum":1,"Name":"ישיבת מליאה בתאריך 31/05/1949 בשעה 16:15","StartDate":"1949-05-31T16:15:00+03:00","FinishDate":"1949-05-31T18:40:00+03:00","IsSpecialMeeting":null,"LastUpdatedDate":"2020-10-15T12:24:06.777+03:00"}
{"Id":316022,"Number":123,"KnessetNum":1,"Name":"ישיבת מליאה בתאריך 07/03/1950 בשעה 16:12","StartDate":"1950-03-07T16:12:00+02:00","FinishDate":"1950-03-07T21:52:00+02:00","IsSpecialMeeting":null,"LastUpdatedDate":"2020-10-14T14:30:38.52+03:00"}
{"Id":316023,"Number":142,"KnessetNum":1,"Name":"ישיבת מליאה בתאריך 23/05/1950 בשעה 16:10","StartDate":"1950-05-23T16:10:00+03:00","FinishDate":"1950-05-23T22:35:00+03:00","IsSpecialMeeting":null,"LastUpdatedDate":"2020-10-14T13:25:02.267+03:00"}
{"Id":316024,"Number":169,"KnessetNum":1,"Name":"ישיבת מליאה בתאריך 24/07/1950 בשעה 15:07","StartDate":"1950-07-24T15:07:00+03:00","FinishDate":"1950-07-24T21:30:00+03:00","IsSpecialMeeting":null,"LastUpdatedDate":"2025-01-21T09:13:53.58+02:00"}
{"Id":316025,"Number":181,"KnessetNum":1,"Name":"ישיבת מליאה בתאריך 23/10/1950 בשעה 16:15","StartDate":"1950-10-23T16:15:00+02:00","FinishDate":"1950-10-23T19:40:00+02:00","IsSpecialMeeting":null,"LastUpdatedDate":"2020-10-14T09:05:14.033+03:00"}
{"Id":316026,"Number":219,"KnessetNum":1,"Name":"ישיבת מליאה בתאריך 29/01/1951 בשעה 16:12","StartDate":"1951-01-29T16:12:00+02:00","FinishDate":"1951-01-29T22:04:00+02:00","IsSpecialMeeting":null,"LastUpdatedDate":"2020-10-13T15:51:49.91+03:00"}
{"Id":316027,"Number":251,"KnessetNum":1,"Name":"ישיבת מליאה בתאריך 14/05/1951 בשעה 16:15","StartDate":"1951-05-14T16:15:00+03:00","FinishDate":"1951-05-14T22:10:00+03:00","IsSpecialMeeting":null,"LastUpdatedDate":"2021-07-19T16:47:32.207+03:00"}
{"Id":316031,"Number":114,"KnessetNum":3,"Name":"ישיבת מליאה בתאריך 23/04/1956 בשעה 12:10","StartDate":"1956-04-23T12:10:00+03:00","FinishDate":"1956-04-23T16:55:00+03:00","IsSpecialMeeting":null,"LastUpdatedDate":"2021-12-05T08:57:10.4+02:00"}
{"Id":316032,"Number":117,"KnessetNum":3,"Name":"ישיבת מליאה בתאריך 09/05/1956 בשעה 11:20","StartDate":"1956-05-09T11:20:00+03:00","FinishDate":"1956-05-09T13:55:00+03:00","IsSpecialMeeting":null,"LastUpdatedDate":"2021-12-05T10:28:33.343+02:00"}
{"Id":316034,"Number":190,"KnessetNum":3,"Name":"ישיבת מליאה בתאריך 20/11/1956 בשעה 16:01","StartDate":"1956-11-20T16:01:00+02:00","FinishDate":"1956-11-20T19:04:00+02:00","IsSpecialMeeting":null,"LastUpdatedDate":"2021-12-30T13:36:44.16+02:00"}
{"Id":316039,"Number":329,"KnessetNum":3,"Name":"ישיבת מליאה בתאריך 17/07/1957 בשעה 11:03","StartDate":"1957-07-17T11:03:00+03:00","FinishDate":"1957-07-17T13:05:00+03:00","IsSpecialMeeting":null,"LastUpdatedDate":"2022-02-24T14:09:21.047+02:00"}
{"Id":316048,"Number":660,"KnessetNum":3,"Name":"ישיבת מליאה בתאריך 29/06/1959 בשעה 21:07","StartDate":"1959-06-29T21:07:00+03:00","FinishDate":"1959-06-29T22:23:00+03:00","IsSpecialMeeting":null,"LastUpdatedDate":"2023-10-29T11:28:41.777+02:00"}
{"Id":316050,"Number":14,"KnessetNum":4,"Name":"ישיבת מליאה בתאריך 22/12/1959 בשעה 16:00","StartDate":"1959-12-22T16:00:00+02:00","FinishDate":"1959-12-22T18:52:00+02:00","IsSpecialMeeting":null,"LastUpdatedDate":"2021-12-15T11:19:21.353+02:00"}
{"Id":316052,"Number":143,"KnessetNum":5,"Name":"ישיבת מליאה בתאריך 18/06/1962 בשעה 16:02","StartDate":"1962-06-18T16:02:00+03:00","FinishDate":"1962-06-18T20:47:00+03:00","IsSpecialMeeting":null,"LastUpdatedDate":"2022-02-02T13:50:21.543+02:00"}
{"Id":316053,"Number":154,"KnessetNum":5,"Name":"ישיבת מליאה בתאריך 10/07/1962 בשעה 15:02","StartDate":"1962-07-10T15:02:00+03:00","FinishDate":"1962-07-10T17:30:00+03:00","IsSpecialMeeting":null,"LastUpdatedDate":"2022-02-03T12:14:11.96+02:00"}
{"Id":316054,"Number":353,"KnessetNum":5,"Name":"ישיבת מליאה בתאריך 05/05/1964 בשעה 16:00","StartDate":"1964-05-05T16:00:00+03:00","FinishDate":"1964-05-05T20:45:00+03:00","IsSpecialMeeting":null,"LastUpdatedDate":"2022-03-03T07:50:20.27+02:00"}
{"Id":316064,"Number":9,"KnessetNum":6,"Name":"ישיבת מליאה בתאריך 13/12/1965 בשעה 16:01","StartDate":"1965-12-13T16:01:00+02:00","FinishDate":"1965-12-13T19:40:00+02:00","IsSpecialMeeting":null,"LastUpdatedDate":"2022-04-28T09:42:58.503+03:00"}
{"Id":316065,"Number":20,"KnessetNum":6,"Name":"ישיבת מליאה בתאריך 11/01/1966 בשעה 16:07","StartDate":"1966-01-11T16:07:00+02:00","FinishDate":"1966-01-11T17:31:00+02:00","IsSpecialMeeting":null,"LastUpdatedDate":"2022-05-02T11:48:47.657+03:00"}
{"Id":316070,"Number":28,"KnessetNum":7,"Name":"ישיבת מליאה בתאריך 19/01/1970 בשעה 16:00","StartDate":"1970-01-19T16:00:00+02:00","FinishDate":"1970-01-19T19:05:00+02:00","IsSpecialMeeting":null,"LastUpdatedDate":"2020-11-02T17:07:51.23+02:00"}
{"Id":316071,"Number":270,"KnessetNum":7,"Name":"ישיבת מליאה בתאריך 15/02/1972 בשעה 16:00","StartDate":"1972-02-15T16:00:00+02:00","FinishDate":"1972-02-15T21:32:00+02:00","IsSpecialMeeting":null,"LastUpdatedDate":"2023-11-20T02:02:43.643+02:00"}
{"Id":316072,"Number":276,"KnessetNum":7,"Name":"ישיבת מליאה בתאריך 02/03/1972 בשעה 10:00","StartDate":"1972-03-02T10:00:00+02:00","FinishDate":"1972-03-02T17:10:00+02:00","IsSpecialMeeting":null,"LastUpdatedDate":"2023-11-20T02:35:43.527+02:00"}
{"Id":317513,"Number":1,"KnessetNum":18,"Name":"ישיבת מליאה בתאריך 24/02/2009 בשעה: 16:00","StartDate":"2009-02-24T16:00:00+02:00","FinishDate":"2009-02-24T17:10:00+02:00","IsSpecialMeeting":false,"LastUpdatedDate":"2013-10-03T16:21:47+03:00"}
{"Id":317538,"Number":2,"KnessetNum":18,"Name":"ישיבת מליאה בתאריך 02/03/2009 בשעה: 16:00","StartDate":"2009-03-02T16:00:00+02:00","FinishDate":"2009-03-02T18:50:00+02:00","IsSpecialMeeting":false,"LastUpdatedDate":"2013-10-03T16:21:47+03:00"}
{"Id":318812,"Number":3,"KnessetNum":18,"Name":"ישיבת מליאה בתאריך 04/03/2009 בשעה: 11:00","StartDate":"2009-03-04T11:00:00+02:00","FinishDate":"2009-03-04T15:50:00+02:00","IsSpecialMeeting":false,"LastUpdatedDate":"2013-10-03T16:21:47+03:00"}
{"Id":319637,"Number":4,"KnessetNum":18,"Name":"ישיבת מליאה בתאריך 09/03/2009 בשעה: 11:00","StartDate":"2009-03-09T11:00:00+02:00","FinishDate":"2009-03-09T15:10:00+02:00","IsSpecialMeeting":false,"LastUpdatedDate":"2013-10-03T16:21:47+03:00"}
{"Id":319927,"Number":5,"KnessetNum":18,"Name":"ישיבת מליאה בתאריך 12/03/2009 בשעה: 11:00","StartDate":"2009-03-12T11:00:00+02:00","FinishDate":"2009-03-12T13:30:00+02:00","IsSpecialMeeting":false,"LastUpdatedDate":"2013-10-03T16:21:47+03:00"}