{"Id":2200451,"Number":34,"KnessetNum":25,"Name":"ישיבת מליאה בתאריך 30/01/2023 בשעה 16:00","StartDate":"2023-01-30T16:00:00+02:00","FinishDate":"2023-01-31T07:30:00+02:00","IsSpecialMeeting":false,"LastUpdatedDate":"2023-01-30T11:07:13.137+02:00"}
{"Id":2200452,"Number":35,"KnessetNum":25,"Name":"ישיבת מליאה בתאריך 31/01/2023 בשעה 16:00","StartDate":"2023-01-31T16:00:00+02:00","FinishDate":"2023-01-31T16:20:00+02:00","IsSpecialMeeting":false,"LastUpdatedDate":"2023-01-31T12:23:00.21+02:00"}
{"Id":2200453,"Number":36,"KnessetNum":25,"Name":"ישיבת מליאה בתאריך 01/02/2023 בשעה 11:00","StartDate":"2023-02-01T11:00:00+02:00","FinishDate":"2023-02-01T16:30:00+02:00","IsSpecialMeeting":false,"LastUpdatedDate":"2023-02-01T10:01:11.937+02:00"}
{"Id":2200860,"Number":37,"KnessetNum":25,"Name":"ישיבת מליאה בתאריך 06/02/2023 בשעה 16:00","StartDate":"2023-02-06T16:00:00+02:00","FinishDate":"2023-02-07T03:30:00+02:00","IsSpecialMeeting":false,"LastUpdatedDate":"2023-02-06T14:36:29.795+02:00"}
{"Id":2200862,"Number":38,"KnessetNum":25,"Name":"ישיבת מליאה בתאריך 07/02/2023 בשעה 16:00","StartDate":"2023-02-07T16:00:00+02:00","FinishDate":"2023-02-07T17:10:00+02:00","IsSpecialMeeting":false,"LastUpdatedDate":"2023-02-07T13:28:23.845+02:00"}
{"Id":2200863,"Number":39,"KnessetNum":25,"Name":"ישיבת מליאה בתאריך 08/02/2023 בשעה 11:00","StartDate":"2023-02-08T11:00:00+02:00","FinishDate":"2023-02-08T21:50:00+02:00","IsSpecialMeeting":false,"LastUpdatedDate":"2023-02-08T13:15:13.693+02:00"}
{"Id":2201030,"Number":40,"KnessetNum":25,"Name":"ישיבת מליאה בתאריך 13/02/2023 בשעה 16:00","StartDate":"2023-02-13T16:00:00+02:00","FinishDate":"2023-02-14T08:00:00+02:00","IsSpecialMeeting":false,"LastUpdatedDate":"2023-02-13T19:35:42.973+02:00"}
{"Id":2201031,"Number":41,"KnessetNum":25,"Name":"ישיבת מליאה בתאריך 14/02/2023 בשעה 16:00","StartDate":"2023-02-14T16:00:00+02:00","FinishDate":"2023-02-14T17:20:00+02:00","IsSpecialMeeting":false,"LastUpdatedDate":"2023-02-14T15:10:04.587+02:00"}
{"Id":2201032,"Number":42,"KnessetNum":25,"Name":"ישיבת מליאה בתאריך 15/02/2023 בשעה 11:00","StartDate":"2023-02-15T11:00:00+02:00","FinishDate":"2023-02-15T21:00:00+02:00","IsSpecialMeeting":false,"LastUpdatedDate":"2023-02-14T17:33:25.436+02:00"}
{"Id":2201366,"Number":43,"KnessetNum":25,"Name":"ישיבת מליאה בתאריך 20/02/2023 בשעה 16:00","StartDate":"2023-02-20T16:00:00+02:00","FinishDate":"2023-02-21T04:20:00+02:00","IsSpecialMeeting":false,"LastUpdatedDate":"2023-02-20T12:47:46.937+02:00"}
{"Id":2201367,"Number":44,"KnessetNum":25,"Name":"ישיבת מליאה בתאריך 21/02/2023 בשעה 16:00","StartDate":"2023-02-21T16:00:00+02:00","FinishDate":"2023-02-21T18:50:00+02:00","IsSpecialMeeting":false,"LastUpdatedDate":"2023-02-21T14:42:50.416+02:00"}
{"Id":2201368,"Number":45,"KnessetNum":25,"Name":"ישיבת מליאה בתאריך 22/02/2023 בשעה 11:00","StartDate":"2023-02-22T11:00:00+02:00","FinishDate":"2023-02-22T19:40:00+02:00","IsSpecialMeeting":false,"LastUpdatedDate":"2023-02-22T10:12:53.022+02:00"}
{"Id":2201938,"Number":46,"KnessetNum":25,"Name":"ישיבת מליאה בתאריך 27/02/2023 בשעה 16:00","StartDate":"2023-02-27T16:00:00+02:00","FinishDate":"2023-02-28T08:00:00+02:00","IsSpecialMeeting":false,"LastUpdatedDate":"2023-02-27T11:15:47.457+02:00"}
{"Id":2201939,"Number":47,"KnessetNum":25,"Name":"ישיבת מליאה בתאריך 28/02/2023 בשעה 16:00","StartDate":"2023-02-28T16:00:00+02:00","FinishDate":"2023-02-28T17:40:00+02:00","IsSpecialMeeting":false,"LastUpdatedDate":"2023-02-28T12:18:57.235+02:00"}
{"Id":2201940,"Number":48,"KnessetNum":25,"Name":"ישיבת מליאה בתאריך 01/03/2023 בשעה 11:00","StartDate":"2023-03-01T11:00:00+02:00","FinishDate":"2023-03-01T16:50:00+02:00","IsSpecialMeeting":false,"LastUpdatedDate":"2023-03-01T10:24:06.898+02:00"}
{"Id":2202474,"Number":49,"KnessetNum":25,"Name":"ישיבת מליאה בתאריך 05/03/2023 בשעה 16:00","StartDate":"2023-03-05T16:00:00+02:00","FinishDate":"2023-03-06T01:00:48+02:00","IsSpecialMeeting":false,"LastUpdatedDate":"2023-08-14T14:37:35.54+03:00"}
{"Id":2202475,"Number":50,"KnessetNum":25,"Name":"ישיבת מליאה בתאריך 06/03/2023 בשעה 09:00","StartDate":"2023-03-06T09:00:00+02:00","FinishDate":"2023-03-06T13:50:00+02:00","IsSpecialMeeting":false,"LastUpdatedDate":"2023-03-06T07:33:14.144+02:00"}
{"Id":2202526,"Number":51,"KnessetNum":25,"Name":"ישיבת מליאה בתאריך 13/03/2023 בשעה 16:00","StartDate":"2023-03-13T16:00:00+02:00","FinishDate":"2023-03-14T08:20:00+02:00","IsSpecialMeeting":false,"LastUpdatedDate":"2023-03-13T15:24:42.781+02:00"}
{"Id":2202527,"Number":52,"KnessetNum":25,"Name":"ישיבת מליאה בתאריך 14/03/2023 בשעה 16:00","StartDate":"2023-03-14T16:00:00+02:00","FinishDate":"2023-03-14T17:00:00+02:00","IsSpecialMeeting":false,"LastUpdatedDate":"2023-03-14T14:11:02.747+02:00"}
{"Id":2202528,"Number":53,"KnessetNum":25,"Name":"ישיבת מליאה בתאריך 15/03/2023 בשעה 11:00","StartDate":"2023-03-15T11:00:00+02:00","FinishDate":"2023-03-15T17:40:00+02:00","IsSpecialMeeting":false,"LastUpdatedDate":"2023-03-14T17:09:14.965+02:00"}
{"Id":2202711,"Number":54,"KnessetNum":25,"Name":"ישיבת מליאה בתאריך 20/03/2023 בשעה 16:00","StartDate":"2023-03-20T16:00:00+02:00","FinishDate":"2023-03-21T02:30:00+02:00","IsSpecialMeeting":false,"LastUpdatedDate":"2023-03-20T15:14:12.162+02:00"}
{"Id":2202712,"Number":55,"KnessetNum":25,"Name":"ישיבת מליאה בתאריך 21/03/2023 בשעה 16:00","StartDate":"2023-03-21T16:00:00+02:00","FinishDate":"2023-03-21T18:20:00+02:00","IsSpecialMeeting":false,"LastUpdatedDate":"2023-03-22T07:08:11.13+02:00"}
{"Id":2202713,"Number":56,"KnessetNum":25,"Name":"ישיבת מליאה בתאריך 22/03/2023 בשעה 11:00","StartDate":"2023-03-22T11:00:00+02:00","FinishDate":"2023-03-23T06:00:00+02:00","IsSpecialMeeting":false,"LastUpdatedDate":"2023-03-28T16:13:49.66+03:00"}
{"Id":2203483,"Number":59,"KnessetNum":25,"Name":"ישיבת מליאה בתאריך 27/03/2023 בשעה 10:00","StartDate":"2023-03-27T10:00:00+03:00","FinishDate":"2023-03-28T15:00:00+03:00","IsSpecialMeeting":false,"LastUpdatedDate":"2023-03-26T15:55:07.2+03:00"}
{"Id":2203484,"Number":60,"KnessetNum":25,"Name":"ישיבת מליאה בתאריך 28/03/2023 בשעה 16:00","StartDate":"2023-03-28T16:00:00+03:00","FinishDate":"2023-03-28T16:10:00+03:00","IsSpecialMeeting":false,"LastUpdatedDate":"2023-03-27T20:41:11.305+03:00"}
{"Id":2203485,"Number":61,"KnessetNum":25,"Name":"ישיבת מליאה בתאריך 29/03/2023 בשעה 11:00","StartDate":"2023-03-29T11:00:00+03:00","FinishDate":"2023-03-29T13:10:00+03:00","IsSpecialMeeting":false,"LastUpdatedDate":"2023-03-29T10:20:57.129+03:00"}
{"Id":2203738,"Number":58,"KnessetNum":25,"Name":"ישיבת מליאה בתאריך 26/03/2023 בשעה 16:00","StartDate":"2023-03-26T16:00:00+03:00","FinishDate":"2023-03-27T01:40:00+03:00","IsSpecialMeeting":false,"LastUpdatedDate":"2023-03-27T08:35:31.577+03:00"}
{"Id":2203826,"Number":57,"KnessetNum":25,"Name":"ישיבת מליאה בתאריך 23/03/2023 בשעה 09:00","StartDate":"2023-03-23T09:00:00+02:00","FinishDate":"2023-03-23T09:40:00+02:00","IsSpecialMeeting":false,"LastUpdatedDate":"2023-03-23T10:55:44.297+02:00"}
{"Id":2204019,"Number":62,"KnessetNum":25,"Name":"ישיבת מליאה בתאריך 02/04/2023 בשעה 10:00","StartDate":"2023-04-02T10:00:00+03:00","FinishDate":"2023-04-02T11:30:00+03:00","IsSpecialMeeting":false,"LastUpdatedDate":"2023-04-02T09:11:29.797+03:00"}
{"Id":2204151,"Number":64,"KnessetNum":25,"Name":"ישיבת מליאה בתאריך 01/05/2023 בשעה 16:00","StartDate":"2023-05-01T16:00:00+03:00","FinishDate":"2023-05-01T22:22:35+03:00","IsSpecialMeeting":false,"LastUpdatedDate":"2023-11-02T15:32:12.073+02:00"}
{"Id":2204152,"Number":65,"KnessetNum":25,"Name":"ישיבת מליאה בתאריך 02/05/2023 בשעה 16:00","StartDate":"2023-05-02T16:00:00+03:00","FinishDate":"2023-05-02T18:30:00+03:00","IsSpecialMeeting":false,"LastUpdatedDate":"2023-05-02T08:36:33.069+03:00"}
{"Id":2204153,"Number":66,"KnessetNum":25,"Name":"ישיבת מליאה בתאריך 03/05/2023 בשעה 11:00","StartDate":"2023-05-03T11:00:00+03:00","FinishDate":"2023-05-03T16:20:00+03:00","IsSpecialMeeting":false,"LastUpdatedDate":"2023-05-03T10:04:00.991+03:00"}
{"Id":2204236,"Number":63,"KnessetNum":25,"Name":"ישיבת מליאה בתאריך 19/04/2023 בשעה 12:00","StartDate":"2023-04-19T12:00:00+03:00","FinishDate":"2023-04-19T15:42:35+03:00","IsSpecialMeeting":false,"LastUpdatedDate":"2023-10-18T11:59:57.763+03:00"}
{"Id":2204601,"Number":67,"KnessetNum":25,"Name":"ישיבת מליאה בתאריך 09/05/2023 בשעה 16:00","StartDate":"2023-05-09T16:00:00+03:00","FinishDate":"2023-05-09T17:30:00+03:00","IsSpecialMeeting":false,"LastUpdatedDate":"2023-05-09T15:23:50.833+03:00"}
{"Id":2204602,"Number":68,"KnessetNum":25,"Name":"ישיבת מליאה בתאריך 10/05/2023 בשעה 11:00","StartDate":"2023-05-10T11:00:00+03:00","FinishDate":"2023-05-10T16:30:00+03:00","IsSpecialMeeting":false,"LastUpdatedDate":"2023-05-10T08:46:09.289+03:00"}
{"Id":2204833,"Number":69,"KnessetNum":25,"Name":"ישיבת מליאה בתאריך 15/05/2023 בשעה 16:00","StartDate":"2023-05-15T16:00:00+03:00","FinishDate":"2023-05-15T21:59:29+03:00","IsSpecialMeeting":false,"LastUpdatedDate":"2023-12-04T15:49:27.197+02:00"}
{"Id":2204834,"Number":70,"KnessetNum":25,"Name":"ישיבת מליאה בתאריך 16/05/2023 בשעה 16:00","StartDate":"2023-05-16T16:00:00+03:00","FinishDate":"2023-05-16T18:30:00+03:00","IsSpecialMeeting":false,"LastUpdatedDate":"2023-05-16T15:27:48.175+03:00"}
{"Id":2204835,"Number":71,"KnessetNum":25,"Name":"ישיבת מליאה בתאריך 17/05/2023 בשעה 11:00","StartDate":"2023-05-17T11:00:00+03:00","FinishDate":"2023-05-17T18:40:00+03:00","IsSpecialMeeting":false,"LastUpdatedDate":"2023-05-17T10:20:06.067+03:00"}
{"Id":2205631,"Number":72,"KnessetNum":25,"Name":"ישיבת מליאה בתאריך 22/05/2023 בשעה 09:00","StartDate":"2023-05-22T09:00:00+03:00","FinishDate":"2023-05-24T06:15:11+03:00","IsSpecialMeeting":false,"LastUpdatedDate":"2023-09-11T15:44:42.287+03:00"}
{"Id":2205632,"Number":73,"KnessetNum":25,"Name":"ישיבת מליאה בתאריך 29/05/2023 בשעה 16:00","StartDate":"2023-05-29T16:00:00+03:00","FinishDate":"2023-05-30T00:40:00+03:00","IsSpecialMeeting":false,"LastUpdatedDate":"2023-05-29T15:44:20.283+03:00"}
{"Id":2205633,"Number":74,"KnessetNum":25,"Name":"ישיבת מליאה בתאריך 30/05/2023 בשעה 16:00","StartDate":"2023-05-30T16:00:00+03:00","FinishDate":"2023-05-30T17:40:00+03:00","IsSpecialMeeting":false,"LastUpdatedDate":"2023-05-30T13:11:50.69+03:00"}
{"Id":2205634,"Number":75,"KnessetNum":25,"Name":"ישיבת מליאה בתאריך 31/05/2023 בשעה 11:00","StartDate":"2023-05-31T11:00:00+03:00","FinishDate":"2023-05-31T18:00:00+03:00","IsSpecialMeeting":false,"LastUpdatedDate":"2023-05-31T09:51:34.793+03:00"}
{"Id":2205695,"Number":76,"KnessetNum":25,"Name":"ישיבת מליאה בתאריך 05/06/2023 בשעה 16:00","StartDate":"2023-06-05T16:00:00+03:00","FinishDate":"2023-06-05T23:10:00+03:00","IsSpecialMeeting":false,"LastUpdatedDate":"2023-06-05T10:57:50.238+03:00"}
{"Id":2205696,"Number":77,"KnessetNum":25,"Name":"ישיבת מליאה בתאריך 06/06/2023 בשעה 16:00","StartDate":"2023-06-06T16:00:00+03:00","FinishDate":"2023-06-06T17:20:00+03:00","IsSpecialMeeting":false,"LastUpdatedDate":"2023-06-06T10:28:35.869+03:00"}
{"Id":2205697,"Number":78,"KnessetNum":25,"Name":"ישיבת מליאה בתאריך 07/06/2023 בשעה 11:00","StartDate":"2023-06-07T11:00:00+03:00","FinishDate":"2023-06-07T18:20:00+03:00","IsSpecialMeeting":false,"LastUpdatedDate":"2023-06-07T09:57:51.872+03:00"}
{"Id":2206463,"Number":79,"KnessetNum":25,"Name":"ישיבת מליאה בתאריך 12/06/2023 בשעה 16:00","StartDate":"2023-06-12T16:00:00+03:00","FinishDate":"2023-06-13T01:20:00+03:00","IsSpecialMeeting":false,"LastUpdatedDate":"2023-06-12T13:53:26.55+03:00"}
{"Id":2206464,"Number":80,"KnessetNum":25,"Name":"ישיבת מליאה בתאריך 13/06/2023 בשעה 16:00","StartDate":"2023-06-13T16:00:00+03:00","FinishDate":"2023-06-13T18:10:00+03:00","IsSpecialMeeting":false,"LastUpdatedDate":"2023-06-13T10:20:15.491+03:00"}
{"Id":2206465,"Number":81,"KnessetNum":25,"Name":"ישיבת מליאה בתאריך 14/06/2023 בשעה 11:00","StartDate":"2023-06-14T11:00:00+03:00","FinishDate":"2023-06-14T21:50:00+03:00","IsSpecialMeeting":false,"LastUpdatedDate":"2023-06-14T09:34:41.598+03:00"}
{"Id":2206837,"Number":82,"KnessetNum":25,"Name":"ישיבת מליאה בתאריך 19/06/2023 בשעה 16:00","StartDate":"2023-06-19T16:00:00+03:00","FinishDate":"2023-06-19T22:00:00+03:00","IsSpecialMeeting":false,"LastUpdatedDate":"2023-06-19T11:03:57.059+03:00"}
{"Id":2206838,"Number":83,"KnessetNum":25,"Name":"ישיבת מליאה בתאריך 20/06/2023 בשעה 16:00","StartDate":"2023-06-20T16:00:00+03:00","FinishDate":"2023-06-20T19:10:00+03:00","IsSpecialMeeting":false,"LastUpdatedDate":"2023-06-20T13:10:17.256+03:00"}
{"Id":2206839,"Number":84,"KnessetNum":25,"Name":"ישיבת מליאה בתאריך 21/06/2023 בשעה 11:00","StartDate":"2023-06-21T11:00:00+03:00","FinishDate":"2023-06-21T14:50:00+03:00","IsSpecialMeeting":false,"LastUpdatedDate":"2023-06-21T10:04:35.542+03:00"}
{"Id":2207081,"Number":85,"KnessetNum":25,"Name":"ישיבת מליאה בתאריך 26/06/2023 בשעה 16:00","StartDate":"2023-06-26T16:00:00+03:00","FinishDate":"2023-06-26T22:50:00+03:00","IsSpecialMeeting":false,"LastUpdatedDate":"2023-06-26T15:16:08.418+03:00"}
{"Id":2207082,"Number":86,"KnessetNum":25,"Name":"ישיבת מליאה בתאריך 27/06/2023 בשעה 16:00","StartDate":"2023-06-27T16:00:00+03:00","FinishDate":"2023-06-27T18:10:59+03:00","IsSpecialMeeting":false,"LastUpdatedDate":"2023-11-30T17:09:47.553+02:00"}
{"Id":2207083,"Number":87,"KnessetNum":25,"Name":"ישיבת מליאה בתאריך 28/06/2023 בשעה 11:00","StartDate":"2023-06-28T11:00:00+03:00","FinishDate":"2023-06-28T17:10:00+03:00","IsSpecialMeeting":false,"LastUpdatedDate":"2023-06-28T08:59:43.609+03:00"}
{"Id":2207566,"Number":88,"KnessetNum":25,"Name":"ישיבת מליאה בתאריך 03/07/2023 בשעה 16:00","StartDate":"2023-07-03T16:00:00+03:00","FinishDate":"2023-07-04T05:50:00+03:00","IsSpecialMeeting":false,"LastUpdatedDate":"2023-07-03T15:09:50.498+03:00"}
{"Id":2207567,"Number":89,"KnessetNum":25,"Name":"ישיבת מליאה בתאריך 04/07/2023 בשעה 16:00","StartDate":"2023-07-04T16:00:00+03:00","FinishDate":"2023-07-05T01:30:00+03:00","IsSpecialMeeting":false,"LastUpdatedDate":"2023-07-04T22:57:35.853+03:00"}
{"Id":2207568,"Number":90,"KnessetNum":25,"Name":"ישיבת מליאה בתאריך 05/07/2023 בשעה 11:00","StartDate":"2023-07-05T11:00:00+03:00","FinishDate":"2023-07-06T02:10:00+03:00","IsSpecialMeeting":false,"LastUpdatedDate":"2023-07-05T10:02:40.932+03:00"}
{"Id":2208049,"Number":91,"KnessetNum":25,"Name":"ישיבת מליאה בתאריך 10/07/2023 בשעה 16:00","StartDate":"2023-07-10T16:00:00+03:00","FinishDate":"2023-07-11T01:31:20+03:00","IsSpecialMeeting":false,"LastUpdatedDate":"2023-07-30T23:51:15.503+03:00"}
{"Id":2208050,"Number":92,"KnessetNum":25,"Name":"ישיבת מליאה בתאריך 11/07/2023 בשעה 16:00","StartDate":"2023-07-11T16:00:00+03:00","FinishDate":"2023-07-11T18:34:09+03:00","IsSpecialMeeting":false,"LastUpdatedDate":"2023-07-30T23:51:28.1+03:00"}
{"Id":2208051,"Number":93,"KnessetNum":25,"Name":"ישיבת מליאה בתאריך 12/07/2023 בשעה 11:00","StartDate":"2023-07-12T11:00:00+03:00","FinishDate":"2023-07-12T20:31:42+03:00","IsSpecialMeeting":false,"LastUpdatedDate":"2023-07-30T23:51:06.643+03:00"}
{"Id":2208510,"Number":94,"KnessetNum":25,"Name":"ישיבת מליאה בתאריך 17/07/2023 בשעה 16:00","StartDate":"2023-07-17T16:00:00+03:00","FinishDate":"2023-07-17T20:28:25+03:00","IsSpecialMeeting":false,"LastUpdatedDate":"2023-07-31T00:05:14.267+03:00"}
{"Id":2208511,"Number":95,"KnessetNum":25,"Name":"ישיבת מליאה בתאריך 18/07/2023 בשעה 16:00","StartDate":"2023-07-18T16:00:00+03:00","FinishDate":"2023-07-18T16:54:48+03:00","IsSpecialMeeting":false,"LastUpdatedDate":"2023-07-30T23:51:11.317+03:00"}
{"Id":2208512,"Number":96,"KnessetNum":25,"Name":"ישיבת מליאה בתאריך 19/07/2023 בשעה 11:00","StartDate":"2023-07-19T11:00:00+03:00","FinishDate":"2023-07-20T03:12:02+03:00","IsSpecialMeeting":false,"LastUpdatedDate":"2023-07-30T23:50:47.167+03:00"}
{"Id":2208847,"Number":98,"KnessetNum":25,"Name":"ישיבת מליאה בתאריך 24/07/2023 בשעה 16:00","StartDate":"2023-07-24T16:00:00+03:00","FinishDate":"2023-07-25T00:07:24+03:00","IsSpecialMeeting":false,"LastUpdatedDate":"2024-01-03T16:09:51.643+02:00"}
{"Id":2208848,"Number":99,"KnessetNum":25,"Name":"ישיבת מליאה בתאריך 25/07/2023 בשעה 16:00","StartDate":"2023-07-25T16:00:00+03:00","FinishDate":"2023-07-25T20:49:46+03:00","IsSpecialMeeting":false,"LastUpdatedDate":"2023-09-20T10:29:14.617+03:00"}
{"Id":2208849,"Number":100,"KnessetNum":25,"Name":"ישיבת מליאה בתאריך 26/07/2023 בשעה 11:00","StartDate":"2023-07-26T11:00:00+03:00","FinishDate":"2023-07-26T11:01:54+03:00","IsSpecialMeeting":false,"LastUpdatedDate":"2023-07-30T23:46:15.09+03:00"}
{"Id":2209083,"Number":97,"KnessetNum":25,"Name":"ישיבת מליאה בתאריך 23/07/2023 בשעה 10:00","StartDate":"2023-07-23T10:00:00+03:00","FinishDate":"2023-07-24T15:52:00+03:00","IsSpecialMeeting":false,"LastUpdatedDate":"2023-11-29T18:28:30.343+02:00"}
{"Id":2209468,"Number":101,"KnessetNum":25,"Name":"ישיבת מליאה בתאריך 30/07/2023 בשעה 12:00","StartDate":"2023-07-30T12:00:00+03:00","FinishDate":"2023-07-30T22:00:00+03:00","IsSpecialMeeting":false,"LastUpdatedDate":"2023-07-30T23:35:15.473+03:00"}
{"Id":2209776,"Number":105,"KnessetNum":25,"Name":"ישיבת מליאה בתאריך 16/10/2023 בשעה 16:00","StartDate":"2023-10-16T16:00:00+03:00","FinishDate":"2023-10-16T18:50:00+03:00","IsSpecialMeeting":false,"LastUpdatedDate":"2023-11-07T12:58:07.683+02:00"}
{"Id":2209778,"Number":106,"KnessetNum":25,"Name":"ישיבת מליאה בתאריך 18/10/2023 בשעה 11:00","StartDate":"2023-10-18T11:00:00+03:00","FinishDate":"2023-10-18T18:30:00+03:00","IsSpecialMeeting":false,"LastUpdatedDate":"2023-10-19T08:45:23.083+03:00"}
{"Id":2209932,"Number":102,"KnessetNum":25,"Name":"ישיבת מליאה בתאריך 16/08/2023 בשעה 11:00","StartDate":"2023-08-16T11:00:00+03:00","FinishDate":"2023-08-16T14:20:00+03:00","IsSpecialMeeting":false,"LastUpdatedDate":"2023-08-16T09:18:45.198+03:00"}