{"Id":238935,"Number":3,"KnessetNum":13,"Name":"ישיבת מליאה בתאריך 20/07/1992 בשעה 16:00","StartDate":"1992-07-20T16:00:00+03:00","FinishDate":"1992-07-20T19:07:00+03:00","IsSpecialMeeting":null,"LastUpdatedDate":"2025-02-12T14:12:10.72+02:00"}
{"Id":238936,"Number":4,"KnessetNum":13,"Name":"ישיבת מליאה בתאריך 21/07/1992 בשעה 16:00","StartDate":"1992-07-21T16:00:00+03:00","FinishDate":"1992-07-21T19:22:00+03:00","IsSpecialMeeting":null,"LastUpdatedDate":"2025-02-12T14:12:58.063+02:00"}
{"Id":238939,"Number":8,"KnessetNum":13,"Name":"ישיבת מליאה בתאריך 29/07/1992 בשעה 11:02","StartDate":"1992-07-29T11:02:00+03:00","FinishDate":"1992-07-29T17:00:00+03:00","IsSpecialMeeting":null,"LastUpdatedDate":"2025-02-12T14:20:29.697+02:00"}
{"Id":238947,"Number":16,"KnessetNum":13,"Name":"ישיבת מליאה בתאריך 27/10/1992 בשעה 16:00","StartDate":"1992-10-27T16:00:00+02:00","FinishDate":"1992-10-27T18:58:00+02:00","IsSpecialMeeting":null,"LastUpdatedDate":"2025-02-12T14:42:37.933+02:00"}
{"Id":238948,"Number":17,"KnessetNum":13,"Name":"ישיבת מליאה בתאריך 28/10/1992 בשעה 11:04","StartDate":"1992-10-28T11:04:00+02:00","FinishDate":"1992-10-28T18:58:00+02:00","IsSpecialMeeting":null,"LastUpdatedDate":"2025-02-12T14:43:11.423+02:00"}
{"Id":238949,"Number":19,"KnessetNum":13,"Name":"ישיבת מליאה בתאריך 03/11/1992 בשעה 16:01","StartDate":"1992-11-03T16:01:00+02:00","FinishDate":"1992-11-03T22:05:00+02:00","IsSpecialMeeting":null,"LastUpdatedDate":"2025-02-12T15:25:23.943+02:00"}
{"Id":238952,"Number":22,"KnessetNum":13,"Name":"ישיבת מליאה בתאריך 10/11/1992 בשעה 16:01","StartDate":"1992-11-10T16:01:00+02:00","FinishDate":"1992-11-10T17:00:00+02:00","IsSpecialMeeting":null,"LastUpdatedDate":"2025-02-12T15:27:01.603+02:00"}
{"Id":238956,"Number":28,"KnessetNum":13,"Name":"ישיבת מליאה בתאריך 24/11/1992 בשעה 16:02","StartDate":"1992-11-24T16:02:00+02:00","FinishDate":"1992-11-24T20:19:00+02:00","IsSpecialMeeting":null,"LastUpdatedDate":"2025-02-12T15:37:00.133+02:00"}
{"Id":238963,"Number":38,"KnessetNum":13,"Name":"ישיבת מליאה בתאריך 16/12/1992 בשעה 11:03","StartDate":"1992-12-16T11:03:00+02:00","FinishDate":"1992-12-16T20:27:00+02:00","IsSpecialMeeting":null,"LastUpdatedDate":"2025-02-12T15:51:28.123+02:00"}
{"Id":238970,"Number":50,"KnessetNum":13,"Name":"ישיבת מליאה בתאריך 12/01/1993 בשעה 16:05","StartDate":"1993-01-12T16:05:00+02:00","FinishDate":"1993-01-12T22:05:00+02:00","IsSpecialMeeting":null,"LastUpdatedDate":"2025-02-12T16:00:03.31+02:00"}
{"Id":238988,"Number":81,"KnessetNum":13,"Name":"ישיבת מליאה בתאריך 24/03/1993 בשעה 09:04","StartDate":"1993-03-24T09:04:00+02:00","FinishDate":"1993-03-24T12:25:00+02:00","IsSpecialMeeting":null,"LastUpdatedDate":"2025-02-13T09:06:47.143+02:00"}
{"Id":238990,"Number":82,"KnessetNum":13,"Name":"ישיבת מליאה בתאריך 08/04/1993 בשעה 11:00","StartDate":"1993-04-08T11:00:00+03:00","FinishDate":"1993-04-08T13:18:00+03:00","IsSpecialMeeting":true,"LastUpdatedDate":"2025-02-13T09:07:36.617+02:00"}
{"Id":238992,"Number":84,"KnessetNum":13,"Name":"ישיבת מליאה בתאריך 28/04/1993 בשעה 11:01","StartDate":"1993-04-28T11:01:00+03:00","FinishDate":"1993-04-28T14:28:00+03:00","IsSpecialMeeting":true,"LastUpdatedDate":"2025-02-13T09:08:56.76+02:00"}
{"Id":238996,"Number":91,"KnessetNum":13,"Name":"ישיבת מליאה בתאריך 13/05/1993 בשעה 19:20","StartDate":"1993-05-13T19:20:00+03:00","FinishDate":"1993-05-13T20:05:00+03:00","IsSpecialMeeting":true,"LastUpdatedDate":"2025-02-13T09:46:02.543+02:00"}
{"Id":239021,"Number":127,"KnessetNum":13,"Name":"ישיבת מליאה בתאריך 30/08/1993 בשעה 11:00","StartDate":"1993-08-30T11:00:00+03:00","FinishDate":"1993-08-30T16:26:00+03:00","IsSpecialMeeting":null,"LastUpdatedDate":"2025-02-13T11:10:23.58+02:00"}
{"Id":239023,"Number":133,"KnessetNum":13,"Name":"ישיבת מליאה בתאריך 12/10/1993 בשעה 16:01","StartDate":"1993-10-12T16:01:00+02:00","FinishDate":"1993-10-12T20:33:00+02:00","IsSpecialMeeting":null,"LastUpdatedDate":"2025-02-13T11:15:42.723+02:00"}
{"Id":239031,"Number":148,"KnessetNum":13,"Name":"ישיבת מליאה בתאריך 16/11/1993 בשעה 16:01","StartDate":"1993-11-16T16:01:00+02:00","FinishDate":"1993-11-16T21:12:00+02:00","IsSpecialMeeting":null,"LastUpdatedDate":"2025-02-13T11:50:55.853+02:00"}
{"Id":239042,"Number":163,"KnessetNum":13,"Name":"ישיבת מליאה בתאריך 21/12/1993 בשעה 16:00","StartDate":"1993-12-21T16:00:00+02:00","FinishDate":"1993-12-22T01:31:00+02:00","IsSpecialMeeting":null,"LastUpdatedDate":"2025-02-13T12:27:01.22+02:00"}
{"Id":239059,"Number":202,"KnessetNum":13,"Name":"ישיבת מליאה בתאריך 23/03/1994 בשעה 10:01","StartDate":"1994-03-23T10:01:00+02:00","FinishDate":"1994-03-23T14:26:00+02:00","IsSpecialMeeting":true,"LastUpdatedDate":"2025-02-13T14:07:02.207+02:00"}
{"Id":239063,"Number":203,"KnessetNum":13,"Name":"ישיבת מליאה בתאריך 11/04/1994 בשעה 10:02","StartDate":"1994-04-11T10:02:00+03:00","FinishDate":"1994-04-11T14:53:00+03:00","IsSpecialMeeting":true,"LastUpdatedDate":"2025-02-13T14:07:46.317+02:00"}
{"Id":239085,"Number":239,"KnessetNum":13,"Name":"ישיבת מליאה בתאריך 06/07/1994 בשעה 11:02","StartDate":"1994-07-06T11:02:00+03:00","FinishDate":"1994-07-06T18:28:00+03:00","IsSpecialMeeting":null,"LastUpdatedDate":"2025-02-16T09:20:06.33+02:00"}
{"Id":239092,"Number":251,"KnessetNum":13,"Name":"ישיבת מליאה בתאריך 13/09/1994 בשעה 10:00","StartDate":"1994-09-13T10:00:00+03:00","FinishDate":"1994-09-13T17:18:00+03:00","IsSpecialMeeting":true,"LastUpdatedDate":"2025-02-16T09:47:44.47+02:00"}
{"Id":239122,"Number":300,"KnessetNum":13,"Name":"ישיבת מליאה בתאריך 17/01/1995 בשעה 15:03","StartDate":"1995-01-17T15:03:00+02:00","FinishDate":"1995-01-18T02:08:00+02:00","IsSpecialMeeting":null,"LastUpdatedDate":"2025-02-16T11:53:14.407+02:00"}
{"Id":239138,"Number":335,"KnessetNum":13,"Name":"ישיבת מליאה בתאריך 12/04/1995 בשעה 11:02","StartDate":"1995-04-12T11:02:00+03:00","FinishDate":"1995-04-12T16:43:00+03:00","IsSpecialMeeting":null,"LastUpdatedDate":"2025-02-16T14:36:27.023+02:00"}
{"Id":239140,"Number":336,"KnessetNum":13,"Name":"ישיבת מליאה בתאריך 09/05/1995 בשעה 12:01","StartDate":"1995-05-09T12:01:00+03:00","FinishDate":"1995-05-09T17:30:00+03:00","IsSpecialMeeting":null,"LastUpdatedDate":"2025-02-16T14:37:25.69+02:00"}
{"Id":239163,"Number":373,"KnessetNum":13,"Name":"ישיבת מליאה בתאריך 15/08/1995 בשעה 14:03","StartDate":"1995-08-15T14:03:00+03:00","FinishDate":"1995-08-15T16:48:00+03:00","IsSpecialMeeting":true,"LastUpdatedDate":"2025-02-16T16:15:52.693+02:00"}
{"Id":239165,"Number":374,"KnessetNum":13,"Name":"ישיבת מליאה בתאריך 28/08/1995 בשעה 11:02","StartDate":"1995-08-28T11:02:00+03:00","FinishDate":"1995-08-28T13:54:00+03:00","IsSpecialMeeting":true,"LastUpdatedDate":"2025-02-16T16:16:30.28+02:00"}
{"Id":239167,"Number":375,"KnessetNum":13,"Name":"ישיבת מליאה בתאריך 20/09/1995 בשעה 11:00","StartDate":"1995-09-20T11:00:00+03:00","FinishDate":"1995-09-20T15:17:00+03:00","IsSpecialMeeting":true,"LastUpdatedDate":"2025-02-16T16:17:35.303+02:00"}
{"Id":239176,"Number":388,"KnessetNum":13,"Name":"ישיבת מליאה בתאריך 22/11/1995 בשעה 11:04","StartDate":"1995-11-22T11:04:00+02:00","FinishDate":"1995-11-22T15:44:00+02:00","IsSpecialMeeting":null,"LastUpdatedDate":"2025-02-23T09:24:23.74+02:00"}
{"Id":239180,"Number":393,"KnessetNum":13,"Name":"ישיבת מליאה בתאריך 05/12/1995 בשעה 19:00","StartDate":"1995-12-05T19:00:00+02:00","FinishDate":"1995-12-05T22:57:00+02:00","IsSpecialMeeting":null,"LastUpdatedDate":"2025-02-23T09:40:02.553+02:00"}
{"Id":239204,"Number":3,"KnessetNum":14,"Name":"ישיבת מליאה בתאריך 24/06/1996 בשעה 16:00","StartDate":"1996-06-24T16:00:00+03:00","FinishDate":"1996-06-24T19:08:00+03:00","IsSpecialMeeting":null,"LastUpdatedDate":"2020-06-11T15:10:44.233+03:00"}
{"Id":239206,"Number":4,"KnessetNum":14,"Name":"ישיבת מליאה בתאריך 26/06/1996 בשעה 11:01","StartDate":"1996-06-26T11:01:00+03:00","FinishDate":"1996-06-26T15:20:00+03:00","IsSpecialMeeting":null,"LastUpdatedDate":"2025-02-23T13:43:44.913+02:00"}
{"Id":239209,"Number":5,"KnessetNum":14,"Name":"ישיבת מליאה בתאריך 01/07/1996 בשעה 16:03","StartDate":"1996-07-01T16:03:00+03:00","FinishDate":"1996-07-01T19:56:00+03:00","IsSpecialMeeting":null,"LastUpdatedDate":"2025-02-23T13:44:23.447+02:00"}
{"Id":239210,"Number":6,"KnessetNum":14,"Name":"ישיבת מליאה בתאריך 02/07/1996 בשעה 16:01","StartDate":"1996-07-02T16:01:00+03:00","FinishDate":"1996-07-02T18:20:00+03:00","IsSpecialMeeting":null,"LastUpdatedDate":"2025-02-23T13:45:00.337+02:00"}
{"Id":239211,"Number":7,"KnessetNum":14,"Name":"ישיבת מליאה בתאריך 03/07/1996 בשעה 11:02","StartDate":"1996-07-03T11:02:00+03:00","FinishDate":"1996-07-03T20:30:00+03:00","IsSpecialMeeting":null,"LastUpdatedDate":"2025-02-23T13:45:44.773+02:00"}
{"Id":239214,"Number":8,"KnessetNum":14,"Name":"ישיבת מליאה בתאריך 08/07/1996 בשעה 16:02","StartDate":"1996-07-08T16:02:00+03:00","FinishDate":"1996-07-08T19:16:00+03:00","IsSpecialMeeting":null,"LastUpdatedDate":"2020-06-10T15:43:16.243+03:00"}
{"Id":239217,"Number":13,"KnessetNum":14,"Name":"ישיבת מליאה בתאריך 17/07/1996 בשעה 11:03","StartDate":"1996-07-17T11:03:00+03:00","FinishDate":"1996-07-17T17:14:00+03:00","IsSpecialMeeting":null,"LastUpdatedDate":"2025-02-23T13:56:48.583+02:00"}
{"Id":239220,"Number":16,"KnessetNum":14,"Name":"ישיבת מליאה בתאריך 24/07/1996 בשעה 09:03","StartDate":"1996-07-24T09:03:00+03:00","FinishDate":"1996-07-24T14:00:00+03:00","IsSpecialMeeting":null,"LastUpdatedDate":"2025-02-23T14:02:29.947+02:00"}
{"Id":239222,"Number":18,"KnessetNum":14,"Name":"ישיבת מליאה בתאריך 03/09/1996 בשעה 11:01","StartDate":"1996-09-03T11:01:00+03:00","FinishDate":"1996-09-03T14:00:00+03:00","IsSpecialMeeting":true,"LastUpdatedDate":"2025-02-23T14:04:25.473+02:00"}
{"Id":239224,"Number":19,"KnessetNum":14,"Name":"ישיבת מליאה בתאריך 17/09/1996 בשעה 11:00","StartDate":"1996-09-17T11:00:00+03:00","FinishDate":"1996-09-17T12:52:00+03:00","IsSpecialMeeting":true,"LastUpdatedDate":"2025-02-23T14:05:12.26+02:00"}
{"Id":239227,"Number":21,"KnessetNum":14,"Name":"ישיבת מליאה בתאריך 08/10/1996 בשעה 16:02","StartDate":"1996-10-08T16:02:00+02:00","FinishDate":"1996-10-08T18:05:00+02:00","IsSpecialMeeting":null,"LastUpdatedDate":"2025-02-23T14:05:47.367+02:00"}
{"Id":239230,"Number":29,"KnessetNum":14,"Name":"ישיבת מליאה בתאריך 24/10/1996 בשעה 17:01","StartDate":"1996-10-24T17:01:00+02:00","FinishDate":"1996-10-24T17:43:00+02:00","IsSpecialMeeting":null,"LastUpdatedDate":"2025-02-23T14:21:17.103+02:00"}
{"Id":239232,"Number":31,"KnessetNum":14,"Name":"ישיבת מליאה בתאריך 29/10/1996 בשעה 16:05","StartDate":"1996-10-29T16:05:00+02:00","FinishDate":"1996-10-29T21:46:00+02:00","IsSpecialMeeting":null,"LastUpdatedDate":"2025-02-23T14:22:15.817+02:00"}
{"Id":239235,"Number":34,"KnessetNum":14,"Name":"ישיבת מליאה בתאריך 05/11/1996 בשעה 16:02","StartDate":"1996-11-05T16:02:00+02:00","FinishDate":"1996-11-05T20:41:00+02:00","IsSpecialMeeting":null,"LastUpdatedDate":"2025-02-23T14:24:56.117+02:00"}
{"Id":239239,"Number":44,"KnessetNum":14,"Name":"ישיבת מליאה בתאריך 27/11/1996 בשעה 11:02","StartDate":"1996-11-27T11:02:00+02:00","FinishDate":"1996-11-27T17:09:00+02:00","IsSpecialMeeting":null,"LastUpdatedDate":"2025-02-23T14:30:24.253+02:00"}
{"Id":239250,"Number":62,"KnessetNum":14,"Name":"ישיבת מליאה בתאריך 16/01/1997 בשעה 11:05","StartDate":"1997-01-16T11:05:00+02:00","FinishDate":"1997-01-16T22:59:00+02:00","IsSpecialMeeting":null,"LastUpdatedDate":"2020-06-11T14:26:06.067+03:00"}
{"Id":239251,"Number":64,"KnessetNum":14,"Name":"ישיבת מליאה בתאריך 21/01/1997 בשעה 16:04","StartDate":"1997-01-21T16:04:00+02:00","FinishDate":"1997-01-21T16:42:00+02:00","IsSpecialMeeting":null,"LastUpdatedDate":"2021-12-26T12:47:51.543+02:00"}
{"Id":239255,"Number":71,"KnessetNum":14,"Name":"ישיבת מליאה בתאריך 05/02/1997 בשעה 11:04","StartDate":"1997-02-05T11:04:00+02:00","FinishDate":"1997-02-05T11:26:00+02:00","IsSpecialMeeting":null,"LastUpdatedDate":"2020-06-11T14:21:43.42+03:00"}
{"Id":239266,"Number":95,"KnessetNum":14,"Name":"ישיבת מליאה בתאריך 14/04/1997 בשעה 10:04","StartDate":"1997-04-14T10:04:00+03:00","FinishDate":"1997-04-14T11:48:00+03:00","IsSpecialMeeting":null,"LastUpdatedDate":"2025-02-24T09:41:32.47+02:00"}
{"Id":239268,"Number":96,"KnessetNum":14,"Name":"ישיבת מליאה בתאריך 30/04/1997 בשעה 11:02","StartDate":"1997-04-30T11:02:00+03:00","FinishDate":"1997-04-30T13:01:00+03:00","IsSpecialMeeting":null,"LastUpdatedDate":"2025-02-24T09:45:19.36+02:00"}
{"Id":239269,"Number":97,"KnessetNum":14,"Name":"ישיבת מליאה בתאריך 08/05/1997 בשעה 11:05","StartDate":"1997-05-08T11:05:00+03:00","FinishDate":"1997-05-08T13:34:00+03:00","IsSpecialMeeting":true,"LastUpdatedDate":"2025-02-24T09:48:07.41+02:00"}
{"Id":239274,"Number":106,"KnessetNum":14,"Name":"ישיבת מליאה בתאריך 04/06/1997 בשעה 11:02","StartDate":"1997-06-04T11:02:00+03:00","FinishDate":"1997-06-04T17:15:00+03:00","IsSpecialMeeting":null,"LastUpdatedDate":"2020-06-11T14:12:16.757+03:00"}
{"Id":239285,"Number":130,"KnessetNum":14,"Name":"ישיבת מליאה בתאריך 13/08/1997 בשעה 11:04","StartDate":"1997-08-13T11:04:00+03:00","FinishDate":"1997-08-13T13:39:00+03:00","IsSpecialMeeting":true,"LastUpdatedDate":"2025-02-24T11:20:51.66+02:00"}
{"Id":239286,"Number":132,"KnessetNum":14,"Name":"ישיבת מליאה בתאריך 24/09/1997 בשעה 11:01","StartDate":"1997-09-24T11:01:00+02:00","FinishDate":"1997-09-24T14:37:00+02:00","IsSpecialMeeting":true,"LastUpdatedDate":"2025-02-24T11:22:15.92+02:00"}
{"Id":239287,"Number":133,"KnessetNum":14,"Name":"ישיבת מליאה בתאריך 13/10/1997 בשעה 11:02","StartDate":"1997-10-13T11:02:00+02:00","FinishDate":null,"IsSpecialMeeting":null,"LastUpdatedDate":"2025-02-24T11:22:55.04+02:00"}
{"Id":239292,"Number":142,"KnessetNum":14,"Name":"ישיבת מליאה בתאריך 12/11/1997 בשעה 10:06","StartDate":"1997-11-12T10:06:00+02:00","FinishDate":"1997-11-12T13:17:00+02:00","IsSpecialMeeting":null,"LastUpdatedDate":"2020-06-11T13:56:04.087+03:00"}
{"Id":239298,"Number":154,"KnessetNum":14,"Name":"ישיבת מליאה בתאריך 09/12/1997 בשעה 16:04","StartDate":"1997-12-09T16:04:00+02:00","FinishDate":"1997-12-09T19:53:00+02:00","IsSpecialMeeting":null,"LastUpdatedDate":"2025-02-24T11:36:54.74+02:00"}
{"Id":239311,"Number":187,"KnessetNum":14,"Name":"ישיבת מליאה בתאריך 04/03/1998 בשעה 11:02","StartDate":"1998-03-04T11:02:00+02:00","FinishDate":"1998-03-04T12:47:00+02:00","IsSpecialMeeting":null,"LastUpdatedDate":"2025-02-24T14:01:20.36+02:00"}
{"Id":239315,"Number":197,"KnessetNum":14,"Name":"ישיבת מליאה בתאריך 08/04/1998 בשעה 11:03","StartDate":"1998-04-08T11:03:00+03:00","FinishDate":"1998-04-08T12:44:00+03:00","IsSpecialMeeting":true,"LastUpdatedDate":"2025-02-24T14:26:08.59+02:00"}
{"Id":239317,"Number":199,"KnessetNum":14,"Name":"ישיבת מליאה בתאריך 05/05/1998 בשעה 16:02","StartDate":"1998-05-05T16:02:00+03:00","FinishDate":"1998-05-05T20:50:00+03:00","IsSpecialMeeting":null,"LastUpdatedDate":"2025-02-24T14:27:21.9+02:00"}
{"Id":239321,"Number":208,"KnessetNum":14,"Name":"ישיבת מליאה בתאריך 26/05/1998 בשעה 16:06","StartDate":"1998-05-26T16:06:00+03:00","FinishDate":"1998-05-26T19:48:00+03:00","IsSpecialMeeting":null,"LastUpdatedDate":"2025-02-25T08:30:54.68+02:00"}
{"Id":239330,"Number":222,"KnessetNum":14,"Name":"ישיבת מליאה בתאריך 30/06/1998 בשעה 16:03","StartDate":"1998-06-30T16:03:00+03:00","FinishDate":"1998-06-30T21:31:00+03:00","IsSpecialMeeting":null,"LastUpdatedDate":"2020-06-11T13:32:15.737+03:00"}
{"Id":239337,"Number":236,"KnessetNum":14,"Name":"ישיבת מליאה בתאריך 24/08/1998 בשעה 11:03","StartDate":"1998-08-24T11:03:00+03:00","FinishDate":"1998-08-24T12:34:00+03:00","IsSpecialMeeting":null,"LastUpdatedDate":"2025-02-25T10:26:52.733+02:00"}
{"Id":239338,"Number":237,"KnessetNum":14,"Name":"ישיבת מליאה בתאריך 14/10/1998 בשעה 11:02","StartDate":"1998-10-14T11:02:00+02:00","FinishDate":"1998-10-14T13:22:00+02:00","IsSpecialMeeting":true,"LastUpdatedDate":"2025-02-25T10:28:15.657+02:00"}
{"Id":239340,"Number":240,"KnessetNum":14,"Name":"ישיבת מליאה בתאריך 21/10/1998 בשעה 11:04","StartDate":"1998-10-21T11:04:00+02:00","FinishDate":"1998-10-21T18:03:00+02:00","IsSpecialMeeting":null,"LastUpdatedDate":"2025-02-25T10:34:36.657+02:00"}
{"Id":239341,"Number":243,"KnessetNum":14,"Name":"ישיבת מליאה בתאריך 28/10/1998 בשעה 09:02","StartDate":"1998-10-28T09:02:00+02:00","FinishDate":"1998-10-28T13:53:00+02:00","IsSpecialMeeting":null,"LastUpdatedDate":"2020-06-11T12:48:16.993+03:00"}
{"Id":239342,"Number":244,"KnessetNum":14,"Name":"ישיבת מליאה בתאריך 01/11/1998 בשעה 17:04","StartDate":"1998-11-01T17:04:00+02:00","FinishDate":"1998-11-01T17:58:00+02:00","IsSpecialMeeting":null,"LastUpdatedDate":"2025-02-25T10:36:51.773+02:00"}
{"Id":239346,"Number":251,"KnessetNum":14,"Name":"ישיבת מליאה בתאריך 17/11/1998 בשעה 11:03","StartDate":"1998-11-17T11:03:00+02:00","FinishDate":"1998-11-17T23:45:00+02:00","IsSpecialMeeting":null,"LastUpdatedDate":"2020-06-11T12:19:36.103+03:00"}
{"Id":239359,"Number":2,"KnessetNum":15,"Name":"ישיבת מליאה בתאריך 15/06/1999 בשעה 16:02","StartDate":"1999-06-15T16:02:00+03:00","FinishDate":"1999-06-15T19:18:00+03:00","IsSpecialMeeting":null,"LastUpdatedDate":"2025-02-25T13:30:38.573+02:00"}
{"Id":239360,"Number":3,"KnessetNum":15,"Name":"ישיבת מליאה בתאריך 16/06/1999 בשעה 11:01","StartDate":"1999-06-16T11:01:00+03:00","FinishDate":"1999-06-16T13:52:00+03:00","IsSpecialMeeting":null,"LastUpdatedDate":"2025-02-25T13:33:28.663+02:00"}
{"Id":239361,"Number":4,"KnessetNum":15,"Name":"ישיבת מליאה בתאריך 21/06/1999 בשעה 16:17","StartDate":"1999-06-21T16:17:00+03:00","FinishDate":"1999-06-21T19:17:00+03:00","IsSpecialMeeting":null,"LastUpdatedDate":"2025-02-25T14:22:36.283+02:00"}
{"Id":239362,"Number":5,"KnessetNum":15,"Name":"ישיבת מליאה בתאריך 22/06/1999 בשעה 16:01","StartDate":"1999-06-22T16:01:00+03:00","FinishDate":"1999-06-22T18:05:00+03:00","IsSpecialMeeting":null,"LastUpdatedDate":"2025-02-25T14:25:43.41+02:00"}
{"Id":239363,"Number":6,"KnessetNum":15,"Name":"ישיבת מליאה בתאריך 23/06/1999 בשעה 11:01","StartDate":"1999-06-23T11:01:00+03:00","FinishDate":"1999-06-23T15:04:00+03:00","IsSpecialMeeting":null,"LastUpdatedDate":"2025-02-25T14:26:27.927+02:00"}
{"Id":239365,"Number":7,"KnessetNum":15,"Name":"ישיבת מליאה בתאריך 28/06/1999 בשעה 16:01","StartDate":"1999-06-28T16:01:00+03:00","FinishDate":"1999-06-28T18:37:00+03:00","IsSpecialMeeting":null,"LastUpdatedDate":"2025-02-25T14:26:56.287+02:00"}
{"Id":239366,"Number":8,"KnessetNum":15,"Name":"ישיבת מליאה בתאריך 29/06/1999 בשעה 16:02","StartDate":"1999-06-29T16:02:00+03:00","FinishDate":"1999-06-29T18:07:00+03:00","IsSpecialMeeting":null,"LastUpdatedDate":"2025-02-25T14:27:21.393+02:00"}
{"Id":239367,"Number":9,"KnessetNum":15,"Name":"ישיבת מליאה בתאריך 30/06/1999 בשעה 11:00","StartDate":"1999-06-30T11:00:00+03:00","FinishDate":"1999-06-30T13:26:00+03:00","IsSpecialMeeting":null,"LastUpdatedDate":"2025-02-25T14:27:50.833+02:00"}
{"Id":239369,"Number":10,"KnessetNum":15,"Name":"ישיבת מליאה בתאריך 05/07/1999 בשעה 11:33","StartDate":"1999-07-05T11:33:00+03:00","FinishDate":"1999-07-05T13:06:00+03:00","IsSpecialMeeting":null,"LastUpdatedDate":"2025-02-25T14:28:59.77+02:00"}
{"Id":239370,"Number":12,"KnessetNum":15,"Name":"ישיבת מליאה בתאריך 07/07/1999 בשעה 11:03","StartDate":"1999-07-07T11:03:00+03:00","FinishDate":"1999-07-07T13:24:00+03:00","IsSpecialMeeting":null,"LastUpdatedDate":"2025-02-25T14:30:03.24+02:00"}
{"Id":239373,"Number":15,"KnessetNum":15,"Name":"ישיבת מליאה בתאריך 14/07/1999 בשעה 11:00","StartDate":"1999-07-14T11:00:00+03:00","FinishDate":"1999-07-14T16:44:00+03:00","IsSpecialMeeting":null,"LastUpdatedDate":"2025-02-25T14:40:57.177+02:00"}
{"Id":239375,"Number":18,"KnessetNum":15,"Name":"ישיבת מליאה בתאריך 21/07/1999 בשעה 09:00","StartDate":"1999-07-21T09:00:00+03:00","FinishDate":"1999-07-21T11:56:00+03:00","IsSpecialMeeting":null,"LastUpdatedDate":"2025-02-25T14:42:38.087+02:00"}
{"Id":239377,"Number":24,"KnessetNum":15,"Name":"ישיבת מליאה בתאריך 18/08/1999 בשעה 11:47","StartDate":"1999-08-18T11:47:00+03:00","FinishDate":"1999-08-18T14:25:00+03:00","IsSpecialMeeting":null,"LastUpdatedDate":"2025-02-25T15:10:06.413+02:00"}
{"Id":239378,"Number":27,"KnessetNum":15,"Name":"ישיבת מליאה בתאריך 14/09/1999 בשעה 13:01","StartDate":"1999-09-14T13:01:00+03:00","FinishDate":"1999-09-14T15:34:00+03:00","IsSpecialMeeting":true,"LastUpdatedDate":"2025-02-25T15:14:21.377+02:00"}
{"Id":239382,"Number":29,"KnessetNum":15,"Name":"ישיבת מליאה בתאריך 05/10/1999 בשעה 16:00","StartDate":"1999-10-05T16:00:00+02:00","FinishDate":"1999-10-05T19:17:00+02:00","IsSpecialMeeting":null,"LastUpdatedDate":"2025-02-25T15:26:22.493+02:00"}
{"Id":239384,"Number":32,"KnessetNum":15,"Name":"ישיבת מליאה בתאריך 12/10/1999 בשעה 16:02","StartDate":"1999-10-12T16:02:00+02:00","FinishDate":"1999-10-12T22:10:00+02:00","IsSpecialMeeting":null,"LastUpdatedDate":"2025-02-25T15:50:09.7+02:00"}
{"Id":239386,"Number":35,"KnessetNum":15,"Name":"ישיבת מליאה בתאריך 19/10/1999 בשעה 16:01","StartDate":"1999-10-19T16:01:00+02:00","FinishDate":"1999-10-19T19:46:00+02:00","IsSpecialMeeting":null,"LastUpdatedDate":"2025-02-25T15:52:13.893+02:00"}
{"Id":239389,"Number":42,"KnessetNum":15,"Name":"ישיבת מליאה בתאריך 02/11/1999 בשעה 16:01","StartDate":"1999-11-02T16:01:00+02:00","FinishDate":"1999-11-02T21:26:00+02:00","IsSpecialMeeting":null,"LastUpdatedDate":"2025-02-25T15:58:22.47+02:00"}
{"Id":239392,"Number":51,"KnessetNum":15,"Name":"ישיבת מליאה בתאריך 23/11/1999 בשעה 16:02","StartDate":"1999-11-23T16:02:00+02:00","FinishDate":"1999-11-23T20:40:00+02:00","IsSpecialMeeting":null,"LastUpdatedDate":"2025-02-25T16:18:28.987+02:00"}
{"Id":239395,"Number":54,"KnessetNum":15,"Name":"ישיבת מליאה בתאריך 30/11/1999 בשעה 16:01","StartDate":"1999-11-30T16:01:00+02:00","FinishDate":"1999-11-30T20:14:00+02:00","IsSpecialMeeting":null,"LastUpdatedDate":"2025-02-26T08:27:13.68+02:00"}
{"Id":239398,"Number":57,"KnessetNum":15,"Name":"ישיבת מליאה בתאריך 07/12/1999 בשעה 14:02","StartDate":"1999-12-07T14:02:00+02:00","FinishDate":"1999-12-07T16:57:00+02:00","IsSpecialMeeting":null,"LastUpdatedDate":"2025-02-26T08:36:37.883+02:00"}
{"Id":239406,"Number":80,"KnessetNum":15,"Name":"ישיבת מליאה בתאריך 02/02/2000 בשעה 11:01","StartDate":"2000-02-02T11:01:00+02:00","FinishDate":"2000-02-02T20:40:00+02:00","IsSpecialMeeting":null,"LastUpdatedDate":"2025-02-26T10:21:54.53+02:00"}
{"Id":239413,"Number":98,"KnessetNum":15,"Name":"ישיבת מליאה בתאריך 15/03/2000 בשעה 11:01","StartDate":"2000-03-15T11:01:00+02:00","FinishDate":"2000-03-15T21:13:00+02:00","IsSpecialMeeting":null,"LastUpdatedDate":"2025-02-26T11:04:51.603+02:00"}
{"Id":239418,"Number":108,"KnessetNum":15,"Name":"ישיבת מליאה בתאריך 23/05/2000 בשעה 16:01","StartDate":"2000-05-23T16:01:00+03:00","FinishDate":"2000-05-23T23:20:00+03:00","IsSpecialMeeting":null,"LastUpdatedDate":"2025-02-26T11:41:02.27+02:00"}
{"Id":239429,"Number":142,"KnessetNum":15,"Name":"ישיבת מליאה בתאריך 15/08/2000 בשעה 11:01","StartDate":"2000-08-15T11:01:00+03:00","FinishDate":"2000-08-15T14:24:00+03:00","IsSpecialMeeting":true,"LastUpdatedDate":"2025-02-27T09:16:21.117+02:00"}
{"Id":239431,"Number":143,"KnessetNum":15,"Name":"ישיבת מליאה בתאריך 28/08/2000 בשעה 12:03","StartDate":"2000-08-28T12:03:00+03:00","FinishDate":"2000-08-28T16:54:00+03:00","IsSpecialMeeting":true,"LastUpdatedDate":"2025-02-27T09:16:53.06+02:00"}
{"Id":239433,"Number":144,"KnessetNum":15,"Name":"ישיבת מליאה בתאריך 26/09/2000 בשעה 11:05","StartDate":"2000-09-26T11:05:00+03:00","FinishDate":"2000-09-26T13:54:00+03:00","IsSpecialMeeting":true,"LastUpdatedDate":"2025-02-27T09:18:44.65+02:00"}
{"Id":239447,"Number":177,"KnessetNum":15,"Name":"ישיבת מליאה בתאריך 21/02/2001 בשעה 11:01","StartDate":"2001-02-21T11:01:00+02:00","FinishDate":"2001-02-21T18:09:00+02:00","IsSpecialMeeting":null,"LastUpdatedDate":"2025-02-27T10:35:34.207+02:00"}
{"Id":239448,"Number":180,"KnessetNum":15,"Name":"ישיבת מליאה בתאריך 28/02/2001 בשעה 11:03","StartDate":"2001-02-28T11:03:00+02:00","FinishDate":"2001-02-28T14:59:00+02:00","IsSpecialMeeting":null,"LastUpdatedDate":"2025-02-27T10:44:09.407+02:00"}
{"Id":239450,"Number":186,"KnessetNum":15,"Name":"ישיבת מליאה בתאריך 14/03/2001 בשעה 11:04","StartDate":"2001-03-14T11:04:00+02:00","FinishDate":"2001-03-14T17:29:00+02:00","IsSpecialMeeting":null,"LastUpdatedDate":"2025-02-27T11:17:15.32+02:00"}
{"Id":239453,"Number":194,"KnessetNum":15,"Name":"ישיבת מליאה בתאריך 02/05/2001 בשעה 11:00","StartDate":"2001-05-02T11:00:00+03:00","FinishDate":"2001-05-02T13:15:00+03:00","IsSpecialMeeting":null,"LastUpdatedDate":"2025-02-27T11:25:34.543+02:00"}
{"Id":239457,"Number":199,"KnessetNum":15,"Name":"ישיבת מליאה בתאריך 15/05/2001 בשעה 16:01","StartDate":"2001-05-15T16:01:00+03:00","FinishDate":"2001-05-15T20:10:00+03:00","IsSpecialMeeting":null,"LastUpdatedDate":"2025-02-27T11:34:20.317+02:00"}
{"Id":239466,"Number":215,"KnessetNum":15,"Name":"ישיבת מליאה בתאריך 26/06/2001 בשעה 16:03","StartDate":"2001-06-26T16:03:00+03:00","FinishDate":"2001-06-26T19:21:00+03:00","IsSpecialMeeting":null,"LastUpdatedDate":"2025-02-27T11:55:27.533+02:00"}
{"Id":239472,"Number":229,"KnessetNum":15,"Name":"ישיבת מליאה בתאריך 08/08/2001 בשעה 11:01","StartDate":"2001-08-08T11:01:00+03:00","FinishDate":"2001-08-08T13:52:00+03:00","IsSpecialMeeting":true,"LastUpdatedDate":"2025-02-27T13:19:11.687+02:00"}
{"Id":239475,"Number":235,"KnessetNum":15,"Name":"ישיבת מליאה בתאריך 17/10/2001 בשעה 13:03","StartDate":"2001-10-17T13:03:00+02:00","FinishDate":"2001-10-17T13:22:00+02:00","IsSpecialMeeting":null,"LastUpdatedDate":"2025-02-27T13:27:07.823+02:00"}
{"Id":239477,"Number":249,"KnessetNum":15,"Name":"ישיבת מליאה בתאריך 20/11/2001 בשעה 16:02","StartDate":"2001-11-20T16:02:00+02:00","FinishDate":"2001-11-20T20:24:00+02:00","IsSpecialMeeting":null,"LastUpdatedDate":"2025-03-03T08:48:06.207+02:00"}
{"Id":239489,"Number":282,"KnessetNum":15,"Name":"ישיבת מליאה בתאריך 05/02/2002 בשעה 09:06","StartDate":"2002-02-05T09:06:00+02:00","FinishDate":"2002-02-05T17:38:00+02:00","IsSpecialMeeting":null,"LastUpdatedDate":"2025-03-03T10:24:07.113+02:00"}
{"Id":239491,"Number":284,"KnessetNum":15,"Name":"ישיבת מליאה בתאריך 12/02/2002 בשעה 16:02","StartDate":"2002-02-12T16:02:00+02:00","FinishDate":"2002-02-12T19:02:00+02:00","IsSpecialMeeting":null,"LastUpdatedDate":"2025-03-03T10:25:24.707+02:00"}
{"Id":239505,"Number":336,"KnessetNum":15,"Name":"ישיבת מליאה בתאריך 12/08/2002 בשעה 14:04","StartDate":"2002-08-12T14:04:00+03:00","FinishDate":"2002-08-12T16:03:00+03:00","IsSpecialMeeting":null,"LastUpdatedDate":"2025-03-03T12:44:11.817+02:00"}
{"Id":239506,"Number":337,"KnessetNum":15,"Name":"ישיבת מליאה בתאריך 21/08/2002 בשעה 10:04","StartDate":"2002-08-21T10:04:00+03:00","FinishDate":"2002-08-21T12:23:00+03:00","IsSpecialMeeting":null,"LastUpdatedDate":"2025-03-03T12:44:40.08+02:00"}
{"Id":239508,"Number":338,"KnessetNum":15,"Name":"ישיבת מליאה בתאריך 03/09/2002 בשעה 10:04","StartDate":"2002-09-03T10:04:00+03:00","FinishDate":"2002-09-03T12:40:00+03:00","IsSpecialMeeting":true,"LastUpdatedDate":"2025-03-03T12:45:18.097+02:00"}
{"Id":239509,"Number":339,"KnessetNum":15,"Name":"ישיבת מליאה בתאריך 18/09/2002 בשעה 10:05","StartDate":"2002-09-18T10:05:00+03:00","FinishDate":"2002-09-18T12:05:00+03:00","IsSpecialMeeting":true,"LastUpdatedDate":"2025-03-03T13:01:55.84+02:00"}