{"Id":10105,"Number":11,"KnessetNum":16,"Name":"ישיבת מליאה בתאריך 10/03/2003 בשעה: 16:00","StartDate":"2003-03-10T16:00:00+02:00","FinishDate":"2003-03-10T20:06:00+02:00","IsSpecialMeeting":false,"LastUpdatedDate":"2013-10-03T16:21:47+03:00"}
{"Id":10106,"Number":12,"KnessetNum":16,"Name":"ישיבת מליאה בתאריך 11/03/2003 בשעה: 16:00","StartDate":"2003-03-11T16:00:00+02:00","FinishDate":"2003-03-11T20:00:00+02:00","IsSpecialMeeting":false,"LastUpdatedDate":"2013-10-03T16:21:47+03:00"}
{"Id":10107,"Number":13,"KnessetNum":16,"Name":"ישיבת מליאה בתאריך 12/03/2003 בשעה: 11:00","StartDate":"2003-03-12T11:00:00+02:00","FinishDate":"2003-03-12T20:25:00+02:00","IsSpecialMeeting":false,"LastUpdatedDate":"2013-10-03T16:21:47+03:00"}
{"Id":10480,"Number":14,"KnessetNum":16,"Name":"ישיבת מליאה בתאריך 24/03/2003 בשעה: 16:00","StartDate":"2003-03-24T16:00:00+02:00","FinishDate":"2003-03-24T19:03:00+02:00","IsSpecialMeeting":false,"LastUpdatedDate":"2013-10-03T16:21:47+03:00"}
{"Id":10481,"Number":15,"KnessetNum":16,"Name":"ישיבת מליאה בתאריך 25/03/2003 בשעה: 16:00","StartDate":"2003-03-25T16:00:00+02:00","FinishDate":"2003-03-25T20:16:00+02:00","IsSpecialMeeting":false,"LastUpdatedDate":"2013-10-03T16:21:47+03:00"}
{"Id":10482,"Number":16,"KnessetNum":16,"Name":"ישיבת מליאה בתאריך 26/03/2003 בשעה: 11:00","StartDate":"2003-03-26T11:00:00+02:00","FinishDate":"2003-03-26T23:20:00+02:00","IsSpecialMeeting":false,"LastUpdatedDate":"2013-10-03T16:21:47+03:00"}
{"Id":11088,"Number":17,"KnessetNum":16,"Name":"ישיבת מליאה בתאריך 30/04/2003 בשעה 10:00","StartDate":"2003-04-30T10:00:00+03:00","FinishDate":"2003-04-30T21:10:00+03:00","IsSpecialMeeting":false,"LastUpdatedDate":"2020-03-03T16:08:04.46+02:00"}
{"Id":11153,"Number":18,"KnessetNum":16,"Name":"ישיבת מליאה בתאריך 05/05/2003 בשעה: 10:00","StartDate":"2003-05-05T10:00:00+03:00","FinishDate":"2003-05-05T13:22:00+03:00","IsSpecialMeeting":false,"LastUpdatedDate":"2013-10-03T16:21:47+03:00"}
{"Id":11177,"Number":19,"KnessetNum":16,"Name":"ישיבת מליאה בתאריך 12/05/2003 בשעה: 17:20","StartDate":"2003-05-12T17:20:00+03:00","FinishDate":"2003-05-12T21:17:00+03:00","IsSpecialMeeting":false,"LastUpdatedDate":"2013-10-03T16:21:47+03:00"}
{"Id":11178,"Number":20,"KnessetNum":16,"Name":"ישיבת מליאה בתאריך 13/05/2003 בשעה: 15:00","StartDate":"2003-05-13T15:00:00+03:00","FinishDate":"2003-05-13T17:50:00+03:00","IsSpecialMeeting":false,"LastUpdatedDate":"2013-10-03T16:21:47+03:00"}
{"Id":11179,"Number":21,"KnessetNum":16,"Name":"ישיבת מליאה בתאריך 14/05/2003 בשעה: 11:00","StartDate":"2003-05-14T11:00:00+03:00","FinishDate":"2003-05-14T19:01:00+03:00","IsSpecialMeeting":false,"LastUpdatedDate":"2013-10-03T16:21:47+03:00"}
{"Id":11434,"Number":24,"KnessetNum":16,"Name":"ישיבת מליאה בתאריך 21/05/2003 בשעה: 11:00","StartDate":"2003-05-21T11:00:00+03:00","FinishDate":"2003-05-21T19:45:00+03:00","IsSpecialMeeting":false,"LastUpdatedDate":"2013-10-03T16:21:47+03:00"}
{"Id":11571,"Number":22,"KnessetNum":16,"Name":"ישיבת מליאה בתאריך 19/05/2003 בשעה: 16:00","StartDate":"2003-05-19T16:00:00+03:00","FinishDate":"2003-05-19T17:52:00+03:00","IsSpecialMeeting":false,"LastUpdatedDate":"2013-10-03T16:21:47+03:00"}
{"Id":11572,"Number":23,"KnessetNum":16,"Name":"ישיבת מליאה בתאריך 20/05/2003 בשעה: 16:00","StartDate":"2003-05-20T16:00:00+03:00","FinishDate":"2003-05-20T18:20:00+03:00","IsSpecialMeeting":false,"LastUpdatedDate":"2013-10-03T16:21:47+03:00"}
{"Id":11856,"Number":25,"KnessetNum":16,"Name":"ישיבת מליאה בתאריך 26/05/2003 בשעה: 10:00","StartDate":"2003-05-26T10:00:00+03:00","FinishDate":"2003-05-27T08:00:00+03:00","IsSpecialMeeting":false,"LastUpdatedDate":"2013-10-03T16:21:47+03:00"}
{"Id":11958,"Number":26,"KnessetNum":16,"Name":"ישיבת מליאה בתאריך 02/06/2003 בשעה: 16:00","StartDate":"2003-06-02T16:00:00+03:00","FinishDate":"2003-06-02T20:30:00+03:00","IsSpecialMeeting":false,"LastUpdatedDate":"2013-10-03T16:21:47+03:00"}
{"Id":12101,"Number":27,"KnessetNum":16,"Name":"ישיבת מליאה בתאריך 03/06/2003 בשעה: 16:00","StartDate":"2003-06-03T16:00:00+03:00","FinishDate":"2003-06-03T17:51:00+03:00","IsSpecialMeeting":false,"LastUpdatedDate":"2013-10-03T16:21:47+03:00"}
{"Id":12108,"Number":28,"KnessetNum":16,"Name":"ישיבת מליאה בתאריך 04/06/2003 בשעה: 11:00","StartDate":"2003-06-04T11:00:00+03:00","FinishDate":"2003-06-04T18:50:00+03:00","IsSpecialMeeting":false,"LastUpdatedDate":"2013-10-03T16:21:47+03:00"}
{"Id":12399,"Number":29,"KnessetNum":16,"Name":"ישיבת מליאה בתאריך 09/06/2003 בשעה: 16:00","StartDate":"2003-06-09T16:00:00+03:00","FinishDate":"2003-06-09T20:04:00+03:00","IsSpecialMeeting":false,"LastUpdatedDate":"2013-10-03T16:21:47+03:00"}
{"Id":12400,"Number":30,"KnessetNum":16,"Name":"ישיבת מליאה בתאריך 10/06/2003 בשעה: 15:00","StartDate":"2003-06-10T15:00:00+03:00","FinishDate":"2003-06-10T20:20:00+03:00","IsSpecialMeeting":false,"LastUpdatedDate":"2013-10-03T16:21:47+03:00"}
{"Id":12401,"Number":31,"KnessetNum":16,"Name":"ישיבת מליאה בתאריך 11/06/2003 בשעה: 11:00","StartDate":"2003-06-11T11:00:00+03:00","FinishDate":"2003-06-11T19:30:00+03:00","IsSpecialMeeting":false,"LastUpdatedDate":"2013-10-03T16:21:47+03:00"}
{"Id":12738,"Number":32,"KnessetNum":16,"Name":"ישיבת מליאה בתאריך 16/06/2003 בשעה: 16:03","StartDate":"2003-06-16T16:03:00+03:00","FinishDate":"2003-06-16T21:10:00+03:00","IsSpecialMeeting":false,"LastUpdatedDate":"2013-10-03T16:21:47+03:00"}
{"Id":12739,"Number":33,"KnessetNum":16,"Name":"ישיבת מליאה בתאריך 17/06/2003 בשעה: 16:00","StartDate":"2003-06-17T16:00:00+03:00","FinishDate":"2003-06-17T19:55:00+03:00","IsSpecialMeeting":false,"LastUpdatedDate":"2013-10-03T16:21:47+03:00"}
{"Id":12740,"Number":34,"KnessetNum":16,"Name":"ישיבת מליאה בתאריך 18/06/2003 בשעה: 11:00","StartDate":"2003-06-18T11:00:00+03:00","FinishDate":"2003-06-18T19:43:00+03:00","IsSpecialMeeting":false,"LastUpdatedDate":"2013-10-03T16:21:47+03:00"}
{"Id":13048,"Number":35,"KnessetNum":16,"Name":"ישיבת מליאה בתאריך 23/06/2003 בשעה: 16:00","StartDate":"2003-06-23T16:00:00+03:00","FinishDate":"2003-06-23T21:10:00+03:00","IsSpecialMeeting":false,"LastUpdatedDate":"2013-10-03T16:21:47+03:00"}
{"Id":13050,"Number":36,"KnessetNum":16,"Name":"ישיבת מליאה בתאריך 24/06/2003 בשעה: 16:00","StartDate":"2003-06-24T16:00:00+03:00","FinishDate":"2003-06-24T18:41:00+03:00","IsSpecialMeeting":false,"LastUpdatedDate":"2013-10-03T16:21:47+03:00"}
{"Id":13051,"Number":37,"KnessetNum":16,"Name":"ישיבת מליאה בתאריך 25/06/2003 בשעה: 11:00","StartDate":"2003-06-25T11:00:00+03:00","FinishDate":"2003-06-25T17:48:00+03:00","IsSpecialMeeting":false,"LastUpdatedDate":"2013-10-03T16:21:47+03:00"}
{"Id":13424,"Number":38,"KnessetNum":16,"Name":"ישיבת מליאה בתאריך 30/06/2003 בשעה: 16:00","StartDate":"2003-06-30T16:00:00+03:00","FinishDate":"2003-06-30T20:34:00+03:00","IsSpecialMeeting":false,"LastUpdatedDate":"2013-10-03T16:21:47+03:00"}
{"Id":13425,"Number":39,"KnessetNum":16,"Name":"ישיבת מליאה בתאריך 01/07/2003 בשעה: 16:00","StartDate":"2003-07-01T16:00:00+03:00","FinishDate":"2003-07-01T19:02:00+03:00","IsSpecialMeeting":false,"LastUpdatedDate":"2013-10-03T16:21:47+03:00"}
{"Id":13426,"Number":40,"KnessetNum":16,"Name":"ישיבת מליאה בתאריך 02/07/2003 בשעה: 11:00","StartDate":"2003-07-02T11:00:00+03:00","FinishDate":"2003-07-02T19:48:00+03:00","IsSpecialMeeting":false,"LastUpdatedDate":"2013-10-03T16:21:47+03:00"}
{"Id":13779,"Number":41,"KnessetNum":16,"Name":"ישיבת מליאה בתאריך 07/07/2003 בשעה: 16:00","StartDate":"2003-07-07T16:00:00+03:00","FinishDate":"2003-07-07T21:06:00+03:00","IsSpecialMeeting":false,"LastUpdatedDate":"2013-10-03T16:21:47+03:00"}
{"Id":13780,"Number":42,"KnessetNum":16,"Name":"ישיבת מליאה בתאריך 08/07/2003 בשעה: 15:47","StartDate":"2003-07-08T15:47:00+03:00","FinishDate":"2003-07-08T20:00:00+03:00","IsSpecialMeeting":false,"LastUpdatedDate":"2013-10-03T16:21:47+03:00"}
{"Id":13781,"Number":43,"KnessetNum":16,"Name":"ישיבת מליאה בתאריך 09/07/2003 בשעה: 11:00","StartDate":"2003-07-09T11:00:00+03:00","FinishDate":"2003-07-09T19:38:00+03:00","IsSpecialMeeting":false,"LastUpdatedDate":"2013-10-03T16:21:47+03:00"}
{"Id":14114,"Number":44,"KnessetNum":16,"Name":"ישיבת מליאה בתאריך 14/07/2003 בשעה: 16:00","StartDate":"2003-07-14T16:00:00+03:00","FinishDate":"2003-07-14T20:11:00+03:00","IsSpecialMeeting":false,"LastUpdatedDate":"2013-10-03T16:21:47+03:00"}
{"Id":14115,"Number":45,"KnessetNum":16,"Name":"ישיבת מליאה בתאריך 15/07/2003 בשעה: 15:00","StartDate":"2003-07-15T15:00:00+03:00","FinishDate":"2003-07-15T20:38:00+03:00","IsSpecialMeeting":false,"LastUpdatedDate":"2013-10-03T16:21:47+03:00"}
{"Id":14116,"Number":46,"KnessetNum":16,"Name":"ישיבת מליאה בתאריך 16/07/2003 בשעה: 11:00","StartDate":"2003-07-16T11:00:00+03:00","FinishDate":"2003-07-16T21:17:00+03:00","IsSpecialMeeting":false,"LastUpdatedDate":"2013-10-03T16:21:47+03:00"}
{"Id":14536,"Number":47,"KnessetNum":16,"Name":"ישיבת מליאה בתאריך 21/07/2003 בשעה: 16:00","StartDate":"2003-07-21T16:00:00+03:00","FinishDate":"2003-07-21T22:52:00+03:00","IsSpecialMeeting":false,"LastUpdatedDate":"2013-10-03T16:21:47+03:00"}
{"Id":14538,"Number":48,"KnessetNum":16,"Name":"ישיבת מליאה בתאריך 22/07/2003 בשעה: 16:00","StartDate":"2003-07-22T16:00:00+03:00","FinishDate":"2003-07-22T18:10:00+03:00","IsSpecialMeeting":false,"LastUpdatedDate":"2013-10-03T16:21:47+03:00"}
{"Id":14540,"Number":49,"KnessetNum":16,"Name":"ישיבת מליאה בתאריך 23/07/2003 בשעה: 11:00","StartDate":"2003-07-23T11:00:00+03:00","FinishDate":"2003-07-23T20:47:00+03:00","IsSpecialMeeting":false,"LastUpdatedDate":"2013-10-03T16:21:47+03:00"}
{"Id":14843,"Number":50,"KnessetNum":16,"Name":"ישיבת מליאה בתאריך 28/07/2003 בשעה: 16:00","StartDate":"2003-07-28T16:00:00+03:00","FinishDate":"2003-07-28T22:29:00+03:00","IsSpecialMeeting":false,"LastUpdatedDate":"2013-10-03T16:21:47+03:00"}
{"Id":14844,"Number":51,"KnessetNum":16,"Name":"ישיבת מליאה בתאריך 29/07/2003 בשעה: 16:00","StartDate":"2003-07-29T16:00:00+03:00","FinishDate":"2003-07-29T22:30:00+03:00","IsSpecialMeeting":false,"LastUpdatedDate":"2013-10-03T16:21:47+03:00"}
{"Id":14846,"Number":52,"KnessetNum":16,"Name":"ישיבת מליאה בתאריך 30/07/2003 בשעה: 16:00","StartDate":"2003-07-30T16:00:00+03:00","FinishDate":"2003-07-31T00:08:00+03:00","IsSpecialMeeting":false,"LastUpdatedDate":"2013-10-03T16:21:47+03:00"}
{"Id":14847,"Number":53,"KnessetNum":16,"Name":"ישיבת מליאה בתאריך 31/07/2003 בשעה: 11:00","StartDate":"2003-07-31T11:00:00+03:00","FinishDate":"2003-07-31T23:34:00+03:00","IsSpecialMeeting":false,"LastUpdatedDate":"2013-10-03T16:21:47+03:00"}
{"Id":15260,"Number":54,"KnessetNum":16,"Name":"ישיבת מליאה בתאריך 13/08/2003 בשעה: 11:00","StartDate":"2003-08-13T11:00:00+03:00","FinishDate":"2003-08-13T15:00:00+03:00","IsSpecialMeeting":false,"LastUpdatedDate":"2013-10-03T16:21:47+03:00"}
{"Id":15452,"Number":55,"KnessetNum":16,"Name":"ישיבת מליאה בתאריך 10/09/2003 בשעה 10:00","StartDate":"2003-09-10T10:00:00+03:00","FinishDate":"2003-09-10T16:20:00+03:00","IsSpecialMeeting":false,"LastUpdatedDate":"2023-12-20T17:55:28.55+02:00"}
{"Id":15677,"Number":56,"KnessetNum":16,"Name":"ישיבת מליאה בתאריך 29/09/2003 בשעה: 11:00","StartDate":"2003-09-29T11:00:00+02:00","FinishDate":"2003-09-29T17:29:00+02:00","IsSpecialMeeting":false,"LastUpdatedDate":"2013-10-03T16:21:47+03:00"}
{"Id":15750,"Number":57,"KnessetNum":16,"Name":"ישיבת מליאה בתאריך 09/10/2003 בשעה: 11:00","StartDate":"2003-10-09T11:00:00+02:00","FinishDate":"2003-10-09T19:20:00+02:00","IsSpecialMeeting":false,"LastUpdatedDate":"2013-10-03T16:21:47+03:00"}
{"Id":15797,"Number":58,"KnessetNum":16,"Name":"ישיבת מליאה בתאריך 20/10/2003 בשעה: 16:00","StartDate":"2003-10-20T16:00:00+02:00","FinishDate":"2003-10-20T20:24:00+02:00","IsSpecialMeeting":false,"LastUpdatedDate":"2013-10-03T16:21:47+03:00"}
{"Id":16101,"Number":59,"KnessetNum":16,"Name":"ישיבת מליאה בתאריך 21/10/2003 בשעה: 15:00","StartDate":"2003-10-21T15:00:00+02:00","FinishDate":"2003-10-21T18:50:00+02:00","IsSpecialMeeting":false,"LastUpdatedDate":"2013-10-03T16:21:47+03:00"}
{"Id":16139,"Number":60,"KnessetNum":16,"Name":"ישיבת מליאה בתאריך 22/10/2003 בשעה: 11:00","StartDate":"2003-10-22T11:00:00+02:00","FinishDate":"2003-10-22T18:59:00+02:00","IsSpecialMeeting":false,"LastUpdatedDate":"2013-10-03T16:21:47+03:00"}
{"Id":16406,"Number":61,"KnessetNum":16,"Name":"ישיבת מליאה בתאריך 27/10/2003 בשעה: 16:00","StartDate":"2003-10-27T16:00:00+02:00","FinishDate":"2003-10-27T17:50:00+02:00","IsSpecialMeeting":false,"LastUpdatedDate":"2013-10-03T16:21:47+03:00"}
{"Id":16448,"Number":62,"KnessetNum":16,"Name":"ישיבת מליאה בתאריך 29/10/2003 בשעה: 11:00","StartDate":"2003-10-29T11:00:00+02:00","FinishDate":"2003-10-29T19:24:00+02:00","IsSpecialMeeting":false,"LastUpdatedDate":"2013-10-03T16:21:47+03:00"}
{"Id":16554,"Number":63,"KnessetNum":16,"Name":"ישיבת מליאה בתאריך 03/11/2003 בשעה 16:00","StartDate":"2003-11-03T16:00:00+02:00","FinishDate":"2003-11-03T18:53:00+02:00","IsSpecialMeeting":false,"LastUpdatedDate":"2020-03-03T16:07:59.383+02:00"}
{"Id":16555,"Number":64,"KnessetNum":16,"Name":"ישיבת מליאה בתאריך 04/11/2003 בשעה: 13:30","StartDate":"2003-11-04T13:30:00+02:00","FinishDate":"2003-11-04T20:20:00+02:00","IsSpecialMeeting":false,"LastUpdatedDate":"2013-10-03T16:21:47+03:00"}
{"Id":16556,"Number":65,"KnessetNum":16,"Name":"ישיבת מליאה בתאריך 05/11/2003 בשעה: 10:00","StartDate":"2003-11-05T10:00:00+02:00","FinishDate":"2003-11-05T15:34:00+02:00","IsSpecialMeeting":false,"LastUpdatedDate":"2013-10-03T16:21:47+03:00"}
{"Id":16557,"Number":66,"KnessetNum":16,"Name":"ישיבת מליאה בתאריך 06/11/2003 בשעה: 17:00","StartDate":"2003-11-06T17:00:00+02:00","FinishDate":"2003-11-06T17:55:00+02:00","IsSpecialMeeting":true,"LastUpdatedDate":"2013-10-03T16:21:47+03:00"}
{"Id":16784,"Number":67,"KnessetNum":16,"Name":"ישיבת מליאה בתאריך 10/11/2003 בשעה: 16:00","StartDate":"2003-11-10T16:00:00+02:00","FinishDate":"2003-11-10T21:00:00+02:00","IsSpecialMeeting":false,"LastUpdatedDate":"2013-10-03T16:21:47+03:00"}
{"Id":16785,"Number":68,"KnessetNum":16,"Name":"ישיבת מליאה בתאריך 11/11/2003 בשעה: 16:00","StartDate":"2003-11-11T16:00:00+02:00","FinishDate":"2003-11-11T19:16:00+02:00","IsSpecialMeeting":false,"LastUpdatedDate":"2013-10-03T16:21:47+03:00"}
{"Id":16786,"Number":69,"KnessetNum":16,"Name":"ישיבת מליאה בתאריך 12/11/2003 בשעה: 11:00","StartDate":"2003-11-12T11:00:00+02:00","FinishDate":"2003-11-12T21:12:00+02:00","IsSpecialMeeting":false,"LastUpdatedDate":"2013-10-03T16:21:47+03:00"}
{"Id":17227,"Number":70,"KnessetNum":16,"Name":"ישיבת מליאה בתאריך 17/11/2003 בשעה: 16:00","StartDate":"2003-11-17T16:00:00+02:00","FinishDate":"2003-11-17T18:47:00+02:00","IsSpecialMeeting":false,"LastUpdatedDate":"2013-10-03T16:21:47+03:00"}
{"Id":17228,"Number":71,"KnessetNum":16,"Name":"ישיבת מליאה בתאריך 18/11/2003 בשעה: 16:00","StartDate":"2003-11-18T16:00:00+02:00","FinishDate":"2003-11-18T20:42:00+02:00","IsSpecialMeeting":false,"LastUpdatedDate":"2013-10-03T16:21:47+03:00"}
{"Id":17230,"Number":72,"KnessetNum":16,"Name":"ישיבת מליאה בתאריך 19/11/2003 בשעה: 11:00","StartDate":"2003-11-19T11:00:00+02:00","FinishDate":"2003-11-19T18:40:00+02:00","IsSpecialMeeting":false,"LastUpdatedDate":"2013-10-03T16:21:47+03:00"}
{"Id":17618,"Number":73,"KnessetNum":16,"Name":"ישיבת מליאה בתאריך 24/11/2003 בשעה: 15:00","StartDate":"2003-11-24T15:00:00+02:00","FinishDate":"2003-11-24T19:40:00+02:00","IsSpecialMeeting":false,"LastUpdatedDate":"2013-10-03T16:21:47+03:00"}
{"Id":17681,"Number":74,"KnessetNum":16,"Name":"ישיבת מליאה בתאריך 25/11/2003 בשעה: 15:00","StartDate":"2003-11-25T15:00:00+02:00","FinishDate":"2003-11-25T19:12:00+02:00","IsSpecialMeeting":false,"LastUpdatedDate":"2013-10-03T16:21:47+03:00"}
{"Id":17873,"Number":75,"KnessetNum":16,"Name":"ישיבת מליאה בתאריך 26/11/2003 בשעה: 11:00","StartDate":"2003-11-26T11:00:00+02:00","FinishDate":"2003-11-26T20:56:00+02:00","IsSpecialMeeting":false,"LastUpdatedDate":"2013-10-03T16:21:47+03:00"}
{"Id":18009,"Number":76,"KnessetNum":16,"Name":"ישיבת מליאה בתאריך 01/12/2003 בשעה: 16:00","StartDate":"2003-12-01T16:00:00+02:00","FinishDate":"2003-12-01T20:50:00+02:00","IsSpecialMeeting":false,"LastUpdatedDate":"2013-10-03T16:21:47+03:00"}
{"Id":18010,"Number":77,"KnessetNum":16,"Name":"ישיבת מליאה בתאריך 02/12/2003 בשעה: 16:00","StartDate":"2003-12-02T16:00:00+02:00","FinishDate":"2003-12-02T20:54:00+02:00","IsSpecialMeeting":false,"LastUpdatedDate":"2013-10-03T16:21:47+03:00"}
{"Id":18011,"Number":78,"KnessetNum":16,"Name":"ישיבת מליאה בתאריך 03/12/2003 בשעה 11:00","StartDate":"2003-12-03T11:00:00+02:00","FinishDate":"2003-12-03T19:40:00+02:00","IsSpecialMeeting":false,"LastUpdatedDate":"2020-02-09T08:57:47.47+02:00"}
{"Id":18583,"Number":79,"KnessetNum":16,"Name":"ישיבת מליאה בתאריך 08/12/2003 בשעה: 16:00","StartDate":"2003-12-08T16:00:00+02:00","FinishDate":"2003-12-08T20:20:00+02:00","IsSpecialMeeting":false,"LastUpdatedDate":"2013-10-03T16:21:47+03:00"}
{"Id":18588,"Number":80,"KnessetNum":16,"Name":"ישיבת מליאה בתאריך 09/12/2003 בשעה: 15:00","StartDate":"2003-12-09T15:00:00+02:00","FinishDate":"2003-12-09T22:20:00+02:00","IsSpecialMeeting":false,"LastUpdatedDate":"2013-10-03T16:21:47+03:00"}
{"Id":18589,"Number":81,"KnessetNum":16,"Name":"ישיבת מליאה בתאריך 10/12/2003 בשעה: 11:00","StartDate":"2003-12-10T11:00:00+02:00","FinishDate":"2003-12-10T21:40:00+02:00","IsSpecialMeeting":false,"LastUpdatedDate":"2013-10-03T16:21:47+03:00"}
{"Id":19087,"Number":82,"KnessetNum":16,"Name":"ישיבת מליאה בתאריך 15/12/2003 בשעה: 16:00","StartDate":"2003-12-15T16:00:00+02:00","FinishDate":"2003-12-15T21:00:00+02:00","IsSpecialMeeting":false,"LastUpdatedDate":"2013-10-03T16:21:47+03:00"}
{"Id":19088,"Number":83,"KnessetNum":16,"Name":"ישיבת מליאה בתאריך 16/12/2003 בשעה: 16:00","StartDate":"2003-12-16T16:00:00+02:00","FinishDate":"2003-12-16T19:25:00+02:00","IsSpecialMeeting":false,"LastUpdatedDate":"2013-10-03T16:21:47+03:00"}
{"Id":19090,"Number":84,"KnessetNum":16,"Name":"ישיבת מליאה בתאריך 17/12/2003 בשעה: 11:00","StartDate":"2003-12-17T11:00:00+02:00","FinishDate":"2003-12-17T20:57:00+02:00","IsSpecialMeeting":false,"LastUpdatedDate":"2013-10-03T16:21:47+03:00"}
{"Id":19500,"Number":85,"KnessetNum":16,"Name":"ישיבת מליאה בתאריך 22/12/2003 בשעה: 13:00","StartDate":"2003-12-22T13:00:00+02:00","FinishDate":"2003-12-22T16:40:00+02:00","IsSpecialMeeting":false,"LastUpdatedDate":"2013-10-03T16:21:47+03:00"}
{"Id":19501,"Number":86,"KnessetNum":16,"Name":"ישיבת מליאה בתאריך 23/12/2003 בשעה: 13:00","StartDate":"2003-12-23T13:00:00+02:00","FinishDate":"2003-12-23T17:00:00+02:00","IsSpecialMeeting":false,"LastUpdatedDate":"2013-10-03T16:21:47+03:00"}
{"Id":19502,"Number":87,"KnessetNum":16,"Name":"ישיבת מליאה בתאריך 24/12/2003 בשעה: 11:00","StartDate":"2003-12-24T11:00:00+02:00","FinishDate":"2003-12-24T16:50:00+02:00","IsSpecialMeeting":false,"LastUpdatedDate":"2013-10-03T16:21:47+03:00"}
{"Id":19983,"Number":88,"KnessetNum":16,"Name":"ישיבת מליאה בתאריך 29/12/2003 בשעה: 16:00","StartDate":"2003-12-29T16:00:00+02:00","FinishDate":"2003-12-29T21:10:00+02:00","IsSpecialMeeting":false,"LastUpdatedDate":"2013-10-03T16:21:47+03:00"}