{"Id":140084,"Number":24,"KnessetNum":17,"Name":"ישיבת מליאה בתאריך 19/06/2006 בשעה 16:00","StartDate":"2006-06-19T16:00:00+03:00","FinishDate":"2006-06-19T21:30:00+03:00","IsSpecialMeeting":false,"LastUpdatedDate":"2021-01-05T12:54:50.107+02:00"}
{"Id":140085,"Number":25,"KnessetNum":17,"Name":"ישיבת מליאה בתאריך 20/06/2006 בשעה: 16:00","StartDate":"2006-06-20T16:00:00+03:00","FinishDate":"2006-06-20T18:50:00+03:00","IsSpecialMeeting":false,"LastUpdatedDate":"2013-10-03T16:21:47+03:00"}
{"Id":140086,"Number":26,"KnessetNum":17,"Name":"ישיבת מליאה בתאריך 21/06/2006 בשעה: 11:00","StartDate":"2006-06-21T11:00:00+03:00","FinishDate":"2006-06-21T17:30:00+03:00","IsSpecialMeeting":false,"LastUpdatedDate":"2013-10-03T16:21:47+03:00"}
{"Id":141891,"Number":27,"KnessetNum":17,"Name":"ישיבת מליאה בתאריך 26/06/2006 בשעה: 16:00","StartDate":"2006-06-26T16:00:00+03:00","FinishDate":"2006-06-26T21:00:00+03:00","IsSpecialMeeting":false,"LastUpdatedDate":"2013-10-03T16:21:47+03:00"}
{"Id":141892,"Number":28,"KnessetNum":17,"Name":"ישיבת מליאה בתאריך 27/06/2006 בשעה 16:00","StartDate":"2006-06-27T16:00:00+03:00","FinishDate":"2006-06-27T19:20:00+03:00","IsSpecialMeeting":false,"LastUpdatedDate":"2021-01-05T12:11:14.867+02:00"}
{"Id":141894,"Number":29,"KnessetNum":17,"Name":"ישיבת מליאה בתאריך 28/06/2006 בשעה: 11:00","StartDate":"2006-06-28T11:00:00+03:00","FinishDate":"2006-06-28T20:50:00+03:00","IsSpecialMeeting":false,"LastUpdatedDate":"2013-10-03T16:21:47+03:00"}
{"Id":142691,"Number":30,"KnessetNum":17,"Name":"ישיבת מליאה בתאריך 03/07/2006 בשעה: 16:00","StartDate":"2006-07-03T16:00:00+03:00","FinishDate":"2006-07-03T21:40:00+03:00","IsSpecialMeeting":false,"LastUpdatedDate":"2013-10-03T16:21:47+03:00"}
{"Id":142692,"Number":31,"KnessetNum":17,"Name":"ישיבת מליאה בתאריך 04/07/2006 בשעה: 16:00","StartDate":"2006-07-04T16:00:00+03:00","FinishDate":"2006-07-04T20:00:00+03:00","IsSpecialMeeting":false,"LastUpdatedDate":"2013-10-03T16:21:47+03:00"}
{"Id":142693,"Number":32,"KnessetNum":17,"Name":"ישיבת מליאה בתאריך 05/07/2006 בשעה: 11:00","StartDate":"2006-07-05T11:00:00+03:00","FinishDate":"2006-07-05T21:40:00+03:00","IsSpecialMeeting":false,"LastUpdatedDate":"2013-10-03T16:21:47+03:00"}
{"Id":143890,"Number":33,"KnessetNum":17,"Name":"ישיבת מליאה בתאריך 10/07/2006 בשעה 16:00","StartDate":"2006-07-10T16:00:00+03:00","FinishDate":"2006-07-10T22:50:00+03:00","IsSpecialMeeting":false,"LastUpdatedDate":"2021-01-05T12:42:40.24+02:00"}
{"Id":143892,"Number":34,"KnessetNum":17,"Name":"ישיבת מליאה בתאריך 11/07/2006 בשעה 16:00","StartDate":"2006-07-11T16:00:00+03:00","FinishDate":"2006-07-11T19:10:00+03:00","IsSpecialMeeting":false,"LastUpdatedDate":"2021-01-05T12:07:21.88+02:00"}
{"Id":143893,"Number":35,"KnessetNum":17,"Name":"ישיבת מליאה בתאריך 12/07/2006 בשעה 11:00","StartDate":"2006-07-12T11:00:00+03:00","FinishDate":"2006-07-12T19:30:00+03:00","IsSpecialMeeting":false,"LastUpdatedDate":"2021-01-05T12:44:40.927+02:00"}
{"Id":144847,"Number":36,"KnessetNum":17,"Name":"ישיבת מליאה בתאריך 17/07/2006 בשעה: 16:00","StartDate":"2006-07-17T16:00:00+03:00","FinishDate":"2006-07-17T21:20:00+03:00","IsSpecialMeeting":false,"LastUpdatedDate":"2013-10-03T16:21:47+03:00"}
{"Id":144848,"Number":37,"KnessetNum":17,"Name":"ישיבת מליאה בתאריך 18/07/2006 בשעה 16:00","StartDate":"2006-07-18T16:00:00+03:00","FinishDate":"2006-07-18T19:40:00+03:00","IsSpecialMeeting":false,"LastUpdatedDate":"2021-01-05T11:34:35.64+02:00"}
{"Id":144849,"Number":38,"KnessetNum":17,"Name":"ישיבת מליאה בתאריך 19/07/2006 בשעה 11:00","StartDate":"2006-07-19T11:00:00+03:00","FinishDate":"2006-07-19T18:50:00+03:00","IsSpecialMeeting":false,"LastUpdatedDate":"2021-01-05T12:06:28.67+02:00"}
{"Id":145604,"Number":39,"KnessetNum":17,"Name":"ישיבת מליאה בתאריך 25/07/2006 בשעה: 11:00","StartDate":"2006-07-25T11:00:00+03:00","FinishDate":"2006-07-25T16:12:00+03:00","IsSpecialMeeting":true,"LastUpdatedDate":"2013-10-03T16:21:47+03:00"}
{"Id":146024,"Number":40,"KnessetNum":17,"Name":"ישיבת מליאה בתאריך 31/07/2006 בשעה: 11:00","StartDate":"2006-07-31T11:00:00+03:00","FinishDate":"2006-07-31T23:30:00+03:00","IsSpecialMeeting":false,"LastUpdatedDate":"2013-10-03T16:21:47+03:00"}
{"Id":146444,"Number":41,"KnessetNum":17,"Name":"ישיבת מליאה בתאריך 08/08/2006 בשעה: 11:00","StartDate":"2006-08-08T11:00:00+03:00","FinishDate":"2006-08-08T15:50:00+03:00","IsSpecialMeeting":false,"LastUpdatedDate":"2013-10-03T16:21:47+03:00"}
{"Id":146716,"Number":42,"KnessetNum":17,"Name":"ישיבת מליאה בתאריך 14/08/2006 בשעה: 16:00","StartDate":"2006-08-14T16:00:00+03:00","FinishDate":"2006-08-14T20:40:00+03:00","IsSpecialMeeting":false,"LastUpdatedDate":"2013-10-03T16:21:47+03:00"}