{"Id":80495,"Number":188,"KnessetNum":16,"Name":"ישיבת מליאה בתאריך 29/11/2004 בשעה: 16:00","StartDate":"2004-11-29T16:00:00+02:00","FinishDate":"2004-11-29T23:00:00+02:00","IsSpecialMeeting":false,"LastUpdatedDate":"2013-10-03T16:21:47+03:00"}
{"Id":80496,"Number":189,"KnessetNum":16,"Name":"ישיבת מליאה בתאריך 30/11/2004 בשעה: 16:00","StartDate":"2004-11-30T16:00:00+02:00","FinishDate":"2004-11-30T20:10:00+02:00","IsSpecialMeeting":false,"LastUpdatedDate":"2013-10-03T16:21:47+03:00"}
{"Id":80497,"Number":190,"KnessetNum":16,"Name":"ישיבת מליאה בתאריך 01/12/2004 בשעה: 11:00","StartDate":"2004-12-01T11:00:00+02:00","FinishDate":"2004-12-01T20:00:00+02:00","IsSpecialMeeting":false,"LastUpdatedDate":"2013-10-03T16:21:47+03:00"}
{"Id":81219,"Number":191,"KnessetNum":16,"Name":"ישיבת מליאה בתאריך 06/12/2004 בשעה 16:00","StartDate":"2004-12-06T16:00:00+02:00","FinishDate":"2004-12-06T22:00:00+02:00","IsSpecialMeeting":false,"LastUpdatedDate":"2020-02-09T09:31:26.953+02:00"}
{"Id":81220,"Number":192,"KnessetNum":16,"Name":"ישיבת מליאה בתאריך 07/12/2004 בשעה: 15:00","StartDate":"2004-12-07T15:00:00+02:00","FinishDate":"2004-12-07T17:10:00+02:00","IsSpecialMeeting":false,"LastUpdatedDate":"2013-10-03T16:21:47+03:00"}
{"Id":81221,"Number":193,"KnessetNum":16,"Name":"ישיבת מליאה בתאריך 08/12/2004 בשעה: 11:00","StartDate":"2004-12-08T11:00:00+02:00","FinishDate":"2004-12-08T16:30:00+02:00","IsSpecialMeeting":false,"LastUpdatedDate":"2013-10-03T16:21:47+03:00"}
{"Id":81709,"Number":194,"KnessetNum":16,"Name":"ישיבת מליאה בתאריך 13/12/2004 בשעה: 13:00","StartDate":"2004-12-13T13:00:00+02:00","FinishDate":"2004-12-13T16:20:00+02:00","IsSpecialMeeting":false,"LastUpdatedDate":"2013-10-03T16:21:47+03:00"}
{"Id":81711,"Number":195,"KnessetNum":16,"Name":"ישיבת מליאה בתאריך 14/12/2004 בשעה: 13:00","StartDate":"2004-12-14T13:00:00+02:00","FinishDate":"2004-12-14T16:40:00+02:00","IsSpecialMeeting":false,"LastUpdatedDate":"2013-10-03T16:21:47+03:00"}
{"Id":81712,"Number":196,"KnessetNum":16,"Name":"ישיבת מליאה בתאריך 15/12/2004 בשעה: 11:00","StartDate":"2004-12-15T11:00:00+02:00","FinishDate":"2004-12-15T18:20:00+02:00","IsSpecialMeeting":false,"LastUpdatedDate":"2013-10-03T16:21:47+03:00"}
{"Id":85520,"Number":197,"KnessetNum":16,"Name":"ישיבת מליאה בתאריך 20/12/2004 בשעה: 16:00","StartDate":"2004-12-20T16:00:00+02:00","FinishDate":"2004-12-20T20:00:00+02:00","IsSpecialMeeting":false,"LastUpdatedDate":"2013-10-03T16:21:47+03:00"}
{"Id":85521,"Number":198,"KnessetNum":16,"Name":"ישיבת מליאה בתאריך 21/12/2004 בשעה: 16:00","StartDate":"2004-12-21T16:00:00+02:00","FinishDate":"2004-12-21T20:20:00+02:00","IsSpecialMeeting":false,"LastUpdatedDate":"2013-10-03T16:21:47+03:00"}
{"Id":85522,"Number":199,"KnessetNum":16,"Name":"ישיבת מליאה בתאריך 22/12/2004 בשעה: 11:00","StartDate":"2004-12-22T11:00:00+02:00","FinishDate":"2004-12-22T19:40:00+02:00","IsSpecialMeeting":false,"LastUpdatedDate":"2013-10-03T16:21:47+03:00"}
{"Id":86497,"Number":201,"KnessetNum":16,"Name":"ישיבת מליאה בתאריך 28/12/2004 בשעה: 16:00","StartDate":"2004-12-28T16:00:00+02:00","FinishDate":"2004-12-28T20:30:00+02:00","IsSpecialMeeting":false,"LastUpdatedDate":"2013-10-03T16:21:47+03:00"}
{"Id":86498,"Number":202,"KnessetNum":16,"Name":"ישיבת מליאה בתאריך 29/12/2004 בשעה: 11:00","StartDate":"2004-12-29T11:00:00+02:00","FinishDate":"2004-12-29T22:10:00+02:00","IsSpecialMeeting":false,"LastUpdatedDate":"2013-10-03T16:21:47+03:00"}
{"Id":86814,"Number":200,"KnessetNum":16,"Name":"ישיבת מליאה בתאריך 27/12/2004 בשעה: 16:00","StartDate":"2004-12-27T16:00:00+02:00","FinishDate":"2004-12-27T20:20:00+02:00","IsSpecialMeeting":false,"LastUpdatedDate":"2013-10-03T16:21:47+03:00"}
{"Id":87166,"Number":203,"KnessetNum":16,"Name":"ישיבת מליאה בתאריך 03/01/2005 בשעה: 16:00","StartDate":"2005-01-03T16:00:00+02:00","FinishDate":"2005-01-03T20:20:00+02:00","IsSpecialMeeting":false,"LastUpdatedDate":"2013-10-03T16:21:47+03:00"}
{"Id":87167,"Number":204,"KnessetNum":16,"Name":"ישיבת מליאה בתאריך 04/01/2005 בשעה: 15:00","StartDate":"2005-01-04T15:00:00+02:00","FinishDate":"2005-01-04T18:10:00+02:00","IsSpecialMeeting":false,"LastUpdatedDate":"2013-10-03T16:21:47+03:00"}
{"Id":87168,"Number":205,"KnessetNum":16,"Name":"ישיבת מליאה בתאריך 05/01/2005 בשעה: 11:00","StartDate":"2005-01-05T11:00:00+02:00","FinishDate":"2005-01-05T18:30:00+02:00","IsSpecialMeeting":false,"LastUpdatedDate":"2013-10-03T16:21:47+03:00"}
{"Id":87784,"Number":206,"KnessetNum":16,"Name":"ישיבת מליאה בתאריך 10/01/2005 בשעה: 16:00","StartDate":"2005-01-10T16:00:00+02:00","FinishDate":"2005-01-10T22:10:00+02:00","IsSpecialMeeting":false,"LastUpdatedDate":"2013-10-03T16:21:47+03:00"}
{"Id":87944,"Number":207,"KnessetNum":16,"Name":"ישיבת מליאה בתאריך 11/01/2005 בשעה: 16:00","StartDate":"2005-01-11T16:00:00+02:00","FinishDate":"2005-01-11T22:10:00+02:00","IsSpecialMeeting":false,"LastUpdatedDate":"2013-10-03T16:21:47+03:00"}
{"Id":87999,"Number":208,"KnessetNum":16,"Name":"ישיבת מליאה בתאריך 12/01/2005 בשעה: 11:00","StartDate":"2005-01-12T11:00:00+02:00","FinishDate":"2005-01-12T19:50:00+02:00","IsSpecialMeeting":false,"LastUpdatedDate":"2013-10-03T16:21:47+03:00"}
{"Id":88287,"Number":209,"KnessetNum":16,"Name":"ישיבת מליאה בתאריך 17/01/2005 בשעה 16:00","StartDate":"2005-01-17T16:00:00+02:00","FinishDate":"2005-01-17T21:20:00+02:00","IsSpecialMeeting":false,"LastUpdatedDate":"2023-12-12T14:59:00.967+02:00"}
{"Id":88288,"Number":210,"KnessetNum":16,"Name":"ישיבת מליאה בתאריך 18/01/2005 בשעה: 16:00","StartDate":"2005-01-18T16:00:00+02:00","FinishDate":"2005-01-18T21:00:00+02:00","IsSpecialMeeting":false,"LastUpdatedDate":"2013-10-03T16:21:47+03:00"}
{"Id":88289,"Number":211,"KnessetNum":16,"Name":"ישיבת מליאה בתאריך 19/01/2005 בשעה: 11:00","StartDate":"2005-01-19T11:00:00+02:00","FinishDate":"2005-01-19T17:40:00+02:00","IsSpecialMeeting":false,"LastUpdatedDate":"2013-10-03T16:21:47+03:00"}
{"Id":88881,"Number":212,"KnessetNum":16,"Name":"ישיבת מליאה בתאריך 24/01/2005 בשעה: 16:00","StartDate":"2005-01-24T16:00:00+02:00","FinishDate":"2005-01-24T21:00:00+02:00","IsSpecialMeeting":false,"LastUpdatedDate":"2013-10-03T16:21:47+03:00"}
{"Id":88882,"Number":213,"KnessetNum":16,"Name":"ישיבת מליאה בתאריך 25/01/2005 בשעה: 16:00","StartDate":"2005-01-25T16:00:00+02:00","FinishDate":"2005-01-25T18:00:00+02:00","IsSpecialMeeting":false,"LastUpdatedDate":"2013-10-03T16:21:47+03:00"}
{"Id":88883,"Number":214,"KnessetNum":16,"Name":"ישיבת מליאה בתאריך 26/01/2005 בשעה: 11:00","StartDate":"2005-01-26T11:00:00+02:00","FinishDate":"2005-01-26T19:20:00+02:00","IsSpecialMeeting":false,"LastUpdatedDate":"2013-10-03T16:21:47+03:00"}
{"Id":89536,"Number":215,"KnessetNum":16,"Name":"ישיבת מליאה בתאריך 31/01/2005 בשעה: 16:00","StartDate":"2005-01-31T16:00:00+02:00","FinishDate":"2005-01-31T22:20:00+02:00","IsSpecialMeeting":false,"LastUpdatedDate":"2013-10-03T16:21:47+03:00"}
{"Id":89537,"Number":216,"KnessetNum":16,"Name":"ישיבת מליאה בתאריך 01/02/2005 בשעה: 16:00","StartDate":"2005-02-01T16:00:00+02:00","FinishDate":"2005-02-01T20:20:00+02:00","IsSpecialMeeting":false,"LastUpdatedDate":"2013-10-03T16:21:47+03:00"}
{"Id":89538,"Number":217,"KnessetNum":16,"Name":"ישיבת מליאה בתאריך 02/02/2005 בשעה: 11:00","StartDate":"2005-02-02T11:00:00+02:00","FinishDate":"2005-02-02T15:10:00+02:00","IsSpecialMeeting":false,"LastUpdatedDate":"2013-10-03T16:21:47+03:00"}