{"Id":93642,"Number":218,"KnessetNum":16,"Name":"ישיבת מליאה בתאריך 07/02/2005 בשעה: 16:00","StartDate":"2005-02-07T16:00:00+02:00","FinishDate":"2005-02-07T20:30:00+02:00","IsSpecialMeeting":false,"LastUpdatedDate":"2013-10-03T16:21:47+03:00"}
{"Id":93643,"Number":219,"KnessetNum":16,"Name":"ישיבת מליאה בתאריך 08/02/2005 בשעה: 16:00","StartDate":"2005-02-08T16:00:00+02:00","FinishDate":"2005-02-08T22:30:00+02:00","IsSpecialMeeting":false,"LastUpdatedDate":"2013-10-03T16:21:47+03:00"}
{"Id":93644,"Number":220,"KnessetNum":16,"Name":"ישיבת מליאה בתאריך 09/02/2005 בשעה: 11:00","StartDate":"2005-02-09T11:00:00+02:00","FinishDate":"2005-02-09T17:20:00+02:00","IsSpecialMeeting":false,"LastUpdatedDate":"2013-10-03T16:21:47+03:00"}
{"Id":94277,"Number":221,"KnessetNum":16,"Name":"ישיבת מליאה בתאריך 14/02/2005 בשעה: 16:00","StartDate":"2005-02-14T16:00:00+02:00","FinishDate":"2005-02-14T21:20:00+02:00","IsSpecialMeeting":false,"LastUpdatedDate":"2013-10-03T16:21:47+03:00"}
{"Id":94278,"Number":222,"KnessetNum":16,"Name":"ישיבת מליאה בתאריך 15/02/2005 בשעה 12:00","StartDate":"2005-02-15T12:00:00+02:00","FinishDate":"2005-02-16T00:25:00+02:00","IsSpecialMeeting":false,"LastUpdatedDate":"2023-07-06T13:46:32.643+03:00"}
{"Id":94279,"Number":223,"KnessetNum":16,"Name":"ישיבת מליאה בתאריך 16/02/2005 בשעה: 09:00","StartDate":"2005-02-16T09:00:00+02:00","FinishDate":"2005-02-16T20:00:00+02:00","IsSpecialMeeting":false,"LastUpdatedDate":"2013-10-03T16:21:47+03:00"}
{"Id":94818,"Number":224,"KnessetNum":16,"Name":"ישיבת מליאה בתאריך 21/02/2005 בשעה: 16:00","StartDate":"2005-02-21T16:00:00+02:00","FinishDate":"2005-02-21T21:00:00+02:00","IsSpecialMeeting":false,"LastUpdatedDate":"2013-10-03T16:21:47+03:00"}
{"Id":94819,"Number":225,"KnessetNum":16,"Name":"ישיבת מליאה בתאריך 22/02/2005 בשעה: 16:00","StartDate":"2005-02-22T16:00:00+02:00","FinishDate":"2005-02-22T19:50:00+02:00","IsSpecialMeeting":false,"LastUpdatedDate":"2013-10-03T16:21:47+03:00"}
{"Id":94820,"Number":226,"KnessetNum":16,"Name":"ישיבת מליאה בתאריך 23/02/2005 בשעה: 11:00","StartDate":"2005-02-23T11:00:00+02:00","FinishDate":"2005-02-23T20:00:00+02:00","IsSpecialMeeting":false,"LastUpdatedDate":"2013-10-03T16:21:47+03:00"}
{"Id":95601,"Number":227,"KnessetNum":16,"Name":"ישיבת מליאה בתאריך 28/02/2005 בשעה: 16:00","StartDate":"2005-02-28T16:00:00+02:00","FinishDate":"2005-02-28T22:00:00+02:00","IsSpecialMeeting":false,"LastUpdatedDate":"2013-10-03T16:21:47+03:00"}
{"Id":95603,"Number":228,"KnessetNum":16,"Name":"ישיבת מליאה בתאריך 01/03/2005 בשעה: 16:00","StartDate":"2005-03-01T16:00:00+02:00","FinishDate":"2005-03-01T19:30:00+02:00","IsSpecialMeeting":false,"LastUpdatedDate":"2013-10-03T16:21:47+03:00"}
{"Id":95604,"Number":229,"KnessetNum":16,"Name":"ישיבת מליאה בתאריך 02/03/2005 בשעה: 11:00","StartDate":"2005-03-02T11:00:00+02:00","FinishDate":"2005-03-02T18:30:00+02:00","IsSpecialMeeting":false,"LastUpdatedDate":"2013-10-03T16:21:47+03:00"}
{"Id":96299,"Number":230,"KnessetNum":16,"Name":"ישיבת מליאה בתאריך 07/03/2005 בשעה: 16:00","StartDate":"2005-03-07T16:00:00+02:00","FinishDate":"2005-03-07T22:10:00+02:00","IsSpecialMeeting":false,"LastUpdatedDate":"2013-10-03T16:21:47+03:00"}
{"Id":96552,"Number":231,"KnessetNum":16,"Name":"ישיבת מליאה בתאריך 08/03/2005 בשעה: 16:00","StartDate":"2005-03-08T16:00:00+02:00","FinishDate":"2005-03-08T20:50:00+02:00","IsSpecialMeeting":false,"LastUpdatedDate":"2013-10-03T16:21:47+03:00"}
{"Id":96684,"Number":232,"KnessetNum":16,"Name":"ישיבת מליאה בתאריך 09/03/2005 בשעה: 11:00","StartDate":"2005-03-09T11:00:00+02:00","FinishDate":"2005-03-09T16:50:00+02:00","IsSpecialMeeting":false,"LastUpdatedDate":"2013-10-03T16:21:47+03:00"}
{"Id":96994,"Number":233,"KnessetNum":16,"Name":"ישיבת מליאה בתאריך 14/03/2005 בשעה: 16:00","StartDate":"2005-03-14T16:00:00+02:00","FinishDate":"2005-03-14T20:40:00+02:00","IsSpecialMeeting":false,"LastUpdatedDate":"2013-10-03T16:21:47+03:00"}
{"Id":96995,"Number":234,"KnessetNum":16,"Name":"ישיבת מליאה בתאריך 15/03/2005 בשעה: 16:00","StartDate":"2005-03-15T16:00:00+02:00","FinishDate":"2005-03-15T17:50:00+02:00","IsSpecialMeeting":false,"LastUpdatedDate":"2013-10-03T16:21:47+03:00"}
{"Id":96996,"Number":235,"KnessetNum":16,"Name":"ישיבת מליאה בתאריך 16/03/2005 בשעה: 11:00","StartDate":"2005-03-16T11:00:00+02:00","FinishDate":"2005-03-16T16:10:00+02:00","IsSpecialMeeting":false,"LastUpdatedDate":"2013-10-03T16:21:47+03:00"}
{"Id":97587,"Number":236,"KnessetNum":16,"Name":"ישיבת מליאה בתאריך 21/03/2005 בשעה: 16:00","StartDate":"2005-03-21T16:00:00+02:00","FinishDate":"2005-03-21T22:30:00+02:00","IsSpecialMeeting":false,"LastUpdatedDate":"2013-10-03T16:21:47+03:00"}
{"Id":97588,"Number":237,"KnessetNum":16,"Name":"ישיבת מליאה בתאריך 22/03/2005 בשעה: 16:00","StartDate":"2005-03-22T16:00:00+02:00","FinishDate":"2005-03-22T18:50:00+02:00","IsSpecialMeeting":false,"LastUpdatedDate":"2013-10-03T16:21:47+03:00"}
{"Id":97589,"Number":238,"KnessetNum":16,"Name":"ישיבת מליאה בתאריך 23/03/2005 בשעה: 11:00","StartDate":"2005-03-23T11:00:00+02:00","FinishDate":"2005-03-23T19:00:00+02:00","IsSpecialMeeting":false,"LastUpdatedDate":"2013-10-03T16:21:47+03:00"}
{"Id":98199,"Number":239,"KnessetNum":16,"Name":"ישיבת מליאה בתאריך 28/03/2005 בשעה: 09:00","StartDate":"2005-03-28T09:00:00+02:00","FinishDate":"2005-03-28T22:00:00+02:00","IsSpecialMeeting":false,"LastUpdatedDate":"2013-10-03T16:21:47+03:00"}
{"Id":98200,"Number":240,"KnessetNum":16,"Name":"ישיבת מליאה בתאריך 29/03/2005 בשעה: 08:00","StartDate":"2005-03-29T08:00:00+02:00","FinishDate":"2005-03-29T21:40:00+02:00","IsSpecialMeeting":false,"LastUpdatedDate":"2013-10-03T16:21:47+03:00"}
{"Id":98201,"Number":241,"KnessetNum":16,"Name":"ישיבת מליאה בתאריך 30/03/2005 בשעה: 11:00","StartDate":"2005-03-30T11:00:00+02:00","FinishDate":"2005-03-30T18:20:00+02:00","IsSpecialMeeting":false,"LastUpdatedDate":"2013-10-03T16:21:47+03:00"}
{"Id":98701,"Number":242,"KnessetNum":16,"Name":"ישיבת מליאה בתאריך 06/04/2005 בשעה: 11:00","StartDate":"2005-04-06T11:00:00+03:00","FinishDate":"2005-04-06T12:50:00+03:00","IsSpecialMeeting":false,"LastUpdatedDate":"2013-10-03T16:21:47+03:00"}
{"Id":99099,"Number":243,"KnessetNum":16,"Name":"ישיבת מליאה בתאריך 20/04/2005 בשעה: 11:00","StartDate":"2005-04-20T11:00:00+03:00","FinishDate":"2005-04-20T13:10:00+03:00","IsSpecialMeeting":false,"LastUpdatedDate":"2013-10-03T16:21:47+03:00"}
{"Id":99499,"Number":244,"KnessetNum":16,"Name":"ישיבת מליאה בתאריך 09/05/2005 בשעה: 10:00","StartDate":"2005-05-09T10:00:00+03:00","FinishDate":"2005-05-09T12:30:00+03:00","IsSpecialMeeting":false,"LastUpdatedDate":"2013-10-03T16:21:47+03:00"}
{"Id":99827,"Number":245,"KnessetNum":16,"Name":"ישיבת מליאה בתאריך 16/05/2005 בשעה: 16:00","StartDate":"2005-05-16T16:00:00+03:00","FinishDate":"2005-05-16T21:40:00+03:00","IsSpecialMeeting":false,"LastUpdatedDate":"2013-10-03T16:21:47+03:00"}
{"Id":99845,"Number":246,"KnessetNum":16,"Name":"ישיבת מליאה בתאריך 17/05/2005 בשעה: 16:00","StartDate":"2005-05-17T16:00:00+03:00","FinishDate":"2005-05-17T19:10:00+03:00","IsSpecialMeeting":false,"LastUpdatedDate":"2013-10-03T16:21:47+03:00"}