{"Id":490000,"Number":177,"KnessetNum":3,"Name":"ישיבת מליאה בתאריך 24/10/1956 בשעה 11:06","StartDate":"1956-10-24T11:06:00+02:00","FinishDate":"1956-10-24T12:27:00+02:00","IsSpecialMeeting":null,"LastUpdatedDate":"2022-01-03T17:36:50.867+02:00"}
{"Id":490001,"Number":182,"KnessetNum":3,"Name":"ישיבת מליאה בתאריך 07/11/1956 בשעה 11:17","StartDate":"1956-11-07T11:17:00+02:00","FinishDate":"1956-11-07T11:59:00+02:00","IsSpecialMeeting":null,"LastUpdatedDate":"2021-12-14T08:31:45.367+02:00"}
{"Id":490002,"Number":183,"KnessetNum":3,"Name":"ישיבת מליאה בתאריך 07/11/1956 בשעה 14:08","StartDate":"1956-11-07T14:08:00+02:00","FinishDate":"1956-11-07T17:18:00+02:00","IsSpecialMeeting":null,"LastUpdatedDate":"2021-12-14T08:34:39.25+02:00"}
{"Id":490003,"Number":186,"KnessetNum":3,"Name":"ישיבת מליאה בתאריך 13/11/1956 בשעה 16:00","StartDate":"1956-11-13T16:00:00+02:00","FinishDate":"1956-11-13T18:23:00+02:00","IsSpecialMeeting":null,"LastUpdatedDate":"2021-12-14T16:36:51.673+02:00"}
{"Id":490004,"Number":187,"KnessetNum":3,"Name":"ישיבת מליאה בתאריך 14/11/1956 בשעה 11:17","StartDate":"1956-11-14T11:17:00+02:00","FinishDate":"1956-11-14T12:08:00+02:00","IsSpecialMeeting":null,"LastUpdatedDate":"2021-12-14T16:54:48.613+02:00"}
{"Id":490005,"Number":188,"KnessetNum":3,"Name":"ישיבת מליאה בתאריך 19/11/1956 בשעה 16:10","StartDate":"1956-11-19T16:10:00+02:00","FinishDate":"1956-11-19T17:45:00+02:00","IsSpecialMeeting":null,"LastUpdatedDate":"2021-12-15T13:12:59.153+02:00"}
{"Id":490006,"Number":189,"KnessetNum":3,"Name":"ישיבת מליאה בתאריך 19/11/1956 בשעה 19:36","StartDate":"1956-11-19T19:36:00+02:00","FinishDate":"1956-11-19T21:21:00+02:00","IsSpecialMeeting":null,"LastUpdatedDate":"2021-12-15T13:28:17.54+02:00"}
{"Id":490007,"Number":191,"KnessetNum":3,"Name":"ישיבת מליאה בתאריך 21/11/1956 בשעה 11:10","StartDate":"1956-11-21T11:10:00+02:00","FinishDate":"1956-11-21T12:25:00+02:00","IsSpecialMeeting":null,"LastUpdatedDate":"2022-02-06T17:20:56.157+02:00"}
{"Id":490008,"Number":200,"KnessetNum":3,"Name":"ישיבת מליאה בתאריך 05/12/1956 בשעה 11:05","StartDate":"1956-12-05T11:05:00+02:00","FinishDate":"1956-12-05T12:45:00+02:00","IsSpecialMeeting":null,"LastUpdatedDate":"2022-02-08T11:10:08.9+02:00"}
{"Id":490009,"Number":203,"KnessetNum":3,"Name":"ישיבת מליאה בתאריך 12/12/1956 בשעה 12:08","StartDate":"1956-12-12T12:08:00+02:00","FinishDate":"1956-12-12T12:20:00+02:00","IsSpecialMeeting":null,"LastUpdatedDate":"2021-12-15T19:04:17.163+02:00"}
{"Id":490010,"Number":205,"KnessetNum":3,"Name":"ישיבת מליאה בתאריך 17/12/1956 בשעה 20:05","StartDate":"1956-12-17T20:05:00+02:00","FinishDate":"1956-12-17T21:30:00+02:00","IsSpecialMeeting":null,"LastUpdatedDate":"2021-12-16T10:16:37.603+02:00"}
{"Id":490011,"Number":215,"KnessetNum":3,"Name":"ישיבת מליאה בתאריך 01/01/1957 בשעה 16:05","StartDate":"1957-01-01T16:05:00+02:00","FinishDate":"1957-01-01T19:17:00+02:00","IsSpecialMeeting":null,"LastUpdatedDate":"2021-12-26T09:16:18.063+02:00"}
{"Id":490012,"Number":216,"KnessetNum":3,"Name":"ישיבת מליאה בתאריך 02/01/1957 בשעה 11:13","StartDate":"1957-01-02T11:13:00+02:00","FinishDate":"1957-01-02T13:29:00+02:00","IsSpecialMeeting":null,"LastUpdatedDate":"2021-12-28T15:10:05.937+02:00"}
{"Id":490013,"Number":218,"KnessetNum":3,"Name":"ישיבת מליאה בתאריך 07/01/1957 בשעה 20:00","StartDate":"1957-01-07T20:00:00+02:00","FinishDate":"1957-01-07T21:25:00+02:00","IsSpecialMeeting":null,"LastUpdatedDate":"2022-01-02T12:13:23.91+02:00"}
{"Id":490014,"Number":221,"KnessetNum":3,"Name":"ישיבת מליאה בתאריך 09/01/1957 בשעה 11:00","StartDate":"1957-01-09T11:00:00+02:00","FinishDate":"1957-01-09T13:10:00+02:00","IsSpecialMeeting":null,"LastUpdatedDate":"2022-01-02T16:01:11.843+02:00"}
{"Id":490015,"Number":224,"KnessetNum":3,"Name":"ישיבת מליאה בתאריך 16/01/1957 בשעה 11:05","StartDate":"1957-01-16T11:05:00+02:00","FinishDate":"1957-01-16T12:56:00+02:00","IsSpecialMeeting":null,"LastUpdatedDate":"2022-01-06T13:03:21.453+02:00"}
{"Id":490016,"Number":225,"KnessetNum":3,"Name":"ישיבת מליאה בתאריך 21/01/1957 בשעה 16:14","StartDate":"1957-01-21T16:14:00+02:00","FinishDate":"1957-01-21T19:08:00+02:00","IsSpecialMeeting":null,"LastUpdatedDate":"2022-01-06T14:24:35.263+02:00"}
{"Id":490017,"Number":226,"KnessetNum":3,"Name":"ישיבת מליאה בתאריך 22/01/1957 בשעה 16:04","StartDate":"1957-01-22T16:04:00+02:00","FinishDate":"1957-01-22T19:07:00+02:00","IsSpecialMeeting":null,"LastUpdatedDate":"2022-01-06T14:36:41.18+02:00"}
{"Id":490018,"Number":227,"KnessetNum":3,"Name":"ישיבת מליאה בתאריך 22/01/1957 בשעה 20:05","StartDate":"1957-01-22T20:05:00+02:00","FinishDate":"1957-01-22T22:12:00+02:00","IsSpecialMeeting":null,"LastUpdatedDate":"2022-01-06T14:59:14.573+02:00"}
{"Id":490019,"Number":228,"KnessetNum":3,"Name":"ישיבת מליאה בתאריך 23/01/1957 בשעה 16:18","StartDate":"1957-01-23T16:18:00+02:00","FinishDate":null,"IsSpecialMeeting":null,"LastUpdatedDate":"2022-01-06T15:20:11.537+02:00"}
{"Id":490020,"Number":229,"KnessetNum":3,"Name":"ישיבת מליאה בתאריך 25/01/1957 בשעה 16:08","StartDate":"1957-01-25T16:08:00+02:00","FinishDate":"1957-01-25T19:09:00+02:00","IsSpecialMeeting":null,"LastUpdatedDate":"2024-02-22T15:09:57.76+02:00"}
{"Id":490021,"Number":231,"KnessetNum":3,"Name":"ישיבת מליאה בתאריך 29/01/1957 בשעה 16:05","StartDate":"1957-01-29T16:05:00+02:00","FinishDate":"1957-01-29T18:55:00+02:00","IsSpecialMeeting":null,"LastUpdatedDate":"2022-01-11T15:27:49.2+02:00"}
{"Id":490022,"Number":232,"KnessetNum":3,"Name":"ישיבת מליאה בתאריך 29/01/1957 בשעה 20:07","StartDate":"1957-01-29T20:07:00+02:00","FinishDate":"1957-01-29T21:50:00+02:00","IsSpecialMeeting":null,"LastUpdatedDate":"2022-01-11T16:28:39.283+02:00"}
{"Id":490023,"Number":234,"KnessetNum":3,"Name":"ישיבת מליאה בתאריך 04/02/1957 בשעה 16:07","StartDate":"1957-02-04T16:07:00+02:00","FinishDate":"1957-02-04T18:59:00+02:00","IsSpecialMeeting":null,"LastUpdatedDate":"2022-01-12T11:15:00.223+02:00"}
{"Id":490024,"Number":235,"KnessetNum":3,"Name":"ישיבת מליאה בתאריך 04/02/1957 בשעה 20:06","StartDate":"1957-02-04T20:06:00+02:00","FinishDate":"1957-02-04T22:05:00+02:00","IsSpecialMeeting":null,"LastUpdatedDate":"2023-12-11T08:40:35.3+02:00"}
{"Id":490025,"Number":236,"KnessetNum":3,"Name":"ישיבת מליאה בתאריך 05/02/1957 בשעה 16:05","StartDate":"1957-02-05T16:05:00+02:00","FinishDate":"1957-02-05T19:02:00+02:00","IsSpecialMeeting":null,"LastUpdatedDate":"2022-01-12T15:30:46.01+02:00"}
{"Id":490026,"Number":237,"KnessetNum":3,"Name":"ישיבת מליאה בתאריך 05/02/1957 בשעה 20:07","StartDate":"1957-02-05T20:07:00+02:00","FinishDate":"1957-02-05T21:30:00+02:00","IsSpecialMeeting":null,"LastUpdatedDate":"2022-01-26T12:08:51.67+02:00"}
{"Id":490027,"Number":238,"KnessetNum":3,"Name":"ישיבת מליאה בתאריך 06/02/1957 בשעה 11:03","StartDate":"1957-02-06T11:03:00+02:00","FinishDate":"1957-02-06T13:19:00+02:00","IsSpecialMeeting":null,"LastUpdatedDate":"2022-01-17T16:36:28.883+02:00"}
{"Id":490028,"Number":239,"KnessetNum":3,"Name":"ישיבת מליאה בתאריך 11/02/1957 בשעה 16:12","StartDate":"1957-02-11T16:12:00+02:00","FinishDate":"1957-02-11T19:04:00+02:00","IsSpecialMeeting":null,"LastUpdatedDate":"2024-02-22T17:02:18.493+02:00"}
{"Id":490029,"Number":241,"KnessetNum":3,"Name":"ישיבת מליאה בתאריך 12/02/1957 בשעה 16:15","StartDate":"1957-02-12T16:15:00+02:00","FinishDate":"1957-02-12T19:04:00+02:00","IsSpecialMeeting":null,"LastUpdatedDate":"2022-01-20T12:59:25.083+02:00"}
{"Id":490030,"Number":242,"KnessetNum":3,"Name":"ישיבת מליאה בתאריך 12/02/1957 בשעה 20:13","StartDate":"1957-02-12T20:13:00+02:00","FinishDate":"1957-02-12T21:52:00+02:00","IsSpecialMeeting":null,"LastUpdatedDate":"2022-01-20T14:24:36.55+02:00"}
{"Id":490031,"Number":243,"KnessetNum":3,"Name":"ישיבת מליאה בתאריך 13/02/1957 בשעה 11:03","StartDate":"1957-02-13T11:03:00+02:00","FinishDate":"1957-02-13T13:34:00+02:00","IsSpecialMeeting":null,"LastUpdatedDate":"2022-01-25T07:03:29.667+02:00"}
{"Id":490032,"Number":248,"KnessetNum":3,"Name":"ישיבת מליאה בתאריך 20/02/1957 בשעה 11:05","StartDate":"1957-02-20T11:05:00+02:00","FinishDate":"1957-02-20T14:04:00+02:00","IsSpecialMeeting":null,"LastUpdatedDate":"2022-02-01T17:48:02.587+02:00"}
{"Id":490033,"Number":249,"KnessetNum":3,"Name":"ישיבת מליאה בתאריך 21/02/1957 בשעה 21:27","StartDate":"1957-02-21T21:27:00+02:00","FinishDate":"1957-02-21T22:09:00+02:00","IsSpecialMeeting":null,"LastUpdatedDate":"2022-02-01T18:16:48.727+02:00"}
{"Id":490034,"Number":250,"KnessetNum":3,"Name":"ישיבת מליאה בתאריך 22/02/1957 בשעה 09:15","StartDate":"1957-02-22T09:15:00+02:00","FinishDate":"1957-02-22T12:02:00+02:00","IsSpecialMeeting":null,"LastUpdatedDate":"2022-02-01T18:19:16.773+02:00"}
{"Id":490035,"Number":252,"KnessetNum":3,"Name":"ישיבת מליאה בתאריך 25/02/1957 בשעה 20:58","StartDate":"1957-02-25T20:58:00+02:00","FinishDate":"1957-02-25T22:22:00+02:00","IsSpecialMeeting":null,"LastUpdatedDate":"2022-02-06T10:49:03.777+02:00"}
{"Id":490036,"Number":253,"KnessetNum":3,"Name":"ישיבת מליאה בתאריך 26/02/1957 בשעה 16:05","StartDate":"1957-02-26T16:05:00+02:00","FinishDate":"1957-02-26T18:48:00+02:00","IsSpecialMeeting":null,"LastUpdatedDate":"2022-02-06T10:50:31.247+02:00"}
{"Id":490037,"Number":254,"KnessetNum":3,"Name":"ישיבת מליאה בתאריך 26/02/1957 בשעה 20:10","StartDate":"1957-02-26T20:10:00+02:00","FinishDate":"1957-02-26T22:16:00+02:00","IsSpecialMeeting":null,"LastUpdatedDate":"2022-02-06T11:13:15.59+02:00"}
{"Id":490038,"Number":255,"KnessetNum":3,"Name":"ישיבת מליאה בתאריך 27/02/1957 בשעה 11:30","StartDate":"1957-02-27T11:30:00+02:00","FinishDate":"1957-02-27T13:16:00+02:00","IsSpecialMeeting":null,"LastUpdatedDate":"2022-02-06T14:59:09.163+02:00"}
{"Id":490039,"Number":256,"KnessetNum":3,"Name":"ישיבת מליאה בתאריך 05/03/1957 בשעה 21:13","StartDate":"1957-03-05T21:13:00+02:00","FinishDate":"1957-03-05T23:34:00+02:00","IsSpecialMeeting":null,"LastUpdatedDate":"2022-02-06T15:36:40.543+02:00"}
{"Id":490040,"Number":257,"KnessetNum":3,"Name":"ישיבת מליאה בתאריך 06/03/1957 בשעה 09:05","StartDate":"1957-03-06T09:05:00+02:00","FinishDate":"1957-03-06T13:25:00+02:00","IsSpecialMeeting":null,"LastUpdatedDate":"2022-02-06T16:50:58.797+02:00"}
{"Id":490041,"Number":258,"KnessetNum":3,"Name":"ישיבת מליאה בתאריך 06/03/1957 בשעה 15:05","StartDate":"1957-03-06T15:05:00+02:00","FinishDate":"1957-03-06T16:45:00+02:00","IsSpecialMeeting":null,"LastUpdatedDate":"2022-02-07T18:10:34.927+02:00"}
{"Id":490042,"Number":259,"KnessetNum":3,"Name":"ישיבת מליאה בתאריך 11/03/1957 בשעה 16:13","StartDate":"1957-03-11T16:13:00+02:00","FinishDate":"1957-03-11T19:12:00+02:00","IsSpecialMeeting":null,"LastUpdatedDate":"2022-02-08T16:47:24.123+02:00"}
{"Id":490043,"Number":260,"KnessetNum":3,"Name":"ישיבת מליאה בתאריך 11/03/1957 בשעה 20:01","StartDate":"1957-03-11T20:01:00+02:00","FinishDate":"1957-03-11T21:15:00+02:00","IsSpecialMeeting":null,"LastUpdatedDate":"2022-02-08T17:31:16.67+02:00"}
{"Id":490044,"Number":261,"KnessetNum":3,"Name":"ישיבת מליאה בתאריך 12/03/1957 בשעה 16:00","StartDate":"1957-03-12T16:00:00+02:00","FinishDate":"1957-03-12T18:58:00+02:00","IsSpecialMeeting":null,"LastUpdatedDate":"2022-02-09T06:57:19.233+02:00"}
{"Id":490045,"Number":262,"KnessetNum":3,"Name":"ישיבת מליאה בתאריך 12/03/1957 בשעה 20:07","StartDate":"1957-03-12T20:07:00+02:00","FinishDate":"1957-03-12T22:00:00+02:00","IsSpecialMeeting":null,"LastUpdatedDate":"2022-02-09T07:04:42.833+02:00"}
{"Id":490046,"Number":263,"KnessetNum":3,"Name":"ישיבת מליאה בתאריך 13/03/1957 בשעה 11:10","StartDate":"1957-03-13T11:10:00+02:00","FinishDate":"1957-03-13T13:25:00+02:00","IsSpecialMeeting":null,"LastUpdatedDate":"2022-02-09T07:40:05.063+02:00"}
{"Id":490047,"Number":264,"KnessetNum":3,"Name":"ישיבת מליאה בתאריך 19/03/1957 בשעה 16:06","StartDate":"1957-03-19T16:06:00+02:00","FinishDate":"1957-03-19T19:13:00+02:00","IsSpecialMeeting":null,"LastUpdatedDate":"2022-02-09T11:39:49.323+02:00"}
{"Id":490048,"Number":265,"KnessetNum":3,"Name":"ישיבת מליאה בתאריך 19/03/1957 בשעה 20:33","StartDate":"1957-03-19T20:33:00+02:00","FinishDate":"1957-03-19T21:45:00+02:00","IsSpecialMeeting":null,"LastUpdatedDate":"2022-02-09T14:50:09.673+02:00"}
{"Id":490049,"Number":270,"KnessetNum":3,"Name":"ישיבת מליאה בתאריך 25/03/1957 בשעה 16:05","StartDate":"1957-03-25T16:05:00+02:00","FinishDate":"1957-03-25T19:10:00+02:00","IsSpecialMeeting":null,"LastUpdatedDate":"2022-02-14T08:10:10.65+02:00"}
{"Id":490050,"Number":272,"KnessetNum":3,"Name":"ישיבת מליאה בתאריך 26/03/1957 בשעה 16:04","StartDate":"1957-03-26T16:04:00+02:00","FinishDate":"1957-03-26T19:03:00+02:00","IsSpecialMeeting":null,"LastUpdatedDate":"2022-02-15T06:58:47.72+02:00"}
{"Id":490051,"Number":277,"KnessetNum":3,"Name":"ישיבת מליאה בתאריך 01/04/1957 בשעה 16:10","StartDate":"1957-04-01T16:10:00+02:00","FinishDate":"1957-04-01T19:00:00+02:00","IsSpecialMeeting":null,"LastUpdatedDate":"2022-02-17T07:59:48.597+02:00"}
{"Id":490052,"Number":278,"KnessetNum":3,"Name":"ישיבת מליאה בתאריך 01/04/1957 בשעה 20:05","StartDate":"1957-04-01T20:05:00+02:00","FinishDate":"1957-04-01T23:31:00+02:00","IsSpecialMeeting":null,"LastUpdatedDate":"2022-02-17T08:07:56.307+02:00"}
{"Id":490053,"Number":280,"KnessetNum":3,"Name":"ישיבת מליאה בתאריך 02/04/1957 בשעה 20:20","StartDate":"1957-04-02T20:20:00+02:00","FinishDate":"1957-04-02T23:54:00+02:00","IsSpecialMeeting":null,"LastUpdatedDate":"2022-02-17T08:47:37.51+02:00"}
{"Id":490054,"Number":281,"KnessetNum":3,"Name":"ישיבת מליאה בתאריך 03/04/1957 בשעה 16:06","StartDate":"1957-04-03T16:06:00+03:00","FinishDate":"1957-04-03T19:15:00+03:00","IsSpecialMeeting":null,"LastUpdatedDate":"2022-02-17T08:50:52.873+02:00"}
{"Id":490055,"Number":282,"KnessetNum":3,"Name":"ישיבת מליאה בתאריך 08/04/1957 בשעה 16:05","StartDate":"1957-04-08T16:05:00+03:00","FinishDate":"1957-04-08T19:02:00+03:00","IsSpecialMeeting":null,"LastUpdatedDate":"2022-02-17T09:16:24.973+02:00"}
{"Id":490056,"Number":293,"KnessetNum":3,"Name":"ישיבת מליאה בתאריך 21/05/1957 בשעה 16:03","StartDate":"1957-05-21T16:03:00+03:00","FinishDate":"1957-05-21T18:45:00+03:00","IsSpecialMeeting":null,"LastUpdatedDate":"2022-02-22T15:30:26.017+02:00"}
{"Id":490057,"Number":299,"KnessetNum":3,"Name":"ישיבת מליאה בתאריך 29/05/1957 בשעה 11:09","StartDate":"1957-05-29T11:09:00+03:00","FinishDate":"1957-05-29T12:14:00+03:00","IsSpecialMeeting":null,"LastUpdatedDate":"2022-02-22T17:06:19.47+02:00"}
{"Id":490058,"Number":300,"KnessetNum":3,"Name":"ישיבת מליאה בתאריך 03/06/1957 בשעה 10:17","StartDate":"1957-06-03T10:17:00+03:00","FinishDate":"1957-06-03T12:47:00+03:00","IsSpecialMeeting":null,"LastUpdatedDate":"2022-02-22T17:24:52.04+02:00"}
{"Id":490059,"Number":301,"KnessetNum":3,"Name":"ישיבת מליאה בתאריך 03/06/1957 בשעה 14:07","StartDate":"1957-06-03T14:07:00+03:00","FinishDate":"1957-06-03T18:50:00+03:00","IsSpecialMeeting":null,"LastUpdatedDate":"2022-02-23T08:42:09.183+02:00"}
{"Id":490060,"Number":306,"KnessetNum":3,"Name":"ישיבת מליאה בתאריך 12/06/1957 בשעה 11:14","StartDate":"1957-06-12T11:14:00+03:00","FinishDate":"1957-06-12T12:41:00+03:00","IsSpecialMeeting":null,"LastUpdatedDate":"2023-12-03T11:40:18.447+02:00"}
{"Id":490061,"Number":310,"KnessetNum":3,"Name":"ישיבת מליאה בתאריך 19/06/1957 בשעה 11:05","StartDate":"1957-06-19T11:05:00+03:00","FinishDate":"1957-06-19T12:32:00+03:00","IsSpecialMeeting":null,"LastUpdatedDate":"2022-02-23T13:54:28.677+02:00"}
{"Id":490062,"Number":311,"KnessetNum":3,"Name":"ישיבת מליאה בתאריך 20/06/1957 בשעה 16:06","StartDate":"1957-06-20T16:06:00+03:00","FinishDate":"1957-06-20T18:52:00+03:00","IsSpecialMeeting":null,"LastUpdatedDate":"2022-02-23T13:59:25.01+02:00"}
{"Id":490063,"Number":319,"KnessetNum":3,"Name":"ישיבת מליאה בתאריך 03/07/1957 בשעה 11:10","StartDate":"1957-07-03T11:10:00+03:00","FinishDate":"1957-07-03T13:45:00+03:00","IsSpecialMeeting":null,"LastUpdatedDate":"2022-02-23T15:28:50.957+02:00"}
{"Id":490064,"Number":322,"KnessetNum":3,"Name":"ישיבת מליאה בתאריך 09/07/1957 בשעה 16:08","StartDate":"1957-07-09T16:08:00+03:00","FinishDate":"1957-07-09T19:03:00+03:00","IsSpecialMeeting":null,"LastUpdatedDate":"2022-02-23T16:27:54.88+02:00"}
{"Id":490065,"Number":325,"KnessetNum":3,"Name":"ישיבת מליאה בתאריך 15/07/1957 בשעה 16:07","StartDate":"1957-07-15T16:07:00+03:00","FinishDate":"1957-07-15T18:45:00+03:00","IsSpecialMeeting":null,"LastUpdatedDate":"2022-02-24T12:07:11.59+02:00"}
{"Id":490066,"Number":326,"KnessetNum":3,"Name":"ישיבת מליאה בתאריך 15/07/1957 בשעה 20:08","StartDate":"1957-07-15T20:08:00+03:00","FinishDate":"1957-07-15T21:30:00+03:00","IsSpecialMeeting":null,"LastUpdatedDate":"2022-02-24T12:14:39.823+02:00"}
{"Id":490067,"Number":327,"KnessetNum":3,"Name":"ישיבת מליאה בתאריך 16/07/1957 בשעה 16:00","StartDate":"1957-07-16T16:00:00+03:00","FinishDate":"1957-07-16T19:10:00+03:00","IsSpecialMeeting":null,"LastUpdatedDate":"2022-02-24T12:17:23.853+02:00"}
{"Id":490068,"Number":345,"KnessetNum":3,"Name":"ישיבת מליאה בתאריך 28/10/1957 בשעה 16:12","StartDate":"1957-10-28T16:12:00+02:00","FinishDate":"1957-10-28T17:06:00+02:00","IsSpecialMeeting":null,"LastUpdatedDate":"2022-03-01T07:51:21.37+02:00"}
{"Id":490069,"Number":346,"KnessetNum":3,"Name":"ישיבת מליאה בתאריך 28/10/1957 בשעה 18:08","StartDate":"1957-10-28T18:08:00+02:00","FinishDate":"1957-10-28T18:31:00+02:00","IsSpecialMeeting":null,"LastUpdatedDate":"2022-03-01T07:55:01.86+02:00"}
{"Id":490070,"Number":347,"KnessetNum":3,"Name":"ישיבת מליאה בתאריך 29/10/1957 בשעה 16:05","StartDate":"1957-10-29T16:05:00+02:00","FinishDate":"1957-10-29T21:26:00+02:00","IsSpecialMeeting":null,"LastUpdatedDate":"2022-03-01T07:56:28.753+02:00"}
{"Id":490071,"Number":348,"KnessetNum":3,"Name":"ישיבת מליאה בתאריך 30/10/1957 בשעה 11:00","StartDate":"1957-10-30T11:00:00+02:00","FinishDate":"1957-10-30T11:25:00+02:00","IsSpecialMeeting":null,"LastUpdatedDate":"2022-03-01T08:13:12.663+02:00"}
{"Id":490072,"Number":349,"KnessetNum":3,"Name":"ישיבת מליאה בתאריך 04/11/1957 בשעה 16:13","StartDate":"1957-11-04T16:13:00+02:00","FinishDate":"1957-11-04T18:44:00+02:00","IsSpecialMeeting":null,"LastUpdatedDate":"2023-11-26T10:13:26.29+02:00"}
{"Id":490073,"Number":350,"KnessetNum":3,"Name":"ישיבת מליאה בתאריך 04/11/1957 בשעה 20:17","StartDate":"1957-11-04T20:17:00+02:00","FinishDate":"1957-11-04T21:03:00+02:00","IsSpecialMeeting":null,"LastUpdatedDate":"2022-03-01T08:43:32.077+02:00"}
{"Id":490074,"Number":353,"KnessetNum":3,"Name":"ישיבת מליאה בתאריך 06/11/1957 בשעה 11:05","StartDate":"1957-11-06T11:05:00+02:00","FinishDate":"1957-11-06T12:03:00+02:00","IsSpecialMeeting":null,"LastUpdatedDate":"2022-03-01T16:35:35.847+02:00"}
{"Id":490075,"Number":357,"KnessetNum":3,"Name":"ישיבת מליאה בתאריך 13/11/1957 בשעה 11:06","StartDate":"1957-11-13T11:06:00+02:00","FinishDate":"1957-11-13T13:00:00+02:00","IsSpecialMeeting":null,"LastUpdatedDate":"2022-03-02T17:09:04.793+02:00"}
{"Id":490076,"Number":358,"KnessetNum":3,"Name":"ישיבת מליאה בתאריך 18/11/1957 בשעה 16:08","StartDate":"1957-11-18T16:08:00+02:00","FinishDate":"1957-11-18T18:57:00+02:00","IsSpecialMeeting":null,"LastUpdatedDate":"2022-03-02T17:21:36.32+02:00"}
{"Id":490077,"Number":359,"KnessetNum":3,"Name":"ישיבת מליאה בתאריך 18/11/1957 בשעה 20:07","StartDate":"1957-11-18T20:07:00+02:00","FinishDate":"1957-11-18T22:00:00+02:00","IsSpecialMeeting":null,"LastUpdatedDate":"2022-03-02T17:33:11.17+02:00"}
{"Id":490078,"Number":361,"KnessetNum":3,"Name":"ישיבת מליאה בתאריך 19/11/1957 בשעה 20:15","StartDate":"1957-11-19T20:15:00+02:00","FinishDate":"1957-11-19T22:25:00+02:00","IsSpecialMeeting":null,"LastUpdatedDate":"2022-03-02T19:19:00.567+02:00"}
{"Id":490079,"Number":365,"KnessetNum":3,"Name":"ישיבת מליאה בתאריך 26/11/1957 בשעה 16:05","StartDate":"1957-11-26T16:05:00+02:00","FinishDate":"1957-11-26T18:51:00+02:00","IsSpecialMeeting":null,"LastUpdatedDate":"2020-10-11T10:42:20.54+03:00"}
{"Id":490080,"Number":366,"KnessetNum":3,"Name":"ישיבת מליאה בתאריך 27/11/1957 בשעה 11:35","StartDate":"1957-11-27T11:35:00+02:00","FinishDate":"1957-11-27T13:34:00+02:00","IsSpecialMeeting":null,"LastUpdatedDate":"2020-10-11T09:54:13.727+03:00"}
{"Id":490081,"Number":374,"KnessetNum":3,"Name":"ישיבת מליאה בתאריך 11/12/1957 בשעה 11:07","StartDate":"1957-12-11T11:07:00+02:00","FinishDate":"1957-12-11T13:10:00+02:00","IsSpecialMeeting":null,"LastUpdatedDate":"2022-03-03T14:00:19.993+02:00"}
{"Id":490082,"Number":380,"KnessetNum":3,"Name":"ישיבת מליאה בתאריך 24/12/1957 בשעה 11:10","StartDate":"1957-12-24T11:10:00+02:00","FinishDate":"1957-12-24T13:11:00+02:00","IsSpecialMeeting":null,"LastUpdatedDate":"2022-03-03T15:20:54.673+02:00"}
{"Id":490083,"Number":381,"KnessetNum":3,"Name":"ישיבת מליאה בתאריך 30/12/1957 בשעה 17:28","StartDate":"1957-12-30T17:28:00+02:00","FinishDate":"1957-12-30T17:35:00+02:00","IsSpecialMeeting":null,"LastUpdatedDate":"2022-03-03T16:20:42.99+02:00"}
{"Id":490084,"Number":384,"KnessetNum":3,"Name":"ישיבת מליאה בתאריך 01/01/1958 בשעה 11:07","StartDate":"1958-01-01T11:07:00+02:00","FinishDate":"1958-01-01T13:55:00+02:00","IsSpecialMeeting":null,"LastUpdatedDate":"2022-03-06T09:52:50.03+02:00"}
{"Id":490085,"Number":385,"KnessetNum":3,"Name":"ישיבת מליאה בתאריך 06/01/1958 בשעה 16:11","StartDate":"1958-01-06T16:11:00+02:00","FinishDate":"1958-01-06T18:57:00+02:00","IsSpecialMeeting":null,"LastUpdatedDate":"2022-03-07T14:18:43.283+02:00"}
{"Id":490086,"Number":386,"KnessetNum":3,"Name":"ישיבת מליאה בתאריך 06/01/1958 בשעה 20:00","StartDate":"1958-01-06T20:00:00+02:00","FinishDate":"1958-01-06T21:25:00+02:00","IsSpecialMeeting":null,"LastUpdatedDate":"2022-03-07T14:21:33.06+02:00"}
{"Id":490087,"Number":387,"KnessetNum":3,"Name":"ישיבת מליאה בתאריך 07/01/1958 בשעה 16:14","StartDate":"1958-01-07T16:14:00+02:00","FinishDate":"1958-01-07T18:59:00+02:00","IsSpecialMeeting":null,"LastUpdatedDate":"2022-03-07T14:43:03.48+02:00"}
{"Id":490088,"Number":388,"KnessetNum":3,"Name":"ישיבת מליאה בתאריך 07/01/1958 בשעה 20:00","StartDate":"1958-01-07T20:00:00+02:00","FinishDate":"1958-01-07T22:33:00+02:00","IsSpecialMeeting":null,"LastUpdatedDate":"2023-11-20T10:52:27.237+02:00"}
{"Id":490089,"Number":390,"KnessetNum":3,"Name":"ישיבת מליאה בתאריך 13/01/1958 בשעה 20:04","StartDate":"1958-01-13T20:04:00+02:00","FinishDate":"1958-01-13T21:30:00+02:00","IsSpecialMeeting":null,"LastUpdatedDate":"2022-03-07T15:53:00.55+02:00"}
{"Id":490090,"Number":393,"KnessetNum":3,"Name":"ישיבת מליאה בתאריך 15/01/1958 בשעה 11:24","StartDate":"1958-01-15T11:24:00+02:00","FinishDate":"1958-01-15T13:24:00+02:00","IsSpecialMeeting":null,"LastUpdatedDate":"2022-03-07T16:20:48.617+02:00"}
{"Id":490091,"Number":395,"KnessetNum":3,"Name":"ישיבת מליאה בתאריך 20/01/1958 בשעה 20:06","StartDate":"1958-01-20T20:06:00+02:00","FinishDate":"1958-01-20T21:45:00+02:00","IsSpecialMeeting":null,"LastUpdatedDate":"2022-03-07T19:08:15.86+02:00"}
{"Id":490092,"Number":396,"KnessetNum":3,"Name":"ישיבת מליאה בתאריך 21/01/1958 בשעה 16:05","StartDate":"1958-01-21T16:05:00+02:00","FinishDate":"1958-01-21T19:10:00+02:00","IsSpecialMeeting":null,"LastUpdatedDate":"2022-03-07T19:17:34.82+02:00"}
{"Id":490093,"Number":397,"KnessetNum":3,"Name":"ישיבת מליאה בתאריך 21/01/1958 בשעה 20:12","StartDate":"1958-01-21T20:12:00+02:00","FinishDate":"1958-01-21T21:06:00+02:00","IsSpecialMeeting":null,"LastUpdatedDate":"2022-03-07T19:29:28.527+02:00"}
{"Id":490094,"Number":398,"KnessetNum":3,"Name":"ישיבת מליאה בתאריך 22/01/1958 בשעה 11:07","StartDate":"1958-01-22T11:07:00+02:00","FinishDate":"1958-01-22T12:40:00+02:00","IsSpecialMeeting":null,"LastUpdatedDate":"2024-02-22T14:50:55.01+02:00"}
{"Id":490095,"Number":406,"KnessetNum":3,"Name":"ישיבת מליאה בתאריך 05/02/1958 בשעה 16:07","StartDate":"1958-02-05T16:07:00+02:00","FinishDate":"1958-02-05T17:40:00+02:00","IsSpecialMeeting":null,"LastUpdatedDate":"2022-03-08T17:35:56.773+02:00"}
{"Id":490096,"Number":413,"KnessetNum":3,"Name":"ישיבת מליאה בתאריך 17/02/1958 בשעה 16:12","StartDate":"1958-02-17T16:12:00+02:00","FinishDate":"1958-02-17T18:53:00+02:00","IsSpecialMeeting":null,"LastUpdatedDate":"2022-03-08T18:45:02.993+02:00"}
{"Id":490097,"Number":414,"KnessetNum":3,"Name":"ישיבת מליאה בתאריך 17/02/1958 בשעה 20:04","StartDate":"1958-02-17T20:04:00+02:00","FinishDate":"1958-02-17T22:17:00+02:00","IsSpecialMeeting":null,"LastUpdatedDate":"2022-03-08T18:51:04.417+02:00"}
{"Id":490098,"Number":415,"KnessetNum":3,"Name":"ישיבת מליאה בתאריך 18/02/1958 בשעה 16:00","StartDate":"1958-02-18T16:00:00+02:00","FinishDate":"1958-02-18T19:15:00+02:00","IsSpecialMeeting":null,"LastUpdatedDate":"2022-03-08T18:58:39.887+02:00"}
{"Id":490099,"Number":418,"KnessetNum":3,"Name":"ישיבת מליאה בתאריך 24/02/1958 בשעה 16:10","StartDate":"1958-02-24T16:10:00+02:00","FinishDate":"1958-02-24T19:05:00+02:00","IsSpecialMeeting":null,"LastUpdatedDate":"2022-03-09T06:50:23.517+02:00"}
{"Id":490100,"Number":423,"KnessetNum":3,"Name":"ישיבת מליאה בתאריך 03/03/1958 בשעה 16:13","StartDate":"1958-03-03T16:13:00+02:00","FinishDate":"1958-03-03T19:08:00+02:00","IsSpecialMeeting":null,"LastUpdatedDate":"2022-03-09T07:36:04.603+02:00"}
{"Id":490101,"Number":425,"KnessetNum":3,"Name":"ישיבת מליאה בתאריך 04/03/1958 בשעה 16:08","StartDate":"1958-03-04T16:08:00+02:00","FinishDate":"1958-03-04T19:16:00+02:00","IsSpecialMeeting":null,"LastUpdatedDate":"2022-03-09T13:37:14.743+02:00"}
{"Id":490102,"Number":427,"KnessetNum":3,"Name":"ישיבת מליאה בתאריך 05/03/1958 בשעה 11:11","StartDate":"1958-03-05T11:11:00+02:00","FinishDate":"1958-03-05T13:10:00+02:00","IsSpecialMeeting":null,"LastUpdatedDate":"2022-03-09T16:13:14.593+02:00"}
{"Id":490103,"Number":428,"KnessetNum":3,"Name":"ישיבת מליאה בתאריך 10/03/1958 בשעה 16:13","StartDate":"1958-03-10T16:13:00+02:00","FinishDate":"1958-03-10T19:08:00+02:00","IsSpecialMeeting":null,"LastUpdatedDate":"2022-03-09T16:22:31.1+02:00"}
{"Id":490104,"Number":429,"KnessetNum":3,"Name":"ישיבת מליאה בתאריך 10/03/1958 בשעה 20:07","StartDate":"1958-03-10T20:07:00+02:00","FinishDate":"1958-03-10T22:12:00+02:00","IsSpecialMeeting":null,"LastUpdatedDate":"2022-03-09T16:29:43.687+02:00"}
{"Id":490105,"Number":431,"KnessetNum":3,"Name":"ישיבת מליאה בתאריך 11/03/1958 בשעה 20:02","StartDate":"1958-03-11T20:02:00+02:00","FinishDate":"1958-03-11T23:04:00+02:00","IsSpecialMeeting":null,"LastUpdatedDate":"2022-03-09T16:50:27.24+02:00"}
{"Id":490106,"Number":432,"KnessetNum":3,"Name":"ישיבת מליאה בתאריך 12/03/1958 בשעה 16:07","StartDate":"1958-03-12T16:07:00+02:00","FinishDate":"1958-03-12T19:15:00+02:00","IsSpecialMeeting":null,"LastUpdatedDate":"2022-03-09T16:58:56.193+02:00"}
{"Id":490107,"Number":433,"KnessetNum":3,"Name":"ישיבת מליאה בתאריך 12/03/1958 בשעה 11:06","StartDate":"1958-03-12T11:06:00+02:00","FinishDate":"1958-03-12T13:55:00+02:00","IsSpecialMeeting":null,"LastUpdatedDate":"2022-03-10T09:24:51.883+02:00"}
{"Id":490108,"Number":443,"KnessetNum":3,"Name":"ישיבת מליאה בתאריך 24/03/1958 בשעה 20:16","StartDate":"1958-03-24T20:16:00+02:00","FinishDate":"1958-03-24T23:59:00+02:00","IsSpecialMeeting":null,"LastUpdatedDate":"2022-03-10T11:22:49.07+02:00"}
{"Id":490109,"Number":444,"KnessetNum":3,"Name":"ישיבת מליאה בתאריך 25/03/1958 בשעה 11:03","StartDate":"1958-03-25T11:03:00+02:00","FinishDate":"1958-03-25T14:27:00+02:00","IsSpecialMeeting":null,"LastUpdatedDate":"2022-03-10T12:52:08.03+02:00"}
{"Id":490110,"Number":446,"KnessetNum":3,"Name":"ישיבת מליאה בתאריך 25/03/1958 בשעה 20:02","StartDate":"1958-03-25T20:02:00+02:00","FinishDate":"1958-03-25T23:40:00+02:00","IsSpecialMeeting":null,"LastUpdatedDate":"2022-03-10T13:37:21.217+02:00"}
{"Id":490111,"Number":448,"KnessetNum":3,"Name":"ישיבת מליאה בתאריך 26/03/1958 בשעה 15:06","StartDate":"1958-03-26T15:06:00+02:00","FinishDate":"1958-03-26T19:17:00+02:00","IsSpecialMeeting":null,"LastUpdatedDate":"2022-03-10T14:03:43.243+02:00"}
{"Id":490112,"Number":449,"KnessetNum":3,"Name":"ישיבת מליאה בתאריך 26/03/1958 בשעה 20:03","StartDate":"1958-03-26T20:03:00+02:00","FinishDate":"1958-03-26T23:59:00+02:00","IsSpecialMeeting":null,"LastUpdatedDate":"2022-03-10T14:31:24.96+02:00"}
{"Id":490113,"Number":453,"KnessetNum":3,"Name":"ישיבת מליאה בתאריך 22/04/1958 בשעה 12:00","StartDate":"1958-04-22T12:00:00+03:00","FinishDate":"1958-04-22T14:00:00+03:00","IsSpecialMeeting":null,"LastUpdatedDate":"2022-03-10T15:29:47.79+02:00"}
{"Id":490114,"Number":456,"KnessetNum":3,"Name":"ישיבת מליאה בתאריך 20/05/1958 בשעה 16:03","StartDate":"1958-05-20T16:03:00+03:00","FinishDate":"1958-05-20T19:05:00+03:00","IsSpecialMeeting":null,"LastUpdatedDate":"2022-03-10T16:03:57.053+02:00"}
{"Id":490115,"Number":457,"KnessetNum":3,"Name":"ישיבת מליאה בתאריך 20/05/1958 בשעה 20:05","StartDate":"1958-05-20T20:05:00+03:00","FinishDate":"1958-05-20T21:35:00+03:00","IsSpecialMeeting":null,"LastUpdatedDate":"2022-03-10T16:12:55.647+02:00"}
{"Id":490116,"Number":458,"KnessetNum":3,"Name":"ישיבת מליאה בתאריך 21/05/1958 בשעה 11:10","StartDate":"1958-05-21T11:10:00+03:00","FinishDate":"1958-05-21T12:30:00+03:00","IsSpecialMeeting":null,"LastUpdatedDate":"2023-11-13T09:40:22.863+02:00"}
{"Id":490117,"Number":460,"KnessetNum":3,"Name":"ישיבת מליאה בתאריך 26/05/1958 בשעה 20:00","StartDate":"1958-05-26T20:00:00+03:00","FinishDate":"1958-05-26T21:23:00+03:00","IsSpecialMeeting":null,"LastUpdatedDate":"2022-03-10T17:16:37.423+02:00"}
{"Id":490118,"Number":463,"KnessetNum":3,"Name":"ישיבת מליאה בתאריך 28/05/1958 בשעה 11:13","StartDate":"1958-05-28T11:13:00+03:00","FinishDate":"1958-05-28T12:47:00+03:00","IsSpecialMeeting":null,"LastUpdatedDate":"2023-01-17T17:30:13.387+02:00"}
{"Id":490119,"Number":464,"KnessetNum":3,"Name":"ישיבת מליאה בתאריך 02/06/1958 בשעה 16:10","StartDate":"1958-06-02T16:10:00+03:00","FinishDate":"1958-06-02T18:55:00+03:00","IsSpecialMeeting":null,"LastUpdatedDate":"2022-03-16T08:13:09.213+02:00"}
{"Id":490120,"Number":465,"KnessetNum":3,"Name":"ישיבת מליאה בתאריך 02/06/1958 בשעה 20:18","StartDate":"1958-06-02T20:18:00+03:00","FinishDate":"1958-06-02T22:00:00+03:00","IsSpecialMeeting":null,"LastUpdatedDate":"2023-11-13T08:39:30.743+02:00"}
{"Id":490121,"Number":466,"KnessetNum":3,"Name":"ישיבת מליאה בתאריך 03/06/1958 בשעה 16:03","StartDate":"1958-06-03T16:03:00+03:00","FinishDate":"1958-06-03T19:00:00+03:00","IsSpecialMeeting":null,"LastUpdatedDate":"2022-03-16T08:35:49.94+02:00"}
{"Id":490122,"Number":467,"KnessetNum":3,"Name":"ישיבת מליאה בתאריך 03/06/1958 בשעה 20:05","StartDate":"1958-06-03T20:05:00+03:00","FinishDate":"1958-06-03T22:16:00+03:00","IsSpecialMeeting":null,"LastUpdatedDate":"2022-03-16T08:45:21.133+02:00"}
{"Id":490123,"Number":473,"KnessetNum":3,"Name":"ישיבת מליאה בתאריך 11/06/1958 בשעה 11:00","StartDate":"1958-06-11T11:00:00+03:00","FinishDate":"1958-06-11T12:55:00+03:00","IsSpecialMeeting":null,"LastUpdatedDate":"2022-03-16T09:53:46.183+02:00"}
{"Id":490124,"Number":474,"KnessetNum":3,"Name":"ישיבת מליאה בתאריך 16/06/1958 בשעה 16:10","StartDate":"1958-06-16T16:10:00+03:00","FinishDate":"1958-06-16T19:07:00+03:00","IsSpecialMeeting":null,"LastUpdatedDate":"2022-03-16T10:34:06.383+02:00"}
{"Id":490125,"Number":476,"KnessetNum":3,"Name":"ישיבת מליאה בתאריך 17/06/1958 בשעה 16:10","StartDate":"1958-06-17T16:10:00+03:00","FinishDate":"1958-06-17T18:45:00+03:00","IsSpecialMeeting":null,"LastUpdatedDate":"2023-11-12T12:34:13.147+02:00"}
{"Id":490126,"Number":477,"KnessetNum":3,"Name":"ישיבת מליאה בתאריך 18/06/1958 בשעה 11:08","StartDate":"1958-06-18T11:08:00+03:00","FinishDate":"1958-06-18T13:02:00+03:00","IsSpecialMeeting":null,"LastUpdatedDate":"2022-03-16T14:03:03.323+02:00"}
{"Id":490127,"Number":480,"KnessetNum":3,"Name":"ישיבת מליאה בתאריך 24/06/1958 בשעה 20:30","StartDate":"1958-06-24T20:30:00+03:00","FinishDate":"1958-06-24T22:04:00+03:00","IsSpecialMeeting":null,"LastUpdatedDate":"2025-05-11T11:42:38.797+03:00"}
{"Id":490128,"Number":481,"KnessetNum":3,"Name":"ישיבת מליאה בתאריך 25/06/1958 בשעה 11:05","StartDate":"1958-06-25T11:05:00+03:00","FinishDate":"1958-06-25T12:45:00+03:00","IsSpecialMeeting":null,"LastUpdatedDate":"2025-05-11T11:42:24.037+03:00"}
{"Id":490129,"Number":483,"KnessetNum":3,"Name":"ישיבת מליאה בתאריך 30/06/1958 בשעה 20:04","StartDate":"1958-06-30T20:04:00+03:00","FinishDate":"1958-06-30T21:45:00+03:00","IsSpecialMeeting":null,"LastUpdatedDate":"2022-03-16T16:34:04.837+02:00"}
{"Id":490130,"Number":485,"KnessetNum":3,"Name":"ישיבת מליאה בתאריך 02/07/1958 בשעה 11:17","StartDate":"1958-07-02T11:17:00+03:00","FinishDate":"1958-07-02T12:28:00+03:00","IsSpecialMeeting":false,"LastUpdatedDate":"2023-01-08T11:51:51.627+02:00"}
{"Id":490131,"Number":487,"KnessetNum":3,"Name":"ישיבת מליאה בתאריך 07/07/1958 בשעה 20:35","StartDate":"1958-07-07T20:35:00+03:00","FinishDate":"1958-07-07T20:48:00+03:00","IsSpecialMeeting":null,"LastUpdatedDate":"2022-03-21T07:35:25.837+02:00"}
{"Id":490132,"Number":488,"KnessetNum":3,"Name":"ישיבת מליאה בתאריך 08/07/1958 בשעה 16:55","StartDate":"1958-07-08T16:55:00+03:00","FinishDate":"1958-07-08T19:20:00+03:00","IsSpecialMeeting":null,"LastUpdatedDate":"2022-03-21T07:37:31.127+02:00"}
{"Id":490133,"Number":489,"KnessetNum":3,"Name":"ישיבת מליאה בתאריך 08/07/1958 בשעה 20:38","StartDate":"1958-07-08T20:38:00+03:00","FinishDate":"1958-07-08T21:40:00+03:00","IsSpecialMeeting":null,"LastUpdatedDate":"2022-03-21T07:46:00.417+02:00"}
{"Id":490134,"Number":490,"KnessetNum":3,"Name":"ישיבת מליאה בתאריך 09/07/1958 בשעה 11:05","StartDate":"1958-07-09T11:05:00+03:00","FinishDate":"1958-07-09T13:16:00+03:00","IsSpecialMeeting":null,"LastUpdatedDate":"2022-03-21T08:29:51.793+02:00"}
{"Id":490135,"Number":491,"KnessetNum":3,"Name":"ישיבת מליאה בתאריך 14/07/1958 בשעה 16:05","StartDate":"1958-07-14T16:05:00+03:00","FinishDate":"1958-07-14T19:02:00+03:00","IsSpecialMeeting":null,"LastUpdatedDate":"2022-04-03T12:03:27.193+03:00"}
{"Id":490136,"Number":492,"KnessetNum":3,"Name":"ישיבת מליאה בתאריך 14/07/1958 בשעה 20:00","StartDate":"1958-07-14T20:00:00+03:00","FinishDate":"1958-07-14T22:00:00+03:00","IsSpecialMeeting":null,"LastUpdatedDate":"2022-04-03T12:09:13.1+03:00"}
{"Id":490137,"Number":494,"KnessetNum":3,"Name":"ישיבת מליאה בתאריך 15/07/1958 בשעה 20:00","StartDate":"1958-07-15T20:00:00+03:00","FinishDate":"1958-07-15T20:30:00+03:00","IsSpecialMeeting":null,"LastUpdatedDate":"2022-04-03T13:04:01.273+03:00"}
{"Id":490138,"Number":495,"KnessetNum":3,"Name":"ישיבת מליאה בתאריך 16/07/1958 בשעה 11:22","StartDate":"1958-07-16T11:22:00+03:00","FinishDate":"1958-07-16T14:00:00+03:00","IsSpecialMeeting":null,"LastUpdatedDate":"2022-04-03T13:06:43.27+03:00"}
{"Id":490139,"Number":497,"KnessetNum":3,"Name":"ישיבת מליאה בתאריך 21/07/1958 בשעה 20:05","StartDate":"1958-07-21T20:05:00+03:00","FinishDate":"1958-07-21T21:37:00+03:00","IsSpecialMeeting":null,"LastUpdatedDate":"2023-11-12T08:06:24.25+02:00"}
{"Id":490140,"Number":501,"KnessetNum":3,"Name":"ישיבת מליאה בתאריך 28/07/1958 בשעה 16:04","StartDate":"1958-07-28T16:04:00+03:00","FinishDate":"1958-07-28T20:12:00+03:00","IsSpecialMeeting":null,"LastUpdatedDate":"2022-04-05T11:01:19.807+03:00"}
{"Id":490141,"Number":503,"KnessetNum":3,"Name":"ישיבת מליאה בתאריך 29/07/1958 בשעה 20:29","StartDate":"1958-07-29T20:29:00+03:00","FinishDate":"1958-07-29T21:50:00+03:00","IsSpecialMeeting":null,"LastUpdatedDate":"2022-04-05T11:05:02.513+03:00"}
{"Id":490142,"Number":512,"KnessetNum":3,"Name":"ישיבת מליאה בתאריך 08/09/1958 בשעה 16:08","StartDate":"1958-09-08T16:08:00+03:00","FinishDate":"1958-09-08T20:00:00+03:00","IsSpecialMeeting":null,"LastUpdatedDate":"2022-04-05T17:04:18.767+03:00"}
{"Id":490143,"Number":515,"KnessetNum":3,"Name":"ישיבת מליאה בתאריך 15/10/1958 בשעה 11:07","StartDate":"1958-10-15T11:07:00+02:00","FinishDate":"1958-10-15T13:00:00+02:00","IsSpecialMeeting":null,"LastUpdatedDate":"2022-04-05T17:43:16.063+03:00"}
{"Id":490144,"Number":516,"KnessetNum":3,"Name":"ישיבת מליאה בתאריך 20/10/1958 בשעה 16:00","StartDate":"1958-10-20T16:00:00+02:00","FinishDate":"1958-10-20T18:22:00+02:00","IsSpecialMeeting":null,"LastUpdatedDate":"2022-04-11T11:55:18.853+03:00"}
{"Id":490145,"Number":517,"KnessetNum":3,"Name":"ישיבת מליאה בתאריך 20/10/1958 בשעה 20:00","StartDate":"1958-10-20T20:00:00+02:00","FinishDate":"1958-10-20T21:59:00+02:00","IsSpecialMeeting":null,"LastUpdatedDate":"2025-05-11T11:26:15.947+03:00"}
{"Id":490146,"Number":519,"KnessetNum":3,"Name":"ישיבת מליאה בתאריך 21/10/1958 בשעה 20:09","StartDate":"1958-10-21T20:09:00+02:00","FinishDate":"1958-10-21T22:15:00+02:00","IsSpecialMeeting":null,"LastUpdatedDate":"2022-04-07T09:41:39.397+03:00"}
{"Id":490147,"Number":520,"KnessetNum":3,"Name":"ישיבת מליאה בתאריך 22/10/1958 בשעה 11:05","StartDate":"1958-10-22T11:05:00+02:00","FinishDate":"1958-10-22T13:08:00+02:00","IsSpecialMeeting":null,"LastUpdatedDate":"2022-06-14T17:06:34.24+03:00"}
{"Id":490148,"Number":524,"KnessetNum":3,"Name":"ישיבת מליאה בתאריך 29/10/1958 בשעה 11:03","StartDate":"1958-10-29T11:03:00+02:00","FinishDate":"1958-10-29T12:36:00+02:00","IsSpecialMeeting":null,"LastUpdatedDate":"2022-04-07T11:22:41.713+03:00"}
{"Id":490149,"Number":531,"KnessetNum":3,"Name":"ישיבת מליאה בתאריך 10/11/1958 בשעה 20:11","StartDate":"1958-11-10T20:11:00+02:00","FinishDate":"1958-11-10T21:00:00+02:00","IsSpecialMeeting":null,"LastUpdatedDate":"2022-04-07T14:31:50.807+03:00"}
{"Id":490150,"Number":533,"KnessetNum":3,"Name":"ישיבת מליאה בתאריך 12/11/1958 בשעה 11:07","StartDate":"1958-11-12T11:07:00+02:00","FinishDate":"1958-11-12T13:05:00+02:00","IsSpecialMeeting":null,"LastUpdatedDate":"2022-04-07T14:54:51.857+03:00"}
{"Id":490151,"Number":536,"KnessetNum":3,"Name":"ישיבת מליאה בתאריך 18/11/1958 בשעה 16:10","StartDate":"1958-11-18T16:10:00+02:00","FinishDate":"1958-11-18T18:55:00+02:00","IsSpecialMeeting":null,"LastUpdatedDate":"2022-04-10T09:31:14.453+03:00"}
{"Id":490152,"Number":539,"KnessetNum":3,"Name":"ישיבת מליאה בתאריך 24/11/1958 בשעה 16:02","StartDate":"1958-11-24T16:02:00+02:00","FinishDate":"1958-11-24T18:18:00+02:00","IsSpecialMeeting":null,"LastUpdatedDate":"2022-04-10T12:47:16.393+03:00"}
{"Id":490153,"Number":540,"KnessetNum":3,"Name":"ישיבת מליאה בתאריך 24/11/1958 בשעה 20:09","StartDate":"1958-11-24T20:09:00+02:00","FinishDate":"1958-11-24T21:10:00+02:00","IsSpecialMeeting":null,"LastUpdatedDate":"2022-04-10T14:33:26.07+03:00"}
{"Id":490154,"Number":542,"KnessetNum":3,"Name":"ישיבת מליאה בתאריך 26/11/1958 בשעה 11:05","StartDate":"1958-11-26T11:05:00+02:00","FinishDate":"1958-11-26T12:36:00+02:00","IsSpecialMeeting":null,"LastUpdatedDate":"2022-04-10T14:52:21.87+03:00"}
{"Id":490155,"Number":543,"KnessetNum":3,"Name":"ישיבת מליאה בתאריך 01/12/1958 בשעה 16:03","StartDate":"1958-12-01T16:03:00+02:00","FinishDate":"1958-12-01T18:56:00+02:00","IsSpecialMeeting":null,"LastUpdatedDate":"2022-04-10T14:56:37.99+03:00"}
{"Id":490156,"Number":544,"KnessetNum":3,"Name":"ישיבת מליאה בתאריך 01/12/1958 בשעה 20:08","StartDate":"1958-12-01T20:08:00+02:00","FinishDate":"1958-12-01T22:00:00+02:00","IsSpecialMeeting":null,"LastUpdatedDate":"2022-04-10T15:06:41.623+03:00"}
{"Id":490157,"Number":545,"KnessetNum":3,"Name":"ישיבת מליאה בתאריך 02/12/1958 בשעה 16:07","StartDate":"1958-12-02T16:07:00+02:00","FinishDate":"1958-12-02T19:30:00+02:00","IsSpecialMeeting":null,"LastUpdatedDate":"2022-04-10T15:19:59.407+03:00"}
{"Id":490158,"Number":546,"KnessetNum":3,"Name":"ישיבת מליאה בתאריך 02/12/1958 בשעה 20:30","StartDate":"1958-12-02T20:30:00+02:00","FinishDate":"1958-12-02T22:33:00+02:00","IsSpecialMeeting":null,"LastUpdatedDate":"2022-04-10T15:26:49.253+03:00"}
{"Id":490159,"Number":547,"KnessetNum":3,"Name":"ישיבת מליאה בתאריך 03/12/1958 בשעה 11:08","StartDate":"1958-12-03T11:08:00+02:00","FinishDate":"1958-12-03T12:29:00+02:00","IsSpecialMeeting":null,"LastUpdatedDate":"2022-04-10T15:38:13.29+03:00"}
{"Id":490160,"Number":551,"KnessetNum":3,"Name":"ישיבת מליאה בתאריך 09/12/1958 בשעה 20:42","StartDate":"1958-12-09T20:42:00+02:00","FinishDate":"1958-12-10T00:41:00+02:00","IsSpecialMeeting":null,"LastUpdatedDate":"2022-04-10T16:05:46.46+03:00"}
{"Id":490161,"Number":552,"KnessetNum":3,"Name":"ישיבת מליאה בתאריך 10/12/1958 בשעה 11:06","StartDate":"1958-12-10T11:06:00+02:00","FinishDate":"1958-12-10T13:13:00+02:00","IsSpecialMeeting":null,"LastUpdatedDate":"2022-04-11T07:20:06.663+03:00"}
{"Id":490162,"Number":554,"KnessetNum":3,"Name":"ישיבת מליאה בתאריך 15/12/1958 בשעה 20:19","StartDate":"1958-12-15T20:19:00+02:00","FinishDate":"1958-12-15T21:45:00+02:00","IsSpecialMeeting":null,"LastUpdatedDate":"2022-04-11T08:41:06.103+03:00"}
{"Id":490163,"Number":556,"KnessetNum":3,"Name":"ישיבת מליאה בתאריך 16/12/1958 בשעה 20:02","StartDate":"1958-12-16T20:02:00+02:00","FinishDate":"1958-12-16T21:25:00+02:00","IsSpecialMeeting":null,"LastUpdatedDate":"2022-04-11T15:54:25.667+03:00"}
{"Id":490164,"Number":557,"KnessetNum":3,"Name":"ישיבת מליאה בתאריך 17/12/1958 בשעה 11:07","StartDate":"1958-12-17T11:07:00+02:00","FinishDate":"1958-12-17T14:20:00+02:00","IsSpecialMeeting":null,"LastUpdatedDate":"2022-04-12T15:22:13.857+03:00"}
{"Id":490165,"Number":560,"KnessetNum":3,"Name":"ישיבת מליאה בתאריך 23/12/1958 בשעה 16:00","StartDate":"1958-12-23T16:00:00+02:00","FinishDate":"1958-12-23T18:51:00+02:00","IsSpecialMeeting":null,"LastUpdatedDate":"2022-04-12T16:31:33.973+03:00"}
{"Id":490166,"Number":561,"KnessetNum":3,"Name":"ישיבת מליאה בתאריך 23/12/1958 בשעה 16:00","StartDate":"1958-12-23T16:00:00+02:00","FinishDate":"1958-12-23T18:51:00+02:00","IsSpecialMeeting":null,"LastUpdatedDate":"2022-04-12T16:52:13.413+03:00"}
{"Id":490167,"Number":571,"KnessetNum":3,"Name":"ישיבת מליאה בתאריך 06/01/1959 בשעה 20:01","StartDate":"1959-01-06T20:01:00+02:00","FinishDate":"1959-01-06T21:47:00+02:00","IsSpecialMeeting":null,"LastUpdatedDate":"2022-04-13T14:14:58.447+03:00"}
{"Id":490168,"Number":572,"KnessetNum":3,"Name":"ישיבת מליאה בתאריך 07/01/1959 בשעה 11:06","StartDate":"1959-01-07T11:06:00+02:00","FinishDate":"1959-01-07T13:30:00+02:00","IsSpecialMeeting":null,"LastUpdatedDate":"2022-04-13T15:32:41.563+03:00"}
{"Id":490169,"Number":574,"KnessetNum":3,"Name":"ישיבת מליאה בתאריך 12/01/1959 בשעה 20:07","StartDate":"1959-01-12T20:07:00+02:00","FinishDate":"1959-01-12T22:45:00+02:00","IsSpecialMeeting":null,"LastUpdatedDate":"2022-04-24T07:24:21.923+03:00"}
{"Id":490170,"Number":582,"KnessetNum":3,"Name":"ישיבת מליאה בתאריך 27/01/1959 בשעה 16:02","StartDate":"1959-01-27T16:02:00+02:00","FinishDate":"1959-01-27T19:00:00+02:00","IsSpecialMeeting":null,"LastUpdatedDate":"2022-04-24T13:27:35.493+03:00"}
{"Id":490171,"Number":583,"KnessetNum":3,"Name":"ישיבת מליאה בתאריך 27/01/1959 בשעה 20:03","StartDate":"1959-01-27T20:03:00+02:00","FinishDate":"1959-01-27T21:31:00+02:00","IsSpecialMeeting":null,"LastUpdatedDate":"2022-04-24T13:35:48.083+03:00"}
{"Id":490172,"Number":584,"KnessetNum":3,"Name":"ישיבת מליאה בתאריך 28/01/1959 בשעה 11:10","StartDate":"1959-01-28T11:10:00+02:00","FinishDate":"1959-01-28T13:50:00+02:00","IsSpecialMeeting":null,"LastUpdatedDate":"2022-04-24T13:48:13.43+03:00"}
{"Id":490173,"Number":585,"KnessetNum":3,"Name":"ישיבת מליאה בתאריך 05/02/1959 בשעה 11:00","StartDate":"1959-02-05T11:00:00+02:00","FinishDate":"1959-02-05T12:50:00+02:00","IsSpecialMeeting":null,"LastUpdatedDate":"2022-04-24T17:04:13.427+03:00"}
{"Id":490174,"Number":587,"KnessetNum":3,"Name":"ישיבת מליאה בתאריך 09/02/1959 בשעה 20:07","StartDate":"1959-02-09T20:07:00+02:00","FinishDate":"1959-02-09T21:50:00+02:00","IsSpecialMeeting":null,"LastUpdatedDate":"2022-04-25T06:56:45.63+03:00"}
{"Id":490175,"Number":589,"KnessetNum":3,"Name":"ישיבת מליאה בתאריך 11/02/1959 בשעה 11:07","StartDate":"1959-02-11T11:07:00+02:00","FinishDate":"1959-02-11T12:38:00+02:00","IsSpecialMeeting":null,"LastUpdatedDate":"2022-05-01T16:00:18.987+03:00"}
{"Id":490176,"Number":590,"KnessetNum":3,"Name":"ישיבת מליאה בתאריך 16/02/1959 בשעה 16:07","StartDate":"1959-02-16T16:07:00+02:00","FinishDate":"1959-02-16T18:48:00+02:00","IsSpecialMeeting":null,"LastUpdatedDate":"2022-05-01T16:04:48.53+03:00"}
{"Id":490177,"Number":593,"KnessetNum":3,"Name":"ישיבת מליאה בתאריך 18/02/1959 בשעה 11:14","StartDate":"1959-02-18T11:14:00+02:00","FinishDate":"1959-02-18T12:20:00+02:00","IsSpecialMeeting":null,"LastUpdatedDate":"2022-05-08T09:27:17.75+03:00"}
{"Id":490178,"Number":600,"KnessetNum":3,"Name":"ישיבת מליאה בתאריך 02/03/1959 בשעה 20:10","StartDate":"1959-03-02T20:10:00+02:00","FinishDate":"1959-03-02T22:40:00+02:00","IsSpecialMeeting":null,"LastUpdatedDate":"2022-05-08T10:24:25.993+03:00"}
{"Id":490179,"Number":603,"KnessetNum":3,"Name":"ישיבת מליאה בתאריך 04/03/1959 בשעה 11:07","StartDate":"1959-03-04T11:07:00+02:00","FinishDate":"1959-03-04T13:00:00+02:00","IsSpecialMeeting":null,"LastUpdatedDate":"2023-11-01T07:37:03.05+02:00"}
{"Id":490180,"Number":604,"KnessetNum":3,"Name":"ישיבת מליאה בתאריך 04/03/1959 בשעה 14:07","StartDate":"1959-03-04T14:07:00+02:00","FinishDate":"1959-03-04T17:22:00+02:00","IsSpecialMeeting":null,"LastUpdatedDate":"2023-10-31T14:16:34.327+02:00"}
{"Id":490181,"Number":608,"KnessetNum":3,"Name":"ישיבת מליאה בתאריך 10/03/1959 בשעה 20:02","StartDate":"1959-03-10T20:02:00+02:00","FinishDate":"1959-03-10T22:44:00+02:00","IsSpecialMeeting":null,"LastUpdatedDate":"2023-10-31T11:12:36.74+02:00"}
{"Id":490182,"Number":610,"KnessetNum":3,"Name":"ישיבת מליאה בתאריך 11/03/1959 בשעה 14:19","StartDate":"1959-03-11T14:19:00+02:00","FinishDate":"1959-03-11T17:13:00+02:00","IsSpecialMeeting":null,"LastUpdatedDate":"2023-10-31T10:50:10.483+02:00"}
{"Id":490183,"Number":611,"KnessetNum":3,"Name":"ישיבת מליאה בתאריך 16/03/1959 בשעה 15:02","StartDate":"1959-03-16T15:02:00+02:00","FinishDate":"1959-03-16T19:17:00+02:00","IsSpecialMeeting":null,"LastUpdatedDate":"2023-10-31T10:33:05.713+02:00"}
{"Id":490184,"Number":612,"KnessetNum":3,"Name":"ישיבת מליאה בתאריך 16/03/1959 בשעה 20:16","StartDate":"1959-03-16T20:16:00+02:00","FinishDate":"1959-03-16T23:18:00+02:00","IsSpecialMeeting":null,"LastUpdatedDate":"2023-10-31T10:15:49.657+02:00"}
{"Id":490185,"Number":613,"KnessetNum":3,"Name":"ישיבת מליאה בתאריך 17/03/1959 בשעה 16:03","StartDate":"1959-03-17T16:03:00+02:00","FinishDate":"1959-03-17T18:55:00+02:00","IsSpecialMeeting":null,"LastUpdatedDate":"2023-10-31T09:25:20.78+02:00"}
{"Id":490186,"Number":615,"KnessetNum":3,"Name":"ישיבת מליאה בתאריך 18/03/1959 בשעה 11:05","StartDate":"1959-03-18T11:05:00+02:00","FinishDate":"1959-03-18T13:04:00+02:00","IsSpecialMeeting":null,"LastUpdatedDate":"2023-10-31T08:48:36.98+02:00"}
{"Id":490187,"Number":617,"KnessetNum":3,"Name":"ישיבת מליאה בתאריך 26/03/1959 בשעה 10:12","StartDate":"1959-03-26T10:12:00+02:00","FinishDate":"1959-03-26T13:30:00+02:00","IsSpecialMeeting":null,"LastUpdatedDate":"2023-10-31T08:22:35.327+02:00"}
{"Id":490188,"Number":618,"KnessetNum":3,"Name":"ישיבת מליאה בתאריך 26/03/1959 בשעה 14:52","StartDate":"1959-03-26T14:52:00+02:00","FinishDate":"1959-03-26T19:13:00+02:00","IsSpecialMeeting":null,"LastUpdatedDate":"2023-10-30T17:10:32.84+02:00"}
{"Id":490189,"Number":619,"KnessetNum":3,"Name":"ישיבת מליאה בתאריך 26/03/1959 בשעה 19:50","StartDate":"1959-03-26T19:50:00+02:00","FinishDate":"1959-03-26T23:31:00+02:00","IsSpecialMeeting":null,"LastUpdatedDate":"2023-10-30T17:05:20.623+02:00"}
{"Id":490190,"Number":620,"KnessetNum":3,"Name":"ישיבת מליאה בתאריך 30/03/1959 בשעה 10:06","StartDate":"1959-03-30T10:06:00+02:00","FinishDate":"1959-03-30T12:55:00+02:00","IsSpecialMeeting":null,"LastUpdatedDate":"2023-10-30T16:58:29.843+02:00"}
{"Id":490191,"Number":621,"KnessetNum":3,"Name":"ישיבת מליאה בתאריך 30/03/1959 בשעה 14:05","StartDate":"1959-03-30T14:05:00+02:00","FinishDate":"1959-03-30T18:50:00+02:00","IsSpecialMeeting":null,"LastUpdatedDate":"2023-10-30T16:30:37.6+02:00"}
{"Id":490192,"Number":622,"KnessetNum":3,"Name":"ישיבת מליאה בתאריך 30/03/1959 בשעה 20:00","StartDate":"1959-03-30T20:00:00+02:00","FinishDate":"1959-03-30T23:34:00+02:00","IsSpecialMeeting":null,"LastUpdatedDate":"2023-10-30T16:16:08.46+02:00"}
{"Id":490193,"Number":623,"KnessetNum":3,"Name":"ישיבת מליאה בתאריך 31/03/1959 בשעה 09:05","StartDate":"1959-03-31T09:05:00+02:00","FinishDate":"1959-03-31T13:00:00+02:00","IsSpecialMeeting":null,"LastUpdatedDate":"2023-10-30T15:44:36.953+02:00"}
{"Id":490194,"Number":624,"KnessetNum":3,"Name":"ישיבת מליאה בתאריך 31/03/1959 בשעה 14:05","StartDate":"1959-03-31T14:05:00+02:00","FinishDate":"1959-03-31T19:50:00+02:00","IsSpecialMeeting":null,"LastUpdatedDate":"2023-10-30T15:15:21.86+02:00"}
{"Id":490195,"Number":626,"KnessetNum":3,"Name":"ישיבת מליאה בתאריך 01/04/1959 בשעה 08:34","StartDate":"1959-04-01T08:34:00+03:00","FinishDate":"1959-04-01T13:03:00+03:00","IsSpecialMeeting":null,"LastUpdatedDate":"2023-10-30T14:45:49.51+02:00"}
{"Id":490196,"Number":630,"KnessetNum":3,"Name":"ישיבת מליאה בתאריך 07/04/1959 בשעה 11:16","StartDate":"1959-04-07T11:16:00+03:00","FinishDate":"1959-04-07T13:05:00+03:00","IsSpecialMeeting":null,"LastUpdatedDate":"2023-10-30T11:32:29.673+02:00"}
{"Id":490197,"Number":635,"KnessetNum":3,"Name":"ישיבת מליאה בתאריך 27/04/1959 בשעה 16:20","StartDate":"1959-04-27T16:20:00+03:00","FinishDate":"1959-04-27T17:40:00+03:00","IsSpecialMeeting":null,"LastUpdatedDate":"2023-10-31T07:57:30.963+02:00"}
{"Id":490198,"Number":639,"KnessetNum":3,"Name":"ישיבת מליאה בתאריך 27/05/1959 בשעה 11:13","StartDate":"1959-05-27T11:13:00+03:00","FinishDate":"1959-05-27T12:55:00+03:00","IsSpecialMeeting":null,"LastUpdatedDate":"2023-10-30T10:16:10.34+02:00"}
{"Id":490199,"Number":642,"KnessetNum":3,"Name":"ישיבת מליאה בתאריך 02/06/1959 בשעה 16:05","StartDate":"1959-06-02T16:05:00+03:00","FinishDate":"1959-06-02T18:21:00+03:00","IsSpecialMeeting":null,"LastUpdatedDate":"2023-10-30T09:34:04.27+02:00"}
{"Id":490200,"Number":643,"KnessetNum":3,"Name":"ישיבת מליאה בתאריך 02/06/1959 בשעה 20:04","StartDate":"1959-06-02T20:04:00+03:00","FinishDate":"1959-06-02T22:00:00+03:00","IsSpecialMeeting":null,"LastUpdatedDate":"2025-05-11T10:13:50.92+03:00"}
{"Id":490201,"Number":644,"KnessetNum":3,"Name":"ישיבת מליאה בתאריך 03/06/1959 בשעה 11:10","StartDate":"1959-06-03T11:10:00+03:00","FinishDate":"1959-06-03T13:00:00+03:00","IsSpecialMeeting":null,"LastUpdatedDate":"2023-10-30T08:07:08.34+02:00"}
{"Id":490202,"Number":646,"KnessetNum":3,"Name":"ישיבת מליאה בתאריך 08/06/1959 בשעה 20:53","StartDate":"1959-06-08T20:53:00+03:00","FinishDate":"1959-06-08T21:25:00+03:00","IsSpecialMeeting":null,"LastUpdatedDate":"2023-10-30T07:28:42.6+02:00"}
{"Id":490203,"Number":647,"KnessetNum":3,"Name":"ישיבת מליאה בתאריך 09/06/1959 בשעה 16:03","StartDate":"1959-06-09T16:03:00+03:00","FinishDate":"1959-06-09T18:28:00+03:00","IsSpecialMeeting":null,"LastUpdatedDate":"2023-10-30T07:21:17.093+02:00"}
{"Id":490204,"Number":648,"KnessetNum":3,"Name":"ישיבת מליאה בתאריך 09/06/1959 בשעה 20:03","StartDate":"1959-06-09T20:03:00+03:00","FinishDate":"1959-06-09T21:55:00+03:00","IsSpecialMeeting":null,"LastUpdatedDate":"2023-10-30T07:15:43.467+02:00"}
{"Id":490205,"Number":649,"KnessetNum":3,"Name":"ישיבת מליאה בתאריך 10/06/1959 בשעה 11:02","StartDate":"1959-06-10T11:02:00+03:00","FinishDate":"1959-06-10T13:10:00+03:00","IsSpecialMeeting":null,"LastUpdatedDate":"2023-10-30T07:08:33.127+02:00"}
{"Id":490206,"Number":654,"KnessetNum":3,"Name":"ישיבת מליאה בתאריך 17/06/1959 בשעה 11:08","StartDate":"1959-06-17T11:08:00+03:00","FinishDate":"1959-06-17T14:06:00+03:00","IsSpecialMeeting":null,"LastUpdatedDate":"2023-10-29T12:34:46.93+02:00"}
{"Id":490207,"Number":656,"KnessetNum":3,"Name":"ישיבת מליאה בתאריך 22/06/1959 בשעה 20:09","StartDate":"1959-06-22T20:09:00+03:00","FinishDate":"1959-06-22T21:36:00+03:00","IsSpecialMeeting":null,"LastUpdatedDate":"2023-10-29T11:57:19.707+02:00"}
{"Id":490208,"Number":657,"KnessetNum":3,"Name":"ישיבת מליאה בתאריך 23/06/1959 בשעה 16:05","StartDate":"1959-06-23T16:05:00+03:00","FinishDate":"1959-06-23T18:45:00+03:00","IsSpecialMeeting":null,"LastUpdatedDate":"2023-10-29T11:45:38.093+02:00"}
{"Id":490209,"Number":658,"KnessetNum":3,"Name":"ישיבת מליאה בתאריך 23/06/1959 בשעה 20:03","StartDate":"1959-06-23T20:03:00+03:00","FinishDate":"1959-06-23T22:00:00+03:00","IsSpecialMeeting":null,"LastUpdatedDate":"2023-10-29T11:41:35.873+02:00"}
{"Id":490210,"Number":659,"KnessetNum":3,"Name":"ישיבת מליאה בתאריך 24/06/1959 בשעה 11:06","StartDate":"1959-06-24T11:06:00+03:00","FinishDate":"1959-06-24T12:55:00+03:00","IsSpecialMeeting":null,"LastUpdatedDate":"2023-10-29T11:35:52.077+02:00"}
{"Id":490211,"Number":661,"KnessetNum":3,"Name":"ישיבת מליאה בתאריך 30/06/1959 בשעה 16:06","StartDate":"1959-06-30T16:06:00+03:00","FinishDate":"1959-06-30T19:15:00+03:00","IsSpecialMeeting":null,"LastUpdatedDate":"2023-10-29T11:18:49.407+02:00"}
{"Id":490212,"Number":662,"KnessetNum":3,"Name":"ישיבת מליאה בתאריך 30/06/1959 בשעה 20:17","StartDate":"1959-06-30T20:17:00+03:00","FinishDate":"1959-06-30T22:15:00+03:00","IsSpecialMeeting":null,"LastUpdatedDate":"2023-10-29T11:11:23.147+02:00"}
{"Id":490213,"Number":663,"KnessetNum":3,"Name":"ישיבת מליאה בתאריך 01/07/1959 בשעה 11:10","StartDate":"1959-07-01T11:10:00+03:00","FinishDate":"1959-07-01T13:45:00+03:00","IsSpecialMeeting":null,"LastUpdatedDate":"2023-10-29T10:58:36.477+02:00"}
{"Id":490214,"Number":669,"KnessetNum":3,"Name":"ישיבת מליאה בתאריך 13/07/1959 בשעה 16:07","StartDate":"1959-07-13T16:07:00+03:00","FinishDate":"1959-07-13T19:08:00+03:00","IsSpecialMeeting":null,"LastUpdatedDate":"2023-10-29T09:19:56.427+02:00"}
{"Id":490215,"Number":673,"KnessetNum":3,"Name":"ישיבת מליאה בתאריך 15/07/1959 בשעה 11:00","StartDate":"1959-07-15T11:00:00+03:00","FinishDate":"1959-07-15T15:26:00+03:00","IsSpecialMeeting":null,"LastUpdatedDate":"2023-10-29T07:51:35.797+02:00"}
{"Id":490216,"Number":680,"KnessetNum":3,"Name":"ישיבת מליאה בתאריך 27/07/1959 בשעה 16:04","StartDate":"1959-07-27T16:04:00+03:00","FinishDate":"1959-07-27T18:43:00+03:00","IsSpecialMeeting":null,"LastUpdatedDate":"2023-10-25T13:32:35.443+03:00"}
{"Id":490217,"Number":685,"KnessetNum":3,"Name":"ישיבת מליאה בתאריך 29/07/1959 בשעה 14:05","StartDate":"1959-07-29T14:05:00+03:00","FinishDate":"1959-07-29T18:20:00+03:00","IsSpecialMeeting":null,"LastUpdatedDate":"2023-10-25T11:49:27.703+03:00"}
{"Id":490218,"Number":687,"KnessetNum":3,"Name":"ישיבת מליאה בתאריך 03/08/1959 בשעה 20:08","StartDate":"1959-08-03T20:08:00+03:00","FinishDate":"1959-08-03T23:30:00+03:00","IsSpecialMeeting":null,"LastUpdatedDate":"2023-10-25T10:07:45.92+03:00"}
{"Id":490219,"Number":691,"KnessetNum":3,"Name":"ישיבת מליאה בתאריך 05/08/1959 בשעה 20:02","StartDate":"1959-08-05T20:02:00+03:00","FinishDate":"1959-08-05T23:30:00+03:00","IsSpecialMeeting":null,"LastUpdatedDate":"2023-10-25T09:38:50.487+03:00"}
{"Id":490220,"Number":1,"KnessetNum":4,"Name":"ישיבת מליאה בתאריך 30/11/1959 בשעה 16:02","StartDate":"1959-11-30T16:02:00+02:00","FinishDate":"1959-11-30T16:41:00+02:00","IsSpecialMeeting":null,"LastUpdatedDate":"2021-12-14T16:12:39.083+02:00"}
{"Id":490221,"Number":3,"KnessetNum":4,"Name":"ישיבת מליאה בתאריך 07/12/1959 בשעה 16:00","StartDate":"1959-12-07T16:00:00+02:00","FinishDate":"1959-12-07T18:41:00+02:00","IsSpecialMeeting":null,"LastUpdatedDate":"2021-12-15T09:00:40.547+02:00"}
{"Id":490222,"Number":7,"KnessetNum":4,"Name":"ישיבת מליאה בתאריך 14/12/1959 בשעה 16:07","StartDate":"1959-12-14T16:07:00+02:00","FinishDate":"1959-12-14T18:27:00+02:00","IsSpecialMeeting":null,"LastUpdatedDate":"2021-12-15T09:38:25.383+02:00"}
{"Id":490223,"Number":9,"KnessetNum":4,"Name":"ישיבת מליאה בתאריך 16/12/1959 בשעה 20:06","StartDate":"1959-12-16T20:06:00+02:00","FinishDate":"1959-12-16T23:08:00+02:00","IsSpecialMeeting":null,"LastUpdatedDate":"2021-12-15T09:55:48.73+02:00"}
{"Id":490224,"Number":10,"KnessetNum":4,"Name":"ישיבת מליאה בתאריך 17/12/1959 בשעה 09:10","StartDate":"1959-12-17T09:10:00+02:00","FinishDate":"1959-12-17T12:39:00+02:00","IsSpecialMeeting":null,"LastUpdatedDate":"2021-12-16T06:56:22.1+02:00"}
{"Id":490225,"Number":11,"KnessetNum":4,"Name":"ישיבת מליאה בתאריך 17/12/1959 בשעה 13:18","StartDate":"1959-12-17T13:18:00+02:00","FinishDate":"1959-12-17T15:30:00+02:00","IsSpecialMeeting":null,"LastUpdatedDate":"2021-12-16T06:54:18.667+02:00"}
{"Id":490226,"Number":15,"KnessetNum":4,"Name":"ישיבת מליאה בתאריך 22/12/1959 בשעה 20:00","StartDate":"1959-12-22T20:00:00+02:00","FinishDate":"1959-12-22T20:45:00+02:00","IsSpecialMeeting":null,"LastUpdatedDate":"2021-12-15T11:24:37.093+02:00"}
{"Id":490227,"Number":16,"KnessetNum":4,"Name":"ישיבת מליאה בתאריך 28/12/1959 בשעה 16:00","StartDate":"1959-12-28T16:00:00+02:00","FinishDate":"1959-12-28T18:34:00+02:00","IsSpecialMeeting":null,"LastUpdatedDate":"2021-12-15T11:29:19.247+02:00"}
{"Id":490228,"Number":17,"KnessetNum":4,"Name":"ישיבת מליאה בתאריך 28/12/1959 בשעה 19:22","StartDate":"1959-12-28T19:22:00+02:00","FinishDate":"1959-12-28T19:41:00+02:00","IsSpecialMeeting":null,"LastUpdatedDate":"2021-12-15T11:58:30.79+02:00"}
{"Id":490229,"Number":21,"KnessetNum":4,"Name":"ישיבת מליאה בתאריך 04/01/1960 בשעה 16:05","StartDate":"1960-01-04T16:05:00+02:00","FinishDate":"1960-01-04T18:40:00+02:00","IsSpecialMeeting":null,"LastUpdatedDate":"2021-12-15T12:50:16.43+02:00"}
{"Id":490230,"Number":22,"KnessetNum":4,"Name":"ישיבת מליאה בתאריך 04/01/1960 בשעה 20:03","StartDate":"1960-01-04T20:03:00+02:00","FinishDate":"1960-01-04T20:50:00+02:00","IsSpecialMeeting":null,"LastUpdatedDate":"2021-12-15T12:59:07.167+02:00"}
{"Id":490231,"Number":25,"KnessetNum":4,"Name":"ישיבת מליאה בתאריך 06/01/1960 בשעה 11:08","StartDate":"1960-01-06T11:08:00+02:00","FinishDate":"1960-01-06T12:22:00+02:00","IsSpecialMeeting":null,"LastUpdatedDate":"2021-12-15T13:24:29.25+02:00"}
{"Id":490232,"Number":27,"KnessetNum":4,"Name":"ישיבת מליאה בתאריך 11/01/1960 בשעה 20:08","StartDate":"1960-01-11T20:08:00+02:00","FinishDate":"1960-01-11T21:36:00+02:00","IsSpecialMeeting":null,"LastUpdatedDate":"2021-12-16T07:01:36.583+02:00"}
{"Id":490233,"Number":33,"KnessetNum":4,"Name":"ישיבת מליאה בתאריך 19/01/1960 בשעה 16:00","StartDate":"1960-01-19T16:00:00+02:00","FinishDate":"1960-01-19T18:57:00+02:00","IsSpecialMeeting":null,"LastUpdatedDate":"2021-12-16T07:23:16.643+02:00"}
{"Id":490234,"Number":34,"KnessetNum":4,"Name":"ישיבת מליאה בתאריך 19/01/1960 בשעה 20:00","StartDate":"1960-01-19T20:00:00+02:00","FinishDate":"1960-01-19T22:03:00+02:00","IsSpecialMeeting":null,"LastUpdatedDate":"2021-12-16T07:12:09.473+02:00"}
{"Id":490235,"Number":39,"KnessetNum":4,"Name":"ישיבת מליאה בתאריך 26/01/1960 בשעה 20:04","StartDate":"1960-01-26T20:04:00+02:00","FinishDate":"1960-01-26T21:25:00+02:00","IsSpecialMeeting":null,"LastUpdatedDate":"2021-12-16T09:39:41.9+02:00"}
{"Id":490236,"Number":41,"KnessetNum":4,"Name":"ישיבת מליאה בתאריך 01/02/1960 בשעה 16:04","StartDate":"1960-02-01T16:04:00+02:00","FinishDate":"1960-02-01T18:55:00+02:00","IsSpecialMeeting":null,"LastUpdatedDate":"2022-01-19T18:59:43.827+02:00"}
{"Id":490237,"Number":42,"KnessetNum":4,"Name":"ישיבת מליאה בתאריך 01/02/1960 בשעה 20:02","StartDate":"1960-02-01T20:02:00+02:00","FinishDate":"1960-02-01T21:07:00+02:00","IsSpecialMeeting":null,"LastUpdatedDate":"2023-07-16T15:43:13.893+03:00"}
{"Id":490238,"Number":43,"KnessetNum":4,"Name":"ישיבת מליאה בתאריך 02/02/1960 בשעה 16:04","StartDate":"1960-02-02T16:04:00+02:00","FinishDate":"1960-02-02T18:40:00+02:00","IsSpecialMeeting":null,"LastUpdatedDate":"2021-12-16T11:07:49.583+02:00"}
{"Id":490239,"Number":44,"KnessetNum":4,"Name":"ישיבת מליאה בתאריך 02/02/1960 בשעה 20:00","StartDate":"1960-02-02T20:00:00+02:00","FinishDate":"1960-02-02T21:10:00+02:00","IsSpecialMeeting":null,"LastUpdatedDate":"2021-12-16T11:14:05.07+02:00"}
{"Id":490240,"Number":49,"KnessetNum":4,"Name":"ישיבת מליאה בתאריך 09/02/1960 בשעה 20:32","StartDate":"1960-02-09T20:32:00+02:00","FinishDate":"1960-02-09T22:20:00+02:00","IsSpecialMeeting":null,"LastUpdatedDate":"2021-12-16T12:25:44.323+02:00"}
{"Id":490241,"Number":50,"KnessetNum":4,"Name":"ישיבת מליאה בתאריך 10/02/1960 בשעה 11:00","StartDate":"1960-02-10T11:00:00+02:00","FinishDate":"1960-02-10T12:34:00+02:00","IsSpecialMeeting":null,"LastUpdatedDate":"2021-12-16T12:37:28.94+02:00"}
{"Id":490242,"Number":54,"KnessetNum":4,"Name":"ישיבת מליאה בתאריך 17/02/1960 בשעה 10:00","StartDate":"1960-02-17T10:00:00+02:00","FinishDate":"1960-02-17T10:15:00+02:00","IsSpecialMeeting":null,"LastUpdatedDate":"2021-12-20T08:05:02.51+02:00"}
{"Id":490243,"Number":58,"KnessetNum":4,"Name":"ישיבת מליאה בתאריך 23/02/1960 בשעה 20:06","StartDate":"1960-02-23T20:06:00+02:00","FinishDate":"1960-02-23T21:25:00+02:00","IsSpecialMeeting":null,"LastUpdatedDate":"2021-12-20T09:40:17.76+02:00"}
{"Id":490244,"Number":61,"KnessetNum":4,"Name":"ישיבת מליאה בתאריך 29/02/1960 בשעה 20:02","StartDate":"1960-02-29T20:02:00+02:00","FinishDate":"1960-02-29T21:40:00+02:00","IsSpecialMeeting":null,"LastUpdatedDate":"2023-07-16T15:44:58.34+03:00"}
{"Id":490245,"Number":62,"KnessetNum":4,"Name":"ישיבת מליאה בתאריך 01/03/1960 בשעה 16:06","StartDate":"1960-03-01T16:06:00+02:00","FinishDate":"1960-03-01T18:51:00+02:00","IsSpecialMeeting":null,"LastUpdatedDate":"2021-12-20T10:45:04.777+02:00"}
{"Id":490246,"Number":63,"KnessetNum":4,"Name":"ישיבת מליאה בתאריך 01/03/1960 בשעה 20:02","StartDate":"1960-03-01T20:02:00+02:00","FinishDate":"1960-03-01T22:13:00+02:00","IsSpecialMeeting":null,"LastUpdatedDate":"2021-12-20T10:50:13.647+02:00"}
{"Id":490247,"Number":65,"KnessetNum":4,"Name":"ישיבת מליאה בתאריך 07/03/1960 בשעה 16:09","StartDate":"1960-03-07T16:09:00+02:00","FinishDate":"1960-03-07T19:06:00+02:00","IsSpecialMeeting":null,"LastUpdatedDate":"2021-12-20T11:06:18.123+02:00"}
{"Id":490248,"Number":66,"KnessetNum":4,"Name":"ישיבת מליאה בתאריך 07/03/1960 בשעה 20:02","StartDate":"1960-03-07T20:02:00+02:00","FinishDate":"1960-03-07T21:25:00+02:00","IsSpecialMeeting":null,"LastUpdatedDate":"2021-12-20T11:30:29.93+02:00"}
{"Id":490249,"Number":70,"KnessetNum":4,"Name":"ישיבת מליאה בתאריך 15/03/1960 בשעה 16:05","StartDate":"1960-03-15T16:05:00+02:00","FinishDate":"1960-03-15T18:10:00+02:00","IsSpecialMeeting":null,"LastUpdatedDate":"2023-07-16T15:46:29.75+03:00"}
{"Id":490250,"Number":72,"KnessetNum":4,"Name":"ישיבת מליאה בתאריך 16/03/1960 בשעה 11:04","StartDate":"1960-03-16T11:04:00+02:00","FinishDate":"1960-03-16T13:34:00+02:00","IsSpecialMeeting":null,"LastUpdatedDate":"2021-12-20T14:43:10.2+02:00"}
{"Id":490251,"Number":73,"KnessetNum":4,"Name":"ישיבת מליאה בתאריך 21/03/1960 בשעה 16:10","StartDate":"1960-03-21T16:10:00+02:00","FinishDate":"1960-03-21T18:50:00+02:00","IsSpecialMeeting":null,"LastUpdatedDate":"2021-12-20T14:47:24.49+02:00"}
{"Id":490252,"Number":74,"KnessetNum":4,"Name":"ישיבת מליאה בתאריך 21/03/1960 בשעה 20:03","StartDate":"1960-03-21T20:03:00+02:00","FinishDate":"1960-03-21T22:17:00+02:00","IsSpecialMeeting":null,"LastUpdatedDate":"2021-12-20T15:23:21.01+02:00"}
{"Id":490253,"Number":75,"KnessetNum":4,"Name":"ישיבת מליאה בתאריך 22/03/1960 בשעה 16:02","StartDate":"1960-03-22T16:02:00+02:00","FinishDate":"1960-03-22T19:53:00+02:00","IsSpecialMeeting":null,"LastUpdatedDate":"2021-12-20T15:29:45.52+02:00"}
{"Id":490254,"Number":76,"KnessetNum":4,"Name":"ישיבת מליאה בתאריך 22/03/1960 בשעה 20:28","StartDate":"1960-03-22T20:28:00+02:00","FinishDate":"1960-03-22T22:24:00+02:00","IsSpecialMeeting":null,"LastUpdatedDate":"2021-12-20T15:34:00.517+02:00"}
{"Id":490255,"Number":78,"KnessetNum":4,"Name":"ישיבת מליאה בתאריך 28/03/1960 בשעה 16:09","StartDate":"1960-03-28T16:09:00+02:00","FinishDate":"1960-03-28T19:07:00+02:00","IsSpecialMeeting":null,"LastUpdatedDate":"2021-12-20T15:45:31.543+02:00"}
{"Id":490256,"Number":80,"KnessetNum":4,"Name":"ישיבת מליאה בתאריך 29/03/1960 בשעה 16:02","StartDate":"1960-03-29T16:02:00+02:00","FinishDate":"1960-03-29T18:57:00+02:00","IsSpecialMeeting":null,"LastUpdatedDate":"2023-07-10T17:49:01.693+03:00"}
{"Id":490257,"Number":85,"KnessetNum":4,"Name":"ישיבת מליאה בתאריך 05/04/1960 בשעה 16:05","StartDate":"1960-04-05T16:05:00+02:00","FinishDate":"1960-04-05T19:06:00+02:00","IsSpecialMeeting":null,"LastUpdatedDate":"2021-12-20T17:28:30.807+02:00"}
{"Id":490258,"Number":86,"KnessetNum":4,"Name":"ישיבת מליאה בתאריך 05/04/1960 בשעה 20:20","StartDate":"1960-04-05T20:20:00+02:00","FinishDate":"1960-04-05T22:33:00+02:00","IsSpecialMeeting":null,"LastUpdatedDate":"2021-12-20T17:47:02.12+02:00"}
{"Id":490259,"Number":89,"KnessetNum":4,"Name":"ישיבת מליאה בתאריך 09/05/1960 בשעה 16:00","StartDate":"1960-05-09T16:00:00+03:00","FinishDate":"1960-05-09T18:05:00+03:00","IsSpecialMeeting":null,"LastUpdatedDate":"2021-12-21T07:48:27.193+02:00"}
{"Id":490260,"Number":93,"KnessetNum":4,"Name":"ישיבת מליאה בתאריך 16/05/1960 בשעה 16:00","StartDate":"1960-05-16T16:00:00+03:00","FinishDate":"1960-05-16T19:20:00+03:00","IsSpecialMeeting":null,"LastUpdatedDate":"2021-12-21T08:52:02.643+02:00"}
{"Id":490261,"Number":94,"KnessetNum":4,"Name":"ישיבת מליאה בתאריך 16/05/1960 בשעה 20:30","StartDate":"1960-05-16T20:30:00+03:00","FinishDate":"1960-05-16T21:55:00+03:00","IsSpecialMeeting":null,"LastUpdatedDate":"2021-12-21T09:10:06+02:00"}
{"Id":490262,"Number":95,"KnessetNum":4,"Name":"ישיבת מליאה בתאריך 17/05/1960 בשעה 17:03","StartDate":"1960-05-17T17:03:00+03:00","FinishDate":"1960-05-17T19:08:00+03:00","IsSpecialMeeting":null,"LastUpdatedDate":"2021-12-21T09:23:07.69+02:00"}
{"Id":490263,"Number":96,"KnessetNum":4,"Name":"ישיבת מליאה בתאריך 17/05/1960 בשעה 20:00","StartDate":"1960-05-17T20:00:00+03:00","FinishDate":"1960-05-17T22:15:00+03:00","IsSpecialMeeting":null,"LastUpdatedDate":"2021-12-21T09:42:13.25+02:00"}
{"Id":490264,"Number":98,"KnessetNum":4,"Name":"ישיבת מליאה בתאריך 23/05/1960 בשעה 16:04","StartDate":"1960-05-23T16:04:00+03:00","FinishDate":"1960-05-23T19:10:00+03:00","IsSpecialMeeting":null,"LastUpdatedDate":"2021-12-21T10:27:00.64+02:00"}
{"Id":490265,"Number":99,"KnessetNum":4,"Name":"ישיבת מליאה בתאריך 23/05/1960 בשעה 20:13","StartDate":"1960-05-23T20:13:00+03:00","FinishDate":"1960-05-23T21:35:00+03:00","IsSpecialMeeting":null,"LastUpdatedDate":"2021-12-21T10:32:42.36+02:00"}
{"Id":490266,"Number":100,"KnessetNum":4,"Name":"ישיבת מליאה בתאריך 24/05/1960 בשעה 16:02","StartDate":"1960-05-24T16:02:00+03:00","FinishDate":"1960-05-24T19:30:00+03:00","IsSpecialMeeting":null,"LastUpdatedDate":"2021-12-21T11:03:55.34+02:00"}
{"Id":490267,"Number":101,"KnessetNum":4,"Name":"ישיבת מליאה בתאריך 24/05/1960 בשעה 20:30","StartDate":"1960-05-24T20:30:00+03:00","FinishDate":"1960-05-24T22:35:00+03:00","IsSpecialMeeting":null,"LastUpdatedDate":"2021-12-21T11:10:04.937+02:00"}
{"Id":490268,"Number":103,"KnessetNum":4,"Name":"ישיבת מליאה בתאריך 30/05/1960 בשעה 11:03","StartDate":"1960-05-30T11:03:00+03:00","FinishDate":"1960-05-30T13:33:00+03:00","IsSpecialMeeting":null,"LastUpdatedDate":"2021-12-21T11:38:51.907+02:00"}
{"Id":490269,"Number":104,"KnessetNum":4,"Name":"ישיבת מליאה בתאריך 30/05/1960 בשעה 15:05","StartDate":"1960-05-30T15:05:00+03:00","FinishDate":"1960-05-30T19:18:00+03:00","IsSpecialMeeting":null,"LastUpdatedDate":"2021-12-21T11:45:07.72+02:00"}
{"Id":490270,"Number":105,"KnessetNum":4,"Name":"ישיבת מליאה בתאריך 06/06/1960 בשעה 16:03","StartDate":"1960-06-06T16:03:00+03:00","FinishDate":"1960-06-06T18:55:00+03:00","IsSpecialMeeting":null,"LastUpdatedDate":"2021-12-21T12:47:21.923+02:00"}
{"Id":490271,"Number":106,"KnessetNum":4,"Name":"ישיבת מליאה בתאריך 06/06/1960 בשעה 20:02","StartDate":"1960-06-06T20:02:00+03:00","FinishDate":"1960-06-06T20:45:00+03:00","IsSpecialMeeting":null,"LastUpdatedDate":"2021-12-21T13:40:31.06+02:00"}
{"Id":490272,"Number":107,"KnessetNum":4,"Name":"ישיבת מליאה בתאריך 07/06/1960 בשעה 16:03","StartDate":"1960-06-07T16:03:00+03:00","FinishDate":"1960-06-07T19:06:00+03:00","IsSpecialMeeting":null,"LastUpdatedDate":"2021-12-21T14:05:17.797+02:00"}
{"Id":490273,"Number":108,"KnessetNum":4,"Name":"ישיבת מליאה בתאריך 07/06/1960 בשעה 20:17","StartDate":"1960-06-07T20:17:00+03:00","FinishDate":"1960-06-07T21:56:00+03:00","IsSpecialMeeting":null,"LastUpdatedDate":"2021-12-21T14:19:57.107+02:00"}
{"Id":490274,"Number":111,"KnessetNum":4,"Name":"ישיבת מליאה בתאריך 13/06/1960 בשעה 20:03","StartDate":"1960-06-13T20:03:00+03:00","FinishDate":"1960-06-13T20:05:00+03:00","IsSpecialMeeting":null,"LastUpdatedDate":"2021-12-21T15:11:59.58+02:00"}
{"Id":490275,"Number":112,"KnessetNum":4,"Name":"ישיבת מליאה בתאריך 14/06/1960 בשעה 16:03","StartDate":"1960-06-14T16:03:00+03:00","FinishDate":"1960-06-14T17:13:00+03:00","IsSpecialMeeting":null,"LastUpdatedDate":"2021-12-21T15:33:19.023+02:00"}
{"Id":490276,"Number":113,"KnessetNum":4,"Name":"ישיבת מליאה בתאריך 14/06/1960 בשעה 20:16","StartDate":"1960-06-14T20:16:00+03:00","FinishDate":"1960-06-14T21:50:00+03:00","IsSpecialMeeting":null,"LastUpdatedDate":"2021-12-21T15:46:48.077+02:00"}
{"Id":490277,"Number":114,"KnessetNum":4,"Name":"ישיבת מליאה בתאריך 15/06/1960 בשעה 11:00","StartDate":"1960-06-15T11:00:00+03:00","FinishDate":"1960-06-15T13:00:00+03:00","IsSpecialMeeting":null,"LastUpdatedDate":"2021-12-21T15:54:00.883+02:00"}
{"Id":490278,"Number":115,"KnessetNum":4,"Name":"ישיבת מליאה בתאריך 20/06/1960 בשעה 16:00","StartDate":"1960-06-20T16:00:00+03:00","FinishDate":"1960-06-20T19:10:00+03:00","IsSpecialMeeting":null,"LastUpdatedDate":"2021-12-21T15:59:14.507+02:00"}
{"Id":490279,"Number":116,"KnessetNum":4,"Name":"ישיבת מליאה בתאריך 20/06/1960 בשעה 20:00","StartDate":"1960-06-20T20:00:00+03:00","FinishDate":"1960-06-20T23:25:00+03:00","IsSpecialMeeting":null,"LastUpdatedDate":"2021-12-21T16:30:30.377+02:00"}
{"Id":490280,"Number":117,"KnessetNum":4,"Name":"ישיבת מליאה בתאריך 21/06/1960 בשעה 16:03","StartDate":"1960-06-21T16:03:00+03:00","FinishDate":"1960-06-21T19:00:00+03:00","IsSpecialMeeting":null,"LastUpdatedDate":"2023-07-11T14:43:20.833+03:00"}
{"Id":490281,"Number":118,"KnessetNum":4,"Name":"ישיבת מליאה בתאריך 21/06/1960 בשעה 20:01","StartDate":"1960-06-21T20:01:00+03:00","FinishDate":"1960-06-21T21:48:00+03:00","IsSpecialMeeting":null,"LastUpdatedDate":"2021-12-22T08:35:50.563+02:00"}
{"Id":490282,"Number":119,"KnessetNum":4,"Name":"ישיבת מליאה בתאריך 22/06/1960 בשעה 11:07","StartDate":"1960-06-22T11:07:00+03:00","FinishDate":"1960-06-22T13:41:00+03:00","IsSpecialMeeting":null,"LastUpdatedDate":"2021-12-22T08:50:06.11+02:00"}
{"Id":490283,"Number":121,"KnessetNum":4,"Name":"ישיבת מליאה בתאריך 27/06/1960 בשעה 16:06","StartDate":"1960-06-27T16:06:00+03:00","FinishDate":"1960-06-27T19:17:00+03:00","IsSpecialMeeting":null,"LastUpdatedDate":"2021-12-22T10:36:01.25+02:00"}
{"Id":490284,"Number":123,"KnessetNum":4,"Name":"ישיבת מליאה בתאריך 28/06/1960 בשעה 16:00","StartDate":"1960-06-28T16:00:00+03:00","FinishDate":"1960-06-28T19:05:00+03:00","IsSpecialMeeting":null,"LastUpdatedDate":"2023-07-16T16:02:53.837+03:00"}
{"Id":490285,"Number":130,"KnessetNum":4,"Name":"ישיבת מליאה בתאריך 06/07/1960 בשעה 11:03","StartDate":"1960-07-06T11:03:00+03:00","FinishDate":"1960-07-06T13:05:00+03:00","IsSpecialMeeting":null,"LastUpdatedDate":"2021-12-22T13:40:56.96+02:00"}
{"Id":490286,"Number":132,"KnessetNum":4,"Name":"ישיבת מליאה בתאריך 11/07/1960 בשעה 20:04","StartDate":"1960-07-11T20:04:00+03:00","FinishDate":"1960-07-11T21:20:00+03:00","IsSpecialMeeting":null,"LastUpdatedDate":"2021-12-22T14:35:52.433+02:00"}
{"Id":490287,"Number":134,"KnessetNum":4,"Name":"ישיבת מליאה בתאריך 12/07/1960 בשעה 20:02","StartDate":"1960-07-12T20:02:00+03:00","FinishDate":"1960-07-12T21:40:00+03:00","IsSpecialMeeting":null,"LastUpdatedDate":"2021-12-23T07:08:52.503+02:00"}
{"Id":490288,"Number":135,"KnessetNum":4,"Name":"ישיבת מליאה בתאריך 13/07/1960 בשעה 11:00","StartDate":"1960-07-13T11:00:00+03:00","FinishDate":"1960-07-13T13:00:00+03:00","IsSpecialMeeting":null,"LastUpdatedDate":"2023-07-04T16:23:31.18+03:00"}
{"Id":490289,"Number":137,"KnessetNum":4,"Name":"ישיבת מליאה בתאריך 18/07/1960 בשעה 20:00","StartDate":"1960-07-18T20:00:00+03:00","FinishDate":"1960-07-18T20:48:00+03:00","IsSpecialMeeting":null,"LastUpdatedDate":"2021-12-23T08:04:34.33+02:00"}
{"Id":490290,"Number":143,"KnessetNum":4,"Name":"ישיבת מליאה בתאריך 26/07/1960 בשעה 16:02","StartDate":"1960-07-26T16:02:00+03:00","FinishDate":"1960-07-26T19:07:00+03:00","IsSpecialMeeting":null,"LastUpdatedDate":"2021-12-23T09:45:00.863+02:00"}
{"Id":490291,"Number":144,"KnessetNum":4,"Name":"ישיבת מליאה בתאריך 26/07/1960 בשעה 20:00","StartDate":"1960-07-26T20:00:00+03:00","FinishDate":"1960-07-26T22:24:00+03:00","IsSpecialMeeting":null,"LastUpdatedDate":"2021-12-23T10:05:01.93+02:00"}
{"Id":490292,"Number":146,"KnessetNum":4,"Name":"ישיבת מליאה בתאריך 03/08/1960 בשעה 15:00","StartDate":"1960-08-03T15:00:00+03:00","FinishDate":"1960-08-03T18:27:00+03:00","IsSpecialMeeting":null,"LastUpdatedDate":"2021-12-23T11:23:29.217+02:00"}
{"Id":490293,"Number":147,"KnessetNum":4,"Name":"ישיבת מליאה בתאריך 03/08/1960 בשעה 19:22","StartDate":"1960-08-03T19:22:00+03:00","FinishDate":"1960-08-03T20:47:00+03:00","IsSpecialMeeting":null,"LastUpdatedDate":"2021-12-23T11:53:11.49+02:00"}
{"Id":490294,"Number":155,"KnessetNum":4,"Name":"ישיבת מליאה בתאריך 23/08/1960 בשעה 12:08","StartDate":"1960-08-23T12:08:00+03:00","FinishDate":"1960-08-23T14:05:00+03:00","IsSpecialMeeting":null,"LastUpdatedDate":"2021-12-26T10:09:29.823+02:00"}
{"Id":490295,"Number":156,"KnessetNum":4,"Name":"ישיבת מליאה בתאריך 24/10/1960 בשעה 16:04","StartDate":"1960-10-24T16:04:00+02:00","FinishDate":"1960-10-24T18:47:00+02:00","IsSpecialMeeting":null,"LastUpdatedDate":"2021-12-26T11:09:26.163+02:00"}
{"Id":490296,"Number":157,"KnessetNum":4,"Name":"ישיבת מליאה בתאריך 24/10/1960 בשעה 20:00","StartDate":"1960-10-24T20:00:00+02:00","FinishDate":"1960-10-24T21:38:00+02:00","IsSpecialMeeting":null,"LastUpdatedDate":"2021-12-26T11:18:32.207+02:00"}
{"Id":490297,"Number":158,"KnessetNum":4,"Name":"ישיבת מליאה בתאריך 25/10/1960 בשעה 16:05","StartDate":"1960-10-25T16:05:00+02:00","FinishDate":"1960-10-25T19:11:00+02:00","IsSpecialMeeting":null,"LastUpdatedDate":"2021-12-26T11:23:54.717+02:00"}
{"Id":490298,"Number":159,"KnessetNum":4,"Name":"ישיבת מליאה בתאריך 25/10/1960 בשעה 20:18","StartDate":"1960-10-25T20:18:00+02:00","FinishDate":"1960-10-25T22:00:00+02:00","IsSpecialMeeting":null,"LastUpdatedDate":"2021-12-26T11:50:46.017+02:00"}
{"Id":490299,"Number":160,"KnessetNum":4,"Name":"ישיבת מליאה בתאריך 26/10/1960 בשעה 11:03","StartDate":"1960-10-26T11:03:00+02:00","FinishDate":"1960-10-26T13:15:00+02:00","IsSpecialMeeting":null,"LastUpdatedDate":"2021-12-26T12:46:34.913+02:00"}
{"Id":490300,"Number":161,"KnessetNum":4,"Name":"ישיבת מליאה בתאריך 31/10/1960 בשעה 16:03","StartDate":"1960-10-31T16:03:00+02:00","FinishDate":"1960-10-31T18:14:00+02:00","IsSpecialMeeting":null,"LastUpdatedDate":"2021-12-26T12:07:54.99+02:00"}
{"Id":490301,"Number":163,"KnessetNum":4,"Name":"ישיבת מליאה בתאריך 01/11/1960 בשעה 16:01","StartDate":"1960-11-01T16:01:00+02:00","FinishDate":"1960-11-01T19:00:00+02:00","IsSpecialMeeting":null,"LastUpdatedDate":"2021-12-26T12:48:04.167+02:00"}
{"Id":490302,"Number":164,"KnessetNum":4,"Name":"ישיבת מליאה בתאריך 01/11/1960 בשעה 20:03","StartDate":"1960-11-01T20:03:00+02:00","FinishDate":"1960-11-01T20:51:00+02:00","IsSpecialMeeting":null,"LastUpdatedDate":"2023-07-16T16:04:06.92+03:00"}
{"Id":490303,"Number":165,"KnessetNum":4,"Name":"ישיבת מליאה בתאריך 02/11/1960 בשעה 11:05","StartDate":"1960-11-02T11:05:00+02:00","FinishDate":"1960-11-02T12:50:00+02:00","IsSpecialMeeting":null,"LastUpdatedDate":"2024-02-22T15:08:47.4+02:00"}
{"Id":490304,"Number":172,"KnessetNum":4,"Name":"ישיבת מליאה בתאריך 14/11/1960 בשעה 20:03","StartDate":"1960-11-14T20:03:00+02:00","FinishDate":"1960-11-14T21:00:00+02:00","IsSpecialMeeting":null,"LastUpdatedDate":"2021-12-27T10:21:02.517+02:00"}
{"Id":490305,"Number":175,"KnessetNum":4,"Name":"ישיבת מליאה בתאריך 16/11/1960 בשעה 11:00","StartDate":"1960-11-16T11:00:00+02:00","FinishDate":"1960-11-16T14:02:00+02:00","IsSpecialMeeting":null,"LastUpdatedDate":"2021-12-27T11:19:29.057+02:00"}
{"Id":490306,"Number":179,"KnessetNum":4,"Name":"ישיבת מליאה בתאריך 22/11/1960 בשעה 20:15","StartDate":"1960-11-22T20:15:00+02:00","FinishDate":"1960-11-22T21:20:00+02:00","IsSpecialMeeting":null,"LastUpdatedDate":"2021-12-27T14:35:29.39+02:00"}
{"Id":490307,"Number":185,"KnessetNum":4,"Name":"ישיבת מליאה בתאריך 30/11/1960 בשעה 11:01","StartDate":"1960-11-30T11:01:00+02:00","FinishDate":"1960-11-30T13:25:00+02:00","IsSpecialMeeting":null,"LastUpdatedDate":"2021-12-27T16:18:24.807+02:00"}
{"Id":490308,"Number":186,"KnessetNum":4,"Name":"ישיבת מליאה בתאריך 05/12/1960 בשעה 16:01","StartDate":"1960-12-05T16:01:00+02:00","FinishDate":"1960-12-05T18:50:00+02:00","IsSpecialMeeting":null,"LastUpdatedDate":"2021-12-27T17:01:45.833+02:00"}
{"Id":490309,"Number":188,"KnessetNum":4,"Name":"ישיבת מליאה בתאריך 06/12/1960 בשעה 16:03","StartDate":"1960-12-06T16:03:00+02:00","FinishDate":"1960-12-06T18:55:00+02:00","IsSpecialMeeting":null,"LastUpdatedDate":"2021-12-27T17:23:47.947+02:00"}
{"Id":490310,"Number":189,"KnessetNum":4,"Name":"ישיבת מליאה בתאריך 06/12/1960 בשעה 20:18","StartDate":"1960-12-06T20:18:00+02:00","FinishDate":"1960-12-06T21:24:00+02:00","IsSpecialMeeting":null,"LastUpdatedDate":"2021-12-27T17:40:45.81+02:00"}
{"Id":490311,"Number":193,"KnessetNum":4,"Name":"ישיבת מליאה בתאריך 13/12/1960 בשעה 16:00","StartDate":"1960-12-13T16:00:00+02:00","FinishDate":"1960-12-13T18:20:00+02:00","IsSpecialMeeting":null,"LastUpdatedDate":"2021-12-28T08:08:53.603+02:00"}
{"Id":490312,"Number":194,"KnessetNum":4,"Name":"ישיבת מליאה בתאריך 19/12/1960 בשעה 16:00","StartDate":"1960-12-19T16:00:00+02:00","FinishDate":"1960-12-19T18:45:00+02:00","IsSpecialMeeting":null,"LastUpdatedDate":"2021-12-28T09:43:55.063+02:00"}
{"Id":490313,"Number":195,"KnessetNum":4,"Name":"ישיבת מליאה בתאריך 19/12/1960 בשעה 20:00","StartDate":"1960-12-19T20:00:00+02:00","FinishDate":"1960-12-19T21:43:00+02:00","IsSpecialMeeting":null,"LastUpdatedDate":"2021-12-28T10:25:54.607+02:00"}
{"Id":490314,"Number":196,"KnessetNum":4,"Name":"ישיבת מליאה בתאריך 20/12/1960 בשעה 16:05","StartDate":"1960-12-20T16:05:00+02:00","FinishDate":"1960-12-20T19:10:00+02:00","IsSpecialMeeting":null,"LastUpdatedDate":"2021-12-28T09:51:20.303+02:00"}
{"Id":490315,"Number":197,"KnessetNum":4,"Name":"ישיבת מליאה בתאריך 20/12/1960 בשעה 20:04","StartDate":"1960-12-20T20:04:00+02:00","FinishDate":"1960-12-20T21:40:00+02:00","IsSpecialMeeting":null,"LastUpdatedDate":"2021-12-28T10:35:41.927+02:00"}
{"Id":490316,"Number":204,"KnessetNum":4,"Name":"ישיבת מליאה בתאריך 02/01/1961 בשעה 20:15","StartDate":"1961-01-02T20:15:00+02:00","FinishDate":"1961-01-02T22:20:00+02:00","IsSpecialMeeting":null,"LastUpdatedDate":"2021-12-28T12:34:56.96+02:00"}
{"Id":490317,"Number":210,"KnessetNum":4,"Name":"ישיבת מליאה בתאריך 16/01/1961 בשעה 16:00","StartDate":"1961-01-16T16:00:00+02:00","FinishDate":"1961-01-16T18:37:00+02:00","IsSpecialMeeting":null,"LastUpdatedDate":"2021-12-28T15:00:15.483+02:00"}
{"Id":490318,"Number":211,"KnessetNum":4,"Name":"ישיבת מליאה בתאריך 16/01/1961 בשעה 20:03","StartDate":"1961-01-16T20:03:00+02:00","FinishDate":"1961-01-16T21:16:00+02:00","IsSpecialMeeting":null,"LastUpdatedDate":"2021-12-28T15:31:29.023+02:00"}
{"Id":490319,"Number":212,"KnessetNum":4,"Name":"ישיבת מליאה בתאריך 17/01/1961 בשעה 16:01","StartDate":"1961-01-17T16:01:00+02:00","FinishDate":"1961-01-17T19:08:00+02:00","IsSpecialMeeting":null,"LastUpdatedDate":"2021-12-28T15:38:59.087+02:00"}
{"Id":490320,"Number":213,"KnessetNum":4,"Name":"ישיבת מליאה בתאריך 17/01/1961 בשעה 20:02","StartDate":"1961-01-17T20:02:00+02:00","FinishDate":"1961-01-17T21:17:00+02:00","IsSpecialMeeting":null,"LastUpdatedDate":"2021-12-28T15:45:09.543+02:00"}
{"Id":490321,"Number":216,"KnessetNum":4,"Name":"ישיבת מליאה בתאריך 23/01/1961 בשעה 20:10","StartDate":"1961-01-23T20:10:00+02:00","FinishDate":"1961-01-23T21:05:00+02:00","IsSpecialMeeting":null,"LastUpdatedDate":"2025-01-22T11:31:36.77+02:00"}
{"Id":490322,"Number":220,"KnessetNum":4,"Name":"ישיבת מליאה בתאריך 30/01/1961 בשעה 16:03","StartDate":"1961-01-30T16:03:00+02:00","FinishDate":"1961-01-30T18:37:00+02:00","IsSpecialMeeting":null,"LastUpdatedDate":"2021-12-29T09:38:39.617+02:00"}
{"Id":490323,"Number":221,"KnessetNum":4,"Name":"ישיבת מליאה בתאריך 30/01/1961 בשעה 20:05","StartDate":"1961-01-30T20:05:00+02:00","FinishDate":"1961-01-30T21:30:00+02:00","IsSpecialMeeting":null,"LastUpdatedDate":"2021-12-29T10:05:09.24+02:00"}
{"Id":490324,"Number":224,"KnessetNum":4,"Name":"ישיבת מליאה בתאריך 06/02/1961 בשעה 16:07","StartDate":"1961-02-06T16:07:00+02:00","FinishDate":"1961-02-06T19:00:00+02:00","IsSpecialMeeting":null,"LastUpdatedDate":"2021-12-29T10:34:43.37+02:00"}
{"Id":490325,"Number":226,"KnessetNum":4,"Name":"ישיבת מליאה בתאריך 07/02/1961 בשעה 16:05","StartDate":"1961-02-07T16:05:00+02:00","FinishDate":"1961-02-07T19:07:00+02:00","IsSpecialMeeting":null,"LastUpdatedDate":"2023-07-30T10:35:17.247+03:00"}
{"Id":490326,"Number":233,"KnessetNum":4,"Name":"ישיבת מליאה בתאריך 15/02/1961 בשעה 11:05","StartDate":"1961-02-15T11:05:00+02:00","FinishDate":"1961-02-15T13:18:00+02:00","IsSpecialMeeting":null,"LastUpdatedDate":"2021-12-29T13:01:47.933+02:00"}
{"Id":490327,"Number":241,"KnessetNum":4,"Name":"ישיבת מליאה בתאריך 28/02/1961 בשעה 16:02","StartDate":"1961-02-28T16:02:00+02:00","FinishDate":"1961-02-28T19:01:00+02:00","IsSpecialMeeting":null,"LastUpdatedDate":"2023-08-02T15:38:22.42+03:00"}
{"Id":490328,"Number":246,"KnessetNum":4,"Name":"ישיבת מליאה בתאריך 07/03/1961 בשעה 16:04","StartDate":"1961-03-07T16:04:00+02:00","FinishDate":"1961-03-07T19:00:00+02:00","IsSpecialMeeting":null,"LastUpdatedDate":"2022-01-10T16:38:35.373+02:00"}
{"Id":490329,"Number":247,"KnessetNum":4,"Name":"ישיבת מליאה בתאריך 07/03/1961 בשעה 20:02","StartDate":"1961-03-07T20:02:00+02:00","FinishDate":"1961-03-07T22:45:00+02:00","IsSpecialMeeting":null,"LastUpdatedDate":"2022-01-10T16:50:56.367+02:00"}
{"Id":490330,"Number":251,"KnessetNum":4,"Name":"ישיבת מליאה בתאריך 14/03/1961 בשעה 16:02","StartDate":"1961-03-14T16:02:00+02:00","FinishDate":"1961-03-14T18:47:00+02:00","IsSpecialMeeting":null,"LastUpdatedDate":"2022-01-11T08:02:54.853+02:00"}
{"Id":490331,"Number":252,"KnessetNum":4,"Name":"ישיבת מליאה בתאריך 14/03/1961 בשעה 20:18","StartDate":"1961-03-14T20:18:00+02:00","FinishDate":"1961-03-14T20:50:00+02:00","IsSpecialMeeting":null,"LastUpdatedDate":"2022-01-11T08:11:50.523+02:00"}
{"Id":490332,"Number":254,"KnessetNum":4,"Name":"ישיבת מליאה בתאריך 20/03/1961 בשעה 16:02","StartDate":"1961-03-20T16:02:00+02:00","FinishDate":"1961-03-20T18:49:00+02:00","IsSpecialMeeting":null,"LastUpdatedDate":"2022-01-11T09:00:18.11+02:00"}
{"Id":490333,"Number":256,"KnessetNum":4,"Name":"ישיבת מליאה בתאריך 21/03/1961 בשעה 16:03","StartDate":"1961-03-21T16:03:00+02:00","FinishDate":"1961-03-21T19:17:00+02:00","IsSpecialMeeting":null,"LastUpdatedDate":"2022-01-11T09:39:58.09+02:00"}
{"Id":490334,"Number":258,"KnessetNum":4,"Name":"ישיבת מליאה בתאריך 22/03/1961 בשעה 16:05","StartDate":"1961-03-22T16:05:00+02:00","FinishDate":"1961-03-22T19:07:00+02:00","IsSpecialMeeting":null,"LastUpdatedDate":"2022-01-11T11:05:20.607+02:00"}
{"Id":490335,"Number":259,"KnessetNum":4,"Name":"ישיבת מליאה בתאריך 22/03/1961 בשעה 20:22","StartDate":"1961-03-22T20:22:00+02:00","FinishDate":"1961-03-22T21:57:00+02:00","IsSpecialMeeting":null,"LastUpdatedDate":"2022-01-11T11:17:46.143+02:00"}
{"Id":490336,"Number":261,"KnessetNum":4,"Name":"ישיבת מליאה בתאריך 23/03/1961 בשעה 14:00","StartDate":"1961-03-23T14:00:00+02:00","FinishDate":"1961-03-23T17:15:00+02:00","IsSpecialMeeting":null,"LastUpdatedDate":"2022-01-11T12:03:35.527+02:00"}
{"Id":490337,"Number":262,"KnessetNum":4,"Name":"ישיבת מליאה בתאריך 23/03/1961 בשעה 16:02","StartDate":"1961-03-23T16:02:00+02:00","FinishDate":"1961-03-23T19:18:00+02:00","IsSpecialMeeting":null,"LastUpdatedDate":"2022-01-11T12:22:03.297+02:00"}
{"Id":490338,"Number":271,"KnessetNum":4,"Name":"ישיבת מליאה בתאריך 15/05/1961 בשעה 20:00","StartDate":"1961-05-15T20:00:00+03:00","FinishDate":"1961-05-15T21:55:00+03:00","IsSpecialMeeting":null,"LastUpdatedDate":"2022-01-13T13:12:09.583+02:00"}
{"Id":490339,"Number":274,"KnessetNum":4,"Name":"ישיבת מליאה בתאריך 17/05/1961 בשעה 11:05","StartDate":"1961-05-17T11:05:00+03:00","FinishDate":"1961-05-17T13:35:00+03:00","IsSpecialMeeting":null,"LastUpdatedDate":"2022-01-16T08:31:43.827+02:00"}
{"Id":490340,"Number":280,"KnessetNum":4,"Name":"ישיבת מליאה בתאריך 30/05/1961 בשעה 20:08","StartDate":"1961-05-30T20:08:00+03:00","FinishDate":null,"IsSpecialMeeting":null,"LastUpdatedDate":"2023-07-17T13:58:45.62+03:00"}
{"Id":490341,"Number":292,"KnessetNum":4,"Name":"ישיבת מליאה בתאריך 03/07/1961 בשעה 11:05","StartDate":"1961-07-03T11:05:00+03:00","FinishDate":"1961-07-03T17:00:00+03:00","IsSpecialMeeting":null,"LastUpdatedDate":"2022-01-17T11:13:59.057+02:00"}
{"Id":490342,"Number":1,"KnessetNum":5,"Name":"ישיבת מליאה בתאריך 04/09/1961 בשעה 16:00","StartDate":"1961-09-04T16:00:00+03:00","FinishDate":"1961-09-04T16:57:00+03:00","IsSpecialMeeting":null,"LastUpdatedDate":"2022-01-17T11:51:26.927+02:00"}
{"Id":490343,"Number":2,"KnessetNum":5,"Name":"ישיבת מליאה בתאריך 04/09/1961 בשעה 19:45","StartDate":"1961-09-04T19:45:00+03:00","FinishDate":"1961-09-04T21:21:00+03:00","IsSpecialMeeting":null,"LastUpdatedDate":"2022-01-17T12:18:22.913+02:00"}
{"Id":490344,"Number":7,"KnessetNum":5,"Name":"ישיבת מליאה בתאריך 11/10/1961 בשעה 11:08","StartDate":"1961-10-11T11:08:00+02:00","FinishDate":"1961-10-11T12:15:00+02:00","IsSpecialMeeting":null,"LastUpdatedDate":"2022-01-17T14:14:24.267+02:00"}
{"Id":490345,"Number":9,"KnessetNum":5,"Name":"ישיבת מליאה בתאריך 16/10/1961 בשעה 20:03","StartDate":"1961-10-16T20:03:00+02:00","FinishDate":"1961-10-16T21:15:00+02:00","IsSpecialMeeting":null,"LastUpdatedDate":"2022-01-17T14:38:08.147+02:00"}
{"Id":490346,"Number":11,"KnessetNum":5,"Name":"ישיבת מליאה בתאריך 18/10/1961 בשעה 11:06","StartDate":"1961-10-18T11:06:00+02:00","FinishDate":"1961-10-18T12:45:00+02:00","IsSpecialMeeting":null,"LastUpdatedDate":"2022-01-17T15:17:38.69+02:00"}
{"Id":490347,"Number":13,"KnessetNum":5,"Name":"ישיבת מליאה בתאריך 23/10/1961 בשעה 20:05","StartDate":"1961-10-23T20:05:00+02:00","FinishDate":"1961-10-23T21:05:00+02:00","IsSpecialMeeting":null,"LastUpdatedDate":"2022-01-17T16:06:48.633+02:00"}
{"Id":490348,"Number":16,"KnessetNum":5,"Name":"ישיבת מליאה בתאריך 30/10/1961 בשעה 16:02","StartDate":"1961-10-30T16:02:00+02:00","FinishDate":"1961-10-30T16:40:00+02:00","IsSpecialMeeting":null,"LastUpdatedDate":"2022-01-17T16:51:34.677+02:00"}
{"Id":490349,"Number":17,"KnessetNum":5,"Name":"ישיבת מליאה בתאריך 31/10/1961 בשעה 16:02","StartDate":"1961-10-31T16:02:00+02:00","FinishDate":"1961-10-31T18:10:00+02:00","IsSpecialMeeting":null,"LastUpdatedDate":"2022-01-17T16:53:56.87+02:00"}
{"Id":490350,"Number":18,"KnessetNum":5,"Name":"ישיבת מליאה בתאריך 02/11/1961 בשעה 10:07","StartDate":"1961-11-02T10:07:00+02:00","FinishDate":"1961-11-02T13:00:00+02:00","IsSpecialMeeting":null,"LastUpdatedDate":"2022-01-17T17:02:51.563+02:00"}
{"Id":490351,"Number":19,"KnessetNum":5,"Name":"ישיבת מליאה בתאריך 02/11/1961 בשעה 15:01","StartDate":"1961-11-02T15:01:00+02:00","FinishDate":"1961-11-02T20:32:00+02:00","IsSpecialMeeting":null,"LastUpdatedDate":"2022-01-17T17:10:11.163+02:00"}
{"Id":490352,"Number":20,"KnessetNum":5,"Name":"ישיבת מליאה בתאריך 06/11/1961 בשעה 16:04","StartDate":"1961-11-06T16:04:00+02:00","FinishDate":"1961-11-06T19:00:00+02:00","IsSpecialMeeting":null,"LastUpdatedDate":"2022-01-17T17:24:14.397+02:00"}
{"Id":490353,"Number":21,"KnessetNum":5,"Name":"ישיבת מליאה בתאריך 06/11/1961 בשעה 20:02","StartDate":"1961-11-06T20:02:00+02:00","FinishDate":"1961-11-06T21:30:00+02:00","IsSpecialMeeting":null,"LastUpdatedDate":"2022-01-18T07:35:09.007+02:00"}
{"Id":490354,"Number":26,"KnessetNum":5,"Name":"ישיבת מליאה בתאריך 14/11/1961 בשעה 16:02","StartDate":"1961-11-14T16:02:00+02:00","FinishDate":"1961-11-14T18:52:00+02:00","IsSpecialMeeting":null,"LastUpdatedDate":"2022-01-18T08:44:53.5+02:00"}
{"Id":490355,"Number":28,"KnessetNum":5,"Name":"ישיבת מליאה בתאריך 15/11/1961 בשעה 11:02","StartDate":"1961-11-15T11:02:00+02:00","FinishDate":"1961-11-15T13:40:00+02:00","IsSpecialMeeting":null,"LastUpdatedDate":"2022-01-18T08:57:47.303+02:00"}
{"Id":490356,"Number":29,"KnessetNum":5,"Name":"ישיבת מליאה בתאריך 20/11/1961 בשעה 16:02","StartDate":"1961-11-20T16:02:00+02:00","FinishDate":"1961-11-20T19:28:00+02:00","IsSpecialMeeting":null,"LastUpdatedDate":"2022-01-18T11:05:45.567+02:00"}
{"Id":490357,"Number":31,"KnessetNum":5,"Name":"ישיבת מליאה בתאריך 21/11/1961 בשעה 16:02","StartDate":"1961-11-21T16:02:00+02:00","FinishDate":"1961-11-21T18:55:00+02:00","IsSpecialMeeting":null,"LastUpdatedDate":"2022-01-23T15:47:36.263+02:00"}
{"Id":490358,"Number":32,"KnessetNum":5,"Name":"ישיבת מליאה בתאריך 21/11/1961 בשעה 20:00","StartDate":"1961-11-21T20:00:00+02:00","FinishDate":"1961-11-21T21:40:00+02:00","IsSpecialMeeting":null,"LastUpdatedDate":"2022-01-23T15:56:56.05+02:00"}
{"Id":490359,"Number":33,"KnessetNum":5,"Name":"ישיבת מליאה בתאריך 22/11/1961 בשעה 11:00","StartDate":"1961-11-22T11:00:00+02:00","FinishDate":"1961-11-22T13:05:00+02:00","IsSpecialMeeting":null,"LastUpdatedDate":"2022-01-23T16:01:35.203+02:00"}
{"Id":490360,"Number":43,"KnessetNum":5,"Name":"ישיבת מליאה בתאריך 07/12/1961 בשעה 12:02","StartDate":"1961-12-07T12:02:00+02:00","FinishDate":"1961-12-07T12:10:00+02:00","IsSpecialMeeting":null,"LastUpdatedDate":"2022-01-18T16:25:14.277+02:00"}
{"Id":490361,"Number":46,"KnessetNum":5,"Name":"ישיבת מליאה בתאריך 12/12/1961 בשעה 16:04","StartDate":"1961-12-12T16:04:00+02:00","FinishDate":"1961-12-12T18:40:00+02:00","IsSpecialMeeting":null,"LastUpdatedDate":"2022-01-19T07:43:25.99+02:00"}
{"Id":490362,"Number":47,"KnessetNum":5,"Name":"ישיבת מליאה בתאריך 12/12/1961 בשעה 20:03","StartDate":"1961-12-12T20:03:00+02:00","FinishDate":"1961-12-12T21:37:00+02:00","IsSpecialMeeting":null,"LastUpdatedDate":"2022-01-19T08:22:52.2+02:00"}
{"Id":490363,"Number":48,"KnessetNum":5,"Name":"ישיבת מליאה בתאריך 13/12/1961 בשעה 11:07","StartDate":"1961-12-13T11:07:00+02:00","FinishDate":"1961-12-13T14:53:00+02:00","IsSpecialMeeting":null,"LastUpdatedDate":"2022-01-19T08:27:27.63+02:00"}
{"Id":490364,"Number":50,"KnessetNum":5,"Name":"ישיבת מליאה בתאריך 18/12/1961 בשעה 20:14","StartDate":"1961-12-18T20:14:00+02:00","FinishDate":"1961-12-18T22:05:00+02:00","IsSpecialMeeting":null,"LastUpdatedDate":"2022-01-19T10:09:59.893+02:00"}
{"Id":490365,"Number":53,"KnessetNum":5,"Name":"ישיבת מליאה בתאריך 20/12/1961 בשעה 11:02","StartDate":"1961-12-20T11:02:00+02:00","FinishDate":"1961-12-20T13:27:00+02:00","IsSpecialMeeting":null,"LastUpdatedDate":"2022-01-19T11:54:40.767+02:00"}
{"Id":490366,"Number":58,"KnessetNum":5,"Name":"ישיבת מליאה בתאריך 27/12/1961 בשעה 11:05","StartDate":"1961-12-27T11:05:00+02:00","FinishDate":"1961-12-27T13:00:00+02:00","IsSpecialMeeting":null,"LastUpdatedDate":"2022-01-20T09:11:49.523+02:00"}
{"Id":490367,"Number":60,"KnessetNum":5,"Name":"ישיבת מליאה בתאריך 01/01/1962 בשעה 19:03","StartDate":"1962-01-01T19:03:00+02:00","FinishDate":"1962-01-01T19:55:00+02:00","IsSpecialMeeting":null,"LastUpdatedDate":"2022-01-20T10:12:55.677+02:00"}
{"Id":490368,"Number":61,"KnessetNum":5,"Name":"ישיבת מליאה בתאריך 02/01/1962 בשעה 16:03","StartDate":"1962-01-02T16:03:00+02:00","FinishDate":"1962-01-02T19:49:00+02:00","IsSpecialMeeting":null,"LastUpdatedDate":"2022-01-20T10:27:34.35+02:00"}
{"Id":490369,"Number":62,"KnessetNum":5,"Name":"ישיבת מליאה בתאריך 02/01/1962 בשעה 20:02","StartDate":"1962-01-02T20:02:00+02:00","FinishDate":"1962-01-02T21:16:00+02:00","IsSpecialMeeting":null,"LastUpdatedDate":"2022-01-20T11:11:29.913+02:00"}
{"Id":490370,"Number":63,"KnessetNum":5,"Name":"ישיבת מליאה בתאריך 03/01/1962 בשעה 11:17","StartDate":"1962-01-03T11:17:00+02:00","FinishDate":"1962-01-03T13:00:00+02:00","IsSpecialMeeting":null,"LastUpdatedDate":"2022-01-20T11:24:25.963+02:00"}
{"Id":490371,"Number":66,"KnessetNum":5,"Name":"ישיבת מליאה בתאריך 09/01/1962 בשעה 16:03","StartDate":"1962-01-09T16:03:00+02:00","FinishDate":"1962-01-09T18:47:00+02:00","IsSpecialMeeting":null,"LastUpdatedDate":"2022-01-24T10:29:06.5+02:00"}
{"Id":490372,"Number":67,"KnessetNum":5,"Name":"ישיבת מליאה בתאריך 09/01/1962 בשעה 20:02","StartDate":"1962-01-09T20:02:00+02:00","FinishDate":"1962-01-09T21:07:00+02:00","IsSpecialMeeting":null,"LastUpdatedDate":"2022-01-24T10:30:18.95+02:00"}
{"Id":490373,"Number":68,"KnessetNum":5,"Name":"ישיבת מליאה בתאריך 10/01/1962 בשעה 11:06","StartDate":"1962-01-10T11:06:00+02:00","FinishDate":"1962-01-10T14:13:00+02:00","IsSpecialMeeting":null,"LastUpdatedDate":"2022-01-24T10:37:19.58+02:00"}
{"Id":490374,"Number":70,"KnessetNum":5,"Name":"ישיבת מליאה בתאריך 15/01/1962 בשעה 20:00","StartDate":"1962-01-15T20:00:00+02:00","FinishDate":"1962-01-15T21:23:00+02:00","IsSpecialMeeting":null,"LastUpdatedDate":"2022-01-24T11:57:53.843+02:00"}
{"Id":490375,"Number":73,"KnessetNum":5,"Name":"ישיבת מליאה בתאריך 17/01/1962 בשעה 11:04","StartDate":"1962-01-17T11:04:00+02:00","FinishDate":"1962-01-17T11:32:00+02:00","IsSpecialMeeting":null,"LastUpdatedDate":"2022-01-24T14:22:25.407+02:00"}
{"Id":490376,"Number":74,"KnessetNum":5,"Name":"ישיבת מליאה בתאריך 22/01/1962 בשעה 16:05","StartDate":"1962-01-22T16:05:00+02:00","FinishDate":"1962-01-22T18:30:00+02:00","IsSpecialMeeting":null,"LastUpdatedDate":"2022-01-24T14:25:43.557+02:00"}
{"Id":490377,"Number":75,"KnessetNum":5,"Name":"ישיבת מליאה בתאריך 23/01/1962 בשעה 16:01","StartDate":"1962-01-23T16:01:00+02:00","FinishDate":"1962-01-23T19:40:00+02:00","IsSpecialMeeting":null,"LastUpdatedDate":"2022-01-24T15:39:40.85+02:00"}
{"Id":490378,"Number":78,"KnessetNum":5,"Name":"ישיבת מליאה בתאריך 29/01/1962 בשעה 16:01","StartDate":"1962-01-29T16:01:00+02:00","FinishDate":"1962-01-29T18:55:00+02:00","IsSpecialMeeting":null,"LastUpdatedDate":"2022-01-24T16:35:32.84+02:00"}
{"Id":490379,"Number":80,"KnessetNum":5,"Name":"ישיבת מליאה בתאריך 30/01/1962 בשעה 16:05","StartDate":"1962-01-30T16:05:00+02:00","FinishDate":"1962-01-30T17:15:00+02:00","IsSpecialMeeting":null,"LastUpdatedDate":"2022-01-25T11:14:12.86+02:00"}
{"Id":490380,"Number":81,"KnessetNum":5,"Name":"ישיבת מליאה בתאריך 30/01/1962 בשעה 17:15","StartDate":"1962-01-30T17:15:00+02:00","FinishDate":"1962-01-30T18:37:00+02:00","IsSpecialMeeting":null,"LastUpdatedDate":"2022-01-25T12:11:09.543+02:00"}
{"Id":490381,"Number":83,"KnessetNum":5,"Name":"ישיבת מליאה בתאריך 31/01/1962 בשעה 11:02","StartDate":"1962-01-31T11:02:00+02:00","FinishDate":"1962-01-31T14:02:00+02:00","IsSpecialMeeting":null,"LastUpdatedDate":"2022-01-25T13:29:45.513+02:00"}
{"Id":490382,"Number":86,"KnessetNum":5,"Name":"ישיבת מליאה בתאריך 06/02/1962 בשעה 16:05","StartDate":"1962-02-06T16:05:00+02:00","FinishDate":"1962-02-06T19:03:00+02:00","IsSpecialMeeting":null,"LastUpdatedDate":"2022-01-25T16:00:24.687+02:00"}
{"Id":490383,"Number":89,"KnessetNum":5,"Name":"ישיבת מליאה בתאריך 12/02/1962 בשעה 16:00","StartDate":"1962-02-12T16:00:00+02:00","FinishDate":"1962-02-12T18:53:00+02:00","IsSpecialMeeting":null,"LastUpdatedDate":"2022-01-26T07:56:04.167+02:00"}
{"Id":490384,"Number":90,"KnessetNum":5,"Name":"ישיבת מליאה בתאריך 12/02/1962 בשעה 20:00","StartDate":"1962-02-12T20:00:00+02:00","FinishDate":"1962-02-12T21:31:00+02:00","IsSpecialMeeting":null,"LastUpdatedDate":"2021-06-08T11:28:50.41+03:00"}
{"Id":490385,"Number":91,"KnessetNum":5,"Name":"ישיבת מליאה בתאריך 13/02/1962 בשעה 16:00","StartDate":"1962-02-13T16:00:00+02:00","FinishDate":"1962-02-13T19:13:00+02:00","IsSpecialMeeting":null,"LastUpdatedDate":"2022-01-26T11:01:09.813+02:00"}
{"Id":490386,"Number":92,"KnessetNum":5,"Name":"ישיבת מליאה בתאריך 13/02/1962 בשעה 20:16","StartDate":"1962-02-13T20:16:00+02:00","FinishDate":"1962-02-13T21:20:00+02:00","IsSpecialMeeting":null,"LastUpdatedDate":"2022-01-26T11:27:45.17+02:00"}
{"Id":490387,"Number":94,"KnessetNum":5,"Name":"ישיבת מליאה בתאריך 19/02/1962 בשעה 16:05","StartDate":"1962-02-19T16:05:00+02:00","FinishDate":"1962-02-19T18:53:00+02:00","IsSpecialMeeting":null,"LastUpdatedDate":"2022-01-30T07:34:22.317+02:00"}
{"Id":490388,"Number":98,"KnessetNum":5,"Name":"ישיבת מליאה בתאריך 21/02/1962 בשעה 11:05","StartDate":"1962-02-21T11:05:00+02:00","FinishDate":"1962-02-21T13:45:00+02:00","IsSpecialMeeting":null,"LastUpdatedDate":"2022-01-30T08:34:43.673+02:00"}
{"Id":490389,"Number":100,"KnessetNum":5,"Name":"ישיבת מליאה בתאריך 26/02/1962 בשעה 19:57","StartDate":"1962-02-26T19:57:00+02:00","FinishDate":"1962-02-26T21:10:00+02:00","IsSpecialMeeting":null,"LastUpdatedDate":"2022-01-30T09:12:56.857+02:00"}
{"Id":490390,"Number":99,"KnessetNum":5,"Name":"ישיבת מליאה בתאריך 26/02/1962 בשעה 16:02","StartDate":"1962-02-26T16:02:00+02:00","FinishDate":"1962-02-26T18:57:00+02:00","IsSpecialMeeting":null,"LastUpdatedDate":"2022-01-30T08:43:34.933+02:00"}
{"Id":490391,"Number":108,"KnessetNum":5,"Name":"ישיבת מליאה בתאריך 07/03/1962 בשעה 11:00","StartDate":"1962-03-07T11:00:00+02:00","FinishDate":"1962-03-07T13:55:00+02:00","IsSpecialMeeting":null,"LastUpdatedDate":"2022-01-30T11:51:49.27+02:00"}
{"Id":490392,"Number":110,"KnessetNum":5,"Name":"ישיבת מליאה בתאריך 12/03/1962 בשעה 20:00","StartDate":"1962-03-12T20:00:00+02:00","FinishDate":"1962-03-12T22:07:00+02:00","IsSpecialMeeting":null,"LastUpdatedDate":"2022-01-30T13:01:30.093+02:00"}
{"Id":490393,"Number":111,"KnessetNum":5,"Name":"ישיבת מליאה בתאריך 13/03/1962 בשעה 16:02","StartDate":"1962-03-13T16:02:00+02:00","FinishDate":"1962-03-13T19:12:00+02:00","IsSpecialMeeting":null,"LastUpdatedDate":"2022-01-30T13:28:58.347+02:00"}
{"Id":490394,"Number":112,"KnessetNum":5,"Name":"ישיבת מליאה בתאריך 13/03/1962 בשעה 20:05","StartDate":"1962-03-13T20:05:00+02:00","FinishDate":"1962-03-13T21:50:00+02:00","IsSpecialMeeting":null,"LastUpdatedDate":"2022-01-31T07:14:11.067+02:00"}
{"Id":490395,"Number":113,"KnessetNum":5,"Name":"ישיבת מליאה בתאריך 14/03/1962 בשעה 11:03","StartDate":"1962-03-14T11:03:00+02:00","FinishDate":"1962-03-14T13:15:00+02:00","IsSpecialMeeting":null,"LastUpdatedDate":"2022-01-31T07:17:53.683+02:00"}
{"Id":490396,"Number":114,"KnessetNum":5,"Name":"ישיבת מליאה בתאריך 19/03/1962 בשעה 11:07","StartDate":"1962-03-19T11:07:00+02:00","FinishDate":"1962-03-19T14:56:00+02:00","IsSpecialMeeting":null,"LastUpdatedDate":"2022-01-31T12:13:07.633+02:00"}
{"Id":490397,"Number":121,"KnessetNum":5,"Name":"ישיבת מליאה בתאריך 03/04/1962 בשעה 16:03","StartDate":"1962-04-03T16:03:00+02:00","FinishDate":"1962-04-03T19:10:00+02:00","IsSpecialMeeting":null,"LastUpdatedDate":"2022-01-31T17:33:16.977+02:00"}
{"Id":490398,"Number":122,"KnessetNum":5,"Name":"ישיבת מליאה בתאריך 03/04/1962 בשעה 20:03","StartDate":"1962-04-03T20:03:00+02:00","FinishDate":"1962-04-03T22:00:00+02:00","IsSpecialMeeting":null,"LastUpdatedDate":"2022-02-01T07:45:19.803+02:00"}
{"Id":490399,"Number":123,"KnessetNum":5,"Name":"ישיבת מליאה בתאריך 04/04/1962 בשעה 11:00","StartDate":"1962-04-04T11:00:00+03:00","FinishDate":"1962-04-04T13:17:00+03:00","IsSpecialMeeting":null,"LastUpdatedDate":"2022-02-01T08:08:56.257+02:00"}
{"Id":490400,"Number":126,"KnessetNum":5,"Name":"ישיבת מליאה בתאריך 10/04/1962 בשעה 16:03","StartDate":"1962-04-10T16:03:00+03:00","FinishDate":"1962-04-10T22:08:00+03:00","IsSpecialMeeting":null,"LastUpdatedDate":"2022-02-01T11:51:09.507+02:00"}
{"Id":490401,"Number":131,"KnessetNum":5,"Name":"ישיבת מליאה בתאריך 21/05/1962 בשעה 16:00","StartDate":"1962-05-21T16:00:00+03:00","FinishDate":"1962-05-21T21:01:00+03:00","IsSpecialMeeting":null,"LastUpdatedDate":"2022-02-01T17:20:12.847+02:00"}
{"Id":490402,"Number":133,"KnessetNum":5,"Name":"ישיבת מליאה בתאריך 23/05/1962 בשעה 11:05","StartDate":"1962-05-23T11:05:00+03:00","FinishDate":"1962-05-23T13:20:00+03:00","IsSpecialMeeting":null,"LastUpdatedDate":"2022-02-02T07:51:15.133+02:00"}
{"Id":490403,"Number":134,"KnessetNum":5,"Name":"ישיבת מליאה בתאריך 28/05/1962 בשעה 16:01","StartDate":"1962-05-28T16:01:00+03:00","FinishDate":"1962-05-28T20:15:00+03:00","IsSpecialMeeting":null,"LastUpdatedDate":"2022-02-02T08:19:13.88+02:00"}
{"Id":490404,"Number":138,"KnessetNum":5,"Name":"ישיבת מליאה בתאריך 05/06/1962 בשעה 16:02","StartDate":"1962-06-05T16:02:00+03:00","FinishDate":"1962-06-05T21:02:00+03:00","IsSpecialMeeting":null,"LastUpdatedDate":"2022-02-02T10:52:26.943+02:00"}
{"Id":490405,"Number":139,"KnessetNum":5,"Name":"ישיבת מליאה בתאריך 06/06/1962 בשעה 11:03","StartDate":"1962-06-06T11:03:00+03:00","FinishDate":"1962-06-06T15:15:00+03:00","IsSpecialMeeting":null,"LastUpdatedDate":"2022-02-02T11:06:19.67+02:00"}
{"Id":490406,"Number":141,"KnessetNum":5,"Name":"ישיבת מליאה בתאריך 12/06/1962 בשעה 15:05","StartDate":"1962-06-12T15:05:00+03:00","FinishDate":"1962-06-12T21:40:00+03:00","IsSpecialMeeting":null,"LastUpdatedDate":"2022-02-02T12:21:43.203+02:00"}
{"Id":490407,"Number":142,"KnessetNum":5,"Name":"ישיבת מליאה בתאריך 13/06/1962 בשעה 12:03","StartDate":"1962-06-13T12:03:00+03:00","FinishDate":"1962-06-13T14:52:00+03:00","IsSpecialMeeting":null,"LastUpdatedDate":"2022-02-02T12:52:37.093+02:00"}
{"Id":490408,"Number":145,"KnessetNum":5,"Name":"ישיבת מליאה בתאריך 20/06/1962 בשעה 12:05","StartDate":"1962-06-20T12:05:00+03:00","FinishDate":"1962-06-20T15:43:00+03:00","IsSpecialMeeting":null,"LastUpdatedDate":"2022-02-03T08:09:38.973+02:00"}
{"Id":490409,"Number":147,"KnessetNum":5,"Name":"ישיבת מליאה בתאריך 26/06/1962 בשעה 15:03","StartDate":"1962-06-26T15:03:00+03:00","FinishDate":"1962-06-26T20:40:00+03:00","IsSpecialMeeting":null,"LastUpdatedDate":"2022-02-03T09:09:41.62+02:00"}
{"Id":490410,"Number":148,"KnessetNum":5,"Name":"ישיבת מליאה בתאריך 27/06/1962 בשעה 12:05","StartDate":"1962-06-27T12:05:00+03:00","FinishDate":"1962-06-27T15:12:00+03:00","IsSpecialMeeting":null,"LastUpdatedDate":"2024-01-08T16:27:54.833+02:00"}
{"Id":490411,"Number":149,"KnessetNum":5,"Name":"ישיבת מליאה בתאריך 02/07/1962 בשעה 16:01","StartDate":"1962-07-02T16:01:00+03:00","FinishDate":"1962-07-02T21:03:00+03:00","IsSpecialMeeting":null,"LastUpdatedDate":"2022-02-03T09:45:45.48+02:00"}
{"Id":490412,"Number":150,"KnessetNum":5,"Name":"ישיבת מליאה בתאריך 03/07/1962 בשעה 15:02","StartDate":"1962-07-03T15:02:00+03:00","FinishDate":"1962-07-03T20:45:00+03:00","IsSpecialMeeting":null,"LastUpdatedDate":"2022-02-03T10:36:02.997+02:00"}
{"Id":490413,"Number":151,"KnessetNum":5,"Name":"ישיבת מליאה בתאריך 04/07/1962 בשעה 15:00","StartDate":"1962-07-04T15:00:00+03:00","FinishDate":"1962-07-04T21:01:00+03:00","IsSpecialMeeting":null,"LastUpdatedDate":"2024-02-22T14:47:04.547+02:00"}
{"Id":490414,"Number":153,"KnessetNum":5,"Name":"ישיבת מליאה בתאריך 09/07/1962 בשעה 16:07","StartDate":"1962-07-09T16:07:00+03:00","FinishDate":"1962-07-09T21:03:00+03:00","IsSpecialMeeting":null,"LastUpdatedDate":"2022-02-03T11:46:32.843+02:00"}
{"Id":490415,"Number":155,"KnessetNum":5,"Name":"ישיבת מליאה בתאריך 11/07/1962 בשעה 17:32","StartDate":"1962-07-11T17:32:00+03:00","FinishDate":"1962-07-11T20:12:00+03:00","IsSpecialMeeting":null,"LastUpdatedDate":"2022-02-06T07:37:17.87+02:00"}
{"Id":490416,"Number":158,"KnessetNum":5,"Name":"ישיבת מליאה בתאריך 17/07/1962 בשעה 15:04","StartDate":"1962-07-17T15:04:00+03:00","FinishDate":"1962-07-17T21:02:00+03:00","IsSpecialMeeting":null,"LastUpdatedDate":"2022-02-07T08:11:45.667+02:00"}
{"Id":490417,"Number":159,"KnessetNum":5,"Name":"ישיבת מליאה בתאריך 18/07/1962 בשעה 15:05","StartDate":"1962-07-18T15:05:00+03:00","FinishDate":"1962-07-18T20:20:00+03:00","IsSpecialMeeting":null,"LastUpdatedDate":"2022-02-07T08:29:20.457+02:00"}
{"Id":490418,"Number":160,"KnessetNum":5,"Name":"ישיבת מליאה בתאריך 19/07/1962 בשעה 12:00","StartDate":"1962-07-19T12:00:00+03:00","FinishDate":"1962-07-19T14:56:00+03:00","IsSpecialMeeting":null,"LastUpdatedDate":"2022-02-07T09:48:33.55+02:00"}
{"Id":490419,"Number":162,"KnessetNum":5,"Name":"ישיבת מליאה בתאריך 24/07/1962 בשעה 15:01","StartDate":"1962-07-24T15:01:00+03:00","FinishDate":"1962-07-24T21:02:00+03:00","IsSpecialMeeting":null,"LastUpdatedDate":"2022-02-07T10:55:26.077+02:00"}
{"Id":490420,"Number":163,"KnessetNum":5,"Name":"ישיבת מליאה בתאריך 25/07/1962 בשעה 15:00","StartDate":"1962-07-25T15:00:00+03:00","FinishDate":"1962-07-25T21:08:00+03:00","IsSpecialMeeting":null,"LastUpdatedDate":"2022-02-07T11:08:04.713+02:00"}
{"Id":490421,"Number":166,"KnessetNum":5,"Name":"ישיבת מליאה בתאריך 31/07/1962 בשעה 21:30","StartDate":"1962-07-31T21:30:00+03:00","FinishDate":"1962-08-01T01:42:00+03:00","IsSpecialMeeting":null,"LastUpdatedDate":"2022-02-06T07:46:55.823+02:00"}
{"Id":490422,"Number":167,"KnessetNum":5,"Name":"ישיבת מליאה בתאריך 01/08/1962 בשעה 16:00","StartDate":"1962-08-01T16:00:00+03:00","FinishDate":"1962-08-01T23:10:00+03:00","IsSpecialMeeting":null,"LastUpdatedDate":"2022-02-06T08:25:38.89+02:00"}
{"Id":490423,"Number":168,"KnessetNum":5,"Name":"ישיבת מליאה בתאריך 06/08/1962 בשעה 16:04","StartDate":"1962-08-06T16:04:00+03:00","FinishDate":"1962-08-06T20:10:00+03:00","IsSpecialMeeting":null,"LastUpdatedDate":"2022-02-06T08:52:43.813+02:00"}
{"Id":490424,"Number":172,"KnessetNum":5,"Name":"ישיבת מליאה בתאריך 30/10/1962 בשעה 16:01","StartDate":"1962-10-30T16:01:00+02:00","FinishDate":"1962-10-30T16:52:00+02:00","IsSpecialMeeting":null,"LastUpdatedDate":"2022-02-06T14:20:47.303+02:00"}
{"Id":490425,"Number":173,"KnessetNum":5,"Name":"ישיבת מליאה בתאריך 31/10/1962 בשעה 11:00","StartDate":"1962-10-31T11:00:00+02:00","FinishDate":"1962-10-31T11:17:00+02:00","IsSpecialMeeting":null,"LastUpdatedDate":"2022-02-06T14:22:23.883+02:00"}
{"Id":490426,"Number":174,"KnessetNum":5,"Name":"ישיבת מליאה בתאריך 05/11/1962 בשעה 16:17","StartDate":"1962-11-05T16:17:00+02:00","FinishDate":"1962-11-05T16:55:00+02:00","IsSpecialMeeting":null,"LastUpdatedDate":"2022-02-07T14:08:39.517+02:00"}
{"Id":490427,"Number":176,"KnessetNum":5,"Name":"ישיבת מליאה בתאריך 06/11/1962 בשעה 16:00","StartDate":"1962-11-06T16:00:00+02:00","FinishDate":"1962-11-06T20:40:00+02:00","IsSpecialMeeting":null,"LastUpdatedDate":"2022-02-07T14:23:34.27+02:00"}
{"Id":490428,"Number":177,"KnessetNum":5,"Name":"ישיבת מליאה בתאריך 07/11/1962 בשעה 11:03","StartDate":"1962-11-07T11:03:00+02:00","FinishDate":"1962-11-07T13:16:00+02:00","IsSpecialMeeting":null,"LastUpdatedDate":"2022-02-07T14:32:26.693+02:00"}
{"Id":490429,"Number":178,"KnessetNum":5,"Name":"ישיבת מליאה בתאריך 12/11/1962 בשעה 16:05","StartDate":"1962-11-12T16:05:00+02:00","FinishDate":"1962-11-12T20:30:00+02:00","IsSpecialMeeting":null,"LastUpdatedDate":"2022-02-07T14:56:01.65+02:00"}
{"Id":490430,"Number":179,"KnessetNum":5,"Name":"ישיבת מליאה בתאריך 13/11/1962 בשעה 17:00","StartDate":"1962-11-13T17:00:00+02:00","FinishDate":"1962-11-13T21:50:00+02:00","IsSpecialMeeting":null,"LastUpdatedDate":"2022-02-07T15:37:44.993+02:00"}
{"Id":490431,"Number":183,"KnessetNum":5,"Name":"ישיבת מליאה בתאריך 21/11/1962 בשעה 10:03","StartDate":"1962-11-21T10:03:00+02:00","FinishDate":"1962-11-21T12:30:00+02:00","IsSpecialMeeting":null,"LastUpdatedDate":"2022-02-07T16:54:20.823+02:00"}
{"Id":490432,"Number":184,"KnessetNum":5,"Name":"ישיבת מליאה בתאריך 26/11/1962 בשעה 11:01","StartDate":"1962-11-26T11:01:00+02:00","FinishDate":"1962-11-26T20:46:00+02:00","IsSpecialMeeting":null,"LastUpdatedDate":"2022-02-07T17:05:17.73+02:00"}
{"Id":490433,"Number":188,"KnessetNum":5,"Name":"ישיבת מליאה בתאריך 04/12/1962 בשעה 16:00","StartDate":"1962-12-04T16:00:00+02:00","FinishDate":"1962-12-04T18:31:00+02:00","IsSpecialMeeting":null,"LastUpdatedDate":"2022-02-08T13:51:38.183+02:00"}
{"Id":490434,"Number":189,"KnessetNum":5,"Name":"ישיבת מליאה בתאריך 05/12/1962 בשעה 11:06","StartDate":"1962-12-05T11:06:00+02:00","FinishDate":"1962-12-05T13:50:00+02:00","IsSpecialMeeting":null,"LastUpdatedDate":"2022-02-08T14:06:45.64+02:00"}
{"Id":490435,"Number":191,"KnessetNum":5,"Name":"ישיבת מליאה בתאריך 11/12/1962 בשעה 16:10","StartDate":"1962-12-11T16:10:00+02:00","FinishDate":"1962-12-11T20:56:00+02:00","IsSpecialMeeting":null,"LastUpdatedDate":"2022-02-08T15:13:10.823+02:00"}
{"Id":490436,"Number":195,"KnessetNum":5,"Name":"ישיבת מליאה בתאריך 19/12/1962 בשעה 11:02","StartDate":"1962-12-19T11:02:00+02:00","FinishDate":"1962-12-19T13:54:00+02:00","IsSpecialMeeting":null,"LastUpdatedDate":"2022-02-09T08:09:17.127+02:00"}
{"Id":490437,"Number":200,"KnessetNum":5,"Name":"ישיבת מליאה בתאריך 01/01/1963 בשעה 16:03","StartDate":"1963-01-01T16:03:00+02:00","FinishDate":"1963-01-01T21:00:00+02:00","IsSpecialMeeting":null,"LastUpdatedDate":"2022-02-09T11:41:52.383+02:00"}
{"Id":490438,"Number":201,"KnessetNum":5,"Name":"ישיבת מליאה בתאריך 02/01/1963 בשעה 11:04","StartDate":"1963-01-02T11:04:00+02:00","FinishDate":"1963-01-02T14:05:00+02:00","IsSpecialMeeting":null,"LastUpdatedDate":"2022-02-09T12:28:34.297+02:00"}
{"Id":490439,"Number":207,"KnessetNum":5,"Name":"ישיבת מליאה בתאריך 16/01/1963 בשעה 11:01","StartDate":"1963-01-16T11:01:00+02:00","FinishDate":"1963-01-16T13:35:00+02:00","IsSpecialMeeting":null,"LastUpdatedDate":"2022-02-10T08:32:32.28+02:00"}
{"Id":490440,"Number":213,"KnessetNum":5,"Name":"ישיבת מליאה בתאריך 30/01/1963 בשעה 11:02","StartDate":"1963-01-30T11:02:00+02:00","FinishDate":"1963-01-30T14:20:00+02:00","IsSpecialMeeting":null,"LastUpdatedDate":"2022-02-10T12:17:25.037+02:00"}
{"Id":490441,"Number":214,"KnessetNum":5,"Name":"ישיבת מליאה בתאריך 04/02/1963 בשעה 16:03","StartDate":"1963-02-04T16:03:00+02:00","FinishDate":"1963-02-04T20:22:00+02:00","IsSpecialMeeting":null,"LastUpdatedDate":"2022-02-10T12:31:46.52+02:00"}
{"Id":490442,"Number":218,"KnessetNum":5,"Name":"ישיבת מליאה בתאריך 12/02/1963 בשעה 16:00","StartDate":"1963-02-12T16:00:00+02:00","FinishDate":"1963-02-12T20:50:00+02:00","IsSpecialMeeting":null,"LastUpdatedDate":"2022-02-13T07:58:20.293+02:00"}
{"Id":490443,"Number":219,"KnessetNum":5,"Name":"ישיבת מליאה בתאריך 13/02/1963 בשעה 11:03","StartDate":"1963-02-13T11:03:00+02:00","FinishDate":"1963-02-13T14:20:00+02:00","IsSpecialMeeting":null,"LastUpdatedDate":"2022-02-13T08:20:51.08+02:00"}
{"Id":490444,"Number":220,"KnessetNum":5,"Name":"ישיבת מליאה בתאריך 18/02/1963 בשעה 16:03","StartDate":"1963-02-18T16:03:00+02:00","FinishDate":"1963-02-18T21:20:00+02:00","IsSpecialMeeting":null,"LastUpdatedDate":"2022-02-13T09:34:25.637+02:00"}
{"Id":490445,"Number":225,"KnessetNum":5,"Name":"ישיבת מליאה בתאריך 27/02/1963 בשעה 11:00","StartDate":"1963-02-27T11:00:00+02:00","FinishDate":"1963-02-27T13:45:00+02:00","IsSpecialMeeting":null,"LastUpdatedDate":"2022-02-14T07:42:59.69+02:00"}
{"Id":490446,"Number":226,"KnessetNum":5,"Name":"ישיבת מליאה בתאריך 04/03/1963 בשעה 16:00","StartDate":"1963-03-04T16:00:00+02:00","FinishDate":"1963-03-04T21:13:00+02:00","IsSpecialMeeting":null,"LastUpdatedDate":"2022-02-14T08:17:30.74+02:00"}
{"Id":490447,"Number":230,"KnessetNum":5,"Name":"ישיבת מליאה בתאריך 13/03/1963 בשעה 16:06","StartDate":"1963-03-13T16:06:00+02:00","FinishDate":"1963-03-13T22:40:00+02:00","IsSpecialMeeting":null,"LastUpdatedDate":"2022-02-14T11:41:44.437+02:00"}
{"Id":490448,"Number":232,"KnessetNum":5,"Name":"ישיבת מליאה בתאריך 18/03/1963 בשעה 16:00","StartDate":"1963-03-18T16:00:00+02:00","FinishDate":"1963-03-18T20:05:00+02:00","IsSpecialMeeting":null,"LastUpdatedDate":"2022-02-14T13:16:15.46+02:00"}
{"Id":490449,"Number":233,"KnessetNum":5,"Name":"ישיבת מליאה בתאריך 19/03/1963 בשעה 16:02","StartDate":"1963-03-19T16:02:00+02:00","FinishDate":"1963-03-19T22:05:00+02:00","IsSpecialMeeting":null,"LastUpdatedDate":"2022-02-14T13:25:10.86+02:00"}
{"Id":490450,"Number":235,"KnessetNum":5,"Name":"ישיבת מליאה בתאריך 21/03/1963 בשעה 11:06","StartDate":"1963-03-21T11:06:00+02:00","FinishDate":"1963-03-21T13:37:00+02:00","IsSpecialMeeting":null,"LastUpdatedDate":"2022-02-14T14:15:48.847+02:00"}
{"Id":490451,"Number":237,"KnessetNum":5,"Name":"ישיבת מליאה בתאריך 26/03/1963 בשעה 16:04","StartDate":"1963-03-26T16:04:00+02:00","FinishDate":"1963-03-26T20:50:00+02:00","IsSpecialMeeting":null,"LastUpdatedDate":"2022-02-14T15:58:25.557+02:00"}
{"Id":490452,"Number":240,"KnessetNum":5,"Name":"ישיבת מליאה בתאריך 07/04/1963 בשעה 15:04","StartDate":"1963-04-07T15:04:00+03:00","FinishDate":"1963-04-07T17:02:00+03:00","IsSpecialMeeting":null,"LastUpdatedDate":"2022-02-15T12:01:05.633+02:00"}
{"Id":490453,"Number":241,"KnessetNum":5,"Name":"ישיבת מליאה בתאריך 21/04/1963 בשעה 11:30","StartDate":"1963-04-21T11:30:00+03:00","FinishDate":"1963-04-21T12:00:00+03:00","IsSpecialMeeting":null,"LastUpdatedDate":"2025-01-22T11:55:55.91+02:00"}
{"Id":490454,"Number":242,"KnessetNum":5,"Name":"ישיבת מליאה בתאריך 30/04/1963 בשעה 15:00","StartDate":"1963-04-30T15:00:00+03:00","FinishDate":"1963-04-30T16:25:00+03:00","IsSpecialMeeting":null,"LastUpdatedDate":"2022-02-15T12:20:53.93+02:00"}
{"Id":490455,"Number":243,"KnessetNum":5,"Name":"ישיבת מליאה בתאריך 06/05/1963 בשעה 16:01","StartDate":"1963-05-06T16:01:00+03:00","FinishDate":"1963-05-06T20:00:00+03:00","IsSpecialMeeting":null,"LastUpdatedDate":"2022-02-15T12:26:56.6+02:00"}
{"Id":490456,"Number":245,"KnessetNum":5,"Name":"ישיבת מליאה בתאריך 08/05/1963 בשעה 11:07","StartDate":"1963-05-08T11:07:00+03:00","FinishDate":"1963-05-08T12:33:00+03:00","IsSpecialMeeting":null,"LastUpdatedDate":"2022-02-15T13:40:01.363+02:00"}
{"Id":490457,"Number":246,"KnessetNum":5,"Name":"ישיבת מליאה בתאריך 13/05/1963 בשעה 16:00","StartDate":"1963-05-13T16:00:00+03:00","FinishDate":"1963-05-13T20:05:00+03:00","IsSpecialMeeting":null,"LastUpdatedDate":"2022-02-15T13:50:01.69+02:00"}
{"Id":490458,"Number":248,"KnessetNum":5,"Name":"ישיבת מליאה בתאריך 15/05/1963 בשעה 11:06","StartDate":"1963-05-15T11:06:00+03:00","FinishDate":"1963-05-15T13:47:00+03:00","IsSpecialMeeting":null,"LastUpdatedDate":"2022-02-15T14:59:50.927+02:00"}
{"Id":490459,"Number":249,"KnessetNum":5,"Name":"ישיבת מליאה בתאריך 20/05/1963 בשעה 16:10","StartDate":"1963-05-20T16:10:00+03:00","FinishDate":"1963-05-20T20:00:00+03:00","IsSpecialMeeting":null,"LastUpdatedDate":"2022-02-15T15:29:28.15+02:00"}
{"Id":490460,"Number":250,"KnessetNum":5,"Name":"ישיבת מליאה בתאריך 21/05/1963 בשעה 16:00","StartDate":"1963-05-21T16:00:00+03:00","FinishDate":"1963-05-21T16:40:00+03:00","IsSpecialMeeting":null,"LastUpdatedDate":"2022-02-15T15:38:04.337+02:00"}
{"Id":490461,"Number":251,"KnessetNum":5,"Name":"ישיבת מליאה בתאריך 22/05/1963 בשעה 11:00","StartDate":"1963-05-22T11:00:00+03:00","FinishDate":"1963-05-22T11:15:00+03:00","IsSpecialMeeting":null,"LastUpdatedDate":"2022-02-15T15:54:35.23+02:00"}
{"Id":490462,"Number":258,"KnessetNum":5,"Name":"ישיבת מליאה בתאריך 12/06/1963 בשעה 11:02","StartDate":"1963-06-12T11:02:00+03:00","FinishDate":"1963-06-12T13:20:00+03:00","IsSpecialMeeting":null,"LastUpdatedDate":"2022-02-16T10:07:06.163+02:00"}
{"Id":490463,"Number":262,"KnessetNum":5,"Name":"ישיבת מליאה בתאריך 24/06/1963 בשעה 16:00","StartDate":"1963-06-24T16:00:00+03:00","FinishDate":"1963-06-24T21:20:00+03:00","IsSpecialMeeting":null,"LastUpdatedDate":"2022-02-16T12:14:56.383+02:00"}
{"Id":490464,"Number":264,"KnessetNum":5,"Name":"ישיבת מליאה בתאריך 26/06/1963 בשעה 11:05","StartDate":"1963-06-26T11:05:00+03:00","FinishDate":"1963-06-26T12:15:00+03:00","IsSpecialMeeting":null,"LastUpdatedDate":"2022-02-16T14:09:59.227+02:00"}
{"Id":490465,"Number":267,"KnessetNum":5,"Name":"ישיבת מליאה בתאריך 03/07/1963 בשעה 11:02","StartDate":"1963-07-03T11:02:00+03:00","FinishDate":"1963-07-03T14:03:00+03:00","IsSpecialMeeting":null,"LastUpdatedDate":"2022-02-17T09:11:01.41+02:00"}
{"Id":490466,"Number":273,"KnessetNum":5,"Name":"ישיבת מליאה בתאריך 17/07/1963 בשעה 11:00","StartDate":"1963-07-17T11:00:00+03:00","FinishDate":"1963-07-17T13:20:00+03:00","IsSpecialMeeting":null,"LastUpdatedDate":"2022-02-20T07:37:42.05+02:00"}
{"Id":490467,"Number":275,"KnessetNum":5,"Name":"ישיבת מליאה בתאריך 23/07/1963 בשעה 16:03","StartDate":"1963-07-23T16:03:00+03:00","FinishDate":"1963-07-23T21:20:00+03:00","IsSpecialMeeting":null,"LastUpdatedDate":"2022-02-20T09:15:07.5+02:00"}
{"Id":490468,"Number":283,"KnessetNum":5,"Name":"ישיבת מליאה בתאריך 21/10/1963 בשעה 16:02","StartDate":"1963-10-21T16:02:00+02:00","FinishDate":"1963-10-21T19:59:00+02:00","IsSpecialMeeting":null,"LastUpdatedDate":"2022-02-22T11:50:38.15+02:00"}
{"Id":490469,"Number":284,"KnessetNum":5,"Name":"ישיבת מליאה בתאריך 22/10/1963 בשעה 16:00","StartDate":"1963-10-22T16:00:00+02:00","FinishDate":"1963-10-22T20:38:00+02:00","IsSpecialMeeting":null,"LastUpdatedDate":"2020-02-23T15:20:44.39+02:00"}
{"Id":490470,"Number":285,"KnessetNum":5,"Name":"ישיבת מליאה בתאריך 23/10/1963 בשעה 11:03","StartDate":"1963-10-23T11:03:00+02:00","FinishDate":"1963-10-23T12:25:00+02:00","IsSpecialMeeting":null,"LastUpdatedDate":"2022-02-22T12:21:09.267+02:00"}
{"Id":490471,"Number":288,"KnessetNum":5,"Name":"ישיבת מליאה בתאריך 30/10/1963 בשעה 11:05","StartDate":"1963-10-30T11:05:00+02:00","FinishDate":"1963-10-30T13:20:00+02:00","IsSpecialMeeting":null,"LastUpdatedDate":"2022-02-22T13:10:44.03+02:00"}
{"Id":490472,"Number":292,"KnessetNum":5,"Name":"ישיבת מליאה בתאריך 11/11/1963 בשעה 16:04","StartDate":"1963-11-11T16:04:00+02:00","FinishDate":"1963-11-11T20:10:00+02:00","IsSpecialMeeting":null,"LastUpdatedDate":"2022-02-22T15:15:41.713+02:00"}
{"Id":490473,"Number":294,"KnessetNum":5,"Name":"ישיבת מליאה בתאריך 13/11/1963 בשעה 11:02","StartDate":"1963-11-13T11:02:00+02:00","FinishDate":"1963-11-13T14:08:00+02:00","IsSpecialMeeting":null,"LastUpdatedDate":"2022-02-22T16:09:36.14+02:00"}
{"Id":490474,"Number":298,"KnessetNum":5,"Name":"ישיבת מליאה בתאריך 25/11/1963 בשעה 16:00","StartDate":"1963-11-25T16:00:00+02:00","FinishDate":"1963-11-25T16:15:00+02:00","IsSpecialMeeting":null,"LastUpdatedDate":"2022-02-23T07:40:21.747+02:00"}
{"Id":490475,"Number":300,"KnessetNum":5,"Name":"ישיבת מליאה בתאריך 27/11/1963 בשעה 11:02","StartDate":"1963-11-27T11:02:00+02:00","FinishDate":"1963-11-27T14:03:00+02:00","IsSpecialMeeting":null,"LastUpdatedDate":"2022-02-23T08:09:23.143+02:00"}
{"Id":490476,"Number":301,"KnessetNum":5,"Name":"ישיבת מליאה בתאריך 02/12/1963 בשעה 16:01","StartDate":"1963-12-02T16:01:00+02:00","FinishDate":"1963-12-02T20:30:00+02:00","IsSpecialMeeting":null,"LastUpdatedDate":"2022-02-23T08:35:55.087+02:00"}
{"Id":490477,"Number":303,"KnessetNum":5,"Name":"ישיבת מליאה בתאריך 04/12/1963 בשעה 11:05","StartDate":"1963-12-04T11:05:00+02:00","FinishDate":"1963-12-04T13:30:00+02:00","IsSpecialMeeting":null,"LastUpdatedDate":"2022-02-23T09:33:30.173+02:00"}
{"Id":490478,"Number":311,"KnessetNum":5,"Name":"ישיבת מליאה בתאריך 25/12/1963 בשעה 11:05","StartDate":"1963-12-25T11:05:00+02:00","FinishDate":"1963-12-25T13:40:00+02:00","IsSpecialMeeting":null,"LastUpdatedDate":"2022-02-24T07:33:08.003+02:00"}
{"Id":490479,"Number":316,"KnessetNum":5,"Name":"ישיבת מליאה בתאריך 07/01/1964 בשעה 16:03","StartDate":"1964-01-07T16:03:00+02:00","FinishDate":"1964-01-07T20:30:00+02:00","IsSpecialMeeting":null,"LastUpdatedDate":"2022-02-24T10:23:23.557+02:00"}
{"Id":490480,"Number":317,"KnessetNum":5,"Name":"ישיבת מליאה בתאריך 08/01/1964 בשעה 11:09","StartDate":"1964-01-08T11:09:00+02:00","FinishDate":"1964-01-08T13:57:00+02:00","IsSpecialMeeting":null,"LastUpdatedDate":"2022-02-24T10:43:56.047+02:00"}
{"Id":490481,"Number":322,"KnessetNum":5,"Name":"ישיבת מליאה בתאריך 21/01/1964 בשעה 16:07","StartDate":"1964-01-21T16:07:00+02:00","FinishDate":"1964-01-21T18:46:00+02:00","IsSpecialMeeting":null,"LastUpdatedDate":"2022-02-27T12:52:57.797+02:00"}
{"Id":490482,"Number":323,"KnessetNum":5,"Name":"ישיבת מליאה בתאריך 22/01/1964 בשעה 11:11","StartDate":"1964-01-22T11:11:00+02:00","FinishDate":"1964-01-22T13:23:00+02:00","IsSpecialMeeting":null,"LastUpdatedDate":"2022-02-27T13:16:40.583+02:00"}
{"Id":490483,"Number":324,"KnessetNum":5,"Name":"ישיבת מליאה בתאריך 27/01/1964 בשעה 16:07","StartDate":"1964-01-27T16:07:00+02:00","FinishDate":"1964-01-27T20:52:00+02:00","IsSpecialMeeting":null,"LastUpdatedDate":"2022-02-27T13:49:39.977+02:00"}
{"Id":490484,"Number":325,"KnessetNum":5,"Name":"ישיבת מליאה בתאריך 28/01/1964 בשעה 16:01","StartDate":"1964-01-28T16:01:00+02:00","FinishDate":"1964-01-28T18:53:00+02:00","IsSpecialMeeting":null,"LastUpdatedDate":"2022-02-27T14:00:55.69+02:00"}
{"Id":490485,"Number":326,"KnessetNum":5,"Name":"ישיבת מליאה בתאריך 29/01/1964 בשעה 11:06","StartDate":"1964-01-29T11:06:00+02:00","FinishDate":"1964-01-29T12:57:00+02:00","IsSpecialMeeting":null,"LastUpdatedDate":"2022-02-27T14:43:01.57+02:00"}
{"Id":490486,"Number":327,"KnessetNum":5,"Name":"ישיבת מליאה בתאריך 03/02/1964 בשעה 16:00","StartDate":"1964-02-03T16:00:00+02:00","FinishDate":"1964-02-03T20:50:00+02:00","IsSpecialMeeting":null,"LastUpdatedDate":"2022-02-27T14:47:56.223+02:00"}
{"Id":490487,"Number":329,"KnessetNum":5,"Name":"ישיבת מליאה בתאריך 05/02/1964 בשעה 11:05","StartDate":"1964-02-05T11:05:00+02:00","FinishDate":"1964-02-05T12:50:00+02:00","IsSpecialMeeting":null,"LastUpdatedDate":"2022-02-28T08:01:14.2+02:00"}
{"Id":490488,"Number":330,"KnessetNum":5,"Name":"ישיבת מליאה בתאריך 10/02/1964 בשעה 16:02","StartDate":"1964-02-10T16:02:00+02:00","FinishDate":"1964-02-10T21:00:00+02:00","IsSpecialMeeting":null,"LastUpdatedDate":"2022-02-28T08:27:26.57+02:00"}
{"Id":490489,"Number":333,"KnessetNum":5,"Name":"ישיבת מליאה בתאריך 17/02/1964 בשעה 16:02","StartDate":"1964-02-17T16:02:00+02:00","FinishDate":"1964-02-17T21:20:00+02:00","IsSpecialMeeting":null,"LastUpdatedDate":"2022-02-28T09:54:51.153+02:00"}
{"Id":490490,"Number":334,"KnessetNum":5,"Name":"ישיבת מליאה בתאריך 18/02/1964 בשעה 13:58","StartDate":"1964-02-18T13:58:00+02:00","FinishDate":"1964-02-18T21:40:00+02:00","IsSpecialMeeting":null,"LastUpdatedDate":"2022-02-28T10:11:24.45+02:00"}
{"Id":490491,"Number":339,"KnessetNum":5,"Name":"ישיבת מליאה בתאריך 02/03/1964 בשעה 16:03","StartDate":"1964-03-02T16:03:00+02:00","FinishDate":"1964-03-02T21:17:00+02:00","IsSpecialMeeting":null,"LastUpdatedDate":"2022-02-28T12:22:16.56+02:00"}
{"Id":490492,"Number":343,"KnessetNum":5,"Name":"ישיבת מליאה בתאריך 10/03/1964 בשעה 16:01","StartDate":"1964-03-10T16:01:00+02:00","FinishDate":"1964-03-10T21:12:00+02:00","IsSpecialMeeting":null,"LastUpdatedDate":"2022-02-28T14:32:11.327+02:00"}
{"Id":490493,"Number":344,"KnessetNum":5,"Name":"ישיבת מליאה בתאריך 11/03/1964 בשעה 11:00","StartDate":"1964-03-11T11:00:00+02:00","FinishDate":"1964-03-11T13:40:00+02:00","IsSpecialMeeting":null,"LastUpdatedDate":"2022-03-01T07:28:11.683+02:00"}
{"Id":490494,"Number":345,"KnessetNum":5,"Name":"ישיבת מליאה בתאריך 16/03/1964 בשעה 16:02","StartDate":"1964-03-16T16:02:00+02:00","FinishDate":"1964-03-16T20:00:00+02:00","IsSpecialMeeting":null,"LastUpdatedDate":"2022-03-01T08:00:34.773+02:00"}
{"Id":490495,"Number":346,"KnessetNum":5,"Name":"ישיבת מליאה בתאריך 17/03/1964 בשעה 16:01","StartDate":"1964-03-17T16:01:00+02:00","FinishDate":"1964-03-17T21:55:00+02:00","IsSpecialMeeting":null,"LastUpdatedDate":"2022-03-01T08:20:13.46+02:00"}
{"Id":490496,"Number":350,"KnessetNum":5,"Name":"ישיבת מליאה בתאריך 28/04/1964 בשעה 16:03","StartDate":"1964-04-28T16:03:00+03:00","FinishDate":"1964-04-28T19:55:00+03:00","IsSpecialMeeting":null,"LastUpdatedDate":"2022-03-01T15:01:16.467+02:00"}
{"Id":490497,"Number":354,"KnessetNum":5,"Name":"ישיבת מליאה בתאריך 06/05/1964 בשעה 11:05","StartDate":"1964-05-06T11:05:00+03:00","FinishDate":"1964-05-06T12:30:00+03:00","IsSpecialMeeting":null,"LastUpdatedDate":"2022-03-03T07:53:00.71+02:00"}
{"Id":490498,"Number":360,"KnessetNum":5,"Name":"ישיבת מליאה בתאריך 20/05/1964 בשעה 11:07","StartDate":"1964-05-20T11:07:00+03:00","FinishDate":"1964-05-20T14:29:00+03:00","IsSpecialMeeting":null,"LastUpdatedDate":"2022-03-03T11:35:06.493+02:00"}
{"Id":490499,"Number":372,"KnessetNum":5,"Name":"ישיבת מליאה בתאריך 17/06/1964 בשעה 11:05","StartDate":"1964-06-17T11:05:00+03:00","FinishDate":"1964-06-17T12:43:00+03:00","IsSpecialMeeting":null,"LastUpdatedDate":"2022-03-08T14:46:55.547+02:00"}
{"Id":490500,"Number":376,"KnessetNum":5,"Name":"ישיבת מליאה בתאריך 29/06/1964 בשעה 16:02","StartDate":"1964-06-29T16:02:00+03:00","FinishDate":"1964-06-29T17:58:00+03:00","IsSpecialMeeting":null,"LastUpdatedDate":"2022-03-09T08:06:40.447+02:00"}
{"Id":490501,"Number":378,"KnessetNum":5,"Name":"ישיבת מליאה בתאריך 01/07/1964 בשעה 11:00","StartDate":"1964-07-01T11:00:00+03:00","FinishDate":"1964-07-01T13:53:00+03:00","IsSpecialMeeting":null,"LastUpdatedDate":"2022-03-09T09:51:20.633+02:00"}
{"Id":490502,"Number":383,"KnessetNum":5,"Name":"ישיבת מליאה בתאריך 14/07/1964 בשעה 16:02","StartDate":"1964-07-14T16:02:00+03:00","FinishDate":"1964-07-14T21:02:00+03:00","IsSpecialMeeting":null,"LastUpdatedDate":"2022-03-09T14:05:01.307+02:00"}
{"Id":490503,"Number":384,"KnessetNum":5,"Name":"ישיבת מליאה בתאריך 15/07/1964 בשעה 09:04","StartDate":"1964-07-15T09:04:00+03:00","FinishDate":"1964-07-15T14:00:00+03:00","IsSpecialMeeting":null,"LastUpdatedDate":"2022-03-10T07:13:03.863+02:00"}
{"Id":490504,"Number":392,"KnessetNum":5,"Name":"ישיבת מליאה בתאריך 17/08/1964 בשעה 11:05","StartDate":"1964-08-17T11:05:00+03:00","FinishDate":"1964-08-17T15:07:00+03:00","IsSpecialMeeting":null,"LastUpdatedDate":"2022-03-13T09:23:25.553+02:00"}
{"Id":490505,"Number":393,"KnessetNum":5,"Name":"ישיבת מליאה בתאריך 12/10/1964 בשעה 16:02","StartDate":"1964-10-12T16:02:00+02:00","FinishDate":"1964-10-12T20:19:00+02:00","IsSpecialMeeting":null,"LastUpdatedDate":"2022-03-13T09:50:24.59+02:00"}
{"Id":490506,"Number":395,"KnessetNum":5,"Name":"ישיבת מליאה בתאריך 14/10/1964 בשעה 11:05","StartDate":"1964-10-14T11:05:00+02:00","FinishDate":"1964-10-14T12:50:00+02:00","IsSpecialMeeting":null,"LastUpdatedDate":"2022-03-13T11:01:04.053+02:00"}
{"Id":490507,"Number":396,"KnessetNum":5,"Name":"ישיבת מליאה בתאריך 19/10/1964 בשעה 16:07","StartDate":"1964-10-19T16:07:00+02:00","FinishDate":"1964-10-19T20:28:00+02:00","IsSpecialMeeting":null,"LastUpdatedDate":"2022-03-13T11:09:16.047+02:00"}
{"Id":490508,"Number":398,"KnessetNum":5,"Name":"ישיבת מליאה בתאריך 21/10/1964 בשעה 11:05","StartDate":"1964-10-21T11:05:00+02:00","FinishDate":"1964-10-21T13:40:00+02:00","IsSpecialMeeting":null,"LastUpdatedDate":"2022-03-13T12:07:46.707+02:00"}
{"Id":490509,"Number":400,"KnessetNum":5,"Name":"ישיבת מליאה בתאריך 27/10/1964 בשעה 16:03","StartDate":"1964-10-27T16:03:00+02:00","FinishDate":"1964-10-27T20:34:00+02:00","IsSpecialMeeting":null,"LastUpdatedDate":"2022-03-13T13:06:07.917+02:00"}
{"Id":490510,"Number":402,"KnessetNum":5,"Name":"ישיבת מליאה בתאריך 02/11/1964 בשעה 16:00","StartDate":"1964-11-02T16:00:00+02:00","FinishDate":"1964-11-02T20:42:00+02:00","IsSpecialMeeting":null,"LastUpdatedDate":"2022-03-14T08:34:57.987+02:00"}
{"Id":490511,"Number":403,"KnessetNum":5,"Name":"ישיבת מליאה בתאריך 03/11/1964 בשעה 16:00","StartDate":"1964-11-03T16:00:00+02:00","FinishDate":"1964-11-03T20:25:00+02:00","IsSpecialMeeting":null,"LastUpdatedDate":"2022-03-14T09:11:02.413+02:00"}
{"Id":490512,"Number":404,"KnessetNum":5,"Name":"ישיבת מליאה בתאריך 04/11/1964 בשעה 11:05","StartDate":"1964-11-04T11:05:00+02:00","FinishDate":"1964-11-04T13:50:00+02:00","IsSpecialMeeting":null,"LastUpdatedDate":"2022-03-14T09:51:58.553+02:00"}
{"Id":490513,"Number":410,"KnessetNum":5,"Name":"ישיבת מליאה בתאריך 18/11/1964 בשעה 11:00","StartDate":"1964-11-18T11:00:00+02:00","FinishDate":"1964-11-18T13:13:00+02:00","IsSpecialMeeting":null,"LastUpdatedDate":"2022-03-15T10:57:40.463+02:00"}
{"Id":490514,"Number":416,"KnessetNum":5,"Name":"ישיבת מליאה בתאריך 02/12/1964 בשעה 11:03","StartDate":"1964-12-02T11:03:00+02:00","FinishDate":"1964-12-02T14:30:00+02:00","IsSpecialMeeting":null,"LastUpdatedDate":"2022-03-15T13:43:49.337+02:00"}
{"Id":490515,"Number":418,"KnessetNum":5,"Name":"ישיבת מליאה בתאריך 08/12/1964 בשעה 16:04","StartDate":"1964-12-08T16:04:00+02:00","FinishDate":"1964-12-08T20:40:00+02:00","IsSpecialMeeting":null,"LastUpdatedDate":"2022-03-16T07:39:17.113+02:00"}
{"Id":490516,"Number":421,"KnessetNum":5,"Name":"ישיבת מליאה בתאריך 15/12/1964 בשעה 16:03","StartDate":"1964-12-15T16:03:00+02:00","FinishDate":"1964-12-15T20:59:00+02:00","IsSpecialMeeting":null,"LastUpdatedDate":"2022-03-16T08:20:53.99+02:00"}
{"Id":490517,"Number":422,"KnessetNum":5,"Name":"ישיבת מליאה בתאריך 16/12/1964 בשעה 11:03","StartDate":"1964-12-16T11:03:00+02:00","FinishDate":"1964-12-16T12:30:00+02:00","IsSpecialMeeting":null,"LastUpdatedDate":"2022-03-16T10:17:46.143+02:00"}
{"Id":490518,"Number":424,"KnessetNum":5,"Name":"ישיבת מליאה בתאריך 22/12/1964 בשעה 16:00","StartDate":"1964-12-22T16:00:00+02:00","FinishDate":"1964-12-22T20:23:00+02:00","IsSpecialMeeting":null,"LastUpdatedDate":"2022-03-16T11:17:52.483+02:00"}
{"Id":490519,"Number":427,"KnessetNum":5,"Name":"ישיבת מליאה בתאריך 29/12/1964 בשעה 16:02","StartDate":"1964-12-29T16:02:00+02:00","FinishDate":"1964-12-29T20:49:00+02:00","IsSpecialMeeting":null,"LastUpdatedDate":"2022-03-22T07:55:57.167+02:00"}
{"Id":490520,"Number":431,"KnessetNum":5,"Name":"ישיבת מליאה בתאריך 06/01/1965 בשעה 11:08","StartDate":"1965-01-06T11:08:00+02:00","FinishDate":"1965-01-06T13:48:00+02:00","IsSpecialMeeting":null,"LastUpdatedDate":"2022-03-27T11:26:47.67+03:00"}
{"Id":490521,"Number":435,"KnessetNum":5,"Name":"ישיבת מליאה בתאריך 18/01/1965 בשעה 16:06","StartDate":"1965-01-18T16:06:00+02:00","FinishDate":"1965-01-18T18:00:00+02:00","IsSpecialMeeting":null,"LastUpdatedDate":"2022-03-27T13:09:54.94+03:00"}
{"Id":490522,"Number":437,"KnessetNum":5,"Name":"ישיבת מליאה בתאריך 20/01/1965 בשעה 11:01","StartDate":"1965-01-20T11:01:00+02:00","FinishDate":"1965-01-20T12:32:00+02:00","IsSpecialMeeting":null,"LastUpdatedDate":"2022-03-27T13:43:23.75+03:00"}
{"Id":490523,"Number":438,"KnessetNum":5,"Name":"ישיבת מליאה בתאריך 25/01/1965 בשעה 16:00","StartDate":"1965-01-25T16:00:00+02:00","FinishDate":"1965-01-25T20:31:00+02:00","IsSpecialMeeting":null,"LastUpdatedDate":"2022-03-27T14:26:09.81+03:00"}
{"Id":490524,"Number":439,"KnessetNum":5,"Name":"ישיבת מליאה בתאריך 26/01/1965 בשעה 16:07","StartDate":"1965-01-26T16:07:00+02:00","FinishDate":"1965-01-26T21:23:00+02:00","IsSpecialMeeting":null,"LastUpdatedDate":"2022-03-27T14:58:22.347+03:00"}
{"Id":490525,"Number":440,"KnessetNum":5,"Name":"ישיבת מליאה בתאריך 27/01/1965 בשעה 11:06","StartDate":"1965-01-27T11:06:00+02:00","FinishDate":"1965-01-27T15:00:00+02:00","IsSpecialMeeting":null,"LastUpdatedDate":"2022-03-27T15:11:51.473+03:00"}
{"Id":490526,"Number":444,"KnessetNum":5,"Name":"ישיבת מליאה בתאריך 08/02/1965 בשעה 16:05","StartDate":"1965-02-08T16:05:00+02:00","FinishDate":"1965-02-08T20:40:00+02:00","IsSpecialMeeting":null,"LastUpdatedDate":"2022-03-28T08:49:25.24+03:00"}
{"Id":490527,"Number":446,"KnessetNum":5,"Name":"ישיבת מליאה בתאריך 10/02/1965 בשעה 11:05","StartDate":"1965-02-10T11:05:00+02:00","FinishDate":"1965-02-10T13:55:00+02:00","IsSpecialMeeting":null,"LastUpdatedDate":"2022-03-28T10:29:15.947+03:00"}
{"Id":490528,"Number":447,"KnessetNum":5,"Name":"ישיבת מליאה בתאריך 15/02/1965 בשעה 16:06","StartDate":"1965-02-15T16:06:00+02:00","FinishDate":"1965-02-15T21:09:00+02:00","IsSpecialMeeting":null,"LastUpdatedDate":"2022-03-28T11:13:38.057+03:00"}
{"Id":490529,"Number":449,"KnessetNum":5,"Name":"ישיבת מליאה בתאריך 17/02/1965 בשעה 11:02","StartDate":"1965-02-17T11:02:00+02:00","FinishDate":"1965-02-17T12:42:00+02:00","IsSpecialMeeting":null,"LastUpdatedDate":"2022-03-28T13:20:56.003+03:00"}
{"Id":490530,"Number":450,"KnessetNum":5,"Name":"ישיבת מליאה בתאריך 22/02/1965 בשעה 16:03","StartDate":"1965-02-22T16:03:00+02:00","FinishDate":"1965-02-22T21:23:00+02:00","IsSpecialMeeting":null,"LastUpdatedDate":"2022-03-28T13:46:52.663+03:00"}
{"Id":490531,"Number":452,"KnessetNum":5,"Name":"ישיבת מליאה בתאריך 24/02/1965 בשעה 11:11","StartDate":"1965-02-24T11:11:00+02:00","FinishDate":"1965-02-24T13:33:00+02:00","IsSpecialMeeting":null,"LastUpdatedDate":"2022-03-29T09:16:12.653+03:00"}
{"Id":490532,"Number":453,"KnessetNum":5,"Name":"ישיבת מליאה בתאריך 01/03/1965 בשעה 16:00","StartDate":"1965-03-01T16:00:00+02:00","FinishDate":"1965-03-01T21:30:00+02:00","IsSpecialMeeting":null,"LastUpdatedDate":"2022-03-29T09:30:30.083+03:00"}
{"Id":490533,"Number":458,"KnessetNum":5,"Name":"ישיבת מליאה בתאריך 10/03/1965 בשעה 11:05","StartDate":"1965-03-10T11:05:00+02:00","FinishDate":"1965-03-10T13:45:00+02:00","IsSpecialMeeting":null,"LastUpdatedDate":"2022-03-29T12:30:54.053+03:00"}
{"Id":490534,"Number":460,"KnessetNum":5,"Name":"ישיבת מליאה בתאריך 16/03/1965 בשעה 16:03","StartDate":"1965-03-16T16:03:00+02:00","FinishDate":"1965-03-16T21:45:00+02:00","IsSpecialMeeting":null,"LastUpdatedDate":"2022-03-29T13:35:18.293+03:00"}
{"Id":490535,"Number":462,"KnessetNum":5,"Name":"ישיבת מליאה בתאריך 22/03/1965 בשעה 16:02","StartDate":"1965-03-22T16:02:00+02:00","FinishDate":"1965-03-22T21:10:00+02:00","IsSpecialMeeting":null,"LastUpdatedDate":"2022-03-31T07:48:21.96+03:00"}
{"Id":490536,"Number":465,"KnessetNum":5,"Name":"ישיבת מליאה בתאריך 29/03/1965 בשעה 16:00","StartDate":"1965-03-29T16:00:00+02:00","FinishDate":"1965-03-29T20:03:00+02:00","IsSpecialMeeting":null,"LastUpdatedDate":"2022-03-31T09:04:21+03:00"}
{"Id":490537,"Number":471,"KnessetNum":5,"Name":"ישיבת מליאה בתאריך 17/05/1965 בשעה 16:02","StartDate":"1965-05-17T16:02:00+03:00","FinishDate":"1965-05-17T21:03:00+03:00","IsSpecialMeeting":null,"LastUpdatedDate":"2022-03-31T12:28:55.187+03:00"}
{"Id":490538,"Number":472,"KnessetNum":5,"Name":"ישיבת מליאה בתאריך 18/05/1965 בשעה 16:06","StartDate":"1965-05-18T16:06:00+03:00","FinishDate":"1965-05-18T20:25:00+03:00","IsSpecialMeeting":null,"LastUpdatedDate":"2022-03-31T12:36:37.363+03:00"}
{"Id":490539,"Number":473,"KnessetNum":5,"Name":"ישיבת מליאה בתאריך 19/05/1965 בשעה 11:02","StartDate":"1965-05-19T11:02:00+03:00","FinishDate":"1965-05-19T13:00:00+03:00","IsSpecialMeeting":null,"LastUpdatedDate":"2022-04-11T09:05:35.52+03:00"}
{"Id":490540,"Number":475,"KnessetNum":5,"Name":"ישיבת מליאה בתאריך 25/05/1965 בשעה 16:02","StartDate":"1965-05-25T16:02:00+03:00","FinishDate":"1965-05-25T20:20:00+03:00","IsSpecialMeeting":null,"LastUpdatedDate":"2022-04-11T11:04:01.507+03:00"}
{"Id":490541,"Number":476,"KnessetNum":5,"Name":"ישיבת מליאה בתאריך 26/05/1965 בשעה 11:02","StartDate":"1965-05-26T11:02:00+03:00","FinishDate":"1965-05-26T13:25:00+03:00","IsSpecialMeeting":null,"LastUpdatedDate":"2022-04-11T11:16:13.503+03:00"}
{"Id":490542,"Number":484,"KnessetNum":5,"Name":"ישיבת מליאה בתאריך 15/06/1965 בשעה 16:01","StartDate":"1965-06-15T16:01:00+03:00","FinishDate":"1965-06-15T20:53:00+03:00","IsSpecialMeeting":null,"LastUpdatedDate":"2022-04-12T10:25:32.393+03:00"}
{"Id":490543,"Number":488,"KnessetNum":5,"Name":"ישיבת מליאה בתאריך 23/06/1965 בשעה 11:05","StartDate":"1965-06-23T11:05:00+03:00","FinishDate":"1965-06-23T13:47:00+03:00","IsSpecialMeeting":null,"LastUpdatedDate":"2022-04-24T09:50:56.583+03:00"}
{"Id":490544,"Number":492,"KnessetNum":5,"Name":"ישיבת מליאה בתאריך 05/07/1965 בשעה 16:00","StartDate":"1965-07-05T16:00:00+03:00","FinishDate":"1965-07-05T21:20:00+03:00","IsSpecialMeeting":null,"LastUpdatedDate":"2019-12-31T08:53:22.123+02:00"}
{"Id":490545,"Number":499,"KnessetNum":5,"Name":"ישיבת מליאה בתאריך 15/07/1965 בשעה 11:03","StartDate":"1965-07-15T11:03:00+03:00","FinishDate":"1965-07-15T11:53:00+03:00","IsSpecialMeeting":null,"LastUpdatedDate":"2022-02-21T16:10:25.897+02:00"}
{"Id":490546,"Number":504,"KnessetNum":5,"Name":"ישיבת מליאה בתאריך 01/09/1965 בשעה 11:03","StartDate":"1965-09-01T11:03:00+03:00","FinishDate":"1965-09-01T12:50:00+03:00","IsSpecialMeeting":null,"LastUpdatedDate":"2022-02-15T08:47:34.65+02:00"}
{"Id":490547,"Number":1,"KnessetNum":6,"Name":"ישיבת מליאה בתאריך 22/11/1965 בשעה 15:58","StartDate":"1965-11-22T15:58:00+02:00","FinishDate":"1965-11-22T17:10:00+02:00","IsSpecialMeeting":null,"LastUpdatedDate":"2020-08-16T09:01:57.853+03:00"}
{"Id":490548,"Number":2,"KnessetNum":6,"Name":"ישיבת מליאה בתאריך 23/11/1965 בשעה 16:00","StartDate":"1965-11-23T16:00:00+02:00","FinishDate":"1965-11-23T17:00:00+02:00","IsSpecialMeeting":null,"LastUpdatedDate":"2020-08-16T09:02:53.12+03:00"}
{"Id":490549,"Number":5,"KnessetNum":6,"Name":"ישיבת מליאה בתאריך 01/12/1965 בשעה 11:02","StartDate":"1965-12-01T11:02:00+02:00","FinishDate":"1965-12-01T13:25:00+02:00","IsSpecialMeeting":null,"LastUpdatedDate":"2020-06-10T09:23:20.923+03:00"}
{"Id":490550,"Number":7,"KnessetNum":6,"Name":"ישיבת מליאה בתאריך 07/12/1965 בשעה 16:02","StartDate":"1965-12-07T16:02:00+02:00","FinishDate":"1965-12-07T19:01:00+02:00","IsSpecialMeeting":null,"LastUpdatedDate":"2020-06-10T12:22:45.093+03:00"}
{"Id":490551,"Number":11,"KnessetNum":6,"Name":"ישיבת מליאה בתאריך 15/12/1965 בשעה 11:05","StartDate":"1965-12-15T11:05:00+02:00","FinishDate":"1965-12-15T13:42:00+02:00","IsSpecialMeeting":null,"LastUpdatedDate":"2020-06-14T10:42:50.213+03:00"}
{"Id":490552,"Number":14,"KnessetNum":6,"Name":"ישיבת מליאה בתאריך 27/12/1965 בשעה 16:03","StartDate":"1965-12-27T16:03:00+02:00","FinishDate":"1965-12-27T20:01:00+02:00","IsSpecialMeeting":null,"LastUpdatedDate":"2020-08-16T09:08:50.553+03:00"}
{"Id":490553,"Number":15,"KnessetNum":6,"Name":"ישיבת מליאה בתאריך 28/12/1965 בשעה 16:03","StartDate":"1965-12-28T16:03:00+02:00","FinishDate":"1965-12-28T19:50:00+02:00","IsSpecialMeeting":null,"LastUpdatedDate":"2020-08-16T09:10:07.073+03:00"}
{"Id":490554,"Number":16,"KnessetNum":6,"Name":"ישיבת מליאה בתאריך 29/12/1965 בשעה 11:00","StartDate":"1965-12-29T11:00:00+02:00","FinishDate":"1965-12-30T11:05:00+02:00","IsSpecialMeeting":null,"LastUpdatedDate":"2020-06-15T09:25:44.943+03:00"}
{"Id":490555,"Number":17,"KnessetNum":6,"Name":"ישיבת מליאה בתאריך 03/01/1966 בשעה 16:04","StartDate":"1966-01-03T16:04:00+02:00","FinishDate":"1966-01-03T18:57:00+02:00","IsSpecialMeeting":null,"LastUpdatedDate":"2020-06-15T10:36:58.257+03:00"}
{"Id":490556,"Number":18,"KnessetNum":6,"Name":"ישיבת מליאה בתאריך 04/01/1966 בשעה 16:03","StartDate":"1966-01-04T16:03:00+02:00","FinishDate":"1966-01-04T17:27:00+02:00","IsSpecialMeeting":null,"LastUpdatedDate":"2020-06-15T12:30:25.98+03:00"}
{"Id":490557,"Number":21,"KnessetNum":6,"Name":"ישיבת מליאה בתאריך 12/01/1966 בשעה 09:31","StartDate":"1966-01-12T09:31:00+02:00","FinishDate":"1966-01-12T20:25:00+02:00","IsSpecialMeeting":null,"LastUpdatedDate":"2020-08-16T09:59:53.99+03:00"}
{"Id":490558,"Number":23,"KnessetNum":6,"Name":"ישיבת מליאה בתאריך 18/01/1966 בשעה 16:01","StartDate":"1966-01-18T16:01:00+02:00","FinishDate":"1966-01-18T18:12:00+02:00","IsSpecialMeeting":null,"LastUpdatedDate":"2021-05-31T13:12:05.143+03:00"}
{"Id":490559,"Number":24,"KnessetNum":6,"Name":"ישיבת מליאה בתאריך 19/01/1966 בשעה 11:05","StartDate":"1966-01-19T11:05:00+02:00","FinishDate":"1966-01-19T12:59:00+02:00","IsSpecialMeeting":null,"LastUpdatedDate":"2020-08-16T14:17:24.87+03:00"}
{"Id":490560,"Number":30,"KnessetNum":6,"Name":"ישיבת מליאה בתאריך 02/02/1966 בשעה 11:05","StartDate":"1966-02-02T11:05:00+02:00","FinishDate":"1966-02-02T13:45:00+02:00","IsSpecialMeeting":null,"LastUpdatedDate":"2020-08-17T13:48:55.637+03:00"}
{"Id":490561,"Number":31,"KnessetNum":6,"Name":"ישיבת מליאה בתאריך 07/02/1966 בשעה 16:01","StartDate":"1966-02-07T16:01:00+02:00","FinishDate":"1966-02-07T17:45:00+02:00","IsSpecialMeeting":null,"LastUpdatedDate":"2020-08-17T14:31:05.243+03:00"}
{"Id":490562,"Number":35,"KnessetNum":6,"Name":"ישיבת מליאה בתאריך 15/02/1966 בשעה 16:04","StartDate":"1966-02-15T16:04:00+02:00","FinishDate":"1966-02-15T19:00:00+02:00","IsSpecialMeeting":null,"LastUpdatedDate":"2020-08-23T07:08:28.31+03:00"}
{"Id":490563,"Number":36,"KnessetNum":6,"Name":"ישיבת מליאה בתאריך 16/02/1966 בשעה 11:05","StartDate":"1966-02-16T11:05:00+02:00","FinishDate":"1966-02-16T14:57:00+02:00","IsSpecialMeeting":null,"LastUpdatedDate":"2020-08-23T11:13:51.89+03:00"}
{"Id":490564,"Number":39,"KnessetNum":6,"Name":"ישיבת מליאה בתאריך 23/02/1966 בשעה 11:05","StartDate":"1966-02-23T11:05:00+02:00","FinishDate":"1966-02-23T14:48:00+02:00","IsSpecialMeeting":null,"LastUpdatedDate":"2020-08-23T13:47:19.73+03:00"}
{"Id":490565,"Number":40,"KnessetNum":6,"Name":"ישיבת מליאה בתאריך 28/02/1966 בשעה 16:00","StartDate":"1966-02-28T16:00:00+02:00","FinishDate":"1966-02-28T22:05:00+02:00","IsSpecialMeeting":null,"LastUpdatedDate":"2020-08-23T14:26:22.043+03:00"}
{"Id":490566,"Number":42,"KnessetNum":6,"Name":"ישיבת מליאה בתאריך 02/03/1966 בשעה 10:02","StartDate":"1966-03-02T10:02:00+02:00","FinishDate":"1966-03-02T15:15:00+02:00","IsSpecialMeeting":null,"LastUpdatedDate":"2020-08-24T14:47:55.113+03:00"}
{"Id":490567,"Number":43,"KnessetNum":6,"Name":"ישיבת מליאה בתאריך 08/03/1966 בשעה 16:02","StartDate":"1966-03-08T16:02:00+02:00","FinishDate":"1966-03-08T21:42:00+02:00","IsSpecialMeeting":null,"LastUpdatedDate":"2020-09-06T08:01:57.733+03:00"}
{"Id":490568,"Number":44,"KnessetNum":6,"Name":"ישיבת מליאה בתאריך 09/03/1966 בשעה 15:01","StartDate":"1966-03-09T15:01:00+02:00","FinishDate":"1966-03-09T21:33:00+02:00","IsSpecialMeeting":null,"LastUpdatedDate":"2020-09-06T10:43:53.523+03:00"}
{"Id":490569,"Number":46,"KnessetNum":6,"Name":"ישיבת מליאה בתאריך 14/03/1966 בשעה 16:00","StartDate":"1966-03-14T16:00:00+02:00","FinishDate":"1966-03-14T21:28:00+02:00","IsSpecialMeeting":null,"LastUpdatedDate":"2022-05-12T09:10:17.42+03:00"}
{"Id":490570,"Number":49,"KnessetNum":6,"Name":"ישיבת מליאה בתאריך 21/03/1966 בשעה 16:02","StartDate":"1966-03-21T16:02:00+02:00","FinishDate":"1966-03-21T21:42:00+02:00","IsSpecialMeeting":null,"LastUpdatedDate":"2020-09-29T13:20:55.157+03:00"}
{"Id":490571,"Number":51,"KnessetNum":6,"Name":"ישיבת מליאה בתאריך 23/03/1966 בשעה 15:30","StartDate":"1966-03-23T15:30:00+02:00","FinishDate":"1966-03-23T21:50:00+02:00","IsSpecialMeeting":null,"LastUpdatedDate":"2020-09-09T09:15:40.43+03:00"}
{"Id":490572,"Number":52,"KnessetNum":6,"Name":"ישיבת מליאה בתאריך 24/03/1966 בשעה 10:02","StartDate":"1966-03-24T10:02:00+02:00","FinishDate":"1966-03-24T13:53:00+02:00","IsSpecialMeeting":null,"LastUpdatedDate":"2020-09-09T10:19:08.357+03:00"}
{"Id":490573,"Number":54,"KnessetNum":6,"Name":"ישיבת מליאה בתאריך 29/03/1966 בשעה 11:02","StartDate":"1966-03-29T11:02:00+02:00","FinishDate":"1966-03-29T22:50:00+02:00","IsSpecialMeeting":null,"LastUpdatedDate":"2020-09-09T12:44:11.24+03:00"}
{"Id":490574,"Number":56,"KnessetNum":6,"Name":"ישיבת מליאה בתאריך 09/05/1966 בשעה 17:02","StartDate":"1966-05-09T17:02:00+03:00","FinishDate":"1966-05-09T21:57:00+03:00","IsSpecialMeeting":null,"LastUpdatedDate":"2020-09-10T11:48:47.61+03:00"}
{"Id":490575,"Number":57,"KnessetNum":6,"Name":"ישיבת מליאה בתאריך 10/05/1966 בשעה 17:03","StartDate":"1966-05-10T17:03:00+03:00","FinishDate":"1966-05-10T21:09:00+03:00","IsSpecialMeeting":null,"LastUpdatedDate":"2022-05-16T11:16:02.013+03:00"}
{"Id":490576,"Number":59,"KnessetNum":6,"Name":"ישיבת מליאה בתאריך 15/05/1966 בשעה 17:03","StartDate":"1966-05-15T17:03:00+03:00","FinishDate":"1966-05-16T19:30:00+03:00","IsSpecialMeeting":null,"LastUpdatedDate":"2020-09-10T16:16:30.203+03:00"}
{"Id":490577,"Number":60,"KnessetNum":6,"Name":"ישיבת מליאה בתאריך 17/05/1966 בשעה 17:02","StartDate":"1966-05-17T17:02:00+03:00","FinishDate":"1966-05-17T19:25:00+03:00","IsSpecialMeeting":null,"LastUpdatedDate":"2020-09-13T10:43:00.937+03:00"}
{"Id":490578,"Number":62,"KnessetNum":6,"Name":"ישיבת מליאה בתאריך 23/05/1966 בשעה 12:04","StartDate":"1966-05-23T12:04:00+03:00","FinishDate":"1966-05-23T19:25:00+03:00","IsSpecialMeeting":null,"LastUpdatedDate":"2020-09-14T13:27:52.06+03:00"}
{"Id":490579,"Number":63,"KnessetNum":6,"Name":"ישיבת מליאה בתאריך 30/05/1966 בשעה 16:00","StartDate":"1966-05-30T16:00:00+03:00","FinishDate":"1966-05-30T21:12:00+03:00","IsSpecialMeeting":null,"LastUpdatedDate":"2024-09-15T12:38:50.887+03:00"}
{"Id":490580,"Number":64,"KnessetNum":6,"Name":"ישיבת מליאה בתאריך 31/05/1966 בשעה 16:00","StartDate":"1966-05-31T16:00:00+03:00","FinishDate":"1966-05-31T23:59:00+03:00","IsSpecialMeeting":null,"LastUpdatedDate":"2024-09-15T18:50:35.737+03:00"}
{"Id":490581,"Number":65,"KnessetNum":6,"Name":"ישיבת מליאה בתאריך 01/06/1966 בשעה 12:05","StartDate":"1966-06-01T12:05:00+03:00","FinishDate":"1966-06-01T14:17:00+03:00","IsSpecialMeeting":null,"LastUpdatedDate":"2020-09-16T15:13:39.657+03:00"}
{"Id":490582,"Number":66,"KnessetNum":6,"Name":"ישיבת מליאה בתאריך 06/06/1966 בשעה 16:02","StartDate":"1966-06-06T16:02:00+03:00","FinishDate":"1966-06-06T21:40:00+03:00","IsSpecialMeeting":null,"LastUpdatedDate":"2024-02-12T14:49:07.937+02:00"}
{"Id":490583,"Number":67,"KnessetNum":6,"Name":"ישיבת מליאה בתאריך 06/06/1966 בשעה 17:02","StartDate":"1966-06-06T17:02:00+03:00","FinishDate":"1966-06-07T22:16:00+03:00","IsSpecialMeeting":null,"LastUpdatedDate":"2020-09-16T17:43:48.823+03:00"}
{"Id":490584,"Number":69,"KnessetNum":6,"Name":"ישיבת מליאה בתאריך 12/06/1966 בשעה 17:03","StartDate":"1966-06-12T17:03:00+03:00","FinishDate":"1966-06-13T22:15:00+03:00","IsSpecialMeeting":null,"LastUpdatedDate":"2020-09-16T19:48:50.78+03:00"}
{"Id":490585,"Number":70,"KnessetNum":6,"Name":"ישיבת מליאה בתאריך 13/06/1966 בשעה 17:03","StartDate":"1966-06-13T17:03:00+03:00","FinishDate":"1966-06-14T21:37:00+03:00","IsSpecialMeeting":null,"LastUpdatedDate":"2020-09-17T10:00:26.08+03:00"}
{"Id":490586,"Number":71,"KnessetNum":6,"Name":"ישיבת מליאה בתאריך 14/06/1966 בשעה 12:06","StartDate":"1966-06-14T12:06:00+03:00","FinishDate":"1966-06-15T15:17:00+03:00","IsSpecialMeeting":null,"LastUpdatedDate":"2020-09-17T10:20:45.28+03:00"}
{"Id":490587,"Number":73,"KnessetNum":6,"Name":"ישיבת מליאה בתאריך 21/06/1966 בשעה 17:06","StartDate":"1966-06-21T17:06:00+03:00","FinishDate":"1966-06-21T21:03:00+03:00","IsSpecialMeeting":null,"LastUpdatedDate":"2020-09-17T14:44:51.647+03:00"}
{"Id":490588,"Number":75,"KnessetNum":6,"Name":"ישיבת מליאה בתאריך 26/06/1966 בשעה 17:02","StartDate":"1966-06-26T17:02:00+03:00","FinishDate":"1966-06-27T21:56:00+03:00","IsSpecialMeeting":null,"LastUpdatedDate":"2020-09-17T16:23:15.6+03:00"}
{"Id":490589,"Number":76,"KnessetNum":6,"Name":"ישיבת מליאה בתאריך 27/06/1966 בשעה 17:06","StartDate":"1966-06-27T17:06:00+03:00","FinishDate":"1966-06-28T21:49:00+03:00","IsSpecialMeeting":null,"LastUpdatedDate":"2020-09-21T10:49:53.513+03:00"}
{"Id":490590,"Number":78,"KnessetNum":6,"Name":"ישיבת מליאה בתאריך 04/07/1966 בשעה 17:01","StartDate":"1966-07-04T17:01:00+03:00","FinishDate":"1966-07-04T21:05:00+03:00","IsSpecialMeeting":null,"LastUpdatedDate":"2020-09-21T13:08:56.813+03:00"}
{"Id":490591,"Number":79,"KnessetNum":6,"Name":"ישיבת מליאה בתאריך 04/07/1966 בשעה 17:07","StartDate":"1966-07-04T17:07:00+03:00","FinishDate":"1966-07-05T21:26:00+03:00","IsSpecialMeeting":null,"LastUpdatedDate":"2020-09-21T14:51:33.533+03:00"}
{"Id":490592,"Number":82,"KnessetNum":6,"Name":"ישיבת מליאה בתאריך 12/07/1966 בשעה 17:01","StartDate":"1966-07-12T17:01:00+03:00","FinishDate":"1966-07-12T21:44:00+03:00","IsSpecialMeeting":null,"LastUpdatedDate":"2020-09-22T13:14:33.613+03:00"}
{"Id":490593,"Number":88,"KnessetNum":6,"Name":"ישיבת מליאה בתאריך 28/07/1966 בשעה 11:02","StartDate":"1966-07-28T11:02:00+03:00","FinishDate":"1966-07-28T14:15:00+03:00","IsSpecialMeeting":null,"LastUpdatedDate":"2020-09-23T15:20:01.763+03:00"}
{"Id":490594,"Number":89,"KnessetNum":6,"Name":"ישיבת מליאה בתאריך 31/07/1966 בשעה 17:00","StartDate":"1966-07-31T17:00:00+03:00","FinishDate":"1966-08-01T21:50:00+03:00","IsSpecialMeeting":null,"LastUpdatedDate":"2020-09-24T08:54:07.437+03:00"}
{"Id":490595,"Number":91,"KnessetNum":6,"Name":"ישיבת מליאה בתאריך 03/08/1966 בשעה 12:02","StartDate":"1966-08-03T12:02:00+03:00","FinishDate":"1966-08-03T15:02:00+03:00","IsSpecialMeeting":null,"LastUpdatedDate":"2020-09-24T12:53:00.023+03:00"}
{"Id":490596,"Number":96,"KnessetNum":6,"Name":"ישיבת מליאה בתאריך 11/10/1966 בשעה 11:02","StartDate":"1966-10-11T11:02:00+02:00","FinishDate":"1966-10-11T19:52:00+02:00","IsSpecialMeeting":null,"LastUpdatedDate":"2020-10-01T10:18:48.213+03:00"}
{"Id":490597,"Number":97,"KnessetNum":6,"Name":"ישיבת מליאה בתאריך 17/10/1966 בשעה 17:12","StartDate":"1966-10-17T17:12:00+02:00","FinishDate":"1966-10-17T20:48:00+02:00","IsSpecialMeeting":null,"LastUpdatedDate":"2020-10-01T11:53:01.25+03:00"}
{"Id":490598,"Number":98,"KnessetNum":6,"Name":"ישיבת מליאה בתאריך 18/10/1966 בשעה 16:02","StartDate":"1966-10-18T16:02:00+02:00","FinishDate":"1966-10-18T19:35:00+02:00","IsSpecialMeeting":null,"LastUpdatedDate":"2020-10-01T12:10:59.89+03:00"}
{"Id":490599,"Number":99,"KnessetNum":6,"Name":"ישיבת מליאה בתאריך 19/10/1966 בשעה 11:00","StartDate":"1966-10-19T11:00:00+02:00","FinishDate":"1966-10-19T14:00:00+02:00","IsSpecialMeeting":null,"LastUpdatedDate":"2020-10-01T13:31:25.89+03:00"}
{"Id":490600,"Number":102,"KnessetNum":6,"Name":"ישיבת מליאה בתאריך 26/10/1966 בשעה 11:05","StartDate":"1966-10-26T11:05:00+02:00","FinishDate":"1966-10-26T13:50:00+02:00","IsSpecialMeeting":null,"LastUpdatedDate":"2021-12-26T12:32:07.737+02:00"}
{"Id":490601,"Number":107,"KnessetNum":6,"Name":"ישיבת מליאה בתאריך 08/11/1966 בשעה 16:00","StartDate":"1966-11-08T16:00:00+02:00","FinishDate":"1966-11-08T20:30:00+02:00","IsSpecialMeeting":null,"LastUpdatedDate":"2020-10-11T14:07:30.787+03:00"}
{"Id":490602,"Number":108,"KnessetNum":6,"Name":"ישיבת מליאה בתאריך 09/11/1966 בשעה 11:06","StartDate":"1966-11-09T11:06:00+02:00","FinishDate":"1966-11-09T13:35:00+02:00","IsSpecialMeeting":null,"LastUpdatedDate":"2020-10-11T15:17:02.933+03:00"}
{"Id":490603,"Number":110,"KnessetNum":6,"Name":"ישיבת מליאה בתאריך 15/11/1966 בשעה 16:08","StartDate":"1966-11-15T16:08:00+02:00","FinishDate":"1966-11-15T18:02:00+02:00","IsSpecialMeeting":null,"LastUpdatedDate":"2020-10-11T17:03:39.207+03:00"}
{"Id":490604,"Number":112,"KnessetNum":6,"Name":"ישיבת מליאה בתאריך 21/11/1966 בשעה 18:32","StartDate":"1966-11-21T18:32:00+02:00","FinishDate":"1966-11-21T20:55:00+02:00","IsSpecialMeeting":null,"LastUpdatedDate":"2020-10-12T08:04:45.387+03:00"}
{"Id":490605,"Number":113,"KnessetNum":6,"Name":"ישיבת מליאה בתאריך 22/11/1966 בשעה 16:02","StartDate":"1966-11-22T16:02:00+02:00","FinishDate":"1966-11-22T21:09:00+02:00","IsSpecialMeeting":null,"LastUpdatedDate":"2020-10-12T08:54:39.147+03:00"}
{"Id":490606,"Number":114,"KnessetNum":6,"Name":"ישיבת מליאה בתאריך 23/11/1966 בשעה 11:00","StartDate":"1966-11-23T11:00:00+02:00","FinishDate":"1966-11-23T16:15:00+02:00","IsSpecialMeeting":null,"LastUpdatedDate":"2020-10-12T09:31:59.377+03:00"}
{"Id":490607,"Number":117,"KnessetNum":6,"Name":"ישיבת מליאה בתאריך 30/11/1966 בשעה 11:05","StartDate":"1966-11-30T11:05:00+02:00","FinishDate":"1966-11-30T13:33:00+02:00","IsSpecialMeeting":null,"LastUpdatedDate":"2020-10-12T14:12:05.39+03:00"}
{"Id":490608,"Number":120,"KnessetNum":6,"Name":"ישיבת מליאה בתאריך 07/12/1966 בשעה 11:02","StartDate":"1966-12-07T11:02:00+02:00","FinishDate":"1966-12-07T12:43:00+02:00","IsSpecialMeeting":null,"LastUpdatedDate":"2020-10-13T07:46:35.073+03:00"}
{"Id":490609,"Number":124,"KnessetNum":6,"Name":"ישיבת מליאה בתאריך 19/12/1966 בשעה 16:02","StartDate":"1966-12-19T16:02:00+02:00","FinishDate":"1966-12-19T19:19:00+02:00","IsSpecialMeeting":null,"LastUpdatedDate":"2020-10-13T10:57:45.657+03:00"}
{"Id":490610,"Number":126,"KnessetNum":6,"Name":"ישיבת מליאה בתאריך 21/12/1966 בשעה 11:05","StartDate":"1966-12-21T11:05:00+02:00","FinishDate":"1966-12-21T14:22:00+02:00","IsSpecialMeeting":null,"LastUpdatedDate":"2020-10-13T11:55:15.797+03:00"}
{"Id":490611,"Number":128,"KnessetNum":6,"Name":"ישיבת מליאה בתאריך 27/12/1966 בשעה 16:00","StartDate":"1966-12-27T16:00:00+02:00","FinishDate":"1966-12-27T20:02:00+02:00","IsSpecialMeeting":null,"LastUpdatedDate":"2020-10-13T15:10:20.123+03:00"}
{"Id":490612,"Number":129,"KnessetNum":6,"Name":"ישיבת מליאה בתאריך 28/12/1966 בשעה 11:01","StartDate":"1966-12-28T11:01:00+02:00","FinishDate":"1966-12-28T14:15:00+02:00","IsSpecialMeeting":null,"LastUpdatedDate":"2020-10-14T07:29:19.08+03:00"}
{"Id":490613,"Number":130,"KnessetNum":6,"Name":"ישיבת מליאה בתאריך 02/01/1967 בשעה 16:02","StartDate":"1967-01-02T16:02:00+02:00","FinishDate":"1967-01-02T20:02:00+02:00","IsSpecialMeeting":null,"LastUpdatedDate":"2020-10-14T08:32:21.633+03:00"}
{"Id":490614,"Number":131,"KnessetNum":6,"Name":"ישיבת מליאה בתאריך 03/01/1967 בשעה 16:01","StartDate":"1967-01-03T16:01:00+02:00","FinishDate":"1967-01-03T20:15:00+02:00","IsSpecialMeeting":null,"LastUpdatedDate":"2021-12-26T12:38:09.687+02:00"}
{"Id":490615,"Number":132,"KnessetNum":6,"Name":"ישיבת מליאה בתאריך 04/01/1967 בשעה 11:03","StartDate":"1967-01-04T11:03:00+02:00","FinishDate":"1967-01-04T14:18:00+02:00","IsSpecialMeeting":null,"LastUpdatedDate":"2020-10-14T13:27:37.407+03:00"}
{"Id":490616,"Number":133,"KnessetNum":6,"Name":"ישיבת מליאה בתאריך 09/01/1967 בשעה 16:02","StartDate":"1967-01-09T16:02:00+02:00","FinishDate":"1967-01-09T19:58:00+02:00","IsSpecialMeeting":null,"LastUpdatedDate":"2020-10-14T13:36:49.477+03:00"}
{"Id":490617,"Number":136,"KnessetNum":6,"Name":"ישיבת מליאה בתאריך 16/01/1967 בשעה 16:01","StartDate":"1967-01-16T16:01:00+02:00","FinishDate":"1967-01-16T20:31:00+02:00","IsSpecialMeeting":null,"LastUpdatedDate":"2020-10-15T09:32:56.78+03:00"}
{"Id":490618,"Number":139,"KnessetNum":6,"Name":"ישיבת מליאה בתאריך 23/01/1967 בשעה 16:05","StartDate":"1967-01-23T16:05:00+02:00","FinishDate":"1967-01-23T21:07:00+02:00","IsSpecialMeeting":null,"LastUpdatedDate":"2020-10-15T12:58:55.443+03:00"}
{"Id":490619,"Number":140,"KnessetNum":6,"Name":"ישיבת מליאה בתאריך 24/01/1967 בשעה 16:00","StartDate":"1967-01-24T16:00:00+02:00","FinishDate":"1967-01-24T21:50:00+02:00","IsSpecialMeeting":null,"LastUpdatedDate":"2020-10-15T16:19:38.883+03:00"}
{"Id":490620,"Number":142,"KnessetNum":6,"Name":"ישיבת מליאה בתאריך 30/01/1967 בשעה 16:32","StartDate":"1967-01-30T16:32:00+02:00","FinishDate":"1967-01-30T21:20:00+02:00","IsSpecialMeeting":null,"LastUpdatedDate":"2020-10-18T13:20:48.363+03:00"}
{"Id":490621,"Number":144,"KnessetNum":6,"Name":"ישיבת מליאה בתאריך 01/02/1967 בשעה 11:00","StartDate":"1967-02-01T11:00:00+02:00","FinishDate":"1967-02-01T14:52:00+02:00","IsSpecialMeeting":null,"LastUpdatedDate":"2020-10-18T15:55:26.883+03:00"}
{"Id":490622,"Number":145,"KnessetNum":6,"Name":"ישיבת מליאה בתאריך 06/02/1967 בשעה 16:05","StartDate":"1967-02-06T16:05:00+02:00","FinishDate":"1967-02-06T21:17:00+02:00","IsSpecialMeeting":null,"LastUpdatedDate":"2020-10-18T17:27:55.65+03:00"}
{"Id":490623,"Number":147,"KnessetNum":6,"Name":"ישיבת מליאה בתאריך 08/02/1967 בשעה 11:01","StartDate":"1967-02-08T11:01:00+02:00","FinishDate":"1967-02-08T14:01:00+02:00","IsSpecialMeeting":null,"LastUpdatedDate":"2020-10-19T12:24:54.207+03:00"}
{"Id":490624,"Number":148,"KnessetNum":6,"Name":"ישיבת מליאה בתאריך 13/02/1967 בשעה 16:02","StartDate":"1967-02-13T16:02:00+02:00","FinishDate":"1967-02-13T21:47:00+02:00","IsSpecialMeeting":null,"LastUpdatedDate":"2020-10-19T15:00:20.603+03:00"}
{"Id":490625,"Number":149,"KnessetNum":6,"Name":"ישיבת מליאה בתאריך 14/02/1967 בשעה 16:02","StartDate":"1967-02-14T16:02:00+02:00","FinishDate":"1967-02-14T21:05:00+02:00","IsSpecialMeeting":null,"LastUpdatedDate":"2020-10-19T16:14:21.693+03:00"}
{"Id":490626,"Number":150,"KnessetNum":6,"Name":"ישיבת מליאה בתאריך 15/02/1967 בשעה 11:00","StartDate":"1967-02-15T11:00:00+02:00","FinishDate":"1967-02-15T15:12:00+02:00","IsSpecialMeeting":null,"LastUpdatedDate":"2020-10-19T17:39:49.25+03:00"}
{"Id":490627,"Number":151,"KnessetNum":6,"Name":"ישיבת מליאה בתאריך 20/02/1967 בשעה 16:01","StartDate":"1967-02-20T16:01:00+02:00","FinishDate":"1967-02-20T21:48:00+02:00","IsSpecialMeeting":null,"LastUpdatedDate":"2020-10-19T18:24:08.213+03:00"}
{"Id":490628,"Number":153,"KnessetNum":6,"Name":"ישיבת מליאה בתאריך 22/02/1967 בשעה 11:01","StartDate":"1967-02-22T11:01:00+02:00","FinishDate":"1967-02-22T16:50:00+02:00","IsSpecialMeeting":null,"LastUpdatedDate":"2022-06-26T07:50:43.11+03:00"}
{"Id":490629,"Number":154,"KnessetNum":6,"Name":"ישיבת מליאה בתאריך 27/02/1967 בשעה 16:01","StartDate":"1967-02-27T16:01:00+02:00","FinishDate":"1967-02-27T22:05:00+02:00","IsSpecialMeeting":null,"LastUpdatedDate":"2022-06-26T12:19:47.783+03:00"}
{"Id":490630,"Number":157,"KnessetNum":6,"Name":"ישיבת מליאה בתאריך 06/03/1967 בשעה 16:00","StartDate":"1967-03-06T16:00:00+02:00","FinishDate":"1967-03-06T21:00:00+02:00","IsSpecialMeeting":null,"LastUpdatedDate":"2021-01-10T16:19:18.39+02:00"}
{"Id":490631,"Number":160,"KnessetNum":6,"Name":"ישיבת מליאה בתאריך 13/03/1967 בשעה 16:02","StartDate":"1967-03-13T16:02:00+02:00","FinishDate":"1967-03-13T20:35:00+02:00","IsSpecialMeeting":null,"LastUpdatedDate":"2022-06-30T07:56:32.963+03:00"}
{"Id":490632,"Number":162,"KnessetNum":6,"Name":"ישיבת מליאה בתאריך 15/03/1967 בשעה 11:02","StartDate":"1967-03-15T11:02:00+02:00","FinishDate":"1967-03-15T12:43:00+02:00","IsSpecialMeeting":null,"LastUpdatedDate":"2022-07-03T09:49:22.733+03:00"}
{"Id":490633,"Number":163,"KnessetNum":6,"Name":"ישיבת מליאה בתאריך 20/03/1967 בשעה 16:02","StartDate":"1967-03-20T16:02:00+02:00","FinishDate":"1967-03-20T21:45:00+02:00","IsSpecialMeeting":null,"LastUpdatedDate":"2022-07-03T10:02:24.523+03:00"}
{"Id":490634,"Number":164,"KnessetNum":6,"Name":"ישיבת מליאה בתאריך 21/03/1967 בשעה 16:02","StartDate":"1967-03-21T16:02:00+02:00","FinishDate":"1967-03-21T21:00:00+02:00","IsSpecialMeeting":null,"LastUpdatedDate":"2022-07-03T13:27:57.75+03:00"}
{"Id":490635,"Number":165,"KnessetNum":6,"Name":"ישיבת מליאה בתאריך 22/03/1967 בשעה 11:00","StartDate":"1967-03-22T11:00:00+02:00","FinishDate":"1967-03-22T13:10:00+02:00","IsSpecialMeeting":null,"LastUpdatedDate":"2022-07-04T09:32:38.92+03:00"}
{"Id":490636,"Number":166,"KnessetNum":6,"Name":"ישיבת מליאה בתאריך 28/03/1967 בשעה 16:02","StartDate":"1967-03-28T16:02:00+02:00","FinishDate":"1967-03-28T20:59:00+02:00","IsSpecialMeeting":null,"LastUpdatedDate":"2022-07-04T11:15:39.247+03:00"}
{"Id":490637,"Number":169,"KnessetNum":6,"Name":"ישיבת מליאה בתאריך 03/04/1967 בשעה 16:02","StartDate":"1967-04-03T16:02:00+02:00","FinishDate":"1967-04-03T22:05:00+02:00","IsSpecialMeeting":null,"LastUpdatedDate":"2022-07-04T11:53:34.97+03:00"}
{"Id":490638,"Number":171,"KnessetNum":6,"Name":"ישיבת מליאה בתאריך 05/04/1967 בשעה 10:02","StartDate":"1967-04-05T10:02:00+03:00","FinishDate":"1967-04-05T14:15:00+03:00","IsSpecialMeeting":null,"LastUpdatedDate":"2022-07-04T13:31:51.347+03:00"}
{"Id":490639,"Number":172,"KnessetNum":6,"Name":"ישיבת מליאה בתאריך 10/04/1967 בשעה 16:00","StartDate":"1967-04-10T16:00:00+03:00","FinishDate":"1967-04-10T20:30:00+03:00","IsSpecialMeeting":null,"LastUpdatedDate":"2022-07-04T14:17:38.807+03:00"}
{"Id":490640,"Number":173,"KnessetNum":6,"Name":"ישיבת מליאה בתאריך 11/04/1967 בשעה 16:00","StartDate":"1967-04-11T16:00:00+03:00","FinishDate":"1967-04-11T20:58:00+03:00","IsSpecialMeeting":null,"LastUpdatedDate":"2022-07-05T13:18:02.63+03:00"}
{"Id":490641,"Number":175,"KnessetNum":6,"Name":"ישיבת מליאה בתאריך 03/05/1967 בשעה 11:00","StartDate":"1967-05-03T11:00:00+03:00","FinishDate":"1967-05-03T13:33:00+03:00","IsSpecialMeeting":null,"LastUpdatedDate":"2022-07-06T11:30:09.447+03:00"}
{"Id":490642,"Number":176,"KnessetNum":6,"Name":"ישיבת מליאה בתאריך 22/05/1967 בשעה 16:03","StartDate":"1967-05-22T16:03:00+03:00","FinishDate":"1967-05-22T21:00:00+03:00","IsSpecialMeeting":null,"LastUpdatedDate":"2022-07-06T12:01:49.677+03:00"}
{"Id":490643,"Number":177,"KnessetNum":6,"Name":"ישיבת מליאה בתאריך 23/05/1967 בשעה 16:01","StartDate":"1967-05-23T16:01:00+03:00","FinishDate":"1967-05-23T20:26:00+03:00","IsSpecialMeeting":null,"LastUpdatedDate":"2022-07-06T12:15:39.037+03:00"}
{"Id":490644,"Number":178,"KnessetNum":6,"Name":"ישיבת מליאה בתאריך 24/05/1967 בשעה 12:30","StartDate":"1967-05-24T12:30:00+03:00","FinishDate":"1967-05-24T13:00:00+03:00","IsSpecialMeeting":null,"LastUpdatedDate":"2022-07-06T13:47:39.1+03:00"}
{"Id":490645,"Number":179,"KnessetNum":6,"Name":"ישיבת מליאה בתאריך 29/05/1967 בשעה 16:07","StartDate":"1967-05-29T16:07:00+03:00","FinishDate":"1967-05-29T18:43:00+03:00","IsSpecialMeeting":null,"LastUpdatedDate":"2022-07-06T13:50:43.64+03:00"}
{"Id":490646,"Number":181,"KnessetNum":6,"Name":"ישיבת מליאה בתאריך 31/05/1967 בשעה 11:00","StartDate":"1967-05-31T11:00:00+03:00","FinishDate":"1967-05-31T11:40:00+03:00","IsSpecialMeeting":null,"LastUpdatedDate":"2022-07-07T14:11:03.81+03:00"}
{"Id":490647,"Number":183,"KnessetNum":6,"Name":"ישיבת מליאה בתאריך 12/06/1967 בשעה 16:05","StartDate":"1967-06-12T16:05:00+03:00","FinishDate":"1967-06-12T16:57:00+03:00","IsSpecialMeeting":null,"LastUpdatedDate":"2022-07-07T14:36:40.923+03:00"}
{"Id":490648,"Number":186,"KnessetNum":6,"Name":"ישיבת מליאה בתאריך 21/06/1967 בשעה 11:07","StartDate":"1967-06-21T11:07:00+03:00","FinishDate":"1967-06-21T13:21:00+03:00","IsSpecialMeeting":null,"LastUpdatedDate":"2022-07-11T07:19:43.937+03:00"}
{"Id":490649,"Number":187,"KnessetNum":6,"Name":"ישיבת מליאה בתאריך 26/06/1967 בשעה 16:02","StartDate":"1967-06-26T16:02:00+03:00","FinishDate":"1967-06-26T20:10:00+03:00","IsSpecialMeeting":null,"LastUpdatedDate":"2022-07-11T07:59:13.143+03:00"}
{"Id":490650,"Number":190,"KnessetNum":6,"Name":"ישיבת מליאה בתאריך 03/07/1967 בשעה 16:03","StartDate":"1967-07-03T16:03:00+03:00","FinishDate":"1967-07-03T21:25:00+03:00","IsSpecialMeeting":null,"LastUpdatedDate":"2022-07-11T13:16:03.51+03:00"}
{"Id":490651,"Number":196,"KnessetNum":6,"Name":"ישיבת מליאה בתאריך 17/07/1967 בשעה 16:02","StartDate":"1967-07-17T16:02:00+03:00","FinishDate":"1967-07-17T21:02:00+03:00","IsSpecialMeeting":null,"LastUpdatedDate":"2022-07-13T07:11:58.777+03:00"}
{"Id":490652,"Number":198,"KnessetNum":6,"Name":"ישיבת מליאה בתאריך 19/07/1967 בשעה 12:30","StartDate":"1967-07-19T12:30:00+03:00","FinishDate":"1967-07-19T15:10:00+03:00","IsSpecialMeeting":null,"LastUpdatedDate":"2022-07-13T08:00:52.913+03:00"}
{"Id":490653,"Number":202,"KnessetNum":6,"Name":"ישיבת מליאה בתאריך 31/07/1967 בשעה 16:03","StartDate":"1967-07-31T16:03:00+03:00","FinishDate":"1967-07-31T21:01:00+03:00","IsSpecialMeeting":null,"LastUpdatedDate":"2022-07-13T09:33:39.22+03:00"}
{"Id":490654,"Number":209,"KnessetNum":6,"Name":"ישיבת מליאה בתאריך 30/10/1967 בשעה 16:01","StartDate":"1967-10-30T16:01:00+02:00","FinishDate":"1967-10-30T20:15:00+02:00","IsSpecialMeeting":null,"LastUpdatedDate":"2022-07-14T08:01:58.373+03:00"}
{"Id":490655,"Number":211,"KnessetNum":6,"Name":"ישיבת מליאה בתאריך 01/11/1967 בשעה 12:30","StartDate":"1967-11-01T12:30:00+02:00","FinishDate":"1967-11-01T15:05:00+02:00","IsSpecialMeeting":null,"LastUpdatedDate":"2022-07-14T08:16:52.007+03:00"}
{"Id":490656,"Number":212,"KnessetNum":6,"Name":"ישיבת מליאה בתאריך 06/11/1967 בשעה 16:05","StartDate":"1967-11-06T16:05:00+02:00","FinishDate":"1967-11-06T20:06:00+02:00","IsSpecialMeeting":null,"LastUpdatedDate":"2022-07-14T08:49:27.75+03:00"}
{"Id":490657,"Number":213,"KnessetNum":6,"Name":"ישיבת מליאה בתאריך 07/11/1967 בשעה 16:02","StartDate":"1967-11-07T16:02:00+02:00","FinishDate":"1967-11-07T18:03:00+02:00","IsSpecialMeeting":null,"LastUpdatedDate":"2022-07-14T09:43:48.873+03:00"}
{"Id":490658,"Number":214,"KnessetNum":6,"Name":"ישיבת מליאה בתאריך 08/11/1967 בשעה 12:33","StartDate":"1967-11-08T12:33:00+02:00","FinishDate":"1967-11-08T14:04:00+02:00","IsSpecialMeeting":null,"LastUpdatedDate":"2022-07-14T09:58:10.177+03:00"}
{"Id":490659,"Number":215,"KnessetNum":6,"Name":"ישיבת מליאה בתאריך 13/11/1967 בשעה 16:01","StartDate":"1967-11-13T16:01:00+02:00","FinishDate":"1967-11-13T19:41:00+02:00","IsSpecialMeeting":null,"LastUpdatedDate":"2022-07-14T10:22:34.853+03:00"}
{"Id":490660,"Number":216,"KnessetNum":6,"Name":"ישיבת מליאה בתאריך 14/11/1967 בשעה 16:02","StartDate":"1967-11-14T16:02:00+02:00","FinishDate":"1967-11-14T19:07:00+02:00","IsSpecialMeeting":null,"LastUpdatedDate":"2022-07-14T11:04:44.463+03:00"}
{"Id":490661,"Number":218,"KnessetNum":6,"Name":"ישיבת מליאה בתאריך 20/11/1967 בשעה 16:03","StartDate":"1967-11-20T16:03:00+02:00","FinishDate":"1967-11-20T19:47:00+02:00","IsSpecialMeeting":null,"LastUpdatedDate":"2022-07-18T07:48:52.053+03:00"}
{"Id":490662,"Number":219,"KnessetNum":6,"Name":"ישיבת מליאה בתאריך 21/11/1967 בשעה 16:00","StartDate":"1967-11-21T16:00:00+02:00","FinishDate":"1967-11-21T18:44:00+02:00","IsSpecialMeeting":null,"LastUpdatedDate":"2022-07-18T08:01:32.52+03:00"}
{"Id":490663,"Number":220,"KnessetNum":6,"Name":"ישיבת מליאה בתאריך 22/11/1967 בשעה 12:30","StartDate":"1967-11-22T12:30:00+02:00","FinishDate":"1967-11-22T13:35:00+02:00","IsSpecialMeeting":null,"LastUpdatedDate":"2022-07-18T08:13:33.263+03:00"}
{"Id":490664,"Number":222,"KnessetNum":6,"Name":"ישיבת מליאה בתאריך 28/11/1967 בשעה 16:00","StartDate":"1967-11-28T16:00:00+02:00","FinishDate":"1967-11-28T18:29:00+02:00","IsSpecialMeeting":null,"LastUpdatedDate":"2022-07-18T12:11:52.007+03:00"}
{"Id":490665,"Number":225,"KnessetNum":6,"Name":"ישיבת מליאה בתאריך 05/12/1967 בשעה 16:00","StartDate":"1967-12-05T16:00:00+02:00","FinishDate":"1967-12-05T19:02:00+02:00","IsSpecialMeeting":null,"LastUpdatedDate":"2022-07-21T08:35:27.433+03:00"}
{"Id":490666,"Number":226,"KnessetNum":6,"Name":"ישיבת מליאה בתאריך 06/12/1967 בשעה 12:35","StartDate":"1967-12-06T12:35:00+02:00","FinishDate":"1967-12-06T14:06:00+02:00","IsSpecialMeeting":null,"LastUpdatedDate":"2022-07-21T08:57:55.533+03:00"}
{"Id":490667,"Number":227,"KnessetNum":6,"Name":"ישיבת מליאה בתאריך 11/12/1967 בשעה 16:02","StartDate":"1967-12-11T16:02:00+02:00","FinishDate":"1967-12-11T20:41:00+02:00","IsSpecialMeeting":null,"LastUpdatedDate":"2022-07-21T09:23:34.753+03:00"}
{"Id":490668,"Number":232,"KnessetNum":6,"Name":"ישיבת מליאה בתאריך 20/12/1967 בשעה 12:30","StartDate":"1967-12-20T12:30:00+02:00","FinishDate":"1967-12-20T14:14:00+02:00","IsSpecialMeeting":null,"LastUpdatedDate":"2022-07-25T08:42:54.177+03:00"}
{"Id":490669,"Number":236,"KnessetNum":6,"Name":"ישיבת מליאה בתאריך 01/01/1968 בשעה 16:02","StartDate":"1968-01-01T16:02:00+02:00","FinishDate":"1968-01-01T19:54:00+02:00","IsSpecialMeeting":null,"LastUpdatedDate":"2022-07-26T13:36:53.037+03:00"}
{"Id":490670,"Number":238,"KnessetNum":6,"Name":"ישיבת מליאה בתאריך 03/01/1968 בשעה 11:05","StartDate":"1968-01-03T11:05:00+02:00","FinishDate":"1968-01-03T13:08:00+02:00","IsSpecialMeeting":null,"LastUpdatedDate":"2022-07-27T09:56:01.663+03:00"}
{"Id":490671,"Number":239,"KnessetNum":6,"Name":"ישיבת מליאה בתאריך 08/01/1968 בשעה 16:03","StartDate":"1968-01-08T16:03:00+02:00","FinishDate":"1968-01-08T20:30:00+02:00","IsSpecialMeeting":null,"LastUpdatedDate":"2022-07-27T10:17:31.863+03:00"}
{"Id":490672,"Number":242,"KnessetNum":6,"Name":"ישיבת מליאה בתאריך 17/01/1968 בשעה 10:00","StartDate":"1968-01-17T10:00:00+02:00","FinishDate":"1968-01-17T15:18:00+02:00","IsSpecialMeeting":null,"LastUpdatedDate":"2022-07-28T08:25:28.027+03:00"}
{"Id":490673,"Number":243,"KnessetNum":6,"Name":"ישיבת מליאה בתאריך 22/01/1968 בשעה 16:02","StartDate":"1968-01-22T16:02:00+02:00","FinishDate":"1968-01-22T20:20:00+02:00","IsSpecialMeeting":null,"LastUpdatedDate":"2022-07-28T09:21:56.59+03:00"}
{"Id":490674,"Number":245,"KnessetNum":6,"Name":"ישיבת מליאה בתאריך 24/01/1968 בשעה 12:35","StartDate":"1968-01-24T12:35:00+02:00","FinishDate":"1968-01-24T15:15:00+02:00","IsSpecialMeeting":null,"LastUpdatedDate":"2022-07-28T09:48:35.55+03:00"}
{"Id":490675,"Number":246,"KnessetNum":6,"Name":"ישיבת מליאה בתאריך 29/01/1968 בשעה 16:02","StartDate":"1968-01-29T16:02:00+02:00","FinishDate":"1968-01-29T20:45:00+02:00","IsSpecialMeeting":null,"LastUpdatedDate":"2022-07-28T12:06:04.19+03:00"}
{"Id":490676,"Number":248,"KnessetNum":6,"Name":"ישיבת מליאה בתאריך 31/01/1968 בשעה: 00:00:00","StartDate":"1968-01-31T00:00:00+02:00","FinishDate":null,"IsSpecialMeeting":null,"LastUpdatedDate":"2014-08-17T15:12:53+03:00"}
{"Id":490677,"Number":249,"KnessetNum":6,"Name":"ישיבת מליאה בתאריך 05/02/1968 בשעה 16:00","StartDate":"1968-02-05T16:00:00+02:00","FinishDate":"1968-02-05T20:38:00+02:00","IsSpecialMeeting":null,"LastUpdatedDate":"2022-07-28T13:49:27.073+03:00"}
{"Id":490678,"Number":251,"KnessetNum":6,"Name":"ישיבת מליאה בתאריך 07/02/1968 בשעה 12:30","StartDate":"1968-02-07T12:30:00+02:00","FinishDate":"1968-02-07T14:17:00+02:00","IsSpecialMeeting":null,"LastUpdatedDate":"2022-08-01T12:19:02.46+03:00"}
{"Id":490679,"Number":253,"KnessetNum":6,"Name":"ישיבת מליאה בתאריך 13/02/1968 בשעה 16:02","StartDate":"1968-02-13T16:02:00+02:00","FinishDate":"1968-02-13T20:15:00+02:00","IsSpecialMeeting":null,"LastUpdatedDate":"2022-08-02T09:01:11.373+03:00"}
{"Id":490680,"Number":255,"KnessetNum":6,"Name":"ישיבת מליאה בתאריך 19/02/1968 בשעה 16:02","StartDate":"1968-02-19T16:02:00+02:00","FinishDate":"1968-02-19T20:37:00+02:00","IsSpecialMeeting":null,"LastUpdatedDate":"2022-08-02T12:31:56.113+03:00"}
{"Id":490681,"Number":257,"KnessetNum":6,"Name":"ישיבת מליאה בתאריך 21/02/1968 בשעה 12:31","StartDate":"1968-02-21T12:31:00+02:00","FinishDate":"1968-02-21T15:24:00+02:00","IsSpecialMeeting":null,"LastUpdatedDate":"2022-08-08T07:50:09.64+03:00"}
{"Id":490682,"Number":258,"KnessetNum":6,"Name":"ישיבת מליאה בתאריך 26/02/1968 בשעה 16:03","StartDate":"1968-02-26T16:03:00+02:00","FinishDate":"1968-02-26T20:44:00+02:00","IsSpecialMeeting":null,"LastUpdatedDate":"2022-08-08T10:28:50.313+03:00"}
{"Id":490683,"Number":259,"KnessetNum":6,"Name":"ישיבת מליאה בתאריך 27/02/1968 בשעה 16:00","StartDate":"1968-02-27T16:00:00+02:00","FinishDate":"1968-02-27T19:02:00+02:00","IsSpecialMeeting":null,"LastUpdatedDate":"2022-08-08T13:10:33.897+03:00"}
{"Id":490684,"Number":263,"KnessetNum":6,"Name":"ישיבת מליאה בתאריך 06/03/1968 בשעה 12:30","StartDate":"1968-03-06T12:30:00+02:00","FinishDate":"1968-03-06T12:58:00+02:00","IsSpecialMeeting":null,"LastUpdatedDate":"2022-08-11T10:08:37.427+03:00"}
{"Id":490685,"Number":264,"KnessetNum":6,"Name":"ישיבת מליאה בתאריך 11/03/1968 בשעה 16:02","StartDate":"1968-03-11T16:02:00+02:00","FinishDate":"1968-03-11T21:08:00+02:00","IsSpecialMeeting":null,"LastUpdatedDate":"2022-08-11T10:11:22.25+03:00"}
{"Id":490686,"Number":266,"KnessetNum":6,"Name":"ישיבת מליאה בתאריך 13/03/1968 בשעה 12:30","StartDate":"1968-03-13T12:30:00+02:00","FinishDate":"1968-03-13T15:12:00+02:00","IsSpecialMeeting":null,"LastUpdatedDate":"2022-08-15T11:33:52.38+03:00"}
{"Id":490687,"Number":267,"KnessetNum":6,"Name":"ישיבת מליאה בתאריך 18/03/1968 בשעה 16:00","StartDate":"1968-03-18T16:00:00+02:00","FinishDate":"1968-03-18T20:56:00+02:00","IsSpecialMeeting":null,"LastUpdatedDate":"2022-08-15T12:52:05.507+03:00"}
{"Id":490688,"Number":269,"KnessetNum":6,"Name":"ישיבת מליאה בתאריך 20/03/1968 בשעה 12:32","StartDate":"1968-03-20T12:32:00+02:00","FinishDate":"1968-03-20T18:37:00+02:00","IsSpecialMeeting":null,"LastUpdatedDate":"2022-08-15T14:08:19.793+03:00"}
{"Id":490689,"Number":270,"KnessetNum":6,"Name":"ישיבת מליאה בתאריך 21/03/1968 בשעה 11:01","StartDate":"1968-03-21T11:01:00+02:00","FinishDate":"1968-03-21T12:58:00+02:00","IsSpecialMeeting":null,"LastUpdatedDate":"2022-08-15T14:52:37.997+03:00"}
{"Id":490690,"Number":272,"KnessetNum":6,"Name":"ישיבת מליאה בתאריך 26/03/1968 בשעה 16:00","StartDate":"1968-03-26T16:00:00+02:00","FinishDate":"1968-03-26T17:00:00+02:00","IsSpecialMeeting":null,"LastUpdatedDate":"2022-08-15T17:15:55.117+03:00"}
{"Id":490691,"Number":275,"KnessetNum":6,"Name":"ישיבת מליאה בתאריך 25/04/1968 בשעה 11:30","StartDate":"1968-04-25T11:30:00+03:00","FinishDate":"1968-04-25T12:40:00+03:00","IsSpecialMeeting":null,"LastUpdatedDate":"2022-08-15T17:40:58.227+03:00"}
{"Id":490692,"Number":276,"KnessetNum":6,"Name":"ישיבת מליאה בתאריך 06/05/1968 בשעה 16:01","StartDate":"1968-05-06T16:01:00+03:00","FinishDate":"1968-05-06T17:00:00+03:00","IsSpecialMeeting":null,"LastUpdatedDate":"2022-08-15T17:44:25.2+03:00"}
{"Id":490693,"Number":280,"KnessetNum":6,"Name":"ישיבת מליאה בתאריך 13/05/1968 בשעה 16:02","StartDate":"1968-05-13T16:02:00+03:00","FinishDate":"1968-05-13T20:55:00+03:00","IsSpecialMeeting":null,"LastUpdatedDate":"2022-08-16T09:07:39.923+03:00"}
{"Id":490694,"Number":281,"KnessetNum":6,"Name":"ישיבת מליאה בתאריך 14/05/1968 בשעה 16:00","StartDate":"1968-05-14T16:00:00+03:00","FinishDate":"1968-05-14T19:47:00+03:00","IsSpecialMeeting":null,"LastUpdatedDate":"2022-09-04T11:58:00.23+03:00"}
{"Id":490695,"Number":282,"KnessetNum":6,"Name":"ישיבת מליאה בתאריך 15/05/1968 בשעה 12:31","StartDate":"1968-05-15T12:31:00+03:00","FinishDate":"1968-05-15T15:20:00+03:00","IsSpecialMeeting":null,"LastUpdatedDate":"2022-09-04T13:43:29.057+03:00"}
{"Id":490696,"Number":283,"KnessetNum":6,"Name":"ישיבת מליאה בתאריך 20/05/1968 בשעה 16:00","StartDate":"1968-05-20T16:00:00+03:00","FinishDate":"1968-05-20T20:27:00+03:00","IsSpecialMeeting":null,"LastUpdatedDate":"2022-09-04T14:28:01.05+03:00"}
{"Id":490697,"Number":284,"KnessetNum":6,"Name":"ישיבת מליאה בתאריך 21/05/1968 בשעה 11:00","StartDate":"1968-05-21T11:00:00+03:00","FinishDate":"1968-05-21T11:20:00+03:00","IsSpecialMeeting":null,"LastUpdatedDate":"2022-09-06T12:57:58.203+03:00"}
{"Id":490698,"Number":285,"KnessetNum":6,"Name":"ישיבת מליאה בתאריך 21/05/1968 בשעה 16:02","StartDate":"1968-05-21T16:02:00+03:00","FinishDate":"1968-05-21T20:12:00+03:00","IsSpecialMeeting":null,"LastUpdatedDate":"2022-09-06T13:02:14.147+03:00"}
{"Id":490699,"Number":289,"KnessetNum":6,"Name":"ישיבת מליאה בתאריך 29/05/1968 בשעה 12:31","StartDate":"1968-05-29T12:31:00+03:00","FinishDate":"1968-05-29T14:27:00+03:00","IsSpecialMeeting":null,"LastUpdatedDate":"2022-09-11T13:15:17.71+03:00"}
{"Id":490700,"Number":290,"KnessetNum":6,"Name":"ישיבת מליאה בתאריך 03/06/1968 בשעה 16:03","StartDate":"1968-06-03T16:03:00+03:00","FinishDate":"1968-06-03T20:56:00+03:00","IsSpecialMeeting":null,"LastUpdatedDate":"2022-09-11T13:53:08.87+03:00"}
{"Id":490701,"Number":293,"KnessetNum":6,"Name":"ישיבת מליאה בתאריך 10/06/1968 בשעה 16:00","StartDate":"1968-06-10T16:00:00+03:00","FinishDate":"1968-06-10T20:19:00+03:00","IsSpecialMeeting":null,"LastUpdatedDate":"2022-09-11T16:24:00.263+03:00"}
{"Id":490702,"Number":297,"KnessetNum":6,"Name":"ישיבת מליאה בתאריך 18/06/1968 בשעה 16:03","StartDate":"1968-06-18T16:03:00+03:00","FinishDate":"1968-06-18T20:10:00+03:00","IsSpecialMeeting":null,"LastUpdatedDate":"2022-09-13T11:45:59.883+03:00"}
{"Id":490703,"Number":299,"KnessetNum":6,"Name":"ישיבת מליאה בתאריך 24/06/1968 בשעה 16:00","StartDate":"1968-06-24T16:00:00+03:00","FinishDate":"1968-06-24T20:44:00+03:00","IsSpecialMeeting":null,"LastUpdatedDate":"2022-09-13T13:10:18.113+03:00"}
{"Id":490704,"Number":303,"KnessetNum":6,"Name":"ישיבת מליאה בתאריך 02/07/1968 בשעה 16:00","StartDate":"1968-07-02T16:00:00+03:00","FinishDate":"1968-07-02T20:23:00+03:00","IsSpecialMeeting":null,"LastUpdatedDate":"2022-09-18T13:29:48.203+03:00"}
{"Id":490705,"Number":305,"KnessetNum":6,"Name":"ישיבת מליאה בתאריך 08/07/1968 בשעה 16:00","StartDate":"1968-07-08T16:00:00+03:00","FinishDate":"1968-07-08T20:45:00+03:00","IsSpecialMeeting":null,"LastUpdatedDate":"2022-09-18T15:07:27.057+03:00"}
{"Id":490706,"Number":307,"KnessetNum":6,"Name":"ישיבת מליאה בתאריך 10/07/1968 בשעה 11:02","StartDate":"1968-07-10T11:02:00+03:00","FinishDate":"1968-07-10T16:32:00+03:00","IsSpecialMeeting":null,"LastUpdatedDate":"2022-09-20T12:22:57.393+03:00"}
{"Id":490707,"Number":311,"KnessetNum":6,"Name":"ישיבת מליאה בתאריך 22/07/1968 בשעה 16:03","StartDate":"1968-07-22T16:03:00+03:00","FinishDate":"1968-07-22T20:24:00+03:00","IsSpecialMeeting":null,"LastUpdatedDate":"2022-09-28T12:39:57.77+03:00"}
{"Id":490708,"Number":312,"KnessetNum":6,"Name":"ישיבת מליאה בתאריך 23/07/1968 בשעה 16:05","StartDate":"1968-07-23T16:05:00+03:00","FinishDate":"1968-07-23T20:06:00+03:00","IsSpecialMeeting":null,"LastUpdatedDate":"2022-09-28T15:19:49.14+03:00"}
{"Id":490709,"Number":313,"KnessetNum":6,"Name":"ישיבת מליאה בתאריך 24/07/1968 בשעה 11:01","StartDate":"1968-07-24T11:01:00+03:00","FinishDate":"1968-07-24T16:06:00+03:00","IsSpecialMeeting":null,"LastUpdatedDate":"2022-09-28T15:34:16.957+03:00"}
{"Id":490710,"Number":329,"KnessetNum":6,"Name":"ישיבת מליאה בתאריך 29/10/1968 בשעה 16:03","StartDate":"1968-10-29T16:03:00+02:00","FinishDate":"1968-10-29T19:41:00+02:00","IsSpecialMeeting":null,"LastUpdatedDate":"2022-10-20T07:17:51.867+03:00"}
{"Id":490711,"Number":330,"KnessetNum":6,"Name":"ישיבת מליאה בתאריך 30/10/1968 בשעה 12:30","StartDate":"1968-10-30T12:30:00+02:00","FinishDate":"1968-10-30T14:22:00+02:00","IsSpecialMeeting":null,"LastUpdatedDate":"2022-10-25T13:51:05.49+03:00"}
{"Id":490712,"Number":332,"KnessetNum":6,"Name":"ישיבת מליאה בתאריך 05/11/1968 בשעה 16:02","StartDate":"1968-11-05T16:02:00+02:00","FinishDate":"1968-11-05T18:48:00+02:00","IsSpecialMeeting":null,"LastUpdatedDate":"2022-10-20T09:59:42.333+03:00"}
{"Id":490713,"Number":334,"KnessetNum":6,"Name":"ישיבת מליאה בתאריך 11/11/1968 בשעה 16:03","StartDate":"1968-11-11T16:03:00+02:00","FinishDate":"1968-11-11T21:25:00+02:00","IsSpecialMeeting":null,"LastUpdatedDate":"2022-10-24T07:41:38.04+03:00"}
{"Id":490714,"Number":335,"KnessetNum":6,"Name":"ישיבת מליאה בתאריך 12/11/1968 בשעה 16:01","StartDate":"1968-11-12T16:01:00+02:00","FinishDate":"1968-11-12T21:25:00+02:00","IsSpecialMeeting":null,"LastUpdatedDate":"2022-10-24T08:17:41.853+03:00"}
{"Id":490715,"Number":336,"KnessetNum":6,"Name":"ישיבת מליאה בתאריך 13/11/1968 בשעה 12:30","StartDate":"1968-11-13T12:30:00+02:00","FinishDate":"1968-11-13T15:43:00+02:00","IsSpecialMeeting":null,"LastUpdatedDate":"2022-10-24T08:38:20.387+03:00"}
{"Id":490716,"Number":341,"KnessetNum":6,"Name":"ישיבת מליאה בתאריך 26/11/1968 בשעה 16:01","StartDate":"1968-11-26T16:01:00+02:00","FinishDate":"1968-11-26T19:38:00+02:00","IsSpecialMeeting":null,"LastUpdatedDate":"2022-10-27T08:06:03.61+03:00"}
{"Id":490717,"Number":342,"KnessetNum":6,"Name":"ישיבת מליאה בתאריך 27/11/1968 בשעה 11:04","StartDate":"1968-11-27T11:04:00+02:00","FinishDate":"1968-11-27T15:45:00+02:00","IsSpecialMeeting":null,"LastUpdatedDate":"2022-10-27T09:54:43.377+03:00"}
{"Id":490718,"Number":348,"KnessetNum":6,"Name":"ישיבת מליאה בתאריך 11/12/1968 בשעה 11:05","StartDate":"1968-12-11T11:05:00+02:00","FinishDate":"1968-12-11T14:02:00+02:00","IsSpecialMeeting":null,"LastUpdatedDate":"2022-10-31T13:11:14.907+02:00"}
{"Id":490719,"Number":354,"KnessetNum":6,"Name":"ישיבת מליאה בתאריך 25/12/1968 בשעה 11:30","StartDate":"1968-12-25T11:30:00+02:00","FinishDate":"1968-12-25T14:46:00+02:00","IsSpecialMeeting":null,"LastUpdatedDate":"2022-11-03T08:52:50.103+02:00"}
{"Id":490720,"Number":356,"KnessetNum":6,"Name":"ישיבת מליאה בתאריך 31/12/1968 בשעה 16:01","StartDate":"1968-12-31T16:01:00+02:00","FinishDate":"1968-12-31T20:31:00+02:00","IsSpecialMeeting":null,"LastUpdatedDate":"2022-11-03T11:12:14.723+02:00"}
{"Id":490721,"Number":359,"KnessetNum":6,"Name":"ישיבת מליאה בתאריך 07/01/1969 בשעה 16:02","StartDate":"1969-01-07T16:02:00+02:00","FinishDate":"1969-01-07T20:31:00+02:00","IsSpecialMeeting":null,"LastUpdatedDate":"2022-11-16T10:56:22.003+02:00"}
{"Id":490722,"Number":361,"KnessetNum":6,"Name":"ישיבת מליאה בתאריך 13/01/1969 בשעה 16:02","StartDate":"1969-01-13T16:02:00+02:00","FinishDate":"1969-01-13T20:40:00+02:00","IsSpecialMeeting":null,"LastUpdatedDate":"2022-11-16T10:58:30.72+02:00"}
{"Id":490723,"Number":362,"KnessetNum":6,"Name":"ישיבת מליאה בתאריך 14/01/1969 בשעה 16:01","StartDate":"1969-01-14T16:01:00+02:00","FinishDate":"1969-01-14T20:05:00+02:00","IsSpecialMeeting":null,"LastUpdatedDate":"2022-11-16T09:32:10.827+02:00"}
{"Id":490724,"Number":363,"KnessetNum":6,"Name":"ישיבת מליאה בתאריך 15/01/1969 בשעה 11:30","StartDate":"1969-01-15T11:30:00+02:00","FinishDate":"1969-01-15T13:38:00+02:00","IsSpecialMeeting":null,"LastUpdatedDate":"2025-01-22T12:40:45.94+02:00"}
{"Id":490725,"Number":364,"KnessetNum":6,"Name":"ישיבת מליאה בתאריך 20/01/1969 בשעה 16:01","StartDate":"1969-01-20T16:01:00+02:00","FinishDate":"1969-01-20T21:15:00+02:00","IsSpecialMeeting":null,"LastUpdatedDate":"2022-11-16T11:05:33.097+02:00"}
{"Id":490726,"Number":366,"KnessetNum":6,"Name":"ישיבת מליאה בתאריך 22/01/1969 בשעה 11:33","StartDate":"1969-01-22T11:33:00+02:00","FinishDate":"1969-01-22T15:13:00+02:00","IsSpecialMeeting":null,"LastUpdatedDate":"2022-11-17T08:24:56.327+02:00"}
{"Id":490727,"Number":367,"KnessetNum":6,"Name":"ישיבת מליאה בתאריך 27/01/1969 בשעה 16:02","StartDate":"1969-01-27T16:02:00+02:00","FinishDate":"1969-01-27T20:38:00+02:00","IsSpecialMeeting":null,"LastUpdatedDate":"2022-11-17T11:08:02.447+02:00"}
{"Id":490728,"Number":370,"KnessetNum":6,"Name":"ישיבת מליאה בתאריך 03/02/1969 בשעה 15:04","StartDate":"1969-02-03T15:04:00+02:00","FinishDate":"1969-02-03T18:18:00+02:00","IsSpecialMeeting":null,"LastUpdatedDate":"2022-11-30T07:56:18.117+02:00"}
{"Id":490729,"Number":371,"KnessetNum":6,"Name":"ישיבת מליאה בתאריך 04/02/1969 בשעה 16:02","StartDate":"1969-02-04T16:02:00+02:00","FinishDate":"1969-02-04T19:50:00+02:00","IsSpecialMeeting":null,"LastUpdatedDate":"2022-11-30T08:02:02.79+02:00"}
{"Id":490730,"Number":372,"KnessetNum":6,"Name":"ישיבת מליאה בתאריך 05/02/1969 בשעה 11:31","StartDate":"1969-02-05T11:31:00+02:00","FinishDate":"1969-02-05T13:40:00+02:00","IsSpecialMeeting":null,"LastUpdatedDate":"2022-12-01T07:26:34.22+02:00"}
{"Id":490731,"Number":373,"KnessetNum":6,"Name":"ישיבת מליאה בתאריך 10/02/1969 בשעה 16:01","StartDate":"1969-02-10T16:01:00+02:00","FinishDate":"1969-02-10T21:02:00+02:00","IsSpecialMeeting":null,"LastUpdatedDate":"2022-12-01T09:36:29.04+02:00"}
{"Id":490732,"Number":374,"KnessetNum":6,"Name":"ישיבת מליאה בתאריך 11/02/1969 בשעה 16:03","StartDate":"1969-02-11T16:03:00+02:00","FinishDate":"1969-02-11T20:23:00+02:00","IsSpecialMeeting":null,"LastUpdatedDate":"2022-12-01T11:55:13.417+02:00"}
{"Id":490733,"Number":376,"KnessetNum":6,"Name":"ישיבת מליאה בתאריך 17/02/1969 בשעה 16:02","StartDate":"1969-02-17T16:02:00+02:00","FinishDate":"1969-02-17T20:10:00+02:00","IsSpecialMeeting":null,"LastUpdatedDate":"2022-12-05T15:25:25.103+02:00"}
{"Id":490734,"Number":377,"KnessetNum":6,"Name":"ישיבת מליאה בתאריך 18/02/1969 בשעה 16:00","StartDate":"1969-02-18T16:00:00+02:00","FinishDate":"1969-02-18T20:05:00+02:00","IsSpecialMeeting":null,"LastUpdatedDate":"2022-12-08T08:29:43.647+02:00"}
{"Id":490735,"Number":379,"KnessetNum":6,"Name":"ישיבת מליאה בתאריך 20/02/1969 בשעה 10:01","StartDate":"1969-02-20T10:01:00+02:00","FinishDate":"1969-02-20T15:05:00+02:00","IsSpecialMeeting":null,"LastUpdatedDate":"2022-12-08T13:17:37.737+02:00"}
{"Id":490736,"Number":380,"KnessetNum":6,"Name":"ישיבת מליאה בתאריך 24/02/1969 בשעה 16:01","StartDate":"1969-02-24T16:01:00+02:00","FinishDate":"1969-02-24T21:05:00+02:00","IsSpecialMeeting":null,"LastUpdatedDate":"2022-12-08T13:34:12.11+02:00"}
{"Id":490737,"Number":381,"KnessetNum":6,"Name":"ישיבת מליאה בתאריך 25/02/1969 בשעה 16:01","StartDate":"1969-02-25T16:01:00+02:00","FinishDate":"1969-02-25T20:11:00+02:00","IsSpecialMeeting":null,"LastUpdatedDate":"2022-12-12T08:57:55.657+02:00"}
{"Id":490738,"Number":382,"KnessetNum":6,"Name":"ישיבת מליאה בתאריך 26/02/1969 בשעה 11:30","StartDate":"1969-02-26T11:30:00+02:00","FinishDate":"1969-02-26T11:35:00+02:00","IsSpecialMeeting":null,"LastUpdatedDate":"2022-12-12T11:49:55.697+02:00"}
{"Id":490739,"Number":383,"KnessetNum":6,"Name":"ישיבת מליאה בתאריך 06/03/1969 בשעה 11:00","StartDate":"1969-03-06T11:00:00+02:00","FinishDate":"1969-03-06T12:55:00+02:00","IsSpecialMeeting":null,"LastUpdatedDate":"2022-12-12T11:51:46.287+02:00"}
{"Id":490740,"Number":384,"KnessetNum":6,"Name":"ישיבת מליאה בתאריך 10/03/1969 בשעה 16:05","StartDate":"1969-03-10T16:05:00+02:00","FinishDate":"1969-03-10T21:00:00+02:00","IsSpecialMeeting":null,"LastUpdatedDate":"2022-12-12T12:12:45.927+02:00"}
{"Id":490741,"Number":387,"KnessetNum":6,"Name":"ישיבת מליאה בתאריך 13/03/1969 בשעה 10:37","StartDate":"1969-03-13T10:37:00+02:00","FinishDate":"1969-03-13T12:04:00+02:00","IsSpecialMeeting":null,"LastUpdatedDate":"2022-12-12T13:37:57.757+02:00"}
{"Id":490742,"Number":388,"KnessetNum":6,"Name":"ישיבת מליאה בתאריך 17/03/1969 בשעה 10:00","StartDate":"1969-03-17T10:00:00+02:00","FinishDate":"1969-03-17T15:25:00+02:00","IsSpecialMeeting":null,"LastUpdatedDate":"2019-12-23T13:10:56.147+02:00"}
{"Id":490743,"Number":396,"KnessetNum":6,"Name":"ישיבת מליאה בתאריך 05/05/1969 בשעה 16:03","StartDate":"1969-05-05T16:03:00+03:00","FinishDate":"1969-05-05T21:10:00+03:00","IsSpecialMeeting":null,"LastUpdatedDate":"2023-02-07T07:50:00.857+02:00"}
{"Id":490744,"Number":397,"KnessetNum":6,"Name":"ישיבת מליאה בתאריך 06/05/1969 בשעה 16:01","StartDate":"1969-05-06T16:01:00+03:00","FinishDate":"1969-05-06T20:07:00+03:00","IsSpecialMeeting":null,"LastUpdatedDate":"2023-02-07T09:49:34.933+02:00"}
{"Id":490745,"Number":399,"KnessetNum":6,"Name":"ישיבת מליאה בתאריך 12/05/1969 בשעה 16:02","StartDate":"1969-05-12T16:02:00+03:00","FinishDate":"1969-05-12T21:12:00+03:00","IsSpecialMeeting":null,"LastUpdatedDate":"2023-02-07T09:58:35.773+02:00"}
{"Id":490746,"Number":400,"KnessetNum":6,"Name":"ישיבת מליאה בתאריך 13/05/1969 בשעה 16:02","StartDate":"1969-05-13T16:02:00+03:00","FinishDate":"1969-05-13T20:02:00+03:00","IsSpecialMeeting":null,"LastUpdatedDate":"2023-02-09T08:08:27.42+02:00"}
{"Id":490747,"Number":401,"KnessetNum":6,"Name":"ישיבת מליאה בתאריך 14/05/1969 בשעה 11:30","StartDate":"1969-05-14T11:30:00+03:00","FinishDate":"1969-05-14T14:55:00+03:00","IsSpecialMeeting":null,"LastUpdatedDate":"2023-02-16T10:34:00.143+02:00"}
{"Id":490748,"Number":402,"KnessetNum":6,"Name":"ישיבת מליאה בתאריך 19/05/1969 בשעה 16:00","StartDate":"1969-05-19T16:00:00+03:00","FinishDate":"1969-05-19T20:16:00+03:00","IsSpecialMeeting":null,"LastUpdatedDate":"2022-06-22T07:54:50.747+03:00"}
{"Id":490749,"Number":403,"KnessetNum":6,"Name":"ישיבת מליאה בתאריך 20/05/1969 בשעה 16:00","StartDate":"1969-05-20T16:00:00+03:00","FinishDate":"1969-05-20T20:16:00+03:00","IsSpecialMeeting":null,"LastUpdatedDate":"2022-06-22T07:29:47.937+03:00"}
{"Id":490750,"Number":406,"KnessetNum":6,"Name":"ישיבת מליאה בתאריך 27/05/1969 בשעה 16:02","StartDate":"1969-05-27T16:02:00+03:00","FinishDate":"1969-05-27T20:08:00+03:00","IsSpecialMeeting":null,"LastUpdatedDate":"2022-06-21T12:23:28.857+03:00"}
{"Id":490751,"Number":409,"KnessetNum":6,"Name":"ישיבת מליאה בתאריך 03/06/1969 בשעה 16:00","StartDate":"1969-06-03T16:00:00+03:00","FinishDate":"1969-06-03T20:41:00+03:00","IsSpecialMeeting":null,"LastUpdatedDate":"2022-06-15T11:02:04.32+03:00"}
{"Id":490752,"Number":414,"KnessetNum":6,"Name":"ישיבת מליאה בתאריך 16/06/1969 בשעה 16:02","StartDate":"1969-06-16T16:02:00+03:00","FinishDate":"1969-06-16T21:21:00+03:00","IsSpecialMeeting":null,"LastUpdatedDate":"2022-06-07T10:59:07.467+03:00"}
{"Id":490753,"Number":419,"KnessetNum":6,"Name":"ישיבת מליאה בתאריך 25/06/1969 בשעה 10:01","StartDate":"1969-06-25T10:01:00+03:00","FinishDate":"1969-06-25T15:53:00+03:00","IsSpecialMeeting":null,"LastUpdatedDate":"2022-05-15T13:06:13.873+03:00"}
{"Id":490754,"Number":420,"KnessetNum":6,"Name":"ישיבת מליאה בתאריך 30/06/1969 בשעה 16:00","StartDate":"1969-06-30T16:00:00+03:00","FinishDate":"1969-06-30T20:30:00+03:00","IsSpecialMeeting":null,"LastUpdatedDate":"2022-05-11T11:58:45.88+03:00"}
{"Id":490755,"Number":421,"KnessetNum":6,"Name":"ישיבת מליאה בתאריך 01/07/1969 בשעה 16:00","StartDate":"1969-07-01T16:00:00+03:00","FinishDate":"1969-07-01T20:09:00+03:00","IsSpecialMeeting":null,"LastUpdatedDate":"2022-05-11T08:24:49.09+03:00"}
{"Id":490756,"Number":424,"KnessetNum":6,"Name":"ישיבת מליאה בתאריך 08/07/1969 בשעה 10:00","StartDate":"1969-07-08T10:00:00+03:00","FinishDate":"1969-07-08T16:14:00+03:00","IsSpecialMeeting":null,"LastUpdatedDate":"2022-05-10T13:15:22.88+03:00"}
{"Id":490757,"Number":430,"KnessetNum":6,"Name":"ישיבת מליאה בתאריך 28/08/1969 בשעה 11:00","StartDate":"1969-08-28T11:00:00+03:00","FinishDate":"1969-08-28T12:58:00+03:00","IsSpecialMeeting":null,"LastUpdatedDate":"2022-04-26T08:47:54.477+03:00"}
{"Id":490758,"Number":1,"KnessetNum":7,"Name":"ישיבת מליאה בתאריך 17/11/1969 בשעה 16:00","StartDate":"1969-11-17T16:00:00+02:00","FinishDate":"1969-11-17T17:20:00+02:00","IsSpecialMeeting":null,"LastUpdatedDate":"2020-10-26T13:09:30.85+02:00"}
{"Id":490759,"Number":2,"KnessetNum":7,"Name":"ישיבת מליאה בתאריך 18/11/1969 בשעה 16:02","StartDate":"1969-11-18T16:02:00+02:00","FinishDate":"1969-11-18T17:50:00+02:00","IsSpecialMeeting":null,"LastUpdatedDate":"2020-10-28T14:48:11.017+02:00"}
{"Id":490760,"Number":3,"KnessetNum":7,"Name":"ישיבת מליאה בתאריך 19/11/1969 בשעה 10:02","StartDate":"1969-11-19T10:02:00+02:00","FinishDate":"1969-11-19T14:48:00+02:00","IsSpecialMeeting":null,"LastUpdatedDate":"2020-10-27T15:35:53.517+02:00"}
{"Id":490761,"Number":6,"KnessetNum":7,"Name":"ישיבת מליאה בתאריך 26/11/1969 בשעה 11:00","StartDate":"1969-11-26T11:00:00+02:00","FinishDate":"1969-11-26T13:10:00+02:00","IsSpecialMeeting":null,"LastUpdatedDate":"2020-10-26T13:43:35.443+02:00"}
{"Id":490762,"Number":9,"KnessetNum":7,"Name":"ישיבת מליאה בתאריך 03/12/1969 בשעה 11:02","StartDate":"1969-12-03T11:02:00+02:00","FinishDate":"1969-12-03T12:51:00+02:00","IsSpecialMeeting":null,"LastUpdatedDate":"2020-11-04T10:38:31.637+02:00"}
{"Id":490763,"Number":12,"KnessetNum":7,"Name":"ישיבת מליאה בתאריך 10/12/1969 בשעה 11:01","StartDate":"1969-12-10T11:01:00+02:00","FinishDate":"1969-12-10T12:47:00+02:00","IsSpecialMeeting":null,"LastUpdatedDate":"2020-10-28T14:10:44.653+02:00"}
{"Id":490764,"Number":13,"KnessetNum":7,"Name":"ישיבת מליאה בתאריך 15/12/1969 בשעה 11:00","StartDate":"1969-12-15T11:00:00+02:00","FinishDate":"1969-12-15T19:46:00+02:00","IsSpecialMeeting":null,"LastUpdatedDate":"2020-10-29T09:07:18.113+02:00"}
{"Id":490765,"Number":15,"KnessetNum":7,"Name":"ישיבת מליאה בתאריך 17/12/1969 בשעה 11:02","StartDate":"1969-12-17T11:02:00+02:00","FinishDate":"1969-12-17T12:48:00+02:00","IsSpecialMeeting":null,"LastUpdatedDate":"2020-11-04T10:25:16.58+02:00"}
{"Id":490766,"Number":19,"KnessetNum":7,"Name":"ישיבת מליאה בתאריך 29/12/1969 בשעה 16:00","StartDate":"1969-12-29T16:00:00+02:00","FinishDate":"1969-12-29T21:50:00+02:00","IsSpecialMeeting":null,"LastUpdatedDate":"2020-11-01T12:30:30.787+02:00"}
{"Id":490767,"Number":24,"KnessetNum":7,"Name":"ישיבת מליאה בתאריך 07/01/1970 בשעה 11:02","StartDate":"1970-01-07T11:02:00+02:00","FinishDate":"1970-01-07T13:41:00+02:00","IsSpecialMeeting":null,"LastUpdatedDate":"2020-10-26T18:54:41.317+02:00"}
{"Id":490768,"Number":26,"KnessetNum":7,"Name":"ישיבת מליאה בתאריך 13/01/1970 בשעה 16:03","StartDate":"1970-01-13T16:03:00+02:00","FinishDate":"1970-01-13T19:28:00+02:00","IsSpecialMeeting":null,"LastUpdatedDate":"2020-11-02T14:42:40.157+02:00"}
{"Id":490769,"Number":32,"KnessetNum":7,"Name":"ישיבת מליאה בתאריך 27/01/1970 בשעה 16:03","StartDate":"1970-01-27T16:03:00+02:00","FinishDate":"1970-01-27T18:48:00+02:00","IsSpecialMeeting":null,"LastUpdatedDate":"2020-11-03T12:37:00.63+02:00"}
{"Id":490770,"Number":34,"KnessetNum":7,"Name":"ישיבת מליאה בתאריך 02/02/1970 בשעה 16:02","StartDate":"1970-02-02T16:02:00+02:00","FinishDate":"1970-02-02T19:10:00+02:00","IsSpecialMeeting":null,"LastUpdatedDate":"2020-11-03T16:15:16.273+02:00"}
{"Id":490771,"Number":36,"KnessetNum":7,"Name":"ישיבת מליאה בתאריך 04/02/1970 בשעה 11:02","StartDate":"1970-02-04T11:02:00+02:00","FinishDate":"1970-02-04T15:04:00+02:00","IsSpecialMeeting":null,"LastUpdatedDate":"2020-11-04T12:44:20.47+02:00"}
{"Id":490772,"Number":38,"KnessetNum":7,"Name":"ישיבת מליאה בתאריך 10/02/1970 בשעה 16:01","StartDate":"1970-02-10T16:01:00+02:00","FinishDate":"1970-02-10T22:27:00+02:00","IsSpecialMeeting":null,"LastUpdatedDate":"2020-10-27T12:28:48.287+02:00"}
{"Id":490773,"Number":41,"KnessetNum":7,"Name":"ישיבת מליאה בתאריך 17/02/1970 בשעה 16:00","StartDate":"1970-02-17T16:00:00+02:00","FinishDate":"1970-02-17T19:35:00+02:00","IsSpecialMeeting":null,"LastUpdatedDate":"2020-11-08T10:11:48.913+02:00"}
{"Id":490774,"Number":42,"KnessetNum":7,"Name":"ישיבת מליאה בתאריך 18/02/1970 בשעה 11:01","StartDate":"1970-02-18T11:01:00+02:00","FinishDate":"1970-02-18T13:55:00+02:00","IsSpecialMeeting":null,"LastUpdatedDate":"2020-11-08T11:25:41.82+02:00"}
{"Id":490775,"Number":45,"KnessetNum":7,"Name":"ישיבת מליאה בתאריך 25/02/1970 בשעה 11:01","StartDate":"1970-02-25T11:01:00+02:00","FinishDate":"1970-02-25T13:32:00+02:00","IsSpecialMeeting":null,"LastUpdatedDate":"2020-11-10T10:28:29.36+02:00"}
{"Id":490776,"Number":46,"KnessetNum":7,"Name":"ישיבת מליאה בתאריך 02/03/1970 בשעה 16:04","StartDate":"1970-03-02T16:04:00+02:00","FinishDate":"1970-03-02T19:45:00+02:00","IsSpecialMeeting":null,"LastUpdatedDate":"2020-11-10T11:30:26.753+02:00"}
{"Id":490777,"Number":47,"KnessetNum":7,"Name":"ישיבת מליאה בתאריך 03/03/1970 בשעה 16:00","StartDate":"1970-03-03T16:00:00+02:00","FinishDate":"1970-03-03T19:51:00+02:00","IsSpecialMeeting":null,"LastUpdatedDate":"2020-11-10T11:32:11.483+02:00"}
{"Id":490778,"Number":49,"KnessetNum":7,"Name":"ישיבת מליאה בתאריך 09/03/1970 בשעה 15:00","StartDate":"1970-03-09T15:00:00+02:00","FinishDate":"1970-03-09T20:45:00+02:00","IsSpecialMeeting":null,"LastUpdatedDate":"2020-11-10T15:51:20.143+02:00"}
{"Id":490779,"Number":51,"KnessetNum":7,"Name":"ישיבת מליאה בתאריך 11/03/1970 בשעה 12:33","StartDate":"1970-03-11T12:33:00+02:00","FinishDate":"1970-03-11T15:12:00+02:00","IsSpecialMeeting":null,"LastUpdatedDate":"2020-11-11T10:24:56.71+02:00"}
{"Id":490780,"Number":55,"KnessetNum":7,"Name":"ישיבת מליאה בתאריך 24/03/1970 בשעה 15:03","StartDate":"1970-03-24T15:03:00+02:00","FinishDate":"1970-03-24T21:45:00+02:00","IsSpecialMeeting":null,"LastUpdatedDate":"2020-11-15T12:53:34.87+02:00"}
{"Id":490781,"Number":60,"KnessetNum":7,"Name":"ישיבת מליאה בתאריך 01/04/1970 בשעה 12:31","StartDate":"1970-04-01T12:31:00+03:00","FinishDate":"1970-04-01T16:31:00+03:00","IsSpecialMeeting":null,"LastUpdatedDate":"2020-11-18T13:19:27.09+02:00"}
{"Id":490782,"Number":61,"KnessetNum":7,"Name":"ישיבת מליאה בתאריך 06/04/1970 בשעה 12:31","StartDate":"1970-04-06T12:31:00+03:00","FinishDate":"1970-04-06T16:31:00+03:00","IsSpecialMeeting":null,"LastUpdatedDate":"2020-11-18T15:11:17.697+02:00"}
{"Id":490783,"Number":62,"KnessetNum":7,"Name":"ישיבת מליאה בתאריך 07/04/1970 בשעה 16:00","StartDate":"1970-04-07T16:00:00+03:00","FinishDate":"1970-04-07T22:02:00+03:00","IsSpecialMeeting":null,"LastUpdatedDate":"2020-11-18T15:58:03.363+02:00"}
{"Id":490784,"Number":66,"KnessetNum":7,"Name":"ישיבת מליאה בתאריך 15/04/1970 בשעה 11:02","StartDate":"1970-04-15T11:02:00+03:00","FinishDate":"1970-04-15T12:01:00+03:00","IsSpecialMeeting":null,"LastUpdatedDate":"2025-01-22T13:12:26.71+02:00"}
{"Id":490785,"Number":69,"KnessetNum":7,"Name":"ישיבת מליאה בתאריך 20/05/1970 בשעה 12:34","StartDate":"1970-05-20T12:34:00+03:00","FinishDate":"1970-05-20T13:53:00+03:00","IsSpecialMeeting":null,"LastUpdatedDate":"2020-11-24T12:05:19.65+02:00"}
{"Id":490786,"Number":70,"KnessetNum":7,"Name":"ישיבת מליאה בתאריך 25/05/1970 בשעה 16:01","StartDate":"1970-05-25T16:01:00+03:00","FinishDate":"1970-05-25T21:32:00+03:00","IsSpecialMeeting":null,"LastUpdatedDate":"2020-11-24T12:21:28.993+02:00"}
{"Id":490787,"Number":71,"KnessetNum":7,"Name":"ישיבת מליאה בתאריך 26/05/1970 בשעה 16:01","StartDate":"1970-05-26T16:01:00+03:00","FinishDate":"1970-05-26T20:36:00+03:00","IsSpecialMeeting":null,"LastUpdatedDate":"2020-11-24T16:20:37.523+02:00"}
{"Id":490788,"Number":72,"KnessetNum":7,"Name":"ישיבת מליאה בתאריך 27/05/1970 בשעה 12:32","StartDate":"1970-05-27T12:32:00+03:00","FinishDate":"1970-05-27T18:41:00+03:00","IsSpecialMeeting":null,"LastUpdatedDate":"2020-11-24T17:14:22.827+02:00"}
{"Id":490789,"Number":73,"KnessetNum":7,"Name":"ישיבת מליאה בתאריך 01/06/1970 בשעה 16:01","StartDate":"1970-06-01T16:01:00+03:00","FinishDate":"1970-06-01T21:15:00+03:00","IsSpecialMeeting":null,"LastUpdatedDate":"2020-11-25T14:02:20.193+02:00"}
{"Id":490790,"Number":75,"KnessetNum":7,"Name":"ישיבת מליאה בתאריך 03/06/1970 בשעה 12:32","StartDate":"1970-06-03T12:32:00+03:00","FinishDate":"1970-06-03T15:25:00+03:00","IsSpecialMeeting":null,"LastUpdatedDate":"2020-11-29T09:45:34.86+02:00"}
{"Id":490791,"Number":77,"KnessetNum":7,"Name":"ישיבת מליאה בתאריך 15/06/1970 בשעה 16:03","StartDate":"1970-06-15T16:03:00+03:00","FinishDate":"1970-06-15T21:22:00+03:00","IsSpecialMeeting":null,"LastUpdatedDate":"2023-02-20T11:32:25.367+02:00"}
{"Id":490792,"Number":78,"KnessetNum":7,"Name":"ישיבת מליאה בתאריך 16/06/1970 בשעה 16:00","StartDate":"1970-06-16T16:00:00+03:00","FinishDate":"1970-06-16T22:15:00+03:00","IsSpecialMeeting":null,"LastUpdatedDate":"2020-11-29T14:27:51.857+02:00"}
{"Id":490793,"Number":79,"KnessetNum":7,"Name":"ישיבת מליאה בתאריך 17/06/1970 בשעה 12:32","StartDate":"1970-06-17T12:32:00+03:00","FinishDate":"1970-06-17T13:55:00+03:00","IsSpecialMeeting":null,"LastUpdatedDate":"2020-11-30T08:13:59.123+02:00"}
{"Id":490794,"Number":81,"KnessetNum":7,"Name":"ישיבת מליאה בתאריך 23/06/1970 בשעה 16:01","StartDate":"1970-06-23T16:01:00+03:00","FinishDate":"1970-06-23T21:19:00+03:00","IsSpecialMeeting":null,"LastUpdatedDate":"2020-11-30T12:14:54.687+02:00"}
{"Id":490795,"Number":84,"KnessetNum":7,"Name":"ישיבת מליאה בתאריך 30/06/1970 בשעה 16:00","StartDate":"1970-06-30T16:00:00+03:00","FinishDate":"1970-06-30T20:35:00+03:00","IsSpecialMeeting":null,"LastUpdatedDate":"2020-11-30T15:50:27.307+02:00"}
{"Id":490796,"Number":86,"KnessetNum":7,"Name":"ישיבת מליאה בתאריך 06/07/1970 בשעה 16:00","StartDate":"1970-07-06T16:00:00+03:00","FinishDate":"1970-07-06T20:46:00+03:00","IsSpecialMeeting":null,"LastUpdatedDate":"2020-12-01T09:49:47.577+02:00"}
{"Id":490797,"Number":87,"KnessetNum":7,"Name":"ישיבת מליאה בתאריך 07/07/1970 בשעה 16:00","StartDate":"1970-07-07T16:00:00+03:00","FinishDate":"1970-07-07T20:28:00+03:00","IsSpecialMeeting":null,"LastUpdatedDate":"2020-12-01T09:52:06.283+02:00"}
{"Id":490798,"Number":88,"KnessetNum":7,"Name":"ישיבת מליאה בתאריך 08/07/1970 בשעה 12:32","StartDate":"1970-07-08T12:32:00+03:00","FinishDate":"1970-07-08T16:13:00+03:00","IsSpecialMeeting":null,"LastUpdatedDate":"2020-12-01T11:09:09.883+02:00"}
{"Id":490799,"Number":91,"KnessetNum":7,"Name":"ישיבת מליאה בתאריך 15/07/1970 בשעה 12:30","StartDate":"1970-07-15T12:30:00+03:00","FinishDate":"1970-07-15T16:27:00+03:00","IsSpecialMeeting":null,"LastUpdatedDate":"2020-12-01T16:39:19.48+02:00"}
{"Id":490800,"Number":92,"KnessetNum":7,"Name":"ישיבת מליאה בתאריך 20/07/1970 בשעה 16:02","StartDate":"1970-07-20T16:02:00+03:00","FinishDate":"1970-07-20T20:32:00+03:00","IsSpecialMeeting":null,"LastUpdatedDate":"2020-12-02T08:45:12.44+02:00"}
{"Id":490801,"Number":95,"KnessetNum":7,"Name":"ישיבת מליאה בתאריך 27/07/1970 בשעה 15:00","StartDate":"1970-07-27T15:00:00+03:00","FinishDate":"1970-07-27T19:27:00+03:00","IsSpecialMeeting":null,"LastUpdatedDate":"2020-12-02T13:48:09.037+02:00"}
{"Id":490802,"Number":98,"KnessetNum":7,"Name":"ישיבת מליאה בתאריך 03/08/1970 בשעה 15:01","StartDate":"1970-08-03T15:01:00+03:00","FinishDate":"1970-08-03T18:51:00+03:00","IsSpecialMeeting":null,"LastUpdatedDate":"2020-12-06T11:45:40.163+02:00"}
{"Id":490803,"Number":99,"KnessetNum":7,"Name":"ישיבת מליאה בתאריך 04/08/1970 בשעה 13:03","StartDate":"1970-08-04T13:03:00+03:00","FinishDate":"1970-08-04T23:22:00+03:00","IsSpecialMeeting":null,"LastUpdatedDate":"2020-12-06T12:50:35.217+02:00"}
{"Id":490804,"Number":104,"KnessetNum":7,"Name":"ישיבת מליאה בתאריך 25/08/1970 בשעה 16:15","StartDate":"1970-08-25T16:15:00+03:00","FinishDate":"1970-08-25T19:06:00+03:00","IsSpecialMeeting":null,"LastUpdatedDate":"2020-12-07T17:53:53.13+02:00"}
{"Id":490805,"Number":106,"KnessetNum":7,"Name":"ישיבת מליאה בתאריך 15/09/1970 בשעה 16:02","StartDate":"1970-09-15T16:02:00+03:00","FinishDate":"1970-09-15T19:10:00+03:00","IsSpecialMeeting":null,"LastUpdatedDate":"2020-12-08T09:17:06.27+02:00"}
{"Id":490806,"Number":110,"KnessetNum":7,"Name":"ישיבת מליאה בתאריך 04/11/1970 בשעה 11:00","StartDate":"1970-11-04T11:00:00+02:00","FinishDate":"1970-11-04T14:00:00+02:00","IsSpecialMeeting":null,"LastUpdatedDate":"2023-09-11T12:03:15.533+03:00"}
{"Id":490807,"Number":114,"KnessetNum":7,"Name":"ישיבת מליאה בתאריך 16/11/1970 בשעה 15:00","StartDate":"1970-11-16T15:00:00+02:00","FinishDate":"1970-11-16T22:03:00+02:00","IsSpecialMeeting":null,"LastUpdatedDate":"2020-12-09T10:09:16.23+02:00"}
{"Id":490808,"Number":115,"KnessetNum":7,"Name":"ישיבת מליאה בתאריך 17/11/1970 בשעה 16:01","StartDate":"1970-11-17T16:01:00+02:00","FinishDate":"1970-11-17T20:30:00+02:00","IsSpecialMeeting":null,"LastUpdatedDate":"2020-12-09T10:49:37.787+02:00"}
{"Id":490809,"Number":116,"KnessetNum":7,"Name":"ישיבת מליאה בתאריך 18/11/1970 בשעה 12:31","StartDate":"1970-11-18T12:31:00+02:00","FinishDate":"1970-11-18T14:15:00+02:00","IsSpecialMeeting":null,"LastUpdatedDate":"2023-09-12T10:41:57.44+03:00"}
{"Id":490810,"Number":122,"KnessetNum":7,"Name":"ישיבת מליאה בתאריך 02/12/1970 בשעה 13:00","StartDate":"1970-12-02T13:00:00+02:00","FinishDate":"1970-12-02T15:19:00+02:00","IsSpecialMeeting":null,"LastUpdatedDate":"2020-12-14T13:58:24.287+02:00"}
{"Id":490811,"Number":126,"KnessetNum":7,"Name":"ישיבת מליאה בתאריך 14/12/1970 בשעה 16:00","StartDate":"1970-12-14T16:00:00+02:00","FinishDate":"1970-12-14T21:16:00+02:00","IsSpecialMeeting":null,"LastUpdatedDate":"2020-12-15T15:09:17.563+02:00"}
{"Id":490812,"Number":128,"KnessetNum":7,"Name":"ישיבת מליאה בתאריך 16/12/1970 בשעה 12:32","StartDate":"1970-12-16T12:32:00+02:00","FinishDate":"1970-12-16T15:04:00+02:00","IsSpecialMeeting":null,"LastUpdatedDate":"2020-12-16T11:52:00.373+02:00"}
{"Id":490813,"Number":132,"KnessetNum":7,"Name":"ישיבת מליאה בתאריך 25/12/1970 בשעה 12:30","StartDate":"1970-12-25T12:30:00+02:00","FinishDate":"1970-12-25T12:50:00+02:00","IsSpecialMeeting":null,"LastUpdatedDate":"2023-09-12T13:59:37.087+03:00"}
{"Id":490814,"Number":133,"KnessetNum":7,"Name":"ישיבת מליאה בתאריך 28/12/1970 בשעה 16:01","StartDate":"1970-12-28T16:01:00+02:00","FinishDate":"1970-12-28T19:51:00+02:00","IsSpecialMeeting":null,"LastUpdatedDate":"2020-12-17T15:14:42.36+02:00"}
{"Id":490815,"Number":142,"KnessetNum":7,"Name":"ישיבת מליאה בתאריך 18/01/1971 בשעה 16:00","StartDate":"1971-01-18T16:00:00+02:00","FinishDate":"1971-01-18T20:00:00+02:00","IsSpecialMeeting":null,"LastUpdatedDate":"2020-12-21T14:23:54.863+02:00"}
{"Id":490816,"Number":144,"KnessetNum":7,"Name":"ישיבת מליאה בתאריך 20/01/1971 בשעה 11:00","StartDate":"1971-01-20T11:00:00+02:00","FinishDate":"1971-01-20T12:55:00+02:00","IsSpecialMeeting":null,"LastUpdatedDate":"2023-09-12T15:50:55.847+03:00"}
{"Id":490817,"Number":145,"KnessetNum":7,"Name":"ישיבת מליאה בתאריך 25/01/1971 בשעה 16:00","StartDate":"1971-01-25T16:00:00+02:00","FinishDate":"1971-01-25T21:25:00+02:00","IsSpecialMeeting":null,"LastUpdatedDate":"2020-12-21T17:42:39.983+02:00"}
{"Id":490818,"Number":148,"KnessetNum":7,"Name":"ישיבת מליאה בתאריך 01/02/1971 בשעה 16:01","StartDate":"1971-02-01T16:01:00+02:00","FinishDate":"1971-02-01T20:34:00+02:00","IsSpecialMeeting":null,"LastUpdatedDate":"2020-12-22T15:29:23.93+02:00"}
{"Id":490819,"Number":150,"KnessetNum":7,"Name":"ישיבת מליאה בתאריך 03/02/1971 בשעה 11:00","StartDate":"1971-02-03T11:00:00+02:00","FinishDate":"1971-02-03T14:00:00+02:00","IsSpecialMeeting":null,"LastUpdatedDate":"2020-12-23T09:14:14.34+02:00"}
{"Id":490820,"Number":151,"KnessetNum":7,"Name":"ישיבת מליאה בתאריך 08/02/1971 בשעה 16:00","StartDate":"1971-02-08T16:00:00+02:00","FinishDate":"1971-02-08T21:10:00+02:00","IsSpecialMeeting":null,"LastUpdatedDate":"2020-12-23T09:23:04.98+02:00"}
{"Id":490821,"Number":153,"KnessetNum":7,"Name":"ישיבת מליאה בתאריך 10/02/1971 בשעה 12:30","StartDate":"1971-02-10T12:30:00+02:00","FinishDate":"1971-02-10T15:04:00+02:00","IsSpecialMeeting":null,"LastUpdatedDate":"2020-12-23T11:18:31.76+02:00"}
{"Id":490822,"Number":154,"KnessetNum":7,"Name":"ישיבת מליאה בתאריך 15/02/1971 בשעה 16:00","StartDate":"1971-02-15T16:00:00+02:00","FinishDate":"1971-02-15T21:06:00+02:00","IsSpecialMeeting":null,"LastUpdatedDate":"2020-12-23T11:32:37.373+02:00"}
{"Id":490823,"Number":156,"KnessetNum":7,"Name":"ישיבת מליאה בתאריך 17/02/1971 בשעה 11:00","StartDate":"1971-02-17T11:00:00+02:00","FinishDate":"1971-02-17T14:31:00+02:00","IsSpecialMeeting":null,"LastUpdatedDate":"2023-09-13T13:18:12.26+03:00"}
{"Id":490824,"Number":158,"KnessetNum":7,"Name":"ישיבת מליאה בתאריך 23/02/1971 בשעה 15:00","StartDate":"1971-02-23T15:00:00+02:00","FinishDate":"1971-02-23T21:39:00+02:00","IsSpecialMeeting":null,"LastUpdatedDate":"2020-12-24T13:14:35.037+02:00"}
{"Id":490825,"Number":160,"KnessetNum":7,"Name":"ישיבת מליאה בתאריך 01/03/1971 בשעה 11:00","StartDate":"1971-03-01T11:00:00+02:00","FinishDate":"1971-03-01T21:25:00+02:00","IsSpecialMeeting":null,"LastUpdatedDate":"2020-12-27T12:27:51.093+02:00"}
{"Id":490826,"Number":161,"KnessetNum":7,"Name":"ישיבת מליאה בתאריך 02/03/1971 בשעה 15:00","StartDate":"1971-03-02T15:00:00+02:00","FinishDate":"1971-03-02T15:00:00+02:00","IsSpecialMeeting":null,"LastUpdatedDate":"2020-12-27T14:39:23.897+02:00"}
{"Id":490827,"Number":162,"KnessetNum":7,"Name":"ישיבת מליאה בתאריך 03/03/1971 בשעה 11:02","StartDate":"1971-03-03T11:02:00+02:00","FinishDate":"1971-03-03T12:40:00+02:00","IsSpecialMeeting":null,"LastUpdatedDate":"2020-12-28T10:27:54.49+02:00"}
{"Id":490828,"Number":163,"KnessetNum":7,"Name":"ישיבת מליאה בתאריך 08/03/1971 בשעה 15:00","StartDate":"1971-03-08T15:00:00+02:00","FinishDate":"1971-03-08T20:46:00+02:00","IsSpecialMeeting":null,"LastUpdatedDate":"2020-12-28T11:42:07.807+02:00"}
{"Id":490829,"Number":164,"KnessetNum":7,"Name":"ישיבת מליאה בתאריך 09/03/1971 בשעה 15:00","StartDate":"1971-03-09T15:00:00+02:00","FinishDate":"1971-03-09T20:07:00+02:00","IsSpecialMeeting":null,"LastUpdatedDate":"2023-09-13T13:48:56+03:00"}
{"Id":490830,"Number":165,"KnessetNum":7,"Name":"ישיבת מליאה בתאריך 10/03/1971 בשעה 11:00","StartDate":"1971-03-10T11:00:00+02:00","FinishDate":"1971-03-10T16:25:00+02:00","IsSpecialMeeting":null,"LastUpdatedDate":"2023-09-13T13:54:40.75+03:00"}
{"Id":490831,"Number":170,"KnessetNum":7,"Name":"ישיבת מליאה בתאריך 23/03/1971 בשעה 15:00","StartDate":"1971-03-23T15:00:00+02:00","FinishDate":"1971-03-23T21:40:00+02:00","IsSpecialMeeting":null,"LastUpdatedDate":"2020-12-31T11:18:42.423+02:00"}
{"Id":490832,"Number":176,"KnessetNum":7,"Name":"ישיבת מליאה בתאריך 13/04/1971 בשעה 11:00","StartDate":"1971-04-13T11:00:00+03:00","FinishDate":"1971-04-13T11:45:00+03:00","IsSpecialMeeting":null,"LastUpdatedDate":"2020-12-31T13:11:23.533+02:00"}
{"Id":490833,"Number":178,"KnessetNum":7,"Name":"ישיבת מליאה בתאריך 04/05/1971 בשעה 16:03","StartDate":"1971-05-04T16:03:00+03:00","FinishDate":"1971-05-04T19:01:00+03:00","IsSpecialMeeting":null,"LastUpdatedDate":"2021-01-03T09:31:04.237+02:00"}
{"Id":490834,"Number":179,"KnessetNum":7,"Name":"ישיבת מליאה בתאריך 05/05/1971 בשעה 11:02","StartDate":"1971-05-05T11:02:00+03:00","FinishDate":"1971-05-05T12:20:00+03:00","IsSpecialMeeting":null,"LastUpdatedDate":"2025-01-27T08:22:49.057+02:00"}
{"Id":490835,"Number":180,"KnessetNum":7,"Name":"ישיבת מליאה בתאריך 10/05/1971 בשעה 16:00","StartDate":"1971-05-10T16:00:00+03:00","FinishDate":"1971-05-10T19:17:00+03:00","IsSpecialMeeting":null,"LastUpdatedDate":"2021-01-03T11:29:11.543+02:00"}
{"Id":490836,"Number":189,"KnessetNum":7,"Name":"ישיבת מליאה בתאריך 31/05/1971 בשעה 16:00","StartDate":"1971-05-31T16:00:00+03:00","FinishDate":"1971-05-31T20:31:00+03:00","IsSpecialMeeting":null,"LastUpdatedDate":"2021-01-05T09:17:08.6+02:00"}
{"Id":490837,"Number":193,"KnessetNum":7,"Name":"ישיבת מליאה בתאריך 08/06/1971 בשעה 16:00","StartDate":"1971-06-08T16:00:00+03:00","FinishDate":"1971-06-08T18:45:00+03:00","IsSpecialMeeting":null,"LastUpdatedDate":"2023-09-18T11:57:37.23+03:00"}
{"Id":490838,"Number":194,"KnessetNum":7,"Name":"ישיבת מליאה בתאריך 09/06/1971 בשעה 09:40","StartDate":"1971-06-09T09:40:00+03:00","FinishDate":"1971-06-09T16:27:00+03:00","IsSpecialMeeting":null,"LastUpdatedDate":"2021-01-05T11:48:03.26+02:00"}
{"Id":490839,"Number":195,"KnessetNum":7,"Name":"ישיבת מליאה בתאריך 14/06/1971 בשעה 16:00","StartDate":"1971-06-14T16:00:00+03:00","FinishDate":"1971-06-14T22:15:00+03:00","IsSpecialMeeting":null,"LastUpdatedDate":"2021-01-05T11:54:47.623+02:00"}
{"Id":490840,"Number":196,"KnessetNum":7,"Name":"ישיבת מליאה בתאריך 15/06/1971 בשעה 16:00","StartDate":"1971-06-15T16:00:00+03:00","FinishDate":"1971-06-15T19:35:00+03:00","IsSpecialMeeting":null,"LastUpdatedDate":"2021-01-05T15:42:10.043+02:00"}
{"Id":490841,"Number":198,"KnessetNum":7,"Name":"ישיבת מליאה בתאריך 21/06/1971 בשעה 16:00","StartDate":"1971-06-21T16:00:00+03:00","FinishDate":"1971-06-21T20:12:00+03:00","IsSpecialMeeting":null,"LastUpdatedDate":"2023-09-18T12:29:51.507+03:00"}
{"Id":490842,"Number":200,"KnessetNum":7,"Name":"ישיבת מליאה בתאריך 23/06/1971 בשעה 11:00","StartDate":"1971-06-23T11:00:00+03:00","FinishDate":"1971-06-23T15:00:00+03:00","IsSpecialMeeting":null,"LastUpdatedDate":"2023-09-18T12:39:00.277+03:00"}
{"Id":490843,"Number":201,"KnessetNum":7,"Name":"ישיבת מליאה בתאריך 28/06/1971 בשעה 15:00","StartDate":"1971-06-28T15:00:00+03:00","FinishDate":"1971-06-28T20:12:00+03:00","IsSpecialMeeting":null,"LastUpdatedDate":"2025-01-27T08:25:43.897+02:00"}
{"Id":490844,"Number":205,"KnessetNum":7,"Name":"ישיבת מליאה בתאריך 05/07/1971 בשעה 16:01","StartDate":"1971-07-05T16:01:00+03:00","FinishDate":"1971-07-05T19:41:00+03:00","IsSpecialMeeting":null,"LastUpdatedDate":"2023-09-18T13:03:50.893+03:00"}
{"Id":490845,"Number":208,"KnessetNum":7,"Name":"ישיבת מליאה בתאריך 12/07/1971 בשעה 15:00","StartDate":"1971-07-12T15:00:00+03:00","FinishDate":"1971-07-12T20:25:00+03:00","IsSpecialMeeting":null,"LastUpdatedDate":"2021-01-10T12:42:40.53+02:00"}
{"Id":490846,"Number":209,"KnessetNum":7,"Name":"ישיבת מליאה בתאריך 13/07/1971 בשעה 15:00","StartDate":"1971-07-13T15:00:00+03:00","FinishDate":"1971-07-13T20:00:00+03:00","IsSpecialMeeting":null,"LastUpdatedDate":"2021-01-10T14:47:20.307+02:00"}
{"Id":490847,"Number":211,"KnessetNum":7,"Name":"ישיבת מליאה בתאריך 19/07/1971 בשעה 15:02","StartDate":"1971-07-19T15:02:00+03:00","FinishDate":"1971-07-19T21:15:00+03:00","IsSpecialMeeting":null,"LastUpdatedDate":"2021-01-11T11:45:27.697+02:00"}
{"Id":490848,"Number":217,"KnessetNum":7,"Name":"ישיבת מליאה בתאריך 28/07/1971 בשעה 09:02","StartDate":"1971-07-28T09:02:00+03:00","FinishDate":"1971-07-28T14:40:00+03:00","IsSpecialMeeting":null,"LastUpdatedDate":"2021-01-12T14:43:34.653+02:00"}
{"Id":490849,"Number":218,"KnessetNum":7,"Name":"ישיבת מליאה בתאריך 10/08/1971 בשעה 11:02","StartDate":"1971-08-10T11:02:00+03:00","FinishDate":"1971-08-10T12:47:00+03:00","IsSpecialMeeting":null,"LastUpdatedDate":"2021-01-12T15:07:50.57+02:00"}
{"Id":490850,"Number":220,"KnessetNum":7,"Name":"ישיבת מליאה בתאריך 13/09/1971 בשעה 11:02","StartDate":"1971-09-13T11:02:00+03:00","FinishDate":"1971-09-13T13:07:00+03:00","IsSpecialMeeting":null,"LastUpdatedDate":"2021-01-13T08:40:06.787+02:00"}
{"Id":490851,"Number":221,"KnessetNum":7,"Name":"ישיבת מליאה בתאריך 25/10/1971 בשעה 16:00","StartDate":"1971-10-25T16:00:00+02:00","FinishDate":"1971-10-25T16:57:00+02:00","IsSpecialMeeting":null,"LastUpdatedDate":"2021-01-13T08:51:16.693+02:00"}
{"Id":490852,"Number":222,"KnessetNum":7,"Name":"ישיבת מליאה בתאריך 26/10/1971 בשעה 16:00","StartDate":"1971-10-26T16:00:00+02:00","FinishDate":"1971-10-26T22:38:00+02:00","IsSpecialMeeting":null,"LastUpdatedDate":"2021-01-13T08:55:41.723+02:00"}
{"Id":490853,"Number":224,"KnessetNum":7,"Name":"ישיבת מליאה בתאריך 01/11/1971 בשעה 16:00","StartDate":"1971-11-01T16:00:00+02:00","FinishDate":"1971-11-01T21:57:00+02:00","IsSpecialMeeting":null,"LastUpdatedDate":"2023-09-26T15:11:23.623+03:00"}
{"Id":490854,"Number":226,"KnessetNum":7,"Name":"ישיבת מליאה בתאריך 03/11/1971 בשעה 11:00","StartDate":"1971-11-03T11:00:00+02:00","FinishDate":"1971-11-03T13:25:00+02:00","IsSpecialMeeting":null,"LastUpdatedDate":"2021-01-13T14:18:56.39+02:00"}
{"Id":490855,"Number":230,"KnessetNum":7,"Name":"ישיבת מליאה בתאריך 15/11/1971 בשעה 16:00","StartDate":"1971-11-15T16:00:00+02:00","FinishDate":"1971-11-15T21:05:00+02:00","IsSpecialMeeting":null,"LastUpdatedDate":"2021-01-14T13:08:31.06+02:00"}
{"Id":490856,"Number":232,"KnessetNum":7,"Name":"ישיבת מליאה בתאריך 17/11/1971 בשעה 11:00","StartDate":"1971-11-17T11:00:00+02:00","FinishDate":"1971-11-17T13:17:00+02:00","IsSpecialMeeting":null,"LastUpdatedDate":"2021-01-17T12:07:17.88+02:00"}
{"Id":490857,"Number":238,"KnessetNum":7,"Name":"ישיבת מליאה בתאריך 01/12/1971 בשעה 11:00","StartDate":"1971-12-01T11:00:00+02:00","FinishDate":"1971-12-01T13:29:00+02:00","IsSpecialMeeting":null,"LastUpdatedDate":"2021-01-18T12:34:56.513+02:00"}
{"Id":490858,"Number":242,"KnessetNum":7,"Name":"ישיבת מליאה בתאריך 13/12/1971 בשעה 16:00","StartDate":"1971-12-13T16:00:00+02:00","FinishDate":"1971-12-13T22:15:00+02:00","IsSpecialMeeting":null,"LastUpdatedDate":"2021-01-19T14:01:20.923+02:00"}
{"Id":490859,"Number":243,"KnessetNum":7,"Name":"ישיבת מליאה בתאריך 14/12/1971 בשעה 16:02","StartDate":"1971-12-14T16:02:00+02:00","FinishDate":"1971-12-14T20:03:00+02:00","IsSpecialMeeting":null,"LastUpdatedDate":"2023-11-16T00:58:07.153+02:00"}
{"Id":490860,"Number":244,"KnessetNum":7,"Name":"ישיבת מליאה בתאריך 15/12/1971 בשעה 11:00","StartDate":"1971-12-15T11:00:00+02:00","FinishDate":"1971-12-15T12:29:00+02:00","IsSpecialMeeting":null,"LastUpdatedDate":"2023-11-19T10:55:40.517+02:00"}
{"Id":490861,"Number":254,"KnessetNum":7,"Name":"ישיבת מליאה בתאריך 10/01/1972 בשעה 16:00","StartDate":"1972-01-10T16:00:00+02:00","FinishDate":"1972-01-10T20:52:00+02:00","IsSpecialMeeting":null,"LastUpdatedDate":"2021-01-24T09:49:34.283+02:00"}
{"Id":490862,"Number":256,"KnessetNum":7,"Name":"ישיבת מליאה בתאריך 12/01/1972 בשעה 11:00","StartDate":"1972-01-12T11:00:00+02:00","FinishDate":"1972-01-12T14:03:00+02:00","IsSpecialMeeting":null,"LastUpdatedDate":"2021-01-24T11:51:43.897+02:00"}
{"Id":490863,"Number":262,"KnessetNum":7,"Name":"ישיבת מליאה בתאריך 26/01/1972 בשעה 11:00","StartDate":"1972-01-26T11:00:00+02:00","FinishDate":"1972-01-26T12:38:00+02:00","IsSpecialMeeting":null,"LastUpdatedDate":"2021-01-25T14:41:04.21+02:00"}
{"Id":490864,"Number":263,"KnessetNum":7,"Name":"ישיבת מליאה בתאריך 31/01/1972 בשעה 16:00","StartDate":"1972-01-31T16:00:00+02:00","FinishDate":"1972-01-31T19:37:00+02:00","IsSpecialMeeting":null,"LastUpdatedDate":"2021-01-26T09:36:54.997+02:00"}
{"Id":490865,"Number":264,"KnessetNum":7,"Name":"ישיבת מליאה בתאריך 01/02/1972 בשעה 16:01","StartDate":"1972-02-01T16:01:00+02:00","FinishDate":"1972-02-01T20:28:00+02:00","IsSpecialMeeting":null,"LastUpdatedDate":"2021-01-26T07:47:40.727+02:00"}
{"Id":490866,"Number":266,"KnessetNum":7,"Name":"ישיבת מליאה בתאריך 07/02/1972 בשעה 16:10","StartDate":"1972-02-07T16:10:00+02:00","FinishDate":"1972-02-07T21:40:00+02:00","IsSpecialMeeting":null,"LastUpdatedDate":"2021-01-26T10:57:16.733+02:00"}
{"Id":490867,"Number":269,"KnessetNum":7,"Name":"ישיבת מליאה בתאריך 14/02/1972 בשעה 16:00","StartDate":"1972-02-14T16:00:00+02:00","FinishDate":"1972-02-14T20:30:00+02:00","IsSpecialMeeting":null,"LastUpdatedDate":"2021-01-26T14:05:16.043+02:00"}
{"Id":490868,"Number":274,"KnessetNum":7,"Name":"ישיבת מליאה בתאריך 23/02/1972 בשעה 11:30","StartDate":"1972-02-23T11:30:00+02:00","FinishDate":"1972-02-23T14:04:00+02:00","IsSpecialMeeting":null,"LastUpdatedDate":"2023-11-20T02:25:38.743+02:00"}
{"Id":490869,"Number":275,"KnessetNum":7,"Name":"ישיבת מליאה בתאריך 28/02/1972 בשעה 10:00","StartDate":"1972-02-28T10:00:00+02:00","FinishDate":"1972-02-28T15:33:00+02:00","IsSpecialMeeting":null,"LastUpdatedDate":"2023-11-20T02:30:20.147+02:00"}
{"Id":490870,"Number":278,"KnessetNum":7,"Name":"ישיבת מליאה בתאריך 07/03/1972 בשעה 16:01","StartDate":"1972-03-07T16:01:00+02:00","FinishDate":"1972-03-07T20:02:00+02:00","IsSpecialMeeting":null,"LastUpdatedDate":"2021-02-03T14:44:17.377+02:00"}
{"Id":490871,"Number":282,"KnessetNum":7,"Name":"ישיבת מליאה בתאריך 14/03/1972 בשעה 15:00","StartDate":"1972-03-14T15:00:00+02:00","FinishDate":"1972-03-14T20:02:00+02:00","IsSpecialMeeting":null,"LastUpdatedDate":"2023-11-20T03:05:31.527+02:00"}
{"Id":490872,"Number":284,"KnessetNum":7,"Name":"ישיבת מליאה בתאריך 16/03/1972 בשעה 11:18","StartDate":"1972-03-16T11:18:00+02:00","FinishDate":"1972-03-16T18:04:00+02:00","IsSpecialMeeting":null,"LastUpdatedDate":"2023-11-20T03:11:45.937+02:00"}
{"Id":490873,"Number":289,"KnessetNum":7,"Name":"ישיבת מליאה בתאריך 27/03/1972 בשעה 11:00","StartDate":"1972-03-27T11:00:00+02:00","FinishDate":"1972-03-27T13:10:00+02:00","IsSpecialMeeting":null,"LastUpdatedDate":"2021-02-01T10:21:30.97+02:00"}
{"Id":490874,"Number":290,"KnessetNum":7,"Name":"ישיבת מליאה בתאריך 13/04/1972 בשעה 11:00","StartDate":"1972-04-13T11:00:00+03:00","FinishDate":"1972-04-13T11:38:00+03:00","IsSpecialMeeting":null,"LastUpdatedDate":"2023-11-20T03:55:24.613+02:00"}
{"Id":490875,"Number":295,"KnessetNum":7,"Name":"ישיבת מליאה בתאריך 03/05/1972 בשעה 16:01","StartDate":"1972-05-03T16:01:00+03:00","FinishDate":"1972-05-03T20:20:00+03:00","IsSpecialMeeting":null,"LastUpdatedDate":"2021-02-02T08:40:20.5+02:00"}
{"Id":490876,"Number":296,"KnessetNum":7,"Name":"ישיבת מליאה בתאריך 04/05/1972 בשעה 11:00","StartDate":"1972-05-04T11:00:00+03:00","FinishDate":"1972-05-04T13:15:00+03:00","IsSpecialMeeting":null,"LastUpdatedDate":"2023-11-20T11:20:30.65+02:00"}
{"Id":490877,"Number":297,"KnessetNum":7,"Name":"ישיבת מליאה בתאריך 08/05/1972 בשעה 16:02","StartDate":"1972-05-08T16:02:00+03:00","FinishDate":"1972-05-08T21:05:00+03:00","IsSpecialMeeting":null,"LastUpdatedDate":"2021-02-02T09:24:36.267+02:00"}
{"Id":490878,"Number":298,"KnessetNum":7,"Name":"ישיבת מליאה בתאריך 09/05/1972 בשעה 16:03","StartDate":"1972-05-09T16:03:00+03:00","FinishDate":"1972-05-09T20:25:00+03:00","IsSpecialMeeting":null,"LastUpdatedDate":"2021-02-02T10:36:50.437+02:00"}
{"Id":490879,"Number":299,"KnessetNum":7,"Name":"ישיבת מליאה בתאריך 10/05/1972 בשעה 11:02","StartDate":"1972-05-10T11:02:00+03:00","FinishDate":"1972-05-10T15:28:00+03:00","IsSpecialMeeting":null,"LastUpdatedDate":"2023-11-20T11:37:51.323+02:00"}
{"Id":490880,"Number":300,"KnessetNum":7,"Name":"ישיבת מליאה בתאריך 15/05/1972 בשעה 16:00","StartDate":"1972-05-15T16:00:00+03:00","FinishDate":"1972-05-15T20:02:00+03:00","IsSpecialMeeting":null,"LastUpdatedDate":"2021-02-02T13:38:11.517+02:00"}
{"Id":490881,"Number":302,"KnessetNum":7,"Name":"ישיבת מליאה בתאריך 17/05/1972 בשעה 11:02","StartDate":"1972-05-17T11:02:00+03:00","FinishDate":"1972-05-17T13:27:00+03:00","IsSpecialMeeting":null,"LastUpdatedDate":"2021-02-03T10:04:44.643+02:00"}
{"Id":490882,"Number":303,"KnessetNum":7,"Name":"ישיבת מליאה בתאריך 22/05/1972 בשעה 16:00","StartDate":"1972-05-22T16:00:00+03:00","FinishDate":"1972-05-22T21:06:00+03:00","IsSpecialMeeting":null,"LastUpdatedDate":"2021-02-03T10:22:45.403+02:00"}
{"Id":490883,"Number":304,"KnessetNum":7,"Name":"ישיבת מליאה בתאריך 23/05/1972 בשעה 15:00","StartDate":"1972-05-23T15:00:00+03:00","FinishDate":"1972-05-23T20:23:00+03:00","IsSpecialMeeting":null,"LastUpdatedDate":"2023-11-21T00:44:20.283+02:00"}
{"Id":490884,"Number":306,"KnessetNum":7,"Name":"ישיבת מליאה בתאריך 29/05/1972 בשעה 16:02","StartDate":"1972-05-29T16:02:00+03:00","FinishDate":"1972-05-29T19:33:00+03:00","IsSpecialMeeting":null,"LastUpdatedDate":"2023-11-21T00:51:07.583+02:00"}
{"Id":490885,"Number":308,"KnessetNum":7,"Name":"ישיבת מליאה בתאריך 31/05/1972 בשעה 11:35","StartDate":"1972-05-31T11:35:00+03:00","FinishDate":"1972-05-31T11:50:00+03:00","IsSpecialMeeting":null,"LastUpdatedDate":"2021-02-04T11:39:14.847+02:00"}
{"Id":490886,"Number":309,"KnessetNum":7,"Name":"ישיבת מליאה בתאריך 05/06/1972 בשעה 16:02","StartDate":"1972-06-05T16:02:00+03:00","FinishDate":"1972-06-05T20:25:00+03:00","IsSpecialMeeting":null,"LastUpdatedDate":"2021-02-04T12:17:41.543+02:00"}
{"Id":490887,"Number":310,"KnessetNum":7,"Name":"ישיבת מליאה בתאריך 06/06/1972 בשעה 15:03","StartDate":"1972-06-06T15:03:00+03:00","FinishDate":"1972-06-06T20:20:00+03:00","IsSpecialMeeting":null,"LastUpdatedDate":"2021-02-07T07:48:16.533+02:00"}
{"Id":490888,"Number":312,"KnessetNum":7,"Name":"ישיבת מליאה בתאריך 08/06/1972 בשעה 11:04","StartDate":"1972-06-08T11:04:00+03:00","FinishDate":"1972-06-08T15:18:00+03:00","IsSpecialMeeting":null,"LastUpdatedDate":"2023-11-21T01:08:18.113+02:00"}
{"Id":490889,"Number":313,"KnessetNum":7,"Name":"ישיבת מליאה בתאריך 12/06/1972 בשעה 16:01","StartDate":"1972-06-12T16:01:00+03:00","FinishDate":"1972-06-12T22:02:00+03:00","IsSpecialMeeting":null,"LastUpdatedDate":"2021-02-07T12:17:07.89+02:00"}
{"Id":490890,"Number":316,"KnessetNum":7,"Name":"ישיבת מליאה בתאריך 15/06/1972 בשעה 11:12","StartDate":"1972-06-15T11:12:00+03:00","FinishDate":"1972-06-15T13:06:00+03:00","IsSpecialMeeting":null,"LastUpdatedDate":"2021-02-08T09:01:25.37+02:00"}
{"Id":490891,"Number":317,"KnessetNum":7,"Name":"ישיבת מליאה בתאריך 19/06/1972 בשעה 16:03","StartDate":"1972-06-19T16:03:00+03:00","FinishDate":"1972-06-19T20:49:00+03:00","IsSpecialMeeting":null,"LastUpdatedDate":"2021-02-08T09:30:55.163+02:00"}
{"Id":490892,"Number":323,"KnessetNum":7,"Name":"ישיבת מליאה בתאריך 03/07/1972 בשעה 16:00","StartDate":"1972-07-03T16:00:00+03:00","FinishDate":"1972-07-03T20:50:00+03:00","IsSpecialMeeting":null,"LastUpdatedDate":"2021-02-09T09:21:45.497+02:00"}
{"Id":490893,"Number":326,"KnessetNum":7,"Name":"ישיבת מליאה בתאריך 10/07/1972 בשעה 16:03","StartDate":"1972-07-10T16:03:00+03:00","FinishDate":"1972-07-10T19:53:00+03:00","IsSpecialMeeting":null,"LastUpdatedDate":"2021-02-10T09:53:39.957+02:00"}
{"Id":490894,"Number":334,"KnessetNum":7,"Name":"ישיבת מליאה בתאריך 26/07/1972 בשעה 09:00","StartDate":"1972-07-26T09:00:00+03:00","FinishDate":"1972-07-26T15:12:00+03:00","IsSpecialMeeting":null,"LastUpdatedDate":"2021-02-16T08:08:52.05+02:00"}
{"Id":490895,"Number":335,"KnessetNum":7,"Name":"ישיבת מליאה בתאריך 15/08/1972 בשעה 11:02","StartDate":"1972-08-15T11:02:00+03:00","FinishDate":"1972-08-15T12:56:00+03:00","IsSpecialMeeting":null,"LastUpdatedDate":"2021-02-16T08:39:08.76+02:00"}
{"Id":490896,"Number":337,"KnessetNum":7,"Name":"ישיבת מליאה בתאריך 23/08/1972 בשעה 11:03","StartDate":"1972-08-23T11:03:00+03:00","FinishDate":"1972-08-23T14:00:00+03:00","IsSpecialMeeting":null,"LastUpdatedDate":"2021-02-16T09:08:06.527+02:00"}
{"Id":490897,"Number":338,"KnessetNum":7,"Name":"ישיבת מליאה בתאריך 05/09/1972 בשעה 14:50","StartDate":"1972-09-05T14:50:00+03:00","FinishDate":"1972-09-05T14:59:00+03:00","IsSpecialMeeting":null,"LastUpdatedDate":"2021-02-16T09:27:48.61+02:00"}
{"Id":490898,"Number":339,"KnessetNum":7,"Name":"ישיבת מליאה בתאריך 12/09/1972 בשעה 10:04","StartDate":"1972-09-12T10:04:00+03:00","FinishDate":"1972-09-12T16:37:00+03:00","IsSpecialMeeting":null,"LastUpdatedDate":"2023-11-28T13:02:44.187+02:00"}
{"Id":490899,"Number":340,"KnessetNum":7,"Name":"ישיבת מליאה בתאריך 20/09/1972 בשעה 16:02","StartDate":"1972-09-20T16:02:00+03:00","FinishDate":"1972-09-20T18:00:00+03:00","IsSpecialMeeting":null,"LastUpdatedDate":"2021-02-16T10:10:38.01+02:00"}
{"Id":490900,"Number":341,"KnessetNum":7,"Name":"ישיבת מליאה בתאריך 16/10/1972 בשעה 16:00","StartDate":"1972-10-16T16:00:00+02:00","FinishDate":"1972-10-16T21:33:00+02:00","IsSpecialMeeting":null,"LastUpdatedDate":"2021-02-16T10:47:29.673+02:00"}
{"Id":490901,"Number":348,"KnessetNum":7,"Name":"ישיבת מליאה בתאריך 31/10/1972 בשעה 15:02","StartDate":"1972-10-31T15:02:00+02:00","FinishDate":"1972-10-31T21:15:00+02:00","IsSpecialMeeting":null,"LastUpdatedDate":"2023-12-04T00:45:18.703+02:00"}
{"Id":490902,"Number":349,"KnessetNum":7,"Name":"ישיבת מליאה בתאריך 01/11/1972 בשעה 11:00","StartDate":"1972-11-01T11:00:00+02:00","FinishDate":"1972-11-01T14:09:00+02:00","IsSpecialMeeting":null,"LastUpdatedDate":"2021-02-17T14:37:55.67+02:00"}
{"Id":490903,"Number":350,"KnessetNum":7,"Name":"ישיבת מליאה בתאריך 06/11/1972 בשעה 16:00","StartDate":"1972-11-06T16:00:00+02:00","FinishDate":"1972-11-06T21:21:00+02:00","IsSpecialMeeting":null,"LastUpdatedDate":"2021-02-17T15:00:23.617+02:00"}
{"Id":490904,"Number":352,"KnessetNum":7,"Name":"ישיבת מליאה בתאריך 08/11/1972 בשעה 11:02","StartDate":"1972-11-08T11:02:00+02:00","FinishDate":"1972-11-08T15:05:00+02:00","IsSpecialMeeting":null,"LastUpdatedDate":"2021-02-18T09:34:28.35+02:00"}
{"Id":490905,"Number":353,"KnessetNum":7,"Name":"ישיבת מליאה בתאריך 13/11/1972 בשעה 16:00","StartDate":"1972-11-13T16:00:00+02:00","FinishDate":"1972-11-13T20:10:00+02:00","IsSpecialMeeting":null,"LastUpdatedDate":"2023-12-04T00:57:11.097+02:00"}
{"Id":490906,"Number":355,"KnessetNum":7,"Name":"ישיבת מליאה בתאריך 15/11/1972 בשעה 11:01","StartDate":"1972-11-15T11:01:00+02:00","FinishDate":"1972-11-15T16:27:00+02:00","IsSpecialMeeting":null,"LastUpdatedDate":"2023-12-04T01:05:52.167+02:00"}
{"Id":490907,"Number":360,"KnessetNum":7,"Name":"ישיבת מליאה בתאריך 28/11/1972 בשעה 16:00","StartDate":"1972-11-28T16:00:00+02:00","FinishDate":"1972-11-28T20:25:00+02:00","IsSpecialMeeting":null,"LastUpdatedDate":"2023-12-04T01:17:30.403+02:00"}
{"Id":490908,"Number":361,"KnessetNum":7,"Name":"ישיבת מליאה בתאריך 29/11/1972 בשעה 11:02","StartDate":"1972-11-29T11:02:00+02:00","FinishDate":"1972-11-29T14:13:00+02:00","IsSpecialMeeting":null,"LastUpdatedDate":"2023-12-28T09:52:18.843+02:00"}
{"Id":490909,"Number":362,"KnessetNum":7,"Name":"ישיבת מליאה בתאריך 04/12/1972 בשעה 16:02","StartDate":"1972-12-04T16:02:00+02:00","FinishDate":"1972-12-04T20:00:00+02:00","IsSpecialMeeting":null,"LastUpdatedDate":"2021-03-09T11:54:33.85+02:00"}
{"Id":490910,"Number":379,"KnessetNum":7,"Name":"ישיבת מליאה בתאריך 15/01/1973 בשעה 16:00","StartDate":"1973-01-15T16:00:00+02:00","FinishDate":"1973-01-15T19:29:00+02:00","IsSpecialMeeting":null,"LastUpdatedDate":"2021-03-02T08:51:03.803+02:00"}
{"Id":490911,"Number":381,"KnessetNum":7,"Name":"ישיבת מליאה בתאריך 17/01/1973 בשעה 11:00","StartDate":"1973-01-17T11:00:00+02:00","FinishDate":"1973-01-17T14:50:00+02:00","IsSpecialMeeting":null,"LastUpdatedDate":"2021-06-02T09:25:11.657+03:00"}
{"Id":490912,"Number":382,"KnessetNum":7,"Name":"ישיבת מליאה בתאריך 22/01/1973 בשעה 16:03","StartDate":"1973-01-22T16:03:00+02:00","FinishDate":"1973-01-22T20:33:00+02:00","IsSpecialMeeting":null,"LastUpdatedDate":"2021-03-02T10:27:52.193+02:00"}
{"Id":490913,"Number":383,"KnessetNum":7,"Name":"ישיבת מליאה בתאריך 23/01/1973 בשעה 16:03","StartDate":"1973-01-23T16:03:00+02:00","FinishDate":"1973-01-23T18:55:00+02:00","IsSpecialMeeting":null,"LastUpdatedDate":"2021-03-02T10:56:50.25+02:00"}
{"Id":490914,"Number":385,"KnessetNum":7,"Name":"ישיבת מליאה בתאריך 29/01/1973 בשעה 16:00","StartDate":"1973-01-29T16:00:00+02:00","FinishDate":"1973-01-29T20:32:00+02:00","IsSpecialMeeting":null,"LastUpdatedDate":"2021-03-02T11:35:35.327+02:00"}
{"Id":490915,"Number":391,"KnessetNum":7,"Name":"ישיבת מליאה בתאריך 12/02/1973 בשעה 16:01","StartDate":"1973-02-12T16:01:00+02:00","FinishDate":"1973-02-12T22:19:00+02:00","IsSpecialMeeting":null,"LastUpdatedDate":"2021-03-04T13:33:47.73+02:00"}
{"Id":490916,"Number":397,"KnessetNum":7,"Name":"ישיבת מליאה בתאריך 26/02/1973 בשעה 16:06","StartDate":"1973-02-26T16:06:00+02:00","FinishDate":"1973-02-26T19:56:00+02:00","IsSpecialMeeting":null,"LastUpdatedDate":"2021-03-09T11:56:33.093+02:00"}
{"Id":490917,"Number":401,"KnessetNum":7,"Name":"ישיבת מליאה בתאריך 06/03/1973 בשעה 15:00","StartDate":"1973-03-06T15:00:00+02:00","FinishDate":"1973-03-06T20:43:00+02:00","IsSpecialMeeting":null,"LastUpdatedDate":"2021-03-15T12:09:13.553+02:00"}
{"Id":490918,"Number":406,"KnessetNum":7,"Name":"ישיבת מליאה בתאריך 20/03/1973 בשעה 16:00","StartDate":"1973-03-20T16:00:00+02:00","FinishDate":"1973-03-20T21:10:00+02:00","IsSpecialMeeting":null,"LastUpdatedDate":"2021-03-16T13:52:35.647+02:00"}
{"Id":490919,"Number":409,"KnessetNum":7,"Name":"ישיבת מליאה בתאריך 26/03/1973 בשעה 16:02","StartDate":"1973-03-26T16:02:00+02:00","FinishDate":"1973-03-26T19:20:00+02:00","IsSpecialMeeting":null,"LastUpdatedDate":"2021-04-07T13:10:25.327+03:00"}
{"Id":490920,"Number":410,"KnessetNum":7,"Name":"ישיבת מליאה בתאריך 27/03/1973 בשעה 15:00","StartDate":"1973-03-27T15:00:00+02:00","FinishDate":"1973-03-27T21:45:00+02:00","IsSpecialMeeting":null,"LastUpdatedDate":"2021-06-02T13:33:10.553+03:00"}
{"Id":490921,"Number":413,"KnessetNum":7,"Name":"ישיבת מליאה בתאריך 02/04/1973 בשעה 16:04","StartDate":"1973-04-02T16:04:00+02:00","FinishDate":"1973-04-02T21:00:00+02:00","IsSpecialMeeting":null,"LastUpdatedDate":"2024-01-18T12:39:32.05+02:00"}
{"Id":490922,"Number":414,"KnessetNum":7,"Name":"ישיבת מליאה בתאריך 03/04/1973 בשעה 15:02","StartDate":"1973-04-03T15:02:00+02:00","FinishDate":"1973-04-04T07:22:00+03:00","IsSpecialMeeting":null,"LastUpdatedDate":"2021-04-12T11:29:04.217+03:00"}
{"Id":490923,"Number":416,"KnessetNum":7,"Name":"ישיבת מליאה בתאריך 09/04/1973 בשעה 16:03","StartDate":"1973-04-09T16:03:00+03:00","FinishDate":"1973-04-09T20:25:00+03:00","IsSpecialMeeting":null,"LastUpdatedDate":"2024-02-04T02:55:56.187+02:00"}
{"Id":490924,"Number":417,"KnessetNum":7,"Name":"ישיבת מליאה בתאריך 10/04/1973 בשעה 11:02","StartDate":"1973-04-10T11:02:00+03:00","FinishDate":"1973-04-10T12:22:00+03:00","IsSpecialMeeting":null,"LastUpdatedDate":"2021-04-12T16:58:48.65+03:00"}
{"Id":490925,"Number":418,"KnessetNum":7,"Name":"ישיבת מליאה בתאריך 10/04/1973 בשעה 15:03","StartDate":"1973-04-10T15:03:00+03:00","FinishDate":"1973-04-10T21:20:00+03:00","IsSpecialMeeting":null,"LastUpdatedDate":"2021-04-12T17:01:48.61+03:00"}
{"Id":490926,"Number":420,"KnessetNum":7,"Name":"ישיבת מליאה בתאריך 29/04/1973 בשעה 12:30","StartDate":"1973-04-29T12:30:00+03:00","FinishDate":"1973-04-29T13:10:00+03:00","IsSpecialMeeting":null,"LastUpdatedDate":"2025-01-27T11:05:08.943+02:00"}
{"Id":490927,"Number":421,"KnessetNum":7,"Name":"ישיבת מליאה בתאריך 29/04/1973 בשעה 14:00","StartDate":"1973-04-29T14:00:00+03:00","FinishDate":"1973-04-29T14:20:00+03:00","IsSpecialMeeting":null,"LastUpdatedDate":"2021-04-13T12:00:32.477+03:00"}
{"Id":490928,"Number":422,"KnessetNum":7,"Name":"ישיבת מליאה בתאריך 14/05/1973 בשעה 16:02","StartDate":"1973-05-14T16:02:00+03:00","FinishDate":"1973-05-14T20:30:00+03:00","IsSpecialMeeting":null,"LastUpdatedDate":"2021-04-13T12:06:30.61+03:00"}
{"Id":490929,"Number":423,"KnessetNum":7,"Name":"ישיבת מליאה בתאריך 15/05/1973 בשעה 16:02","StartDate":"1973-05-15T16:02:00+03:00","FinishDate":"1973-05-15T21:07:00+03:00","IsSpecialMeeting":null,"LastUpdatedDate":"2021-04-13T12:34:10.46+03:00"}
{"Id":490930,"Number":426,"KnessetNum":7,"Name":"ישיבת מליאה בתאריך 22/05/1973 בשעה 16:00","StartDate":"1973-05-22T16:00:00+03:00","FinishDate":"1973-05-22T19:46:00+03:00","IsSpecialMeeting":null,"LastUpdatedDate":"2021-04-14T09:14:40.397+03:00"}
{"Id":490931,"Number":428,"KnessetNum":7,"Name":"ישיבת מליאה בתאריך 24/05/1973 בשעה 18:35","StartDate":"1973-05-24T18:35:00+03:00","FinishDate":"1973-05-24T19:15:00+03:00","IsSpecialMeeting":null,"LastUpdatedDate":"2021-04-14T10:47:45.363+03:00"}
{"Id":490932,"Number":429,"KnessetNum":7,"Name":"ישיבת מליאה בתאריך 28/05/1973 בשעה 16:02","StartDate":"1973-05-28T16:02:00+03:00","FinishDate":"1973-05-28T21:30:00+03:00","IsSpecialMeeting":null,"LastUpdatedDate":"2019-12-16T14:07:51.277+02:00"}
{"Id":490933,"Number":434,"KnessetNum":7,"Name":"ישיבת מליאה בתאריך 11/06/1973 בשעה 16:00","StartDate":"1973-06-11T16:00:00+03:00","FinishDate":"1973-06-11T21:18:00+03:00","IsSpecialMeeting":null,"LastUpdatedDate":"2019-12-17T10:42:59.917+02:00"}
{"Id":490934,"Number":435,"KnessetNum":7,"Name":"ישיבת מליאה בתאריך 12/06/1973 בשעה 15:01","StartDate":"1973-06-12T15:01:00+03:00","FinishDate":"1973-06-12T19:31:00+03:00","IsSpecialMeeting":null,"LastUpdatedDate":"2021-04-13T13:54:56.813+03:00"}
{"Id":490935,"Number":437,"KnessetNum":7,"Name":"ישיבת מליאה בתאריך 18/06/1973 בשעה 16:00","StartDate":"1973-06-18T16:00:00+03:00","FinishDate":"1973-06-18T21:32:00+03:00","IsSpecialMeeting":null,"LastUpdatedDate":"2023-02-20T12:21:10.973+02:00"}
{"Id":490936,"Number":440,"KnessetNum":7,"Name":"ישיבת מליאה בתאריך 25/06/1973 בשעה 16:00","StartDate":"1973-06-25T16:00:00+03:00","FinishDate":"1973-06-25T21:03:00+03:00","IsSpecialMeeting":null,"LastUpdatedDate":"2021-04-27T11:58:28.747+03:00"}
{"Id":490937,"Number":457,"KnessetNum":7,"Name":"ישיבת מליאה בתאריך 28/07/1973 בשעה 09:07","StartDate":"1973-07-28T09:07:00+03:00","FinishDate":"1973-07-28T20:26:00+03:00","IsSpecialMeeting":null,"LastUpdatedDate":"2024-02-01T00:42:56.953+02:00"}
{"Id":490938,"Number":459,"KnessetNum":7,"Name":"ישיבת מליאה בתאריך 19/09/1973 בשעה 10:08","StartDate":"1973-09-19T10:08:00+03:00","FinishDate":"1973-09-19T11:20:00+03:00","IsSpecialMeeting":null,"LastUpdatedDate":"2021-05-06T11:18:40.633+03:00"}
{"Id":490939,"Number":460,"KnessetNum":7,"Name":"ישיבת מליאה בתאריך 01/10/1973 בשעה 14:00","StartDate":"1973-10-01T14:00:00+02:00","FinishDate":"1973-10-01T16:27:00+02:00","IsSpecialMeeting":null,"LastUpdatedDate":"2021-05-06T11:23:34.833+03:00"}
{"Id":490940,"Number":462,"KnessetNum":7,"Name":"ישיבת מליאה בתאריך 23/10/1973 בשעה 18:03","StartDate":"1973-10-23T18:03:00+02:00","FinishDate":"1973-10-24T01:03:00+02:00","IsSpecialMeeting":null,"LastUpdatedDate":"2024-02-01T00:25:46.243+02:00"}
{"Id":490941,"Number":465,"KnessetNum":7,"Name":"ישיבת מליאה בתאריך 30/10/1973 בשעה 16:00","StartDate":"1973-10-30T16:00:00+02:00","FinishDate":"1973-10-30T17:08:00+02:00","IsSpecialMeeting":null,"LastUpdatedDate":"2021-05-13T07:22:41.357+03:00"}
{"Id":490942,"Number":466,"KnessetNum":7,"Name":"ישיבת מליאה בתאריך 13/11/1973 בשעה 16:06","StartDate":"1973-11-13T16:06:00+02:00","FinishDate":"1973-11-13T23:30:00+02:00","IsSpecialMeeting":null,"LastUpdatedDate":"2024-02-01T00:16:03.89+02:00"}
{"Id":490943,"Number":468,"KnessetNum":7,"Name":"ישיבת מליאה בתאריך 21/11/1973 בשעה 11:03","StartDate":"1973-11-21T11:03:00+02:00","FinishDate":"1973-11-21T12:23:00+02:00","IsSpecialMeeting":null,"LastUpdatedDate":"2024-01-31T23:56:26.223+02:00"}
{"Id":490944,"Number":470,"KnessetNum":7,"Name":"ישיבת מליאה בתאריך 26/11/1973 בשעה 11:00","StartDate":"1973-11-26T11:00:00+02:00","FinishDate":"1973-11-26T11:20:00+02:00","IsSpecialMeeting":null,"LastUpdatedDate":"2022-07-17T14:42:52.16+03:00"}
{"Id":490945,"Number":473,"KnessetNum":7,"Name":"ישיבת מליאה בתאריך 29/11/1973 בשעה 10:30","StartDate":"1973-11-29T10:30:00+02:00","FinishDate":"1973-11-29T10:55:00+02:00","IsSpecialMeeting":null,"LastUpdatedDate":"2023-02-20T11:36:22.637+02:00"}
{"Id":490946,"Number":475,"KnessetNum":7,"Name":"ישיבת מליאה בתאריך 10/12/1973 בשעה 11:03","StartDate":"1973-12-10T11:03:00+02:00","FinishDate":"1973-12-10T11:58:00+02:00","IsSpecialMeeting":null,"LastUpdatedDate":"2021-05-13T10:23:42.727+03:00"}
{"Id":490947,"Number":478,"KnessetNum":7,"Name":"ישיבת מליאה בתאריך 18/12/1973 בשעה 14:57","StartDate":"1973-12-18T14:57:00+02:00","FinishDate":"1973-12-18T16:37:00+02:00","IsSpecialMeeting":null,"LastUpdatedDate":"2024-01-31T17:02:13.047+02:00"}
{"Id":490948,"Number":479,"KnessetNum":7,"Name":"ישיבת מליאה בתאריך 20/12/1973 בשעה 09:03","StartDate":"1973-12-20T09:03:00+02:00","FinishDate":"1973-12-20T14:46:00+02:00","IsSpecialMeeting":null,"LastUpdatedDate":"2021-05-13T10:55:43.28+03:00"}
{"Id":490949,"Number":481,"KnessetNum":7,"Name":"ישיבת מליאה בתאריך 25/12/1973 בשעה 12:30","StartDate":"1973-12-25T12:30:00+02:00","FinishDate":"1973-12-25T15:15:00+02:00","IsSpecialMeeting":null,"LastUpdatedDate":"2021-05-13T11:16:56.443+03:00"}
{"Id":490950,"Number":1,"KnessetNum":8,"Name":"ישיבת מליאה בתאריך 21/01/1974 בשעה 16:00","StartDate":"1974-01-21T16:00:00+02:00","FinishDate":"1974-01-21T17:06:00+02:00","IsSpecialMeeting":null,"LastUpdatedDate":"2021-05-18T02:13:45.987+03:00"}
{"Id":490951,"Number":2,"KnessetNum":8,"Name":"ישיבת מליאה בתאריך 22/01/1974 בשעה 11:04","StartDate":"1974-01-22T11:04:00+02:00","FinishDate":"1974-01-22T20:04:00+02:00","IsSpecialMeeting":null,"LastUpdatedDate":"2021-05-18T02:29:24.593+03:00"}
{"Id":490952,"Number":4,"KnessetNum":8,"Name":"ישיבת מליאה בתאריך 29/01/1974 בשעה 11:03","StartDate":"1974-01-29T11:03:00+02:00","FinishDate":"1974-01-29T20:32:00+02:00","IsSpecialMeeting":null,"LastUpdatedDate":"2020-08-17T12:48:17.233+03:00"}
{"Id":490953,"Number":11,"KnessetNum":8,"Name":"ישיבת מליאה בתאריך 13/02/1974 בשעה 11:01","StartDate":"1974-02-13T11:01:00+02:00","FinishDate":"1974-02-13T15:37:00+02:00","IsSpecialMeeting":null,"LastUpdatedDate":"2021-05-18T03:55:02.85+03:00"}
{"Id":490954,"Number":17,"KnessetNum":8,"Name":"ישיבת מליאה בתאריך 27/02/1974 בשעה 11:01","StartDate":"1974-02-27T11:01:00+02:00","FinishDate":"1974-02-27T13:51:00+02:00","IsSpecialMeeting":null,"LastUpdatedDate":"2021-05-18T22:12:19.5+03:00"}
{"Id":490955,"Number":20,"KnessetNum":8,"Name":"ישיבת מליאה בתאריך 06/03/1974 בשעה 11:00","StartDate":"1974-03-06T11:00:00+02:00","FinishDate":"1974-03-06T14:15:00+02:00","IsSpecialMeeting":null,"LastUpdatedDate":"2021-05-27T08:39:30.85+03:00"}
{"Id":490956,"Number":21,"KnessetNum":8,"Name":"ישיבת מליאה בתאריך 10/03/1974 בשעה 11:04","StartDate":"1974-03-10T11:04:00+02:00","FinishDate":"1974-03-10T21:32:00+02:00","IsSpecialMeeting":null,"LastUpdatedDate":"2021-05-18T22:55:48.887+03:00"}
{"Id":490957,"Number":24,"KnessetNum":8,"Name":"ישיבת מליאה בתאריך 13/03/1974 בשעה 11:00","StartDate":"1974-03-13T11:00:00+02:00","FinishDate":"1974-03-13T12:40:00+02:00","IsSpecialMeeting":null,"LastUpdatedDate":"2021-05-27T09:06:00.163+03:00"}
{"Id":490958,"Number":27,"KnessetNum":8,"Name":"ישיבת מליאה בתאריך 19/03/1974 בשעה 15:01","StartDate":"1974-03-19T15:01:00+02:00","FinishDate":"1974-03-19T20:14:00+02:00","IsSpecialMeeting":null,"LastUpdatedDate":"2021-05-27T11:51:22.953+03:00"}
{"Id":490959,"Number":29,"KnessetNum":8,"Name":"ישיבת מליאה בתאריך 21/03/1974 בשעה 10:04","StartDate":"1974-03-21T10:04:00+02:00","FinishDate":"1974-03-21T17:30:00+02:00","IsSpecialMeeting":null,"LastUpdatedDate":"2021-05-29T01:26:40.213+03:00"}
{"Id":490960,"Number":36,"KnessetNum":8,"Name":"ישיבת מליאה בתאריך 02/04/1974 בשעה 10:52","StartDate":"1974-04-03T10:52:00+03:00","FinishDate":"1974-04-03T15:35:00+03:00","IsSpecialMeeting":null,"LastUpdatedDate":"2022-06-14T10:51:07.443+03:00"}
{"Id":490961,"Number":37,"KnessetNum":8,"Name":"ישיבת מליאה בתאריך 11/04/1974 בשעה 16:16","StartDate":"1974-04-11T16:16:00+03:00","FinishDate":"1974-04-11T22:25:00+03:00","IsSpecialMeeting":null,"LastUpdatedDate":"2021-05-30T23:16:33.31+03:00"}
{"Id":490962,"Number":38,"KnessetNum":8,"Name":"ישיבת מליאה בתאריך 17/04/1974 בשעה 10:03","StartDate":"1974-04-17T10:03:00+03:00","FinishDate":"1974-04-17T10:55:00+03:00","IsSpecialMeeting":null,"LastUpdatedDate":"2021-05-30T23:33:42.94+03:00"}
{"Id":490963,"Number":39,"KnessetNum":8,"Name":"ישיבת מליאה בתאריך 29/04/1974 בשעה 16:33","StartDate":"1974-04-29T16:33:00+03:00","FinishDate":"1974-04-29T18:37:00+03:00","IsSpecialMeeting":null,"LastUpdatedDate":"2021-05-30T23:43:10.897+03:00"}
{"Id":490964,"Number":40,"KnessetNum":8,"Name":"ישיבת מליאה בתאריך 02/05/1974 בשעה 09:02","StartDate":"1974-05-02T09:02:00+03:00","FinishDate":"1974-05-02T09:25:00+03:00","IsSpecialMeeting":null,"LastUpdatedDate":"2021-05-30T23:44:33.953+03:00"}
{"Id":490965,"Number":41,"KnessetNum":8,"Name":"ישיבת מליאה בתאריך 06/05/1974 בשעה 16:02","StartDate":"1974-05-06T16:02:00+03:00","FinishDate":"1974-05-06T17:01:00+03:00","IsSpecialMeeting":null,"LastUpdatedDate":"2021-05-31T00:00:37.897+03:00"}
{"Id":490966,"Number":42,"KnessetNum":8,"Name":"ישיבת מליאה בתאריך 07/05/1974 בשעה 16:01","StartDate":"1974-05-07T16:01:00+03:00","FinishDate":"1974-05-07T18:15:00+03:00","IsSpecialMeeting":null,"LastUpdatedDate":"2021-05-31T00:59:22.05+03:00"}
{"Id":490967,"Number":43,"KnessetNum":8,"Name":"ישיבת מליאה בתאריך 08/05/1974 בשעה 11:02","StartDate":"1974-05-08T11:02:00+03:00","FinishDate":"1974-05-08T13:34:00+03:00","IsSpecialMeeting":null,"LastUpdatedDate":"2021-05-31T01:17:25.557+03:00"}
{"Id":490968,"Number":45,"KnessetNum":8,"Name":"ישיבת מליאה בתאריך 14/05/1974 בשעה 16:00","StartDate":"1974-05-14T16:00:00+03:00","FinishDate":"1974-05-14T19:49:00+03:00","IsSpecialMeeting":null,"LastUpdatedDate":"2021-10-03T00:28:07.273+03:00"}
{"Id":490969,"Number":47,"KnessetNum":8,"Name":"ישיבת מליאה בתאריך 20/05/1974 בשעה 16:06","StartDate":"1974-05-20T16:06:00+03:00","FinishDate":"1974-05-20T21:40:00+03:00","IsSpecialMeeting":null,"LastUpdatedDate":"2021-06-06T00:27:51.547+03:00"}
{"Id":490970,"Number":51,"KnessetNum":8,"Name":"ישיבת מליאה בתאריך 29/05/1974 בשעה 17:02","StartDate":"1974-05-29T17:02:00+03:00","FinishDate":"1974-05-29T20:40:00+03:00","IsSpecialMeeting":null,"LastUpdatedDate":"2021-06-24T10:38:11.16+03:00"}
{"Id":490971,"Number":52,"KnessetNum":8,"Name":"ישיבת מליאה בתאריך 30/05/1974 בשעה 15:05","StartDate":"1974-05-30T15:05:00+03:00","FinishDate":"1974-05-30T22:45:00+03:00","IsSpecialMeeting":null,"LastUpdatedDate":"2021-06-24T10:47:39.007+03:00"}
{"Id":490972,"Number":53,"KnessetNum":8,"Name":"ישיבת מליאה בתאריך 03/06/1974 בשעה 11:03","StartDate":"1974-06-03T11:03:00+03:00","FinishDate":"1974-06-03T19:15:00+03:00","IsSpecialMeeting":null,"LastUpdatedDate":"2021-06-24T11:00:27.2+03:00"}
{"Id":490973,"Number":60,"KnessetNum":8,"Name":"ישיבת מליאה בתאריך 18/06/1974 בשעה 15:00","StartDate":"1974-06-18T15:00:00+03:00","FinishDate":"1974-06-18T17:41:00+03:00","IsSpecialMeeting":null,"LastUpdatedDate":"2021-07-03T15:46:08.173+03:00"}
{"Id":490974,"Number":67,"KnessetNum":8,"Name":"ישיבת מליאה בתאריך 03/07/1974 בשעה 11:05","StartDate":"1974-07-03T11:05:00+03:00","FinishDate":"1974-07-03T16:40:00+03:00","IsSpecialMeeting":null,"LastUpdatedDate":"2021-07-04T01:48:58.623+03:00"}
{"Id":490975,"Number":70,"KnessetNum":8,"Name":"ישיבת מליאה בתאריך 10/07/1974 בשעה 11:00","StartDate":"1974-07-10T11:00:00+03:00","FinishDate":"1974-07-10T16:19:00+03:00","IsSpecialMeeting":null,"LastUpdatedDate":"2021-07-04T03:15:53.607+03:00"}
{"Id":490976,"Number":78,"KnessetNum":8,"Name":"ישיבת מליאה בתאריך 25/07/1974 בשעה 11:04","StartDate":"1974-07-25T11:04:00+03:00","FinishDate":"1974-07-25T15:25:00+03:00","IsSpecialMeeting":null,"LastUpdatedDate":"2021-07-31T13:55:36.043+03:00"}
{"Id":490977,"Number":83,"KnessetNum":8,"Name":"ישיבת מליאה בתאריך 06/08/1974 בשעה 15:00","StartDate":"1974-08-06T15:00:00+03:00","FinishDate":"1974-08-06T21:44:00+03:00","IsSpecialMeeting":null,"LastUpdatedDate":"2021-08-02T09:38:59.26+03:00"}
{"Id":490978,"Number":89,"KnessetNum":8,"Name":"ישיבת מליאה בתאריך 28/08/1974 בשעה 13:04","StartDate":"1974-08-28T13:04:00+03:00","FinishDate":"1974-08-28T13:51:00+03:00","IsSpecialMeeting":null,"LastUpdatedDate":"2021-09-02T03:07:53.427+03:00"}
{"Id":490979,"Number":90,"KnessetNum":8,"Name":"ישיבת מליאה בתאריך 09/09/1974 בשעה 11:03","StartDate":"1974-09-09T11:03:00+03:00","FinishDate":"1974-09-09T12:00:00+03:00","IsSpecialMeeting":null,"LastUpdatedDate":"2021-10-13T08:18:50.577+03:00"}
{"Id":490980,"Number":91,"KnessetNum":8,"Name":"ישיבת מליאה בתאריך 09/09/1974 בשעה 12:00","StartDate":"1974-09-09T12:00:00+03:00","FinishDate":"1974-09-09T13:15:00+03:00","IsSpecialMeeting":null,"LastUpdatedDate":"2021-10-13T08:29:35.577+03:00"}
{"Id":490981,"Number":92,"KnessetNum":8,"Name":"ישיבת מליאה בתאריך 09/10/1974 בשעה 11:04","StartDate":"1974-10-09T11:04:00+02:00","FinishDate":"1974-10-09T12:47:00+02:00","IsSpecialMeeting":null,"LastUpdatedDate":"2021-10-13T08:36:53.293+03:00"}
{"Id":490982,"Number":94,"KnessetNum":8,"Name":"ישיבת מליאה בתאריך 15/10/1974 בשעה 16:00","StartDate":"1974-10-15T16:00:00+02:00","FinishDate":"1974-10-15T16:42:00+02:00","IsSpecialMeeting":null,"LastUpdatedDate":"2021-10-13T11:03:42.647+03:00"}
{"Id":490983,"Number":95,"KnessetNum":8,"Name":"ישיבת מליאה בתאריך 21/10/1974 בשעה 16:03","StartDate":"1974-10-21T16:03:00+02:00","FinishDate":"1974-10-21T19:32:00+02:00","IsSpecialMeeting":null,"LastUpdatedDate":"2021-10-13T11:10:35.18+03:00"}
{"Id":490984,"Number":100,"KnessetNum":8,"Name":"ישיבת מליאה בתאריך 30/10/1974 בשעה 11:04","StartDate":"1974-10-30T11:04:00+02:00","FinishDate":"1974-10-30T15:20:00+02:00","IsSpecialMeeting":null,"LastUpdatedDate":"2021-10-13T21:44:58.097+03:00"}
{"Id":490985,"Number":101,"KnessetNum":8,"Name":"ישיבת מליאה בתאריך 04/11/1974 בשעה 16:00","StartDate":"1974-11-04T16:00:00+02:00","FinishDate":"1974-11-04T16:40:00+02:00","IsSpecialMeeting":null,"LastUpdatedDate":"2024-02-22T14:45:53.757+02:00"}
{"Id":490986,"Number":102,"KnessetNum":8,"Name":"ישיבת מליאה בתאריך 04/11/1974 בשעה 17:20","StartDate":"1974-11-04T17:20:00+02:00","FinishDate":"1974-11-04T20:35:00+02:00","IsSpecialMeeting":null,"LastUpdatedDate":"2021-10-13T22:38:30.713+03:00"}
{"Id":490987,"Number":103,"KnessetNum":8,"Name":"ישיבת מליאה בתאריך 05/11/1974 בשעה 16:03","StartDate":"1974-11-05T16:03:00+02:00","FinishDate":"1974-11-05T23:11:00+02:00","IsSpecialMeeting":null,"LastUpdatedDate":"2021-10-13T22:50:45.133+03:00"}
{"Id":490988,"Number":105,"KnessetNum":8,"Name":"ישיבת מליאה בתאריך 11/11/1974 בשעה 16:03","StartDate":"1974-11-11T16:03:00+02:00","FinishDate":"1974-11-11T20:49:00+02:00","IsSpecialMeeting":null,"LastUpdatedDate":"2021-10-13T23:06:28.4+03:00"}
{"Id":490989,"Number":111,"KnessetNum":8,"Name":"ישיבת מליאה בתאריך 25/11/1974 בשעה 16:03","StartDate":"1974-11-25T16:03:00+02:00","FinishDate":"1974-11-25T19:52:00+02:00","IsSpecialMeeting":null,"LastUpdatedDate":"2019-12-26T11:48:09.303+02:00"}
{"Id":490990,"Number":126,"KnessetNum":8,"Name":"ישיבת מליאה בתאריך 30/12/1974 בשעה 16:04","StartDate":"1974-12-30T16:04:00+02:00","FinishDate":"1974-12-30T20:24:00+02:00","IsSpecialMeeting":null,"LastUpdatedDate":"2021-11-16T10:32:50.833+02:00"}
{"Id":490991,"Number":128,"KnessetNum":8,"Name":"ישיבת מליאה בתאריך 01/01/1975 בשעה 11:01","StartDate":"1975-01-01T11:01:00+02:00","FinishDate":"1975-01-01T14:15:00+02:00","IsSpecialMeeting":null,"LastUpdatedDate":"2021-11-19T02:16:46.453+02:00"}
{"Id":490992,"Number":131,"KnessetNum":8,"Name":"ישיבת מליאה בתאריך 08/01/1975 בשעה 11:02","StartDate":"1975-01-08T11:02:00+02:00","FinishDate":"1975-01-08T14:49:00+02:00","IsSpecialMeeting":null,"LastUpdatedDate":"2021-11-20T01:45:19.397+02:00"}
{"Id":490993,"Number":146,"KnessetNum":8,"Name":"ישיבת מליאה בתאריך 12/02/1975 בשעה 11:20","StartDate":"1975-02-12T11:20:00+02:00","FinishDate":"1975-02-12T12:05:00+02:00","IsSpecialMeeting":null,"LastUpdatedDate":"2021-11-20T03:20:13.823+02:00"}
{"Id":490994,"Number":152,"KnessetNum":8,"Name":"ישיבת מליאה בתאריך 27/02/1975 בשעה 11:02","StartDate":"1975-02-27T11:02:00+02:00","FinishDate":"1975-02-27T15:12:00+02:00","IsSpecialMeeting":null,"LastUpdatedDate":"2021-12-20T22:10:03.727+02:00"}
{"Id":490995,"Number":153,"KnessetNum":8,"Name":"ישיבת מליאה בתאריך 03/03/1975 בשעה 16:00","StartDate":"1975-03-03T16:00:00+02:00","FinishDate":"1975-03-03T20:06:00+02:00","IsSpecialMeeting":null,"LastUpdatedDate":"2021-12-20T22:24:05.637+02:00"}
{"Id":490996,"Number":155,"KnessetNum":8,"Name":"ישיבת מליאה בתאריך 05/03/1975 בשעה 11:02","StartDate":"1975-03-05T11:02:00+02:00","FinishDate":"1975-03-05T12:55:00+02:00","IsSpecialMeeting":null,"LastUpdatedDate":"2021-12-21T00:27:36.687+02:00"}
{"Id":490997,"Number":157,"KnessetNum":8,"Name":"ישיבת מליאה בתאריך 11/03/1975 בשעה 16:03","StartDate":"1975-03-11T16:03:00+02:00","FinishDate":"1975-03-11T17:52:00+02:00","IsSpecialMeeting":null,"LastUpdatedDate":"2021-12-30T00:28:38.08+02:00"}
{"Id":490998,"Number":158,"KnessetNum":8,"Name":"ישיבת מליאה בתאריך 12/03/1975 בשעה 11:00","StartDate":"1975-03-12T11:00:00+02:00","FinishDate":"1975-03-12T14:03:00+02:00","IsSpecialMeeting":null,"LastUpdatedDate":"2021-12-21T01:13:25.187+02:00"}
{"Id":490999,"Number":159,"KnessetNum":8,"Name":"ישיבת מליאה בתאריך 17/03/1975 בשעה 16:00","StartDate":"1975-03-17T16:00:00+02:00","FinishDate":"1975-03-17T22:16:00+02:00","IsSpecialMeeting":null,"LastUpdatedDate":"2021-12-23T00:56:13.473+02:00"}
{"Id":491000,"Number":161,"KnessetNum":8,"Name":"ישיבת מליאה בתאריך 19/03/1975 בשעה 11:01","StartDate":"1975-03-19T11:01:00+02:00","FinishDate":"1975-03-19T15:45:00+02:00","IsSpecialMeeting":null,"LastUpdatedDate":"2021-12-24T01:14:56.217+02:00"}
{"Id":491001,"Number":163,"KnessetNum":8,"Name":"ישיבת מליאה בתאריך 24/03/1975 בשעה 16:05","StartDate":"1975-03-24T16:05:00+02:00","FinishDate":"1975-03-24T21:10:00+02:00","IsSpecialMeeting":null,"LastUpdatedDate":"2021-12-24T02:02:47.76+02:00"}
{"Id":491002,"Number":164,"KnessetNum":8,"Name":"ישיבת מליאה בתאריך 14/04/1975 בשעה 14:04","StartDate":"1975-04-14T14:04:00+03:00","FinishDate":"1975-04-14T16:31:00+03:00","IsSpecialMeeting":null,"LastUpdatedDate":"2021-12-24T02:05:33.587+02:00"}
{"Id":491003,"Number":166,"KnessetNum":8,"Name":"ישיבת מליאה בתאריך 29/04/1975 בשעה 16:01","StartDate":"1975-04-29T16:01:00+03:00","FinishDate":"1975-04-29T19:45:00+03:00","IsSpecialMeeting":null,"LastUpdatedDate":"2021-12-26T00:59:38.54+02:00"}
{"Id":491004,"Number":169,"KnessetNum":8,"Name":"ישיבת מליאה בתאריך 06/05/1975 בשעה 16:03","StartDate":"1975-05-06T16:03:00+03:00","FinishDate":"1975-05-06T20:15:00+03:00","IsSpecialMeeting":null,"LastUpdatedDate":"2021-12-27T15:14:51.443+02:00"}
{"Id":491005,"Number":170,"KnessetNum":8,"Name":"ישיבת מליאה בתאריך 07/05/1975 בשעה 11:06","StartDate":"1975-05-07T11:06:00+03:00","FinishDate":"1975-05-07T14:55:00+03:00","IsSpecialMeeting":null,"LastUpdatedDate":"2021-12-27T15:39:21.857+02:00"}
{"Id":491006,"Number":172,"KnessetNum":8,"Name":"ישיבת מליאה בתאריך 13/05/1975 בשעה 15:01","StartDate":"1975-05-13T15:01:00+03:00","FinishDate":"1975-05-13T20:15:00+03:00","IsSpecialMeeting":null,"LastUpdatedDate":"2022-01-07T00:38:49.433+02:00"}
{"Id":491007,"Number":187,"KnessetNum":8,"Name":"ישיבת מליאה בתאריך 17/06/1975 בשעה 15:02","StartDate":"1975-06-17T15:02:00+03:00","FinishDate":"1975-06-17T19:18:00+03:00","IsSpecialMeeting":null,"LastUpdatedDate":"2022-01-22T03:35:37.847+02:00"}
{"Id":491008,"Number":189,"KnessetNum":8,"Name":"ישיבת מליאה בתאריך 23/06/1975 בשעה 16:02","StartDate":"1975-06-23T16:02:00+03:00","FinishDate":"1975-06-23T19:16:00+03:00","IsSpecialMeeting":null,"LastUpdatedDate":"2022-01-22T03:16:02.043+02:00"}
{"Id":491009,"Number":208,"KnessetNum":8,"Name":"ישיבת מליאה בתאריך 18/08/1975 בשעה 11:12","StartDate":"1975-08-18T11:12:00+03:00","FinishDate":"1975-08-18T12:55:00+03:00","IsSpecialMeeting":null,"LastUpdatedDate":"2022-01-17T01:09:51.807+02:00"}
{"Id":491010,"Number":210,"KnessetNum":8,"Name":"ישיבת מליאה בתאריך 03/09/1975 בשעה 12:01","StartDate":"1975-09-03T12:01:00+03:00","FinishDate":"1975-09-03T21:10:00+03:00","IsSpecialMeeting":null,"LastUpdatedDate":"2022-01-17T00:57:33.223+02:00"}
{"Id":491011,"Number":211,"KnessetNum":8,"Name":"ישיבת מליאה בתאריך 17/09/1975 בשעה 11:03","StartDate":"1975-09-17T11:03:00+03:00","FinishDate":"1975-09-17T12:03:00+03:00","IsSpecialMeeting":null,"LastUpdatedDate":"2022-01-17T00:46:55.883+02:00"}
{"Id":491012,"Number":212,"KnessetNum":8,"Name":"ישיבת מליאה בתאריך 29/09/1975 בשעה 11:12","StartDate":"1975-09-29T11:12:00+02:00","FinishDate":"1975-09-29T13:00:00+02:00","IsSpecialMeeting":null,"LastUpdatedDate":"2022-01-17T00:28:09.803+02:00"}
{"Id":491013,"Number":213,"KnessetNum":8,"Name":"ישיבת מליאה בתאריך 09/10/1975 בשעה 10:00","StartDate":"1975-10-09T10:00:00+02:00","FinishDate":"1975-10-09T17:00:00+02:00","IsSpecialMeeting":null,"LastUpdatedDate":"2022-01-17T00:34:22.837+02:00"}
{"Id":491014,"Number":216,"KnessetNum":8,"Name":"ישיבת מליאה בתאריך 22/10/1975 בשעה 11:00","StartDate":"1975-10-22T11:00:00+02:00","FinishDate":"1975-10-22T14:24:00+02:00","IsSpecialMeeting":null,"LastUpdatedDate":"2022-02-28T09:05:18.19+02:00"}
{"Id":491015,"Number":231,"KnessetNum":8,"Name":"ישיבת מליאה בתאריך 26/11/1975 בשעה 11:03","StartDate":"1975-11-26T11:03:00+02:00","FinishDate":"1975-11-26T13:33:00+02:00","IsSpecialMeeting":null,"LastUpdatedDate":"2022-03-11T01:18:07.43+02:00"}
{"Id":491016,"Number":232,"KnessetNum":8,"Name":"ישיבת מליאה בתאריך 01/12/1975 בשעה 16:03","StartDate":"1975-12-01T16:03:00+02:00","FinishDate":"1975-12-01T19:03:00+02:00","IsSpecialMeeting":null,"LastUpdatedDate":"2022-03-11T01:21:54.447+02:00"}
{"Id":491017,"Number":234,"KnessetNum":8,"Name":"ישיבת מליאה בתאריך 03/12/1975 בשעה 11:01","StartDate":"1975-12-03T11:01:00+02:00","FinishDate":"1975-12-03T14:30:00+02:00","IsSpecialMeeting":null,"LastUpdatedDate":"2022-03-16T08:36:06.523+02:00"}
{"Id":491018,"Number":237,"KnessetNum":8,"Name":"ישיבת מליאה בתאריך 10/12/1975 בשעה 11:03","StartDate":"1975-12-10T11:03:00+02:00","FinishDate":"1975-12-10T13:07:00+02:00","IsSpecialMeeting":null,"LastUpdatedDate":"2022-03-16T10:26:12.28+02:00"}
{"Id":491019,"Number":238,"KnessetNum":8,"Name":"ישיבת מליאה בתאריך 15/12/1975 בשעה 16:01","StartDate":"1975-12-15T16:01:00+02:00","FinishDate":"1975-12-15T21:07:00+02:00","IsSpecialMeeting":null,"LastUpdatedDate":"2022-03-16T10:52:32.457+02:00"}
{"Id":491020,"Number":255,"KnessetNum":8,"Name":"ישיבת מליאה בתאריך 21/01/1976 בשעה 11:04","StartDate":"1976-01-21T11:04:00+02:00","FinishDate":"1976-01-21T15:12:00+02:00","IsSpecialMeeting":null,"LastUpdatedDate":"2022-03-22T12:32:34.08+02:00"}
{"Id":491021,"Number":260,"KnessetNum":8,"Name":"ישיבת מליאה בתאריך 03/02/1976 בשעה 16:01","StartDate":"1976-02-03T16:01:00+02:00","FinishDate":"1976-02-03T19:58:00+02:00","IsSpecialMeeting":null,"LastUpdatedDate":"2022-03-31T02:30:04.667+03:00"}
{"Id":491022,"Number":270,"KnessetNum":8,"Name":"ישיבת מליאה בתאריך 25/02/1976 בשעה 11:00","StartDate":"1976-02-25T11:00:00+02:00","FinishDate":"1976-02-25T14:42:00+02:00","IsSpecialMeeting":null,"LastUpdatedDate":"2022-05-02T01:36:00.293+03:00"}
{"Id":491023,"Number":273,"KnessetNum":8,"Name":"ישיבת מליאה בתאריך 03/03/1976 בשעה 11:03","StartDate":"1976-03-03T11:03:00+02:00","FinishDate":"1976-03-03T13:43:00+02:00","IsSpecialMeeting":null,"LastUpdatedDate":"2022-04-05T00:32:02.92+03:00"}
{"Id":491024,"Number":276,"KnessetNum":8,"Name":"ישיבת מליאה בתאריך 10/03/1976 בשעה 11:03","StartDate":"1976-03-10T11:03:00+02:00","FinishDate":"1976-03-10T15:17:00+02:00","IsSpecialMeeting":null,"LastUpdatedDate":"2022-04-10T01:48:28.273+03:00"}
{"Id":491025,"Number":278,"KnessetNum":8,"Name":"ישיבת מליאה בתאריך 18/03/1976 בשעה 10:03","StartDate":"1976-03-18T10:03:00+02:00","FinishDate":"1976-03-18T14:02:00+02:00","IsSpecialMeeting":null,"LastUpdatedDate":"2022-04-10T01:58:58.643+03:00"}
{"Id":491026,"Number":281,"KnessetNum":8,"Name":"ישיבת מליאה בתאריך 24/03/1976 בשעה 11:02","StartDate":"1976-03-24T11:02:00+02:00","FinishDate":"1976-03-24T15:45:00+02:00","IsSpecialMeeting":null,"LastUpdatedDate":"2022-05-01T23:50:43.247+03:00"}
{"Id":491027,"Number":285,"KnessetNum":8,"Name":"ישיבת מליאה בתאריך 12/04/1976 בשעה 10:04","StartDate":"1976-04-12T10:04:00+03:00","FinishDate":"1976-04-12T10:52:00+03:00","IsSpecialMeeting":null,"LastUpdatedDate":"2022-05-02T02:05:19.66+03:00"}
{"Id":491028,"Number":287,"KnessetNum":8,"Name":"ישיבת מליאה בתאריך 03/05/1976 בשעה 10:09","StartDate":"1976-05-03T10:09:00+03:00","FinishDate":"1976-05-03T11:32:00+03:00","IsSpecialMeeting":null,"LastUpdatedDate":"2022-05-02T02:12:39.327+03:00"}
{"Id":491029,"Number":293,"KnessetNum":8,"Name":"ישיבת מליאה בתאריך 18/05/1976 בשעה 16:01","StartDate":"1976-05-18T16:01:00+03:00","FinishDate":"1976-05-18T19:12:00+03:00","IsSpecialMeeting":null,"LastUpdatedDate":"2022-05-03T01:05:23.22+03:00"}
{"Id":491030,"Number":302,"KnessetNum":8,"Name":"ישיבת מליאה בתאריך 08/06/1976 בשעה 16:00","StartDate":"1976-06-08T16:00:00+03:00","FinishDate":"1976-06-08T21:00:00+03:00","IsSpecialMeeting":null,"LastUpdatedDate":"2020-05-06T15:02:00.373+03:00"}
{"Id":491031,"Number":305,"KnessetNum":8,"Name":"ישיבת מליאה בתאריך 15/06/1976 בשעה 15:00","StartDate":"1976-06-15T15:00:00+03:00","FinishDate":"1976-06-15T21:04:00+03:00","IsSpecialMeeting":null,"LastUpdatedDate":"2022-05-23T10:47:41.87+03:00"}
{"Id":491032,"Number":313,"KnessetNum":8,"Name":"ישיבת מליאה בתאריך 04/07/1976 בשעה 15:01","StartDate":"1976-07-04T15:01:00+03:00","FinishDate":"1976-07-04T15:40:00+03:00","IsSpecialMeeting":null,"LastUpdatedDate":"2022-05-31T00:38:15.083+03:00"}
{"Id":491033,"Number":316,"KnessetNum":8,"Name":"ישיבת מליאה בתאריך 07/07/1976 בשעה 11:03","StartDate":"1976-07-07T11:03:00+03:00","FinishDate":"1976-07-07T14:16:00+03:00","IsSpecialMeeting":null,"LastUpdatedDate":"2022-06-06T01:31:04.87+03:00"}
{"Id":491034,"Number":326,"KnessetNum":8,"Name":"ישיבת מליאה בתאריך 03/08/1976 בשעה 16:04","StartDate":"1976-08-03T16:04:00+03:00","FinishDate":"1976-08-03T17:14:00+03:00","IsSpecialMeeting":null,"LastUpdatedDate":"2020-04-05T10:24:40.377+03:00"}
{"Id":491035,"Number":330,"KnessetNum":8,"Name":"ישיבת מליאה בתאריך 30/08/1976 בשעה 14:03","StartDate":"1976-08-30T14:03:00+03:00","FinishDate":"1976-08-30T16:38:00+03:00","IsSpecialMeeting":null,"LastUpdatedDate":"2022-06-16T13:48:23.017+03:00"}
{"Id":491036,"Number":332,"KnessetNum":8,"Name":"ישיבת מליאה בתאריך 07/09/1976 בשעה 14:03","StartDate":"1976-09-07T14:03:00+03:00","FinishDate":"1976-09-07T17:18:00+03:00","IsSpecialMeeting":null,"LastUpdatedDate":"2022-06-16T13:54:41.3+03:00"}
{"Id":491037,"Number":333,"KnessetNum":8,"Name":"ישיבת מליאה בתאריך 21/09/1976 בשעה 12:09","StartDate":"1976-09-21T12:09:00+03:00","FinishDate":"1976-09-21T14:15:00+03:00","IsSpecialMeeting":null,"LastUpdatedDate":"2022-06-16T14:00:36.033+03:00"}
{"Id":491038,"Number":334,"KnessetNum":8,"Name":"ישיבת מליאה בתאריך 06/10/1976 בשעה 16:15","StartDate":"1976-10-06T16:15:00+02:00","FinishDate":"1976-10-06T18:55:00+02:00","IsSpecialMeeting":null,"LastUpdatedDate":"2022-06-16T14:09:48.773+03:00"}
{"Id":491039,"Number":337,"KnessetNum":8,"Name":"ישיבת מליאה בתאריך 27/10/1976 בשעה 11:04","StartDate":"1976-10-27T11:04:00+02:00","FinishDate":"1976-10-27T14:05:00+02:00","IsSpecialMeeting":null,"LastUpdatedDate":"2022-08-12T00:23:16.293+03:00"}
{"Id":491040,"Number":342,"KnessetNum":8,"Name":"ישיבת מליאה בתאריך 09/11/1976 בשעה 16:03","StartDate":"1976-11-09T16:03:00+02:00","FinishDate":"1976-11-09T20:32:00+02:00","IsSpecialMeeting":null,"LastUpdatedDate":"2022-09-01T02:38:12.03+03:00"}
{"Id":491041,"Number":346,"KnessetNum":8,"Name":"ישיבת מליאה בתאריך 17/11/1976 בשעה 11:04","StartDate":"1976-11-17T11:04:00+02:00","FinishDate":"1976-11-17T16:05:00+02:00","IsSpecialMeeting":null,"LastUpdatedDate":"2022-10-27T11:26:17.067+03:00"}
{"Id":491042,"Number":352,"KnessetNum":8,"Name":"ישיבת מליאה בתאריך 01/12/1976 בשעה 11:02","StartDate":"1976-12-01T11:02:00+02:00","FinishDate":"1976-12-01T14:20:00+02:00","IsSpecialMeeting":null,"LastUpdatedDate":"2022-11-16T10:29:20.987+02:00"}
{"Id":491043,"Number":362,"KnessetNum":8,"Name":"ישיבת מליאה בתאריך 27/12/1976 בשעה 16:04","StartDate":"1976-12-27T16:04:00+02:00","FinishDate":"1976-12-27T19:35:00+02:00","IsSpecialMeeting":null,"LastUpdatedDate":"2022-11-17T14:25:42.793+02:00"}
{"Id":491044,"Number":365,"KnessetNum":8,"Name":"ישיבת מליאה בתאריך 03/01/1977 בשעה 16:03","StartDate":"1977-01-03T16:03:00+02:00","FinishDate":"1977-01-03T19:00:00+02:00","IsSpecialMeeting":null,"LastUpdatedDate":"2022-11-17T11:41:54.267+02:00"}
{"Id":491045,"Number":398,"KnessetNum":8,"Name":"ישיבת מליאה בתאריך 29/03/1977 בשעה 11:05","StartDate":"1977-03-29T11:05:00+02:00","FinishDate":"1977-03-29T13:05:00+02:00","IsSpecialMeeting":null,"LastUpdatedDate":"2022-03-22T09:58:42.49+02:00"}
{"Id":491046,"Number":400,"KnessetNum":8,"Name":"ישיבת מליאה בתאריך 19/04/1977 בשעה 12:08","StartDate":"1977-04-19T12:08:00+03:00","FinishDate":"1977-04-19T14:00:00+03:00","IsSpecialMeeting":null,"LastUpdatedDate":"2022-03-22T09:51:53.737+02:00"}
{"Id":491047,"Number":401,"KnessetNum":8,"Name":"ישיבת מליאה בתאריך 02/05/1977 בשעה 10:07","StartDate":"1977-05-02T10:07:00+03:00","FinishDate":"1977-05-02T11:45:00+03:00","IsSpecialMeeting":null,"LastUpdatedDate":"2022-03-22T09:43:38.93+02:00"}
{"Id":491048,"Number":403,"KnessetNum":8,"Name":"ישיבת מליאה בתאריך 16/05/1977 בשעה 10:06","StartDate":"1977-05-16T10:06:00+03:00","FinishDate":"1977-05-16T11:59:00+03:00","IsSpecialMeeting":null,"LastUpdatedDate":"2022-03-22T09:36:59.547+02:00"}
{"Id":491049,"Number":1,"KnessetNum":9,"Name":"ישיבת מליאה בתאריך 13/06/1977 בשעה 16:04","StartDate":"1977-06-13T16:04:00+03:00","FinishDate":"1977-06-13T17:11:00+03:00","IsSpecialMeeting":null,"LastUpdatedDate":"2020-08-16T09:38:28.417+03:00"}
{"Id":491050,"Number":2,"KnessetNum":9,"Name":"ישיבת מליאה בתאריך 20/06/1977 בשעה 11:02","StartDate":"1977-06-20T11:02:00+03:00","FinishDate":"1977-06-20T11:21:00+03:00","IsSpecialMeeting":null,"LastUpdatedDate":"2020-08-19T12:55:29.873+03:00"}
{"Id":491051,"Number":3,"KnessetNum":9,"Name":"ישיבת מליאה בתאריך 20/06/1977 בשעה 16:04","StartDate":"1977-06-20T16:04:00+03:00","FinishDate":"1977-06-21T00:23:00+03:00","IsSpecialMeeting":null,"LastUpdatedDate":"2020-08-19T12:56:56.537+03:00"}
{"Id":491052,"Number":6,"KnessetNum":9,"Name":"ישיבת מליאה בתאריך 29/06/1977 בשעה 11:00","StartDate":"1977-06-29T11:00:00+03:00","FinishDate":"1977-06-29T14:35:00+03:00","IsSpecialMeeting":null,"LastUpdatedDate":"2020-08-22T00:51:27.533+03:00"}
{"Id":491053,"Number":9,"KnessetNum":9,"Name":"ישיבת מליאה בתאריך 06/07/1977 בשעה 11:01","StartDate":"1977-07-06T11:01:00+03:00","FinishDate":"1977-07-06T15:15:00+03:00","IsSpecialMeeting":null,"LastUpdatedDate":"2020-08-22T02:01:44.29+03:00"}
{"Id":491054,"Number":12,"KnessetNum":9,"Name":"ישיבת מליאה בתאריך 13/07/1977 בשעה 11:02","StartDate":"1977-07-13T11:02:00+03:00","FinishDate":"1977-07-13T14:15:00+03:00","IsSpecialMeeting":null,"LastUpdatedDate":"2020-08-22T03:04:30.873+03:00"}
{"Id":491055,"Number":14,"KnessetNum":9,"Name":"ישיבת מליאה בתאריך 19/07/1977 בשעה 16:00","StartDate":"1977-07-19T16:00:00+03:00","FinishDate":"1977-07-19T22:40:00+03:00","IsSpecialMeeting":null,"LastUpdatedDate":"2020-08-24T16:43:36.243+03:00"}
{"Id":491056,"Number":15,"KnessetNum":9,"Name":"ישיבת מליאה בתאריך 20/07/1977 בשעה 11:01","StartDate":"1977-07-20T11:01:00+03:00","FinishDate":"1977-07-20T16:03:00+03:00","IsSpecialMeeting":null,"LastUpdatedDate":"2020-08-23T15:03:04.903+03:00"}
{"Id":491057,"Number":18,"KnessetNum":9,"Name":"ישיבת מליאה בתאריך 27/07/1977 בשעה 11:00","StartDate":"1977-07-27T11:00:00+03:00","FinishDate":"1977-07-27T19:28:00+03:00","IsSpecialMeeting":null,"LastUpdatedDate":"2020-08-23T17:49:35.943+03:00"}
{"Id":491058,"Number":22,"KnessetNum":9,"Name":"ישיבת מליאה בתאריך 15/08/1977 בשעה 12:01","StartDate":"1977-08-15T12:01:00+03:00","FinishDate":"1977-08-15T15:31:00+03:00","IsSpecialMeeting":null,"LastUpdatedDate":"2020-09-27T00:01:01.287+03:00"}
{"Id":491059,"Number":24,"KnessetNum":9,"Name":"ישיבת מליאה בתאריך 01/09/1977 בשעה 11:01","StartDate":"1977-09-01T11:01:00+03:00","FinishDate":"1977-09-01T17:20:00+03:00","IsSpecialMeeting":null,"LastUpdatedDate":"2020-09-27T01:15:17.88+03:00"}
{"Id":491060,"Number":25,"KnessetNum":9,"Name":"ישיבת מליאה בתאריך 19/09/1977 בשעה 11:01","StartDate":"1977-09-19T11:01:00+03:00","FinishDate":"1977-09-19T13:15:00+03:00","IsSpecialMeeting":null,"LastUpdatedDate":"2020-09-27T01:22:20.68+03:00"}
{"Id":491061,"Number":27,"KnessetNum":9,"Name":"ישיבת מליאה בתאריך 13/10/1977 בשעה 16:11","StartDate":"1977-10-13T16:11:00+02:00","FinishDate":"1977-10-13T19:04:00+02:00","IsSpecialMeeting":null,"LastUpdatedDate":"2020-09-27T01:35:26.557+03:00"}
{"Id":491062,"Number":31,"KnessetNum":9,"Name":"ישיבת מליאה בתאריך 24/10/1977 בשעה 16:03","StartDate":"1977-10-24T16:03:00+02:00","FinishDate":"1977-10-24T20:40:00+02:00","IsSpecialMeeting":null,"LastUpdatedDate":"2020-09-27T02:42:05.387+03:00"}
{"Id":491063,"Number":39,"KnessetNum":9,"Name":"ישיבת מליאה בתאריך 09/11/1977 בשעה 11:01","StartDate":"1977-11-09T11:01:00+02:00","FinishDate":"1977-11-09T14:45:00+02:00","IsSpecialMeeting":null,"LastUpdatedDate":"2020-10-07T15:02:58.277+03:00"}
{"Id":491064,"Number":40,"KnessetNum":9,"Name":"ישיבת מליאה בתאריך 14/11/1977 בשעה 16:00","StartDate":"1977-11-14T16:00:00+02:00","FinishDate":"1977-11-14T18:47:00+02:00","IsSpecialMeeting":null,"LastUpdatedDate":"2020-10-07T15:34:02.983+03:00"}
{"Id":491065,"Number":41,"KnessetNum":9,"Name":"ישיבת מליאה בתאריך 15/11/1977 בשעה 16:02","StartDate":"1977-11-15T16:02:00+02:00","FinishDate":"1977-11-15T19:15:00+02:00","IsSpecialMeeting":null,"LastUpdatedDate":"2021-04-07T11:23:16.473+03:00"}
{"Id":491066,"Number":43,"KnessetNum":9,"Name":"ישיבת מליאה בתאריך 20/11/1977 בשעה 16:00","StartDate":"1977-11-20T16:00:00+02:00","FinishDate":"1977-11-20T18:11:00+02:00","IsSpecialMeeting":null,"LastUpdatedDate":"2020-10-09T01:35:53.24+03:00"}
{"Id":491067,"Number":47,"KnessetNum":9,"Name":"ישיבת מליאה בתאריך 28/11/1977 בשעה 16:01","StartDate":"1977-11-28T16:01:00+02:00","FinishDate":"1977-11-28T20:38:00+02:00","IsSpecialMeeting":null,"LastUpdatedDate":"2021-04-07T11:31:24.033+03:00"}
{"Id":491068,"Number":48,"KnessetNum":9,"Name":"ישיבת מליאה בתאריך 29/11/1977 בשעה 16:02","StartDate":"1977-11-29T16:02:00+02:00","FinishDate":"1977-11-29T19:52:00+02:00","IsSpecialMeeting":null,"LastUpdatedDate":"2020-10-14T09:19:50.87+03:00"}
{"Id":491069,"Number":51,"KnessetNum":9,"Name":"ישיבת מליאה בתאריך 06/12/1977 בשעה 16:00","StartDate":"1977-12-06T16:00:00+02:00","FinishDate":"1977-12-06T18:15:00+02:00","IsSpecialMeeting":null,"LastUpdatedDate":"2020-10-14T11:39:16.917+03:00"}
{"Id":491070,"Number":53,"KnessetNum":9,"Name":"ישיבת מליאה בתאריך 12/12/1977 בשעה 16:02","StartDate":"1977-12-12T16:02:00+02:00","FinishDate":"1977-12-12T18:18:00+02:00","IsSpecialMeeting":null,"LastUpdatedDate":"2020-10-14T13:18:37.443+03:00"}
{"Id":491071,"Number":55,"KnessetNum":9,"Name":"ישיבת מליאה בתאריך 14/12/1977 בשעה 11:01","StartDate":"1977-12-14T11:01:00+02:00","FinishDate":"1977-12-14T14:28:00+02:00","IsSpecialMeeting":null,"LastUpdatedDate":"2020-10-14T23:01:34.58+03:00"}
{"Id":491072,"Number":70,"KnessetNum":9,"Name":"ישיבת מליאה בתאריך 18/01/1978 בשעה 11:04","StartDate":"1978-01-18T11:04:00+02:00","FinishDate":"1978-01-18T15:18:00+02:00","IsSpecialMeeting":null,"LastUpdatedDate":"2021-04-07T16:02:13.657+03:00"}
{"Id":491073,"Number":71,"KnessetNum":9,"Name":"ישיבת מליאה בתאריך 23/01/1978 בשעה 16:01","StartDate":"1978-01-23T16:01:00+02:00","FinishDate":"1978-01-23T21:45:00+02:00","IsSpecialMeeting":null,"LastUpdatedDate":"2020-10-18T02:29:26.867+03:00"}
{"Id":491074,"Number":72,"KnessetNum":9,"Name":"ישיבת מליאה בתאריך 24/01/1978 בשעה 16:02","StartDate":"1978-01-24T16:02:00+02:00","FinishDate":"1978-01-24T19:16:00+02:00","IsSpecialMeeting":null,"LastUpdatedDate":"2020-10-18T02:45:31.847+03:00"}
{"Id":491075,"Number":73,"KnessetNum":9,"Name":"ישיבת מליאה בתאריך 25/01/1978 בשעה 11:03","StartDate":"1978-01-25T11:03:00+02:00","FinishDate":"1978-01-25T15:02:00+02:00","IsSpecialMeeting":null,"LastUpdatedDate":"2020-10-18T14:36:36.373+03:00"}
{"Id":491076,"Number":74,"KnessetNum":9,"Name":"ישיבת מליאה בתאריך 30/01/1978 בשעה 16:03","StartDate":"1978-01-30T16:03:00+02:00","FinishDate":"1978-01-30T18:05:00+02:00","IsSpecialMeeting":null,"LastUpdatedDate":"2020-10-18T02:51:07.863+03:00"}
{"Id":491077,"Number":81,"KnessetNum":9,"Name":"ישיבת מליאה בתאריך 14/02/1978 בשעה 16:04","StartDate":"1978-02-14T16:04:00+02:00","FinishDate":"1978-02-14T19:27:00+02:00","IsSpecialMeeting":null,"LastUpdatedDate":"2020-10-19T01:16:21.057+03:00"}
{"Id":491078,"Number":84,"KnessetNum":9,"Name":"ישיבת מליאה בתאריך 21/02/1978 בשעה 16:00","StartDate":"1978-02-21T16:00:00+02:00","FinishDate":"1978-02-21T20:05:00+02:00","IsSpecialMeeting":null,"LastUpdatedDate":"2020-10-20T22:32:27.763+03:00"}
{"Id":491079,"Number":85,"KnessetNum":9,"Name":"ישיבת מליאה בתאריך 22/02/1978 בשעה 11:00","StartDate":"1978-02-22T11:00:00+02:00","FinishDate":"1978-02-22T12:32:00+02:00","IsSpecialMeeting":null,"LastUpdatedDate":"2020-10-20T23:35:21.59+03:00"}
{"Id":491080,"Number":86,"KnessetNum":9,"Name":"ישיבת מליאה בתאריך 27/02/1978 בשעה 16:02","StartDate":"1978-02-27T16:02:00+02:00","FinishDate":"1978-02-27T19:40:00+02:00","IsSpecialMeeting":null,"LastUpdatedDate":"2020-10-20T23:53:25.89+03:00"}
{"Id":491081,"Number":100,"KnessetNum":9,"Name":"ישיבת מליאה בתאריך 29/03/1978 בשעה 10:01","StartDate":"1978-03-29T10:01:00+02:00","FinishDate":"1978-03-29T10:07:00+02:00","IsSpecialMeeting":null,"LastUpdatedDate":"2020-10-22T00:56:19.81+03:00"}
{"Id":491082,"Number":105,"KnessetNum":9,"Name":"ישיבת מליאה בתאריך 19/04/1978 בשעה 11:02","StartDate":"1978-04-19T11:02:00+03:00","FinishDate":"1978-04-19T12:05:00+03:00","IsSpecialMeeting":null,"LastUpdatedDate":"2020-10-26T22:08:36.007+02:00"}
{"Id":491083,"Number":106,"KnessetNum":9,"Name":"ישיבת מליאה בתאריך 04/05/1978 בשעה 12:32","StartDate":"1978-05-04T12:32:00+03:00","FinishDate":"1978-05-04T13:18:00+03:00","IsSpecialMeeting":null,"LastUpdatedDate":"2020-10-26T22:12:06.513+02:00"}
{"Id":491084,"Number":107,"KnessetNum":9,"Name":"ישיבת מליאה בתאריך 15/05/1978 בשעה 16:01","StartDate":"1978-05-15T16:01:00+03:00","FinishDate":"1978-05-15T19:24:00+03:00","IsSpecialMeeting":null,"LastUpdatedDate":"2020-10-26T22:29:28.407+02:00"}
{"Id":491085,"Number":110,"KnessetNum":9,"Name":"ישיבת מליאה בתאריך 22/05/1978 בשעה 16:00","StartDate":"1978-05-22T16:00:00+03:00","FinishDate":"1978-05-22T20:15:00+03:00","IsSpecialMeeting":null,"LastUpdatedDate":"2020-10-27T18:29:11.667+02:00"}
{"Id":491086,"Number":112,"KnessetNum":9,"Name":"ישיבת מליאה בתאריך 24/05/1978 בשעה 11:01","StartDate":"1978-05-24T11:01:00+03:00","FinishDate":"1978-05-24T16:05:00+03:00","IsSpecialMeeting":null,"LastUpdatedDate":"2020-10-31T23:45:28.16+02:00"}
{"Id":491087,"Number":113,"KnessetNum":9,"Name":"ישיבת מליאה בתאריך 29/05/1978 בשעה 18:35","StartDate":"1978-05-29T18:35:00+03:00","FinishDate":"1978-05-29T19:17:00+03:00","IsSpecialMeeting":null,"LastUpdatedDate":"2020-10-27T01:55:15.813+02:00"}
{"Id":491088,"Number":114,"KnessetNum":9,"Name":"ישיבת מליאה בתאריך 30/05/1978 בשעה 16:00","StartDate":"1978-05-30T16:00:00+03:00","FinishDate":"1978-05-30T21:13:00+03:00","IsSpecialMeeting":null,"LastUpdatedDate":"2020-11-01T01:00:23.697+02:00"}
{"Id":491089,"Number":117,"KnessetNum":9,"Name":"ישיבת מליאה בתאריך 06/06/1978 בשעה 16:01","StartDate":"1978-06-06T16:01:00+03:00","FinishDate":"1978-06-06T20:03:00+03:00","IsSpecialMeeting":null,"LastUpdatedDate":"2020-11-01T01:44:40.77+02:00"}
{"Id":491090,"Number":131,"KnessetNum":9,"Name":"ישיבת מליאה בתאריך 10/07/1978 בשעה 16:06","StartDate":"1978-07-10T16:06:00+03:00","FinishDate":"1978-07-10T20:15:00+03:00","IsSpecialMeeting":null,"LastUpdatedDate":"2020-11-08T02:30:56.287+02:00"}
{"Id":491091,"Number":134,"KnessetNum":9,"Name":"ישיבת מליאה בתאריך 17/07/1978 בשעה 16:02","StartDate":"1978-07-17T16:02:00+03:00","FinishDate":"1978-07-17T19:02:00+03:00","IsSpecialMeeting":null,"LastUpdatedDate":"2023-09-06T17:30:18.873+03:00"}
{"Id":491092,"Number":137,"KnessetNum":9,"Name":"ישיבת מליאה בתאריך 24/07/1978 בשעה 11:02","StartDate":"1978-07-24T11:02:00+03:00","FinishDate":"1978-07-24T18:26:00+03:00","IsSpecialMeeting":null,"LastUpdatedDate":"2020-11-08T14:57:36.203+02:00"}
{"Id":491093,"Number":143,"KnessetNum":9,"Name":"ישיבת מליאה בתאריך 23/08/1978 בשעה 12:01","StartDate":"1978-08-23T12:01:00+03:00","FinishDate":"1978-08-23T13:25:00+03:00","IsSpecialMeeting":null,"LastUpdatedDate":"2020-11-12T01:52:09.15+02:00"}
{"Id":491094,"Number":166,"KnessetNum":9,"Name":"ישיבת מליאה בתאריך 12/12/1978 בשעה 11:04","StartDate":"1978-12-12T11:04:00+02:00","FinishDate":"1978-12-12T14:05:00+02:00","IsSpecialMeeting":null,"LastUpdatedDate":"2020-11-19T09:10:14.597+02:00"}
{"Id":491095,"Number":168,"KnessetNum":9,"Name":"ישיבת מליאה בתאריך 19/12/1978 בשעה 15:03","StartDate":"1978-12-19T15:03:00+02:00","FinishDate":"1978-12-19T22:24:00+02:00","IsSpecialMeeting":null,"LastUpdatedDate":"2020-11-22T01:30:55.577+02:00"}
{"Id":491096,"Number":174,"KnessetNum":9,"Name":"ישיבת מליאה בתאריך 02/01/1979 בשעה 16:02","StartDate":"1979-01-02T16:02:00+02:00","FinishDate":"1979-01-02T20:01:00+02:00","IsSpecialMeeting":null,"LastUpdatedDate":"2020-11-25T12:04:48.667+02:00"}
{"Id":491097,"Number":181,"KnessetNum":9,"Name":"ישיבת מליאה בתאריך 17/01/1979 בשעה 11:00","StartDate":"1979-01-17T11:00:00+02:00","FinishDate":"1979-01-17T18:02:00+02:00","IsSpecialMeeting":null,"LastUpdatedDate":"2021-04-19T14:36:39.297+03:00"}
{"Id":491098,"Number":187,"KnessetNum":9,"Name":"ישיבת מליאה בתאריך 31/01/1979 בשעה 11:00","StartDate":"1979-01-31T11:00:00+02:00","FinishDate":"1979-01-31T14:54:00+02:00","IsSpecialMeeting":null,"LastUpdatedDate":"2020-12-01T00:03:31.577+02:00"}
{"Id":491099,"Number":191,"KnessetNum":9,"Name":"ישיבת מליאה בתאריך 12/02/1979 בשעה 16:02","StartDate":"1979-02-12T16:02:00+02:00","FinishDate":"1979-02-12T17:38:00+02:00","IsSpecialMeeting":null,"LastUpdatedDate":"2020-12-01T00:33:31.163+02:00"}
{"Id":491100,"Number":192,"KnessetNum":9,"Name":"ישיבת מליאה בתאריך 13/02/1979 בשעה 16:02","StartDate":"1979-02-13T16:02:00+02:00","FinishDate":"1979-02-13T19:45:00+02:00","IsSpecialMeeting":null,"LastUpdatedDate":"2020-12-01T00:50:56.417+02:00"}
{"Id":491101,"Number":195,"KnessetNum":9,"Name":"ישיבת מליאה בתאריך 20/02/1979 בשעה 16:00","StartDate":"1979-02-20T16:00:00+02:00","FinishDate":"1979-02-20T19:47:00+02:00","IsSpecialMeeting":null,"LastUpdatedDate":"2020-12-01T19:46:14.177+02:00"}
{"Id":491102,"Number":198,"KnessetNum":9,"Name":"ישיבת מליאה בתאריך 27/02/1979 בשעה 15:01","StartDate":"1979-02-27T15:01:00+02:00","FinishDate":"1979-02-27T20:22:00+02:00","IsSpecialMeeting":null,"LastUpdatedDate":"2020-12-02T00:14:13.293+02:00"}
{"Id":491103,"Number":202,"KnessetNum":9,"Name":"ישיבת מליאה בתאריך 07/03/1979 בשעה 11:00","StartDate":"1979-03-07T11:00:00+02:00","FinishDate":"1979-03-07T14:35:00+02:00","IsSpecialMeeting":null,"LastUpdatedDate":"2020-12-03T23:37:36.107+02:00"}
{"Id":491104,"Number":204,"KnessetNum":9,"Name":"ישיבת מליאה בתאריך 15/03/1979 בשעה 10:01","StartDate":"1979-03-15T10:01:00+02:00","FinishDate":"1979-03-15T13:07:00+02:00","IsSpecialMeeting":null,"LastUpdatedDate":"2020-12-03T23:49:31.393+02:00"}
{"Id":491105,"Number":206,"KnessetNum":9,"Name":"ישיבת מליאה בתאריך 20/03/1979 בשעה 11:04","StartDate":"1979-03-20T11:04:00+02:00","FinishDate":"1979-03-20T21:01:00+02:00","IsSpecialMeeting":null,"LastUpdatedDate":"2020-12-04T00:15:45.137+02:00"}
{"Id":491106,"Number":207,"KnessetNum":9,"Name":"ישיבת מליאה בתאריך 21/03/1979 בשעה 10:02","StartDate":"1979-03-21T10:02:00+02:00","FinishDate":"1979-03-22T04:10:00+02:00","IsSpecialMeeting":null,"LastUpdatedDate":"2020-12-04T00:42:41.797+02:00"}
{"Id":491107,"Number":213,"KnessetNum":9,"Name":"ישיבת מליאה בתאריך 04/04/1979 בשעה 11:05","StartDate":"1979-04-04T11:05:00+03:00","FinishDate":"1979-04-04T15:17:00+03:00","IsSpecialMeeting":null,"LastUpdatedDate":"2020-12-04T02:01:47.083+02:00"}
{"Id":491108,"Number":214,"KnessetNum":9,"Name":"ישיבת מליאה בתאריך 16/04/1979 בשעה 11:04","StartDate":"1979-04-16T11:04:00+03:00","FinishDate":"1979-04-16T13:05:00+03:00","IsSpecialMeeting":null,"LastUpdatedDate":"2020-12-04T02:08:17.4+02:00"}
{"Id":491109,"Number":215,"KnessetNum":9,"Name":"ישיבת מליאה בתאריך 30/04/1979 בשעה 11:03","StartDate":"1979-04-30T11:03:00+03:00","FinishDate":"1979-04-30T12:40:00+03:00","IsSpecialMeeting":null,"LastUpdatedDate":"2020-12-04T02:11:54.06+02:00"}
{"Id":491110,"Number":216,"KnessetNum":9,"Name":"ישיבת מליאה בתאריך 30/04/1979 בשעה 12:46","StartDate":"1979-04-30T12:46:00+03:00","FinishDate":"1979-04-30T13:55:00+03:00","IsSpecialMeeting":null,"LastUpdatedDate":"2020-12-04T02:15:11.817+02:00"}
{"Id":491111,"Number":217,"KnessetNum":9,"Name":"ישיבת מליאה בתאריך 07/05/1979 בשעה 16:00","StartDate":"1979-05-07T16:00:00+03:00","FinishDate":"1979-05-07T21:27:00+03:00","IsSpecialMeeting":null,"LastUpdatedDate":"2020-12-04T02:22:54.067+02:00"}
{"Id":491112,"Number":218,"KnessetNum":9,"Name":"ישיבת מליאה בתאריך 08/05/1979 בשעה 16:02","StartDate":"1979-05-08T16:02:00+03:00","FinishDate":"1979-05-08T18:04:00+03:00","IsSpecialMeeting":null,"LastUpdatedDate":"2020-12-04T02:27:06.813+02:00"}
{"Id":491113,"Number":219,"KnessetNum":9,"Name":"ישיבת מליאה בתאריך 09/05/1979 בשעה 11:01","StartDate":"1979-05-09T11:01:00+03:00","FinishDate":"1979-05-09T14:26:00+03:00","IsSpecialMeeting":null,"LastUpdatedDate":"2020-12-04T02:34:19.607+02:00"}
{"Id":491114,"Number":224,"KnessetNum":9,"Name":"ישיבת מליאה בתאריך 22/05/1979 בשעה 16:03","StartDate":"1979-05-22T16:03:00+03:00","FinishDate":"1979-05-22T19:42:00+03:00","IsSpecialMeeting":null,"LastUpdatedDate":"2020-12-05T03:37:00.87+02:00"}
{"Id":491115,"Number":227,"KnessetNum":9,"Name":"ישיבת מליאה בתאריך 29/05/1979 בשעה 16:00","StartDate":"1979-05-29T16:00:00+03:00","FinishDate":"1979-05-29T20:40:00+03:00","IsSpecialMeeting":null,"LastUpdatedDate":"2020-12-11T03:04:28.613+02:00"}
{"Id":491116,"Number":228,"KnessetNum":9,"Name":"ישיבת מליאה בתאריך 30/05/1979 בשעה 11:02","StartDate":"1979-05-30T11:02:00+03:00","FinishDate":"1979-05-30T14:46:00+03:00","IsSpecialMeeting":null,"LastUpdatedDate":"2021-04-19T15:16:38.367+03:00"}
{"Id":491117,"Number":230,"KnessetNum":9,"Name":"ישיבת מליאה בתאריך 05/06/1979 בשעה 16:01","StartDate":"1979-06-05T16:01:00+03:00","FinishDate":"1979-06-05T19:37:00+03:00","IsSpecialMeeting":null,"LastUpdatedDate":"2020-12-13T03:13:17.21+02:00"}
{"Id":491118,"Number":236,"KnessetNum":9,"Name":"ישיבת מליאה בתאריך 19/06/1979 בשעה 16:01","StartDate":"1979-06-19T16:01:00+03:00","FinishDate":"1979-06-19T19:40:00+03:00","IsSpecialMeeting":null,"LastUpdatedDate":"2020-12-13T01:21:28.51+02:00"}
{"Id":491119,"Number":238,"KnessetNum":9,"Name":"ישיבת מליאה בתאריך 25/06/1979 בשעה 16:02","StartDate":"1979-06-25T16:02:00+03:00","FinishDate":"1979-06-25T19:05:00+03:00","IsSpecialMeeting":null,"LastUpdatedDate":"2020-12-13T02:12:51.053+02:00"}
{"Id":491120,"Number":243,"KnessetNum":9,"Name":"ישיבת מליאה בתאריך 04/07/1979 בשעה 11:02","StartDate":"1979-07-04T11:02:00+03:00","FinishDate":"1979-07-04T15:56:00+03:00","IsSpecialMeeting":null,"LastUpdatedDate":"2020-12-16T00:42:59.517+02:00"}
{"Id":491121,"Number":256,"KnessetNum":9,"Name":"ישיבת מליאה בתאריך 19/09/1979 בשעה 12:03","StartDate":"1979-09-19T12:03:00+03:00","FinishDate":"1979-09-19T14:40:00+03:00","IsSpecialMeeting":null,"LastUpdatedDate":"2020-12-17T12:58:28.787+02:00"}
{"Id":491122,"Number":258,"KnessetNum":9,"Name":"ישיבת מליאה בתאריך 15/10/1979 בשעה 11:03","StartDate":"1979-10-15T11:03:00+02:00","FinishDate":"1979-10-15T13:42:00+02:00","IsSpecialMeeting":null,"LastUpdatedDate":"2020-12-20T01:13:14.15+02:00"}
{"Id":491123,"Number":264,"KnessetNum":9,"Name":"ישיבת מליאה בתאריך 31/10/1979 בשעה 11:00","StartDate":"1979-10-31T11:00:00+02:00","FinishDate":"1979-10-31T14:28:00+02:00","IsSpecialMeeting":null,"LastUpdatedDate":"2021-04-28T16:30:57.993+03:00"}
{"Id":491124,"Number":267,"KnessetNum":9,"Name":"ישיבת מליאה בתאריך 07/11/1979 בשעה 11:01","StartDate":"1979-11-07T11:01:00+02:00","FinishDate":"1979-11-07T15:37:00+02:00","IsSpecialMeeting":null,"LastUpdatedDate":"2021-04-28T16:33:08.11+03:00"}
{"Id":491125,"Number":270,"KnessetNum":9,"Name":"ישיבת מליאה בתאריך 14/11/1979 בשעה 11:03","StartDate":"1979-11-14T11:03:00+02:00","FinishDate":"1979-11-14T15:45:00+02:00","IsSpecialMeeting":null,"LastUpdatedDate":"2021-01-12T13:32:01.337+02:00"}
{"Id":491126,"Number":272,"KnessetNum":9,"Name":"ישיבת מליאה בתאריך 20/11/1979 בשעה 16:01","StartDate":"1979-11-20T16:01:00+02:00","FinishDate":"1979-11-20T21:12:00+02:00","IsSpecialMeeting":null,"LastUpdatedDate":"2021-04-28T16:28:41.933+03:00"}
{"Id":491127,"Number":273,"KnessetNum":9,"Name":"ישיבת מליאה בתאריך 21/11/1979 בשעה 11:01","StartDate":"1979-11-21T11:01:00+02:00","FinishDate":"1979-11-21T18:10:00+02:00","IsSpecialMeeting":null,"LastUpdatedDate":"2021-01-13T02:28:36.15+02:00"}
{"Id":491128,"Number":282,"KnessetNum":9,"Name":"ישיבת מליאה בתאריך 12/12/1979 בשעה 11:00","StartDate":"1979-12-12T11:00:00+02:00","FinishDate":"1979-12-12T14:00:00+02:00","IsSpecialMeeting":null,"LastUpdatedDate":"2021-04-28T19:38:52.433+03:00"}
{"Id":491129,"Number":285,"KnessetNum":9,"Name":"ישיבת מליאה בתאריך 19/12/1979 בשעה 11:00","StartDate":"1979-12-19T11:00:00+02:00","FinishDate":"1979-12-19T14:57:00+02:00","IsSpecialMeeting":null,"LastUpdatedDate":"2021-04-28T20:17:29.24+03:00"}
{"Id":491130,"Number":288,"KnessetNum":9,"Name":"ישיבת מליאה בתאריך 26/12/1979 בשעה 11:00","StartDate":"1979-12-26T11:00:00+02:00","FinishDate":"1979-12-26T16:32:00+02:00","IsSpecialMeeting":null,"LastUpdatedDate":"2023-02-21T10:36:14.657+02:00"}
{"Id":491131,"Number":291,"KnessetNum":9,"Name":"ישיבת מליאה בתאריך 02/01/1980 בשעה 11:00","StartDate":"1980-01-02T11:00:00+02:00","FinishDate":"1980-01-02T14:04:00+02:00","IsSpecialMeeting":null,"LastUpdatedDate":"2021-02-11T01:36:18.797+02:00"}
{"Id":491132,"Number":296,"KnessetNum":9,"Name":"ישיבת מליאה בתאריך 15/01/1980 בשעה 16:00","StartDate":"1980-01-15T16:00:00+02:00","FinishDate":"1980-01-15T21:50:00+02:00","IsSpecialMeeting":null,"LastUpdatedDate":"2021-02-11T01:29:34.53+02:00"}
{"Id":491133,"Number":297,"KnessetNum":9,"Name":"ישיבת מליאה בתאריך 16/01/1980 בשעה 11:00","StartDate":"1980-01-16T11:00:00+02:00","FinishDate":"1980-01-16T17:07:00+02:00","IsSpecialMeeting":null,"LastUpdatedDate":"2021-02-11T01:28:43.98+02:00"}
{"Id":491134,"Number":304,"KnessetNum":9,"Name":"ישיבת מליאה בתאריך 04/02/1980 בשעה 16:03","StartDate":"1980-02-04T16:03:00+02:00","FinishDate":"1980-02-04T19:00:00+02:00","IsSpecialMeeting":null,"LastUpdatedDate":"2021-02-11T01:51:49.323+02:00"}
{"Id":491135,"Number":311,"KnessetNum":9,"Name":"ישיבת מליאה בתאריך 19/02/1980 בשעה 16:02","StartDate":"1980-02-19T16:02:00+02:00","FinishDate":"1980-02-19T19:23:00+02:00","IsSpecialMeeting":null,"LastUpdatedDate":"2021-02-17T04:35:16.357+02:00"}
{"Id":491136,"Number":314,"KnessetNum":9,"Name":"ישיבת מליאה בתאריך 26/02/1980 בשעה 16:02","StartDate":"1980-02-26T16:02:00+02:00","FinishDate":"1980-02-26T20:38:00+02:00","IsSpecialMeeting":null,"LastUpdatedDate":"2021-02-17T06:01:24.147+02:00"}
{"Id":491137,"Number":315,"KnessetNum":9,"Name":"ישיבת מליאה בתאריך 27/02/1980 בשעה 11:02","StartDate":"1980-02-27T11:02:00+02:00","FinishDate":"1980-02-27T16:03:00+02:00","IsSpecialMeeting":null,"LastUpdatedDate":"2021-02-17T06:34:39.573+02:00"}
{"Id":491138,"Number":318,"KnessetNum":9,"Name":"ישיבת מליאה בתאריך 06/03/1980 בשעה 09:01","StartDate":"1980-03-06T09:01:00+02:00","FinishDate":"1980-03-06T14:24:00+02:00","IsSpecialMeeting":null,"LastUpdatedDate":"2021-02-18T02:28:12.53+02:00"}
{"Id":491139,"Number":338,"KnessetNum":9,"Name":"ישיבת מליאה בתאריך 02/06/1980 בשעה 16:05","StartDate":"1980-06-02T16:05:00+03:00","FinishDate":"1980-06-02T23:00:00+03:00","IsSpecialMeeting":null,"LastUpdatedDate":"2021-04-01T04:16:40.453+03:00"}
{"Id":491140,"Number":342,"KnessetNum":9,"Name":"ישיבת מליאה בתאריך 10/06/1980 בשעה 16:00","StartDate":"1980-06-10T16:00:00+03:00","FinishDate":"1980-06-10T19:04:00+03:00","IsSpecialMeeting":null,"LastUpdatedDate":"2021-04-28T20:24:32.763+03:00"}
{"Id":491141,"Number":364,"KnessetNum":9,"Name":"ישיבת מליאה בתאריך 13/08/1980 בשעה 11:03","StartDate":"1980-08-13T11:03:00+03:00","FinishDate":"1980-08-13T15:56:00+03:00","IsSpecialMeeting":null,"LastUpdatedDate":"2020-10-18T11:03:01.767+03:00"}
{"Id":491142,"Number":367,"KnessetNum":9,"Name":"ישיבת מליאה בתאריך 13/10/1980 בשעה 16:02","StartDate":"1980-10-13T16:02:00+02:00","FinishDate":"1980-10-13T20:43:00+02:00","IsSpecialMeeting":null,"LastUpdatedDate":"2020-10-18T13:46:47.743+03:00"}
{"Id":491143,"Number":372,"KnessetNum":9,"Name":"ישיבת מליאה בתאריך 22/10/1980 בשעה 11:01","StartDate":"1980-10-22T11:01:00+02:00","FinishDate":"1980-10-22T15:46:00+02:00","IsSpecialMeeting":null,"LastUpdatedDate":"2020-10-27T16:00:29.22+02:00"}
{"Id":491144,"Number":384,"KnessetNum":9,"Name":"ישיבת מליאה בתאריך 19/11/1980 בשעה 11:01","StartDate":"1980-11-19T11:01:00+02:00","FinishDate":"1980-11-19T18:09:00+02:00","IsSpecialMeeting":null,"LastUpdatedDate":"2020-07-05T10:27:43.12+03:00"}
{"Id":491145,"Number":387,"KnessetNum":9,"Name":"ישיבת מליאה בתאריך 26/11/1980 בשעה 11:02","StartDate":"1980-11-26T11:02:00+02:00","FinishDate":"1980-11-26T12:25:00+02:00","IsSpecialMeeting":null,"LastUpdatedDate":"2020-10-27T16:52:26.787+02:00"}
{"Id":491146,"Number":400,"KnessetNum":9,"Name":"ישיבת מליאה בתאריך 29/12/1980 בשעה 16:02","StartDate":"1980-12-29T16:02:00+02:00","FinishDate":"1980-12-29T18:38:00+02:00","IsSpecialMeeting":null,"LastUpdatedDate":"2020-06-30T10:38:37.987+03:00"}
{"Id":491147,"Number":401,"KnessetNum":9,"Name":"ישיבת מליאה בתאריך 30/12/1980 בשעה 16:00","StartDate":"1980-12-30T16:00:00+02:00","FinishDate":"1980-12-30T18:42:00+02:00","IsSpecialMeeting":null,"LastUpdatedDate":"2020-06-30T10:37:54.08+03:00"}
{"Id":491148,"Number":405,"KnessetNum":9,"Name":"ישיבת מליאה בתאריך 07/01/1981 בשעה 11:02","StartDate":"1981-01-07T11:02:00+02:00","FinishDate":"1981-01-07T15:05:00+02:00","IsSpecialMeeting":null,"LastUpdatedDate":"2020-06-29T11:23:44.88+03:00"}
{"Id":491149,"Number":410,"KnessetNum":9,"Name":"ישיבת מליאה בתאריך 20/01/1981 בשעה 16:04","StartDate":"1981-01-20T16:04:00+02:00","FinishDate":"1981-01-20T20:17:00+02:00","IsSpecialMeeting":null,"LastUpdatedDate":"2020-06-25T13:43:20.833+03:00"}
{"Id":491150,"Number":425,"KnessetNum":9,"Name":"ישיבת מליאה בתאריך 24/02/1981 בשעה 16:02","StartDate":"1981-02-24T16:02:00+02:00","FinishDate":"1981-02-24T18:58:00+02:00","IsSpecialMeeting":null,"LastUpdatedDate":"2020-06-22T10:02:23.137+03:00"}
{"Id":491151,"Number":448,"KnessetNum":9,"Name":"ישיבת מליאה בתאריך 03/06/1981 בשעה 11:05","StartDate":"1981-06-03T11:05:00+03:00","FinishDate":"1981-06-03T13:05:00+03:00","IsSpecialMeeting":null,"LastUpdatedDate":"2020-06-11T11:31:51.937+03:00"}